शीर्षक,विवरण
संसदीय गरिमाको संकुचन,"पुसको मध्य जाडोमा सुरु भएको संसद्को हिउँदे अधिवेशन तात्दै नताती आइतबार सकिएको छ । संसद्मा एकपटकबाहेक न प्रतिपक्ष तात्यो, न सत्तापक्षलाई प्रतिवादमा उत्रनुपर्ने बाध्यता सिर्जना भयो । एक किसिमले भन्ने हो भने कर्मकाण्डी दृश्य मञ्चनमै सीमित रह्यो । एकातिर मुलुकको अर्थतन्त्र खस्किँदो छ । पुँजीगत खर्च क्षमतामा अत्यधिक ह्रास आउनुको सामान्य कारणसमेत खोजी भएन । सेयर बजारदेखि अर्थतन्त्रका नसाहरू शिथिल भइरहेका छन् । यस्ता महŒवपूर्ण विषयमा संसदभित्र गम्भीरतापूर्वक छलफल भएको पाइएन । जनप्रतिनिधिहरूले मुलुकका समस्याका समग्र पक्षमा जसरी संसद्लाई केन्द्रित गराउनुपथ्र्याे, त्यस्तो दृश्य देखा परेन । हिउँदे अधिवेशन सकिँदा उपलब्धिमूलक भएको टिप्पणी गर्ने हैसियतमा न शीर्ष नेतृत्व रह्यो, न त सांसदहरू नै । अर्काे त, अधिवेशनको अन्त्यमा संसद्बाट बिदाइ भाषण हुँदाका बखत संसद् भरिभराउ र उत्साही हुन्थ्यो । प्रधानमन्त्री र नेताहरू बोलिरहँदा संसदभित्र आधाभन्दा बढी कुर्सी खाली देखिनुले उत्साही माहोल नभएको स्पष्ट पार्छ । यद्यपि हिउँदे अधिवेशन ८९ दिन चालु रह्यो । अधिवेशन तीन महिना लामो देखिए पनि वास्तवमा ३२ दिनमा ४६ पटक बैठक बसेको थियो । संसदीय कालखण्डमा हिउँदे अधिवेशन सामान्यतः एक महिनाजति मात्र चल्थ्यो र विधेयकमै केन्द्रित रहँदै सकिन्थ्यो । लामो समय चले पनि संघीय संसद्को दुवै सदनबाट जम्माजम्मी ६ विधेयक मात्र पारित भए । यो अधिवेशनबाट पारित गर्न २३ विधेयक दर्ता भएका थिए । संसद्मा तीनवटा सार्वजनिक महत्त्वका प्रस्तावमाथि छलफल भए । सडक दुर्घटना, गुणस्तरीय स्वास्थ्य सेवा र छाउपडी प्रथा अन्त्य गर्ने विषयमा सार्वजनिक महत्त्वको प्रस्ताव पारित भएका छन् । संसद्बाट पारित तीन महŒवपूर्ण प्रस्ताव पनि सरकारले कार्यान्वयन गर्नुपर्नेछ । संसद्मा प्रधानमन्त्रीसँग प्रत्यक्ष प्रश्नोत्तरसम्बन्धी नियमावली प्रदत्त व्यवस्थासमेत उल्लंघन हुन पुग्यो । नियमावलीअनुरूप प्रत्येक महिनाको पहिलो साता एक घन्टा प्रधानमन्त्रीसँग प्रश्नोत्तर कार्यक्रम हुनुपर्ने व्यवस्था छ । एकपटकबाहेक दोस्रोपटक हुन सकेन । प्रधानमन्त्रीलाई संसद् र नागरिकप्रति जवाफदेही बनाउने उद्देश्यअनुरूप प्रश्नोत्तर कार्यक्रमलाई महत्त्वपूर्ण कडी मानिन्छ । यद्यपि मन्त्रीहरूले मौखिक र लिखित प्रश्नका जवाफ दिए । उता प्रमुख विपक्षी दलले विषय उठान गरिसकेपछि त्यसलाई टुंगोमा नपुर्याई बीचैमा छाड्ने प्रवृत्ति प्रदर्शन गर्यो । वाइडबडी प्रकरण उठान गरे पनि त्यो मुद्दामा निरन्तर उभिन नसकेपछि प्रतिपक्षीको भूमिका कमजोर मात्र होइन, शंकास्पद नै देखियो । संसद्मा रौनक छाउन नसक्नुमा उपल्ला तहका नेताहरूको न्यून उपस्थिति रहनु पनि हो । अर्कोतिर कुनै विषयमा निर्णय लिनुपर्ने दिनबाहेक अधिकांश बैठकमा सांसदको उपस्थिति पनि न्यून रह्यो । संसद्लाई राष्ट्रिय राजनीतिको चासोमा पार्ने दायित्व प्रतिनिधि सभाका सभामुख र राष्ट्रियसभाका अध्यक्षको पनि हो । मुलुकका महŒवपूर्ण विषयमा सघन बहस गर्ने उद्देश्य पूरा गर्न राष्ट्रिय सभालाई प्रौढविज्ञहरूको थलो भन्ने गरिन्छ । तर राष्ट्रिय सभा प्रौढ थलो प्रमाणित गर्नबाट चुक्यो । यो त प्रतिनिधि सभामा पानी पर्दा राष्ट्रिय सभामा छाता ओढ्ने परम्पराकालीन शैलीमै रमायो । प्रतिनिधि सभालाई रोचक र प्रभावकारी पार्न सभामुखको भूमिका महत्त्वपूर्ण मानिन्छ । तर सभामुखमाथि संसद्लाई सरकारको छाया बनाएको अभियोग लाग्यो । चिकित्सा शिक्षा विधेयक पारित गराउँदाका बखत प्रतिपक्षी दलको विरोध हुँदाहुँदै मार्सल लगाएर पास गराइएपछि सभामुखको भूमिकामा प्रश्न उठेको थियो । यो दृश्यसँगै राज्यको शक्ति सन्तुलनमा गडीबडी उत्पन्न हुँदै सरकारलाई स्वेच्छाचारी बन्न मैदान उपलब्ध हुने हो कि भन्ने आशंका पैदा भएको छ । राज्यका तीन अंगमध्ये संसद्लाई महत्त्वपूर्ण मानिन्छ । तर यो दृश्यले संसद् राज्यको अंग नभई सारमा सरकारमातहतमा परिणत हुने त होइन ? शंका पैदा गराएको छ । त्यसका अतिरिक्त सांसदहरूले उठाएका विषयमा पटकपटक सभामुखबाट रुलिङ हुँदा सरकारले चासो नदिएको घटनाले संसद्को वजन घटाएको स्पष्ट हुन्छ । पछिल्लो समय तराईमधेस थरुहट आन्दोलनबारे अध्ययन गठन गठित गिरीषचन्द्र लाल संयोजक रहेको आयोगको प्रतिवेदन सार्वजनिक गर्न माग गर्दै राष्ट्रिय जनता पार्टीका सांसदहरूले लगातार संसद् अवरुद्ध गरेका थिए । सभामुखको रुलिङपछि पनि सरकारले प्रतिवेदन सार्वजनिक गर्ने चासो दिएन । संसद्ले आफ्नो गरिमा र वजन कायम गर्ने मामलामा यो अधिवेशनबाट सिक्नुपर्छ ।"
म्याग्दीमा दुई स्थानीय तहमा सीमा विवाद,"बेनी : म्याग्दीको बेनी नगरपालिका१० पात्लेखेत र रघुगंगा गाउँपालिका५ झिँका बासिन्दाबीच सीमा विवाद बढेको छ । सीमा क्षेत्रमा पर्ने रघुगंगा र बराह पंग्रेनी सामुदायिक वन तथा हिलाको भूगोललाई दुवै वडाका जनप्रतिनिधि र बासिन्दाले आफ्नो क्षेत्रमा भएको दाबी गर्न थालेपछि विवाद बढेको हो । सीमा विवादका कारण सामुदायिक वनको घाँस, दाउरा, काठ उपयोग र सीमा क्षेत्रमा पर्ने हिला गाउँमा विकास गतिविधि प्रभावित हुनुका साथै सामाजिक द्वन्द्व सिर्जना भएको छ । झिँका बासिन्दाले डेङग्रेखोला र पात्लेखेतले घट्टेखोलालाई आफूहरुको सिमाना भएको दाबी गरेका छन् । रघुगंगा५ का वडा अध्यक्ष मनबहादुर शेरपुञ्जाले साविक झिँ गाविसको ९ नम्बर वडामा पर्ने हिला क्षेत्रलाई पात्लेखेतले दाबी गरेको, सीमा क्षेत्रमा रहेका सामुदायिक वनको उपभोग र आम्दानी वितरणमा पात्लेखेतका बासिन्दाले एकलौटी गरेका कारण विवाद भएको बताए । नापी विभागको नक्सा, साविकको वडा, सीमा क्षेत्रका बासिन्दाको जग्गाधनी पुर्जा लगायत कागजातका आधारमा झिँको सिमाना डेङ्ग्रेखोला हो, वडा अध्यक्ष शेरपुञ्जाले भने, पात्लेखेतले दाबी गरेको हिला झिँको साविक ९ नम्बर वडामा पर्छ । हिला गाउँमा करिब ३० घरधुरीको बसोबास छ । हिलामा केही वर्षयता पात्लेखेतका बासिन्दाले घरजग्गा किन्ने र घर बनाउने क्रम बढेको छ । पात्लेखेतका वडा अध्यक्ष लोकबहादुर पुनले २०३५ सालमा नापी भएपछि २०३६ मा तत्कालिन घतान र झिँ गाउँ पञ्चायतको बीच भागलाई छुट्टाएर बनाइएको पात्लेखेतको जग्गाधनी पुर्जामा अभिलेख नभएको र २०५५ मा दुई गाउँका जनप्रतिनिधिबीच भएको सहमतिका आधारमा घट्टेखोला सीमा भएको बताउँछन् । २० वर्षअघि समाधान भइसकेको विवाद अहिले पुन बल्झाउन खोजिएको पुन बताउँछन् । सीमा विवाद समाधानका लागि सोमबार दुइटै स्थानीय तह र वडाका जनप्रतिनिधि, सुरक्षा अधिकारी, नापीका कर्मचारीको टोलीले स्थलगत अध्ययन र स्थानीयबासीहरुको प्रतिक्रिया लिएको छ । जिसस प्रमुख देवेन्द्रबहादुर केसी, प्रजीअ लीलाधर अधिकारी, रघुगंगा गाउँपालिकाका अध्यक्ष भवबहादुर भण्डारी, बेनपाकी उपमेयर सञ्जु बरुवाल, प्रहरी नायव उपरीक्षक महेन्द्र मरासिनी, नापी अधिकृत सहदेव सुवेदीसहितको टोलीले विवादित क्षेत्रको स्थलगत निरीक्षण गरेको थियो । नापी विभागको आधिकारिक नक्सा, पुराना कागजात, सहमतिका दस्तावेज लगायत प्रमाण जुटाएर दुवै वडाका जनप्रतिनिधिसँग संयुक्त बैठक बसेर विवाद समाधानको पहल गरिने नगर उपप्रमुख बरुवालले बताइन् ।"
दूरसञ्चारका कर्मचारी मृत फेला,विराटनगर : दूरसञ्चार कार्यालय विराटनगरका एक कर्मचारी मृत फेला परेका छन्। मोरङको कानेपोखरी गाउँपालिका५ राधाकृष्ण टोलस्थित महाराजथान पैनीमा सोमबार उनी मृत्त फेला परेका हुन्। विराटनगर महानगरपालिका५ जामुनगाछी घर भएका ४२ वर्षीय प्रलाद कोइराला मृत्त फेला परेको इलाका प्रहरी कार्यालय पथरीका प्रहरी निरीक्षक कमल बजगाईले बताए। कोइराला दूरसञ्चारका लाइनमेन हुन्। बजगाईका अनुसार पानी बगिरहेको पैनीमा डुबेर मृत्यु भएको अवस्थामा कोइरालाको शव फेला परेको हो। पैनीमा घोप्टो परेको अवस्थामा शव देखेपछि स्थानीय बासिन्दाले प्रहरीलाई खबर गरेका थिए। प्रहरीका अनुसार कानेपोखरी५ बाट आइतबार साँझ विराटनगरस्थित घरतर्फ फर्किएका कोइरालाको शव सोमबार भेटिएको हो। घटनाका बारेमा अनुसन्धान सुरु गरिएको प्रहरीले जनाएको छ। अत्यधिक मादक पदार्थ सेवन गरेका कारण पैनीमा लडेपछि उठ्न नसकेर त्यहीं मृत्यु भएको हुन सक्ने प्रहरी अनुमान छ। शवको कोसी अञ्चल अस्पताल विराटनगरमा पोस्टमार्टम गरिएको छ। त्यस्तै विराटनगर११ पंचमुखी चौक बस्ने ८१ वर्षीय कान्छी सिजली मगरको आफ्नै घर अगाडि रहेको नालीमा लडेर मृत्यु भएको छ। डिलमा बसिरहेको अवस्थामा नालीमा लडेर घाइते भएकी वृद्धाको उपचारका लागि लैजाने क्रममा बाटोमै मृत्यु भएको प्रहरीले जनाएको छ।
गाडेको अवस्थामा महिलाको शव बरामद,मलंगवा : कविलासी नगरपालिका ७ गैरबजार भन्दा पूर्वमा रहेको झिम खोलामा गाडेको अवस्थामा महिलाको शव फेला परेको छ। खोलामा निर्माणधीन अवस्थामा रहेको पुल नजिकै बालुवामा गाडिएको अवस्थामा महिलाको शव बरामद भएको जिल्ला प्रहरी कार्यालय सर्लाहीका प्रहरी निरीक्षक कुन्दन देवले जानकारी दिएका छन्। अन्दाजी २५३० वर्षको देखिन महिलाको शव बरामद भएको निरीक्षक देवले बताए। पहिचान हुन सकेको छैन। केही दिन पहिले मात्र शवलाई गाडेको हुन सक्ने प्रहरीले जनाएको छ। अत्याधिक गन्हाउन थालेपछि स्थानीयले सशस्त्र प्रहरीलाई खबर गर्दा सशस्त्र प्रहरीले नेपाल प्रहरीलाई खबर गरेपछि घटना बाहिरिएको हो। शवलाई निकालेर पोस्टमार्टमका लागि मलंगवा ल्याउने तयारी भइरहेको प्रहरीले जनाएको छ।
कर्णालीमा नदी सम्मेलन हुँदै,"सुर्खेतः कर्णालीमा पहिलो पटक नदी सम्मेलन हुने भएको छ। दैलेखको आठबिस नगरपालिकाको राकम कर्णालीमा राष्ट्रिय नदी सम्मेलन हुने भएको हो। नदीको क्षमता चेकजाँच, अध्ययन र नदी संरक्षण गर्ने उद्देश्यका साथ राष्ट्रिय सम्मेलनको आयोजना गरिएको नदी संरक्षण संस्थाका सदस्य भक्तबहादुर शाहीले जानकारी दिए। दैलेखको आठबीस नगरपालिकाको राकम कर्णालीमा चैत १५, १६ र १७ गते राष्ट्रिय नदी सम्मेलन आयोजना गरिने भएको छ। करिब तीनसय जति राष्ट्रिय तथा अन्तराष्ट्रिय विज्ञ तथा कर्मचारीको उपस्थिति रहने राकम कर्णालीमा मुख्यमन्त्री महेन्द्रबहादुर शाही सहभागी हुने छन्। चैत १४ गते वीरेन्द्रनगरमा कर्णाली प्रदेशका मुख्यमन्त्री शाहीले कार्यक्रमको उद्घाटन गरिसकेपछि टोली राकम कर्णालीतर्फ प्रस्थान गर्ने सदस्य शाहीले जानकारी दिए। 'कार्यक्रममा कर्णाली नदीको अवस्था कस्तो छ, कहाँ केके सम्भावना छन् भन्ने विषयमा विज्ञले प्रस्तूति दिनेछन्' शाहीले भने, 'विज्ञको टोलीले कर्णाली नदीको चेक जाँच गरेको प्रतिवेदन पनि प्रदेश सरकारलाई हस्तान्तरण गर्नेछ।' वर्षेनी नदी तटीय क्षेत्र कटान हुनुका साथै नदीको संरक्षण आवश्यक रहेकाले जोखिम र नदीबाट सुरक्षित तरिकाबाट लिन सकिने लाभका विषयमा छलफल हुनेछ। तीन दिनसम्म चल्ने राष्ट्रिय नदी सम्मेलनमा राकम कर्णालीमा र्याफ्टिङ गरिने छ भने उपस्थित सबैलाई नदी तटको छेउमा टेन्ट लगाएर बासस्थान बनाइने आयोजनकले तयारी गरिरहेको छ। यसैबीच चैत ११ गते दिउँसो एक बजेदेखि कर्णाली नदीसँग सम्बन्धित फोटोहरु स्थानीय घण्टाघरमा प्रदर्शनमा राखिने आयोजकले बताएको छ। निःशुल्क रुपमा हेर्न पाइने उक्त प्रदर्शनीमा तीन सयभन्दा बढी फोटोहरु प्रदर्शनीमा राखिनेछ। फोटो प्रदर्शनी चैत ११, १२ र १३ गतेसम्म हुनेछ।"
