शीर्षक,विवरण
सर्लाहीमा आगलागीबाट ४ घर जलेर नष्ट,"मलंगवा : सर्लाहीको पर्सा गाउँपालिका४ कविलासी टोलमा मंगलबार राति लागलागी हुँदा ४ घर जलेर नष्ट भएका छन्। आगलागीबाट परी १४ लाख ७५ हजारको धनमाल जलेर नष्ट भएको प्रहरीले जनाएको छ। कविलासी टोलका नरेश राय यादवको घरमा विद्युत सर्ट भई आगलागी हुँदा सोही ठाउँका उपेन्द्र यादव, बसीर बैठा धोबी, हकिम बैठा धोबी र ईस्लाम बैठा धोबीको घर जलेर नष्ट भएको हो। आगीलागीमा परी रायको फुसको कच्ची घर, गोठ, अन्न, लत्ताकपडा र मोटर साइकल जलेर नष्ट भएको छ। रायको मात्रै ६ लाख ८० हजारको क्षति भएको प्रहरीले जनाएको छ। त्यसैगरी बसीरको फुसको घर, लत्ताकपडा, अन्न र ५ वटा बाख्रा मरेको छ। हकिम बैठाको फुसको कच्ची घर, अन्नपात, लत्ताकपडा र ६ वटा बाख्रा गरी ३ लाख ६० हजारको क्षति भएको छ। ईस्लामको पनि फुसको कच्ची घर र गोठ सहित गोठमा भएको ६ बटा बाख्रा गरी ६० हजारको क्षति भएको प्रहरीले जनाएको छ। आगो निभाउने क्रममा रायको हात खुट्टा समेत जलेको छ।त्यसैगरी कविलासी नगरपालिका ७ गैर बस्ने रामपृत रायको परालको टालीमा आगलागी हुँदा ४० हजार बराबरको पराल जलेर नष्ट भएको हो। आगो स्थानीयवासी, प्रहरी र दमकलको सहयोगमा नियन्त्रणमा लिइएको थियो।"
मर्मत हुँदै माथिल्लो मर्स्याङ्दी 'ए',"बेसीसहर : मस्र्याङ्दी गाउँपालिकास्थित ५० मेगावाटको माथिल्लो मस्र्याङ्दी 'ए' जलविद्युत् आयोजनाको विस्तृत मर्मत थालिएको छ।विद्युत उत्पादन भएपछि पहिलोपटक आयोजनाको मर्मत थालिएको हो। विद्युत गृहमा टर्वाइन र बाँधस्थलको मर्मत सुरु गरिएको आयोजनाले जनाएको छ। आयोजनाले विद्युत उत्पादन थालेको २ वर्ष भएको छ। २५२५ मेगावाटका २ वटा फ्रान्सिस टर्बाइन रहेको उक्त आयोजनामा जडित युनिट २ को मर्मतसम्भार भइरहेको छ। फेब्रअरी १५ तारिखबाट सुरु गरिएको बृहत् मर्मतसम्भार कार्य एक डेढ महिनामा सक्ने लक्ष्य छ। युनिट २ को मर्मत युनिट १ को मर्मत थालिने आयोजनाका जनसम्पर्क प्रमुख कर्ण अधिकारीले जानकारी दिए। उनका अनुसार युनिट २ मर्मतमा रहेपछि अहिले युनिट १ बाट मात्रै विद्युत् उत्पादन भइरहेको छ। उक्त टर्बाइनबाट २५ मेगावाट विद्युत् उत्पादन भइरहेको उनले बताए। रन अफ रिभर (पानीको बहावमा आधारित) उक्त परियोजनाको बाँधक्षेत्रमा पनि मर्मत भइरहेको छ। गएको बर्खामा गएको भीषण पहिरो, बर्खायामको बाढीपहिरोले माटो तथा बालुवाका कणले टर्बाइनका दाँतहरूमा क्षति पुर्याएको आयोजनाले जनाएको छ। सबै क्षेत्रको मर्मत गर्न करिब ३ महिना लाग्ने आयोजनाले जनाएको छ। आयोजना मर्मतका लागि चिनियाँ ३ जना विषेशज्ञसहित १५ जना इन्जिनियर तथा प्राविधिक खटिएका छन्। उनीहरू सबै चीनबाट माथिल्लो मस्र्याङ्दी 'ए' आयोजनाको मर्मतका लागि आएका हुन्। सन् २०१३ को जनवरीमा निर्माण सुरु गरिएको माथिल्लो मस्र्याङ्दी 'ए' आयोजनाले २०१७ जनवरीबाट व्यावसायिक विद्युत् उत्पादन थालेको थियो। चिनियाँ बहुराष्ट्रिय कम्पनी सिनो हाइड्रोको ९० र नेपालको चितवन कोई समूह (सगरमाथा हाइड्रोपावर कम्पनी) को १० प्रतिशत लगानी रहेको छ।"
नागरिकता माग्दै रिले अनशन,"विराटनगर : जन्मसिद्ध नागरिकका सन्तान भएकै कारण उमेर पुगेर पनि आफूहरुले नागरिकता पाउन नसकेको भन्दै विराटनगरमा रिले अनशन सुरु भएको छ। विराटनगर महानगरपालिकाको 'बी' प्लटमा बुधबारबाट नागरिकता नपाएका युवाहरुले तत्काल वंशजको आधारमा नागकिता पाउनुपर्ने लगायतका माग राखेर अनशन थालेका हुन्। जन्मका आधारमा नागरिकता लिएका अभिभावकका धेरै सन्तान नागरिकताविहीन बन्नु परेको र राज्य यस विषयमा संवेदनशील नभएको भन्दै युवाहरुले तीनदिने अनशन थालेका छन्।नागरिकता पीडित संघर्ष समितिका संयोजक विराटनगर६ का इशान खान, मोहम्मद तौसिफ, विराटनगर९ का इम्तियाज अन्सारी, विराटनगर१५ का आकाशकुमार हुलुवाई र गुड्डु सिंह अनशनमा बसेका छन्। समितिका संयोजक खानले शुक्रबारसम्ममा पनि आफूहरुको मागको कुनै सुनुवाई नभए आमरण अनशनसहितको थप संघर्ष थाल्ने बताए। उनका अनुसार मोरङमा एक हजारभन्दा बढी जन्मसिद्ध नागरिकका सन्तानले उमेर पुगेर पनि नागरिकता पाउन सकेका छैनन्।'नागरिकताका लागि विभिन्न निकायहुँदै प्रधानमन्त्री कार्यालयसम्म पुग्दा आश्वासन मात्रै पाइयो,' खानले भने, 'जन्मसिद्धका आधारमा २०६३ सालमा नागरिकता पाएका अभिभावकका धेरै सन्तान उमेर पुगेर पनि लामो समयदेखि नागरिकताविहीन बन्नु परेको छ।' '२०७२ सालको संविधानको धारा ११ को उपधारा (१), (२) र (३) बमोजिम नागरिकता प्राप्त गर्न कुनै अड्चन छैन,' उनले भने, 'तर ऐन नबनेको भन्दै नागरिकता दिइएको छैन।' उनले मुलुकको मुल कानुनलाई ऐन नबनेको भनेर बन्धक बनाउन नपाइने जिकिर गरे। संविधानको धारा १० (१) मा कुनै पनि नेपाली नागरिकलाई नागरिकता प्राप्त गर्ने हकबाट बञ्चित नगरिने प्राब्धान रहेको उल्लेख गर्दै उनले भने, 'संविधानका धाराहरुमा कानुनअनुसार शब्दावलीमा कुनै बाधा अवरोध पनि पुर्याइएको छैन।' खानले नागरिकताकै कारण उच्च शिक्षा र रोजगारीको अवसरबाट बन्चित भई धेरै युवाको भविष्य नै अन्धकारमा परिरहेको गुनासो गरे। विभिन्न समयमा उच्च र सर्वोच्च अदालतले समेत जन्मसिद्ध नागरिकको सन्तानलाई वंशजका आधारमा नागरिकता दिनका लागि आदेश दिइसक्दा पनि नागरिकलाई आफ्नौ नैसर्गिक अधिकारबाट बन्चित गराउने काम भइरहेको संघर्ष समितिका सचिव मोहम्मद तौसिफले बताए। उनले नेपालको संविधानमा स्पष्ट व्यवस्था र अदालतको आदेश बमोजिम युवाहरुलाई नागरिकता दिइनुपर्ने बताए। संविधान कार्यान्वयन र अदालतको आदेशको पालना गर्नु राज्यको दायित्व हुने उनको तर्क छ। नागरिकताका लागि आन्दोलन गर्नु परेकोमा दुःख व्यक्त गर्दै अध्यक्ष खानले नागरिकताविहीन युवा युवतीको समस्याको सम्बोधन तत्काल गर्न माग गरे। चरणवद्ध आन्दोलन गर्दा पनि कुनै सुनुवाई नभए पनि रिले अनशन थालिएको र यसले पनि कुनै उपलब्धी हाँसिल नभए आमरण अनशन गर्दै अन्तराष्ट्रिय अदालत, संयुक्त राष्ट्र संघ र मानव अधिकार आयोग समक्ष पुग्न आफूहरु बाध्य हुने उनले बताए। नागरिकता पीडित संघर्ष समितिले आमाको नामबाट नागरिकता र जन्मसिद्धका सन्तानलाई वंशजको आधारमा नागरिकता दिइनु पर्ने, महिला र पुरुषबीचको विभेदको अन्त्य हुनुपर्ने, सर्वोच्च र उच्च अदालतको परमादेशको पालना हुनुपर्ने लगायतका माग अघि सारेको छ। दोहोरो नागरिकता लिएकालाई उच्चस्तरिय छानबिन समिति गठन गरेर कारवाही गरिनुपर्ने, जन्मसिद्ध नागरिकका सन्तानलाई वंशजको आधारमा नागरिकता दिइनुपर्ने, बुवा वेपत्ता वा मृत्यु भएमा एकल महिलाका सन्तानलाई आमाको नागरिकताको आधारमा नागरिकता दिनुपर्ने लगायतका मागलाई पनि आफ्नो मुख्य मुद्दा बनाइएको जानकारी खानले दिए। २०४६ साल अघि जन्मिएका जुनसुकै नेपाली नागरिकलाई २०६३ सालमा जन्मका आधारमा नागरिकता दिइएको थियो । २०६३ मा जन्मसिद्ध नागरिकता लिएकाका सन्तानले भने अहिले वंशजको नागरिकता पाउन नसकेका हुन्। जन्मका आधारमा एक पटक मात्रै नागरिकता दिने व्यवस्था उपयुक्त हुने र अन्य व्यवस्था कानुन बनाएर मात्रै दिनु भन्ने फैसला २०७० सालमा सर्वोच्च अदालतले गरेको पनि छ। त्यही फैसलाका आधारमा गृह मन्त्रालयले २०७० चैत २० गते जन्मका सन्तानलाई अहिले नागरिकता नदिनु भन्दै परिपत्र गरेको थियो। मोरङको कटहरी गाउँपालिका४ की ममता हरिजनले पनि नागरिकता पाउन नसकेको बताइन। 'घरमा बुवा आमा सबैको नागरिकता छ, उनले भनिन्, 'मैले भने पाउन नसक्दा लामो समयदेखि पढाईबाट बञ्चित हुनुका साथै लोकसेवा आयोगकको तयारी गर्न पाइरहेकी छैन।' विराटनगर महानगरपालिका६ का २१ वर्षीय शशिकुमार सिंहले पनि नागरिकता नपाउँदा वैदेशिक रोजगारीका लागि जान नपाएको दुखेसो गरे। 'बुवाले जन्मका आधारमा नागरिकता लिनु भएको छ। आमाको वंशको नागरिकता छ,' उनले भने,'नागरिकताका लागि पटकपटक धाउँदा पनि मैले चैं पाउन सकिन। जिल्ला प्रशासन कार्यालय मोरङमा जाँदा दिन नमिल्ने भन्दै फर्काउने गरिएको छ।' मोरङका प्रमुख जिल्ला अधिकारी रमेशकुमार केसीले गृहको त्यतिबेलाको परिपत्रका कारण अहिलेसम्म जन्मसिद्ध नागरिकता लिएकाका सन्तानलाई वंशजको नागरिकता दिन नसकिएको बताए। नागरिकका विधेयक २०७५ संसदमा पेश भइसकेका कारण पारित भएर आएपछि नागरिकतासम्बन्धी सबै समस्याको हल हुनसक्ने उनको भनाइ छ। ऐन नबनेसम्म नागरिकता सम्बन्धी जटिलताको समाधान हुन गाह्रो पर्ने प्रजिअ केसीले बताए। उनले बावुले नागरिकता प्राप्त गर्नुपूर्व जन्मिएको सन्तानको हकमा नागरिकता ऐनमा कुनै व्यवस्था नभएको बताए।"
सुर्खेतमा पहिलो पटक ५ जना राउटेले बुझे तलब,"सुर्खेतः जंगलमा फिरन्ते जीवन बिताउँदै आएका लोपोन्मुख जाती राउटेले पहिलो पटक तलब बुझेका छन्। राउटे समुदायको उत्थानका लागि क्रियाशिल सामाजिक सेवा केन्द्रको कार्यक्रमलाई सहयोग गरेबापत पाँचजना राउटेले पहिलो महिनाको पारिश्रमिक बुझेका हुन्। लेकबेसीमा बस्दै आएका उनीहरुलाई बुधबार गाडीमा राखेर वीरेन्द्रनगरमा ल्याएपछि बैंकमार्फत उनीहरुको महिनाको पारिश्रमिक भुक्तानी दिइएको छ।आधुनिक समाजसँग नजिक्याउन सोकेकमार्फत लागु भएको सामाजिकिकरण कार्यक्रममा राउटे परासहकर्ताको भूमिका निभाएकोमा मासिक तलब दिने गरिएको सोसेक दैलेखका अध्यक्ष हिरासिंह थापाले जानकारी दिए। बुधबार बिहानै थापासहितको टोलीले भेरी किनारमा बसिरहेका राउटे समुदायमा पुगेरे पाँच मुखियालाई वीरेन्द्रनगर तलब पारिश्रमिक भुक्तानीका लागि ल्याइएको थियो। राउटेका मुख्य मुखिया सुर्यनारायण शाहीले एक महिनाको दुई हजार रुपैयाँ पारिश्रमिक बुझेका छन् भने अन्य चारजना सहायक मुखियाले प्रतिव्यक्ति १ हजार ५ सयका दरले बुझेका छन्। 'उनीहरुको दैनिकी व्यवस्थिति गराउने अभियानमा हामीलाई निकै चुनौती खडा भयो, उनीहरुबाटै आवश्यक सहयोग नहुने देखियो, अध्यक्ष थापाले भने, 'आफ्नो समुदायका नागरिकलाई परिवर्तनप्रति आकर्षण गराउन सहयोग पुर्याउन भन्नका लागि पाँचजनालाई जागिरेका रुपमा सहजकर्ता नियुक्त गरेका हौं।' बैंकमार्फत महिनबहादुर शाही, प्रकाश शाही, डिलबहादुर शाही र विरबहादुर शाहीले जनही मासिक  हजार सय रुपैयाँ बुझेका हुन्। पहिलो तलब पाएपछि राउटे मुखिया सुर्यनारायण शाहीले भने, 'सरकारले दिने भत्ताबाहेक तबल पाउने गरी काम गरेका थिएनौं, पहिलो पटक बैंकमै आएर तलब बुझेका हौं।' उनले सबै कुरा एकै पटक परिवर्तन सम्भव नभए पनि विस्तारै विस्तारै आफ्नो समुदाय पनि सामान्य मानिससरह जीवन बिताउने शाहीले बताए। ४५ दिनभन्दा धेरै एकै ठाउँमा नबस्ने राउटेले गर्मीयाम सुरु भएपछि पुनः अर्को ठाउँमा बसाई सर्ने तयारी गरिरहेका छन्।"
ढुंगा लागेर मृत्यु,नुवाकोट : नुवाकोटको पश्चिमी भेगमा रहेको मानेपाखामा भीरबाट खसेको ढुंगा लागेर एकजनाको ज्यान गएको छ। सदरमुकाम विदुरदेखि ३० किलोमिटर पश्चिममा रहेको म्यागङ गाउपालिका३ मानेपाखामा बाटो खन्ने क्रममा माथिबाट खसेको ढुंगा टाउकोमा लागेर स्थानीय ४९ वर्षीय छोरे तामाङको घटनास्थलमै मृत्यु भएको जिल्ला प्रहरी कार्यालय नुवाकोटका प्रमुख तथा प्रहरी उपरीक्षक कृष्णबहादुर पल्लिमगरले जानकारी दिए। मृतकको शव नुवाकोट जिल्ला अस्पताल त्रिशूलीमा पोष्टमार्टम गरिएको छ।घटनाका सम्बन्धमा थप अनुसन्धान भइरहेको उपरीक्षक पल्लिमगरले बताए।
