शीर्षक,विवरण
विप्लवका कार्यकर्ता एलएमजी र एम१६ सहित पक्राउ,"धरान : नेत्रविक्रम चन्द विप्लव नेतृत्वको नेपाल कम्युनिष्ट पार्टीका एकजना कार्यकता दुई थान अत्याधुनिक हतियारसहित पक्राउ परेका छन् । प्रहरीले धरानको पानमारा सडकखण्डमा मोटरसाइकलबाट मोरङतर्फ जाँदै गरेका विप्लवका कार्यकर्ता मोरङको बेलबारी नगरपालिका१० का देवकुमार लिम्बू 'सन्दीप' लाई लङ मेसिन गन र एम१६ सहित पक्राउ गरेको हो । पानमारास्थित सडकमा नियमित चेकजाँचमा खटिएको ट्राफिक प्रहरीको टोलीले मोटरसाइकलबाट मोरङतर्फ जाँदै गरेका दुईजनामाथि चेकजाँच गर्ने क्रममा उक्त हतियार बरामद गरेका हुन् । प्रहरीले हतियार बरामद गरेपछि विप्लवकका एकजना कार्यकर्ता भने भाग्न सफल भएका छन् । पक्राउ परेका लिम्बू विप्लवको पूर्वी ब्यूरो सदस्य रहेको खुलेको छ। लिम्बुलाई अहिले पानीबारी प्रहरी चौकीमा राखेर अुनसन्धान अघि बढाइएको छ। प्रहरीका अनुसार बराम भएका दुवै हतियार माओवादीले द्वन्द्वकालमा नेपाली सेनाबाट लुटेको अनुमान गरिएको छ । आफुले प्रयोग गर्दै आएको हतियार विप्लवका कार्यकर्ताबाट बरामद भएपछि नेपाली सेनाको टोली पनि त्यहाँ पुगेको छ । यी दुवै हतियार नेपाली सेनाले प्रयोग गर्दै आइरहेको छ । एलएमजी सशस्त्र प्रहरीसँग केही थान भए पनि एम१६ भने नेपाली सेनासँग मात्रै रहेको छ । अमेरिकामा निर्मित एम१६ राइफल नेपाली सेनाले माओवादीसँग युद्धकै क्रममा खरिद गरेको थियो । विप्लवका कार्यकर्ता अत्याधुनिक हतियारसहित पक्राउ गरेपछि अहिले एक नम्बर प्रदेशका प्रहरी प्रमुख डीआईजी केदार रिजाल, संघीय प्रहरी कार्यालय धरानका प्रमुख एसएसपी शरद खत्री, सुनसरीका प्रहरी प्रमुख एसपी राजन अधिकारी पनि पानबारी पुगिसकेका छन् ।"
उडेको एक मिनेटमै दुर्घटनामा परेको थियो हेलिकोप्टर,"काठमाडौ : सरकारले ताप्लेजुङमा भएको हेलिकप्टर दुर्घटनामा ज्यान गुमाएका संस्कृति पर्यटन तथा नागरिक उड्ययन मन्त्री रवीन्द्र अधिकारीसहित सातैजनाको शव भेटिएको जनाएको छ । गृहमन्त्रालयमा आयोजित आकष्मिक पत्रकार सम्मेलनमा मन्त्री सवार हेलिकोप्टर मौसमको खराबीका कारण दुर्घटना परेको जानकारी दिइएको हो । गृहमन्त्रालयले बुधबारै पत्रकार सम्मेलन गरेर घटनाको पुष्टि गर्दै मन्त्री अधिकारीसहित सातैजनाले हेलिकोप्टर दुर्घटनामा ज्यान गुमाएको जानकारी दिएको छ । गृहमन्त्रालयका अनुसार ताप्लेजुङको लिङखिम र फुरुम्बु गाउँपालिकाको बीच भागमा अवस्थित तारे ढुङ्गा पारीको भीरमा हेलिकोप्टर दुर्घटना भएको हो । दुर्घटनास्थलमा हेलिकोप्टर टुक्रा टुक्रा भएको अवस्थामा भेटिएको त्यहाँ पुगेका स्थानीय भुपेन्द्र गुरुङले जानकारी दिएका छन् । गृह प्रवक्ता रामकृष्ण सुवेदीले तेह्रथुमको आठराई चुहानडाँडा गाउँपालिकामा निर्माण गर्न लागिएको एयरपोर्ट निरीक्षण सकेर ताप्लेजुङको पाथीभरा मन्दिर दर्शन गर्न गएको हेलिकोप्टर दुर्घटनामा परेको जानकारी दिए । पर्यटनमन्त्रीसहित ६ जना यात्रु र एकजना पाइलटको ज्यान गएको छ, सुवेदीले भने, दुर्घटनामा परेका मन्त्रीज्यूको शव केही भाग जले पनि चिनिने अवस्थामा छ । उहाँका निजी सुरक्षा गार्डको शव चिनिने अवस्थामा छ । अरुको शव भने चिनिने अवस्थामा छैन । शव संकलनका लागि नेपाली सेना, सिम्रिक एयर र एयर डाइनेस्टीको हेलिकोप्टर गइसकेका उनले बताए । दुर्घटनास्थलबाट शव विमानस्थलसम्म ल्याउन २ देखि अढाई घण्टासम्म लाग्ने अवस्था रहेको सुवेदीले बताएका छन् । उता त्रिभुवन विमानस्थल कार्यालयका प्रवक्ता प्रतावबाबु तिवारीले मन्त्री अधिकारीसहितको टोलीले पाथीभरा दर्शन गरेर फिर्ने क्रममा हेलिकोप्टर दुर्घटनामा परेको बताएका छन् । सुकेटार विमानस्थलबाट उडेको एक मिनेटमै हेलिकोप्टर दुर्घटनामा परेको पाइयो, विमानस्थलका प्रवक्ता प्रतावबाबु तिवारीले भने, अफ्ठ्यारो भिरमा हेलिकोप्टर खसेकाले उद्दारमा पनि कठिनाइ भएको छ, मौसम पनि प्रतिकूल छ । दुर्घटनामा परेको हेलिकोप्टरमा को को सवार थिए ? हेलिकप्टर दुर्घटनामा पर्यटनमन्त्री अधिकारीसहित सातजनाको मृत्यु"
"चट्याङ लागेर वीरगन्जमा एक महिलाको मृत्यु, एक गम्भीर",वीरगन्ज : वीरगन्जमा बुधबार दिउँसो चट्याङ लागेर एक महिलाको मृत्यु भएको छ।अर्की एक महिला गम्भीर घाइते भएकी छन्। मृत्यु हुनेमा वीरगन्ज महानगरपालिका२० हरपतगन्जकी ३० वर्षीया रुआफजा खातुन रहेकी छन्। उनीसँगै घाइते भएकी छिमेकी ४० वर्षीया शायदा खातुनको भने वीरगन्ज हेल्थ केयर हस्पिटमा उपचार भइरहेको छ। दिउँसो १ बजेतिर घर बाहिर निस्किएका बेला वर्षा हुन थालेपछि रुअफजा र शायदा दुवैजना गाउँमै रहेको आँपको रुखमुनि ओत लागेर बसिरहेका चट्याङ लागेर गम्भीर घाइते भएका थिए। गम्भीर घाइते दुवैलाई गाउँलेहरुले तत्कालै वीरगन्ज हेल्थ केयर हस्पिटलमा लगेपनि रुअफजाको उपचारका क्रममा मृत्यु भएको पर्साका प्रहरी उपरीक्षक रेवती ढकालले जानकारी दिए। मृतक रुअफजाको शव नारायणी उपक्षेत्रीय अस्पतलमा पोष्टर्मटम पछि परिवारको जिम्मा लगाएको प्रहरी उपरीक्षक ढकालले बताए।
बैतडीका ९ स्थानीय तहमा प्रहरीचौकी,"बैतडी : जिल्लाका १० वटा स्थानीय तहमध्ये ९ तहका केन्द्रमा प्रहरीको उपस्थिति रहेको छ।शान्ति सुरक्षा कायम गर्न स्थानीय तहका केन्द्रमा प्रहरीचौकी स्थापना गरिएको जिल्ला प्रहरी कार्यालयका प्रहरी नायव उपरीक्षक नेत्रमणी गिरीले बताए । उनले स्थानीय तहका केन्द्रमै सेवाग्राही बढी आउने गरेका जानकार दिए।तहका केन्द्रमा बैकिङ सेवा सुचारु भएपछि प्रहरीले उपस्थिती जनाएको हो। स्थानीय तह स्थापना भएपछि सुर्नया, शिवनाथ र पञ्चेश्वर गाउँपालिकाका केन्द्रमा प्रहरीचौकी स्थापना गरिएको प्रहरी नायव उपरीक्षक गिरीले बताए। उनले दशवटा स्थानीय तहमध्ये ६ वटामा पहिला नै प्रहरीको उपस्थिती रहेको बताए।तीन ठाउँमा चालु आर्थिक वर्षमा प्रहरीचौकी स्थापना गरेको उनले जानकारी दिए। प्रहरीचौकी नभएको सिगास गाउँपालिकाको केन्द्र गर्जेमा पनि प्रहरीचौकी स्थापनाका लागि जिल्ला प्रशासन कार्यालयमार्फत गृहमन्त्रालयमा अनुरोध गरिएको प्रहरी नायव उपरीक्षक गिरीले जानकारी दिए। स्थानीय तहको केन्द्रमा अस्थायी प्रहरीचौकी स्थापना भएपछि कामकाजमा सहजता आएको सुर्नया गाउँपालिकाका अध्यक्ष बीरबहादुर बिष्टले बताए। उनले स्थानीय सरकारको केन्द्र भएको ठाउँमा प्रहरीको उपस्थितिले कानुन कार्यान्वयनमा सहजता ल्याएको बताए। शिवनाथ गाउँपालिकाको केन्द्रमा अस्थायी प्रहरीचौकी स्थापना भएपछि बैंकले समेत आफ्नो सेवा सुरु गरेको गाउँपालिकाका अध्यक्ष कर्णसिंह साउँदले बताए। ग्रामीण क्षेत्रमा हुने विभिन्न खालका सामाजिक विकृति, अपराध न्यूनीकरणमा प्रहरीको उपस्थितिले सहयोग पुग्ने सामुदायिक प्रहरी सेवा केन्द्रका अध्यक्ष दिपेश शाहले बताए। उनले भने, 'प्रहरी जति गाउँमा पुग्नसक्यो त्यति नै नागरिक र प्रहरीबीचको सम्बन्ध बलियो हुन्छ।' स्थानीय तहका केन्द्रमा प्रहरीको उपस्थिति सामुदायिक प्रहरी साझेदारी कार्यक्रम पनि प्रभावकारी हुने प्रहरी नायव उपरीक्षक गिरीले बताए। उनले जिल्लाभरी ३० युनिटबाट सेवा दिइरहेको बताए। 'जति हाम्रा युनिट विस्तार हुन्छन् त्यति नागरिक र हामीबीचको सम्बन्ध बलियो हुन्छ, उनले भने।'"
अमेरिकाको भर्जिनियामा गाडीको ठक्करबाट एक नेपालीको मृत्यु,नुवाकोट : अमेरिकामा भएको दुर्घटनामा नुवाकोटका एक वृद्धको ज्यान गएको छ। सडक दुर्घटनामा परी नुवाकोटको पूर्वी भेगमा रहेको थानसिङ महादेवस्थान घर भएका चन्द्र भण्डारीको मृत्यु भएको परिवारजनले जनाएका छन्। लिखु गाउँपालिका६ थानसिंह महादेवस्थान घर भएका भण्डारी छोरी ज्वाइलाई भेट्न चार महिना अगाडि अमेरिका पुगेका थिए। ७२ वर्षीय भण्डारीको अमेरिकाको भर्जिनियास्थित टाइसन कर्नरमा गाडीले ठक्कर दिँदा ज्यान गएको हो। जेब्रा क्रसिङ्गमा हिँड्दै गर्दा भण्डारीलाई गाडीले ठक्कर दिँदा घटनास्थलमै उनको मृत्यु भएको परिवारजनले जनाएका छन्। उनको शव नेपाल ल्याउने विषयमा छलफल भइरहेको मृत भण्डारीका छोरा नारायणप्रसाद भण्डारीले जानकारी दिए।
हेलिकप्टर दुर्घटनामा पर्यटनमन्त्री अधिकारीसहित सातजनाको मृत्यु,"ताप्लेजुङ : ताप्लेजुङमा बुधबार भएको एयर डाइनेस्टीको हेलिकप्टर दुर्घटनामा संस्कृति पर्यटन तथा नागरिक उड्ययन मन्त्री रवीन्द्र अधिकारीसहित सातैजनाको मृत्यु भएको छ । पाथिभरा दर्शन गरेर काठमाडौंका लागि उडेको मन्त्री सवार हेलिकप्टर फुङलिन नगरपालिका १० साविक फुरुम्बु गाविसको मयाम सिरानस्थित तारेढुंगा भीरमा दुर्घटनाग्रस्त भएको हो। संघीय प्रहरी इकाइ धरानका एसएसपी शरद खत्रीका अनुसार दुर्घटनामा परेका सबै सातजनाकै निधन भएको हो । 'घटनास्थलमा सबै सातजनाको शव भेटिएको छ', उनले भने, 'दुर्घटनास्थलमा प्रहरीको टोली पुगिसकेको छ ।' क्याप्टेन प्रभाकर केसीले चलाएको एयर डाइनेस्टीको एमआई एयरबस हेलिकप्टर मन्त्री अधिकारीसहित सातजना यात्रुलाई लिएर तेह्रथुमको चुहानडाँडास्थित निर्माणाधीन एयरपोर्ट अवलोकनपछि ताप्लेजुङतर्फ लागेको थियो । हेलिकप्टरमा संस्कृति पर्यटन तथा नागरिक उड्ययनमन्त्री रविन्द्र अधिकारी, यति एयरलाइन्सका अध्यक्ष आङछिरिङ शेर्पा, नेपाल नागरिक उड्ययन प्राधिकरणका उपमहानिर्देशक वीरेन्द्रप्रसाद श्रेष्ठ, मन्त्री अधिकारीका पिएसो अर्जुनकुमार घिमिरे, प्रधानमन्त्री कार्यालयका सल्लाहकार युवराज दाहाल, नेपाल नागरिक उड्न प्राधिकरण इन्जिनियर धुब्रदास भोछिभया, हेलिकप्टर क्याप्टेन : प्रभाकर केसी सवार थिए । मन्त्री अधिकारीसहितको टोली तेह्रथुमको चुहानडाँडास्थित विमानस्थल अवलकोन सकेपछि ताप्लेजुङ पुगेको थियाे । दुर्घटनामा ज्यान गुमाउनेहरु रविन्द्र अधिकारी : मन्त्री संस्कृति पर्यटन तथा नागरिक उड्ययन आङछिरिङ शेर्पा : अध्यक्ष यति एयरलाइन्स वीरेन्द्रप्रसाद श्रेष्ठ : उपमहानिर्देशक नेपाल नागरिक उड्ययन प्राधिकरण अर्जुनकुमार घिमिरे : मन्त्री अधिकारीका पिएसो युवराज दाहाल : प्रधानमन्त्री कार्यालयका सल्लाहकार धुब्रदास भोछिभया : इन्जिनियर नेपाल नागरिक उड्न प्राधिकरण हेलिकप्टर क्याप्टेन : प्रभाकर केसी"
