शीर्षक,विवरण
अलपत्र मेलम्ची,"विगत तीन महिनादेखि मेलम्ची खानेपानी आयोजनाको निर्माण ठप्प छ। मेलम्चीको ९७ प्रतिशत काम पूरा भइसकेको थियो। अस्थायी बाँध बाँधेर गएको माघ २७ मा काठमाडौंमा पानी ल्याउने सरकारी उद्घोष थियो। भुक्तानी नपाएर काम छाडेको ठेकेदारलाई फर्काउने खानेपानीमन्त्री बिना मगरको प्रयास कर्मचारीतन्त्र र प्रधानमन्त्रीका पूर्वाधार विज्ञहरूको असहयोगका कारण सफल हुन सकेन। तर ठेकेदारलाई अघिल्ला सचिव गजेन्द्र ठाकुरले विनाकारण भुक्तानी दिएनन्। ठेक्का रद्द भयो। सचिव ठाकुर र आयोजना प्रमुख सूर्यराज कँडेलको दाउ नयाँ ठेकेदार नियुक्त गर्ने थियो। नयाँ ठेकेदार नियुक्त गर्नुको मुख्य उद्देश्य त्यसभित्र निहित कमिसन खेल थियो। नेपालको ठेक्कापट्टामा परिचालन खर्च वापत हुने अग्रिम भुक्तानीमध्ये केही अंश निर्णयकर्तामा भागबन्डा गर्ने चलन छ। यही लालचमा सिंगो आयोजनालाई धरापमा पारिएको छ । मेलम्चीको ठेकेदार विदेशी भए पनि यो पूर्वाधार निर्माणमा स्वदेशका आपूर्तिकर्ता, उपठेकेदार, कामदार, श्रमिकहरूको ठूलो लगानी परेको छ। सरकारले यसलाई भुल्नु हुन्न। रात दिन खटेर काम गरेका मजदुर र श्रमिकहरूले पाँच महिनादेखि तलब पाएका छैनन्। स्थानीय आपूर्तिकर्ताले भुक्तानी पाएका छैनन्। कूल मिलाएर झन्डै डेढ अर्ब रुपैयाँ नेपाली पक्षले ठेकेदारबाट भुक्तानी पाउन बाँकी छ। उनीहरू आफूले पाउनुपर्ने रकम सरकारले दिनुपर्ने भन्दै आन्दोलित भएका छन्। मंगलबार आयोजनास्थलमा पत्रकार सम्मेलन गरेर स्थानीय मजदुर, श्रमिक तथा आपूर्तिकर्ताहरूले आन्दोलनको उद्घोष गरे। यो उद्घोषसँगै नयाँ ठेकेदार नियुक्त गरी आफ्नो निहित स्वार्थ पूरा गर्न लागिपरेकाहरूको नियतमा ठूलो ठेस लागेको छ। सीएमसी नआउनेनल्याउने हो भने मेलम्ची अब कहिले आउँछ यकिन भन्न नसकिने अवस्था पैदा भएको छ । मेलम्चीमा नयाँ ठेक्का गर्दा प्रक्रियागत समय र थप भारयुक्त लागतका कारण पुरानै ठेकेदारलाई आपसी सहमति गरी काम चालू गराउने पक्षमा खानेपानीमन्त्री मगर थिइन्। तर आयोजना प्रमुखदेखि मन्त्रालयका उच्चपदस्थ कर्मचारी पुरानो ठेकेदारलाई काममा लगाउन नसकिने भन्दै सरकारलाई असहयोग गरिरहेका छन्। एकपटक ठेक्का रद्द भई पुनः वार्ताद्वारा उसैलाई ठेक्का दिलाइएका उदाहरण नेपालको पूर्वाधार आयोजनामा थुप्रै छन्। हाल बनिरहेको कुलेखानी तेस्रोमा पनि ठेक्का रद्द भएकै थियो। मध्य मर्स्याङ्दी जलविद्युत्मा पनि ठेक्का रद्द भएर पछि वार्ताद्वारा काम चालू गराइएको थियो। तर मेलम्चीमा सीएमसीलाई ल्याउनै हुन्न भन्ने पक्षमा केही प्रभावशाली कर्मचारीको असहयोग हुन्छ भने यसमा सरकारको निरीहता छर्लंग देखिन्छ। असहयोग गर्ने कर्मचारीलाई हटाई देश र जनताका पक्षका काम गर्न सक्ने कर्मचारी ल्याउन सक्नुपर्छ । यसका लागि प्रधानमन्त्रीको हस्तक्षेप आवश्यक पर्छ। प्रधानमन्त्रीलाई उनका केही सल्लाहकारले अभै पनि भ्रममा राखेको देखिन्छ। भ्रमित प्रधानमन्त्रीले उचित निर्णय गर्न र निर्देशन दिन सक्दैनन्। भ्रममा पार्नेहरूका आआफ्ना दाउ र स्वार्थ छन्। प्रधानमन्त्री दुविधामा परेको हो भने उनले स्वतन्त्र विज्ञहरूको सल्लाह लिनुपर्छ। भ्रम चिर्नुपर्छ। के गर्दा मेलम्चीको लागत बढ्दैन र छिटो उपत्यकामा पानी आउँछ भन्ने अर्जुनदृष्टि प्रधानमन्त्रीले लगाउनुपर्छ। खानेपानीमन्त्रीले पनि कर्मचारीले असहयोग गरे भन्दैमा त्यत्तिकै चुप लागेर बस्नु हुन्न। उनले सीधै मन्त्रिपरिषद्मा पुरानै ठेकेदारलाई काममा लगाउने प्रस्ताव लैजानुपर्छ । मेलम्चीसित राष्ट्रिय स्वार्थको अर्काे ठूलो आयोजना पनि जोडिएको छ तनहुँ हाइड्रो। तनहुँले पनि एकतर्फी ठेक्का रद्द गरिसकेको छ सीएमसी नआएका कारण। तनहुँको पनि पुनः ठेक्का गर्नुपयो भने यसको लागत र समय पुनः वृद्धि हुनेछ, जुन मुलुकका लागि दुर्भाग्य हो। अन्तर्राष्ट्रिय दातृ निकायसित व्यापारिक ऋण लिएर आयोजना बनाउने अनि यो र त्यो बहानामा लम्बिने पुरानो रोग यसमा पनि देखिने डर छ। यसले समग्र मुलुकको कमजोर ठेक्का व्यवस्थापन, अनिर्णय मात्र होइन, कमिसन लालचलाई पनि उजागर गर्छ। तसर्थ तत्काल सीएमसीलाई फर्काउन दुई कारणले सरकार गम्भीर हुनैपर्छ। पहिलो कम लागत र छोटो समयमा पानी ल्याउन। दोस्रो नयाँ ठेकेदार नियुक्त गर्दा काम गर्न नसक्ने स्थिति प्रस्ट भएकाले आयोजनाको भविष्य अन्योलमा पार्न नदिन। यति पनि गर्न नसक्ने हो भने झन्डै दुईतिहाइको सरकार कति कमजोर र नालायक रहेछ भन्ने सन्देश जनतामा प्रवाहित हुनेछ र यो सरकारबाट जनताले थप अपेक्षा गर्न छाडिदिनेछन् ।"
दुई सय नेपाली विद्यार्थीलाई भारतले दियो स्वर्ण जयन्ती छात्रवृत्ति,"काठमाडौँ : काठमाडौंस्थित भारतीय दूतावासले नेपालका विभिन्न विश्वविद्यालय र कलेजमा स्नातक तहका २०० जेहेन्दार नेपाली विद्यार्थीलाई शैक्षिक सत्र २०१८२०१९ का लागि स्वर्ण जयन्ती छात्रवृत्ति प्रदान गरेको छ । यस वर्ष नेपालका ५० जिल्लाको विद्याथीहरुले एमबीबीएस, बीडीएस, बीई, बीएससी, बीबीए र बीकमसहित ३६ वटा स्नातक कोर्षका लागि छात्रवृत्ति पाउनेछन् । यी विद्यार्थीमध्ये ४५ प्रतिशत छात्रा र ८ प्रतिशत अपाङ्ग छन् । होटेल हायात रिजेन्सीमा आयोजित स्वर्ण जयन्ती छात्रवृत्ति समारोहका प्रमुख अतिथि शिक्षा सचिव खगराज बरालले २०० विद्यार्थीलाई छात्रवृत्तिका लागि योग्यताको प्रमाणपत्र प्रदान गरे । नेपालका लागि भारतीय राजदूत मञ्जीव सिंह पुरीले छात्रवृत्ति प्राप्त गर्ने विद्यार्थीहरुलाई बधाई दिँदै व्यक्तिगत तथा व्यवसायिक सफलता हासिल गर्न सल्लाह दिदए । उनीहरुको सफलताले नेपालको सामाजिक आर्थिक विकासमा टेवा पुर्याउनुका साथै भारतनेपाल सम्बन्धलाई थप मजबुत बनाउने उनले बताए । सन् २००२ मा भारत सरकारले भारतनेपाल आर्थिक सहकार्य को ५० वर्ष पुरा भएको अवसरमा यस प्रतिष्ठित स्वर्ण जयन्ति छात्रवृत्तिको सुरुवात गरेको थियो । यस छात्रवृत्ति कार्यक्रमको पहिलो संस्करण अन्तर्गत ५० जेहेन्दार नेपाली विद्यार्थीहरुलाई छात्रवृत्ति प्रदान गरिएको थियो । सन् २००७ मा सो छात्रवृत्ति संख्या वृद्धि भइ १०० पुगेको थियो । सन् २०१२ यता छात्रवृत्ति संख्या दुई गुनाले वृद्धि भएर २०० भएको छ । यस छात्रवृत्ति कार्यक्रम अन्तर्गत एमबीबीएस बीडीएसका विद्यार्थीले पाँच वर्षसम्म प्रतिमहिना ४ हजार, बीईका विद्यार्थीले चार वर्षसम्म प्रतिमहिना ४हजार र अन्य स्नातक कोर्षका विद्यार्थीले तीन वर्षसम्म प्रतिमहिना तीन हजार प्राप्त गर्नेछन् । हालसम्म नेपालका ७७ जिल्लका २३५० भन्दा बढी नेपाली विद्यार्थीलाई स्वर्ण जयन्ती छात्रवृत्ति प्रदान गरिसकिएको छ । नेपाल तथा भारतका विश्वविद्यालय तथा कलेजमा चिकित्सा, विज्ञान, पशु विज्ञान, औषधि विज्ञान, दन्त विज्ञान, कृषि, इन्जिनियरिङ्ग, कला, कमर्स, विज्ञान, कम्पुटर विज्ञान, नर्सिङ तथा अन्य विभिन्न विषयका अध्ययनका लागि भारत सरकारले कूल ३००० छात्रवृत्ति प्रदान गर्दछ । यी छात्रवृत्तिहरु नेपाल तथा नेपाली जनताको समग्र सामाजिकआर्थिक विकासका निमित्त नेपालमा मानव स्रोतको विकासमा सहयोग पुर्याउन भारतको प्रयासको एक हिस्सा भएको बताइएको छ ।"
महिलाको शव फेला,राजविराज : सप्तरीको कञ्चनरुप नगरपालिकामा बुधबार एक महिलाको पासोमा झुण्डिएको अवस्थामा शव फेला परेकी छन्।कञ्चनरुप नगरपालिका ५ पिप्रा पूर्व बस्ने कुशेश्वर चौधरीकी श्रीमती २५ वर्षीया माला चौधरीको शव फेला परेको सप्तरी प्रहरीले जानकारी दिएको छ। बारीमा रहेको आँपको रुखमा साडीको पासो लगाई झुण्डिएको अवस्थामा शव फेला परेको जिल्ला प्रहरी कार्यालयका प्रहरी उपरीक्षक राजेन्द्र विष्टले बताए। शव पोष्टमार्टमका लागि राजविराजस्थित अस्पताल ल्याइएको छ।मृतकको घर र माइत पक्षका परिवारका सदस्यहरु कोही पनि नआएकाले बुधबार पोष्टमार्टम हुन नसकेको अस्पतालले जनाएको छ।मृतकका श्रीमान वैदेशिक रोजगारमा छन्।
सहायक वन अधिकृत साह ३० हजार घुससहित पक्राउ,"धनगढी : कैलालीका सहायक वन अधिकृत ३० हजार घुससहित पक्राउ परेका छन्। बुधबार दिउँसो वन अधिकृत भरतप्रसाद साहलाई बिचौलिया मार्फत ३० हजार रुपैयाँ घुस लिँदै गरेको अवस्थामा अख्तियार दुरुपयोग अनुसन्धान आयोग महेन्द्रनगरको टोलीले पक्राउ गरेको हो। उनलाई धनगढीको तारानगरमा रहेको सव डिभिजन वनकार्यालयको आफ्नै कार्यकक्षमा सेवाग्राहीबाट घुस लिँदै गरेको अवथामा रंगे हात पक्राउ गरेको अख्तियार दुरुपयोग अनुसन्धान आयोग कञ्चनपुरका प्रमुख प्रेमसागर केसीले जानकारी दिए। रोकिएको काठ सम्बन्धी मुद्धाको फाइल सहज बनाइदिन्छु भनेर घुस लिएको भेटियो', उनले भने, त्यसपछि प्रहरी प्रशासन लगाएर पक्राउ गरेको हो।' सुनसरीको इनरुवा नगरपालिका ३ का साहलाई थप अनुसन्धानको लागि अख्तियारको मुख्यालयमा पठाइने र घुस सम्बन्धी मुद्धा चलाइने जनाइएको छ।"
बलात्कारपछि बालिका हत्या गर्ने युवकलाई जन्मकैद,"भोजपुर : बालिकालाई बलात्कारपछि हत्या गरेको अभियोगमा एक युवकलाई जिल्ला अदालत भोजपुरले जन्मकैदको फैसला सुनाएको छ । अदालतले ११ वर्षीया बालिकालाई बलात्कारपछि हत्या गरेको अभियोगमा साल्पासिलिछो गाउँपालिका५, दोभाने सालेवाका २० वर्षीय सञ्जय राईलाई जन्मकैदको सजाय सुनाएको हो । जिल्ला न्यायाधीश हरिश्चन्द्र ईङ्नामको एकल ईजलासले राईलाई जबरजस्ती करणी उद्योगमा ८ वर्ष र ज्यान मारेको अभियोगमा जन्मकैदको फैसला सुनाएको हो । अदालतको फैसलाले मृतक बालिकाको परिवारलाई अभियुक्त राईबाट एकलाख क्षतिपूर्ति दिने निर्णय ठहर गर्दै जन्मकैदको फैसला सुनाएको जिल्ला अदालत भोजपुरका निमित्त श्रेस्तेदार नवीन कोइरालाले जानकारी दिए । पीडक राईले गत भदौ १० गते बेलुका मोबाइलमा फिल्म हेर्दै सुतेकी ११ वर्षीया बालिकालाई बलात्कार गरेपछि आमाबुवालाई सुनाइदिने डरले घाँटी थिचेर हत्या गरेका थिए । पीडित परिवारको उजुरीका आधारमा उनलाई घरबाटै नियन्त्रणमा लिइएको थियो । मृतक बालिका दोभानेको सालेवामै आमा धनमनी र सौतेनी बुवा राजन राईसँग बस्दै आएकी थिइन् ।"
