शीर्षक,विवरण
तातोपानी नाका सम्बन्ध,"उत्तरी छिमेकीसँग जोड्ने प्रमुख नाका (तातोपानीखासा) खुल्दैछ। भूकम्पसँगै बन्द नाका चार वर्षपछि खुल्न लागेको हो। नेपालचीन जोड्ने भरपर्दाे सडक संरचनासहितको यो नाका भूकम्पलगत्तै रोकिएको थियो। नाका सञ्चालनमा आएपछि तातोपानी क्षेत्रले तंग्रिने अवसर पाउनेछ। नाका खुल्ने विषयले सीमा जिल्ला मात्र होइन, आसपासका क्षेत्र पनि उत्साहित छन्। चीनलाई रेलमार्गले जोड्ने ठूला गफ सुन्दै आएका जनतालाई नाका सुचारु हुन लाग्दा उत्साह थपिनु स्वाभाविक हो। नेपालले सधैं त्यो नाकालाई दक्षिणको विकल्पका रूपमा मात्र लिए पनि चिनियाँ सामान आउने क्रम भने जारी रह्यो। भारतको कोलकाता, विशखापट्टनम भएर पनि नेपाल भित्रिरहेकै छ। हुन त जसोतसो रसुवागढी नाकाबाट पनि डेढ वर्षदेखि समयसमयमा सामान आइरहेको छ, तातोपानीको विकल्पका रूपमा। यता चिनियाँ कम्पनीले बाह्रबिसे तातोपानी जोड्ने २६ किलोमिटर सडकखण्डको पुनर्निर्माण गरिरहेको छ। नाका भने पुरानै पुल मर्मतसम्भारपछि सुचारु गर्न लागिएको हो। यद्यपि निर्माणाधीन नयाँ पुलको काम भने जारी रहनेछ। दुवैतिरको सहमतिमा सरकारले आउँदो वैशाखमा नाका खोल्ने योजनासहित काम अघि बढाएको छ। नेपाल र चीन सम्बन्धको एक प्रमुख आधार मानिने यो नाकाबाट आफ्नो मुलुकविरोधी गतिविधि हुन्छ भन्ने चिनियाँ बुझाइ छ। त्यहीकारण नाका खुल्न ढिलाइ भएको सुनिन्छ। त्यसका अतिरिक्त नेपाल चीनतिर लहसिएको छैन भन्ने संकेत दिन नेपाल सरकारकर्मचारीतन्त्रबाट उक्त नाकालाई बेवास्ता गरिएको देखिन्छ। अन्य शक्तिलाई भुलाउन यस्तो बेवास्ता गरेको धारणा पनि बाहिर आइरहेको छ। दुवै धारणा गलत मात्र होइन, विकासका वाधक पनि हुन्। त्यही धारणामा चीन नेपालको नाकामा अल्मलिएको हो। तातोपानी नाका क्षेत्र भूकम्प र बाढीपहिरोको चपेटामा पर्दै आएको छ। तातोपानी नाका बन्द भएपछि थातथलो छोडेर रसुवागढी लागेका हुन् वा काठमाडौं रहन बाध्य मानिस त्यसतर्फ फर्कन थालेका छन्। सडक बन्दै गर्दा पनि सवारी साधन आउजाउ हुन थालेको छ। खासाको पुरानो बस्तीलाई चिनियाँले अन्यत्र सारे पनि तातोपानीमा पुरानैको वर्चश्व रहनेछ। लिपिङको सडक बनाएर धराप भत्काउँदै त्यो नाका वैशाखदेखि सञ्चालनमा ल्याउँदा चीनतर्फ पनि सकारात्मक सन्देश जाने बुझाइ चीन स्वशासित तिब्बत सरकारको छ। सडक निर्माणसँगै जीर्ण भौतिक संरचना हटाउने काम पनि भइरहेको छ। सरकारी निकायको भवन निर्माण र मर्मतसमेत भइरहेका छन्। नेपाललाई अन्य रणनीतिक चालमा पर्न नदिन चीन सचेत भएकाले नाका खुलाउन जोड दिएको हुनुपर्छ। अमेरिकाले अघि बढाएको इन्डोप्यासिफिक रणनीति र केपी शर्मा ओली नेतृत्व सरकारको भारतसँगको सामीप्यले पनि यो नाका छिटो खुल्ने संकेत गर्छ। चीनसँग निकट रहेको मानिएको वर्तमान नेतृत्वसमेत अर्को छिमेक र विश्व शक्तितर्फ लहसिएको अनुभव चीनले गरेको छ। प्रतिक्रिया नदिने चीन यस्ता विषयमा खुलेर बोल्न थालेकोले पनि त्यसलाई प्रस्ट्याउँछ। आफूले अघि बढाएको बेल्ट एन्ड रोड इनिसियटिभ (बीआरआई) लाई रोक्न बुझेको इन्डोप्यासिफिक रणनीतिक खेल भइरहेको बुझाइ चीनको छ। यो मत्थर गर्न पनि अधिकतम नाका खोलेर सहज अन्तरक्रियामा चीन अघि बढ्न लागेको देखिन्छ। यसमा नेपालले पनि साथ दिनुपर्छ। छिमेक सम्बन्ध अब्बल र विश्वासिलो भएमा मात्र अन्य मुलुकसँगको सम्बन्ध बलियो हुनेछ। नेपालले चीनसँगको पुरानो र नयाँ नाका विकास गर्दै त्रिदेशीय सहकार्यका लागि माध्यम बन्न सक्नुपर्छ। सरकारले गतिलो सडक सञ्जाल निर्माण गर्दै रेलको आधार अघि बढाउनुपर्छ। अन्यथा चीनबाट खेलौना रेलकै वर्चश्व नेपालमा हुनेबाहेक अन्य सम्भावना रहँदैन।"
दुर्घटनाअघि मन्त्री रवीन्द्र र पाथिभराका पुजारीको त्यो संवाद,"ताप्लेजुङ : संस्कृति, पर्यटन तथा नागरिक उड्ययनमन्त्री रवीन्द्र अधिकारी सवार एयर डाइनेस्टीको एमआई एयरबस हेलिकोप्टर बुधबार दिउँसो १२ बजेर ५५ मिनेटमा ताप्लेजुङको पाथिभरा मन्दिर नजिकै अवतरण गर्यो । तेह्रथुमको आठराई चुहानडाँडास्थित एयरपोर्ट निर्माणस्थलको अवलकोनपछि मन्त्री अधिकारीसहितको टोली पाथिभरा दर्शनका लागि त्यहाँबाट ताप्लेजुङ पुगेको थियो । मन्त्रीसहितको सरकारी टोली हेलिकोप्टरबाट झर्दा पाथीभर मन्दिर क्षेत्रमा बाक्लो हिमपात भइरहेको थियो । हिउँ पर्दा पर्दै मन्त्री अधिकारीसहितले पाथिभरा मन्दिरको दर्शन र पूजा पनि गरे । पाथिभरा मन्दिरका मुख्य पुजारी डिल्ली आचार्यका अनुसार मन्त्री अधिकारीले दर्शन गरिसकेपछि हिउँ पर्ने क्रम झनै बढेको थियो । त्यसपछि मन्त्री अधिकारी र हेलिकोप्टरका पाइलटसहित सबैजना पुजारीकै निवासमा आगो तापेर बसे । हिउँ धेरै परेकाले मन्त्रीज्यूसहितलाई मैले नै आगो तापेर बसौँ भनँे, पूजारी आचार्यले भने, मन्त्रीज्यू आउने खबर प्रहरीबाट थाहा पाएकाले पूजा सामाग्रीसहित तयारी गरिसकेको थिएँ, हिउँ परेकाले आगो पनि बालेको थिएँ । पूजा सकेपछि हिउँ झनै बाक्लो पर्न थालेपछि मन्त्री अधिकारीले नै पूजारीको निवासमै गएर आगो तापौँ भनेका थिए । हिउँ बाक्लो पर्न थालेपछि मन्त्रीज्यूले मेरै निवासमा गएर आगो तापौँ भन्नुभयो, पुजारी आचार्यले अन्नपूर्णसँग भने, त्यसपछि उहाँले मलाई चिया पकाउन भन्नुभयो । दुर्घटनामा परेको हेलिकोप्टरमा को को सवार थिए ? हेलिकप्टर दुर्घटनामा पर्यटनमन्त्री अधिकारीसहित सातजनाको मृत्यु उडेको एक मिनेटमै दुर्घटनामा परेको थियो हेलिकोप्टर मन्त्री सवार हेलिकप्टर दुर्घटनाको गहिरो अनुसन्धान गर्न कांग्रेसको माग हिउँ बाक्लै पर्ने क्रम जारी रहेपछि मन्त्री अधिकारीले पूजारी आचार्यलाई भनेका थिए, तपाईँले मिठो चिया पकाउनुहुन्छ, लौ त आगो ताप्दै चिया पनि पिऊँ । तर त्यहीबीचमा हिउँ पर्दा पर्दै मौसम खुले जस्तो भयो । मौसम एकछिन खुले जस्तो भएपछि प्रधानमन्त्रीका सरकारी स्वकीय सचिव युवराज दाहालले अब जानुपर्छ भन्नुभयो, पूजारी आचार्यले भने, त्यसपछि सबैजना उम्लिँदै गरेको चिया नखाइ हेलिकोप्टरमा जानुभयो । मन्त्री अधिकारीसँगै रहेका एकजनाले फुङ्लिङ बजारमा फोन गरेर मौसमको अवस्था सोधेका थिए । फुङ्लिङबाट पाथिभरा देखिने भएकाले उनले मौसम खुले नखुलेको सोधेका थिए । फुङ्लिङबाट फोनमा बोल्नेले, कुहिरो बाक्लो छैन, मौसम खुल्दैछ भन्ने जवाफ दिएका थिए । पुजारी आचार्यले मन्त्री अधिकारीसहित सबै सबैजलाई हेलिकोप्टरम पुगेर चिया दिएका थिए । सबैले चिया पिएपछि हेलिकोप्टर दिउँसो १ बजेर २५ मिनेटमा काठमाडौँका लागि उडेको थियो । आफूसँग मुस्काउँदै कुरा गरेका मन्त्री दुर्घटनामा परेको खबर पाएपछि पूजारी आचार्य पनि स्तब्ध छन् । हेलिकोप्टरमा जानुअघि आगो ताप्दै मन्त्रीज्यूले पाथीभरका लागि धेरै काम गर्नुछ भन्नु भएको थियो, उहाँले मलाई ढुक्क बनाउँदै हामी पाथीभरका लागि अझै केही गर्छौँ भनेर आश्वस्त पार्नुभयो, पुजारी आचार्यले भने, तर उहाँले मुस्काउँदै दिएका ती बाचा केही मिनेटमै दुर्घटनामा परेको हेलिकोप्टरसँगै बिलिन भए ।"
एक जुझारु विकासप्रेमी राजनीतिज्ञको अवसान,"काठमाडाैं : बुधबार मध्यान्तरको एउटा अकल्पनीय दुर्घटनाले सिङ्गो देश स्तब्ध छ । बहालवाला संस्कृति, पर्यटन तथानागरिक उड्ययनमन्त्री, एउटा जुझारु विकासप्रेमी राजनीतिज्ञलाई नेपालले सदाका लागि गुमाएको छ । एयर डाइनेस्टीको हेलिकप्टरमा पूर्वी नेपालको पाथिभरा दर्शन गरेर फर्कँदै गर्दा ताप्लेजुङ्गको फुङलिङ१०, तारेभिरमा हेलिकप्टर दुर्घटनामा हेलिकप्टरमा सवार मन्त्री रवीन्द्र अधिकारीसहित सातजनाकै निधन भयो । मृत्यु अप्रिय तर अन्तिम सत्य हो । तर केही मृत्युहरु यस्ता हुन्छन्, जसलाई स्वीकार गर्न गाह्रो हुन्छ । विद्यार्थी राजनीतिबाट उदाएको एउटा आशालाग्दो युवा नेताको अवासानले देशलाई ठूलो पीडा बोकाएको छ । हसिँलो र जुझारु विकासप्रेमी राजनीतिज्ञ रवीन्द्र अधिकारीको मृत्यु हामी सबैलाई अपत्यारिलो लागेको हुनसक्छ । हेलिकप्टर हराइरहेको समाचार सार्वजनिक हुँदा सामाजिक सञ्जालमा सबैले अधिकारीसहित सवार सबै सकुशल भइदिए हुन्थ्यो भन्ने कामना गर्दै थिए । तर त्यो कामना धेरै बेर टिकेन, एक घण्टा बित्दा नबित्दै दुःखद् खबर पुष्टी भयो । उनीहरुको उद्दारका लागि नेपाली सेनाको हेलिकप्टर दुर्घटनास्थल तिर उडे । बुधबार राति अबेरसम्म शव संकलन गरेर राजधानी ल्याउने प्रयास जारी रह्यो । रवीन्द्र अधिकारी सालिन, सुयोग्य व्यक्ति थिए । उनमा रहेको राजनीतिक सस्कार साँच्चिकै अद्वितिय र अतुलनीय थियो । नेपालको विकासबारे बहस छेड्ने र विकास समस्या समाधानका लागि उनले एक कुशल राजनीतिज्ञको भूमिका निभाए । संसदीय समितिमा रहेर उनले समस्या समाधान र सहजीकरणमा सधैं प्रयास गरिरहे । उनी आफ्नो राजनीतिक जीवनमा सधैं सक्रिय र क्रियाशील रहे । उदार, समायोजनकारी, सबैसँग घुलमिल हुने र पछिल्लो समय मन्त्रीको भूमिकामा रहँदा पनि उनीसम्मको पहुँच सबैका लागि सुलभ थियो । एउटा सक्रिय युवा नेताको बारेमा मृत्यु आलेख (अबिच्युरी) लेख्नुपर्दा पीडाले हात चल्न मान्दैनन् । यो अकल्पनीय घटनासँगै नेपालले एक विकासप्रेमी जुझारु राजनीतिज्ञ गुमाएको छ । विकास र अर्थतन्त्रका बारेमा रविन्द्र अधिकारीका विशेष चासो दिन्थे । पछिल्लो पटक सरकारमा सामेल भएर पर्यटन मन्त्रीको जिम्मेवारी पाएपछि उनले पर्यटनको विकासबाट संवृद्ध नेपाल बनाउने अभियानमा सक्रिय थिए । देशभर हवाई यातायात विस्तारका लागि विमानस्थलको सम्भाव्यता अध्ययन, पर्यटन पूर्वाधारको विकासका लागि उनले धेरै समय खर्चेका थिए । देशको एक मात्र अन्तर्राष्ट्रिय विमानस्थलमा हवाई ट्राफिकको भीडभाड कम गर्न आन्तरिक उडानका लागि काभ्रेको नागीडाँडामा छुट्टै विमानस्थल बनाउनेदेखि निर्माणाधीन क्षेत्रीय अन्तर्राष्ट्रिय विमानस्थललाई तीव्रता दिने, त्रिभुवन अन्तर्राष्ट्रिय विमानस्थलको विस्तार तथा सञ्चालन अवधि विस्तारमा उनले काम गरे । पर्यटन पूर्वाधारको विकासबिना पर्यटन क्षेत्रले विकासको गति लिन सक्दैन भनेरै उनले पर्यटन पूर्वाधार विकासलाई प्राथमिकता दिए । पर्यटकीय नगरी पोखरा उनको राजनीतिक कर्मथलो भएका कारण पनि उनले पर्यटन क्षेत्रको अन्तर्यलाई राम्ररी बुझेका थिए । विकास समितिको सभापति छँदा र पर्यटनमन्त्री हुँदा उनीसँग पटकपटक संवाद भइरहन्थ्यो । पर्यटन मन्त्री भएपछि १०० दिने कार्ययोजना तयार गर्ने क्रममा उनले मन्त्रालयमा बोलाएर सुझाव लिएको सम्झन्छु । धेरैले अरूको कुरा कमै सुन्छन् । तर उनमा सुन्ने, ग्रहण गर्ने र अरूलाई सम्झाउने अद्भूत गुण थिए । दुई वर्षअघिको एउटा कार्यक्रम सम्झन्छु । जसमा रवीन्द्र अधिकारी, गगन थापा तथा हृदयेश त्रिपाठी वक्ताका रुपमा थिए । विकास बहसमा अधिकारी र थापाको जुझारु कुरा सुनेपछि हृदयेश त्रिपाठीले भने, युवा वयमा सरकार बाहिर रहँदा म पनि भाइहरु जस्तै जुझारु थिएँ । कार्यकारी पदमा रहेर डेलिभर गर्न गाह्रो छ । त्यही भुक्तभोगीका रुपमा आज मेरो स्वर मत्थर छ, भोलि तिमीहरु पनि त्यस्तै हुन्छौ । तर मन्त्रीका रुपमा रवीन्द्र अधिकारीमा त्यही पुरानै जोश कायमै देखिन्थ्यो । हवाई दुर्घटनामा यात्रुको निधन, चोटपटक या लगेजको क्षतिमा बीमा रकम बढाउने मन्ट्रियाल महासन्धिलाई संसद्बाट अनुमोदन गराउनेदेखि पर्यटन पूर्वाधारको कार्यान्वयनलाई तीव्रता दिने, देशभर पर्यटकीय गन्तव्यहरु पहिचान र घोषणा गर्ने, भ्रमण वर्षलाई अभियानका रुपमा लैजाने, नेपालको पर्यटन क्षेत्रका विकृति निवारणमा उनी सक्रिय थिए । नियतिले अधिकारीमाथि बज्रपात गर्यो । मन्त्री रवीन्द्र अधिकारीप्रति हार्दिक श्रद्धान्जलि !"
