शीर्षक,विवरण
भारतको कोठीबाट उद्दार गरिएका चेलीको डिएनए परीक्षण,काठमाडौँ : भारतको उत्तर प्रदेश राज्यस्थित आग्रा सहरको कोठीमा बेचिएका पाँच नेपाली चेलीलाई उद्दार गरी डिएनए परीक्षण गरिएको छ। आग्राको कोठीमा बेचिएका ती चेलीलाई समाजसेवी बालकृष्ण पाण्डे र माइती इन्डियाको पहलमा उद्दार गरी नेपाल प्रहरीको विधि विज्ञान प्रयोगशालामा डिएनए परीक्षणपछि परिवारमा बुझाइएको हो । नक्कली बाबुआमा बनेर समेत उद्दार गरिएका चेलीहरुलाई पुनः बेच्ने गरेको पाइएपछि समाजसेवी पाण्डेको पहलमा भारतको विशेष अदालत र जिल्ला अदालतको निर्देशनपछि उद्दार गरिएको थियो । कोठीबाट नेपाल ल्याइएका ५ चेलीमध्ये ३ जनालाई एआईजी पुष्कर कार्कीसहितको समन्वयमा केन्द्रीय प्रहरी विधि विज्ञान प्रयोगशालामा डिएनए परीक्षण गरिएको थियो । ती चेलीहरु र उनीहरुका परिवारका सदस्यको डिएनए रिपोर्ट सात दिनमै तयार गरिएको हो । अदालतले दिएको म्यादभन्दा ७ दिन पूर्व नै रिपोर्ट आएपछि उनीहरुलाई परिवारको जिम्मा लगाइएको हो । बेचिएका चेलीहरुको पहिचानका लागि पहिलो पटक डिएनए परीक्षण गरिएको हो । डिएनए परीक्षण गरी पहिलो पटक चेलीहरुलाई अभिभावकको जिम्मा लगाइएको अभियन्ता सीता अधिकारीले बताएकी छन् । उनीहरुलाई कोठीमा १७ महिनाको नारकीय जीवनपछि परिवारजनलाई हस्तान्तरण गरिएको हो । कोठीबाट उद्दार गरेपछि भारत सरकारले सञ्चालन गरेको आश्रममा १२ महिनासम्म राखिएका उनीहरु आफ्नो परिवारसँग घर फर्किएका छन् ।
छुरा प्रहार गरी महिलाको हत्या,इनरुवा : सुनसरीको इटहरी उपमहानगरपालिका४ माखिम टोलमा छुरा प्रहार गरी एक महिलाको हत्या गरिएको छ । डेरा गरी बस्दै आएकी ३० वर्षीया सोनिया राईको स्थानीय लालबहादुर राईले सोमबार छुरा प्रहार गरी हत्या गरेका हुन् । हत्या गर्ने राई इलाका प्रहरी कार्यालय इटहरीको नियन्त्रणमा रहेको प्रहरी उपरीक्षक राजन अधिकारीले बताए । राई विवाहित हुन् । उनका श्रीमान् विदेशमा छन् । हत्याबारे अनुसन्धान भइरहेको इलाका प्रहरी कार्यालयका प्रहरी निरीक्षक बुद्धि चौलागार्इंले जानकारी दिएका छन् ।
पशु ढुवानी मापदण्ड लागु गर्न परमादेश जारी,"काठमाडौं : पशु ढुवानी मापदण्ड २०६४ मा भएका व्यवस्था लागु गर्न सरकारको नामम परमादेश जारी भएको छ। न्यायाधीश मीरा खड्का र तेजबहादुर केसीको संयुक्त इजलासले सोमबार पशु ढुवानी मापदण्ड २०६४ लागु गर्न कृषि तथा पशुपन्छी मन्त्रालय लगायतको नाममा परमादेश जारी गरेको हो। मापदण्डमा पशु ढुवानी गर्दा सजिलो र सहज हुने गरी गर्नुपर्ने, निर्दयी तरिकाले सवारीमा कोचेर ल्याउन नपाइने, नाक, पुच्छर, खुट्टामा डोरीले बाध्न नपाउने, ढुवानी गर्दा चरुवा बस्नु पर्ने, दानापानीको व्यवस्था गर्नु पर्ने लगायतका कुरा समेटीएका छन्। कानुन व्यवसायी पदमबहादुर श्रेष्ठ र षट्कोण श्रेष्ठले पशु ढुवानी मापदण्ड २०६४ को प्रभावकारी कार्वन्वयन गरी पशुकल्याण सुनिश्चित गर्नुपर्ने भन्दै रीट हालेका थिए। यसै रीटको आधारमा सर्वोच्च अदालतले पशु मन्त्रालय, पशु सेवा विभाग, केन्द्रीय पशु क्वारेन्टाइन कार्यलय लगायत ११ जना विपक्षीको नाममा उक्त ऎन लागु गर्न आदेश दिएको हो।"
नेपालका कर्मचारीहरूलाई भारतमा तालिम दिइँदै,"काठमाडौँ : भारत सरकारले नेपालका कर्मचारीहरुलाई दिने तालिमलाई निरन्तरता दिएको छ । अर्थ मन्त्रालयका २० जना कर्मचारीको दोश्रो टोलीले इन्स्टिच्यूट अफ गभर्मेन्ट अकाउन्ट्स एण्ड फाइनान्स मा सञ्चालन हुने ग्लोबल पर्सपेक्टिभ फाइनानसियल म्यानेजमेन्ट विषयक तालिम भारतमा लिइरहेका छन् । दोस्रो चरणमा सोमबारदेखि यो तालिम भारत सरकार विदेश मन्त्रालयको भारतीय प्राविधिक तथा आर्थिक सहकार्य कार्यक्रम अन्तर्गत भइरहेको छ । जम्मा ६२ कर्मचारीहरुलाई प्रदान गरिने उक्त विशेष तालिम नेपालको अर्थ मन्त्रालयको अनुरोधमा गरिएको हो । यस तालिमले विद्युतीय भुक्तानी प्रणाली, लेखाविधि तथा रकम व्यवस्थापन, सार्वजनिक ऋण प्रणाली, वैदेशिक ऋणअनुदान तथा प्रतिदानको लेखाविधि, पेन्सन भुक्तानी प्रणाली, आन्तरिक लेखापरिक्षण, आर्थिक जिम्मेवारी तथा बजेट व्यवस्थापन आदि विषय कर्मचारीलाई दक्ष बनाउने विश्वास लिइएको छ । तालिममा आर्थिक प्रणाली सञ्चालनबारे विश्वव्यापी अभ्यासको ज्ञान पनि सहभागीहरुलाई दिइने छ । प्रथम ब्याचका २० नेपाली कर्मचारीहरुले यही माघ १० गते १० दिन लामो तालिम लिइसकेका छन् । आइएनजीएफ भारत सरकारको सार्वजनिक अर्थ व्यवस्थापन क्षेत्रको आधुनिक सिकाई सुविधायुक्त एक प्रमुख तालिम केन्द्र हो । अर्थ क्षेत्रमा छुट्टै पहिचान बनाउन सफल यस संस्थाले नेपालसहित छिमेकी देशका कर्मचारीलाई पनि तालिम दिँदै आएको छ । आइएजीएफ संसारभरका विकासशील मित्र राष्ट्रका कर्मचारीललाई आईटेक कार्यक्रम अन्तर्गत व्यवसायिक तालिम प्रदान गर्ने एक साझेदार संस्थाका रुपमा स्थापित छ ।"
७५३ रोजगार संयोजकका लागि २२६२ जना सर्ट लिस्टमा (सूचीसहित),"काठमाडौं : सरकारले प्रधानमन्त्री रोजगार कार्यक्रम अन्तर्गत ७५३ वटै स्थानीय तहमा खटाउने रोजगार संयोजक पदमा आवेदन दिएका मध्येबाट परीक्षार्थीहरूको प्रारम्भीक योग्यताक्रमको सूची सार्वजनिक गरेको छ। अधिकृत तथा नासुसरह गरी कूल २३ हजार ९१७ आवेदन परेकामा दुई हजार २६२ जनालाई सर्ट लिस्टमा राखिएको हो। सातै प्रदेशका स्थानीय तहहरूमा खटाउने रोजगार संयोजक पदमा आवेदन दिएकामध्ये माग संख्या ७५३ को तीन गुणा बढीलाई प्रारम्भीक योग्यताक्रमको सूची (सर्ट लिस्ट) मा समावेश गरिएको हो। बराबर नम्बर ल्याउने दुबै उम्मेदवारलाई सूचीमा समावेश गरिएको छ। श्रम रोजगार तथा सामाजिक सुरक्षा मन्त्रालयको सोमबारको बैठकबाट सर्ट लिस्ट छानिएको मन्त्रायले जनाएको छ। हरेक स्थानीय तहमा एक रोजगार संयोजक राख्ने गरी सरकारले आवेदन आह्वान गरेको थियो। १० हजार भन्दा कम जनसंख्या भएका स्थानीय तहमा नायब सुब्बा सरह र अन्यमा अधिकृत सरह रोजगार अधिकृत राख्नेगरी सरकारले आवेदन मागेको थियो। अब सर्ट लिस्टमा परेकाहरूलाई कम्प्युटर सीप परीक्षा लिइनेछ। र, अन्तिम सूची सार्वजनिक गरिनेछ। सरकारले फागुन १ गतेदेखि प्रधानमन्त्री रोजगार कार्यक्रम लागू गर्दैछ। सर्ट लिस्टमा परेकाहरूको नामावली हेर्नुहोस् प्रदेश १ बाट रोजगार संयोजक (शाखा अधिकृत सरह) मा २१६४ जनाको आवेदन परेकोमा ३९० जनालाई सर्ट लिस्ट गरिएको छ। यहाँ यो पदमा १३० जना माग भएको छ। हेर्नुस् सूची यस्तै प्रदेश १ बाटै ७ रोजगार संयोजक (नासु सरह) माग भएकोमा २१ जना सर्ट लिस्टमा परेका छन्। यो पदका लागि १५०१ जनाले आवेदन दिएका थिए। हेर्नुस् सर्ट लिस्टमा परेका आवेदकको सूची यस्तै प्रदेश २ मा रोजगार संयोजक (शाखा अधिकृत सरह) मा १३६ जनाको आवेदन माग भएकोमा ४०८ जना सर्ट लिस्टमा परेका छन्। यो पदका लागि ३६४७ जनाले आवेदन दिएका थिए। हेर्नुस् सर्ट लिस्टमा परेका आवेदकको सूची प्रदेश ३ बाट रोजगार संयोजक (शाखा अधिकृत सरह) मा ३१४९ जनाको आवेदन परेकोमा ३३७ जनालाई सर्ट लिस्ट गरिएको छ। यहाँ यो पदमा ११२ जना माग भएको छ। हेर्नुस् सूची यस्तै प्रदेश ३ बाटै ७ रोजगार संयोजक (नासु सरह) माग भएकोमा २२ जना सर्ट लिस्टमा परेका छन्। यो पदका लागि १८४५ जनाले आवेदन दिएका थिए। हेर्नुस् सर्ट लिस्टमा परेका आवेदकको सूची गण्डकी प्रदेशबाट रोजगार संयोजक (शाखा अधिकृत सरह) मा १०१० जनाको आवेदन परेकोमा २२२ जनालाई सर्ट लिस्ट गरिएको छ। यहाँ यो पदमा ७४ जना माग भएको छ। हेर्नुस् सूची यस्तै गण्डकी प्रदेशमै ११ रोजगार संयोजक (नासु सरह) माग भएकोमा ३३ जना सर्ट लिस्टमा परेका छन्। यो पदका लागि ९४५ जनाले आवेदन दिएका थिए। हेर्नुस् सर्ट लिस्टमा परेका आवेदकको सूची यस्तै प्रदेश ५ मा रोजगार संयोजक (शाखा अधिकृत सरह) मा १०९ जनाको आवेदन माग भएकोमा ३२७ जना सर्ट लिस्टमा परेका छन्। यो पदका लागि २२७३ जनाले आवेदन दिएका थिए। हेर्नुस् सर्ट लिस्टमा परेका आवेदकको सूची कर्णाली प्रदेशबाट रोजगार संयोजक (शाखा अधिकृत सरह) मा १३८८ जनाको आवेदन परेकोमा १८६ जनालाई सर्ट लिस्ट गरिएको छ। यहाँ यो पदमा ६२ जना माग भएको छ। हेर्नुस् सूची यस्तै कर्णाली प्रदेशमै १७ रोजगार संयोजक (नासु सरह) माग भएकोमा ५२ जना सर्ट लिस्टमा परेका थिए। यो पदका लागि १९९० जनाले आवेदन दिएका थिए। हेर्नुस् सर्ट लिस्टमा परेका आवेदकको सूची सुदूरपश्चिम प्रदेशबाट रोजगार संयोजक (शाखा अधिकृत सरह) मा २४०३ जनाको आवेदन परेकोमा २४६ जनालाई सर्ट लिस्ट गरिएको छ। यहाँ यो पदमा ८२ जना माग भएको छ। हेर्नुस् सूची यस्तै सुदूरपश्चिम प्रदेशमै ६ रोजगार संयोजक (नासु सरह) माग भएकोमा १८ जना सर्ट लिस्टमा परेका थिए। यो पदका लागि १६०२ जनाले आवेदन दिएका थिए। हेर्नुस् सर्ट लिस्टमा परेका आवेदकको सूची छानिएका उम्मेदवारहरूको कम्प्युटर सीप परीक्षाको समयतालिका पनि मन्त्रालयले सार्वजनिक गरेको छ। फागुनको ११ र १२ मा उनीहरूको कम्प्युटर सीप परीक्षा हुनेछ।"
पशु ढुवानी मापदण्ड लागु गर्न परमादेश जारी,"काठमाडौं : पशु ढुवानी मापदण्ड २०६४ मा भएका व्यवस्था लागु गर्न सरकारको नामम परमादेश जारी भएको छ। न्यायाधीश मीरा खड्का र तेजबहादुर केसीको संयुक्त इजलासले सोमबार पशु ढुवानी मापदण्ड २०६४ लागु गर्न कृषि तथा पशुपन्छी मन्त्रालय लगायतको नाममा परमादेश जारी गरेको हो। मापदण्डमा पशु ढुवानी गर्दा सजिलो र सहज हुने गरी गर्नुपर्ने, निर्दयी तरिकाले सवारीमा कोचेर ल्याउन नपाइने, नाक, पुच्छर, खुट्टामा डोरीले बाध्न नपाउने, ढुवानी गर्दा चरुवा बस्नु पर्ने, दानापानीको व्यवस्था गर्नु पर्ने लगायतका कुरा समेटीएका छन्। कानुन व्यवसायी पदमबहादुर श्रेष्ठ र षट्कोण श्रेष्ठले पशु ढुवानी मापदण्ड २०६४ को प्रभावकारी कार्वन्वयन गरी पशुकल्याण सुनिश्चित गर्नुपर्ने भन्दै रीट हालेका थिए। यसै रीटको आधारमा सर्वोच्च अदालतले पशु मन्त्रालय, पशु सेवा विभाग, केन्द्रीय पशु क्वारेन्टाइन कार्यलय लगायत ११ जना विपक्षीको नाममा उक्त ऎन लागु गर्न आदेश दिएको हो।"
