शीर्षक,विवरण
एक महिनादेखि डोल्पामा फ्याक्स सेवा बन्द,"दुनै,डोल्पा : हिमाली जिल्ला डोल्पाको सदरमुकाम दुनैमा महिना दिनदेखि फ्याक्स सेवा बन्द भएको छ। फ्याक्स सेवा बन्द हुँदा सरकारी कार्यालयको काम प्रभावित भएको छ। संघीय तथा तालुक कार्यालयबाट जरुरी कागजात र सूचना फ्याक्सबाटै आउने हुँदा महिना दिनदेखि फ्याक्सबाट हुने काम रोकिएको जिल्ला प्रशासन कार्यालय डोल्पाले जानकारी दिएको छ। सरकारी कामकाजका अधिकांश पत्रहरु फ्याक्सबाटै आउने हुँदा फ्याक्सको अभावमा कार्यालयको काम प्रभावित भएको निमित्त प्रमुख जिल्ला अधिकारी लक्ष्मी शर्माले बताइन्। उनले बारम्बार जिल्लाको दूरसञ्चार कार्यालयमा मर्मतका लागि ताकेता गरेपनि काम हुन नसकेको बताइन्। जिल्लाका एक दर्जन सरकारी कार्यालयमा हाल फ्याक्सबाटै पत्र आदानप्रदान हुने गर्छन्। दूरसञ्चार कार्यालय डोल्पाका प्राविधिक नवराज भट्टराइले जिल्लाबाट केही गर्न नसकिने र क्षेत्रीय कार्यालयका प्राविधिकले मर्मत गर्ने भएकाले काममा ढिलाइ भएको जानकारी दिए। रेडियो लिंकमा आएको समस्या र सिस्टममा फेरबदल भएका कारण फ्याक्स सेवा प्रभावित भएको दूरसञ्चार क्षेत्रीय कार्यालय नेपालगञ्जका प्राविधिक प्रमुख शिव खनालले जानकारी दिए। केही दिनमा फ्याक्स सेवा संचालनमा आउने उनले बताए।उनले डोल्पालाई नयाँ रुट प्रयोग गरेर नेपाल टेलिकमको सेवा प्रदान गर्ने तयारीमा रहेको समेत जानकारी दिए। दसैं पछि नेपाल टेलिकमका सबै सेवा प्रभावकारी नहुँदा ग्राहकले सास्ती भोग्नु परिरहेको छ। पछिल्लो दुई सातामा दुई दर्जनभन्दा धेरै पटक डोल्पा सञ्चार विच्छेद भएको छ।इन्टरनेट र फोन सेवा प्रभावकारी बनाउन स्थानीयको माग छ।"
फोहर प्लाष्टिक किन्दै इलाम नगरपालिका,"फिक्कल : इलाम नगरपालिकाले प्रयोग भइसकेका फोहर प्लाष्टिक खरिद गर्न थालेको छ। वातावरण स्वच्छता कायम गर्नका लागि प्लाष्टिकजन्य फोहर खरिद गर्न थालेको नगरपालिकाले जनाएको छ। गत माघ १ गतेबाट प्रतिकिलो १५ का दरले प्लाष्टिकजन्य फोहर खरिद गर्ने व्यवस्था गरिएको इलाम नगरपालिकाका प्रमुख महेश बस्नेतले बताए। प्लाष्टिक खरिद गर्न माघ एक गतेबाट सुरु गरिएको भएपनि अहिलेसम्म प्लाष्टिकजन्य फोहर बेच्नका लागि कोही पनि नआएको नगरपालिकाले जनाएको छ। फोहर प्लाष्टिक किन्नका लागि नगरपालिकाले तुरुन्तै ठाउँ तोक्ने र प्रसारप्रचारलाई अगाडि बढाउने बताइएको छ। इलाम नगरपालिकाले २०६७ देखि पोलिथिनको झोलामा भने प्रतिबन्ध लगाएको छ। पोलिथिन झोला भने नगरपालिकाले किन्दैन। खानेपानीको बोतल, खाद्य बस्तुको प्याकेजीङमा भएको प्लाष्टिकलगायतका प्याष्टिकजन्य फोहर खरिद गर्ने भएको हो। इलाम नगरपालिकामा दैनिक सात टन फोहर उत्पादन हुने गरेको एक अध्ययनले देखाएको छ। तीमध्ये करीब १० प्रतिशत प्लाष्टिजन्य फोहर हुने गरेको नगर प्रमुख बस्नेतको भनाइ छ। नगरपालिकाले खरिद गरेको फोहर स्टोर गरिने र यसलाई प्रशोधन गरेर पेट्रोलियम पदार्थ वा सडक पक्की गर्नमा प्रयोग गरिने अलकत्र बनाउने योजना नगरपालिकाको छ। सिसाजन्य फोहरमा भने प्रतिबन्ध लगाउने नगरपालिकाको तयारी छ। हाल नगरपालिकाले महिनाको दुई दिनमात्रै सिसाजन्य फोहर सङ्कलन गर्ने गरेको छ।रासस"
घाँटी रेटेर हत्या,पोखरा : पाल्पा रम्बापानी गाउँपालिका घर भएका १४ वर्षीय सचिन सिञ्जालीको सोमबार राति हत्या भएको छ । लेकसाइडस्थित निर्माणाधीन घरको भुइँ तलामा घाँटी रेटेर उनको हत्या भएको कास्कीका प्रमुख एसपी ओमबहादुर रानाले बताए । प्रहरीले घटनामा संलग्नता रहेको आरोपमा पर्वतको जलजला मल्जाजका २१ वर्षीय बेनी काले भनिने कुमार गर्बुजालाई पक्राउ गरेको छ । उनीहरूबीच केटीका विषयमा विवाद हुँदा चक्कु हानाहान भएको खुलेको छ । सचिन पोेखरा शान्तिनगरमा बस्दै आएका थिए ।
बाल 'कारागार' भैरहवाबाट एकैसाथ ६ जना फरार,"भैरहवा : भैरहवास्थित बाल सुधार गृह (बाल कारागार) बाट ६ जना थुनवा र कैदी फरार भएका छन् । सोमबार राति करिब १२ बजेको समयमा आँगनमा रहेको गेट र भित्तामा लगाइएको काँडेतारको प्वालबाट उनीहरु फरार भएका हुन् । फरार हुनेमा चारजना चोरी मुद्दाका र दुई जबरजस्ती करणीका कैदी र अभियुक्त रहेको बालसुधार गृह रुपन्देहीले जनाएको छ । १८ वर्ष मुनिका पुरुष कैदी र थुनुवालाई भैरहवामा बालसुधार गृहमा राख्ने गरिएको छ । गृहका अनुसार फरार हुनेमा जबरजस्ती करणी मुद्दामा पूर्पक्षका लागि थुनामा रहेका देवदह नगरपालिका७ रुपन्देहीका १६ वर्षीय जीवन खत्री, जबरजस्ती करणी मुद्दामा ११ वर्ष कैद सजाय भुक्तान गरिरहेका नौबाहिनी गाउँपालिका४ प्युठानका १६ वर्षीय सुरेश घर्ती रहेका छन् । भाग्नेमा चोरी मुद्दामा एक महिना १५ दिन सजाय र ८८ हजार एक सय रुपैयाँ जरिवाना तोकिएर सजाय भुक्तान गरिरहेका तानसेन नपा३ पाल्पाका १७ वर्षीय सन्दीप रणपाल छन् । त्यस्तै चोरी मुद्दामा एक महिना कैद र २ लाख ५२ हजार जरिवाना तोकिएर सजाय भुक्तान गरिरहेका विरुवा गापा४ स्याङ्जाका १७ वर्षीय अनिश थापा, नकवजनी चोरी मुद्दामा पुर्पक्षका लागि थुनामा रहेका गाईघाट नेपालटार३ उदयपुरका १७ वर्षीय सिद्धार्थजंग लामा (सविन पौडेल) र चोरी मुद्दामा पुर्पक्षका लागि थुनामा रहेका बुटवल उपमनपा८ का १५ वर्षीय राजेश सुनार रहेको बाल सुधार गृह रुपन्देहीले जनाएको छ । सुधार गृहका कैदी र थुनुवालाई बालमैत्री वातावरण अन्तर्गत घाम ताप्न कोठाबाट बाहिर निकाल्ने गरिएको थियो । त्यहीक्रममा उनीहरुले योजना बनाएर फरार भएको बालसुधार गृह रुपन्देहीकी प्रमुख सुभद्रा गौतमले बताइन् ।फरार अभियुक्त र कैदीहरुको रातिदेखि नै खोजी भइरहेको जिल्ला प्रहरी कार्यालय रुपन्देहीले जनाएको छ । कैदी र थुनुवाहरु गेट र काँडेतारबाट फरार भएको स्थल । तस्बिर : सलमान खान"
दाङमा स्कुले छात्रमाथि खुकुरी प्रहार,दाङ : दाङको तुलसीपुरमा एक विद्यार्थीमाथि खुकुरी प्रहार भएको छ । यहाँको लिटिल हेवन विद्यालयमा कक्षा १० मा अध्ययनरत विद्यार्थी दिनेश ओलीलाई विद्यालय समय सकेर बाहिर निस्कँदै गर्दा विद्यालयको गेटै नजिक युवाहरुको एक समुहले खुकुरी प्रहार गरेको लिटिल हेवन विद्यालयका शिक्षक यमकान्त खरेलले जानकारी दिए । खुकुरी प्रहारबाट घाइते भएका दिनेशको राप्ती प्रादेशिक अस्पताल तुलसीपुरमा उपचार भइरहेको छ । खुकुरी प्रहार गर्नेमध्येबाट एकजनालाई पक्राउ गरेको प्रहरी जनाएको छ । पछिल्लो समय दाङमा आपराधिक घटना बढिरहेका छन् । अघिल्लो दिन सोमबार मात्रै दाङमा ३ वर्षीया एक बालिकाको अपहरण भएको थियो ।
"बुवा, आमा गुमाएका तीन बालकलाई परिवार दलको सहयोग","विराटनगर : बुवा, आमा गुमाएर अभिभावकविहीन बनेका मोरङको सुनवर्षी नगरपालिका७ कुँडेलीका तीन असहाय बालकलाई नेपाल परिवार दलले आर्थिक सहयोग गरेको छ। परिवार दलले उनीहरुका लागि ५० हजार रुपैयाँ नगद सहयोग उपलब्ध गराएको हो। सेतो लामखुट्टेको टोकाईबाट बुवा, आमा नै गुमाएका तीन बालकको बिचल्ली भन्ने शीर्षकमा माघ १६ गते अन्नपूर्ण अनलाइनमा समाचार प्रकाशन भएको थियो । सेतो लामखुट्टेको टोकाईबाट २०७० साल चैत ३० गते बुवा फगुलाल राजवंशी र गत साउन २५ गते आमा सन्तोषी राजवंशीको मृत्यु भएको थियो। सेतो लामखुट्टेकै टोकाईबाट बिरामी परेको थाहा पाए पनि आर्थिक अवस्था कमजोर भएर समयमा उपचार पाउन नसक्दा दुवै जनाको मृत्यु भएपछि छोराहरु १५ वर्षीय दिपक, ९ वर्षीय राजीव र ५ वर्षीय रोशन राजवंशीको बिचल्ली भएको थियो। बुवा, आमाको मृत्युपछि उनीहरुलाई फूपु सरसादेवी राजवंशी र मावलकी हजुरआमा ७० वर्षीया कृष्णवति राजंवशीले संरक्षण गर्दै आएका थिए। बुवा, आमाको मृत्युपछि अभिभावक बनेकी फूपु सरसादेवीको पनि गत पुस अन्तिममा मृत्यु भएपछि दुईजना भाइ हुर्काउने र परिवार चलाउने दायित्व दिपककै काँधमा आइपरेको थियो। अभिभावक गुमाउनु पर्दाको पीडासँगै आर्थिक अभावका कारण दिपकले पढाइ समेत छाड्नु परेको थियो। भाइलाई पढाउने मन हुँदाहुँदै पनि स्कुल पठाउन सकेका थिएनन्। अन्नपूर्णमा समाचार आएपछि नेपाल परिवार दलका केन्द्रीय अध्यक्ष एकनाथ ढकालले तीन बालकलाई सहयोग स्वरुप ५० हजार रुपैयाँ नगद पार्टीका केन्द्रीय सदस्य अशोक कुमार चौधरी र तीर्थराज घिमिरेमार्फत पठाएका हुन्। अध्यक्ष ढकालले उपलब्ध गराएको नगद केन्द्रीय सदस्य चौधरी र घिमिरेले तीन बालकलाई गाउँमै पुगेर हस्तान्तरण गरेका हुन्। फूपुको पनि मृत्यु भएपछि वृद्ध अवस्थाकी हजुरआमाले मात्रै संरक्षण गर्न नसक्दा तीनैजना अहिले रतुवामाई नगरपालिका५ गोविन्दपुरस्थित ठूलीआमा उर्मिलादेवी राजवंशीको घरमा बस्दै आएका छन्। वृद्ध अवस्थाकी हजुरआमा कृष्णवति पनि नातिहरुसँगै छोरी उर्मिलादेवीकै घरमा बस्दै आएकी छन्।"
रातु खोला दाेहन : क्रसर र ठेकेदारको पक्षमा बर्दिबास नगरपालिका,"बर्दिबास : महोत्तरीको बर्दिबास नगरपालिकाले रातु खोला उत्खननको विषयलाई खण्डन गरेको छ। सोमबार विज्ञप्ति सार्वजनिक गर्दै नगरपालिकाले सञ्चार माध्यममले भ्रम फैलाएको आरोप लगाएको हो। नगरपालिकाले निकालेको विज्ञप्तिमा मिडियाले भ्रम फैलाउने काम गरेको आरोप लगाइएको हो। नगरपालिकाले विज्ञप्ति सार्वजनिक गरेको भोलिपल्ट रातु खोलामा पुग्दा भने दोहन नरोकिएको प्रष्ट देखिन्छ। रातु खोलाको अबैध उत्खनन् रोक्न जनमानसबाट उठेको अवाजलाई सम्बोधन गर्नुको साटो बर्दिबास नगरपालिकाले चेतावनी दिँदै मिडियामाथि आक्षेप लगाएको हो। नगरपालिकाका प्रवक्ता शम्शेर सिंह लामाले सार्वजनिक गरेको विज्ञप्तिमा भनिएको छ,रातु खोलाको उत्खननको विषयमा आम जनमानसमा भ्रमपूर्ण सन्देश प्रसार भइरहेको छ। पूर्वग्राही मानसिकताले ग्रसित त्यस्ता तथ्यहिन र बनावटी समाचारप्रति नगरपालिकाको गम्भीर ध्यानाकर्षण भएको छ। नगरपालिकाले खोलाबाट अवैध उत्खनन् नभएको दाबी गरेको छ। असोज २८ गते १८ क्रसर उद्योगलाई गैरकानुनी उत्खनन् बन्द गर्न पत्र पठाइएको जानकारी गराएको नगरपालिकाले जिल्ला समन्वय समितिबाट प्रारम्भिक वातावरणीय प्रभाव मूल्यांकन ९आइई० बाट स्वीकृत भएपछि मात्र ठेक्का सम्झौता भएको दाबी गरेको छ। उता प्रदेश(२ सरकारले बनाएको बालुवा र गिट्टी उत्खनन् तथा क्रसर संचाल कार्यविधि विपरित रातु खोलाको उत्खनन् र त्यहाँ क्रसर संचालन भइरहेको छ। सम्झौता अनुसार उत्खनन् नगरेको सन्दर्भमा ठेकेदारलाई लिखित तथा मौखिक निर्देशन समेत दिइएको छ। अवैध उत्खनन् रोक्न नगरपालिका सधै प्रतिबद्ध रहने विज्ञप्तिमा उल्लेख गरेको छ। कसैले वा ठेकेदारले सम्झौता विपरित उत्खनन् गरेमा कारबाही गर्न नगरपालिका तयार छ, प्रवक्ता लामाले सार्वजनिक गरेको विज्ञप्तिमा भनिएको छ,सिंगो बर्दिबास नगरपालिकाललाई बदनाम गराउन र तथ्यलाई तोडमोड गर्दै जनतामा भ्रम छर्ने दुश्प्रयास नगर्न समेत सम्बन्धित सबैलाई सचेत गराइन्छ।"
ट्याक्टर दुर्घटना हुँदा सहचालकको मृत्यु,विराटनगर : मोरङको ऊर्लाबारी नगरपालिका८ को भित्री सडकमा मंगलबार ट्याक्टर दुर्घटना हुँदा सहचालकको मृत्यु भएको छ । मे १ त ३८३१ नम्बरको ट्याक्टर अनियन्त्रित भएर पल्टिएको थियो । दुर्घटनामा सहचालक झापा शिवसताक्षी नगरपालिकाका १४ वर्षीय रसिकलाल हस्दाको घटनास्थलमै मृत्यु भएको इलाका प्रहरी कार्यालय उर्लाबारीका प्रहरी निरीक्षक रामप्रसाद तिमल्सिनाले जानकारी दिए । दुर्घटनामा ट्याक्टरमा सवार ऊर्लाबारी८ का मोहन मुर्मु घाइते भएका छन् । उनको अरनिको अस्पताल ऊर्लाबारीमा उपचार भइरहेको छ । चालक भने फरार छन् ।
