शीर्षक,विवरण
वैकल्पिक राजनीतिले दक्षिणपन्थी आउने खतरा भयो: बाबुराम,"काठमाडौं : नयाँ शक्ति पार्टीका संयोजक डा बाबुराम भट्टराई बुधबार साँझ स्वदेश फर्किएका छन् । साउन ६ गते युरोप भ्रमणमा निस्किएका उनले नेपाल फर्कँदै नेपालको पछिल्लो राजनीतिक अवस्थाबारे टिप्पणी गरेका छन् । युरोप भ्रमणबाट फर्किएपछि उनले वैकल्पिक राजनीति वैकल्पिक राजनीतिले दक्षिणपन्थी प्रकारका शक्तिहरु आउने खतरा बढेको दाबी गरे । 'वैकल्पिक राजनीतिको कुरा गर्दा विकल्पमा दक्षिणपन्थी प्रकारका शक्तिहरु अगाडि आउने खतरा पनि देखियो त्यसमा सतर्क हुनुपर्ने महसुस भयो', बाबुरामले भनेका छन् । उनले अहिले विश्वभर नै पुराना राजनीतिक विचार र शक्तिहरुसँग वितृष्णा बढ्दै गएको पनि बताए । 'अहिले विश्वव्यापी रुपमा नै पुराना राजनीतिक विचार, शक्तिहरुबाट जनतामा वितृष्णा पैदा भएको नै हामीले पाउँछौं', उनले भनेका छन्, 'युरोपका कतिपय देशहरुमा पनि नयाँ नयाँ शक्तिहरुको उदय हुँदै गएको र पुराना विचार, पुराना पार्टीहरुबाट देशका समस्या हल हुन नसकेको हामीले देख्यौं ।' उनले युरोपका थुप्रै देशमा वैकल्पिक राजनीतिक शक्तिको उदय हुँदै गइरहेको बताए । 'खासगरी फ्रान्सका राष्ट्रपति इम्मानुएल म्याक्रोनले छोटै समयमा विजय हासिल गर्नुभयो', उनले अगाडि भने, 'उहाँका पार्टीका सांसदहरुसँग हामीले कुरा गर्दा उनीहरुले आफ्नै ढंगले नयाँ विचार अघि ल्याउन खोजेको हामीले पायौं ।' नेता भट्टराईले जर्मनीमा दक्षिणपन्थी प्रकारका शक्तिहरुको उदय हुन लागेको पनि औँल्याए । 'त्यहाँ दक्षिणपन्थी प्रकारका शक्तिहरु उदाउन खोजेको अस्थामा फेरि एकचोटि लोकतान्त्रिक प्रगतिशील शक्तिहरुले वैकल्पिक धार सिर्जना गर्नुपर्छ भन्ने बहस सुरु गरेको हामीले देख्यौं', भट्टराईले थपे । युरोपभरी वैकल्पिक राजनीतिक धारबारे बहस सुर भएको उनको ठम्याई थियो । 'इटलीमा पनि वैकल्पिक राजनीतिक धारबारे बहस भएको हामीले देख्यौं', भट्टराईले भने, 'यस हिसाबले अहिले २१औं शताब्दीको सुरुमा हिजोको शीतयुद्धकालिन बजारमुखी उदारवादी पुँजीवाद र राज्यनियन्त्रित समाजवादका जुन दुईवटा धार थिए', उनले थपे, 'ती शक्तिहरुको विकल्पमा क्रमशः जनताले प्रगतिशील लोकतान्त्रिक तेस्रो धार खोजेको देख्यौं । त्यसैले नेपालमा पनि हामीले वैकल्पिक राजनीतिका कुरा गरिराखेका छौं, त्यसको सान्दर्भिकता थप बढेको हामीले महसुस गर्यौं ।' वैकल्पिक राजनीतिको कुरा गर्दा चनाखो हुनुपर्ने पनि उनले बताए । 'पुराना राजनीतिक शक्तिहरुको विकल्प दिँदा खाली सतही ढंगले रुप पक्षमा मात्रै केन्द्रित भएर विकल्पका कुरा गर्यौं भने दक्षिणपन्थी प्रकारका विकल्पहरु अगाडि आउने खतरा देखियो', उनको चिन्ता थियो, 'त्यो इटलीमा पनि देखियो, जर्मनीमा पनि त्यस्तो देखिन्छ र अरु केही देशमा पनि अलि दक्षिणपन्थी प्रकृतिका शक्तिहरु अगाडि आउन खोजेको भान हुन्छ ।' नेता भट्टराईले यो पक्षमा पनि सतर्क हुँदै अगाडि बढ्नुको विकल्प नरहेको उनको भनाइ थियो । 'हामीले दक्षिणपन्थी यथास्थितिवादी विकल्प (जसले खाली रुप पक्षलाई मात्रै जोड दिन्छ, विचार, राजनीति र कार्यक्रमिक पक्षलाई, संरचनात्मक परिवर्तनका पक्षलाई ध्यान दिँदैन) बाट चाहिँ सतर्क हुनुपर्ने हामीलाई अनुभुति भयो', उनले भने,'त्यसैले हामीले उन्नत प्रकारको लोकतन्त्र, समावेशी लोकतन्त्र र समावेशी विकासलाई केन्द्रमा राखेर अग्रगामी, प्रगतिशील लोकतान्त्रिक प्रकृतिको विकल्प निर्माण गर्नमा ध्यान दिनुपर्छ भन्ने अनुभुति हामीलाई भएको छ ।'"
जनप्रतिनिधि धन कमाउन खाडी मुलुकमा !,"प्यूठान : स्वर्गद्वारी नगरपालिका१ कोचिवाङ प्यूठानका वडा सदस्य नारायण पुनमगर धन कमाउन विदेश उडेका छन्। घरव्यवहार चलाउन समस्या भएपछि उनी कुवेत गएका हुन्। रोजगारीका लागि यसअघि समेत उनी खाडी मुलुक पुगेका थिए। कुवेत पुगेका उनी दुई महिना पुगिसकेको छ। तर, वडा अध्यक्ष मेघराज जिसीले विदेश पुगेपछि मात्र थाहा पाएको प्रतिक्रिया दिए। कुवेत पुगेपछि मात्र थाहाँ पाएँ, उनले भने, जान्छु पनि नभनी जानुभएछ। विदेश पुगेपछि पुनमगरले फोनमा आफूसँग चुनावमा उठेर गल्ती गरेको प्रतिक्रिया दिएको समेत सुनाए। वडा अध्यक्षमार्फत पुनमगरले जनतालाई धोका दिएकोप्रति क्षमा मागेका छन्। पुनमगरका घरपरिवारले आठ महिनाको सात हजारका दरले ५६ हजार रुपैयाँ पारिश्रमिक बुझेका छन्। उनका घरमा बुवाआमासहित श्रीमती र एक छोरा छन्। घरव्यवहार धान्ने एक्लो जिम्मा पुनमगरकै काँधमा रहेको वडा अध्यक्ष जिसीले बताए। स्थानीय तह निर्वाचनमा पुनमगर राष्ट्रिय जनमोर्चाबाट ६ सय २७ मत ल्याएर वडा सदस्यमा विजयी भएका थिए।"
मुलुकको सुरक्षा अवस्था जटिल : प्रधानसेनापति,"काठमाडौं : प्रधानसेनापति राजेन्द्र क्षेत्रीले मुलुकको पछिल्लो सुरक्षा अवस्था जटिल बन्दै गएको बताएका छन्। राष्ट्रिय परिस्थितिलाई सूक्ष्म ढंगले नियाल्दा साम्प्रदायिक भावना फैलाउन खोज्ने समूह एवं क्षेत्रीय एजेन्डा बोेकेका विखण्डनकारी सलबलाइरहेको पछिल्लो अवस्थामा मुलुकको समग्र सुरक्षा अवस्था जटिलतातर्फ उन्मुख भएको उनको भनाइ छ। अनिवार्य अवकाश हुने एक महिनाअघि शुक्रबारबाट बिदा बस्न लागेका प्रधानसेनापति क्षेत्रीले बुधबार सकल दर्जालाई सम्बोधन गर्दै जातीय, भाषिक र धार्मिक आडमा साम्प्रदायिकता फैलाएर मुलुकमा अस्थिरता निम्त्याउन खोज्ने समूह सक्रिय रहेको बताए। विध्वंशकारी घटना गराई जनमानसमा डरत्रासको वातावरण सिर्जना गरी फेरि पनि द्वन्द्व चाहने समूहका गतिविधि सक्रिय रहेको प्रधानसेनापतिको क्षेत्रीको भनाइ छ। त्यस्ता अवाञ्छित एवं अराजक गतिविधिलाई निस्तेज पार्न नेपाली सेना सबल एवं सक्षम रहेको उनले बताए। थापा कायममुकायम प्रधानसेनापति प्रधानसेनापति क्षत्री बिदा बस्ने भएपछि कायममुकायमको जिम्मेवारी नेपाली सेनाका बलाधिकृत रथी पूर्णचन्द्र थापाले सम्हाल्दै छन्। जंगीअड्डामा बिहीबार बेलुका अयोजना हुने विशेष समारोहमा प्रधानसेनापति राजेन्द्र क्षेत्रीले थापालाई कायममुकायम प्रधानसेनापतिको जिम्मेवारी बुझबुझारथ गर्नेछन्। लम्जुङमा जन्मिएका थापा २०३७ साल मंसिर २७ गते गोरखबहादुर गणमा सहायक सेनानी पदमा नियुक्त भएका थिए। थापा २०३६ सालमा अधिृकत क्याडेटका रूपमा नेपाली सेनामा भर्ना भएका थिए। थापाले २०७१ माघ २५ देखि २०७२ माघ २४ सम्म संयुक्त राष्ट्रसंघको मध्यपूर्वस्थित इजरायल र सिरियाको सिमानास्थित गोलन हाइटमा फोर्स कमान्डरका रूपमा काम गरेका थिए। संयुक्त राष्ट्रसंघको नेपालस्थित अनमिन मिसन रहँदा थापाले संयुक्त सुपरिवेक्षक समन्वय समितिमा नेपाल सरकार र नेपाली सेनाको प्रतिनिधित्व गर्दै सहअध्यक्षको भूमिका निर्वाह गरेका थिए। थापाले नेपालबाट कमान्ड तथा स्टाफ कलेज र भारतबाट नेसनल डिफेन्स कोर्स गरेका छन्। थापाले त्रिभुवन विश्वविद्यालयबाट स्नातक र भारतको मद्रास विश्वविद्यालयबाट डिफेन्स एन्ड स्ट्राटिजिक स्टडिजमा स्नातकोत्तर गरेका छन्। उनी सुप्रबल दक्षिण बाहु र प्रख्यात त्रिशक्ति पट्ट चौथोबाट सम्मानित छन्। प्रधानसेनापति क्षेत्रीले अवकाश पाउने भएपछि सरकारले थापालाई कामयमुकायम प्रधानसेनापतिको जिम्मेवारी सुम्पने निर्णय गरेको थियो।"
विषयगत समितिमा मन्त्री थापाको ब्रिफिङ,"काठमाडौँ : संघीय संसद् अन्तर्गतका समितिले आफ्ना क्षेत्रअन्तर्गत मन्त्रालय र निकायका कार्ययोजना बारेमा जानकारी लिन सुरु गरेका छन्। यस अन्तर्गत महिला तथा सामाजिक समितिले बिहीबार महिला, बालबालिका तथा ज्येष्ठ नागरिक मन्त्रालयका चालू आर्थिक वर्षको कार्यक्रमको जानकारी लिएको छ। सो समितिको आजको बैठकमा महिला, बालबालिका तथा ज्येष्ठ नागरिकमन्त्री थममाया थापाले लैङ्गिक समानता नीति २०७५ को मस्यौदा तयार भइराखेको र बालबालिकासम्बन्धी ऐन २०४८ लाई प्रतिस्थापना गर्ने नयाँ ऐनको मस्यौदा तयार भएको जानकारी गराइन्। उनले वीरगञ्ज, रुपन्देही र चितवनमा आगामी भदौ १ गतेदेखि बालसुधार गृह स्थापना गर्न स्वीकृत भएको, काठमाडौँ उपत्यकालाई सडक बालबालिका मुक्त बनाउने अभियान जारी रहेको र बालबालिकामाथि हुने हिंसा अन्त्य गर्न बालसंरक्षण कार्यक्रम सञ्चालन भइराखेको जानकारी गराइन्। ज्येष्ठ नागरिकसम्बन्धी काम गर्ने विभिन्न संस्थालाई आर्थिक अनुदान सहयोग उपलब्ध गराइएको, सबै सङ्घीय मन्त्रालयका लैङ्गिक सम्पर्क विन्दुको क्षमता विकास गर्ने कार्यक्रम रहेको उनले बैठकमा बताइन्। मन्त्री थापाले भनिन्, 'महिला तथा बालबालिकामाथि हुने हिंसा तथा दुव्र्यवहारमा कमी ल्याउन सामूहिक प्रयासको आवश्यकता पर्छ।' मन्त्रालयका कानुनी, संस्थागत तथा कार्यक्रमगत सुधार गर्ने कार्य जारी रहेको उनले समितिको बैठकमा जानकारी गराइन्। रासस"
"दुई सचिवको बढुवा, एक कामु","कठमाडौं : सरकारले दुईजना वरिष्ठ सहसचिवलाई सचिवमा बढुवा गरेको छ भने एकजनालाई कामु सचिव बनाएको छ । बुधबार राति बसेको मन्त्रिपरिषद् बैठकले तीर्थराज ढकाल र आनन्दराज ढकाललाई सचिवमा बढुवा गरेको हो भने गृह मन्त्रालयका सहसचिव केदार न्यौपानेलाई कामु सचिवमा बढुवा गरेको छ । न्यौपानले डा गोविन्द केशीको अनशन तोडाउन सरकारी वार्ता टोलीमा रहेर प्रभावकारी भूमिका निर्वाह गरेका थिए । बढुवा भएका मध्ये तीर्थराज ढकालाई ५ नम्बर प्रदेशको प्रमुख सचिवमा, आनन्द ढकाललाई ३ नम्बर प्रदेशको प्रमुख सचिवमा पदस्थापन गरिएको छ भने केदार न्यौपानेलाई १ नम्बर प्रदेशको कामु प्रमुख सचिवमा पदस्थापन गरिएको छ । सँगै प्रदेश१ का प्रमुख सचिव रेश्मीराज पाण्डेलाई प्रधानमन्त्री तथा मन्त्रिपरिषद् कार्यालयमा सरुवा गरिएको छ ।"
