शीर्षक,विवरण
स्थानीय तहमा झागिँदै भ्रष्टाचार,"सरकारी सेवा प्रवेश गरेको साढे दुई वर्षमै युवा कर्मचारीले सात करोड भ्रष्टाचार गरेको घटनाले एकैपटक धेरै आयाममा सोच्न बाध्य बनाएको छ। यो प्रसंगले एकातिर हाम्रो सामाजिक चेतको स्तर जाँच्न बाध्य बनाएको छ भने अर्कोतिर सरकारी कर्मचारीको कमाउ नियत उजागर गरेको छ। भ्रष्टाचार सुशासनविरुद्ध सबैभन्दा ठूलो अपराध हो। यसले केवल आर्थिक अनियमितता सिर्जना गर्दैन, साथसाथै सार्वजनिक सेवा प्रवाहलाई कमजोर र क्षीण पनि बनाउँछ। ससाना कामका लागि पनि अनावश्यक खर्च गर्नुपर्ने प्रणाली स्थापित हुन्छ। आम मानिस अनावश्यक व्ययभारको भारी बोक्न बाध्य हुन्छन्। सिंगो शासकीय संयन्त्र लथालिंग हुन्छ। सरकारी स्रोतहरूको अनुचित प्रयोग गर्न पल्किएकाहरू शक्तिसम्पन्न बन्दै जान्छन्। परिणाम शासनसंयन्त्रमा सीमित पैसावाल र शक्तिवालहरूको वर्चस्व हावी हुँदै जान्छ। जसले गर्दा लोकतन्त्र कुलिनतन्त्रमा सीमित हुन पुग्छ। आर्थिक क्षेत्रमा सिन्डिकेट र कार्टेलिङ हावी हुन्छ। त्यसैले भ्रष्टाचार केवल आर्थिक अनियमितता वा अख्तियारको दुरुपयोग मात्र होइन, यो लोकतन्त्रको सबैभन्दा ठूलो दुस्मन पनि हो। तर लोकतन्त्रले स्थापित गरेको संरचना नै भ्रष्टाचार व्यापकताको माध्यम बन्यो भने के हुन्छ ? स्थानीय सरकारका एक लेखा अधिकृतले गरेको भ्रष्टाचारले यस्तै प्रश्न जन्माइदिएको छ। अवश्य पनि राजधानीमा केन्द्रीकृत राज्यशक्ति गाउँगाउँमा पुर्याउन, राज्यतहमा जनताको सहज पहुँच स्थापित गराउन, स्वशासनको अनुभूति बोध गराउन संघीयताको परिकल्पना गरिएको हो। तीन तहको राज्य संरचना निर्माणको मूल सार अधिकार प्रवाह र राज्य सञ्चालनमा सहभागिता हो। अधिकारसँगसँगै अधिकार दुरुपयोगको सम्भावना पनि जान्छ। त्यसैले अधिकार दुरुपयोग नहोस् भनेर चेक एन्ड ब्यालेन्स को प्रणाली स्थापित गरिएको हुन्छ। अख्तियार दुरुपयोग अनुसन्धान आयोगको परिकल्पना त्यसैले नै गरिएको हो। संविधानतः निर्वाचनमार्पत गठन भएका स्थानीय सरकारमा अधिकार पनि प्रशस्त छन्। स्थानीय स्रोत, साधनको पहिचान, प्रयोग र विस्तारमार्फत सुशासन स्थापित गर्न ती शासनको स्थापना गरिएको हो। तर ती संरचनामा हुन सक्ने अधिकार दुरुपयोग नियन्त्रण गर्न र भ्रष्ट कर्ममा आवश्यक कारबाही प्रक्रियामा लैजान सक्ने गरी नयाँ संयन्त्र निर्माण भने भइसकेको छैन। केन्द्र र केही क्षेत्रीय तहमा सीमित अख्तियारले स्थानीय तहसम्मको अख्तियार दुरुपयोग र भ्रष्टाचार नियन्त्रण गर्न सम्भव छैन। कम्तीमा अहिलेको संरचनाले त असम्भव नै छ। देशका सबैजसो स्थानीय तहमा उदयपुर कटारी नगरपालिकाका लेखा अधिकृत रविनचन्द्र ढकाल जसरी नै अकूत सम्पत्ति कमाउतिर मोडिए भने देशको सुशासन कस्तो होला ? त्यसैले सरकारले कि त अदुअआको क्षमता विस्तार गर्नुपर्छ नभए त्यस्तै खाले संरचना स्थानीय सरकारको तहसम्म पुर्याउनुपर्छ। ढकाल प्रकरणले भर्खर जागिरको सुरुवात गर्दै गरेको, सरकारी संयन्त्रमा राम्ररी भिजिनसकेको एक युवाले यसरी अकूत कमाइ गर्ने गरी भ्रष्टाचार गर्ने आँट कसरी गर्यो ? के त्यसका पछाडि हाम्रो सामाजिक चेत जिम्मेवार छैन ? के यसले हाम्रा सामाजिक मान्यता कसरी निर्माण भनेर एकपटक सोच्न सिकाउँदैन ? जसरी पनि कमाउनुपर्ने, कमाएर देखाउनुपर्ने, ठूलो भवन बनाउनैपर्ने, महँगा गाडी चढ्नैपर्ने, तडकभडकपूर्ण जिन्दगी बिताउनैपर्ने मान्यताको कारण त होइन ? किनभने भ्रष्टाचार सामाजिक मान्यतासँग जोडिने विषय हो। त्यस्तो हो भने हाम्रा सामाजिक मान्यता कसरी निर्माण भइरहेछन् भन्नेबारे चिन्तन गर्नैपर्ने हुन्छ। भ्रष्टाचार नियन्त्रणका लागि सामाजिक मान्यतामा परिवर्तन ल्याउनेतफूपनि ध्यान दिनुपर्छ। लोकतन्त्रले शक्तिलाई जनताका घरआँगनमा पुर्याएको छ। यस्तो नहोस्, यसले भ्रष्टाचारलाई पनि व्यापक नबनाओस्। भ्रष्टाचारबाट जोगिने हो भने सिंगो समाज जागरुक हुन जरुरी छ। इमानदार र नैतिकवान्लाई सम्मान गर्ने परिपाटी विकास गरिनुपर्छ, धनाढ्य र कमाउवालालाई होइन। साथसाथै भ्रष्टाचार नियन्त्रणका लागि आवश्यक अधिकारसम्पन्न संयन्त्र स्थानीय स्तरसम्मै निर्माण गरिनुपर्छ। स्थानीय तहका सात सय ५३ सरकारमा यसरी नै ढकाल प्रवृत्ति नदेखियोस् भनी बेलैमा सचेत हुन जरुरी छ।"
विप्लवका गोरखा इन्चार्ज पक्राउ,गोरखा : नेत्रविक्रम चन्द विप्लव नेतृत्वको नेकपाका जिल्ला इन्चार्ज योगेन्द्र कुमाललाई प्रहरीले पक्राउ गरेको छ। विप्लव नेतृत्वको नेकपाका प्रवक्ता विश्वकर्मा पक्राउ प्रवक्ता पक्राउ परेपछि विप्लवले गरे नेपाल बन्दको घोषणा किन पक्राउ पर्दैछन् विप्लवका नेता ? सरकार किन आक्रमक ? कुमाललाई गोरखा नपरपालिका वडा नम्बर १२ दशकिलोस्थित उनकै निवासबाट बिहीबार दिउसो पौने १ बजे पक्राउ गरेको प्रहरी उपरीक्षक विमल बस्नेतले जानकारी दिए। बस्नेतका अनुसार उनलाई अनुसन्धानका लागि नियन्त्रणमा लिइएको हो। बुधबारमात्र नेकपाका प्रवक्ता खड्गबहादुर विश्वकर्मालाई प्रहरीले काठमाडौंको नागढुंगाबाट नियन्त्रणमा लिएको थियो।
प्रकाण्ड प्रकरणमा नेकपा नेताकै चेतावनी: दुला भित्रको सर्पसँग नजिस्केको राम्रो,"कालिकोटः नेत्रविक्रम चन्द नेतृत्वको नेपाल कम्युनिस्ट पार्टीका प्रवक्ता खड्गबहादुर बिश्वकर्मा प्रकाण्ड पक्राउ परेपछि उनको गृहजिल्ला कालिकोटमा विरोध सुरु भएको छ । नरहरिनाथ गाँउपालिका माल्कोटमा जन्मो नेकपाका प्रवक्ता प्रकाण्ड पक्राउ परेपछि जिल्लाका स्थानीय नागरिक, सत्तरुढ र प्रतिपक्षी दलका नेता र तत्कालीन नेकपा माओवादी केन्द्रबाट निर्वाचित स्थानीय सरकारका प्रमूखहरुलेसमेत विरोध जनाएका हुन् । पलाँता गाँउपालिका अध्यक्ष लक्ष्मणबहादुर बम, पचालझरना गाँउपालिका अध्यक्ष खड्गराज सेजुवाल र तिलागुफा नगर प्रमूख रतनबहादुर शाहीले सामाजिक सञल फेसबुकमार्फत प्रकाण्डको पक्राउको विरोध गरेका हुन् । तीनैजना तत्कालीन नेकपा माओवादी केन्द्रबाट गाँउपालिकामा विजयी भएका हुन् । पलाँता गाँउपालिका अध्यक्ष लक्ष्मणबहादुर बमले प्रकाण्डको फोटो राखेर कडा प्रतिक्रिया दिएका छन् । दुला भित्रको सर्पसँग जिस्किँदा राम्रो प्रतिक्रिया कुनै कालखण्डमा देखिएकै छैन, उनले लेखेका छन्, विनाशर्त रिहा गरेकै राम्रो । तिलागुफा नगर प्रमूख रतनबहादुर शाहीले दमनले विस्फोट हुन्छ भन्ने कुरा सरकारले बुझ्नुपर्छ भन्दै सरकारलाई चेतावनी दिएका छन् । उनी पनि नेकपा माओवादी केन्द्रबाटै नगर प्रमुखमा बिजयी भएका हुन् । विप्लवका प्रवक्ता प्रकाण्डको घरमा टाँसियो पक्राउ पुर्जी विप्लव नेतृत्वको नेकपाका प्रवक्ता विश्वकर्मा पक्राउ प्रवक्ता पक्राउ परेपछि विप्लवले गरे नेपाल बन्दको घोषणा प्रकाण्डमाथि सात करोड चन्दा असुलेको अभियोग किन पक्राउ पर्दैछन् विप्लवका नेता ? सरकार किन आक्रमक ? विप्लवका गोरखा इन्चार्ज पक्राउ यस्तै पचालझरना गाँउपालिका अध्यक्ष खड्गराज सेजुवालले पनि आफ्नो यो यो कामले सरकारबारे राम्रो संकेत नदिएको बताएका छन् । यो राम्रो संकेत होइन, बिनाशर्त रिहा गरियोस । उनले पनि प्रकाण्डलाई पक्राउ गरेर सरकारले राम्रो काम नगरेको प्रतिक्रिया दिएका छन् । यस्तै प्रमुख प्रतिपक्षी दल नेपाली कांग्रेस कालिकोटमा सहसचिव दमनबहादुर शाही र सत्तापक्षकै नेकपा कालिकोटका नेता दुर्गाप्रसाद काफ्ले लगायतका अन्य नेताले पनि प्रकाण्ड पत्राउको विरोध जनाएका छन् । नेपाली कांग्रेस कालिकोटका सहसचिव शाहीले सरकारको शक्ति यी नेताको गिरफ्तारीसित झुक्नुनै हो भनेका छन् । यस्तै सत्ताधारी नेकपा कालिकोटका नेता दुर्गाप्रसाद काफ्लेले प्रकाण्ड कुनै नाम मात्रै नभइ यो दश वर्षे जनयुद्ध र १९ दिने जनआन्दोलनको प्रतीक भएको बताएका छन् । दुई भाइ र एउटी बहिनी गुमाएर पनि निरन्तर राजनीतिमा सक्रिय प्रकाण्डको गिरफ्तारीविरुद्ध जिल्लाका नेता एकै ठाउँ उभिएका हुन् । जसको बलिदानीले गणतन्त्र आयो, उनैलाई हत्कडी भिराउनु न्यायोचित होइन, नेताहरुले भनेका छन्, सरकारले बिनासर्त रिहा गर्नुपर्छ ।"
नेकपाको 'हेडक्वार्टर' धुम्बाराहीमा,"काठमाडौं : नेपाल कम्युनिस्ट पार्टी (नेकपा)ले पार्टी हेडक्वार्टर धुम्बाराहीलाई बनाउने निर्णय गरेको छ। बिहीबार बसेको सचिवालय बैठकले पेरिसडाँडालाई जनवर्गीय संगठनको कार्यसलय बनाएर धुम्बाराहीलाई हेडक्वार्टर बनाउने निर्णय गरेको प्रवक्ता नारायणकाजी श्रेष्ठले जानकारी दिए। सचिवालय बैठकले पार्टी हेडक्वार्टर धुम्बाराहीमा रहने निर्णय गरेको छ, प्रवक्ता श्रेष्ठले भने, पेरिसडाँडालाई जनवर्गीय संगठनको कार्यलय रहने छ। तत्कालीन एमाले र माओवादी एकता हुनुअघि धुम्बाराहीमा एमाले र पेरिसडाँडामा माओवादीको हेडक्वार्टर थियो। त्यसैगरी नेकपा सचिवालय बैठकले विभिन्न सुझाव सिफारिस गर्न गठन भएका कार्यदलको समय अवधि बढाउने निर्णय गरेको छ। सँगै कार्यदललाई थप जिम्मेवारीसमेत दिएको छ। हामीले प्रदेश स्तरमा प्रदेश, जिल्ला स्तरमा र जनवर्गीय स्तरमा संगठनिक एकीकरणका लागि कार्यदल गठन गरेका थियौँ। यसको कार्यअवधि शुक्रबासम्मको थियो। यसको कार्यअवधि बढाएर साउन मसान्तसम्म समय दिने निर्णय भएको छ, प्रवक्ता श्रेष्ठले भने, सँगै सबै कार्यदललाई अर्को कार्यदेशसमेत दिइएको छ। तिनै कार्यदलले केन्द्रीय सल्लाहकार, राष्ट्रिय परिषद्, जेष्ठ कम्युनिस्ट मञ्च, केन्द्रीय आयोग र विभागहरुमामा राख्ने सदस्यको नामसमे सुझाव सिफारिस गर्न निर्देशन दिइएको छ। सँगै बैठकले मन्त्री, मेयर, उपमेयर गाउँपालिकाका अध्यक्ष र उपाध्याक्षसम्मलाई कार्यकारी पदको जिम्मेवारी नदिने निर्णय गरेको छ। संघीय मन्त्री, प्रदेशका मन्त्री, प्रादेशिक दल नेता र उपनेता, संघीय र प्रदेशसभाका प्रमुख सचेत र मुख्य सचेतक र सचेतक, संसदीय समितिका सभापति र महानगरपालिका, नगरपालिकाका मेयर, उपमेयर, जिल्ला समन्वयन समितिका सभापति र उपसभापति सँगै गाउँपालिकाका अध्यक्ष र उपाध्यक्षलाई कुनै पनि स्तरको कार्यकारी पद अर्थात् अध्यक्ष र सचिव पदको जिम्मेवारी नदिने निर्णय भएको छ, पार्टी प्रवक्ता श्रेष्ठले भने, सचिवालय बैठकले सांगठनिक एकीकरणका लागि सहज बनाउन यस्तो निर्णय गरेको हो।"
