शीर्षक,विवरण
जीविकामै छुवाछूत,"ऋणधन गरेर निम्न पुँजी व्यवसाय थालेका सर्लाही चन्द्रनगरका मधेसी दलितको नयाँ प्रयास छुवाछूतकै कारण असफल भएको छ। यो समाचार आफूलाई आधुनिक दाबी गर्ने नेपाली समाजको निम्ति दुःखद् मात्र नभई लज्जास्पद पनि हो। पटकपटकका पेचिला संघर्षपछि संघीय गणतान्त्रिक बनेको नेपाली राज्य प्रणालीमा दासकालीन भेदभाव बाँकी नै छन् भन्नु जोकोहीका लागि संकोच लाग्ने विषय हो। दलित भएकैले ग्राहकले उपेक्षा गरेको र व्यवसाय नै बन्द गर्नुपरेको उक्त घटनाले राजनीतिक परिवर्तनको इतिहास रचेको हाम्रो समाजमा सामाजिक र सांस्कृतिक परिवर्तन नभएको जनाउँछ। यो घटनाले अहिलेसम्मको नेपाली राजनीतिकसामाजिक इतिहासमाथि नै गम्भीर भएर सोच्न प्रेरित गर्छ। २०२० सालको मुलुकी ऐनदेखि नै कानुनी रूपमा बन्देज लगाइएको जातीय विभेद किन जीवित छ ? यो प्रश्नले केवल कानुनी बन्दोबस्तले मात्र समस्याको निराकरण गर्न नसक्दो रहेछ भन्नेतर्फ इंगित गर्छ। सँगै उठ्ने अर्को प्रश्न हो, पटकपटकका राजनीतिक आन्दोलन हुँदाहुँदै पनि सामाजिक परिवर्तन किन हुन सकेन ? प्रस्ट छ राजनीतिक आन्दोलनका अगुवाहरूले सामाजिक परिवर्तनलाई कहिल्यै पनि केन्द्रमा राखेनन्। राजनीतिक आन्दोलन केवल सत्ता प्राप्तिका खातिर बन्यो। दलित समस्या विभेदकारी सोपानीकरणको लामो अभ्यासमा उत्पन्न हो। यसलाई धेरैले सामाजिकसांस्कृतिक समस्याका रूपमा हेर्छन् भने कसैकसैले आर्थिक समस्याका रूपमा। कुनै एक पाटोबाट मात्र यसलाई हेर्नु एकांगी हुनेछ। दलित समस्यालाई राजनीतिकअर्थशास्त्रीय र सामाजिकसांस्कृतिक समस्या दुवै फलकको मिश्रित परिणामका रूपमा बुझ्न उपयुक्त हुनेछ। राजनीतिक अर्थशास्त्र यस अर्थमा, लामो समयसम्म नेपाली समाजमा तीनवटा आर्थिक स्रोत थिए : जमिन, जंगल र खनिज। जमिन र जंगलमा कहिल्यै दलितहरूको स्वामित्व रहेन। खनिज सधैं राज्यको प्रत्यक्ष सञ्चालनमा रहने गथ्र्यो। जमिन र जंगलमा स्वामित्व नभएकैले दलित समुदाय ज्यालादारी श्रममा बाँच्न बाध्य भयो। बालीघरे प्रथा, हरुवा, चरुवा त्यसैको उदाहरण हो। दलित समुदायले श्रम गर्ने पेसालाई समाजमा हेपिएको दर्जामा राखियो। सर्लाहीका मधेसी दलितले थालेको व्यवसाय गर्ने प्रयास यो इतिहासदेखिको लामो श्रम विभाजनको साङलोबाट उन्मुक्त हुने प्रयत्न हो। तर त्यो अहिले पनि सफल हुन सकेको छैन। किनभने समाजमा जरा गाडेर बसेको संरचनाले दलित समुदाय पुरानै पेसामा सीमित भइरहोस् भन्ने चाहन्छ। उसले अरू पेसा अपनाएको देख्न चाहँदैन। यो हाम्रा राजनीतिक आन्दोलनका असफलताको उदाहरण हो भने सामाजिक आन्दोलन थालनी नै नभएको प्रमाण पनि। संविधानको धारा १७ मा उल्लिखित स्वतन्त्रताको हक, धारा २४ को छुवाछूत तथा भेदभावविरुद्धको हक र धारा ४० को दलितको हक बाट सर्लाहीका मधेसी दलित वञ्चित भएका छन्। तर यस्ता विभेदमा दोषी प्रत्यक्ष छैनन्। सिंगो सामाजिक चेत नै दोषी बनेको छ। प्रत्यक्ष तवरमा विभेद नदेखिने, कानुन उल्लंघन नै गरेजस्तो पनि नमानिने तर कुनै न कुनै हिसाबले विभेद भइरहने यस्तो सूक्ष्म भेदभाव हटाउन राज्यले नै पहलकदमी लिनुपर्छ। त्यसका लागि राज्यले विशेष कार्यक्रम लागू गर्न आवश्यक छ। राज्यका नीतिहरूकै कारण दलितकरण भएको हो। त्यसैले यसको समाधान पनि राज्य तहबाटै खोजिनुपर्छ। राज्यले एकातर्फ समाजको सांस्कृतिक स्तर उकास्ने गरी कार्यक्रम ल्याउनुपर्छ भने अर्कोतर्फ नाफामूलक व्यवसायमा दलित समुदाय स्थापित हुने गरी नीति निर्माण गर्नुपर्छ।"
सरकारले बिजनेस दिन नसक्दा प्रदेशसभा अधिवेशन अन्त्य,"बुटवल : प्रदेश नाम र राजधानी तोक्न सुझाव समिति गठन गर्दै प्रदेश ५ को बर्खे (दोस्रो) अधिवेशन अन्त्य गरिएको छ । सरकारको सिफारिसमा प्रदेशप्रमुख उमाकान्त झाले संसद् अधिवेशन अन्त्यको पत्र संसद्लाई पठाएका हुन । संसद्मा दर्ता भएका सबै विधेयक पारित भएपछि संसद् बिजनेसविहीन भएको थियो । बुधबारको मन्त्रिपरिषद् बैठकले अधिवेशन अन्त्यका लागि प्रदेश प्रमुखलाई आग्रह गरेको थियो । प्रदेश प्रमुख उमाकान्त झाको पत्र पढ्दै सभामुख पूर्णबहादुर घर्तीले अधिवेशन अन्त्य भएको घोषणा गरेका थिए । बिजनेस दिन नसकेको सरकारले सबै शक्ति बजेट कार्यान्वयनमा लगाउने योजनासहित संसद्को अन्त्य गरिएको दाबी गरेको छ । संसद्ले अहिलेसम्म १४ वटा विधेयक पारित गरेको छ भने प्रादेशिक लोकसेवा आयोगसम्बन्धी विधेयक छलफलकै क्रममा छ । संघीय सरकारले कानुन नबनाउँदा मस्यौदा निर्माणमा ढिलाइ भइरहेको प्रदेश कानुन आयोगले जनाएको छ । दोस्रो अधिवेशनको अन्तिम बैठकले प्रदेश नामाकरणका विषयमा चौतर्फी माग र सदनसमेत अवरुद्ध भएपछि सुझाव समिति गठन गरेको थियो । १५ सदस्यीय समितिमा नौ जिल्लाका सांसदहरू सदस्यका रूपमा रहेका छन् । समितिले तीन महिनाभित्र प्रतिवेदन पेस गर्नुपर्ने सभामुख घर्तीले सदनलाई जानकारी गराए । समितिमा राजपाकी कल्पना पाण्डे, नेकपाका चेतनारायण आचार्य, तुल्सीप्रसाद चौधरी, दिनेश पन्थी, विष्णु पन्थी, सरस्वती गौतम, नारायणप्रसाद आचार्य, दीपेन्द्रकुमार पुन, दिपेश थारू, कांग्रेका भुवनेश्वर चौधरी, वीरबहादुर राना, रमा अर्याल, निर्मला क्षत्री, फोरमका सहसराम यादव, जनमोर्चाकी तारा जिसी रहेका छन् । सदस्यमध्ये अर्घाखाँचीका ३, पाल्पा, कपिलवस्तु, बर्दिया र रूपन्देहीका २२ सांसद छन् । त्यस्तै दाङ, प्युठान, गुल्मी र रोल्पाका एकएक सदस्य समितिमा राखिएको छ । प्रदेश नामाकरण र राजधानीको विषयमा सांसदहरू विभाजित हुँदा यो काम कठिनपूर्ण देखिएको छ । प्रदेश राजधानी बुटवल र दाङ हुनुपर्ने तीव्र माग छ भने कपिलवस्तुका सांसदले सोही जिल्लामा हुनुपर्ने माग राखेका छन् । नाम भने लुम्बिनी र बुद्धभूमिमध्ये एक हुने सम्भावना देखिएको छ । बिहीबार प्रदेशसभामा विशेष सम्बोधन गर्दै मुख्यमन्त्री शंकर पोखरेलले प्रदेश नामाकरण र राजधानी तोक्ने काम जनता विभाजन नहुने गरी गर्न समितिलाई सुझाव दिएका छन् । अहिले रहेको आञ्चलिक मनोविज्ञान हटाउँदै प्रदेशको विकास गर्नुपर्ने दायित्व रहेकाले आग्रह पूर्वाग्रहमा नरही नाम र राजधानी टुंगो लगाउनमा उनले जोड दिए । मुख्यमन्त्री पोखरेलले बजेट कार्यान्वयनमा सरकार जुटेको समेत संसद्लाई जानकारी गराएका छन् । बजेट कार्यान्वय इकाइहरूको विषयमा संघीय सरकारबाट साउनभित्रै निर्णय हुने भन्दै नभए प्रदेश बजेट कार्यान्वयनमा जुट्ने उनले बताए । आफ्नो इकाइ नभएको अवस्थामा सेवा करारमै भए पनि बजेट कार्यान्वयनमा सरकार जान्छ, उनले भने । प्रदेशको पूर्वाधार विकासको काम भदौबाट सुरु हुने भन्दै प्रदेश सरकारले जनअपेक्षाअनुरूप काम गरेर देखाउने मुख्यमन्त्रीले पोखरेलले बताए । तीन तहको सरकार बनेपछि करका विषयमा प्रदेश गम्भीर रहेको भन्दै प्रदेश ५ मा कुनै पनि कर वृद्धि नभएको र स्थानीय तहलाई समेत अनुचित कर संकलन नगर्न आग्रह गरिएको उनले बताए । जनतामाथि कर थप्ने विषय राम्रो होइन, हाम्रो प्रदेशमा कुनै कर बढेको छैन, बरु जिससले लिने कर घटाएका छौं, उनले भने । मुख्यमन्त्री पोखरेलले बजेट विनियोजनको विषयमा सांसदहरूले गुनासो गर्न नपर्ने भन्दै मापदण्ड बनाएर काम गरिएको उनले बताए । उनले चालु वर्षलाई कानुन निर्माणको वर्षका विषयमा सरकारले लिएको भन्दै तत्कालै अर्काे अधिवेशन आह्वान गरिने जानकारीसमेत गराए । बिहिबारको प्रदेश सभामा विशेष समय लिएर बोल्दै सांसद सन्तोष पाण्डेले प्रदेश नामाकरण लुम्बिनीको विषयमा हुनुपर्ने, प्रदेशको एउटा मन्त्रालय भैरहवामा लैजानुपर्ने, साना दलको भूमिकालाई पनि प्रदेश सरकारले ध्यान दिनुपर्ने विषयमा कुरा उठाएका थिए । प्रदेश ५ सभाले विशेषाधिकार समितिको नामसमेत टुंगो लगाएको छ । विशेषाधिकार समितिमा अमरबहादुर डाँगी, अष्टभुजा पाठक, कमलराज श्रेष्ठ, कल्पना पाण्डे, तारा जिसी, तेजबहादुर वली, पार्वती पुन, फखरुद्दिन खान, बाबुराम गौतम, सन्तोषकुमार पाण्डे, हरि रिजाल रहेका छन् । यसअघि संसद्मा ६ वटा संसदीय समिति निर्माण गरिएको थियो ।"
अदालतमा हाजिर हुन राज्यमन्त्रीलाई पार्टीको निर्देशन,"जनकपुरधाम : राजपा अध्यक्षमण्डलले महोत्तरीमा भएको सशस्त्रका असइ हत्याकाण्डका आरोपितलाई अदालतमा हाजिर हुन निर्देशन दिएको छ । अध्यक्षमण्डलको बैठकले प्रदेश राज्यमन्त्री अभिराम शर्मासहित मुद्दा लागेका सबै आरोपितलाई अदालतमा हाजिर हुन निर्देशन दिएको जनाइएको छ । राजपा स्रोतका अनुसार बुधबार बसेको बैठकले यस विषयमा निर्णय लिएको हो । अध्यक्षमण्डलका ६ जना नेताकै सहभागितामा भएको बैठकले अदालतको सम्मानका लागि आरोपितलाई हाजिर हुन निर्देशन दिएको एक पदाधकिारीले सुनाए । उनका अनुसार अध्यक्षमण्डलका सबै नेता अदालतको फैसलाकै पक्षमा छन् । असइ हत्याका आरोपित राज्यमन्त्री शर्माले अदालतको सम्मान गर्ने बताएका छन् । यसका लागि आफू चाँडै अदालतमा हाजिर हुने उनको भनाइ छ । राज्यमन्त्रीबाट राजीनामा नदिई अदालतमा हाजिर हुने उनले सुनाए । मधेस आन्दोलनका क्रममा सशस्त्र प्रहरीका असइ थमन विकको हत्या आरोपमा राज्यमन्त्री शर्मासहित २८ जनाविरुद्ध मुद्दा लागेको छ । २०७२ भदौ २५ गते महोत्तरीको जलेश्वरमा असइ विकको हत्या भएको थियो । घटनामा संलग्न भएको आरोपमा प्रहरीले तीन जनालाई पक्राउ गरेको थियो । महोत्तरी ३ को प्रदेशसभा (१) बाट निर्वाचित शर्माले प्रदेश सरकारमा सामाजिक विकास राज्यमन्त्रीका रूपमा बुधबार शपथ लिएका थिए । महोत्तरी जिल्ला अदालतमा विचाराधीन मुद्दामा शर्मासहित जलेश्वर६ का रमेशप्रसाद साह, सतीशनन्द चौधरी, राजा चौधरी, नरेश साह, रामराजा साह, हरिओमकुमार भगत, बिक्की साह, जलेश्वर९ का चन्देश्वर साह, गोलु साह, रवीन्द्रराम चमार, रञ्जित साह, देवेन्द्र चौधरी, पवन कापडी, अनिल ठाकुर, फुले यादव, रोहितकुमार शर्मा, लालबाबु बिन, शम्भु साह, देवेन्द्र यादव, कौशलकुमार यादव, लक्ष्मी महतो, धमेन्द्र राय, रामशंकर मि श्र, सुरेश पाण्डेसहितकालाई अभियुक्त बनाइएको छ । विककी पत्नी शोभा गहतराजले २०७४ चैत २८ गते जिल्ला प्रहरी कार्यालय र त्यसका कार्यालय प्रमुखलाई विपक्षी बनाउँदै परमादेशका लागि उच्च अदालतमा निवेदन दिएकी थिइन् । उक्त निवेदनमाथि सुनुवाइ गर्दै २९ चैतमा उच्च अदालत जनकपुरका न्यायाधीश रमेशकुमार खत्रीको इजलासले जिल्ला प्रहरी कार्यालय महोत्तरीलाई १५ दिनभित्र सरकारी वकिलको कार्यालय जनकपुरमार्फत लिखित जवाफ पेस गर्न परमादेशसमेत जारी गरेको थियो । प्रहरी प्रतिवेदनमा उल्लेख भएअनुसार असइ विकलाई आन्दोलनकारीले नियन्त्रणमा लिई लाठी, भाटा, लात्ती, मुक्काले हानी गम्भीर घाइते बनाएका थिए । प्रहरीले विकलाई उद्धार गरी उपचारका लागि जलेश्वर पुयाएका थिए । उनलाई थप उपचारका लागि जनकपुर ल्याइँदै गरेका बेला आन्दोलनकारीको समूहले प्रकौली चोकमा पुगेर बाटो अवरुद्ध गरी ढुंगामुढा गरेको थियो । एम्बुलेन्स नरोकी भ्रमरपुरा गाउँको बाटो भई जाने क्रममा पुनः अवरोध भएपछि कुरुवा र प्रहरी डराएर भागेपछि विक पनि भाग्न खोजेका थिए । सोही क्रममा उनलाई आन्दोलनकारीले कुटपिट गरी मारेको प्रतिवेदनमा उल्लेख छ ।"
