शीर्षक,विवरण
नागरिक सर्वोच्चता स्थापित गर्न आह्वान,"घोषणापत्रका मुख्य सवाल प्रधानमन्त्री केपी शर्मा ओलीमा सर्वसत्तावादी चिन्तन र व्यवहार हावी  भागबन्डा, संकीर्ण स्वार्थ र शक्ति आर्जनलाई सर्वोपरि ठान्ने दलतन्त्र नै मुलुकको समग्र उन्नतिको बाधक राजनीतिक दलहरुले संवैधानिक संस्कार आत्मसात् गर्न सकेनन् राजनीतिक प्रक्रियामा नागरिक स्वामित्व स्थापित नगरी ऐतिहासिक कार्यभार पूरा हुँदैन  यौनिक दुर्व्यवहार, बलात्कार, हिंसा र हत्या मौलाउने राज्यमा लैंगिक समानता फगत झूटो वाचा  संघीयताका नाममा हावी एकात्मक चिन्तन र केन्द्रीकृत शासकीय सोचलाई चिर्न जनताले लडाइँ थाल्नुपर्छ"
प्रदेश प्रमुख परियार बर्खास्त,"ॅआन्दोलनमा बलियो समर्थन मिल्दै छनेकपाको दाहालनेपाल समूहले प्रतिनिधिसभा विघटनविरुद्धको आन्दोलनमा सबैतिरबाट बलियो समर्थन मिल्दै गएको निष्कर्ष निकालेको छ । केन्द्रीय कमिटीको शुक्रबार बसेको बैठकमा अध्यक्षद्वय पुष्पकमल दाहाल र माधवकुमार नेपाल तथा प्रवक्ता नारायणकाजी श्रेष्ठले अहिलेसम्मको आन्दोलनको समीक्षा गर्दै आफूहरूले उठाएको एजेन्डामा जनता गोलबद्ध भएको उल्लेख गरेका थिए । उनीहरूले पार्टीका गतिविधिमा ओली पक्षबाट भ्रम छर्ने काम भइरहेकाले त्यसलाई नपत्याउन केन्द्रीय कमिटी सदस्यहरूलाई आग्रह गरेका थिए ।बैठकमा अध्यक्ष नेपालले सर्वोच्च अदालतमा वकिलहरूले गरेको बहस हेर्दा कुनै हालतमा विघटन सदर हुन सक्ने ठाउँ नरहेकाले अब फैसला पनि त्यसैअनुसार आउने आकलन रहेको सुनाएका थिए । तर ओलीले साम, दाम प्रयोग गरेर हिँडिरहेको, पार्टीका नेताकार्यकर्तालाई भड्काउन खोजेको उनले ब्रिफिङ गरेका थिए । कुनै पनि बेला निर्वाचन आयोग वा अन्यत्र पार्टीको पक्षमा रहेका नेताहरूका सम्पूर्ण कागजात आवश्यक पर्न सक्ने भन्दै बैठकमा केन्द्रीय सदस्यहरूको नागरिकतालगायत कागजात जम्मा पारिएको थियो ।"
विघटनको मुद्दा ११ गते 'हेर्दाहेर्दै मा,"काठमाडौं (कास) प्रतिनिधिसभा विघटनको मुद्दामा दुवै पक्ष र एमिकस क्युरीको रायसमेत सुनुवाइ गरेको सर्वोच्च अदालतले आगामी मंगलबारका लागि पेसी तोकेको छ । सुनुवाइ सकिएपछि इजलासका तर्फबाट प्रधानन्यायाधीश चोलेन्द्रशमशेर जबराले बहसनोट पेस गर्न दुई दिन समय तोकेका छन् । एमिकस क्युरीका तर्फबाट वरिष्ठ अधिवक्ता गीता पाठक संग्रौलाले बहस सकेपछि प्रधानन्यायाधीश जबराले महान्यायाधिवक्ता कार्यालयका नायब महान्यायाधिवक्ता पदमप्रसाद पाण्डेयलाई बहसनोट पेस गर्नुभयो ? भनी सोधेका थिए । जवाफमा पाण्डेयले आइतबार पेस गर्ने जवाफ दिएपछि जबराले सोमबार ल्याए पनि हुन्छ भनेका थिए । त्यसपछि उनले मंगलबार फेरि हेर्दाहेर्दै का लागि पेसी तोक्न आदेश दिए । त्यसो भए मंगलबार निर्णय सुनाउने (निसु) भनी कानुन व्यवसायीहरूले प्रश्न गरेका थिए । प्रधानन्यायाधीश जबराले भने, होइन, निसुको त प्रश्नै भएन । १० गतेसम्म बहसनोट भयो । ११ गते हेर्दाहेर्दै सकियो, त्यही दिन पनि हुन सक्छ । १२ गते पनि हुन सक्छ । शुक्रबार बहस गर्दै वरिष्ठ अधिवक्ता संग्रौलाले सीमित सरकारलाई असीमित अधिकार नहुने तर्क गरेकी थिइन् । उनले संविधानको धारा ७६ बारे धारणा राख्दै त्यसका उपधारा एकपछि अर्को चरणका रूपमा प्रयोग हुने बताइन् । उनले संविधानमा कुनै निषेध नगरिएकाले उही दलका सांसदहरूले पनि अविश्वासको प्रस्ताव पेस गर्न सक्ने जिकिर गरिन् । उनले प्रधानमन्त्रीलाई प्रतिनिधिसभा विघटन गर्ने विशेषाधिकार नहुने बताइन् । प्रधानमन्त्रीको अवशिष्ट अधिकार हुने दाबी गरिए पनि त्यो तहगत सरकारहरूको अधिकार बाँडफाँटका विषयमा रहेको उनको तर्क थियो ।"
१७ दिनपछि भागरथीको अन्त्येष्टि,"(बैतडी)  बलात्कारपछि हत्या गरिएकी बैतडीकी किशोरी भागरथी भट्टको शव बुझी परिवारले शुक्रबार महाकाली नदी किनारमा अन्त्येष्टि गरेका छन् । पोस्टमार्टमपछि उनको शव १५ दिनदेखि जिल्ला अस्पताल बैतडीमा थियो । माघ २३ गते घटनास्थलबाट शव उठाएर २४ गते पोस्टमार्टम गरिए पनि घटनाका दोषी पत्ता नलागेसम्म शव नबुझ्ने आफन्तको अडान थियो । प्रहरीले बुधबार घटनामा संलग्न रहेको भन्दै भागरथी अध्ययनरत विद्यालयकै ११ मा पढ्ने १६ वर्षका एक किशोरलाई अभियुक्तका रूपमा सार्वजनिक गरेको थियो । बिहीबार सरकारी वकिल कार्यालयमा अभियुक्त र उनका बुबालाई सँगै राखेर लिइएको बयानमा किशोरले बलात्कार र हत्या आफैंले गरेको स्विकारेपछि परिवारजनले शव बुझ्ने निर्णय गरेका हुन् । घटना उनी एक्लैबाट सम्भव नहुने भन्दै पीडित परिवारले विधिविज्ञान प्रयोगशालाको प्रतिवेदन आएपछि मात्रै शव बुझ्ने बताउँदै आएका थिए । प्रयोगशालामा पठाइएको मृतकको भजाइनल स्वाब, मुखको स्वाब, योनिबाट निस्किएको रगतको मेडिकल रिपोर्ट आउन बाँकी रहेको जिल्ला प्रहरी प्रमुख डीएसपी नारायणप्रसाद अधिकारीले बताए । प्रहरीको प्राविधिक, स्थलगतलगायतका अनुसन्धानबाट उनी नै आरोपित भएको विश्वास लागेपछि शव बुझेको मृतकका काका शिवराज भट्टले बताए । मृतक र अभियुक्त दिनेश भट्ट दुवै हाम्रै हुन् । प्रहरीको अहिलेसम्मको अनुसन्धानबाट ऊ दोषी हो भन्ने प्रमाणित भएपछि शव बुझेर दाहसंस्कार गरेका हौं, उनले भने । आरोपितलाई अपराधीका रूपमा सजाय गरेपछि मेडिकल रिपोर्टसहित अन्य तथ्य प्रमाण परिवारलाई विश्वस्त पार्ने खालको हुनुपर्ने माग प्रहरी प्रशासनसँग राख्दै शव बुझिएको उनको भनाइ छ । माघ २१ गते भागरथी विद्यालयबाट घर जाने समय भएपछि आफू पनि कक्षा छाडेर गएको अभियुक्तले बयानमा बताएका छन् । बाटोमा ढुकेर बसेका बेला उनी आएपछि धकेलेर सडकबाट तल फालेको, लडेपछि घाँटी च्यापेको र बलात्कार गरेको बयान दिएको प्रहरी स्रोतले बतायो । बलात्कार गरेपछि मृतकले नमार छोडी दे भने पनि घर गएर अरूलाई भन्ने डरले फेरि घाँटी थिचेर मारेको र त्यहाँबाट घरतर्फ हिँडेको पनि अभियुक्तले बयान दिएका छन् । अभियुक्त सार्वजनिक गरेसँगै प्रहरीले बुधबार जिल्ला अदालतबाट ५ दिनको म्याद थपेर अनुसन्धान गरिरहेको छ । दोगडाकेदार गाउँपालिका७ चडेपानीकी भागरथी सनातन धर्म माविमा कक्षा १२ मा पढ्थिन् ।"
कान्तिपुरकर्मी पुरस्कृत,"काठमाडौं (कास) कान्तिपुर पब्लिकेसन्सले आफनो २८ औं वार्षिकोत्सवका अवसरमा शुक्रबार ११ जनालाई पुरस्कृत गरेको छ । कोरोना महामारीका कारण विगतमा जस्तो यो वर्ष औपचारिक कार्यक्रम नगरिए पनि उत्कृष्ट कार्यसम्पादन गर्नेलाई पुरस्कृत गरिएको हो । कान्तिपुर मिडिया ग्रुपका अध्यक्ष तथा प्रबन्ध निर्देशक कैलाश सिरोहियाले पुरस्कृत भएकालाई नगद तथा प्रमाणपत्र प्रदान गरेका थिए । त्यसक्रममा अध्यक्ष तथा प्रबन्ध निर्देशक सिरोहियाले लोकतान्त्रिक मूल्यमान्यतालाई प्रवर्द्धन गर्दै पब्लिकेसन्सले निष्पक्ष पत्रकारिताको अभ्यासलाई अझै निखार्दै जाने बताए । पब्लिकेसन्सको सफलताका पछाडि कर्मचारीको उत्कृष्ट टिमवर्क रहेको उल्लेख गर्दै उनले आगामी दिनमा पनि यो टिम स्पिरिट लाई कायम राख्न आग्रह गरे ।पुरस्कृत हुनेमा कान्तिपुर दैनिककी सहायक वरिष्ठ उपसम्पादक बिनु सुवेदी, दार्चुला संवाददाता मनोज बडू, उपसम्पादक (फोटो पत्रकार) इलिट जोशी, काठमान्डु पोस्टका सहायक वरिष्ठ उपसम्पादक अर्जुन पौडेल, भरतपुर छापाखानाका जुनियर एक्जिक्युटिभ सञ्जीवकुमार भुजेल, फाइनान्सका सिनियर एक्जिक्युटिभ सन्तोष शर्मा, मार्केटिङ एक्जिक्युटिभ आनन्दकुमार सिंह, वितरण विभाग (डेस्क) का जुनियर एक्जिक्युटिभ रेखा कार्की, वितरक केशवप्रसाद पराजुली, प्रशासनका सुरक्षाकर्मी बाबुराम मिश्र र आईटी विभागका सहायक जितेन्द्रकुमार यादव छन् । २०४९ फागुन ७ गते कान्तिपुर दैनिक र द काठमान्डु पोस्ट गरी दुईवटा प्रकाशन थालेर कान्तिपुर पब्लिकेसन्सले आफ्नो यात्रा सुरु गरेको थियो ।"
चेयरम्यान बंगलामा सन्नाटा,"(जनकपुर)  जनकपुर चुरोट कारखानाको चेयरम्यान बंगलामा यहाँको निकै चहलपहल हुने ठाउँमा पर्छ किनभने यो प्रदेश २ प्रमुखको सरकारी निवास हो । बंगलाको माथिल्लो तलामा प्रदेश प्रमुखको निवास र भुइँतलामा उनको सचिवालय छ । त्यसैले प्रदेश प्रमुख हुँदा बखत जचुकालिको चेयरम्यान बंगलामा बाक्लै चहलपहल हुन्छ । शुक्रबार अपराह्न भने बंगला सुनसान थियो । सुरक्षामा खटिएका नेपाली सेनाबाहेक अन्य मानिसहरू देखिएनन् । माथिल्लो तल्लाको बेडरुममा शुक्रबार पदमुक्त गरिएका प्रदेश २ का प्रमुख तिलक परियार सानो बटनवाला मोबाइलमा कसैसित आश्चर्य मान्दै कुरा गरिरहेका थिए, किन हटाए ? म आफैं अचम्मित छु । एउटा कल कटेपछि मोबाइलमा तारन्तार अरू कल आइरहेका थिए । सबैलाई उनले एउटै जवाफ दिँदै थिए, खै, किन हटाएहटाए, आफैं छक्क परेको छु । अप्रत्याशित रूपमा पदमुक्त गरिएका उनी स्तब्ध देखिन्थे । कान्तिपुरसँग करिब २० मिनेटसम्मको कुराकानीमा परियारका आँखा रसाइरहे । बाँकेको कोहलपुरका परियार प्रदेश २ प्रमुखमा नियुक्त भएको भोलिपल्टै पदबहाली गर्न जनकपुर आउँदा श्रीमती चन्द्रालाई साथै ल्याएका थिए । संयोग कस्तो भने, बिरामी परेर चन्द्रा बिहीबार मात्रै काठमाडौं पुगिन् । चेयरम्यान बंगलाको अन्तिम दिनको बसाइमा परियार एक्लै परे । प्रमुख स्वकीय सचिव पद्म विश्वकर्माका अनुसार अब शनिबारसम्ममा सरसामान सबै बुझबुझारथ गरेर परियार पनि काठमाडौं फर्किने योजना छ । प्रदेश प्रमुखज्यूको कार्यालयका सचिवकर्मचारीसित सरसल्लाह हुँदै छ, विश्वकर्माले भने । पदमुक्त भएपछि पदमा चिप्केर बसिरहनुपर्ने कुरो आएन नि, तुरुन्तै काठमाडौं फर्किन्छु, परियारले भने । प्रदेश २ मा प्रमुख फेरिएको यो दोस्रोपटक हो । रत्नेश्वरलाल कायस्थलाई हटाएर सरकारले परियारलाई नियुक्त गरेको थियो । प्रदेश २ प्रमुखबाट परियारलाई संघीय सरकारले पदमुक्त गर्नुमा जनकपुरका राजनीतिकर्मीबीच दुईवटा कारणमा अड्कलबाजी छ । पहिलो प्रदेश निजामती सेवाको गठन, सञ्चालन र सेवाका सर्त सम्बन्धमा व्यवस्था गर्न बनेको विधेयकलाई प्रमाणीकरण गर्नु, दोस्रो परियारका स्वकीय सचिव अनिल पासवान र नेपाल रेलवे कम्पनीका महाप्रबन्धक गुरुप्रसाद भट्टराईबीच फोनमा भएको गालीगलौज । प्रदेश प्रमुखको सचिवालयले भने यी दुवै अड्कलबाजी बेठीक रहेको जनाएको छ । धेरै जनाले पासवान र भट्टराईबीचको फोन संवादलाई लिएर मसँग पनि जिज्ञासा राखेका छन्, परियारका प्रमुख स्वकीय सचिव विश्वकर्माले भने, यो सानो वादविवाद हो । पदमुक्त गरिनुको यो कारण होइन । जयनगरजनकपुर रेल सेवा कहिलेदेखि सञ्चालनमा आउने ? प्रदेश प्रमुखले बुझ्न खोजेको भन्दै गत साता पासवानले भट्टराईलाई फोन गरेका थिए । केन्द्रीय सरकार मातहत रहेकाले प्रदेशलाई जानकारी नदिने भन्दै भट्टराई तर्किन खोजेपछि उनीहरूबीच अश्लील गालीगलौज भएको अडियो सञ्चारमाध्यममा सार्वजनिक भएको थियो । ओलीको छोरा हुँ अपहरण पनि गराइदिन सक्छु भन्दै भट्टराईले पासवानलाई धम्क्याएपछि दुवैको भनाभनमा शीर्ष नेताको नामै लिएर राजनीतिक आक्षेप एकअर्कालाई लगाएका थिए । गत माघ २८ मा प्रदेश प्रमुख परियारले प्रमाणीकरण गरेको प्रदेश निजामती सेवाको गठन, सञ्चालन र सेवाका सर्त सम्बन्धमा व्यवस्था गर्न बनेको विधेयकमा भने कर्मचारी असन्तुष्ट थिए । यो कुरा परियारले पनि स्विकारे । विधेयक अहिल्यै ल्याउनुहुन्न । अझै होमवर्क गरौं भन्ने कुरा कर्मचारीबाट आएको हो, परियारले कान्तिपुरसँग भने, प्रदेशसभाले पास गरेको विधेयक प्रक्रियाबाट आएपछि मैले रोक्न मिल्दैन । त्यसैले प्रमाणीकरण गरिदिएँ । परियारले राजनीतिक प्रतिशोधका कारण आफूलाई पदमुक्त गरिएकाले काठमाडौं फर्किएर सर्वोच्च अदालतमा कानुनी अपिल गर्ने बताए । उनले कानुनी व्यवस्था केही छ भने पदमुक्तको मामिलामा सर्वोच्चमा अपिल गर्ने सोचमा रहेको खुलाए । पदमुक्त गर्लान् भन्ने कुनै शंका गरेको थिइनँ, उनले भने, पदमुक्त गरिएको राष्ट्रपति कार्यालयबाट इमेल आएपछि झसंग भएँ ।"
