शीर्षक,विवरण
सीमामा सशस्त्रको 'डेडिकेटेड फोर्स बनाउन प्रस्ताव,"यसका लागि मन्त्रालयले गृहकार्य थालेको उनको भनाइ छ । सीमा सुरक्षा सरकारको उच्च प्राथमिकतामा छ, सशस्त्रलाई डेडिकेटेड फोर्सका रूपमा परिचालन गर्दै सीमा सुरक्षा बलियो बनाइनेछ, उनले भने, सीमासम्बन्धी नीतिलाई पुनर्विचार गरी सीमालाई अझ नियन्त्रित र नियमन गर्नुपर्ने देखिन्छ । सीमा सुरक्षाका लागि २ सय ५ बीओपी तैनाथ भएको र यसलाई ५ सय पुर्याइने उनले बताए ।सीमा सुरक्षा सरकार र गृह मन्त्रालयको मात्र नभई सबैको साझा दायित्व भएकाले आपसी समन्वय र सहकार्यमा समान दृष्टिकोण र औपचारिक संयन्त्रबाट प्रभावकारी रूपमा सीमा सुरक्षा तथा व्यवस्थापन गर्न सकिने र डेडिकेटेड फोर्स सशस्त्र नै हुने उनले दोहोर्याए ।मन्त्री थापाले सीमा सुरक्षामा खटिने फौजलाई हातहतियार सुसज्जित र बन्दोबस्तीमा कुनै कमी हुन नदिने गरी योजना तर्जुमा गरिने बताए । अब सीमा सुरक्षामा खटिने सशस्त्र प्रहरीका लागि हातहतियार, गोलीगट्ठा एवं उपयुक्त बन्दोबस्तीका सामग्री र सवारीसाधनहरू उपलब्ध गराई जनशक्तिलाई आधुनिकीकरण र सेवा विशिष्टीकरण गराउँदै लैजान आवश्यक छ, उनले भने । यसका लागि सशस्त्रको जनशक्ति थप्नुपर्ने, आधुनिक साधनस्रोत र प्रविधिलाई सम्पन्न बनाई क्षमता विकास गर्नुपर्ने तथा सीमा सुरक्षासम्बन्धी आवश्यक ऐन, नियमहरूसमेत परिमार्जन र तर्जुमा गर्नुपर्ने आवश्यकता रहेको उनले औंल्याए । यसलाई क्रमशः परिपूर्ति गर्दै लैजाने ध्येय मन्त्रालयको रहेको उनको भनाइ छ ।गृहसचिव न्यौपानेले पनि गृहमन्त्रीकै भनाइ दोहोर्याउँदै सशस्त्र प्रहरीलाई नै डेडिकेटेड फोर्सका रूपमा विकास गर्नुपर्ने पक्षमा आफू रहेको बताए । सशस्त्र प्रहरी खटिएपछि सीमा सुरक्षा, सीमापार समन्वय, अपराध नियन्त्रण तथा सीमा अभिलेखमा सुधार आएको छ, उनले भने, सीमामा खटिने निकायबीचको समन्वय महत्त्वपूर्ण हुने भएकाले भारत सरकारले यसैमा केन्द्रित भएर फोर्स गठन गरेको छ । हामी पनि सशस्त्रलाई यस्तै किसिमले डेडिकेटेड बनाएर खटाउन सक्छौं । उनले देशको आकार र आर्थिक क्षमताका आधारमा सीमा सुरक्षा र व्यवस्थापन नहुने बताए । कुनै पनि देशको सीमा सुरक्षामा गरिब र धनीको सवाल हुँदैन, सशस्त्र प्रहरी बल परिचालन र आवश्यक बजेट तर्जुमा गरी स्रोतसाधन सम्पन्न बनाइनेछ र सूचनाको प्रवाहका लागि अन्तरनिकाय समन्वय गर्न विशेष संयन्त्र विकास गरिनेछ ।सशस्त्र प्रहरी महानिरीक्षक शैलेन्द्र खनालले सशस्त्र प्रहरीका थुप्रै म्यान्डेट भए पनि मूल दायित्व र प्राथमिकतामा सीमा सुरक्षा रहेको बताए । आफूले नेतृत्व सम्हालेपछि पनि सीमा सुरक्षालाई प्राथमिकतामा राखेर काम गर्दै आएको उनले स्पष्ट पारे । सीमा सुरक्षा, आधुनिक प्रविधि, अन्तरनिकाय तहमा विभिन्न संयन्त्रमार्फत समन्वय र सहकार्य गर्दै आएका छौं, उनले भने । आपराधिक व्यक्ति तथा समूहले सीमा क्षेत्रका नागरिकलाई आर्थिक प्रलोभनमा पार्न सक्नेप्रति सजग भई सीमा लक्षित विकास तथा सहुलियतका प्याकेज ल्याउन उनले सुझाव दिए । सीमा क्षेत्रका नागरिकको जीवनस्तर उकास्ने गरी काम हुन सके सीमा रक्षामा सुरक्षा निकाय र नागरिकसँगको सहकार्य अझ मजबुत हुने उनले बताए । खनालले सीमा सुरक्षाका लागि सूचना आदानप्रदान र समन्वयका लागि सीमा क्षेत्रमा खटिने सबै निकायको साझा संयन्त्र पनि आवश्यक भएको उल्लेख गरे ।उत्तरी सीमाका उच्च हिमाली भूभागको कठ्यांग्रिने जाडोदेखि दक्षिणी सीमाको अत्यधिक गर्मी र हावाहुरीको सामना गरेर खटिँदै आएका छौं, उनले भने, सुदूरपूर्वको ओलाङचुङगोलादेखि सुदूरपश्चिमको कालापानीलिपुलेकनजिक छाङरुसम्म खटिएका छौं, सीमा सुरक्षामा अन्य निकायसँग समेत समन्वय र सहकार्य गरिएको छ । यो दायित्वलाई अझ सशक्त बनाउँदै अघि बढ्छौं ।कार्यक्रममा नेपाल प्रहरीका डीआईजी दिवेश लोहनीले सीमा क्षेत्रमा तैनाथ प्रहरीका सीमा चौकीलाई इलाका प्रहरी कार्यालयका रूपमा विकास गर्ने लक्ष्य रहेको बताए । सीमासम्बन्धी विषयमा प्रहरीको चासो र सरोकार रहेको जनाउँदै उनले सूचना आदानप्रदान र समन्वय गर्न एकीकृत संयन्त्र अपरिहार्य रहेको धारणा राखे । प्रहरी प्रवक्ता एसएसपी वसन्तबहादुर कुँवरले सीमा अपराध अनुसन्धान र सीमासम्बन्धी सरोकारका विषयमा प्रहरीको भूमिकालाई अलग राख्न नसकिने बताए । त्यही खाकाअनुसार प्रहरीले सीमा सुरक्षासम्बन्धी कार्यशालामा धारणा पेस गरेको उनले बताए । दुईदिने कार्यशालाबाट प्राप्त रायसुझावसहितको एकीकृत प्रतिवेदन सरकारलाई बुझाइने सेनाले बताएको छ । त्यसपछि मन्त्रिपरिषद्बाट ठोस र परिवर्तित सन्दर्भअनुसार निर्णय हुन सक्ने कार्यशालामा सहभागी एक सुरक्षा अधिकारीले बताए ।"
बिहारमा नेपाली किशोरीको बलात्कारपछि हत्या,"पश्चिम चम्पारणका प्रहरी अधिक्षक (एसपी) नवीनचन्द्र झाले प्रारम्भिक अनुसन्धानमा एसएचओ रञ्जनले बलात्कार र हत्याजस्तो जघन्य घटनाबारे थाहा हुँदाहुँदै उजुरी दायर नगरेको र उल्टै अभियुक्तलाई प्रमाण लुकाउन सहयोग गरेको बताए । अनुसन्धान टोलीले दोषी ठहर गरेमा रञ्जनमाथि कानुनी कारबाही थालिने उनको भनाइ छ । अडियो बाहिर आउनासाथ एसएचओ रञ्जन निलम्बनमा परिसकेका छन् ।घटनाको अनुसन्धान गर्न उपप्रहरी अधिक्षक (डीसीपी) को नेतृत्वको एउटा विशेष टोलीसमेत गठन गरिएको छ । प्रहरी अधिक्षक झाका अनुसार फरेन्सिक जाँचका लागि मुजफ्फरपुरबाट एउटा टोली आइतबार घटनास्थल पुगेको थियो । त्यसको रिपोर्ट आउन केही दिन लाग्ने उनले बताए । म हिजो (आइतबार) दिनभर घटनास्थलमै थिएँ, उनले कान्तिपुरसँग भने, घटनास्थलको प्रकृति र साक्षीको भनाइअनुसार बालिकाको हत्या भएको देखिन्छ । पोस्टमार्टम नगरिएको र शव जलाइएकाले छानबिन गर्न कठिन भएको छ । छिमेकी र साक्षीसँग बयान लिएर आवश्यक प्रमाण जुटाउने काम भइरहेको छ, अधिक्षक झाले भने, बालिकाको शव जलाउनुअघिका केही तस्बिरसमेत फेला पारेका छौं । जसमा घाँटीमा डामहरू पनि देखिन्छ । बालिकाका बाबुले घटनाकै दिन अभियुक्तविरुद्ध उजुरी दिन खोजे पनि एसएचओ रञ्जनले मानेका थिएनन् । भारतीय सञ्चारमाध्यमका अनुसार अभियुक्तहरूले बालिकाका बाबुलाई बन्धक बनाएर प्रहरीमा रिपोर्ट नगर्न धम्कीसमेत दिएका थिए । त्यहाँबाट जसोतसो फुत्किएर उनी छोरालाई लिएर नेपाल फर्किए । त्यसको दुई दिनपछि अरू आफन्तलाई साथ लाएर उनी फेरि चैनपुर फर्किएका थिए । चम्पारणमा बस्दै आएका नेपाली समुदायले उक्त घटनाको विरोध गरेर मुद्दा दर्ता गर्नुपर्ने भनेपछि आफू त्यहाँबाट आएको किशोरीका बाबुको भनाइ छ । चैनपुर थानामा ११ जनाविरुद्ध फेब्रुअरी २ मा उजुरी दर्ता गराएर उनी नेपाल फर्किएका छन् । विनय साह, दीपककुमार साह, रमेश साह र देवेन्द्रकुमार साहविरुद्ध सामूहिक बलात्कार र हत्याको आरोप लगाइएको छ । घरमालिक साहसहित अन्य ७ जनाविरुद्ध जबर्जस्ती शव जलाएर प्रमाण नष्ट गरेकामा मुद्दा दर्ता गरिएको नवलसिंहले बताए । घटनामा संलग्न घरबेटी सीताराम साह र उनका छोरा दीपकलाई प्रहरीले पक्राउ गरेको छ । अन्य फरार छन् ।बारबर्दिया नगरपालिकाका मेयर दुर्गाबहादुर थारूले जघन्य अपराध गर्ने घरमालिक साहसहित अभियोगीलाई भारतीय कानुनअनुसार फाँसीको सजाय दिन माग गरेका छन् । पीडित परिवारलाई उचित क्षतिपूर्ति दिन परराष्ट्र मन्त्रालयबाट पहल गरिनुपर्ने उनको भनाइ छ । पोस्टमार्टमसमेत नगरी जबर्जस्ती बालिकालाई जलाइएको घटना जघन्य अपराध भएकाले नेपालले भारतीय अधिकारीसँग न्यायका लागि पहल गर्नुपर्ने उनले बताए ।"
पालिकालाई तीन टुक्रा बनाउन प्रस्ताव,"(रुकुम पूर्व)  पुथाउत्तरगंगा गाउँसभामा गाउँपालिका विभाजनसम्बन्धी दुई प्रस्तावमा छलफल भइरहेका बेला तेस्रो प्रस्ताव दर्ता गरिएपछि विवाद भएको छ । पालिकालाई टुक्र्याएर तीनवटा बनाउनुपर्ने भन्दै तेस्रो प्रस्ताव दर्ता भएपछि गाउँसभा भाँडिएको हो ।यसअघि दुईवटा गाउँपालिका बनाउने दुई प्रस्तावमाथि गत माघ १७ गते छलफल भएर टुंगोमा पुग्न लागेको थियो । भौगोलिक दृष्टिले सर्वसाधारणलाई सुविधा नभएकाले हालको गाउँपालिकालाई तीनवटा पालिका बनाउन प्रस्ताव गरियो । हालको केन्द्रलाई नै केन्द्र मान्ने गरी उत्तरगंगा, कोल र जाङको क्षेत्र मिलाएर जामाबगर केन्द्र बनाउने गरी सुनगुफा र हुकाम र मैकोटको केन्द्र गरघाट हुने गरी पुथा गाउँपालिका प्रस्ताव गरिएको छ । गाउँपालिका अध्यक्ष, उपाध्यक्ष र कार्यपालिका सदस्यसमेतको समर्थनमा गाउँपालिका टुक्र्याउने प्रस्ताव गरिएको हो । तेस्रो गाउँपालिका बनाउने प्रस्ताव आएपछि गाउँसभा अनिर्णीत बनेको गाउँपालिका अध्यक्ष ओमप्रकाश घर्ती मगरले बताए । ४५ दिनभित्र विशेष गाउँसभा गर्ने र त्यसैबाट थप गाउँपालिकाको सिफारिस गरिने अध्यक्ष घर्तीले बताए । गाउँपालिका टुक्र्याउनेबारे विवाद बढेपछि आयोग बनाउन छलफल भएको छ । वडा मिलाउने र सीमारेखा पनि अनुकूल हुने गरी सिफारिस गर्न कार्यपालिकाले आयोग बनाउने तयारी गरेको हो । पुथाउत्तरगंगा१२ का वडाध्यक्ष गंगबहादुर पुन मगरले गाउँपालिका भूगोलमा ठूलो भएपछि सबैले सेवा प्रवाहमा असहज महसुस गरेको बताए । असजिलो भएको महसुस जनतादेखि हामी सबैलाई भएको थियो, उनले भने, सकेसम्म पायक र नजिक स्थानीय तह हुनुपर्छ भनेर गाउँपालिका टुक्र्याउन छलफल भएको हो । गाउँसभा माघ १५ गते सुरु भएर १७ गते स्थगित भएको थियो । रुकुम पूर्वका तीन स्थानीय तहमध्ये पुथाउत्तरगंगा सबैभन्दा ठूलो हो । साविकका रन्मामैकोट, हुकाम, जाङ, कोल, राङ्सी र तकसेरा गाविस मिलाएर यो गाउँपालिका बनाइएको थियो । यसमा १४ वडा छन् । जिल्लाबाट पुथा र उत्तरगंगा गाउँपालिका भनेर सिफारिस गरिए पनि माथिबाट एक भएर आएको थियो । पुथा यहाँको अग्लो हिमाल हो भने उत्तरगंगा नदी । माथि उत्तरगंगा नामबाट चिनिने नदी तल आउँदा सानीभेरी र पछि ठूलीभेरी हुँदै भेरी नदीका नाममा प्रख्यात छ ।"
चिडियाखाना सञ्चालन र तलबका लागि १५ करोड माग,"घाटाको बजेटकोषले गत साउनमा यो चालु आर्थिक वर्षका लागि ५८ करोड १७ लाख ३९ हजार ६ सय ३९ रुपैयाँको बजेट ल्याएको थियो । अघिल्लो आर्थिक वर्ष कोषको बजेट ९७ करोड ८० लाख रुपैयाँ थियो । कोषको खातामा २७ करोड ८६ लाख ८३ हजार ३ सय ४३ रुपैयाँ बचत भए पनि तत्कालीन सदस्य सचिव यज्ञनाथ दाहालले घाटाको बजेट ल्याएको भन्दै सञ्चालक समितिका सदस्यले आपत्ति जनाएका थिए । कोषको खातामा भएको रकममध्ये ७ करोड चिडियाखानाले मात्र प्रयोग गर्न मिल्ने रकम हो । कोषमा वन तथा वातावरण मन्त्रालयका सचिव विश्वनाथ ओली, अर्थ मन्त्रालयका सचिव शिशिरकुमार ढुंगाना र पर्यटन मन्त्रालयका सचिव यादव कोइरालासहित चितवनका गिरीराज त्रिपाठी र मीनाकुमारी न्यौपाने, कास्कीका रामराज रेग्मी, सिन्धुपाल्चोकका सरल सहयात्री र शम्भु दंगाल, काठमाडौंकी स्वाती थापा तथा नर्वेका पर वेग र चीनका झु झाहुवा सदस्य छन् । कोषमा विदेशी नागरिकलाई समेत सञ्चालक सदस्य राख्न सकिने व्यवस्था छ । बोर्ड सदस्य विगतमा कोषको अध्यक्षसमेत रहेका वनमन्त्रीहरूले नियुक्त गरेका हुन् । हरेक ६ महिनामा सञ्चालक समितिको बैठक बस्ने व्यवस्था भए पनि ७ महिनादेखि बस्न सकेको छैन । बैठकबाट नै एक्याप व्यवस्थापनको म्याद, तलबलगायतका विषयमा छलफल गरी टुंगो लगाउने साउनमा निर्णय भएको थियो । एक्याप व्यवस्थापन गर्ने जिम्मा कोषलाई सरकारले दिएको म्याद गत माघ ३ गते सकिएको छ । कोषले फेरि पनि ५ वर्षका लागि एक्याप व्यवस्थापनको जिम्मा आफूले नै पाउनुपर्ने जिकिरसहित प्रस्ताव अघि बढाएको छ । उक्त प्रस्ताव छलफलमै छ । गण्डकी प्रदेशले एक्याप आफूअन्तर्गत राखेर व्यवस्थापन गर्ने निर्णय गर्दै त्यहाँबाट जम्मा हुने राजस्व स्थानीय तहमा समेत बाँडफाँट गर्ने र एउटा परिषद् बनाउने प्रस्ताव सरकारसमक्ष पेस गरेको छ । एक्याप गण्डकीका ५ जिल्ला र १५ वटा स्थानीय तहमा फैलिएको छ । एक्यापमा काम गरेका विज्ञहरूले त्यस क्षेत्रको व्यवस्थापनमा स्थानीयलाई प्राथमिकता दिन ध्यानाकर्षण गराएका छन् ।"
