शीर्षक,विवरण
'५ वर्षमा ८८ खर्ब चाहियो',सम्मेलनमा सहभागी हुन आएका म्यानमारका लगानी तथा वैदेशिक आर्थिक सम्बन्धमन्त्री यु थुङ टुनले एसियाले विश्व अर्थतन्त्रको एक तिहाइ हिस्सा ओगट्ने भए पनि आर्थिक वृद्धिदरका हिसाबले दुई तिहाइ हिस्सा ओगट्ने बताए । उनले दक्षिण एसियाली मुलुकले लोभलाग्दो आर्थिक वृद्धिदर हासिल गरेको र म्यानमार पनि लगानीका लागि उपयुक्त गन्तव्य भएको बताए ।
उद्योगमन्त्री असन्तुष्ट,"मन्त्रालयका एक अधिकारीले भने विधेयकमा केही विषय गलत भएकाले त्यसलाई सच्याएर लगिएको उल्लेख गरे । तर यो विषयमा मन्त्री यादव र मन्त्रालयका अधिकारी बोल्न चाहेका छैनन् । लगानी सम्मेलन सकिएपछि कुरा गरौंला भन्ने जवाफ मन्त्रालयका अधिकारीहरूले दिएका छन् । यसअघि उद्योगमन्त्री र कृषिमन्त्रीबीच तरकारी बजारको अनुगमनको विषयमा कार्यक्षेत्र विवाद भएको थियो । विगतमा मन्त्री हुँदा पनि यादवको कार्यशैली विवादमा आएको थियो । त्यसैले उनलाई लगानी सम्मेलनजस्तो काममा मुख्य भूमिका दिँदा केही विवाद आउन सक्नेमा प्रधानमन्त्रीको समूह सतर्क थियो । त्यसैले यादवको विभागसँग जोडिने निकट विषयबाहेक अन्य सबैमा अर्थमन्त्री, प्रधानमन्क्री कार्यालय र लगानी बोर्ड सत्रिय भएका थिए ।"
परीक्षा संयन्त्रमा प्रश्न,"सुरक्षित र व्यवस्थित तरिकाले पठाइएको प्रश्नपत्र बाहिरिनु र परीक्षा नै स्थगित हुनुलाई शिक्षा मन्त्रालयले गम्भीर रूपमा लिएको छ । मन्त्रालयका सचिव खगराज बरालले विज्ञप्ति प्रकाशित गरी परीक्षार्थी र अभिभावकलाई परेको असरप्रति दुःख व्यक्त गरेका छन् । परीक्षामा संलग्न कर्मचारी, केन्द्राध्यक्ष र प्रहरीको मिलेमतोमा प्रश्नपत्र बाहिरिएको अनुमान जानकारहरूले गरेका छन् । बाहिरिएको प्रश्नपत्र फोटोकपी नभई फोटो खिचेको पाइएको हो । फोटोमा प्रश्नपत्र सँगै ब्लेड पनि देखिन्छ । सुरक्षा अधिकारीहरूले ब्लेडले प्याकिङ काटेर प्रश्नपत्र झिकिएको आशंका गरेका छन् । एसईईका लागि ७ वटै प्रदेशले उत्तरपुस्तिका छपाइ र परीक्षा व्यवस्थापनको जिम्मा पाएका थिए । केन्द्रले परीक्षाको सम्पूर्ण जिम्मेवारी नदिँदा प्रदेश २ सहित कतिपय प्रदेश सरकार असन्तुष्ट छन् ।"
बाँकी परीक्षा स्थगित,"मन्त्री पोखरेलले परीक्षा स्थगित हुँदा विद्यार्थीअभिभावकलाई परेको मर्काप्रति मन्त्रालयको ध्यानाकर्षण भएको जनाए । परीक्षाजस्तो संवेदनशील विषयमा प्रश्नपत्र आउट गरेर कानुन उल्लंघन भएको छ, यसको भर्त्सना गर्छु, उनले भने, सरकार शान्तिपूर्ण रूपमा परीक्षा सञ्चालन गर्न प्रतिबद्ध छ । उनले विद्यार्थीलाई आगामी परीक्षाको तयारीमा जुट्नसमेत आग्रह गरे । प्रदेश सरकार, स्थानीय तह, अभिभावक र विद्यार्थीलाई परीक्षाको वातावरण बनाउन उनले अपिल गरे । प्रश्नपत्र आउट गर्नेलाई कारबाही दायरामा ल्याउने प्रतिबद्धतासमेत पोखरेलले जनाए । बाँकी परीक्षाका लागि उच्च सतर्कता अपनाइएको र प्रश्नपत्रहरू सिलबन्दी गरी परीक्षण भइरहेको उनको भनाइ छ ।"
छानबिन गर्न ३ टोली,"उनले प्रदेश २ कै प्रश्नपत्र आउट गरिनु शंकास्पद रहेको बताए । संघीयताविरोधी षड्यन्त्र हो कि ? प्रदेश २ लाई बदनाम गराउने उद्देश्य हो कि ? उनले भने, छानबिनपछि सबै प्रस्ट हुन्छ ।"
विद्यार्थीद्वारा प्रदर्शन,"सन्तोष सिंह (धनुषा), भरत जर्घामगर (सिरहा), ओमप्रकाश ठाकुर (सर्लाही), शिव पुरी (रौतहट), लक्ष्मी साह (बारा) र शंकर आचार्य (पर्सा) को सहयोगमा"
धराप घरलाई मापदण्ड खुकुलो,"सुरक्षा प्रमुख सर्त सहरी विकासविद् सागाछें काठमाडौं महानगरपालिकाले लागू गरेको भवन निर्माण मापदण्ड धेरै कमजोर रहेको बताउँछन् । उनका अनुसार भवनको फार बढाउनु भनेको महानगरमा दोब्बर जनसंख्या बढाउनु हो । महानगर सुरक्षित हुँदैन भने राजस्व उठाएर मात्रै के काम ? मापदण्डविपरीत जथाभावी तला थपेकाहरूको आवाज सम्बोधन गर्ने नाममा लचिलो मापदण्ड अपनाउनु गलत हो, उनले भने, यसले महानगरको सुरक्षामा चुनौती थपिएको छ । २०६४ को मापदण्डअनुसार गोरेटो बाटोमा पनि घर बनाउन पाइन्थ्यो । माटो परीक्षण जरुरी थिएन । त्यो मापदण्ड पनि महानगरवासी र महानगरले पालना गरेका थिएनन् । तर, २०७२ मा भूकम्प गएपछि मापदण्डबिना घर बनाउन नपाउने, नक्सा पास अनिवार्य गर्ने नियम बन्यो । सरकारको मापदण्डअनुसार भवन बनाउँदा कम्तीमा ६ मिटर सडक छोड्नैपर्छ । ३ तलाभन्दा अग्लो घर बनाउन अनिवार्य माटो परीक्षण गर्नुपर्छ । त्यसलाई उल्टाएर लचिलो मापदण्ड लागू गर्नु भनेको विनाशलाई बेवास्ता गर्नु रहेको सागाछें बताउँछन् ।"
डाक्टर श्रीमान्बाट कुटिएकी सुनीताको मृत्यु,बिरामी नहुँदा पनि डायादव अस्पतालमा बसिरहेको गुनासो आएपछि आफूले नारायणी अस्पतालका निमित्त मेडिकल सुपरिटेन्डेन्टलाई क्रसचेक गर्न सक्ने पनि एसपी ढकालले बताए ।
माछा गायब,जीवनका लागि नदीको व्यवस्थापन नारा दिइएको सम्मेलनको बिहीबार कर्णाली प्रदेशका मुख्यमन्त्री महेन्द्रबहादुर शाहीले उद्घाटन गरेका थिए । ४ दिनसम्म चल्ने सम्मेलनमा नेपालको स्वतन्त्र बहाव भएका नदीहरूलाई कसरी दिगो व्यवस्थापन गर्न सकिन्छ भन्नेबारे छलफल भइरहेको छ ।
ट्याक्सी चालकले बेहोस यात्रुलाई सडकमा ओरालिदिएपछि,"सरोजको स्टाटसमा प्रतिक्रिया जनाउने अधिकांशले यो घटनालाई समाजमा हराउँदै गएको मानवीयतासँग जोडेर हेरेका छन् । धेरैले ट्याक्सी चालकको लापरबाहीले बिरामीको ज्यान गएको लेखेका छन् । सुवास अधिकारीले लेखेका छन, कस्तो नरमाइलो लाग्यो । समाजमा मानवीयता हरायो ।"
समायोजनपछि सेवाग्राहीलाई सास्ती,"त्यसैले कर्मचारीले सबै कुरा ध्यान दिएर विधि र प्रक्रिया हेर्नुपर्छ । एक त थोरै त्यसमाथि नयाँ कर्मचारी छन् त्यसैले समय लाग्ने गरेको छ, रेग्मीले भने । पहिला एकदुई दिनभित्रै पूरा हुने गरेको कामका लागि अहिले तीनदेखि १० दिनसम्म लाग्ने गरेको सेवा लिन आउनेहरूको अनुभव छ । भएका कर्मचारीहरू गएपछि नयाँ कर्मचारी कहिले आउने ठेगान छैन ।"
खोला सफा गर्दै विदेशी,"बसपार्क क्षेत्रबाट बढी फोहोर उत्पादन हुने भएकाले त्यहाँ नगरपालिकाले कर्मचारी खटाउनुपर्ने रेडक्रस सभापति अशोक श्रेष्ठ बताउँछन् । फोहोरको मुहान पत्ता लगाउनुपर्छ, स्थानीयले त जनचेतना जगाएपछि स्वत सफा राख्नुपर्छ भन्नेमा जान्छन्, फोहोर राख्न डस्टबिनको समेत कमी छ, उनले भने । कारागार नजिकसम्मको करिब ४ किमि क्षेत्रमा फोहोर फाले सामाजिक बहिस्कार र दण्डजरिवानाको व्यवस्था हुनुपर्ने स्थानीय माधव देवकोटाले जिकिर गरे । सार्वजनिक शौचालय अभावमा खोलामै शौच गर्न जाने भएकाले त्यतातर्फ समेत नगरपालिकाको ध्यान जान जरुरी भएको उनको भनाइ छ ।"
प्राधिकरणका करोडौंका भवन भत्कँदै,"२०३० तिर बनेका यी भवनमा कुलेखानीको निर्माणकालमा प्राधिकरणका कर्मचारी बसेका थिए । आयोजनाको निर्माण सकेपछि भवनहरू खाली हुनुको साथै बेवारिसे भएका हुन् । भवनहरू भत्कन थालिसके तर पनि प्राधिकरणलाई कुनै चासो छैन, स्थानीय सीताराम रेग्मीले भने, होटल व्यवसाय सञ्चालन गर्न प्राधिकरणले यी भवन बहालमा दिए संरक्षण हुनुका साथै आन्तरिक एवं बाह्य पर्यटक आवागमन बढ्ने थियो । होटल व्यवसायका लागि यी भवनहरू उपयुक्त छन् । करिब ४ बिघामा निर्माण गरिएका यी भवन मर्मतसम्भारका साथै उचित व्यवस्थापन नगरे केही वर्षभित्रमा भत्केर प्रयोग गर्न नसक्ने अवस्थामा पुग्नेछन् । इन्द्रसरोवरको काखमा रहेका भवनहरू गाउँपालिका अर्थात् स्थानीय व्यवसायीलाई भाडामा उपलब्ध गराएको भए पनि यस क्षेत्र गुल्जार हुने थियो, स्थानीय झम्क बलामीले भने ।"
नियम टेर्दैनन् जनप्रतिनिधि,सरकारले २ महिनाअघि १ करोडभन्दा कम लागतका योजनामा डोजर लगाउन नपाउने गरी व्यवस्था गरेको थियो । यदि त्यस्ता योजनामा डोजर लगाउनै परिस्थिति आइपरे प्राविधिकको प्रतिवेदनका आधारमा लगाउने व्यवस्था सरकारले जारी गरेको निर्देशिकामा उल्लेख छ । तर जिल्लामा निर्देशिका उल्लंघन जनप्रतिनिधिबाटै भइरहेको छ ।
ढोकाको ठाउँमा झ्याल,"ठेकेदारले मन्दिर निर्माण पूरा गर्न ढिलाइ गरेका छन् । २०७४ मै निर्माण सम्पन्न गर्ने गरी ठेक्काको जिम्मा पाएको थियो । तर निर्माण सम्पन्न गर्ने अवधि १ वर्ष नाघ्दा आधा काम पनि भएको छैन । ३ तलामध्ये पहिलो तलाको काम भएको छैन । काठ पनि कम गुणस्तरको ल्याइएको गुठियारको गुनासो छ । यहाँ किनिएका १२ थाममध्ये ७ वटामा प्वालैप्वाल छन् । स्थानीय सिकर्मी सत्यनारायण महर्जर्नका अनुसार गाभा (बीच भागमा प्वाल नभएको) र सेन्टर भएको काठ (बीचमा प्वाल भएको) गरी दुई किसिमका थाम हुन्छन् । गाभा महँगो पर्ने भएकाले अधिकांश सस्तो सेन्टर भएको काठ प्रयोग गरिएको छ । हामी यस्तो काठ प्रयोग नगर्न अनुरोध गर्छौं, उनले भने, अटेर गरे कडा रूपमा प्रस्तुत हुन्छौं । उनका अनुसार थाममा सबैभन्दा बलियो चुकुलको भाग हुनुपर्छ । तर, यहाँ ल्याइएका प्रायः थामका चुकुल बिग्रेकाले मोबिकलले टाँसेर राखिएको छ । त्यसमाथि सबै नयाँ काठ छन् । पानीले छोए चाँडै बिग्रिने मात्र नभई फुस्कने समस्या पनि हुने बताए ।"
अधिकारकर्मीले नै न्याय नपाएको गुनासो,प्रहरी निरीक्षक प्रकाशराज शर्मासहित ४ जनाको टोलीले चलाएको गोली परियारलाई लागेको पहिचान भएको थियो । आयोगले दोषीलाई फौजदारी अभियोगमा मुद्दा चलाई जेल चलान गर्न सिफारिस गरे पनि कार्यान्वयन भएको छैन । आयोगका प्रथम सहिद फरियारको १३ औँ वार्षिक स्मृति दिवसमा शुक्रबार आयोजित कार्यत्रममा परिवारले १३ वर्ष बितिसक्दा पनि न्याय नपाएको गुनासो गरे । आयोगको सिफारिस कार्यान्वयन नगरेर सरकारले दण्डहीनतालाई प्रश्रय दिएको उनीहरूको भनाइ थियो । कार्यक्रममा आयोग अध्यक्ष अनुपराज शर्मालगायतले परियारप्रति श्रद्धाञ्जली व्यक्त गरेका थिए । उनको नाममा स्थापित १ लाख रुपैयाँ राशिको दयाराम परियार स्मृति मानव अधिकार सम्मान पुरस्कार हरेक वर्ष जेठ १३ मा प्रदान गरिन्छ ।
लगानी सम्मेलनको अर्थराजनीति,"शंकरप्रसाद कोइरालालेखक पूर्व अर्थ, उद्योग, वाणिज्य तथा आपूर्तिमन्त्री हुन् ।"
कमल थापाको आन्दोलन,"अब भन्नोस्, आफ्ना दुवै माग हिन्दु धर्मको स्थापना र राजतन्त्रको पुनरागमन यसरी सत्तापक्ष र प्रतिपक्षद्वारा बलजफ्ती अपहरित भएको अवस्थामा राष्ट्रिय प्रजातन्त्र पार्टीका आन्दोलनकारी नेता विचरा कमल थापाले कसरी आन्दोलन अघि बढाउन सक्छन् त ? यो असम्भव छ ।"
साधारण तर चिन्तनीय,"चैत १३ गते प्रकाशित स्नेह सायमिको आई लभ यु, आई डोन्ट लभ यु पढेंँ । साधारण विषय भए पनि लेखकले उठाएको कुरा गम्भीर चिन्ताको विषय हो । हिजोका बाआमा र सन्तान तथा आजका बाआमा र सन्तानको सम्बन्धमा जमिनआसमानको फरक छ । हिजोका बाआमा मनैदेखि सन्तानलाई माया गर्थे । तिनले आई लभ यु भन्नुको केही अर्थ थिएन । सन्तानले पनि बाआमालाई त्यस्तै आदर गर्थे । यही हाम्रो संस्कृतिको पहिचान थियो । हुन त आज पनि बाआमालाई सन्तानले आदर नगर्ने होइन, गर्छन् । सन्तानले त्यसमा औपचारिकता बढी खोज्छन् । आज सबै काम औपचारिकतामा गरिन्छ । सन्तानको इच्छाले गर्दा बाआमा पनि औपचारिकता निर्वाह गर्न बाध्य छन् । आई लभ यु भनिरहनु हाम्रो संस्कृतिको अवमूल्यन गर्नु हो । यही विचलनले केटाकेटी ठूलो भएपछि बाआमाप्रति पूर्णतः औपचारिक बनेका छन् । वृद्धवृद्धालाई समय दिनु वा तिनको स्याहार गर्नु समय खेर फालेको रूपमा बुझ्छन् । डा शिवशंकर यादव, छपकैया, वीरगन्ज"
