"शीर्षक","विवरण"
"""जलाउन घाटमा पुर्याएको शव प्रहरी नियन्त्रणमा","श्रीमानसहित ३ जना पक्राउ"",""मलंगवा : सर्लाहीको रामनगर गाउँपालिकामा जलाउन घाटमा पुर्याएको एक महिलाको शवलाई बुधबार दिउँसो प्रहरीले नियन्त्रणमा लिएको छ । रामनगर गाउँपालिका वडा नं १ खैर्वाका सुनिल साहकी २१ वर्षीया श्रीमती मनिषा साहको शवलाई प्रहरीले जलाउन घाटमा पुर्याएको अवस्थामा प्रहरीले नियन्त्रणमा लिएको छ । जलाउनका लागि खोलामा लगिसकेको अवस्थामा शवलाई नियन्त्रणमा लिइएको प्रहरीले जनाएको छ । घटना संकास्पद लागेपछि शवलाई नियन्त्रणमा लिइएको जिल्ला प्रहरी कार्यालय सर्लाहीका प्रवक्ता प्रहरी नायव उपरीक्षक दिपेन्द्र पंजियारले जानकारी दिए । मनिषाको श्रीमान सुनिल साह, ससुरा रामेश्वर साह र देवर रामबाबु साहलाई नियन्त्रणमा लिएको प्रहरी उपरीक्षक नरेश राज सुबेदीले जानकारी दिए । घाँटीमा निलडाम जस्तो देखिएको छ । घटनाबारे अनुसन्धान भइरहेको छ, प्रहरी उपरीक्षक सुबेदीले भने, थप कुराहरु पोष्टमार्टम रिपोर्टमा थाहा हुन्छ । मनिषाको शव पोष्टमार्टमका लागि प्रादेशिक अस्पताल मलंगवामा राखिएको छ ।"""
"अन्नपूर्णकर्मी आचार्य सम्मानित","बर्दिया : ४४औं विश्व पर्यटन दिवसको अवसरमा बर्दियाका अन्नपूर्ण संवाददाता यादव आचार्य सम्मानित भएका छन् । ठाकुरबाबा नगरपालिकाले सम्पादन गरेका विभिन्न कार्यहरूको जानकारी आम समुदायमा सम्प्रेषण तथा प्रकृति, कला र संस्कृतिको संरक्षण र प्रबद्र्धनमा योगदान पुर्याएको उच्च मूल्यांकन गर्दै आचार्यलाई सम्मान पत्रसहित सम्मान गरिएको छ । नेपाल पत्रकार महासंघ बर्दियाका अध्यक्षसमेत रहेका आचार्य अन्नपूर्ण पोस्ट्सँगै एपीवान टेलिभिजनमा बर्दियाबाट संवाददाताका रूपमा कार्यरत छन् । उनी जैविक विविधता संरक्षण, मानव वन्यजन्तु द्वन्द्व न्यूनीकरण, पर्यापर्यटन प्रबद्र्धनका सबालमा समेत कलम चलाउँदै आएका छन् । आचार्यसँगै पर्यटन दिवसका अवसरमा उज्यालोकर्मी भावुक योगी, कान्तिपुरकर्मी कमल पन्थी, न्युज २४ कर्मी ज्योति पन्थी, नेपाल टेलिभिजनकर्मी डिलप्रकाश गौतमलाई सम्मान गरिएको छ ।"
"बर्दियामा थारू नृत्य","गुलरिया : पर्यटकीयस्थल बर्दिया राष्ट्रिय निकुञ्ज नजिक ठाकुरबाबा मन्दिर प्रांगणमा ४४औं विश्व पर्यटन दिवस मनाइरहँदा राष्ट्रिय थारू नृत्यांगना छमछमी नाच्दै सहभागीलाई लोभ्याइन् । लुम्बिनी प्रदेश सरकारको प्रवद्र्धन तथा ठाकुरबाबा नगरपालिकाद्वारा आयोजित सभामा प्रदर्शन गरिएका थारू सांस्कृतिक झाँकीसँगै थुप्रै नृत्यले सहभागीलाई मन्त्रमुग्ध पारे । लुम्बिनी प्रदेशका मुख्यमन्त्री डिल्लीबहादुर चौधरीले थारू नृत्य पर्यटकीय होटलका प्याकेजमा राख्न सुझाव दिएका छन् । उनले युवालाई पर्यटन व्यवसायमा जोड्नुपर्ने बताए । कार्यक्रमका प्रमुख अतिथि चौधरीले गरिब किसान, मुक्तकमैया, महिलालगायत युवा वर्गलाई पर्यटन व्यवसायमा जोड्ने प्रदेशको नीति रहेको प्रस्ट्याउँदै उनीहरूलाई पर्यटन व्यवसायमा जोड्न सकेमात्र बेरोजगारी घट्ने दाबी गरे । यो हाम्रो प्रदेशको नीति पनि हो, उनले भने, गत वर्ष बर्दियामा २४ हजार पर्यटकले अवलोकन गरे पनि अब एक लाख पर्यटक भित्र्याउने प्रदेश सरकारको रणनीति छ । उनले भारतीय राजदूतसँग रूपैडिहा र गड्डाचौकी नाकाबाट पर्यटक भित्र्याउन छलफल भएको बताए । उनले स्थानीय कलाकार तयार भइसकेकोले होटल व्यवसायीलाई स्थानीय सांस्कृतिक नृत्यहरू प्याकेजमा राख्न सुझाए ।"
"माओवादी केन्द्रका सुदूरपश्चिम प्रदेश समिति उपाध्यक्ष बडुवालको निधन","काठमाडौं : नेकपा माओवादी केन्द्रका सुदूरपश्चिम प्रदेश समिति उपाध्यक्ष कृष्ण बडुवालको निधन भएको छ । उपचारका क्रममा उनको बुधबार राति निधन भएको हो । माओवादी केन्द्रको तीन महिने रुपान्तरण अभियानमा डोटी खटिएका बडुवालको स्वासप्रश्वासमा समस्या आएपछि लम्की अस्पतालहुँदै नेपालगन्ज लगिएको थियो । हाँ उपचार सम्भव नभएपछि भारतको लखनौं लैजाने क्रममा बाटोमै निधन भएको पारिवारिक स्रोतले जनाएको छ ।"
"""नवलपरासीमा कुष्ठरोग र क्षयरोगका बिरामी बढ्दै","नियन्त्रणमा चुनौती"",""परासी : नवलपरासीमा कुष्ठरोग र क्षयरोगका बिरामीको संख्या बढ्दै गएको छ । नेपालमा कुष्ठरोग निवारण घोषणा भएको एक दशकबढी भइसकेको छ । सरकारले सन् २०५० सम्म क्षयरोग निवारण घोषणको लक्ष्य लिएर क्षयरोग मुक्त नेपाल घोषणा अभियान कार्यक्रमलाई अगाडि बढाएको छ । तर, नवलपरासीमा भने कुष्ठरोग र क्षयरोगका बिरामीको संख्या बढ्दै गएको छ । केही पालिकाहरूले यी रोग पहिचानका लागि बजेट नछुट्टाउँदा रोगीको संख्या यकिन गर्न समेत समस्या भएको पालिकास्तरका स्वास्थ्य शाखाहरुले जनाएका छन् । गत आर्थिक वर्ष २०७९०८० मा ७० जना नयाँ कुष्ठरोगका बिरामी भेटिएका छन् । पहिचान हुन नसकेका अझै धेरै बिरामी रहेको अनुमान गरिएको स्वास्थ्य कार्यालयका तथ्याङ्क अधिकृत बजरंगी चौधरीले बताए । गत वर्ष केही पालिकामा बजेट अभावमा रोग पहिचानको काम प्रभावकारी नहुँदा अघिल्लो वर्षको तुलनामा संख्या कम देखिएपनि कुष्ठरोगका बिरामी बढ्दै गएको चौधरीले बताए । अघिल्लो आर्थिक वर्ष २०७७०७८ मा ७७ जना कुष्ठरोगका बिरामी भेटिएका थिए । सबैभन्दा बढी बर्दघाटमा १७ जना नयाँ कुष्ठरोगका बिरामी भेटिएका थिए । त्यहाँ अघिल्लो आर्थिक वर्षमा जम्मा ६ जना मात्र कुष्ठरोगका बिरामी भेटिएकोमा गत आर्थिक वर्षमा यो संख्या ह्वात्तै बढेको हो । यसैगरी सुनवलमा १५, रामग्राममा ११, पाल्हीनन्दन र सरावलमा १०१०, सुस्तामा ५ र प्रतापपुरमा २ जना नयाँ कुष्ठरोगका बिरामी भेटिएका छन् । १४ वर्ष मुनिका एक जना बालकमा पनि कुष्ठरोग देखिएको स्वास्थ्य कार्यालयले जनाएको छ । कुष्ठरोग पहिचानका लागि स्थानीय तहबाट प्रभावकारी रूपमा अझै पनि काम हुन नसकेको सरोकारवालाहरूको भनाइ छ । प्रभावकारी कार्यक्रम बनाएर स्थानीय तहले अभियानको रूपमा कुष्ठरोग पहिचानको काम गर्नुपर्नेमा स्वास्थ्य कार्यालयका प्रमुख ओमप्रकाश पन्थीले बताए । कुष्ठरोग भएको थाहा पाउँदा पाउँदै पनि उपचारमा नआउनेको संख्या धेरै भएकाले पालिकास्तरमा जनचेतनाका कार्यक्रम सञ्चालन गर्नुपर्ने उनले बताए । गाउँमा कुष्ठरोग भएको थाहा पाएपछि सम्झाइ बुझाइ गर्दा समेत उपचारका लागि कोही जान मान्दैनन्,किन जानु उपचार गर्न ? भन्ने धेरै छन् ,'बर्दघाट नगरपालिकाका स्वास्थ्य शाखा प्रमुख माधव ज्ञवालीले भने । पछिल्लो पटक पहिचान गरी उपचारको दायरामा ल्याउनु नै मुख्य चुनौति भएको स्वास्थ्यकर्मीहरुले बताएका छन् । बारा जिल्लापछि सबैभन्दा बढी नवलपरासीमा कुष्ठरोगका बिरामी भेटिएको स्वास्थ्य कार्यालय प्रमुख पन्थीले बताए । विश्व स्वास्थ्य संगठन (डब्लूएचओ) ले सन् २०१० मा नेपाललाई कुष्ठरोग निवारण भएको घोषणा गरेको थियो । निवारण घोषणा भएसँगै नेपालमा कुष्ठरोगीको संख्यामा कम हुने, कुष्ठ प्रभावित व्यक्तिले नियमित उपचार सेवा पाउने सबैको विश्वास भएपनि त्यसो हुन नसक्दा रोगका बिरामीको संख्या बढ्दै गएको स्वास्थ्यकर्मीले बताएका छन् । क्षयरोगी पनि बढ्दै कुष्ठरोगसँगै नवलपरासीमा क्षयरोग पनि गम्भीर स्वास्थ्य समस्याको रूपमा देखिएको छ । क्षयरोगको पहिचान र निवारणका कार्यक्रम प्रभावकारी काम हुन नसक्दा अहिले क्षयरोगका बिरामीको संख्या बढ्दै गएको हो । स्वास्थ्य कार्यालयले दिएको जानकारीअनुसार हाल जिल्लामा ४७० जना क्षयरोगका बिरामी छन् । गत आर्थिक वर्षमा १९ जना क्षयरोगका बिरामीको मृत्यु भएको छ । गतवर्ष सुस्ता, पाल्हीनन्दन र प्रतापपुरमा क्षयरोगका बिरामी पत्ता लगाउन शिविर नै सञ्चालन गरिएको थियो । क्षयरोगका बिरामीहरु पनि समयमै अस्पताल नआउने र अन्तिम समयमा मात्रै अस्पताल आउने गरेका कारण कतिपयको रोग निधानमा समस्या हुने गरेको स्वास्थ्य कार्यालयले जनाएको छ । सरकारले सन् २०५० सम्ममा क्षयरोग निवारण घोषणको लक्ष्य लिएर क्षयरोग मुक्त नेपाल घोषणा अभियान कार्यक्रमलाई अगाडि बढाएको छ ।"""
