"शीर्षक","विवरण"
"भारतको 'चन्द्रयान३' चन्द्रमामा सफलतापूर्वक अवतरण","काठमाडौं : भारतले पठाएको चन्द्रयान३ चन्द्रमामा सफलतापूर्वक अवतरण गर्न सफल भएको छ । भारतले १४ जुलाईमा पठाएको चन्द्रयान३ बुधबार चन्द्रमाको दक्षिणी ध्रुवमा सफलतापूर्वक अवतरण गरेको हो । यससँगै चन्द्रमाको दक्षिण ध्रुवमा अवतरण गराउने भारत पहिलो देश पनि बनेको छ । इसरोका अनुसार चन्द्रयान३ ले दक्षिणी ध्रुवमा अनुसन्धान गर्नेछ । भारतीय प्रधानमन्त्री नरेन्द्र मोदीले सफल अवतरण गराउने इसरोका वैज्ञानिकहरूलाई धन्यवाद दिए । उनले यससँगै भारतको कथन बदलेको बताए । 'यो कथनमा मात्र सीमित रहेन । भारत रियालिटीमा परिणत गरेर देखाएको छ । भारतको लागि अब चन्द्रमा टाँढा रहेन,' सम्बोधन गर्दै उनले भने ।"
"नवलपरासीमा तस्करबाट प्रहरी नै असुरक्षित","परासी : भारतसँग सीमाना जोडिएको नवलपरासीका सीमा क्षेत्रका प्रहरी चौकीका इन्चार्जले आफूहरू तस्करबाटै असुरक्षित भएको गुनासो गरेका छन् । जिल्लाको भूजहवा, बसैया, झोलनीपुर, विस्नुपुरा, पाचपेंडायालगायतका नाका तस्करीको ट्रान्जिट प्वाइन्टका रुपमा चिनिँदै आएका छन् । त्यस नाकाबाट हुने चोरी निकासी नियन्त्रणका क्रममा तस्करहरूले केही इन्चार्जहरूलाई धम्की दिने गरेको बताइएको छ । प्रहरीकै मिलमतोमा नाकाबाट अवैध सामान भित्रिने गरेको आरोप लाग्दै आएको छ । नयाँ सरुवा भएर जाने इन्चार्जलाई तस्करहरूले सुरुमा तस्करीको सामान ल्याएबापत मासिक रकम दिनेबारे मोल तोल गर्ने गर्छन् । मोलतोल मिले प्रहरी साठगाँठमा अवैध कारोबार हुने गरेको छ । मोलतोल नमिले वा केही प्रहरी प्रलोभनमा नपरी कडाई गरेमा तस्करहरूले धम्की दिने गरेको पाइएको हो । पहिलेदेखि अवैध काम गर्दै आएका केही व्यक्तिले मिलेर काम गर्न पर्यो भन्दै थिए । मैले हुँदैन भने त्यसपछि बाहिर हिँड्दा जे पनि गरिदिन्छौं भन्दै धम्की आउन थालेको छ, एक प्रहरी चौकीका इन्चार्ज भने । धम्की आएपछि अहिले आफू बाहिर जाँदा दुई तीन जना जवान लिएर हिँड्ने गरेको उनले बताए । ट्रान्जिट प्वाइन्टका रूपमा चिनिँदै आएका नाकाका केही घरमा अवैध सामान राख्नका लागि गोदाम बनाइएको प्रहरीहरु नै बताउँछन् । कहिले काही प्रहरीले गोदाममा छापा मार्ने गरेको छ । अधिकांश दिनमा भने सोही गोदामबाट अवैध सामान जाने गरेको स्थानीयको भनाइ छ । अहिले पनि केही नाकामा राखेका गोदाममा छापा मारे अवैध सामान बरामद हुने एक इन्चार्जले बताएका छन् । छापा मार्न जाँदा ठूलै टोली लिएर जानु पर्ने ती इन्चार्जले बताए । सीमा क्षेत्रमा अवैध सामान पक्राउ गर्ने र गोदाममा छापा मार्दा यसअघि तस्कर र प्रहरीबीच नै झडपका घटना हुँदै आएका छन् । पछिल्लो पटक नाकाबाट ठूलो परिणाममा अवैध सामान नआएपनि मोटर साइकल र साइकलहरुबाट कपडा, चामल, केराउलगायतका सामान भित्रिने गरेका छन् । तस्करबाट आउने धम्कीबारे जिल्ला प्रहरी कार्यालयका प्रहरी उपरीक्षक काजी कुमार आचार्यले सीमाका इन्चार्जले त्यसबारे जानकारी नगराएको बताए । सीमा क्षेत्र संवेदनशील क्षेत्र हो । सोहीअनुरुप प्रहरी परिचालन हुने गरेको छ । अवैध कारोबार गर्ने व्यक्तिहरूले काम गर्ने क्रममा केही अप्ठ्यारो पार्न सक्छन् । हामी त्यस व्यक्तिहरूबाट सजग छौं, उनले भने । जिल्लाका ७ स्थानमा सीमा चौकी छन् ।"
"""नेपालको पूर्वाधार विकासमा साउदीको चासो","मन्त्री ज्वालासँग छलफल"",""काठमाडौं : भौतिक पूर्वाधार तथा यातायातमन्त्री प्रकाश ज्वाला र नेपालका लागि साउदी अरबका राजदूत साद नासिर अब्दुल्लाह अबु हमिदबीच पूर्वाधार विकास र आयोजना साझेदारीका विषयमा छलफल भएको छ । बुधबार भएको भेटवार्तामा मन्त्री ज्वालाले साउदी अरब रोजगारीको गन्तव्य भएको बताउँदै अब भौतिक पूर्वाधार र यातायातका क्षेत्रमा पनि साझेदारी गर्नुपर्ने बताए । 'साउदीमा नेपालीको श्रमले ठूलो भौतिक विकास भएको छ । त्यहाँको स्रोत, साधन र प्रविधि नेपालको भौतिक विकासमा आवश्यक छ,' मन्त्री ज्वालाले भने, 'साउदी अरबमा करिब चार लाख नेपाली कामदारले श्रम गरिरहेका छन् । उनीहरूले पनि केही दक्षता पाएकै छन्, त्यो दक्षता भौतिक विकासमा लगाउन हामी तयार छौं । त्यसका लागि साउदी सरकारको सहयोग हामीलाई आवश्यक छ ।' साउदी सरकारले साउदी विकास कोषमार्फत् नेपालको भौतिक पूर्वाधारको विकासमा सहयोग गरेको भन्दै मन्त्री ज्वालाले विकास परियोजना बढाउन आग्रह गरे । 'नेपाल सन् २०२६ मा अतिकम विकसित मुलुकबाट विकसित मुलुकमा स्तरोन्नति हुँदैछ । त्यसका लागि विकासलाई तीव्रता र दिगोपना सुनिश्चित गर्न पूर्वाधार क्षेत्रमा थप लगानी र सहायता आवश्यक छ,' उनले भने । साउदी राजदूत हमिदले नेपालको पूर्वाधार तथा यातायातका क्षेत्रमा सहकार्य गर्न आफूहरू तयार रहेको बताए । 'पूर्वाधार विकासमा साझेदारी गर्न हाम्रो देश तयार छ, तर त्यसका लागि ठोस प्रस्ताव नेपाल सरकारले दिनुपर्यो,' राजदूत हमिदले भने । साउदी अरेबियाले वर्ल्ड एक्पो, २०३० आयोजना गर्नका लागि उम्मेदवारी दिएको छ । साउदीसँगै दक्षिण कोरिया र इटालीले पनि आयोजनाका लागि उम्मेदवारी दिएका छन् । तर नेपालले साउदी अरबलाई सहयोग गर्ने निर्णय गरिसकेको मन्त्री ज्वालाले बताए ।"""
"कोसी प्रदेश : विश्वासको मतविरुद्धको रिटमा बिहीबारका लागि पेसी तोकियो","विराटनगर : कोसी प्रदेशका मुख्यमन्त्री उद्धव थापाले संविधान अनुसार विश्वासको मत प्राप्त नगरेको भन्दै सर्वोच्च अदालतमा बुधबार रिट दायर भएको छ । थापाले असंवैधानिक तरिकाले लिएको विश्वासको मत लिएको भन्दै त्यसविरुद्ध नेकपा (एमाले) ले कोसी प्रदेश संसदीय दलका नेता एवं पूर्वमुख्यन्त्री हिक्मतकुमार कार्कीले परमादेशको माग गर्दै रिट दर्ता गराएका हुन् । रिटको पेसी बिहीबार (भोलि)का लागि तोकिएको छ । सर्वोच्च अदालतका प्रवक्ता विमल पौडेलले रिटको सुनुवाइका लागि बिहीबारलाई पेसी तोकिएको जानकारी दिए । रिटमा प्रदेश प्रमुख पर्शुराम खापुङ, मुख्यमन्त्री थापा, सभाध्यक्ष भएर सभामुखको भूमिका निर्वाह गरेका अध्यक्ष मण्डलका सदस्य इस्राइल मन्सुरी, अध्यक्ष मण्डलकी सदस्य एवं प्रदेशसभा सदस्य गीता तिमल्सिना र कोसी प्रदेशसभा सचिवालयलाई विपक्षी बनाइएको छ । कार्कीले मुख्यमन्त्री थापाले प्राप्त गरेको विश्वासको मत शून्य सरह रहेको भन्दै त्यसलाई बदर गरी ठूलो दलको नेताको हैसियतमा आफूलाई मुख्यमन्त्री नियुक्तिका लागि उत्प्रेषणमुक्त परमादेशको माग पनि रिटमार्फत गरेका छन् । कार्कीले संविधानको धारा १६८ को उपधारा ३ बमोजिम आफूलाई मुख्यमन्त्री नियुक्तिका लागि परमादेश दिन माग गरेका हुन् । उक्त उपधारामा प्रदेशसभाको सबैभन्दा ठूलो दलको नेतालाई प्रदेश प्रमुखले मुख्यमन्त्री नियुक्त गर्ने व्यवस्था छ । वर्तमान सरकारले कानुनी र संवैधानिक रुपमा विश्वासको मत प्राप्त नगरेको दाबी कार्कीको छ । उनले मुख्यमन्त्रीले विश्वासको मत पाउनै नसक्ने जिकिर पनि गरेका छन् । रिटमा भनिएको छ, २०८० साउन ११ गतेको सर्वोच्चको आदेश बमोजिम संविधानको धारा १६८ को उपधारा २ बमोजिम प्रत्यर्थी (उद्धव थापा) साउन १६ गते मुख्यमन्त्री नियुक्त हुनुभएको हो । तर, उल्लेखित आधारमा निजले विश्वासको मत प्राप्त नगरेको र एकपटक विश्वासको मत प्राप्त गर्न नसकेको मुख्यमन्त्रीले पटकपटक सो अवसर प्राप्त गर्न नसक्ने तथा दलीय संरचनाका आधारमा समेत निजले विश्वासको मत प्राप्त गर्ने सम्भावना नै छैन । सभामुख बाबुराम गौतमसहितको हस्ताक्षरका आधारमा नेपाली कांग्रेस प्रदेश संसदीय दलका नेतासमेत रहेका थापा असार २१ गते मुख्यमन्त्री नियुक्त भएका थिए । सर्वोच्च अदालतले साउन ११ गते उनको नियुक्ति बदर गर्दै संविधानको धारा १६८ को उपधारा २ अनुसार पुनः सरकार गठन गर्न आदेश दिएको थियो । सरकार गठनमा सभामुख सहभागी हुन नपाउने व्याख्या पनि सर्वोच्चले गरेको छ । सर्वोच्चको आदेशपछि सभामुखलाई राजीनामा गराएर आफूलाई समर्थन गर्न लगाउँदै थापा पुनः साउन १६ गते मुख्यमन्त्री नियुक्त भए । सोमबार भने प्रदेशसभाबाट सभामुखसमेतलाई प्रयोग गरेर विश्वासको मत लिएका हुन् । प्रदेशसभा बैठक आह्वान गरेर बिरामी परेको भन्दै उपसभामुख सिर्जना दनुवार काठमाडौं लागेपछि अध्यक्ष मण्डलका सदस्य एवं काँग्रेसका प्रदेशसभा सदस्य इस्राइल मन्सुरीले सभाको अध्यक्षता गरेका थिए । मुख्यमन्त्रीको विश्वासको मतसम्बन्धी प्रस्तावमा मत विभाजनपछि दिएको मत सच्याउने समयमा सभाध्यक्षको आसनमा नेकपा (माओवादी केन्द्र)की प्रदेशसभा सदस्य गीता तिम्सिनालाई बोलाउँदै मन्सुरी मतदान प्रक्रियामा सहभागी भएका हुन् । उनकै मतका आधारमा मुख्यमन्त्री थापाले ४७ मत पाएका थिए । विपक्षमा ३० मत परेको थियो । सभामुखले पक्ष वा विपक्षमा मतदान गर्न नपाउने संवैधानिक व्यवस्था छ । मत बराबरी भएको अवस्थामा भने निर्णायक मत दिन पाउँछन् । सभाध्यक्षको मत प्रयोग गर्नु गैरकानुनी रहेको दाबी रिटमा गरिएको छ । पूर्वमुख्यमन्त्री कार्कीले रिटमार्फत् मुख्यमन्त्री उद्धव थापालाई अदालतको अवहेलना मुद्दामा कारबाही गर्न पनि माग गरेका छन् । विश्वासको मत लिँदा अदालतको आदेशको अवहेलना भएको दाबी रिटमा गरिएको छ । साथै, दीर्घकालीन महत्वका निर्णय नगर्ने गरिको आदेश पनि माग गरिएको छ । मुख्यमन्त्रीले पेस गरेको प्रस्तावमा मत बराबर नहुँदै अध्यक्षता गर्ने व्यक्तिले विश्वासको मतको प्रस्तावको पक्षमा मत दिएको अवस्था भएकाले मुख्यमन्त्रीले संवैधानिक हैसियतमा विश्वासको मत प्राप्त गर्न नसकेको रिटमा उल्लेख छ । त्यस्तो सरकारले दीर्घकालीन असर पर्ने प्रकृतिका कामकारबाही र निर्णय गर्नु अनुचित एवं गैरसंवैधानिक भएकाले रिटको अन्तिम टुंगो नलागेसम्म त्यस्ता निर्णय नगर्न अन्तरिम आदेशको माग रिटमा गरिएको छ । एमाले प्रदेश संसदीय दलका प्रमुख सचेतक रेवतीरमण भण्डारीले सभामुखको आसनमा बसेका व्यक्तिले निर्धारित समय सकिएपछि विश्वासको पक्षमा मत दिएर मुख्यमन्त्रीले विश्वासको मत पाएको भन्दै जबरजस्ती आफैंले घोषणा गर्नु संविधानको धारा १८६ र प्रदेशसभा नियमावलीविपरीत रहेको बताए । सभामुख बाबुराम गौतम पदबाट राजीनामा दिएर थापाको नेतृत्वमा सरकार गठन प्रक्रियामा सहभागी भएपछि अहिले कोसी प्रदेश सभामुखविहीन छ । सभामुख कुनै पनि दलले लिन मानिरहेका छैनन् । गौतम सरकारका आर्थिक मामिला तथा योजना मन्त्री छन् । कोसीको ९३ सदस्यीय प्रदेशसभामा एमालेका ४०, कांग्रेसका २९, माओवादीका १३, राप्रपाका ६, एकीकृत समाजवादीका ४ र जसपाका १ जना प्रदेशसभा सदस्य छन् । एमाले र राप्रपा एउटा गठबन्धनमा छन् । बहुमतका लागि ४७ मत आवश्यक पर्छ ।"
