"शीर्षक","विवरण"
"एमाले र राप्रपाको नाराबाजीपछि कोशी प्रदेशसभा बैठक अनिश्चितकालका लागि स्थगित","विराटनगर : कोसी प्रदेशसभा बैठक प्रतिपक्षी दलको विरोध र बहिष्कारका कारण अनिश्चितकालका लागि स्थगित गरिएको छ । नेपाली कांग्रेस कोसी प्रदेश संसदीय दलका नेतासमेत रहेका मुख्यमन्त्री उद्धव थापाले सोमबार प्रदेशसभाबाट विश्वासको मत लिएपछि बैठक बधुबारका लागि आह्वान गरिएको थियो । थापाले सभामुख इस्राइल मन्सुरीलाई समेत प्रयोग गरेर संविधानविपरीत विश्वासको मत लिएका थिए । बुधबारको बैठक सुरु हुनासाथ उठेर विरोध जनाउँदै प्रतिपक्षी दलका प्रदेशसभा सदस्यले नाराबाजीमा उत्रिए । कानुनको धज्जी उडाएर मुख्यमन्त्रीलाई विश्वासको मत दिने सभामुखको अध्यक्षतामा सभा सञ्चालन हुन नसक्ने भन्दै प्रतिपक्षी नेकपा (एमाले) र राष्ट्रिय प्रजातन्त्र पार्टी (राप्रपा)का सदस्यले बैठक बहिष्कार गरेका हुन् । सभाध्यक्ष मन्सुरीले बैठक सुरु भएको घोषणा गरेलगत्तै एमाले र राप्रपाका प्रदेशसभा सदस्यले उठेर विरोध जनाए । त्यसपछि सभाध्यक्षविरुद्ध नाराबाजी गर्दै प्रदेशसभा सदस्यहरु बैठक कक्ष छाडेर बाहिरिएका हुन् । उनीहरुले असंवैधानिक कदम मुर्दावाद भनेर नाराबाजी गरेका थिए । लगत्तै सभामुख मन्सुरीले अर्को सूचना जारी नभएसम्मका लागि बैठक स्थगित भएको घोषणा गरे । राप्रपा प्रदेश संसदीय दलका नेता भक्तिप्रसाद सिटौलाले सभाध्यक्षबाट गैर संवैधानिक र गैर संसदीय अभ्यास भएको बताए । कानुनविपरीतको अभ्यास प्रदेशसभामा भएका कारण बैठक बहिष्कार गरिएको जानकारी उनले दिए । एमालेका प्रदेशसभा सदस्य तिलकुमार मेन्याङ्बोले सभाको अध्यक्षता गर्ने व्यक्तिले विश्वासको मत दिएर असंवैधानिक काम गरेको बताए । सभामुखबाट संविधानको ठाडो उल्लंघन भएको छ, उनले भने, फेरि असंवैधानिक कदम हुनसक्ने देखेर बैठक बहिष्कार गरिएको हो । बुधबारको प्रदेशसभा बैठकमा प्रदेश निजामती सेवा ऐन २०७९ लाई संशोधन गर्न बनेको विधेयक र स्थानीय सेवाको गठन सञ्चालन र सेवाका सर्तहरु सम्बन्धमा व्यवस्था गर्न बनेको विधेयक पेश गर्ने कार्यसूची थियो । प्रतिपक्षीको बहिष्कार र विरोधका कारण बैठक कार्यसूचीमा प्रवेश नै गर्न पाएन । मुख्यमन्त्री थापाले प्रदेशमा सहमति, सहकार्य, समझदारी र सरसल्लाहबाट नै अघि बढ्ने बताए । पत्रकारसँग संक्षिप्त कुराकानी गर्दै उनले अब सहमतिबाटै प्रदेशसभा प्रारम्भ हुने पनि उल्लेख गरे । साथीहरु (प्रतिपक्षी) अलि आवेशमा आउनु भयो । सभा चल्न सकेन । अनिश्चितकालका लागि रोकिएको छ, थापाले भने, तर, कोसीमा सहमति र सहकार्यको विकल्प छैन । सहमतिबाटै प्रदेशसभा बैठक सुरु गरेर बजेट ल्याइनेछ । सहमति भयो भने एकै दिनमा बजेट आउँछ । उनले सहमति जुटाउन विपक्षीसँग वार्ताको प्रयास भइरहेको पनि बताए । प्रदेशसभामा देखिएको अन्योलताका सम्बन्धमा सर्वोच्च अदालतको आदेशलाई स्वीकार गर्ने पनि उनको भनाइ छ । सर्वोच्चको आदेशलाई पालना गर्नैपर्छ । तर, सर्वोच्चबाट चाँडै निर्णय नआउँला,मुख्यमन्त्री थापाले भने ।"
"दुई अर्ब ३७ करोड विद्युत् बक्यौता उठाउन बाँकी","हेटौंडा : नेपाल विद्युत् प्राधिकरण हेटौंडा वितरण केन्द्रले रू दुई अर्ब ३७ करोड ८२ लाख ९८ हजार तीन सय ६० विद्युत् महसुल उठाउन बाँकी रहेको जनाएको छ । विद्युत् बक्यौता नतिर्ने हेटौंडास्थित शिवम् सिमेन्ट उद्योगसहित नौ सय ४२ जनालाई कालोसूचीमा राखिएको केन्द्रका इञ्जिनियर सन्तोष चौहनले जानकारी दिए । उनका अनुसार सिमेन्ट उद्योगले आठ वर्षदेखि बक्यौता तिरेको छैन । इञ्जिनियर चौहनले उद्योगले हालसम्मको दुई अर्ब २४ करोड विद्युत् महसुल बक्यौता तिर्न बाँकी रहेको जानकारी दिए । 'उद्योगलाई विद्युत् आपूर्ति सहज गराउनका लागि लोडसेडिङको समयमा केन्द्रले डेडिकेटेड प्रसारण लाइन उपलब्ध गराएको थियो । त्यसबेलादेखिको महसुल तिर्न अटेर गरिरहेको छ,' उनले भने । उद्योगसहित विद्युत् बक्यौता नतिर्ने नौ सय ४२ लाई कालोसूचीमा राखे पनि महसुल उठाउन नसकिएको इञ्जिनियर चौहनले बताए । महसुल नतिर्ने ग्राहकका तीन पुस्तासम्म मिटर जडान गर्न नपाइने गरी कालोसूचीमा राखिएको उनको भनाइ थियो । 'कालोसूचीमा रहेका पाँच जनाले बक्यौता तिरेपछि कालोसूचीबाट हटाइएको छ । पाँच जनाबाट एक लाख २२ हजार पाँच सय ९२ संकलन गरिएको छ,' उनले भने । उनका अनुसार सिमेन्ट उद्योगले महसुल नतिरे पनि विद्युत् वितरण भने भइरहेको छ । प्राधिकरण हेटौंडाले हाल विद्युत् चोरी नियन्त्रण गर्न सफल भएको उनले जनाए । विगतमा धेरै चुहावट भए पनि अहिले सचेतनाका कारण चोरी सङ्ख्या घटेको चौहानको भनाइ थियो । विद्युत् चोरी गर्ने २१ जनाबाट प्राधिकरणले एक लाख ६६ हजार ९१ जरिवाना लिएको उनले जानकारी दिए ।"
"""सेयर बजारमा दोहोरो अंकले वृद्धि","१ अर्ब ५१ करोडको कारोबार"",काठमाडौं : सेयर कारोबारको चौथो दिन नेप्से परिसूचक दोहोरो अंकले बढेको छ । नेप्से परिसूचक २९४७ अंकले २०४५४५ विन्दुमा पुगेको छ । सेन्सेटिभ इण्डेक्स ४३० विन्दुले बढेको छ । आज २७३ कम्पनीको ४२ लाख ३७ हजार ६९ कित्ता सेयर १ अर्ब ५१ करोड ४ लाख ८८ हजार ९८४ रुपैयाँमा खरिदबिक्री भयो । आज कुथेली बुखारी स्माइल हाइडोपावरको सेयर मूल्य ९९९ प्रतिशतले बढ्यो । कारोबार रकमका आधारमा घोराही सिमेन्ट शीर्षस्थानमा रह्यो । सो कम्पनीको ७ करोड ५७ लाख मूल्य बराबरको सेयर खरिदबिक्री भयो । कारोबारमा आएका १३ वटै उपसमूहको सूचक बढेको छ ।"
"तीन हप्तादेखि रिप र उनापानी गाउँ अन्धकारमा","सिमकोट : गत साउन १३ र १४ गते परेको अविरल वर्षाका कारण आएको बाढी र पहिराले विद्युतमा क्षति पुर्याउँदा हुम्लाको मध्यभेगमा रहेका दुई गाउँबासी अन्धकारमा बस्दै आएका छन् । विद्युत् आपूर्ति बन्द हुँदा सर्केगार्ड गाउँपालिका२ को रिप र वडा नं ३ को उनापानी गाउँका बासिन्दाले अहिले उज्यालोका लागि सल्लाको दियालोको भर पर्नुपरेको छ । पहिराले क्षति पुर्याएको नहर तथा पावर हाउस हालसम्म मर्मत नहुँदा स्थानीयवासी दियालो बाल्न बाध्य भएका हुन् । विद्युत् हाउस नबन्दा तीन हप्तादेखि वडा नं ३ उनापानी गाउँलेले सल्लाको दियालो बाल्नुपरेको स्थानीयवासी महेश थापाले बताए । यसअघि तीन सय घरधुरीका लागि विद्युत् आपूर्ति गर्दै आएको लघुजलविद्युत् आयोजनाको नहर र पावर हाउसलाई गत साउन १२ गते आएको पहिरोले क्षति पुर्याएपछि त्यसयता गाउँमा अन्धकार छाएको उनको गुनासो थियो । विद्युत् आपूर्ति भइरहेका कारण सोलारको विकल्पसमेत नगरिएकाले हाल जंगलबाट सल्लाको झरो टिपेर दियालोको रूपमा बाल्नुपरिरहेको हो । पावर हाउसलाई यति धेरै समयसम्म मर्मत गर्न कसैको ध्यान जान नसकेको र अब कहिले मर्मत हुन्छ भन्ने यकिनसमेत नभएको स्थानीयबासी थापाको भनाइ छ । दुई सय ५० घरधुरी रहेको वडा नं २ को रिप गाउँको समस्या पनि उस्तै छ । त्यहाँका बासिन्दा पनि सल्लाको झरो बालेर उज्यालोमा बस्न बाध्य छन् । उक्त गाउँका लागि विद्युत् आपूर्ति गर्दै आएको रिपगाड लघुजलविद्युत् आयोजनाको नहर र पावर हाउसलाई पनि असार १२ र १३ गते आएको बाढी तथा पहिरोले क्षति पुर्याएपछि विद्युत् सेवा बन्द भएको स्थानीयबासी कालीबहादुर महताराले बताए । उज्यालोमा बस्न बानी परेका बासिन्दालाई अहिले पुनः पुरानै जमानामा फर्काएको उल्लेख गर्दै उनले विद्युत् सेवा बन्द हुँदा साह्रै कठिन भएको गुनासो गरे । स्थानीयवासीले पहिरोले क्षति पुर्याएको २५ किलोवाटको लघुजलविद्युत् आयोजना मर्मतका लागि वडा र गाउँपालिकामा माग गर्दा कुनै सुनुवाइ हुन नसकेको दुखेसो गरे । वडा नं ३ का वडाध्यक्ष अकिल कार्कीले धेरै ठूलो क्षति भएका कारण तत्काल मर्मत गर्न कठिन भएको र क्षतिको विवरणसहित पावर हाउस तथा नहर मर्मतका लागि मुचुल्का सरोकारवाला निकायमा पेस गर्ने कार्य भए पनि हालसम्म मर्मत गर्ने निकाय नभेटिएको बताए ।"
"सुन प्रकरणमा पक्राउ परेका दावाको कनेक्सन केही पूर्वआईजीपीसँग छ : रवि लामिछाने","काठमाडौं : राष्ट्रिय स्वतन्त्र पार्टीका सभापति रवि लामिछानेले सुन तस्करी प्रकरणमा पक्राउ परेका दावा लामाको कनेक्सन केही पूर्वप्रहरीका उच्चअधिकारीसँग रहेको दावी गरेका छन् । बुधबार संसद बैठकमा बोल्दै सभापति लामिछानेले केही पूर्वमहानिरीक्षकसँग दावाको सम्पर्क देखिएको सूचना प्रहरीले आफूलाई दिएको दावी गरेका हुन् । तर, उनले दावासँग सम्पर्कमा रहेका ती पूर्वप्रहरी महानिरीक्षकहरूको नाम भने खुलाउन चाहेनन् । लामिछानेले भने,' सरकारका बहालवाला एक महानिर्देशकले सुन आएको कुराको जानकारी लामा भनिएका व्यक्तिलाई फोटोसमेत पठाएको जानकारी प्रहरी नेतृत्वले मलाई दिएका छन् । यसमा संलग्न केही बिचौलीयाहरूबारे जानकारी पनि उपलब्ध गराएका छन्, 'उनले भने,' यसको जानकारी सम्बन्धित निकायलाई गराउनेछु ।' लामिछानेले लामासँग केही पूर्वप्रहरीहरूको पनि कुराकानी भएको सूचना प्राप्त भएको जिकिर गरे । उनले भने,'सुन प्रकरणमा पक्राउ परेका दावा लामासँग केही पूर्वप्रहरीहरूको पनि कुराकानी भएको सूचना प्राप्त भएको छ । यसमा प्रधानमन्त्री र गृहमन्त्रीको ध्यानाकर्षण गराउन चाहन्छु ।' उनले दावा भनिएका व्यक्तिसँग प्रहरीका उच्चअधिकारीको टेलिफोनमा भएको रेकर्ड संसदले जस्ताको त्यस्तै हेर्न पाउनुपर्ने माग गरे । 'फरेन्सिक ल्याबबाट दावासँग टेलिफोनमा भएको रेकर्ड संसदीय समितिले अथवा संसदले जस्ताको तस्तै हेर्न पाओस्,जहाँभित्र अत्यन्तै सूचना छन्,'उनले भने ।"
"तीन दिनभित्र बढि लिएको शुल्क फिर्ता नगरे आन्दोलनमा उत्रिने नेविसंघको चेतावनी","काठमाडौं : नेपाल विद्यार्थी संघले इन्जिनियरिङ्गतर्फको स्नातक तह अध्ययनका लागि अस्वभाविक रूपमा शुल्क बढाइएको भन्दै तत्काल फिर्ता लिन माग गरेको छ । बुधबार काठमाडौंमा पत्रकार सम्मेलन गर्दै नेविसंघ केन्द्रीय समितिले इन्जिनियरिङ शिक्षा विद्यार्थीको व्यक्तित्व विकासमात्र नभएर राष्ट्र निर्माण र विकासको बलियो आधार भएकाले शुल्क वृद्धिको निर्णयबाट त्रिभुवन विश्वविद्यालय र इन्जिनियरिङ्ग अध्ययन संस्थान (आईओई) पछाडि हट्नुपर्ने माग गरेको हो । गुणस्तरीय इन्जिनियरिङ अध्ययनका लागि नेपाली विद्यार्थीहरू प्रत्येक वर्ष ठूलो संख्यामा विदेश गइरहेको अवस्थामा स्वदेशमा रहेका क्याम्पसहरुमा चर्को शुल्कवृद्धि गरिनु बुद्धिमानी नहुने नेविसंघको ठहर छ । पत्रकार सम्मेलनमा नेपाल विद्यार्थी संघका केन्द्रीय अध्यक्ष दुजाङ शेर्पाले अध्ययनका लागि युवाहरु बाहिर गएको अवस्थामा देशमै बसेर पढ्छु भन्ने विद्यार्थीलाई पनि चर्को शुल्क वृद्धिका पढ्ने अवस्था नभएको बताए । उनले तीन दिनभित्र शूल्क वृद्धि फिर्ता नभए कडा आन्दोलनमा उत्रिने चेतावनी समेत दिए । इन्जिनियरिङ्ग अध्ययन संस्थानले गत भदौ ४ गते सूचना प्रकाशित गरी स्नातक तहअन्तर्गत बीईबीआर्क अध्ययनका लागि शुल्क वृद्धि भएको जानकारी गराएको थियो । शिक्षाको क्षेत्रमा आमूल परिवर्तनको आवश्यकता रहेको बताउँदै नेविसंघले यसका लागि प्राविधिक, व्यावहारिक र जीवन उपयोगी शिक्षालाई समय सापेक्ष रूपमा परिवर्तन गर्न आवश्यक रहेको जनाएको छ ।"
