"शीर्षक","विवरण"
"चुरेमा फस्टाएको अचार उद्योग","कैलाली : नेपालमा रोजगारी छैन भनेर विदेश जानेहरूको लर्को लागि रहेको छ तर कैलालीको चुरेका दिवाकर योगी यतै सम्भावना खोजिरहेका छन् । चुरे क्षेत्रमा फल्ने सिजन अनुसारको अचार बनाउने, अर्गानिक पहाडी उत्पादनहरू प्रशोधन गरेर उनी खाडी मुलक जाने युवाहरूभन्दा चार गुण बढी आम्दानी गरिरहेका छन् । कैलालीको चुरे गाउँपालिकामा पर्ने भीमदत्त पन्त राजमार्गको फल्टुडेमा छ, हाम्रो अचार उद्योग तथा फलफूल प्रशोधन केन्द्र । राजमार्गमै उद्योगको बोर्ड लगाइएको छ । बुवा हरिशंकर योगीले २०६१ सालदेखि अचार बनाउने कामबाट सुरु गरेको व्यवसाय, अहिले छोरा दिवाकर योगीले अत्याधुनिक प्लान्ट जडान गरेर अचार र अमिलो (चुक) उत्पादन गरिरहेका छन् । योगीको उद्योगमा सिजन अनुसार लसुनको अचार, आँपको अचार, अमिलो र खुर्सानीको अचार, सिस्नुको पाउडर, तेजपत्ता, कागतीको रस लगायतका थुप्रै अर्गानिक उत्पादनहरू पाइन्छन् । बुवाले अचारबाट सुरु गर्नु भएको हो, अहिले अमिलो (चुक) पनि उत्पादन गरिरहेको छु । चुक भन्दा पनि बोक्राबाट बढी फाइदा छ दिवाकरले भने, चुकको बोक्रा जर्मन निर्यात भइरहेको छ । दिवाकरका अनुसार अमिलो १० लिटर रस पकायो भने १ लिटर मात्रै चुक निस्कन्छ । तर सुकाएको बोक्रा भने २५० रुपैयाँ किलो बिक्री भइरहेको छ । अमिलोको दाना किनेर चुक बनाएर बिक्री गर्नमा खासै फाइदा छैन तर बोक्रा बिक्री हुन थालेपछि राम्रो फाइदा हुने गरेको छ, दिवाकरले भने । उनीबाट अमिलोको बोझा सुर्खेतको एउटा अर्बल कम्पनीले किलोको २५०का दरले किन्छ । दिवाकर भन्छन्, त्यो सबै बोक्रा जर्मन जान्छ । त्यहाँ त्यो बोक्रा हर्वल चियाका लागि प्रयोग हुन्छ भन्ने सुनेको छु । अहिले अमिलोको सिजन हो । कैलालीका चुरे, जोरायल र मोहन्याल गाउँपालिका, डडेल्धुरा, बैतडी र दार्चुलाबाट समेत अहिले उनको उद्योगमा किसानले अमिलोका दाना ल्याई रहेका छन् । २०६४ सालमा रिज्म एफपीले उनलाई अचार बनाउने र चुक बनाउने मेसिन सहयोग गरेपछि उनी अर्गानिक उत्पादनमा व्यावसायिक रूपमा लागेका हुन । गाउँघरमा चुक बनाउँदा सामान्य तया परम्परागत काठको कोल्हुमा पेलेर तामाको भाँडामा दाउराले पकाउने गरिन्छ तर योगीको उद्योगमा अचार बनाउने र पकाउने आधुनिक मेसिन राखिएको छ । त्यसमा स्टिमबाट पकाउने गरिन्छ । आफ्नो रोजगारी मात्रै होइन, योगीको उद्योगमा सिजन अनुसार १५२० जना स्थानीय महिलाहरू पनि रोजगारी पाउने गरेका छन् । आपको सिजनमा आम खुर्सिन आउछौं, लसुन र खुर्सानीको पनि सिजन हुन्छ । अहिले अमिलो खुर्सिन आएका छौं अमिलोको बोझा निकाल्दै गरेकी फल्टुडेकी खगिसरा रसाइलीले भनिन । चुकको बोक्रा निकाल्न योगीको यद्योगमा १५२० जना महिला आएका थिए । अमिलो खुर्सिदै गरेकी अर्की महिला कौसिला रसाइलीले भनिन, एक क्रेट अमिलो खोर्सको सय रुपैयाँ हुन्छ । सक्नेले दिनमा ८ क्रेट पनि बनाउँछन् । सिजन अनुसारको राम्रो रोजगारी भएको छ । योगीको उद्योगमा स्थानीय किसानको अमिलो, आँप, कागती, लसुन, सिस्नु र खुर्सानी पनि आउछ । उनको उद्योगका कारण स्थानीयको उत्पादनले बजार पाएको छ । गाउँका किसान उनको उद्योगमा भारी बोकेर मौसम अनुसारको कृषि उपज ल्याउने गरेका छन् । स्थानीय चण्डीका रानामगर भन्छिन्, गाउँको उत्पादन गाउँमै बिक्री गर्न पाएकाले सजिलो भएको छ । खुर्सानी, लसुन, आम, अमिलो, कागती, तेजपत्ता, सिस्नु सबै गाउँमै बिक्री हुनेगर्छ । दिवाकरले उद्योगमा एक करोड लगानी गरेका छन् । उनका बुवा हरिहर योगीले २०६४ सालमा राष्ट्रिय स्तरको उत्कृष्ट खाद्य उद्यमी तथा व्यवसायी पुरस्कार पनि पाइसकेका छन् । बुवाको कामलाई आधुनिक रूपमा अगाडि बढाएका दिवाकर, पहाडमा पनि स्वरोजगारको प्रचुर सम्भावना छ भन्ने उदाहरण बनेका छन् ।"
"चारतारे गौतम होटल सञ्चालनमा","ढल्केबर : व्यापारिक कारोबार घट्दै गइरहेको भन्ने होटल व्यवसायीले गुनासो गरिरहेका बेला धनुषाको मिथिला नगरपालिकामा चारतारे मापदण्डको गौतम होटल सञ्चालनमा आएको छ । आर्थिक मन्दीलाई चुनौती दिँदै गौतम होटल बर्दिबासले लालगढमा ३५ करोड रुपैयाँ लगानी गरेको हो । उक्त होटलको मधेस प्रदेशका मुख्यमन्त्री सरोजकुमार यादवले शनिबार उद्घाटन गरे । उक्त अवसरमा मुख्यमन्त्री यादवले होटल व्यवसायमा लगानी बढ्नु सुखद् भएको उल्लेख गरे । समय सापेक्ष बदलिँदो सोच, गौतम होटलको नवीनतम अठोट भन्ने भावकासाथ अत्याधुनिक सेवा सुविधासहितको होटल निर्माण गरिएको गौतम होटलका सञ्चालक हिरालाल गौतमले जानकारी दिए । होटल व्यवसायका लागि केन्द्रबिन्दु बन्दै गएको लालगढमा करिब डेढ बिघा क्षेत्रफलमा निर्माण भइरहेको होटलमा १ सय ५० जनाभन्दा बढी बसोबास गर्न मिल्ने आरामदायी कोठाहरू रहेको गौतमको भनाइ छ । होटलका कोठाबाट, आकर्षक चुरिया पहाड, हरियाली एवं प्राकृतिक रमणीय वातावरणको अवलोकन गर्न सकिने उनले सुनाए । होटलमा सभा सम्मेलन, गोष्ठीका लागि कक्षहरू छन् । भित्र र बाहिर गरी लगभग दुई हजार जनाको व्यवस्थापन गर्नसक्ने क्षमता छ, गौतमले भने ।"
"""कोशीका मन्त्रीले पाए जिम्मेवारी : राई आन्तरिक मामिला","उप्रेती पर्यटन र जबेगूलाई भौतिक पूर्वाधार"",""विराटनगर : कोशी प्रदेशका तीनजना मन्त्रीहरुलाई मन्त्रालय तोकिएको छ । लामो समयदेखि बिनाविभागीय रहेका मन्त्रीहरुले बल्ल मन्त्रालयको जिम्मेवारी पाएका हुन् । मुख्यमन्त्री केदार कार्कीको सिफारिसमा प्रदेश प्रमुख परशुराम खापुङले नेपालको संविधानको धारा १६८ को उपधारा (९) बमोजिम मन्त्रीहरुका लागि आइतबार मन्त्रालय तोकिदिएका छन् । प्रदेश प्रमुखको कार्यालयका प्रवक्ता नरेन्द्रकुमार श्रेष्ठका अनुसार शम्शेर राईले आन्तरिक मामिला तथा कानुन, गणेशप्रसाद उप्रेतीले पर्यटन, वन तथा वातावरण र कमलप्रसाद जबेगूले भौतिक पूर्वाधार विकास मन्त्रालयको जिम्मेवारी पाएका छन् । मुख्यमन्त्री कार्कीले राईलाई असोज २८ गते तथा उप्रेती र जबेगूलाई कात्तिक १७ गते बिनाविभागीय मन्त्री बनाएका थिए । मन्त्रालयको जिम्मेवारी नतोकिँदा मन्त्रीहरु हालसम्म बिनाविभागीय नै थिए । प्रदेशको आर्थिक मामिला तथा योजना मन्त्रालय, उद्योग, कृषि तथा सहकारी मन्त्रालय, खानेपानी, सिँचाई तथा उर्जा मन्त्रालय, सामाजिक विकास मन्त्रालय र स्वास्थ्य मन्त्रालय भने मुख्यमन्त्री कार्कीले आफैंसँग राखेका छन् । मन्त्री बनेकामध्ये राई नेपाली कांग्रेस, उप्रेती नेकपा (माओवादी केन्द्र) र जबेगू नेकपा (एकीकृत समाजवादी)बाट निर्वाचित प्रदेशसभा सदस्य हुन् । उनीहरुलाई मन्त्रालयको जिम्मेवारी दिएपनि कोशी प्रदेशमा सरकार विस्तार भइसकेको छैन । सरकार विस्तार गर्न केही दिन समय लाग्ने मुख्यमन्त्रीनिकट स्रोतले बतायो । प्रदेशमा सभामुख पद पनि खाली छ । तत्कालीन सभामुख बाबुराम गौतमले साउन १६ गते पदबाट राजीनामा दिएर कांग्रेस प्रदेश संसदीय दलका नेता उद्धव थापालाई मुख्यमन्त्री बनाउन सहयोग गरेका थिए । सर्वोच्चको फैसलासँगै थापा नेतृत्वको सरकारले वैधानिकता पाएन भने नयाँ सभामुख नियुक्ति प्रक्रिया पनि अघि बढाइएको छैन । गठबन्धनबाट विद्रोह गरेर कांग्रेसका कार्की नेकपा (एमाले)समेतको समर्थनमा असोज २७ गते मुख्यमन्त्री नियुक्त भएका थिए । उनले एमालेका रामबहादुर रानामगरलाई मन्त्री पनि नियुक्त गरे । पछि मुख्यमन्त्रीले माओवादी र एकीकृत समाजवादीबाट मन्त्री नियुक्त गरेपछि एमाले सरकारबाट बाहिरिएको थियो । प्रदेशसभाको बैठक आगामी मंगलबारलाई बोलाइएको छ ।"""
"निस्सा वितरणमा ढिलाइ गरेको भन्दै सुकुमबासीले गरे टीकापुर नगरपालिका घेराउ","टीकापुर : भूमिहीन सुकुमबासीका लागि निस्सा वितरणमा ढिलाइ गरेको भन्दै आन्दोलित भएका टीकापुर वडा नं १ का भूमिहीन सुकुमबासीहरुले कैलालीको टीकापुर नगरपालिका केन्द्र घेराउ गरेका छन् । शुक्रबारदेखि तत्काल निस्सा वितरण गर्नुपर्ने माग राख्दै नगरपालिकामा तालाबन्दी गरेका भूमिहीन सुकुमबासीहरुले नगरपालिकाले मागको सुनुवाई नगर्दै ताला खोलेको भन्दै आइतबार घेराउ गरेका हुन् । नगरपालिकाले वडा नं ६ मा सुकुमबासीहरुका लागि निस्सा वितरणको कार्य सुरु गरिसक्दा समेत वडा नं १ मा निस्सा वितरण प्रक्रिया रोकिएको भन्दै उनीहरु आक्रोशित बनेका हुन् । अन्य वडामा सुरु भइसक्दा समेत वडा नं १ मा निस्सा वितरण कार्य नभएकाले नगरपालिकामा तालाबन्दी गरेकोमा पालिकाले ताला खोलेपछि केन्द्र घेराउ गरिएको आन्दोलनका संयोजक पूर्णबहादुर खड्काले बताए । हाम्रा मागको सम्बोधन गर्नका लागि नगरपालिकाका जनप्रतिनिधिले लिखित रुपमा प्रतिबद्धता गर्नुपर्छ,' खड्काले भने, त्यसका लागि हामी नगरपालिकासँग वार्तामा बस्न तयार छौं, हामी शान्तिपूर्ण रुपमा आन्दोलनका कार्यक्रम गर्छौं । नगरपालिका घेराउ गर्न जम्मा भएका भूमिहीन सुकुमबासीलाई नगर प्रमुख रामलाल डगौरा थारुले सम्बोधन गरेका छन् । उनले निस्सा वितरणका लागि प्रक्रिया अघि बढेर दावी विरोधका लागि एक हप्ते सूचना प्रकाशनको चरणमा रहेको बताए । हामी निस्सा वितरणको प्रक्रियामा लागिरहेका छौं, आज मात्रै थप तीन वडालाई दावी विरोधका लागि सूचना प्रकाशित गर्न पत्राचार गरिसकेका छौंनगर प्रमुख थारुले भने, १० हजार बढी आवेदन गरेका छन्, यी सबैमाथि छानविन गर्न, इन्ट्री गर्न समय लागेको हो, यो समस्या हामी सक्दो चाँडो टुंग्याउने प्रयासमा छौं । पालिका केन्द्रमा घेराउ बन्दी गरिएपछि आज पनि नगरपालिकाका कामकारवाही प्रभावित भएको छ ।"
"लाभांश लिन डिप्रोक्स लघुवित्तको आह्वान","काठमाडौं : डिप्रोक्स लघुवित्त वित्तीय संस्थाले पुरानो नगद लाभांश लिन बाँकी रहेका सेयरधनीलाई आह्वान गरेको छ । यसअघि विभिन्न साधारणसभाबाट पारित भएको नगद लाभांशहरू केही सेयरधनीले अझै बुझिनलिएकाले छिट्टै लिन भनेको छ । यसर्थ ढिलो नगरी नगद लाभांश लिन बाँकी रहेका सेयरधनीले सेयर प्रमाणपत्रसहित परिचयपत्र लिएर आउन अनुरोध गरेको छ । यससँगै विभिन्न आर्थिक वर्षमा कम्पनीको सेयरधनी रहेका तर अहिले सेयर बिक्री गरिसकेका सेयरधनीले कागजातको प्रतिलिपिसहित कम्पनीको सेयर रजिष्ट्रार नबिल इन्भेस्टमेण्ट बैंकिङ लिमिटेड, नक्साल, काठमाडौंमा सम्पर्क गरी लाभांश बुझिलिन सक्ने बताइएको छ । कम्पनीको अनुसार ५ वर्षभन्दा पुरानो बुझिलिन बाँकी रहेको नगद लाभांश रकम कम्पनी ऐन २०६३ बमोजिम लगानीकर्ता संरक्षण कोषमा जम्मा हुने छन् ।"
"""सेयर बजारमा सामान्य गिरावट","कारोबार रकम १ अर्ब तल"",""काठमाडौं : साताको पहिलो कारोबार दिन नेप्से परिसूचक सामान्य अंकले घटेको छ । नेप्से ७२९ अंकले घटेर १८५१२३ विन्दुमा पुगेको हो । सेन्सेटिभ इण्डेक्स १६५ अंकले घटेर ३५४४३ विन्दुमा अडिएको छ । २९३ स्क्रिप्टको ३४ लाख १९ हजार ७३ कित्ता सेयर ३६ हजार ९७७ पटकको कारोबारमा ९६ करोड ४० लाख १० हजार ४३१ रुपैयाँमा खरिदबिक्री भए । सामान्य अंकले घटेको सेयर बजारमा कुनै पनि कम्पनीको सेयर सकारात्मक सर्किट लेभलमा कारोबार हुन सकेन । कारोबारमा माउन्टेन इनर्जी नेपालका लगानीकर्ताले भने गुमाए । सो कम्पनीको सेयर मूल्य ९९९ प्रतिशतले घट्यो । थ्री स्टार हाइड्रोपावरको सेयर मूल्य सर्वाधिक ९६३ प्रतिशतले बढ्यो । साविको लघुवित्त वित्तीय संस्थाको ९०४ प्रतिशत,इङवा हाइड्रोपावरको ८६० प्रतिशत र माइ खोला हाइड्रोपावरको ६२८ प्रतिशत र मोलुङ हाइड्रोपावरको ५६९ प्रतिशतले सेयर मूल्य बढ्यो । कारोबार रकमका आधारमा सोनपुर मिनरल्स शीर्ष स्थानमा रह्यो । सो कम्पनीको ६ करोड ९५ लाख २९ हजार २७० रुपैयाँको सेयर कारोबार भयो । सबै समूहको उपसूचकमा गिरावट आएको छ । माइक्रो फाइनान्स उपसमूह बाहेक अन्य सबै उपसमूहको परिसूचक घट्यो । ९४ स्क्रिप्टको मूल्य बढ्दा १३६ को घट्यो भने १० को मूल्य स्थिर रह्यो ।"""
