शीर्षक,विवरण
भोलिको संसार कसरी व्यवस्थित गर्ने ?,"चाहेआजको होस् या भोलिको, संसारलाई चाहिने आधारभूत कुरा हुन् स्वास्थ्य, शान्ति र आत्मबोध। विश्वव्यापीकरणको क्रममा यी तिनै सिद्धान्तको महत्व दिनहुँ बढिरहेको छ। कोरोनाको संक्रमणले जसरी संसारलाई एउटै एकाइको रूपमा लिएको छ, त्यसरी नै संसारका सबै देशहरू पनि यसविरुद्ध एकत्रित भएका छन्। कुनै पनि देशलाई एकलै लड्नु सम्भव छैन। विश्वस्तरको स्वास्थ्य भन्नाले आर्थिक गतिविधिसित सम्बन्धित छ। आर्थिक दृष्टिबाट विश्व विभाजित भएको छ धनी र गरिब। कोही धनी भएर कोही गरिब भएर सधैं बस्न सक्दैन, यसबाट अनेक द्वन्द्व उत्पन्न हुन्छ। अत : धनीले गरिब मुलुकलाई आर्थिक क्षेत्रमा सहयोग गर्नुपर्छ। त्यसैअनुसार अन्तर्राष्ट्रिय स्तरमा आर्थिक सहयोगको क्रम चलिरहेको छ। धनी मुलुकहरूले गरिब मुलुकहरूलाई बर्सेनि करिब ४० अर्ब डलरको सहायता दिने गर्छन्। यसबाट गरिब मुलुकहरूमा शिक्षा, स्वास्थ्य, यातायात, कृषि, उद्योग आदि क्षेत्रमा अनेक गतिविधि सञ्चालन भइरहेका छन्। यो एउटा राम्रो पक्ष हो। तर धनी मुलुकहरूले गरिब मुलुकलाई ऋण दिएको र त्यहाँ लगानी गरेबापत करिब ५० अर्ब डलर गरिब मुलुकबाट धनी मुलुकमा बर्सेनि जाने गरेको तथ्यांक पाइन्छ। यसको माने धनीले गरिबलाई दिएको भन्दा गरिब मुलुकबाट धनी मुलुकमा बढी साधन स्रोत गइरहेको देखिन्छ। यो नराम्रो पक्ष हो। धनीगरिब मुलुकबीचको खाडल पुर्ने उद्देश्यले संयुक्त राष्ट्रसंघले हरेक धनी मुलुकले आफ्नो वार्षिक आम्दानीको एक प्रतिशत गरिब मुलुकलाई दिन निर्देशन दिएको हो। तर सो निर्देशनको पालना भएन। तथ्यांकअनुसार धनी मुलुकहरूले आफ्नो आम्दानीको ०७ प्रतिशत मात्र दिने गरेको छ। तर वास्तवमा त्यसमध्ये ठूलो भागदाता राष्ट्रमै फर्केर गएको छ। यस हिसाबले धनी र गरिब मुलुकबीचको खाडल कम गर्ने लक्ष्य हासिल भइरहेको देखिन्न। जे भए पनि आर्थिक सहयोगको सिद्धान्तलाई सर्वत्र स्वीकार गरिएको छ र त्यस सिद्धान्तलाई सही मानेमा लागू गर्ने समस्या भने बाँकी रहेको छ। आजको समय भूमण्डलीकरण काल हो। हुन पनि यातायात र सञ्चारको विकासले विश्वका सबै देशहरू नजिक आएका छन्। त्यसबाट धेरै लाभ भएको छ तर केही खतरा पनि देखिएका छन्। सो कोरोना भाइसरले देखाएको छ। कुनै एक ठाउँको घटनाले सबै ठाउँमा असर पारेको छ, चाहे त्यो रोग व्याध फैलिने होस् या स्वास्थ्योपचारको विधिमा होस्। सबै मुलुकका मानिसहरू प्रभावित भएका छन्। त्यसैले विश्वमा खाद्य सुरक्षा हुनुपर्ने, शुद्ध खानेपानीको सुरक्षा हुनुपर्ने, उत्पादन र उपभोगको सुरक्षा हुनुपर्ने र वातावरणको सुरक्षा हुनुपर्ने कुरा सबैले महसुस गरेका छन्। यसको माने विश्वमा विद्यमान प्राकृतिक स्रोतसाधनको उचित उपयोग हुनुपर्ने र त्यसको उचित उपभोग र वितरण हुनुपर्ने कुरा पनि सर्वस्वीकृत भइसकेको छ। समस्या खाली यस सिद्धान्तलाई कसरी चित्तबुझ्दो किसिमले व्यवहारमा उतार्ने भन्ने मात्र हो। यो क्रम जारी नै छ र यसबाट कुनै मुलुक अलग रहन सक्दैन। यस सम्बन्धमा मानिसले अप्राकृतिक जीवन शैलीलाई त्यागेर प्राकृतिक शैली अपनाउनु पर्ने खाँचो देखिएको छ। लागेको बानी छोड्न मानिसलाई कठिन पर्छ। तर बृहत् लाभका लागि सानोतिनो स्वार्थ नछाडी सुख छैन। यो कुरा महसुस भएपछि अन्तर्राष्ट्रिय सम्बन्धमा ठूलो सुधार आउने छ। लागेको बानी छोड्न मानिसलाई कठिन पर्छ। तर बृहत् लाभका लागि सानोतिनो स्वार्थ नछाडी सुख छैन। यो कुरा महसुस भएपछि अन्तर्राष्ट्रिय सम्बन्धमा ठूलो सुधार आउने छ। विश्व स्तरमा लागू हुनुपर्ने अर्को कुरा हो शान्ति। विश्व शान्तिको लागि संयुक्त राष्ट्रसंघ खडा भएको छ। यसले आफ्नो ७० वर्षभन्दा बढी समयमा एक प्रकारले विश्वमा शान्ति कायम गर्न सफल भएको छ। पहिलो र दोस्रो विश्वयुद्धजस्तो बृहत् रूपको युद्ध हुन दिएको छैन। हुन त सानो स्तरमा विभिन्न ठाउँमा लडाइँ झगडा भइ नै रहेका छन् तर त्यसले अन्तर्राष्ट्रिय स्वरूप लिएको छैन। यस्ता धेरै लडाइँमा शान्तिसुरक्षा कायम गर्ने काम यही संस्थाबाट हुने गरेको छ। आजको संसारमा एउटा राष्ट्रले अर्काे राष्ट्रसित युद्ध गरेर कब्जा गर्ने सोचाइ छाडिसकेका छन्। यस्तो सोचाइ लुप्त हुनु नै यस संस्थाको ठूलो सार्थकता हो। विश्वको शान्तिसुरक्षाको लागि आणविक हतियार सबभन्दा ठूलो खतरा मानिन्छ। यसको मूलभूत व्यवस्था आणविक हतियार नफैलाउने अन्तर्राष्ट्रिय सन्धिबाट भएको छ। अमेरिका र रूससित सबभन्दा धेरै यस्ता हतियार छन्। उनीहरूले यसको उपयोगिता नदेखेर आपसी समझदारीमा यस्ता हतियार नष्ट गरिरहेका छन्। यो सन्धिलाई सबै मुलुकले नमानेकाले विश्वशान्ति खल्बलिने डर कायम रहेको छ। यसै सिलसिलामा बेलाबेलामा अन्तर्राष्ट्रिय तनाव बढ्ने गरेको छ। नयाँ आणविक हतियार प्राप्त गर्न खोजिरहेका इरान, उत्तर कोरियाजस्ता मुलुकलाई लिएर संसारमा खिचातानी भइरहेका छन्। तर त्यसको मन्थन र समाधान हुने क्रम पनि जारी छ। अन्तर्राष्ट्रिय सुरक्षामा नयाँ खतरा आतंकवादले ल्याएको छ। यो राज्यराज्यबीचको समस्या होइन। यो राज्यविरुद्ध गैरसरकारी व्यक्ति र समुदायले सञ्चालन गरेको गतिविधि हो। आतंकवाद आधारभूत रूपमा हिंसात्मक भएको पाइन्छ र यसमा धेरै निरपराध जनधनको क्षति भएको पाइन्छ। प्राय : यस्ता गतिविधि आन्तरिक हुने गरेका छन्। तर यसले अन्तर्राष्ट्रिय रूप लिएको पनि देखिएको छ। आतंकवाद स्पष्टरूपले संयुक्त राष्ट्रसंघको मातहत आएको छैन किनभने यसका कुनै पनि सदस्य राष्ट्रले यो गतिविधि चलाएको सावित भएको छैन। आतंकवादविरुद्ध लड्न संसारमा नयाँ किसिमको धारणा र विधि अपनाउन आवश्यक देखिन्छ। व्यक्तिगत र राष्ट्रिय स्तरमा जुन प्रकारको आत्मबोध आवश्यक छ, त्यसरी नै विश्वव्यापी रूपमा आत्मबोध चाहिन्छ। यो मानवताको चेतना हो र मानव जातिको भाग्य र भविष्य एउटै गाँठोमा गाँसिएको छ भन्ने भावना जागृत हुनुपर्छ। विश्वव्यापी स्तरमा स्वास्थ्य र शान्तिसम्बन्धी मामिलाले एक मुलुकका मानिस अर्काे मुलुकबाट अलग रहन सक्दैन भन्ने चेतना खुलिसकेको छ। वातावरणको समस्याले विश्वव्यापी आत्मबोधको जागृति ल्याउन ठूलो मद्दत गरेको छ। यसको ह्रास र नासबाट कोही पनि छुट्टिएर बस्न सक्दैन। त्यसको संरक्षण र संवर्धन गर्नुपर्ने आवश्यकतामा कुनै विवाद छैन। विवाद खाली कसले कति र के गर्नुपर्ने भन्ने सबालमा केन्द्रित छ। विकसित देशले कति गर्नुपर्ने, द्रूतगतिले विकास गरिरहेका देशहरूले कति गर्नुपर्ने र सानातिना देशले के गर्नुपर्ने भन्ने कुरामा मात्र विवाद चर्किरहेको देखिन्छ। आजको विश्व सार्वभौम र स्वतन्त्र राज्यहरूमा विभक्त भएको छ। राष्ट्रहरूले आआफ्नो राष्ट्रिय स्वार्थलाई अगाडि बढाउनु उनीहरूको कर्तव्य र जिम्मेवारी हो भनेर बुझेका छन्। राष्ट्रिय स्वार्थका लागि लड्नु स्वाभाविक मानिन्छ। तर भूमण्डलीय संसारमा यो धारणालाई बदल्नुपर्ने अवस्था आइसकेको छ। राष्ट्रिय स्वार्थको सिमाना तोक्नुपर्ने अवस्था आएको छ। राष्ट्रिय स्वार्थभन्दा मानवताको स्वार्थलाई प्राथमिकता दिनुपर्ने समय आएको छ। यसका लागि व्यापक आध्यात्मिक चेतनाको विकास हुन जरुरी छ। यस सन्दर्भमा एक विश्वव्यापी धर्मको प्रतिपादन गर्नुपर्ने देखिन्छ। हाल भएका सम्प्रदायमा विभाजित धर्महरूले आधुनिक अवस्था, समस्या र चिन्तनको हाँकलाई समेट्न सकेको छैन। त्यसैकारण एक विश्व धर्मको आवश्यकता देखिएको छ। त्यसबाट हामीले संसारमा विश्वमुखी आत्मदर्शनको विकास हुने आशा गर्न सक्छौं।"
