शीर्षक,विवरण
राजनीतिक दुर्घटनाका पूर्वाभ्यास,"मैले एउटा किताब लेखें २०७१ सालमा। त्यो अंग्रेजीमा थियो। त्यसको टाइटल थियो रिसरेक्सन। यसको माने हो पुनर्जीवन। त्यसको कभर पृष्ठमा छापिएको छ ज्ञानेन्द्र शाहको तस्बिर। यो मुख्यतः नेपालमा राजसंस्था फर्केर आउला कि भन्ने विचारले लेखिएको थियो। राजसंस्था कुन अवस्थामा विलय भएको थियो भन्ने चर्चा पनि गरिएको थियो। जुन परिस्थितिमा यो गयो, त्यो बेला यो पुनः फर्कन्छ भत्रे मानिसमा विश्वास थिएन। मलाई पनि लागेको थियो राजसंस्था नेपालबाट जानुमा कतै न कतै दैविक हात थियो। त्यसकारण मैले सो पुस्तकमा एउटा श्लोक उद्धरण गरेको थिएँ। त्यसमा भनिएको थियो तादृशी जायते बुद्धिव्र्यवसायोपि तादृशः। सहायास्तादृशा एवं यादृशी भवितव्यता।। चाणक्य ८६। यसको माने हो भविष्यमा जस्तो हुनु छ; मानिसको बुद्धि र व्यवहार त्यस्तै हुँदै जान्छ। त्यस्तै किसिमका सहयोगी पनि प्राप्त हुँदै जान्छन्। यो उक्ति त्यसबेलाको स्थितिलाई व्याख्या गरेजस्तो लाग्छ। अहिले विचार गर्दा त्यो श्लोक त राजालाई मात्र लागू भएको होइन रहेछ; अरू शासकलाई पनि उत्तिकै लागू हुने रहेछ। प्रधानमन्त्री केपी शर्मा ओलीसित जति उनकै साथीहरू रिसाएर उनीसित छुट्टिएका छन्; उनीहरू प्रधानमन्त्रीसित त्यति रिसाएका छैनन् जति उनका सहयोगीसँग रिसाएका छन्। हुन त सहयोगीहरूले आफ्नो मूल मानिसको प्रशंसा गर्ने नै भए। तर सहयोगीहरूका भाषा र शैलीबाट मानिसहरू धेरै चिढिँदा रहेछन्। नेकपा फुट्नुमा जति मुख्य मानिसको हात छ; त्योभन्दा धेरै उनका सहयोगीको भएको देखिन्छ। त्यसैले त्यो श्लोकको सान्दर्भिकता नेपालको राजनीतिमा बरोबर रहने गरेको देखिन्छ। नेपालमा यस्तो संकट आइपर्छ र त्यो दुई वर्षपछि आउने छ भनेर एकजना मानिसले भनेका थिए। ती मानिस हुन् डा उपेन्द्र देवकोटा। त्यसै पुस्तकमा अर्को उक्ति पनि उल्लेख गरिएको छ; जसले यस्तै दैवसंजोग लागेको हुन सक्ने दर्शाएको थियो। न निर्मितः केन न दृष्टपूर्वं न श्रूयते हेममयो कुरङ्गः। तथापि तृष्णा रघुनन्दनस्य विनाशकाले विपरीत बुद्धिः।। चाणक्य १६५। यसको माने हो सुनको मृग न कहिल्यै बनाइएको, न कहिल्यै देखिएको, न कहिल्यै सुनिएको चीज हो। तैपनि रामलाई त्यसलाई प्राप्त गर्ने लोभ लाग्यो। विनाश हुने बेला बुद्धि भ्रष्ट हुन्छ। यसले पनि राजसंस्था कसरी गएको भन्नेबारेमा व्याख्या गर्छ। हुन त वास्तवमा राजसंस्था नेपालीले फालेको नभई भारतको इशारामा फालिएको भन्ने तथ्य पछि खुल्न आयो। यसले सत्तासीन नेकपाको वर्तमान स्थितिलाई पनि चित्रण गर्छ। यो मुलुकमा बहुमत भएको आफ्नो पार्टीका कारण संसद् भंग गरेर नेपाली कांग्रेसले दुईपटक चित खाएको परम्परा हुँदाहुँदै आफूलाई प्राप्त दुईतिहाइको बहुमत भएको सरकार प्रमुख फेरि त्यही बाटो हिँड्नुलाई विनाशको बेला बुद्धि बिग्रन्छ भन्नु के गलत हुन्छ ? हुन त अहिलेको घडीमा आउँदो वैशाखमा हुने निर्वाचन हुन्छ कि हुन्न भनी यकिन भन्न नसकिने अवस्था छ, तैपनि मध्यावधि निर्वाचनबाट नेपालका कुनै पनि प्रधानमन्त्रीले भनेजस्तो प्रतिफल निस्केको छैन। पहिलो मध्यावधि निर्वाचनले नेपालमा राजनीतिक अस्थिरता ल्याइदियो। सत्तामा आउनका लागि राजनीतिज्ञहरूले के मात्र गरेनन् ? सांसदहरू किनिए, बेचिए। कति दिनसम्म होटलमा थुनिए पनि। कोहीकोहीले विदेश भ्रमण गर्न पनि पाए। राजनीतिमा नैतिकता हराएको यसै बखतमा हो। अब पनि त्यसो नहोला भनेर कसरी भन्ने ? एउटा गजबको कुरा के भने नेपालमा यस्तो संकट आइपर्छ र त्यो दुई वर्षपछि आउने छ भनेर एकजना मानिसले भनेका थिए। ती मानिस हुन् डा उपेन्द्र देवकोटा। उनी एउटा नाम चलेको दिमागी डाक्टर थिए। तर त्यसभन्दा पनि ठूलो योग्यता उनमा राजनीतिको थियो। उनी रोगी भए र दुई वर्षअगाडि संसार छाडेर गए। तर उनले अबको दुई वर्षमा नेपालमा राजनीतिक संकट आइपर्छ र राजसंस्थाको पुनस्र्थापना हुन्छ भनेर भविष्यवाणी गरेका थिए। यसका लागि उनले तयारी गरेर बस्नुस् भनेर पनि एउटा संस्थाको भेलामा भनेका थिए। नभन्दै नेपालमा पाँच वर्षका लागि एकछत्र शासन गर्न सक्ने अवस्था आएका बेलामा यस्तो संकट कसरी आउन सक्छ र भनेर कतिजनाले सो कुरा पत्याएनन्। तर कुरा साँचो निस्क्यो। उनका केही राजनीतिक विचारले आजको सन्दर्भमा ठूलो महत्त्व राखेको देखिन्छ। उनले खास गरेर २०४७ सालको राजनीतिक परिवर्तनपछि नेपालमा भएका यति धेरै विदेशी हस्तक्षेप र चलखेलले गर्दा नेपाल एउटा स्वतन्त्र मुलुकका रूपमा रहन्न कि भन्ने ठूलो डर र शंका नेपाली जनतामा पसेको कुरा गर्थे। २०६३ सालको परिवर्तनपछि यो डर र शंका झन्झन् बढ्दै गयो। नयाँ संविधानको घोषणा र त्यसपछि उत्पन्न संकटले नेपाललाई साह्रै नाजुक परिस्थितिमा पुयाएकोमा उनी बडो दुःखी थिए। नेपालको अस्तित्व जोगाउन राजसंस्थाको पुनर्बहाली हुनुपर्छ भन्नेमा विश्वास गर्थे। धर्मनिरपेक्षताका बारेमा यो नेपालीको चरित्रसित नसुहाउँदो कुरा लादिएको मान्दथे। यसबाट देशको विशिष्ट पहिचान नै लोप हुने खतरा बढेकाले संविधानबाट धर्मनिरपेक्षता हटाएर नेपाललाई हिन्दु राज्य घोषणा गर्नुपर्ने आवश्यकतामा जोड दिन्थे। उनका विचारमा यो संविधान अव्यावहारिक, नसुहाउँदा र नचाहेका बुँदाले भरिएको छ। संविधानको जन्मदेखि नै यो विवादित भएको छ। यसले देशलाई विखण्डनतिर लैजान्छ। अतः यो संविधानका अमिल्दा खर्चिलो र नेपालजस्तो सानो देशलाई नसुहाउँदा प्रावधान खारेज गर्नुपर्छ भन्नेमा उनको जोड थियो। नेपालको वैदेशिक सम्बन्धमा भारत र चीन नै सबभन्दा महत्त्वपूर्ण देश हुन् भन्ने विचार थियो। नेपालले भारतको सुरक्षामा कुनै पनि ठेस लाग्न नदिने ग्यारेन्टी गर्ने। यसका लागि नेपालभारत सीमालाई नियमन गर्ने। चीनलाई पनि नेपालले सुरक्षाका विषयमा पूरा ग्यारेन्टी दिने। भारत र चीनलाई यति विश्वास दिलाउनुपर्छ कि नेपालले एकअर्काको विरुद्ध कुनै पनि गतिविधि गर्न दिने छैन भनेर विश्वास दिलाउनुपर्छ भन्नेमा उनको विश्वास थियो। उनी आफैंले यी काम गर्न सकिन्छ भन्ने विश्वासमा थिए। नेपालमा चलेको वृद्धभत्ताको विचार तत्कालीन प्रधानमन्त्री मनमोहन अधिकारीलाई दिएको उनै दाबी गर्थे। सोही भत्ताका क्रममा सामाजिक सुरक्षाको नाउँले चल्दै आएको छ। हुन त मासिक पाँच हजार दिने भनेर कबुलिएको थियो तर सरकारले अरू विषयमा झूटो बोलेजस्तै यसमा पनि झूटो बोले। डा देवकोटाले शिक्षा र स्वास्थ्य क्षेत्रमा मानिसहरूलाई सक्दो धेरै सुविधा दिने योजना बनाएका थिए। कक्षा १० सम्मको शिक्षा अनिवार्य गर्ने। स्कुल जाने उमेरका कुनै पनि केटाकेटी घरमा बस्न नपाउने। आर्थिक अवस्था कमजोर परिवारलाई आर्थिक सहायता दिने। कक्षा १२ सम्मको शिक्षा निःशुल्क गर्ने। त्यसैगरी स्वास्थ्य क्षेत्रमा पहिलो प्राथमिकता प्राथमिक स्वास्थ्योपचारलाई दिने। नेपालको कुनै पनि ठाउँमा यस उपचारबाट कसैले पनि वञ्चित हुनुनपर्ने। विशेषज्ञको सेवा उपलब्ध गर्नुपर्ने अवस्थाका लागि स्वास्थ्य बिमाको व्यवस्था गर्ने। आम्दानी भएका नागरिकले उपचार खर्च व्यहोर्नुपर्ने। विपन्न नागरिकलाई राज्यले सबै खर्च दिने। उपचारका लागि आधुनिक र परम्परागत उपचारको सुविधा एकै ठाउँमा उपलब्ध गराउने। त्यस्तो व्यक्ति गुमाउनु यो देशको दुर्भाग्य हो।"
