शीर्षक,विवरण
विश्व बैंकको १७ अर्ब फिर्ता हुँदै,"ऋण व्यवस्थापनमा चुकेको सरकारडिजिटल नेपाल फ्रेमवर्क कार्यान्वयनका लागि प्राप्त १७ अर्ब रुपैयाँको यति ठूलो स्रोत सरकारले समयमै सदुपयोग गर्न नसक्दा प्रोजेक्ट खारेज भई विश्व बैंक यसबाट बाहिरिनु दुःखद विषय भएको डिजिटल अर्थतन्त्रका जानकार एवं यसअघि विश्व बैंकमा काम गरेका विवेक राणा बताउँछन् । एउटा मन्त्रालय वा निकायलेले अर्को मन्त्रालयलाई दोषी देखाउनु, अन्तरनिकाय विभागीय समझदारी नहुनु, सम्झौता गरिएको भन्दा फरक विषयमा काम गर्न खोज्नु, सरोकारवालाहरूलाई सहभागी नगराउनु र एउटा निकायले अर्कोसँग बारम्बार राय मागेर बस्नु भनेको हाम्रो समग्र कर्मचारीतन्त्र संरचनाको अकर्मण्य हो, उनले भने, परियोजनाहरू यसरी फिर्ता जाँदा सरकारलाई अन्य दातृ निकाय र अन्तर्राष्ट्रिय वित्तीय संस्थाहरूबाट सहयोग प्राप्त गर्न कठिन हुन्छ । यसअघि पनि ऋण व्यवस्थापनमा सरकार चुस्त नहुँदा सेन्ट्रल बैंक रिफर्म प्रोग्राम का लागि उपलब्ध गराउने भनिएको रकम विश्व बैंकले फिर्ता लिएर किर्गिस्तानमा लगानी गरेको उनले स्मरण गरे । डिजिटल प्रणाली स्थापना गर्ने विषयमा सरकार गम्भीर नभएकाले पनि डीएनए प्रोजेक्ट असफल भएको विज्ञ राणाको भनाइ छ । डिजिटल नेपालको नारा लगाए पनि परियोजना कार्यान्वयनका विषयमा डेढ वर्षसम्म अन्योल रहनु भनेको डिजिटल अजेन्डा सरकारको प्राथमिकतामै नभएको स्पष्ट बुझिने उनले बताए । कुनै पनि बैंकले आफैं आएर कसैलाई कर्जा दिँदैन, माग भएपछि नै दिने हो, उनले भने, आफैं पैसा मागेर आफैं अलमलमा पर्नुले हाम्रो सरकारको ऋण तथा अनुदान र प्रोजेक्ट व्यवस्थापनको कमजोरी उजागर गरेको छ । अन्तर्राष्ट्रिय दातृ निकायसँग सम्झौता गर्नुअघि र गरिसकेपछि हुनुपर्ने विभागीय पूर्वाधार, अन्तरविभागीय समझदारी बलियो नभएकाले समयमै निर्णय गर्न नसकिएको हो । यो हाम्रा लागि अत्यन्तै दुभार्ग्यपूर्ण कुरा हो ।"
सुँगुरको मिर्गौला पहिलो पटक मान्छेमा,"आठ लाखभन्दा बढी अमेरिकीहरूको मिर्गौला फेल भएको तथ्यांक छ । मिर्गौला पीडितहरूको रगतबाट विषाक्त पदार्थ निकाल्न उनीहरूको डायलसिस गर्ने गरिन्छ । जीवित वा मृत मानवदाताबाट प्राप्त गरिएको मिर्गौला प्रत्यारोपण गर्न एक लाखभन्दा बढी प्रतीक्षा सूचीमा छन् । डायलसिसबाट बिरामीलाई केही अवधिका लागि बचाउन सकिए पनि मिर्गौला प्रत्यारोपण तुलनात्मक रूपमा भरपर्दो उपाय हो । तर मिर्गौला अभावका कारण बर्सेनि हजारौं बिरामी प्रत्यारोपणकै पर्खाइमा मर्ने गर्छन् । प्रत्येक वर्ष अमेरिकामा कुल २५ हजार मिर्गौला प्रत्यारोपण हुने गर्छ ।मानिसमा जनावरको अंग प्रत्यारोपण गरिने विधा जेनोट्रान्सप्लान्टेसनलाई दशकौंदेखि एक सम्भावित समाधानका रूपमा हेरिँदै आएको छ । यो मिर्गौला पीडितका लागि अझ प्रभावकारी हुने देखिन्छ । तर यसको चुनौती भनेको मानव प्रतिरक्षा प्रणालीले प्रत्यारोपण गरिएका अर्काको तन्तुहरूलाई अस्वीकार हो । यसो भएमा झन् जटिलता निम्त्याउन सक्छ । राम्रोसँग मेल खाएका दाताहरूबाट लिइएको अंगलाई पनि दीर्घकालमा शरीरले अस्वीकार गर्ने जोखिम रहने विशेषज्ञहरू बताउँछन् ।हालैका वर्षहरूमा जिन सम्पादन र क्लोनिङलगायतका वैज्ञानिक प्रगतिहरूले जेनोट्रान्सप्लान्टलाई वास्तविकताको नजिक पुर्याएको छ । यसले अंगहरूलाई अझ मिल्दो बनाउन र प्रतिरक्षा प्रणालीद्वारा अस्वीकार गर्ने सम्भावना कम गराउन जनावरको जिनहरू परिमार्जन गर्न सम्भव बनाएको छ । प्रत्यारोपण गरिएको यो मिर्गौला बायोटेक कम्पनी इजेनेसिसद्वारा इन्जिनियर गरिएको सुँगुरबाट प्राप्त गरिएको हो, जसले अंगको सम्भावित अस्वीकृतिमा संलग्न तीनवटा जिनहरू हटाएको थियो । साथै, मानव अनुकूलता बढाउन सात मानव जिनहरू पनि सम्मिलित गरिएको थियो । सुँगुरहरू रेट्रोभाइरसका वाहक हुने भएकाले कम्पनीले मानिसलाई सर्ने सम्भावना रहेको भाइरसलाई पनि निष्क्रिय बनाएको थियो ।सेप्टेम्बर २०२१ मा न्युयोर्कको एनवाईयू लागोन हेल्थका शल्यचिकित्सकहरूले आनुवंशिक रूपमा परिमार्जित सुँगुरको मिर्गौला एक मस्तिष्कमृत (ब्रेन डेथ) व्यक्तिमा जोडेका थिए । सो व्यक्तिमा यसले काम गरेर पिसाब बनाउन थालेको थियो । केही समयपछि बर्मिङ्घमको अलाबामा विश्वविद्यालयका वैज्ञानिकहरूले पनि आफूहरूले गरेको सोही प्रकारको परीक्षण सफल भएको घोषणा गरेका थिए ।युनिभर्सिटी अफ मेरिल्यान्डका शल्यचिकित्सकहरूले आनुवंशिक रूपमा परिमार्जित सुँगुरबाट मुटुरोग भएका बिरामीहरूमा दुई पटक मुटु प्रत्यारोपण गरिसकेका छन् । उनीहरूमा सुरुमा अंगले काम गरेको थियो भने शरीरले पनि स्वीकार गरेको थियो । तर केही समयपछि भने मुटु प्रत्यारोपण गरिएका दुवै बिरामीको रोगको प्रकृतिका कारण मृत्यु भएको थियो । आफ्नो मिर्गौला फेल भएपछि स्लेम्यानले सात वर्षदेखि डायलसिस गराउँदै आएका थिए । सन् २०१८ मा मानव मिर्गौला प्रत्यारोपण गराए पनि त्यो पाँच वर्ष नपुग्दै असफल भएको थियो । त्यसपछि उनले पुनः डायलसिस सुरु गर्नुपरेको थियो । जसका कारण उनमा हृदयाघातलगायत जटिलताहरू देखिएको डा विलियम्सले बताए । जब स्लेम्यानले २०२३ मा डायलसिस पुनः सुरु गरे, उनमा गम्भीर भास्कुलर जटिलताहरू देखिएको थियो । उनको रक्त नलीहरू जम्दै र असफल भइरहेका थिए । उनलाई बारम्बार अस्पतालमा भर्ना गर्नुपरेको थियो, डा विलियम्सले भने, स्वास्थ्य समस्याका बाबजुद पनि काम गरिरहने स्लेम्यानले अर्को मानव मिर्गौलाका लागि पाँचदेखि ६ वर्ष कुर्नुपर्ने थियो । तर उनी यो अवधिसम्म बाँच्न सक्ने अवस्थामा थिएनन् । डा विलियम्सले स्लेम्यानलाई सुँगुरको मिर्गौला प्रत्यारोपणबारे प्रस्ताव गरेपछि विभिन्न प्रश्नहरूका बाबजुद उनले स्वीकृति दिएका थिए । मैले यसलाई मलाई मद्दत गर्ने तरिकाका रूपमा मात्र नभई बाँच्नका लागि प्रत्यारोपण आवश्यक पर्ने हजारौं मानिसहरूका लागि आशा प्रदान गर्ने तरिकाका रूपमा देखेको छु, मास जनरलद्वारा उपलब्ध गराइएको विज्ञप्तिमा उनले भनेका छन् ।स्लेम्यानको नयाँ मिर्गौलाले अहिलेसम्म काम गरिरहेको देखिन्छ भने उनलाई डायलसिस आवश्यक परेको छैन । सुँगुरको नयाँ मिर्गौलाले पिसाब बनाउँदै छ भने क्रिएटिनिन र अनावश्यक तरल पदार्थलाई पनि फिल्टर गर्दै छ । चिकित्सकहरूका अनुसार उनको स्वास्थ्य अवस्थामा दिनानुदिन सुधार हुँदै गइरहेको छ । यद्यपि डाक्टरहरूले स्लेम्यानलाई अंग अस्वीकारको लक्षणहरूका लागि निगरानीमा राखिरहेका छन् । मास जनरलको लेगोररेटा सेन्टर फर क्लिनिकल ट्रान्सप्लान्ट टोलरेन्सका निर्देशक डा तात्सुओ कावाई र डा नाहेल इलियाससहित सर्जनहरूको टोलीले चार घण्टा लामो शल्यक्रिया गरेको थियो । एजेन्सीको सहयोगमा"
