शीर्षक,विवरण
कसले बनायो गुट ?,"नेकपामा ओली समूहभित्रै नेता ईश्वर पोखरेल छन् । ओली समूहमै रहे पनि विगतमा दुईपटकसम्म महासचिव भएकाले उनको वरिपरि लाग्ने सानो समूह छ । नेता नेपाल समूहभित्र पनि केही नेताहरूको ससानो घेरा छ । स्थायी समिति सदस्य घनश्याम भुसाल, योगेश भट्टराईहरूको उपसमूह नेपाल समूहभित्रै पनि छ ।पूर्वमाओवादी धारभित्र अध्यक्ष पुष्पकमल दाहाल नै मुख्य नेता हुन् । तर यो धारभित्र दाहालको मात्र होइन, अन्य नेताका पनि समूह छन् । तत्कालीन माओवादीसँग एकता प्रक्रियामा जोडिएका पूर्वएकता केन्द्रका नारायणकाजी श्रेष्ठको समूह छ । माओवादी शान्ति प्रक्रियामा आएपछि एकता भएकाले श्रेष्ठको छुट्टै पहिचान पार्टीभित्र छ । त्यसैले आन्तरिक लेखाजोखामा श्रेष्ठको उपसमूह पनि देखिन्छ । माओवादीबाट फुटेर गएको मोहन वैद्य समूहबाट रामबहादुर थापा नेतृत्वको समूह फर्कियो । फर्किएर आएपछि उक्त समूहको पनि छुट्टै अस्तित्व छ । त्यसैले माओवादी धारभित्र दाहाल, श्रेष्ठ र थापाका उपसमूह छन् । नेकपा संयुक्तबाट माओवादीमा जोडिन आइपुगेका गणेश साहलगायत पनि छन् । तर पार्टीभित्र बार्गेनिङ र आफ्नो समूह संस्थागत गर्ने तहको भूमिकामा छैनन् ।नेकपाभित्रका गुटले कुन तहको आकार लिइसकेका छन् भन्ने प्रस्टोक्ति अध्यक्षद्वयकै प्रतिवेदनमा पनि छ । पार्टीभित्र घात, अन्तर्घात र अराजकताका प्रवृत्तिहरू बढिरहेका छन् । पार्टी अनुशासनको स्तर दयनीय अवस्थामा छ । पार्टी अनुशासनको स्थान गुट अराजकताले लिने खतरा दिन प्रतिदिन बढ्दै गएको छ प्रतिवेदनमा छ । प्रतिवेदनको यो अंशले पुष्टि गर्छ कि नेकपाभित्र पार्टीको अनुशासनभन्दा गुटीय अनुशासन प्यारो बन्दै गइरहेको छ । पार्टीको अनुशासन नभएपछि विधि र पद्धतिलाई बिर्सिएपछि हुने यस्तै हो, नेकपाको अनुशासन आयोगका अध्यक्ष अमृत बोहराले भने, आलोचनालाई विरोधका रूपमा लिइयो र पार्टीको संस्थागत प्रणालीलाई कमजोर बनाइयो, यसकै कारण गुटबन्दी बढेको हो । एकतापछि नेकपा सचिवालयका नौ जनाभन्दा बाहिर छलफल नै हुँदैन । सचिवालयभित्र पनि अध्यक्षद्वयको निर्णय हुन्छ । तीनतीन महिनामा बस्ने भनेको स्थायी समिति बैठक एक वर्षमा बल्ल बसिरहेको छ । योभन्दा ठूलो केन्द्रीय समिति बैठक एकता भएको डेढ वर्ष बितिसक्दा पनि बसेको छैन ।स्थायी समितिका दुई बैठकका बीचको लामो अन्तराल, प्रत्येक तीन महिनाभित्र बैठक बस्नै पर्ने आफ्नो निर्णय एवम् स्थायी समितिसम्बन्धी अन्तर्राष्ट्रिय कम्युनिस्ट आन्दोलनको मान्यता र मर्मसमेतका विपरीत हुन गएको छ अध्यक्षद्वयले आफ्नो प्रतिवेदनमा बैठक नबसेको कुरालाई यसरी गल्तीका रूपमा महसुस त गरेका छन् । तर यसलाई सच्याउने तत्परता भने प्रतिवेदनमा उल्लेख छैन । गत वर्षको स्थायी समिति बैठकमा पनि गल्तीको कुरा उठेपछि अध्यक्षद्वयले जवाफ दिने क्रममा सच्याउने प्रतिबद्धता जनाएका थिए । तर यो बीचमै धेरै विवाद र झगडा बढे । नियमित बैठक नहुँदा पार्टीभित्र के भइरहेको छ भन्ने थाहा पाउन केन्द्रीय तहका नेताहरू पनि सचिवालय तहका नेतासँग पुग्नुपर्ने हुन्छ । त्यसलाई सचिवालयका नेताहरूले आफ्नो समूह बलियो बनाउने अवसरका रूपमा प्रयोग गरेका छन् ।गुटबन्दीका कारण पार्टीभित्र अहिले व्यक्तिगत क्षमता र योगदानभन्दा भाडबन्डाको पल्ला भारी छ । राजनीतिक नियुक्ति र पार्टीका आन्तरिक कमिटीहरूमा भागबन्डा हुन्छ । मुख्यतः पूर्वएमाले र पूर्वमाओवादी धारको भागबन्डा छ । एकीकरण प्रक्रियामा रहेकाले यो भागबन्डालाई नेताहरूले स्वाभाविक ठानेका छन् । यी दुई धारभित्र पनि नेतानेताबीचको भागबन्डा हुने गरेको छ, जसले पार्टीभित्र योगदान र क्षमताको कदर कम हुन थालेको गुनासो बढेको छ । जस्तो, वरिष्ठ नेता माधव नेपालले यसअघि सचिवालयमा राखेका तीनवटा नोट अफ डिसेन्ट भागबन्डासँगै जोडिएका थिए । ओली पक्षले एकलौटी रूपमा आफूनिकट व्यक्तिहरूलाई प्रदेश र विभागमा राखेको भन्दै उनले असहमति राखेका थिए । पहिले पार्टीभित्र संस्थागत छलफल हुन्थ्यो, अहिले छलफल गर्ने प्रणाली कमजोर भएको छ, नेता बोहराले भने, सचिवालयलाई नै मुख्य ठानिएको छ, पार्टी प्रणाली होइन, नेताकमिटी बनाइएको छ ।तत्कालीन पार्टीमा राज्य व्यवस्था विभाग सक्रिय थियो । त्यसले राजनीतिक नियुक्तिलगायतमा भूमिका खेल्थ्यो । पार्टीको नियुक्तिमा जानेहरूको सम्भावित सूची तयार गर्थ्यो । अहिले त्यो विभाग बल्ल बन्दै छ । नियुक्ति हुने व्यक्तिहरू नेताका खल्तीबाट चयन हुन्छन् । यो बीचमा प्रधानमन्त्री तथा मन्त्रीहरू बने, बदलिए । तर पार्टीभित्र एजेन्डा राखेर छलफल भएन । यसलाई पार्टीभित्रको लोकतन्त्र साँघुरिएका रूपमा बुझ्नुपर्ने विश्लेषक प्रसार्इंको धारणा छ । पार्टी भित्र लोकतन्त्रको स्पेस निचोरेपछि गुटबन्दी बढ्छ, लोकतान्त्रिक ढंगले भनेर नहुने भएपछि गुटमा लाग्नै पर्ने हुन्छ उनले भने ।अध्यक्षद्वयको प्रतिवेदनमा सोमबार सुरु भएको छलफलमा पार्टी गुटबन्दीले बिगारेको भन्दै परिपाटीमाथि नेताहरूले प्रश्न गरेका छन् । पार्टीले दुई वर्षदेखि सरकार चलाइरहँदा सरकारका काममा पार्टीका नेताहरू अनभिज्ञ बन्ने अवस्था आएको उनीहरूको भनाइ छ । नेता युवराज ज्ञवालीले पार्टीको योजनाअनुसार सरकार चल्ने खालको पद्धति बसाउनुपर्ने माग गरेका छन् । पार्टीभित्र बढ्दै गएको एकाधिकार पुरुष नेताहरूको हालिमुहालीमाथि पनि प्रश्न उठेको छ । गुटबन्दीकै कारण आआफ्नो पक्षका व्यक्तिहरू खोज्दा पार्टीको समावेशी छविमा धक्का लाग्न थालेको धारणा नेत्रीहरू अष्टलक्ष्मी शाक्य र पम्फा भुसालले सोमबारको बैठकमा राखेका छन् । अध्यक्षद्वयको प्रतिवेदनमा प्रभावकारी प्रशिक्षण नभएको र संगठनात्मक संरचना नबनेको लगायतका कारणले गुटबन्दी र अन्योल बढेको उल्लेख छ । तर संगठनात्मक एकीकरणको काम सक्न झन्डै डेढ वर्ष समय लगाउने शीर्ष नेताहरू नै हुन् । पार्टीको राजनीतिक प्रतिवेदन कस्तो हुने, के लाइन लिने भन्नेमा पूर्वएमाले र माओवादी गुटबीच विवाद भयो । त्यस्तै संगठनात्मक संरचनाबारे गुटहरूकै भागबन्डामा कुरा नमिल्दा झन्डै डेढ वर्ष बित्यो । संगठनकै स्वरूपमाथि पनि अझै स्पष्ट नभएको धारणा नेता वामदेव गौतमले सोमबारको बैठकमा पनि राखेका छन् । केन्द्रीय तहमा रहेको शीर्षनेताहरूबीचको गुट र भागबन्डाको रोग तल्लो तहसम्म फैलिएको छ । एकीकरण प्रक्रियामा अहिले एउटै जिल्लामा एकभन्दा बढी सहइन्चार्ज राखिएका छन् । एकभन्दा बढी सहइन्चार्ज भएपछि प्रत्येक जिल्लामा त्यो पदलाई नेताहरूले आफ्नो समूह निर्माण गर्नमा बढ्ता खर्च गरिरहेका छन् । केही समयअघि प्रदेश २ मा केन्द्रीय गुटबन्दीको आडमा तल्लो तहमा नेताहरूले आफ्नो वर्चस्व जमाउन खोज्दा झडपको स्थिति मात्र आएन, पार्टीबाट निष्कासन गर्नुपर्ने मागसहितका ज्ञापनपत्र अध्यक्ष ओली र दाहाललाई बुझाउने परिस्थिति निर्माण भयो । यस्ता प्रवृत्ति झाँगिइरहँदा जारी बैठकले अध्यक्षद्वयको राजनीतिक प्रतिवेदनलाई विगतमा जस्तै अध्यक्षहरूले बैठकमा उठेको प्रश्नमाथि दिने कर्मकाण्डी जवाफका भरमा पारित गर्छ वा बृहत् परिमार्जन गर्छ ? केही दिनमै देखिनेछ ।"
जनताको सवालमा सरकार मौन,"उनीहरूले सरकारले गरेका कतिपय राम्रा र महत्त्वपूर्ण काम पनि जनताले अनुभूत गर्न नसकेको टिप्पणी गरे । उनीहरूले मन्त्रीहरू नियुक्ति र बर्खास्तीको कारण दिन आग्रह गरेका छन् ।एमसीसी पारित गर्न हुन्न बैठकमा स्थायी समिति सदस्य भीम रावल र देव गुरुङले संसद्बाट मिलिनियम च्यालेन्ट कम्प्याक्ट (एमसीसी) सम्बन्धी सम्झौता गर्न नहुने बताए । उनीहरूले एमसीसी इन्डोप्यासिफिक रणनीतिअन्तर्गतकै रहेको जिकिर गर्दै त्यसलाई संसद्बाट पारित गर्न नहुने बताएका हुन् । एमसीसी सम्झौतामा हस्ताक्षर गरेपछि इन्डोप्यासिफिक रणनीतिमा सहभागी भएको ठहरिन्छ, बैठकपछि स्थायी समिति सदस्य गुरुङले पत्रकारसँग भने, हाम्रो वैदेशिक नीतिसँग बाझिने गरी कुनै पनि सम्झौता गर्न हुँदैन । प्रधानमन्त्री केपी शर्मा ओलीले संसद्को हिउँदे अधिवेशन सुरु हुनेबित्तिकै संसद्बाट एमसीसी सम्झौता पारित हुने बताएका थिए ।बैठकमा नेता रावलले भारतले नयाँ नक्सा जारी गरिसकेपछि नेपालले पनि आफ्नो भूभाग समेटिने गरी नयाँ नक्सा जारी गर्न तदारुकता नदेखाएको टिप्पणी गरे । उनले उच्चस्तरीय टोली बनाएर नेपालको नयाँ नक्सा तत्काल जारी गर्नुपर्ने बताए । सचिवालयलाई समावेशी बनाऔंबैठकमा स्थायी समिति सदस्यहरू युवराज ज्ञवाली, अष्टलक्ष्मी शाक्य, पम्फा भुसाललगायतले सचिवालयको संख्या बढाउन प्रस्ताव गरेका छन् । स्थायी समितिको एक तिहाइ सदस्य हुने गरी सचिवालयको संख्या १५ सदस्यीय बनाउनुपर्छ, बैठकमा नेताहरूले भने । सोमबार बोल्ने दुई महिला सदस्यले सचिवालय समावेशी नभएको भन्दै त्यसलाई समावेशी बनाउन र महिलालाई पनि समावेश गर्ने गरी विधान संशोधन गर्न माग गरे । धारणा राख्ने १२ जना स्थायी समिति सदस्यमध्ये महिला समावेशीको कुरा उठाउनेमा अष्टलक्ष्मी शाक्य र पम्फा भुसाल मात्रै थिए । नेता छविलाल विश्वकर्माले संविधानले व्यवस्था गरेअनुसार दलित समुदायको प्रतिनिधित्व कतै पनि हुन नसकेको बताए । यस्तै नेताहरूले पार्टी केन्द्रीय कार्यालयहरूमा जस्तै जिल्ला र प्रदेश कमिटीहरूमा पनि उपाध्यक्षको व्यवस्था हुनुपर्ने माग गरेका छन् । बैठकमा नेताहरूले पार्टीको एकता महाधिवेशनको मितिबारे प्रस्ट पार्न नेतृत्वसँग माग गरेका छन् । उनीहरूले ०७७ को अन्त्यसम्ममा महाधिवेशन गर्ने प्रस्ताव साँच्चै हो या प्रस्तावका रूपमा मात्रै आएको हो भनेर प्रश्न पनि सोधेका थिए । वामदेवले भने संगठनात्मक सिद्धान्त मिलेन बैठकमा सचिवालय सदस्य वामदेव गौतमले पार्टीको संगठनात्मक सिद्धान्त नमिलेको बताएका छन् । पार्टी सदस्य हुन नीति, सिद्धान्त र विचार मानेर मात्रै हुन्न, गौतमले भने, संगठनमा काम गर्न तयार हुनुपर्छ र आर्थिक रूपले पनि पार्टीलाई सहयोग गर्नुपर्छ । उनले विचार मात्रै मिल्नेलाई सदस्यता दिँदा पार्टीको संगति नमिलेको बताउँदै अब सदस्यता वितरणमा ध्यान दिनुपर्ने बताए । गौतमले पार्टीले वैज्ञानिक समाजवादलाई आफ्नो कार्यक्रम बनाएर अघि बढ्नुपर्नेमा जोड दिए । बोहराको फरक मत पार्टी अनुशासन आयोगलाई केन्द्रीय कमिटीले निर्देशन दिन सक्ने विधानको व्यवस्थाप्रति अनुशासन आयोगका अध्यक्ष अमृत बोहराले फरक मत राखेका छन् । उनले यसअघिको स्थायी समिति बैठकमा पनि अनुशासन आयोगलाई अरू विभागजस्तै केन्द्रीय कमिटीले सञ्चालन गर्न सक्ने व्यवस्था संशोधन गर्न माग गरेका थिए । अनुशासन आयोगलाई स्वायत्त बनाउनुपर्छ भन्ने उहाँको पहिलेदेखिकै माग हो, स्रोतले भन्यो, तर यसपालि विधान संशोधन प्रस्ताव आउँदा पनि उक्त विषय नसमेटिएपछि बोहराले उपस्थितिमा हाजिर गर्नुभएको छैन । बोहरा स्थायी समिति बैठकमा सहभागी छन् । उनले आइतबार बैठक सुरु हुनेबित्तिकै आफू उपस्थित भए पनि बैठकको उपस्थितिमा हस्ताक्षर नगर्ने जानकारी गराएका थिए । उनले स्थायी समितिमा प्रतिवेदनमाथि बोल्न बाँकी छ । सोमबारको बैठकमा १२ जना सदस्यले आफ्ना धारणा राखेको र बाँकी छलफलका लागि मंगलबार फेरि बैठक बस्ने प्रवक्ता नारायणकाजी श्रेष्ठले जानकारी दिएका छन् ।"
