शीर्षक,विवरण
लिपुलेक क्षेत्र नेपाली भूमि हो : राष्ट्रपति भण्डारी,"काठमाडौं : राष्ट्रपति विद्यादेवी भण्डारीले लिम्पियाधुरा, लिपुलेक र कालापानी क्षेत्र नेपालको भूमि भएकाले त्यसलाई प्राप्त गर्न तदनुकूल पहल गरिने बताएकी छन्। सोमबार संघीय संसद्को दुवै सदनको संयुक्त बैठकलाई सम्बोधन गर्दै उनले छुटेको नेपालको भूमि समावेश गरी नयाँ नक्शा सार्वजनिक गरिने जानकारी दिइन। लिपुलेक क्षेत्रमा अतिक्रमण गरी हालै भारतले सडक निर्माण गरेको थियो। नीति तथा कार्यक्रममा वर्तमान सरकार गठनपछि छिमेकी मुलुकसहित अन्तरराष्ट्रिय सम्बन्धमा नयाँ आयाम स्थापित भएको पनि जनाइएको छ।"
मासु पसलमा आगलागी,"धादिङ : शुक्रबार सदरमुकामको एक मासु पसलमा आगलागी हुँदा पसल जलेर पुर्ण क्षति भएको छ। निलकण्ठ नगरपालिका३ पुछारबजार बसपार्क रोडमा रहेको रेडियो विहानीको घरमा सटर भाडा लिएर सञ्चालन गरिएको रामकोट फ्रेस हाउसमा आगो लागेको हो। मासु पोल्नको लागि राखिएको ग्यास लिक भएर आगो लागेको हुनसक्ने अनुमान गरिएको छ । सटर पछाली आवास कोठा र सटरमा पसल रहेकाले दुवै कोठा पुर्ण रुपमा जलेको छ। आगलागी लगत्तै नगरपालिकाको दमकल, सशस्त्र प्रहरी, नेपाल प्रहरी र स्वयंसेवकहरुको पहलमा आगो नियन्त्रणमा लिइएको थियो। तर पसलमा रहेका फ्रिज खाद्यान्न लगायतका सामाग्रीहरु भने पुर्ण रुपमा जलेको छ। समयमै आगो निभाउन सकेकाले माथिल्लो तल्लामा रहेको रेडियो विहानीको स्टेशन जोगिएको थियो। आगलागीबाट ५ लाख भन्दामाथिको क्षति भएको अनुमान गरिएको छ। क्षतिको यकिन विवरण थप अध्ययन पछि मात्रै आउने जिल्ला प्रहरी कार्यालय धादिङका सूचना अधिकारी रुपक खड्काले बताए।"
संरक्षण र उत्खनन्को पर्खाइमा तेताङको नुनखानी,जोमसोम : मुस्ताङको वारागुङ मुक्तिक्षेत्र ३ तेताङमा अवस्थित ऐतिहासिक तथा प्राकृतिक नुन खानी संरक्षणको पर्खाइमा छ । करिब ३० वर्षअघि मुस्ताङको टुकुचेका स्थानीय समाजसेवी सुब्बा शंकरमान शेरचनले उक्त नुन खानी जिल्ला भित्र प्रयोगमा ल्याएका थिए । पछिल्लो समय बजारिया प्रशोधित नुनको उपयोग हुन थालेपछि तेताङको ऐतिहासिक नुन खानी ओझेलमा परेको हो । उ समय सुब्बा शेरचनले नुन खानीको संरक्षण गर्दै जिल्ला भित्र प्रयोगमा ल्याएको वारागुङ मुक्तिक्षेत्र३ का वडाध्यक्ष नविनकुमार गुरुङले जानकारी दिए । तत्कालिन समयमा सुब्बा शेरचनले प्रति पाथी नुनको १९ रुपैयाँमा बिक्री गर्ने गरेको वडाध्यक्ष गुरुङले स्मरण गरे । बजारिया नुन नहुँदा र मुस्ताङमा सडक संञ्जालले नजोडिँदा तेताङको नुन उपयोग हुने गरेको थियो। स्थानीय नुन उ समय गाउँले र पशु चौपाया आदीलाई खुवाउने गथ्र्ये । सुब्बा शेरचनले नुन खानी उपयोगमा ल्याउन छोडेपछि स्थानीय गाउँ समाजले नुन खानी संञ्चालन तथा संरक्षण गरे । तर त्यो नुन खानी उत्खनन्को काम दिर्घकालिन बन्न सकेन । नुन खानी संरक्षण तथा उत्खनन हुन नसक्दा बर्सेनि लाखौं मुल्यको नुन त्यसै खेर गइरहेको वडाध्यक्ष गुरुङले सुनाए । वारागुङ३ तेताङको नरसिंह खोलाको कलात्मक पहाडमा नुन खानी अवस्थित छ । त्यहाँ पहाडबाट रसाएको नुनिलो पानीलाई पाइपमार्फत तानेर कुण्डमा जम्मा गरी ढिक्क बनाइने गरिन्थ्यो । तल्लो मुस्ताङ देखि उपल्लो मुस्ताङका ९६ वटै गाउँमा तेताङको नुन पुग्ने गथ्र्यो ।तेताङ नुन खानी ऐतिहासिक तथा धार्मिक दृष्टिकोणले पनि महत्वपूर्ण मानिएको छ । ८ औं शताब्दी अर्थात् १३ सय वर्ष अघि बुद्धिस धर्म गुरु पद्यसम्भवले तेताङको नरसिंह खोला पहाडमा नुन रोपेको धार्मिक किंवदन्ती छ । छिमेकी देश भारतमा जन्मिएका गुरु पद्यसम्भव राक्षसको बध गर्न तिब्बत जाने क्रममा तेताङको नरसिंह खोला पहाडको ओढारमा ध्यान बसेका भन्ने भनाइ छ । पद्य सम्भवकै दैवी शक्तिको बलले तेताङको नरसिंह खोला पहाडमा नुन खानी उत्पती भएको कागछोदे गुम्बाका खेम्बो तेन्जिङ साङ्वोले सुनाए । उनले पद्य सम्भवसँग जोडिएका मुस्ताङका कतिपय तिर्थस्थल मध्ये तेताङको नुन खानी पनि एक भएको उनको भनाई छ । मुस्ताङको जोमसोमकोरला सडकको पूर्वतर्फ नरसिंह खोला तिरैतिर करिब १ घण्टाको पैदलयात्रापछि नुन खानी स्थल पुग्न सकिन्छ । बर्खायाममा खोलाको बहाव उच्च हुँदा ३ महिना नुन खानी स्थल पुग्न कठिन हुन्छ । मुस्ताङ जिल्ला खानी तथा जैविक विविधताले महत्वपूर्ण भएकाले ३ वर्षअघि खानी तथा भूगर्व विभागको एक टोलीले समेत नुन खानीको संम्भाव्य अध्ययन गरेको थियो । नुन खानीको निरीक्षण गर्न तत्कालिन उद्योग मन्त्री सोमप्रसाद पाण्डेसहित खानी विभागका ३ सदस्यीय भूगर्व विद् टोली मुस्ताङ आएका थिए । मुस्ताङका संघीय सांसद प्रेमप्रसाद तुलाचनको पहलमा ४ वर्षअघि मुस्ताङमा नुन खानी र युरोनियम खानीको सम्भाव्यता अध्ययन भएको थियो । अध्ययन टोलीले ऐतिहासिक तथा प्राकृतिक नुन खानीलाई व्यवसायिक रुपमा संञ्चालन गर्ने संम्भावना कम भएको तर यसलाई स्थानीय स्तरको उद्योगको रुपमा विकास गर्न सकिने निश्कर्ष निकालेको थियो । मुस्ताङका संघीय सांसद तुलाचनले नुन खानीलाई पर्यटकीय गन्तब्यमा विकास गर्न र स्थानीय स्तरको उद्योगमा संञ्चालन गर्न सके रोजगारी तथा पर्यटन प्रर्वद्धनमा सघाउ पुर्याउने बताएका छन् । प्रयोगविहीन अवस्थाको ओझेलमा परेको नुन खानीलाई स्तरोन्नति गर्न वारागुङ मुक्तिक्षेत्रले चालु वर्ष १० लाख बजेट विनियोजन गरेको गाउपालिका अध्यक्ष फेञ्चोक छेप्तेन गुरुङले जानकारी दिए । नुन खानी स्थलमा कुण्ड निर्माण तथा पाइप लाइन जोड्न र आवश्यक तटबन्ध निर्माण गर्न बजेट विनियोजन भएको उनले बताए । नरसाङ खोलाको देब्रेतर्फ पहाडबाट नुनिलो पानी रसाउने गरेको छ । पाइपबाट खोलाको दाहिनेतर्फ ५ वटा नुन भण्डारण गर्ने कुण्ड भएपनि संरक्षणको अभावमा जीर्ण बनेको अध्यक्ष गुरुङले जानकारी दिए । लकडाउन हटेको खण्डमा चालु आर्थिक वर्षभित्रै नुन खानी स्थलको पूर्वाधार स्तरोन्नति गर्ने लक्ष्य रहेको उनको भनाइ छ ।
महानगरका सफाई कर्मचारीसहित ३१ जनाको आरडीटी रिपोर्ट पोजिटिभ,"काठमाडौं : काठमाडौँ महानगरपालिकामा काम गर्ने ३१ जनामा कोरोना भाइरस (कोभिड१९) पोजेटिभ देखिएको छ। शुक्रबार गरिएको र्यापिड डाइगोनेस्ट परीक्षणमा ३१ जानाको पोजेटिभ देखिएको महानगरपालिकाका स्वास्थ्य विभाग प्रमु्ख नरेन्द्र विलास बज्राचार्यले बताए। पोजेटिभ देखिएका अधिकांस सफाइ कर्मचारी रहेको उनले बताए। हामीले आज सफाई कर्मचारी, चालक र स्वास्थ्य स्वयम सेवकको कोरोना परिक्षण गरेका हौँ, उनले भने, परीक्षण गरिएको मध्ये ३१ जनामा पोजेटिभ देखिएको छ। जसमा सफाई कर्मचारी र महिला स्वायमसेविकालाई देखिएको छ। महानगरले स्वास्थ्य विभागको समन्वयमा शुक्रबार नौ सय ३४ जनाको कोरोना परीक्षण गरिएको थियो। जसमध्ये आडीटी विधिबाट छ सय ६४ र पिसिआर विधिबाट दुई सय ७० जनाको परीक्षण गरिएको महानगरपलिकाको स्वास्थ्य विभाग प्रमुख बज्राचार्यले जानकारी दिएका छन्। हामीले आरडिटि र पिसिआर दुवै विधिबाट परिक्षण गरेका थियौँ, उनले भने, जसमा पिसिआर टेस्टको त रिजल्ट आउन समय लाग्छ। आर डिटिमा सफाई कर्मचारी र स्वास्थ्य स्वयम सेविकाको पोजेटिभ देखिएको छ। पीसीआर विधिबाट टेस्ट गर्दा लामो समय लाग्ने भएकाले आरडीटी विधिबाट पनि परीक्षण गरिएको उनले बताए। सफाई कर्मचारीको कोरोना परिक्षण महानगरपालिका र स्वास्थ्य सेवा विभागको समन्वयमा भएको थियो। आरडीटीमा पोजेटिभ देखिएका सबै कर्मचारीको स्वाब निकालेर पिसिआर परिक्षणका लागि पठाइएको प्रमुख बज्राचार्यले बताए।"
सबै सामुदायिक विद्यालयमा उच्च गतिको इन्टरनेट,काठमाडौं : सरकारले सबै सामुदायिक विद्यालयमा उच्च गतिको इन्टरनेट पुर्याउने भएको छ। शुक्रबार संघीय संसदको संयुक्त बैठकमा आर्थिक वर्ष २०७७ ७८ को नीति तथा कार्यक्रम सार्वजनिक गर्दै सरकारले यस्तो घोषणा गरेको हो। बैठकमा नीति तथा कार्यक्रम प्रस्तुत गर्दै राष्ट्रपति विद्यादेवी भण्डारीले सबै सामुदायिक विदालयमा उच्च गतिको इन्टरनेट र आधुनिक प्रयोगशाला निर्माण गर्ने घोषणा गरेकी हुन्। सँगै शिक्षा क्षेत्रमा सरकारले विभिन्न नयाँ योजना ल्याएको छ।
"चन्द्रागिरीमा पाँच जनालाई कोरोना संक्रमण देखिएपछि कडाइ, औषधि पसल मात्रै खुल्ने","काठमाडौं : काठमाडौँ उपत्यकाको मुख्य प्रवेशद्वारमा रहेको चन्द्रागिरी नगरपालिकाले पाँच जनामा कोरोना परीक्षण रिपोर्ट पोजिटिभ देखिएपछि लकडाउनलाई कडाइ गर्न लागेको छ। नगरपालिकाले सशस्त्र प्रहरी अस्पताल बलम्बुमा ४८५ लाई गरेको पिसिआर परीक्षणमा पाँच जनाको कोरोना परीक्षण रिपोर्ट पोजिटिभ आएपछि लकडाउनलाई कडाइ गर्न लागेको हो। परीक्षण गरिएका ४८५ मध्ये ७२ जनाको रिपोर्ट आउन बाँकी रहेको छ। पोजिटिभ रिपोर्ट आएकामध्ये वडा नं ९ मच्छेगाउँका एक, वडा नं १ दहचोकका एक, वडा नं १२ बलम्बुका एक र दुई सशस्त्र प्रहरी बलमा कार्यरत व्यक्ति रहेका छन्। सशस्त्रका दुईमध्ये एकजना अस्पतालमा कार्यरत र अर्को एकजना भक्तपुरको दुवाकोटमा बस्दै आएका थिए। नगरपालिकाका प्रवक्ता हरिभक्त महर्जनले चन्द्रागिरीमा कोरोना सङ्क्रमितको सङ्ख्या बढेकाले नगरपालिकाभित्र तीन दिनका लागि लकडाउनलाई कडाइ गर्न लागेको जानकारी दिए। 'भोलिदेखि तीन दिनसम्म नगरपालिकाभित्रका औषधी पसलबाहेक अन्य पसल र नगरपालिकाभित्र हुँदै आएका विकास निर्माणका कार्यलाई सञ्चालनमा रोक लगाउने निर्णय गरेका छौँ', उनले भने। बिरामी मानिस हिँडडुल गर्नुपरेमा सामाजिक दूरी कायम राखी, स्यानेटाइजर, माक्स र पञ्जा लगाएर मात्र हिँड्न आग्रह गरिएको प्रवक्ता महर्जनले बताए। नगर प्रमुख घनश्याम गिरीले चन्द्रागिरिमा कोरोना सङ्क्रमितको सङ्ख्या बढेसँगै चेकजाँचको सङ्ख्यालाई समेत वृद्धि गरिएको जानकारी दिए।"
बैतडीमा भारतबाट आएका एकजनामा आरडीटी रिपोट 'पोजिटिभ ',"बैतडी : बैतडीमा क्वारेन्टाइनमा बसेका एकजनाको आरडीटी रिपोट पोजिटिभ देखिएको छ । डिलाशैनी गाउँपालिका १ सरस्वती मावि नानारा क्वारेन्टाइनमा बसेका ५० वर्षीय पुरुषको आरडीटी रिपोट पोजेटिभ देखिएको डिलाशैनी गाउँपालिकाका स्वास्थ्य शाखा प्रमुख नवराज जोशीले जानकारी दिए । गत वैशाख १८ गते भारतको धार्चुला नाकाबाट स्वदेश भित्रिएका डिलाशैनी गाउँपालिका १ का ती पुरुषको आरडीटी गर्दा रिपोट पोजेटिभ आएको हो । आरडीटीमा पोजेटिभ देखिएका पुरुषलाई जिल्ला अस्पतालको आइसोलेसनमा ल्याउने तयारी भइरहेको स्वास्थ्य कार्यालयका प्रमुख योगेशप्रसाद भट्टले बताए । उनले भने, 'आरडीटी रिपोट पोजेटिभ देखिएका ती पुरुषलाई जिल्ला अस्पतालको आइसोलेसनमा राख्छौं । थ्रोट स्वाब संकलन गरेर पीसीआर परीक्षणका लागि धनगढी पठाइनेछ।' नानारा क्वारेन्टाइनमा ७४ र डिलाशैनी गाउँपालिकाका विभिन्न क्वारेन्टाइनमा २२७ जना छन्। तीमध्ये एकजनाको आरडीटी रिपोट पोजेटिभ आएपछि कसैलाई पनि घर नपठाएको स्वास्थ्य शाखा प्रमुख जोशीले बताए । आरडीटी पोजेटिभ देखिएका पुरुषको पीसीआर रिपोटको नआउँदासम्म सबैलाई क्वारेन्टाइनमा राखिने उनले बताए ।"
