शीर्षक,विवरण
एमसीसी खारेज गर्न साझा पार्टीको माग,"काठमाडौं : आपत्तिजनक बुँदाहरू संशोधन नगर्ने हो भने एमसीसी सम्झौता नेपालको तर्फबाट खारेज गर्न साझा पार्टीले माग गरेको छ। एमसीसी (कम्प्याक्ट) सम्झौता संसदबाट पारित गराई छाड्ने प्रधानमन्त्री केपी ओलीको अभिव्यक्तिप्रति गम्भीर ध्यानाकर्षण भएको उल्लेख गर्दै साझा पार्टीले यस्तो माग गरेको हो। साझा पार्टीका प्रवक्ता डा सूर्यराज आचार्यले मंगलबार जारी गरेको विज्ञप्तीमा भनिएको छ, 'आपत्तिजनक बुँदाहरू संसोधन नगर्ने हो भने एमसीसी सम्झौता नेपालकोतर्फबाट खारेज गरियोस् भनेर साझा पार्टीले जोडदार माग गर्दछ।' एमसीसी सम्झौताका कतिपय बुँदा नेपालको राष्ट्रिय स्वाभिमान र हितको बर्खिलापमा रहेकाले सो सम्झौता संसोधनबिना संसदबाट पास गरिनु हुँदैन भन्ने अडान साझा पार्टीले पहिलेदेखि प्रस्तुत गर्दै आएको छ। एमसीसी सम्झौता नेपालको कानुनभन्दा माथि हुने, नेपाल सरकारको समेत १३ करोड डलर लगानी रहने आयोजनाको लेखापरिक्षणमा महालेखा परिक्षकको संलग्नता नहुने, नेपालभित्रै निर्माण हुने प्रसारण लाईनका लागि तेस्रो देश भारतको स्वीकृति लिनुपर्ने, नेपाल सरकारको गठन आदेशबाट स्थापित आयोजना कार्यान्वयन एकाई (एमसीए) को निर्णय प्रकृयामा एमसीसी हावी रहने, आयोजनामा रोजगारीका लागि नागरिकताको कुनै बन्देज नहुने, सम्झौताका केही दफा आयोजना सम्पन्न भइसकेपछि पनि क्रियाशील रहने लगायत सम्झौताका आपत्तिजनक प्रावधानको समीक्षा र सुझावका लागि साझा पार्टीले स्वतन्त्र विज्ञहरूको कार्यदलको माग गर्दै आएको विज्ञप्तीमा उल्लेख छ। सत्ताधारी दल नेकपाभित्रै र आम नागरिकबाट समेत एमसीसी सम्झौता विनासंसोधन पारित हुन नहुने आवाज जोडदाररूपमा उठ्दै आएको उल्लेख गर्दै विज्ञप्तीमा भनिएको छ, 'समाजका विभिन्न कोणबाट उठेका चिन्ता र चासोलाई वेवस्ता गर्दै बहुमतको आडमा एमसीसीलाई पारित गरेरैछाड्ने सरकारको ढिपी दम्भयुक्त र दुर्भाग्यपूर्ण छ।' पूर्वाधार विकासको द्विपक्षीय अनुदान सहयोगको सम्झौता राष्ट्रिय हितमा दुरगामी प्रभाव पर्न सक्नेगरी अन्तर्रा्ष्ट्रिय सन्धिकोरूपमा संसदबाट पारित गरिनु वाञ्छनीय नरहेको बताउँदै विज्ञप्तीमा भनिएको छ, 'द्विपक्षीय वैदेशिक सहयोगको मामिलामा निश्चय पनि यसले राम्रो नजिर स्थापित गर्दैन। सबै दाताले त्यस्तै प्रकृतिको सम्झौताको माग गरेमा के होला तथा यसले पञ्चशील र असंलग्नतामा आधारित नेपालको स्वतन्त्र परराष्ट्र नीतिमा कस्तो प्रभाव पार्ला भन्नेतर्फ गम्भीरतका साथ सोच्न हामी सरकारलाई आग्रह गर्दछौँ।' सरकारका गलत सोच र निर्णयमाथि खबरदारी गर्नुपर्ने प्रमुख प्रतिपक्ष नेपाली कांग्रेस एमसीसी सम्झौताको पक्षमा उभिनु विडम्बनापूर्ण रहेको साझाको ठहर छ। विज्ञप्तीमा भनिएको छ, 'कांग्रेसका नेता, सदस्यपंक्ति तथा आम जनसमुदायलाई देशको हितका लागि विनासंसोधनको एमसीसी सम्झौताको खारेजीको पक्षमा उभिन साझा पार्टी आह्वान गर्दछ।'"
क्वारेन्टाइन व्यवस्थापनमा खटिएका वडाध्यक्षको मृत्यु,"धनगढी : कञ्चनपुरको कृष्णपुर नगरपालिका ७ को राष्ट्रिय माविमा क्वारेन्टाइनको व्यवस्थापन गरिरहेका वडा अध्यक्षको क्वारेन्टाइनमै मृत्यु भएको छ। मंगलबार साँझ क्वारेन्टाइन व्यवस्थापनमा जुटेका कृष्णपुर नगरपालिका७ का वडा अध्यक्ष कल्लु रानाको मृत्यु भएको ईलाका प्रहरी कार्यालय रैकवारविचवाका प्रहरी सहायक निरीक्षक भीमसिंह धामीले जानकारी दिए। वडा नम्वर ७ कै राष्ट्रिय माविमा क्वारेन्टाइन व्यवस्थापनमा जुटेका ५८ वर्षीय वडा अध्यक्ष राना एक्कासी बेहोस भएका थिए। उनको घटनास्थलमै मृत्यु भएको प्रहरीले जनाएको छ। उनको शव सेती प्रादेशिक अस्पतालमा राखिएको छ। अस्पतालले उनको पोष्टमार्टम पछि कोरोना परीक्षण हुने जनाएको छ। यसैगरी भारतबाट फर्केका कैलालीको गौरीगंगा नगरपालिका ७ का ५५ वर्षिय पुरुषको बुधबार बिहान ६ बजे सेती प्रादेशीक अस्पतालको आइसोलेसनमा मृत्यु भएको छ। मंगलबार दिउँसो उनलाई, गौरीफन्टा बर्डरभन्दा ५ सय मिटर भित्रबाट बेहोस अवस्थामा उद्धार गरी सेती प्रादेशीक अस्पतालको इमरजेन्सी वार्डमा पुर्याइएको थियो। भारतबाट फर्किएका एकजनाको सेती अस्पतालको आइसोलेसनमै मृत्यु"
भारतबाट सुर्खेत आएका युवाको मृत्यु,सुर्खेतः भारतबाट फर्किएका एक युवाको मृत्यु भएको छ । भारतको गुजरातबाट आएका ती युवाको मंगलबार राती वीरेन्द्रनगरमा मृत्यु भएको हो । सुर्खेतको चिङ्गगाड गाउँपालिका ५ का २२ वर्षीय युवाको मृत्यु भएको हो । उनी मंगलबार मात्र रुपैडिया नाकाबाट सुर्खेत आएका थिए । प्रदेश सभा सांसद खड्कबहादुर खत्रीले गाडीमा आउँदै गर्दा उनलाई असजिलो भएपछि वीरेन्द्रनगरस्थित प्रदेश अस्पतालमा भर्ना गरिएको थियो । तर उनको राती १२ बजे नै अस्पतालमै मृत्यु भएको उनले जनाए । सामाजिक विकास मन्त्रालयले पनि भारतबाट फर्किएका युवाको मृत्यु भएको पुष्टि गरेको छ । मन्त्रालयले बुधबार विज्ञप्ति निकालेर युवाको मृत्यु भएको जनाएको हो । मन्त्रालयअन्तर्गतको स्वास्थ्य महाशाखाका प्रमुख लक्ष्मीनारायण तिवारीले गाडीमा आउँदाआउँदै सिकिस्त भएको र उपचारका लागि अस्पताल लैजाँदै गर्दा बाटोमै मृत्यु भएको दाबी गरेका छन् । साथै ती युवा वाथ रोगको समस्या रहेको भन्दै उनको कोरोना भाइरस संक्रमणले मृत्यु भए नभएको एकीन गर्न स्वाब झिकिएको जानकारी दिए । भारतबाट भित्रिएका उनको आरडीटी परीक्षण समेत गरिएको थिएन । प्रदेश अस्पतालका कोरोना फोकल पर्सन डाक्टर केएन पौडेलले भने आफूहरु अस्पतालमा जाँचका लागि पुग्दा युवा मृत अस्थामा भेटिएको बताए । पीसीआर परीक्षणपछि मात्र उनको मृत्युको कारण पत्ता लाग्ने उनको भनाइ छ ।
रूकुम घटनालाई तोडमोड गर्ने प्रयास,"जाजरकोट : अन्तर्जातीय प्रेमका विषयमा जनप्रतिनिधिकै संलग्नतामा भएको रुकुम पश्चिमको घटनालाई तोडमोड गर्न खोजिएको आरोप पीडित पक्षले लगाएका छन्। चौरजहारी नगरपालिकाको सोतीमा गत शनिबार भएको घटनालाई रुकुमका जनप्रतिनिधिले तोडमोड गर्न खोजेको भन्दै पीडितले न्याय पाउनेमा आशंका व्यक्त गरेका छन्। वडाध्यक्ष डम्बरबहादुर मल्लकै संलग्नतामा हत्याकाण्ड भएको र उनी पूर्वगृहमन्त्री जनार्दन शर्माको संरक्षणमा रहेकाले न्याय पाउनेमा पीडित परिवारले आशंका गरेका हुन्। सोतीका स्थानीय र केही जनप्रतिनिधिले नै लकडाउन उलंघन गर्दै हुल आएको र उमेर नपुगेकी केटीलाई जर्बजस्ती लिन खोजेकाले गाउँलेले नियन्त्रणमा लिने क्रममा भागदौड हुँदा भेरीमा खसेर ज्यान गएको बयान दिएका छन्। साथै उनीहरूले यो घटनालाई जातीयतासँग जोड्न नहुने भन्दै घटनालाई विषयान्तर गर्ने प्रयास गरिरहेको पीडितको भनाइ छ। तर कथित उपल्लो जातको भनिने ठकुरीकी छोरी तल्लो जातको भनिने दलितले लिन खोजेको भन्दै पूरै गाउँ नै उर्लिएर आक्रमण गर्दा तीन जनाको मृत्यु भएको हो। तीनजना अझै बेपत्ता छन्। मंगलबार संघीय संसद्मा रुकुमपश्चिमबाट निर्वाचित जनार्दन शर्माले पनि यो घटनाबारे सोही आशयको धारणा राखेपछि घटनामा संंलग्नलाई राजनीतिक संरक्षण गर्न खोजिएको पीडित परिवारको आशंकामा थप बल पुगेको हो। रुकुम प्रहरीले नै अनुसन्धान गर्ने र मुघा पनि जिल्ला अदालत रुकुममा नै दर्ता हुने भएपछि आशंका बढेको हो। मृतक नवराज विकका बुवा मोहनलालले घटनाबारे निष्पक्ष छानबिन गरी दोषीलाई कारबाही हुनुपर्ने बताए। बयान दिन रुकुम जाँदा झन्झिटिलो हुने र उतैबाट अनुसन्धान तथा मुद्दा चलाए चलखेल हुनसक्ने उनको आशंका छ। जाजरकोट प्रहरीले नै घटनाबारे अनुसन्धान गर्नुपर्ने र मुद्दा पनि जाजरकोटबाटै चलाइनुपर्ने उनीहरूले माग गरेका थिए। पीडितले माग सम्बोधन नहुँदासम्म शव नबुझ्ने अडान लिएका थिए। तर जुन जिल्लामा घटना भएको हो सोही जिल्लामा मुद्दा चल्ने कानुनी प्रावधान र स्थानीय प्रशासनले घटनाको सत्यतथ्य छानबिन गर्ने आश्वासन दिएपछि मंगलबार शव बुझ्न राजी भएका हुन्। पीडित परिवारले जिल्ला प्रहरी कार्यालयमा किटानी जाहेरीसमेत दिएका छन्। वडाध्यक्ष डम्बरबहादुर मल्ल, केटीका बुवा वीरबहादुर मल्ल, आमा प्रकाशी मल्ल, सन्तोष मल्ल, रमेश मल्ल, मोहन पुन मगर लगायतका २० जनाविरुद्ध किटानी जाहेरी दिएको जिल्ला प्रहरी प्रमुख डिएसपी किशोरकुमार श्रेष्ठले बताए। दलित अधिकारकर्मी र पीडित परिवारले घटनाबारे निष्पक्ष छानबिन हुनुपर्ने, पीडित परिवारलाई राज्यले क्षतिपूर्ति दिनुपर्ने, घाइतेको निःशुल्क उपचारको व्यवस्था मिलाउनुपर्ने, बेपत्ताको तत्काल खोजी गर्नुपर्ने लगायतका माग राखी जिल्ला प्रशासन कार्यालयमा ज्ञापनपत्र बुझाएका छन्। जाजरकोटका प्रमुख जिल्ला अधिकारी जनकराज पन्तले पीडितका माग सम्बोधन गर्ने र माग पूरा गर्ने सम्बन्धमा सम्बन्धित निकायमा आवश्यक पहल गरिने आश्वासन दिएपछि पीडित परिवार लास बुझ्न सहमत भएका हुन्। चौरजहारीका टीकाराम सुनारको शव पोष्र्टमार्टम गरिएको छ भने अन्य दुई जनाको बुधबार पोष्र्टमार्टम गरिने पन्तले बताए। हराएका तीन जनाको खोजी कार्य भइरहेको उनले जानकारी दिए। भेरी नगरपालिका ११ का लोकेन्द्र सुनार, गोविन्द शाही, ४ का सन्दीप विक अझै बेपत्ता छन्। भेरी नगरपालिका ४ का नवराज विक र गणेश बुढा, चौरजहारीका टीकाराम सुनारको शव यसअघि नै फेला परिसकेको छ। नवराजकी प्रेमिका चौरजहारी नगरपालिका ८ सोतीकी १७ वर्षीय सुष्मा मल्ललाई बेहुलीका रूपमा भिœयाउन शनिबार १९ युवासहित गाउँ पुगेका बेला वडाध्यक्ष मल्लसहित सोतीका गाउँलेले आक्रमण गरेर लखेट्दा उनीहरूको मृत्यु भएको प्रहरीको प्रारम्भिक अनुसन्धानबाट खुलेको छ। घेराबन्दीमा पारेर गाउँ नै उर्लेर आक्रमण गरेको घटनाबाट बाँचेर आएका युवाले बताए। उनीहरूले नवराज लगायतका केहीलाई कब्जामा लिएर हत्या गरी भेरीमा फालिदिएको र अन्यलाई भेरीमा पौडी खेल्ने क्रममै ढुंगा हानेर हत्या गरेको बताएका छन्। भेटिएका तीन शवमध्ये तीनै जनाको टाउकोमा गहिरो चोट लागेको र एक जनाको हातमा घरेलु हतियारको चोट रहेको भेरी नगरपालिका ४ का मौसम विकले बताए।"
अछामबाट बर्दिया आएका एकजनाको क्वारेन्टाइनमै मृत्यु,"गुलरिया : बर्दियाको गुलरिया नगरपालिकास्थित बबई बहुमुखी क्याम्पसको क्वारेन्टाइनमा रहेका एकजना पुरुषको मृत्यु भएको छ। गुलरिया नगरपालिका ९ स्थित घर भएका ५५ वर्षीय पुरुष सूदुरपश्चिम प्रदेशको अछामबाट फर्किएपछि मंगलबार क्वारेन्टाइनमा राखिएको थियो । कामदारको रुपमा अछाम पुगेका उनी जेठ ८ गते अछाम डोटी अत्तरिया हुँदै १३ गते बर्दिया प्रवेश गरेको प्रमुख जिल्ला अधिकारी प्रेमलाल लामिछानेले बताए । बुधबार बिहान ६:२० बजे उनको क्वारेन्टाइनमै मृत्यु भएको छ । मृत्युको कारण भने खुलेको छैन । उनको स्वाब परीक्षणका लागि निकालिएकाले नतिजा आएपछि मात्र शवको व्यवस्थापन हुने प्रजिअ लामिछानेले जानकारी दिए । उनको मृत्युको बारेमा अनुसन्धान भइरहेको जनाइएको छ । क्वारेन्टाइनमै रहेकात व्यक्तिको मृत्युको खबरले बर्दियामा त्रास बढेको छ । जिल्ला भित्रिने क्रमबढेसँगै बर्दियामा कोरोना भाइरस संक्रमितको संख्या ७ पुगेको बर्दिया अस्पताल गुलरियाका प्रमुख डाक्टर सुभाष पाण्डेयले बताए । उनले भने,' क्वारेन्टाइनमा आश्रित व्यक्तिको स्वाब नमूनाको रिपोर्ट आएपछि मात्र मृत्युको एकिन हुनेछ। त्रसित हुनुपर्ने कुनै अवस्था छैन ।'"
