शीर्षक,विवरण
पूर्ण नक्सा सार्वजनिक गर,"भारतले नेपाली भूभाग लिपुलेकमा सडक संरचना निर्माण सम्पन्न गरी उद्घाटनसमेत गरिसक्दा पनि नेपालले ती क्षेत्रसहितको औपचारिक नक्सा सार्वजनिक गर्न नसक्नुलाई संयोग वा प्राविधिक कठिनाइ मात्र होइन, उसको नियतलाई पनि सन्दीग्ध बनाएको छ। देशको अस्मिता र सार्वभौमसत्तामा छिमेकीले प्रश्न उठाइरहेका बेला उक्त सडक भारतलाई भाडामा दिने प्रधानमन्त्रीको तुक्काले पनि सरकार यो मुद्दामा असंवेदनशील रहेको देखाउँछ। भूमि व्यवस्था मन्त्रालयको कर्मचारी तहबाट नक्सा सार्वजनिक गर्न पटकपटक भएका प्रयास यही सरकारले रोक लगाएको सार्वजनिक भएसँगै उसको नियत नांगिएको हो। सबै राजनीतिक दल र जनताको साथ पाउँदासमेत किन नेपालले त्यसो गर्न सकेन वा गरेन ? के कति कारणले सरकारले राष्ट्रको सही नक्सा जारी गर्न नसकेको हो, सत्तामा बस्ने पात्रहरूले स्पष्ट पार्नुपर्छ। लकडाउनको यो समयमा पनि सडक, सदन, राजनीतिक दल र बौद्धिक क्षेत्र सबैतिर नेपाली भूमि फिर्ता ल्याउनुपर्ने आवाज प्रखर रूपमा उठिरहेको छ। भारतीय कदमविरुद्घ सडकमा आन्दोलन र विरोध प्रदर्शन मात्र होइन सामाजिक सञ्जालमा पनि ती भावनाहरू व्यक्त भइरहेका छन्। भारतमै रहेका विज्ञहरूले पनि नेपालसँग भारतले यो प्रकारको द्वेष नराख्न भनेका छन्। जनस्तरबाट गठित विज्ञहरूका विभिन्न समूहले तयार गरेको नेपालको नयाँ राजनीतिक नक्सा छ महिनाअघि नै सार्वजनिक गरेर सरकारलाई दबाब दिइरहेका छन्। त्यही आधार अध्ययन गरेर नापी विभागले नक्सा तयार गरे पनि भारतद्वारा अतिक्रमित नेपाली भूमि लिम्पियधुरा, कालापानी र लिपुलेक समेटिएको नक्सा सरकारले अझै सार्वजनिक गरेको छैन। लिम्पियाधुरा, कालापानी र लिपुलेक क्षेत्र नेपालको भूभाग हो भन्नेमा नेपाल सरकार स्पष्ट छ भनेर वक्तव्य निकाल्दै वार्ताको पहल गरेको भनिरहँदा किन नक्सा सार्वजनिक गरेन ? राजदूतलाई बोलाएर सोध्ने क्रममा नयाँ जारी भएको नक्सा दिन सक्नुपथ्र्याे। तर, अतिक्रमित भूभाग फिर्ता ल्याउन वक्तव्यबाजी गर्नेबाहेकको ठोस प्रगति गर्न नसक्नु दुःखद् हो। वार्ता गर्ने र प्रमाण पेस गर्ने भने पनि सरकारको आधिकारिक नक्सामै अझै पनि सम्पूर्ण नेपाली भूभाग समावेश नहुनु क्षम्य हुन सक्दैन। ०७२ मा जारी नेपालको संविधानको अनुसूची३ मा निसाना छापभित्र राखिएको नेपालको नक्सामै कालापानी क्षेत्र समेटिइएन। त्यहीबाट सुधार गर्नुपर्ने भए पनि सरकार यसतर्फ सचेत देखिँदैन। पाठ्यपुस्तक हुन् या नापी विभागले प्रकाशन गरेका नक्सा, कहीं उक्त क्षेत्र समेटिएन। सच्याएर पेस गरेको नक्सामा लिपुलेककालापानी समेटे पनि लिम्पियाधुरा छैन। यसले स्पष्ट हुन्छ, संविधान संशोधन गरेर लिम्पियाधुरासमेत समेटिएको नेपालको आधिकारिक नक्सा तत्काल सार्वजनिक गर्न आवश्यक देखिन्छ। राष्ट्रको आधिकारिक नक्सा जारी गर्न सरकारलाई संसद् र नागरिक स्तरबाट निर्देशन र दबाब पर्दा पनि अझै अलमल गर्नु मुलुक र नागरिकप्रति बेइमानी गर्नुबराबर हो। यस्तो अवस्थामा कूटनीतिक पहलकदमीका लागि पनि आफ्नो तयारीअनुरूप सबै भूभाग समेटेर आधिकारिक नक्सा जारी गर्न आवश्यक छ। पश्चिममा मात्र केन्द्रित हुँदा अन्य नियमित भूभागमा वा विवाद सल्टिएको स्थानमा पनि ध्यान पुर्याउन आवश्यक छ। पूर्वको पाँचथरमा पनि नेपाली जमिनमा भारतले हालै आधिपत्य जमाएको सार्वजनिक भएको हो। भारतसँग सीमा जोडिएको पाँचथरको फालेलुङ गाउँपालिकाको नेपाली भूमि भारतीय सीमा सुरक्षा बल (एसएसबी) ले कब्जा गरेको छ भने सुस्तामा पनि त्यही अवस्था देखिन्छ। नेपाली भूभाग कुनै हालतमा फिर्ता हुनैपर्छ। फिर्ता गर्ने पहिलो सर्त वा प्रक्रिया भनेको पूर्ण नेपालको आधिकारिक नक्सा सार्वजनिक गर्नु हो। त्रुटिपूर्ण र अधुरा नक्सा रहेका सबै पाठ्यपुस्तकहरूमा तत्काल सुधार गर्नुपर्छ। र, आम रूपमा सुरु नक्सा प्रयोगमा ल्याउनुपर्छ। सबै प्रमाणअनुसार लिम्पियाधुरासम्मको भूभाग नेपालकै भएकाले चराको चुच्चोजस्तो सीमा देखिने नक्सा जारी गर्न अब ढिलाइ गर्न हुँदैन।"
राष्ट्रसंघ दस्ताबेजमा काली नदीवारि नेपाल,"न्युयोर्क : नेपालले सन् १९५५ डिसेम्बर १४ मा संयुक्त राष्ट्रसंघमा सदस्यता पाएको हो। नेपालले सन् १९४९ मा सदस्यताका लागि आवेदन दिएको भए पनि तत्कालीन सोभियत संघको कारण नेपालले सदस्यता पाउन ६ वर्ष संघर्ष गर्नुपरेको थियो। राणाकालीन अवस्थामै पठाइएको उक्त पत्रमा तत्कालीन डाइरेक्टर जनरल (परराष्ट्रमन्त्रीको हैसियत) को रूपमा विजयशमशेर राणाले तत्कालीन मेजर पदमबहादुर खत्रीलाई प्रतिनिधिका रूपमा पठाएका थिए। मोहनशमशेर प्रधानमन्त्री रहँदैमा उक्त प्रक्रिया अघि बढेको थियो। नेपालले सदस्यता प्राप्त गर्दा राजा त्रिभुवनकै प्रत्यक्ष शासन थियो। त्यतिबेला बुझाएको उक्त डकुमेन्ट राष्ट्रसंघ सुरक्षा परिषद्मार्फत अन्नपूर्ण पोस्ट्लाई उपलब्ध छ। काली नदीलाई पश्चिम सीमा र मेची नदीलाई पूर्वी सीमा भनिएकाले यसमा छिमेकीले धेरै विवाद गरिरहनु नपर्ने राष्ट्रसंघीय एक उच्च अधिकारीले बताए। राष्ट्र संघमा सदस्यताका लागि बुझाइएको पत्रमा, यूएन चार्टरको सदस्यतासम्बन्धी प्रावधानको धारा ४ अनुसार नक्सा बुझाउने स्पष्ट व्यवस्था भए पनि तत्कालीन अवस्थामा नेपालले राष्ट्रसंघमा सदस्यता लिँदा नेपालको नक्सा बुझाएको प्रमाण भेटिँदैन। तत्कालीन समयमा सदस्यता लिँदा नक्सा नै नबुझाए पनि नेपालले आफ्नो भूभाग र सिमानाबारे नक्साकै जस्तै स्पष्ट हुने गरी लेखेर प्रमाणहरू बुझाएको थियो। नेपालभारतबीच सीमा विवाद जारी रहँदै यो मुद्दा अन्तर्राष्ट्रिय अदालतसम्म पुगेमा यस्ता प्रमाण बलिया आधार हुनेछन्। नेपालभारतबीच सीमा विवाद जारी रहेमा इन्टरनेसनल कोर्ट अफ जस्टिस (आइसीजे) ले नदीको मुहानलाई केन्द्र मान्ने स्पष्टै देखिन्छ। अर्थात् काली नदीको मुहानलाई नेपालको आधिकारिक सिमाना कायम गर्ने अन्तर्राष्ट्रिय कानुनका विज्ञहरूको धारणा छ। यसैलाई आधार मान्दा पनि अहिले भारतले निर्माण गरेको सडकको १९ किमि सडक नेपाली भूभागमा परेको परराष्ट्रमन्त्री प्रदीप ज्ञवालीले नै स्पष्ट पारिसकेका छन्। विगतका सन्धिलाई आधार मान्दा सुगौली सन्धिअनुसार धारा ५ मा नेपालले कुमाउ गढवाललगायत क्षेत्र गुमाएको भनेर लेखिएको छ। जसको अर्थ हुन्छ काली नदी पूर्वको नेपालको भूभाग हो। राष्ट्रसंघमा बुझाइएको उक्त पत्रमा पनि काली पश्चिमको भूभागमा नेपालका राजा वा उसको सन्ततिले कुनै अधिकार राख्दैनन् भन्ने सुगौली सन्धिको धारा ५ का बुँदा पनि उल्लेख छ। नेपालले ६५ वर्षअघि संयुक्त राष्ट्रसंघमा सदस्यता लिन बुझाएको दस्ताबेजमै नेपालको पश्चिमी सिमाना काली (महाकाली) नदी रहेको प्रस्ट उल्लेख छ। राष्ट्रसंघमा सदस्यता लिँदा नेपालले पश्चिममा काली नदी र पूर्वमा मेची नदीलगायत अन्य भूभागसहितको स्पष्ट आँकडा दिएको छ। राष्ट्रसंघको सदस्यता लिँदा मुलुकको विगतको प्रमाणित इतिहास, सीमा, जनसंख्या, वैदेशिक सम्बन्ध, मुलुकको क्षेत्रफल, जनसंख्या, स्थापना भएको वर्ष, अन्य देशसँगको सम्बन्ध, छुट्टै राज्य हो भन्ने यथेष्ट प्रमाणलगायत विषय स्पष्ट किटान गरेर लेख्नुपर्ने प्रावधानअनुसार सबै प्रमाणित कागजात नेपालले उपलब्ध गराएको थियो। कालापानी, लिम्पियाधुरा र लिपुलेक क्षेत्र नेपालको रहेको भन्दै सरकारले भारतलाई पटकपटक कूटनीतिक नोट दिइसकेको छ। भारतले पनि त्यस क्षेत्रलाई विवादित क्षेत्र भन्दै वार्ताबाटै सल्टाउने बताइरहेका बेला नेपालको अर्को छिमेकी चीन जोड्ने सडक निर्माण गरी उद्घाटन गरेको हो। राजा र इस्ट इन्डिया कम्पनीबीच सम्झौता हुँदा ३ नम्बर धारामा नेपाल र इस्ट इन्डिया कम्पनीबीच अबउप्रान्त सीमा विवाद हुने छैन र शान्ति कायम हुनेछ समेत लेखिएको छ। नेपाल सरकारसँग तत्कालीन सम्झौता रहे पनि अहिले भारतले चीनको तिब्बत जाने मानसरोवर मार्गको उद्घाटन गरेपछि नेपालभारतबीच सीमा विवादले उत्कर्षमा पुगेको हो। नेपालले लगातार वार्ताबाट समाधानका लागि मिति माग गरेको र भारतले यसमा बेवास्ता गर्दै आएको छ। नेपालले त्यतिबेला सदस्यता लिँदा नेपाल निकै पुरानो मुलुकका रूपमा व्याख्या गरेको उपलब्ध डकुमेन्टमा छ। नेपाल कुनै पनि मुलुकको अधीनमा रहन नपरेको तर आफ्ना केही भूभाग युद्धमा गुमाउनुपरेको विषयसमेत उल्लेख छ। सन् १७९२ मै अहिलेको उत्तरी छिमेक तर त्यतिबेला तिब्बतपारिको मुलुक चीनसँग लडाइँ लडेको विषय पनि उल्लेख छ। १८१५ मा तत्कालीन इस्ट इन्डिया कम्पनी (ब्रिटिस) सँग र १८५५ मा तत्कालीन तिब्बत (हाल चीनको स्वशासित क्षेत्र) सँग लडाइँ लडेको उल्लेख छ। ती सबै लडाइँको शान्तिपूर्ण निकासमा नेपालले त्यतिबेला तत्परता देखाएको पनि प्रस्तुत डकुमेन्टमा लेखिएको छ। विदेशीको संलग्नताविहीन वार्ता गरेर ती मुलुकसँग दुईपक्षीय सम्बन्धसमेत राम्रो राखेको उल्लेख छ। यसरी प्रस्तुत विषयमा ब्रिटिससँगको लडाइँ र उनीहरूसँगको दुईपक्षीय हार्दिकतालाई निकै महŒवसाथ राखिएको छ। लडाइँपछि सुगौली सन्धिमा नेपालको गुमेको भूभागको किटान पनि गरिएको छ।"
