शीर्षक,विवरण
दोषीमाथि तत्काल कारबाही होस्,"मुलुक छुवाछुतविरोधी कानुनी बाटोमा हिँडेको छ दशक टेक्न खोज्दैछ, तर समाजमा अझै दलितमाथि भेदभावयुक्त जघन्य व्यवहार यथावत् छ। छुवाछुत मात्र होइन कि मानवताविरुद्घकै अपराधजन्य पछिल्ल्लो घटना जाजरकोटमा देखापर्यो। जाजरकोट जिल्ल्लाको भेरी नगरपालिका४ का नवराज बिक साथीहरूसहित मल्ल थरकी आफ्नी प्रेमीका लिन रुकुम पश्चिमको चौरजहारी नगरपालिका८ मा आउँदै गर्दा जुन बर्बर घटना भयो, यसले हाम्रो राजनीतिकसामाजिक समग्र व्यवस्थाको सोच र व्यवहारलाई उदांगो पारेको छ। गाउँमा आएका किशोरयुवकलाई आक्रमण गरेर, घेरा हालेर नदीमा हेलिन बाध्य पारिनु सभ्य समाजका लागि कहिल्यै नमेटिने कलंकको टीका हो। तीनजनाको शव भेरी नदीमा भेटिनु, तीनजना अझै बेपत्ता हुनु, यो हाम्रो समाजमा मानवता मरेको दुःखद् घटना हो। कहिल्यै नफर्किने गरी नदीमा सेलाउनुपर्ने त हाम्रो अमानवीय र विभेदकारी सोच अनि व्यवहार हो। प्राणीमध्ये मानिस सर्व श्रेष्ठ र विवेकशील हो भनी भट्याइरहँदा यही मानिस कसरी यतिसम्म विवेकहीन र हिंस्रक बन्न पुग्यो ? अनमेल विवाह वा बालविवाह वा हातहतियारसहित आएका दस्ता, लकडाउनमा आउन नहुने, यस्ता तर्क घटनाको सत्यतथ्य बुझ्न गठन गरिएको समिति ले बाहिर ल्याउला नै। तत्कालको सवाल के हो भने हिंसाको परिणामका रूपमा शव हाम्रा सामुन्ने छन्। कुनै पनि बहानामा यसरी ज्यानै जाने गरी कुटपिट गर्नु, घेरा हाल्नु, हेलिन बाध्य पार्ने कुकृत्य मानवताविरुद्घकै अपराध हो। यो जुनसुकै कोणबाट हेरे पनि निन्दनीय छ। समूहले नै कानुन हातमा लिनेजस्तो कदम चालिनु र यसमा स्थानीय सरकारका प्रतिनिधिसमेत संलग्न भएको खबर आउनु झनै उदेकलाग्दो छ। थप निराशाजनक खबर के छ भने घटनामा मुछिएकालाई सामान्य सोधपुछपछि छोडिएको छ। कसैले किटानी जाहेरी दर्ता नगरेको हुँदा पक्राउ नगरिएको कुतर्क अघि सारिएको छ। अझ अपराधकर्ममा संलग्नलाई राजनीतिक संरक्षण हुने हो कि भन्ने शंका पनि बढाएको छ। स्मरण रहोस्, कानुनभन्दा माथि विवेक र न्याय हुन्छ। पीडितको परिवार विक्षिप्त छ, त्रासमा छ। एक्लो छोरो गुमाएको पीडाले नवराजका बिरामी र अशक्त बाबु अवाक् छन् भने आमाको होसहवास उडेको छ। किशोर उमेरका केटाकेटीलाई सम्झाइबुझाइ गर्नु, कानुनी निकायलाई खबर गर्नु, हिंसा हुन नदिनु हरेक वयस्क व्यक्ति र सभ्य मानिसको कर्तव्य हो। प्रश्न उठ्छ, गाउँमा किन कसैले मारपिट गर्नुहुँदैन भनेन वा यसो भन्न खोजिएको आवाज त्रासले कुण्ठित भयो। यो एकदुईजना मानिस आक्रोशित वा असन्तुलित भएको घटना होइन, यसमा त समूहले नै विवेक र मानवता गुमाएको देखिन्छ। यो झनै डरलाग्दो संकेत हो। घटना भइसकेपछि पीडित पक्षलाई अहिलेसम्म न्यायका लागि आश्वस्त पार्न नसक्नु राज्यको चरम असफलता हो। त्यहाँबाट प्रतिनिधित्व गर्ने तीनै तहका सरकार यसमा उदासीन हुनु, मौन रहनु, अझ उनीहरू नै ढोकछोपमा संलग्न भएका खबर आउनु विडम्बना हो। यो घटनाको छानबिन गर्न तत्कालै उच्चस्तरीय टोली पठाइनुपर्छ, ता कि प्रमाण लोप हुन नसकुन्। यो घटना छानबिन गर्न संसदीय समितिकै गठन हुनुपर्ने माग पनि उठेको छ। सरकारी स्तरमा मात्र छानबिन समिति गर्दा राजनीतिक ढाकछोपको सम्भावना उत्तिकै रहन्छ। त्यसकारण सरकारी छानबिनका अतिरिक्त संयुक्त संसदीय छानबिन समिति गठन हुनुपर्छ। निर्धा, निमुखा, निरक्षर, निःसहाय नागरिकले आफूलाई निरन्तर निरीह महसुस गर्नु समाजवादउन्मुख राज्यका लागि सुहाउँदैन। पीडित पक्षले आफ्नो साथमा राज्य छ, म न्याय पाउँछु भन्ने विश्वास गुमाउँदा उत्पन्न हुने प्रतिहिंसा झनै खतरनाक हुन्छ। समुदायसमुदायले जुनसुकै बखत कानुन हातमा लिन सक्ने हुँदा यसतर्फ बेलैमा सोचियोस्। किशोरीलाई दुवै पक्षबाट पुगेको मानसिक आघात कम गर्न राज्य संवेदनशील बनोस्। २०६३ जेठ २१ गते नेपालको संसद्ले छुवाछुतमुक्त राष्ट्र घोषणा गरेको चौध वर्षको पूर्वसन्ध्यामा भएको यस्तो साम्प्रदायिक हिंसाको शृंखला रोकिनुपर्छ। हामी संवैधानिक, कानुनी, नीतिगत रूपमा जति अगाडि छौं, व्यावहारिक रूपमा उति नै पछाडि। वर्तमान संविधानको धारा ४० मा दलितको हकअन्तर्गत ७ वटा उपधारामा दलितको सम्मानमा हामीले खर्च गरेका निर्जीव शब्दमा प्राण भर्न हाम्रो चेतनाको तह संग्लिनैपर्छ। आजको युगमा पनि हामी जातपातका आधारमा विभेद, हिंसा गर्छाैं र यस्ता घटनालाई यहाँ यस्तै हो भनी सामान्य रूपमा लिन्छौं भने हामीलाई इतिहासले दुत्कार्नेछ। त्यसकारण गहिरो छानबिन गरी दोषीमाथि कडा सजाय हुनुपर्छ र राजनीतिक संरक्षण दिन खोज्नेलाई पनि सजायको भागीदार बनाइनुपर्छ।"
सर्वोच्चको ऐतिहासिक फैसला : लकडाउन खुलेको ३० दिनभित्र उपस्थित हुनेलाई हदम्याद (पूर्ण पाठ),"काठमाडौँ : लकडाउन खुलेको ३० दिनभित्र अदालतमा उपस्थित हुने सेवाग्राहीलाई हदम्यादको सुविधा दिने गरी सर्वोच्च अदालतले फैसला गरेको छ । बिहीबार प्रधानन्यायाधीश चोलेन्द्र शमशेर राणा सहित सर्वोच्चका सबै १९ जना न्यायाधीशको इजलासले गरेको यो एक ऐतिहासिक फैसला हो । सर्वोच्चको इतिहासमा सम्भवतः सबै न्यायाधीश उपस्थित भइ गरेको यो पहिलो फैसला हो । यस फैसलासँगै तारेख, पेशी, हदम्याद सम्बन्धी विवाद सल्टिएको छ । जस अनुसार सरकारले लकडाउन खुला गरेको ३० दिनभित्र सेवाग्राहीले थाती रहेका मुद्दाका लागि तारेख, पेशीका लागि अदालतमा उपस्थित हुन पाउने व्यवस्था गरिएको छ । अर्थात् लकडाउन खुलेको एक महिनाभित्र अदालत उपस्थित हुने सेवाग्राहीले हदम्यादको सुविधा पाउनेछन् । उनीहरुको रोकिएको वा थाती रहेको मुद्दा प्रक्रिया सुचारु हुनेछ । काठमाडौँ बाहिर प्रदेश र जिल्लाको हकमा पनि यही सुविधा लागु हुनेछ । बिहीबारको वृहद् फैसला ५२ पृष्ठ लामो छ ।"
लगानी घट्यो,"काठमाडौं : चालु आर्थिक वर्षमा अघिल्लो वर्षको तुलनामा लगानीमा कमी आउने आकलन गरिएको छ । आर्थिक सर्वेक्षण २०७६७७ ले कोरोना भाइरस महामारी (कोभिड१९) का कारण सार्वजनिक र निजी लगानीमा ३४ प्रतिशतले संकुचन आइ १८ खर्ब ८९ रुपैयाँ लगानी हुने अनुमान गरिएको छ । चालु आवमा सार्वजनिक खर्च (सरकारको खर्च) १३ खर्ब ८५ अर्ब रुपैयाँ हुने सरकारको अनुमान छ । बाँकी लगानी निजी क्षेत्र र घरयासी क्षेत्रबाट आउनेछ । चालु आर्थिक वर्षमा लगानीमा संकुचन आउने भए पनि अघिल्लो आर्थिक वर्ष २०७५७६ मा भने लगानी १९२ प्रतिशतले वृद्धि भएको थियो । अर्थशास्त्री केशव आचार्य लगानीमा कमी आउँदा उत्पादन तथा रोजगारीमा कमी आउने बताउँछन् । चालु आर्थिक वर्षमा कुल गार्हस्थ उत्पादन २३ प्रतिशत हुने अनुमान गरिएको छ । सरकारले आर्थिक वर्षको सुरुवातमा ८५ प्रतिशतको आर्थिक वृद्धिदरको लक्ष्य राखेको थियो । तर कोभिड१९ को महामारीले पर्यटन, व्यापार, औद्योगिक क्षेत्र, उपभोग तथा आपूर्ति श्रृंखलामा आघात पारेपछि वृद्धिदर कमजोर हुने आकलन गरिएको हो । केन्द्रीय तथ्यांक विभागले जेठ महिनादेखि पूर्ववत् आर्थिक क्रियाकलाप सुचारू भए उक्त आर्थिक वृद्धिदर हासिल हुने अनुमान गरेको भएपनि जेठ महिनामा पनि आर्थिक गतिविधि ठप्प छन् । जसका कारण आर्थिक वृद्धिदर अझै कमजोर हुनसक्छ । यद्यपि अनुमानित आर्थिक वृद्धिदर हासिल भएको खण्डमा नेपाली अर्थतन्त्रको आकार ३७ खर्ब ६७ अर्ब रुपैयाँको हुनेछ । लगानी घटेको र (गार्हस्थ) बचत बढेकाले लगानीको उपलब्धता भने बढेको छ । गत आर्थिक वर्षमा बचत र लगानीको अन्तर ३७६ प्रतिशत थियो । अर्थात लगानीको आवश्यकता अनुसार स्रोतको उपलब्धता कम भएर अन्तर फराकिलो थियो । चालु आर्थिक वर्ष २०७६७७ मा वचत र लगानीको अन्तरमा कमी आइ ३२१ प्रतिशत हुने अनुमान छ । यसको अर्थ लगानीको लागि स्रोत उपलब्ध भए पनि लगानी गर्ने वातावरण नभएको भन्ने हो । आर्थिक सर्वेक्षण अनुसार, आर्थिक वर्ष २०७३७४ मा वचत र लगानीको उपलब्धतामा सन्तुलन कायम रहेपनि त्यसपछिका वर्षहरूमा भने वचत र लगानीको मागमा ठूलो खाडल रहँदै आएको छ । गत वर्ष यो खाडल निकै उच्च थियो भने चालु आर्थिक वर्षमा लगानीको माग कम हुँदा केही घटेको छ । चालु आर्थिक वर्षमा मुलुकको कुल गार्हस्थ उत्पादनको १८१ प्रतिशत वचत रहने अनुमान गरिएको छ, यस्तो वचत अघिल्लो आर्थिक वर्षमा १८९ प्रतिशत थियो । कुल राष्ट्रिय वचतमा अघिल्लो वर्षको तुलनामा सामान्य वृद्धि भएको छ । कुल राष्ट्रिय वचत १७ अर्ब ३३ अर्ब रुपैयाँ रहेको आर्थिक सर्वेक्षणमा उल्लेख छ । चालु आर्थिक वर्षमा लगानी बोर्डको कार्यालयबाट मात्रै १ खर्ब ५५ अर्ब रुपैयाँको लगानी स्वीकृत भएको छ । त्यस्तै, नेपालीहरूको प्रतिव्यक्ति ऋण ३८ हजार एक सय २९ पुगेको छ । सरकारले ऋण परिचालन बढाएपछि प्रत्येक नेपालीको ऋणभार २ हजार छ सय एक रुपैयाँ थपिने अनुमान छ । नेपाली अर्थतन्त्रको मेरुदण्ड मानिएको रेमिट्यान्स प्राप्तिमा गिरावट आउने अनुमान छ । अघिल्लो आर्थिक वर्षमा ८ खर्ब ७९ अर्ब रुपैयाँ रेमिट्यान्स भित्रिएकोमा चालु आर्थिक वर्षमा ७ खर्ब २५ अर्ब रेमिट्यान्स भित्रने अनुमान छ । अघिल्लो वर्ष कुल गार्हस्थ उत्पादन (जीडीपी) को २५४१ प्रतिशत बराबर रेमिट्यान्स भित्रिएको थियो भने चालु आवमा यो घटेर १९२५ प्रतिशत बराबर रहने अनुमान गरिएको छ । आर्थिक सर्वेक्षण प्रस्तुत गर्दै अर्थमन्त्री डायुवाराज खतिवडाले फागुन अघिसम्म अर्थतन्त्रका सबै परिसूचक मजबुत रहेको भएपनि त्यसयता कोरोना भाइरसको महामारीका कारण उत्पन्न अन्तर्राष्ट्रिय र राष्ट्रिय परिवेशले दबाब उत्पन्न भएको उल्लेख गरेका छन् ।"
