शीर्षक,विवरण
काठमाडौंमा अलपत्र परेका ३ सय ६२ जना धनकुटा पुगे,"धनकुटा : लकडाउनको कारण काठमाडौंमा अलपत्र परेका ३ सय ६२ जना धनकुटेलीको उद्धार भएको छ। धनकुटाका सात स्थानीय तह तथा धनकुटाकाठमाडौं कोरोना विपद् सहयोग समितिको समन्वयमा उनीहरुलाई ८ वटा बसमा राखेर बिहीबार राति जिल्ला ल्याइएको हो। उनीहरुलाई बिहीबार भेडेटार भन्दा मुनि छोटीमोरङ (धरानतर्फ) सम्म ल्याएर गाडी भित्रै राखिएको थियो। शुक्रबार स्वास्थ्य परीक्षण प्रश्चात सम्बन्धित स्थानीय तहका प्रतिनिधिले आआफ्नो पालिकाका व्यक्ति बुझेका छन्। उपचार, अध्ययन तथा रोजगारीको शिलशिलामा काठमाडौंमा रहेका उनीहरुलाई ल्याउन धनकुटाका स्थानीय तह मार्फत पहल गरिएको जिल्ला प्रशासन कार्यालय धनकुटाका सूचना अधिकारी जयाराम श्रेष्ठले बताए। उनका अनुसार अलपत्र परेका व्यक्तिलाई काठमाडौंदेखि धनकुटासम्म ल्याउँदाको यातायात खर्च सम्बन्धित स्थानीय तहले तिरेका छन्। काठमाडौंदेखि उद्धार गरेर ल्याइएका सबै व्यक्तिलाई क्वारेन्टाइनमा राखिने भएको छ। हरेक स्थानीय तहले आआफ्नो पालिका भित्रका नागरिकलाई क्वारेन्टाइनमा राख्ने व्यवस्थापन गरेका छन्।"
जनयुद्धमा ध्वस्त अछामी दरवारको निमार्ण कार्य लकडाउनमा जारी,"अछाम : जिल्लाको पहिचान बोकेको ऐतिहासिक अछाम दरवार बाह्र वर्षदेखि निर्माणधिन अवस्थामा रहेको छ। जिल्लामा अन्य विकास निमार्णका कार्य रोकिएका बेला भने दरवारको कामले अहिले तीब्रता लिएको छ। अन्य समयमा विभिन्न बहानामा काम रोकिदै सुरु हुँदै भए पनि यो बेला दरवारको काम निरन्तर चलिरहेको छ। निमार्णको कामले राम्रोसँग निरन्तरता नपाएको दरवारको काम भने लकडाउनका बेला जारी छ। ठेकेदारले काठको अभावको कारण देखाउँदै दरवार निमार्णका काम रोकिँदै बन्दै गरेको थियो। अहिले दरवारको काम करिब ८० प्रतिशत सम्पन्न भएको निमार्णको जिम्मा पाएको साउद कन्ट्रक्सनका प्रोपाइटर जयबहादुर साउदले बताए। उनले भने अहिले दरवार निमार्णको काम जारी,लकडाउनको पालना गर्दे सावधानी अपनाउँदै मिस्तीरीहरु काठको काम गरिरहेका छन्,काठ उपलब्ध भए यो वर्ष दरवारको काम सकिनेछ। लकडाउनले गर्दा काठ आयात रोकिएको छ। धुरी चिनाइको काम अब १५ दिनको मात्र छ। दरबार निर्माणको ठेक्का २ करोड २५ लाखमा स्वीकृत भएको थियो। तर हालसम्म महगींका कारण ४ करोड भन्दा लगानी दरवारका लागि सकेको उनले बताए। हालसम्म १ करोड २० लाख भुक्तानी लिएको साउदले बताए। तत्कालिन नेकपा माओवादीको आक्रमणका क्रममा ०५८ फागुन ४ गते अछाम दरवार ध्वस्त भएको थियो। दरबार पुनर्निर्माणको काम ०६५ मै सुरु भयो। ७ वर्षदेखि अवरुद्ध भएको काम फेरी ०७५ भदौ पहिलो सातामा सुरु भएको थियो। आफुले पटक पटक ठेकेदारलाई काम गर्न दबाब दिदै आएको जिल्ला समन्वय समितिका प्रमुख नरबहादुर कुँवरले बताए। उनले भने धेरै पटक ताकेता गरियो। अहिले भने केहि काठ भएकाले काम जारी छ। आवश्यक काठ उपलब्ध भए ठेकेदारले यो वर्ष काम सक्नेछ। बाह्र वर्षसम्म काठको कारण देखाउँदै धेरै पटक काम रोकियो। ठेकेदारले यो आर्थिक वर्षमा निमार्ण सक्ने प्रतिबद्धता जनाएका छन्। अछाम दरबार झन्डै डेढ सय वर्षअघि मंगलसेनका तत्कालिन राजा टीकाभुक शाहको पालामा निर्माण सुरु भइ उनका छोरा दलबहादुर शाहको पालामा १९३५ सालमा निर्माण सम्पन्न भएको हो भन्ने इतिहास छ। सरकारले ०२९ सालमा अछामी राजाका सन्तान योगेन्द्रबहादुर शाहबाट ९० हजारमा उक्त दरबार किनेको अछामी ईतिहासका जानकार सुरतबहादुर शाह बताउँछन्। योगेन्द्रबहादुरका भाइ तपेन्द्रबहादुर शाह सेनाका जर्नेल रहेकाले उनैले सरकारसँग दरबार बिक्रिको व्यवस्था मिलाएको बताइन्छ। तीन तले दरबारमा ३० कोठा थिए। माटोको नभएर मासको गारो बनाएर दरबार निमार्ण गरीएको थियो। दरबारमा पहिले जिल्ला प्रशासन कार्यालय, तत्कालीन जिल्ला पञ्चायत, मालपोत, जिल्ला अदालतलगायत कार्यालय सञ्चालन भए पनि सदरमुकाम आक्रमणका बेला भने जिल्ला प्रशासन कार्यालय मात्र थियो। सो आक्रमणमा प्रमुख जिल्ला अधिकारी मोहनसिंह खत्री समेत मारिएका थिए।"
बाँकेका कोरोना संक्रमितलाई उपचारका लागि दाङ ल्याइयो,दाङ : बाँकेबाट आठजना कोरोना संक्रमितलाई उपचारका लागि दाङमा ल्याइएको छ। दाङमा स्थापना भएको कोराना विशेष अस्पतालमा उनीहलाई उपचार सुरु गरिएको छ। शुक्रबार नरैनापुर गाउँपालिकामा भेटिएका ८ संक्रमितलाई बाँकेबाटै एम्बुलेन्स दाङको बेलझुण्डी रहेको कोरोना विशेष अस्पतलामा ल्याइएको अस्पतालका मेडिकल सुपरिटेन्डेन्ट डा सर्वेश शर्माले बताए। बाँकेका आइसोलेसन बेडको अभावका कारण बाँकेबाट बिरामी दाङको कोरोना विशेष अस्पतालमा ल्याएको जनाइएको छ। बाँकेको खजुरास्थित कोरोना विशेष अस्पतालमा जम्मा २५ वटा आइसोलेसन बेड मात्रै छन्। त्यो यसअघि नै भरिसकेको छ। आइसोलेनस बेडको अभावका कारण बिरामीलाई बाँकेबाट दाङ ल्याउन थालिएको हो। यसअघि बर्दियाबाट बेलझुण्डी ल्याउन खोज्दा विरोध भएको थियो। त्यसपछि बाँकेको खजुरास्थित कोरोना विशेष अस्पतलामै ती बालिकालाई राखेर उपचार गरिसुरु गरिएको छ। जिल्ला बाहिरका बिरामी आउने हल्ला पछि स्थानीयले समेत त्यसको विरोध गरे पनि प्रदेश सरकारले नै प्रदेश भित्रका बिरामीलाई बेल्झुण्डीमा उपचारका लागि ल्याउन सक्ने निर्णय गरेको थियो। त्यो निर्णयपछि बाँकेका आठ बिरामीलाई सहजै रुपमा दाङ ल्याइएको हो। दाङमा एक सय बेडको आइसोलेसन कक्ष तयारी अवस्थामा राखिएको छ।
नेविसंघका १६ विद्यार्थी प्रहरी नियन्त्रणमा,"दैलेख : नेपालको भूमी मिचेर भारतले लिपुलेकमा सडक बनाएको विरोध गर्दै नेपाली कांग्रेसको विद्यार्थी संगठन नेपाल विद्यार्थी संघले दैलेखमा राँके जुलुस प्रदर्शन गरेको छ। शुक्रबार साँझ दैलेखको लोकतान्त्रीक चोकबाट डेकेन्द्रचोकसम्म कालो पट्टी बाँधेर जुलुक निकालेको हो। प्रदर्शनकै क्रममा नेविसंघमा आबद्ध १६ जना विद्यार्थी नेता तथा कार्यकर्तालाई प्रहरीले नियन्त्रणमा लिएको छ। नेविसंघका केन्द्रीत सदस्य लोकेश आचार्य, नेताहरु शुशिल देउजा, मौषम थापा लगाएतका १६ जनालाई प्रहरीले नियन्त्रणमा लिएको हो। जिल्ला प्रहरी कार्यालय दैलेख अगाडी रहेको देवकोटा चोकमा प्रर्दशन गरीरहेको उनीहरुलाई नियन्त्रणमा लिईएको जिल्ला प्रहरी कार्यालय दैलेखका प्रहरी निरिक्षक उपेन्द्रप्रसाद आचार्यले बताए। जुलुसमा सहभागीले भारतीय विस्तारवाद मुर्दावाद, लाचार ओली सरकार राजीनामा दे, हाम्रो भूमी फिर्ता गर, चिनिया हस्तक्षेप बन्द गर लगायतका नारा लगाएका थिए।"
लकडाउनमा कास्कीमा ३२ हजार भित्रिए,पोखरा : कोरोना भाइरस (कोभिड १९) को संक्रमण रोक्न घोषित लकडाउनका बेला कास्कीमा ३२ हजार बाहिरबाट आएको तथ्यांक प्रहरीले सार्वजनिक गरेको छ। कास्की प्रहरीले चैत र वैशाख ३१ गतेसम्म जिल्ला भित्रिएकाको संख्या सार्वजनिक गरेको हो। जिल्ला प्रहरी कार्यालय कास्कीका प्रमुख एसपी दानबहादुर कार्कीले लकडाउनका बेला १२ हजार ७ सय १८ सवारी साधन लकडाउनका बेला भित्रिएको जानकारी दिए। ती अत्यावश्यक सामान आयात गर्ने लगायत गाडी हुन्। तिनैमा मानिसहरु पनि जिल्ला भित्रिएका थिए। चैत ११ गतेदेखि वैशाख ३१ गतेसम्म भित्रिएका सानाठूला गरी १२ हजार ७ सय १८ सवारी साधनमा ३२ हजार ६ सय २४ जना व्यक्ति कास्की प्रवेश गरेका हुन्। तर मूल सडकबाहेकबाट आएकाको रेकर्ड भने नरहेको प्रहरी प्रमुख कार्कीले जनाए। उनकै भनाइमा लकडाउनका बेला कास्कीबाट १४ हजार ५ सय १५ सवारी जिल्ला बाहिरिएका छन्। लकडाउनको सुरुआती चरणमा पोखराबाट बाहिर जानेहरुलाई जिल्ला प्रशासन कार्यालय कास्कीले पास उपलब्ध गराएको थियो। निर्माण क्षेत्रमा कार्यरत मजदुर लगायत पास लिएर बाहिरिएका थिए। ३१ वैशाखसम्ममा कास्कीबाट ४८ हजार ८ सय १७ जना बाहिरिएको जिल्ला प्रहरी कार्यालय कास्कीले जनाएको छ। कास्की प्रहरीले बिहीबार भर्चुअल पत्रकार सम्मेलन गरेको थियो। पछिल्लो समय निर्माण सामग्री ओसारपसार गर्ने ढुवानीका साधन बिना पास गुड्न थालेको छन्। सुरक्षित रहेका भनिएका र बाहिरभित्र आजजाउ नगर्ने गरी कतिपय निर्माण क्षेत्र सुचारु भएका छन्। गण्डकी प्रदेश सरकारले वैशाख दोस्रो सातादेखि नै निर्माण क्षेत्रमा काम गर्न दिने निर्णय गरेको थियो। गृहमन्त्रालयसँगसँगै जिल्ला प्रशासन कार्यालय कास्कीले पनि ३१ वैशाखअघिका सबै पास खारेज गरेको छ। देशैभरि संक्रमितको संख्या बढेपछि लकडाउन कडा पारिएको छ। खाद्यान्न र औषधिका पसलहरु पहिलेदेखि नै खुला थिए। पछिल्लो समय बैंक तथा वित्तीय संस्था पनि खुला छन्। अस्पतालहरुमा बहिरंग सेवा खुला भएको छ। सामाजिक दुरी बिना नै अस्पतालहरुमा बिरामीको भिड जम्मा भएको छ। लकडाउनका बेला अपराधका केही घटनाहरु भने भएको जिल्ला प्रहरी कार्यालय कास्की प्रमुख एसपी कार्कीले जनाएका छन्। कास्कीमा ८५ वटा मुद्दा कास्कीमा दर्ता भएका छन्। चैतमा ६७ मुद्दा दर्ता भएका थिए। लकडाउनका अवधिका ८५ मुद्दामध्ये बैंकिङ कसुरका १० मुद्दा परेका छन्। ती चेक अनादारका मुद्दा हुन्। वैशाखमा मात्रै कास्कीमा १० जनाले झुन्डिएर आत्महत्या गरेको रिपोर्ट प्रहरीले सार्वजनिक गरेको छ। चैतमा ३ र वैशाखमा ४ ज्यान मार्नेसम्बन्धी उद्योगका घटना भएका छन्।
क्याम्पस प्रमुख क्वारेन्टाइनमा बस्न नमानेपछि सिडिओले भने गलहत्ताएर भारत पठाउनू,परासी : पश्चिम नवलपरासीको बेलाटारीस्थित त्रिभुवन क्याम्पसका प्रमुख मनोजधर दुवे क्वारेन्टाइनमा बस्न अटेरी गर्दै आएका छन्। ३ दिनअघि भारतबाट आएका उनी आफ्नै क्याम्पसको क्वारेन्टाइनमा नबसी होम क्वारेन्टाइनमा बस्ने भन्दै अडान लिएका हुन्। दुई दिनअघि सोही क्याम्पसको क्वारेन्टाइनमा बसेका एक जनामा कोरोना पुष्टि भएको थियो। क्वारेन्टाइनमा नबसी होम क्वारेन्टाइनमा बस्ने जनाएपछि क्याम्पस प्रमुख बाहिर हिँडडुल गर्न सक्ने भन्दै स्थानीय त्रसित बनेका छन्। गाउँपालिकाले सोही क्याम्पसमा क्वारेन्टाइन बनाएको छ। क्वारेन्टाइन स्थलदेखि केही पर रहेको भवनमा उनी बस्दै आएका छन्। भारतबाट आएको जानकारी पाएपछि प्रशासनले उनलाई क्वारेन्टाइनमा लैजान लागेको थियो। तर राजनीतिक दबाबले उनलाई त्यसै छाडिएको स्थानीयले बताएका छन्। राजनीतिक दबाबपछि प्रशासनले समेत उनलाई क्वारेन्टाइनमा लैजान वास्ता नगरेको स्थानीयको भनाई छ। भारतबाट आउने सबैलाई होम क्वारेन्टाइनमा नभई संस्थागतमा राख्दै आए पनि राजनीतिक दबाबले उनलाई छुट्टै राख्दा स्थानीयले त्यसको बिरोध गरेका छन्। क्वारेन्टाइनमा रहेको स्वास्थ्य टोलीले आउने बित्तिकै उनको नाम समावेश गरेको थियो। तर डेरामै बस्ने अडान लिएपछि सुरक्षा दिन नसक्ने भन्दै प्रशासनले नाम हटाउन लगाएको क्वारेन्टाइनका स्वास्थ्य इन्चार्ज क्रषि चौधरीले बताए। भारतबाट आउने जो कोही पनि घरमा नभई संस्थागत क्वारेन्टाइनमा बस्नु पर्ने प्रमुख जिल्ला अधिकारी बासुदेव दाहालले बताए। क्याम्पस प्रमुखले क्वारेन्टाइनमा बस्न अटेरी गर्दै आएको र लकडाउन उल्लघंन गरेको आरोपमा कारबाही हुने प्रजिअ दाहालले बताए। 'क्वारेन्टाइन नजिकै डेरा भएपनि बस्न पाइँदैन। स्थानीय तहले व्यवस्थापन गरेको क्वारेन्टाइनमा बस्नुपर्छ। क्याम्पसको क्वारेन्टाइनमा नबसे गलहत्ताएर भारतमै पठाउनु भनेर प्रहरीलाई निर्देशन दिइएको छ' प्रजिअ दाहालले भने। क्वारेन्टाइनमा हाल ५२ जना स्वास्थ्यकर्मीको निगरानीमा छन्।
