शीर्षक,विवरण
थप ११४ जनामा कोरोना पुष्टि : संक्रमितको संख्या ८८६ पुग्यो,"काठमाडौं : बुधबार थप एक सय १४ जनामा कोरोना भाइरस (कोभिड१९) संक्रमण पुष्टि भएको छ। स्वास्थ्य तथा जनसंख्या मन्त्रालयका प्रवक्ता डा विकास देवकोटाका अनुसार योसहित नेपालमा संक्रमितको संख्या ८८६ पुगेको छ। विभिन्न प्रयोगशालामा गरिएको परीक्षणमा एकै दिन यति ठूलो संख्यामा उनीहरुमा कोरोना पोजेटिभ देखिएको हो। बुधबार मात्र ११४ जनामा संक्रमण पुष्टि भएको हो । जसमध्ये धरानको बिपी कोइराला स्वास्थ्य विज्ञान प्रतिष्ठान ११ जनाको रिपोर्ट पोजिटिभ आएको हो । धरानमा कोरोना पुष्टि भएका आठजना सप्तरी बोडे बसाइ नगरपालिकाका हुन् । उनीहरु १८ देखि ५६ वर्षका पुरुष हुन् । सप्तरीकै बालनविभुल गाउँपालिका अन्य दुईजना १७ वर्षीय महिला, २९ वर्षीय पुरुषमा संक्रमण पुष्टि भएको छ । सप्तरीकै अर्का २९ वर्षीय पुरुषमा संक्रमण पुष्टि भएको छ । त्यसैगरी विराटनगरस्थित कोसी कोरोना अस्पतालको प्रयोगशालामा भएको परीक्षणमा १७ जनाको रिपोर्ट पोजिटिभ आएको छ । उनीहरुमध्ये झापा गौरादह नगरपालिका दुईजना २६ र ४१ वर्षीय पुरुष छन् । झापाकै कचनकवलका दुई जनाको रिपोर्ट पोजिटिभ आएको छ । सँगै हेटौंडा किटजन्य प्रादेशिक प्रयोगशालामा गरिएको परीक्षणमा आठ जनाको रिपोर्ट पोजिटिभ आएको छ । उनीहरुमध्ये एकजना हेटौंडाकै हुन् । अन्य सातजना रौतहट, गढीमाई नगरपालिका हुन् । पोखराको प्रदेशीक प्रयोगशालामा भएको परीक्षणमा चार जनामा कोरोना पोजिटिभ देखिएको छ भने दाङको राप्ति स्वास्थ्य विज्ञान प्रतिष्ठानमा भएको परीक्षणमा १८ जनाको रिपोर्ट पोजिटिभ आएको छ । उनीहरु रुकुमपूर्व र दाङका हुन् । सँगै भेरी अस्पतालको प्रयोगशालामा गरिएको परीक्षणमा थप १६ जनाको रिपोर्ट पोजिटिभ आएको छ । उनीहरु सबै बाँकेका हुन् । त्यसैगरी राष्ट्रिय प्रयोगशालामा ३८ जनामा संक्रमण पुष्टि भएको छ । उनीहरु सिरहा, सप्तरी, बारा, रौतहटका छन् । योसँगै संक्रमितको संख्या कुल आठ सय ८६ पुगेको हो । जसमध्ये पुरुष सात सय ९६ र महिला ९० जना छन् । मन्त्रालयका अनुसार अहिलेसम्म ४७ जिल्लामा संक्रमण फैलिएको छ । बुधबारसम्म एक सय ८३ जना निको भएका छन् भने अरुको विभिन्न अस्पतालमा उपचार भइराखेको छ । मंगलबार साँझ र बुधबार गरेर २८ जना डिस्चार्ज भएको प्रवक्ता देवकोटाले जानकारी दिए । अहिलेसम्म नेपालमा कोरोनाकै कारण चार जनाको मृत्यु भइसकेको छ । सरकारले परीक्षणको दायर बढाउँदै सातै प्रदेशका २० अस्पतालमा पीसीआर परीक्षण गरिरहेको छ भने देशभर आरडीटी विधिबाट व्यापक परीक्षण भइरहेको छ । मन्त्रालयका प्रवक्ता देवकोटाका अनुसार अहिलेसम्म पीसीआर विधिबाट ५८ हजार २ सय ७७ र आरडीटी विधिबाट एक लाख दुई सय ८७ जनाको नमुना परीक्षण गरिएको छ । पछिल्लो २४ घण्टामा पीसीआर विधिबाट तीन हजार पाँचसय २५ र आरडीटी दुई हजार तीन सय २० जनाको नमुना परीक्षण गरिएको छ । मन्त्रालयका अनुसार ७० हजार तीन सय ५ जना क्वारेन्टाइन र ६ सय ९९ जना आइसोलेसनमा मा छन् । प्रवक्ता देवकोटाका अनुसार मन्त्रालयको कल सेन्टर एक हजार १२ जनाले जिज्ञासा राखेका छन् । पछिल्लो २४ घण्टामा चार सय ४२ जनाले स्वमूल्यांकन फारम भरेका छन् । जसमध्ये ९ जना रेड जुनमा परेका छन् ।"
संसद्को कार्यसूचीबाट यसरी हट्यो संविधान संशोधन विधेयक,"काठमाडौं : संघीय संसद् सचिवालयले सार्वजनिक गरेको सम्भावित कार्यसूचीबाट बुधबार संविधन संशोधन प्रस्ताव हटेको छ। लिपुलेक, लिम्पियाधुरा र कालापानीसमेटिएको नयाँ नक्सा अनुसार निशान छाप परिवर्तन गर्ने प्रयोजनका लागि हुन लागेको संविधान संशोधन प्रस्ताव सम्भावित कार्यसूचीबाट हटेपछि यो विषयमा विभन्न टिकाटिप्पणी सुरु भएका छन्। प्रस्तावित कार्यसूचीमा कानुनमन्त्री शिवमाया तुम्बाहाङ्फले संविधान संशोधन प्रस्ताव संसदमा पेश गर्ने उल्लेख थियो। यद्यपि बैठकअघि सार्वजनिक भएको कार्यसूचीमाबाट संविधान संशोधनको विषय हटाइएको हो। संविधान संशोधन प्रस्ताव संविधानको अनुसूची ३ मा रहेको निशान छापभित्रको नक्सा परिवर्तनका निम्ति मात्र संसदमा दर्ता भएको हो। सोही अनुसार कार्यसूची तयार भए पनि त्यो बुधबार हटाइएको हो। प्रधानमन्त्री केपी ओलीले मंगलबार साँझ बोलाएको सर्वदलीय बैठकमा नेपाली कांग्रेसले संविधान संशोधनमा राष्ट्रिय सहमति खोज्न आग्रह गरेको थियो। संसद सरकारकै बिजनेश अनुसार चल्छ। सरकारले संविधान संशोधनका लागि राष्ट्रिय सहमतिका लागि प्रस्तावित कार्यसूचीबाट उक्त विषय हटाएको स्रोतको दाबी छ। मंगलबार साँझ बालुवाटारमा सर्वदलीय बैठक करिब ३ घण्टा चलेको थियो। सर्वदलीय बैठकको निष्कर्ष अनुसार नै सरकारले संसदको बिजनेस परिवर्तन गरेको हो। बुधबारको प्रस्तावित कार्यसूचीबाट संविधान संशोधन प्रस्ताव हटेपछि भारतीय मिडियाले भने नेपाल नयाँ नक्सा परिवर्तनबाट पछाडि हटेको हल्ला चलाउन थालेका छन्। सरकारले बिहीबार बजेट भाषण भएकाले बजेटपछि राष्ट्रिय सहमति जुटाएर संविधान संशोधन पेश गर्ने तयारी गरेको हो। बुधबारको बैठकमा संविधान संशोधन कार्यसूची अगाडि बढेको भए कानुनमन्त्रीले बैठकमा विधेयक पेश गर्ने थिइन्। संसदमा पेश भएपछि प्रस्ताव सार्वजनिक जानकारीका लागि मिडियामा प्रकाशित गरिने थियो। संविधान संशोधनका लागि संसदमा दुई तिहाइ मत चाहिन्छ। प्रतिनिधिसभामा सत्तारुढ नेपाल कम्युनिस्ट पार्टी (नेकपा) को मात्र दुई तिहाइ मत छैन। दुई तिहाइका लागि प्रमुख प्रतिपक्षी दल कांग्रेस वा मधेस केन्द्रित दलको सहयोग आवश्यक छ। यद्यपि सरकारले संविधान संशोधनका लागि राष्ट्रिय सहमति जुटाउने तयारी सरकारले गरेको छ। कांग्रेस संविधान संशोधनको पक्षमा उभिएको छ। मधेस केन्द्रित दलले निशान छापका लागि मात्र नभएर अन्य विषयसमेत समेट्न माग गर्दै आएका छन्। सरकारले जेठ ५ गते नेपालको नयाँ नक्सा ल्याउने निर्णय गरेको थियो। भूमिव्यवस्था, सहकारी तथा गरीबी निवारण मन्त्रालयले लिम्पियाधुरासहित गुञ्जी, नाभी, कुटीलगायत केही भूभाग समेटिएको नेपालको नक्शा (राजनीतिक तथा प्रशासनिक) जेठ ७ गते सार्वजनिक गरिसकेको छ। सोही अनुरुप निशान छापभित्र रहेको नेपालको नक्सा सीमा अनुरुप मिलाउने तयारी स्वरुप सरकारले संविधान संशोधनको प्रस्ताव जेठ ९ गते संसद्मा दर्ता गरेको थियो। संविधान संशोधन प्रस्ताव संविधानको अनुसूची ३ मा रहेको निशान छापभित्रको नक्सा परिवर्तनका निम्ति मात्र संसदमा दर्ता भएको हो। संविधान संशोधन विधेयकको विषय समेटिएको संसदको कार्यसूची संविधान संशोधन विधेयकको कार्यसूची हटाइएको सूचना ।"
संविधान संशोधन विधेयकलाई समर्थन गर्ने राप्रपाको निर्णय,"काठमाडौं : राष्ट्रिय प्रजातन्त्र पार्टी (राप्रपा) ले निशान छाप परिवर्तन गर्न संसदमा दर्ताको तयारीमा रहेको संविधान संशोधन विधेयकलाई समर्थन गर्ने निर्णय गरेको छ। राप्रपाका तीनवटै अध्यक्ष कमल थापा, पशुपति शमशेर राणा र प्रकाशचन्द्र लोहनीबीच बुधबार बसेको बैठकले संविधान संशोधन विधेयकमा समर्थन गर्ने निर्णय गरेको हो। पार्टीका केन्द्रीय सचिवालय प्रमुख ध्रुवबहादुर प्रधान र भास्कर भद्रालले पार्टीले विधेयकको पक्षमा मतदान गर्ने निर्णय गरेको जानकारी दिए।"
संविधान संशोधन प्रस्तावमा हामी ब्याक भएका छैनौँ : कांग्रेस,"काठमाडौं : नेपाली कांग्रेसका प्रवक्ता विश्वप्रकाश शर्माले संविधान संशोधनको प्रक्रिया अगाडि बढाउन माग गरेका छन्। बुधबारको कार्यसूचीबाट उक्त प्रस्ताव हटेपछि मंगलबारको सर्वदलीय बैठकमा कांग्रेसको आग्रहमा संविधान संशोधन प्रस्तावको कार्यसूची हटेको भन्दै समाचार सार्वजनिक भएपछि प्रवक्ता शर्माले आपत्ति जनाएका हुन्। बुधबारको संसद बैठकमा संविधान संशोधन विधेयक प्रस्तुत नहुने संसद्को कार्यसूचीबाट यसरी हट्यो संविधान संशोधन विधेयक प्रस्ताव ल्याउँदा कांग्रेस नचाहिने फिर्ता गर्दा दोष लगाउने ? को गर्दैछ यो षड्यन्त्र ?, शर्माले ट्विटरमा प्रश्न गर्दै भनेका छन्, प्रक्रिया सुचारु गर्नोस्। केसको बैठक बसेर संस्थागत निर्णय साथ नयाँ नक्सा र संशोधनको पक्षमा उभिने जानकारी सर्वदलीय बैठकमै दिइसकेका छौं। यसमा हामी चट्टानी रुपले दृढ छौं र रहन्छौं"
कार्यसमिति बैठक बोलाउन देउवालाई गगनको दबाब,"काठमाडौं : नेपाली कांग्रेसका नेता गगनकुमार थापाले कांग्रेस केन्द्रीय कार्यसमितिको बैठकका लागि ढिला नगर्न आग्रह गरेका छन्। नक्सा सम्बन्धी विषयमा अनेक चलखेल भइरहेको र नक्सालाई संविधानमा समावेश गर्ने प्रक्रिया बीचैमा तुहिनसक्ने आशंका बढिरहेका बेला नेता थापाले बैठकका लागि ढिला नगर्न आह्वान गरेका हुन्। पार्टी सभापति शेरबहादुर देउवालाई नेता थापाले बैठक बोलाउन ढिला गर्न नहुने तर्फ ध्यानाकर्षण गराएका हुन्। उनले परिवर्तित नक्सालाई संविधानको अंग बनाउन प्रस्तुत संशोधनको पक्षमा उभिने पार्टी नेतृत्वको निष्कर्षलाई औपचारिकता दिनका लागि मात्रै बैठक बोलाउन लागिएकाले ढिला नगरी भोलि नै बैठक बोलाउनु पर्नेमा जोड दिएका छन्। सामाजिक सञ्जालमा उनले लेखेका छन्, परिवर्तित नक्सालाई संविधानको अङ्ग बनाउन प्रस्तुत संशोधनको पक्षमा उभिने पार्टी नेतृत्वको निष्कर्षको स्वामित्व लिने औपचारिकताका लागि मात्र केन्द्रीय समितिको बैठक चाहिएको हो। सभापतिज्यू भोलि नै बैठक बोलाई यो औपचारिकता पूरा गरौँ। काँग्रेस नेता थापाले पार्टीले यस विषयलाई तत्काल औपचारिक निर्णय गरेर फास्ट ट्रयाकबाट संविधान संशोधन प्रस्तावलाई पारित गर्नेगरी नेतृत्वदायी भूमिका खेल्न पनि आग्रह गरे। भारतले सीमाना मिचेको भन्दै थापाले संसदबाट संकल्प गर्नुपर्नेमा जोड दिएका छन्। प्रतिनिधि सभाको बैठकमा बुधबार संशोधन प्रस्ताव पेश गर्ने भनिए पनि अन्तिममा आएर कार्यसूचीबाट हटाइएपछि आशंका बढ्दै गइरहेका बेला उनले कांग्रेसलाई तत्काल औपचारिक निर्णय गर्न जोड दिएका हुन्। भारतीय पक्षबाट विभिन्न पार्टीका नेतालाई नक्सा पारित नगर्न दबाब आएको चर्चा व्यापक भइरहेका बेला त्यसबाट प्रभावित नहुन नेता थापाले नेताहरुलाई दबाब दिँदै आएका छन्।"
