शीर्षक,विवरण
लाइसेन्स परीक्षामा विवाद,"सामान्य अवस्थामा निमुखालाई यातायात कार्यालयमा गएर काम फत्ते गर्नु भनेको सानोतिनो युद्ध जित्नुसरह नै हुन्छ। दलाली वा कार्यालयका उच्च तहका कर्मचारीसँग पहुँच राख्न नसक्नेहरू कुनै काम लिएर पहिलोपटक यातायात कार्यालय पुगे पनि कामै नगरी आत्तिएर फर्कनुपर्ने अवस्था छ। सर्वसाधारणले भोग्दै आएको दुःखका शृंखला सोमबार फेरि दोहोरियो। सवारी चालक अनुमतिपत्र लिने आशमा लिखित परीक्षाका लागि घन्टौसम्म लामवद्ध सर्वसाधारण परीक्षा नै नदिइ फर्कनुपर्यो। निमुखा जनतालाई दुइटा सरकारी कार्यालयको विवादको चपेटामा पार्नु अन्याय हो। यस्तो गल्ती अबदेखि कुनै पनि सरकारी कार्यालयले दोहोऱ्याउनु हुँदैन। सवारीचालक अनुमतिपत्र प्रदान गर्नुअघि लिइने लिखित परीक्षाको पारदर्शिताका विषयमा यातायात कार्यालय र ट्राफिक प्रहरीबीच विगतदेखि नै सामान्य विवाद थियो। परीक्षा सञ्चालन हुने ठाउँमा सीसीटीभीको व्यवस्था गर्नुपर्ने ट्राफिकको चाहना छ। सोमबार उपत्यकामा तोकिएका केन्द्रमा परीक्षार्थी समयमै पुगे पनि ट्राफिकका प्रतिनिधि नआएकाले परीक्षा हुन पाएन। सर्वसाधारण केन्द्रमा परीक्षा दिन तयारी अवस्थामा पुगेका थिए। तोकिएको समयभन्दा झन्डै दुई घण्टापछि मात्रै ट्राफिकका प्रतिनिधि नआउने जानकारी पाएपछि परीक्षार्थीलाई त्यसै फर्काइयो। यो घटनामा यातायात कार्यालयले ट्राफिक प्रहरी महाशाखाको असहयोगका कारण परीक्षा हुन नसकेको बताएको छ । ट्राफिकले भने सडकमा हुने जाम व्यवस्थापनमा जनशक्ति खटाउनुपर्दा परीक्षा केन्द्रमा पठाउन नसकिएको बताएको छ। तर जसको कमजोरी भए पनि परीक्षाको पर्खाइमा बसेका सयौं नागरिकले व्यर्थेमा हैरानी बेहोर्नुपर्यो। यो हैरानीको जिम्मेवारी कसले लिने? अरूका गल्तीको भागिदार निमुखा नागरिकलाई किन बनाउने ? यसको जवाफ यातायात कार्यालय र ट्राफिक महाशाखाले दिनुपर्छ। आउने दिनमा यस्ता त्रुटि हुन नदिने प्रतिबद्धता जनाउनुपर्छ। पक्कै पनि परीक्षा हुने भएपछि केन्द्र र मिति अघिल्लो दिन नै तय गरिन्छ। सामान्यतया विगतमा हुँदै आएको शैलीमा परीक्षा चलाउन कति जनशक्ति चाहिने, कुन निकायबाट कतिजना प्रतिनिधि सहभागी हुने भन्ने पनि पहिले नै निक्र्योल हुन्छ। परीक्षा सञ्चालनको शैलीप्रति कुनै निकायको असन्तुष्टि वा समस्या छन् भने पनि छलफलबाटै टुंग्याउनुपर्छ। तर जनतालाई अन्योलमा पारेर परीक्षालाई अनिश्चित बनाउनु हुँदैन। हिजोआज सधैंजसो सडकमा राजनीतिक दलको विरोध प्रदर्शन, आमसभा र जुलुस भइरहेको छ। यसले ट्राफिक प्रहरीलाई भीड नियन्त्रण र यातायात आवागमनलाई चुस्त बनाउन सकस भइरहेको छ । यसको प्रभाव सवारी अनुमतिपत्र वितरणमा देखिएको हो भने वैकल्पिक व्यवस्था हुनुपर्छ। ट्राफिक प्रहरीको समस्यामा पनि सरोकारवाला निकाय गम्भीर बन्नुपर्छ। निकै अप्ठ्यारो परेको अवस्थामा सीसीटीभी जडान भएको हलमा परीक्षा चलाउँदा थोरै जनशक्तिले पनि काम चलाउन सकिन्छ भन्ने ट्राफिक महाशाखाको राय हो भने यसलाई पनि सकारात्मक मान्नुपर्छ। लामो समयपपछि हुन लागेको परीक्षा भएकाले फेरि पनि पटकपटक स्थगित गरिँदा सीधा असर सर्वसाधारणमाथि पर्छ भन्ने वास्तविकतालाई बिर्सनु हुँदैन। जसका कमजोरी भए पनि सोमबारको परीक्षामा सवारी चालक अनुमतिपत्रको पर्खाइमा बसेका सयौं जनताले एकैपटक दुःख पाए। जिम्मेवार निकायको लापरबाहीले यो परिणाम निम्त्याएको हो। कोरोनाको संक्रमण रोकिएला र लाइसेन्स लिउँला भनेर दिन कुरेर बसेका जनतालाई बल्लबल्ल हुन लागेको परीक्षाका लागि केन्द्रमै पुगेर पनि रित्तो हात फर्कनुपर्ने लाजमर्दो अवस्था अबदेखि आउन दिनुहुन्न। ट्राफिक प्रहरी र यायातायात कार्यालय दुवैको कामको प्रकृति हेरेर सर्वसाधारणले पनि आफ्नो तर्फबाट सक्दो सकारात्मक भूमिका निर्वाह गरिदिनुपर्छ।"
"मनाङमा डेढ महिनादेखि निरन्तर आगलागी, निभाउन हेलिकोप्टर प्रयोग गर्नुपर्ने स्थानीय माग","काठमाडौं मनाङ : हिमाली जिल्ला मनाङको चामे गाउँपालिका२ थानचोकको वनबाट मङ्सिर ११ देखि सुरु भएको आगो अझै नियन्त्रणमा आउन सकेको छैन। सल्लोको जङ्गल, सुकेका पातपतिङ्गर अनि निगालोको झाडीमा फैलिएको आगलागी नियन्त्रणबाहिर नै छ। हाल यो आगलागी नासो गाउँपालिका८ ताचैसम्म पुगेको छ। डेढ महिनादेखि निरन्तर आगलागी हुँदा पनि यसलाई निभाउन तथा नियन्त्रण गर्नेतर्फ प्रभावकारी पहल हुन सकेको छैन। हालसम्म कुनै मानवीय क्षति नभए पनि जडीबुटी र वन्यजन्तुमा कति असर पर्यो भन्ने एकिन हुन सकेको छैन। मानव वस्तीसम्म आएमा यसले ठूलो दुर्घटना निम्त्याउने खतरा छ। आगलागी भएको क्षेत्र लमजुङको सदरमुकाम बेँसीशहरबाट ५५ किलोमिटर र सदरमुकाम चामेबाट डेढ घण्टाको दूरीमा पर्दछ। स्थानीय प्रशासनले केन्द्रसँग समन्वय गरेर आगो नियन्त्रणमा तदारुकता नदेखाउँदा हजारौँ हेक्टर जङ्गल डढेलोले सखाप बनाएको छ। यो क्षेत्र अन्नपूर्ण संरक्षण क्षेत्र एक्याप को संरक्षणमा रहेको छ। मनाङका प्रमुख जिल्ला अधिकारी विष्णु लामिछानेले सुरक्षा समितिसँगको समन्वयमा नियन्त्रणको प्रयास भइरहेको बताउँछन्। 'हाम्रो प्रयत्न छ। हामी नियन्त्रणको प्रयास गरिरहेका छौँ। स्थानीय प्रशासन, सुरक्षा संयन्त्र, स्थानीय र सरोकारवाला समुदायको संयुक्त प्रयासमा जोखिम न्यूनीकरण गर्ने काम भइरहेको छ। मानव बस्तीसम्म आउन नदिने हाम्रो प्रयास हुनेछ', उनले भने, 'अन्तिम अवस्थामा हेलिकोप्टरसम्मको प्रयोग पनि हुनसक्छ।' मानवीय क्षति नभए पनि बहुमूल्य जडीबुटी र दुर्लभ वन्यजन्तु लोप हुने खतरा भएकोले यसलाई तत्काल निभाउनुपर्ने माग आसपासका बासिन्दाले गर्दै आएका छन्। उनीहरूले केन्द्रसँग समन्वय गरेर हेलिकोप्टर प्रयोग गरेर भए पनि डढेलो तत्काल निभाउनुपर्ने बताएका छन्। यसअघि पाथिभारा क्षेत्रमा लागेको डेढेलो नियन्त्रणका लागि सिम्रिक एयरको हेलिकोप्टर प्रयोग गरिएको थियो। स्थानीय याद घलेले हिमाली क्षेत्रको जङ्गलमा लामो समयदेखि लागेको आगोबाट महत्वपूर्ण जडीबुटी र वन्यजन्तु लोप भएको बताए। 'प्रशासन र जनप्रतिनिधि पनि मुकदर्शक बनेको उनको आरोप छ। आगलागी भएको क्षेत्र जङ्गलमा थार, घोरल, कस्तुरी, मृग, हिउँचितुवा जस्ता वन्यजन्तु र पाँचऔँले, निरमसी, कुट्की, पदमचाल, यार्सागुम्बालगायत जडीबुटी पाउने गरिन्छ। आगलागी फैलँदै जाँदा नजिकैको ताचै गाउँ जोखिममा पर्ने खतरा छ। ताचैमा ६० घरपरिवारको बसोबास रहँदै आएको छ। स्थानीयले पटकपटक हारगुहार गरेपछि सोमबार मात्र प्रजिअ, नेपाली सेना, सशस्त्र प्रहरी बल, नेपाल प्रहरी र एक्यापका प्रतिनिधिसहितको टोली आगलागी भएको क्षेत्रमा पुगेको थियो। स्रोतसाधन अभाव र भौगोलिक विकटताले आगो नियन्त्रणमा चुनौती थपिएको छ। यतिबेला स्थानीयवासी र सुरक्षाकर्मीले स्याउलाको प्रयोग गरेर आगो नियन्त्रणको प्रयास गरिरहेका छन्। जुन संभव नरहेको स्थानीय नै बताउँछन्। किन हुन्छ आगलागी ? आगलागीका कारण महत्वपूर्ण जडीबुटी र वन्यजन्तु लोप हुने अवस्था आउँदा जैविक विविधतालाई समेत असर पर्ने देखिएको छ। अन्नपूर्ण संरक्षण क्षेत्र (एक्याप) का जिल्ला प्रमुख लेखनाथ गौतमले आगलागीबाट जैविक विविधतामा गम्भीर असर पुर्याउने बताए। हिमाली क्षेत्रमा लामो समयसम्म लागेको आगोले वनस्पति र वन्यजन्तु लोप हुन्छन्। यसले जैविक विविधतालाई असर पार्छ उनको भनाइ छ। हिमाली जङ्गलमा आगलागी हुनुमा जङ्गली जनावरको चोरीशिकारी, गुच्चीच्याउर नयाँ घाँसका लागि आगलागी हुने गर्छ।"
