शीर्षक,विवरण
प्रधानमन्त्री ओली आज झापा र मोरङका तीन कार्यक्रममा सहभागी हुने,"विराटनगर : प्रधानमन्त्री केपी शर्मा ओली तीनवटा कार्यक्रममा सहभागी हुन मंगलबार झापा र मोरङ आउँदै छन्। ओली बिहान ११ बजे यति एयरलाइन्सको जहाजमार्फत झापाको भद्रपुर विमानस्थलमा ओर्लने कार्यक्रम तय भएको सुरक्षा स्रोतले बतायो। उनले सुरुमा बिर्तामोड नगरपालिका७ मा विपन्न ३७ परिवारका लागि निर्माण गरिएको प्रदेश १ गौरव भिलेजको रुपमा नामाकरण गरिएको आवासको उद्घाटन गर्ने छन्। उद्घाटनपछि नगरपालिकाले आवास समुदायलाई हस्तान्तरण गर्ने कार्यक्रम छ। अव्यवस्थित रुपमा बसोवास गर्दै आएका ३७ विपन्न परिवारका लागि बिर्तामोड नगरपालिकाको संयोजनमा आवास निर्माण गरिएको हो। नगर प्रमुख धुब्रकुमार शिवकोटीले धनजुजु श्रेष्ठ र कमला श्रेष्ठले एक बिघा तीन कट्ठा जग्गा उपलब्ध गराएपछि आवास निर्माण सम्भव भएको जानकारी दिए। हेविट्याट नेपालको ८३ लाख रुपैयाँ र सहारा नेपालको प्राविधिक सहयोगमा नगरपालिकाले आवास निर्माण गरेको हो। विशेष गरी चौधरी, कुर्मी र सन्थाल समुदायका विपन्न नागरिकका लागि सात दशमलव तीन धुर क्षेत्रफलमा घरहरु तयार गरिएका हुन्। एउटा आवास निर्माणमा चार लाख रुपैयाँ खर्च भएको निर्माण समितिका सचिव अविरल कृष्ण खरेलले जानकारी दिए। आवास उद्घाटन सकिएपछि ओलीले बिर्तामोडमै बी एण्ड सी अस्पतालले सञ्चालनमा ल्याएको पूर्वाञ्चल क्यान्सर हस्पिटलको उद्घाटन गर्ने छन्। क्यान्सरको उपचार गराउन अब विदेश गइरहन नपर्ने बताउँदै अस्पतालका कार्यकारी प्रमुख दुर्गा प्रसाईले तीन सय बेडको स्वीकृति पाएपछि हालसम्म एक सय बेड सञ्चालनमा ल्याइएको जानकारी दिए। झापाका दुईवटा कार्यक्रम सकिएपछि ओली मोरङ आइपुग्ने छन्। उनले उर्लाबारी नगरपालिका८ र ९ को सीमानामा रहेको रातोहोली खोल्सीनजिक लोपोन्मुख एवं अल्पसंख्यक सन्थाल समुदायका लागि निर्माण गर्न लागिएको एकीकृत सन्थाल बस्तीको शिलान्यास गर्ने कार्यक्रम छ। उर्लाबारी९ मा सन्थाल बस्तीको शिलान्यास गरेपछि प्रधानमन्त्री ओलीले उर्लाबारी८ मा आयोजित कार्यक्रमलाई सम्बोधन गर्ने छन्। उर्लाबारी८ का वडा अध्यक्ष कूलबहादुर कार्कीले कार्यक्रमको सबै तयारी पूरा भइसकेको बताए। उनका अनुसार सन्थाल जातिका लागि ३० करोड रुपैयाँ खर्च गरेर दुई वर्षभित्रमा एकीकृत बस्ती निर्माण गरिसक्ने योजना छ। झापा र मोरङका विभिन्न कार्यक्रममा सहभागी भएपछि विराटनगर विमानस्थल हुँदै प्रधानमन्त्री आजै काठमाडौं फर्कने बताइएको छ। ओली विभिन्न कार्यक्रममा सहभागी हुन गत आइतबार पनि झापा आएका थिए। झापाका तीन स्थानीय तहहरु दमक नगरपालिका, गौरादह नगरपालिका र कमल गाउँपालिका क्षेत्रमा बन्ने नेपालचीन मैत्री औद्योगिक पार्कको शिलान्यास ओलीले गरे। त्यही दिन जिल्लाका विभिन्न विकास आयोजनाको शिलान्यास पनि उनले गरेका छन्। ओलीको एक सातामा तीन दिन झापा पुग्ने कार्यक्रम यसअघि नै तय भएको थियो। आगामी २१ गते पनि उनी झापा आएर सुखानीको कार्यक्रममा सहभागी हुने बताइएको छ। सुरक्षा व्यवस्था कडाप्रधानमन्त्री ओलीको भ्रमण तय भएपछि बिहानैदेखि झापा र मोरङको सुरक्षा व्यवस्था कडा पारिएको छ। सुरक्षा व्यवस्था मिलाउन नेपाली सेना, नेपाल र सशस्त्र प्रहरी तथा राष्ट्रिय अनुसन्धानसमेतका चारवटै सुरक्षा अंगलाई परिचालन गरिएको छ। ठाउँठाउँमा ठूलो संख्यामा सुरक्षाकर्मी खटाइएको छ। मोरङ प्रहरी प्रमुख एसपी सन्तोष खड्का र झापा प्रहरी प्रमुख एसपी सानुराम भट्टराई सुरक्षा व्यवस्था मिलाउन आफैँ फिल्डमा खटिएका छन्। कुनै पनि कमजोरी हुन दिने हिसाबमा पर्याप्त सुरक्षाकर्मी परिचालन गर्दै भरपर्दो सुरक्षा व्यवस्था मिलाइएको प्रदेश १ प्रहरी प्रमुख डीआईजी ईश्वरबाबु कार्कीले जानकारी दिए। उनका अनुसार भद्रपुर विमानस्थलदेखि विभिन्न कार्यक्रमहरु आयोजना गरिएका स्थान र प्रधानमन्त्री काठमाडौं फर्कने विराटनगर विमानस्थलसम्मको सुरक्षा व्यवस्था अत्यन्तै कडा पारिएको छ। नेपाल प्रहरीका डीआईजी कार्की र प्रदेश १ सशस्त्र प्रहरी बल प्रमुख डीआईजी वंशीराज दाहाल झापा पुगिसकेका छन्। प्रधानमन्त्रीको भ्रमणका सन्दर्भमा मिलाइएको सुरक्षा व्यवस्थाको अनुगमन र निरीक्षणका क्रममा रहेका उनीहरुले सुरक्षामा कुनै पनि कमजोरी हुन नदिन निर्देशन दिएका छन्।"
राप्रपा महाधिवेशन प्रतिनिधिको निर्वाचन वैशाख १० गतेभित्रै,"काठमाडौं : राष्ट्रिय प्रजातन्त्र पार्टीले महाधिवेशन प्रतिनिधिको निर्वाचन आगामी वैशाख १० गतेभित्र सम्पन्न गर्ने निर्णय गरेको छ। पार्टी केन्द्रीय कार्य व्यवस्था समितिको सोमबारको बैठकले वैशाख २५ देखि २८ गतेसम्म काठमाडौँमा हुने महाधिवेशनलाई दृष्टिगत गर्दै उक्त निर्णय गरेको केन्द्रीय सचिवालय प्रमुख ध्रुवबहादुर प्रधानले जानकारी दिए। बैठकले स्थानीय तह परिषद् तथा केन्द्रीय निर्वाचन समिति निर्देशिका पारित गरेको छ। निर्देशिकामा जिल्ला निर्वाचन समितिको गठन फागनु २५ गतेभित्र गरिसक्ने तथा सक्रिय सदस्यता वितरण अभियानलाई चैत १५ सम्म म्याद थप गर्ने उल्लेख छ। वडादेखि जिल्ला तहसम्मका इकाई समितिको गठन यही चैत मसान्तसम्ममा गरिसक्ने पनि उल्लेख छ। समायोजन गर्न बाँकी केही जिल्लाको सात दिनभित्र समायोजन गर्न नेता बुद्धिमान तामाङ, विक्रम पाण्डे, ध्रवबहादुर प्रधान र भास्कर भद्रालाई जिम्मेवारी दिइएको पार्टीद्वारा जारी विज्ञप्तिमा उल्लेख छ। रासस"
राप्रपाले गठन गर्यो निर्वाचन समिति,"काठमाडौं : राष्ट्रिय प्रजातन्त्र पार्टी (राप्रपा)ले केन्द्रीय निर्वाचन समिति गठन गरेको छ । वैशाख २५ देखि २८ गतेसम्म काठमाडौंमा हुने केन्द्रीय महाधिवेशनका लागि केन्द्रीय निर्वाचन समिति गठन गरेको हो । केन्द्रीय अधिवेशनका लागि हरिबहादुर बस्नेतको अध्यक्षतामा बसेको केन्द्रीय निर्वाचन समिति गठन गरेको हो । समितिको सहअध्यक्षमा तोरणबहादुर गुरुङ, सचिवमा गीताभक्त जोशी तथा सहसचिवमा झनक प्याकुरेल रहेका छन् । निर्वाचन समिति सदस्यमा रोशन कार्की, कैंया चौधरी, श्यामबहादुर शाही, पुष्कर अधिकारी र रामेश्वर श्रेष्ठ रहेका छन् ।"
सरकारले वार्ता टोली गठन गरे लगत्तै विप्लवले बनाए समिति,"काठमाडौं : सरकारले वार्ता टोली गठन गरे लगत्तै नेत्रविक्रम चन्द्र विप्लव समूहले समेत सरकारसँग वार्ताका लागि टोली गठन गरेको छ । विप्लवले विज्ञप्ति सार्वजनिक गर्दै खड्गबहादुर विश्वकर्मा प्रकाण्डको नेतृत्वमा दुई सदस्यीय वार्ता टोली गठन गरेको जानकारी दिएका हुन् । वार्ता टोली उदयबहादुर चलाउने दीपक रहेका छन् । 'नेपाल सरकारसँग देशका राजनीतिक, आर्थिक र राष्ट्रिय स्वाधीनताका विषयमा वार्तामा बस्न हाम्रो जनप्रिय पार्टी नेपाल कम्युनिस्ट पार्टी सहमत भएको छ', विप्लवले विज्ञप्तिमा भनेका छन्, 'पार्टीका तर्फबाट वार्तामा सहभागी बन्न पार्टीका केन्द्रीय समिति सचिवालय सदस्य एवम् प्रवक्ता कप्रकाण्डको नेतृत्वमा केन्द्रीय सदस्य कदीपक सदस्य रहेको दुई सदस्यीय उच्चस्तरीय वार्ता टोली गठन गरिएको जानकारी गराउँदछौं ।'"
"खोलाको बगरमा माटोको ढिस्कोले पुरिएर युवतीको मृत्यु, बालिका र महिला घाइते",विराटनगर : मोरङको सुनवर्षी नगरपालिका१ कालाबञ्जारस्थित डाँस खोलाको बगरमा माटो खन्ने क्रममा ढिस्कोले पुरिएर मंगलबार दिउँसो एक युवतीको मृत्यु भएको छ। घटनामा परेर एक बालिका र महिला घाइते भएका छन्। मृतक २० वर्षीया वन्शुबिया यादव भारतीय नागरिक हुन्।प्रहरीका अनुसार उनी केही दिनअघि सुनवर्षी नगरपालिका४ गान्धी आश्रमस्थित मावली घरमा आएको खुलेको छ।दिउँसो २ बजेतिर माटोको ढिस्को खसेर पुरिँदा घटनास्थलमै उनको मृत्यु भएको मोरङ प्रहरीका प्रवक्ता डीएसपी मानबहादुर राईले जानकारी दिए। उनका अनुसार घटनास्थलमा पुगेको प्रहरी टोलीले भारतको दरभङ्गा घर भएकी वन्शुबियाको शव माटोले पुरिएको अवस्थामा बाहिर निकालेर पोस्टमार्टमाका लागि रंगेली अस्पताल पुर्याएको छ। उनी मावली गाउँका तीनचार जनासँग मिलेर घर लिपपोतमा प्रयोग गरिने माटो खन्न गएको प्रारम्भिक अनुसन्धानबाट खुलेको डीएसपी राईले बताए। खाल्डोमा पसेर माटो खन्ने क्रममा माथिबाट ढिस्को खसेर भएको घटनामा एक बालिका र एक महिला गरेर अरु दुईजना घाइते भएका छन्। घाइते हुनेमा सुनवर्षी४ की ९ वर्षीया बालिका मनिका यादव र ५५ वर्षीया महिला झोलीया यादव रहेको जानकारी राईले दिए। घाइते दुवै जनाको रंगेली अस्पतालमा उपचार भइरहेको र अवस्था खतरामुक्त रहेको जानकारी अस्पतालले दिएको उनको भनाइ छ।
तोरी फुलेर ढपक्क खोकना (फोटो फिचर),ललितपुर : ललितपुरको दक्षिण गाउँ खोकना यतिबेला तोरी फुलेर सुन्दर बनेको छ। तोरी फुलेर खोकनाका खेतबारी छपक्क ढाकेको छ। खोकना तोरीको तेलका लागि प्रख्यात छ। यहाँ स्थानीय कोलबाटै तोरीको तेल पेल्छन्। तोरीकै तेल बेचेर उनीहरू दैनिकी चलाउने गरेका छन्। तस्बिर : सुनिता डंगोल
दैलेखमा बालिकालाई करणी गरेको आरोपमा युवक पक्राउ,दैलेख : दैलेखमा बालिकालाई जबरजस्ती करणी गरेको आरोपमा प्रहरीले एकजना युवालाई पक्राउ गरेको छ । भगवतीमाई गाउँपालिका२ बेस्तडाका १८ वर्षीया मोहन बुढालाई १६ वर्षीया बालिकालाई जबरजस्ती करणी गरेको आरोपमा प्रहरीले पक्राउ गरेको जनाएको छ । जिल्ला प्रहरी कार्यालय दैलेखका प्रहरी नायब उपरीक्षक (डिएसपी) अनुपम श्रेष्ठका अनुसार पीडित बालिकाको परिवारले जाहेरी दरखास्त दिएको थियो । पीडित परिवारले दिएको जाहेरी दरखास्तका आधारमा युवकलाई पक्राउ गरिएको डिएसपी श्रेष्ठले बताए । पक्राउ परेका ती युवालाई जिल्ला अदालतबाट म्याद थप गरी घटनाको सम्बन्धमा थप अनुसन्धान भइरहेको बताइएको छ । अहिले युवक प्रहरी हिरासतमा छन् ।
ताप्लेजुङ दोभान बजारमा आगलागी : ३५ घर जलेर नष्ट,"ताप्लेजुङ : ताप्लेजुङको मेरिङ्देन गाउँपालिका३ तथा जिल्लाकै दोस्रो ठूलो बजार दोभान बजारमा आगलागी भइरहेको छ। आज बिहान १० बजे भोला पौडेलका घरबाट विद्युत् चुहिएर आगलागी भएको स्थानीयवासी गणेश कार्कीले बताए। दोभान बजारमा अहिले ३५ घर जलेर पूरै नष्ट भइसकेको जनाइएको छ। उनले भने, 'आगो नियन्त्रणभन्दा बाहिर गइसक्यो, केही घर भत्काएर अग्निरेखा कोर्ने काम गर्दै छौं।' ताप्लेजुङको दमकल आगलागी क्षेत्रमा पुगेको र छिमेकी जिल्ला पाँचथरदेखि पनि आउँदै गरेको जिल्ला प्रहरी कार्यालयका प्रमुख बालरनसिंह राणाले जानकारी दिए। उनले भने, 'म पनि आगलागी क्षेत्रमा जाँदै छु। आगलागी भीषण छ भन्ने खबर आएको छ।' सुरक्षाकर्मी र स्थानीयवासीले आगो नियन्त्रण गर्ने पहल गरिरहेको कार्कीले जानकारी दिए।  रासस"
