शीर्षक,विवरण
औद्योगिक क्षेत्रले जगाएको आशा,"संयुक्त राष्ट्रसंघको एउटा समितिले भर्खरै मात्र मुलुकलाई अल्पविकसितबाट विकासशील राष्ट्रमा स्तरोन्नतिका लागि सिफारिस गरेको छ। विकासशील राष्ट्र बन्न चाहिने तीनवटा मापदण्डमध्ये दुईवटा सहजै पूरा गरे पनि प्रतिव्यक्ति आयको सन्दर्भमा भने नेपालले निर्धारित लक्ष्य भेटाउन सकेको छैन। उद्योग तथा कलकारखाना स्थापना प्रक्रियामा लागेको ब्रेक, बढ्दो बेरोजगार दर तथा न्यून आर्थिक क्रियाकलापका कारण प्रतिव्यक्ति आम्दानीको लक्ष्यमा पुग्न कठिनाइ भइरहेको छ। सरकारले पछिल्लो समय दु्रतगतिमा दौडाएको औद्योगिक क्षेत्र स्थापना प्रक्रियाले भने विकासशील राष्ट्रमा स्तरोन्नति हुने मात्रै होइन समग्र मुलुककै आर्थिक हैसियत माथि उकास्ने आशा जगाएको छ। नयाँ उद्योग स्थापनाका लागि सरकार आफैंले पहल गरेर उद्योगीव्यवसायीलाई आकर्षित गराउन पहल गर्नु सकारात्मक हो। विगतमा खुलेका औद्योगिक क्षेत्रमा भएका कमीकमजोरी सुधार्दै सबै औद्योगिक क्षेत्रको कुशल व्यवस्थापन हुनसक्यो भने मात्रै मुलुकले आशा गरेअनुसारको लक्ष्य हासिल हुनसक्छ। मुलुकको आवश्यकता र औद्योगिक क्षेत्र स्थापनाको मर्म बुझेर सम्पूर्ण क्रियाकलाप अघि बढाउनुपर्छ। मुलुकमा पहिलोपटक २०१९ सालमै बालाजु औद्योगिक क्षेत्र स्थापना भएको थियो। त्यसपछि विभिन्न समयमा मुलुकको सबैजसो क्षेत्रको प्रतिनिधित्व हुनेगरी १० वटा यस्ता औद्योगिक ग्राम खुलिसकेका छन्। २०४५ सालदेखि त औद्योगिक क्षेत्र व्यवस्थापन लिमिटेड नै स्थापना गरेर औद्योगिक क्षेत्रहरूको व्यवस्थापन भइरहेको छ। तैपनि छिमेकी भारत तथा चीनलगायत विश्वका अधिकांश मुलुकमा तीव्र गतिमा औद्योगिक विकास भइरहे पनि मुलुकभित्र भने यसले अपेक्षाकृत गति लिन नसकेको तीतो यथार्थ छ। अहिलेसम्म बालाजु, भक्तपुर, पाटन, धरान, बुटवल, नेपालगञ्ज, पोखरा, वीरेन्द्रनगर, हेटौंडा र राजविराजमा औद्योगिक क्षेत्र स्थापना भइसकेका छन्। पछिल्ला दुई साताभित्रमा कन्चनपुर, मकवानपुर, झापा, बाँकेमा नयाँ औद्योगिक क्षेत्रको शिलान्यास गरिएको छ र अन्य स्थानमा पनि खुल्ने प्रक्रियामा छ। औद्योगिक क्षेत्र खोल्दा मुलुकको भौगोलिक सन्तुलन कायम गरिएको छ। यति सानो मुलुकमा झण्डै हाल खुलिसकेका र खुल्ने प्रक्रियामा रहेका समेत गर्दा डेढदर्जन औद्योगिक क्षेत्र स्थापना हुनु पर्याप्त हो। तर यी क्षेत्रहरूबाट सोचेअनुसार परिणाम आउन नसक्दा अर्थतन्त्रमा जति योगदान पुर्याउनुपर्ने हो त्यो हुन सकेको छैन। पछिल्लो समय मुलुकको कुल गार्हस्थ उत्पादनमा उद्योगको हिस्सा पाँच प्रतिशत रहेको सरकारी तथ्यांक छ। विगतमा यो प्रतिशतमा केही बढिरहे पनि क्रमशः घट्दो क्रममा छ। नयाँ औद्योगिक क्षेत्र स्थापना प्रक्रिया अघि बढाउँदै गर्दा पुरानामा केकस्ता समस्या थिए र यस्तो किन भइरहेको छ भन्ने विषयमा पनि अध्ययन हुनु आवश्यक छ। यसअघि स्थापना भएकामध्ये अधिकांश औद्योगिक क्षेत्र विदेशी सहायतामा निर्माण भएका छन्। यसपटक भने सरकारी लगानीमै स्थापना हुन लागेका हुन्। तर ठाउँ तोक्दैमा उद्योग कलकारखाना स्थापना हुन्छ, रोजगारी वृद्धि हुन्छ र मुलुकको आर्थिक कायापलट हुन्छ भन्नेमा ढुक्क हुनुहुँदैन। औद्योगिक क्षेत्रलाई गोदाम वा विदेशबाट ल्याइएको सामग्री भण्डारण केन्द्रमा परिणत हुन दिनुहुन्न। स्वदेशी उत्पादनलाई बढावा दिने कार्यक्रम ल्याउनुपर्छ। समग्र सामाजिक तथा आर्थिक क्षेत्रमा सकारात्मक प्रभाव पार्ने र आर्थिक क्रियाकलापमा बढोत्तरी हुने गतिविधिलाई प्राथमिकता दिनुपर्छ। यसो गर्न सकिएमा मात्रै रोजगारी सिर्जनादेखि मुलुकको कुल गार्हस्थ उत्पादनमा समेत महत्वपूर्ण योगदान पुर्याउनेछ। यसले जनताको आय स्तरमा वृद्धि भई मुलुकको अर्थतन्त्र उकास्न समेत महत्वपूर्ण भूमिका खेल्नेछ। यसका लागि विगतमा खोलिएको औद्योगिक क्षेत्रमा देखिएको कमीकमजोरी सच्याएर नयाँ परिवेशमा सकारात्मक सोचका साथ अघि बढ्न जरुरी छ।"
बढ्यो आर्थिक गतिविधि,"काठमाडौं : कोरोना भाइरस महामारी व्यवस्थापन हुँदै गएपछि आर्थिक क्रियाकलापमा भारी वृद्धि भएको देखिएको छ। बैंक तथा वित्तीय संस्थामा उपलब्ध पैसाको स्तरले आर्थिक गतिविधि बढेको देखाएको हो। वित्तीय स्रोत (पुँजी)को उपयोगका आधारमा पनि आर्थिक गतिविधिलाई मापन गर्ने गरिन्छ। वित्तीय आँकडाले औद्योगिक क्रियाकलाप र नागरिकको किनमेल बढ्न थालेको देखाएका छन्। नेपाल राष्ट्र बैंकका प्रवक्ता डा गुणाकर भट्टले पछिल्लो दुई महिनामा बैंकहरूसँग भएको लगानीयोग्य रकम २ खर्ब रुपैयाँ घटेको बताए। पुस मध्यतिर २ खर्ब ३० अर्बसम्म पुगेको अधिक तरलता (बैंक तथा वित्तीय संस्थाले तुरुन्त लगानी गर्न सक्ने गरी राखेको पैसा) आइतबार ७१ अर्ब रुपैयाँमा झरेको छ। तर, यसबीच राष्ट्र बैंकले कोभिड १९ बाट प्रभावित व्यवसायका लागि ८४ अर्ब रुपैयाँ पुनरकर्जा दिएको छ। पुनरकर्जा भनेको राष्ट्र बैंकले नयाँ पैसा छापेर बजारमा पठाउनेजस्तै हो। पुसपछि बैंकहरूले नयाँ ऋण नदिएको र निक्षेप फिर्ता पनि नभएको भए अहिले वित्तीय प्रणालीमा ३ खर्ब रुपैयाँभन्दा ज्यादा अधिक तरलता हुन्थ्यो। पुनरकर्जालाई जोडेर हेर्दा पुसमा भएको २ खर्ब रुपैयाँ अधिक तरलता व्यवस्थापन भइसकेको देखिन्छ, प्रवक्ता डा भट्टले भने। बैंकसँग अहिले ७१ अर्ब मात्रै रहेको र थप ९ अर्ब ५४ करोड राष्ट्र बैंकले तरलता प्रशोचन अर्थात् बजारबाट पैसा खिचेर लिएको छ। यो जोड्दा पनि अहिलेको अवस्थामा बैंकहरू ८० अर्ब रुपैयाँभन्दा बढी ऋण दिन सक्ने अवस्था छैनन्। निक्षेपकर्ताले पैसा फिर्ता लिन थाले भने त त्यति पनि ऋण दिने क्षमता रहँदैन। यसले एकातिर मुलुकमा आर्थिक गतिविधि बढेको देखाएको छ भने सँगै बैंकमा पैसा अभाव निम्तिन थालेको संकेत पनि गरेको छ। सामान्यतः नेपाली वित्तीय प्रणालीमा ३०४० अर्ब रुपैयाँ अधिक तरलता रहेकै अवस्थामा पनि पैसा अभाव हुन थाल्छ। धेरै बैंक तथा वित्तीय संस्थामा छरिएर रहेको पैसा एकमुष्ट जोड्दा ठूलो अंक देखिने भए पनि हरेक बैंकको लगानी क्षमता बराबर हुँदैन। बजारमा लगानीयोग्य पैसा अभाव भयो भने त्यसको असर सुरुमै ब्याजदरमा पर्छ। बैंकहरूले एकातिर ऋणीसँग बढी ब्याज लिन थाल्छन् भने सँगै निक्षेपकर्ताले पाउने ब्याज पनि बढ्छ। आफ्नो बैंकमा निक्षेप तान्न यसअघि पनि बैंकहरूले ब्याजदर बढाउने प्रतिस्पर्धा गर्दै आएका थिए। तरलता अभाव देखिँदाको दोस्रो असरचाहिँ सेयर बजारमा पर्छ। ब्याजदर बढ्न थालेपछि सेयर बजार ओरालो लाग्न थाल्छ। असोजपछि बढ्न थालेको अन्तर्राष्ट्रिय व्यापारले तीव्रता पाएको छ। लामो समय बन्द रहेका औद्योगिक कलकारखानाले विदेशबाट कच्चा पदार्थ किन्ने क्रम हिउँद लागेसँगै बढ्न थालेको छ। राष्ट्र बैंकको तथ्यांकले पनि पुससम्म आइपुग्दा नेपालले पोहोर सालकै बराबर पैसा वस्तु आयातमा खर्चिसकेको छ। माघको औपचारिक तथ्यांक आउन बाँकी छ। तर, मागमा आयात निकै चुलिएको सरकारी अधिकारीहरू बताउँछन्। सेयर बजारमा पनि लगानी बढेको छ। असार मसान्तमा सेयर धितोमा ५० अर्ब रुपैयाँ लगानी भएकामा पुससम्म ७६ अर्ब रुपैयाँ कर्जा परिचालन भएको छ। माघ र फागुनमा सेयर धितो कर्जा अझै बढेको सेयर बजारको फैलँदो आकारले पनि जनाउँछ। बैंकहरूको तथ्यांक हेर्ने हो भने फागुन लागेपछि कर्जा विस्तार आक्रामक रूपमा अघि बढेको देखिन्छ। नेपाल बैंकर्स संघको तथ्यांकअनुसार फागुनको दुई सातामा २७ वटा वाणिज्य बैंकले मात्रै ४४ अर्ब रुपैयाँ थप कर्जा लगानी गरेका छन्। जबकि, यसबीचमा २३ अर्ब रुपैयाँ मात्रै निक्षेप थपिएको छ।"
गरिबी निवारणमा अलमल,"काठमाडौं : सरकार गरिब पहिचानमै अल्मलिएको छ। पहिचानमै सरकार अल्मलिएपछि गरिबी निवारणसम्बन्धी कार्यक्रम प्रभावकारी हुन सकेका छैनन्। सरकारले चालू आर्थिक वर्षमा २३ जिल्लामा गरिबी पहिचान गर्ने भएको छ। यसअघि २६ जिल्लामा गरिबी पहिचान भइसकेको छ। पहिचान भइसकेका ती जिल्लामा कस्ता कार्यक्रम लैजाने भन्नेमा सरकार अलमलमा छ। सहकारीमार्फत गरिबी निवारण गर्न सकिने भए पनि सरकारले गरिबी निवारण गर्न चासो देखाएको छैन। पाण्डेका अनुसार यस वर्ष अन्य २३ जिल्लाको गरिब पहिचान गर्ने गरी गृहकार्य भइरहेको छ। भूमि व्यवस्था, सहकारी तथा गरिबी निवारण मन्त्रालयले गरिबी निवारणसम्बन्धी ठोस कार्यक्रम ल्याउन नसके पनि अन्य मन्त्रालयबाट हुँदै आएका गरिबी निवारणसम्बन्धी कार्यक्रमको उपलब्धि खोजी गरेको छ। मन्त्रालयका शाखा अधिकृत बाबुराम पाण्डेका अनुसार गरिबी निवारणसम्बन्धी सम्पूर्ण कार्यक्रमको उपलब्धि खोजी गर्न गृहकार्य सुरु भइसकेको छ। परामर्शदाता छनोट गरी गरिबी निवारणसँग जोडिएका कार्यक्रम पहिचान गरी उपलब्धि खोज्न सुरु गरिएको पाण्डेले बताए। पाण्डेका अनुसार चैत मसान्तसम्म गरिबी निवारणसँग सम्बन्धित सबै कार्यक्रमको प्रतिवेदन निर्माण हुनेछ। मन्त्रालयले गरिबी निवारणसँग सम्बन्धित १८ वटा कार्यक्रम पहिचान गरी कार्यक्रमको उपलब्धि खोजी गरिरहेको पाण्डेले बताए। ती सबै कार्यक्रमले गरिबी निवारणमा के योगदान पुग्यो भन्ने विषयमा अध्ययन हुँदै छ, उनले भने। मन्त्रालयले गरिबसँग विश्वेश्वर, सहकारी क्षेत्र सुदृढीकरण, मेडपा, गरिबी निवारण कोष, प्रधानमन्त्री रोजगार कार्यक्रम, प्रधानमन्त्री कृषि आधुनिकीकरण, राष्ट्रपति महिला उत्थान कार्यक्रम, सामुदायिक तथा कबुलियती वन कार्यक्रम, स्वास्थ्य बिमा कार्यक्रमको विवरण खोज गरिरहेको छ। त्यस्तै व्यावसायिक तथा सीप विकास कार्यक्रम, वैकल्पिक ऊर्जा प्रवर्द्धन केन्द्र, जनता आवास कार्यक्रम, प्रदेश तथा स्थानीय शासन सहयोग कार्यक्रम, सामाजिक सुरक्षा कार्यक्रम (दलित, एकल महिला) युवा तथा साना व्यवसायी स्वरोजगार कार्यक्रम, हलैया, कमैया पुनस्र्थापना कार्यक्रम, सहकारी बजार विकास कार्यक्रमको विवरण खोजी सुरु भइसकेको पाण्डेले जानकारी दिए। गरिबी निवारणसम्बन्धी सम्पूर्ण काम गर्ने गरी छुट्टै गरिबी निवारण मन्त्रालय स्थापना भए पनि सरकारले गरिबी निवारणसम्बन्धी कार्यक्रम ल्याउन सकेको छैन। सरकारले गरिबी निवारणसम्बन्धी ठोस कार्यक्रम ल्याउन नसक्दा दिनप्रतिदिन गरिबी बढ्दै गएको छ। पछिल्लो समय विश्वव्यापीरूपमा फैलिएको कोरोना भाइरस (कोभिड १९) ले बेरोजगार बढ्नुका साथै गरिबी पनि बढाएको छ। गरिबी निवारण कोष यसै मन्त्रालयअन्तर्गत ल्याइए पनि प्रभावकारीरूपमा कार्यान्वयन हुन सकेको छैन। कोष यसअघि प्रधानमन्त्री कार्यालयअन्तर्गत थियो। सरकारले कोषको कार्यक्रम फेजआउट गर्ने समेत निर्णय गरिसकेको छ। जसका कारण कोषअन्तर्गत सञ्चालन भइरहेका कार्यक्रमसमेत अलपत्र परेका छन्। मन्त्रालयले त्यसको स्वामित्व लिन सकिरहेको छैन।"
