शीर्षक,विवरण
काठमाडौं उपत्यकामा थप १६६ जनामा कोरोना संक्रमण,"काठमाडौं : पछिल्लो २४ घण्टामा काठमाडौं उपत्यकामा थप १६६ जनामा कोरोना भाइरस (कोभिड१९) संक्रमण पुष्टि भएको छ। काठमाडौंमा १२६, ललितपुरमा १२ र भक्तपुरमा २८ जनामा कोरोना भाइरस संक्रमण पुष्टि भएको मन्त्रालयका प्रवक्ता डा जागेश्वर गौतमले जानकारी दिए। यस्तै पछिल्लो २४ घण्टामा ८१८ जनामा कोरोना भाइरस (कोभिड१९) संक्रमण पुष्टि भएको छ। आइतबार कोरोना संक्रमण पुष्टि भएकामध्ये २२० महिला र ५९८ पुरुष रहेका छन् । योसहित संक्रमितको संख्या ३१ हजार ८ सय ३५ पुगेको स्वास्थ्य मन्त्रालयका प्रवक्ता डा जागेश्वर गौतमले जानकारी दिए। यस्तै पछिल्लो २४ घण्टामा २८१ जना कोरोना जितेर डिस्चार्ज भएका छन्। योसँगै कुल डिस्चार्ज हुनेको संख्या १८ हजार ६३१ पुगेको छ। मन्त्रालयका प्रवक्ता गौतमका अनुसार सक्रिय संक्रमितको संख्या १३ हजार १ सय ५५ सक्रिय संक्रमित रहेका छन् । होम आइसोलेसनमा ३ हजार ९ सय ४३ जना रहेका छन्। यस्तै मन्त्रालयका अनुसार हालसम्म क्वारेन्टाइनमा ११ हजार ४ सय १४ जना रहेका छन् भने आइसोलेसनमा ९ हजार २ सय १२ जनाको उपचार भइरहेको छ। नेपालमा हालसम्म १४९ जनाको कोरोनाबाट मृत्यु भएको छ।"
नमुना आइसोलेसन,"नवलपुर : कोरोना संक्रमण भएपछि अत्तालिएकाहरुले कोराना परास्त गर्दा खुसीको सीमा थिएन। छोटो अवधिमा नै कोरोना संक्रमणमुक्त भएपछि खुसीले नाच्दै थिए। रिपोर्ट सुन्न आतुर भएकाहरु नेगेटिभ हुनेको नामावली सुनाउँदा कोही भुईंमा ढोग्दै थिए भने कोही नाच्दै उफ्रिंदै थिए। तीमध्येका एक थिए भीमबहादुर सुनार। भारतमा गाडी चलाउँदै आएका भीमबहादुरमा नेपाल आएपछि कोरोना देखियो। परिवारका चार सदस्यमध्ये उनमा मात्रै कोरोना पोजिटिभ देखियो। कोरोना जितेकोमा उनी खुसीले नाच्दै थिए। उनीहरुका लागि आइसोलेसन घर जस्तै भयो। आत्मबल र हौसला दिएर छिटो निको बनाइदिनुभयो , देवचुली १० विशालटारका भीमबहादुरले भने, पछिसम्मको लागि जीवन जिउने कला सिकेर जाँदैछु। समुदायले चलाएको प्राकृतिक चिकित्सालय नमुना आइसोलेसनको रुपमा स्थापित भएको छ। नवलपुरको देवचुली नगरपालिका १६ रजहरमा रहेको सामुदायिक प्राकृतिक चिकित्सालय कम खर्चमा छिटो निको भएर बिरामी घर फर्किएका छन्। नियमित योगा, प्राकृतिक चिकित्सा पद्धतिको उपचारले संक्रमित कोरोनालाई परास्त गर्न सफल भएका छन्। अस्पतालको खुल्ला हरियाली वातावरणमा रमाउँछन् संक्रमित। उनीहरु दैनिक एकदेखि डेढ घण्टासम्म योग गर्छन्। चिकित्सकको लगातार परामर्शले डर र चिन्ताबाट मुक्त भएको उनीहरु सुनाउँछन्। आफ्नो लागि चिकित्सालय मन्दिर र चिकित्सक भगवान जस्तै भएको बताउँदै घर जान बिदा भए कावासोती वडा नम्बर १ का तेजबहादुर थापा। भारतबाट फर्किएपछि घर नजिकै सामुदायिक वनको भवनमा क्वारेन्टाइनमा बसे। कोरोना संक्रमण भएको खबरले उनी डराए। सुरुमा कोरोना पोजिटिभ आउँदा दिमागमा नराम्रो कुरा खेल्न लाग्यो तर यहाँ आएपछि आत्तिन दिनुभएन, राम्रो कुरा मात्रै सोच्न लगाउनुभयो , उनले भने, योगले पसिना बगाएरै कोरोना भगाइयो ।कोरोना लागिहाले पनि आत्तिन नहुने बताए। दिमागमा सकारात्मक सोचाइले सन्चो भएको उनको अनुभव छ। आइसोलेसनमा रहँदा खानपान र जीवनशैली सिके उनीहरुले। तनाव लिने कुनै समय नै भएन। दैनिक व्यायायम, योगाभ्यास, आध्यात्मिक परामर्शले उनीहरुमा हौसला बढायो। दैनिक मह र कागती पानी, बेसार हालेको दूधको प्रयोगले संक्रमणलाई छिटो जिते। बिहान चार बजेपछि उनीहरुको नित्यकर्म सुरु हुन्थ्यो। भारतको चेन्नइबाट फिर्किएकी गैडाकोटकी जमुना केसीले चिकित्सालयको खानपिन र परामर्शले सहज बनाएको बताइन्। अस्पतालको ब्यवस्थापनले उर्जा दिएको उनको अनुभव छ। कोभिड १९ अस्थायी अस्पतालको रुपमा सेवा सुरु गरिएको उक्त चिकित्सालयको उपचार पद्धतिबाट संक्रमित छिटो निको भएर घर फर्किए। छिटोमा पाँच दिनमा बढीमा ३५ दिनसम्म उपचार भएको र कसैको पनि मृत्यु नभएको चिकित्सालयका व्यवस्थापक हरिप्रसाद सापकोटाले बताए। संक्रमितलाई तनाव हुने फर्सद नै दिएनौं , सापकोटाले भने, हरेक क्रियाकमा सामेल गराएर उपचार गर्दा निको भएको देखी संक्रमितभन्दा बढी हामी खुसी भयौं । ३ वर्षदखि ७८ वर्षसम्मले कोरोना जितेर गएका उनले बताए। उपचार पद्धति र जीवनशैलीको कारण कोरोनालाई पराजित गर्न सकेको उनको भनाइ छ। दुई महिनामा तीन सय २१ जना कोरोना जितेर घर फर्किएका र आइसोलेसनमा अहिले ४८ जना उपचाररत भएको उनले जानकारी दिए। भाइरल लोड घटाउने विधिहरु प्रयोग गरिएको चिकित्सालयका निर्देशक डा विनोद पौडेलले बताए। जीवनशैलीसँगै आहारविहारको पद्धति सिकाइएको पौडेलले बताए। संक्रमित हौं भन्ने तनावलाई सबैभन्दा पहिले ब्यवस्थापन गर्यौं, उनले भने, त्यसपछि प्राकृतिक चिकित्सा पद्धतिबाट शरीरमा भाइरल लोड घटाउन लाग्यौं। यो कम खर्चमा धेरैको उपचार हुने कोभिड अस्पताल भएको चिकित्सालयको दावी छ। कोरोना संक्रमणको भयावह अवस्था आए नेपाल भरिको संक्रमित राख्न तयार भएको व्यवस्थापक सापकोटाले बताए। सरकार र समुदायले चाहेमा देशभरका संक्रमित राख्न तयार छौं , उनले भने, अहिलेसममको अनुभवले प्राप्त सफलताले आँट आएको छ ।"
सप्त ऋषिको पूजासँगै तीज सकियो,"पोखरा: सप्त ऋषिको पूजा गरी यस वर्षको तीज सकिएको छ । शुक्ल पञ्चमीको दिन हिन्दू महिलाले आइतबार ऋषि पञ्चमीको पूजा गरे । पवित्र जलाशायमा गइ एक वर्षको सांकेतिक अर्थ दिने ३ सय ६५ वटा दतिवनले दाँत माझी, शुद्ध माटो र तिलले नुहाएर ऋषिको पूजा गरेमा सौभाग्य प्राप्त हुने विश्वास छ । ऋषि पञ्चमी संगै नेपाली महिलाको महान चाड तीजको सकीएको मानिन्छ । कोभिड १९ को कोरोना भाइरस नियन्त्रण गर्न कास्की जिल्लामा निषेधाज्ञा लगाइएको छ । कोरोना भाइरसकै कारण तीजमा घर बाहिर निस्कने अवस्था नरहेकोले दिदी बहिनीहरुले घरभित्रै तीज मनाए । सामान्य अवस्थमा शिव मन्दिरहरुमा पूजा गर्न भीड हुन्थ्यो । पोखराको लामाचौरमा तीजको ठूलो मेला लाग्थ्यो । तीज गीत प्रतियोगिता मात्र होइन राष्ट्रिय महिला भलिबल प्रतियोगिता पनि हुन्थ्यो । पोखराको बाटुलेचौर, मालेपाटन, लेकसाइड लगायत बिभिन्न स्थानमा तीज मेला हुने गदथ्यो । पछिल्लो समयमा कोरोना भाइरस संक्रमण निकै बढेकोले वर्षको तीजमा माइत जान नपाएर खल्लो भएको पोखरा ६ जरेवरकी स्थानीय अनिता पोखरेलले बताइन् । गत वर्ष कम्तीमा २५३० जना जम्मा भएर पञ्चमीको पूजा गरिन्थ्यो । पञ्चमीको पूजा गरेपछि नाचगान गरि रमाइलो गरिने भए पनि यस वर्ष कोरोना भाइरस बढेकोले घरकै परिवार बिच तीज मनाइएको स्थानीय दुर्गा देवी तिमिल्सीनाले बताइन् ।"
बोक्सीको आरोपमा महिलामाथि निर्घात कुटपिट,"महोत्तरी : महोत्तरीमा बोक्सीको आरोपमा एक महिलामाथि निर्घात कुटपिट भएको छ। महोत्तरीको सम्सी गाउँपालिका ७ जावेद टोलकी ४५ वर्षीया पवनदेवी यादवलाई बोक्सीको आरोपमा सोही गाउँका स्थानीयले कुटपिट गरेछि अस्पताल भर्ना भएकी छिन् । सम्सी गाउँपालिका ७ जावेद टोलका स्थानीय दिनेश यादव, उनकी श्रीमती सुजिया देवी, छोराहरु कृष्ण यादव, आशिकयादवसहित मिलेर कुटपिट गरेको पीडितको आरोप छ। गत शुक्रबार बोक्सीको आरोपमा निर्घात कुटिएकी यादवको अवस्था गम्भीर बनेपछि जनकपुरधामस्थित जानकी हेल्थ केयर एण्ड रिसर्च सेन्टरमा उपचार भइरहेको पीडितका छोरा संजय यादवले जानकारी दिए । संजय भने, म शुक्रबार घरभन्दा बाहिर थिएँ। बेलुका एक्कासी दिनेश यादवको परिवारले मेरो आमा माथि बोक्सी भन्दै गालीगलौजसहित पिटपाट गरे, समयमै प्रहरी बोलाए, त्यतिखेर प्रहरी सम्झाई बुझाई गरेर गयो, तर राती आएर पुन: मेरो आमालाई कुटपिट गरे ।' घटनास्थलमा प्रहरी चौकीबाट प्रहरी सहायक निरीक्षक (सई) दिपेन्द्र यादवसहित आएर विवाद नगर्न सम्झाई बुझाइ गए तर प्रहरी गइसकेपछि पुनः१११२ बजेतिर कुटपिट गरेको संजयले बताए । कुटपिटको क्रममा आमा पवन देवीलाई बचाउन गएकी उनकी छोरी रुवीयादवको कपडा समेत दिनेश यादवको छोराले च्यातिदिएको संजयले बताए । उनले भने, मेरो बहिनीको कपडा समेत च्यातिदिए, बहिन चिच्याएर गाउँका मानिस आएर धन्न बचाए, तर प्रहरीले केही सहयोग गरेन् । यता घटनामा संलग्न आरोपि कृष्ण यादवलाई सम्सी प्रहरी चौकीले पक्राउ गरेपनि उजूरी नपरेकाले आफूहरुले छोडेको सई दिपेन्द्र यादवले बताए । तर दोसीलाई पक्राउको दबाव बढेपछि आरोपित कृष्ण यादवलाई पक्राउ गरी अनुसन्धान प्रक्रिया अगाडि बढाइएको महोत्तरीका प्रहरी उपरीक्षक टिका केसीले जानकारी दिए । उनले भने, पीडितको तर्फबाट हालसम्म जाहेरी आइसकेको छैन, जाहेरी नआउँदा कारवाही प्रक्रियामा अप्ठयारो भइरहेको छ, उजूरी आउने बित्तिकै थप कारवाही अगाडि बढाइनेछ ।"
विश्वभर कोरोनाबाट मृत्यु हुनेको संख्या ८ लाख नाघ्यो,विश्व महामारी कोरोना भाइरस (कोभिड१९) संक्रमणबाट मृत्यु हुनेको संख्या ८ लाख नाघेको छ। जोन्स होप्किन्स विश्वविद्यालयले आइतबार जारी गरेको तथ्यांकअनुसार कोरोनाबाट मृत्यु हुनेको संख्या ८ लाख ४ हजार ४ सय ३१ पुगेको छ । यस्तै विश्वभरी संक्रमितको संख्या दुई करोड ३२ लाख ५ हजारभन्दा बढी पुगेको छ । यसका साथै संक्रमण पुष्टि भएकाहरुमध्ये एक करोड ४८ लाखभन्दा बढी निको भएका छन् । कोरोना संक्रमणबाट सबैभन्दा बढी प्रभावित अमेरिकामा आइतबार बिहानसम्म ५६ लाख ६६ हजार ८ सय बढी संक्रमित छन् भने एक लाख ७६ हजार बढीको मृत्यु भएको छ । दोस्रो स्थानमा रहेको ब्राजिलमा ३५ लाख ८२ हजार ३ सय ६२ संक्रमित भएका छन् । एक लाख १४ हजार २ सय ५० को मृत्यु भएको छ । यस्तै मेक्सिकोेमा कोरोनाबाट मृत्यु हुनेको संख्या ६० हजार २ सय ५४ पुगेको छ । साथै भारतमा पनि ५६ अजार ७ सय जनाको कोरोनाबाट मृत्यु भइसकेको जनाइएको छ ।
बागमती नदीमा तीनजना बालिका बेपत्ता,"रौतहट : रौतहटस्थित बागमती नदीमा आइतबार बिहान पौडी खेल्ने क्रममा डुबेर तीनजना बालिका बेपत्ता भएका छन् । रौतहटको गढिमाई नपा ७ धरमपुर टोलका भदै मुखियाको १० वर्षीया छोरी पिंकु कुमारी मुखिया, लक्षुमण दासकी १२ वर्षीया छोरी सुसिता कुमारी दास र छटु मुखियाकी १० वर्षीया छोरी चन्चल कुमारी मुखिया गाउँ नजिकै रहेको बामती नदीमा नुहाउने क्रममा बेपता भएका छन् । बालिकाहरु नदीमा हराएको खबर पाउनासाथ धरमपुर चौकी, समनपुर इलाका प्रहरी कार्यालयबाट खटीएको प्रहरीको टोलीले र स्थानीयले बेपत्ताहरुको खोजी गरिरहेको रौतहटका प्रहरी प्रमुख एसपी रविराज खड्काले जानकारी दिए। ।न"
"ट्रम्पमाथि उनकी दिदीको टिप्पणी : उसको कुनै सिद्धान्त छैन, क्रूर व्यक्ति हो ऊ","वासिङटन : अमेरिकी राष्ट्रपति डोनल्ड ट्रम्पकी दिदीले उनलाई सिद्धान्त नभएको व्यक्ति भन्दै कडा आलोचना गरेकी छन् । ट्रम्पकी दिदीले ट्रम्पलाई भनेकी छन्, उनको कुनै सिद्धान्त छैन । ट्रम्प क्रूर व्यक्ति भएको पनि उनकी दिदीको टिप्पणी छ । ट्रम्पकी दिदी मेरियाना ट्रम्प बेरी पूर्वसंघीय न्यायाधीश समेत हुन् । मेरीको यस्तो टिप्पणी उनकी भान्जीले रेकर्ड गरेकी थिइन् । ट्रम्पको निन्दा गर्दै मेरीले हालै एक पुस्तक समेत सार्वजनिक गरेकी छन् । त्यहाँ उनले आफ्नो परिवारले कसरी संसारकै खतरनाक व्यक्ति सिर्जना गर्यो भन्नेबारे चर्चा गरेकी छन् । मेरीले यही शनिबार २०१८ र २०१९ मा रेकर्ड गरेको बताएकी छन् । एक रेकर्डमा ८३ वर्षीया बेरीले भनेकी छन् कि, २०१८ मा उनले आफ्नो भाइको अन्तर्वार्ता फक्स न्युजमा हेरेकी थिइन् । जहाँ उनले दिदीलाई आमाबाबुबाट अलग्याइएका आप्रवासी बच्चाहरु भएको सीमाक्षेत्रमा राख्न सुझाव दिएका थिए । उसको आधार, मेरो मतलब मेरो परमेश्वर, यदी तिमी धार्मिक व्यक्ति भएको भए तिमी मानिसलाई सहयोग गर्न चाहन्छौ, बेरीले भनिन् । यस्तै ट्रम्पले ट्वीटमा झुट बोलेको पनि बताइन् । साथै राष्ट्रपतिले आफ्ना अध्यागमनबारे बिचारहरु पढ्ने नगरेको पनि बेरीले बताएकी थिइन् । उसले के पढेको छ ? उनले भनिन्, अहँ, उ पढ्दैन । उनको रेकर्ड पहिलो पटक वासिंटन पोस्टमा प्रकाशित थियो । रोबर्ट ट्रम्पको निधनपछि ह्वाइट हाउसमा उनलाई सम्झँदै गर्दा बेरीको रेकर्डिङ चर्चामा आएको हो ।"
