शीर्षक,विवरण
शून्य बेरुजुअभियानमा गाउँपालिका,"ओखलढुंगाः महालेखा परिक्षकको कार्यालयले हरेक वर्ष दिने लेखा परिक्षण प्रतिवेदनमा वर्षेनी बेरुजु बढेपछि ओखलढुङ्गाको चिशंखुगढी गाउँपालिकाले बेरुजु शुन्य अभियान थालेको छ। बेरुजु बढ्ने तर, फर्छ्यौट नहुने हुँदा बेरुजुको अंक बढे पनि स्थानीय तहले बेरुजु कम गर्ने कुनै योजना नल्याएको अवस्थामा चिशंखुगढी गाउँपालिकाले भने बेरुजु शून्य अभियान थालेको हो। गाउँपालिकाले चालु आर्थिक वर्षमा हुने अन्तिम लेखा परीक्षणमा यस अघिका योजना तथा व्यक्तिका नाममा रहेको बेरुजु नियमित गर्न अभियान थालेको हो। चालु तथा पूजिगत तर्फका विभिन्न शीर्षकमा भएको बेरुजु फर्छ्यौट गर्न वडा तथा सम्बन्धित सरोकारवालालाई परिपत्र गरिएको गाउँपालिकाका प्रमुख प्रशासकीय अधिकृत ओमबहादुर दर्जीले बताए। गाउँपालिकाले वडा कार्यालयलाई समेत बेरुजु शून्य अभियान सहजीकरण गर्न लिखित आग्रह गरेको छ। संघीय मामिला तथा सामान्य प्रशासन मन्त्रालयले यही मंसिर १५ गते परिपत्र गर्दै गत आर्थिक वर्षको बेरुजु समेत फर्छ्यौट गर्न सबै स्थानीय तहलाई ताकेता गरेको थियो। यही परिपत्रका आधारमा गाउँपालिकाले खरिदसँग सम्बन्धित बेरुजु मंसिर मशान्त भित्र फर्छ्यौट गर्न सरोकारवालाहरुलाई पत्र लेखेरै ताकेता गरेको हो। बेरुजु फर्छ्यौटसँगै गाउँपालिकाले आर्थिक वर्ष २०७६०७७ को अन्तिम लेखा परीक्षणको तयारी समेत थालेको छ। आर्थिक अनुशासन र शून्य बेरुजु कायम गर्न गाउँपालिकाले पहल थालेको अध्यक्ष निशान्त शर्माले जानकारी दिए। शून्य बेरुजुले आर्थिक अनुशासनको अवस्था झल्काउने भएकाले गाउँपालिकाले प्रथामिकता दिएको शर्माको भनाइ छ। बेरुजु फर्छ्यौट गर्न अभियान सुरु गर्ने चिंशंखुगढी गाउँपालिका ओखलढुंगाको पहिलो स्थानीय तह हो। चिशंखुगढीको बेरुजु आर्थिक वर्ष ०७४०७५ १ करोड १६ लाख २६ हजार, आर्थिक वर्ष ०७५०७६ मा २ करोड ७ लाख ६ हजार र गत आर्थिक वर्षमा २ करोड १४ लाख ६५ हजार रहेको छ। वर्षेनी बेरुजुको अंक बढ्दै गएपछि स्थानीय तहमा सुशासन कमजोर रहेको भन्दै सरोकारवालाहरुले आलोचना गर्दै आएका थिए। गत वर्ष मात्रै ओखलढुंगाका ८ स्थानीय तहको १५ करोड ४५ लाख ८४ हजार बेरुजु रहेको महालेखको लेखा परीक्षण प्रतिवेदनमा उल्लेख छ।"
नौ महिनापछि भाटेकोशीको बञ्जी सञ्चालनमा,सिन्धुपाल्चोक : कोरोना भाइरसका कारण चैतदेखि बन्द भएको सिन्धुपाल्चोकको भोटेकोशीको बञ्जी जम्प नौ महिनापछि पुनः सञ्चालनमा आएको छ। स्वास्थ्य सुरक्षाको मापदण्ड अपनाइ सञ्चालनमा ल्याइएको बञ्जी जम्पमा हाल दैनिक चारदेखि १५ जनासम्मले बञ्जी गर्ने दी लास्ट रिसोर्ट एडभेन्चर प्रालिका व्यवस्थापक कुमार राउतले बताए। विसं २०५६ देखि सञ्चालित १६० मिटरको उक्त बञ्जी जम्प रोमाञ्चकका दृष्टिकोणले उत्कृष्ट मानिन्छ। देशमा बन्दाबन्दी लागू हुनुअघि स्वदेशी र विदेशीसहित दैनिक १०० जनासम्म आउने गरेकामा भर्खरमात्र सञ्चालनमा आएकाले क्रमशः पर्यटकहरु आउने अपेक्षा गरिएको व्यवस्थापक राउतले स्पष्ट गरे। बञ्जीका लागि युवायुवती बढी आकर्षित हुने र प्रहरी अधिकृत तालीममा सहभागीलाई पनि अनिवार्य रुपमा समावेश गरिएको बताइएको छ। बञ्जीका लागि स्वदेशीलाई रु छ हजार र विदेशीलाई नौ हजार २०० दस्तुर लिने गरिएको छ। बञ्जीका साथै रोमाञ्चक सुइङ पनि सञ्चालनमा आएको छ। चीनसँगको प्रमुख व्यापारिक तातोपानी नाका निरन्तररुपमा सञ्चालनमा आए तिब्बतको मानसरोवर जाने भारतीय तीर्थ यात्री नाका हुँदै जाने भएकाले बाह्य र आन्तरिक पर्यटकको सङ्ख्यामा वृद्धि हुने प्रचुर सम्भावना रहेको छ। नेपालका राष्ट्रिय विभूति वास्तुविद् अरनिको १३औँ शताब्दिमा चीन जाँदा बञ्जीभन्दा माथि रहेको भोटेकोशी गाउँपालिका५ स्थित त्याङथलीमा बास बसेका थिए। तामाङ जातिको बाहुल्यता रहेको उक्त गाउँमा बास बसेपछि त्याङथली नाम राखेको थिए। तामाङ भाषामा त्याङथलीको अर्थ चोटा हुने र भोटेकोशीमाथि पर्ने हुँदा त्याङथली नाम राखेको स्थानीयवासीको भनाइ रहेको छ। अरनिको बास बसेको उक्त ऐतिहासिक स्थानको भौगोलिक तथा पर्यटकीय सम्भावनाका बारेमा निजीस्तरमा अनुसन्धानमा लागिपरेको अरनिको पाहुना घरको प्रबन्धकसमेत रहेको राउतले जानकारी दिए।
पश्चिमी वायुको प्रभावले वर्षा र हिमपातको सम्भावना,"काठमाडौं : शनिबार देशभर आंशिकदेखि सामान्य बदली रही केही स्थानमा हल्का वर्षा र हिमपात हुने भएको छ। जल तथा मौसम विज्ञान विभागले शनिबार एक बुलेटिन प्रकाशित गरी पश्चिमी वायुको प्रभावसँगै दक्षिणपूर्वी अरवियन सागरबाट जलवाष्पयुक्त हावा नेपाल प्रवेश गरिरहेकाले सुदूरपश्चिम, गण्डकी र कर्णाली प्रदेशको उच्च हिमाली भूभागका केही स्थानमा हल्का वर्षा र हिमपात हुने जनाएको छ। साथै पहाडी भूभागका एक वा दुई स्थानमा हल्का वर्षाको सम्भावना रहेको विभागल जनाएको छ। हाल देशभर आंशिकदेखि सामान्य बदली रहेको छ। राति प्रदेश नं १, दुई, वाग्मती र सुदूरपश्चिम प्रदेशका पहाडी भूभागमा आंशिकदेखि सामान्य बदली रही हिमाली भूभागमा हल्कादेखि माध्यम हिमपातको सम्भावना रहेको मौसम पूर्वानुमान महाशाखाले जनाएको छ। महाशाखाको पछिल्लो विवरणअनुसार आज काठमाडौं उपत्यकाको न्यूनतम तापक्रम ९ दशमलव ३ डिग्री र अधिकतम तापक्रम २० दशमलव शून्य डिग्री सेल्सियस रहेको छ। त्यस्तै आज सबैभन्दा कम जुम्लाको न्यूनतम तापक्रम माइनस १ दशमलव ५ डिग्री र सबैभन्दा धेरै जनकपुरको न्यूनतम तापक्रम १५ दशमलव ४ डिग्री सेल्सियस रहेको छ।"
"सिन्धुलीका १४२ सामुदायिक विद्यालयमा शिक्षक दरबन्दी शुन्य, पठनपाठन प्रभावित","सिन्धुली : सिन्धुलीका ३९ माध्यमिक विद्यालय सहित १ सय ४२ वटा सामुदायिक विद्यालयमा शिक्षकको दरबन्दी शुन्य रहेको पाइएको छ । यहाँका ३९ माध्यमिक, ८२ वटा निम्नमाध्यमिक र २१ वटा प्राथमिक गरी कुल १ सय ४२ वटा विद्यालयमा कुनै पनि तहका शिक्षक दरबन्दीको नभएको पाइएको हो । सरकारले माध्यमिक तहमा कम्तीमा ७, निम्नमाध्यमिक तहमा चार र प्राथमिक तहमा ३ जना शिक्षकको दरबन्दीको तोकेको छ । एउटै कक्षामा विद्यार्थी संख्याका आधारमा ४५ जनाभन्दा बढी विद्यार्थी भए थप शिक्षकको व्यवस्था गर्ने नीति छ । तर यहाँ आधारभुत तहकै २१ वटा विद्यालय शिक्षक दरबन्दी बिहिन हुँदा पठनपाठनमा समस्या हुने गरेको शिक्षा विकास तथा समन्वय इकाई सिन्धुलीका प्रमुख नेत्रप्रसाद गजुरेलले बताए । जिल्लामा प्राथमिक तहका ३ सय ६६, निम्नमाध्यमिक तहको ८१ र माध्यमिक तहको १ सय २० वटा गरी जम्मा ५ सय ६७ वटा सामुदायिक विद्यालयहरु रहेका छन् । तीमध्ये १ सय ४२ ओटा सामुदायिक विद्यालयमा स्थापनाकालदेखिनै राहत, अस्थायी र स्थायी कुनैपनि किसिमको दरबन्दी व्यवस्थापन हुनै सकेको छैन, गजुरेलले भने । यस्ता विद्यालयहरुमा झण्डै २५ हजार छात्र तथा छात्राहरु अध्ययन गर्दै आएका छन् । उनीहरुलाई तल्लो तह वा निजी श्रोतमा राखिएका शिक्षकहरुले पठनपाठन गराउने गरेका छन् । सरकारले तोकेअनसारको शिक्षक दरबन्दी दिन नसकेपछि अभिभावहरुले निजी श्रोतमा राखिएका शिक्षक र तल्लो तहका शिक्षकहरुले माथिल्लो कक्षामा पढाउनु पर्ने बाध्यता रहेको छ, उनले थपे । जिल्लामा कक्षा १ देखि १२ सम्म ७९ हजार १ सय ३३ जना विद्यार्थीहरु अध्ययनरत छन् । विद्यार्थी संख्याका आधारमा जिल्लामा प्राथमिक तहमा शिक्षक विद्यार्थी अनुपात २४ प्रतिसत मात्र रहेको छ । निमाविमा ६८ र माविमा ४५ प्रतिस रहेको छ । दरबन्दी शिक्षक नभएका विद्यालयमा निजी स्तरमा राखिएका शिक्षकहरुका साथै प्रावितहकाले निमाविसम्म र निमावि तहकाले कक्षा १२ सम्मका विद्यार्थीहरु पठनपाढन गराउनु पर्ने बाध्यता रहेको गजुरेलेको भनाइ छ । कतिपय स्थानीय तहले अनुदान दिएर पनि विद्यालय संचालन गर्नु परेको छ । पछिल्लो समय विद्यार्थी संख्या कम भएका विद्यालयहरु मर्जगर्दा समेत दरबन्दीको व्यवस्थापन हुन सकेको छैन । जिल्लामा हाल राहत समेतगरी १ हजार ६ सय ३२ जना प्रावि, ३ सय २६ जना निमावि, २ सय ६७ जना मावि र साविक उच्चमाविका अनुदान समेत गरी १ सय २८ जनाको दरबन्दी रहेको छ ।"
शक्तिपीठ स्थापना,"भोजपुर : भोजपुर जिल्लाको षडानन्द नगरपालिका१, मृगस्थलीमा ॐकार शक्तिपीठ स्थापना गरिएको छ। पीठमा हिन्दू, किराँत र बौद्ध धर्मावलम्बी एकै ठाउँमा बसेर आआफ्ना आराध्यहरूको पूजा आराधना गर्न पाउने भएका छन्। ओमकार परिवार एकै थलोमा पूजाआराधना गर्न पाउने संरचना नेपालमै यो पहिलो हो। ॐकार शक्तिपीठमा हिन्दू, किराँत, बौद्ध तथा अन्य ॐकार परिवार एकै ठाउँमा अटाएका यस अभियानका गुरु बालमुकुन्द गौतमले जानकारी दिए। सबै जातजातिका पूर्वजहरूले सनातनदेखि मानिआएका धर्महरूलाई ॐकार परिवारभित्र समेटी एकआपसमा सहिष्णुता, जातीय सद्भाव कायम गर्दै धार्मिक आस्थाका साथ विद्यमान कुरीतिलाई हटाई शक्तिपीठमा सात्विक विधिबाट पूजा आराधना थालिएको हो, उनले भने। २०७५ साल मंसिर १७ गते जिल्ला प्रशासन कार्यालय भोजपुरमा दर्ता गरिएको यो शक्तिपीठमा चेतनाथ गौतम र जीवन थापा अध्यक्ष छन्। शक्तिपीठमा योगसाधना, ध्यान, तपस्या तथा अन्य आध्यात्मिक ज्ञान लिन इच्छुक जुनसुकै धर्मावलम्बी भए पनि खुला रहने व्यवस्था छ। ३५ रोपनी जग्गा भएको शक्तिपीठमा शिवशक्ति मन्दिर, काली भगवती मन्दिर, पञ्चकन्या भगवतीसहित सुम्निमा भगवती मन्दिर, यम्सुमा भगवती, नागराज कुण्ड, चार सय भक्तजन अटाउने हल र साधना कुटी निर्माण भइसकेको छ। २०५५ सालतिर शक्तिपीठका अध्यक्ष गौतमले सपनामा त्यस स्थानमा शिवको बास भएको देखे र मन्दिर बनाएपछि यो अवधारणा अघि बढेको हो। अभियानका गुरु बालमुकुन्दले अब बनाइने तीनवटा १०८ सिँढीमा क्रमशः बुद्ध, सुम्निमापारुहाङ र शिवपार्वतीका ससाना मूर्ति रहने जानकारी दिए। उनका अनुसार सांसद सुदन किराँतीले सरकारी तवरबाट गराएको डीपीआरले संरचना पूर्ण गर्न करिब आठ करोड रुपैयाँ लाग्ने देखाएको छ। यसका लागि १० वर्ष समय लाग्नेछ। किराँतीले वार्षिक ३० लाखका दरले रकम उपलब्ध गराउने मौखिक आश्वासन दिएको उनले बताए।"
