शीर्षक,विवरण
बढ्यो निको हुने दर,"काठमाडौं : कोरोना संक्रमणको दर घट्दै जाँदा निको हुने संक्रमितको संख्या बढेको छ। अहिले नेपालमा कोरोना संक्रमणबाट निको हुने दर ९४ दशमलव ४ प्रतिशत रहेको छ। स्वास्थ्य सेवा विभाग, इपिडिमियोलोजी तथा रोग नियन्त्रण महाशाखा (ईडीसीडी)का निर्देशक डा वासुदेव पाण्डेले संक्रमणबाट निको हुने दर बढ्दै गएको बताए। उनले भने, अहिले गाइडलाइन्स (निर्देशिका) पनि परिवर्तन भएको छ। त्यसकारण पनि निको हुने दर बढी देखिएको हो। यसअघिको निर्देशिकामा निको भएका व्यक्तिको पुष्टि हुन पीसीआर परीक्षणमा नेगेटिभ रिपोर्ट अनिवार्य थियो। तर अहिलेको नयाँ निर्देशिकाअनुसार, एक पटक संक्रमित भइसकेपछि पुनः पीसीआर गर्नु पर्दैन। १४ दिन पुगिसकेपछि निको भएको सूचीमा राखिन्छ। कुनै समस्या छैन भने निको भएकोमा गणना गरिन्छ , डा पाण्डेले भने। नेपालको निको हुने दर सार्क मुलुकका अन्य राष्ट्रभन्दा राम्रो देखिएको छ। निको हुने मुलुकमध्ये सबैभन्दा राम्रो भारतमा देखिएको छ। त्यसपछि नेपालको निको हुने दर उच्च देखिएको छ। भारतको निको हुने दर ९४ दशमलव ७ प्रतिशत रहेको छ। नेपालको निको हुने दर ९४ दशमलव ३ प्रतिशत रहेको छ। नेपाल र मालदिभ्समा कोरोना संक्रमितको निको हुने दर उस्तै छ। सार्क मुलुकमध्ये श्रीलंकामा निको हुने दर ७२ दशमलव ५ प्रतिशत छ। त्यसपछि अफगानिस्तान ७८ दशमलव ६, बंगलादेश ८३ दशमलव ९ र पाकिस्तान ८७ दशमलव २ प्रतिशत निको हुने दर रहेको छ। भुटानमा ९१ दशमलव २ प्रतिशत रहेको छ। महिलाको संख्या कम छ। अनुपात हेर्दा महिलाभन्दा पुरुष नै बढी निको भएको देखिएको छ। कोरोना संक्रमणबाट हालसम्म २ लाख ३२ हजार ८ सय ७२ जनालाई निको भएको छ। हालसम्म २ लाख ४६ हजार ६ सय ९४ जनालाई कोरोना पोजेटिभ पुष्टि भएको स्वास्थ्य तथा जनसंख्या मन्त्रालयले जनाएको छ। संक्रमितमध्ये ६६ दशमलव ५ प्रतिशत पुरुष छन्। संक्रमित महिला भने ३४ दशमलव ५ प्रतिशत छन्। सरकारले कात्तिक महिनायता दैनिक पीसीआर परीक्षण दरसमेत घटाएको छ। पछिल्लो चौबिस घण्टामा ७ हजार ४ सय १४ जनामा पीसीआर परीक्षण गरिएको थियो। शुक्रबार १ हजार ४४ जना नयाँ संक्रमित थपिएको स्वास्थ्य मन्त्रालयले जनाएको छ। पछिल्लो चौबिस घण्टामा १ हजार २ सय ७१ जना निको भएका छन्। सरकारले परीक्षणको दायरा साँघुरो बनाएका कारण संक्रमण दर घट्दो देखिएको विज्ञहरूको भनाइ छ। जनस्वास्थ्यविज्ञ डा बाबुराम मरासिनी भन्छन्, परीक्षणको दायरा बढाएको भए संक्रमण दर पनि बढी देखिन्थ्यो। संक्रमण दर न्यून हुनेबित्तिकै निको हुने दर पनि स्वतः बढी हुन पुग्यो। अहिले पीसीआर परीक्षणमध्ये संक्रमण दर १३ दशमलव ५ प्रतिशत रहेको छ। पोजेटिभमध्ये मृत्युदर शून्य दशमलव ६७ प्रतिशत रहेको स्वास्थ्य मन्त्रालयले जनाएको छ। शुक्रराज ट्रपिकल तथा सरुवा रोग अस्पताल टेकुका निर्देशक डा सागरकुमार राजभण्डारीका अनुसार, पछिल्लो समय संक्रमितमा जाँच गराउने प्रवृत्तिमा पनि कमी आएको छ। नयाँ संक्रमितको संख्यामा कमी आएको छ। १४, १५ दिनअघि भर्ना भएका बिरामी निको हुँदै गएका छन्। जसले गर्दा पनि निको हुने दर बढेको हो। डा राजभण्डारीले भने, नयाँ संक्रमित थोरै देखिएका छन्। त्यसले गर्दा निको हुने दर बढी देखिएको हो। संक्रमितको रोग प्रतिरोधात्मक क्षमता र समयमै उपचार पाएका कारण पनि निको हुने दर बढी देखिएको हो। डा राजभण्डारीका अनुसार दीर्घ बिरामीलाई जटिल बनाए पनि अन्य उमेरसमूहका व्यक्तिको निको हुने दर बढी देखिएको हो। अहिले होम आइसोलेसनमा ७ हजार ३ सय ४१ जना रहेका छन्। आईसीयूमा ३ सय १० जना उपचाररत छन्। भेन्टिलेटरमा ५० जना रहेका छन्।"
बलात्कार मिलापत्रमा ६ पक्राउ,"विराटनगर : बलात्कार घटनामा मिलापत्र गराउन संलग्न रहेको आरोपमा प्रहरीले ६ जनालाई पक्राउ गरेको छ। मोरङको धनपालथान गाउँपालिका५ की २१ वर्षीया युवती भदौ २४ गते बलात्कृत भएको भन्दै असोज २५ गते इलाका प्रहरी कार्यालय रंगेलीमा किटानी जाहेरी परेको थियो। त्यही जाहेरीका आधारमा प्रहरीले मिलापत्र गराउनेमध्येका गाउँलेलाई बिहीबार साँझ नियन्त्रणमा लिएको हो। पक्राउ पर्नेमा धनपालथान५ का ६५ वर्षीय धनेशु खवास, ५३ वर्षीय सुधारसिंह खवास, ६२ वर्षीय मागन खवास, ६२ वर्षीय कलकनु खवास, रंगेली१ का ६७ वर्षीय जगतनारायण खवास र बेलबारी८ का ५३ वर्षीय मथालु खवास छन्। तर, मिलापत्र गराउन भूमिका रहेका धनपालथान५ की वडा सदस्य नेपालदेवी खवास र बेलबारी८ का वडा सदस्य प्रवीणकुमार खवास पक्राउ परेका छैनन्। मोरङ जिल्ला प्रहरी प्रवक्ता डीएसपी मानबहादुर राईले बलात्कार घटनामा भेला भई गाउँलेको भेला (पञ्चायती) बसेर मिलापत्र गराउनेमध्येका ६ जनालाई नियन्त्रणमा लिइएको जानकारी दिए। मिलापत्रमा जनप्रतिनिधिसहित अरू पनि मुछिएका छन्, डीएसपी राईले भने, तर, फरार रहेका कारण खोजी जारी छ। पक्राउ परेकाविरुद्ध जघन्य अपराधलाई ढाकछोप गरेको कसुरमा शुक्रबार म्याद थप गरी अनुसन्धान थालिएको राईले बताए। बेलबारी८ का ३३ वर्षीय सुरेशकुमार खवासले धान खेतमा युरिया मल लगाउन साथी भन्दै लिएर गएका युवतीलाई धनपालथान५ स्थित नहरमा बलात्कार गरेको आरोप छ। प्रहरीले अभियुक्त खवासलाई यही मंसिर १९ गते रंगेली७ बाट पक्राउ गरेको थियो। उनीविरुद्ध जबर्जस्ती करणी मुद्दा चलाउन म्याद थप गरेर प्रहरीले अनुसन्धान गरिरहेको छ। यसरी भएको थियो मिलापत्रखेतमा मल हाल्न साथी भन्दै बेलबारी८ का सुरेशकुमारले ती युवतीलाई लिएर गए। खेतमा पुर्याएपछि बलात्कार गरेको स्थानीयले देखे। घटनापछि पीडित युवतीको परिवारले प्रहरीमा जाने तयारी गर्यो। तर, भोलिपल्ट बिहान जनप्रतिनिधिसहित बसेको पञ्चायतीले युवतीलाई कानुनी उपचार खोज्नबाट रोक्यो। ५ लाख रुपैयाँ दिने सर्त राखेर मिलापत्र गरायो। आर्थिक अवस्था कमजोर भएका कारण र सबैबाट दबाब परेपछि पीडित परिवारले तत्काल न्यायका लागि जान नपाएको स्थानीयको भनाइ छ। तर, पीडक भनिएको पक्ष सर्तअनुसार पैसा दिन तयार भएन। विवाद बढ्दै गएपछि उक्त घटनाबारे असोज २५ गते प्रहरीले थाहा पायो। बलात्कार भएको खुलेपछि प्रहरीले पीडित युवतीलाई जाहेरी दिन लगाएर घटनाको अनुसन्धान थाल्यो। पीडितका मामाले समाज (पञ्चायती)ले निर्णय गरेर जान नदिएका कारण समयमै प्रहरी कार्यालय पुग्न नपाइएको बताए। पञ्चायतीमा बसेका सबै जना पैसा दिएर घटना मिलाउने पक्षमा देखिएपछि त्यतिबेला आफ्नो पक्षमा बोलिदिने कोही नभएको उनको भनाइ छ। उनका अनुसार छलफलका क्रममा दुई जनाको बिहे गराउने कुरा पनि चल्यो। तर, सुरेशकुमारले बिहे गरिसकेका कारण परिवारले नमान्दा त्यो सम्भव भएन। अन्ततः युवतीलाई क्षतिपूर्ति र बिहे खर्चबापत ५ लाख रुपैयाँ दिने कागज बनाएर घटनालाई मिलापत्रमा टुंग्याइयो। असोज ९ गतेभित्र उक्त पैसा दिने सर्त राखेर कागज बनाइयो। तर, पीडित पक्षले पैसा नपाएपछि फेरि वडा सदस्य नेपालदेवीको घरमा अर्को छलफल बोलाइयो।"
भारतको खोप सस्तो पर्ने,"काठमाडौं : सरकारले कोरोना भाइरसविरुद्ध भारतमा बन्दै गरेका खोप किन्न सस्तो पर्नेे प्रारम्भिक अनुमान गरेको छ। भारतमा खोप निर्माणमा लागेका कम्पनीले प्रतिगोटा ८ डलरसम्म उपलब्ध गराउन सकिने जानकारी सरकारलाई दिएका छन्। भारतमा अक्सफोर्ड, बायोएनटेकलगायत कम्पनी खोप निर्माणमा जुटेका छन्। अरू देशमा उत्पादित खोपको मूल्य १० देखि १५ डलरसम्म पर्ने अनुमान सरकारको छ। कोभिड१९ संकट व्यवस्थापन केन्द्र (सीसीएमसी) निर्देशक समितिका संयोजक उपप्रधानमन्त्री ईश्वर पोखरेलले खोप किन्नेबारे भइरहेका प्रगतिबारे शुक्रबार सामूहिक छलफल गरेका थिए। जनतालाई समयमै निःशुल्क खोप उपलब्ध गराउनेबारे सीसीएमसीमा आबद्ध मन्त्रीहरूसँग सरकारका पछिल्ला निर्णय र त्यसमा भइरहेको प्रगतिबारे छलफल भएको हो, उपप्रधानमन्त्री पोखरेलले भने, समयमै जनतालाई निःशुल्क खोप उपलब्ध गराउने सन्दर्भमा छलफल भयो। त्यसबाहेक कतिपय निर्णय कार्यान्वयनका सन्दर्भमा पनि अनौपचारिक छलफल गर्यौं। उक्त छलफलमा गृह, अर्थ, परराष्ट्र, संघीय मामिला तथा सामान्य प्रशासन, स्वास्थ्य तथा जनसंख्या, पर्यटनमन्त्रीसहित मुख्यसचिव र सचिवहरू सहभागी थिए। त्यस क्रममा विभिन्न देशले निर्माण गरिरहेका खोपको मूल्य, उपलब्धता र सहजताबारे छलफल भएको थियो। सरकारले अमेरिका, बेलायत, रुस, चीन, अस्ट्रेलिया, भारतलगायत देशमा उत्पादित खोपको मूल्य र उपलब्धताबारे अध्ययन गरिरहेको छ। भारतमा अक्सफोर्डले निर्माण गर्दै गरेको खोप सस्तो पर्ने देखिएको एक मन्त्रीले जानकारी दिए। यद्यपि, यो खोपले मान्यता भने पाइसकेको छैन। सरकारले विभिन्न देशमा बन्दै गरेका भ्याक्सिन (खोप)को मूल्य के कति पर्ने रहेछ ? ल्याउँदा के कस्तो उपकरण र सावधानी अपनाउनुपर्ने रहेछ ? ककसले भ्याक्सिन दिन सक्ने रहेछन् भनेर गहन अध्ययन गरिरहेको छ, एक मन्त्रीले भने, हालको अवस्था हेर्दा भारतबाट किन्दा सस्तो पर्ने देखिएको छ। भोलि कुनै देशले निःशुल्क दिने भनेर पनि भन्न सक्छन्। सरकारले ७२ प्रतिशत जनसंख्यालाई पुग्ने गरी खोप किन्ने तयारी गरेको छ। तीन करोड जनसंख्यालाई आधार मान्ने हो भने २ करोडभन्दा बढी भ्याक्सिन किन्नुपर्ने अवस्था छ, एक मन्त्रीले अन्नपूर्ण पोस्ट्सँग भने। सरकारले किनेर ल्याउने खोप सर्वसाधारणलाई निःशुल्क वितरण गर्नुपर्छ। विश्व स्वास्थ्य संगठन (डब्लुएचओ)ले कुनै पनि देशले खोपमा नागरिकबाट कुनै पनि रकम लिन नमिल्ने बताइसकेको छ। खोप ७ डलरमा किन्न पाइए ५० अर्ब रकम आवश्यक पर्ने देखिएको छ। अर्थमन्त्री विष्णु पौडेलले उक्त रकमको जोहो मन्त्रालयले नै गर्ने बचन दिएको स्रोतले बतायो। विज्ञहरूका अनुसार विश्वमा १ सय २० भन्दा बढी कम्पनीले खोप निर्माणको तयारी गरिरहेका छन्। स्वास्थ्य मन्त्रालयले खोप ल्याउन डा श्यामराज उप्रेतीको संयोजकत्वमा समिति गठन गरेको थियो। खोप ल्याउन सरकारले अध्यादेश जारी गरेर कानुनी बाटो खोलिसकेको छ।"
