शीर्षक,विवरण
कहालीलाग्दो वैदेशिक रोजगार,"स्वदेशमा रोजगार पाइएन; कुनै पनि उद्यम गर्न सकिएन वा सफल भइएन भने धेरैका मनमा तत्काल सजिलो उपाय फुर्छ वैदेशिक रोजगार। मुलुकमा जीवन निर्वाह गर्ने अवसर नभेटेपछि मनले नमान्दा पनि वैदेशिक रोजगारलाई अन्तिम विकल्प मान्नुपर्ने अवस्था छ। आफन्त र प्रियजनबाट टाढिनुपर्ने बाध्यात्मक परिस्थिति त छँदै छ; रोजगारका क्रममा उतै निधन भएपछि बाकसभित्र बेरिएर आउनुपर्ने वियोगान्त घटनाले गरिबको पीडामाथि पीडा थपिइरहेको छ। धन लिन बिदेसिएकाहरू प्राण उतै त्यागेर धरतीबाटै विलय भइरहेको घटना दैनिक घटिरहेका छन्। पीडितका आफन्त र प्रियजनलाई आँसुको आहालमा डुबाइरहेको यस्ता घटनाले सरकारलाई भने पटक्कै छोएको छैन नै; राजनीतिक दलले त बुझ्ने कोसिससमेत गरेका छैनन्। मलेसियामा रोजगारका क्रममा निधन भएका नेपालीका १८ वटा शव शनिबार एकैपटक काठमाडौं आइपुग्यो। विमानस्थलमा ती शवको पर्खाइमा रहेकाहरूले आफ्ना प्रियजनको निधन कसरी भयो भनेर सोध्नसमेत पाएनन्। उनीहरूका लागि महिनौं कुरेर भए पनि निधन भइसकेको अनुहार हेर्न पाउनु नै सबैभन्दा ठूलो उपलब्धि हुने गरेको छ। त्यसबाहेक उनीहरूले सोच्नसमेत सकेका छैनन्। आफ्ना मान्छेको निधनको कारण के होला ? उसले विदेशमा बिरामी भएपछि पर्याप्त उपचार पायो कि पाएन ? काम गर्ने कम्पनी वा अरू कसैले पिटेर पो मारिदियो कि जस्ता विषयमा भरपर्दो जानकारी लिनसमेत नसक्ने अवस्था छ। धन कमाउन साहुसँग ऋण काढेर बिदेसिएको व्यक्ति नै परलोक भएपछि पीडामा छटपटिएका परिवारलाई मलम लगाइदिने निकायको अभाव छ यतिखेर। मुलुकको अर्थतन्त्रको त्राण शरीरलाई हत्केलामा राखेर विदेशी भूमिमा हाड खियाइरहेका नागरिकले पठाएको रेमिट्यान्सले धानिरहेको छ। तिनै नागरिकले पठाएको पैसामा मोजमस्ती गरिरहेका प्रधानमन्त्रीदेखि मन्त्रीसम्म र सरकारका प्रशासकहरूले समेत यस्ता घटना किन बारम्बार दोहोरिइरहन्छ र यसलाई सुरक्षित बनाउन के गर्न सकिन्छ भन्ने विषयमा गम्भीर नहुनु ज्यादै दुःखद हो। सत्ता प्राप्तिका लागि मुलुकमा हिजोआज दैनिकजसो सभासम्मेलन हुने गरेको छ। नेताका कोठे बैठकको गन्ती गरिसाध्य छैन। तर यस्ता सम्मेलन वा बैठकमा घामपानी वा हर प्रकारका वाधाको प्रवाह नगरी हाड खियाइरहेका दाजुभाइलाई यो बाध्यात्मक अवस्थाबाट मुक्ति दिने विषयमा मन्थन भएको पाइँदैन। बरु विदेशमा दस नंग्रा खियाइरहेकाबाट आर्थिक संकलन गर्ने र कसरी चुनाव वा सत्ता आरोहणका लागि भर्याङ बनाउने भन्ने ध्याउन्नमा नेताहरू केन्द्रित भएको पाइन्छ। योभन्दा लाजमर्दो अवस्था अरू केही हुन सक्दैन। चुनावी घोषणापत्र र भाषणमा ठूलाठूला नारा लगाउने तर कार्यान्वयनमा चासो नदिने दलीय प्रवृत्तिले मुलुकमा रोजगारको अवस्था सिर्जना हुन सकेको छैन। वैदेशिक रोजगारमा गएका नेपालीमध्ये सबैभन्दा मलेसियामा धेरैको निधन हुने गरेको छ। गत वर्ष मात्रै यसरी रोजगारमा गएकामध्ये २५० भन्दा बढीको मृत्यु भएको छ। विविध प्रकारका रोग, आत्महत्या, सडक दुर्घटना तथा लुटेराको आक्रमण अकालमै ज्यान जाने मुख्य कारण बनेका छन्। नेपालीलाई स्वदेशमै काम गर्न सक्ने वातावरण निर्माणतर्फ सबैको ध्यान केन्द्रित हुनुपर्छ। रोजगारमा गए पनि काम गर्ने वातावरण सुरक्षित भएको सुनिश्चित हुनुपर्छ। नेपाली कामदारले भोग्नुपरेका समस्याबारेमा सम्बन्धित मुलुकमा रहेका दूतावास तथा कूटनीतिक नियोगबाट गुनासो सुन्ने प्रभावकारी व्यवस्था हुनुपर्छ। अदक्ष कामदारलाई वैदेशिक रोजगारमा जानुअघि सीपमूलक तालिम अनिवार्य गरिनुपर्छ, ताकि उनीहरूले त्यहाँ जोमिखयुक्त काम गर्न नपरोस्। रोजगारमा गएर निधन भएका व्यक्तिको परिवारलाई क्षतिपूर्ति तथा राहतको भरपर्दो व्यवस्था हुनुपर्छ।"
घट्यो प्रहरीमा आकर्षण,"काठमाडौं : प्रहरीमा जवानदेखि निरीक्षकसम्म भर्नाका बेला एकै प्रश्न सोधिन्छ तपाईंले प्रहरी पेसा नै किन रोज्नुभयो ? केहीले देशको शान्तिसुरक्षा गर्न पाउनु गौरवको विषय भएको जवाफ दिन्छन्। केहीले इज्जत र प्रतिष्ठासँग जोड्छन् त केहीले संयुक्त राष्ट्रसंघीय मिसनसँग जोडेर आर्थिक समस्या टार्ने कुरा उठाउँछन्। प्रहरी जनशक्ति शान्तिसुरक्षामा खटिएकै छन्। मिसनमा गएकै छन्। तर, सरकारले बेलाबेला खुलाइरहेको भर्ना प्रक्रियामा आवेदन संख्या हेर्दा आकर्षण भने घट्दो देखिन्छ। प्रहरी प्रधान कार्यालयले २०७४ देखि २०७६ सम्म जवानका लागि तीन पटक भर्ना खुलायो। २०७४ साउन ३१ गते ७ सय ६७ जना जवान माग गरिएकामा ४४ हजार ३ सय ५५ जनाको आवेदन पयो। २०७५ असोज १५ मा ६ हजार २ सय ४४ जना माग गरिएकामा ४१ हजार ८ सय ७१ जनाले आवेदन दिए। तुलनात्मक रूपमा धेरै पदमा भर्ना खोल्दा आवेदन उत्तिकै बढ्नुपर्ने प्रहरी मुख्यालयको बुझाइ रहे पनि त्यसअनुरूप हुन सकेन। जवानकै लागि २०७६ भदौ ६ गते ३ हजार ५ सय ९६ जनाको भर्ना खुलाइएको थियो। तर, ३९ हजार ७ सय ३४ जनाले मात्रै आवेदन दिए। सहायक निरीक्षक (असई) भर्नामा पनि अपेक्षाअनुरूप आवेदन आएन। २०७३ देखि २०७५ सम्म तीन पटक क्रमशः ५ सय ५१, ३ सय १४ र ५ सय २४ जना भर्नाका लागि आवेदन मागिएको थियो। २०७३ मा १८ हजार ९ सय ६५, २०७४ मा १६ हजार ६ सय ६३ र २४ हजार १५ जनाले आवेदन दिए। तुलनात्मक रूपमा यो संख्या पनि कम भएको बुझाइ मुख्यालयको छ। प्रहरी निरीक्षक भर्नामा पनि उस्तै देखिन्छ। २०७३ जेठमा ८६ जना माग गरिएकामा २ हजार ८ सय ४५, २०७४ साउनमा ९१ जना माग गरिएकामा २ हजार ५ सय ३९ जनाले मात्रै आवेदन दिए। २०७५ असोजमा पुनः प्रहरी निरीक्षक माग भयो। १ सय ८ जना माग हुँदा धेरै आवेदन आउने अनुमान मुख्यालयको थियो। तर, ठीक उल्टो भयो। जम्मा २ हजार ६ सय ८१ जनाले आवेदन दिए। बढ्दो बेरोजगारीमा पनि युवाहरू किन प्रहरी जागिरमा आकर्षित भएनन् ? पूर्वप्रहरी अतिरिक्त महानिरीक्षक (एआईजी) राजेन्द्रसिंह भण्डारी प्रहरीमा आकर्षण कम हुनुलाई दुई पाटोबाट हेर्नुपर्ने बताउँछन्। व्यक्तिले जागिर दुईवटा उद्देश्य राखेर खान्छ, कि माम त कि दाम, भण्डारी भन्छन्, अहिले यी दुवै प्रहरीमा सहज छैन। खालि कामको बोझ मात्रै छ। भण्डारीका अनुसार प्रहरीले निष्पक्ष सेवा गर्न पाएँ भन्ने अवस्था छैन। राजनीतिक नेतृत्वले प्रहरीलाई आफूखुसी उपयोग गर्न थाले। चेन अफ कमान्डमा चल्ने संस्थामा यो डरलाग्दो कुरा हो। यसले शान्ति सुरक्षाको अवस्थालाई गम्भीर दीघकालीन असर गर्छ, उनी भन्छन्। विगतमा द्वन्द्वका कारण प्रहरीमा जागिर लगाउन जबर्जस्ती भर्ना लिनुपर्ने बाध्यता रहेको उनी सुनाउँछन्। अहिलेका युवा पंक्तिको सोच अलि फराकिलो छ। उसले काम गरेको समयलाई पैसासँग जोड्छ, उनी भन्छन्, प्रहरीमा अहिले लगाइने कामको अवधि र उसले पाउने तलबको असमानता पनि कम आकर्षणको मुख्य कारण हो। प्रहरी संगठनलाई कानुनभन्दा पनि व्यक्तिको आदेशमा चल्नुपर्ने बनाएपछि स्वाभिमानी व्यक्ति प्रहरीमा भर्ना हुन नजाने केही पूर्वप्रहरी अधिकारी बताउँछन्। पूर्वप्रहरी नायब महानिरीक्षक (डीआईजी) रमेशप्रसाद खरेल नेपाल प्रहरीलाई नेताहरूले आफ्नो भ्रातृ संगठनका रूपमा प्रयोग गरेको बताउँछन्। राजनीतिक दबाबका कारण नेपाल प्रहरीले कानुनअनुसार काम गर्न पाइरहेको छैन। नेताहरूले यो संगठन मेरो पार्टीको भ्रातृ संगठन हो, मैले जे भने पनि मान्नुपर्छ भनेर निमोठिरहेका छन्, खरेल भन्छन्, कानुनको आदेश हैन व्यक्तिको आदेशका भरमा संगठन चल्न ुपरेपछि यो पेसामा आकर्षण कम हुनु स्वाभाविक हो। प्रहरी पेसा आफैंमा स्वाभिमानी भए पनि परिवर्तित समयमा जीवनयापनमै कठिनाइ भएपछि सर्वसाधारणले अरू पेसा रोज्ने गरेको ठम्याइँ खरेलको छ। भन्छन्, हो हिजो आर्थिक स्वतन्त्रताजस्तो संयुक्त राष्ट्रसंघीय मिसनमा जान सजिलो थियो। म पाँच वर्ष मिसनमा बसें। त्यो ह्वाइट मनी थियो। यसले मेरो जीवन आर्थिक रूपमा सजिलै चलेको छ। अहिले त्यो अवस्था छैन। प्रहरी प्रवक्ता एसएसपी वसन्तबहादुर कुँवर प्रहरीमा आकर्षण घटेको भनेर अहिल्यै विश्लेषण गर्ने बेला नभएको बताउँछन्। प्रहरीका आफ्नै बाध्यता पनि छन्। जिम्मेवारी धेरै छन्। कामको चाप धेरै भयो भन्ने गुनासा पनि छन्, प्रवक्ता कुँवर भन्छन्, बढ्दो आकांक्षा राखेर प्रहरीमा भन्दा धेरै तलब पाइने मनसायले पनि जागिर छाडेका होलान्।राजीनामाको लहरएकातिर भर्ना आकर्षक कम हुनु र अर्कोतिर राजीनामाको लहर चल्नुले शान्तिसुरक्षामा गम्भीर असर पर्ने चिन्ता प्रहरी मुख्यालयको छ। २०७४०७५ मा २ हजार ५ सय ६४ जनाले राजीनामा दिए। त्यसैगरी २०७५०७६ मा ३ हजार ७३ जनाले र २०७६०७७ मा २ हजार ७७ जनाले राजीनामा दिए। दर्जागत रूपमा हेर्दा राजीनामा दिनेमा सई, असई, हबल्दार र जवानको संख्या ठूलो छ। प्रहरीको यही जनशक्ति फिल्डमा बढी खटिनेमा पर्छ। प्रहरीको कुल संख्याको ७० प्रतिशतभन्दा बढी संख्या यिनै दर्जाको छ। पूर्वएआईजी राजेन्द्र सिंह भण्डारी यो दर्जाका धेरैले राजीनामा दिनुको पछाडि आर्थिक पाटो नै मुख्य रहेको बताउँछन्। अहिले मिसन पनि छैन। महँगीअनुसार प्रहरीको रासनभत्ता र तलबमा असमानता छ। प्रहरीमा कामको बोझ धेरै छ, भण्डारी भन्छन्, त्यति नै समय अन्य काममा खटिँदा पैसा धेरै कमाउने देखिएपछि जागिर छाड्छन्। उनका अनुसार जवान, असई र प्रहरी निरीक्षकलाई भर्नादेखि तालिम र कार्यालयमा दरबन्दी कायम गर्दासम्म ठूलो धनराशि खर्च हुन्छ। मुख्यालयका अनुसार प्रहरी निरीक्षकलाई तयारी अवस्थामा काममा लगाउँदासम्म १२ देखि १४ लाख रुपैयाँ खर्च हुन्छ। त्यस्तै, असईको सातदेखि आठ लाख र जवानको पाँचदेखि ६ लाख रुपैयाँ खर्च हुने मुख्यालयले जनाएको छ।"
