शीर्षक,विवरण
"बालिका हत्या प्रकरण : निषेधाज्ञा तोड्दै बर्दिबासमा निरन्तर प्रदर्शन, सरकारविरुद्ध चर्को नाराबाजी","बर्दिबास : ६ वर्षीय बालिका गुलाब साह खातुनको हत्या घटनाले बार्दिबासमा तनाव बढेको छ। दोषीलाई कारवाहीको माग गर्दै भएको आन्दोलनमा प्रहरीको गोली लागेर संजय न्यौपानेको मृत्यु भएपछि आन्दोलन थप चर्किएको छ। मृतकलाई सहिद घोषणा गर्नुपर्ने र दोषीलाई फाँसी दिनुपर्ने माग गर्दै स्थानीयले प्रदर्शनलाई निरन्तरता दिएका हुन्। बालिका हत्या प्रकरण : प्रदर्शन नियन्त्रण गर्न प्रहरीको हवाइ फायर (अपडेट) बालिका हत्या प्रकरण : प्रदर्शनमा उत्रिएकामाथि गोली प्रहार, ३ जना घाइते बर्दिबास बालिका हत्या प्रकरण : घाइते दुईजनालाई थप उपचारका लागि काठमाडौं लगियो बालिका हत्या प्रकरण : प्रहरीको गोली लागेका संजयको मृत्यु बालिकाको हत्यापछि तनाव बालिका हत्या प्रकरण : तनाव बढेपछि बर्दिबासमा निषेधाज्ञा बालिका हत्या प्रकरण : निषेधाज्ञा अवज्ञा गर्दै स्थानीयको प्रदर्शन जारी बर्दिबासका सर्वपक्षीय बैठकले मृतकलाई सहिद घोषणा गर्न माग गरेको छ। बर्दिबास सेवा समितिले आयोजना गरेको सर्वपक्षीय बैठकले आन्दोलनका घाइतेलाई उपचार तथा क्षतिपूर्ति दिनुपर्ने, आन्दोलनमा गोली चलाउन निर्देशन दिनेलाई तुरुन्त निलम्बन गरेर बर्खास्त गर्नुपर्ने, बालिकाको हत्यारालाई कडा कारवाही हुनुपर्ने माग अघि सारेको हो। यस्तै माग पूरा गर्न सरसकारसँग वार्ता गर्ने वार्ता टोलीसमेत गठन भएको छ। कांग्रेसका नेता चिरञ्जिवी हमालको संयोजकत्वमा ११ सदस्यीय वार्ता टोली गठन भएको हो। उपचारको क्रममा काठमाडौंमा मृत्यु भएका न्यौपानेको शव आजै पशुपति आर्यघाटमा दाहसंस्कार गर्ने परिवारजनले जनाएको छ। आइतबारबाट हराएकी महोत्तरीको बर्दिबास १४ स्थित शुभम् बस्तीकी ६ वर्षीय गुलाब साह खातुनको शव सोमबार मध्यराति भेटिएको थियो। बालिका हत्याको आरोपमा गौशाला५ का अरुण साहलाई प्रहरीले पक्राउ गरिसकेको छ। भीड तितरवितर पार्न प्रहरीले चलाएको गोली उछिटिएर लागेको महोत्तरीका प्रमुख जिल्ला अधिकारी कृष्णबहादुर कटुवालले बताएका छन्। प्रदेशसभा सदस्य शारदादेवी थापाले प्रहरीले मृतक बालिकाको लाशलाई समयमा व्यवस्थान गर्न नसक्दा अर्को मान्छे मर्ने घटना भएको बताइन्। उद्योग वाणिज्य संघ बर्दिबासका सदस्य विनोद भण्डारीले राजनीतिक दलको ठूलो कमजोरीले वातावरण बिग्रिएको बताए। दोषीलाई फाँसी दिन माग प्रदर्शनकारीले दोषीलाई फाँसी दिन माग गर्दै प्रदर्शनलाई चर्काएका छन्। सरकारविरुद्ध चर्को नाराबाजी गर्दै प्रदर्शनकारीले बर्दिबासमा आन्दोलन चर्काएका हुन्। प्रदर्शनकारीले बिहानैदेखि पूर्वपश्चिम राजमार्ग ठप्प पारेका छन्। प्रदर्शनकारीले राजमार्गमा टायर बालेर बाटो अवरुद्ध गरेका हुन्। उनीहरूले बालिकाको हत्यारालाई कडा कारबाही गर्नुपर्ने, प्रहरी दमन अन्त्य गर्नुपर्ने, गोली चलाउने प्रहरी तथा गोली चलाउन आदेश दिनेलाई तुरुन्त निलम्बन गरी कारबाही गर्नुपर्ने लगायतका माग राखेका छन्। बर्दिबास क्षेत्रमा निषेधाज्ञा घटनाको विषयमा तनाव बढ्दै गएपछि बर्दिबासमा निषेधाज्ञा जारी भएको छ। जिल्ला प्रशासन कार्यालय महोत्तरीले बुधबार बिहान ९ बजेदेखि बर्दिबासमा निषेधाज्ञा गर्ने निर्णय गरेको हो। प्रमुख जिल्ला अधिकारी कृणबहादुर पूर्वमा रातु खोला, पश्चिममा माइस्थान, उत्तर पाटुचोक र दक्षिणमा क्वाट्रचोकसम्म निषेधाज्ञा जारी भएको छ। सीडीओ कटुवालका अनुसार बुधबार बिहान ९ बजेदेखि बिहीबार बिहान ६ बजेसम्मका लागि निषेधाज्ञा लगाउने निर्णय भएको हो।"
बालिकालाई जबरजस्ती गरेको आरोपमा विक पक्राउ,स्याङ्जा : १४ वर्षिया बालिकालाई जबरजस्ती करणी गरेको आरोपमा ३८ वर्षीय रमेश भन्ने मैते विक पक्राउ परेका छन्। बालिकालाई जबर्जस्ती गरेको भनी प्रहरी कार्यालयमा परेको जाहेरीका आधारमा उनलाई पक्राउ गरिएको प्रहरी नायब उपरीक्षक राजेन्द्र अधिकारीले जानकारी दिए। धादिङ घर भई पोखरा महानगरपालिका नयाँगाउँ बस्ने विक कामको शिलशिलामा स्याङ्जा आएको बताइएको छ। बिकले कात्तिक २६ गते साँझको करिब ९ बजे जबरजस्ती करणी गरेको आरोप छ। आरोपित मैते बिकलाई पक्राउ गरी करणी सम्बन्धी कसूर जवरजस्ती करणी मुद्धामा मुद्धा दर्ता गरी जिल्ला अदालत स्याङ्जाबाट मंगलबार १० म्याद थपगरी अनुसन्धान सुरु गरेको प्रहरीले जनाएको छ।
बालिका हत्या प्रकरण : निषेधाज्ञा अवज्ञा गर्दै स्थानीयको प्रदर्शन जारी,"बर्दिबास : बालिकाको हत्यारालाई कडा कारबाही तथा प्रहरीको बल प्रयोगविरुद्ध निषेधाज्ञाको अवज्ञा गर्दै बिहानैदेखि स्थानीयले प्रदर्शन जारी राखेका छन्। ६ वर्षीया बालिका गुलाब साह खातुनको बलात्कारपछि हत्या भएको आरोपमा पक्राउ परेकालाई कडा कारबाही गर्दै स्थानीयले मंगलबारदेखि प्रदर्शन जारी राखेका हुन्। प्रदर्शनलाई नियन्त्रणमा लिन मंगलबार प्रहरीले चलाएको गोली लागेर प्रदर्शनकारी संजय न्यौपानको बुधबार बिहान उपचारका क्रमममा ज्यान गएपछि आन्दोलन झन चर्किएको हो। प्रदर्शनकारीले बिहानैदेखि पूर्वपश्चिम राजमार्ग ठप्प पारेका छन्। प्रदर्शनकारीले राजमार्गमा टायर बालेर बाटो अवरुद्ध गरेका हुन्। उनीहरूले बालिकाको हत्यारालाई कडा कारबाही गर्नुपर्ने, प्रहरी दमन अन्त्य गर्नुपर्ने, गोली चलाउने प्रहरी तथा गोली चलाउन आदेश दिनेलाई तुरुन्त निलम्बन गरी कारबाही गर्नुपर्ने लगायतका माग राखेका छन्। त्यस्तै मृतक न्यौपानेलाई सहिद घोषणा गरी पीडित परिवारलाई उचित क्षतिपूर्तिसमेत दिन माग गरेका छन्। जिल्ला प्रशासन कार्यालय महोत्तरीले बुधबार बिहान ९ बजेदेखि बर्दिबासमा निषेधाज्ञा जारी गरेको छ। प्रमुख जिल्ला अधिकारी (सीडीओ) कृष्णबहादुर कटुवालका अनुसार निषेधाज्ञा बिहीबार बिहान ६ बजेसम्म जारी रहनेछ। सुरक्षालाई ध्यानमा राखेर जिल्ला प्रशासनले नेपाल प्रहरी र सशस्त्र प्रहरी परिचालन गरेको छ। यसैबीच सर्वपक्षीय बैठक बसेर माग पूरा गर्नका लागि वार्ता टोलीसमेत बनेको छ। कांग्रेसका नेता चिरञ्जिवी हमालको संयोजकत्वमा ११ सदस्यीय वार्ता टोली गठन भएको हो। बालिका हत्या प्रकरण : प्रदर्शन नियन्त्रण गर्न प्रहरीको हवाइ फायर (अपडेट) बालिका हत्या प्रकरण : प्रदर्शनमा उत्रिएकामाथि गोली प्रहार, ३ जना घाइते बर्दिबास बालिका हत्या प्रकरण : घाइते दुईजनालाई थप उपचारका लागि काठमाडौं लगियो बालिका हत्या प्रकरण : प्रहरीको गोली लागेका संजयको मृत्यु बालिकाको हत्यापछि तनाव बालिका हत्या प्रकरण : तनाव बढेपछि बर्दिबासमा निषेधाज्ञा बालिका हत्या प्रकरण : मृतक संजयलाई सहिद घोषणा गर्न माग बालिका हत्या प्रकरण : निषेधाज्ञा अवज्ञा गर्दै स्थानीयको प्रदर्शन जारी"
पोखरामा राजा खोज्दै प्रदर्शन,"पोखरा : देशको राष्ट्रियता खतरामा परेको, भ्रष्टचार बढेको भन्दै पोखरामा हजारौँ युवाहरु प्रदर्शनमा उत्रिएका छन् । गणतान्त्रिक सरकार असफल भएको भन्दै मोटरसाइकल, कार, बस र्यालीमा सहभागीले राष्ट्रियता जोगाउन देशमा राजसंस्थाको आवश्यकता रहेको भन्दै प्रदर्शन गरेका हुन् । कोरोना कहरमा पनि युवा नेपालको राष्ट्रिय झण्डा बोकेर सडकमा उत्रेका थिए । सहभागीले पूर्व राजा ज्ञानेन्द्र शाह, कोमल लगायत पूर्वा राजाको तस्बिर र ब्यानर लिएका थिए । देश व्यापी रुपमा राजतन्त्र तथा हिन्दू राष्ट्रको पक्षमा र्याली र आमसभा गर्ने क्रममा पोखरामा पनि पदर्शन गरिएको हो । र्यालीमा पश्चिमाञ्चलका नागरिकका सहभागीता रहेको आयोजकले बताएका छन्।"
बालिका हत्या प्रकरण : तनाव बढेपछि बर्दिबासमा निषेधाज्ञा,बर्दिबास : बालिकाको बलात्कारपछि हत्या भएको घटनाको विषयमा तनाव बढ्दै गएपछि बर्दिबासमा निषेधाज्ञा जारी भएको छ। जिल्ला प्रशासन कार्यालय महोत्तरीले बुधबार बिहान ९ बजेदेखि बर्दिबासमा निषेधाज्ञा गर्ने निर्णय गरेको प्रमुख जिल्ला अधिकारी (सीडीओ) कृष्णबहादुर कटुवालले जानकारी दिए । कटुवालका अनुसार बुधबार बिहान ९ बजेदेखि बिहीबार बिहान ६ बजेसम्मका लागि निषेधाज्ञा लगाउने निर्णय भएको हो।
४३ दिन पछि खुल्यो कर्णाली स्वास्थ्य विज्ञान प्रतिष्ठानको ताला,"जुम्ला : कर्णाली स्वास्थ्य विज्ञान प्रतिष्ठानको शैक्षिक प्रशासन र केन्द्रीय प्रशासन कार्यालयमा तालाबन्दी भएको ४३ दिनपछि आज ताला खुलेको छ। केही दिन यता लगातार भएको वार्तामा विभिन्न बुँदामा सहमति भएपछि ताला खुलेको प्रतिष्ठनका भिसी राजेन्द्रराज वाग्लेले जानकारी दिए। प्रतिष्ठानका पदाधिकारी र आन्दोलनरत कर्मचारीबीच भएको सहमतिपछि ताला खुलेको हो। सहमतिमा नियुक्त भएका डीन र अन्य डीनहरुको सम्बन्धमा ३ सदस्य कार्यदल गठन गर्ने र उक्त कार्यदलले पेश गरेको प्रतिवेदन कार्यकारी परिषद्मा पेश गर्ने साथै प्रतिष्ठानको कार्यकारी परिषद्ले आगामी सिनेट बैठकमा निर्णय गराई १ जना डीन प्रमुख रहने र अन्य संकायका डीन सहायकहरू डीन रहने ब्यवस्था गर्ने रहेको छ। त्यस्तै ललितपुरको माहालक्ष्मीस्थानमा रहेको प्रतिष्ठानको सम्पर्क कार्यालय यथाशीघ्र हटाउने र उक्त सम्पर्क कार्यालयमा कार्यरत कर्मचारीहरुलाई १ हप्ताभित्र प्रतिष्ठानको केन्द्रीय कार्यालय जुम्ला बोलाउने, प्रतिष्ठानका सम्पूर्ण पदाधिकारीहरू विशेष कामबाहेक पुरा समय प्रतिष्ठानको केन्द्रीय कार्यालय जुम्लामा बस्ने सहमति भएको छ। यसका साथै अन्य मागका सम्बन्धमा कार्यकारी परिषदबाट हुवहु पारित गर्ने सहमति भएको अन्दोलनरत प्रतिष्ठान कर्मचारी कल्याणकारी समाजका अध्यक्ष रमाकान्त उपाध्यायले जानकारी दिए। गत असोज २६ गते नै प्रतिष्ठानको सम्पर्क कार्यालय ललितपुरबाट उपकुलपति राजेन्द्रराज वाग्लेले स्वास्थ्य संकायको डीनमा प्रा डा मुन्निराज क्षेत्रीलाई नियुक्त गरेका थिए। सोही नियुक्तिलाई खारेज गर्नुपर्ने कर्मचारीहरुको माग थियो। यस्तै, प्रतिष्ठानमा कार्यरत कुनैपनि कर्मचारी बाहिर काम गर्न नपाउने र दोहोरो सुविधा भोग गर्न नपाउने ऐनमा उल्लेख भएअनुसार गर्नुपर्ने भन्दै कर्मचारीहरू आनदोलनरत थिए। मेडिकल डीन रेशम रानाको विषयले पनि प्रतिष्ठानका कर्मचारीभित्र तीव्र असन्तुष्टि रहेको थियो। मेडिकल डिनका रुपमा नियुक्त भएका रानाले एसएसबीएच योजनाबाट सुविधा लिनुका साथै ऐनेस्थेसिया सहायक कोर्ष कोर्डिनेटरको जिम्मेवारीमा रहेर पनि सुविधा लिएको कल्याणकारी समाजको आरोप छ। समाजका एक पदाधिकारीका अनुसार यसरी एउटै संस्थाभित्र तेहेरो सुविधा लिनु गैरकानुनी भएको र त्यस्तो सुविधा लिनेलाई कारबाही हुनुपर्ने बताए।"
