शीर्षक,विवरण
सानेपा बैठकअघि शशांक निवासमा भेला : आन्दोलन चर्काउने कि फैसला पर्खिने ?,"काठमाडौं : नेपाली काँग्रेसको केन्द्रीय समिति बैठक मंगलबार बस्दैछ। संसद् विघटन गर्ने प्रधानमन्त्री केपी ओलीको कदमको विरोध गर्दै आएको कांग्रेसले आन्दोलनको समीक्षा तथा नयाँ रणनीतिबारे छलफल गर्न बैठक बोलाएको हो। केन्द्रीय समितिको बैठकअघि वरिष्ठ नेता रामचन्द्र पौडेलसहितका नेताहरू महामन्त्री शशांक कोइरालाको निवासमा सोमबार भेला भएका छन्। संसद् विघटन गर्ने प्रधानमन्त्री केपी ओलीको कदमविरुद्ध ठोस् निर्णय लिन सभापति शेरबहादुर देउवाले अलमल गरेकोले उनलाई दबाब दिन संस्थापन इतरका नेताहरू जम्मा भएको एक सहभागीले बताए। उनका अनुसार मंगलबार बैठकका संभावित एजेन्डा र रणनीतिबारे छलफल भइरहेको छ। ओली पुस ५ गते संसद विघटन गरेपछि पुस ७ गतेदेखि कांग्रेसको बैठक बस्दै आए पनि अहिलेसम्म ठोस् निर्णय केही गरेको छैन। आन्दोलनलाई निरन्तरता दिँदै अदालतको निर्णय कांग्रेसले पर्खेको छ। यसबीचमा पटकपटक बैठक बोलाए पनि स्थगित हुँदै आएको छ। कांग्रेसले संसद विघटन असंवैधानिक र अलोकतान्त्रिक कदम भन्दै आए पनि पुनर्स्थापनाका पक्षमा संस्थागत निर्णय अहिलेसम्म भएको छैन। कांग्रेस 'पर्ख र हेर' को रणनीतिबाट अघि बढेको देखिन्छ। नयाँ राजनीतिक घटनाक्रमपछि पार्टीभित्रैबाट दुईथरी विचार आएका छन्। एउटा पक्ष पुनर्स्थापनालाई बटमलाइन बनाएर अहिले नै सडक आन्दोलन चर्काउनुपर्ने पक्षमा छ भने अर्को पक्ष अदालतको निर्णय कुर्नुपर्ने पक्षमा देखिन्छ। रामचन्द्र पौडेल पक्ष आन्दोलन चर्काउने पक्षमा भए पनि सभापति शेरबहादुर देउवा आन्दोलन चर्काउने मुडमा छैनन्। अदालतको निर्णय स्वीकार्य हुने र चुनावका लागि पनि कांग्रेस तयार रहेको सभापति देउवालगायतका पार्टीका नेताहरूले बताउँदै आएका छन्। संसद विघटनविरुद्ध नेपाली कांग्रेसले माघ ३ गते शनिबार देशभर नै प्रदर्शन गरेको थियो।७५३ वटा पालिकाका ६,७४३ वडामा एकसाथ विरोध प्रदर्शन भएको छ । प्रदर्शनसँगै आयोजित सभालाई विभिन्न नेताहरुले सम्बोधन गरेका थिए। यसअघि कांग्रेसले पुस १३ गते १ सय ६५ वटै प्रतिनिधिसभा निर्वाचन क्षेत्र र पुस २५ गते ३ सय ३० प्रदेशसभा निर्वाचन क्षेत्रमा विरोध प्रदर्शन गरेको थियो। पछिल्ला दिनमा अदालतभित्र र बाहिर पनि पुनर्स्थापनाको पक्षमा माहोल बलियो बन्दै गएको कांग्रेसको आन्तरिक विश्लेषण छ। यसका पछाडि केही खास कारण छन्। अदालतमा भइरहेको बहस सुनुवाइ र त्यसमा इजलासबाट ओइरिएका प्रश्न एवं प्रतिक्रिया, सरकारी पक्षले विघटनको निर्णयलाई वैधानिकता दिन गरेका विवादित (किर्ते) कामहरू, अदालतलाई प्रभावित गर्ने गरी प्रधानमन्त्रीबाट आइरहेका उत्तेजक अभिव्यक्ति, नागरिकस्तरमा भइरहेको विघटनको विरोध, विघटनको विपक्षमा बौद्धिक तथा पेसागत समुदायबाट भइरहेको खबरदारीलगायतका कारणले पुनर्स्थापनाको पक्षमा माहोल बलियो बन्दै गएको हो। नेकपाका दुवै पक्षले कांग्रेससँग सहकार्यको प्रस्ताव राखेका छन्। पटकपटक सम्वाद पनि भइसकेको छ। सभापति शेरबहादुर देउवासहितको टिम ओली पक्षसँग अलि बढी निकट देखिएको छ र पटकपटक भेटवार्ता पनि भएको छ। त्यसैगरी प्रचण्ड र माधव नेपाल पक्ष भने वरिष्ठ नेता रामचन्द्र पौडेलसहितको असन्तुष्ट समूहसँग सामिप्य र संवाद बढाएको छ। पुस ५ मा संसद विघटन हुनुअघि पनि दुवै पक्षले कांग्रेसलाई सहकार्यका लागि अफर गरेका थिए। चुनावकै पक्षमा सकारात्मक देखिएका र मौन बसेका देउवा पनि पछिल्ला दिनमा पुनर्स्थापनाको पक्षमा अलि खुल्न थालेका छन्। चुनावको बाहना देखाएर सत्ता लम्ब्याउने ओलीको डिजाइनमा नफस्न पार्टीभित्रैबाट देउवालाई ठूलो दबाब छ। कोरोना लगायतका कारणले तत्काल चुनाव संभव नभएको र संसद पुनर्स्थापना नभए अस्थिरता र संक्रमणको डरलाग्दो शृखंला सुरु हुने र त्यसको जिम्मेबारी कांग्रेसले पनि लिनुपर्ने बताउँदै पार्टीका युवा नेताहरूले बालुवाटारको ललिपपमा नलोभिन कांग्रेस नेतृत्वलाई सचेत गराउँदै आएका छन्।"
पुल उद्घाटन गर्न प्रधानमन्त्री ओली दाङमा,"लुम्बिनी : प्रधानमन्त्री केपी शर्मा ओलीले लुम्बिनी प्रदेशको राजधानी राप्ती उपत्यकाको राप्ती नदीमा निर्माण भएको पुलको उद्घाटन गरेका छन् । प्रधानमन्त्री ओली नेपाली सेनाको हेलिकोप्टरबाट पुल उद्घाटनका लागि राप्ती उपत्यकाको सिसहनिया पुगेका हुन्। उनलाई लुम्बिनी प्रदेशका मुख्यमन्त्री शङ्कर पोखरेल, मन्त्री, प्रदेशसभाका सदस्य र प्रमुख जिल्ला अधिकारी जयनारायण आचार्य तथा सुरक्षा निकायका उच्च अधिकारीले स्वागत गरेका थिए। पुल उद्घाटनपछि उनले राप्ती गाउँपालिका२ लालमटियामा आयोजित जनसभालाई सम्बोधन गर्ने कार्यक्रम छ । प्रधानमन्त्री ओलीले राप्ती नदीमा निर्मित पुलको अवलोकनसमेत गरेका छन्। राप्ती गाउँपालिकाको सिसहनिया र गढवा गाउँपालिकाको महदेवा जोड्ने गरी नेपालकै दोस्रो लामो पक्की पुल हो । पूर्वनिर्धारित समयभन्दा चार महिना अगाडि नै निर्माण भएको पुलको लम्बाइ ८६० मिटर र चौडाइ साढे १० मिटर छ । करीब रु एक अर्ब लागतको सो पुल चार वर्षभित्र बनाइसक्ने सम्झौता भएको थियो । पुल निर्माणपछि देउखरी क्षेत्रका सिसहनियामहदेवा वारिपारि गर्न सहज भएको छ । यसअघि वर्षायाममा उर्लिएको भेलमा जोखिमपूर्ण तरिकाले राप्ती नदीमा डुङ्गाबाट वारपार गर्नुपर्ने बाध्यता थियो । पुल निर्माण भएसँगै देउखुरीबासीलाई यात्रा गर्न सहज हुने छ । पुल निर्माणबाट साविकको गोबरडिहा गाविस र साविकको सिसहनियाँ क्षेत्रका बासिन्दा लाभान्वित भएका छन् । पछिल्लो समय पुल पर्यटकीय गन्तव्यका रुपमा विकास भएको छ । दाङ जिल्लाका मात्रै नभएर बाहिरी जिल्लाबाट समेत आन्तरिक पर्यटक यहाँ आउने गरेका छन् । अहिले गढवा गाउँपालिकाअन्तर्गत पर्ने राप्तीपारिको क्षेत्रबाट आउँदा कालाकाटेभालुवाङ हुँदै करीब डेढ घण्टाको सवारी साधनबाट यात्रा गर्नुपर्ने अवस्था छ । पुल निर्माणसँगै १५ मिनेटभित्रै वारपार गर्न सकिने भएको छ । बर्दियाको गेरुवा नदीमा पुल बनाएकै कम्पनी द एएनके लुम्बिनी वाइपी जेभीले देउखुरीको राप्ती नदीको पुल बनाउने जिम्मा पाएको थियो । तत्कालीन प्रधानमन्त्री पुष्पकमल दाहाल प्रचण्डले २०७३ मङ्सिर २२ गते पुल शिलान्यास गरेका थिए।"
निकुञ्जले गर्यो ठूलो परिमाणमा हतियार बरामद,"डोल्पा : शेफोक्सुण्डो राष्ट्रिय निकुञ्जले ठूलो परिमाणमा हतियार बरामद गरेको छ। निकुञ्ज क्षेत्रबाट ३३ थान भरुवा बन्दुक र दुई नालसहित ८ जना पक्राउ गरेको हो। निकुञ्जले मध्यवर्ति क्षेत्रमा पर्ने जगदुल्ला गाँउपालिकाको काईगाँउ,हुरिकोट,माझगाँउ,झयाकोट, तथाछाँचुबाट ठुलो परिनाममा भरुवा बन्दुक बरामद गरेको शेफोक्सुण्डो राष्ट्रिय निकुञ्जका निमित्त प्रमुख संरक्षण अधिकृत सरोजमणि पौडेलले जानकारी दिए। पौडेलकाअनुसार निकुञ्जको गस्तिमा रहेको टोलीले अबैधरुपमा कस्तुरीको चोरी सिकारी गर्ने ८ जना पक्राउ गरी हिरासतमा राखेर अनुसन्धान भै रहेको बताए। चोरी सिकार गर्नेहरुले अबैध रुपमा लुकाएर राखेका भरुवा बन्दुक निकुञ्जलाई बुझाउन स्थानीय र जनप्रतिनिधिले निकै ठूलो सहयोग गरेको भन्दै पौडेलले धन्यवाद प्रकट गरे। निकुञ्जको संरक्षण क्षेत्रमा पनि स्थानीय केहि व्यक्तिले लुकीछीपी कस्तुरी लगायत अन्य वन्यजन्तुको सिकारी गर्ने गरेको सुचनाको आधारमा उनीहरुलाई पक्राउ गरेको र कारवाहीको लागि निकुञ्जको हिरासतमा राखेर अनुसन्धान भै रहेको निकुञ्जले जनाएको छ। यस अगाडि निकुञ्जले ३७ थान भरुवा बन्दुक,एक कटुवा पेस्तोल,१० वटा ईन्सास राइफलको गोली बरामद गरेको थियो। हालसम्म निकुञ्जले विभिन्न मितिमा ७० वटा भरुवा बन्दुक बरामद गरी सकेको छ। निकुञ्जले घरमा राखिएका हतियार बुझाउन सार्वजानिक सुचना जारी गर्दा पनि नबुझाएपछि निकुञ्जले गस्तिबाट सुचनाका आधारमा विभिन्न स्थानबाट भरुवा बन्दुक बरामद गरेको दाबी गरेको छ। पछिल्लो समय निकुञ्जले संरक्षण क्षेत्रमा गस्ति बढाएपछि अबैध रुपमा चोरी सिकार गर्नेहरु भागाभाग भएका छन। निकुञ्जमा मध्यवर्ति क्षेत्र,सामुदायिक बन,चोरी सिकारी नियन्त्रण ईकाइ भएपनि स्थानीय केहि व्यक्तिले भने चोरी सिकार गरिरहेका छन्। स्थानीयको नागरिकको सुचना,स्थानीय सरकारको सहकार्य तथा प्रहरी र अन्य निकायको सहकार्यमा निकुञ्जले चोरी सिकार गर्नेहरु पक्राउ गर्नुका साथै हतियारसमेत बरामद गरेको छ।"
रहेनन् चर्चित गीत मिर्मिरे आँखाका गायक धनबहादुर,"पोखरा : यो दाजुको मिर्मिरे आँखा, बेली र चमेलीलगायत चर्चित लोकगीतका संकलक धनबहादुर गायकको निधन भएको छ । २०२१ साल वैशाख ६ गते पोखराको बाटुलेचौरमा जन्मिएका गायकको सोमबार मणिपाल अस्पतालमा निधन भएको हो । उच्च रक्तचापका बिरामी उनलाई ३ दिनअघि अस्पताल भर्ना गरिएको थियो । राष्ट्रिय लोकबाजार सारंगी संरक्षण पाठशाला प्रतिष्ठानका अध्यक्ष समेत रहेका उनी पोखरा महानगरपालिकाले गठन गर्न लागेको प्रज्ञा प्रतिष्ठानमा उनलाई गन्धर्व सिफारिस भएका भएका थिए । तर प्रतिष्ठानमा नियुक्ति हुनुअघि नै उनको निधन भएको छ । पछिल्लो समय धनबहादुर नयाँ पुस्तालाई सारंगी सिकाउन व्यस्त थिए ।"
'अझै एक साता पानी पर्ने संभावना छैन',"काठमाडौं : यस वर्ष हिउँदयाममा पानी नपर्दा हिउँदे बालीनालीका उत्पादनमा असर पुग्ने भएको छ । गत वर्षको मङ्सिर, पुस र माघमा वर्षा भएको थियो । यस वर्ष एकपटक पनि पानी परेको छैन । पश्चिमका केही स्थानमा हल्का पानी परेको भए पनि अन्य ठाउँमा तीन महिनादेखि पानी नपरेको मौसमविद् विभूति पोखरेलले जानकारी दिए । 'हाल कायम रहेको पश्चिमी वायुको प्रभावले पानी पर्ने सम्भावना कमै रहेको छ,' उनले भने। वर्षा हुनका लागि पश्चिमी वायु सक्रिय भई प्राप्त मात्रामा जलवाष्पयुक्त हावा बहनु पर्दछ । अझै एक साता वर्षा हुने सम्भावना नरहेको मौसमविद्को अनुमान छ । पानी पार्ने उल्लेखनीय मौसमी प्रणाली देशभर नै नरहेको जल तथा मौसम विज्ञान विभागले जनाएको छ । हिउँदयाममा पानी नपरेकाले गहुँ, तोरी, फापरलागयतका बालीमा सुख्खा लागेकाले ५० देखि ७० प्रतिशत उत्पादन घट्ने सम्भावना रहेको वरिष्ठ कृषि विज्ञ डा केदार बूढाथोकीले बताए। 'माघ महिनाभित्र पानी परे केही राहत मिल्छ । धेरै नोक्सानी हुँदैन,' उनले भने। हिउँदे बालीलाई कात्तिक र मङ्सिरमा पानी पर्दा हिउँदे बालीको उत्पादन वृद्धि हुने जनाइएको छ । रासस"
