शीर्षक,विवरण
राहतका लागि ल्याइएको चामल गाउँपालिकाले गर्यो फिर्ता,"ओखलढुंगा : चिशंखुगढी गाउँपालिकाले राहत वितरणका लागि ल्याइएको चामल आपूर्तिकर्तालाई फिर्ता पठाएको छ । राहत वितरणका लागि ल्याइएको चामल खरिद सम्झौता अनुसार नभएको भन्दै फिर्ता पठाएको हो । ठेक्कामार्फत खरिद सम्झौता गरेको सप्लायर्सले सोना मनसुली चामल ढुवानी गर्ने सर्त भएपनि रामविलास मिसाएर ढुवानी गरेपछि फिर्ता गरिएको गाउँपालिकाका प्रमुख प्रशासकीय अधिकृत ओमबहादुर दर्जीले बताए । अन्य सामग्री भने सम्झौता अनुसार नै ढुवानी गरेको पाइएको छ । गाउँपालिकाले राहत वितरणका आपूर्तिकर्तालाई सम्झौता अनुसारको चामल आपूर्ति गर्न निर्देशन समेत दिएको छ । आपूर्तिकर्ताले सामग्री ढुवानी गरेपछि सम्झौता अनुसारको गुणस्तर भए नभएको अनुगमन गरिएको थियो । 'सम्झौतामा सोना मनसुली चामल ल्याउने उल्लेख भए पनि कतिपय वडामा रामविलास ल्याइएको पाइएपछि फिर्ता गरेका हौं, प्रमुख प्रशासकीय अधिकृत दर्जीले भने, 'खाद्यवस्तुको गुणस्तरमा कुनै सम्झौता हुँदैन ।' सबै सामग्री आपूर्ति भइसकेपछि तत्काल राहत वितरण गर्ने गाउँपालिकाले जनाएको छ । चामल तोकिएभन्दा फरक पाइएपछि राहत वितरण रोकिए पनि आपूर्तिकर्तालाई तत्काल ढुवानी गराएर एक, दुई दिनभित्रै राहत वितरणको काम सुरु गरिने बताइएको छ । गाउँपालिकाले यसअघि संघ तथा प्रदेश सरकारले जारी गरेको असंगठित क्षेत्रमा कार्यरत मजदुर तथा असहायलाई दैनिक जीवन यापनका लागि राहत उपलब्ध गराउने सम्बन्धी मापदण्डअनुसार व्यक्ति तथा परिवार छनौट गरेको थियो । चिशंखुगढीले ८ वडाका ७ सय ६७ परिवारलाई प्रतिपरिवार २५ केजी चामल, २ केजी दाल, १ लिटर तेल र १ प्याकेट नुन राहत स्वरुप वितरण गर्ने तयारी गरेको छ ।"
सिम्रिकको हेलिकोप्टरबाट सुत्केरीको उद्धार,धनगढी : बझाङकी ३३ वर्षीय एक सुत्केरीको सम्रिक एयरको हेलिकोप्टरबाट उद्दार गरी काठमाडौं ल्याइएको छ। बझाङमा शल्यक्रिया गरी शिशु जन्माएकी महिलाको स्वास्थ्यमा अचानक गम्भीर समस्या देखिएपछि सेती प्रादेशिक अस्पताल धनगढी रेफर गरिएको थियो। अवस्था गम्भीर रहेको र त्यहाँ उपचार संभव नहुने भएपछि उनलाई हेलिकोप्टरबाट राजधानी ल्याइएको थियो। बझाङ केदारस्यु गाउँपालिका ३३ वर्षीय जानकीदेवी रावलको शल्यक्रिया गरी शिशु जन्माएकी थिइन् ।सुदूरपश्चिम प्रदेशका सामाजिक विकास मन्त्री कृष्णराज सुवेदीको पहलमा हेलिकोप्टरबाट उनको उद्धार गरिएको हो। सेतीमा उपचार सम्भव नभएपछि सिम्रिक एयको हेलिकोप्टरमार्फत काठमाडौं पुर्याएको सामाजिक विकास मन्त्री कृष्णराज सुवेदीले स्वकीय सचिव लोकेन्द्र धामीले जानकारी दिए । उनको राजधानीको टिचिङ अस्पतालमा उपचार भइरहेको छ र स्वास्थ्यमा क्रमश सुधार भइरहेको धामीले अन्नपूर्ण अनलाइनसँग बताए।
२८८ जना मात्र क्वारेन्टाइनमा,"कालिकोट : जिल्ला भित्रिएकामध्ये दुई सय ८८ जनामात्रै क्वारेन्टाइन बसेका छन्। पछिल्लो समय जिल्लाका नौवटै स्थानीय तहमा गरी झन्डै ६ हजारभन्दा बढी मानिस जिल्ला भित्रिएका छन्। भित्रिएका सबैलाई स्थानीय तहले क्वारेन्टाइनमा राख्न सकेको छैन्। क्वारेन्टाइनमा बसेकाहरू विदेशबाट आएका तथा यसअघि संक्रमित पहिचान भएको ठाँउबाट आएकालाई मात्र राखिएको छ। उनीहरूको नमुना र्यापिड टेस्ट गर्ने कार्य जारी छ। हालसम्म झन्डै एक हजारभन्दा बढी मानिस क्वारेन्टाइनमा बसेर घर फर्किसकेका छन्। जिल्लामा कोरोना परीक्षणका लागि स्वाब संकलन गरिएका सबैको रिपोर्ट नेगेटिभ आएको छ। १३ जनाको स्वाब संकलन गरी परीक्षणका लागि बाह्य जिल्ला पठाएकोमा सबैको रिपोर्ट नेगेटिभ आएको हो। स्वास्थ्य सेवा कार्यालय कालिकोटका अनुसार जिल्लामा चार सय २६ जनाको र्यापिड टेस्ट र १३ जनाको स्वाब संकलन गरिएकोमा सबैको रिपोर्ट नेगेटिभ आएको छ। यस्तै, सान्नीत्रिवेणी गाउँपालिका र तिलागुफा नगरपालिकाबाट दुई जनाको स्वाब संकलन गरी परीक्षणका लागि सुर्खेत पठाइएको जनस्वास्थ्य अधिकृत कटकबहादुर महतले बताए। र्यापिड टेस्ट गर्ने स्वास्थ्यकर्मीको टोली गाउँमै रहेको उनको भनाइ छ। प्रमूख जिल्ला अधिकारी कृष्णचन्द्र पौडेलले कोरोनाको जोखिमका हिसाबले जिल्ला सामान्य रहेको बताए। गाउँ भित्रिएकाको र्यापिड टेस्ट गर्दा पनि सबैको रिपोर्ट नेगेटिभ आएकाले कालिकोटमा कोरोनाको जोखिम सामान्य रहेको उनको भनाइ छ।"
नेपाल फर्किएका २४ नेपालीलाई पुनः भारत पठाइयो,"जनकपुरधाम : भारतको विभिन्न स्थानबाट नेपाल भित्रिएका २४ जना नेपालीलाई पुनः भारतीय क्वारेन्टाइनमा फर्काइएको छ । धनुषाको महिनाथपुर र इनर्वा क्षेत्रबाट नेपाल प्रवेश गरेका २४ जनालाई सशस्त्र प्रहरीले रोकेर दुई दिन नेपालमा राखी पुनः भारततर्फ पठाएको हो । महिनाथपुर १३ र इनर्वा नाकामा सोमबार बिहान ११ जना आइपुगेका थिए । उनीहरु भारतीय क्वारेन्टाइनमा १५ दिन बिताएर बालबच्चासहित कागजपत्र लिइ नेपाल फर्किएका थिए । अलपत्र परेकामध्ये महोत्तरीको भंगहा नगरपालिकाका सितापुरका इन्दल सदाले एउटा रुखको सहारामा वर्षा तथा घाम छल्नु परेको दुःखेसो पोखे । उनले भने, हामी भारतको बिहार राज्य राजनगर स्थित सिमरीमा १५ दिन क्वारेन्टाइनमा राखी चेकजाँचपश्चात नेपाली सिमासम्म आइपुग्यौं, तर यहाँ आएर सशस्त्र प्रहरीले बस्न दिएन, माथिको आदेश आए मात्र जान दिने भन्छन्, हामीलाई खुल्ला चौरमा राखिएको छ, न पानी छ न खाना, राती मच्छरले सुत्नै दिंदैन । सीमामा अलपत्र परेका कमला नगरपालिकाका दिलिप मण्डल खत्वेले भारतमा १५ दिन क्वारेन्टाइन बसेर आए पनि पुनः भारततर्फ फर्काइनु दुःखद रहेको बताए । उनले भने, हामीलाई कुनै स्कुलमा राखिदिए पनि हुन्थ्यो, आफ्नो देश जस्तो अरु ठाउँ कहाँ हुन्छ । बालबच्चा सहित भारतबाट नेपाल फर्किन लागेका उनीहरुलाई मंगलबार पुनः भारतीय प्रहरीमार्फत उतै पठाइएको सशस्त्र प्रहरी उपरीक्षक राजेश उप्रतिले जानकारी दिए । उनले भने, नेपालमा रहेकोलाई नेपालमै राख्ने र भारतमा रहेकोलाई भारतमै राख्ने माथिल्लो स्तरमै सहमति भएको छ, हामीले केही गर्न सक्दैनौं, हामी त कानूनको कार्यान्वयन निकाय मात्र हो । प्रदेश २ का आन्तरिक मामिला तथा कानून मन्त्री ज्ञानेन्द्रकुमार यादवले संघीय सरकारले सीमामा प्रदेशसरकारसँग संघीय सरकारको समन्वयन नभएकाले नेपालीहरु यसतो विपद्को बेलासमेत भारतीय भूमिमा बस्न बाध्य भएको बताए । उनले भने, भारतीय क्वारेन्टाइनबाट नेपाल आइसकेकालाई फेरि भारत फर्काउन मिल्दै मिल्दैन। उनीहरु नेपाली नागरिक हो, कसरी राख्ने हाम्रो जिम्मेवारी हो, तर सुरक्षा निकायले हामीलाई नै जानकारी गराएन, संघीय सरकारले जे भन्यो, त्यही मान्छ ।"
राहत चामल प्रकरण : जेलमा रहेका व्यवसायी धरौटीमा छुटे,"परासी : पश्चिम नवलपरासीको रामग्राम नगरपालिकाले वितरण गरेको राहत चामल प्रकरणमा जेलमा रहेका राजेश राइस मिल परासीका व्यवसायी पटवारी वनियाँ धरौटीमा छुटेका छन्। अदालतमा ५० हजार र जिल्ला प्रशासन कार्यालयमा १० हजार धरौटी बुझाएपछि बानियाँ सोमबार जेल मुक्त भएका हुन्। चामल प्रकरणका ७३ वर्षीया वनियाँलाई दुई वटा मुद्दा दायर गरिएको थियो। व्यवसायी वनियाँले नगरपालिकालाई राहतका लागि उपलब्ध गराएको चामल न्यून गुणस्तरको रहेको पाइएको थियो। चामल न्यून गुणस्तर सरकारको मापदण्ड अनुसार नभएको पाइएपछि खाद्य प्रविधि तथा गुण नियन्त्रण कार्यालय भैरहवाले अदालत र जिल्ला प्रशासन कार्यालयमा मुद्दा दायर गरेको थियो। जिल्ला अदालतमा दायर गरिएको मुद्दामा उनलाई पुर्पक्षका लागि थुनामा पठाइएको थियो। थुनामा रहेका वनियाँले उच्च अदालत तुलसीपुर बुटवल इजलाशमा थुना मुक्त हुनका लागि निवदेन पेश गरेका थिए। निवेदनका आधारमा उच्च अदालतले ५० हजार धरौटीमा रिहा गर्ने आदेश दिएकाले उनलाई छाडिएको जिल्ला अदालतका श्रेस्तेदार डिल्ली शर्माले जानकारी दिए। यसैगरी व्यवसायी वनियाँले खाद्य उद्योगको उत्पादन तथा बिक्री वितरणका लागि अनुज्ञापत्र नलिई व्यवसायी सञ्चाल गरेको अभियोगमा जिल्ला प्रशासनमा मुद्दा दायर गरिएको थियो। उक्त मुद्दामा अनुसन्धान हुँदा १० हजार धरौटी लिइ तारेखमा छाडिएको प्रमुख जिल्ला अधिकारी बासुदेव दाहालले जानकारी दिए। यता व्यवसायी वनियाँ उपर गुणस्तर तथा नाप तौल कार्यालय बुटवलले घटी तौलमा मुद्दा दर्ता गर्ने तयारी गरेको छ। वनियाँले तौल कमी गरी चामल उपलब्ध गराएको आरोप छ। उनको बयान सकिएकाले अदालतमा मुद्दा चलाउने प्रकृया सुरु गर्न लागिएको गुणस्तर तथा नाप तौल कार्यालयले जनाएको छ। नगरपालिकाले २३ सय विपन्नका लागि प्रतिघरधुरी ५, १० र १५ केजी सोना मनसुली चामल र सोहीअनुसारका अन्य खाद्यन्न वितरण सुरु गरिएको थियो। चैत २८ गते रामग्राम नगरपालिकाले वितरण गरेको चामल खान योग्य नभएको र कम तौल भएको भन्दै केही राहत लगेका हरुले खाद्य सामाग्री नगरपालिकाको गेट अगाडी फालेका थिए। नगरपालिकाले २५० क्विन्टल चामल वनियाँको राइस मिलबाट खरिद गरेको थियो। १० लाखमा खरिद गरिएको चामलको मूल्य प्रति केजी ४० रुपैयाँ छ। यसैबीच राहत सामग्री खरिद प्रकृयाबारे अख्तियार दुरुपयोग अनुसन्धान कार्यालय बुटवलले पनि नगरपालिकाबाट कागज पत्र लगेर अनुसन्धान गरिरहेको छ।"
आठ महिनादेखि बिनातलब काम गर्दै मजदुर,"बैतडी : पाटन पञ्चेश्वर सडकमा काम गर्ने लेन्थवर्करहरूले गएको असोज महिनादेखि तलब पाएका छैनन्। सो सडकमा काम गर्ने १२ मजदुरले तलब नपाउँदा दैनिक छाक टार्न मुस्किल भएको छ। वर्षौंदेखि सडकमा काम गर्दै आएका तर पाटन पञ्चेश्वर सडक प्रदेश सरकारअन्तर्गत रहेपछि आफूलाई तलब खान मुस्किल भएको मजदुर जयराम भुलले बताए। उनले भने, सडकमै काम गरेर परिवार पाल्ने जोहो गरिरहेका हामीले असोजदेखि तलब पाएका छैनौं। तलब नपाउँदा घरपरिवार चलाउन निकै समस्या भएको छ। आफूहरूले काम गरेको तलब नपाउँदा घरपरिवार चलाउन मुस्किल भएको मजदुर लक्ष्मी दमाईले बताइन्। उनले भनिन्, एकातिर लकडाउन छ। कतै केही काम गर्न पाइँदैन। सडकमा काम गरेको पैसा पनि पाइएन। अब लालाबालालाई के खुवाउने ? पाटनपञ्चेश्वर सडकमा काम गर्ने ६ महिला र ६ पुरुषले तलब नपाउँदा चुल्हो नबल्ने स्थिति आएको हो। यो सडक डिभिजन सडक मातहत हुँदा हामीलाई नियमित तलब आइरहन्थ्यो अहिले प्रदेश सरकार मातहत आएपछि समस्या छौं, लालसिंह ठगुन्नाले भने, हामीलाई मन्त्रीदेखि सांसदसम्मले काम गर्नुहोस व्यवस्था गर्छौं भनेका थिए तर तलब नखाएको ८ महिना भइसक्दासमेत केही पहल भएको छैन। पूर्वाधार विकास कार्यालय बैतडीका प्रमुख जगतप्रसाद जोशीले लेन्थवर्करहरूसँग कुनै सम्झौता नभएको र यो विषयमा मन्त्रालयले पनि केही निर्णय नगरेकाले तलब खुवाउन नसक्ने बताए। उनले भने, पाटनपञ्चेश्वर सडकमा काम गर्ने लेन्थवर्करको विवरण मन्त्रालयमा बुझाएको छु। अहिलेसम्म केही निर्णय भएको छैन। उनीहरूलाई काम नगर्नोस् पनि भनेका थियौं। सम्झौता पनि भएको होइन। साउनदेखि असोजसम्मको तलब पनि सो सडकमा काम गरिरहेको निर्माण कम्पनीमार्फत दिलाएको जोशीले बताए। उनले भने, लेन्थवर्कर राख्ने विषयमा प्रदेश सरकारले पनि केही निर्णय गरेको छैन। तीन महिनाको तलब निर्माण कम्पनीमार्फत मिलाइदिएका थियौं। अब केही गर्न सकिने अवस्था छैन। पाटनपञ्चेश्वर सडकमा अहिले कालोपत्रेको काम भइरहेको छ।"
