शीर्षक,विवरण
'रेड जोन' मै छैन भौतिक दूरी कायम,"महेन्द्रनगर : सरकारले कोरोनाभाइरस महामारीको 'रेड जोन' अर्थात् खतरनाक क्षेत्रका रूपमा सुदूरपश्चिमका चारवटा जिल्ला समेटेको छ। देशभर २९ वटा जिल्लालाई 'रेड जोन' क्षेत्रका रूपमा वर्गीकृत गरिएको छ। कञ्चनपुर, कैलाली, बैतडी र दार्चुला गरी सुदूरपश्चिमका चारवटा जिल्ला रेड जोनमा छन्। तर, रेड जोनमा परेको कञ्चनपुरमा भने सामाजिक दूरी वेवास्ता गरी सामाजिक सुरक्षा भत्ता वितरण भइरहेको छ। स्थानीय प्रशासनले लकडाउनलाई थप कडाइका साथ लागू गरिरहेका बेला मंगलबार बिहान बेदकोट नगरपालिकामा भने वृद्धभत्ता वितरणमा भीडभाड देखियो । वृद्धभत्ता वितरण गर्दा सामाजिक दूरी कायम गरेर वितरण गनुपर्ने भएपनि कञ्चनपुरको बेदकोट नगरपालिका वडा७ मा बाक्लो भीडभाडमा वृद्धभत्ता वितरण गरिएको छ । सेवाग्राहीले भने वडा कार्यालयले व्यवस्थापन नगर्दा समस्या भएको बताएका छन् । 'वडा कार्यालयले लाइनमा दूरी कायम गरी राख्नुपर्ने हो, कसैले नियम नै मान्दैनन,' स्थानीय दिल कुमारी पाण्डेयले भनिन्। वडा कार्यालयले दूरी कायम गरी बस्न भनेपनि सेवाग्राहीले नमानेको जनाएको छ । बेदकोट नगरपालिका७ का वडा अध्यक्ष वीरबहादुर डगौराले सेवाग्राहीलाई दूरी कायम गरी बस्न आग्रह गर्दा नमानेको बताए । 'हामी जनप्रतिनिधि कोही राहत वितरणमा त कोही भत्ता वितरणमा व्यस्त हुँदा व्यवस्थापन गर्न नसकिएको हो,' उनले भने,' सेवाग्राहीलाई दूरी कायम गर्न भन्दा मान्दै मान्दैनन् एक्लै व्यवस्थापन गर्न सकिएन ।' यसअघि भारतको उत्तराखण्डबाट नेपाल आएका बेदकोटका एकजनामा कोरोना संक्रमण देखिएको थियो ।"
सुनसान पश्चिमाञ्चल क्षेत्रीय अस्पताल (फोटो फिचर),"पोखरा : यति बेला विश्व नै कोरोना कहरको मारमा छ। मान्छेबाट मान्छेमा सर्ने कोभिड१९ को संक्रमण नियन्त्रण गर्न युरोप, अमेरिका, एसियाका ठूलासाना प्राय सबै देश लकडाउनमा छन्। नेपाल सरकारले कोरोना संक्रमण नियन्त्रण गर्न चैत ११ गतेदेखि लकडान लगाएको छ। लकडाउनको समयमा अस्पताल नगई नहुने बिरामीबाहेक अन्य बिरामी घरमै औषधि सेवन गरेर बसेका छन्। यति बेला इमर्जेन्सी केही परेमात्र अस्पताल आउन र अन्यथा सामान्य बिरामी अस्पताल नगएकै राम्रो हुने डक्टरले सुजाएका छन्। इमर्जेन्सी सेवा लिन आउने बिरामी, प्रसूति सेवा, डायग्नोसिस गर्नु पर्ने बिरामी भने अस्पताल जाने गरेका छन्। अस्पताल पुग्ने संख्या सामान्य अवस्थाभन्दा निकै न्यून छ। गण्डकी प्रदेशको राजधानी सहर पोखरामा अहिलेसम्म कोरोना भाइरस संक्रमित बिरामी भेटिएका छैनन्। प्रदेशको बागलुङ जिल्लामा दुई जनामा कोरोना सक्रमण देखिए पनि उपचारपछि सञ्चो भएर घर फर्केका छन्। पश्चिमाञ्चल क्षेत्रीय अस्पताल पोखरामा सामान्य अवस्थामा दैनिक १२ सय देखि १५ सय जनासम्म बिरामी उपचार गर्न आउने गरेकोमा त्यो संख्या अहिले घटेर मुस्किलले दुई सय दुई सय पचास जना बिरामी दैनिक उपचारका लागि आउने गरेको अस्पताल प्रशासनले बताएको छ। पछिल्लो समय दैनिक ३०३५ जनाको शल्यक्रियाबाट प्रसूति सेवा भइरहेको पश्चिमाञ्चल क्षेत्रीय अस्पताल पोखराका निर्देशक डा अर्जुन आचार्यले जनाकारी दिए। हप्तामा १ सय १० जना डायग्नोसिस सेवा लिन आउने गरेको पनि अस्पतालका निर्देशक डा आचार्यले बताए। ज्वरो लगायत इमर्जेन्सी सेवा लिन आउने बिरामी पनि फाट्टफुट्ट आउने गरेको कर्मचारीले बताएका छन्। सधै जसो निकै भिडभाड हुने अस्पताल भित्रको टिकट काउन्टर र औषधि लिने कान्ण्टर सुनसान छ। बच्चाबच्ची खेल्ने सुविधासहितको अस्पताल परिसको चौर, सडक पनि सुनसान छ। कुचीकार बिहान सबेरै सरसफाइमा व्यस्त हुन्छन्। भित्र पस्ने गेटअघि सेनिटाइज गर्छन् अर्का कर्मचारीले। दैनिक भिडभाड हुने अस्पतालमा अहिले डेढ दुई सयजना बिरामी पनि नआएकाले सुनसान रहेको सफाइ कर्मचारी मनोज परियारले सुनाए। यति बेला बिरामी निजी अस्पतालको व्यवहारका कारण सरकारी अस्पतालमा नै प्राथामिकतामा पर्ने गरे पनि सरकारी अस्पताल पश्चिमाञ्चल क्षेत्रीय अस्पताल नै सुनसान छ। यति बेला पश्चिमाञ्चल क्षेत्रीय अस्पताल परिसरमा वगमबेली, जाकाराण्डा फूललगायत विभिन्न प्रजातिका पहेला, राता, निलो, प्याजी रङ्का फूलहरु फुलेर सुन्दर देखिएको छ। वसन्त ऋतु यसै त हरियाली अस्पताल परिसबाटै मौसम खुल्दा देखिने माछापुच्छ्रे हिमालले त्यहाँ पुग्ने जोकोहीलाई मोहित बनाउँछ। सवारी साधन नचल्दा बनेको शान्त र धुलोधुवा रहित वातावरणमा चराचुरुंगीको चिरविर आवाजको संगीत सुनिन्छ।"
बैतडीमा दादुरारुबेला खोप अभियान,"बैतडी : जारी लकडाउनका कारण रोकिएको दादुरारुबेला खोप अभियान बैतडीमा फेरी सुरु हुने भएको छ । गत चैत १ देखि १४ गते सम्म सञ्चालन भएको खोप अभियान चैत ११ गतेदेखि लकडाउन हुँदा प्रभावित भएको थियो । जिल्लाका ४ स्थानीय तहमा खोप अभियान प्रभावित भएको र ती स्थानीय तहमा यही वैशाख २६ गतेदेखि सुरु गर्ने तयारी भएको स्वास्थ्य कार्यालयका खोप सुपरभाइजर निरीक्षक हरिश भट्टले जानकारी दिए । जिल्लाको सुर्नया गाउँपालिका, पाटन नगरपालिका, शिवनाथ गाउँपालिका र पञ्चेश्वर गाउँपालिकामा खोप अभियान सञ्चालन हुने भट्टले बताए । उनले भने, 'हामीले यसअघि खोप अभियान प्रभावित भएका क्षेत्रमा पुनः अभियान सञ्चालन गर्न भनेका छौं । प्रदेश स्वास्थ्य निर्देशनालयले खोप अभियान सञ्चालन गर्न निर्देशन दिएकाले हामीले खोप अभियान सञ्चालन नभएका ठाउँमा सञ्चालन गर्दैछौं ।' देशका विभिन्न ठाउँमा दादुरा प्रकोपको रुपमा देखा परेकाले सामाजिक दुरी कायम गर्नुका साथै सुरक्षाका सबै उपाय अपनाएर दादुरारुबेला खोप अभियान सञ्चालन गर्ने तयारी भएको हो । 'देशका विभिन्न ठाउँमा दादुराको प्रकोप देखिएको छ । त्यसैले हामीले दादुरा रोगबाट बालबालिकाहरुलाई बचाउनका लागि खोप अभियानलाई फेरी सञ्चालन गर्ने तयारी गरेको हौं ।' बालबालिकालाई दादुरा रुबेला रोग लाग्नबाट बचाउनका लागि दादुरा रुबेला खोप दिइने गरिन्छ । ९ महिनादेखि ५ वर्ष मुनिका बच्चालाई दादुरा रुबेला खोप लगाइन्छ । बैतडीमा २७ हजार ४२८ बालबालिकालाई दादुरारुबेला खोप लगाउने लक्ष्य रहेको छ ।"
वीरगन्जमा तीन सातापछि पीसीआर मेसिन सञ्चालन,"वीरगन्ज : सरकारले वीरगन्जको नारायणी अस्पतालमा पठाएको पीसीआर मेसिन तीन सातापछि मात्रै सञ्चालनमा आएको छ । प्रदेश सरकारको आग्रहमा राष्ट्रिय जनस्वास्थ्य प्रयोगशालामा प्रयोगमा रहेको पीसीआर मेसिन बैशाख ३ गते नै नारायणी अस्पतालमा पठाइएको थियो । मेसिन सञ्चालनका लागि आवश्यक अन्य महँगा उपकरणहरू सरकारले नपठाएका कारण पीसीआर मेसिन अस्पतालको स्टोर रुममै ३ सातादेखि थन्क्याएर राखिएको थियो । आवश्यक अन्य उपकरण र औजारको जोहो गरेर मेसिन जडान गरि मंगलबारदेखि पीसीआर परीक्षण ल्याब सञ्चालन गरिएको अस्पतालका मेसु डाक्टर मदन उपाध्यायले जानकारी दिए । पहिलो दिन १६ वटा स्वाब अस्पतालको ल्याबमा परीक्षण गरि रिभेरीफिकेसनका लागि काठमाडौं उनले बताए । उनले भने, मेसिनको टेष्टका लागि मंगलबार १६ जनाको स्वाब टेष्ट गरी रिभेरीकेसनका लागि काठमाडौं पठाएका छौं, त्यहाँबाट आउने रिपोर्ट र यहाँको रिपोर्ट मेल खाएपछि मात्रै यहाँको ल्याबबाट नियमित पीसीआर परीक्षण सुरु गर्छौं । पीसीआर मेसिनबाट दैनिक अधिकतम ७० वटा स्वाबको परीक्षण गर्न सकिने डा उपाध्यायले जानकारी दिए । सरकारले बैशाख ३ गते पीसीआर मेसिन मात्रै पठाएको तर त्यसका लागि आवश्यक विभिन्न किसिमका अन्य उपकरण र औजारहरू नपठाएकाले ती सामानको जोहो गर्न समय लागेको अस्पतालले जनाएको छ । यसअघि वीरगन्जमा पीसीआर ल्याब सञ्चालनमा आउन नसक्दा कोरोनाका शंकास्पद र संक्रमितहरूको स्वाब संकलन गरेर पीसीआर परिक्षणका लागि अस्पतालले काठमाडौंमै पठाउने गरेको थियो ।"
गोरखाको चेपाङ बस्तीमा दादुराको महामारी,"गोरखा : गोरखाको गण्डकी गाउँपालिकाको चेपाङबस्तीमा दादुराको महामारी फैलिएको छ। गाउँपालिका६ को ह्विलिङमा तीनजना बालबालिका र वडा नम्बर ७ को क्षेत्रीखोलाका पाँच जना चेपाङ समुदायमा दादुरा फैलिएको हो। वडा नम्बर ६ ह्वीलिङका एकै घरका १२ र नौ वर्षका र अर्को एक घरका आठ वर्षका बालकमा दादुराका बिरामी रहेको स्थानीय बेलु चेपाङले जानकारी दिइन्। त्यस्तै वडा नम्बर ७ क्षेत्रीखोलाका छ महिना, चार, १४, १८ र २९ वर्षका स्थानीय संक्रमित भएको गीता चेपाङले बताइन्। उनीहरुमध्ये ह्विलिङका तीन जनालाई निको भइसकेको बेली चेपाङको भनाइ छ। क्षेत्रीखोलाका चार जनाको अवस्था सामान्य रहेको र एकजना गम्भीर बिरामी रहेको स्थानीय श्रीमाया चेपाङले जानकारी दिइन्। २९ वर्षकी राममाया चेपाङको अवस्था गम्भीर रहेको उनको भनाइ छ। राममाया मेरो नन्द हो। छ दिनदेखि एक सय चार डिग्री भन्दा बढी ज्वारो आइरहेको छ, उनले भनिन्, उच्च ज्वारो आउने, टाउँको दुख्ने, बान्ता आउने, पखाला लाग्ने, घाँटी सुख्खा हुने, दुख्ने भएर सिकिस्त छन्। अरु पनि दुई हप्ताअघिदेखि बिरामी रहेको उनले बताइन्। स्वास्थ्य कार्यालय गोरखाले क्षेत्रीखोलामा दादुराको महामारी फैलिएको जनाएको छ। बेनिघाट रोराङमा दादुराको महामारी फैलिएपछि सीमानामा पर्ने हाम्रो चेपाङबस्तीमा पनि महामारी फैलन सक्छ भनेर हामीले निगरानी गरिरहेका थियौँ, कार्यालयका सूचना अधिकारी राजुरमण न्यौपानेले भने, अब शुक्रबारदेखि त्यहाँ खोप अभियान चलाउँछौं। महामारीको पुष्टि भएपछि आइतबार स्वास्थ्य सेवा विभाग र प्रदेश स्वास्थ्य निर्देशनालयका प्रतिनिधिले गाउँपालिकामा आएका छन्। उनीहरुले महामारी नियन्त्रण गर्ने बारे अभिमुखीकरण कार्यक्रम गरेका गण्डकी गाउँपालिकाकी स्वास्थ्य शाखा प्रमुख बेलिमाया श्रेष्ठले जानकारी दिइन्। गाउँमै स्वास्थ्यकर्मी बसेर सरसफाइ र पोषणको कार्यक्रम गरिरहेको र भिटामिन ए क्याप्सुल खुवाइएको उनले बताइन्। गण्डकी गाउँपालिका ७ क्षेत्रीखोलाका दादुराका बिरामी।"
