शीर्षक,विवरण
आन्तरिक मूल्यांकन गरेर विद्यार्थीलाई एसईई उत्तीर्ण गराउन प्याब्सनको माग,काठमाडौं : कोरोना (कोभिड १९)संक्रमण त्रासका कारण सम्पन्न हुन नसकेका विद्यालय तहको परीक्षा सञ्चालनको सट्टा सम्बन्धित विद्यालयले नै आन्तरिक मूल्यांकन गरेर विद्यार्थी उत्तीर्ण गराउन प्याब्सनले माग गरेको छ । कोरोनाको संक्रमण त्रास कायमै रहेको र कहिले साम्य हुन्छ भन्ने एकिनसमेत नभएको अवस्थामा परीक्षा सञ्चालन गर्ने मिति कुरेर बस्नु उपयुक्त नहुने उसको भनाइ छ । कोरोना त्रासले विद्यालय तह अन्तर्गत माध्यमिक शिक्षा परीक्षा एसईई तथा कक्षा ११ र १२ को परीक्षा सम्पन्न हुन सकेको छैन । केहि स्थानीय तहमा कक्षा ८ को परीक्षा पनि सम्पन्न हुन सकेको छैन । प्याब्सनले मंगलबार जारी गरेको विज्ञप्तिमा एसईईको लागि विद्यालयले आन्तरिक मूल्यांकन गर्ने र सोही मूल्यांकनको आधारमा राष्ट्रिय परीक्षा बोर्डले प्रमाणीकरण गरेर ग्रेड सिट तथा प्रमाणपत्र उपलब्ध गराउनुपर्ने माग गरिएको छ । विश्वका प्रतिष्ठित शैक्षिक संस्थहरुले समेत आन्तरिक मूल्यांकन गरेर विद्यार्थीलाई प्रमणपत्र उपलब्ध गराउने निर्णय गरेकोले नेपालमा पनि सोही अबलम्बन गर्दा उपयुक्त हुने प्याब्सनको दावी छ ।
अवैध मदिरासहित खाद्यान्न बोकेर जीप चलाएपछि,"स्याङ्जा : अवैध मदिरासहित बिल नभएका खाद्यान्न बोकेर स्याङजाबाट पर्वततर्फ जाँदै गरेको जीप प्रहरीले नियन्त्रणमा लिएको छ। मदिरा सहित बिल नभएका दाल, चामल लगायतका खाद्यान्न सामाग्री प्रहरीले पक्राउ गरेको हो। साँझको करिब ९ बजेतिर स्याङ्जाबाट पर्वततर्फ जाँदै गरेको ग २ च ६८६३ नम्बरको जीप अर्जुनचौपारीमा प्रहरीले नियन्त्रणमा लिएको हो। जीप चालकसँग चैत २७ गतेको सवारी पास रहेको जनाइएको छ। पुरानो मितिका पास बोक्दै लकडाउनको उल्लंघन गर्दै रातारात जीप चालक र सहचालकलाई प्रहरीले कारवाही गरेको छ। बिल बिनाको अवैध मदिरा सहितको खाद्यान्न बोकेको जीप पर्वततर्फ जाँदै गरेको छ भन्ने सूचनाका आधारमा प्रहरीले अर्जुनचौपारी गाउँपालिका१ स्थित कच्ची सडकबाट सो जीपलाई नियन्त्रणमा लिएर अनुसन्धान गरेको हो। जीपमा सफर नामको अवैध मदिरा र चामल, दाल, चाउचाउलगायत बिल नभएका खाद्यान्न रहेको र एक लाख ७१ हजार ८ सय ३५ रुपैयाँ मुल्य बराबरका सामान रहेको प्रहरीले जनाएको छ। जीप चालक पर्वत महाशिला गाउँपालिका बस्ने बिनय गुरूङ र उक्त जीपका सहचालक रूपेन्द्र गुरूङलाई आवश्यक कारवाहीको लागि आन्तरिक राजश्व कार्यालय पोखरा पठाईएको प्रहरी उपरीक्षक विमलराज कडेंलले जानकारी दिए।"
संक्रमण फैलिने डरले सामाजिक सुरक्षा भत्ता वितरण रोकियो,"वीरगन्ज : सामाजिक सुरक्षा भत्ताको रकम झिक्न मनियारीका ७७ वर्षीय गजाधर राउत मङगलबार बिहान झरीमा रुझ्दै २ घण्टा पैदल हिँडेर वीरगन्जको कृषि विकास बैंकमा पुगे । तर बैंक पुग्दा भत्ता रकम वितरण रोकिएको जवाफ पाएपछि घर फर्किन लागेका राउतले दुखेसो पोख्दै भने, 'राती चौकीदार(कट्वाल) ले गाउँभरि घुमेर भत्ता लिन बैंक जानु भने, झरीमा रुझ्दै बैंक आइयो, तर हाकिमले अहिले भत्ता पाइँदैन भने बैंकको दैलोबाटै फर्काइदिए।' वीरगन्ज महानगरका लाभग्राहीलाई सोमबारसम्म सामाजिक सुरक्षा भत्ता वितरण गर्दै आएको कृषि विकास बैंकले अचानक सूचना टाँसेर मङगलबारदेखि भने भत्ता वितरण कार्य स्थगीत गरेको छ । तर बैंकको उक्त सूचनाबारे गाउँगाउँमा खबर गरिएको छैन । जसका कारण वीरगन्जको घण्टाघरस्थित बैंकमा भत्ता रकम झिक्न मङगलबार बिहान पुगेका वृद्धवृद्धा, एकल महिला, अपाङगता भएका व्यक्ति निराश हुँदै घर फर्किएका छन्। बैंकबाट भत्ता रकम झिक्न नपाएपछि निराशहुँदै घर फर्किन लागेकी बेलवा गाउँकी एकल महिला निमिया देवीले भनिन्, ' मुखीया (वडाअध्यक्ष ) जी ले नै घर घरमा डुलेर बैंक जानु भनेपछि दुई घण्टा पैदल हिँडेर यो झरीमा रुझ्दै बैंक आए, तर यहाँ आउँदा भत्ता रकम अहिले पाइँदैन भनेर गेटबाटै फर्काइदिए।' कोरोनाको महामारी नियन्त्रण तथा रोकथामका लागि सरकारले लगाएको लकडाउनमा सवारी साधन चलेका छैनन् । जसका कारण वीरगन्ज महानगरको ग्रामीण भेगका वडाका अशक्त वृद्धवृद्धा, एकल महिला, अपाङगता भएका व्यक्तिलाई भने सामाजिक सुरक्षा भत्ता लिन डेढ दुई घण्टा पैदल हिँडेर बैंक धाउनुपर्ने बाध्यता छ । तर बैंकको उक्त सूचनाबारे वडा कार्यालयमा खबर नगरिदिँदा लकडाउनमा गाउँबाट घण्टौं पैदल हिँडेर बैंक पुगेका असशक्त वृद्धवृद्धा, एकल महिला थप सास्ती खेप्न बाध्य भए। जोखिमले भत्ता वितरण रोकिएको हो : बैंक सोमबारसम्म भत्ता रकम वितरण गर्दै आएको घण्टारस्थित कृषि विकास बैंकको शाखाले भीडभाड व्यवस्थापन गर्न नसकिएकाले कोरोनाको संक्रमण फैलने जोखिम रहेको कारण देखाउँदै मङगलबारदेखि भने भत्ता वितरण कार्य स्थगीत गरेको हो । बैंकले टाँस गरेको सूचनामा महानगरपालिका र वडा कार्यालयसँग समन्वय गरी व्यवस्थित रुपमा भाइरस संक्रमणबाट बच्न सुरक्षात्मक उपाय अपनाइ निकट भविष्यमा नै सामाजिक सुरक्षा भत्ता रकम वितरण गरिने जनाइएको छ । बैंकका शाखा प्रबन्धक कोमल प्रसाद सिटौलाले सोमबारसम्म करिब १ हजार ५ सय जनालाई भत्ता वितरण गरिसकिएको र अब करिब ५ हजारलाई वितरण गर्न बाँकी रहेको बताए । अब १२ दिनमै महानगरपालिका र वडा कार्यालयसँग छलफल गरेर भत्ता रकम सकेसम्म लाभग्राहीकै घरमा पुर्याउने विकल्प खोजीने सिटौलाले बताए । वीरगन्ज महानगरपालिकाको ३२ मध्ये ग्रामीण भेगका ११ वटा वडा गरी ज्येष्ठ , दलित ज्येष्ठ , एकल महिला, आंशिक अपाङग, पूर्ण अपाङग र दलित बालबालिका गरी सामाजिक सुरक्षा भत्ताको सुविधा लिने ६ हजार ५ सय भन्दा बढी लाभग्राही छन् । वीरगन्ज महानगरपालिकाले सामाजिक सुरक्षा भत्ताको रकम ,वीरगन्जमा रहेको कृषि विकास बैंकको शाखा कार्यालयमा लक्षित सेवाग्राहीको नाममा खाता खोलेर त्यहि खाता मार्फत चार चार महिनामा उपलब्ध गराउँदै आएको छ । सामाजिक सुरक्षा भत्ताको रकम झिक्न, लक्षित सेवाग्राही आफै बैंकमा पुग्नु पर्ने अनिवार्यता छ । भत्ता नपाउँदा थप मारमा चालु आर्थिक वर्षको दोश्रो चौमासको भत्ता रकम फागुन मै उपलब्ध गराउनु पर्नेमा महानगर र बैंकले लकडाउनका कारण देखाउँदै २ महिना ढिला गरी बाड्न थालेका थिए। तर त्यो पनि मङगलबारदेखि अनिश्चितकालसम्मका लागि रोकिएपछि अशक्त वृद्धवृद्धा, एकल महिला, अपाङगता भएका थप मारमा परेका छन्। मङगलबार बिहान बैंकबाट रित्तै हात फर्किएकी घुर्मीकी वृद्धा शान्ति देवीले भनिन्, 'दुइ महिनादेखि छोराको कमाइ धन्दा बन्द छ , यहि भत्ताको आश थियो, अब यो पनि कहिलेदेखि कहाँबाट बाँड्छ त्यो ठेगान छैन।' महानगरलाई बैंकले खबर गरेको छैन : मेयर सरावगी वीरगन्ज महानगरका नगर प्रमुख विजय सरावगीले भने भत्ता वितरण कार्य रोकिएको विषयमा बैंकले महानगरलाई कुनै जानकारी नदिएको बताए । महानगरलाइ कुनै जानकारी गराइएको छैन, उनले भने, 'अर्को कुरा भत्ता वितरण रोक्ने कानुनी अधिकार पनि बैंकलाई छैन , म यस विषयमा बैंकका जिम्मेवारी कर्मचारीसँग कुरा गर्छु।' भीड व्यवस्थापनका लागि बैंकलाई सहयोग चाहिए महानगर प्रहरी खटाउन आफू तयार रहेको उनले बताए । लागग्राहीको घर घरमै भत्ता रकम पुयाउने व्यवस्था मिलाउन आफूले बैंकलाई सुझाव दिइसकेको पनि उनले बताए ।"
"एम्बुलेन्सको ठक्करबाट प्रहरी हवल्दारको मृत्यु, अर्का एक घाइते",धनगढी : पूर्वपश्चिम महेन्द्र राजमार्गमा एम्बुलेन्स र मोटरसाइकल ठोक्किँदा एकजनाको मृत्यु भएको छ भने एकजना घाइते भएका छन्। मृत्यु हुनेमा सशस्त्र प्रहरी बेस क्याम्प पहलमानपुरमा कार्यरत सहायक हवल्दार ३५ वर्षीय गोरख ऐर रहेको प्रहरीले जानकारी दिएको छ । पूर्वपश्चिम राजमार्गअन्तरगत कैलालीको गौरीगंगा नगरपालिका९ शंकरपुरमा एम्बुलेन्स र मोटरसाइकल ठोक्किँदा मोटरसाइकलमा सवार हवल्दारको मृत्यु भएको जिल्ला प्रहरी कार्यालय कैलालीका प्रहरी नायव उपरीक्षक दक्षकुमार बस्नेतले जानकारी दिए । पश्चिमबाट पूर्वतर्फ गइरहेको ओमसाइ अस्पतालको से १ च १८२८ नम्बरको एम्बुलेन्स र पूर्वबाट पश्चिमतर्फ आइरहेको म २ प ५३०३ नम्बरको मोटरसाइकल आपसमा ठोक्किएको प्रहरीले जनाएको छ । मोटरसाइकल चालक घोडाघोडी नगरपालिका वडा नम्बर १० का २८ वर्षीय भरत बोहरा भने घाइते भएका छन्। एम्बुलेन्स चालक धनगढी उपमहानगरपालिका वडा नम्वर १० का ५४ वर्षीय आशाराम चौधरीलाई इलाका प्रहरी कार्यालय सुखडले नियन्त्रणमा लिएको छ ।
लकडाउनमा गाउँ फर्किएका युवा विकास निर्माणमा जुटे,"बेनी : कोरोना (भाइरस) रोकथामका लागि गरिएको लकडाउनपछि गाउँमा गएका युवाहरु श्रमदान र विकास निर्माणमा जुटेका छन् । लकडाउनपछि सहरी क्षेत्रबाट गाउँमा पुगेका फुर्सदीला युवाहरु सडक निर्माण, स्तरोन्नति, सिचाइ, भवन, खानेपानी, खेलमैदान निर्माण लगायत विकास निर्माणका काममा जुटेका हुन् । रघुगंगा गाउपालिका २ भगवतिको पखटोलमा काठमाडौं, पोखरा र बेनीलगायतका सहरबाट आएका युवाहरुले श्रमदान गरेर एक किलोमिटर सडक खनेका हुन् । बाक्लो बस्तीभित्र सवारी साधनलाई आवातजावत गर्न मिल्ने सडक बनाउन श्रमदान गरेका स्थानीय निर्मल केसीले बताए । अर्जुन खत्रीको संयोजकत्वमा दैनिक दशजना युवाहरुले घरायसी र खेतबारीको कामबाट बचेको समयमा सडकमा श्रमदान गरेका थिए । 'फुर्सदलाई सदुपयोग गरेर सडक बनाएका हौं, 'खत्रीले भने, 'बस्तीभित्र एम्बुलेन्स, जीप पुग्न सक्ने सडक भयो भने सबैलाई सुविधा पुग्छ ।त्यही भएर सबै दाजुभाइ मिलेर काम गरिरहेका छौं।' भगवतिका वडा अध्यक्ष रिमबहादुर कटुवालले युवाहरुलाई विकासका काममा परिचालन गर्दा उनीहरुको विकास योजनाप्रति अपनत्व हुने र विकृतिबाट टाढा राख्न सहयोग पुग्ने बताए । युवाहरुले सुरु गरेको सडक निर्माणलाई पूर्णता दिन आगामी वर्षको बजेटमा प्राथमिकता दिने उनले बताए । म्याग्दीको अन्य ठाउँमा पनि लकडाउनपछि गाउँमा पुगेका युवाहरुले स्थानीय तहले बजेट बिनियोजन गरेका सडक, खानेपानी, भवन लगायत विकास निर्माणको कामको नेतृत्व गरेका छन् । बेनीमा बस्दै आएका बेनी१० पात्लेखेतका समिर रोकाले लकडाउनपछि गाउँ गएको समयमा उपभोक्ता समितिको नेतृत्व गरेर नेपाने देखि धैरेनी टोल जोड्ने सडक निर्माण गरेका छन् ।'डोजर र स्थानीय जनशक्ति परिचालन गरेर सडक खनेका हौ,' उनले भने, 'लकडाउनका बीच गाउँमा सडक पुर्याउँदा खुसी भएका छौं।' नेपानेदेखि धैरेनी टोल जोड्ने सडक दुई किलोमिटर छ । २२ घरधुरी लाभान्वित भएका छन् । माइक्रोबस, जीप, ट्याक्टर, मोटरसाइकललगायतका सवारी साधन चलाउन सकिने भएको छ । सडक पाँच मिटर फराकीलो छ । बेनी नगरपालिकाले चार लाख रुपैयाँ बिनियोजन गरेको सडक निर्माणमा उपभोक्ताले एक लाख रुपैयाँ बराबरको श्रमदान गरेका थिए । यसैगरी लकडाउनकै बीच अन्नपूर्ण गाउँपालिका५ शिखको तल्लो गाउँदेखि घिर्वाङ जोड्ने २५ किलोमिटर सडक निर्माण भएको छ । स्थानीय स्तरमा उपलब्ध उपकरण (डोजर र मजदुर) परिचालन गरेर सडक निर्माण गरेको उपभोक्ता समितिका अध्यक्ष भविन्द्र गुरुङले जानकारी दिए । 'यही भएको डोजर र मजदुरलाई सामाजिक दुरी कायम गरेर सतर्कता अपनाएर सडक खनेका हौं,' उनले भने, 'विकास पनि भयो, मजदुरहरुले रोजगारी पनि पाए।' सडकको चौडाई ४५ मिटर छ । १५ लाख ७१ हजार ८७० को लागतमा सडक निर्माण भएको उपभोक्ता समितिले जनाएको छ । अन्नपूर्ण गाउपालिकाले आठ लाख २५ हजार रुपैयाँ बिनियोजन गरेको सडक निर्माणमा स्थानीय स्रोत र नगद समेत परिचालन भएको वडा अध्यक्ष दिनेश तिलीजाले बताए । तल्लो शिखबाट चार लाख, पाउद्धारबाट एक लाख, शिख देउरालीबाट पचास हजार र किन्दुबाट पचास हजार आर्थिक सहयोग संकलन भएको थियो । उपभोक्ताले एक लाख ४६ हजार ८७० बराबरको श्रमदान गरेका छन् । सडक निर्माण भएपछि शिख, किन्दु, झारवाङका १३० घरधुरीका ५०० जनसंख्या लाभान्वित भएका छ । आवत जावत, निर्माण र खाद्यान्न सामग्री ढुवानी तथा आलु, तरकारीलगायत कृषि उपज निकासीमा सहज भएको छ ।"
