शीर्षक,विवरण
विपतको पूर्वसंकेत,"कोरोना भाइरस (कोभिड१९) ले आज सारा विश्व आक्रान्त छ। विश्वकै अर्थतन्त्रमा नकारात्मक असर पर्ने तथ्यहरू सार्वजनिक भइसकेका छन्। अझ नेपालजस्तो गरिब र मध्यमस्तरको राष्ट्रमा समेत दरिन नसकेको मुलुकका लागि कोरोनाको कहर पीडादायी भइरहेको छ। आगामी दिनमा सोचेकोभन्दा पृथक् अप्ठेरो परिस्थिति उत्पन्न हुँदैछ। नेपालको अर्थतन्त्र मूलतः वैदेशिक रोजगारीबाट प्राप्त हुने विप्रेषण अर्थात् रेमिट्यान्समा अडेको छ। कुल गार्हस्थ्य उत्पादन (जीडीपी) को योगदान २७ प्रतिशत भएबाट हामी कति परनिर्भर छौं भन्ने यही तथ्यांकले पुष्टि गर्छ। छिमेकी भारतबाहेक नै ४० लाख बढी युवायुवती रोजगारीका लागि विश्वभर छरिएका छन्। खाडी राष्ट्र र मलेसियामा मात्र १५ लाखभन्दा बढी नेपाली छन्। औपचारिक (११० मुलुक) तथा अनौपचारिक (एक सय) गरेर दुई सयभन्दा बढी मुलुकमा विभिन्न माध्यमबाट रोजगारीका लागि गएका छन्। अधिकांश अदक्ष तथा अर्धदक्ष प्रकृतिका छन्। एकातिर स्वदेशकै अर्थतन्त्र चौपट छ, त्यसमाथि कोरोनाका कारण नागरिकको जीउज्यान नै जोखिममा। अहिले अर्थतन्त्रभन्दा व्यक्तिको ज्यान ठूलो हुन गएको छ। यस्तो अवस्थामा वैदेशिक रोजगारमा रहेका नेपाली युवा धमाधम फिर्ता गर्ने सुरुवात् कुवेतबाट भएको छ। अब नेपालीले स्वदेश फर्कन पाउनुपर्छ, त्यो उनीहरूको अधिकार हो। यद्यपि, कोरोनाले विश्व नै लकडाउन भइरहेका बेला फर्काइन लागिएका ती नेपाली कति सुरक्षित छन्, तिनीहरू फर्केपछि क्वारेन्टाइनको व्यवस्थापन कसरी गर्ने, अरूलाई संक्रमणबाट कसरी जोगाउने जस्ता पिरलो आइलागेको छ। रोजगारदाता मुलुकले कोभिड१९ का कारण कामदार फर्काउने प्रक्रिया अघि बढाएपछि सरकार बिउँझेको छ। यद्यपि फर्केर आएकाहरूलाई सुरक्षित कसरी राख्ने र अरूलाई संक्रमण हुन नदिन उचित बन्दोबस्ती सबैभन्दा ठूलो चुनौती सरकारसामु छ। कुवेतले त आकर्षक प्याकेज घोषणा गरेर हार्दिकताका साथ कामदारलाई आफ्नै मुलुक लगिदिने जनाउ दिएको छ। करिब तीन हजार नेपालीलाई ४५ दिनभित्र काठमाडौं ओरालिदिने भएको छ। कुवेत मात्र होइन अन्य मुलुकले पनि यस्तै प्रक्रिया अपनाउनेछन्। कुवेतले त नेपालसम्म ल्याइदिने भनेको छ। अन्य देशले त्यसो नगरी उनीहरूको विमानस्थलसम्म लगिदिनेछन्। पहिलो चरणमा ती मुलकले भिसा नभएकाहरूलाई नै फर्काउने हुन्। आधारभूत ज्ञान, सीप नलिई गैरकानुनी तबरबाट वैदेशिक रोजगारीमा जानेहरू नै पहिलो चरणको मारमा पर्नेछन्। तिनीहरूमा आश्रितपरिवार के होलान् ? हिजो विदेशमा अलपत्र नेपालीलाई स्वदेश फर्काउन ठाडै अस्वीकार गरेको सरकारले कुवेतको जनाउलाई अब के गर्छ ? विदेशमा काम गर्न जान बाध्य पार्ने सरकारको सोच, नीति, कार्यशैली र नियत नै अहिलेको अवस्थाका जड हुन्। राज्यले गरेको हिंसाको अर्काे रूप हो वैदेशिक रोजगारीमा जानुपर्ने बाध्यता। सुशासन कायम गरेको भए, लगानीमैत्री वातावरण र नीति बनाएको भए, उद्योग स्थापना गर्न घुस दिननपर्ने स्थिति भएको भए यहाँ कामको दुःख हुने थिएन। घरपरिवारबाट अलग रही कडा शारीरिक परि श्रम गरेर पठाएको पैसाको न सदुपयोग भयो न त राज्यले त्यसबाट केही पाठ नै सिक्यो। अब नआउनु विपत्ति आइसकेको छ। फिर्ता आउने नेपालीको उचित व्यवस्थापन कसरी गर्ने भन्ने मूल ध्येयबाट सरकार पछि हट्नु हुँदैन। उनीहरू आइहालेमा रोग संक्रमण हुन नदिने बन्दोबस्ती सरकारले गर्नैपर्छ। नत्र विदेशबाट फर्केको एउटा संक्रमितले समुदायमै कोरोना पैलाइसकेको छ र मुलुक तेस्रो चरणउन्मुख भएको छ। यो जटिल परिस्थितिमा सरकारले राजनीतिक दल, सरकारी संयन्त्र र आम नागरिकको समेत सहयोग लिई तयारी अवस्थामा रहनुको विकल्प छैन।"
विदेशमा रहेका नेपालीलाई प्राथमिकताका आधारमा फर्काइने,"काठमाडौँ : सरकारले विदेशमा रहेका नेपालीलाई प्राथमिकताका आधारमा स्वदेश फर्काउने तयारी गरेको छ। कोरोना संक्रमित मुलुकसहित सबैतर्फबाट नेपालीलाई ल्याउनु पर्ने भएकाले सरकार क्वरेन्टाइनको ब्यवस्थापनमा जुटेको छ। हजारौंको संख्याका नेपाली फर्कने इच्छा गरेकोले सबै प्रदेशमा ठूलो संख्यामा क्वारेन्टाइन ब्यवस्थापन गर्नु पर्ने देखिएको छ। कुवेतले करिब तीन हजार नेपालीलाई काठमाडौं ल्याउन लागेपछि उनीहरूको ब्यवस्थापनका विषयमा सरकारले छलफल चलाएको छ। कुवेतले नेपाली फर्काउन प्रक्रिया अघि बढाए लगत्तै साउदी अरब र युनाईटेड अरब इमिरेट्स (युएई) ले पनि आममाफी कार्यक्रम ल्याएका छन्। तत्काल फिर्ता प्रक्रियाका लागि उनीहरू त्यतातर्फ अग्रसर भएका हुन्। अवैध कामदार फर्काउन युएईले यसअघि नै सूचना जारी गरेको थियो। सबै मुलुकबाट नेपालीलाई स्वदेश ल्याउनु पर्ने अवस्था बनेपछि ब्यवस्थापनका लागि अर्थ, उद्योग, श्रम, स्वास्थ्य र पर्यटन मन्त्रालयले छलफल थालेका छन्। हामी सुरक्षित रूपमा ल्याएर उनीहरूलाई क्वारेन्टाइनमा राखेर गाउँसम्म पुर्याउने गरी अन्तर मन्त्रालय छलफल अघि बढेको छ परराष्ट्रमन्त्री प्रदीप ज्ञवालीले भने, फर्काउने तय नहुँदासम्म जहाँ कार्यरत त्यही मुलुकमा सुरक्षित रूपमा बस्नका लागि व्यवस्था मिलाइएको छ। राष्ट्र एवं सरकार प्रमुख तह र आफूले समते सकमक्षीसँग टेलिफोन गरी त्यस्तो ब्यवस्था मिलाइएको उनले बताए। विदेशमा रहेका नेपालीको रेखदेख गर्ने जिम्मेवारी सम्बन्धित मुलुककै हो। उनीहरूलाई नेपाल ल्याएपछि कहाँ र कसरी राख्ने भन्नेमा समस्या रहेको उनले बताए। अन्तरमन्त्रालय छलफलमा मतभेद पनि भएको बैठकमा सहभागीले बताए। स्थानीय तह, प्रदेश वा संघ कहाँ राख्ने भन्नेमा उनीहरूबीच विवाद रहेको एक अधिकारीले बताए। ठूलो स्रोतको उपयोग हुने हुँदा त्यसमा सबैको आँखा गएकाले पनि समस्या उत्पन्न भएको एक अधिकारीले बताए। उपचार गर्न गएका र घुम्न गएका नेपाली पनि अन्तर्राष्ट्रिय उडान नहुँदा अन्यौलमा छन्। विदेशी मुलुकले नेपालबाट आफ्ना नागरिक धमाधम फिर्ता लग्गा पनि सरकारले आफ्ना नागरिक ल्याउने विषयमा ध्यान नदिएको गुनासो विदेश स्थित नेपाली दूतावासमा कार्यरत कूटनीतिक अधिकारीको छ। ती दूतावासहरूले नेपालीलाई फर्काउने विषयमा परराष्ट्र मन्त्रालयलाई लिखित जानकारी गराइसकेका थिए। तर, अझै निर्णय नहुँदा विदेशमा रहेका नेपालीलाई उत्तर दिन नसकेको गुनासो उनीहरूको छ। कुवेत सरकारले फर्काउने तयारी अघि बढाइसकेको छ तर सरकारले यहाँबाट कुनै सिग्नल दूतावासलाई दिएको छैन, एक अधिकारीले भने। विदेशबाट ल्याइने हजारौंलाई कसरी ब्यवस्थापन गर्ने भन्नेमा अन्यौल छ। नेपालीलाई प्राथमिकताका आधारमा फिर्ता ल्याउने छौं। व्यवस्थापनका लागि सरकारले योजना बनाइरहेको छ परराष्ट्रमन्त्री ज्ञवालीले भने, स्थानीय तह, प्रदेश र संघ कहाँ कसरी कसरी राख्ने भन्ने विषयमा तय भएपछि फर्काइनेछ। विश्वका दुई सय भन्दा बढी मुलुकमा नेपाली छन्। अधिकांश नेपाली युवा मलेसिया, कतार, साउदी अरब, युएई, कुवेत, बरहराइन, ओमन, लेबनन, इजरायल, अफगानिस्तान, जापान, दक्षिण कोरिया लगायतमा बस्छन्। सन् १९८५ वैदेशिक रोजगारी ऐन आएपछि नेपाली भारत बाहेकका मुलुकमा जाने क्रम सुरु भएपनि सन १९९० पछि बढी विदेसिएका हुन्।"
कोसीमा भारतले काम थाल्दा विरोध,"राजविराज : नेपालभारत सीमानाका बन्द रहेका बेला सयौं संख्यामा भारतीय नेपाल आएर कोसी बाँधमा काम गर्न थालेका छन्। कोसी बाँधको काम सुरु भएसँगै सप्तरीको हनुमाननगर कंकालनी नगरपालिका१२ का बासिन्दा विरोधमा उत्रिएका छन्। स्वास्थ्य र सुरक्षाका कुनै पनि मापदण्ड पूरा नगरी भारतीय र अन्यत्र जिल्लाका मजदुर ल्याएर कोरोना भित्र्याउन खोजेको भन्दै उनीहरूले सडक अवरुद्ध पारे। हनुमाननगर कंकालिनी नगरपालिका१२ का मो साबिरले भने, हामीले आफ्नै ठाउँमा सीप प्रयोग गर्न पाएका छैनाँै, बालबालिका भोकै छन् तर सीमापारिबाट हुल बाँधेर आएका भारतीय काम गरिरहेका छन्। कोरोनाको भयले आवतजावत गर्ने डुंगासमेत बन्द गरिँदा माछा मार्ने काम ठप्प भएको जनाउँदै उनले बाँधको स्पर मर्मतका लागि भारतीय मजदुर ल्याएर कोरोना भित्र्याइरहेको आरोप लगाए। कोरोना संक्रमण नियन्त्रण तथा रोकथामका निम्ति अपनाउनुपर्ने सामान्य सतर्कतासमेत नअपनाई भारतीय ठेकेदारले काम गरिरहेकोे भन्दै स्थानीय सूर्यनारायण मण्डलले विरोध जनाए। कोसी बाँधको पूर्वतर्फ मर्मतका लागि कर्मचारी तथा मजदुर भारततर्फबाट आई मर्मत गर्नगराउन सहजीकरणका लागि भारतीय पक्षले वैशाख ६ गते अनुरोध गरेको थियो। जिल्ला प्रशासन कार्यालयले गृह मन्त्रालयको सर्त पालना गर्नेगराउने व्यवस्था मिलाई मर्मत गर्न अनुमति दिएपछि बाँधको काम सुरु भएको हो। कोसी योजना विराटनगरका सम्पर्क सह भूअर्जन कार्यालयले समेत सर्तहरू पालना गरेर मात्र काम गर्न बाँध नियन्त्रण एवं जल निस्सरण जल संसाधन विभाग वीरपुरलाई वैशाख १३ गते शनिबार पत्राचार गरेको छ। अनुमति पत्रमा नेपाल प्रवेश अगाडि संक्रमित नभएको प्रमाण पेस गर्नुपर्ने, नेपाल प्रवेशपछि स्वास्थ्य जाँच गर्नुपर्ने, मजदुर र कर्मचारीले सामाजिक दूरी कायम गर्ने, अलग क्याम्पमा बस्नुपर्ने र स्वास्थ्य तथा जनसंख्या मन्त्रालयले तय गरेको स्वास्थ्यसम्बन्धी मापदण्ड पालन गर्नुपर्ने उल्लेख छ। सुपरभाइजरसहितको केही प्राविधिक कर्मचारी भारतीय रहे पनि मजदुरहरू नेपाली नै राख्नुपर्ने गरी अनुमति दिएको जानकारी दिँदै सप्तरीका सीडीओ सुनील खनालले कामको सम्पूर्ण विवरणसहित कागजात सम्पर्क सह भूअर्जन अधिकृत सन्तोषकुमार चोङवाङसँग माग गरिएको बताए। चोङवाङले वर्षा आउनुअघि नै काम नभएमा बाढीले दुःख दिन सक्ने भएकाले नेपाली मजदुरबाटै काम गराउने गरी सीमित भारतीय प्राविधिक मात्र आउन पाउने सर्तमा सतर्कतासाथ काम गर्न अनुमति दिएको बताए। स्थानीय भने भारतबाट कर्मचारी र मजदुर आएर काम गराउँदा स्वास्थ्य जाँच र लकडाउनको सामान्य नियमसमेत पालना नभएको बताउँछन्। सामाजिक दूरीसमेत कायम नगरी हुल बाँधेर मर्मत गर्न थालिएको राहुल मण्डलको आरोप छ। महामारी फैलिरहेका बेला स्पर मर्मत कार्यमा लकडाउनको सामान्य नियमसमेत पालना नगरी हुलका हुल मजदुर दैनिक रूपमा ल्याएर काम गराउनु डरलाग्दो भएको स्थानीय बासिन्दासमेत रहेका पूर्व उपसभामुख गंगाप्रसाद यादवले बताए। भारतको सीमावर्ती जिल्लामा धमाधम कोरोना संक्रमित पुष्टि भइरहेको र सीमा जोडिएको भारत बिहारमा संक्रमितको संख्या बढिरहेको अवस्थामा त्यहाँबाट कर्मचारी र मजदुर ल्याएर काम गर्नु गम्भीर गल्ती हुने उनको भनाइ छ। वडा कार्यालयसँग कुनै समन्वय छैन, वडाध्यक्ष रामदेव मुखियाले भने, बाढी नियन्त्रणका लागि कोसी बाँधको स्पर मर्मत आवश्यक भए पनि स्थानीय गरिबको डुंगामा ताला लगाएर अरूबाट काम गराउनु गलत हो। पचासौं मजदुरलाई सामाजिक दूरी कायम गरेर काम गराउने अवस्था नदेखिएको भन्दै स्थानीय महिला, बालबालिका समेतले सडक नै अवरुद्ध गरेको इलाका प्रहरी कार्यालय हनुमाननगर इन्स्पेक्टर कमलकुमार लुंगेलीले जानकारी दिए। भारतीय ल्याएर काम गराउनु गलत भएको भन्दै मानिक मुखियाले कोरोनाले निम्त्याएको महामारी नियन्त्रण गर्न सीमामा थप कडाइ गर्नुपर्ने बताए।"
