शीर्षक,विवरण
बालेनलाई डिलाको प्रश्न : सडकमा सानो व्यापार गर्नेलाई डन्डा अनि निर्जिव सालिकमा पैसा ?,"काठमाडौं : नेपाली कांग्रेसकी केन्द्रीय सदस्य डिला संग्रौला पन्तले र्याप गायक यम बुद्धको सालिक निर्माण गर्ने काठमाडौं महानगरपालिकाका मेयर बालेन्द्र शाहको निर्णयको आलोचना गरेकी छन्। सुरुमा महानगरको बजेटबाट १५ लाख छुट्टयाएका मेयर शाहले चौतर्फी आलोचनापछि आफ्नै तलबबाट सालिक निर्माण गर्ने घोषणा गरेका थिए। यो घोषणालाई अपरिपक्व भन्दै आलोचना भइरहेका बेला डिलाले फेसबुकमार्फत जनताको पसिनाबाट जम्मा भएको पैसाले सालिक बनायनु राज्यकोषको दुरुपयोग भएको जिकिर गरेकी हुन्। ब्यक्तिका नाममा सालिक, पार्क, गेट स्मृति र प्रतिष्ठानका लागि जनताको पसिनाबाट जम्मा भएको राज्यकोष दुरुपयोग गरिनु ठिक होइन। फेरि आफ्नै तलबबाट बनाउँछु भन्नु पनि उचित देख्दिनँ, उनले भनेकी छन्। उनले सालिक बनाउने पैसा पैसा गरीब, असहायको आय आर्जनमा जोड्न सुझाएकी छन्। उनले केही अघि मकै पोल्ने दम्पतीलाई महानगरका प्रहरीले गरेको लछार पछार घटना सम्झिदै प्रश्न गरेकी छन्, सडकमा सानो ब्यापार गर्नेलाइ डन्डा, अनि निर्जिव सालिक निर्माणमा पैसा? यो कस्तो नीति ?"
राष्ट्रपति भण्डारीद्वारा आबेको हत्याप्रति खेद प्रकट,काठमाडौं : राष्ट्रपति विद्यादेवी भण्डारीले जापानका पूर्वप्रधानमन्त्रीको हत्या भएकामा खेद प्रकट गरेकी छन्। राष्ट्रपति भण्डारीले आज ट्वीट गरी आबेप्रति भावपूर्ण श्रद्धाञ्जलि प्रकट गरेकी हुन्। यस दुःखद् घडीमा उनले मैत्रीपूर्ण जापानी जनता र स्वर्गीय आबेको परिवारजनमा समवेदनसमेत प्रकट गरिन्। आबेको शुक्रबार चुनावी सभामा भाषण गरिरहेका बेला गोली हानी हत्या भएको थियो। यस दुःखद् घडीमा आज नेपाल सरकारले पनि देशभर शोक मनाउने निर्णय गरेको थियो।
वारागुङ मुक्ति क्षेत्रमा सँस्कृति झल्किने तीन महिलाको प्रतिमा,"जोमसोम : धार्मिक कलासँस्कृति, भेषभूषा र मौलिकताले मुस्ताङको वारागुङ मुक्तिक्षेत्र गाउँपालिका निकै प्रसिद्ध गाउँपालिका हो। वारागुङ मुक्तिक्षेत्र गाउँपालिकाको ५ वटै वडाहरुमा १९ वटा गाउँ छन्। सबै गाउँहरुमा गुरुङ समुदायको बसोबास छ। सबै गाउँमा ऐतिहाँसिक, धार्मिक र साँस्कृतिक मान्यताअनुसार आफ्नो विभिन्न चाडपर्व, जन्म र मृत्यु, पूजापाठ र शुभकार्य लगायतमा धार्मिक कलासँस्कृति र भेषभुषा प्रस्फुटन गरिने गरेको पाइन्छ। संघीयतापछिको पहिलो कार्यकालमा वारागुङ मुक्ति क्षेत्र गाउँपालिकाको पूर्वअध्यक्ष बनेका फेञ्चोक छेप्तेन गुरुङले आफ्नो पालिका भवन धार्मिक मान्यताअनुसार तिब्बती शैलीमा निर्माण गरे। वारागुङ मुक्तिक्षेत्रको पालिका भवन पर्यटकीय दृष्टिकोणले पनि आफैंमा महत्वपूर्ण मानिन्छ। कागबेनीदेखि मुक्तिनाथ जाने मुख्य सडककै नजिक वारागुङ मुक्ति क्षेत्रको कलात्मक प्रशासकीय भवन निर्माण सम्पन्न भएको थियो। जहाँ पुग्दा धार्मिक पर्यटक सो प्रशासकीय भवन हेर्न लालायित हुन्छन्। स्थानीय तहको पहिलो कार्यकाल सकिने अन्तिम वर्षमा वारागुङ मुक्ति क्षेत्रका पूर्व अध्यक्ष फेञ्चोक छेप्तेनले फेरि मुक्तिनाथ र उपल्लो मुस्ताङ जाने पर्यटकका लागि वारागुङको पहिचान झल्किने साँस्कृतिक स्वागत प्रतिमा निर्माणको काम अघि बढाए। अहिले सो प्रतिमा निर्माणको ९० प्रतिशत काम सम्पन्न भइसकेको छ। पूर्व अध्यक्ष गुरुङकै परिकल्पना बमोजिम वारागुङ५ र १ वडा जोड्ने पालिकाको सीमाना पान्डाखोलाको सडक किनारामा सँस्कृति झल्किने स्वागत प्रतिमा निर्माण गरिएको हो। जुन स्थान दक्षिणतर्फ घरपझोङ गाउँपालिकाको सीमाना पर्छ। पोखराबाट बेनी हुँदै मुक्तिनाथ र लोमान्थाङ जाने पर्यटकलाई स्वागत गर्न वारागुङ मुक्तिक्षेत्र गाउँपालिका धार्मिक तथा साँस्कृतिक स्वागत प्रतिमा निर्माण गरेको हो। जोमसोम कटेर जब पर्यटक उकालो उक्लिन्छन् अनि देख्न पाइन्छ पर्यटक लोभ्याउन वारागुङ मुक्तिक्षेत्रको आर्कषक स्वागत प्रतिमा। वारागुङले निर्माण गरेको स्वागत प्रतिमाले त्यहाको साँस्कृतिक भेषभुषा र जीवनशैलीलाई उजागर गरिदिएको पाइन्छ। स्वागत प्रतिमामा ३ जना महिलालाई साँस्कृतिक रुपले जीवन्तरुपमा उभ्याइएको छ। बाह्र गाउँले समुदायले हरेक शुभकार्य, विवाह ब्रतबन्ध, पूजाआजा र अतिथि सत्कारका लागि यसप्रकार धार्मिक सँस्कृतिलाई जिवन्त रुपमा प्रस्तुत गर्ने गर्छन्। कंक्रिट, ढुंगा र माटोलगायतका सामाग्रीले निर्माण गरिएको प्रतिमा सजाइएका ३ महिलाको शिरमा नागको स्वरुप झल्किने गरी स्ह्युले लगाएको देख्न सकिन्छ। ३ महिलाको कानमा सुनको रिङ (आलोङ) लगाएका छन्। बाह्रगुङ सँस्कृतिअनुसार ३ महिलाहरुको घाँटीमा लगाउने ( झ्युरु स्ही ) पहिराइएको छ। यसका अलावा महिलाको घाँटीमा लगाउने बहुमुल्य मुवा ( सुम्ज्यु),चोली ( हङ्च्यु) ,शरीरमा लगाउने पछ्यौरा ( स्हेन्भुरे ), छातीमा लगाउने चाँदीको धिक्रा हुक, ढाँडमा बाँध्ने पटुकी (काउ ठिङ्मा, नाम्वा ढुक्पा (किटी),बख्खु (ग्वे) र खुट्टामा लगाउने धोजा जुत्ता (स्होम्बा स्याङजेन)लगायतको भेषभुष प्रस्फुटन हुनेगरी प्रतिमा निर्माण गरिएको हो। अतिथि देव भव भन्ने उक्ति झैँ वारागुङले ३ महिलाको स्वागत प्रतिमा राखेर पर्यटकको सत्कार झल्काएको हो। तीन महिलाहरुमध्ये २ जनाले क्ष्याप्का केरा अर्थात् ठेकी लिएका छन् भने १ महिलाको हातमा चोखोपानी र फुल राख्ने कचौरा (याङ्जी)लिएको देख्न सकिन्छ। वारागुङ मुक्ति क्षेत्रको १९ वटै गाउँहरुमा गाउ समाजले यस्तै आतिथ्यता र सत्कारका लागि ३ जना महिला चुनेर जिम्मेवारी दिने परम्परा रहेको पूर्व गापा अध्यक्ष फेञ्चोक छेप्तेन गुरुङले जानकारी दिए। समाजका सबै असलकार्यहरुमा चुनिएका महिलाले शुभकार्यका लागि सम्मान प्रकट गर्छन् र त्यसपछि काम सुरु गर्ने चलन रहेको पूर्वअध्यक्ष गुरुङले उल्लेख गरे। जोमसोम र कागबेनी प्रवेश गर्ने सीमाक्षेत्रमा निर्माण गरिएको स्वागत प्रतिमाको आर्टिस गर्ने जिम्मा सो पालिका निवासी कुङ्गा गुरुङ लगायतको टोलीले तयार गरेको गाउँपालिकाका प्रमुख प्रशासकीय अधिकृत जितबहादुर रानाले जानकारी दिए। गाउँपालिकाको चालु आर्थिक वर्ष विनियोजन भएको १० लाख बजेटले प्रतिमा निर्माण गरिएको प्रशासकीय अधिकृत रानाले उल्लेख गरे। प्रतिमा झन्डै १ महिना लगाएर निर्माण गरिएको उनको भनाइ छ। धार्मिक कलासँस्कृति, सम्पदा र मौलिकताको संरक्षण तथा सम्बर्द्धन गर्दै दीगो पर्यटन विकासमा योगदान रहनेगरी पालिकाले प्रतिमालगायतका पूर्वाधार निर्माण गरेको प्रशासकीय अधिकृत रानाले बताए।"
पछिल्लो तीन महिनामा विपद्जन्य घटनामा ११८ जनाको मृत्यु,"काठमाडौं : गएको वैशाखयता विपद्जन्य घटनामा ११८ जनाको मृत्यु भएको छ। राष्ट्रिय विपद् जोखिम न्युनीकरण तथा व्यवस्थापन प्राधिकरणले यो बीचमा एक हजार ३४ विपद्जन्य घटना भएको र त्यसमा परेर ११८ को मृत्यु, एक बेपत्ता र २७१ घाइते भएको जानकारी दिएको छ। प्राधिकरणका अनुसार सबैभन्दा बढी चट्याङबाट ४९ जनाको मृत्यु भएको छ। कूल १४० चट्याङ परेकामा ११७ जना घाइते भएको सार्वजनिक विवरणमा उल्लेख छ। प्राप्त विवरणमा आगलागीबाट १९, जनावरको आक्रमणबाट १२, पहिरामा परेर १५, बढीका कारण तीन र हावाहुरीका कारण नौं जनाको मृत्यु भएको हो। ती घटनाबाट एक हजार ३४७ परिवार प्रभावित भएका छन् भने रु ७७ करोड ५९ लाख बढीको क्षति भएको छ।"
मूल्यवृद्धिले बन्द हुँदै नवलपरासीका इँट्टा उद्योग,"परासी : इन्धनदेखि कोइलाको अत्याधिक मूल्यवृद्धिका कारण नवलपरासीका इँट्टा उद्योगहरु बन्द हुने भएका छन्। एक वर्षको अवधिमा इन्धन, कोइलाको अत्यधिक मूल्यवृद्धि हुनुको साथै माटोको अभावले पनि उद्योगहरु बन्द गर्नुपर्ने अवस्था आएको नवलपरासीका इँट्टा व्यवसायी एंव नेपाल इँट्टा उद्योग महासंघका केन्द्रीय सदस्य कृष्ण नारायण श्रेष्ठले बताए। जिल्लामा १७ वटा उद्योग छन्। ती उद्योगहरुबाट दैनिक ११ लाखको हाराहारीमा इँट्टा उत्पादन हुँदै आएको श्रेष्ठले जानकारी दिए। जिल्लामा उत्पादनकै हाराहारीमा इँट्टाको माग थियो। केही महिना पहिले प्रति केजी २५ रुपैयाँ पर्ने कोइला अहिले ४२ रुपैयाँ पुगेको छ। आर्थिकमन्दीसँगै इन्धनको मूल्य पनि अचाकाली बढ्यो। त्यसमाथि माटोको अभाव र मजदुर पाउन छाडेपछि उद्योग बन्द गर्नुपर्ने अवस्थामा पुगेको हो, श्रेष्ठले भने। बैंकले लगानी गर्न छाडेपछि व्यक्तिहरुले घर बनाउन छाड्नु र ठूला संरचनाका भवनहरु पनि निर्माण हुन नसकेपछि इँट्टाको माग धेरै नरहेको श्रेष्ठको भनाइ छ। जिल्लामा अहिले करिब ६ करोड संख्याका इँट्टा स्टकमा छन्। पहिला भारतबाट कोइला आउँथ्यो अहिले अमेरिका, अष्ट्रेलिया र इण्डोसियाबाट मगाउनुपर्छ। त्यसमाथि सरकारले तेस्रो मुलकमा पैसा पठाउन रोकेको छ। जसले गर्दा कोइला खरिद गर्नै नपाएपछि उद्योग बन्द गर्नुको विकल्प छैन, बालाजी इँट्टा उद्योग सरावलका सञ्चालक कुलदिप आचार्यले भने। सबै क्षेत्रमा मूल्यवृद्धि भए पनि इँट्टाको मूल्यवृद्धि हुन नसकेको व्यवसायीहरुको भनाइ छ। अहिलेको बजार मूल्यअनुसार जिल्लामा प्रति इँट्टा १६ रुपैयाँ छ। उद्योगमा ७ हजारले प्रत्यक्षसहित १२ हजारले रोजगारी पाएका थिए। उद्योग बन्द भएपछि उनीहरु सबै बेरोजगार भएको नवलपरासी इँट्टा उद्योग संघले जनाएको छ। कोइला अभाव र मूल्यवृद्धिले भारत र पाकिस्ताका उद्योगहरु बन्द भइसकेकोले अब नेपालका सबै उद्योगहरु पनि बन्द हुने अवस्थामा पुगेको महासंघका केन्द्रीय सदस्य श्रेष्ठले बताए। केही दिनमा महासंघले मूल्यवृद्धि र कच्चा पदार्थको अभावका कारण देशभरकै उद्योगहरु बन्द भएको घोषणा गर्दै छ, श्रेष्ठले भने।"
