शीर्षक,विवरण
स्थानीय तह चुनावमा भएको अन्तर्घात छानविन गर्न समिति गठन,"काठमाडौं: नेकपा माओवादी केन्द्रले स्थानीय तहको निर्वाचनमा भएको अन्तर्घात सम्वन्धमा छानविन गर्न समिति गठन गरेको छ। शनिबार पार्टी कार्यालय पेरीसडाँडामा बसेको स्थायी समिति बैठकले तीन सदस्यीय छानविन समिति गठन गरेको हो। समितिको अध्यक्षमा टंक राई रहेका छन्। यस्तै सदस्यहरूमा मुक्ति प्रधान र खिमलाल देवकोटा रहेको पार्टी प्रवक्ता कृष्णबहादुर महराले जानकारी दिए। यस्तै, पार्टीको विद्यार्थी संगठन अखिल क्रान्तिकारीमा देखिएको विवाद समाधान गर्न रमेश मल्ल, नरेन्द्र न्यौपाने र रत्न ढकाल रहेको समिति बनाइएको छ।"
खोला किनारमा फेला परेको शव पहिचानमा समस्या,"विराटनगर: मोरङको रंगेली नगरपालिका१ स्थित केसलिया खोलाको किनारमा शनिबार बिहान फेला परेको शवको पहिचानमा समस्या भएको छ। खोला किनारमा लडेको जेरीको रुखमा अड्किरहेको अवस्थामा भेटिए पनि शव महिलाको हो कि पुरुषको भनेर छुट्याउन नसकिएको मोरङ प्रहरीका प्रवक्ता डिएसपी दीपक श्रेष्ठले बताए। उनकाअनुसार सडेर दुर्गन्धित भएको अवस्थामा भेटिएको शवको पहिचानमा समस्या भइरहेको हो। 'खोला किनारमा भेटिएको शवको पहिचान भएको छैन', श्रेष्ठले भने, 'शव नै महिलाको हो कि पुरुषको भन्ने पनि छुट्याउन गाह्रो परिरहेको छ।' कुहिएका कारण मृतकको पहिचान हुन नसकेको उनले बताए। निक्कै समयअघि मृत्यु भएको र शव भने कुहिएपछि भर्खरै मात्र भेटिएका कारण यस्तो अवस्था आएको उनको भनाइ छ। रुखमा अड्किएर रहेको शव बाढी आएका बेला खोलाले बगाएर ल्याएको हुनसक्ने डीएसपी श्रेष्ठले बताए। स्थानीयले खोला किनारमा बाढीले लडाएको रुखमा अड्किएको शव देखेपछि प्रहरीलाई खबर गरेका थिए। इलाका प्रहरी कार्यालय रंगेलीका प्रहरी निरीक्षक शैलेश न्यौपाने नेतृत्वको टोली घटनास्थल पुगेर घटनाको अनुसन्धान थालिसकेको छ। त्यस्तै मोरङको सुन्दरहरैँचा नगरपालिका८ मा अघिल्लो दिन मृत फेला परेका पुरुषको पनि पहिचान हुन सकिरहेको छैन। पूर्वाञ्चल विश्वविद्यालयनजिकको बाँझो खेतमा खोप्टो परेको अवस्थामा अन्दाजी ३५३६ वर्षीय पुरुषको शव शुक्रबार दिउँसो भेटिएको थियो। स्थानीयले प्रहरीलाई दिएको जानकारीअनुसार मृत फेला परेका पुरुष बिहीबार साँझ मात्रै त्यो ठाउँमा देखा परेका थिए। स्थानीयले पनि मृतकलाई चिन्न नसकेको र त्योभन्दा अघि उनीहरूले ती पुरुषलाई कतै पनि नदेखेको प्रहरीले जनाएको छ। शव पोस्टमार्टमका लागि बीपी कोइराला स्वास्थ्य विज्ञान प्रतिष्ठान धरान लगेर घटनाका बारेमा अनुसन्धान अघि बढाइएको उनले जानकारी दिए।"
म मेरो तलबबाट यम बुद्धको सालिक बनाउँछु,"काठमाडौं : काठमाडौं महानगरपालिकाका मेयर बालेन्द्र शाहले आफ्नो तलबबाट र्यापर यम बुद्धको सालिक बनाउने बताएका छन्। मेयर शाहले सामाजिक सञ्जाल फेसबुकमार्फत् आफ्नो तलबबाट यम बुद्धको सालिक बनाउने बताएका हुन्। उनले भनेका छन्, म मेरो तलबबाट यम बुद्धको सालिक बनाउँछु। तपाईहरुको दिन शुभ रहोस्। यसअघि मेयर शाहले १५ लाख रुपैंया बजेट विनियोजन गरेका थिए। मेयर शाहले सालिक बनाउनकै लागि बजेट विनियोजन गरेको भन्दै चर्को आलोचना भएको थियो। विरोधपछि महानगरको बजेटमार्फत् सालिक बनाउने निर्णयबाट पछि हटेका हुन्।"
बाढीले सडकको ट्रयाक पुरिँदा उपल्लो मुस्ताङको सडक अवरुद्ध,जोमसोम शनिबार राति परेको अविरल वर्षाका कारण आएको बाढीले कागबेनी खोलाको सडक पुरिँदा उपल्लो मुस्ताङको सडक अवरुद्ध भएको छ। वर्षाका कारण मुक्तिनाथबाट बग्ने ठाँडो खोलाको बाढीले बालुवा र गेग्रान बगाएर ल्याउँदा कागबेनीमा निर्माणधीन पुल नजिकै सडक ट्रयाक पुरिएको प्रहरी चौकी कागबेनीले जनाएको छ। कागबेनीस्थित खोलामा पक्की पुल निर्माणाधीन अवस्थामा छ। सोही पुलको तल सवारी ट्रयाक रहेकोमा ५ फिट जति गेग्रान जम्मा हुँदा सडक अवरुद्ध भएको कागबेनी प्रहरी चौकीका इन्चार्ज राम थापाले जानकारी दिए। यस्तै कागबेनीको मुक्तिनाथ ठाँडो खोलाको बाढीले कागबेनीमा अस्थायी साँघो समेत बगाएको प्रहरीले बताएको छ। अविरल वर्षासँगै आएको बाढीले कागबेनीस्थित धर्मशाला समेत जोखिम परेको छ। श्राद्ध तथा पिण्डदान गर्ने धर्मशालाको नदी क्षेत्रमा बालुवा र गेग्रान जम्मा भएकाले श्राद्ध गर्न असहज भएको छ। केही वर्षअघि मुक्तिनाथको ठाँडो खोला र कालिगण्डकी नदी कटानले धर्मशालाको श्राद्धस्थलको पूर्वाधारमा क्षति पुर्याएको थियो। बाढीले कागबेनीदेखि उपल्लो मुस्ताङ जोड्ने सडक अवरुद्ध भएपछि वारागुङ मुक्तिक्षेत्र गाउँपालिकाले शनिबार बिहानैदेखि डोजर परिचालन गरी सडक ट्रयाक खुलाउन पहल गरेको प्रमुख प्रशासकीय अधिकृत जितबहादु रानाले जानकारी दिए। राष्ट्रिय गौरवको आयोजना अन्तर्गत कालिगण्डकी करिडोरले निर्माण गरेको कागबेनीउपल्लो मुस्ताङ जोड्ने पुल ६ वर्षमा पनि सम्पन्न हुन सकेको छैन। गल्वा रफिना जेभी कन्ट्रक्सनले निर्माण गरेको जम्मा २५ मिटर लम्बाइको पुल निर्माण कम्पनीको चरम ढिलासुस्तीले सम्पन्न हुन ढिलाइ भएको हो। पुलको लागत २ करोड ८८ लाख रहेपनि अहिले एप्रोच रोड र केही फिनिसिंङको काम बाँकी रहेको आयोजनाले जनाएको छ।
चिकित्सक लापरबाही प्रकरण : छानविन समितिले प्रतिष्ठानसँग माग्यो स्पष्टीकरण,"जनकपुरधाम : मधेस स्वास्थ्य विज्ञान प्रतिष्ठानअन्तर्गतको प्रादेशिक अस्पताल जनकपुरधाममा शल्यक्रियामा चिकित्सकले गरेका गम्भीर लापरबाहीलाई मधेश प्रदेशको महिला बालबालिका तथा समाजिक न्याय समितिले लिखित र मौखिक स्पष्टीकरण सोधेको छ। अस्पतालले बिरामीलाई चेकजाँच बिनै पित्तथैलीको शल्यक्रिया गर्दा बिरामीको ज्यान नै जोखिममा परेपछि मधेस प्रदेशसभाको महिला बालबालिका तथा समाजिक न्याय समिति सभापति जयनुल राईन नेतृत्वको छानविन समितिले प्रतिष्ठानका उपकूलपति डा रामकेवल साहलाई बोलाएर मौखिक तथा लिखित जवाफ घटनाबारे लिएको हो। महोत्तरीको जलेश्वर नगरपालिका २ घर भई हालः जनकपुरधाम उपमहानगरपालिका भाडा कोठा लिएर बस्दै आएकी विभा चौधरीले झण्डै चार महिना अघि गराएको चेकजाँचको आधारमा चिकित्सकले पित्तथैली पत्थरीको शल्यक्रिया गर्दा बिरामीको ज्यान जोखिममा परेको हो। २०७८ फाल्गुन २८ गते बिरामीले अल्ट्रासाउण्डमा गराएको रिपोर्टको आधारमा नै चिकित्सकले शल्यक्रिया गरेको गम्भीर लापरबाही भेटिएको भन्दै सांसदहरुले छानविन माग गरेका हुन्। चार महिना अघि व्यक्तिगत (सेल्फ) रुपमा भिडियो एक्सरे (अल्ट्रासाउण्ड) गराएको र सोही आधारमा डा अमरेश कर्णले भर्ना गरी डा राजेश साह र डा आश्विनी यादवले शल्यक्रिया गरेको थियो। शल्यक्रियापछि बिरामीको अवस्था नाजुक हुँदा जेकजाँच गर्दा चार महिनाको गर्भवति भएको जानकारी प्राप्त भएको थियो। समितिको तर्फबाट जयनुल राइन नेतृत्वको टोलीले जनकपुरधामस्थित प्रादेशिक अस्पतालमा चिकित्सकहरुको टोलीसँग सोधपुछ गरीसकेको जानकारी दिए। थप जानकारीका लागि उपचाररत काठमाडौंस्थित मेडिसिटी हस्पिटलमा बुझ्न जान लागेको राइनले जानकारी दिए। उनले भने, घटनाको कारण, अहिलेको स्थितिबारे उपचाररत हस्पिटलको धारणा लगायतको विषयवस्तु मिहीन ढंगको छानविन गरिरहेका छौं। अहिले त्रुटि ठयाक्कै यही हो भन्न मिलेन, तर प्रारम्भिकरुपमा लापरबाही भएको पाइएको छ। थप कुराहरु स्वास्थ्यका विज्ञहरुसँग पनि सल्लाह हुँदैछ। छानविन समितिमा संयोजक जयनुल राइन, सदस्यहरु शारदा देवी थापा, प्रमिला दास र रानीशर्मा तिवारी र प्रदेशसभा सचिव रञ्जित यादव भोलि बिरामी भेटन तथा अवस्था बुझ्न काठमाडौं जान लागेको छ।"
"राजनीतिक दलबाट जनता सन्तुष्ट छैनन्, जनभावना बुझ्न नसके अरु बालेनहरु आउँछन् : सभामुख सापकोटा","काठमाडौं : सभामुख अग्निप्रसाद सापकोटाले निर्वाचनमा हुने सबै खालका विकृति र विसंगतिको अन्त्यका लागि अभियान सञ्चालन गर्नुपर्ने बताएका छन्। शनिबार काठमाडौंमा राष्ट्रिय युवा परिषद्ले आयोजना गरेको संघीय नमूना युवा संसद अभ्यासको उद्घाटन गर्दै सभामुख सापकोटाले अहिले सामान्य मान्छेले चुनाव लड्नै नसक्ने गरि खर्च हुन थालेको र चुनावमा विकृति र विसंगति देखिन थालेको भन्दै यसको अन्त्यका लागि युवाहरुले अभियान नै सञ्चालन गर्नुपर्ने बताएका हुन्। हालै भएको स्थानीय तहको निर्वाचनमा काठमाडौंको र अन्य स्थानको विश्लेषण गर्दा विद्यमान परिस्थितिबाट जनताहरु सन्तुष्ट नदेखिएको उनले बताए। उनले जनताहरुको भावनालाई नेपालका राजनीतिक पार्टी र नेतृत्वमा बसेकाहरुले बुझ्न नसके आगामी चुनावमा अर्कै परिस्थिति आउन सक्ने धारणा राखे। त्यस्तै उनले चुनावलाई स्वतन्त्र, निष्पक्ष, शान्तिपूर्ण रुपमा सम्पन्न गर्न र असल, इमान्दार उम्मेदवारलाई जिताउनका लागि युवाहरुले गरेको नमूना संसद अभ्यासले महत्वपूर्ण योगदान गर्ने जिकिर गरे। सभामुख सापकोटाले अहिलेको समयमा सहि बिचारका साथ अघि बढ्न युवाहरुलाई सुझाव पनि दिए।"
कविता : मेरो डायरी!,"मेरो डायरी! के थिएन र त्यहाँ ? बुवाका मल्हम जस्ता शब्दहरू, आमाको शीतलता, साथीहरूले दिएको जिन्दगीको परिभाषा, मनपर्ने मान्छेको सुवास। साँच्चै, अचम्मको डायरी थियो त्यो। ती प्रत्येक पन्नाहरू मसँगै संवाद गर्थे र मेरो मन हलुका पार्थे। आहा ! त्यो दिनभरि मलाई छोएर चिसो बतास पनि मेरै वरिपरि हिँडिरहन्थ्यो। तर कुनै बेला, ती पन्नाहरू पर्लक्क पल्टिँदा उत्ताउलो बर्खे भेल पसेको भान हुन्थ्यो मलाई त्यतिबेला मेरा आँखा झरीलाई बिर्साउने गरी एकोहोरो बर्सिरहन्थे। नढाँटी भन्नुपर्दा, आजसम्म त्यो डायरीभन्दा नजिक मेरो आफ्नो कोही हुन सकेन। सम्झना आलै छ नि, एकदिन काठमाडौं हुस्सु ओडेर निदाइरहेथ्यो, त्यही बेला मेरो डायरी लालुपातेको रंग पैंचो माग्न भन्दै हिँडेको थियो। मेरो डायरी फर्किआएको दिन म कति पोखिन्छु होला एक डोको पीरहरू लुकाएर राखेकी छु, थोरै खुसीका पुलिन्दाहरू पनि छन्। ती सबैलाई लालुपातेसँग मागिल्याएको रंगमा चोपलेर खाली पन्नाहरू भर्नेछु। त्यतिबेला, ऊ रमाउँदै भन्दो हो अब तिम्रा अक्षरहरू टुहुरा हुँदैनन्। हेर त, म छु नि ! साँच्चै, मेरो डायरी, लालुपातेको छहारीमा थोरै रातो रंग बोकेर मलाई पर्खिरहेको थियो।"
पेरिसडाँडामा माओवादीको स्थायी समिति बैठक,"काठमाडौं : नेकपा माओवादी केन्द्रको स्थायी समिति बैठक सुरु भएको छ। कोटेश्वरस्थित पार्टी केन्द्रीय कार्यालयमा केहीवेर अघि स्थायी समिति बैठक सुरु भएको हो। पार्टी अध्यक्ष पुष्पकमल दाहालको अध्यक्षतामा वसेको बैठकले मुलुकको पछिल्लो राजनीतिक अवस्था, पार्टी संगठन विस्तार लगायत विषयमा छलफल गर्ने बताइएको छ। स्थानीय तहको निर्वाचनमा भएको अन्तरघात, पार्टीमा चुलिएको गुटको अन्त्य गर्नेबारे समेत छलफल हुने स्रोतले बताएको छ। पार्टी भित्रको चरम गुटवन्दीका कारण माओवादीले पदाधिकार चयन गर्न सकेको छैन। पोलिव्युरो र स्थायी समिति चयनमा पनि माओवादी भित्र तिव्र विवाद छ।"
