शीर्षक,विवरण
"नेप्से परिसूचक सामान्य अंकले बढ्यो, डेढ अर्बको सेयर कारोबार",काठमाडौं : सेयर कारोबारको पहिलो दिन आइतबार नेप्से परिसूचक झिनो अंकले बढेको छ। नेप्से २१६ अंकले बढेर १९६३२२ विन्दुमा अडिएको छ। सेन्सेटिभ इण्डेक्स ११७ अंकले बढेर ३८४८३ विन्दुमा पुगेको छ। यसदिन २४३ कम्पनीको ३६ लाख ९४ हजार कित्ता सेयर १ अर्ब ५६ करोड १७ लाख रुपैयाँ बराबरमा खरिदबिक्री भयो। कारोबार रकमका आधारमा यसदिन नबिल बैंक शीर्षस्थानमा रहेको छ। सो बैंकको १९ करोड ८० लाख ६७ हजार रुपैयाँ बराबरको सेयर कारोबार भयो। कारोबारमा आएका १३ समूहमध्ये ९ को सूचक बढ्यो भने ४ को घट्यो। यसदिन लाइफ इन्स्योरेन्सको सूचक सर्वाधिक १९८ प्रतिशतले बढ्दा होटल एन्ड टुरिजमको १६५ प्रतिशतले बढ्यो। बैंकिङ समूहको सूचक ०६७ प्रतिशतले ओरालो लाग्यो। सामान्य अंकले बढेको सेयर बजारमा धवलागिरी लघुवित्त वित्तीय संस्थाको मूल्य सकारात्मक सर्किट लेभलमा कारोबार भयो।
'गठबन्धनबाटै सरकार गठनको पहिलो प्रयास गरिन्छ',"काठमाडौं : नेकपा माओवादी केन्द्रका महासचिव देव गुरुङले सत्ता गठबन्धनबाटै सरकार गठनको प्रयास गरिने बताएका छन्। माओवादी केन्द्रको पदाधिकारी बैठकपछि महासचिव गुरुङले गठबन्धन यथावत रहेकाले सरकार गठनको प्रयास गठबन्धनबाटै थालिने बताएका हुन्। महासचिव गुरुङले भने, गठबन्धनका घटकहरूबीच कुराकानी हुन्छ। गठबन्धनकै प्रक्रियाबाट निर्वाचन भएकाले गठबन्धनको बैठक बस्नुपर्छ। भोलि गठबन्धनको आयोजना हुने भएको छ। गठबन्धनबाटै सरकार गठनको पहिलो प्रयास गरिने छ। गुरुङले भोलि (सोमबार) गठबन्धनको बैठक आयोजना हुने र गठबन्धनको चुनावी समीक्षा गरिने बताए। आजको बैठकमा पदाधिकारीहरूले मुलभूत रूपमा निर्वाचनबाट कतिपय सन्दर्भमा अपेक्षाकृत परिणाम नआएपनि मुलभूत रूपमा गठबन्धनको परिणाम ठीक भएको औंल्याएका थिए। माओवादी केन्द्रका उपाध्यक्ष कृष्णबहादुर महराले यसअघि सत्ता समीकरणमा अन्य विकल्प सोच्न सकिने बताएका थिए।"
चुनावी समीक्षा र आगामी रणनीति तय गर्न माओवादी केन्द्रको बैठक,काठमाडौंः नेकपा माओवादी केन्द्रको पदाधिकारी बैठक जारी छ। निर्वाचन समीक्षा र आगामी रणनीति तय गर्न पदाधिकारीको बैठक पार्टी कार्यालय पेरिसडाँडामा बसेको हो । बैठकमा पदाधीकारीहरुले चुनावी रिपोर्टिङ प्रस्तुत गरिरहेका छन् । सत्ता गठबन्धन दल नेकपा माओवादी केन्द्रले सत्ता समीकरणमा अन्य विकल्प समेत रहेको बताएको छ । बैठकमा नेताहरुले चुनावी नतिजा अपेक्षा अनुरुप नआएको बताएका छन् । बैठक शनिबार पनि बसेको थियो । पार्टी उपाध्यक्ष कृष्णबहादुर महराले चुनावी समीक्षापछि आगामी रणनीतिबारे थप निर्णय हुने बताए ।
१९ जना डिस्चार्ज हुँदा ६ कोरोना संक्रमित थपिए,काठमाडौं : नेपालमा थप ६ जनामा कोरोना संक्रमण पुष्टि भएको छ। स्वास्थ्य तथा जनसंख्या मन्त्रालयका अनुसर देशभर परीक्षण गरिएका ४ सय ५४ नमूनामध्ये ६ नमूनाको रिपोर्ट पोजिटिभ आएको हो। कोरोनाका कारण गत २४ घण्टामा पनि कसैको मृत्यु भएको छैन । आइतबार थप १९ संक्रमित डिस्चार्ज भएका छन् । हाल नेपालमा १ सय ८ सक्रिय संक्रमित रहेको मन्त्रालयले जनाएको छ ।
नक्कली शैक्षिक प्रमाणपत्र पेश गरी सरकारी सुविधा लिने दुईजनाविरुद्ध मुद्दा,काठमाडौं : अख्तियार दुरुपयोग अनुसन्धान आयोगले शैक्षिक योग्यताको नक्कली प्रमाणपत्र पेश गरी सरकारी सेवामा प्रवेश गरेको आरोपमा दुईजनाविरुद्ध आरोपत्र दायर गरेको छ। ओखलढुंगा पूर्वाधार विकास कार्यालयका ल्याब टेक्निसियन राम एकवाल यादव र कैलालीमा उच्चमाध्यमिक विद्यालय संयोजक मधुरा चौधरीविरुद्ध आइतबार विशेष अदालत काठमाडौंमा मुद्दा दायर गरेको हो। दुवैजनाले सरकारी सेवाको लाभ लिने उद्देश्यले नक्कली प्रमाणपत्र पेश गरेको पुष्टि हुन आएकाले मुद्दा दायर गरेको अख्तियारका प्रवक्ता श्याम प्रसाद भण्डारीले जानकारी दिए। चौधरीले नक्कली प्रमाणपत्र पेश गरी माध्यमिक तहको स्थायी शिक्षक पदमा नियुक्त भएको र यादव ल्याब टेक्निसियन पदमा करार सेवामा काम गरेको पुष्टि भएको अख्तियारले जनाएको छ।
"संसदमा १२ दल सहभागी हुने, ५ पार्टीले राष्ट्रिय दलको मान्यता नपाउने","काठमाडौं : प्रतिनिधिसभामा १२ राजनीतिक दल सहभागी हुन पाउने भएका छन् । प्रतिनिधिसभामा १२ दल संसदमा सहभागी हुने भएपनि ७ दलले मात्रै राष्ट्रिय दलको मान्यता पाउने देखिएको हो । नेपाली कांग्रेस, नेकपा एमाले, नेकपा माओवादी केन्द्र, राष्ट्रिय स्वतन्त्र पार्टी, राष्ट्रिय प्रजातन्त्र पार्टी, जनता समाजवादी पार्टी र जनमत पार्टीले राष्ट्रिय दलको मान्यता पाउनेछन् । राष्ट्रिय दलको मान्यता पाउन प्रत्यक्षतर्फ एक सिट र समानुपातिकतर्फ सदर मतको ३ प्रतिशत 'थ्रेस होल्ड ' कटाउनुपर्ने कानुनी व्यवस्था छ । नेकपा एकीकृत समाजवादीले 'थ्रेस होल्ड' कटाउन संघर्ष गरिरहेको छ । समाजवादीले अहिलेसम्म २ लाख ९४ हजार मत प्राप्त गरेपनि 'थ्रेस होल्ड' कटाउन हम्मेहम्मे देखिएको छ। राष्ट्रिय जनमोर्चा, नेपाल मजदुर किसान पार्टी, लोकतान्त्रिक समाजवादी पार्टी र नागरिक उन्मुक्ति पार्टीले पनि थ्रेस होल्ड कटाएका छैनन् ।"
प्रदेशको राजधानी सार्ने काम रोक्न माग गर्दै कांग्रेस र एमालेले निकाले विज्ञप्ति,बुटवल: लुम्बिनी प्रदेशको स्थायी मुकाम तत्काल नसार्न नेपाली कांग्रेस र नेकपा एमालेले माग गरेका छन् । राजधानी तोकिएको राप्ती उपत्यका देउखुरी क्षेत्रमा पूर्वाधार निर्माण नहुँदै बुटवलबाट जवरजस्त राजधानी सार्न खोजिएको भन्दै नेकपा एमाले र नेपाली कांग्रेस रुपन्देहीले ध्यानाकर्षण गराउँदै विरोध जनाएका छन् । आइतबार दुवै पार्टीले प्रेस विज्ञप्ति जारी गर्दै काम चलाउ सरकारले राजधानी सार्न खोज्नु गलत भएको उल्लेख गरेका छन् । जवरजस्त राजधानी सार्ने काम तत्काल रोक्न दुवै पार्टीले प्रदेश सरकारसँग माग गरेका छन् । पूर्वाधारबीना राजधानी लैजादा सेवा प्रवाहमा प्रतिकुल असर पर्ने दुबै दलको ठहर छ । मुख्यमन्त्री कुलप्रसाद केसी नेतृत्वको काम चलाउ सरकारले हतारहतारमा राजधानी सार्न खोज्नु सस्तो लोकप्रियता मात्र भएको विज्ञप्तिमा उल्लेख गरिएको छ । यसअघि रुपन्देहीमा क्रियाशिल कर्मचारीका पेशागत संगठनले पनि संयुक्त विज्ञप्ति जारी गर्दै राजधानी सार्ने कदमको विरोध जनाएका छन् ।
एसियन हाइड्रोपावरले मंसिर २७ गतेदेखि आईपीओ निष्काशन गर्दै,काठमाडौं : एसियन हाइड्रोपावरले मंसिर २७ गतेदेखि आईपीओ निष्काशन गर्ने भएको छ। कम्पनीले सर्वसाधारणका लागि छुट्याएको सेयरमध्ये पहिलो चरणमा आयोजना प्रभावित क्षेत्र इलामका स्थानीय र वैदेशिक रोजगारीमा रहेका नेपालीका लागि आईपीओ निष्काशन गर्न लागेको हो। कम्पनीले प्रतिकित्ता १ सय रुपैयाँ अंकित दरमा ३ लाख ४० हजार कित्ता सेयर आयोजना प्रभावित स्थानीयका लागि र ८४ हजार कित्ता सेयर वैदेशिक रोजगारीमा गएका नेपालीहरुका लागि बिक्री गर्न लागेको हो। स्थानीय बासिन्दाले छिटोमा पुस १२ गते र ढिलोको पुस २७ गतेसम्म निवेदन दिइसक्नुपर्ने छ। वैदेशिक रोजगारीमा रहेकाहरुले भने पुस १२ गतेसम्म आवदेन दिन सक्नेछन्। कम्पनीको आईपीओ बिक्री प्रबन्धकमा एनएमबि क्यापिटल लिमिटेड रहेको छ।
संसदीय दलको कार्यालय व्यवस्थापनमा जुट्यो सङ्घीय संसद् सचिवालय,"काठमाडौं : सङ्घीय संसद् सचिवालय दलहरुको संसदीय दलको कार्यालय व्यवस्थापनमा जुटेको छ। प्रतिनिधिसभा निर्वाचनको मतपरिणाम आउने क्रम अन्तिम चरणमा रहेका बेला संसद सचिवालय दलको सङ्ख्या आँकलन गरी आवश्यक तयारीमा जुटेको हो। कम्तिमा दुई सांसद रहेको दलले संसदीय दल खोल्न कानुनी प्रावधान रहेकाले उनीहरुको दल गठन भएपछि सञ्चालनका लागि कार्यालय र स्थान उपलब्ध गराउने गृहकार्य भइरहेको संसद सचिवालयका प्रवक्ता डा रोजनाथ पाण्डेले बताए। उनले सकभर सिंहदरबारमा नै संसदीय दलको कार्यालयको व्यवस्थापन गर्ने र ठाउँ अभाव भए संसद भवन नयाँ बानेश्वरमा समेत केहि दलको कार्यालय स्थापना गर्ने गरि तयारी भइरहेको उनले बताए। त्यस्तै प्रवक्ता पाण्डले संसद बैठकको तयारीका लागि बानेश्वरस्थित संसद भवनका पूर्वाधार, स्वास्थ्य मापदण्ड लगाएतका विषयमा आवश्यक तयारी गरिरहेको जानकारी दिए। सङ्घीय संसद्को सिंहदरबारस्थित नयाँ भवन निर्माण कार्य पूरा हुन समय लाग्ने देखिएकाले संसदको नयाँ अधिवेशन बानेश्वरमा नै हुने उनले बताए। निर्वाचनको अन्तिम परिणाम आएको ३० दिनभित्र संसदको अधिवेशन आह्वान गर्नुपर्ने प्रावधान छ।"
सुविधा पास लिएर नेपाल आउन थाले भारतीय गाडी,"इलाम: 'सुविधा पास' लिएर भारतीय सवारी नेपाल प्रवेश गर्न थालेका छन् । सूर्योदय नगर उद्योग वाणिज्य संघको पहलमा पशुपतिनगर भन्सार कार्यालयले आइतबार(आज)देखि सुविधा पास उपलब्ध गराउन थालेको हो । भारतीय नम्बर प्लेटका निजी सवारीलाई नेपाल भित्रन पशुपतिनगर नाकाबाट सुविधा पास उपलब्ध गराइन्छ । तीन वर्षदेखि भारतीय सवारी साधनलाई यो सुविधा दिइएको थिएन । भन्सार कार्यालयले बिहीबार सरोकारवालासँग छलफल गरी भारतीय नम्बर प्लेटका जीप, कार र मोटरसाइकललाई सुविधा पास दिने निर्णय गरेको थियो । पशुपतिनगर भन्सार कार्यालयका प्रमुख प्रेमबहादुर लामाले पशुपतिनगर बजारको तल्लो छेउसम्मका लागि सुविधा पास उपलव्ध गराउने व्यवस्था गरेको बताए । इलामका प्रमुख जिल्ला अधिकारी माधवप्रसाद ढुंगानाले भारतीय पर्यटकको आवागमन बढाउन यो निर्णय लिएको बताए । उनले भने, व्यापारिक सम्भावना भएको बजार भएपनि कतिपय असहजताका कारण भारतीय पर्यटक आउने सहज वातावरण थिएन । अब भारतीय पर्यटकको संख्या बढ्ने अनुमान गरेका छौँ । सुविधा पासले पनि केही सहजता ल्याउने छ ।' सूर्योदय उद्योग वाणिज्य संघ र सूर्योदय होटल एसोसिएसन, पर्यटन व्यवसायसँग आबद्ध संघसंस्थाले सीमा नजिकको बजारसम्म भारतीय सवारीसाधनलाई सुविधा पासमा प्रवेश दिन माग गर्दै आएका थिए । कोभिड १९ को प्रकोप पछि सुविधा पास बन्द थियो । सूर्योदय नगरपालिकाका मेयर रणबहादुर राईले व्यवसायीले यात्रुसँग चर्को मुल्य असुलेको गुनासो आइरहेकाले मुल्य सूची, भाडा दरमा एकरुपता ल्याएर सेवा प्रदान गर्न सुझाव दिए । उनले भने कानुन अनुसार स्वच्छ र पारदर्शी सेवाका लागि सबैले सहकार्य गर्नु आवश्यक देखिएको छ । सुविधा पास बन्द भएपछि सूर्योदय नगर उद्योग वाणिज्य संघले सरोकारवालासँग सेवा पूर्ववत खुलाउने पहल भइरहेको संघका अध्यक्ष प्रमोद राईले बताए । अध्यक्ष राईले भने, भारतीय नम्बर प्लेटका निजी प्रयोजनका सवारीसाधनले नेपालसँगको सीमा नाघेर पशुपतिनगर बजारसम्म आउन सुविधा पास पाउँदा नेपाली बजारमा चहलपहल बढ्ने छ । यसअघि भारतीय गाडीले २४ घण्टासम्म नेपालको सीमाभित्र सवारी सञ्चालन गर्न दैनिक पाँच सय रुपयाँ रकम तिरेर अस्थायी अनुमतिपत्र लिनुपर्थ्यो । झापाको मेची भन्सार कार्यालयले असोज १० देखि नै सुविधाको पासमा भारतीय गाडी नेपाल आउने व्यवस्था गरेको छ ।"
