शीर्षक,विवरण
प्रतिस्वाब ५५ सय उठाउँदै राप्ती प्रतिष्ठान,"(दाङरूपन्देही)  घोराहीस्थित राप्ती स्वास्थ्य विज्ञान प्रतिष्ठानले हालसम्म गरेको पीसीआर परीक्षणको प्रतिस्वाब ५ हजार ५ सय रुपैयाँका दरले रकम असुल्न थालेको छ । प्रतिष्ठानले सबै स्थानीय तहलाई स्वाब परीक्षणको रकम शोधभर्ना गर्न भन्दै पत्र पठाएर मागेको हो । स्थानीय तहले रकम नदिएपछि प्रतिष्ठानले परीक्षण बन्द गरेको छ ।प्रतिष्ठानमा आएका स्वाबका नमुना शनिबारदेखि नेपालगन्ज पठाउन थालिएको छ । दुई पीसीआर मेसिन रहेको प्रतिष्ठानले बिहीबारदेखि नै स्वाब संकलन रोकेको थियो । प्रदेश ५ मा चार स्थानमा परीक्षण हुने गरेको छ । शनिबार साँझसम्म संकलन भएका ५ हजार ५ सय १४ स्वाब परीक्षणको पर्खाइमा छन् तर प्रतिष्ठानले शनिबारदेखि परीक्षण गर्न छोडेको छ । स्वाब संकलन र परीक्षणबापतको भन्दै पत्र पठाएर रकम माग्न थालेपछि स्थानीय तह बिलखबन्दमा परेका छन् । उनीहरूले आफ्नै खर्चमा संकलन गरेका स्वाब पनि नेपालगन्ज र भैरहवा पठाउन थालेका छन् । पैसा नदिए परीक्षण नगर्ने भन्दै प्रतिष्ठानले स्वाब लिन रोकेको गढवा गाउँपालिका अध्यक्ष सहजराज अहिरले बताए । अहिलेसम्मको परीक्षणबापत ४७ लाख रुपैयाँ तिर्नुपर्ने भन्दै ताकेता आएको उनले बताए । पहिले परीक्षण गरेको पैसा तिर्नुपर्छ भन्ने ताकेता पत्र आएको थियो, उनले भने, रकम उपलब्ध नगराएपछि अहिले संकलन गरेको स्वाब लिएका छैनन् । संकलन गर्नुपूर्व रकम माग नगरेकाले अहिले तिर्न नसक्ने जानकारी गराएको उनले बताए । सरकारी प्रतिष्ठानले पीसीआर परीक्षणमा व्यापार गर्न खोजेको बंगलाचुली गाउँपालिका अध्यक्ष भक्तबहादुर वलीले बताए । पहिले फोन गरेर पैसा तिर्नुपर्छ भनेका थिए, अहिले पत्र नै आयो, यो त स्वास्थ्यका नाममा व्यापार भयो, उनले भने, सरकारी निकायबाटै परीक्षणको पैसा मागेपछि हामी बिलखबन्दमा पर्यौं । बंगलाचुलीले ८० लाख रुपैयाँ तिर्नुपर्ने पत्र आएको उनले बताए । जति खर्च देखिए पनि प्रतिष्ठान संघीय सरकारमातहत रहेकाले खर्च भएको रकम सरकारी दायित्वकै विषय भएको उनको भनाइ छ । लमही नगरपालिकालाई ५ लाख ९० हजार ५ सय रुपैयाँ तिर्नुपर्ने ताकेता पत्र आएको नगरप्रमुख कुलप्रसाद केसीले बताए । अहिले हामी त्यस्तो पैसा तिर्न सक्दैनौं, उनले भने, महामारीका समयमा सरकारी निकायबाटै मनपरी रकम असुल्दै व्यापार गर्ने काम रोकिनुपर्छ । प्रतिष्ठानले बबई गाउँपालिकासँग पनि ४६ लाख ९१ हजार ५ सय रुपैयाँ तिर्न पत्राचार गरेको छ । दाङका सबै स्थानीय तहलाई पत्राचार गरेरै रकम माग गरिएपछि तीव्र विरोध सुरु भएको छ । रकम नदिने स्थानीय तहको स्वाब फिर्ता पठाउन थालिएको तुलसीपुर उपमहानगरपालिका प्रमुख घनश्याम पाण्डेले बताए । प्रतिष्ठानले पैसा नदिएका कारण परीक्षण गर्न सकिँदैन भनेर फर्काइदियो, उनले भने, सरकारी प्रयोगशालाले संकटका बेला पैसा मागेर परीक्षण रोक्नु गलत हो । परीक्षण रोक्ने प्रतिष्ठानका पदाधिकारीलाई कारबाही गर्न उनले माग गरे । प्रतिष्ठानका कामु रजिस्ट्रार कैलाशप्रसाद देवले भने आर्थिक समस्या भएकाले स्थानीय तहसँग पीसीआर परीक्षण भइसकेकाको रकम शोधभर्ना गर्न अनुरोध गरेको बताए । कोरोना परीक्षणका क्रममा अन्य बिरामी घट्दा आर्थिक स्रोत घटेको छ, उनले भने, पीसीआर मेसिन, किटलगायत सामग्री प्रतिष्ठान आफैंले खरिद गरेर काम गरिरहेको छ । खर्च धान्न कठिन भएपछि स्थानीय तहसँग मागिएको हो । यसअघि स्थानीय तहसँग भएको छलफलअनुसारै पत्राचार गरिएको प्रतिष्ठानकी उपकुलपति डा संगीता भण्डारीले बताइन् । सबै स्थानीय तहले आफ्नो भागमा पर्ने रकम दिन सहमति जनाएका थिए । अहिले रकम नदिएपछि स्वाब फर्काइदिएका हौं, उनले भनिन्, अन्य प्रयोगशाला लामो समयदेखि बन्द छन् । आम्दानी गर्ने अन्य ठाउँ छैन । आर्थिक अभावमा दिनरात खटिएका प्राविधिकलाई तलब खुवाउन पनि समस्या परेको उनको दाबी छ । प्रतिष्ठानले स्थानीय तहका लागि आफ्नै रकमले भीटीएम र किट किनेकाले शोधभर्ना मागिएको उनले बताइन् । हामीले पीसीआर मेसिनको रकम पनि पाएका छैनौं, उनले भनिन्, जसरी पनि रकम दिनैपर्छ । सरकारले तोकेको दरअनुसार नै रकम मागेका छौं ।स्वास्थ्य मन्त्रालयका प्रवक्ता डा जागेश्वर गौतमले सरकारले मुलुकमा सञ्चालित २५ वटा प्रयोगशालामा रिएजेन्ट सामान, मेसिनलगायत सबै बन्दोबस्त गरेकाले रकम उठाउन नमिल्ने बताए । यसरी पैसा लिन मिल्दैन, उनले भने, मन्त्रालयले प्रतिष्ठानलाई रकम नलिन भनिसकेको छ ।प्रदेश ५ का प्रदेशसभा सदस्यहरूले राप्ती स्वास्थ्य विज्ञान प्रतिष्ठानले कोभिड१९ परीक्षणबापत स्थानीय तहसँग रकम असुल्न खोजेको भन्दै प्रदेश सरकारसँग जवाफ माग गरेका छन् । प्रदेशसभाको आइतबारको बैठकमा उनीहरूले प्रतिष्ठानले प्रतिव्यक्ति ५ हजार ५ सय रुपैयाँ संकलन गर्न स्थानीय तहलाई पत्र नै पठाएर निर्देशन दिएको बताए । प्रदेशसभा सदस्य सरस्वती गौतमले प्रतिष्ठान सरकारले सञ्चालन गरेको हो वा नाफामुखी संस्था हो ? भन्दै सरकारले तत्काल जवाफ दिनुपर्ने बताइन् । स्थानीय तहले रकम उपलब्ध नगराएको भन्दै केही दिनदेखि प्रतिष्ठानमा ल्याइएका स्वाबको परीक्षण रोकिएको उनले जानकारी गराएकी थिइन् । बाँकी पृष्ठ ११"
ओलीसँग कुनै सम्झौता भएको छैन,"(काठमाडौं)  नेकपाभित्रको आन्तरिक शक्ति संघर्ष विभाजनउन्मुख दिशामा अघि बढिरहेका बेला नेकपाका अध्यक्षसमेत रहेका प्रधानमन्त्री केपी शर्मा ओली र उनीनिकट नेताहरूसँग कांग्रेस सभापति शेरबहादुर देउवाले गरिरहेको भेटवार्तालाई रहस्यका साथ हेरिएको छ । भेटलाईलिएर भइरहेका विभिन्न आशंका र अड्कलबाजीका बीच देउवाले आइतबारको पार्टी केन्द्रीय कार्यसमिति बैठकमा प्रधानमन्त्री ओलीसँग कुनै किसिमको गोप्य सम्झौता नभएको प्रस्ट्याएका छन् ।पार्टीको चौधौं महाधिवेशनको कार्यतालिका परिमार्जन गर्ने विषयमा बसेको बैठकको सुरुमै यही विषय प्रवेश भएको थियो । सुरुवातमै पार्टीका वरिष्ठ नेता रामचन्द्र पौडेलले भेटको प्रसंग कोट्याउँदै बैठकलाई जानकारी गराउन माग गरेका थिए । देउवाले असार १७ गते बालुवाटारमा ओलीसँग र आइतबार ओलीका विश्वासपात्र संसदीय दलका उपनेतासमेत रहेका स्थायी कमिटी सदस्य सुवास नेम्वाङसँग बूढानीलकण्ठमा भेटवार्ता गरेका थिए । नेम्वाङसँग भेटवार्तापछि देउवा कांग्रेस बैठकमा गएका थिए । प्रधानमन्त्रीसँग एक्लै र नेम्वाङसँग पार्टीकै नेता मीनेन्द्र रिजाललाई सँगै राखेर भेटवार्ता गरेका उनले बैठकमा संवैधानिक आयोगका पदाधिकारीको नियुक्ति र एमसीसीका विषयमा छलफल भएको बताएका थिए । नेम्वाङको भेटबारे भने नेता रिजाललाई जानकारी गराउन लगाएका थिए । नेम्वाङसँगको भेट संसद् अधिवेशन बोलाउन लागेको भन्ने आशंकाबीच भएको थियो । नेम्वाङले शनिबार कांग्रेस नेता रिजाललाई टेलिफोनमार्फत कांग्रेस र जनता समाजवादी मिलेर संसद् अधिवेशन बोलाउन खोजेको सूचना आफूहरूले पाएको भन्दै प्रस्ट हुन चाहेका थिए । प्रधानमन्त्री ओलीले सभामुख र संसद्मा प्रतिनिधित्व गर्ने राजनीतिक दललाई जानकारीसम्म नदिई असार १८ गते संसद् अधिवेशन अन्त्य गराएका थिए । त्यसबाट असन्तुष्ट कांग्रेस र जनता समाजवादी मिलेर अधिवेशन बोलाउने तरखर गर्न लागेको सूचना कसैले सुनाइदिएपछि आफ्ना दूतका रूपमा प्रधानमन्त्री ओलीले देउवासँग भेट्न पठाएका थिए । अधिवेशन अन्त्य भए पनि संसद्का एक चौथाइ सदस्यले लिखित अनुरोध गरेमा अधिवेशन बोलाउनुपर्ने संवैधानिक बाध्यता छ । नेम्वाङले यही विषयमा प्रस्ट हुन सभापतिलाई भेट्न खोज्नुभएको रहेछ, रिजालले कांग्रेस बैठकमा भनेका थिए, त्यसैको सिलसिलामा आज सभापतिसँग भेटको समय मिलाइएको हो । नेम्वाङले भने संसद् अधिवेशन बोलाउनेबारेको प्रसंग उल्लेख गरेनन् । उनले छाया सरकार बनाएर अघि बढेको प्रतिपक्षसँग अहिलेका समसामयिक राजनीतिक विषय, संवैधानिक आयोगका बाँकी पदाधिकारी नियुक्ति, कोभिड१९ को संक्रमणलगायतमा खुलस्त छलफल भएको बताए । पार्टी दुर्घटनामा पर्न लागेकै बेला सत्ता साझेदारी गर्नेसम्मको कुराकानी भएको भनेर आएको छ नि भन्ने कान्तिपुरको प्रश्नमा नेम्वाङले भने, पहिलो कुरा त हाम्रो पार्टी दुर्घटनामा पर्दैन । नेताहरूले वार्ता र संवादमार्फत एकताको निष्कर्षमा पुर्याउनु हुन्छ । दुवै अध्यक्षहरू यसमा प्रस्ट हुनुहुन्छ । अर्को, प्रमुख प्रतिपक्षसँग सरकार बनाएर जाने कुरा भनेका छैनौं । निर्वाचन सकिएपछि सुरुमा भनेका थियौं, अहिले भनेका छैनौं तर सञ्चारकर्मीले माया गरेर लेखिदिएका छन् । देउवाले ओलीसँग मिलेको र गोप्य सम्झौता गरेको भनेर बाहिरका चर्चा सत्य नभएको बताएका थिए । पार्टीको आसन्न महाधिवेशनलाई लिएर आन्तरिक प्रतिस्पर्धा सुरु भइसकेका बेला देउवाका लागि सत्ता राजनीतिको विषय बढ्दा रुचिकर बने पनि इतर खेमालाई भने यो विषयले सशंकित तुल्याएको छ । प्रधानमन्त्री ओलीलाई भेटेको जानकारी पाएदेखि नै वरिष्ठ नेता पौडेलले अंकगणितको जोडघटाउमा लाग्न नहुने भन्दै नेतृत्वलाई मनोवैज्ञानिक दबाब दिन थालेका छन् । केन्द्रीय कार्यसमिति बैठकमा पनि उनैले यस विषयलाई प्रवेश गराएका थिए । सत्तारूढ नेकपाभित्र पनि ओली इतर खेमाका लागि कांग्रेस सभापतिसँगको भेटले चस्का दिएको छ । कांग्रेस केन्द्रीय सदस्य रिजालले प्रधानमन्त्री ओलीले कांग्रेसलाई देखाएर आफ्नै पार्टीका अर्का अध्यक्ष पुष्पकमल दाहाल र माधवकुमार नेपाल खेमालाई दबाबमा पार्ने रणनीतिबमोजिम पनि यस्तो भेटवार्ता भएको हुन सक्ने अनुमान लगाए । नेकपा नेता नेम्वाङले भने त्यस्तो योजनाअन्तर्गत भेटवार्ता नभएको दाबी गरे । यस्तो प्रश्न गर्ने, टिप्पणी गर्ने विषय स्वाभाविक हो । तर, व्यावहारिक र यथार्थ होइन, नेम्वाङले थपे, सम्बन्ध नराखौं निरंकुश भयो भन्ने, सम्बन्ध राखौं अर्को पक्षलाई दबाब दिन भन्ने ? नेम्वाङले संवैधानिक आयोगका पदाधिकारी नियुक्तिहरूका विषयमा भने छलफल गरेर अघि बढ्नेबारे कुराकानी भएको बताए । कांग्रेसकै कतिपय केन्द्रीय सदस्यहरूले ओलीले प्रधानमन्त्री र पार्टी अध्यक्ष दुवै पद नछाड्ने अडानमा रहेका र त्यसैका कारण पार्टी विभाजित हुने अवस्था बनेमा कांग्रेससँगको सहकार्य आवश्यक हुने ठानेर अहिल्यैदेखि सम्बन्ध बढाएको दाबी गरेका छन् । रिजाल भने त्यसलाई अहिल्यै पत्याइहाल्दैनन् । स्वयं सभापति देउवाले समेत पार्टी विभाजन हुनेमा पत्याएका छैनन् । जुन दिन सभापति देउवालाई नेकपा फुट्ने भयो भन्ने विश्वास जाग्छ, त्यसबेला ओलीले खोज्नै पर्दैन, आफैं लाग्नुहुन्छ, देउवानिकट अर्का एक केन्द्रीय सदस्यले भने, अहिले के हुन्छ भनेर चाखपूर्वक हेर्नु मात्रै भएको छ । उनका अनुसार देउवा यतिबेला ओली र अर्का अध्यक्ष पुष्पकमल दाहाल दुवैसँग सम्पर्कमा छन् । देउवासँग सम्बन्ध बढाउन ओली लागेपछि दाहाल र नेपाललाई सशंकित बनाएको छ । सशंकित नहुन आश्वस्त पार्दै देउवा आफैंले दाहालसँग सम्पर्क कायम राख्दै आएको स्रोतको दाबी छ । दाहालसँग उनी आफैं नभई विश्वासपात्रहरूलाई संवादको जिम्मा लगाएका छन् । ओलीसँग असार १७ भेटेलगत्तै विश्वासपात्रमार्फत दाहालसँग शुक्रबार भेट भएको थियो । नेम्वाङसँगको भेटमा भने देउवाले आफू ओली र दाहाल कतैतिर पनि नरहेको बताएका थिए । नेकपाभित्रको विवाद आन्तरिक हो, यसमा म ओली र दाहाल कतैतिर पनि छैन, देउवाको भनाइ उद्धृत गर्दै रिजालले भने, पार्टी मिलाउनुहोस्, शुभकामना छ । पार्टी सभापतिसँग भएको छलफलमा सरकार निर्माण, सरकारको साझेदारी, ओलीलाई समर्थनजस्ता कुनै पनि विषयमा छलफल नभएको दाबी पनि रिजालले गरे ।"
