शीर्षक,विवरण
युवतीको विषयमा ग्याङ फाइट गर्ने सातजना जेल चलान,"ललितपुर : गत वैशाख २० गते पुल्चोकको सुमेरु सिटी अस्पताल नजिकै युवतीको विषयमा ग्याङ फाइटमा संलग्न सातजना जेल चलान भएका छन्। फाइटमा २० वर्षीय अन्सल शाक्यको मृत्यु भएको थियो। फाइटमा संलग्न सात युवालाई शुक्रबार पुर्पक्षका लागि जेल चलान गरिएको हो। महानगरीय प्रहरी परिसर जावलाखेलका प्रवता नारायण चिमोरियाका अनुसार मुकेश महर्जन, कृष्ण तामाङ, प्रितम चुडाल थापा, सागर शाही, कुमार तामाङ, विशान्त थापा मगर र सुजन सोडारी पुर्पक्षका लागि जेल चलान भएका हुन्। मुकेशले अन्सलमाथि छुरा प्रहार गरेको प्रहरी आनुसन्धानबाट खुलेको थियो। वैशाख २० गते साँझ ६:३० मा दुई पक्षबीच ग्याङ फाइट हुँदा मृतक शाक्यको टाउँको र छात्तिमा गम्भीर चोट लागेको थियो। उपचारका लागि सुमेरु सिटी अस्पताल पुरयाउने बित्तिकै उनको मृत्यु भएको थियो। उनको मृत्यु भए लगत्तै प्रहरीले चारजनालाई नियन्त्रणमा लिएको थियो। भोलिपल्ट एकजना र केही दिनपछि मात्र अन्य अभियुक्त पक्राउ परेका थिए। घटनामा संलग्न अविश्येक शाही, सविन लामा, विजय ठकुरी, शाही, एलेक्स भन्ने रुपेन खड्गी र जग्गु भन्ने पृथ्वीमान शाक्यमाथि अभद्र व्यवहार गरेको आरोपमा मुद्दा दायर भएको थियो। मृतक पक्षका उनीहरु बिहीबार जनही २० हजार धरौटीमा रिहा भएका छन्। जिल्ला अदालत पाटनका न्यायाधीश मदनबहादुर धामीले उनीहरु पुर्पक्षका लागि जेल चलानको आदेश दिएको जिल्ला अदालत पाटनका श्रेस्तेदार चन्द्रप्रकास तिवारीले जानकारी दिए।"
प्रहरी बिटमै मासु पसल !,"नेपालगन्ज : नेपालगन्जमा प्रहरी बिटमा मासु पसल सन्चालन गरेको फेला परेको छ। नेपालगन्ज उपमहानगरपालिका ८ को रानीतलाउ नजिकको सब्जीमण्डीमा प्रहरी बिटमै मासु पसल सन्चालन गरेको भेटिएको हो। जिल्ला संयुक्त बजार अनुगमन समितिले शुक्रबार बिहान गरेको बजार अनुगमनका क्रममा मासु व्यवसायी रिजवान कुरैसीले प्रहरी बिटमै मासु पसल सन्चालन गरेको भेटिएको उपभोक्ता हित संरक्षण मञ्चका अध्यक्ष बसन्त गौतमले जानकारी दिए। अनुगमन टोली पुग्दा कुरैसी भने भागेका थिए। बिटमा अचानो राखेर मासु काट्ने प्रयोजनमा प्रयोग भएको देखिन्छ। जिल्ला प्रहरी कार्यालयले प्रहरी बिटमै मासु पसल सन्चालन गर्ने कुरैसीलाई प्रहरीले दिउँसो पक्राउ गरेको थियो। बाँकेका प्रहरी प्रमुख अरुण पौडेलले प्रहरी बिट भए पनि प्रयोगविहीन अवस्थामा रहेको बताए। उनले भने, जिल्लामा निर्माण गरिएका १५२० वटा प्रहरी बिट अहिले पनि प्रयोगविहीन छन्। उसले अपराध गरेको भए कारबाही हुन्छ। अनुगमन समितिले सब्जी मण्डी नजिकको बब्लु मासु पसलमा खसीको मासु भनेर बेच्नका लागि काट्न भनेर राखेको दुई वटा बाख्री जफत गरी ५० हजार रुपैयाँ जरिवाना गरेको थियो। मासु पसलमा फ्रिज नै नराखेर मासु स्टोर गर्ने गरिएको, मासु काटने औजार फोहर स्थानमा राख्ने गरेको र दूषित स्थानमा मासुको बिक्री हुने गरेको अवस्था फेला पारेको थियो। बाँकेका सहायक प्रमुख जिल्ला अधिकारीको नेतृत्वमा रहेको अनुगमन टोलीले धम्बोझी, मासु मण्डी लगायतको स्थानमा मासु बिक्रीको अवस्थाको अनुगमन गरेको थियो।"
सप्तरीमा हावाहुरीबाट लाखौंको क्षति,"राजविराज : सप्तरीमा आएको हावाहुरीले लाखौं रुपैयाँको क्षति पुर्याएको छ। हावाहुरीले जिल्लाका एक दर्जन भन्दाबढी फुस र जस्ताले छाएका घर टहरामा क्षति पुर्याएको सप्तरी प्रहरीले जानकारी दिएको हो। विहीबार राती आएको हावाहुरीले सात लाख भन्दा बढीको क्षति भएको प्रहरीले अनुमान गरेको छ। हावाहुरीले दर्जनौं रुख विरुवा ढलेका छन्। बोदे बर्साइन नगरपालिका क्षेत्रमा सबै भन्दाबढि क्षति पुगेको छ। बोदे बर्साईन नगरपालिका७ बर्साईन टोलमा मात्र ९ घरमा क्षति भएको डिएसपी भावेश रिमालले बताए। चन्देश्वरप्रसाद यादव र विर्जु मण्डलको एलबेस्टरले छाएको घर, दिलिप यादव, श्रवण साह र संजिव मण्डलको जस्ताले छाएको घर पूर्ण रुपले क्षति भएको जिल्ला प्रहरी कार्यालय सप्तरीले जनाएको छ। यसैगरी सोही ठाउँका सुर्यनारायण साह, राधादेबी साह, विरेन्द्रप्रसाद साह र निरसीदेवी रायको जस्ताले छाएको घरको जस्ता उडाएको छ। जिल्ला प्रहरी कार्यालय सप्तरीका अनुसार रुपनी गाउँपालिका ५ बसबिट्टी टोल बस्ने शिवनारायण खंगको फुसको घर, महदेवा गाउँपालिका १ पकरी बस्ने शिवनारायण यादवको जस्ताले छाएको गाईगोठ समेत हुरीले उडाएको छ। हावाहुरीले घरका साथै घरभित्र रहेको अन्नपात लगायतका सामानमा समेत नोक्सान पुयाएको छ। हुरीले पुर्याएको क्षतिको विवरण गाउँगाउँबाट आउने क्रम जारी रहेको प्रहरीले जनाएको छ।"
थपिए २८४ सीमा स्तम्भ,"भैरहवा : नेपालभारत सीमा कपिलवस्तु र रुपन्देहीमा २ सय ८४ नयाँ सीमा स्तम्भ निर्माण गरिएको छ। जसमध्ये ७ वटा मुख्य, ६८ मध्यम र २ सय ९ वटा सामान्य छन्। नेपालभारत सीमा सर्वेक्षण नम्बर ३ टोलीले ५ महिना लगाएर उक्त सीमा स्तम्भ निर्माणस्थल निर्धारण गरेको हो। सन् २०१८ को डिसेम्बर १५ देखि २०१९ को मे अन्तिमसम्म सीमा स्तम्भ निर्माण गरिएको थियो। २०१८ को डिसेम्बर २८ मा भारत उत्तर प्रदेशको बहराइचमा नेपालभारतको पहिलो संयुक्त बैठक बसेर निर्माण थालनी गरिएको थियो। नवलपरासीदेखि बर्दियासम्म चार सय १८ किलोमिटर क्षेत्रमा सीमा स्तम्भ निर्माण र सर्वेक्षण जिम्मा पाएको नम्बर ३ टोलीले यस वर्ष रुपन्देही र कपिलवस्तुको मात्रै सीमा स्तम्भ निर्माण गरेको हो। रुपन्देहीको सीमामा ३ सय ५१ नयाँ सीमा स्तम्भ निर्माण गर्नुपर्ने भए पनि यस वर्ष ८१ वटा मात्रै नयाँ सीमा स्तम्भ निर्माण गरिएको सीमा सर्वेक्षणका प्रमुख उमेश कुमारले जानकारी दिए। जसमध्ये ४० वटा नेपालले बनाएको हो भने ४१ वटा सीमा स्तम्भ भारतले निर्माण गरेको हो। २ सय ७० सीमा स्तम्भ भने अझै निर्माण गर्न बाँकी छन्। यस्तै, कपिलवस्तुमा २ सय ४१ सीमा स्तम्भ निर्माण गर्नुपर्नेमा २ सय ३ वटा बनाइएको छ। जसमध्ये नेपालले १ सय ३६ र भारतले ६७ वटा सीमा स्तम्भ निर्माण गरेको छ। यहाँ ३८ सीमा स्तम्भ निर्माण गर्न बाँकी छन्। दुई देशको सहमतिअनुसार बिजोर नम्बर भएको सीमास्तम्भ नेपालले निर्माण गर्नुपर्ने हुन्छ भने जोर नम्बरको भारतले निर्माण गर्नुपर्नेछ। हामीले पाएको म्यान्डेटअनुसार अधिकतम सीमा स्तम्भ निर्माण गरेका छौं, सर्वेक्षण टोली प्रमुख कुमारले भने, केही अप्ठ्यारा ठाउँमा निर्माण गर्न नसकिए पनि महŒवपूर्ण स्थानमा सीमा स्तम्भ निर्माण गर्न सफल भएका छौँ। उनले यस वर्ष जंगल, नदी, सुक्खा नदीलगायत अप्ठ्यारा स्थानमा समेत सीमा स्तम्भ निर्माण गरिएको जानकारी दिए। विगतमा काम हुन नसके पनि अहिले केही नयाँ र आधुनिक तरिकाबाट सीमा स्तम्भ बनाइएको छ, उनले भने, जीर्ण सीमा स्तम्भलाई नयाँ तरिकाबाट सोही ठाउँमा पुनर्निर्माण गरिएको हो भने दुई देशको सहमतिअनुसार नयाँ स्थानमा सीमा स्तम्भ बनाएका छौं। भैरहवामा आयोजित दुई देशको दोस्रो संयुक्त बैठकले सर्वेक्षण टोलीद्वारा निर्माण गरिएका सीमा स्तम्भ प्रमाणीकरण गरेको छ। जसमा नेपालतर्फबाट कपिलवस्तुका प्रमुख जिल्ला अधिकारी अर्जुनप्रसाद पोखरेल, रुपन्देहीका उदयबहादुर राना, भारत सिद्धार्थनगर जिल्लाकी प्रमुख विकास अधिकारी हर्षिता माथु, बलरामपुरका सहायक विकास अधिकारी अरुणकुमार शुक्ला तथा महाराजगन्जका सहायक विकास अधिकारी जस्धिर सिंहले प्रमाणीकरण गरेका हुन्। सर्वेक्षण टोलीका अनुसार यस वर्ष गहिरो नदी परेको ठाउँमा भने सीमा स्तम्भ निर्माण गरिएको छैन। निर्माण बाँकी रहेका सीमा स्तम्भ आगामी वर्षमा निर्माण सुरु गरिने नापी अधिकृत भगीरथ भट्टले बताए। सर्वेक्षण प्रमुख कुमारले अब बस्ने नेपालभारत सर्वे अफिसियल कमिटी (एसओसी) को संयुक्त बैठकले जुनजुन ठाउँमा सीमा स्तम्भ बनाउन निर्देशन दिन्छ, सोहीअनुसार २०२० को डिसेम्बरबाट पुनः सीमा स्तम्भ निर्माण थालिने बताए। दुई देशका अधिकारीहरूको संयुक्त बैठकले सीमा सर्वेक्षण क्रममा देखिएका समस्या समाधान गर्न माथिल्लो निकायलाई अनुरोध गर्ने सहमति गरेका छन्। नेपालभारत अन्तर्राष्ट्रिय सीमा सर्भे गर्न २०१५ देखि सर्वेक्षण टिम खटिएको हो।"
पानीको मूलमा अवरोध गर्दा बहिष्कार,"गोरखा : खानेपानी योजनाको मुहान दर्ता गर्न अवरोध गरेको भन्दै सिरानचोक२ खमारीका खोपबहादुर बस्नेत दुई वर्षदेखि बहिष्कारमा परेका छन्। स्थानीय आमाबाउ समूहको बैठकले आफूलाई बहिष्कार गर्ने निर्णय गरेको पीडित बस्नेतको भनाइ छ। तपाईंलाई बहिष्कार गरिएको छ भन्ने निर्णयको फोटोकपी ल्याएर दिएका छन्, उनले भने, कोही अटेर गरी मेरो परिवारसँग मिले ५ हजार रुपैयाँ जरिवाना गर्ने निर्णय पनि लेखेका छन्। आफूलाई गाउँमा एक्लो बनाएकाले गाउँपालिकाको न्यायिक समितिमा निवेदन दिए पनि न्याय नपाएको उनले सुनाए। समितिले जेठ ५ गते बोलाएको भेलामा गएर फर्किंदा केही युवाले आफू र श्रीमती डिलमाया बस्नेतलाई आक्रमण गरेको उनले बताए। म भागेर बाँचें, चौकीमा गएर शरण लिएँ। बूढीलाई लछारपछार गरे, उनले भने, आँपपीपल अस्पतालमा उपचार गरेर आएकी छन्। खेतभन्दा माथि पानीको मुहान छ। त्यसको केही पानी सिँचाइका लागि छाडिदिनुपर्ने माग बस्नेतले गरेका थिए। सिँचाइभन्दा खानेपानी महत्वपूर्ण भएकाले कत्ति पनि नछाड्ने गाउँलेको तर्क छ। पानी विवाद जिल्ला प्रशासन कार्यालय र जिल्ला प्रहरी कार्यालयसम्म पनि पुगेको थियो। तर, जिल्ला प्रहरीले प्रहरी चौकी हर्मी र हर्मीले न्यायिक समितिमै पठाएको चौकीका असइ केशबहादुर पौडेलले बताए। उनका अनुसार गाउँलेले उक्त मुहानको पानी २५ वर्षदेखि अस्थायी रूपमा उपभोग गर्दै आएका थिए। नेपाल रेडक्रस सोसाइटीले पक्की संरचना बनाइदिने तयारी गरेपछि उपभोक्ताले दर्ता प्रक्रिया अघि बढाएका थिए। मूल दर्ता गर्न अवरोध गरेपछि उनलाई बहिष्कार गर्ने निर्णय गरिएको स्थानीय राजेश भण्डारीले स्वीकार गरे। २५ वर्षदेखि गाउँलेले प्रयोग गर्दै आएको पानीको मूल अब दर्ता गर्न दिन्नँ भनेपछि गाउँले आक्रोशित भएर एक्ल्याउने निर्णय गरेका हुन्, उनले भने, कसैले सहयोग गरे ५ हजार जरिवाना गर्ने निर्णय पनि भएको हो। तर, उचित नदेखिएकाले निर्णय सच्याएको उनले सुनाए। सच्याएको व्यहोरा उहाँको परिवारलाई दिन छुटेको होला, उनले भने। लालपुर्जामा नभएको जग्गामा रहेको मूल पनि दर्ता गर्न नदिएपछि खानेपानी आयोजना असफल भएको उनले सुनाए। स्थलगत अध्ययन गर्न लागेका बेला कुटपिटको घटना भएकाले बस्नेत परिवारले प्रहरी गुहारेको गाउँपालिका उपाध्यक्ष रीता देवकोटाले बताइन्। भोलिपल्ट स्थलगत अध्ययनमा जाने भनेर बैठक स्थगन भयो, उनले भनिन्, तर, बेलुकी कुटपिटको घटना भएर उनीहरू प्रहरी कार्यालयतिर गएछन्। त्यसपछि म भएको ठाउँमा उजुरी आएको छैन।"
