शीर्षक,विवरण
"आफ्नालाई जागिर खुवाउन बेइमानी : परीक्षा एक, प्रश्नपत्र फरक","काठमाडौं : पद उही। परीक्षा उही। हल उही। तर, प्रश्नपत्र फरक। यस्तो कहाँ हुन्छ ? अन्यत्र नभए पनि नेपाल रेडक्रसमा हुँदो रहेछ। रेडक्रसले परीक्षा लिएर छैटौं तह लेखा अधिकृत नियुक्ति गरेको एक वर्ष हुन लाग्यो। आफ्ना मान्छे पास गराउन त्यो परीक्षामा भएको बेइमानी भने बल्ल खुलेको छ। त्यसमा उही हलमा बसेका परीक्षार्थीलाई फरक प्रश्नपत्र दिइएको पाइएको छ। एउटा २० अंकको बाहेक अरू प्रश्न भने दुवैमा मिल्छन्। द्वितीय पत्रको नेपाली खण्डको १ नम्बरमा एउटा प्रश्नपत्रमा आन्तरिक लेखा परीक्षणबारे प्रश्न छ। अर्कोमा अन्तर्राष्ट्रिय व्यापारबारे। प्रश्न फरक बन्नुको प्रकरण भने गम्भीर छ। छैटौं तहको लेखा र प्रशासनको परीक्षा उही दिन उही समय (२०७५ असार २ गते बिहान ८ बजेदेखि) भएको थियो। प्रशासनको एक प्रतिस्पर्धीलाई लेखा समूहको, त्यो पनि फरक प्रश्न दिइयो। उनको परीक्षा बिग्रियो। उनलाई षड्यन्त्रपूर्वक असफल गराएर सफल बनाइयो तत्कालीन अध्यक्ष सञ्जीव थापाकी भतिजी प्रतीक्षा थापालाई। उनी सञ्जीवका कान्छा भाइ राजीवकी छोरी हुन्। राजीव उदयपुरमा रेडक्रस उपशाखाका सभापति छन्। ती परीक्षार्थीलाई प्रशासनकै प्रश्न परेको भए थापाले सम्भवतः पास गर्ने थिइनन्। यसबारे रेडक्रस केन्द्रीय पदपूर्ति समितिका तत्कालीन सभापति सुरेन्द्र ऐरले फरकफरक प्रश्नपत्रको प्रकरण स्वीकारे। अन्तिम घडीमा प्रश्नपत्रको एउटा प्रश्न स्तर नमिल्ने ठानियो। त्यसलाई फेरियो। पुरानो प्रश्नपत्र पनि थाकमै छुटेछ र प्रशासन समूहको एक परीक्षार्थीलाई परेछ, उनले भने, उनको परीक्षा कमसल भयो। उनले रेडक्रसमा उजुरी पनि दिएका छन्। तर, न उनको सुनुवाइ भयो। न परीक्षा रद्ध गरियो। यति ठूलो बदासीलाई प्राविधिक त्रुटिका नाममा अलमल्याउँदै आइएको छ। उता लेखातर्फ छैटौं तहमा उत्तीर्ण अविनास तामाङ रसुवा सभापति बाबुलाल तामाङका भतिज हुन्। दोहोरो प्रश्नपत्रको एउटै तीरले केन्द्रीय अध्यक्ष र जिल्ला सभापतिका भतिजीभजितालाई पास गराइयो, रेडक्रसका एक उच्च अधिकारीले भने, आफ्नालाई सजिलो, अरूलाई जटिल प्रश्न दिइयो। फसाइयो। परोपकारी संस्था रेडक्रसमा अनियमितता अनियन्त्रित भएपछि थापा नेतृत्वको समितिलाई हालै सरकारले विघटन गरेको छ। एक वर्षभित्र चुनाव गराउने गरी डा विश्वकेशर मास्केको अध्यक्षतामा तदर्थ समिति बनाएको छ। त्यसको उपाध्यक्षमा कृष्ण गौतम, महामन्त्री कमल निरौला, कोषाध्यक्ष सीताराम कोइराला, सदस्यमा दीपेन्द्र ढकाल, दीपक मि श्र, लोकराज ढकाललगायत छन्। रेडक्रसका सात आधारभूत सिद्धान्त छन् मानवता, निष्पक्षता, तटस्थता, स्वाधीनता, एकता, विश्वव्यापकता र ऐच्छिक सेवा। यिनै सिद्धान्तलाई आत्मसात् गर्दै रेडक्रस विश्वव्यापी रूपमा परोपकारमा सक्रिय छ। नेपालमा भने ती सबै सिद्धान्त मिच्ने गरिन्छ।"
विद्यालयको सोलार प्यानल हावाले उडायो,रौतहट : बिहीबार राति आएको हावाहुरीले विजयपुर नगरपालिकामा रहेको श्रीमावी दुधिअवामा जडान भएको सोलार प्यानल उडाएको छ।हावाहुरीले चारहजार वाट क्षमताको सोलार प्यानल उडाएको हो। प्यानल खस्दा विधालयको छाना तथा अन्य उपकरण गरी करिब १५ लाख बराबरको क्षति भएको विद्यालय शिक्षक रन्जन खरेलले जानकारी दिए।
अस्पतालमा होहल्ला गर्ने छ पक्राउ,चितवन : भरतपुर अस्पतालमा उपचारका क्रममा बालकको मृत्युपछि होहल्ला गर्ने छजनालाई प्रहरीले पक्राउ गरेको छ। मृत्यु हुनेमा रौतहट जिल्ला चन्द्रपुर नगरपालिका५ बस्ने प्रकाश बस्नेतका १४ महिनाका छोरा रहेका छन्। निमोनियका कारण उपचारका लागि जेठ १४ गते भरतपुर अस्पताल ल्याइएका बालकको उपचारका क्रममा बिहीबार साँझ मृत्यु भएको थियो। बालकको आमाको दूध खाने समयमा दूध सर्किएर मृत्यु भएको अस्पतालले जनाएको छ। बालकको मृत्युपछि बालकका आफन्त र सर्वसाधारण चिकित्सकको लापरवाहीका कारण मृत्यु भएको भन्दै आक्रोशित बनेका थिए। आक्रोशित भीडलाई नियन्त्रणमा लिने क्रममा बिहीबार साँझ प्रहरीले सामाजिक अभियन्ता अर्जुन भुसालसहित छजनालाई नियन्त्रणमा लिएको प्रहरी नायब उपरीक्षक दुर्गाराज रेग्मीले जानकारी दिए।रासस
धारामा पानी लिन गएकी महिलाको हँसियाले हानी हत्या,बझाङ : बझाङको सुर्मा गाउँपालिकामा एक महिलाको हत्या भएको । सुर्मा गाँउपालिका४ सुर्मागाउँकी २५ वर्षीय जुना पुजाराको हत्या भएको हो । सोही ठाउँमा लोकेन्द्र पुजाराले बिहीबार साँझ धारामा पानी लिन भर्दै गर्दा हँसियाले हानी जुनाको हत्या गरेको जिल्ला प्रहरी कार्यालयका प्रमुख डिएपी सूर्य केसीले जानकारी दिएका छन् । जुना लक्षीचन्द्र पुजाराकी श्रीमती हुन् । उनको हत्या गर्ने लोकेन्द्र नाताले ससुरा पर्छन् । जुना र लोकेन्द्रको यसअधि पनि घरायसी विवादका कारण झगडा भएर प्रहरी चौकीमा मिलापत्र गरिएको प्रहरीले जनाएको छ । बिहीबार पनि सामान्य विषयमा झगडा हुँदा लोकेन्द्रले जुनाको टाउकोमा हँसिया प्रहार गरेका थिए । उनको घटनास्थलमै मृत्यु भएको प्रहरीको भनाई छ । दौलीचौर चौकीबाट गएको प्रहरी टोलीले घटनास्थल पुगी अभियुक्तलाई नियन्त्रणमा लिई चौकीमा ल्याएको प्रहरीले जानकारी दिएको छ ।
नक्सापासबिनै सरकारी भवन निर्माण,"धनगढी : धनगढी उपमहागरपालिका क्षेत्रभित्र घर तथा अन्य संरचना निर्माण गर्दा अनिवार्य रुपमा नक्सापास गर्नुपर्ने प्रावधान छ। तर, सुदूरपश्चिम प्रदेश सरकारका मन्त्रालय लगायतका कार्यालयले उक्त प्रावधानको उल्लंघन गरी भवन निर्माण गरिरहेका छन्। सुदूरपश्चिम प्रदेश सभा सचिवालयले नक्सापास नगरि भवन निर्माण कार्य अगाडि बढाएको छ। प्रदेश सभाको नौ कोठे भवन अहिले निर्माणाधिन अवस्थामा रहेको छ भने चमेना गृहको भवननिर्माण सम्पन्न भइसकेको छ। तीन वटा संसदीयदलको कार्यालय तथा प्रदेश सभा समितिको कार्यालयको भवन पनि निर्माणाधिन अवस्थामा छ। वैशाखदेखि भवनको जग हाल्ने काम शुरु भएको छ। प्रदेश सभा सचिवालयले पनि भवनको निर्माण कार्य शुरु गरेको छ। प्रदेश सभाका कानुन उपसचिव तेजप्रकाश जोशीले आर्थिक मामिला तथा योजना मन्त्रालयका कारण भवनको काम अघि बढाउन ढिलाई भएको बताए। भवनको काम यही वर्ष सम्पन्न हुनुपर्ने हो , उनले भने, समयमै काम नभए पुनःम्याद थप गरि काम अघि बढाइने छ। धनगढी उपमहानगरपालिकाका ईन्जिनियर द्विजराज भट्टले प्रदेशसभा सचिवालयले बनाउन लागेको भवनको नक्सापास नगरिएको बताए। मापदण्ड मात्रै माग गरेको तर, नक्सापासका लागि प्रक्रिया सुरु गरेको छैन उनले भने, मापदण्ड पठाएका थियौं, त्यसै अनुरुप निर्माण गर्न लागिएको होला। सडक विस्तारलाई पनि ख्याल गर्दै प्रदेशसभा सचिवालयलाई भवन निर्माणको मापदण्ड दिइएको उनले बताए। प्रदेश सरकारका अधिकांश मन्त्रालयहरुले संरचना निर्माण गरिरहेका छन्। तर, नक्सापासका लागि कुनै पनि मन्त्रालयले स्वीकृति लिएका छैनन्।"
बर्थिङ सेन्टरमा बच्चा जन्माउने महिला बढे,"गुल्मी : मालिका गाउँपालिका२ दर्लिङकी लिला खड्काले २२ वर्षको उमेरमा पहिलो सन्तान जन्माइन् । २१ वर्षमा विहे गरेकी उनले विहेको वर्षदिनमै नपुग्दै बच्चा जन्माइन्। पहिलोपटक सन्तान जन्माउँदा उनमा चिन्ता थियो। घरमै सुत्केरी हुनुपर्ने भएकाले सुत्केरी हुने मिति नजिँकिदै गर्दा उनी झन् झन् पीडामा हुन्थिइन्। तर, गाउँमै बर्थिङ सेन्टर खुलेपछि लिलाको डर हटेको छ। 'पेटमा बच्चा आउँदा गाउँमै बर्थिङ सेन्टर खुल्यो,उनले भनिन्, 'ठूलो अस्पताल पुग्नै परेन्।ढुक्कसँग बर्थिङ सेन्टरमै छोरी जन्माए।'गत मंसिरमा उनले स्वास्थ्यकर्मीको सल्लाहमा बर्थिङमै शकुसल सन्तान जन्माएको बताइन्।खड्काजस्तै गाउँका धेरै महिला बर्थिङ सेन्टर संचालनमा आएपछि खुसी भएका छन्। सदरमुकाम तम्घासबाट टाढा रहेका दुर्गमका महिला प्रत्यक्ष लाभान्वित भएका छन्। दुर्गममा बर्थिङ सेन्टर खुलेपछि गर्भवती महिला खुसी छन्।'गाउँमा बर्थिङ सेन्टर खुलेपछि ढुक्क छौं, खड्काले भनिन्, 'पहिले तमघासमा जानुपथ्र्यो।गाउँमै बर्थिङ सेन्टर खुलेपछि त्यो झन्झट हटेको छ।' स्वास्थ्य संस्थामा शिशु जन्माउँदा भत्ता पाइने र सुरक्षित गर्भवती हुने भएपछि धेरैको आकर्षण बढ्दै गएको छ। मालिका गाउँपालिकाले सबै वडामा बर्थिङ सेन्टर स्थापना गरेको छ। यसअघि उपलब्ध गराइएको बजेटमा गाउँपालिकाले नगद एक हजार रुपैयाँ पोषण भत्ता थपिदिएको छ। नियमित गर्भ जाँच गरी बर्थिङ सेन्टरमा बच्चा जन्माउनेले नगद तीन हजार आठ सय रुपैयाँ रकम पाउने गरेको गाउँपालिका अध्यक्ष रितबहादुर थापाले जानकारी गराए। 'गाउँपालिकालाई हुनेछ।' चालु आर्थिक वर्षमा अभियान संचालनका लागि तीन लाख रुपैयाँ बजेट विनियोजन भएको प्रमुख प्रशासकीय अधिकृत गोविन्द भट्टराईले जानकारी गराए।९५ प्रतिशत महिला बर्थिङमा सुत्केरी हुनुपर्ने, पाँच प्रतिशत रिफर, शतप्रतिशत गर्भजाँच र टिडी खोप लगाएपछि शून्य होम डेलिभरी भएको घोषणा गरिने उनको भनाइ छ। उनका अनुसार गाउँपालिकाका हवाङदी, अर्खावाङ र घमिरका महिला बर्थिङ सेन्टरमै सन्तान जन्माउने गरेका छन्। बर्थिङमा बच्चा जन्माउनेलाई गाउँपालिकाले बर्थ सर्टिफिकेट समेत उपलब्ध गराउँछ। बर्थिङ सेन्टरसम्म आवतजावतका लागि गर्भवतीलाई गाउँपालिकाले निःशुल्क एम्बुलेन्सको समेत व्यवस्था मिलाएको छ। यसले अझ बढी महिलालाई स्वास्थ्य संस्थामा पुगेरै सुरक्षित रुपमा बच्चा जन्माउनका लागि उत्प्रेरित गराएको छ। सदरमुकामबाट दुर्गममा भएपनि गाउँपालिकाले थालेको अभियानले गाउँका महिला सुरक्षित भएको महशुस गरेका छन्। गर्भवती महिलाको घरमा गर्भवतीको लोगोसहित हरियो झण्डा, सन्देशमूलक झण्डा राखिएको स्वास्थ्य संयोजक बसन्त भुषालले सुनाए। उनका अनुसार गत वर्षको तुलनामा बर्थिङमा बच्चा जन्माउनेको संख्या दोब्बरले वृद्धि भएको छ।"
