शीर्षक,विवरण
अतिक्रमित जग्गा खोज्दै वन कार्यालय,"परासी : नवलपरासीका वन कार्यालयले जिल्लामा अतिक्रमित वन क्षेत्रको विवरण खोज्न थालेको छ। नवलपरासी दुई जिल्लामा विभाजन भएपछि कार्यालयले अतिक्रमित क्षेत्रको विवरण खोज्न थालेको हो। अहिले दुवै जिल्लासँग साविककै जिल्लाको तथ्यांक छ। उक्त तथ्यांक पाँच वर्ष पुरानो हो। हरेक वर्ष वन क्षेत्र अतिक्रमण कार्य बढेको छ। तर कार्यालयसँग भने पुरानै तथ्यांक छ। सव डिभिजन कार्यालयमार्फत अतिक्रमित क्षेत्रको तथ्यांक संकलन गर्न लागिएको डिभिजन वन कार्यालय पश्चिम नवलपरासीका सहायक वन अधिकृत मुसाफिर भगतले जानकारी दिए। पश्चिम जिल्लामा चार वटा सव डिभिजन कार्यालय छन्। सुनवल, बर्दघाट अमरौट र प्रतापपुरमा रहेका कार्यालयलाई जिपिएस प्वाइण्टबाट अतिक्रमित क्षेत्रको डाटा संकलन गर्न लगाइएको भगतले बताए। २०७१ सालको तथ्यांकअनुसार दुवै जिल्लाको कुल वन क्षेत्र १ लाख २२ हजार ३ सय ६५ हेक्टर छ। पुरानो तथ्यांकअनुसार पश्चिम जिल्लामा कुल वन क्षेत्र २२ हजार हेक्टर छ। १ लाख ३ सय ६५ हेक्टर वन क्षेत्र पूर्वी जिल्लामा छ। कुल वन क्षेत्रमध्ये ११ हजार ६ सय ७ हेक्टर राष्ट्रिय निकुञ्ज अन्तरगत पर्छ। दुवै जिल्लामा गरी कुल ४ हजार ९ सय १७ हेक्टर अतिक्रमण भएको छ। सबैभन्दा बढी पूर्वी जिल्लामा अतिक्रमण भएको छ। पुरानो तथ्यांकअनुसार पश्चिम जिल्लामा ७ सय ५६ हेक्टर वन क्षेत्र अतिक्रमण भएको छ। पूर्वी जिल्लामा ४ हजार १ सय ६१ हेक्टर वन अतिक्रमण भएको छ। जिपिएसमार्फत राष्ट्रिय वन तथा सामुदायिक वन क्षेत्रमा भएको अतिक्रमणको तथ्यांक संकलन भइरहेको छ। असार मसान्तभित्र विवरण आएपछि पछिल्लो पटक भएको अतिक्रमण क्षेत्रको वास्तविक तथ्यांक आउने डिभिजन वन कार्यालयले जनाएको छ। सबैभन्दा बढी राजमार्ग छेउमा अतिक्रमण हुने गरेको छ। पश्चिम जिल्लामा सुनवल र अमरौटमा सबैभन्दा बढी अतिक्रमण भएको छ। त्यसैगरी पूर्वी जिल्लामा सर्दी र दुम्किवास क्षेत्रमा सबैभन्दा बढी वन क्षेत्र अतिक्रमण भएको वन कार्यालयको तथ्यांकमा उल्लेख छ। अतिक्रमणको प्रकृति संस्थागत बढी छ। मठ, मन्दिर, चर्च, गुम्बालगायतका धार्मिक संस्था, खेलमैदान, खानेपानी टंकी निर्माण, विद्यालयका नाउँमा वन क्षेत्र अतिक्रमण भएका छन्। त्यसैगरी खेतीपाती, हाट बजार व्यवस्थापनका नाउँमा पनि अतिक्रण भएका छन्। केही स्थानमा वन क्षेत्र अतिक्रमण गरेर घना बस्ती नै बसालिएको छ। त्यसैगरी केही व्यक्तिहरुले टहरो र पक्की घर समेत निर्माण गरेर वन अतिक्रमण गरेको वन कार्यालयले जनाएको छ।वन अतिक्रमण गरेर संरचना निर्माण गर्नेमा जनप्रतिनिधिसमेत छन्। अतिक्रमित संरचना हटाइयो पश्चिम नवलपरासीको दाउन्ने क्षेत्रको बतासे डाँडाँमा वन क्षेत्र अतिक्रमण गरेर बनाएका संरचनालाई डिभिजन वन कार्यालयले हटाएको छ। उक्त क्षेत्रमा चारवटा पक्की टहरा निर्माण गरेर केही व्यक्तिहरु बस्दै आएका थिए। करिब पाँच वर्षअघिबाट वन क्षेत्रमा टहरा बनाएर बसेकालाई वन कार्यालयका कर्मचारी, सशस्त्र प्रहरी र नेपाल प्रहरीको संयुक्त टोलीले हटाएको डिभिजन वन कार्यालय परासीका सहायक वन अधिकृत मुसाफिर भगतले जानकारी दिए। पक्की टहरालाई सुरक्षित बनाउनका लागि तारबार गरिरहेको अवस्थामा पुगेको टोलीले संरचनालाई भत्काएको हो। टोलीले टहरो निर्माणमा प्रयोग भएका जस्तापाता, सोलार कुर्सीलगायतका सामाग्रीहरु बरामद गरेर बडेरा क्याम्पमा राखेको वन कार्यालयले जनाएको छ।"
सुरक्षाकर्मीमाथि वन्यजन्तु चोरी शिकारी मुद्दा,"दार्चुला : दार्चुलाका एक सुरक्षाकर्मीमाथि वन्यजन्तु चोरी शिकारी मुद्धा दायर भएको छ। सुदूरपश्चिम प्रहरी गण३ गुल्ममा कार्यरत व्याँस गाउँपालिका२ का सिकेन्द्रसिँह धामी विरुद्ध वन्यजन्तु चोरी शिकारी मुद्दा दायर भएको हो। गत बैशाख ८ गते पुलघाँटमा जिल्ला प्रहरी कार्यालय दार्चुलाका प्रहरी सहायक निरीक्षक लक्ष्मणदत्त भट्ट नेतृत्वको प्रहरी टोलीले प्रहरी जवानको धामीको साथबाट वन्यजन्तु झारलको सुकुटी मासु २ किलो ६ सय ५० ग्राम सहित पक्राउ गरेको थियो। प्रहरी जवान धामीबाट पक्राउ गरिएको सुकुटी मासु वन्यजन्तु झारलको भएको पुष्टि राष्ट्रिय विधि विज्ञान प्रयोगशालाले गरेपछि डिभिजन वन कार्यालय दार्चुलाले जिल्ला अदालतमा मुद्दा दायर गरेको सूचना अधिकारी रणेन्द्र सिंहले बताए। डिभिजन वन कार्यालय दार्चुलाले राष्ट्रिय निकुञ्ज तथा वन्य जन्तु संरक्षण ऐन २०२९ को फदा २६(६) बमोजिम मुद्दा दायर गरेको हो। प्रहरी जवान धामीको साथबाट बरामद गरिएको सुकुटी मासु हिमालयन थारको भएको पुष्टि भएको छ, उनी विरुद्ध अदालतमा मुद्दा दायर गरिएको छ सिंहले भने।"
"जागिर सरकारी, काम निजीमा","विराटनगर : कोसी अञ्चल अस्पताल प्याथोलोजी विभागका कर्मचारीले निजी प्याथोलोजीमा काम गर्ने गरेका छन्। उनीहरू अञ्चल अस्पतालमा कार्यरत चिकित्सकझैं जागिर सरकारी अस्पतालमा भए पनि काम निजी प्याथोलोजीमा गर्छन्। अस्पतालमा काम गर्ने समयावधि उनीहरूले निजीमा दिने गरेका छन्। अञ्चल अस्पतालको प्याथोलोजी विभागका इन्चार्ज मेडिकल टेक्नोलोजिस्ट जयवेन्द्र यादव र ल्याब टेक्निसियन राजेन्द्रप्रसाद साहले अस्पतालको प्रवेशद्वारदेखि ५० मिटरभित्रै निजी प्याथोलोजी खोलेर काम गर्ने गरेका छन्। इन्चार्ज यादवले कोसी अस्पतालको गेट एड्भान्स ल्याब सञ्चालन गर्नुका साथै जनआन्दोलन चोकस्थित म्याक्स इन्टरनेसनल अस्पतालमा समेत प्याथोलोजी सञ्चालन गरेका छन्। त्यस्तै साहले आइस्मा फार्मेसीभित्र प्याथोलोजी सञ्चालन गरेका छन्। पुरानो र अनुभवी दुवै जनाले सञ्चालन गरेको ल्याबमा एक सहयोगी ल्याब असिन्टेट राखेर स्याम्पल (परीक्षणका लागि जम्मा गरिएको रगत, दिसा, पिसाबलगायत) संकल्न भएपछि निजी प्याथोलोजीमा आएर परीक्षण गर्ने गरेको हो। उनीहरूको प्याथोलोजीमा कार्यरत सहयोगीले संकल्न गरेको स्याम्पल अस्पतालभित्रै लगेर दिँदा अस्पतालको उपकरणले परीक्षण गरेर दिने गरेको ल्याबका एक कर्मचारीले बताए। कर्मचारीको काम बिहान ९ देखि २ बजेसम्म कार्यकाल निर्धारण गरिएको छ। तर, बीचमै निजीमा जाने गरेको र अस्पतालमा बसेका बेला निजीमा आएको परीक्षणको काम गर्ने गरेका छन्। तलब अस्पतालबाट लिने गरे पनि कर्मचारीले काम भने निजीमा गर्ने गरेका छन्। विभागका प्रमुख नै अस्पतालको निर्धारित समयमा निजीमा काम गर्छन् भने अन्य कर्मचारीले त गर्ने नै भए नि ! प्याथोलोजी विभागकै एक कर्मचारीले भने। सबै सिनियर कर्मचारी निजीमा काम गर्न आकर्षण भएका छन्, उनले भने, कलेक्सन गरिएको स्याम्पल भोलेन्टियर भई काम गर्ने जुनियरले परीक्षण गर्छन्। र, रिपोर्टमा हस्ताक्षर पनि कतिपयमा ती जुनियरकै हुन्छ। जुन गैरकानुनी हो। प्याथोलोजी विभागमा काम गर्ने कर्मचारीले बिहानको ९ बजेदेखि दिउँसो २ बजेसम्म काम गर्नुपर्ने हो तर त्यहाँ कार्यरत कर्मचारी १० बजे आउने र हाजिरी गरेर निजीको काम गर्न उद्यत उनीहरू बीचमै बाहिरिने गरेका छन्। बिहान १० बजेसम्म ती कर्मचारी आफ्नै लगानीमा सञ्चालन गरेका निजी प्याथोलोजीमा काम गर्छन्। कर्मचारीको अनुशासविहीन कार्य रोक्न मेडिकल सुपरिन्टेन्डेन्ट डारोषण पोखरेलले अस्पताल समय बाहिर गएर काम नगर्न अस्पतालका सबै कर्मचारीलाई पत्रचार गरेको बताए। उनले इमान नभएका कर्मचारी बाहिर जाने गरेको हुन सक्ने बताए। भने, उजुरी आए स्पष्टीकरण सोधेर माथि पठाउनेछौं। उनले अस्पताल समय बाहिर गएर काम गर्ने कर्मचारीलाई पब्लिकले कुनै अवरुद्ध गरे अस्पताल जिम्मेवारी नहुने जानकारी दिए। प्रमुख यादवले सञ्चालन गरेको एड्भान्स ल्याबमा चिकित्सकसमेत राखेका छन्। बिहान ७ देखि बेलुका ७ बजेसम्म सेवा दिँदै आएका छन्। अञ्चल अस्पतालको प्याथोलोजी विभागका इन्चार्ज मेडिकल टेक्नोलोजिस्ट जयवेन्द्र यादवले टाइम पास गर्न सो ल्याब सञ्चालन गरेको बताए। उनले २ बजेपछि कहाँ जाने भनेर ल्याब सञ्चालन गरेको सुनाए।"
३६ हजार घुससहित वडा सदस्य पक्राउ,काठमाडौं : अख्तियार दुरुपयोग अनुसन्धान आयोगले वडा सदस्यलाई घुससहित पक्राउ गरेको छ।एकडारा गाउँपालिका ४ महोत्तरीका वडा सदस्य रामचन्द्र राय (यादव) लाई ३६ हजार घुससहित अख्तियारले रंगेहात पक्राउ गरेको हो। गाउँपालिकाको बजेटबाट निर्माण हुने धर्मशालाको रकम निकासा गराउन सहज गराई दिने भनी सेवाग्राहीसँग उनले घुस लिएको अख्तियार जनाएको छ। घुस लिइसकेको अवस्थामा जलेश्वर नगरपालिका १ स्थित सैलेश चोकबाट रङ्गेहात नियन्त्रणमा लिई अनुसन्धान भइरहेको अख्तियारका प्रवक्ता एवं सहसचिव प्रदीपकुमार कोइरालाले जानकारी दिए।
धरानमा डेंगुको महामारी : ७३ बिरामी उपचारमा,"धरान : पोथी लामखुट्टेको टोकाइबाट सर्ने प्राणघातक रोग डेंगु धरान उपमहानगरमा महामारीका रुपमा फैलिएको छ। पछिल्लो समय धरान उपमहानगरपालिकाले फोहोर व्यवस्थापनमा ध्यान नपुर्याउँदा डेंगुको महामारी फैलिएको स्थानीयको गुनासो छ। धरानमा अहिले ७३ डेंगुका बिरामी भेटिएका छन्। उनीहरुको बीपी कोइराला स्वास्थ्य विज्ञान प्रतिष्ठान र विजयपुर अस्पताल धरानमा उपचार भइरहेको छ। प्रतिष्ठानमा ६० जना र विजयपुरमा १३ जनाको उपचार भइरहेको छ। ७३ बिरामीमध्ये एकजना इटहरीका र अन्य ७२ धरानकै छन्। बीपी कोइराला स्वास्थ्य विज्ञान प्रतिष्ठान धरानका निर्देशक प्राडा गौरीशंकर साहले धरानमा ६० जनामा डेंगुको समस्या देखिएको बताए। प्रतिष्ठानमा आएका एक सय १४ बिरामीको परीक्षण गर्दा ६० जनामा डेंगू देखा परेको उनको भनाइ छ। विजयपुर अस्पतालमा १३ जना डेंगु बिरामीको उपचार भइरहेको निर्देशक प्रभाव खतिवडाले जानकारी दिए। धरान उपमहानगरपालिकाकी कार्यबाहक मेयर मञ्जु भण्डारीले उपमहानगरपालिकामा फगिङ मेसिन नहुँदा तत्काल खरिद गरी डेंगू नियन्त्रणको काम संचालन गर्ने बताइन्। बीपी प्रतिष्ठानले उपमहानगरलाई दुईवटा फगिङ मेसिन उपलब्ध गराएको निर्देशक साहले बताए। धरान १५ का वडाअध्यक्ष नरेशकुमार इवारमले वडामा ३० डेंगू रोगी भेटिएको बताए। उनले वडामा डेंगू रोगको प्रकोप फैलिएपछि स्वास्थ्य प्राविधिक परिचालन गरी नियन्त्रणको प्रयास भइरहेको बताएका छन्। पोथी लामखुट्टेले पानीमा अण्डा पारेर बच्चा निकाल्ने बेलामा मान्छेलाई टोकेपछि बिरामी हुने बीपी प्रतिष्ठान धरानका सहायक प्रवक्ता डा अशोक ऐरले जानकारी दिए। लामखुट्टेले टोकेपछि सुरुमा ज्वरो आउने, शरीरमा दादुरा जस्ता फोका आउने, लिभर पुल्ने र पेटमा पानी जम्ने र गिजाबाट रगत आउने, शरीर दुख्ने लक्षय देखिने उनले बताए। पोथी लामखुट्टे सफा पानीमा मात्र बस्ने भएकाले घरवरपर पानी जम्न दिनु नहुने उनको भनाइ छ। डेंगुको समयमा उपचार नभए बिरामीको ज्यान खतरामा पर्ने भएकाले तत्काल उपचार गर्नुपर्ने बीपी प्रतिष्ठान माइक्रोबाइलोजी विभाग प्रमुख प्राडा बसुधा खनालको सुझाव छ। सुनसरीका निमित्त प्रमुख जिल्ला अधिकारी धु्रवबहादुर खड्काले धरानमा महामारीका रुपमा फैलिएको डेंगु नियन्त्रण गर्न उच्च सर्तकर्ता अपनाइको बताए।"
