शीर्षक,विवरण
'दुई महिलाले अस्वीकार गरेपछि तेस्रो घरमा गएर बलात्कार गरेँ',"रुकुम पश्चिम : एकै दिन तीन महिलालाई जवरजस्ती करणी गरेको भन्दै एक व्यक्तिलाई पक्राउ गरेको छ। जिल्लाको आठविसको नगरपालिका८ डाँफेका २२ वर्षीय केशव आरसीले पुरुष नभएको घरमा गएर जवरजस्ती करणी गरेको भन्दै प्रहरीले पक्राउ गरेको हो। जिल्ला प्रहरी कार्यालय रुकुम प्रमुख प्रहरी नायव उपरीक्षक सुमित खड्काका अनुसार पक्राउ परेका केशवले मंसिर २७ गते राति करिब १ बजे श्रीमान घरमा नभएकी स्थानीय ४० वर्षीया महिला, करिब साढे १ बजे अर्की ४५ वर्षीया एकल महिलालाई जवरजस्ती करणीको प्रयास गरेका थिए। दुई महिलामाथिको प्रयास असफल भएपछि उनले राति करिब २ बजे घरमा सुतिरहेकी अर्की ४० वर्षीया महिलालाई जवरजस्ती करणी गरेको अनुसन्धानबाट खुलेको डिएसपी खड्काले बताए। दुई महिलालाई बलात्कारको प्रयासमा प्रतिकार भएपछि तेस्रो घरमा गएर जवरजस्ती करणी गरेको स्वीकार गरेको प्रहरीको भनाइ छ। ढोकाको खापबाट हात छिराई काठको खुटी (चुक्कुल) निकालेर उनी भित्र प्रवेश गरी प्रतिकार गर्दा पनि जवरजस्ती करणी गरेको पीडित महिलाले प्रहरीमा दिएको उजुरीमा उल्लेख छ। पीडित तीनै जनाले प्रहरी कार्यालयमा उजुरी दर्ता गराएका छन्। पीडितको निवेदनको आधारमा केशवलाई मंसिर ३० गते बेलुका नगरपालिका९ राडी बजारमा लुकिरहेको अवस्थामा पक्राउ गरिएको डिएसपी खड्काले बताए। केशवविरुद्ध जवरजस्ती करणी सम्बन्धि मुद्दा दर्ता भएको छ। जिल्ला अदालतबाट म्याद थप गरेर प्रहरी हिरासतमा राखेर घटनाको थप अनुसन्धान भइरहेको डिएसपी खड्काले बताए।"
"सुनको मूल्य बढ्यो, चाँदी स्थिर",काठमाडौं : नेपाली बजारमा सुनको मूल्य वृद्धि भएको छ। बुधबार तोलामा १ सयले वृद्धि भएर ७१ हजार ६ सय रुपैयाँमा कारोबार भइरहेको नेपाल सुन चाँदी व्यवसायी महासंघले जनाएको छ ।मंगलबार सुन तोलामा ७१ हजार ५ सय रुपैयाँमा कारोबार भएको थियो। महासंघका अनुसार तेजावी सुनको मूल्य तोलामा १ सयले वृद्धि भएर ७१ हजार ३ सयमा कारोबार भइरहेको छ। चाँदीको मूल्य भने स्थिर छ। मंगलबार तोलाको ८ सय ५० रुपैयाँमा कारोबार भएको चाँदी बुधबार पनि सोही मूल्यमा कारोबार भइरहेको छ ।
वडाध्यक्ष छुटाउन नगरपालिका बन्द,"राजविराज : बलात्कार प्रयासको आरोपमा पक्राउ परेका वडा अध्यक्षलाई छुटाउन बुधबारबाट शम्भुनाथ नगरपालिकाको सम्पूर्ण कामकाज ठप्प पारिएको छ। पक्राउ परेका शम्भुनाथ नगरपालिका १२ का वडा अध्यक्ष लक्ष्मी साहको रिहाईको एक सुत्रीय माग राखी नगरपालिका कार्यालय, मातहत वडा कार्यालय र विषयगत कार्यालय अनिश्चितकालका लागि बन्द गरिएको नगर प्रमुख योगेन्द्रप्रसाद चौधरीले बताए । नगर प्रमुख चौधरीले भने, 'झुठा मुद्दा लगाई प्रहरीले कारवाही अगाडि बढाएको विरोधमा निर्दोष वडा अध्यक्ष साह रिहा नभएसम्म नगरपालिका र मातहतका सबै कार्यालयहरु बन्द गरेका हौं।' गैरकानुनी कार्यमा सहयोग नगर्दा व्यक्तिगत रिसइबीका कारण महिलाले वडा अध्यक्षविरुद्ध झुठो उजुरी दर्ता गराई चरित्र हत्या गरेको वडा नम्बर ८ का अध्यक्ष लक्ष्मीकान्त चौधरीले बताए । यौन दुव्र्यवहारको उजुरी दर्ता गरी सप्तरी प्रहरीले वडा अध्यक्ष साहसहित सोही ठाउँका अनीलकुमार राय अमात र नसिम मियाँलाई आठ दिन अघि (गएको मङ्गलबार) पक्राउ गरी कारवाही अघि बढाएको छ । गाउँमा उत्पन्न विवाद पञ्चेती (छलफल) गरी मिलाइ दिने प्रलोभन दिइ गत मङ्सिर १२ गते ३४ वर्षीया महिलालाई बलात्कार प्रयास गरेको आरोपमा वडा अध्यक्ष साहसहित तीनजनालाई पक्राउ गरी अनुसन्धान भइरहेको जिल्ला प्रहरी कार्यालय सप्तरीका एसपी कृष्ण प्रसाईले बताए । उजुरीकर्ता महिलाको १६ वर्षीय छोरा र २३ वर्षीया विवाहिता महिलाको विवाह गर्नुपर्ने गाउँलेको दबाब अस्विकार गर्दै आएकोमा आरोपितले छलफलका लागि भनेर बोलाएर बलात्कार गर्न खोजेको पीडितको आरोप छ । नसिमले स१०प २५८३ नम्बरको मोटरसाइकलमा चढाई घर नलगी एकान्त चौरमा लगेको, अनीलले वडा अध्यक्षले भनेको मान्नु भनी सल्लाह दिएको र वडा अध्यक्षले बलात्कार प्रयास गरेको पीडितको उजुरीमा उल्लेख छ । छोराको विवाह गर्नुपर्ने दबाब र सो समस्या मिलाइ दिने भन्दै त्यसवापत जबरजस्ती सम्बन्ध राख्न खोजेपछि प्रतिकार गर्दा वडा अध्यक्षले ज्यान मार्ने धम्की दिएको महिलाले बताएकी छिन् । राजनैतिक प्रतिशोधको भावनाले नियोजित तरिकाले महिला परिचालन गरी फसाँइएको दावी नेपाली कांग्रेस सप्तरीका सभापति दिनेश यादवको छ । सभापति यादवले झुठो उजुरीकै आधारमा सत्यतथ्य छानबिन नगरी मुद्दा दर्ता गर्नुलाई प्रहरीको गैरजिम्मेवारपूर्ण कार्य भनेका छन् । नेपाली कांग्रेसले वडा अध्यक्ष साहसहित तीनजना निर्दोष रहेको भन्दै गत शुक्रबार राजविराजमा जुलुस प्रदर्शन गरेर जिल्ला प्रशासन कार्यालय र जिल्ला प्रहरी कार्यालयमा ज्ञापन पत्र बुझाएको थियो । यसैगरी सप्तरीको विभिन्न स्थानीय तहका प्रमुख तथा नेकपा, कांग्रेस, समाजवादी पार्टी र राजपा नेपालले झुठा मुद्दा फिर्ता गरी थुनामा राखिएका निर्वाचित जनप्रतिनिधिलाई ससम्मान रिहा गर्न माग गर्दै विज्ञप्ति जारी गरेका छन् । उनीहरुले जिल्ला प्रशासन कार्यालय र जिल्ला न्यायाधिवक्ताको कार्यालयमा ज्ञापनपत्र बुझाउँदै उजुरी फिर्ता लिई अविलम्ब रिहा गर्न माग गरेका छन् । नगरपालिकाको बन्द घोषणाले कर्मचारी हाजिर गरेर घर फर्किएका छन् । शम्भुनाथ नगरपालिकाको सम्पूर्ण कामकाज अनिश्चितकालिन बन्द गरिएको छ। सेवाहरु ठप्प हुँदा सेवाग्राही मर्कामा परेका छन् ।"
जेभिएर स्कुललाई 'एक्सलेन्स टिचिङ अवार्ड',"काठमाडौं : काठमाडौंस्थित जेभियर इन्टरनेशनल स्कुल तथा कलेजलाई एक्सलेन्स टिचिङ अवार्ड प्रदान गरिएको छ । हालै दुवईमा आयोजित एक कार्यक्रममा स्कुललाई उक्त अवार्ड वितरण गरिएको हो । दुवईको अमिटी विश्वविद्यालयमा आयोजित समारोहमा शिक्षा क्षेत्रमा प्रशंसनीय काम गरेको भन्दै जेभियरलाई एक्सलेन्स टिचिङ अवार्ड प्रदान गरिएको हो । कुनै पनि मुलुकको शिक्षा क्षेत्रमा गुणस्तरीय शिक्षण सेवा दिने संस्थालाई यो अवार्ड दिने गरिन्छ । भारतीय प्रधानमन्त्री नरेन्द्र मोदीका विशेष सल्लाहकार डा दीपक बोहरा र अफगानिस्तानका शिक्षा मन्त्रालयका वरिष्ठ शिक्षा सल्लाहकार अताउल्लाह वाहिधारले संयुक्त रुपमा अवार्ड हस्तान्तरण गरे । अवार्ड ग्रहण गरेपछि जेभियरका कार्यकारी निर्देशक लोक वहादुर भण्डारीले भने, 'नेपालका शैक्षिक संस्थाहरु पनि अन्तर्राष्ट्रिय अवार्डका लागि योग्य छन् । यहाँका स्कुल कलेजले पनि अन्तर्राष्ट्रिय स्तरको पढाई दिइरहेका छन् भन्ने प्रमाण यो अवार्डले दिलाएको छ ।' शिक्षा क्षेत्रमा लामो समयदेखि आवद्ध व्यक्तिबाट सञ्चालित जेभिएरले विद्यालयदेखि विश्वविद्यालय तहसम्मको शिक्षा प्रदान गरिरहेको छ ।"
बीपी प्रतिष्ठान : चार वर्षदेखि दिक्षान्त रोकियो,"धरान : बीपी कोइराला स्वास्थ्य विज्ञान प्रतिस्ठान धरानमा चारवर्षदेखि दिक्षान्त रोकिएको छ। प्रतिस्ठानका पदाधिकारीहरूको आन्तरिक द्वन्द्वका कारण धरासायी बनेको प्रतिस्ठानले समयमा दिक्षान्त कार्यक्रम नगर्दा यसको असर चिकित्सा शिक्षामासमेत देखा परेको छ। बीपी प्रतिस्ठानमा एमडी, एमडीएस, एमबीबीएस, बीडीएस, बीएससी नर्सिङ अध्ययन गरिसकेका डाक्टर र नर्स गरि ५ सयभन्दा बढि विद्यार्थीहरू दिक्षित हुनबाट वञ्चित भएको प्रतिस्ठानका जुनियर रेसिडेण्ट वेलफेयर सोसाइटीका अध्यक्ष कविराज पौडेलले बताएका छन्। प्रतिस्ठानमा अध्ययन गरिसकेका चिकित्सक र नर्सहरूले दिक्षान्त नहँुदा शैक्षिक प्रमाणपत्रसमेत पाउन सकेका छैनन् शैक्षिक प्रमाणपत्र नपाउँदा अन्य मेडिकल कलेज र विदेशमा गएर अध्ययन गर्नबाठ वञ्चित भएको उनीहरूको गुनासो छ। चार वर्षदेखि प्रतिस्ठानले अध्ययन पूरा गरेका चिकित्सक र नर्सहरूलाई शैक्षिक प्रमाणपत्र नदिपछि पटकपटक प्रतिस्ठानका पदाधिकारीहरूलाई अनुरोध गर्दासमेत सुनुवाइ नभएकाले अब आन्दोलन गर्नुको विकल्प नरहेको अध्यक्ष पौडेलले बताए। केपी ओली पहिलोपकट प्रधानमन्त्री हुँदा भएको दिक्षान्त कार्यक्रम प्रतिस्ठानका पदाधिकारीहरूको विवादका कारण रोकिएको हो। प्रतिस्ठानका निलम्बित उपकुलपति डा राजकुमार रौनियार, शिक्षाध्यक्ष गुरु खनाल, निर्देशक अरविन्द सिन्हा र रजिष्ट्रार तुलबहादुर श्रेष्ठबीचको आपसी विवादका कारण दिक्षान्त रोकिएको प्रतिस्ठानका कर्मचारी बताउँछन्। रौनियार सेवाग्राहीसँग घुस लिएको अभियोगमा निलम्बनमा परेका छन्। श्रेष्ठको कार्यकाल सकिएको छ, भने शिक्षाध्यक्ष खनाललाई कार्यबाहक उपकुलपतिको जिम्मेवारी दिइएको छ। अध्ययन सकेका विद्यार्थीहरूको प्रमाणपत्रमा शिक्षाध्यक्ष र उपकुलपतिले हस्ताक्षर गर्नुपर्ने हुन्छ। तर दुबै पदमा डा खनाल रहेका कारण पनि दिक्षान्त कार्यक्रम हुन नसकेको प्रतिस्ठानका चिकित्सकको भनाइ छ। एउटै व्यक्तिलाई दुईवटा पदको जिम्मेवारी दिएपछि दिक्षान्त कार्यक्रम गर्न झन समस्या भएको हो। खनालले भने सिनेट बैठक बोलाएर दिक्षान्त समारोह आयोजना गर्ने प्रतिवद्धता जनाएका छन्।"
चिसोले जमे मनाङका हिमताल,"बेसीशहर : अत्यधिक चिसो बढेपछि मनाङमा रहेका हिमताल र झरना जमेका छन्। माथिल्लो मनाङमा रहेको गंगापूर्णसँगै आधादर्जन हिमताल जमेर चट्टानजस्तै बनेका छन्। मनाङको तापक्रम दिउँसो पनि माइनसमा छ। साँझ बिहान त माइनस ६ डिग्री सेल्सियससम्म पुग्ने गरेको छ। चिसो नघट्दा जनजीवन प्रभावित बनेको छ। खानेपानी र ठाडो खोलासमेत जमेका छन्। तालमा मिसिने ससाना हिमनदीसमेत जमेका छन्। फाट्टफुट्ट पुगेका पर्यटक भने जमेको तालमाथि हिँडेर नौलो अनुभव लिइरहेका छन्। जिल्ला प्रहरी कार्यालय मनाङका डिएसपी टिकाबहादुर कार्कीले खोलानाला, खानेपानी जमेको बताए । उनका अनुसार आगो बालेर पाइप तताएपछि मात्र पानी झर्ने गरेको छ । माथिल्लो मनाङका छिरिङ लोप्साङ गुरुङले गंगापूर्ण ताल हिउँदमा बर्सेनि जम्ने गरेको बताए। उक्त ताल समुद्र सतहबाट ३ हजार ५ सय ४० मिटर उचाइमा छ। गुरुङकाअनुसार दिनभर घाम लाग्दा पनि तालको पानी पग्लिएको छैन। पर्यटन व्यवसायी समिति मनाङका अध्यक्ष विनोद गुरुङका अनुसार यहाँका ताल सफा भएका बेला नीलो, वर्षायाममा सेतो र हिउँदमा जम्ने विशेषताका छन्। 'मनाङमा विचित्रको सौन्दर्य छ । यही सौन्दर्य हेर्न पर्यटक आउँछन्, गुरुङले भने, 'चिसो समयमा समेत अलिअलि पर्यटक आइरहेका छन्।' स्थानीयका अनुसार ४ हजार ९ सय १९ मिटरमा रहेको तिलिचो, भ्राकामा पर्ने केंचो ताल, धारापानीको नाचैमा पर्ने डोना अर्थात् ठूलागी र थोंचेमा पर्ने पोंकरलगायतका ताल पनि यतिबेला जमेका छन्। यी विश्व चर्चित ताल हुन्। निस्याङ गाउँपालिका १ ढिकुरपोखरीका पर्यटन व्यवसायी समीरबाबु घलेले चिसो मौसममा पनि पर्यटक आइरहेको बताए । 'धेरैजसो चिसो छल्न बेसी झरिसके। हामी फाट्टफुट्ट आउने पर्यटक कुरेर जसोतसो बसिरहेका छौँ, घलेले भने, 'चिसो भएपनि यो मौसममा हिउँ पर्ने हुँदा मनाङ निकै राम्रो देखिन्छ ।' अन्नपूर्ण संरक्षण क्षेत्र आयोजना (एक्याप) का संरक्षण अधिकृत बाबुलाल तिरुवाकाअनुसार मनाङका ताल हेर्न बर्सेनि हजारौं पर्यटक आउँछन्। हिमताल भएकाले पनि बाह्य तथा आन्तरिक पर्यटकको केन्द्र बन्ने गरेका हुन्। चिसो समयमा जम्ने, हिउँ परेपछि त्यसैले ढाकिने र गर्मीयाममा पग्लिएपछि हिमाली छाया देखिने दृश्यले पर्यटक लोभिने गरेको तिरुवा बताउँछन्। उनकाअनुसार मंसिरपुसदेखि फागुनसम्म हिमताल प्रायः जमिरहेका हुन्छन्। फागुनसम्म हिउँ परिरहने भएकाले तापक्रम बढदै गएपनि जमिसकेको पानी पग्लिन गाह्रो हुन्छ। फागुन अन्तिम सातादेखि भने पग्लिन थाल्छ। चिसोले जमेको माथिल्लो मनाङमा रहेको गंगापूर्ण हिमताल । तस्बिर : अन्नपूर्ण"
