शीर्षक,विवरण
आक्रान्त खाडी,"इरानी सैन्य जनरल कासिम सुलेमानीको हत्यापछि खाडी क्षेत्र त्रासदीमा परेको छ। त्यही विन्दुबाट खाडीमा युद्ध भड्कने खतरा पैदा भएको छ। अमेरिकी राष्ट्रपति डोनाल्ड ट्रम्पको आदेशमा सुलेमानी ड्रोन निशानामा मारिएपछि त्यसको बदला लिने घोषणा इरानले गरेको छ। सुलेमानीको मृत्युसँगै खाडीबारे विश्वभर नयाँ राजनीतिक बहस सुरु भएका छन्। अमेरिकी पेन्टागनको निर्णयप्रति विभिन्न कोणबाट विश्लेषण भइरहेका छन्। मुलुकभित्रै महाभियोग झेलिरहेका ट्रम्पको भत्र्सना हुन थालेको छ। यस्ता घटना बढ्दै जाँदा अमेरिकाको प्रभुत्वसम्मान स्वतः ओरालो लाग्नेछ। अमेरिकाले विगतमा आतंककारी गतिविधिमा लागेका र तानाशाहलाई आक्रमण गरेको भए पनि राज्यसंयन्त्रभित्रको सैन्य नेतृत्वलाई निशाना बनाएको थिएन। खाडी क्षेत्रमा इरानी प्रभाव विस्तार गर्ने नायकका रूपमा परिचित सुलेमानी इरानका सर्वोच्च नेता आयातुल्लाह अली खामेनीका विश्वास पात्र मानिन्थे। उनको नेतृत्वमा खाडीको राजनीति चलेको थियो। सुन्नीहरू पनि रक्षात्मक बन्न बाध्य थिए। एक फरक धार बोकेर हिँडेका सैन्य जनरललाई मारेको विषयमा विश्वमा नयाँ बहस सुरु भएको छ। एउटा राज्यका जिम्मेवार सैन्य अधिकारी कुनै भिडन्त वा आक्रमणमा नभई सीधा निशानामा पर्नु भनेको युद्धको हुँकार गर्नु हो भन्दै खाडीमा अमेरिकीसँग बदलाको भाव बढेको छ। अमेरिकाले यसको मूल्य चुकाउनुपर्ने भन्दै इरानले कडा प्रतिवाद गरिरहेको छ। विश्वले पनि यस्तो कार्यमा अमेरिकालाई पूर्ण साथ दिने अवस्था छैन। सियाहरूको उपस्थिति विश्वभर रहेको र विशेषगरी युरोपमा उनीहरू बाहुल हुने क्रम बढ्दै गएको अवस्थाले पनि अतिवादी गोराहरू उनीहरूको निशानामा पर्न सक्ने आकलन हुन थालेको छ। कतिपय इरानीले राष्ट्रका सच्चा सिपाहीलाई निशानामा पारेर अमेरिकाले कायरता प्रदर्शन गरेको भन्दै यस्ता हत्यामा संलग्न अमेरिकी राष्ट्रपति ट्रम्पलाई उल्टो आतंककारीको दर्जामा राख्नुपर्ने बहस छेडेका छन्। ट्रम्पको यो निर्णयले विश्वका धेरै नागरिक प्रभावित हुनेछन्। खाडी राष्ट्र आक्रान्त हुँदा त्यहाँ कार्यरत अन्य मुलुकका नागरिक असुरक्षित हुनेछन्। यसले गर्दा उनीहरू आफ्नो मुलुक फर्कन बाध्य हुन्छन्। केही मुलुकले आफ्ना नागरिकलाई सचेत रहन र परिस्थिति बिग्रिएमा फर्कन सूचनासमेत जारी गरिसकेका छन्। अझ कडा असर त दक्षिण एसियाली राष्ट्रहरूबाट त्यहाँ काम गर्न गएका नगारिकमाथि पनि पर्नेछ। नेपाली पनि ३० लाख बढी खाडी क्षेत्रमा कार्यरत छन्। यस्तो अवस्थामा नेपालले पनि आफ्नो हितानुकूल निर्णय लिनुपर्छ। नेपाल सरकार पर्ख र हेर मा रहेको भए पनि त्यहाँ युद्ध भड्कँदै गए के गर्ने र आफ्नो नागरिकको सुरक्षा कसरी गर्ने भनेर आफ्नो दृष्टिकोण सार्वजनिक गर्नुपर्छ। हुन त तत्काल उद्धार गर्न आवश्यक परेमा के गर्ने भन्दै त्यसको तयारीसमेत सरकारले गरिरहेको छ। तर, त्यहाँको राजनीतिक विषयमा भने नेपाल सरकारले अझै कुनै धारणा सार्वजनिक गरेको छैन। सुलेमानी हत्याबारेमा अन्तर्राष्ट्रिय बहस भने भइरहेको छ। यसलाई कैयन्ले ट्रम्पको युद्धउन्माद र सनकसमेत भनेका छन्। यो घटना अन्तर्राष्ट्रिय कानुन र मानव अधिकारका आधारभूत मूल्यमान्यताविपरीत रहेकाले अमेरिकाको लोकतान्त्रिक साख र विश्व नेतृत्वको आधिकारिकता नै अन्योलमा छ। हुन त, सुलेमानी विगतमा पनि अमेरिकी निशानामा थिए, तर राष्ट्रपतिहरूले यस प्रकारको निर्देशन दिएका थिएनन्। सार्कका सबैजसो मुलुकका कामदार खाडी क्षेत्रमा कार्यरत छन्। यो घटनाले चार दशकअघिको इरानअमेरिका सम्बन्धलाई झल्काएकाले सार्क राष्ट्रहरूले पनि यसमा साझा धारणा बनाउन आवश्यक छ।"
खतिवडा हट्ने चर्चाले बढ्यो सेयरबजार,"काठमाडौं : सेयरबजारप्रति अनुदार छवि बनाएका अर्थमन्त्री डा युवराज खतिवडाको राष्ट्रियसभा सदस्यको दुईवर्षे कार्यकाल फागुनमा सकिँदै छ। उनको दल नेकपाले राष्ट्रियसभामा यसअघि प्रतिनिधित्व गरेकालाई नदोहोर्याउने निर्णय गरेसँगै खतिवडाको मन्त्री पद गुम्ने चर्चाको प्रभाव सेयरबजारमा परेको छ। खतिवडालाई सांसद नबनाइएमा उनको मन्त्री पद ६ महिनापछि स्वतः सकिनेछ। खतिवडाको मन्त्री पद सकिन लागेकै कारण आइतबार र सोमबार सेयर बजार लगातार बढेको विश्लेषण गरिएको छ। चार महिनापछि नेपाल स्टक एक्सचेन्ज (नेप्से) परिसूचक १२ सय अंकमा पुगेको छ। २०७६ भदौ १० मा १२०८ अंकबाट झरेपछि पहिलोपटक सोमबार १२००६९ अंक पुगेको हो। सोमबार नेप्सेमा ८४ करोड २५ लाख ८२ हजार रुपैयाँको व्यापार भएको छ। आइतबार नेप्से परिसूचक ११८२४३ थियो। यो रकम विगतमा सेयर बजार घट्दाको समयको तुलनामा दैनिक औसत कारोबारको दोब्बर हो। कारोबार रकम बढ्नुले लगानीकर्ता सेयरबजारप्रति उत्साहित देखिएका छन्। आइतबार पनि नेप्से परिसूचक १४ अंक बढेको थियो। नेप्सेले लामो समयदेखि हतोत्साही लगानीकर्तालाई मनोबल दिएको छ, नेपाल इन्भेस्टर्स फोरमका महासचिव राजन लम्सालले भने। सेयरबजारको बढोत्तरीको आधार भने कमजोर छ। गत साता अन्त्यमा नेकपाले राष्ट्रियसभामा उम्मेदवार नदोहोर्याउने निर्णय गरेको थियो। लगानीकर्ताको अर्थमन्त्री लक्ष्यित मनोबल बढेको सेयरबजारले प्रतिनिधित्व गरेको छ। खतिवडा राष्ट्रपतिबाट मनोनीत राष्ट्रियसभा सदस्य हुन्। अन्य उम्मेदवारको हकमा नदोहोरिने निर्णयका कारण खतिवडालाई मात्र दोहोर्याएर मनोनीत गराउने सवालमा नेकपालाई नैतिक दबाब परेको छ। सेयरबजारप्रति खतिवडाको धारणाबारे नेकपाभित्रै आलोचना हुने गरेको छ। खतिवडाले सेयरबजारलाई तरकारीको भाउ जस्तो भनेर तुलना गरेपछि नेकपाकै एक नेताले अर्थतन्त्रमा सेयरबजारमा हुने कारोबार मानव शरीरमा मुटुले रगत पम्प गरेजस्तै भएकाले उदार हुन आग्रह गरेका थिए। खतिवडाले सेयरबजारलाई अनुत्पादक क्षेत्रका रूपमा व्याख्या गर्दै आएका छन्। यस्तै उनले सेयर कारोबार मूल्यमा पुँजीगत लाभ कर लगाउने विवादास्पद निर्णयको विरोधमा सेयर लगानीकर्ताले २०७५ जेठ २२ मा कारोबार ठप्प बनाएका थिए। सेयर लगानीकर्ताका अनुसार अर्थमन्त्रीले सेयर बजारको हुर्मत लिएकै कारण नेप्सेमा सूचीकृत लघुवित्त र बिमा कम्पनीबाहेक सबै वित्तीय संस्थाको सेयरको मूल्य आम्दानी अनुपात २०६८ साल असारमा बजार क्र्यास हुँदाकै आसपासमा पुगेको बताएका छन्। बैंकहरूले थप निष्कासनपछि आपूर्ति बढेर सेयरको मूल्य आम्दानी अनुपात घट्दो क्रममा थियो। अर्थमन्त्री खतिवडाले नियमित रूपमा सेयरबजारविरुद्ध अभिव्यक्ति दिन थालेपछि लगानीकर्ताले मनोबल गुमाउन पुगे, एक लगानीकर्ताले भने, अर्थमन्त्रीले सेयरबजारप्रति सधैं पूर्वाग्रही भावना राखेकाले बजार लामो समय ओरालो लाग्न पुग्यो। खतिवडा २०७४ फागुन १४ मा अर्थमन्त्री बनेका थिए। खतिवडा अर्थमन्त्री हुँदा नेप्से परिसूचक १३५८९५ बिन्दुमा थियो। त्यतिबेला कुल बजार पुँजीकरण १५ खर्ब ८९ अर्ब रुपैयाँ थियो। सोमबार नेप्से परिसूचक १२०० अंकको थ्रेसहोल्ड पार गरेपछि १५ खर्ब ३० अर्ब रुपैयाँ छ। यो वृद्धिले लय समातेमा लगानीकर्ताले लाभ पाउन सक्छन्। अहिलेको स्तरबाट उकालो लागेमा नेप्से १२८४ अंकसम्म उक्लिन सक्ने देखाएको छ। यो स्तरबाट घटेमा भने ११४९ अंकमा रोकिन सक्छ।"
नेपाल र चीनका गृहमन्त्रीबीच सुरक्षा छलफल,"बेइजिङ : नेपाल र चीनका गृहमन्त्रीबीच सीमा सुरक्षा, द्विपक्षीय सम्बन्ध र चीनविरोधी गतिविधिमा कडाइ गर्ने विषयमा बेइजिङमा छलफल भएको छ। गृहमन्त्री रामबहादुर थापा र चीनका सार्वजनिक सुरक्षामन्त्री चाओ खचीबीच दुई देशका सुरक्षा चासोका विषयमा छलफल भएको बेइजिङस्थित नेपाली दूतावासले जनाएको छ। दूतावासका अनुसार दुई देशले चीनमा अपराध गरेर नेपालमा लुक्ने, नेपालमा बसेर दुवै देशको सुरक्षामा खलल पुर्याउने विरुद्ध सहकार्य गर्ने भएका छन्। गृहमन्त्री थापाले सोमबार बेइजिङमा चीनको राज्य परिषद्का सदस्य तथा सार्वजनिक सुरक्षामन्त्री चाओसँग द्विपक्षीय सम्बन्ध उचाइमा लैजान सहकार्य अपरिहार्य रहेको बताएका थिए। गृहमन्त्री थापा चीनको सार्वजनिक सुरक्षा मन्त्रालयको निमन्त्रणामा आइतबार बेइजिङ आइपुगेका हुन्। उनीहरूबीच चीनविरोधी गतिविधि हुन नदिने तथा दुई देशबीचको सीमा सुरक्षा सबल बनाउने विषयमा पनि छलफल भएको थियो। चिनियाँ पक्षले तिब्बत, हङकङ र सिनच्याङ चीनको आन्तरिक मामिला भएको र यस सम्बन्धमा अरू देशले हस्तक्षेप गर्नु आवश्यक नभएको प्रस्ट पारेको थियो। मन्त्री थापाले नेपाली भूमिमा चीनविरोधी गतिविधि हुन नदिने प्रतिबद्धता जनाएका छन्। गृह मन्त्रालयका प्रवक्ता केदारनाथ शर्माले चिनियाँ मन्त्री तथा सुरक्षा अधिकारीसँग मैत्रीपूर्ण तथा सौहार्द भेटवार्ता भएको जानकारी दिए। सुपुर्दगी सन्धिका विषयमा केही छलफल भयो कि भन्ने जिज्ञासा प्रवक्ता शर्माले भने, यो एउटा मैत्रीपूर्ण निमन्त्रणामा भएको भेटघाट कार्यक्रम मात्र हो। कुनै किसिमको सन्धिसम्झौता भएको छैन। गत असोजमा राष्ट्रपति सी चिनिफिङको भ्रमणका क्रममा कानुनी सहायतासम्बन्धी सम्झौतामा हस्ताक्षर भएको थियो। यही आधारमा सुर्पुदगी सन्धि पनि हुन सक्ने अनुमान छ। मन्त्री थापाले चिनियाँ समकक्षीलाई नेपाल भ्रमणको निम्तो दिएका छन्।"
