शीर्षक,विवरण
"पश्चिमी वायुको प्रभाव : मुलुकभर चिसो बढ्यो, अझै हिमपात र वर्षाको सम्भावना","काठमाडौं : पश्चिमी वायु सक्रिय हुँदा मुलुकभर चिसो बढेको छ।चिसोले गर्दा जनजीवन कष्टकर बन्दै गएको छ। वायु सक्रिय हुँदा पश्चिमी भूभागमा हल्का वर्षा र उच्च हिमाली भेगमा हिमपातको संभावना रहेको मौसम पूर्वानुमान महाशाखाले जनाएको छ। मंगलबार दिउँसो मध्य र पूर्वी भागमा मौसम सामान्य रहेपनि रातीदेखि बादल देखिने संभावना रहेको छ। देशको पश्चिमी भूभागमा सामान्य बदली र बाँकी भूभागमा आंशिकदेखि सामान्य बदली रही उच्च पहाडी तथा हिमाली भूभागका थोरै स्थानमा हिमपातको संभावना रहेको मौसम पूर्वानुमान महाशाखाका मौसमविद् गंगा नगरकोटीले जानकारी दिइन्।उनले भनिन्,' पश्चिमी वायु सक्रिय हुँदा पश्चिमका थोरै स्थानका साथै मध्य र पूर्वी भूभागका एक दुई स्थानमा हल्का वर्षाको संभावना छ।उपत्यकाको मौसम भने सफा नै छ।' काठमाडौंको आजको तापक्रम न्यूनतम ४२ र अधिकतम १६३ डिग्री सेल्सियस रहेको छ। यस्तै जुम्लाको तामक्रम न्युनतम ०३ र अधिकतम ७७ डिग्री सेल्सियस छ। सिमरामा भने सबैभन्दा उच्च तापक्रम रहेको छ। त्यहाँको तापक्रम न्यूनतम ९६ र अधिकतम २३५ डिग्री सेल्सियस रहेको छ। यस्तो छ तीन दिनको मौसम पौष २२ गते दिउँसो : देशको पश्चिमी भुभागमा सामान्य बदली र बांकी भूभागमा आंशिकदेखि सामान्य बदली रही उच्च पहाडी तथा हिमाली भूभागका थोरै स्थानमा हल्का देखि मध्यम हिमपात तथा पश्चिमका थोरै स्थानमा साथै मध्य र पूर्वी भूभागका एक दुई स्थानमा हल्का वर्षाको संभावना छ । रातीः देशको पश्चिमी भूभाग, मध्य र पूर्वका पहाडी भुभागमा सामान्य बदली र बांकी भुभागमा आंशिक देखि सामान्य बदली रही उच्च पहाडी तथा हिमाली भूभागका थोरै स्थानहरुमा हल्का देखि मध्यम हिमपात तथा पश्चिमका थोरै स्थानहरुमा साथै मध्य र पुर्वी भूभागका एक दुइ स्थानमा हल्का वर्षाको संभावना छ । पौष २३ गते दिउँसो : देशभर सामान्य बदली रही पश्चिमका केही स्थानहरुमा र मध्य र पूर्वका थोरै स्थानहरुमा हल्का देखि मध्यम वर्षाको संभावना छ। देशका उच्च पहाडी तथा हिमाली भूभागका केही स्थानहरुमा मध्यम देखि भारी हिमपात हुने सम्भावना रहेको छ। रातीः देशभर सामान्य बदली रही पश्चिमका केही स्थानहरुमा र मध्य र पूर्वका थोरै स्थानहरुमा हल्का देखि मध्यम वर्षाको संभावना छ। देशका उच्च पहाडी तथा हिमाली भूभागका केही स्थानहरुमा मध्यम देखि भारी हिमपात हुने सम्भावना रहेको छ। पौष २४ गते दिउँसो : देशभर आंशिक देखि सामान्य बदली रही केही स्थानहरुमा हल्का देखि मध्यम वर्षाको संभावना छ। देशका उच्च पहाडी तथा हिमाली भूभागका केही स्थानहरुमा मध्यम देखि भारी हिमपात हुने सम्भावना रहेको छ। रातीः देशको मध्य तथा पूर्वी भूभागमा सामान्य बदली तथा पश्चिमका भूभागमा आंशिक बदलि रही पश्चिमका एकदुई स्थानमा साथै मध्य र पूर्वका थोरै स्थानमा हल्का देखि मध्यम वर्षाको संभावना छ। देशका उच्च पहाडी तथा हिमाली भूभागका केही स्थानमा मध्यम देखि भारी हिमपात हुने सम्भावना रहेको छ।"
मंगलबार राजधानीका यी स्थानमा ७ घण्टा विद्युत कटौती हुँदै,"काठमाडौं : राजधानीका केही स्थानमा मंगलबार ७ घण्टा विद्युत कटौती हुने भएको छ। महाराजगन्ज वितरण केन्द्रको ओम फिडरबाट वितरित लाइन बिहान ९ बजेदेखि दिउँसो ४ बजेसम्म कटौती हुने भएको हो। उक्त फिडर अन्तर्गत सुकेधारा, न्यूकोलोनी, ढलाने पुल तथा निलो पुल लगायतका स्थानमा विद्युत कटौती हुने नेपाल विद्युत प्राधिकरणले जनाएको छ। प्राधिकरणले मंगलबार एक सूचना जारी गर्दै चक्रपथ विस्तारका लागि रुख कटान गरिने भएकाले विद्युत कटौती हुने जानकारी दिएको हो ।"
मालपोतका सुब्बा घुससहित पक्राउ,"काठमाडौं : मालपोत कार्यालय साँखु, काठमाडौंका नायव सुब्बासहित दुईजना घुससहित पक्राउ गरेका छन्। अख्तियार दुरुपयोग अनुसन्धान आयोगले नासु रामेश्वर कुइकेल र लेखापढी व्यवसायी श्रीराम सापकोटालाई घुस लिदालिदै पक्राउ गरेको हो। नायव सुब्बले लेखापढी व्यवसायी श्रीराम सापकोटासँग दृष्टी बन्दकको लिखत पास गरे वापत दुई हजार लिदैंगर्दा अख्तियार कार्यालय साँखु परिसरबाट पक्राउ गरेका अख्तियारका प्रवक्ता प्रदीपकुमार कोइरालाले जानकारी दिए।"
'प्रहरीलाई सक्दो सहयोग गर्नुहोस्',"भैरहवा : पाँच नम्बर प्रदेशका प्रहरी नायब महानिरीक्षक (डीआइजी) सुरेशविक्रम शाहले नागरिकले प्रहरी संगठनलाई सहयोग गर्न आवश्यक रहेको बताएका छन् ।मंगलबार रुपन्देहीको इलाका प्रहरी कार्यालय मर्चवारको नवनिर्मित भवन र ब्यारेकको उद्घाटन गर्दै उनले भने, 'यो संगठन तपाईहरुको हो, यसलाई मलजल गर्नुस्, हामी लाग्छौं र तपाईंहरुको सेवामा लागिरहन्छौँ।' उनले नागरिकको सहयोगविना प्रहरीले मात्र केही गर्न नसक्ने बताउँदै अपराधमुक्त समाज निर्माणका लागि प्रहरीलाई सहयोग गर्न आग्रह गरे ।'गलत क्रियाकलाप गर्ने समूहव्यक्तिको सूचना दिएमा हामीले समाजलाई शान्त राख्न सक्छौँ, उनले भने, 'जबसम्म तपाईहरुको सहयोग पाउँदैनौं तबसम्म अपराध अनुसन्धानमा सफल भइदैन।' उनले नागरिकलाई पीडा दिने क्रियाकलाप भएमा आफूहरु नागरिकको प्रहरी हुन नसक्ने भन्दै आचरण, व्यवहारमा थप सुधार ल्याउन आफू मातहतका कर्मचारीलाई निर्देशन दिए। नयाँ भवनजस्तै प्रहरीको सेवा उत्कृष्ठ हुने बताउँदै सत्य सेवा सुरक्षणम् मूलमन्त्र अंगालेर काम गर्ने उनले निर्देशन दिए । मर्चवार क्षेत्रको सम्मरीमाई गाउँपालिकाका अध्यक्ष जितेन्द्रनाथ (बब्लु) शुक्लले विगत र हालको पुलिसिङ्गमा धेरै परिवर्तन आएको भन्दै हाल प्रहरी सामुदायसँग मिलेर अघि बढेको कार्य सराहनीय रहेको उल्लेख गरे । मर्चवारी गाउँपालिकाका अध्यक्ष केशवनन्द बनियाँले खाँदै गरेको खाना समेत छाडेर नागरिकको सेवामा लाग्ने प्रहरीको तलब निकै न्यून रहेको भन्दै थप वृद्धि गर्नेपर्ने माग राखे। कुल २३ कठ्ठा क्षेत्रफलमा रहेको इप्रका मर्चवारको नयाँ भवन १ करोड ५५ लाख ८३ हजार रुपैयाँको लागतमा निर्माण भएको रुपन्देहीका निमित्त प्रहरी प्रमुख प्रहरी नायब उपरीक्षक खड्क बहादुर खत्रीले बताए।उनले आधुनिक डिजाइनमा निर्माण भएको भवनले नागरिकको सेवा प्रवाहमा सहजता ल्याउनेमा विश्वास व्यक्त गरे।"
"सुनचाँदीको मूल्य घट्यो, कति पुग्यो तोलाको?","काठमाडौं : नेपाली बजारमा निरन्तर उकालो लागेको सुनको मूल्य मंगलबार ५ सयले घटेको छ। आज सुन तोलाको ७५ हजार ५ सय रुपैयाँमा कारोबार भइरहेको नेपाल सुन चाँदी व्यवसायी महासंघले जनाएको छ।तेजावी सुन ७५ हजार २ सय रुपैयाँ कायम गरिएको महासंघले जनाएको छ। सोमबार सुन तोलामा ५ सयले बढेर ७६ हजार पुगेर नयाँ रेकर्ड कायम गरेको थियो।आइतबार ७५ हजार ५ सय रुपैयाँमा कारोबार भएको थियो। यस्तै, चाँदीको मूल्यमा सामान्य गिरावट आएको छ। चाँदी ९ सय रुपैयाँमा कारोबार भइरहेको छ।सोमबार चाँदी तोलामा २० रुपैयाँ बढेर ९२० रुपैयाँमा कारोबार भएको थियो।"
