शीर्षक,विवरण
मोटरसाइकलमा विश्व भ्रमण,"स्याङ्जा : स्याङ्जाका ३० वर्षे यामप्रसाद लुइँटेलले शुक्रबारदेखि मोटरसाइकलबाट विश्वभ्रमणको यात्रा सुरु गरेका छन्। आठ लाख किलोमिटर यात्रा गरी गिनिज बुकमा नाम लेखाउने उद्देश्य लिएर उनी विश्वभ्रमणमा निस्केका हुन्। वालिङ् नगरपालिका १४ तमादीका लुइँटेलले १० वर्षे विश्व भ्रमण यात्रा स्याङ्जादेखि सुरु गरेका हुन्। आमा, बुवा, दाई, भाउजुलगायत घरपरिवारको आशीर्वाद लिएर निस्केका लुइँटेललाई जिल्ला समन्वय समिति स्याङ्जाले पनि विधिवतरूपमा विश्वभ्रमण यात्रा शुभारम्भ कार्यक्रमको आयोजना गरी विदाइ गरेको छ। कालो वर्ण, अग्लो कद, अग्लो मोटरसाइकलको पछाडि नेपालको झण्डा फहराउँदै हुइँकिँदै निस्केका लुइँटेलले भ्रमण वर्ष २०२० को अवसर पारेर नेपाललाई विश्वभर चिनाउने अभियानमा लागिपरेको बताए। विश्वका १ सय ९२ देश पुग्ने लक्ष्य लिएका उनले ८ लाख किलोमिटर मोटरसाइकल यात्रा पूरा गरी गिनिज बुकमा रेकर्ड राख्ने जनाए। हाल गिनिज बुकमा नाम लेखाउन सफल अस्ट्रियाका इमेलिया स्टोनको ७ लाख ३५ हजार किलोमिटर यात्रा रहेको छ। पारिवारिक अवस्था कमजोर हुँदा उच्च शिक्षा पढन नपाएको बताउँदै उनले २०६५ सालमा साउदी अरब पुगेको र फर्केपछि नेपालमै व्यवसाय गरे पनि केही उपलब्धि हुन नसकेको उनले दुखेसो पोखे। उनले थपे, सानो र राम्रो हाम्रो नेपाललाई विश्वसामु चिनाउन दुई वर्ष अघिदेखि विभिन्न देशका भाषा, सवारी साधन चलाउने सीप सिकेको छु। नेपालका ७ सय ५३ स्थानीय तहको भ्रमणपछि उनी विश्व भ्रमणमा निस्कने भएका छन्। करिब १० वर्षमा पुनः उनी स्याङ्जा फर्केर आउँदा विभिन्न देशमा पुगेको डकुमेन्ट्रीसहित आउने उनले प्रतिबद्धता जनाए। दैनिक दुई सय ५० किलोमिटर मोटरसाइकल यात्रा गर्ने उनको लक्ष्य छ। जिल्ला समन्वय समितिका प्रमुख सीता सुन्दास, गल्याङ प्रमुख भूपराज अधिकारी, पुतलीबजार नगर उपप्रमुख महेश पुरी, निमित्त प्रमुख जिल्ला अधिकारी धु्रव गिरी, जिल्ला समन्वय अधिकारी विश्वप्रकाश अर्याल, पत्रकार महासंघका उपाध्यक्ष अर्जुन काफ्लेलगायतले लुइँटेलको यात्राको सफलताको कामना गर्दै आवश्यक सहयोग गर्ने प्रतिबद्धता जनाए। अविवाहित लुइँटेल आफ्नो अभियानलाई सबैले सहयोग गर्ने जनाएका कारण विश्व भ्रमणजस्तो यात्रामा सहभागी हुने अवसर मिलेको बताउँछन्। शुक्रबारदेखि नै उनले आफ्ना आमा, बुबा, दाजु, भाउजु र भतिजीको आशीर्वाद र माया बोकेर परिवारको अनुमति र सहमतिमै विश्व भ्रमणमा निस्केको जनाए।"
डलर एकै दिनमा १ रुपैयाँ १ पैसा महँगियो,"काठमाडौं : नेपाल राष्ट्र बैंकले आइतबारका लागि अमेरिकी डलरको बिक्री मूल्य १ सय १५ रुपैयाँ ८० पैसा तोकेको छ। यो गत शुक्रबारको तुलनामा १ रुपैयाँ १ पैसा महँगो हो। धेरै महिनापछि अमेरिकी मुद्रा ग्रिनव्याक यति फराकिलो दरले महँगिएको छ। एक सातायता अन्तर्राष्ट्रिय बजारमा सुन र पेट्रोलियमको भाउ ओरालो लाग्न थालेपछि केही राहत पाइने आशा पलाइरहेको बेला अमेरिकी मुद्राले पुनः निराशा थपेको छ। डलर महँगिएमा सुन र तेलमात्र होइन, अन्तर्राष्ट्रिय बजारमा सस्तिन थालेका कुनै पनि सामान किन्न नेपाली ग्राहकले भने फेरि महँगो मूल्य तिर्नुपर्ने हुन्छ। मूलतः भारतीय सेयर बजारमा बिक्रीचाप ह्वात्तै चुलिएपछि शुक्रबार त्यहाँको मुद्रा भारतीय रुपैयाँ (भारु) एकैदिन ६८ पैसासम्म सस्तिन पुग्यो। भारतीय बजारमा शुक्रबार अमेरिकी डलर ७१ रुपैयाँ ९० पैसादेखि ७२ रुपैयाँ २९ पैसासम्म कारोबार भयो। अन्तिम समयमा भारु केही बलियो भएकाले नेपाली रुपैयाँको अवमूल्यन १ रुपैयाँमै सीमित भएको हो। शुक्रबार भारतको प्रमुख सेयर सूचक बीएसई (बम्बे स्टक एक्सचेञ्ज) सेन्सेक्स १४ सय ४८ अंक अर्थात् ३ दशमलव ६४ प्रतिशत घट्यो। पाँच वर्षअघि अर्थात् २४ अगस्ट २०१५ मा १६ सय २४ अंक घटेको बीएसई सेन्सेक्सका लागि गत शुक्रबार त्यसयताकै सबैभन्दा खराब दिन बनेको छ। भारतको अर्को धितोपत्र बजार नेसनल स्टक एक्सचेञ्जको सूचक एनएसई निफ्टी ४ सय ३१ अंक अर्थात् ३ दशमलव ७१ प्रतिशत घट्यो। यो एक हिसाबले भारतीय सेयर बजारमा गएको पहिरो नै हो। चीनबाट फैलिएको कोरोना संक्रमणका कारण विश्व अर्थतन्त्र जोखिममा परेको छ। त्यस्तो बेला छिमेकको सबैभन्दा ठूलो अर्थतन्त्र भएकाले भारत सर्वाधिक प्रभाव खेप्ने मुलुकको सूचीमा अगाडि नै पर्छ। यही त्रासले विदेशी लगानीकर्ताले आफ्नो स्वामित्वको सेयर भटाभट बेचेर पैसा फिर्ता लान थालेका छन्। भारतमा विदेशी लगानीकर्ताले पनि सेयरमा लगानी गर्न पाउँछन्। उनीहरूलाई सेयरमा गरेको लगानी फिर्ता लान भारतको केन्द्रीय बैंकले अमेरिकी डलर उपलब्ध गराउनुपर्छ। यसरी डलरको माग एक्कासि चुलिएपछि भारुसँगको यसको विनिमय दर पनि अकासिएको छ। अन्तर्राष्ट्रिय समाचार संस्था रोयटर्सले शुक्रबारमात्रै भारतमा विदेशी पोर्टफोलियो व्यवस्थापकले १४ अर्ब २९ करोडको सेयर बेचेको जनाएको छ। ऋणपत्र पनि भारी मात्रामा बेचिएको, तर त्यसको यकिन तथ्यांक उपलब्ध नभएको रोयटर्सले भनेको छ। पछिल्ला अनुमानअनुसार कोरोना भाइरसका कारण विश्व अर्थतन्त्रको वृद्धिदर कम्तीमा ३० आधारविन्दु अर्थात् २ खर्ब ५० अर्ब अमेरिकी डलरले घट्ने भएको छ। भारतले सन् २०१९ को अन्तिम त्रैयमासमा आर्थिक वृद्धिदर ४५ प्रतिशतमा खुम्चिएको प्रतिवेदन गत बुधबार सार्वजनिक गरेको थियो। पछिल्ला दिनमा विकासोन्मुख ठूला अर्थतन्त्रसँगै अमेरिकी सेयर बजार पनि ओरालो लाग्न थालेको छ। उता १८ मार्चमा बस्ने अमेरिकी केन्द्रीय बैंक फेडेरल रिजर्भको बोर्ड बैठकले कम्तीमा २५ आधारविन्दुले ब्याजदर कटौती गर्ने सम्भावना बढेको छ। यसले गर्दा जापानी येन भने डलरको तुलनामा महँगिएको छ। सम्भावित विश्व आर्थिक मन्दीबाट जोगिन संसारभरका लगानीकर्ता सेफ हेभन अर्थात् सर्वाधिक सुरक्षित मानिने मुद्रा येनतर्फ आकर्षित भएका छन्। यसले नेपाली बजारमा पनि येनको भाउ महँगिएको छ। शुक्रबार १० रुपैयाँ ४२ पैसामा पाइने १० येन किन्न आइतबार १० रुपैयाँ ६६ पैसा तिर्नुपर्ने भएको छ। कोरोना संक्रमण बढ्दै गए अमेरिकी डलर र जापानी येनसँगै अरु थुप्रै मुद्रा, सुन, पेट्रोलियम र प्रायः सबै वस्तुको मूल्यवृद्धि हाम्रो नियन्त्रण घेराभन्दा बाहिर जाने जोखिम बढेको छ। यसको एउटामात्र फाइदा रोजगारीका लागि विदेशमा रहेका नेपालीको आम्दानी नेपाली रुपैयाँमा रुपान्तरण गर्दा केही बढेको देखिनेछ।"
जिउँदै जोखेर खसीबोका खरीदबिक्री,"ओखलढुंगा : ओखलढुंगामा जिउँदै जोखेर मात्रै खसीबोका बिक्री गर्न थालिएको छ। पशु पालक किसानलाई जिउँदै जोख्दा मोल लिन सजिलो बनाउने भएकाले यस्तो अभियान थालिएको हो। सिद्धिचरण नगरपालिकाको १० बाट जोखेर मात्रै बिक्री गर्न थालिएको वडा अध्यष दामोदर धमलाले बताए। यसका लागि उद्योग वाणिज्य तथा आपूर्ति मन्त्रालय अन्तर्गत सञ्चालित ग्रामीण उद्यम तथा विप्रेषण आयोजना (समृद्धि) ले सहजीकरण गरेको छ। नगरपालिकाको बेतिनीमा रहेको नमुना बाख्रापालन समूहका खसी बाख्रा पहिलोपटक जोखेर बेचिएका हुन्। अगुवा किसान घनश्याम बास्तोलाले २ लाख ८ हजार ६ सय रुपैयाँ बराबरको १९ वटा खसीबोका जोखेर बिक्री गरे। तौलिँदा काँटा लगाएर आउने तौलमा प्रतिकेजी खरी जातका खसीबोकालाई ४ सय ८० रुपैयाँ, जमुना पारी जातका खसीबोकालाई ५ सय २० रुपैयाँ र बोयर जातका खसीबोकालाई ६ सय ५० रुपैयाँ भाउसमेत निर्धारण गरिएको छ। तौलमा लादी, रौं, खुर, सिङ जस्ता वस्तुको ह्रासकट्टी भने गरिदैन। किसानको घरमै पुगेर व्यापारीले खसीबोका जोखेर खरीद गरेपछि किसान खुसी भएका छन्। अनुमानकै भरमा मोलतोल गरेर खसीबोका बिक्री गर्दा हामी ठगिँदै आएका थियौं, अगुवा किसान बास्तोलाले भने, जोखेर कारोबार गर्ने भएपछि हामीले वास्तविक मूल्य पाएका छौं। खसीबोका व्यापारी ऋषिकुमार धमलाले नयाँ कामको सुरुवात भएको बताए। अरु समूहमा पनि आफू खसीबोका जोखेर कारोबार गर्न तयार रहेको उनको भनाई छ। समृद्धिले प्रदेश १ का ओखलढुंगा, खोटाङ, धनकुटा, भोजपुर, उदयपुर र तेह्रथुम जिल्लाका किसानलाई लक्षित गरेर नश्ल सुधार, बजार व्यवस्थापन, सहुलियत ऋण सहजीकरण, प्राविधिक ज्ञान तथा तालिम र अनुदानलगायत क्षेत्रमा काम गर्ने गरेर उद्यमशीलता विकासमा सहगोग गर्दै आएको छ।"
बालविवाहले लिइरहेछ ज्यान,"नेपालगन्ज : नेपालगन्ज उपमहानगरपालिका१९ की १७ वर्षीया युवतीको गत साउनमा विष सेवन गरी मृत्यु भयो। जनजाति ती युवतीले दलित युवकसँग बिहे गरेकी थिइन्। परिवारले अन्तरजातीय बिहे स्विकारेन। दाम्पत्य जीवन एक वर्ष नटिक्दै उनले आत्महत्या गरिन्। डुडुवा गाउँपालिका५ की १८ वर्षीया युवतीले गत भदौमा आत्महत्या गरिन्। उनको प्रेमविवाह मुस्किलले सात महिना टिक्यो। तनाव सहन नसकेपछि उनले झुन्डिएर आत्महत्या गरिन्। खजुरा गाउँपालिका५ का १९ वर्षका युवकले अन्तरजातीय र अन्तरधार्मिक बालविवाह गरे। हिन्दु धर्म मान्ने ती युवकले मुस्लिम युवतीसँग प्रेमविवाह गरेका थिए। सुरुमा परिवारले स्विकारेन। नवदम्पती ६ महिना भारतमा बसे। जेनतेन परिवारले स्विकार्यो। त्यसपछि तगारो बन्यो, दाइजो। बिहेको एक वर्षभित्रै गत असारमा उनले आत्महत्या गरे। बाँकेमा चालु आर्थिक वर्षको साढे ७ महिनामा अकालमै ज्यान गुमाउने बालबालिकाको संख्या सात पुगेको छ। आत्महत्या गर्नेको संख्या भने १० रहेको जिल्ला प्रहरी कार्यालय बाँकेले जनाएको छ। बाँके प्रहरीको चार वर्षको तथ्यांकअनुसार आत्महत्या गर्नेमध्ये ६३१३ प्रतिशत २० वर्षमुनिका छन्। यस अवधिमा दुई सय ६ आत्महत्या भएकोमा एक सय २८ जनाको उमेर २० वर्षमुनिको थियो। २० वर्षमुनिका आत्महत्यामध्ये ५० प्रतिशत त बालविवाहपछि आत्महत्या गर्नेहरू रहेको जिप्रका बाँकेका प्रवक्ता डीएसपी शिवबहादुर सिंह बताउँछन्। बालविवाहपछि आत्महत्या गर्ने युवतीको संख्या अझ डरलाग्दो छ। आत्महत्या छोरीको संख्या ९५ प्रतिशत छ, डीएसपी सिंहले भने, उमेर नपुग्दै बिहे गर्छन्। पारिवारिक थिचोमिचो सहन नसकेर आत्महत्याजस्तो गलत बाटो रोज्न पुग्छन्। चार वर्षमा २० वर्षमुनिका ९४ जना बालिकाले आत्महत्या गरेका छन्। यीमध्ये बालविवाहपछि आत्महत्या गर्नेको संख्या ६९ छ। यसमा २० वर्षमुनिका ७३४३ प्रतिशत छन्। सबैभन्दा बढी २० वर्षमुनिको आत्महत्या ०७५७६ मा ६७३४ प्रतिशत भएको थियो। गत वर्ष भएका ४९ आत्महत्यामध्ये ३३ वटा २० वर्षमुनिकै थिए। अघिल्लो वर्ष ०७४७५ मा ६६६६ प्रतिशत २० मुनिकाले आत्महत्या गरेका थिए। ६३ आत्महत्यामध्ये ४२ जना २० वर्षमुनिका थिए। ०७३७४ मा पनि ६१३३ प्रतिशत २० वर्षमुनिका थिए। यस अवधिमा ७५ आत्महत्यामध्ये ४६ जना २० वर्षमुनिका थिए। ४३ बालविवाह रोकिएन किशोरी क्लब र बाल क्लबको सहयोगमा बाँकेमा यस वर्ष प्रहरीले ४३ वटा बालविवाह रोकेको छ। प्रहरीले रोकेको बताए पनि अभिभावकले प्रहरीको आँखा छलेर पुनः बिहे गरेका खबर सार्वजनिक भइरहेका छन्। बाँके प्रहरी प्रमुख एसपी वीरबहादुर ओलीले प्रहरीले रोकेपछि पुनः बिहे गरेको पाइएमा अभिभावक, बिहे गराउने पण्डित, जन्ती सबैउपर मुद्दा चलाउने बताए। जिल्ला प्रहरी कार्यालय बाँकेले शनिबार नेपालगन्जमा हिन्दु धर्मका पुजारी, इस्लाम धर्मका मौलानालगायतका धर्मगुरु, क्रिस्चियन धर्मका पास्टर र जनप्रतिनिधिलाई डाकेर आयोजना गरेको अन्तरक्रियामा एसपी ओलीले भने, अहिलेसम्म प्रहरीले बालविवाह रोक्ने काममात्र गरेको हो। प्रहरीले विवेकले काम गरेको थियो। अब विधिले काम हुन्छ। बालविवाह गर्नेगराउने सबैलाई कारबाहीको दायरामा ल्याउने अभियान सञ्चालन गर्नेछौं। कम उमेरमा बिहे गरेन भने साइत छैन, बिहे नै हुँदैन, शुभ हुँदैन जस्ता भ्रम सिर्जना गरी बालविवाह गर्न बाध्य नपार्न पण्डित, मौलाना र पास्टर सहमत भएका छन्।"
