शीर्षक,विवरण
भीरको टुप्पोमा गाउँपालिकाको बैठक,"भोजपुर : अरुण गाउँपालिका १ याङपाङको दाउनेको शिवरात्री गुफाको प्रचारप्रसार गर्न गाउँपालिकाले भीरको सिरानमै गाउँपालिकाले बैठक सम्पन्न गरेको छ। गाउँपालिका जनप्रतिनिधि,कर्मचारी र सरोकारवाला सर्वसाधरणको भेलाले गुफाको प्रचारप्रसारमा विशेष जोड दिएको छ। गुफाको प्रचार गर्न गाउँपालिकाले ९१ औं कार्यपालिकाको बैठक चलाएको थियो। धार्मिक महत्व बोक्ने गुफाको प्रबद्र्धन गर्न गाउँपालिकाले बैठक चलाएको थियो । पर्यटकीय सम्भावना बोकेको गुफाको प्रचार गर्ने उद्देश्यले गुफाको भीरमै गाउँपालिकाले बैठक चलाएको गाउँपालिका याङपाङका वडाध्यक्ष नगेन्द्र खत्रीले बताए । भीरको टुप्पामा बसेको ऐतिहासिक बैठकले गाउँपालिका क्षेत्रभित्रका पर्यटकीय गन्तव्यको प्रबद्र्धन गरेर आन्तरिक तथा बाह्य पर्यटक भित्राउने लक्ष्य लिएको उनले बताए । धार्मिक पर्यटनबाट अर्थतन्त्र सुधार्दै स्थानीयबासीलाई आयमूलक बनाउने उद्देश्यले गुफा सम्बद्र्धनमा गाउँपालिका जुटेको गाउँपालिका प्रमुख गजेन्द्रबहादुर कार्कीले बताए । उनले भने, 'गुफाको प्रबद्र्धन गर्न हामी योजनासहित अघि बढेका छौँ, गुफाको भौतिक संरचना निर्माण गरेर बाह्य पर्यटनसम्म भित्राउने हाम्रो लक्ष्य छ।' गुफाको पूर्वाधार निर्माण गर्न सकिए पर्यटक भित्राउन सकिने स्थानीय अमर मगर बताउँछन् । उनले भने, 'गुफाको प्रबद्र्धन हुनसके अझै बाह्य पर्यटक गुफाको दर्शन गर्न आउने थिए।' गुफाको दर्शन गरी भाकल गरे मनोकांक्षा पूरा हुने विश्वास छ । विशेषगरी शिवरात्रीमा भगवान शिवको व्रत बस्दा पुण्य प्राप्त हुने भएकाले धार्मिक तिर्थालुको घुँइचो लाग्न गरेको पुजारी सोमनाथ शर्माले बताए । 'मनोकांक्षा पुरा गर्ने मनसायले जिल्ला बाहिरबाट हिन्दु धर्मालम्बी आउने गरेका छन्,' पुजारी शर्माले भने । शिवरात्री गुफालगायत जिल्लाभित्रका सिद्धकाली, टक्सार, पशुपती , पातले गुफा, दाउने गुफा स्थानमा भक्तजन विशेष जमघट हुने गर्छ । ऐतिहासिक धार्मिक महत्व बोकेको गुफामा परापूर्वकालमा ३ साधुले ४ महिना ध्यान गरेको स्थान भएकाले शिवरात्रीमा ठूलो मेला लाग्ने गरेको किम्बदन्ती छ । गुफाभित्र भगवान शिवको मूर्ति, ७ वटा विभिन्न देवीदेवतीको मूर्ति, तबला, मादल, गाईका थुन, गैंडाको बच्चा, गोमन साँप, बजाइने शंख आकृतिका ढुङ्गा छन्।"
गुल्मीमा जीप दुर्घटना : विद्युत प्राधिकरणका ७ कर्मचारी घाइते,"गुल्मी : जिल्लाको गुल्मीदरवार गाउँपालिका२ जुभुङको अर्थुङमा जीप दुर्घटना हुँदा सात जना घाइते भएका छन् । आइतबार तमघासबाट जुभुङ जाँदै गरेको लु १ च ६७०१ नम्बरको जीप सडकबाट झण्डै ५० मिटर तल खसेर दुर्घटना भएको जिल्ला प्रहरी कार्यालय गुल्मीले जनाएको छ । नेपाल विद्युत प्राधिकरण गुल्मीमा कार्यरत कर्मचारीको टोली दुर्घटनामा परेको प्रहरीको भनाइ छ । घाइते हुनेहरूमा पदम थापा, गोविन्द रिजाल, लोकबहादुर खत्री, दिलिप रेश्मी, दोजराज राई, भुमिश्वर कुवँर र शेरबहादुर सोमै रहेको जिल्ला प्रहरी कार्यालय गुल्मीका प्रहरी उपरीक्षक मिनबहादुर घलेले जानकारी दिए । घलेका अनुसार घाइते सबैको उद्धार गरी उपचारका लागि लुम्बिनी मेडिकल कलेज प्रवास पाल्पा पठाइएको छ । प्राधिकरणको टोली जुहाङ खैरेनीको ट्रान्सफर्मरमा समस्या आएपछि मर्मतको लागि गएको प्राधिकरण प्रमुख नारायणप्रसाद अर्यालले बताए ।"
जसले सिकाउँछन् प्याड बनाउन,"जनकपुर : हरेक महिनाको चार दिन महिलाहरूको लागि विशेष हुन्छ। कसैकसैले ६ दिनसम्म पनि भोग्छन्। त्यो हो महिनावारी हुँदाको अवस्था। महिनावारीलाई समाजमा छुवाछुत, वा लाजको विषय पनि बनाउँछन्। यही कारण छोरीहरू यस अवधिमा न राम्ररी विद्यालयमा पढ्न भ्याउँछन् न दैनिक दिनचर्यामा रमाउन नै। लाज धाककै कारण महिनावारी स्वच्छताको कुरा घरमासमेत गर्न गाहे हुन्छ। तर, मधेसका प्याड लिडर महिलाहरू अब गाउँगाउँमा महिनावारी स्वच्छता अभियान सञ्चालनमा लागि परेका छन्। २०७४ फागुन महिनादेखि सिमित समूहको प्रयासले सुरु भएको प्याड बैंक अभियानबाट अहिले ३ हजार महिलाहरू तालिम प्राप्त बनेका छन्। महिनावारी स्वच्छता र महिलाहरूमा पाठेघर खस्ने समस्यालाई निराकरण गर्न महोत्तरीकी प्रोमिशा मि श्रा, सृनु झा, स्मृती झा, सिरहाकी गुन्जा मण्डल र सर्लाहीकी स्नेहा झालगायतका युवतीहरूको समूहले प्याड बैंक अभियान थालेका हुन्। जतिसुकै पढेलेखेका महिला भए पनि महिनावारी चक्रसँग सबै जुध्नुपर्ने हुँदा ग्रामीण क्षेत्रका महिलाहरूमा चेतना जगाउन अभियान तहत कार्यक्रमहरू गरिएको प्याड बैंक सञ्चालक प्रोमिशा मि श्रा बताउँछिन्। यो समस्या खुलेर चर्चा नहुने र स्वच्छताको ख्याल नगर्दा दिर्घकालीन रोगहरू निम्तिन्छन्, मि श्राले भनिन्, हामी महिनावारीको विषयमा निर्धक्क भइ लाज नमान्दै समाजमा छोरीहरूले बोल्न सकुन् भनेर प्रयासरत छौं। मधेसमा महिलाहरूमाझ महिनावारीको कुरा गर्दा उनीहरूले निकै असहज अनुभव गर्छन्। महिलाले नै महिलाको पीडा न्यूनीकरणमा भूमिका खेल्न सक्ने प्रोमिशाको विश्वास छ। प्याड बैंक सञ्चालक समूहमा हाल १५ जना सहजकर्ता छन्। यी सहजकर्ताहरूले गाउँगाउँमा पुगेर किशोरी र महिलाहरूलाई महिनावारी स्वच्छताका विषयमा जनचेतना दिने र घरमै सेनेटरी प्याड निर्माण गर्न तालिम दिन्छन्। प्रदेश २ का धनुषा, महोत्तरी, सिरहा, सर्लाही, सप्तरी, बारा र पर्सा गरी सात जिल्ला र काठमाडौं, काभ्रे, सिन्धुपालचोक तथा ललितपुरमासमेत प्याड बैंकका सहजकर्ताहरूले किशोरीहरूलाई घरेलु प्याड निर्माणको तालिम दिइसकेका छन्। यसका साथै महोत्तरीको जलेश्वर कारागारमा कैदी जीवन बिताइरहेका महिलाहरूलाई पनि प्याड बैंकले सुरक्षित महिनावारी र प्याड बनाउने तालिम दिएको छ। हामीले बनाउने प्याड पुनः प्रयोग गर्न मिल्ने हुन्छ, सहजकर्ता रचना झाले भनिन्, फलाटिनको कपडा, सुति कपडा, सुइ, धाँगो र बटनको प्रयोग गरी प्याड घरमै बनाउन सकिन्छ। यी प्याडहरू राम्ररी प्रयोग गरियो भने वर्ष दिनसम्म पनि टिकाउ हुन्छ। बजार पाइने तयारी प्याड प्रयोगपछि व्यवस्थापन गर्न नजान्दा जथाभावि फाल्ने समस्या बनेको मि श्रा बताउँछिन्। प्याड बैंकले पुनः प्रयोग गर्न मिल्ने प्याड बनाउन सिकाएर डिस्पोजलको तरिका पनि सिकाउने गरेको छ। आधिकारिक रूपमा कुनै निकायमा दर्ता नभए पनि प्याड बैंक अभियानले निःशुल्क रूपमा गर्ने जनचेतना प्रभावकारी हुँदै गएको छ। अभियानलाई थप प्रभावकारी बनाउन दश जना महिलाहरूलाई प्रशिक्षक तालिम दिन विज्ञापनसमेत आह्वान गरिएको समूह सञ्चालक बताउँछन्।"
राजश्व छल्न मध्य रातमा बालुवागिट्टी तस्करी,"महोत्तरी : महोत्तरीमा नदीजन्य सामग्री चोरी निकासी बढ्दै गएको छ । रातु खोला, मरहा खोला, जंघालगायतका मुख्य नदीबाट रातारात बालुवा, गिट्टी, ढुंगाको तस्करी बढेको हो । मध्य रातमा अवैधरुपमा नदीजन्य सामग्री तस्करी गर्न प्रयोग गरिएका ११ वटा सवारी साधनलाई प्रहरीले खोलाबाटै नियन्त्रणमा लिएको छ । इलाका प्रहरी कार्यालय बर्दिबासका इन्स्पेक्टर सोनु साहको कमाण्डमा खटिएको प्रहरी टोरीले रातु खोला र मरहा नदीबाट टिपर, जेसिबी र ट्रयाक्टर प्रहरीले नियन्त्रणमा लिएको हो । बर्दिबास७ किसानगरस्थित रातु खोलाबाट ५ वटा टिपर, ३ वटा ट्याक्टर नियन्त्रणमा लिइएको छ । त्यसैगरी बर्दिबास१० टुटेश्वरबाट एकवटा जेसिबी र २ वटा ट्याक्टर नियन्त्रणमा लिइरहेको डीएसपी राजन चपागाईले जनाए । तस्करीमा प्रयोग गरिएको सवारी साधनलाई कारवाहीका लागि बर्दिबास नगरपालिकालाई बुझाइएको छ ।विना लगानी नदीजन्य सामग्री तस्करीमा राम्रो आम्दानी हुन्छ । त्यसैले मध्य रातमा तस्कर सवारीसाधन लिएर खोला पस्ने गरेको प्रहरीले जनाएको छ ।विकास निर्माणका लागि मापदण्डमा रहेर स्थानीय सरकारले खोलाको ठेक्का लगाउने प्रावधान छ।"
दोस्रो रामेछाप महोत्सव जारी,"काठमाडौं : मन्थलीमा जारी दोस्रो रामेछाप कृषि, पर्यटन, सांस्कृतिक तथा औद्योगिक व्यापार महोत्सव करिब १२ हजार ५०० जनाले अवलोकन गरेका छन् । नेपाल भ्रमण वर्ष २०२० र जिल्लाको व्यापार, व्यवसायलाई लक्षित गरी आयोजना गरिएको महोत्सवमा अवलोकन गर्न आउनेको संख्या बढिरहेको रामेछाप उद्योग वाणिज्य संघका सचिव सुरेश उदासले जानकारी दिए। कृषि, पर्यटन प्रवर्द्धन गर्ने हाम्रो सान, कला संस्कृतिको जगेर्ना रामेछापको पहिचान, भ्रमण वर्ष २०२० सफल पार्ने हाम्रो अभियानभन्ने मूल नाराका साथ फागुन ६ गतेदेखि सुरु भएको महोत्सव १५ गतेसम्म चल्ने रामेछाप उद्योग वाणिज्य संघले जनाएको छ। महोत्सवले आन्तरिक र बाह्य पर्यटकलाई रामेछापमा भित्र्याउनुका साथै जिल्लाभित्रका विभिन्न कृषि उपज, साना उद्योगीद्धारा उत्पादित वस्तु प्रदर्शनमा सहयोग पुगेको रामेछाप उद्योग वाणिज्य संघका सचिव उदासले बताए।महोत्सवको मुख्य आकर्षणको रुपमा हस्तकलाका सामग्री प्रदर्शन,शैलुङ क्षेत्रको पर्यटन प्रबर्द्धन गर्न हेलिकप्टरबाट मन्थलीशैलुङ उडान, स्थानीय तथा राष्ट्रिय कलाकारबाट बृहत सांस्कृतिक कार्यक्रम रहेको कार्यक्रम संयोजक एवंम् सामाजिक सशक्तिकरण नेपालका अध्यक्ष सोनुकुमार रोकाले जानकारी दिए। ७५ वटा स्टलमा रामेेछापमा उत्पादन भएका विभिन्न सामग्री राखिएको उनले बताए। महोत्सवकै अवसरमा पर्यटकीय क्षेत्रको विकास र प्रर्बद्धनका लागि तामाकोशी नदीमा र्याफ्टीङले सुरु गरिएको छ। किङ्ग स्टार क्रियसन प्राइभेट लिमिटेडले हलेदेदेखि एयरपोर्टसम्म करिब १२ किलोमिटर र्याफ्टीङ संचालन गरेको हो। महोत्सवले पर्यटन आर्थिक विकासमा टेवा पुर्याएको व्यवसायीहरुले बताएका छन्। रामेछाप उद्योग वाणिज्य संघको आयोजनामा भएको महोत्सवमा मन्थली नगरपालिका मुख्य प्रायोजक र सामाजिक सशक्तिकरण नेपाल सहआयोजक रहेको छ।"
ढिलासुस्तीविरुद्ध खबरदारी गर्ने पाँच अगुवा पक्राउ,"चरिकोट : खाडीचौर सडकमा ढिलासुस्तीविरुद्ध खबरदारी गर्ने पाँच सामाजिक अगुवा पक्राउ परेका छन् । नागरिक स्तरबाट सञ्चालित संघर्ष अभियानअन्तर्गत लामोसाँघु जिरी सडक सुधार आयोजनाको कार्यालय डाँडापाखर सिन्धुपाल्चोकमा तालाबन्दी कार्यक्रममा प्रहरीले हस्तक्षेप गरी ५ जना अगुवालाई पक्राउ गरेको हो । खाडीचौरचरिकोट सडक संघर्ष समितिका संयोजक चिरञ्जिवी मास्के, सह संयोजक रमेश खतिवडा, सचिव गोकर्ण भण्डारीसहित सदस्य सिर्जन घिमिरे र ज्ञानबहादुर बस्नेत पक्राउ परेका छन् ।उनीहरुलाई जिल्ला प्रहरी कार्यालयका इन्सपेक्टर रामचन्द्र घिमिरेको टोलीले पक्राउ गरेको हो ।पक्राउ परेकाले प्रहरी कस्टडीमै बसेर पनि आन्दोलन जारी राख्ने संघर्ष समितिका सहसंयोजक रमेश खतिवडाले जानकारी दिए । दोलखा र सिन्धुपाल्चोक जिल्लाको महत्वपूर्ण लाइफलाइन मानिएको खाडचौरचरिकोट सडक स्तरोन्नतिको काममा ढिलाई भएको भन्दै संघर्ष समितिको अगुवाइमा यसअघि विभिन्न आन्दोलन समेत गरेको थियो । ढिलाइविरुद्धको नागरिक खबरदारीको आन्दोलनमा दोलखाका नागरिक समाज, विभिन्न संघसंस्थाले सहयोग गरिरहेका छन् । यो सडकखण्ड पाँच वर्षदेखि अलपत्र छ।"
