शीर्षक,विवरण
सूर्यविनायकजडिबुटी सडकखण्डमा गुड्ने सवारीलाई नयाँ नियम,"काठमाडौं : महानगरीय ट्राफिक प्रहरी महाशाखाले सूर्यविनायकजडिबुटी सडकखण्डमा ट्राफिक व्यवस्थापनका लागि नयाँ नियम लागु गरेको छ। महाशाखाले बस लेन अवधारणसहितको नियम ल्याएको हो। उपत्यकाको सवारी आवागमनमा सहजता ल्याउन तथा सवारी दुर्घटना कम गर्ने उद्देश्यले सूर्यविनायकजडिबुटी सडकखण्डमा यात्रुबाहक तथा मालबाहक सवारी साधन र कम गतिमा गुड्ने सवारी साधन दायाँ लेनबाट र निजी तथा साना सवारी साधन सधैं दाहिने लेनबाट मात्र चलाउने व्यवस्था फागुन १४ गतेदेखि लागु गरिने भएको छ, महाशाखाले जारी गरेको विज्ञप्तिमा उल्लेख छ। उपत्यकाको सवारी आवागमनलाई थप सहज र प्रभावकारी बनाउन प्रहरी उपरीक्षक जीवनकुमार श्रेष्ठको अध्यक्षतामा बनेको समितिको सुझावका आधारमा तत्काल यो सडकमा नयाँ नियम लागु भएको हो। महाशाखाका प्रमुख प्रहरी वरिष्ठ उपरीक्षक भीम प्रसाद ढकालले सवारी साधनले जथाभावी लेनको प्रयोग गरेर सवारी चलाउने तथा लेन परिवर्तन गर्ने, लुकिङ्ग ग्लास र साइड लाइटको प्रयोग नगरी जथाभावी ओभरटेक गर्ने तीव्र गतिमा सवारी चलाउने लगायतका असावधानीले दुर्घटनाको जोखिम बढ्ने हुनाले हुँदा यस्तो नियम लागू गरेको बताए। सडकमा गुड्ने सवारी र सडकको अवस्था हेरी सुरक्षित तरिकाले निर्धारित लेनमा तोकिएको गतिमा मात्र सवारी चलाई सुरक्षित आवागमन हुनेमा आफू विश्वस्त रहेको बताए।"
भर्याङबाट लडेर मृत्यु,ताप्लेजुङ : फुलिङ नगरपालिका३ का दुर्गाप्रसाद सुनुवारको आफ्नै घरको भर्याङबाट लडेर मृत्यु भएको छ । आइतबार बिहान भर्याङबाट ओर्लने क्रममा लडेका ६८ वर्षीय सुनुवारको घटनास्थलमै मृत्यु भएको हो । शव जिल्ला अस्पतालमा पोष्टमार्टम गरी आफन्तको जिम्मा लगाइएको जिल्ला प्रहरी कार्यालय ताप्लेजुङका सूचना अधिकारी विष्णु खड्काले जानकारी दिए।
बलात्कारका दोषी १४ वर्षपछि पक्राउ,"विराटनगर : मोरङको पथरीशनिश्चरेमा भएको सामूहिक बलात्कार प्रकरणका दोषी १४ वर्षपछि पक्राउ परेका छन्। घटनामा संलग्न मध्ये पथरीशनिश्चरे नगरपालिका१० (साविकको शनिश्चरे गाविस१ ) का ३६ वर्षीय सूर्य विश्वकर्मा पक्राउ परेका हुन् । इलाका प्रहरी कार्यालय पथरीका डीएसपी दिलिप गिरी नेत्रृत्वको टोलीले विश्वकर्मालाई शनिबार राती सुनसरीको धरान उपमहानगरपालिका ६ बाट पक्राउ गरेको हो । उनीसहित पथरीशनिश्चरे १० का राजु भनिने रामबहादुर बुढाथोकी र दीपक नेपालीले एक २० वर्षीया युवतीलाई २०६२ साल फागुन ११ गतेदेखि दुई दिनसम्म बन्धक बनाएर सामूहिक बलात्कार गरेको पथरीका डीएसपी गिरीले बताए। उनकाअनुसार तीनैजना मिलेर दीपक नेपालीको घरमा बन्धक बनाएर बलात्कार गरेका हुन् । घटनाअनुसार पथरीशनिश्चरेस्थित भुटानी शरणार्थी शिविरमा रहेको दिदीको घरमा एक युवती पुगेकी थिइन् । 'साँझको समयमा चउरमा निस्किएका बेला तीन युवा आएर ती युवतीलाई आफ्नै साथीको बहिनी भन्दै घुम्न जाउँ भनेर फकाउँदै लगेका रहेछन्,' डीएसपी गिरीले भने, 'त्यसपछि दीपकको घरमा लगेर दुई दिनसम्म बन्धक बनाउँदै सामूहिक बलात्कार गरेछन् ।' तीनैजनाविरुद्ध तत्कालिन पुनरावेदन अदालत विराटनगरले २०७१ साल वैशाख १० गते जनही १० वर्ष कैद र १५ हजार रुपैयाँ जरिवानाको फैसला सुनाएको थियो । घटनापछि उनीहरु फरार थिए । यस घटनामा तीनैजनालाई जिल्ला अदालत मोरङले २०६९ साल पुस २४ गते सफाइ दिएको थियो। जिल्लाको फैसला चित्त नबुझेको भन्दै सरकारी वकिल कार्यालयले पुनरावेदन गरेपछि जिल्लाको आदेश उल्टाउँदै पुनरावेदन अदालतले उनीहरुविरुद्ध कैद र जरिवानाको फैसला गरेको थियो । विशेष सूचनाका आधारमा विश्वकर्मालाई धरानबाट पक्राउ गरिए पनि फरार रहेका बुढाथोकी र नेपालीको भने खोजी तीव्र पारिएको डीएसपी गिरीले बताए। उनकाअनुसार प्रहरीले जबरजस्ती करणी मुद्दा चलाए पनि घटनामा संलग्न तीनैजना फरार रहेका थिए। मुद्दा चलिरहेका बखत उपस्थित नभइकन फरार भएका उनीहरुलाई जिल्ला अदालतले भने सफाइ दिएको थियो । डीएसपी गिरीका अनुसार घटनापछि श्रीमती र छोराछोरीसहित भागेर धरान पुगेका विश्वकर्माले त्यहाँ फर्निचर व्यवसाय र जग्गा कारोबारको काम गर्दै आएको पाइएको छ । धरानमा उनको आफ्नै घर पनि रहेको छ। 'घटना भएको लामो समयपछि बलात्कार घटनाका दोषी पक्राउ परेका छन्,' गिरीले भने, 'बलात्कार प्रकरणपछि गाउँको घर, जग्गा, जमिन त्यत्तिकै छाडेर भागेका उनी धरानमा आफैले घर बनाएर निर्वाधरुपमा व्यवसाय सञ्चालन गरेर बसिरहेको पाइयो ।' पक्राउ परेका विश्वकर्मालाई प्रहरीले आइतबार जिल्ला अदालत मोरङमा बुझाएको छ । विश्वकर्मालाई कैद सजाय भुक्तानका लागि कारागार चलान गरिएको अदालतमा स्रेस्तेदार ईश्वरमणि ओझाले बताए ।"
"बैतडी जिप दुर्घटना, दुई गम्भीर घाइते",बैतडी : बैतडीमा जिप दुर्घटना हुँदा दुई जना गम्भीर घाइते भएका छन् । आइतबार बिहान २ बजे पाटन नगरपालिका३ बोहरीगाउँबाट डडेल्धुरा जादैं गरेको से १ ज २१३ नम्बरको जिप धुरामा दुर्घटनामा भएको बैतडीका प्रहरी प्रवक्ता तथा प्रहरी निरीक्षक किसन चन्दले जानकारी दिए । दुर्घटनामा जिप चालक पाटन नगरपालिका ८ का २३ वर्षीय लोकेश मडै र २६ वर्षीय गणेश महरा घाइते भएका छन् । घाइते दुवैको डडेल्धुरा अस्पतालमा उपचार हुन नसकेपछि थप उपचारका लागि धनगढी पठाइएको छ । जिपमा दुईजना मात्रै सवार रहेका थिए । जिप सडकबाट २०० मिटर तल खसेको जिल्ला प्रहरी कार्यालय बैतडीले जनाएको छ ।
घोषणामै सीमित डिजिटल विद्यालय,"कालिकोट : तामझामसहित एक वर्षअघि डिजिटल विद्यालय घोषणा गरिएका २ विद्यालय घोषणामै सीमित भएका छन्। नमुनाका रूपमा कालिकोटका २ स्कुललाई ०७५ असोज १ गते डिजिटल विद्यालय घोषणा गरिएको थियो। तर अहिलेसम्म पनि यी स्कुलमा सामान्य डिजिटल सेवा विस्तार नहुँदा घोषणामा मात्र सीमित भएका हुन्। रास्कोट नगरपालिकाको बडिमालिका मावि र खाँडाचक्र नगरपालिकाको महादेव आधारभूत विद्यालय बालमन्दिरलाई डिजिटल घोषणा गरिएको थियो। जहाँ हेलिकप्टर चार्टर गरी प्रदेश सरकारका मन्त्रीले स्कुलमै पुगेर डिजिटल घोषणा गरेका थिए। केही थान कम्प्युटर मात्र भएका ती स्कुलमा अहिले डिजिटल विद्यालय भन्नलायक अरु केही सेवा छैन। कर्णाली प्रदेश सरकारले एक वर्षअघि प्रदेशका २४ विद्यालयलाई डिजिटल बनाउने निर्णय गरेको थियो। सरकारले प्रत्येक निर्वाचन क्षेत्रको आधारमा एउटा स्कुल छनोट गरेर स्मार्ट डिजिटल डिभाइस, स्मार्ट बोर्ड, कम्प्युटर, मल्टिमिडिया प्रोजेक्टर र स्पिकर, नेटवर्क प्रिन्टर, स्क्यानर, फोटोकपि मेसिन, सर्भिलेन्स सिस्टम, स्विच, डिजिटल मार्कर प्रयोग गर्दै अध्यापन गराइने घोषणा गरेको भए पनि बोलीमा मात्र सीमित छ। डिजिटल विद्यालय घोषणाका लागि आवश्यक उपकरण केही पनि नभएको बडिमालिका मावि रास्कोटका प्रधानाध्यापक पुष्पराज बरालले बताए। घोषणा त गरियो, त्यसका लागि आवश्यक पर्ने सामान खरिद गर्न बजेट व्यवस्थापन गरिएन, उनले भने, विद्यालयमा कम्युटर, प्रोजेक्टर प्रयोग गरी इन्टरनेटका माध्यमबाट पढाउने भनिए पनि अहिले स्कुलमा कम्प्युटरसमेत छैनन्। घोषणाका बेला स्कुलमा भएका ४ वटा कम्प्युटर पनि बिग्रेकाले आफूहरूले पटकपटक प्रदेश सरकारलाई जानकारी गराउँदा पनि कसैले नसुनेको उनको दुखेसो छ। खाँडाचक्र नगरपालिकामा रहेको महादेव आधारभूतमा पनि आवश्यक सामाग्री नभएको शिक्षक कमलबहादुर शाहीले बताए। आर्थिक वर्ष ०७५७६ मा आएको १२ लाख ५० हजार रुपैयाँमा १४ वटा कम्प्युटर, ४ वटा ल्यापटप, ४ वटा प्रोजेक्टर खरिद गरिसकेको उनले बताए। सस्तो लोकप्रियताका लागि सरकारले घोषणा मात्र गरेको कांग्रेसका क्षेत्रीय सभापति दमनबहादुर शाहीले आरोप लगाए। सरकारले डिजिटल बनाउने भनेर घोषणा गरेका विद्यालयमा भौतिक पूर्वाधार, स्रोत साधन र दक्ष जनशक्तिको व्यवस्थापन गर्न सरकार चुकेको दाबी गरे।"
सीमामा कोरोना जाँच गरिने,"बैतडी : भारतसँग सीमा जोडिएको बैतडीको झुलाघाट नाकामा कोरोना भाइरस जाँचका लागि सहायताकक्ष राखिएको छ। दशरथचन्द नगरपालिका, स्वास्थ्य कार्यालय र जिल्ला अस्पतालले संयुक्त सहायताकक्ष स्थापना गरेका हुन्। झुलाघाट नाकाबाट भित्रिनेहरूको स्वास्थ्य परीक्षणका लागि सहायताकक्ष स्थापना गरिएको स्वास्थ्य कार्यालय प्रमुख योगेशप्रसाद भट्टले बताए। भारतबाट स्वदेश फर्कने नेपालीमा कोरोनाको संक्रमण परीक्षण गर्न सीमामा सहायताकक्ष स्थापना गरेका हौं, उनले भने, भारतबाट फर्किने सबैको सहायताकक्षमा स्वास्थ्य परीक्षण हुन्छ। नगरपालिका मातहतका स्वास्थ्य संस्थाबाट सहायताकक्षमा २ जना स्वास्थ्यकर्मी खटाइएको दशरथचन्द नगरपालिकाका स्वास्थ्य शाखा प्रमुख दुर्गादत्त जोशीले बताए। उनले भने, कोरोना भाइरसको संक्रमणबारे सचेतना फैलाउन र भारतबाट आउनेको स्वास्थ्य परीक्षणका लागि हामीले सहायताकक्ष सञ्चालन गरेका हौं। भारतबाट फर्किनेहरूको इन्फ्रारेड थर्मामिटरले ज्वरो नाप्ने गरिएको स्वास्थ्य कार्यालय प्रमुख भट्टले बताए। सहायताकक्षमा ज्वरो मापनका साथै २ साता अघिसम्म चीन गए नगएको र रुघाखोकी लागे नलागेको सोधपुछ हुन्छ, उनले भने, अत्यधिक ज्वरो आएको र केही शंकास्पद बिरामी भेटिए जिल्ला अस्पतालमा अलग्गै कोठामा राख्ने व्यवस्था गरिएको छ। सहायताकक्षले भारतबाट फर्कनेहरूलाई पनि सजिलो हुने नगरपालिकाका स्वास्थ्य शाखा प्रमुख जोशीले दाबी गरे। उनले भने, कोही शंकास्पद बिरामी भए पत्ता लाग्छ। अन्यलाई म स्वस्थ्य छु भनेर थाहा पनि हुन्छ। कक्षले भारतबाट फर्कने नागरिकलाई सजिलो हुने हाम्रो विश्वास छ।"
मिथिला मध्यमा परिक्रमा (फोटो फिचर),"जनकपुरधाम : नेपालकै सबैभन्दा लामो दुरीको १५ दिवसीय मिथिला मध्यमा परिक्रमा सुरु भएको छ । फागुन शुक्ल औंसी अर्थात अतबार धनुषाको मिथिला विहारी नगरपालिकाको कचुरीबाट मिथिला विहारीको डोला उठाएर हजारौं धार्मिक यात्री परिक्रमामा सहभागी भएका हुन्। भगवान मिथिला विहारीको डोला लिएर परिक्रमा यात्री अपरान्ह जनकपुरस्थित रत्नसागर मन्दिर पुगेका छन्। परिक्रमामा सहभागी श्रद्धालुले त्यहाँ विश्राम गरेर जानकी मन्दिरको दर्शन गर्दै पहिलो पडाव जनकपुरकै हनुमाननगर पुग्छन्। हनुमाननगरमा मिथिला विहारीको डोलासँगै जनकपुरको अग्नि कुण्डबाट निस्कने किशोरीजीको डोलासमेत सहभागी पनि आइपुग्छ। दुवै डोलाले पहिलो विश्राम गरी सोमबार बिहानै परिक्रमा दोस्रो पडाव भारतको कलना तर्फ प्रस्थान गर्छ। मध्यमा परिक्रमा जनकपुरको हनुमानगढी, भारतको कल्यानेश्वर, गिरिजास्थान, महोत्तरीको मठिहानी, जलेश्वर, मडई, धु्रवकुण्ड, कञ्चनवन, धनुषाको पर्वता, धनुषाधाम, सतोषर हुदैं औरही पुग्छ। त्यसपछि भारतको करुणा, विशौललगायतका धार्मिकस्थल हुँदै फागु पूर्णिमाको दिन जनकपुर आइपुग्छ। प्रचण्डले उठाए मिथिला परिक्रमाको डोला प्रदेश २ मा सरकार परिवर्तन हुने प्रचण्डको संकेत नेपाल तथा भारतसहित कुल १ सय ३३ किलोमिटर लामो दूरीमा पैदल यात्रा गर्ने यात्री निकै नियमनिष्ठाका साथ १५ दिनको समय बिताउँछन्। यो परिक्रमामा सहभागी हुँदा पापमोक्ष हुनुका साथै मनोवाञ्छित फल प्राप्त हुने जनविश्वास रहेको छ।"
