शीर्षक,विवरण
"कालिकोटको छाप्रेमा भीषण पहिरो, दुई घर पुरिए, २५ जोखिममा ( भिडियो)","कालिकोट : तिलागुफा नगरपालिका७ छाप्रेमा भीषण पहिरो गएको छ। गएराति अबिरल वर्षासँगै गाँउ माथिबाट हिरो आएपिछ स्थानीय गाउँ छाडेर भागेका छन्।पहिरोका कारणा तिलागुफा नगरपालिकाको वडा नं ६, ७ र ८ का तीन वटा बस्तीहरु जोखिममा परेका छन्। तिलागुफा नगरपालिका प्रमुख रतनबहादुर शाहीले पहिरोका कारण छाप्रे, डाँडको बस्ती बिस्थापित भएको जानकारी दिए। उनले भने'पहिरो अहिले पनि बगिरहेका छ। राति गाउँमा पहिरो पस्दा भागाभाग भयो। पहिरोले पसेपनि मानवीय क्षति भने नभएको शाहीले बताए। डाँढ गाउँका दुई घरमा पहिरो पसेको छ। टाकुल्लाको दुई कोठे घर पुरिएको छ। पहिरोले कर्णाली राजमार्ग अन्तर्गत सुर्खेत जुम्ला सडकखण्ड पनि अवरुद्ध भएको छ। कर्णाली राजमार्गमा गुड्ने सवारी साधनहरु बीच बाटोमै अलपत्र परेका छन्। पहिरोग्रस्त क्षेत्रमा उद्धारका लागि तीन वटै सुरक्षा निकाय खटिएका छन्। जिल्ला प्रहरी कार्यालय कालिकोटका प्रमुख डीएसपी श्यामबाबु ओलीयाको नेतृत्वमा नेपाल प्रहरी, सशस्त्र प्रहरीका डीएसपी दिलप्रसाद भट्टको नेतृत्वमा सशस्त्र प्रहरी र नेपाली सेनाको पहिरो स्थलमा खटिएको छ। डीएसपी श्यामबाबु ओलीयाले आफूहरुले पहिरोको जोखिममा परेका परिवारहरुको तथ्यांक संकलन, उनीहरुको बसोबासका लागि नगरपालिकासँग समन्वय गरिरहेको बताए। उनले भने, पहिरो रोकिएको छैन्। छाप्रेका २५ घरहरु तत्काल विस्थापित हुने अवस्थामा छन्। जोखिममा रहेका परिवारको घरमा रहेको सामानहरु सुरक्षित ठाँउ तिर लिने कार्य भइरहेको छ। हेर्नुहोस् भिडियो"
ठेउला र डेङ्गुका बिरामी जाँच्न किटको अभाव,"धादिङ : जिल्ला अस्पताल धादिङवेशीमा उपचार गराउन आउनेहरूमा डेङ्गु र ठेउला (स्क्रब टाइफस) रोगको संक्रमण देखिन थालेको छ। ठेउलाका बिरामी बढ्न थालेपछि महामारीकै रुप लिने हो कि भनेर स्वास्थ्यकर्मीसमेत चिन्तित छन्। गत वर्ष यही सिजनामा धादिङमा डेङ्गु देखा परेको थियो। भदौ महिनामा धादिङ जिल्ला अस्पतालमा उच्च ज्वरो आएका बिरामीको स्वास्थ परीक्षण गर्दा पाँच जनामा डेंगु र १७ जना ठेउला देखिएको जिल्ला अस्पताल धादिङले जानकारी दिएको छ। यहाँ उपचार गराउन आउनेमध्ये ५ जनामा डेङ्गु र १७ जनामा स्क्रब टाइफसका रोगका लक्षण देखिएको छ', अस्पतालका सूचना अधिकारी कृष्णलाल उप्रेतीले भने, 'चिकित्सकको निगरानीमा उपचार गराइरहेका छौँ।' अन्य बिरामीमा पनि संक्रमण भएको अनुमान चिकित्सकहरूले गरेको छन्। तर परीक्षण गर्ने किट थोरै सङ्ख्यामा भएकाले शंकास्पद सबै जनाको परिक्षण गर्न सकिएको छैन। बिरामीको संख्या दिनदिनै बढेसँगै अस्पतालमा यो रोगको प्रारम्भिक परीक्षणका लागि आवश्यक पर्ने सामग्रीको समेत अभाव भएको छ। सबै किसिमका लक्षण मेल खाएको र नगरी नहुने सिकिस्त बिरामीलाई मात्र अहिले ती दुवै रोगको परीक्षण गर्ने गरेको अस्पतालले जनाएको छ। चिकित्सकहरूले शंकास्पद बिरामीहरूमा समेत रोगको परीक्षण गर्न नपाएकोले झन् समस्या उत्पन्न भएको बताएका छन्। बजार क्षेत्र भन्दा ग्रामीण क्षेत्रका स्थानीयमा यो रोग फेला पर्न थालेको छ। यस वर्ष धादिङमा दुबै रोगका संक्रमित दिनदिनै बढ्दै गएकाले सरकारले तत्काल रोगको प्रारम्भिक परीक्षणका लागी आवश्यक पर्ने किट उपलब्ध गराउन जिल्ला अस्पतालका स्वास्थकर्मीले माग गरेका छन्। टाउको दुख्ने, अत्याधिक ज्वरो आउने, गर्धन र घाँटी वरपर मसिना बिमिरा आउने स्क्रब टाइफसको प्रमुख लक्षण हुन्। यो रोग धादिङमा दुई वर्ष अघिदेखि देखिन थालेको हो। माइट नामको किर्नाले टोकेपछि स्क्रब टाइफस रोग लाग्छ। यो जुम्राभन्दा पनि सूक्ष्म हुन्छ। प्रायः नाङ्गो आँखाले देख्न सकिँदैन। यो मुसाको कानमा बस्छ। घाँसमा माइट झरेको अवस्थामा मानिससँगको सम्पर्कमा आउँदा यसको संक्रमण हुन्छ। आजकाल दैनिक जसो डेङ्गु र स्क्रब टाइफस रोगका लक्षण मिल्ने र उच्च ज्वरो आएका बिरामीमा १० देखि १५ जनासम्म उपचार गराउन आउने गरेका छन्। तिनीहरू सबैमा रोगका संक्रमण नदेखिएपनि देशभर भइरहेको डेङ्गुको प्रकोपले आत्तिएर जचाउन आर्ने बढी छन्। स्वास्थ्य कार्यालय धादिङका जनस्वास्थ्य अधिकृत विष्णु रिजालले परीक्षण गराउनको लागि किटको अभाव नहुने बताए यहाँ परीक्षण गराएका बिरामीको विवरण र रिपोर्ट स्वास्थ्य मन्त्रालय अन्तर्गत इपीडीमीयोलोजी तथा रोग नियन्त्रण महाशाखामा पठाउनु पर्छ', उनले भने, 'त्यसपछि आवश्यक मात्रामा उसैले किट पठाइदिन्छ। धादिङमा डेङ्गु र स्क्रब टाइफसका विरामी बढ्न थालेपछि आवश्यक समन्वय गरिरहेको रिजालले बताए। जिल्लामा डेङ्गु र स्क्रब टाइफस रोगका बिरामी देखा पर्न थालेपछि रोगबाट बच्न उच्च सर्तकता अपनाउन समेत चिकित्सकले सुझाव दिएका छन्। लगातार उच्च ज्वरो आएमा तत्काल परीक्षण गर्न स्वास्थ्य संस्था जान समेत उनीहरूको अनुरोध छ।"
चण्डीगढ विश्वविद्यालयले नेपाली विद्यार्थीसँग परामर्श गर्ने,"काठमाडौं : भारतको चर्चित चण्डीगढ विश्वविद्यालयले नेपाली विद्यार्थीलाई लक्षित गरी ४ दिने शैक्षिक परामर्श अभियान गर्ने भएको छ। विश्व विद्यालयको नेपालमा रहेको भर्ना केन्द्र काठमाडौंको एआईपी एडुसकेशनमा हुने अभियान आगामी भदौ १० देखि १३ गतेसम्म चल्नेछ। अभियानअन्तर्गगत प्रत्येक दिन बिहान १० बजेदेखि साँझ ६ बजेसम्म विश्वविद्यालयले दिने छात्रवृत्ति, विद्यार्थी जीवन, रोजगारीको अवसर, पूर्व विद्यार्थी मञ्चलगायतका विषयमा जानकारी उपलब्ध गराइनेछ। अभियानमा विश्वविद्यालयका प्रतिनिधिसँग फेसबुकबाट प्रत्यक्ष सवालजवाफ, विश्वविद्यालय प्रतिनिधिबाट प्रत्यक्ष परामर्श, तत्काल योग्यता परीक्षा र भर्ना तथा विश्वविद्यालयका नेपालमा रहेका पूर्व विद्यार्थीसँग संवादको अवसर पनि प्राप्त हुनेछ। चण्डीगढ विश्वविद्यालयमा ५ सयभन्दा बढी नेपाली विद्यार्थीले अध्ययन गरिसकेका छन्। विश्व विद्यालयस्तरीय शिक्षा र असंख्य राजगारीका अवसरका लागि चण्डीगढ विश्वविद्यालय परिचित छ। भारतमा ख्याति कमाइरहेको यो विश्वविद्यालयमा विश्वका ४० देशका विद्यार्थी अध्ययन गर्छन्। विश्वविद्यालयले नेपालको त्रिभुवन विश्वविद्यालयसँग पनि सहकार्य गरेको छ।"
विद्यालयबाट फर्किदै गरेका बालक बाढीले बगाएर बेपत्ता,नुवाकोट : नुवाकोटको पश्चिमी भेगमा रहेको भाल्चेमा बाढीसहितको खोलाले बगाउँदा एकजना स्कुले बालक वेपत्ता भएका छन्। किस्पाङ गाउँपालिका१ भाल्चेस्थित सामरे खोलामा आएको बाढीले बगाउँदा स्थानीय १० वर्षीय सरोज घले वेपत्ता भएको जिल्ला प्रहरी कार्यालय नुवाकोटले जनाएको छ। स्थानीय होलिजोन बोर्डिङ स्कुलको कक्षा ३ मा अध्ययनरत घले सोमबार बेलुकी विद्यालयबाट घर फर्किने क्रममा खोलामा आएको बाढीले बगाएको थियो। वडाध्यक्ष आइतबहादुर घलेका अनुसार बाढीले बगाएर बेपत्ता बालकको खोजि भइरहेको छ।यस्तै चट्याङ लागेर नुवाकोटकै बुङताङ गाविस४ पारीगाउँका सुकुराम तामाङको गोठमा पालेको एक हल गोरु र एउटा बाख्रा मरेको जिल्ला प्रहरी कार्यालय नुवाकोटले जनाएको छ।
अरिंगालको टोकाइबाट किशोरको मृत्यु,अर्घाखाँची : जिल्लाको सन्धिखर्क नगरपालिका५ कुरापोख्रालका १५ वर्षीय नन्दबहादुर मुखियाको अरिंगालको टोकाइबाट निधन भएको छ। स्थानीय कृष्ण मुखियाका अनुसार गोपेश्वर आधारभूत बिद्यालय मथुरामा कक्षा ५ मा अध्ययन गर्ने मुखिया सोमबार बिहान विद्यालय जान भनी हिडेको थिए। विद्यालय नगई आफ्नो घरभन्दा तल रहेको एक कटहरको रुखमा चढेका बेला अरिंगालले टोकेको थियो। अरिंगालले टोकेपछि बलेबाङ नजिकै रहेको एक घरमा गएर आफूलाई अरिंगालले टोकेको र बचाउन हारगुहार गरे । सो कुराको जानाकारी पाउन बित्तिकै स्थानीय पार्बता मुखियाले नन्दबहादुरको घरमा खबर गरी जिल्ला अस्पताल पठाएको कृष्ण मुखियालाई जानाकारी दिएकी थिईन। गम्भीर अबस्थामा रहेका निजलाई अर्घाखाँची जिल्ला अस्पतालमा प्राथमिक उपचार पछि थप उपचारको निम्ति जिल्ला बाहिर रिफर गरिएको थियो। विद्यालय गएको छोरा अरिंगालको टोकाइबाट गम्भीर घाइते भएको खबर पाएपछि उनका परिवार हतार हतार अस्पताल आएका थिए । जिल्ला अस्पतालले बुटवल रिफर गरिसकेपछि पनि आर्थिक जोरजाम गर्न स्वास्थ्य बिमाको कागजात लिन पुन घर जानुपर्ने भएकोले बुटवल लैजान ढिलाई भएको प्रत्यक्षदर्शीको भनाइ छ। जिल्ला अस्पतालमा उपचार सम्वभ नभएर रिफर गरेपनि डाक्टरको टिमले बचाउन निकै प्रयास गरेको अस्पतालका डाक्टरले जानाकारी दिए।
