शीर्षक,विवरण
महालेखाको संकुचन,"संवैधानिक अंगका क्रियाकलापदेखि पदाधिकारीलाई जवाफदेही तुल्याउनेसम्मका विषय संसद्को अधिकार र कार्यक्षेत्रभित्र पर्छन्। तर, संसद्को अर्थ समितिले त्यो अधिकार प्रधानमन्त्रीमातहत पठाउने गरी कानुनी व्यवस्था गर्न आश्चर्यजनक भूमिका खेलेको छ। संवैधानिक अंग संविधानतः प्रत्यक्ष रूपमा संसद्प्रति उत्तरदायी हुन्छन्। संसद्को अर्थ समितिले आर्थिक कार्यविधि तथा वित्तीय उत्तरदायित्व सम्बन्धमा व्यवस्था गर्न बनेको विधेयक निर्माण गर्ने क्रममा भने संवैधानिक अंगका पदाधिकारीको वित्तीय उत्तरदायित्व प्रधानमन्त्रीप्रति हुने व्यवस्था पारित गरेको छ। यसले अनेकन आशंका पैदा गराएको छ। त्यतिमात्र होइन, महालेखा परीक्षकको आर्थिक हिसाबकिताबका अधिकार संकुचन गरी सचिवहरूलाई स्वेच्छाचारी हुने किसिमका दफासमेत अर्थ समितिबाट पारित भएका छन्। यस्ता किसिमका दफा कसले र कसरी थपे भन्ने विषय रहस्यमय बनेको छ। किनभने, सरकारबाट विधेयक प्रस्तुत गर्दा यस्ता दफा थिएनन्। विधेयकका मस्यौदा कोरिँदाका बखत महालेखा परीक्षकसँग पनि सुझाव मागिएको थियो। त्यतिबेला यस्ता दफाबारे सुझाव मागिएका थिएनन्। उसले लेखा परीक्षणलाई सहज तुल्याउने गरी सुझावको लामै फेहरिस्त बुझाएको थियो। विधेयकमा आर्थिक मामलामा सचिवलाई स्वेच्छाचारी हुने किसिमका दफा थिएनन् र महालेखा परीक्षक प्रधानमन्त्रीमातहत हुने विषय पनि थिएन। तर, अर्थ समितिमा विधेयकमाथि दफावार छलफलका क्रममा संसद्को अधिकार सरकारतिर हस्तान्तरण गर्ने प्रावधान घुस्न पुग्यो। समितिबाट पारित विधेयकमा नियन्त्रणकारी दफा घुसेपछि महालेखा परीक्षकले अर्थ समितिका सभापतिसँग गुनासोसमेत दर्ज गराएका छन्। सरकारकै स्वार्थमा र समितिकै सदस्यको मिलेमतोमा प्रधानमन्त्रीमातहत पुर्याएको देखिन्छ। समितिबाट पारित दफामा संवैधानिक अंगका पदाधिकारीबाट वित्तीय उत्तरदायित्व भएनभएको सम्बन्धमा प्रधानमन्त्रीबाट निगरानी गरिने व्यवस्था थपिएको छ। यो प्रावधानप्रति महालेखा परीक्षकलगायत संवैधानिक पदाधिकारीले असन्तुष्टि व्यक्त गरिसकेका छन्। सिद्धान्ततः सरकारका खराब, अनुचित र अनुत्तरदायी काममा निगरानी र नियन्त्रण गर्न संवैधानिक अंगको व्यवस्था भएको हो। संवैधानिक अंगको निष्पक्षता र स्वतन्त्रता संविधानद्वारा प्रत्याभूत गरिएको छ। संवैधानिक अंगले तयार पारेका प्रतिवेदनमाथि संसद् र संसदीय समितिमा छलफल हुन्छ भने पदाधिकारीले खराब आचरण प्रदर्शन गरेमा महाभियोग लगाउने अधिकार पनि संसद्लाई मात्र प्राप्त छ। संवैधानिक व्यवस्था र त्यसको मान्यताविपरीत कानुन निर्माण हुनु भनेको आफैंमा जायज काम होइन। यसले संविधानका भावना र मान्यताप्रति जनप्रतिनिधि गम्भीर छैनन् या त संसदीय समिति सरकारको औजार बनेको देखाउँछ। यो विधेयक राष्ट्रियसभामा विचाराधीन छ। तर, अर्थ विधेयक भएका कारण राष्ट्रियसभाले संशोधन गर्न सक्दैन। राष्ट्रियसभाले यस्ता प्रकृतिका विधेयकमा छलफल गरी १५ दिनभित्र कुनै सुझाव भए सुझावसहित प्रतिनिधिसभामा फिर्ता पठाउन सक्ने व्यवस्था छ। यसमा प्रतिनिधिसभाले ठोस निर्णय लिनुपर्ने हुन्छ। यस्ता प्रावधान नियोजित रूपमा भएका हुन् कि अन्जानवश हो भन्ने विषयमा संसदीय समिति गम्भीर हुनैपर्छ। संविधानविपरीतका प्रावधान यसरी सहजै पारित हुँदै गयो भने लोकतान्त्रिक पद्धति धरापमा पर्न सक्छ। अब मन्त्रालय र केन्द्रीयस्तरका सचिवालयका हकमा आर्थिक उत्तरदायित्व विभागीय मन्त्री वा राज्यमन्त्रीको हुनेछ। प्रस्तावित ऐनबमोजिम लेखा राख्ने, खर्च गर्ने तथा बेरुजु फर्स्यौट गर्नेगराउनेलगायत वित्तीय उत्तरदायित्व बहन गर्ने जिम्मेवारी लेखा उत्तरदायी अधिकृत अर्थात् सचिवको हुने व्यवस्था राखिएको छ। जसले महालेखा परीक्षकको कार्यक्षेत्रलाई साँघुरो मात्र बनाएको छैन कि बेरुजुभित्र हुन सक्ने बदमासी पनि महालेखा परीक्षकले हेर्न नसक्ने पारिएको छ। सरकारको आम्दानी र खर्चमा परीक्षण गर्ने दायित्व महालेखा परीक्षकको हो। कानुन उल्लंघन गरेर या जानाजान भएका आर्थिक हिनामिना र नोक्सानीका सवालमा जाँच गर्ने उसको दायित्वभित्र पर्छ। तर, अब सचिवले बेरुजु फस्र्याैट गर्दा ठीक प्रक्रिया अपनाएका छन् या छैनन् या बदमासी गरेका छन् या छैनन् भन्ने सवालमा महालेखा परीक्षकले हेर्न पाउँदैनन्। सचिवहरूले बेरुजु फर्स्यौट भएको जनाएपछि महालेखा परीक्षकले सात दिनभित्र लगत कट्टा गर्नुपर्ने छ। यसले बेरुजु र अनियमित अंकको पारो त ह्वात्तै घट्ला। तर सचिवबाट बेरुजु फर्स्यौट सन्दर्भमा हुन सक्ने अनुचित कर्मका सवालमा भने पूर्णतः ढाकछोप हुनेछ। त्यसकारण महालेखा परीक्षकको बेरुजुमा जाँच गर्न पाउने अधिकार हटाइनु भनेको अराजकता निम्त्याउनुसरह हुनेछ। त्यसकारण संवैधानिक अंगको वित्तीय दायित्व प्रधानमन्त्रीमातहत लैजाने र महालेखा परीक्षकको अधिकारका सवाल नाजायज भएको हुँदा प्रतिनिधिसभाबाट अन्तिम रूप दिनुअघि संशोधन हुनुपर्छ।"
पहिराेले बेनीजोमसोम सडक अवरुद्ध (तस्बिर),"मुस्ताङ : बेनीजोमसोम हिलाम्मे सडकमा मुस्ताङ गन्तव्य बनाएर हिँडेका सवारी साधनलाई सकस परेको छ। सडकको म्याग्दी खण्डमा सास्ती भएको हो। राष्ट्रिय गौरवको आयोजना कालिगण्डकी करिडोरको म्याग्दी खण्डको आधा दर्जन स्थानमा सडक हिलाम्मे भएको करिडोर सडकका सुपरभाइजर इन्द्रसिंह शेरचनले जानकारी दिए। अहिले म्याग्दीको दानामा गएको पहिरोले सडकखण्ड अवरुद्ध भएको छ। बेनीजोमसोम ७६ किलोमिटर सडकखण्डको दोश्रो प्याकेज अन्नपूर्ण गाउँपालिका दाना, रुप्से झरना र काभ्रेभीरमा सडक हिलाम्मे भएको शेरचनको भनाइ छ। म्याग्दीको भुरुङ तातोपानी देखि मुस्ताङको कोवाङ सम्म २ वटै प्याकेजको काम शर्मा गजुरमुखी जेभीले लिएको छ। सवारी चालक कृष्णमोहन नेपालीले निर्माणधिन सडकमा करिडोरको मेशिनले खनेकाले थप सडक बिग्रिएको बताए। अर्का चालक बुद्ध गुरुङले सडक हिलाम्मेका कारण दिनहु सवारी फस्ने गरेको दुःखेसो गरे।"
डिप ट्युबवेल हस्तान्तरण,काठमाडौं : अमेरिकी दूतावासले गण्डकी प्रदेशलाई डिप ट्युबवेल हस्तान्तरण गरेको छ। पोखरा क्षेत्रमा ट्युबवेलको निर्माणकार्य सम्पन्न गरी अमेरिकी दूतावासको इन्डोप्याकम अग्मेन्टेशन टिमले सोमबार ट्युबवेल हस्तान्तरण गरेका हुन्। हस्तान्तरण भएका दुईवटा ट्युबवेल लामापाटनस्थित सशस्त्र प्रहरी बल तालिम महाविद्यालयमा र मालेपाटनस्थित कालिका वाहिनीमा अवस्थित छन्। बाँकी तीन ट्युबवेल असोजकात्तिकमा सम्पन्न हुनेछन्। ट्युबवेल हस्तान्तरण समारोहमा सशस्त्र प्रहरी बलका नायब प्रहरी महानिरीक्षक बाबुराम पाण्डे र इन्डोप्याकम अग्मेन्टेशनकी टिम लिडर अमेरिकी सेनाकी क्याप्टेन केटलिन ह्यानरको उपस्थिती थियो।
वाइन चुस्कीमा तीजको दर ! बूढी आमा भन्छिन् : कस्तो चलन आयो बा !,"काठमाडौं : भदौं ८ गते शनिबार । मध्यान्ह हुँदै थियो । राजधानीको एउटा पार्टी प्यालेसमा तीजको भाका घन्किन थाल्यो टोल नै थर्किने गरी । सजिएका दिदीबहिनीले एकछिनमै पार्टी प्यालेस हाउसफुल भयो अनि सुरु भयो तीजको दर पार्टी। रातो साडी, छड्के तिलहरी र अनि सुनले सजिएका दिदीबहिनीले पार्टी प्यालेस रंगिन थियो। टोलका दिदीबहिनीले प्रतिव्यक्ति हजार रुपैयाँका दरले पैसा उठाएर दर कार्यक्रमको आयोजना गरेका रहेछन्। हल्का कोल्ड ड्रिंक्सपछि एक घन्टा जति दिदीबहिनीले तीजका नेपाली गीत मै 'डान्स' गरे। त्यसपछि बाँडियो दरको स्न्याक्स । मेन्युमा थियो, चिकेन फ्राइ, मटन फ्राइ, म:म, प्राउन,पापड अनि केही थरी वाइन र बियर । प्राय: सबैका हातमा थियो ग्लास । ग्लासमा थियो वाइन । वाइनको चुस्कीसँगै दिदीबहिनी दर पार्टीमा निकै चम्किएका थिए। पार्टी प्यालेसका संचालक भन्दै थिए, स्न्याक्स भन्दा पनि वाइनकै डिमान्ड बढी। पुर्याउनै गाह्रो। बढी नै खपत हुन थालेपछि ट्रे मा वितरण गर्न छोडियो। अनि दिदीबहिनी फेरि बारतिर झुम्मिए। वाइनको नसाले रमाएका युवती भन्दै थिइन् ' ह्या यार, कति तीजकै मात्र गीत बजाएको। अब राम्रो बजाउनु पर्यो, अलि हट चाहियो। अनि डिजे भाइ पनि हल्का मुस्कान दिँदै टाउको कन्याउन थाल्यो । युट्यूबमा सर्च गरेर हट आइटम बजायो। मुन्नी बदनाम हुइँ डार्लिङ तेरे लिए हट गीतले पार्टी प्यालेस गुन्जिन थाल्यो। एकछिन अघिको तीजको दर पार्टी 'अब मुन्नी बद्नाम हुइँतिर मोडियो । म्युजिक र त्यहाँको माहोल हेर्दा लाग्थ्यो रातमा रंगिएको एउटा क्लब। यो त एउटा दरपार्टीको सामान्य चित्र हो। तीजको मुखमा राजधानीका पार्टी प्यालेसमा दर पार्टी प्राय: यस्तै हुने गर्छन्। मेन्युमा वाइन र बियर अनि हिन्दी र अंग्रेजी रिमिक्स त अनिवार्य जस्तै भएको छ। तीजको स्वरूप पनि फेरिदै गएको छ। घरको भान्सामा दर पाक्न छोडेको छ। होटल तथा पार्टी प्यालेसमा दर पाक्न थालेको छ। प्यालेसमा भोजभतेर आयोजना गर्ने, महंगो गरगहना, पहिरनमा प्रतिस्पर्धा गर्ने, माछामासु र मदिराजन्य परिकार खाने प्रवृत्ति बढेको छ। गीत सुन्दा उराठ लाग्छ तीजको गीत र नाचमा मौलिकता हराउँदै गएकोमा बुढापाका चिन्तित छन्। राजधानीको थलीकी ७८ वर्षीया सीता थापाले तीजको मौलिकता अहिलेका पुस्ताले बिर्सेको भन्दै दु:ख व्यक्त गरिन्। 'अहिलेका तीज गीतमा नत माइतीका कुरा समेटिएका छन् न त दिदीबहिनीका,' उनले भनिन्, 'तीजका गीत सुन्दा उराठ लागेर आउँछ।' आफ्ना पालामा दर खाएको संझिदै भनिन्, 'दरका दिन सबै दिदीबहिनी एक ठाउँमा भेला हुन्थ्यौं। आफै गीत गाउँथ्यौं, आफैं मादल बजाउथ्यौं, आमाले पकाएका मीठा परिकार दरका रुपमा खान्थ्यौं। कम्ति रमाइलो हुँदैनथ्यो।' उनले हिजोआज आफ्नो घरमा दर पाक्न छोडेको भन्दै दुखेसो पोखिन। 'आफू बुढो भइयो, भान्सा जान सकिदैन, खान मन लागेर के गर्नु,' उनले भनिन्,' घरमा तीज दर नपाकेको धेरै भयो। बुहारी जागिरे। बाहिरै खाएर आउँछन्। दर खाने दिनमा पनि होटलबाट दर मगाउँछन्। त्यही खान्छौं।' अनामनगरकी बिना शर्मा भन्छिन्, 'उहिले दरका रुपमा चोखो परिकार खाने गरिन्थ्यो। तीजको अघिल्लो दिन मात्र दर खाने चलन थियो। अहिले त महिना दिनअघि छोरी बुहारीलाई भ्याइ नभ्याइ हुन्छ।' जमानामा फेरिएको भन्दै उनले थपिन्,'कस्तो चलन आयो बा कस्तो। हाम्रा पालाको तीज त हरायो। यस्तै रह्यो भने अब तीज एकादेशको कथा हुनेछ।' संस्कृतिमाथि प्रहार भड्किलो फेसनले तीजको सांस्कृतिक महिमा ओझेलमा पर्दै गएको चिन्ता संस्कृतिवद्को छ। संस्कृतिविद् गोविन्द टण्डनले पछिल्लो समय तीज पर्वमा विकृति विसंगति भित्रिदै गएको भन्दै चिन्ता व्यक्त गरे। उनले भने,' तीजको मौलिकता गुम्दै गएको अवस्था छ। अरु चाडबाडजस्तै तीजमा पनि पश्चिमा शैलीको प्रभाव परेको छ। यसो हुनु राम्रो होइन। मनोरञ्जनका नाममा विकृति विसंगति भित्रिन दिनु हुँदैन।' तीज गीतमा विवाहित दिदीबहिनीलाई दाइभाइ लिन आएकोनआएको, दिदीबहिनीबीचका दु:ख सुखका कुराबारे चर्चापरिचर्चा हुन्थ्यो। गीतको माध्यमबाट मनको वह पोख्थे। तर हिजोआज विदेशी गीतले तीज पिट्न थालेको छ। तीज गीतको सट्टा डिजे चल्न थालेका छन्। घरमा होइन होटलमा दर पाक्न थालेको छ। मौलिक पर्व तीजमा पश्चिमा शैलीका गीतले स्थान पाउनु चिन्ताको विषय भएको संस्कृतिविद् टन्डनको बुझाइ छ। उनले चाडबाड बाध्यताले नभइ रहरले मनाउनुपर्ने बताए। यसरी संस्कृतिभित्र विकृति विसंगति भित्रिदै जाने हो भने तीज मात्र नभएर तिहारको देउसी भैंलोका गीतहरु पनि ओझेलमा पर्दै जानेछन्।"
