शीर्षक,विवरण
संसद्मा कश्मीरको विषयमा प्रश्न,"हेटौंडा : प्रदेश ३ को संसद्मा कश्मीरबारे नेपालले देखाएको मौनताको विषयमा प्रदेशसभा सदस्यले प्रश्न गरेका छन्। भारत र पाकिस्तानबीचको द्वन्द्वका कारण कश्मीरमा भएको तनाव र भारतले पछिल्लो समयमा उठाएको कदमबारे नेपालले कुनै प्रतिक्रिया नदेखाएको भन्दै प्रदेशसभा सदस्यले प्रश्न गरेका हुन्। नेपाली कांग्रेसका प्रदेशसभा सदस्य नरोत्तम वैद्यले कश्मीरको विषयमा सरकारले लम्पसारवादको नीति लिएको आरोप लगाए। सरकारले यो विषयमा गैह्रजिम्मेवार रवैया देखाएको छ, उनले प्रश्न गरे, परराष्ट्र नीतिमा नजिकैबाट नियालेको भनेको के हो ? हामीले बुझ्न सकेनौं। नेपाल मजदुर किसान पार्टीकी प्रदेशसभा सदस्य सिर्जना सायँजुले कश्मीरको विषयमा भारत देखाएको हैकमबारे नेपालले मुख खोल्नुपर्ने बताइन्। उनले सार्क राष्ट्रको अध्यक्षको हैसियतले पनि नेपाल बोल्नुपर्ने उनको भनाइ छ। के हामी मौन बसेर मोदीको अनुयायी बन्न खाजेका हौँ ', सायँजुले प्रश्न गरिन्। नेपाल मजदुर किसान पार्टीका अर्का प्रदेशसभा सदस्य सुरेन्द्रराज गोसाँईले पनि यस विषयमा बोल्नुपर्ने बताए। नेकपाका प्रदेशसभा सदस्यले भने यस विषयमा सरकारको बचाउ गरेका छन्। नेपालले असंग्लन परराष्ट्र नीति अबलम्वन गरेको र यो विषयमा संयुक्त राष्ट्र संघले बोल्ने भन्दै सरकारको बचाउ गरेका हुन्। बैठकमा बोल्दै नेकपा प्रदेशसभा सदस्य नारायण सिलवालले सडकका केही चटके र जोक्करले प्रतिपक्षको काम गर्न खोजेको भन्दै प्रतिपक्ष दलको भूमिकाबारे प्रश्न गरे। नेकपाका प्रदेशसभा सदस्य बसन्त मानन्धरले बजेट कार्यान्वयनमा सरकार गम्भीर हुनुपर्ने बताए। मंगलबारको बैठकबाट मदन भण्डारी स्वास्थ्य विज्ञान प्रतिष्ठान सम्बन्धी बनेको विधेयक प्रतिवेदनसहित पास भएको छ। प्रदेशसभा नियमावली पहिलो संशोधनसहित पारित भएको प्रदेशसभा सचिवालयले जनाएको छ।"
एस्काभेटर दुर्घटना हुँदा एकको मृत्यु,टिकाराम खनाल रुकुम : रुकुमपश्चिममा एस्काभेटर दुर्घटना हुँदा एक जनाको मृत्यु भएको छ । जिल्लाको त्रिवेणी गाउँपालिमा सडक खन्दै गरेको एस्काभेटर दुर्घटना हुँदा सहचालकको मृत्यु भएको हो । काम गरेर फर्किने क्रममा दुर्घटना हुँदा सहचालक दाङ गढवा गाउँपालिका७ का २६ वर्षीय उत्तमकुमार चौधरीको मृत्यु भएको प्रहरीले जानकारी दिएको छ । सोमबार काम गरेर फर्किदै गर्दा रा १ क १०३० नम्बरको स्काभेटर गाउँपालिका२ बारकोटमा दुर्घटना भएको जिल्ला प्रहरी कार्यालय रुकुम (पश्चिम)का प्रमुख प्रहरी नायव उपरीक्षक सुमित खड्काले जानकारी दिए । एस्काभेटर सडकबाट करिब तीन सय मिटर तल खसेको थियो । घटनाको विषयमा अनुसन्धान भइरहेको प्रहरीको भनाइ छ । प्रहरीले त्रिवेणी गाउपालीका७ मुरुका २७ वर्षीय असिम डाँगीलाई नियन्त्रणमा लिएर सवारी ज्यान सम्बन्धी मुद्दा दर्ता गरेर अनुसन्धान सुरु गरेको हो ।
सुनको भाउ घट्यो : यस्तो छ आजको बजार मूल्य,काठमाडौं : नेपाली बजारमा सोमबार कीर्तिमान कायम गरेको सुनको मूल्य मंगलबार ९ सयले घटेर ७२ हजार ६ सय पुगेको नेपाल सुन चाँदी व्यावसायी महासंघले जनाएको छ। सोमबार सुन तोलामा ७३ हजार ५सयमा कारोबार भएको थियो।चाँदी भाउ भने स्थिर रहेको छ। सोमबार तोलाको ८६० रुपैयाँमा कारोबार भएको चाँदी मंगलबार सोही मूल्यमा कारोबार भइरहेको छ। सुन एक महिनादेखि बढ्ने र घट्ने क्रममा छ।
ब्लास्टिङ गरी सकडको अवरोध हटाइँदै,नुवाकोट : चीनको केरुङ नाका जोड्ने सडक पहिरोका कारण ३ दिनदेखि अवरुद्ध छ। पहिरोका कारण राम्चेधुन्चे सडक खण्ड अन्तर्गत ब्राबलमा आइतबार पहिरो गएपछि सडक अवरुद्ध बनेको हो। अवरुद्धसडक खुलाउनका अहिले ब्लास्टिङ सुरु गरिएको छ। ब्राबल अवरोध हटाउन मंगलबार बिहानैदेखि ड्रिलिङको काम सुरु भएको प्रमुख जिल्ला अधिकारी अर्जुन भण्डारीले जानकारी दिए। पहिरो हटाइ बुधबारदेखि सडक पूर्णरूपमा सञ्चालनमा आउने प्रजिअ भण्डारीले बताए। अवरुद्ध सडकमा सोमबार बेलुकीदेखि अस्थायी बाटो निर्माण गरेर सवारी पास गराइएको थियो। सडकको छेउ भासिएको छ। कुनातिर चट्टान छ। सडक खुलाउनेप्रयास असफल भएपछि कार्यालयले आइतबार साँझ ब्लास्टिङको स्वीकृतिका लागि गृह मन्त्रालयमा पत्र पठाएको थियो। गृहले सोमबार बिहान रक्षा मन्त्रालयमा पत्र पठाएकोमा रक्षाले सेनालाई स्वीकृति प्रदान गरेपछि ब्यास्टिङको काम सुरु गरिएको हो।
शालिकराम आत्महत्या प्रकरण : प्रहरी अनुसन्धानमाथि अदालतका तीन प्रश्न,"काठमाडौं : शालिकराम पुडासैनी आत्महत्या प्रकरणमा तीन अभियुक्त (रवि लामिछाने, युवराज कँडेल र अस्मिता कार्की) लाई चितवन जिल्ला अदालतले सोमबार धरौटी र साधारण तारेखमा रिहा गर्न आदेश दिएको छ। िचतवन जिल्ला अदालतका न्यायधीश हेमन्त रावलको इजलासले गरेको आदेशपछि रवि लामिछानेसहित तीनजना छुटेका छन्। साउन ३० गते राजधानीबाट पक्राउ परेका तीनैजनालाई चितवन जिल्ला अदालतले भदौ ३ गते लामिछानेलाई छानबिनका लागि ५ दिन म्याद थप गरेको थियो। पत्रकार पुडासैनीले आत्महत्याअघि अस्मिता, लामिछाने र कँडेलले आफूलाई मर्न बाध्य पारेको भन्दै रेकर्ड गरेको भिडियो सार्वजनिक भएको थियो। पुडासैनीकै आवाजको भिडियो रहेको पुष्टिपछि थप अनुसन्धान गर्न लामिछाने, कार्की र कँडेलमाथि प्रहरीले १० तीनसम्म हिरासतमा राखेर अनुसन्धान गरेको थियो। जिल्ला अदातलको यो फैसलाले विभिन्न प्रश्न उब्जाएको छ। जसमध्ये प्रमुख तीन प्रश्न नाङ्गै भिडियो खिचेपछि किन पाइन्टसर्ट लगाएर झुन्डिए ? प्रहरी अनुसन्धानमाथि अदालतको फैसलाले गरेको पहिले प्रश्न हो(नाङ्गै भिडियो खिचेपछि किन शालिकराम पुडासैनी पाइन्टसर्ट लगाएर झुन्डिए ? शालिकरामले झुन्डिनु अघि रेकर्ड गरेको डिभियोमा उनले भित्री वस्त्र लगाएको देखिन्छ। तर, झुन्डिएको अवस्थामा उनले सर्टपाइन्ट नै लगाएका तस्बिर प्रहरी समक्ष छन्। यसकारण शालिकरामको मृत्यु समय र उक्त भिडियो खिचिएको समय फरक रहेको अदालतको फैसलामा उल्लेख छ। फैसलामा शालिकरामले भिडियोमा भनेका कुरा मर्नु अगाडि नै भनेका हुन् भन्ने यकिन हुन नसकेको उल्लेख छ। प्रहरी अनुसन्धानले यो कुरा प्रष्ट पार्न नसकेको फैसलामा लेखिएको छ। भिडियोमा व्यक्त गरेको भनाइ नै वर्ड विफोर देथ अफ डाइङ्ग पर्सन थियो वा थिएन भनि यकिन गर्न भिडियो रेकर्ड गरेको समय र निजले आत्महत्या गरी देहत्याग गरेको समयको अन्तर छुट्याउन सबुतको रुपमा रहेको भिडियो र मृतको शव परीक्षण प्रतिवेदनमा मृत्युको समय उल्लेख हुनु आवश्यक देखिन्छ। जुन अनुसन्धानका क्रममा गरिएको शव परीक्षणको प्रतिवेदनमा उल्लेख भएको छैन, अदालतको फैसलामा भनिएको छ। भिडियो कसले खिच्यो ? प्रहरी अनुसन्धानमाथि अदालतको फैसलाले गरेको अर्को प्रश्न हो( शालिकरामले रवि लामिछानेसहित तीनजनालाई आरोप लगाएको भिडियो कसले खिच्यो? शालिकराम स्वयम्ले आफ्नो भिडियो नखिचेर अरु कसैले खिचिदिएको अदालतको फैसलामा उल्लेख छ। उनले आफ्नो मोबाइललाई कुनै उपयुक्त ठाउँमा राखेर आफ्नो भिडियो खिचेको समेत प्रहरीको मुचुल्कामा नरहेको भन्दै फैसलाले प्रहरी अनुसन्धानमाथि प्रश्न उठाएको छ। सो भिडियो रेकर्ड हुँदा निज शालिकरामले कुनै अर्को व्यक्तिको सहयोगमा सो भिडियो रेकर्ड गरेको अवस्था देखिन्छ, अदातलको फैसलामा भनिएको छ,मृत्युकालीन घोषणालाई माथि सोसँग सम्बन्धित अन्य कोरर्बोरेटिभ एभिडेन्सियल इक्वइन्स सँग नजोडिदासम्म सोही भनाइलाई मात्र निर्णायक प्रमाणको रुपमा ग्रहण गर्न नसकिने अवस्थामा त्यसरी समर्थित हुने अन्य प्रमाण कोरर्बोरेटिभ एभिडेन्सियल मिसिल संलग्न रहेको देखिएन। आत्महत्याको कारण के ? प्रहरी अनुसन्धानमाथि अदालतको फैसलाले गरेको पहिले प्रश्न हो( शालिकरामले आत्महत्या गर्नुको कारण के ? शालिकरामको भिडियो अन्योलग्रस्त भएको अदालतको फैसलामा प्रष्टै उल्लेख छ। अर्कोतर्फ रविसहित अन्य तीन जनाले शालिकरामलाई आत्महत्या गर्न दुरुत्साहन गरेको भिडियोमा उल्लेख भएपनि उनीहरुले त्यस्तो काम गरेका हुन कि होइनन भन्ने पक्षबाट प्रहरीले अनुसन्धान नै नगरेको समेत अदालतले आफ्नो फैसलामा उल्लेख गरेको छ। प्रमाणस्वरुप पेश गरिएको भिडियोमा मृतकले प्रत्यवादीले आफूलाई विभिन्न किसिमले धाकधम्की दिए भनि उल्लेख गरेको भन्ने सन्दर्भलाई दिएर सो विषयमा यी प्रतिवादीबाट त्यसरी भने बोमोजिम कुनै कार्य कसुर भए गरेको थियो वा थिएन भन्नेतर्फ प्रस्तुत मुद्दाको अनुसन्धान केन्द्रित भएको देखिदैन, फैसलामा भनिएको छ। प्रतिवादीमाथि अदालतको शंका अदालतले पूर्व सहकर्मी भएको नाताले पुडासैनीको आत्महत्या प्रकरणमा प्रतिवादीबाट दुरुत्साहन भएको भएको हुनसक्ने प्रारम्भिक शंका उब्जाएको छ। अदालतले पूर्वसहकर्मीको नाताले प्रतिवादी लामिछाने र कँडेलको आग्रह पूर्वाग्रह, दूराग्रह, वैमनस्यता, प्रतिशोध वा अस्वस्थ प्रतिस्पर्धा भए नभएको विषयमा अहिलै एकिन गर्न नसकिए पनि होइन भनेर अनुमान लगाउन नसकिने आशंका देखाएको छ। आदेश भन्छ, सहकर्मी हुनुको नाताले निजको प्रतिवादी मध्येका अस्मिता कार्कीसँगको विवाहइत्तर निजी सम्बन्धका बारेमा थाहा जानकारी नै थिएन र निजलाई सहकर्मीको अवस्थाबाट अलग भई सकेको अवस्थामा यी प्रतिवादीहरुले सो सम्बन्धको विषयमा लिएर कार्यक्रम सार्वजनिक गर्ने धम्की वा त्रास देखाएनन होला र सो धम्की र त्रास निज मृतक शालिकराम पुडासैनीलाई आत्महत्या गर्न दुस्प्रेरित गर्ने तहसम्मको कारण थिएन होला भनी अहिले नै भन्न सकनिे अवस्था पनि देखिएन। तर अदालतले पछि प्रमाण बुझ्दै जाँदा ठहरे बमोजिम हुनेगरी हाललाई धरौटी तारेखमा राखेर न्यायका लागि ठाउँ राखिदिएको छ।"
