शीर्षक,विवरण
बाटैमा छोप्न आउँछन् बिचौलिया,"भद्रपुर : आइतबार बिहान १० बज्न १० मिनेट बाँकी छँदै नापी कार्यालय झापामा चहलपहल बढ्न थाल्यो। लाग्थ्यो, सेवाग्राही बिहानैदेखि कार्यालयमा आए र कर्मचारी पनि सेवा दिइरहेका छन्। उनीहरू न सेवाग्राही थिए न त कर्मचारी। उनीहरू त बिचौलिया रहेछन्। घडीमा १० बज्यो। केही सेवाग्राही कार्यालयमा छिर्दै थिए। बिचौलियामध्येका एकले ओहो तपाई कहाँबाट यहाँ ?यहाँ हामी छौं नि, तपाईंलाई के दुःख ? भन्दै हात मिलाउन थाले। सेवाग्राही अलमलमा परे। सेवाग्राही बिर्तामोड नगरपालिका५ का सन्दीप खातुनले भने, मैले तपाईलाई चिनेकै छैन। उनी तर्कंदै थिए। तर ती बिचौलियाले चिया खाने बहानामा कार्यालयपछाडिको क्यान्टिनमा लगेर आफ्नो काम हातमा लिए। खातुन पाँच वर्ष दुबईमा बसेर आएका रहेछन्। विदेश नजाने भएपछि जग्गा बैंकमा धितो राख्ने प्रक्रियाका लागि नापीमा आएको उनले बताए। उनले भने, मलाई यस्तै पैसा खान बसेका हुन्छन् भन्ने पनि थाहा थियो तर आज आफैं परियो। काम छिटो हुने लोभमा ३ हजार खर्च गरियो। १०ः४५ बज्दा कार्यालयका ३५ कर्मचारीमध्ये ४० प्रतिशतको मात्र उपस्थिति थियो। एघार बजेसम्म सबै आउनुहुन्छ। यस्तै हो कसैको घर टाढा छ आउँदाआउँदै ढिला हुन्छ नि, कर्मचारी सुरेश ठकुरीले भने। कार्यालय भवन जीर्ण छ। गेट र पर्खाल छैन। पानीको एउटा जार राखिएको थियो, तर पानी थिएन। कार्यालयका भित्ताभरि पान खाएर थुकिएको छ। सेवाग्राहीलाई बस्नका लागि तीन वटा कुर्सीबाहेक केही छैन। कार्यालयका फाँटमा भन्दा चिया पसलमा चहलपहल देखिन्छ। हैरान पार्छन् बिचौलियाले बनियानीबाट कल्पना राई काखमा तीन महिनाको नानी बोकेर आएकी थिइन्। पैसा आवश्यक परेकाले २ कठ्ठा जग्गा बैंकमा धितो राखेर व्यापार गर्न खोजेकी रहिछन्। त्यसका लागि उनलाई नक्सा चाहिएको थियो। उनी गाडीबाट झरेर कार्यालयसम्म आइपुग्दा करिब ६७ जना बिचौलियामध्ये कसैले झोला, कसैले नानी समातिदिएका थिए। कामको जिम्मा कसले लिने भन्ने टुंगो पनि बिचौलियाले लगाए। त्यसबापत राईले दुई हजार तिरिन्। आफैंले काम फत्ते गर्नु भनेको ठूलो उपलब्धि हो, ज्यामीरगढीका एक युवकले भने। राजस्व तिर्ने ठाउँमा तीन घण्टा लाइनमा बसेका उनले भने, लाइन पनि ठूलो छैन। तर बीचबीचमा एकैछिन है सानो गल्ती सच्याउने हो वा खुद्रा पैसा लिन बिर्सेछ भन्दै बिचौलिया छिरेर सेवाग्राहीलाई अलमल्याइदिन्छन्। मध्याह्न १२ बजे मादक पदार्थ सेवन गरेका २ बिचौलिया कार्यालयमा छिरे। म पनि कामको बहानामा नक्सा फाँटको लाइनमै थिएँ। मैले भनें, आँखा देख्नुहुन्न ? यत्रो लाइन छ। दुईमध्येका एक बिचौलियाले भने, हाम्रो सानो काम छुटेछ के बैनी भन्दै दुवै भित्र छिरे। ल त सर भरे चोकमा भेट्नुपर्छ है, भनेर फाइल टेबलमा राखिदिएर उनीहरु मुसुमुुुसु हाँस्दै निस्किए। बिचौलिया नसमाए काम बन्दैन दिउँसो १ बजे। ३५ डिग्रीको उखरमाउलो गर्मी र भीडले गर्दा सेवाग्राही उकुसमुकुसमा थिए। त्यसमाथि बीचबीचमा अनेक बहाना लिएर छिर्नेबिचौलियाले गर्दा सेवाग्राहीमा चिडचिडाहट बढ्दो थियो। एकजना कित्ताकाट गर्न आएका अधबैंसे उमेरका लक्ष्मण राजवंशी बिहान १० बजे नापी कार्यालय आइपुगेको बताउँछन्। म आउँदा पनि यिनीहरू नै अगाडि थिए। अहिले पनि यिनै मान्छेहरू घुमिराखेको देख्छु। हामी आपैं काम गर्छौं भन्नेको केही पार लाग्ने रहेनछ, उनले भने, अमिन लगेर जग्गा कित्ताकाट गर्न लगाउनुपर्ने थियो। यहाँ कागजपत्र पेस गर्दै लिन आनाकानी मान्ने। पैसा लिन पाइँदैन भन्ने कुरा कर्मचारीले पहिलै बुझ्छन् जस्तो लाग्छ। हामी सीधै लाइनमा बस्नेलाई अनेक बहाना बाजी हुन्छ बिचौलियाको काम छिनभरमा भएको देखिन्छ। बिर्ताबजारबाट जग्गा मूल्यांकन गर्न आएकी शर्मिला चेम्जोङ भन्छिन्, पुरानो नक्सामा जग्गा नापेको मिलेनछ। त्यही सच्याउन आएकी। उनका अनुसार नयाँ नक्सा बनाउँदा अर्काको दुई कठ्ठा जग्गा आपूतिर आएको छ। पहिलाको जग्गा पनि अमिन लगेरै नापेको हो। अब फेरि एक लाख रुपैयाँ लाग्छ भन्छन्। ३ बज्नै लाग्दा कार्यालय सुनसान हुँदै थियो। त्यत्तिकैमा भीआईपी गाडीमा एकजना मान्छे आए। ती सेवाग्राही काठमाडौंबाट आएका रहेछन्। गाडी रोकिनेबित्तिकै बिचौलियाले घेरिहाले। अवस्था सुधार्छु : प्रमुख नापी कार्यालयका प्रमुख डिल्लीराज भण्डारी बिचौलियाको आफ्नो कार्र्यालयमा केही काम नभएको बताउँछन्। आपू आउँदा लथालिंग रहेको कार्यालय व्यवस्थित हँुदै गएको उनको दाबी छ। एक वर्ष अगाडिसम्म यहाँ सीसीटीभी राख्छु भन्दा बिचौलिया मैमायिथ जाइलाग्न खोजे। तर पनि मैले कार्यालयमा सीसीटीभी राखेरै छोडें। जीर्ण भवनको अवस्थाले पनि आपूले सोचेजस्तो कार्यालय बनाउन नसकेको भण्डारीले स्वीकारे। म हरेक दिन बिहान पौने दसमा कार्यालय आउँछु। मेरो अगाडि बिचौलिया देखिँदैनन्। म कार्यकक्षमा बसेपछि उनीहरुको चलखेल सुरु हुन्छ भन्ने सुन्छु। कर्मचारी र बिचौलियाको सम्पर्क भइराख्छ। नापी कार्यालयलाई प्रदेशकै उत्कृष्ट बनाउने दाबी उनले गरे।"
दुई वर्षदेखि गाउँपालिकाको काम मन्दिरबाटै,"मलंगवा : गाउँपालिका भवन नहुँदा चक्रघट्टा गाउँपालिकाका अध्यक्ष विक्रम राय यादव मन्दिरमा बसेर गाउँपालिकाको कामकाज गर्दै आएका छन्। भवन अभावमा मन्दिरको एकपट्टि अध्यक्ष र अर्कोपट्टि उपाध्यक्षको कोठा बनाइ कार्यालय संचालन गरिएको हो। बीचको कोठामा हनुमानको प्रतिमा रहेको छ। मन्दिरको बरण्डामै गाउँ कार्यपालिकाको बैठक, तालिम तथा गोष्ठीहरु समेत हुने गरेको छ। गाउँपालिका संचालन गर्न कृषि सेडको भवन अपुग भएपछि अध्यक्ष र उपाध्यक्ष दुई वर्षदेखि मन्दिरमै बस्दै आएको गाउँपालिकाका निमित्त कार्यालय प्रमुख मुकेशकुमार पाठकले जानकारी दिएका छन्। बजारको बीचमा रहेको कृषि सेडमा चारवटा ससना कोठा रहेको अध्यक्ष यादवले बताए। चार कोठामा गाउँपालिकाको सम्पूर्ण कामकाज गर्न कठिनाइ भएपछि आफु मन्दिरमा गएर बस्न थालेको यादवको भनाइ छ। भाडाको लागि कुनै भवन बजारमा नपाएपछि बाध्य भएर मन्दिरमा बस्नु परेको हो', यादवले भने, अन्य स्थानमा लगे विवाद चर्किने देखिएपछि मन्दिरमै बस्नु ठिक ठानेँ। 'सेडमा कार्यालय प्रमुख, स्वास्थ्य, प्रशासन र योजना शाखा संचालन छ। अन्य शाखाहरु सेडको बरण्डामै संचालन भइरहेका छन्। कर्मचारीलाई बस्ने ठाउँ छैन। मन्दिरको कोठामा झ्याल छैन। गर्मीमा जसोतसो बसेर काम गर्नु परेको छ। मन्दिरका साधुहरुसमेत बेलाबेलामा मन्दिर खाली गर्नका लागि हल्ला गर्छन्', यादवले दुखेसो गरे। गाउँपालिकाको आफ्नो भवन नभएपछि कामकाज गर्न अहिले निकै कठिनाइ भएको निमित्त कार्यालय प्रमुख मुकेश पाठकले बताए। 'अहिले हामीसंग चारकोठा मात्र छ। त्यो पनि कृषि सेडको हो। कुन दिन त्यो कोठा पनि छोड्नुपर्छ ठेगान छैन। मन्दिरको सानो बरण्डामा तालिम गोष्ठी चलाउनु परेको छ', उनले भने, 'अहिले गाउँपालिकाको भवन निर्माणाधीन अवस्था छ। त्यो बन्न अझै १ वर्ष लाग्छ। भवन निर्माणका लागि थप बजेट नहुँदा झन ढिलाइ हुने देखिन्छ।'"
'प्रदेश ५ को राजधानी यसैवर्ष टुंगो लाग्छ',"गुल्मी : प्रदेश ५ का मुख्यमन्त्री शंकर पोखरेलले प्रदेश राजधानी र नामाकरण को टुंगो यसैवर्षभित्र लाग्ने बताएका छन् । मंगलबार सदरमुकाम तम्घासमा आयोजित पत्रकार सम्मेलनमा बोल्दै उनले सुझाव संकलन समितिले प्रतिवेदन बुझाएलगत्तै राजधानी टुंगो लगाइने उल्लेख गरे । राजधानीका विषयमा गठित समितिले भूगोलविद्, राजनीतिज्ञ र विभिन्न क्षेत्रका विज्ञहरुसँग छलफल जारी राखेको उनको भनाइ छ । राजनीति दाउँपेचभन्दा सबै जिल्लाका नागरिकहरुलाई पायक पर्ने उचित स्थानमा राजधानी तोकिने उनले ठोकुवा गरे । सबैले दिपावली गर्ने गरी राजधानीको टुंगो लाग्छ, उनले भने,सबै नागरिकलाई पायक हुने ठाउँ तोक्छौँ । यस्तै, पोखेरलले जिल्लाको सत्यवतिका पहिरो पीडितहरुको पूनःस्थापनको जिम्मा प्रदेश सरकारले लिने उद्घोष गरेका छन् । सत्यवतिको दुई ठाउँमा पहिरो जाँदा धेरै जनधनको क्षति भयो । ठूलोलुम्पेकमा बस्ती नै स्थानान्तरण गर्नुपर्ने छ, उनले भने, यसको सबै जिम्मा प्रदेश सरकारले लिन्छ । पहिरोपीडितले चिन्ता लिनुपर्दैन् । प्रदेश सरकार आफैँमा सक्षम भएकाले केन्द्र सरकारले आवश्यक ठानेर सहयोग दिएमात्र लिने उल्लेख गरे । प्रदेश सरकारकै पहलमा पहिरो प्रभावित क्षेत्रमा अध्ययन अनुसन्धान गरिसकेको बताए । गत साउन १० गते सत्यवति गाँउपालिकाको लिम्घा र ठूलोलुम्केपमा पहिरो जाँदा १३ जनाको मृत्यु भएको थियो ।"
रोकिरहेको मिनीट्रकमा आगजनी,"काठमाडौ : रामेछापको मन्थली नगरपालिका वडा नम्बर ५ सुनारपानीमा मिनी ट्रकमा आगजनी भएको छ। गएराति ११ बजेतिर बा ५ ख ३७४४ नम्बरको मिनीट्रकमा अज्ञात व्यक्तिले आगो लगाएका हुन्। ड्राइभर सन्देश कार्कीको घरनजिकै पार्किङ गरेर राखिएको मिनिट्रक पूर्णरुपमा जलेको ट्रक धनी नवीन कार्कीले जानकारी दिए। उनकाअनुसार गाडीमा आगलागी भएको स्थानीय एक बृद्धले देखेर खबर गरेपछि स्थानीयले आगो निभाउने प्रयास गरेका थिए। ट्रकमा आगो कसले, किन लगायो भन्ने अनुसन्धान भइरहेको जिल्ला प्रहरी कार्यालयका प्रहरी निरीक्षक टेकेन्द्र पौडेलले जानकारी दिए। सवारी धनी कार्की तामाकोशी ढुवानी सेवा समितिका अध्यक्ष हुन्।"
बन्दै गरेको रंगशालाको खाल्डोमा डुबेर बालकको मृत्यु,ताप्लेजुङ : मदन भण्डारी रंगशाला निर्माण गर्ने क्रममा बनेको पानी जमेको खाल्डोमा पौडी खेल्ने क्रममा बालकको मृत्यु भएको छ । ताप्लेजुङको मैवाखोला गाउँपालिकाको केन्द्र साँघुमा मदन भण्डारी रंगशाला निर्माणाधिन छ। मृत्यु हुनेमा स्थानीय १५ वर्षीय मनकुमार चोङवाङ छन्। जिल्ला प्रहरी कार्यालय ताप्लेजुङका प्रमुख संञ्जयसिं थापाका अनुसार मंगलबार मनकुमारसहित तीनजना रंगशाला निर्माणस्थलको खाल्डोमा जमेको पानीमा पौडी खेल्न गएका थिए । सोहि क्रममा डुबेर दिउँसो २बजेतिर उनको मृत्यु भएको हो। मृतकको शव पोष्टमार्टमका लागि जिल्ला अस्पताल ल्याइने प्रहरीले जनाएको छ।
विद्यालयमा प्रअ र व्यवस्थापन समिति अध्यक्षबीच विवाद,"विराटनगर : विराटनगर महानगरपालिका११ पञ्चमुखी चोकको अरुणोदय अधारभुत विद्यालयका प्रधानाध्यापकले व्यवस्थापन समितिको अध्यक्षलाई जानकारी नै नदिइ भवन निर्माण गरेपछि विवाद उत्पन्न भएको छ। समाजिक विकास मन्त्रालय प्रदेश १ ले अनुदान दिएको १० लाखबाट गरेको भवन निर्माण र विराटनगर महानगरपालिकाले दिएको ३ लाख आर्थिक सहयोगमा गरेको मर्मत कार्य आफूलाई जानकारी नै नदिएको भन्दै व्यवस्थापन समितिका अध्यक्ष सीतो सहनीले आपत्ति जनाएका छन्। प्रअ ज्ञानेन्द्र खड्गाले आफूलाई जानकारी नदिइ काम गरेको व्यवस्थापन समितिका अध्यक्ष सीतो सहनीको आरोप छ। 'समाजिक विकास मन्त्रालयले भौतिक निर्माण अन्तर्गत दिएको १० लाखको काम गर्दा मेरो अनुपस्थितिमा निर्णय गरेर ठेक्कामा लगाए। तीन महिनादेखि प्रअ खड्गाले कुनै पनि मिटिङमा समेत मलाई बोलाएनन्', अध्यक्ष सहनीले बताए। स्थानीय तहको निर्वाचनपछि वडा अध्यक्षको सिफारिसमा भोलेन्टियरमा एक शिक्षक राखेपछि नै अध्यक्ष सहनी र प्रअ खड्काबीच विवाद देखिँदै आएको थियो। प्रअ खड्काले भने अध्यक्षलाई बैठकमा बोलाउँदा नआउने गरेको बताएका छन्। उनले भने, अध्यक्ष बैठकमा आउँदैनन्, अनि विद्यालयमा आएको अनुदानलाई खर्च गर्न वडा अध्यक्षको अध्यक्षतामा बैठक बसेर काम गरेँ।'"
