शीर्षक,विवरण
"करिनाको परिवारलाई सहयोग जुट्दै, बहिनी र आमाको निशुल्क उपचार हुने","धादिङ : आमा प्यारालाइसिसले थलिएको अवस्थामा बाबाले आत्महत्या गरेपछि बिचल्लीमा परेका नीलकण्ठ नगरपालिका १२ आँगेटारीस्थित करिना थापामगरको परिवारलाई सहयोग जुट्न थालेको छ । प्यारालाइसिसले थलिएकी करिनाकी आमा लक्ष्मी थापा मगर र शरीरको जताततै बाक्लो रौँसहित पिठ्युँमा मासुको डल्ला भएकी बहिनी सोमकुमारी पनि उपचार हुने भएको छ । काठमाडौंको धुम्वाराहीस्थित हस्पिटल फर एडभान्स मेडिसिन एण्ड सर्जरी (ह्याम्स) अस्पतालले सम्भव भएसम्मका सबै उपचार निशुल्क गरिदिने अस्पतालका अध्यक्ष आर एस भण्डारीले अन्नपूर्णकर्मीसँग टेलिफोनमा बताए । आत्महत्या गरेको करिनाको बाबाको भर्खरै काजक्रिया सकिएकाले घरको व्यवस्थापन मिलाएर जतिसक्दो चाँडो उपचारको लागि पठाइने नीलकण्ठ नगरपालिका १२ का अध्यक्ष बाबुराम लंसालले बताएका छन् । साँकोषस्थित साँकोष उच्च माविमा ७ कक्षामा अध्ययनरत करिनाको १२ कक्षासम्म पढ्दा लाग्ने शैक्षिक सामाग्री, लत्तापकडा सहितको सबै खर्च धादिङवेशीमा विभिन्न पेशा व्यवसायमा रहेका युवाको समूह 'डायमण्ड इन्भेष्टमेन्ट ग्रुप' ले बेहोरिदिने भएको छ । सोही ग्रुपले प्रवद्र्धन गरेको स्वर्णीय बहुउद्येश्यीय सहकारीमा करिनाले १२ कक्षा पास गरेपछि रोजगारीको ग्यारेन्टी सहित पढाइ खर्च बेहोर्नका लागि साँकोष उच्च माविसँग लिखित सम्झौता नै गरिदिएको छ । त्यस्तै करिनाकी बहिनी सोमकुमारीको उपचारपछि र भाइ काजीका लागि उनीहरुले पढ्न चाहने सम्मको उच्च शिक्षा अध्ययनमा लाग्ने सबैखाले खर्च, बालबालिकाको शिक्षा, दिक्षा र सुरक्षाका लागि काम गरिरहेको संस्था नेपाल युथ फाउण्डेशनले बेहोर्ने सस्थाका कार्यक्रम व्यवस्थापक राजन पण्डितले प्रतिवद्धता जनाएका छन् । त्यस्तै तीनवटै बालबालिकाको पढाइको खर्चस्वरुप पोखराका ८६ वर्षीय वृद्ध दिनबन्धु कोइरालाले पनि मासिक ५ हजार बालबालिकाको खातामा दिने प्रतिवद्धता जनाएका छन् । आमाको प्यारालाइसिस भएको र बाबाले आत्महत्या गरेपछि बालबालिकाको विचल्ली भएको समाचार सार्वजनिक भएपछि छिमेकी विद्यालयमा अध्ययनरत बालबालिकाले खाजा खर्च कटाएर नगद जम्मा गरी साँकोष उच्च मावि पुगेर हस्तान्तरण गरेका छन् । नीलकण्ठ माविबाट ३५ हजार ६ सय १०, पन्चकन्या माविबाट ११ हजार ८ सय ८०, पण्डितचौर आधारभुत विद्यालयबाट १० हजार ५, करिना अध्ययनरत विद्यालयकै जुनियर रेडक्रस सर्कलबाट १४ हजार १ सय ५, गणेश हिमाल क्याम्पसबाट २० हजार ७ सय ३५, मनरुपी माविबाट ८ हजार ७ सय ३०, धादिङ वोर्डिङ तेक्वान्दो विद्यार्थी बाट ४ हजार २ सय ७०, किवो बोर्डिङ स्कुलले १२ हजार ७ सय ७५, जुनियर रेडक्रस गोष्ठीबाट ६ हजार ५ सय ३०, पशुपति मावि ८ हजार ४ सय ७५, बालमन्दिर मावि बाट ११ हजार ४ सय ३०, सुनगाभा एकेडेमीबाट ५ हजार १ सय ५० र कुण्डला माविबाट १ हजार ६ सय रुपैया बालबालिकाहरुले साथीको सहयोग स्वरुप विद्यालयलाइ हस्तान्तरण गरेका छन् । त्यस्तै सिद्धलेक गाउँपालिका कार्यलयले नगद ५० हजार, आवाज अभियान नेपालले १५ हजार र परोपकारी युवा समाजको ११ हजार सहयोग गरेका छन् । समाचार सार्वजनिक भएपछि बालबालिकाको शिक्षा दिक्षा घरब्यवहारमामा सहयोगको लागि विभिन्न सामाजिक सस्थाहरु र ब्यक्तिहरुले चासो देखाएकाले भविष्यमा बालबालिकाको उच्च शिक्षा र घरब्यवहारमा खर्च गर्ने गरि विद्यालयको तर्फबाट शिक्षक राम लामिछाने, बालबालिकाका काका बलबहादुर थापा मगर र विद्यालय ब्यवस्थापन समितिका सदस्य टिका मगरको संरक्षकत्वमा राष्ट्रिय बाणिज्य बैंक धादिङवेशीमा १०३००२०२८८१० नम्वरको खाता संचालन गरिएको छ । त्यस्तै वडा कार्यलयको पहलमा वडा अध्यक्ष बाबुराम लंसाल र काका इन्द्र बहादुर थापा मगर संरक्षक रहने गरि तिनवटै बालबालिकाको नाममा सानिमा बैंक धादिङवेशी शाखामा ००४०११०८००००३८८ नम्वरको खाता संचालन गरिएको छ । करिनाको घर भुकम्पको अनुदान पाउने सुचीमा रहेपनि पहिलो किस्ता लिएर अहिलेसम्म बनेको छैन । उनीहरु अहिले टहरामा बस्दै आएका छन् । विभिन्न सस्थासंग समन्वय गरेर उनीहरुको पक्की घर पनि बनाइदिने वडा अध्यक्ष बाबुराम लंसालले बताए । त्यस्तै सामाजिक अभियन्ता राधा श्रेष्ठ, मिरा केसी र प्रभा पोखरेलको पहलमा विभिन्न सहयोगी व्यक्तिबाट उठाइएको ६७ हजार बालबालिकालाई प्रदान गरिएको छ ।"
बालबालिकालाई विद्यालय ल्याउन दिवा खाजा,"स्याङ्जा : भीरकोट नगरभित्रका सबै बालबालिकालाई दिवा खाजाको व्यवस्था गरिएको छ । नगरपालिका र सामुदायिक विद्यालयको सहकार्यमा दिवा खाजाको व्यवस्था गरिएको हो । कुनै पनि बालबालिका शिक्षाबाट बंचित नहोऊन भन्ने उदेश्यले नगरपालिकाले दिवा खाजाको व्यवस्था मिलाएको जनाएको छ । अन्र्तराष्ट्रिय बाल अधिकार दिवसको अवसर पारेर मंसिर १ गतेदेखि नगरभित्रका ४२ वटा बालविकास कक्षामा अध्ययरत ५ सय ५४ बालबालिकालाई दिवा खाजाको व्यवस्था गरिएको नगरप्रमुख छायाराम खनालले जानकारी दिए । 'बालविकासमा अध्ययरत ससाना बालबालिका खाजाको अभावका विद्यालयमा नियमित आउन सकेका थिएनन्, 'प्रमुख खनालले थपे, 'उनीहरुलाई खाजाको व्यवस्था गरेमा नियमित उपस्थिति हुनसक्ने देखिएकाले खाजाको व्यवस्था गरिएको हो ।' विद्यालयमै खाजाको व्यवस्था भएपछि बालबालिका खुशी देखिएका छन् । विद्यालयमै बनाउने गरी घरेलु खाजा दिइने शिक्षा शाखा प्रमुख हेमप्रसाद आचार्यले बताए । विद्यालयमै उपलब्ध खाजाले बालबालिकाको स्वास्थ्यमा सकारात्मक प्रभाव पार्नुका साथै बालबालिका नियमित बिद्यालय आउनेमा नगरपालिका विश्वस्त छ । भीरकोट नगरपालिकाले बालबालिकाको क्षेत्रमा उल्लेखनीय काम गरेको जानकारी गराउँदै आउँदो चैत मसान्तभित्रै बालमैत्री नगर घोषणाको तयारीमा जुटिरहेको उपप्रमुख सीमा कर्माचार्य केसीले जानकारी दिइन । अन्तराष्ट्रिय बालदिवस नोभेम्बर २० तारेखका दिन मनाइँदै आएको छ । विश्वभरीका बालबालिकाको आधारभूत आवश्यकता पूरा गरी बालबालिकालाई खुशी बनाउने उद्देश्यले यो दिवस मनाउने गरिएको हो ।"
धार्मिक तथा पर्यटकीय स्थलमा हवाई सेवा,"विराटनगर : प्रदेश १ का धार्मिक तथा पर्यटकीय स्थलको भ्रमणका लागि हवाई सेवा सुरु गरिने भएको छ। ताप्लेजुङको पाथिभरा मन्दिर, खोटाङको हलेसी महादेव मन्दिरसमेतका धार्मिक तीर्थस्थल र अन्य पर्यटकीय स्थललाई लक्षित गरेर सेवा सुचारु गर्न लागिएको हो। जसले धार्मिक तथा आन्तरिक पर्यटन प्रवद्र्धनमा मद्दत पुग्ने अपेक्षा गरिएको छ। विराटनगर विमानस्थलबाटै मंसिर तेस्रो सातादेखि सेवा सञ्चालनका लागि विराट होलिडे ग्रुप, सीता एयर र माउण्टेन हेलिकप्टर कम्पनीबीच सहमति भएको छ। ग्रुपका अध्यक्ष भविषकुमार श्रेष्ठले माग धेरै आएका कारण धार्मिक तीर्थस्थलसँगै हिमालय क्षेत्रको दृश्यावलोकनका लागि पर्वतीय उडान भर्ने गरी हवाई सेवा सुरु गर्न लागिएको बताए। विराटनगरबाट जहाजमा ताप्लेजुङको सुकेटार र त्यहाँबाट हेलिकप्टरमा पाथिभरा मन्दिर दर्शनका लागि तीर्थयात्रीलाई लैजाने योजना रहेको श्रेष्ठले बताए। उनका अनुसार त्यस अघि नै माउण्टेन हेलिकप्टर सुकेटार विमानस्थलमा लगेर राखिने छ। सुकेटारबाट पाथिभरासम्मको हेलिकप्टर उडान ७ मिनेटको हुने जानकारी उनले दिए। त्योबाहेक धरानबाटै सिधै हेलिकप्टमामा पाथिभरा उडान भर्ने योजना पनि छ, उनले भने, हलेसी महादेवको दर्शन गर्न जान चाहने भक्तजनहरूलाई पनि धरानबाटै हेलिकप्टरमा लैजान सकिन्छ। जहाजमा जान चाहनेलाई लामीडाँडा विमानस्थलसम्म जहाजमा लैजाने योजना छ। त्यसपछि गाडीमा लगेर हलेसीको दर्शन गरेर फर्किएपछि जहाजमै विराटनगर ल्याइने श्रेष्ठले बताए। जहाजबाट पर्वतीय उडान पनि भर्ने योजना छ। हेलिकप्टरले एक पटकमा ५ जना यात्रु बोक्नेछ। ६ जनाको क्षमता भएको हेलिकप्टरले उच्च क्षेत्रमा उडान गर्नु पर्ने भएकाले ५ जना मात्रै यात्रु बोक्ने श्रेष्ठको भनाइ छ। भ्रमण वर्ष २०२० लाई समेत धार्मिक तथा पर्यटकीय क्षेत्रलाई लक्षित गरेर सुरु गरिएको हवाई सेवाले मद्दत गर्ने पर्यटन व्यवसायीको बुझाई छ।"
कर्मचारी आफैले खोले वन कार्यालयलको ताला,डोल्पा : जिल्ला वन कार्यालय डोल्पाका कर्मचारीले आफ्नै कार्यालयमा लगाएको ताला खुलाएका छन्। २३ जना कर्मचारीले ११ महिसम्मको रासन नपाएपछि माग गर्दै आफ्नै कार्यालयमा ताला लगाएका थिए। जिल्ला प्रशासन कार्यालयले ठेकेदार र कर्मचारीसहित उपस्थिति गराएर रासन उपलब्ध गराउने बताएपछि प्रशासनको अनुरोधमा लगाइएको ताला खोलिएको कर्मचारीले बताए। ताला खुलेपछि सेवा सुचारू भएको छ ।राशनको जिम्मा लिएका ठेकेदार र कर्मचारी राखेर प्रशासनमा छलफल गराउने प्रशासनले जनाएको छ।
रामजानकी विवाह पञ्चमीको तयारीमा आर्थिक अभाव,"जनकपुरधाम : रामजानकी विवाह पञ्चमी तयारीमा आर्थिक अभाव देखिएको छ। मंसिर १५ गते यस वर्षको विवाह पञ्चमी परेको छ। भारतमा राम मन्दिर बन्ने निश्चित भएसँगैको पहिलो खुसीयाली भगवान् रामको ससुराली जनकपुरधामको विवाह पञ्चिमीमा इजहार हुने जानकी मन्दिरले जनाएको छ। पाँच वर्षमा भारतको अयोध्याबाट आउने भगवान् रामको विशेष जन्ती यस वर्षको विवाह पञ्चमीमा जनकपुरधाम आउने लागेको छ। तर, मेला व्यवस्थापन, वैवाहिक कार्यक्रम, खानपानका लागि जनकी मन्दिरसंग आर्थिक संकट छ। भगवान राम र मैया सिताको वैवाहिक उत्सव हेर्न नेपाल, भारत तथा अन्य मुलुकबाट लाखौंको संख्यामा भक्तजनहरू जनकपुर आउने गरेको जनकी मन्दिरका उत्तराधिकारी महन्थ रामरोशन दास वैष्णवले बताए। विवाह पञ्चमी आएका भक्तजनहरूको बास, खानपान, जन्तीको बिदाई, सांस्कृतिक कार्यक्रम व्यवस्थापन गर्न कम्तिमा चार करोड खर्च हुन्छ, उनले भने, सात दिनसम्म चल्ने विवाह पञ्चमी महामहोत्सवलाई संघीय सरकारले उपेक्षा गर्दै आएको छ।मधेशलाई मात्र नभई नेपालको विश्वमा जानकी मन्दिरले पहिचान दिलाएको उनले बताए। प्रदेश सरकारले ५० लाख विवाह पञ्चमी व्यवस्थानको लागि दिने चासो देखाए पनि अहिलेसम्म दिएको छैन। विवाह पञ्चमीको खर्च जुटाउन जानकी मन्दिरलाई प्रत्येक वर्ष चन्दा दातासँग हात फैलाउनु परेको छ। महोत्सवअन्तर्गत पहिलो दिन मंसिर १० गते जनकपुर नगर दर्शन, ११ गते फूलवारी लिला, १२ गते धनुषयज्ञ, १३ गते तिलकोत्सव, १४ गते मटकोर, १५ गते स्वयम्वर र शुभ विवाह र १६ राम कलेवासँगै विवाह पञ्चमी सम्पन्न हुनेछ।"
महिलाको दुवै स्तन काटेर फरार,भोजपुर : भोजपुरको षडानन्द नगरपालिका८ तुङ्गेछाको सेमेङमा अज्ञात समूहले महिलाको दुवै स्तन काटिदिएका छन् । घटनामा ३० वर्षीया महिला गम्भीर घाइते भएकी हुन्। बुधबार बिहान करिब ११ बजे स्थानीय खकुवाखोलामा लुगाकपडा धुन गएकी महिलाको नकापधारी अज्ञात समूहले स्तन काटेर भागेको बताइएको छ । उक्त समूहले कपडा धोइरहेकी महिलालाई जबरजस्ती नियन्त्रणमा लिएर स्तन काटी गम्भीर घाइते बनाएर फरार भएको जिल्ला प्रहरी कार्यालय भोजपुरका डीएसपी नरबहादुर सलामी मगरले बताए । उनको उपचारका लागि दिङ्लातर्फ लगिएको प्रहरीले जनाएको छ । घटनाको खबर पाएपछि इलाका प्रहरी कार्यालय दिङलाका प्रहरी निरीक्षक अमनलाल माझीको कमाण्ड टोली घटनास्थलमा पुगेको र फरार समूहको खोजी गरिरहेको प्रहरीले जनाएको छ ।
मुनाहरुको यो मुस्कान (फोटोफिचर),"काठमाडौं : अन्तर्राष्ट्रिय बाल अधिकार दिवस देशभर मनाइएको छ। प्रत्येक बालबालिकाको हक सुनिस्चित गर्नको लागि मनाइने यो दिन बुधबार राजधानीमा विभिन्न कार्यक्रम गरी मनाइएको हो। यही दिवसको अवसरमा बुधबार युनिसेफद्वारा आयोजित कार्यक्रममा बालबालिकाले विभिन्न प्रतिभा देखाएका हुन्। यस्तै बाल अधिकारलाई बढावा र शिक्षा भन्ने नारासहित पाटनको मंगलबजारमा चित्रकला प्रतियोगिता पनि भयो। उक्त प्रतियोगितामा सहभागि बालबालिकाको तस्बिर सुनिता डंगोलले खिचेकी छन्। हेर्नुस्, तस्बिरहरु :"
