शीर्षक,विवरण
कर छली अपराध,"सर्वोच्च अदालतले मूल्य अभिवृद्धि कर (भ्याट) तथा आयकर छलीका मुद्दामा राजस्व प्रशासनका पक्षमा फैसला गरेको छ। यसले आन्तरिक राजस्व विभागले १० वर्षअघि सुरु गरेको भ्याट छलीको अनुसन्धानबाट निर्धारित कर असुलीको बाटो खुलेको छ। विभागले २०६८ सालमा गरेको भ्याट छलीको अनुसन्धान मुलुकको राजस्व प्रशासनमा अहिलेसम्मकै सबैभन्दा महत्त्वपूर्ण कदमका रूपमा लिइएको छ। झन्डै असफलताको चरणमा पुगेको भ्याटमा यसले प्रशस्त सुधारका लागि मार्ग प्रशस्त गरेको छ। यद्यपि आन्तरिक राजस्व विभागले यो प्रणालीलाई सशक्त बनाउन नचाहेको देखिन्छ। कारोबार गर्नेहरूबीचमा देखिएको बेमेल (मिसम्याच) का आधारमा अघि बढाइएको अनुसन्धानपछि भ्याटको अनुपालनामा सुधार भएको थियो। ५१८ फर्मबाट त्यतिबेला ६ अर्ब ५९ करोड राजस्व निर्धारण भएको थियो। यो अनुसन्धान अघि बढाउन अर्थ मन्त्रालयको तत्कालीन नेतृत्व र अनुसन्धानमा सहभागी अधिकृतहरू धन्यवादका पात्र हुन्; जसले नेपालको कर प्रणालीमा रहेको ठूलो जोखिम पहिचान गरेर सही ट्र्याकमा ल्याउन विभिन्न समयमा भूमिका निर्वाह गरेका छन्। अनुसन्धानबाट नक्कली भ्याट बिल बनाएर वस्तु आयात गर्दा राखेको भ्याट क्रेडिट मिलान गरी व्यापारीले उल्टै सरकारलाई ठगेको पाइएको थियो। कतिपयले उपभोक्ताबाट भ्याट उठाएर सरकारलाई बुझाएका थिएनन्। नक्कली बिजक बनाएर आफूले वस्तु खरिद गरेका कम्पनीहरूसँग लागत बढाएर आफ्नो सञ्चालन खर्च उच्च देखाई आयकरसमेत ठगेका थिए। ठेक्कापट्टाको भ्याट असुली न्यून थियो। भ्याटमा दर्ता भएका दुई लाख १३ हजार सात सय ७० करदातामध्ये १५ प्रतिशतले मात्र भ्याट दाखिला गर्दै आएका छन्। ४० प्रतिशत क्रेडिट फाइलर (भ्याटको दायित्व भएका तर दाखिला गर्न बाँकी रहेका) छन्। वस्तु आयात गरेर बिक्री नभएसम्म भ्याट दाखिला गर्नु पर्दैन। तर कतिपय फर्मले नक्कली फर्मसँग कारोबार देखाएर त्यहाँ वस्तु स्टक रहेको भन्दै भ्याट तिरेका थिएनन्। भ्याटमा दर्तामध्ये ३५ प्रतिशतले त कर विवरण बुझाउँदैनन्; जसलाई कर प्रशासनको भाषामा ननफाइलर भनिन्छ। भ्याटमा दर्तामध्ये १० प्रतिशत कारोबारको भ्याट लाग्ने सीमाभन्दा कारोबार कम हुने भएकाले उनीहरूले विवरण मात्र बुझाए हुन्छ। भ्याट दाखिला गर्नु पर्दैन। भ्याट मूलतः अन्तिम उपभोगमा लाग्ने कर हो। वस्तु तथा सेवाको अन्तिम उपभोग गर्ने उपभोक्ताबाट उठाएको कर राज्यकोषमा दाखिला नगरेर भ्याटमा लुट मच्चाउनेहरू ढिलोचाँडो कर तिर्न बाध्य भएका छन्। कर छली गम्भीर र अक्षम्य अपराध हो। यो वास्तवमा ठूलो लुट पनि हो। दुर्गम भूभागमा बसोबास गर्ने कतिपय मानिसमा सिटामोल र जीवनजलको समेत पहुँच छैन। उनीहरूको जनजीवन कष्टकर छ। राज्यले प्रवाह गर्ने वस्तु र सेवाको गुणस्तर तथा पूर्वाधार विकासमा लगानी गर्नुपर्ने कर छल्न उद्यत हुनेलाई कारबाहीको दायरामा ल्याउनैपर्छ। आन्तरिक राजस्व विभागले कारोबारको मिसम्याच पत्ता लगाउने प्रणालीलाई प्रभावकारी रूपमा लागू गर्न सकेन। बरु राजस्व अनुसन्धान विभागले राजस्व चुहावट नियन्त्रणका लागि कारोबारको मिसम्याच हेरेर विभिन्न फर्मलाई अनुसन्धानको दायरामा ल्याउनुका साथै मुद्दासमेत दायर गरिरहेको छ। तर आफैंमा स्रोतसम्पन्न आन्तरिक राजस्व विभागले पनि त्यसरी अनुसन्धान अघि बढाउन आनाकानी गर्नुले विगतमा सुरु गरिएका अनुसन्धानसमेत फितलो बनाउने प्रयासको निरन्तरताकै उपजका रूपमा लिनुपर्छ। जबसम्म राजनीतिक नेतृत्वमा कर प्रणाली सशक्त बनाउनुपर्छ भन्ने आत्मानुभूति हुन सक्दैन तबसम्म यस्ता समस्या देखा परिरहन सक्छन्। यस्तो अवस्थामा सशक्त आम सञ्चारमाध्यम र न्यायालयको भूमिका अपेक्षित छ। राजनीतिक दलहरूले चन्दा र घुसको पृथकता नछुट्याउँदासम्म, सरकारसँग काम बनाउन मन्त्री र कर्मचारीलाई घुस दिनुपर्ने बाध्यता रहिरहेसम्म यस्ता समस्या रहिरहन्छन्। यसका लागि राजनीतिक नेतृत्वदेखि कर्मचारीसम्मको आचरण सुधार हुन आवश्यक छ। कर छलीजस्तो जघन्य अपराधमा कहीँ कसैलाई जोगाउने, बचाउने या सहानुभूति राख्ने काम स्वीकार्य छैन।"
ओली र प्रचण्डको असमझदारीले पार्टीमा सन्नाटा : दाउ पर्खदै दुई अध्यक्ष,"काठमाडौं : नेकपाका दुई अध्यक्ष प्रधानमन्त्री केपी ओली र पुष्पकमल दाहालबीचको असमझदारीले सत्तारुढ दलमा सन्नाटा छाएको छ। आइतबार तेस्रो पटक ६ माघसम्मका लागि संसद् बैठक स्थगित भएयताका दुई दिन नेकपाका दुई अध्यक्षबीच संवाद छैन। प्रधानमन्त्री ओली सरकारी निवास बालुवाटारमा व्यस्त छन् भने अर्का अध्यक्ष दाहाल खुमलटारचितवन आउजाउ गरिरहेका छन्। मंगलबार प्रधानमन्त्री ओली बालुवाटारमै चेम्बर अफ कमर्सका प्रतिनिधिसँगको भेटघाटदेखि उच्चस्तरीय प्रशासन सुधार कार्यान्वयन तथा अनुगमन समितिको प्रतिवेदन बुझ्ने कार्यक्रममा व्यस्त देखिए। दाहाल भने बिहान पार्टीका नेता भीम रावल, अग्नि सापकोटालगायतसँग अलगअलग छलफल गरी चितवन पुगेर फर्केिए । नेकपाभित्र सभामुख चयन, विकास र सहयोगसम्बन्धी अमेरिकी नियोग मिलेनियम च्यालेन्स कर्पाेरेसन (एमसीसी)का विषयमा पार्टी नेताहरूकै बीचमा तीव्र धु्रवीकरण भइरहेको छ। दाहालले चितवन पुगेर मंगलबार साँझ थुप्रै मिटिङ गर्नुपर्ने भएकाले आफू दुई घण्टाका लागि मात्र माडी आएको बताए पनि त्यस्तो छलफल दाहाल फर्केपछि पनि भएको छैन। संसद्मा झन्डै दुई तिहाइ मतका साथ बलियो उपस्थिति रहेको नेकपाले सभामुख उम्मेदवार चयन गर्न नसक्दा संसद् एक महिना बन्धक बनिसकेको छ। तर, बन्धक संसद् खुलाउने र पार्टीभित्रको धु्रवीकरण तोड्न नेकपाका दुई अध्यक्षलाई तीव्र दबाब भए पनि ओलीदाहाल संवादमा छैनन्। दुवै अध्यक्ष दुई दिनयता एकअर्काे अध्यक्षले चाल्ने कदम को सूक्ष्म अध्ययन गर्दै बसेका छन्। दुवै अध्यक्ष केही दिन पर्ख र हेरको नीतिमा देखिनुभएको छ, नेकपाका एक स्थायी समिति सदस्यले भने, प्रधानमन्त्री आफू अनुपस्थित बैठकको निर्णय दाहालले कसरी कार्यान्वयन गर्न सक्छन् भनेर हेर्न थाल्नुभएको छ, दाहाल पनि प्रधानमन्त्री ओलीको अबको स्टेप के हुन सक्छ भनेर बसिरहेको देखिनुहुन्छ। प्रधानमन्त्री ओली र कार्यकारी अध्यक्ष प्रचण्ड दुई दिनयता एकअर्कोले चाल्ने रणनीतिको सूक्ष्म अध्ययनमा छन् । नेकपाभित्रको गाँठो फुकाउन संवादमा बस्नुपर्ने दुवै अध्यक्ष आफूनिकट नेतासँगको संवादमा छन्। दाहाल सचिवालयका एक सदस्यले मंगलबार चितवनबाट साँझ काठमाडौं फर्केर अन्नपूर्णसँग भने, दुई दिनयता संवादमा गतिरोध छ, राजनीति चकमन्न छ। सभामुखका लागि ओली र दाहालका आआफ्नै रुचिका पात्र छन्। सभामुखको पात्र चयनमा सकस परिरहेका बेला २३ पुसमा नेता वामदेव गौतमको भैंसेपाटी निवासमा बसेको बहुमत सचिवालय सदस्यको प्यानल बैठक ले ओलीदाहालबीच झन् असमझदारी बढेको छ। अध्यक्षद्वयमा बढेको असमझदारीका कारण उपसभामुख शिवमाया तुम्बाहाङफेको राजीनामा अड्किएको नेकपाका नेता बताउँछन्। उपसभामुखलाई पार्टीभित्रैबाट ब्याकफोर्स रहेका कारण राजीनामा दिनुभएको छैन, यो देखिँदो कुरा हो, नेकपा स्थायी समिति सदस्य देवेन्द्र्र पौडेलले अन्नपूर्णसँग भने। उपसभामुख तुम्बाहाङफेलाई पार्टी सचिवालयले शनिबार राजीनामा दिन आग्रह गरेको थियो। तर, उनले राजीनामा दिएकी छैनन्। राजीनामा नदिँदा नेकपा सचिवालयकै निर्णय कार्यान्वयनमा जटिलता पैदा भएको छ। दाहाल स्वयंले पनि पार्टीभित्र देखा परेको राजनीतिक जटिलता चितवनको एक कार्यक्रममा मंगलबार स्विकारे। म आउने समय भएर माडी आएको होइन। निकै दबाब थियो, नजा भन्ने साथीहरू पनि थिए काठमाडौंमा। तपाईंहरूले देख्नुभएको छ, केन्द्रीय राजनीतिमा अलिअलि जटिलता देखा पर्छन्। तिनलाई समाधान गर्न लगातार छलफल गर्नु थियो। मलाई नेताहरूले अहिले यस्तो बेला बाहिर नजान भनिरहनुभएको थियो। म माडी जाने भएँ भनेर दुई घण्टाका लागि आएको हुँ, दाहालले मंगलबार माडीको खिचरा महोत्सव उद्घाटनमा भने। दाहाल मंगलबार नै चितवन पुगेर काठमाडौं फर्केका हुन्। प्रधानमन्त्रीका निजी सचिवालयका अनुसार आइतबारयता दाहाल बालुवाटार आएका छैनन्। शनिबारको सचिवालय निर्णय कार्यान्वयनका सवालमा बालुवाटारमा तुम्बाहाङफेसँग ओली, दाहाल, महासचिव विष्णु पौडेल र सचिवालय सदस्य ईश्वर पोखरेलले छलफल गरेका थिए। छलफलमा तुम्बाहाङफे आफ्नो अडानबाट नगलेपछि उनलाई प्रधानमन्त्रीकै ढाडस रहेको आशंका इतर पक्षका नेताले गरेका छन्। सभामुख चयनका विषयमा दाहालले वरिष्ठ नेता माधव नेपाल, मात्रिका यादव, देव गुरुङलगायत नेतासँग अनौपचारिक संवाद गरेका छन्। प्रधानमन्त्री ओलीले पनि महासचिव विष्णु पौडेल, ईश्वर पोखरेललगायतसँग संवाद गरिरहेका छन्।"
