शीर्षक,विवरण
मन्त्री फेरिने हल्लाले सिंहदरबार अस्थिर,"सरकार गठनको नौ महिना बितेदेखि मन्त्रिमण्डल पुनर्गठनको चर्चा चलेको थियो। न्यूनतम सेवा पनि प्रवाह गर्न नसकेपछि सरकारका मन्त्रीहरूको कार्यशैलीप्रति औंला ठड्याएको थियो। मन्त्रीहरूले आज हो कि भोलि हो भनेजस्तो गरी एघार महिना व्यतित भयो। मन्त्री फेरिने हल्लासँगै सिंहदरबार अस्थिर हुने गर्छ। सचिव र कर्मचारीले मन्त्रीको आदेश कार्यान्वयन गर्न रुचि देखाउँदैनन्, अझ कतिपय बेला टेर्दैनन् पनि। जसले सरकारी कामकाजमा असर पर्छ। मन्त्रिमण्डल फेरबदलका विषयले मन्त्रीहरू स्वयं पनि अस्थायी र अन्तरिम मानसिकतामा पुग्छन्। सत्तारुढ नेकपा सचिवालयको गत आइतबार बसेको बैठकले मन्त्रिमण्डल पुनर्गठन गर्ने कार्यादेश पार्टी अध्यक्ष एवं प्रधानमन्त्री केपी शर्मा ओलीलाई दिएको थियो। अर्का अध्यक्ष पुष्पकमल दाहालसित पटकपटक छलफल गरी मन्त्रिमण्डल पुनर्गठन गर्ने सहमति भयो। दुवै अध्यक्षबीच कसलाई राख्ने र कसलाई हटाउने भन्ने अन्तिम निर्णायक घडीमा आइपुग्दा दुवै अध्यक्षले आफन्त त्याग गर्न गाह्रो माने। यद्यपि मन्त्रिमण्डलमाथि पूर्ण नियन्त्रण र अधिकार प्रधानमन्त्रीकै हुन्छ, त्यसमा विवाद छैन। चुनावपछि एकीकृत पार्टीमा सहमति चाहिने भएपछि प्रधानमन्त्री एक्लैले निर्णय लिन सक्ने स्थिति देखिन्न। दुवैले निकटवर्ती खोजेपछि स्थिति अप्ठ्यारोमा परिणत भएको हो। मन्त्रिपरिषद् फेरबदलमा योग्य वा अयोग्य जस्ता विषयमा बहस भएको भए जायज ठानिन्थ्यो। दुर्भाग्य, आफ्ना र निकटका खोज्ने प्रचलनको क्रमभंग हुन सकेन। राजनीतिक दलमा आफ्ना गुटका मान्छेलाई च्याप्ने प्रवृत्ति नयाँ होइन। अझ इतिहासदेखि नै गुटबन्दीको संस्कार र संस्कृतिमा हुर्कंदै आएको कम्युनिस्ट पार्टीलाई साँच्चिकै एकताबद्ध गराउनु आफैंमा चुनौतीपूर्ण छ। यसैको असरस्वरूप अध्यक्षद्वयले आआफ्ना मान्छे परित्याग गर्न नसकेकाले मन्त्रिमण्डल पुनर्गठनमा सकस परेको घामजत्तिकै छर्लंग छ। मन्त्रिमण्डलका अधिकांश सदस्यले काम गर्न नसकेको पक्कै हो। दुईतिहाइको शक्तिशाली सरकारले समेत जनताका लागि केही गर्न सकेन भन्ने सन्देश गुञ्जन व्यापक भएकाले अध्यक्षद्वय मन्त्रिमण्डलमा हेरफेर गर्न सहमत भएका पनि हुन्। तर राम्रो भन्दा हाम्रो ले मन्त्रिमण्डल विस्तारलाई अप्ठ्यारोमा पार्यो। मुलुकलाई चाहिएको हाम्रा होइन, राम्रा मान्छे हो। राम्रा मान्छे स्वाभिमानी हुन्छन्, लोभ र लालचबाट माथि उठ्छन्। त्यस्ता मान्छेमा चाकडी र चाप्लुसी गरी पदमा पुगौं भन्ने भावना राख्दैनन्। त्यसैले राम्रा मान्छेले जिम्मेवारी पाउँदैनन्। योग्य र इमानदार दुवै गुण भएका नेता मुलुकले नपाएकै कारण यो हविगत भएको हो। तैपनि यति ठूलो बलिदानीपूर्ण संघर्षबाट प्राप्त गणतन्त्रमा जनप्रतिनिधिले केही गर्लान् भन्ने आशा जनताले मारेका छैनन्। त्यही जनअपेक्षाअनुसार काम गर्न सक्ने मान्छेलाई जिम्मेवारी दिइनु उपयुक्त हुन्छ। दलभित्र असल नियत भएका, मुलुक र जनताप्रति कटिबद्ध भएका जनप्रतिनिधि नै नभएको पक्कै होइन, केवल त्यस्ता व्यक्तिलाई अवसरको खाँचो छ। धेरै पढेका, विद्वानहरूले देश विकास गर्न सक्छन् कि भन्ने एकप्रकारको आशा पनि वर्तमान मन्त्रिमण्डलका केही सदस्यहरूसित थियो। तिनले पनि आफ्नै हैसियत देखाए। पढेर मात्र हुँदो रहेनछ, नियत सफा हुनुपर्ने रहेछ भन्ने उदाहरण पनि स्थापित भयो। नियतलाई नाप्न नसके पनि उसको कार्यसम्पादन मापन गर्न सकिन्छ। इतिहासमै शक्तिशाली वर्तमान सरकारमा असल जनप्रतिनिधिले जिम्मेवारी पाए भने गरेर देखाउन सकिने ठाउँ छ। सरकार गठन भएको पहिलो वर्ष आधार वर्ष तयार भयो भनियो, सबैले माने। दोस्रो वर्ष पनि सकिन लाग्यो, अब के भन्ने ? त्यसैले अबको बाँकी तीन वर्ष धमाधम काम गर्ने हो भने पनि देशको आर्थिकसामाजिक विकासका लागि पर्याप्त हुनेछ। जनताको विश्वासरुपि धरोहरलाई अक्षुण्ण राख्न एउटै तत्वको आवश्यकता छअसल नियत।"
आलमको भिडियो सार्वजनिक भएपछि प्रहरी तनावमा,"गौर : तीनवटा मुद्दामा पुर्पक्षका लागि कारागार चलान गरिएका निलम्वित सांसद मोआफ्ताव आलम र प्रहरी अधिकृतबीच भएको सम्वादको भिडियो सार्वजनिक भएपछि प्रहरी अधिकृत तनावमा छन्। असोज २६ गते बिहान आलमलाई पक्राउ गरी इद्रिसगेटदेखि गौर ल्याउने क्रममा जीपमा भएको भिडियो सम्वाद आलम पुर्पक्षका लागि जेल चलान भएपछि सार्वजनिक भएको हो। भिडियो सार्वजनिक भएको विषयमा प्रहरी अधिकारीहरू नै अन्यौलमा छन्। आलमलाई पक्राउ गर्न गएका एक प्रहरी अधिकृतले जीपमा आलमसँग सम्वाद गरेका थिए। आलमले प्रहरी अधिकृतलाई थर्काउँदै जिल्लामा आगो लगाइदिने समेत भनेका थिए। हाइप्रोफाइल व्यक्तिलाई पक्राउ गर्दा कसरी गरिएको थियो र उनी कुन अवस्थामा थिए, मानवअधिकार र प्रचलित कानुनको खिलाफमा गरिएको थियो की भन्ने बारेमा कुनै निकायले प्रश्न गर्दा प्रमाणको लागि जीपमै सम्वाद रेकर्ड गरिएको प्रहरीको भनाइ छ। एक प्रहरी अधिकृतले भने, हाइ प्रोफाइलका भीआइपीलाई पक्राउ गर्दा पछि जवाफ दिन सजिलो होस् भन्ने उद्देश्यले यस्ता प्रमाण प्रहरीले राख्ने गर्छ। जिल्ला प्रहरी कार्यालयले मुद्दाको अनुसन्धान पछि भिडियो जिल्ला अदालत र जिल्ला सरकारी वकिल कार्यालय गौरमा बुझाएको थियो। भिडियो कसरी बाहिरियो भन्नेमा आफूहरू अचम्ममा परेको जिल्ला प्रहरी कार्यालय रौतहटका डीएसपी नवीन कार्कीले बताए। भिडियोका कारण अनावश्यक तनाव थपिएको उनले प्रतिक्रिया दिए। डीएसपी कार्की सोमबार बिदामा घर गएका छन्। आलमलाई कारागार चलान गरिएकै दिन जिल्ला न्यायाधीवक्ता खडिन्द्रराज कटवाल र न्यायाधीश दीपक ढकाल पनि बिदामा बसेका थिए। आलमविरुद्ध ३२ वर्ष कैद सजाय माग दाबीसहित कात्तिक १९ गते तीनवटा मुद्दा दर्ता भएको थियो। कर्तव्य ज्यान मुद्दामा २० वर्ष, ज्यानमार्ने उद्योगमा १० र विस्फोटक पदार्थसम्बन्धी मुद्दामा दुई वर्ष कैद सजाय मागदाबी गरी जिल्ला सरकारी वकिलाको कार्यालयले मुद्दा दर्ता गरको थियो। रौतहटको यमुनामाइ गाउँपालिका४ का त्रिलोक प्रताप सिंह मारिएको भन्दै बाबु श्रीनारायण सिंह र ओसी अख्तर मारिएको भन्दै आमा रोक्साना खातुनले कतव्र्य ज्यान मुद्दा र सर्लाही जिल्ला गडैता २ का सफि अहमद र भारतको सितामणी जिल्ला बैरगनिया २ का गौरीशंकर राम चमारले बम बिस्फोटमा घाइते भएको भन्दै ज्यान मार्ने उद्योगमा जाहेरी दिएका थिए। आमलविरुद्ध प्रहरीले बिस्फोटक पदार्थसम्बन्धी मुद्दा समेत चलाएको छ।"
उत्तर कोरियामाथि नाकाबन्दी : नेपाल गम्भीर नभएको अमेरिकाको आरोप,"काठमाडौं : उत्तर कोरियामाथि लगाएको नाकाबन्दी कार्यान्वयनमा नेपाल गम्भीर नभएको आरोप अमेरिकासहित पश्चिमा मुलुकले लगाएका छन्। संयुक्त राष्ट्रसंघ सुरक्षा परिषद्ले उत्तर कोरियामाथि प्रतिबन्ध लगाएको छ। राष्ट्रसंघले आगामी पुस ६ (डिसेम्बर २२) भित्र आफ्ना सदस्य राष्ट्रमा रहेका सबै उत्तर कोरियालीलाई फिर्ता गराउन तथा उनीहरूका आर्थिक गतिविधि बन्द गर्न आग्रह गरेको छ। नेपालमा केही उत्तर कोरियालीको भिसा नवीकरण गरिएको र केही रेस्टुरेन्ट सञ्चालनमा रहेको भन्दै यस्ता गतिविधि तत्काल अन्त्य गर्न अमेरिकालगायत मुलुकले परराष्ट्र मन्त्रालयलाई ध्यानाकर्षण गराएका छन्। अमेरिकी र केही युरोपेली मुलुकले दुई साताअघि संयुक्त रूपमा सरकारको ध्यानाकर्षण गराएका हुन्। पश्चिमा शक्तिले नेपाल अझै उत्तर कोरियालीप्रति सफ्ट रहेको आरोपसमेत लगाएका छन्। उनीहरूले उत्तर कोरियालीलाई फिर्ता गरेर आफूले पारित गरेको राष्ट्रसंघीय रिजुलुसनका पक्षमा अडिन आग्रह गरेका छन्। न्युयोर्कस्थित नेपाली स्थायी नियोगले कात्तिक २१ गते सुरक्षा परिषद्लाई पत्र लेख्दै नाकाबन्दी प्रस्ताव कार्यान्वयनमा नेपाल प्रतिबद्ध रहेको जानकारी दिएको थियो। त्यसका लागि केही कदम लिइएको नियोगले स्पष्ट पारेको थियो। कात्तिक १४ गतेसम्म ३३ उत्तर कोरियाली नागरिकलाई फिर्ता पठाइएको पत्रमा उल्लेख थियो। गैरकानुनी रूपमा रहेका उनीहरूलाई अध्यागमन कानुनअनुरूप कारबाही हुने जानकारी नेपाली पक्षले दिएको थियो। हामी शान्तिका पक्षमा छौं। उत्तर कोरियाका विषयमा हामीले गर्नुपर्ने कार्य गरिरहेका छौं, परराष्ट्र प्रवक्ता भरतराज पौड्यालले भने, त्यसको जानकारी राष्ट्रसंघलाई दिएका छौं। उत्तर कोरियालीले सञ्चालन गरेको अस्पताल, रेस्टुरेन्ट बन्द गर्ने प्रक्रिया सुरु भएको नेपालले प्रस्ट पारेको थियो। तर, राष्ट्रसंघलाई दिइएको पत्रअनुसारको प्रतिबद्धता कार्यान्वयन नभएको काठमाडौंस्थित अमेरिकी उच्च अधिकारीले बताए। प्रतिबद्धता पूरा गर्न नेपालका सरकारी निकायबीच समन्वय अभाव देखियो, उनले भने, सत्तारुढ दलका नेताहरूमा उत्तर कोरिया भ्रमण मोह पनि उत्तिकै देखिन्छ। परिषद्ले उत्तर कोरियालाई निःशस्त्रीकरणको बाटोमा लैजाने उद्देश्यले आर्थिक नाकाबन्दी लगाएको छ। अन्य मुलुकमा रहेका उत्तर कोरियालीले रोजगारी र विभिन्न आर्थिक गतिविधि सञ्चालन गर्दै आफ्नो सरकारलाई पैसा जुटाउने गरेको राष्ट्रसंघ अध्ययनको दाबी छ। सो रकम पारमाणिक घातक क्षेप्यास्त्र उत्पादनमा प्रयोग भइरहेको निष्कर्ष पनि उक्त अध्ययनको छ। नेपालमा यति बेला २० उत्तर कोरियाली रहेको सूचना बाहिर आएपछि अमेरिकी अधिकारी थप सशंकित भएका हुन्। एक साताअघि उत्तर कोरियाली टोली काठमाडौं आएर राजनीतिक भेटमा सक्रिय रहेपछि पश्चिमाहरू सशंकित देखिएका छन्। काठमाडौं महानगरपालिकाका मेयर विद्यासुन्दर शाक्यको निमन्त्रणामा उत्तर कोरियाली संसद्का उपप्रमुख प्योङयाङ महानगरका प्रमुख चो हुई रिमको नेतृत्वमा एक टोली आएको थियो। टोलीले राजनीतिक भेटघाट र लगानी प्रतिबन्ध फुका गर्ने विषयमा लबिङ गर्दै महानगरसँग सहकार्यको विषयसमेत उठाएको थियो। टोलीले नेकपा विदेश विभाग प्रमुख तथा पूर्वप्रधानमन्त्री माधवकुमार नेपालसँग भेटवार्ता गरेको खुलाए पनि अन्य भेटघाट गोप्य राखिएको छ।"
