शीर्षक,विवरण
प्रदीपको रोजी सुरु,"फिल्मको बुधबार बालाजुस्थित नेपाल चलचित्र विकास कम्पनी (एनएफडीसी) मा मुहूर्त गरिएको हो । फिल्ममा नायिकाद्वय पारमिता राज्यलक्ष्मी शाह र मिरुना मगरको पनि मुख्य भूमिका रहने बताइएको छ । निरक पौडेलको निर्देशन रहने फिल्मको कथा अनुप सापकोटाको हो भने पटकथा तथा संवाद केदार भुसालले तयार पारेका हुन् । राजुविक्रम थापाको छायांकन, अर्जुन पोखरेल र एलिस कार्कीको संगीत रहने फिल्मका लागि दयाराम पाण्डेले गीत लेखेका हुन् । फिल्ममा कर्मा, कृष्ण शिवाकोटी, प्रकाश श्रेष्ठ, प्रदीप दाहाल लगायतको पनि अभिनय रहने छ । आइतबारदेखि छायांकन सुरु हुने रोजी को स्वदेशसँगै दुबई र फिलिपिन्समा खिचिने निर्देशक पौडयालले जानकारी दिए । यसअघि कुसुमे रुमाल २ र होमवर्क निर्देशन गरिसकेका पौडयालले रोजी अघिल्ला फिल्म भन्दा उत्कृष्ट बन्ने बताए ।"
हैरान सौगात,"हैरान बाट डेब्यु गर्दै गरेकी अभिनेत्री आरोही आफूले चाहेको पात्र बन्न पाउँदा खुसी देखिइन् । गम्भीर विष्टले लेखेको फिल्म नवराज उप्रेतीले खिचेका हुन् । सौगातका बाबुसमेत रहेका गजितले फिल्मलाई फुल कमर्सियल, एक्सनप्याक्ड, सस्पेन्स भन्न रुचाए ।"
उल्सनको सेन्टिमेन्टल पप,"यसपछि म सक्छु जित्न, सुनिदेऊ एउटा कुरा बोलका गीतहरू लगालग रिलिज हुन लागेको उनले जनाए । पहिलो चोटि कन्ट्री रक गाउँदै छु, उनले भने, श्रोतालाई पक्कै नयाँपन महसुस हुनेछ ।"
हाई हिलविरुद्ध क्रिस्टिन,"रेड कार्पेटको तामझामलाई लिएर टाइलाइट अभिनेत्रीले निराशा व्यक्त गर्दै आएकी छन् । गत वर्षको फेस्टिभलमा उनले यस्तो चलन हटाउनुपर्ने बताएकी थिइन् । अभिनेताले गर्नु नपर्ने कुरा मलाई मात्र किन गर्न लगाउँछौ ? २८ वर्षे अभिनेत्रीको तर्क थियो, हुन त कालो टाईको नीति पनि छ । यो म बुझ्छु । हामीलाई फ्ल्याट वा हाई हिल दुवैमा छुट हुनुपर्छ ।"
हामीमा प्रभा र रोशन,"दोस्रो चरणमा रोशनले फूल क्रान्ति, झरी, म धरहरा, पाठशाला, गुन्द्रुक र बाकस गरी छ कविता सुनाए ।"
सर्पले डसेर मृत्यु,प्रहरीका अनुसार स्थानीय स्वास्थ्य संस्थामा सर्पदंशको उपचार नहुँदा वर्षमा एक दर्जनभन्दा बढीले ज्यान गुमाउँदै आएका छन् ।
गुटउपगुट अन्त्य गर्छु,"वडा तहसम्म प्रशिक्षण चलाउन कांग्रेसले प्रशिक्षक तयार गरेको हो । कार्यक्रममा जिल्ला कार्यसमिति, नगर सभापति, कांग्रेसका तर्फबाट स्थानीय तहको निर्वाचनमा उम्मेदवार, निर्वाचित वडाध्यक्षहरू सहभागी छन् ।"
झरना मासिने गरी विद्युत्,"यो अन्नपूर्ण गाउँपालिका ३, दानामा अवस्थित पर्यटकीय महत्त्व राख्ने कालीगण्डकी करिडोरको सबैभन्दा आकर्षक गन्तव्य पनि हो । रुप्सेको तस्बिर २०३० सालमा हुलाक टिकटमा पनि प्रकाशित भएको छ । रुप्सेको सुन्दरता संरक्षण गर्नुपर्छ, पर्यटन व्यवसायी कविन तुलाचनले भने, विद्युत् उत्पादन गर्न खोलानाला नै धेरै छन् । झरनामै पाइप जोड्नुपर्ने छैन ।नदी कटानले बनाएको धौलागिरी र अन्नपूर्ण हिमशृंखलाबीच ६ हजार ९ सय ६७ मिटरमा रहेको यसलाई संसारकै गहिरो गल्छी मानिन्छ ।"
विधेयक छलेर तोकियो पारिश्रमिक,वैशाख ९ को समितिको बैठकमा सत्तापक्षकै सांसदले प्रदेशसभा सदस्यको मर्यादाक्रम नटुंगिईकन छलफल नगर्ने अडान राखेका थिए । सोही कारण त्यसयता ती दुई विधेयकमाथिको दफावार छलफल हुन सकेको छैन । यसअघि चैत २५ को प्रदेशसभा बैठकमा मर्यादाक्रम नतोकी हतारोमा विधेयक आएको भन्दै सत्तापक्षका सांसदले नै विपक्षमा मतदान गर्न अनुरोध गरेका थिए । तर २९ गतेको बैठकमा सभामुखले मर्यादाक्रम टुंंग्याउने पहल गर्न प्रदेश सभालाई रुलिङ गरेपछि विधेयक छलफलका लागि पठाउने प्रस्ताव सर्वसम्मतले पारित भएको थियो । सोही दिनको मन्त्रिपरिषद् बैठकले पनि तत्काल मर्यादाक्रम टुंग्याउन संघीय सरकारलाई अनुरोध गर्ने निर्णयसमेत गरिसकेको छ । यो निर्णयबारे वैशाख ११ को बैठकमा सभामुख सानुकुमार श्रेष्ठले सभालाई जानकारीसमेत गराएका छन् ।
भैपरी खर्च केका लागि ?,शोक प्रस्ताव पारितबुधबारको प्रदेशसभा बैठकले सांसद हरिशरण लामिछानेको निधनप्रति समवेदना व्यक्त गर्दै शोकप्रस्ताव पारित गरेको छ । भक्तपुर प्रदेशसभा १ (क) बाट निर्वाचित लामिछानको मस्तिष्काघातका कारण जेठ १ गते निधन भएको थियो ।
भाषा नजोगाए राष्ट्रियता कमजोर,२०६८ को जनगणनाअनुसारमा मुलुकमा १ सय २३ भाषा छन् । तीमध्ये केही लोप हुने अवस्थामा पुगिसकेका छन् । कार्यक्रममा भाषा आयोगका अध्यक्ष डालवदेव अवस्थीले आयातीत भाषाले मुलुकको विकासलाई अन्योलमा पार्ने बताए ।
लाङटाङ र गोसाइँकुण्ड प्लास्टिकमुक्त बनाइने,"खच्चर व्यवसाय सञ्चालन गर्न गाउँपालिकामा दर्ता गर्नुपर्ने नीति बनाउने र लाङटाङ, क्यान्जिन र गोसाइँकुण्ड रुटमा सामान लिएर जाने प्रत्येक खच्चरले ८ किलो र हेलिकप्टरले ४० किलो फोहोर तल झार्ने नीति बनाएर कार्यान्वन गर्ने गाउँपालिकाको योजना रहेको तामाङले बताए । फोहोमैला व्यवस्थापनका लागि प्रत्येक बस्ती र टोलमा फोहोरमैला व्यवस्थापन समूहसमेत गठन गरिनेछ ।"
हराए सोह्रखुट्टे पाटीका सामान,"पुरातत्त्व विभागले भने आफूहरूलाई थाहै नदिई पाटी भत्काएको दाबी गरेको छ । हामीले पनि भत्काइसकेपछि थाहा पायौं, विभागका प्रवक्ता रामबहादुर कुँवर भन्छन्, यहाँका काठ कहाँ गए, इँटा कहाँ गए, हामी सडक विभागसँग माग्छौं । यो ऐतिहासिक सम्पदामा हाम्रो पनि चासो छ । यसलाई स्थानीयवासीको सल्लाहअनुसार नै बनाउन हामी तयार छौं । सम्पदा जोगाउनु हाम्रो दायित्व हो । स्थानीयवासी यसरी जागरुक हुनु झन् खुसीको कुरा हो ।"
"कपनको धूलो, कपनको हिलो","डेढ वर्षअघि सरकारले ठेक्का लगाएकामध्ये केही सडकको समय सकिइसकेको छ । केहीको असार र केहीको असोजसम्म समय भए पनि ढिलासुस्ती भइरहेको छ, उनले भने, एक वर्षअघि स्थानीय तहको चुनावताका ठेक्का लागेका सबै सडक बनिसक्नुपर्ने हो तर ठेकदारले कतै आधा काम सकेका छन्, कतै कामै भएकै छैन । उनले निरन्तर घचघच्याउँदा पनि ठेकदारले समयमै काम गर्ने छाँट नदेखाएको गुनासो गरे । काम भइरहेको १० करोडको बाटोमा मैले २० लाखको ग्राभेल हालेर केही हुँदैन, उनले भने, मैले नसकेको काम यही हो । असार मसान्तभित्र सबै सडक हिँड्न सक्ने बनाउन ठेकेदारलाई कबुल गराएका छौं । कपन साततलेदेखिको मूल बाटो बनाउने ठेकेदार शारदा अधिकारी हुन् ।"
महानगरका दुई नियमावली सार्वजनिक,"यसैगरी विद्यालय शिक्षा व्यवस्थापन नियमावलीमा माध्यमिक शिक्षा सम्बन्धी काम, कर्तव्य र अधिकारलाई प्रस्ट पारिएको छ । ८८ पृष्ठमा, १७ परिच्छेद, १०० दफा र १३ अनुसूची समेटिएको यो नियमावलीमा विद्यालय खोल्न अनुमति दिनेदेखि आवश्यक परे विद्यालय गाभ्नेसम्मका निर्णय गर्ने अधिकारको व्यवस्था गरिएको छ । शैक्षिक परामर्श दिने संस्था, ब्रिजकोर्स, कोचिङ सेन्टर जस्ता संस्थालाई पनि यो नियमावली मातहत समेटिएको छ । भाषा शिक्षण कक्षा, परीक्षा पूर्वतयारी कक्षा आदि सञ्चालन गर्न महानगरसँग स्वीकृति लिनुपर्ने हुन्छ । यी दुई नियमावलीसहित काठमाडौं महानगरपालिकाले ९ वटा ऐन तथा नियमावली राजपत्रमार्फत सार्वजनिक गरिसकेको जनाएको छ । संविधानको अनुसूची ८ मा महानगरपालिकाले २२ वटा ऐन बनाउनुपर्ने उल्लेख छ । जेठ १७ मा महानगरका निर्वाचित प्रतिनिधिले पदभार ग्रहण गरेका थिए ।"
अन्तर्राष्ट्रिय समाज अध्यक्षमा राणा,"ललितपुर (कास) साप्ताहिक पत्रिकाका सम्पादकहरूको संस्था अन्तर्राष्ट्रिय समाजको नेपालमा ७ जना पदाधिकारी रहने गरी शाखा गठन भएको छ । समाजको नेपालस्थित शाखाका अध्यक्षमा देशान्तर साप्ताहिकका प्रधानसम्पादक कविर राणा भएका छन् । उपाध्यक्षमा दमौली एक्सप्रेस साप्ताहिकका सम्पादक प्रदीप काफ्ले भएका छन् । सदस्यहरूमा मूलधार साप्ताहिकका सम्पादक एवं नेपाल पत्रकार महासंघका महासचिव रमेश विष्ट, मोर्चा साप्ताहिकका सम्पादक एवं नेपाल पत्रकार महासंघ २ नम्बर प्रदेश सभापति दीपेन्द्र चौहान, देशान्तर साप्ताहिकका सम्पादक विष्णुप्रसाद देवकोटा, नौलो बिहानी साप्ताहिकका सम्पादक तुला अधिकारी र चियाबारी साप्ताहिकका सम्पादक सोम अधिकारी छन् । समाज सन् १९५५ मा अमेरिकामा स्थापना भएको थियो ।"
जंगलमा शव भेटियो,काठमाडौं (कास) पशुपतिस्थित विश्वरूपा जंगलमा मंगलबार एक पुरुषको शव भेटिएको छ । अन्दाजी ४० वर्षका मृतकको परिचय खुल्न सकेको छैन । यस सम्बन्धमा थप अनुसन्धान भइरहेको प्रहरीले जनाएको छ ।
भारतीय गाडीमा लागूऔषध,"काठमाडौं (कास) प्रहरीले भारतीय गाडीमा राखिएको लागूऔषधसहित दुई जनालाई पक्राउ गरेको छ । पक्राउ पर्नेमा रक्सौलका ३३ वर्षीय जितेन्द्र कुमार र ३२ वर्षीय सनोज कुमार छन् । बल्खुको सडकमा बीआर ०५ पीए ७०३१ नम्बरको गाडी चेकजाँच गर्ने क्रममा मंगलबार उनीहरूलाई पक्राउ गरिएको हो । उनीहरूका साथमा ब्रुपेनर्फिन, डाइजेपाम र फेनारगन ५५ सय एम्पुल बरामद भएको छ ।"
रोजगारमा पठाउने पक्राउ,"काठमाडौं (कास) गैरकानुनी रूपमा नेपालीलाई विदेश पठाएको आरोपमा प्रहरीले जरङ्कुबाट दुई जनालाई पक्राउ गरेको छ । मंगलबार विशेष सूचनाका आधारमा छापा मरेको प्रहरीले नवलपासी गैंडाकोटकी ४३ वर्षीया मनमाया आचार्य र तनहुँका ३९ वर्षीय छविलाल घिमिरेलाई पक्राउ गरेको हो । उनीहरूले कार्यालय सञ्चालन गरेको स्थानबाट ३४ वटा नेपाली नागरिकता, राहदानी ३० वटा, विभिन्न व्यक्तिका कागजातका प्रतिलिपि, स्वास्थ्य परीक्षण प्रतिवेदन लगायतका कागजात बरामद भएका छन् ।"
नक्कली नोटसहित पक्राउ,काठमाडौं (कास) नक्कली नेपाली रुपैयाँसहित प्रहरीले मंगलबार धापाखेलबाट दुई जनालाई पक्राउ गरेको छ । उक्त स्थानमा टहरो बनाई बस्दै आएका सिन्धुलीका २४ वर्षीय सुदीप तामाङ र ललितपुर आस्राङका १९ वर्षीय साजन भुलान रु ४ लाख ५० हजार सहित पक्राउ परेका हुन् । उनीहरूका साथमा १ हजार दरका नक्कली नोट ४ सय ५० थान बरामद भएको छ ।
चार वर्षपछि ए डिभिजन लिग हुने,"रोजगारीसँगै खेल्ने अवसरलिग सञ्चालन गर्ने निर्णयलाई एकदमै सकारात्मक रूपमा लिएको छु, राष्ट्रिय टोलीका कप्तान विराज महर्जनले भने, लिग नहुँदा राष्ट्रिय खेलाडीले मात्र होइन, अरुले पनि खेल्न पाएको थिएन । लिग आयोजना गर्ने निर्णय राष्ट्रिय टिमका खेलाडीका लागि मात्र होइन, सम्पूर्ण क्लब र अवसर नपाएका खेलाडीका लागि पनि एदकमै खुसीको कुरा हो ।लिग नहुँदा गुमाएका अवसर उल्लेख गर्दै महर्जनले भने, सीमित खेलाडीले राष्ट्रिय टिममा अवसर पाएका छन्, अरु धेरैले खेल्ने मौका पनि पाएका छैनन् । खेलाडीले रोजगारी पनि गुमाएको अवस्था छ । त्यसैले अब हुने लिगले खेलाडीलाई रोजगारीसँगै खेल देखाउने अवसर पनि दिनेछ । यसले राम्रो माहोल ल्याउने छ ।"
थ्रीस्टार फाइनलमा,बिहीबार अर्को सेमिफाइनलमा मनाङ मस्र्याङ्दीले सुनसरी ११ सँग प्रतिस्पर्धा गर्नेछ ।
डीएभीलाई उपाधि,काठमाडौं (कास) डीएभी स्कुलले एमआईएस क्रिकेट प्रतियोगिता जितेको छ । डीएभीले बुधबार फाइनलमा आयोजक मोर्डन इन्डियन स्कुललाई ३० रनले पराजित गर्दै सातौं वर्ष आयोजित प्रतियोगिता चौथोपल्ट जितेको हो । मोर्डनको मैदानमा टस जितेको डीएभीले २० औं ओभरमा १ सय ३७ रनमा अलआउट भयो । रजत प्रसाद र रिसव सिंहले समान २९ तथा आदित्य अग्रवालले २४ रन बनाए । एमआईएस १९ ओभरमा १ सय ७ रनमै अलआउट भयो । अर्पित खेतानले २० रन खर्चेर ४ विकेट लिएर एमआईएसलाई धराशायी पार्दै म्यान अफ द फाइनल बने । डीएभीकै आदित्य अग्रवाल म्यान अफ द सिरिजमा चुनिए ।
दुई पुलिसलाई सभामुख कप,दुवैतर्फका विजेताले समान ३ लाख ५० हजार रुपैयाँ पुरस्कार पाए । उपविजेताले पनि समान २ लाख तथा तेस्रा भएको टोलीले १ लाख पुरस्कार पाए ।
बाराले जित्यो मेयर कप,निजगढ (कास) प्रथम मेयर कप फुटबलको उपाधि बारा ११ ले जितेको छ । फाइनलमा बाराले मौवादेवी युवा क्लब बडहर्वालाई टाइब्रेकरमा ४२ ले पराजित गर्यो । बडहर्वाका एलिस थिङ म्यान अफ द म्याच र चन्दन महतो म्यान अफ द सिरिज घोषित भए ।
