शीर्षक,विवरण
सांसदलाई १० करोड दिनु हुन्न,"हामीलाई थाहै छ, सांसदहरू भनेका जननिर्वाचित प्रतिनिधिहरू हुन् । जनताको पक्षमा रही काम गर्न, आवश्यक नीति, नियम र कानुन निर्माण गरी देशलाई समुन्नतिको यात्रामा लैजान संसद्मा पठाएका हौं । तर चुनावताका जनतालाई दिइएका विकासका आश्वासन पुरा गर्न सांसदहरूले प्रत्येक वर्ष आफैं वितरण गर्नेगरी मोटो रकम माग गर्दै आइरहेका छन् । जनतालाई विकास निर्माणका आश्वासन दिइसकेपछि ती आश्वासन परिपूर्ति गर्न सांसद आफैंले योगदान दिएको देखाउन र पुन: भोटबैंक बचाउन प्रत्यक्ष रूपले लगानी गर्ने उद्देश्यले सांसदले रकम माग्ने गरेका हुन् । यसभन्दा अघिका सांसदहरूले लिएको रकम खास काममा नआएको र दुरुपयोग भएको गुनासो व्यापक रूपमा आउने गरेको हो । सांसद विकास कोषको त्यस्तो रकमले आफ्नै घर वरपरको मात्र विकास निर्माण गर्ने गरेको, आफ्नो इच्छा अनुसार बजेट बाँड्ने गरेको, ठूला विकास निर्माणमा बजेट नलगाई ससाना टुक्रे योजनामा लगानी गर्दा कुनै पनि काम सम्पन्न हुन नसकेको, देखिने खालको राम्रो विकास निर्माण नभएको, बजेटको चरम दुरुपयोग भएको, सांसदले आफ्नो क्षेत्रमा रकम वितरण गर्दा दलीय उद्देश्यले ओतप्रोत भई वितरण गर्ने गरेको, समग्रमा बजेट कहीं कतै राम्रोसँग सदुपयोग नभएको जस्ता दृश्य देखापरेकै हुन् । विगतमा यति धेरै गुनासा सुन्दासुन्दै पुन: सांसदहरूले यसपटक पनि १० करोड रुपैयाँ माग गर्नु र रकम विनियोजन गर्न अनावश्यक दबाब दिनु जनताको तर्फबाट कत्ति पनि राम्रो मानिएको छैन । आफैंले बजेट माग गरी आफैंले विकास गर्न खोज्नु सांसदका लागि कत्ति पनि सुहाउने र पदीय दृष्टिकोणले पनि उपयुक्त छैन । नरनाथ पाण्डेकावासोती८, नवलपुर"
पाठ्यक्रम विकास केन्द्रलाई आग्रह,"पाठ्यक्रम विकास केन्द्रले यस वर्षदेखि कक्षा ११ र १२ मा नेपाली विषयलाई विस्थापन गर्ने वा ५० पूर्णांकको मात्र बनाउने भन्ने विषयमा त्यस कार्यालयले गृहकार्य गरिरहेकामा म जस्ता नेपाली भाषाप्रेमीहरूको गम्भीर ध्यानाकर्षण भएको छ । नेपाली भाषा हाम्रो राष्ट्रभाषा र सम्पूर्ण नेपालीको साझा सम्पर्कको भाषा रहेकाले यसको संरक्षण र सम्बद्र्धन गर्नु हाम्रो दायित्व हुन आउँछ । आजभोलि नेपाली विषयमा विद्यार्थीको सिकाइ उपलब्धि झन् कमजोर हुँदै गएको, सामान्य बोलीचाली, चिठीपत्र, निवेदनजस्ता व्यावहारिक लेखनमा पनि विद्यार्थी अक्षम बन्दै गइरहेको अवस्थामा पाठ्यक्रम विकास केन्द्रले समेत यस्तो निर्णय गर्नुले नेपाली भाषा उपेक्षित भएको स्पष्ट हुन्छ । राष्ट्रभाषा भनेको जुन कुनै देशको निजी पहिचान र अमूल्य सम्पत्ति हो । यसलाई जीवन्त र अक्षुण्ण राख्नु सरकारको मुख्य दायित्व हो । यसर्थ अहिले गरिन थालेको निर्णयलाई यथाशीघ्र सच्याई विद्यालयीय शिक्षामा नेपाली विषयलाई कक्षा १२ सम्म अनिवार्य विषयको रूपमा राख्न जरुरी देखिन्छ । क्याम्पस स्तरमा ऐच्छिक विषयको रूपमा राख्दा कुनै आपत्ति हुँदैन । तर विद्यालयीय शिक्षामा यसलाई कुनै पनि हालतमा हटाउनु हँुदैन । केपी शर्मा ज्ञवालीकाठमाडौं"
बलात्कार घट्न सक्छ,"बिहे नगरे पनि प्रजनन अधिकार दिँदा पितृसत्ता समाप्त हुने र मातृसत्ता अगाडि बढ्नेछ । यसले गर्दा समाजमा हुने वेश्यावृत्ति तथा बलात्कार कम हुने निश्चित छ । उदाहरणस्वरूप पश्चिमाहरूले युट्युबमा कुनै भेदभाव नहुनेगरी छोराआमा, छोरीबुबा र अन्य हाडनातासँंग हुने यौन सम्बन्धी कुरा नेपाल र अन्य देशमा लागू भइसकेपछि उपरोक्त विकृति निश्चय नै समाप्त हुन्छ । तर हरेक कुराको सीमा हुन्छ । हाशिम अन्सारीराजविराज, सप्तरी"
सरोकारवालाको ध्यान जाओस्,"आजको कान्तिपुर दैनिकमा विद्यालय शिक्षाको पाठ्यक्रम निर्माण भइरहेको खबर छापिएको समाचार पढ्न पाएँ । एक दिनको म्याद दिई सुझाव, सल्लाहको अपेक्षासमेत गरेको छ । राष्ट्रिय पाठ्यक्रम विकास तथा मूल्याङ्कन परिषद्मा स्वीकृति गर्न मस्यौदापत्र पनि सार्वजनिक गरिएको छ । सरोकारवालासँग छलफलमा अझै समय दिई अन्तरक्रियामा समय आवश्यक भए जस्तो लाग्छ । हतपतको काम लतपत हुन्छ भन्ने उखान चरितार्थ नहोस् । सरोकारवालाहरूको ध्यानाकृष्ट होस् । उमेशलाल कर्णजिल्ला शिक्षा कार्यालय, धनुषा"
शिक्षकको सरुवा गर्नुपर्छ,"सामुदायिक विद्यालयमा अध्यापनरत शिक्षकहरू योग्य, तालिम प्राप्त र सक्षम छन् भनी मन्त्रालयले गर्व गरिरहँदा आफूले सञ्चालन गरेको विद्यालयमा १७ थरी शिक्षक छन् भन्ने कुरा स्वीकार्न नै चाहँदैन । जुन विद्यालयमा महत्त्वपूर्ण अड्डा जमाएर बसेका स्थायी शिक्षकहरू छन्, जसलाई सबै खालको सुविधा राज्यले प्रदान गरिरहेको छ । अर्काथरी अस्थायी जो पटकपटक परीक्षाको आशा अनि निराशाको अन्योलमा रहेकाहरू जसलाई आंशिक सुविधा प्राप्त छ । त्यसैगरी राहत, ईसीडी शिक्षकहरू अझै कम सुविधा लिएर काम गर्न विवश छन् भने सबैभन्दा समस्यामा निजी स्रोत शिक्षकहरू नै देखिन्छन् । एउटै विद्यालयमा सामाजिक विभेदयुक्त संरचनाको निर्माण गरेर अधिक प्रतिफल खोज्नु सरकारको नालायकीपन मात्रै हो । स्थायीलाई जीवन नै स्थायी भएजस्तै गरेर अधिकार दिनु अनि अरू शिक्षकलाई उपेक्षाको नजर राख्नु नै त्रुटिपूर्ण छ । शिक्षण र खेललाई एउटै स्वरूपमा हेर्न सकिन्छ । खेलमा खेलाडी जति भए पनि एकजनाको कमजोरीले हार्नुपर्ने पनि हुन सक्छ, त्यस्तै निरन्तर जोतिने शिक्षकहरूबीचको असमान व्यवहार र नीतिगत अस्थिरताले समस्या बढ्दै जाने देखिन्छ । प्रत्येक ५५ वर्षमा शिक्षकको सरुवा गर्न सक्ने वातावरण सिर्जना गर्नसके मात्र सामुदायिक विद्यालयको गुणस्तर सुधार गर्न सकिन्छ । गोविन्द रिमालगैंडाकोट नगरपालिका५, नवलपरासी"
स्वस्थ कांग्रेसको खाँचो,"नेपाली कांग्रेसमा २०४६ सालदेखि नै नराम्रो रोग लागेको छ । अप्रजातान्त्रिक तौरतरिका त्यतिबेलादेखि नै सुरु भएको हो । तर तत्काल निदान गर्न नसक्दा अब जटिल र बिग्रेको अंग नै काटेर फाल्नुपर्ने अवस्था आइपर्यो । अझै पनि इमानदार र युवा कार्यकर्ताहरूले बिग्रेको कामै नलाग्ने अंग काटेर फाल्ने हिम्मत गर्ने हो भने कांग्रेस तन्दुरुस्त हुने थियो । स्वस्थ र पारदर्शी कांग्रेस नै देशले चाहेको हो । केदारनाथ त्रिपाठी बुढानीलकण्ठ, काठमाडौं"
"सत्यमोहन, ९९ वर्ष र प्रेरणा","शताब्दी पुरुष सत्यमोहन जोशीको ९९ औं जन्मदिनमा हामी तमाम नेपालीजनका तर्फबाट हार्दिक मंगलमय शुभकामना व्यक्त गर्छौं । एकजना सामान्य मानिस आफ्नो बलबुताबाट कतिसम्म बढ्न सक्छ भन्ने कुराको मानक तीनतीन पटक मदन पुरस्कार लगायत थुप्रै मानसम्मान तथा पुरस्कार र प्रमाणपत्रहरूका धनी सत्यमोहन साक्षी छन् । सत्यमोहन एउटा युग भइसकेको छ । सत्यमोहनले हाम्रो समाजलाई धेरै गुण लगाइसकेका छन् । अब उनको व्यक्तित्वबाट जीवन जिउने कला, दाम्पत्य जीवन, कला, संस्कृति, अध्ययन, अनुसन्धान तथा स्वास्थ्य, आध्यात्म तथा समृद्धिको गुह्य कुरा तमाम नेपालीले सिक्न सक्नुपर्छ । सत्यमोहनको व्यक्तित्व र जीवन जिउने कला प्रेरणादायी छ । युगपुरुष सत्यमोहनको वास्तविक सम्मान भनेको उनको जीवनका तमाम आयामको गहन अध्ययन, अनुसन्धान गरी नेपाली मानकका रूपमा तथ्यहरू केलाएर व्यवहारमा प्रयोग गर्ने वातावरण बनाउनु हो । वीरेन्द्र सुवाल व्यासी२ महाकालीस्थान, भक्तपुर"
पिँधमा उठ्ने प्रश्न,"छोटो समयमा देखेको अवस्था के हो भने कतिपय ठाउँमा भुसको आगो सल्किन थालेको छ । स्थानीय सरकारलाई लोकतान्त्रिक गर्न सकेनौं भने वा जानेनौं भने फेरि त्यसले समाजलाई असर गर्न सक्छ । त्यसैगरी समाजको लोकतान्त्रीकरण गरेनौं भने फेरि त्यो समाजले स्थानीय सरकारलाई अलोकतान्त्रीकरणतर्फ लैजान्छ । यहाँ उठाउन खोजिएको आधारभूत पक्ष के हो भने कसरी स्थानीय सरकार, समाज र त्यसका साधनहरू सबैलाई एकै समयमा लोकतान्त्रीकरण गर्न सकिन्छ ? त्यो बारे सरोकारवाला सबै पक्षको दृष्टि पुगोस् । पिँधमा उठिरहेका प्रश्नहरूले सही नेतृत्व, सार्थक संवाद र समझदारीको मञ्च पायो भने त्यसले गाउँदेहातको कायाकल्प गर्न बेर लाउँदैन । यस्ता काममा राजनीतिक दल, सामाजिक संस्थाहरू, स्थानीय सञ्चार माध्यम र नागरिक समाजले आआफ्नो पक्षबाट पहल गर्दै स्थानीय तहमा मुख्यत: पारदर्शिता, उत्तरदायित्व, समावेशी जस्ता कुरालाई टेवा दिन सक्छन् । कुन वडामा कुन शीर्षकमा कति, कहिले र कसरी काम हुँदैछ, हेर्ने जिम्मेवारी सामान्य जनको पनि हो, उसले पनि अधिकारपूर्वक विकासको अनुगमन गर्न सक्छ । उसले बन्दै गरेको नीति निर्माणको निगरानी गर्न सक्छ । तर यसका लागि प्रत्येक नागरिकले आफ्नो काम भनेको केवल मतदान गर्ने र अन्य बेला गफ चुट्ने होइन, सहकार्य र सहयोगको ठाउँको खोजी गर्नु पनि हो भनी बुझ्न सक्नुपर्छ ।"
मोदी भ्रमणपछिको राउत तरंग,मुख्यमन्त्री राउतले आफ्नो भाषणमार्फत नेपाल र भारतका सरकारहरूलाई ती पुराना दिनहरूको सम्झना दिलाउन आवश्यक ठानेर त्यो प्रसंग उठाएको हुनुपर्छ । त्यही मञ्चबाट केही मिनेटअघि मात्र रक्षामन्त्री ईश्वर पोखरेलले साङ्केतिक रूपमा हामी राजनीतिक मुद्दाहरूको समाधान गर्ने प्रयास गर्दैछौं भनेका थिए । राउतले त्यसैलाई अलि प्रस्ट रूपमा मात्र राख्नखोजेको हुनुपर्छ । प्रधानमन्त्री केपी ओलीको पहिलो कार्यकालमा परराष्ट्र मन्त्री कमल थापाले दिल्लीकाठमाडांैबीच आदानप्रदान गरेका चारबुँदे ननपेपर र विशेषदूतका रूपमा प्रदीप ज्ञवालीले गर्नुभएका प्रयासलाई मुख्यमन्त्री राउतले उप्काउनमात्र खोजेको हुनुपर्छ । विश्लेषक साह हालै संघीय फोरममा आबद्ध भएका छन् ।
अभिभावकत्व ग्रहणका अनुत्तरित प्रश्न,"२०६१ सालबाट हरेक शैक्षिक सत्रको सुरुवातमा विद्यार्थी भर्ना अभियान चलाइने गरिएको छ त्यसबेला भर्ना दर ८० प्रतिशत रहेकामा गत वर्ष प्राथमिक तहमा विद्यार्थी भर्नादर ९७ प्रतिशत नाघेको थियो । अर्थात् शिक्षा क्षेत्रमा राज्यको ठूलो लगानी, नि:शुल्क रूपमा आधारभूत तहको शिक्षा प्राप्त गर्न पाउने विषय मौलिक हकका रूपमा ग्यारेन्टी भएको तथा हरेक वर्ष भर्नादर बढाउने अभियान चलाइरहँदा पनि सबै बालबालिकालाई अझैसम्म विद्यालयमा पुर्याउन सकिएको छैन । विद्यालयमा जेनतेन भर्ना भए पनि पढाइ पूरा नहुँदै स्कुल छाड्ने दर निकै उच्च छ । घर तथा स्कुलबाट हुनुपर्ने उत्प्रेरणाको अभाव, विद्यालयमा उचित शिक्षण सिकाइको अभाव, घरपरिवारको गरिबी तथा परिवारमा शिक्षा र चेतनाको कमी जस्ता कारणले बालबालिकाले बीचैमा स्कुल छाड्ने गरेका छन् । सरकारी स्कुलमा माध्यमिक तहसम्मको शिक्षा नि:शुल्क हुने व्यवस्था भए पनि ट्युसन लगायतका नाममा मासिक रूपमा शुल्क लिइन्छ जसले गर्दा धेरै गरिबका छोराछोरी स्कुल छाड्ने वा परीक्षा नै दिन नपाउने अवस्थामा पुग्छन् । नतिजा सुधार्ने नाममा सरकारी स्कुलहरूले पनि निजी स्कुलले जस्तै गरी अभिभावकलाई चुस्ने गरेका छन् । वार्षिक ६ हजारमा अमूक विद्यार्थीको अभिभावकत्व खरिद गर्ने प्रतिस्पर्धा चलिरहेका बेला उल्लिखित यथार्थतर्फ पनि सबैको ध्यान जानु आवश्यक छ ।"
