शीर्षक,विवरण
कम्युनिस्ट जोगाउने नेता,"राजनीतिमा कुनै राम्रो विचार मनमा लिँदैमा त्यसलाई कसैले गणना गर्दैन । सबभन्दा ठूलो कुरा सतहमा देख्दा एन्टी करेन्ट जस्तो भए पनि त्यस विचारमा दुनियाँको ध्यान खिच्न सक्यो भनेमात्रै पर्याप्त बहस हुने स्थिति आउँछ । त्यसका लागि नेतृत्वमा साहस जरुरी हुन्छ, जुन मदनमा थियो । २०४८ सालको निर्वाचनपछि मदनलाई तपाईंहरू त संसद्मुखी हुनुभयो नि ? भनी सोधिएको एउटा प्रश्नको जवाफमा उहाँले भन्नुभएको छ हो, हाम्रो मुख संसद्तिरै फर्किएको छ । किनभने हामीलाई जनताले निर्वाचित गरेर संसद्मा पठाएका छन् र हामी उनीहरूका लागि संसद्मै लड्छौं । जबकि त्यतिबेला कम्युनिस्ट आन्दोलनमा संसद्मुखी शब्दले आफ्नो जातबाट च्युत भएको र गाली गरेको अर्थमा लिइन्थ्यो । नेतृत्वले जे गर्दैछ, त्यसको पक्षपोषण कसरी र कुन तरिकाले गर्ने भन्ने सन्दर्भमा मदन रोलमोडलका रूपमा स्थापित हुनुहुन्छ । नेकपा (एमाले) र नेकपा (माओवादी केन्द्र) एकताको संघारमा रहेका बेला जनताको बहुदलीय जनवादको सान्दर्भिकता झ्न बढेर गएको छ । फरक पृष्ठभूमिबाट आएका कारण तत्कालै एमालेकै जसरी जनताको बहुदलीय जनवाद भन्न गाह्रो माने पनि माओवादीको समेत हिँड्ने अर्को बाटो छैन ।"
स्नेहा हत्या प्रकरण: तारिखमा छुटे मलामी,"प्रहरी अनुसन्धानमा स्नेहा हत्यामा आमाबुवासहित ५ जना संलग्न भएको र शव लुकाउन ६ जनाले सहयोग गरेको खुलेको थियो । हत्याअघि नै सद्गत गर्ने स्थान, गुइँठा, मट्टीतेल र चिनी व्यवस्था गर्ने व्यक्ति तोकिएका थिए । पल्लो कोठामा छोरी सुतिरहँदा अर्कोमा आमाबुवाले तीन सहयोगीसँग स्नेहा हत्या योजना बुनेको प्रहरीले जनाएको थियो । सद्गतका लागि दिलीपका भाइ प्रदीपले नै सबै तयारी गरेको र खोला किनारमा डेढ घण्टासम्म शव जलाएर पानीले आगो निभाई हड्डी र खरानी बगाएर प्रमाण नष्ट गरेको आरोप प्रहरीले लगाउँदै आएको थियो ।"
वैशाखमा लक्ष्यभन्दा बढी राजस्व संकलन,"आन्तरिक राजस्व विभाग, भन्सार विभाग, अर्थ मन्त्रालय राजस्व महाशाखाका अधिकारीहरूसँग अर्थमन्त्री खतिवडाले नै छलफल गरिरहेका छन् । उनले चुहावटका क्षेत्रमा कडाइ गर्न निर्देशन दिइरहेको अर्थका अधिकारीहरू बताउँछन् ।"
२ सय ४३ स्थानीय तह बैंकविहीन,बैंकहरूलाई स्थानीय निकायमा शाखा खोल्न प्रोत्साहन गर्न राष्ट्र बैंकले सम्बन्धित बैंकलाई सरकारी कारोबारलगायत विशेष सुविधा दिएको छ । जसमध्ये कुनै पनि शाखा नभएको स्थानीय तहमा स्थापना भई सञ्चालनमा आउने पहिलो वाणिज्य बैंकको शाखालाई स्थानीय निकायसम्बन्धी सम्पूर्ण सरकारी कारोबार सञ्चालन गर्न दिने र त्यसका लागि आवश्यक व्यवस्था केन्द्रीय बैंकले गर्ने जनाइएको छ ।
सेयर कायम गर्ने आपूर्तिको पत्र अर्थलाई,"नुन कोषमा बचत रहेको ४ करोड ४ लाख ९७ हजार ६ सय ९४ को सन्दर्भमा उक्त रकम २०३५ सालदेखि कर्पोरेसन्सले निब्र्याजी प्रयोग गरिरहेको हुँदा हरेक वर्ष जम्मा भएको रकमको उक्त समयमा प्रचलित वाणिज्य बैंकको बचत हिसाबको ब्याजदरको आधारमा ब्याज हिसाब गरी हुन आएको वा आउने रकम एकमुष्ठ नेपाल सरकारको सेयरमा परिणत गर्ने निर्णय भएको थियो । भैतिक सहयोग र वाणिज्य बैंकको बचत हिसाबको ब्याजदरको आधारमा हिसाब गरी हुन आएको वा आउने रकम यकिन गरी सरकारको सेयरमा परिणत वा लगानी जनाउन आपूर्ति मन्त्रालयमार्फत कर्पोरेसन्स र कम्पनी रजिस्ट्रार कार्यालयमा लेखी पठाउने निर्णय भएको थियो । तर, कम्पनी रजिस्ट्रारमा पठाइएको पत्र गायब बनाइएको छ ।"
शाही विवाहमा खर्च कति ?,"राजपरिवारको विवाहमा बर्नाड र वेस्टउड ले विवाह कार्डलगायतका सामग्री छाप्ने गर्छ । उसले तत्कालै अगामी विवाहमा प्रिन्टिङमा हुने खर्चबारे केही उल्लेख गरेको छैन । तर, उसले निम्तो पत्र, स्टाम्प, थ्यांक यु कार्ड, क्यालिग्राफरदेखि खाममा ठेगाना छपाइसहितको एउटा सेटमा राजपरिवारले ३४ अमेरिकी डलर (३ हजार ६ सय ९९ रुपैयाँ) सम्मको खर्च गर्न उपयुक्त रहेको जनाएको छ । सीएनएनका अनुसार ६ सय अतिथिका लागि स्टेसनरी खर्च २० हजार ३ सय डलर (२२ लाख ८ हजार ८ सय ४३ रुपैयाँ) हुनेछ । शाही दम्पतीबाट १ हजार २ सयजना सर्वसाधारणलाई निम्तोपत्र पठाइनेछ, त्यसबापत ४० हजार ७ सय डलर (४४ लाख २८ हजार ५ सय ६७ रुपैयाँ) बराबरको बिल तिर्नुपर्नेछ ।"
पश्चिम सेती आयोजना: समितिले दिएन सुझाव,"बैतडी, बझाङ, डडेल्धुरा र डोटी जिल्लालाई छुने आयोजनाले वार्षिक २ अर्ब ८० करोड युनिट विद्युत् उत्पादन गर्ने अनुमान छ । आयोजनाका लागि १ खर्ब ८० अर्ब लाग्ने अनुमान छ ।आयोजना निर्माणका लागि सरकारले २०५४ मा अस्ट्रेलियाली कम्पनी स्मेकलाई दिएको थियो । तर, पटकपटक म्याद थप्दा पनि कम्पनीले आर्थिक स्रोत जुटाउन नसकेपछि २०६८ साउनमा सम्झौता खारेज भएको हो । सोही वर्ष आयोजना निर्माणको जिम्मा थ्री गर्जेजलाई दिने निर्णय भएको हो । थ्री गर्जेजले २०६८ मा गरेको सम्झौतामा आयोजना सन् २०१४ देखि निर्माण सुरु गरी २०१९ को डिसेम्बरमा निर्माण गरिसक्ने उल्लेख छ । तर, प्राधिकरणसँग ६ महिनाअघि भएको संयुक्त लगानी सम्झौतामा आयोजनाको निर्माण अवधिबारे उल्लेख छैन ।"
इन्धनको मूल्य बढयो,"नयाँ मूल्यसूचीअनुसार प्रतिलिटर पेट्रोलको मूल्य १ सय १० रुपैयाँ, डिजेल र मटितेल प्रतिलिटर ९२९२ रुपैयाँ पुगेको छ । मूल्य समायोजनपश्चात् पेट्रोलमा ०७२ पैसा नाफा रहेको जनाइएको छ । डिजेलमा भने नोक्सान भएको निगमको दाबी छ । गोइतका अनुसार डिजेलमा प्रतिलिटर २ रुपैयाँ २९ पैसा घाटा छ । मूल्य समायोजनपश्चात् सीमा क्षेत्रमा मूल्य सस्तो भएको जनाइएको छ । मूल्य समायोजनपश्चात् वीरगन्ज र रक्सौल सीमाको तुलनामा नेपालमा प्रतिलिटर पेट्रोल २० रुपैयाँ ६६ पैसा र डिजेल २३ रुपैयाँ ६५ पैसा सस्तो छ, निगमका कार्यकारी निर्देशक सुशील भट्टराईले भने । खाना पकाउने एलपी ग्यास र हवाई इन्धनको मूल्य भने यथावत् छ । खाना पकाउने एलपी ग्यासको मूल्य १ हजार ३ सय ७५ रुपैयाँ पर्छ । हवाई इन्धन आन्तरिकतर्फ प्रतिलिटर १ अमेरिकी डलर तोकेको छ ।"
अघोषित मिल्क होली डे,"पहिला १५१५ दिनमा भुक्तानी आउँथ्यो । अहिले दुई महिना तीन महिनामा पनि भुक्तनी नहुने समस्या सुरु भएको छ । डेरी उद्योगहरूले के गरेका हुन् ? बुझ्नै गाह्रो भएको छ, तिमिल्सिनाले भने । डेरी उद्योगहरूले सहकारीलाई ४ देखि ९० लाख रुपैयाँसम्म भुक्तानी दिन बाँकी रहेको उनले बताए । यी समस्याहरूका कारण किसानहरू धेरै नै मारमा पर्ने अवस्था आएको छ । सरकारले नेपालमा मागको दैनिक ४ लाख लिटर दूध अपुग छ भन्ने गर्छ । तर, हामीले उत्पादन गरेको दूध किन बिक्दैन, तिमिल्सिनाले भने । यो समस्याका कारण किसानहरू व्यवसायबाट पलायन हुने खतरा रहेको उनले बताए । यो समस्या तत्काल निराकरण होस् भनेर हामी केन्द्र सरकार, प्रदेश सरकार र जिल्लाका सबै स्थानीय तहका प्रमुखहरूको ध्यानाकर्षण गराउँछौं, उनले भने ।"
गैरकानुनी बिमा पोलिसी रोक,"नेपालमा बिमाको इतिहास धेरै पुरानो भए पनि थोरै मात्र उपलब्धि हासिल भएकाले अब यसलाई व्यापक बनाउन उनले निर्देशन दिए । हाल करिब १० प्रतिशत जनसंख्यामा जीवन बिमा पुगेको रहेछ, अब मलाई भन्नुहोस् यो तथ्यांक कति वर्षमा २५३० प्रतिशत पुर्याउनुहुन्छ । सरकारले कृषि बिमामा ठूलो अनुदान दिँदै आए पनि अपेक्षित रूपमा उपलब्धि हासिल नभएकामा उनले गुनासो गरे । सरकारले अनुदान दिइरहने तर उपलब्धि हासिल नहुने अवस्थाको अब अन्त्य हुनुपर्छ, उनले भने ।"
कोहलपुरसुर्खेत प्रसारण लाइनमा समस्यै समस्या,"हावाहुरी, बाढीपहिरोले बढी क्षति पुगेका बेला मर्मत गर्न कर्मचारीले हैरानी भोग्नुर्दछ । मर्मतमै हप्ता दिनभन्दा बढी खर्च हुने गर्छ । यसले अत्यावश्यक सेवा प्रवाहमा समस्या देखिएको छ । दैनिक कामदेखि अस्पतालमा अक्सिजन पलान्ट उत्पादन, सञ्चार माध्यम सञ्चालनलगायतका व्यावसायिक काममा प्रत्यक्ष असर पुगेको छ । सुर्खेत वितरण केन्द्रले कर्मचारी अभावबारे प्राधिकरणलाई जानकारी गराए पनि सुनुवाइ नभएको बताएको छ ।"
बैंकका शाखा थप,"यसैगरी माछापुच्छ्रे बैंकले पनि एकैपटक १० स्थानमा शाखा थपेको छ । थप गरिएका शाखाहरू खोटाङको हलेसी, धनुषाको गणेशमान चारनाथ, झापाको बाह्रदसी, मोरङको जहदा, रौटहटको वृन्दावन, चितवनको कालिका र इच्छाकामना, कास्कीको मादी, अछामको पञ्चदेवल विनायक, मुगुको खत्याडमा रहेको बैंकको विज्ञप्तिमा छ । यसैबीच नेपाल इन्भेस्टमेन्ट बैंकले दोलखाको सिंगटी, पाँचथरको राँके, नुवाकोटको चोकदे र रामेछापको लिखुमा चारवटा शाखा तथा रसुवाको धुन्चेमा एक्स्टेन्सन काउन्टर खोलेको जनाएको छ । यीसँगै अब बैंकका शाखा ७० वटा पुगेका छन् ।"
गरिमा रेमिट सञ्चालनमा,काठमाडौं (कास) गरिमा विकास बैंकले गरिमा रेमिट सञ्चालनमा ल्याएको छ । बैंकले मंगलबार सञ्चालनमा ल्याएको रेमिटको माध्यमबाट देशका विभिन्न स्थानहरूमा रहने गरिमा रेमिटका एजेन्टहरूमार्फत एक स्थानबाट अर्को स्थानमा सहज रूपमा रकम स्थानान्तरण गर्न सकिने जनाएको छ । बैंकले छिट्टै नै विदेशी मुद्रा विनिमयसम्बन्धी कार्य गर्ने तथा भिसा डेबिट कार्डसमेत सञ्चालनमा ल्याउने जारी विज्ञप्तिमा छ ।
सुजुकीको सुकुटे यात्रा,काठमाडौं (कास) भीजी अटोमोबाइल्सले सुजुकी इन्ट्रडर चलाउने बाइकधनीलाई सुकुटेसम्मको यात्रामा सहभागी गराएको छ । यात्रामा ५० जना चालकको सहभागिता रहेको विज्ञप्तिमा उल्लेख छ ।
उत्तर कोरियाको चेतावनी शिखर वार्ता रद्द हुन सक्छ,"कोरियाली प्रायद्वीपमा नि:शस्त्रीकरण र शान्ति स्थापनाका लागि दुवै देशले निकट सहकार्य जारी राख्ने सहमति काङ र पोम्पियोबीच भएको छ, दक्षिण कोरियाले विज्ञप्ति जारी गर्दै भनेको छ ।"
इब्राहिम जेलमुक्त,गतसाता सम्पन्न १४औं आमनिर्वाचनबाट ६१ वर्षसम्म सत्ताको नेतृत्व गरेको बारिसन न्यासनल गठबन्धनमाथि जित हासिल गर्दै प्रधानमन्त्री बनेका ९२ वर्षीय महाथिर मोहम्मदले उनको रिहाइका लागि मलेसियाली राजाकहाँ क्षमादान दिलाउन पहल गरेका थिए ।
चेखबका तीन नेपाली बहिनी,"उनीहरूभन्दा पाकी शान्तिलाई यी सबै कुरा नौला लागेनन् । उनले दुवै जनालाई सम्झाउँदै भनिन्, प्यासन हुनुपर्छ करिअर रोकिँदैन । शान्तिले थिएटरमा काम गर्दा परिवार र आफन्तलाई विश्वास दिलाउनुपर्ने चुनौती हुने बताइन् । खास गरी महिला रंगकर्मीले करिअर र परिवार दुवैमा ब्यालेन्स मिलाउनुपर्ने बाध्यता रहेको उनको अनुभव छ । आमाको अनुभवसमेत बटुलि सकेकी शान्तिले अविवाहित बहिनीहरू सुषमा र सुनिसालाई सम्झाउँदै भनिन्, बिहे गर्नुभन्दा पहिला केटालाई थिएटर बुझाउनू । रमाइलो मान्दै सुनिसाले ठटयौउली पारामा थपिन्, हवस्, मलाई बिहे गर्ने केटालाई पहिले थिएटरको लत लगाउँछु । चुल्बुले कान्छी सुनिसाको कुरा सुनेर शान्ति (आभा) र सुषमा (माया) उनको मुखमा हेर्दै खित्का छाडेर हाँसिरहे । घनश्याम श्रेष्ठको परिकल्पना र निर्देशन रहेको नाटकमा घिमिरे युवराज, श्रीओम श्रेष्ठ रोदन, श्याम खडका, विकाश जोशी, अर्जुन न्यौपाने, अन्ना देउजा, जीवन बराल, अस्मिता खनाल, अमुल श्रेष्ठ, सुरेश जीसीलगायतको पनि अभिनय छ । चेखबको चर्चित नाटकमध्ये पर्ने तीन बहिनी मा भर्खरै बाबुआमा गुमाएका र राजधानीमा सेटल हुन खोजिरहेका तीन बहिनीको मनोदशा समेटिएको छ । संक्रमणकालीन रूसी समाजको यो कथालाई मेघराज अधिकारीले नेपाली रूपान्तरण गरेको हो ।नाटक जेठ १२ सम्म मञ्चन हुनेछ ।"
