शीर्षक,विवरण
नेपाल फोटो प्रतियोगिता घोषणा,"(काठमाडौं)  फोटो जर्नालिस्ट क्लब नेपालले ७ वर्षदेखि गर्दै आएको फोटो प्रतियोगिताको ७ औं संस्करण घोषणा गरेको छ । आइतबार राजधानीमा एक कार्यक्रम गरी सर्वाधिक राशिको नेपाल फोटो प्रतियोगिता २०७६ घोषणा गरेको हो । आफूले खिचेको फोटोलाई प्रतियोगितामा लागि अनलाइन इन्ट्री गर्दै ग्लोबल आईएमई बैंक तथा आईएमई ग्रुपका अध्यक्ष चन्द्रप्रसाद ढकालले प्रतियोगिता घोषणा गरेका हुन् । विभिन्न सात विधामा प्रतिस्पर्धा गराइने प्रतियोगितामा भाग लिन चाहनेका लागि आइतबारबाटै आवेदन खुला भएको कार्यक्रममा बताइयो । क्लबको वेबसाइटमा गएर दिइएको निर्देशनअनुसार फोटो दर्ता गर्न सकिने क्लबले जनाएको छ । प्रतियोगितामा व्यावसायिक र सौखिन सबैखाले फोटोग्राफर तथा फोटो पत्रकार सहभागी हुन पाउनेछन् । प्रतियोगितामा विदेशी नागरिक तथा विदेशमा खिचिएको फोटोले भने सहभागिता जनाउन पाउनेछैनन् तर खेलकुद विधाको हकमा भने नेपालबाहिर खिचिएको तस्बिर भने समावेश गराउन पाइने बताइएको छ । उक्त फोटोमा नेपाली वा नेपाल झल्कने विषय भने कतै न कतै देखिएको हुनुपर्नेछ । दर्ता प्रक्रिया आउँदो माघ १७ मा सकिने बताइएको छ ।प्रतियोगिताको घोषणासँगै गत वर्षको फोटो प्रतियोगितामा समावेश फोटाको संग्रह नेपाल ल्यान्ड अफ कन्ट्रास्ट को आईएमई ग्रुपका ढकालसँगै नेपाल ललितकला प्रज्ञा प्रतिष्ठानका उपकुलपति गोपाल चित्रकार, नेपाल पर्यटन बोर्डका निमित्त निर्देशक श्री विमल कँडेल, शिखर इन्स्योरेन्सका वरिष्ठ प्रबन्धक सुरज राजवाहक, अर्घाखाँची सिमेन्टका कामु महाप्रबन्धक रमेश थापा, मनराम ग्रुपका संरक्षक मनमाया श्रेष्ठ र क्लबका अध्यक्ष विकास कार्कीले लोकार्पण गरेका थिए ।प्रतियोगिताअन्तर्गत उत्कृष्टलाई फोटो अफ दि इयर उपाधिसहित १ लाख रुपैयाँ पुरस्कार दिइने बताइएको छ । नेपाल ललितकला प्रज्ञा प्रतिष्ठानका उपकुलपति चित्रकारले क्लबले गर्दै आएको प्रतियोगिता साहित्य विधाको मदन पुरस्कार जत्तिकै महत्त्वपूर्ण रहेको दाबी गरे ।"
इरान ध्वस्त पार्ने ट्रम्पको चेतावनी,"वासिङ्टनबग्दाद अमेरिकी राष्ट्रपति डोनाल्ड ट्रम्पले इरानले आफ्ना नागरिक वा कुनै सम्पत्तिमाथि हमला गरे त्यसको कडा प्रतिरोध गर्ने चेतावनी दिएका छन् । ट्रम्पका अनुसार त्यस्तो आक्रमणको बदलामा अमेरिकी सेनाले हालसम्मकै भयानक आक्रमण गर्ने तथा इरानका ५२ स्थान ध्वस्त बनाइदिनेछ । इरानको इस्लामिक रेभोलुसनरी गार्ड्स कर्प्स् (आईआरजीसी) अन्तर्गतको विशेष फौज कुड्सका जर्नेल कासिम सुलेमानीको अमेरिकी सेनाको आक्रमणमा मुत्यु भएपछि दुई देशबीच तनाव बढेको हो । इरानी सर्वोच्च नेता, राष्ट्रपति तथा विदेशमन्त्रीलगायतले सुलेमानीको हत्याको बदला लिने चेतावनी दिँदै आएपछि ट्रम्पले चेतावनी दिएका हुन् ।ट्रम्पले सामाजिक सञ्जाल ट्वीटरमा लेखेका छन्, उनीहरूले हामीमाथि आक्रमण गरे, त्यसको हामीले सशक्त जवाफ दियौं । यदि, तिनीहरूले पुनः आक्रमण गरे भने उनीहरूले हालसम्मकै भयानक आक्रमण देख्नेछन् । अत्याधुनिक प्रविधि तथा हतियारका लागि २० खर्ब डलर खर्च गरिरहेको अमेरिकी सेना विश्वमै उत्कृष्ट र शक्तिशाली रहेको उल्लेख गर्दै ट्रम्पले भनेका छन्, इरानले अमेरिकी क्याम्प वा अमेरिकी नागरिकमाथि आक्रमण गरे हामी बिनासंकोच केही नयाँ र सुन्दर हतियार प्रयोग गर्नेछौं ।इरानले सुलेमानीको हत्याको जवाफ दिने बताइरहेको उल्लेख गर्दै उनले इरानका ५२ वटा स्थानलाई सेनाले लक्ष्य बनाइरहेको बताए । ट्रम्पका अनुसार त्यस्ता स्थान इरान र इरानी संस्कृतिका लागि निकै महत्त्वपूर्ण र ऐतिहासिक छन् । उनले लेखेका छन्, अमेरिका धम्की सुन्न चाहँदैन । सन् १९७९ मा इरानस्थित अमेरिकी दूतावासबाट ५२ अमेरिकी नागरिकलाई बन्दी बनाइएको प्रसंग उल्लेख गर्दै ट्रम्पले हाल अमेरिकी सेनाको निसानामा रहेका ५२ स्थानले तिनको प्रतिनिधित्व गर्ने जनाए ।"
कारबाही सेनाविरूद्ध,"तेहरान इरानी सर्वोच्च नेताका सुरक्षा सल्लाहकारले कासिम सुलेमानीमाथि भएको आक्रमणको बदलामा अमेरिकी सेनालक्षित आक्रमण गर्ने चेतावनी दिएका छन् । अमेरिकी सञ्चार माध्यम सीएनएनसँग तेहरानमा अन्तर्वार्ता दिँदै इरानी सर्वोच्च नेता आयोतुल्लाह खामेनीका सैनिक सल्लाहकार हुसेन डेगहानले भने, जवाफी कारबाही निश्चय नै अमेरिकी सेना र उनीहरूका सैनिक क्षेत्रमा हुनेछ । इरानका पूर्वरक्षामन्त्री डेगहान खामेनीनिकट मानिन्छन् । तपाईंलाई एउटा कुरा भनौं हाम्रो नेतृत्वले आधिकारिक रूपमा घोषणा गरिसकेको छ कि हामीले युद्ध चाहेका छैनौं र चाहँदैनौं, अन्तर्वाताका क्रममा उनले भने ।"
गरिमामा पन्छिँदै कृषि मन्त्रालय,"डेढ महिनाअघि समिति बैठकले पनि तत्काल राहत उपलब्ध गराउन सिफारिस गरेको थियो । तर किसानलाई राहत दिन आलटाल भइरहेको छ । तत्कालीन कृषिमन्त्री चक्रपाणि खनालले पनि डीएनए परीक्षणको प्रतिवेदनपछि आयातकर्तालाई मुद्दा चलाउने बताएका थिए । अर्थ मन्त्रालयको सहमति लिएर किसानलाई क्षतिपूर्ति दिने उनको भनाइ थियो । त्यसका लागि मन्त्रिपरिषद्बाट टुंगो लगाउने उनले प्रतिबद्धता जनाएका थिए । एक महिनायता कृषि मन्त्रालयको जिम्मेवारी घनश्याम भुसालले सम्हालेका छन् । उनले पनि किसानका समस्याबारे सुनुवाइ गरेका छैनन् । गरिमा प्रकरणमा मन्त्रालय आफू पन्छिएर विभाग र प्रदेशस्थानीय सरकारलाई कारबाही गर्न सिफारिस गरेको छ । नोक्सान बेहोर्न बाध्य किसानलाई तत्काल राहत उपलब्ध गराउन प्रदेश र स्थानीय सरकारलाई पत्राचार गर्छौं, प्रवक्ता केसीले भने । त्यसका लागि ६० स्थानीय तह र १३ जिल्लामा अनुरोध गरिनेछ । केन्द्रको हकमा कुन मोडालिटीबाट उपलब्ध गराउने भन्ने सन्दर्भमा मन्त्रिपरिषद्बाट टुंगो लगाइने उनले बताए । राहत दिन पालिकाहरू तयार रहेकाले पत्र पठाउने निर्णय भएको बीउबिजन केन्द्र प्रमुख एवं क्षतिपूर्ति समिति संयोजक थापाले बताए । संघीय मन्त्रालयमार्फत चिठी पठाउन सिफारिस गरेका छौं, उनले भने । केन्द्रका अनुसार गरिमा हाइब्रिड धान नेपालमा ०७२ सालमा दर्ता भएको हो । १२० देखि १२५ दिन यसको पाक्ने अवधि हो । बोटको उचाइ १ सयदेखि १०५ सेन्टिमिटर, उत्पादन क्षमता प्रतिहेक्टर ५८ देखि ६३ टन हो । गरिमा हाइब्रिडको मसिनो दाना हुन्छ । यो जातको सिफारिस क्षेत्र तराई र भित्री मधेस हो । तर किसानले लगाएको बीउको पाक्ने अवधि १५० देखि १६० दिन रहेको नार्कले पुष्टि गरेको थियो ।"
विद्युत् महसुल १० युनिटसम्म ३० रुपैयाँ !,"काठमाडौं (कास) नेपाल विद्युत् प्राधिकरणले १० युनिटसम्म विद्युत् खपत् गर्ने ग्राहकलाई ३० रुपैयाँ मात्रै लिने गरी शुल्क निर्धारण गर्ने तयारी गरेको छ । प्राधिकरणको सञ्चालक समितिको आइतबार बसेको बैठकमा यसबारे छलफल भएको ऊर्जा, जलस्रोत तथा सिँचाइमन्त्री वर्षमान पुनले जानकारी दिए । १० युनिटभन्दा कम विद्युत् खपत गर्ने ग्राहकको संख्या करिब ७ लाख रहेको उनले बताए । यी ग्राहकलाई सेवा शुल्कबापत ३० रुपैयाँ मात्रै लिएर विद्युत् दिँदा प्राधिकरणलाई मासिक करिब २५ लाख भार पर्छ, मन्त्री पुनले भने, प्राधिकरणले निर्माण गरिरहेका आयोजना पूरा भइरहेका छन् । यिनले प्राधिकरणको आम्दानी बढाइरहेकाले घाटा पर्दैन । अहिले लागू भइरहेको विद्युत् महसुल परिमार्जनका लागि पनि छलफल भरहेको उनले जनाए । सय मेगावाटसम्म विद्युत् खपत गर्ने ग्राहकका लागि पनि शुल्क घटाउने तयारी रहेको उनले बताए । विद्युत् खपत बढाउने हिसाबले शुल्क परिमार्जन गर्न लागिएको मन्त्री पुनको भनाइ छ ।"
सरकारी खर्चले बढायो निक्षेप,"अर्थ मन्त्रालय र राष्ट्र बैंकको मौखिक निर्देशनअनुसार बैंकहरूले निक्षेपको ब्याजदरमा भद्र सहमति गरेका छन् । यही कारण बजारमा ब्याजदर उतारचढाव धेरै देखिएको छैन । त्यो सहमति तोडिने हो भने ब्याजदरको उतारचढाव धेरै हुने उनीहरूको तर्क छ ।राष्ट्र बैंकले भने बजारमा तरलताको अवस्था सामान्य रहेको बताएको छ । गत बिहीबारसम्म वित्तीय प्रणालीमा ५० अर्ब रुपैयाँभन्दा केही बढी लगानीयोग्य तरलता छ, राष्ट्र बैंकका प्रवक्ता गुणाकर भट्टले भने । सरकारी खर्चसँगै राजस्व र रेमिट्यान्स (विदेशी मुद्रा) वित्तीय प्रणालीमा भित्रिएकाले बैंक निक्षेप बढेको उनले बताए । राष्ट्र बैंकको तथ्यांकअनुसार गत सातासम्म वाणिज्य बैंकहरूको कुल निक्षेप ३० खर्ब १८ अर्ब रुपैयाँ छ । अघिल्लो साता यस्तो निक्षेप २९ खर्ब ९७ अर्ब रुपैयाँ थियो ।"
साढे ८ अर्बको खजुर र भटमास तेल निर्यात,"(पर्सा)  वीरगन्ज आईसीपीबाट गत वर्षसम्म जुस, जाम र स्पोर्ट्स सुज सर्वाधिक निकासी हुने गरेको थियो । चालु आवमा भने खजुर र भटमासको तेल बढी निकासी भएको छ । यस वर्ष मंसिर मसान्तसम्म ८ अर्ब ५८ करोड रुपैयाँ बराबरको खजुर र भटमासको तेल भारत निकासी भएको भन्सार कार्यालयले जानकारी दिएको छ । गत आवको मंसिर अन्त्यसम्मको तुलनामा चालु आवको सोही अवधिमा यो नाकाबाट खजुरको प्रशोधित तेल निकासी ५ र भटमासको प्रशोधित तेल निकासी झन्डै ७५ गुना बढेको छ । गत आवको सोही अवधिमा यो नाका भएर २ अर्ब २ करोड रुपैयाँबराबरको १ करोड ७३ लाख लिटर खजुरको प्रशोधित तेल निकासी भएको थियो । चालु आवमा अहिलेसम्म ६ अर्ब ७४ करोड रुपैयाँ बराबरको ६ करोड ५४ लाख ३९ हजार किलो तेल निकासी भएको छ । गत आवको मंसिरसम्म यो नाका हुँदै २ करोड ७७ लाख रुपैयाँ बराबरको २ लाख ५ हजार ४१ किलो भटमासको प्रशोधित तेल निकासी भएको थियो । चालु आवको मंसिर मसान्तसम्ममा यो नाका हुँदै १ अर्ब ८४ करोड रुपैयाँ बराबरको १ करोड ४५ लाख किलो भटमासको तेल निकासी भएको वीरगन्ज भन्सार कार्यालयका सूचना अधिकृत विमल साहले बताए । स्वदेशी उत्पादन निकासी प्रोत्साहन गर्न यी वस्तुको निर्यातमा शून्य भन्सार शुल्क लाग्ने गरेको उनले जनाए । गत आवदेखि भारततर्फ यी तेलको निकासी सुरु भएको हो । ब्राजिल, अर्जेन्टिना, युक्रेन, इन्डानेसियालगायत मुलुकबाट खजुरको कच्चा तेल आयात गरेर प्रशोधन गरी नेपालमा खाने तेल उत्पादन गरिन्छ । नेपालमै खपतका लागि यसको आयात गर्दा १० प्रतिशत भन्सार शुल्क र १३ प्रतिशत मूल्य अभिवृद्धि कर लाग्छ । तर, भारत निकासी प्रयोजनका लागि आयात गर्दा भने बैंक ग्यारेन्टीमा आयातको सुविधा छ । यसमा भन्सार शुल्क लाग्दैन ।"
