शीर्षक,विवरण
नेकपा केन्द्रीय बैठक माघ १५ मा,काठमाडौं (कास) नेकपा केन्द्रीय कमिटीको पुस २३ गतेका लागि बोलाइएको बैठक स्थगित भएको छ । प्रधानमन्त्री निवास बालुवाटारमा आइतबार बसेको नेकपा सचिवालय बैठकले निर्धारित केन्द्रीय कमिटी बैठक स्थगित गर्ने निर्णय गरेको हो । राष्ट्रिय सभा निर्वाचनको तयारीमा जुट्नुपर्ने भएकाले बैठक माघ १५ गतेका लागि सारिएको प्रचार विभाग उपप्रमुख सूर्य थापाले जानकारी दिए । काठमाडौंमा गत पुस ५ गते सम्पन्न स्थायी समिति बैठकले २३ गते केन्द्रीय कमिटी बैठक डाक्ने निर्णय गरेको थियो । नेकपाको अन्तरिम विधानमा केन्द्रीय कमिटी बैठक ६६ महिनामा गर्ने प्रावधान छ ।
सचिवालय अलि मिलेको छैन : नेपाल,"धनगढी (कास) नेकपाका वरिष्ठ नेता माधवकुमार नेपालले पार्टी सचिवालय अपूर्ण रहेको बताएका छन् । पुष्पलाल मित्रता केन्द्रले आइतबार धनगढीमा गरेको कार्यक्रममा उनले तत्कालीन एमालेका उपाध्यक्ष र उपमहासचिवलाई सचिवालयमा ल्याउनुपर्ने बताए । तत्कालीन एमालेमा भीम रावल र अष्टलक्ष्मी शाक्य उपाध्यक्ष तथा घनश्याम भुसाल उपमहासचिव थिए । तत्कालीन एमालेका उपाध्यक्ष र उपमहासचिवलाई सचिवालयमा ल्याउँदा सुदूरपश्चिम प्रदेश र महिलाको प्रतिनिधित्व हुने नेता उनको भनाइ थियो । अहिले सचिवालय अलि मिलेको छैन, उनले भने, व्यक्तिको क्षमता र योग्यता ख्याल गरेर सचिवालय सदस्य थप्नुपर्छ ।"
भारतीय प्रहरीद्वारा नियन्त्रण,"कपिलवस्तु (कास) यशोधरा गाउँपालिका८ मटेरियाका मुवारक खाँलाई शनिबार भारतीय सुरक्षाकर्मीले मर्यादपुर बजारबाट नियन्त्रणमा लिएर लगेको छ । आफन्तको वर्कसपमा बसिरहेका बेला भारतीय सुरक्षाकर्मीले जबर्जस्ती यूपी५५एक्स ०१०१ नम्बरको सेतो स्कार्पियोमा राखेर उनलाई लगेको प्रत्यक्षदर्शीले बताए । भारतीय प्रहरीसँग सोध्दा एसओजी इन्टेलिजेन्सले लगेको बताएका छन्, जिल्लाका निमित्त प्रहरी प्रमुख नायब उपरीक्षक सुनील मल्लले भने, यसबारे थप बुझ्दै छौं ।"
नक्कली मोहीका नाममा २ करोड ॅहिनामिना,"काठमाडौं (कास) धनुषामा गुठी संस्थानका कर्मचारी, बिचौलिया र नक्कली मोही मिलेर मुआब्जाका नाममा २ करोड रुपैयाँभन्दा बढी हिनामिना गरेको पाइएको छ । धनुषाको साविक भरतपुर गाविसमा सेनाका लागि अधिग्रहण गरिएको गुठीको जग्गामा किर्ते मोही कायम गरी मुआब्जा वितरणका नाममा रकम हिनामिना गरेको भेटिएको हो । अख्तियारले उक्त प्रकरणमा गुठी संस्थान शाखा कार्यालय, जनकपुरका तत्कालीन प्रमुख राजबाबु पाण्डे, सहायक प्रशासक मनोजकुमार आचार्य, वरिष्ठ लेखा सहायक हरिचन्द्र भुसाल, बिचौलिया सुमनकान्त ठाकुर, नक्कली मोही गायत्रीदेवी जयसवाल र शत्रुधन जयसवालविरुद्ध आइतबार भ्रष्टाचार मुद्दा दायर गरेको छ । संस्थानको जनकपुर कार्यालयले दुई जना नक्कली मोही खडा गरी गैरकानुनी रूपमा मुआब्जा वितरण गरेको र त्यसमा कर्मचारी र बिचौलियाले मोटो रकम कमिसनका रूपमा लिएको अभियोगपत्रमा उल्लेख छ । यसैगरी अख्तियारले सेवाग्राहीसित ४९ हजार रुपैयाँ घूस लिएको आरोपमा महानगरीय अपराध महाशाखा, काठमाडौंका निरीक्षक (इन्स्पेक्टर) जयनेपाल थापाविरुद्ध भ्रष्टाचार मुद्दा दायर गरेको छ ।"
"पहिले पानी बाराबार, अहिले अंकमाल","(जनकपुर)  मधेस आन्दोलनका बेला प्रदेश २ मा मधेसकेन्द्रित राजनीतिक दलहरूको तारो तत्कालीन एमाले थियो । त्यही एमाले र माओवादी केन्द्र एकतापछि बनेको नेकपाको जनकपुरस्थित कार्यालयमा आइतबार अभूतपूर्व जमघट देखियो । नेकपा कार्यालयमा राष्ट्रिय जनता पार्टी (राजपा) का नेताकार्यकर्ता झन्डा बोकेर पुगे, आपसमा अंकमाल गरे । चुनावी गठबन्धन सफल बनाएर छाड्ने उद्घोष गरे । केन्द्रमा राष्ट्रिय सभा निर्वाचनका लागि तालमेल घोषणा हुनुअघिसम्म नेकपा र राजपाबीच यस्तो सौहार्द दृश्य देखिएला भन्ने यहाँ कल्पनासमेत गरिएको थिएन । यी दुई दल यसअघि सधैं प्रतिस्पर्धीका रूपमा थिए । प्रदेशमा पनि राजपा सत्तारूढ हो भने नेकपा प्रतिपक्ष । प्रदेश २ को सत्तारूढ राजपाका मन्त्रीहरू सरकारी गाडीमै नेकपा कार्यालय पुगेका थिए । नेकपाको कार्यालयबाट सूर्य र छाता चुनावचिह्न अंकित झन्डा बोकेर नारा लगाउँदै नेताकार्यकर्ता उम्मेदवारी दर्ताका लागि निर्वाचन कार्यालय पुगेका थिए । नेकपाका नेताकार्यकर्ताले नेकपाराजपा गठबन्धन जिन्दावाद, वीर सहिद अमर रहुन् र संयुक्त उम्मेदवारलाई विजयी गराऔं भन्ने नारा लगाएका थिए । राजपाका कार्यकर्ताले जय मधेस बाहेकका नारा लगाएनन् । प्रदेश २ को राजपा संसदीय दलका नेता एवं मन्त्री जितेन्द्र सोनलले केन्द्रमा भएको सहमतिलाई सफल बनाउन लागिपर्ने बताए । नेकपाका संसदीय दलका नेता सत्यनारायण मण्डलले नेकपाराजपा गठबन्धनबाट राजनीतिमा दूरगामी प्रभाव पर्ने दाबी गरे । राजनीतिमा जे पनि सम्भव हुन्छ, उनले भने । यस प्रदेशमा कांग्रेस र समाजवादी पार्टीले तालमेल गरे पनि दुवै पार्टी मनोनयन दर्ताका लागि फरकफरक समयमा निर्वाचन कार्यालय पुगेका थिए । कांग्रेसका नेताकार्यकर्ता आफ्ना उम्मेदवारसँगै पार्टी कार्यालयबाट हिँडेर निर्वाचन कार्यालय पुगेका थिए । कांग्रेससमाजवादी गठबन्धनको मनोनयनका बेला प्रदेश सरकारका मन्त्री विजय यादव र ज्ञानेन्द्र यादव पनि निर्वाचन कार्यालय पुगेका थिए । कांग्रेस संसदीय दलका नेता रामसरोज यादवले मधेसको मुद्दामा कांग्रेस लचिलो रहेकाले समाजवादीसँगको गठबन्धन सफल हुने दाबी गरे । उनले प्रदेश २ को राष्ट्रिय सभाको निर्वाचनमा राजपाको मत पनि आफूतिर आउने र कांग्रेससमाजवादी गठबन्धनले जित्ने दाबी गरे । समाजवादी पार्टीका केन्द्रीय सदस्य उमेश साहले पनि मधेसमा नेकपाराजपाको गठबन्धनले असन्तुष्ट रहेकाले त्यसको फाइदा कांग्रेससमाजवादी गठबन्धनलाई हुन सक्ने बताए । नेकपा र राजपाको गठबन्धनबाट प्रदेश २ मा राधेश्याम पासवान, तुलसा दाहाल, मृगेन्द्रकुमार सिंह यादव र शेखर सिंहले उम्मेदवारी दिएका छन् । पासवान र दाहाल नेकपा तथा यादव र सिंह राजपाका हुन् । कांग्रेससमाजवादी गठबन्धनबाट रामप्रित पासवान, भोला पञ्जियार, अनिरुद्र सिंह र नगिनादेवी यादवले उम्मेदवारी दर्ता गराएका छन् । पासवान र सिंह समाजवादी तथा पञ्जियार र यादव कांग्रेसका हुन् । प्रदेश २ मा नेकपाराजपा गठबन्धनसँग स्पष्ट बहुमत छ ।"
"१८ पद, ४५ उम्मेदवार","काठमाडौं (कास) राष्ट्रिय सभाका १८ सिटमा आइतबार ४५ जनाको उम्मेदवारी दर्ता भएको छ । निर्वाचन आयोगका अनुसार महिला समूहमा १६, दलितमा ५, अपांगता भएको व्यक्ति वा अल्पसंख्यकमा ५ र अन्य समूहमा १९ जनाले उम्मेदवारी दिएका हुन् । राष्ट्रिय सभामा पहिलो चरणको दुईवर्षे कार्यकाल पूरा भएर आउँदो फागुनबाट महिलातर्फ ७, दलिततर्फ २, अपांगता भएका व्यक्ति वा अल्पसंख्यकतर्फ २ र अन्य समूहमा ७ पद रिक्त हुँदैछन् । प्रदेश १ र ५ मा ३३, प्रदेश २, प्रदेश ३, गण्डकी, कर्णाली र सुदूरपश्चिमका २२ सिट खाली हुन लागेका हुन् । तिनै पदका लागि माघ ९ मा निर्वाचन हुन लागेको हो । प्रदेश सांसद र स्थानीय तहका प्रमुखअध्यक्ष, उपप्रमुखउपाध्यक्षको मतका आधारमा राष्ट्रिय सभा सदस्य प्रदेशस्तरबाट चयन हुन्छन् । यो चुनावमा प्रदेश २ मा नेकपा र राजपाले तथा कांग्रेस र समाजवादी पार्टीले चुनावी गठबन्धन गरेका छन् । अन्य स्थानमा नेकपा, कांग्रेस, समाजवादी र राजपा आआफ्नै तवरले उठेका छन् । प्रदेश ३ मा नेमकिपा र गण्डकी तथा प्रदेश ५ मा राष्ट्रिय जनमोर्चाको पनि उम्मेदवारी परेको छ । आयोगका प्रवक्ता राजकुमार श्रेष्ठका अनुसार आइतबार उम्मेदवारी दिएकाहरूमाथि सोमबार बिहान १० देखि ४ बजेसम्म उजुरी दिन सकिनेछ ।"
देउवालाई दबाब दिन सभापति भेला,"(काठमाडौं)  कांग्रेस वरिष्ठ नेता रामचन्द्र पौडेल पक्षले सोमबार जिल्ला सभापतिहरूको भेला बोलाएको छ । भेलामा पूर्वमहामन्त्री कृष्ण सिटौला समूह पनि सामेल हुने भएको छ । धनकुटामा रहेका सिटौला भने आउनेनआउने टुंगो छैन । सभापति शेरबहादुर देउवाले बहुमतको बलमा पुस ११ को केन्द्रीय कार्यसमिति बैठकबाट महाधिवेशनको कार्यतालिका तोक्ने, विधानका दफा निलम्बन गर्ने, विभागको संख्या थप्ने र तरुण दलको म्याद बढाउने निर्णय गरेपछि पौडेल र सिटौला पक्षका नेताहरूले चर्को विरोध गर्दै आएका छन् । इतिहासमै पहिलोपटक बहुमतबाट महाधिवेशनको कार्यतालिका तोकेर र विधानको नियम निलम्बन गरेर गलत नजिर स्थापित गरेको उनीहरूको आरोप छ ।पौडेलसिटौला पक्षले पुस ११ को निर्णय सच्याउनुपर्ने बटमलाइन अघि सारेको छ । यसैका लागि दबाब दिन उनीहरूले जिल्ला सभापतिहरूको भेला बोलाएका हुन् । ४० जिल्लाभन्दा बढीका सभापतिले गर्ने निर्णयबाट देउवालाई ठूलो दबाब पर्ने बुझाइ पौडेलसिटौला पक्षको छ । पार्टी विभाजनको कालखण्डबाहेक ७० वर्षको इतिहासमा देउवाबाट पहिलोपल्ट एकलौटी रूपमा महाधिवेशनको घोषणा भएको सिटौलाले बताए । कांग्रेसमा विवाद बीपी कोइरालाको पालादेखिकै हो, गणेशमान सिंह, कृष्णप्रसाद भट्टराई र गिरिजाप्रसाद कोइरालाबीच पनि ०४९ सालतिर ठूलै विवाद थियो, उनले भने, सिंह र भट्टराई एउटा कित्तामा थिए, अर्को कित्तामा गिरिजाप्रसाद तर तत्कालीन सभापति भट्टराईले गिरिजाप्रसादको सहमतिबाटै महाधिवेशनको कार्यतालिका र कार्ययोजना घोषणा गर्नुभएको थियो । पुस ११ गतेको निर्णयले महाधिवेशन निष्पक्ष हुन्छ भन्नेमा आशंका बढाएको सिटौलाको तर्क छ । हामीसँग त महाधिवेशनको कार्यतालिका र कार्ययोजनाबारे छलफलसम्म भएन, उनले भने, पारस्परिक सहमतिविपरीत भएका निर्णय सच्याउनुपर्छ भन्नेमा पौडेलजी र हामी एकै ठाउँमा छौं । देउवा केन्द्रीय कार्यसमितिको निर्णय पूरै उल्टाउने पक्षमा छैनन् । उनीनिकट सहमहामन्त्री प्रकाशशरण महतका अनुसार फागुन ७११ गतेसम्म तोकिएको केन्द्रीय महाधिवेशनको तिथि अब तलमाथि हुँदैन । स्थानीय तहका अधिवेशनहरू, क्रियाशील सदस्यता वितरण, नियम निलम्बनका केही प्रावधान थपघट गर्न सकिन्छ । यसमा सभापतिजी पनि तयार हुनुहुन्छ, उनले भने ।निर्णय सच्याउनेनसच्याउने विवाद पछिल्लोपटक कांग्रेसभित्र जुंगाको लडाइँ बनेको छ । पौडलनिकट सदस्य हृदयराम थानीका अनुसार निर्णय सच्याउनुपर्ने माग बटमलाइन हो । सभापतिहरूको जमघटबाट निर्णय सच्याउनका लागि दबाब दिन लागिएको हो, उनले भने, सभापतिजीले निर्णय सच्याउनुभएन भने क्षेत्र, गाउँ हुँदै विशेष महाधिवेशनसम्मको बाटो तय हुन सक्छ, उनले भने । पार्टीभित्र चर्कंदै गएको विवाद मत्थर बनाउन आइतबार दिनभर दुवै पक्षका केही युवा नेतासमेत जुटेका थिए । भीष्मराज आङदम्बे, एनपी सावद, सुरेन्द्रराज पाण्डे, गगन थापा, धनराज गुरुङ, दीपक गिरी, सरिता प्रसाईं, प्रदीप पौडेल, बद्री पाण्डे, रामकृष्ण यादव, गुरुराज घिमिरे, जीवन परियारलगायतको बैठकले दुवै नेतालाई भेटेर विवाद समाधानका लागि दबाब दिने निर्णय गरेका छन् । सभापति र पौडेल दुवैलाई भेटेर समाधानको बाटो खोज्न हामीले दबाब दिएका छौं, केन्द्रीय सदस्य सावदले भने, नीतिगत र व्यावहारिक रूपमा ठूलो फाटो छैन । महाधिवेशनको प्रक्रियालाई विश्वसनीय रूपमा अघि बढाउने विषयमा सहमति जुटाएर अघि बढ्न सकिन्छ । अहिले हामीले गरिरहेको प्रयास पनि त्यही हो ।अर्का केन्द्रीय सदस्य प्रदीप पौडेलले जिल्ला सभापतिको भेला हुनुअघि नै नेतृत्वले पहल गर्नुपर्नेमा नगरिएकाले विवादले गम्भीर मोड लिन सक्ने बताए । जिल्ला सभापतिहरूको भेलाले आक्रामक ढंगको निर्णय लियो भने स्थितिलाई झनै गम्भीर मोडमा धकेल्न सक्छ, त्यसलाई ख्याल गरेर सभापतिले असहमत पक्षसँग संवाद गर्नुपर्थ्यो, उनले भने, सभापतिले त्यस्तो पहल नगरी बहुमतबाट गरिएका निर्णय नै अन्तिम हो, यसैलाई प्रयोग गरेर निरन्तर अघि बढ्छु भन्ने संकेत दिनुभयो । यसले असहमत पक्षलाई झन् आक्रामक बनाएको छ ।"
