शीर्षक,विवरण
"'भित्र छौं, बाहिर थाहा छैन'","आज मेरो बिदा हो । दिनभर जिम गरिरहेको छु । धेरै तनाव लिएको छैन, एक सुपरमार्केटका म्यानेजर गुरुङले भने, पछिल्लो घटनाक्रमलाई यहाँ कार्यरत नेपालीले महत्त्वका साथ हेरेका छैनन् । उनले आफ्नो मनमा भने केही डर पलाएको सुनाए ।बग्दादमा भन्दा कुर्दिस्तान क्षेत्रमा नेपाली बढी छन् । कुर्दिस्तानमा कम्तीमा १५ हजार नेपाली छन् । अवैध रूपमा जाने भएकाले इराकमा कति नेपाली छन् भन्ने आधिकारिक तथ्यांक कतै छैन ।गुरुङले बग्दादभन्दा कुर्दिस्तान बढी सुरक्षित रहेको बताए । हुन त यहाँ इरानी पनि छन्, अमेरिकी पनि छन् । सबै आआफ्नो भूमिकामा छन् । नेपालीहरू दिनभर आआफ्नो ड्युटी गर्छन् । बेलुका कोठामा फर्किन्छन्, उनले भने, अरू विषयमा खासै चासो छैन । गुरुङका अनुसार नेपाली युवती धेरै घरेलु काममा छन् । उनीहरूलाई झन् चासो छैन, उनले भने ।गैरआवासीय नेपाली संघ, इराकका अध्यक्षसमेत रहेका गुरुङले नेपालीसँग समन्वय बढाउन थालेको जानकारी दिए । इरानमा भने २५ जना मात्रै नेपाली रहेको सरकारी तथ्यांक छ । इराक र इरानमा नेपाली कूटनीतिज्ञको उपस्थिति छैन । इराकलाई कुवेतस्थित नेपाली दूतावास र इरानलाई पाकिस्तानस्थित नेपाली दूतावासले हेर्ने गर्छ । कुवेतमा रहेको नेपाली दूतावाससँग निरन्तर समन्वय गरिरहेका छौं । यहाँको स्थितिबारे जानकारी पनि दिइरहेको छु, गुरुङले भने । इराक मामिला हेर्ने कुवेतका लागि नेपाली राजदूत दुर्गाप्रसाद भण्डारीले बग्दादमा रहेका नेपालीलाई कम्पनीबाट बाहिर ननिस्किन सूचना जारी गरिएको बताए । सतर्कतासाथ बस्न भनेका छौं, उनले भने ।परराष्ट्र मन्त्रालयले इराक र इरान मामिला हेर्ने नेपाली दूतावासलाई सर्तक गराएको छ । त्यहाँको घटनाक्रमलाई नजिकबाट हेरिरहेका छौं, परराष्ट्र मन्त्रालयका सहायक प्रवक्ता सुरेश अधिकारीले भने, दूतावासहरूले नेपालीसँग समन्वय गरिरहेका छन् ।इराक र इरानमा रहेका नेपालीको विषयमा आइतबार परराष्ट्र र श्रम मन्त्रालयबीच छलफल भएको थियो । परराष्ट्रमन्त्री प्रदीप ज्ञवाली, श्रममन्त्री रामेश्वर राय यादव, परराष्ट्र सचिव शंकर बैरागी र श्रम सचिव विनोद केसीबीच छलफल भएको हो । संकटग्रस्त अवस्थामा लिबियाबाट नेपालीलाई उद्धार गरेको अनुभव हामीसँग छ, श्रममन्त्री यादवले कान्तिपुरसँग भने, इराकबाट नेपाली ल्याउनैपरे हामीले अवैध रूपमा गएको भन्दै पन्छिन मिल्दैन । नेपालीलाई राज्यका तर्फबाट सकुशल उद्धार गर्नैपर्छ । यसका लागि कस्तो रणनीति अपनाउने भनेर छलफल गर्यौं । बैठकमा नेपाली रहेको स्थान पहिचान गर्न र सम्पर्क गर्न दूतावासलाई परिचालन गर्ने निर्णय भएको मन्त्री यादवले बताए ।"
१२२ चिनियाँलाई अभद्र व्यवहारमा जरिवाना,"(काठमाडौं)  गैरकानुनी अनलाइन कारोबार, साइबर र सीमापार अपराधको आशंकामा पक्राउ परेका १ सय २२ चिनियाँ नागरिकविरुद्धको कसुर पुष्टि नभएपछि स्थानीय प्रशासनले अभद्र व्यवहार मा जनही एक हजार रुपैयाँ जरिवाना गराएको छ ।काठमाडौंका प्रमुख जिल्ला अधिकारी जनकराज दाहालको इजलासले अभद्र व्यवहारको कसुरमा जरिवाना लिएर रिहा गर्न आदेश दिएको हो । आदेशपछि जनही एक हजार रुपैयाँ जरिवाना बुझाए पनि प्रहरीले उनीहरूलाई रिहा गरेन । अध्यागमन विभागको आग्रहमा प्रहरीले सबैलाई हिरासतमा राखेको छ । पक्राउ परेकामध्ये ८४ जनासँग राहदानी छैन । ६७ राहदानी बरामद भएकामा ३८ जना मात्रै राहदानीवाहक रहेको खुलेको छ । नेपाल प्रहरी र चिनियाँ प्रहरीको संयुक्त अपरेसनमा पुस ७ मा उनीहरूलाई राजधानीको मनमैजु, बाँसबारी र बूढानीलकण्ठका १० वटा घरबाट पक्राउ गरिएको थियो । पक्राउ परेका चिनियाँ नागरिकलाई अभद्र व्यवहारमा दोषी ठहर गर्दै १ हजार रुपैयाँ जरिवाना असुल गरेर छाड्न भनिएको छ, प्रजिअ दाहालले कान्तिपुरसँग भने, अभद्र व्यवहारबाहेक उनीहरूको अन्य अपराधमा संलग्नता देखिएन । थुनछेक बहस र बयानपछि दाहालको इजलासले उनीहरूलाई जरिवाना लिएर छाड्न आदेश दिएको हो । पक्राउ परेका चिनियाँबारे हाम्रोतर्फबाट हुने काम सकिएको छ, दाहालले भने, अध्यागमन नियम उल्लंघनमा अरू निकायले केकस्तो अनुसन्धान र कारबाही गर्छन्, यसमा उतैबाट बुझ्नुहोला ।पुस ७ मा एकैपटक यति धेरै चिनियाँलाई पक्राउ गरेपछि ठूलो उपलब्धि हासिल गरेको भन्दै प्रहरी अधिकारीले संगठित, आर्थिक, साइबर र सीमापार अपराध पुष्टि गरिछाड्ने दाबी गरेका थिए । तर दुई साता लामो अनुसन्धानमा चिनियाँले अध्यागमन कानुन उल्लंघनबाहेक अर्को अपराध गरेको नभेटिएपछि अभद्रमा जरिवाना असुल गरेर उनीहरूलाई नेपालबाट चीन फिर्ता गर्नका लागि अध्यागमन विभागको जिम्मा लगाइएको हो ।अध्यागमन नियम र अभद्र व्यवहारबाहेक अर्को कसुरमा उनीहरूको संलग्नता भेटिएन, एसएसपी उत्तमराज सुवेदीले कान्तिपुरसँग भने, अभद्रमा जरिवाना गराइसकिएको छ, अब अध्यागमनले यसबारे आवश्यक प्रक्रिया पुर्याएर उनीहरूलाई निष्कासन गर्नेछ ।प्रशासनले जरिवाना लिएर छोडेलगत्तै प्रहरीले चिनियाँहरूलाई अध्यागमन विभाग पुर्याएको थियो । तर अध्यागमनले निष्कासन नभएसम्म चिनियाँलाई प्रहरीकै हिरासतमा पठाएको छ । अध्यागमन विभागका महानिर्देशक ईश्वरराज पौडेलले जनही ५० हजार रुपैयाँ जरिवाना गराएर चिनियाँलाई निष्कासनको प्रक्रिया अघि बढाइएको जानकारी दिए । प्रहरीले चिनियाँलाई हाम्रो जिम्मा लगाइसकेको छ, अब छिट्टै कानुनी प्रक्रिया पूरा गरेर उनीहरूलाई आफ्नै देश निष्कासन गरिनेछ, पौडेलले भने, राहदानी भएकाले पर्यटक भिसाको दुरुपयोग गरेको र नभएकाले गैरकानुनी रूपमा बसेको कसुरमा सजाय गरेर निष्कासन गरिनेछ । तर उच्च स्रोतका अनुसार चिनियाँ नागरिकहरू चीनविरुद्ध राजनीतिक अभियानका रूपमा जान सक्ने जोखिम देखेर उनीहरूमाथि आम गिरफ्तारी को नीति अपनाइएको हो । तर यस विषयमा चीनले कुनै पनि धारणा सार्वजनिक गरेको छैन । सीमापार अपराध र साइबर अपराध गरेको आरोपमा विभिन्न मुलुकमा रहेका आफ्ना देशका नागरिकविरुद्ध चीनको सार्वजनिक सुरक्षा मामिला हेर्ने मन्त्रालयले त्यहाँको कानुन कार्यान्वयन गर्ने निकायमार्फत क्लाउड सोर्ड र युन्जीआन नाम दिएर विशेष अपरेसन थालेको छ । चीनका १३ वटा प्रान्तमा यस्तो अपरेसन चलाइएको छ ।पछिल्लो १ वर्षमा मात्रै यो अपरेसनमार्फत नेपालसहित विभिन्न मुलुकबाट ९९ हजार शंकास्पद चिनियाँ नागरिक पक्राउ परिसकेका छन् । पक्राउ परेका व्यक्तिका १ लाख १८ हजारवटा मुद्दा समाधान भएको चीनको दाबी छ । आफ्ना नागरिक विभिन्न मुलुकबाट पक्राउ गर्न चिनियाँ प्रहरी सम्बन्धित देशसँग समन्वय गर्ने गरी खटिएको पनि चिनियाँ विदेश मन्त्रालयले जनाइसकेको छ । चीनले सार्वजनिक गरेको तथ्यांकअनुसार कम्बोडिया, फिलिपिन्स, नेपाल, लाओसलगायत मुलुकबाट दूरसञ्चार प्रविधिको ठगी आशंकामा २ हजार ५ सय ५३ जनालाई १४ पटकसम्म पक्राउ गरिएको छ । पछिल्लो ८ वर्षमा मात्रै यस्तो अपराधमा संलग्न ४ हजार २ सय ५ जना मारिएको, सन्दिग्ध ४१ हजार पक्राउ परेको र उनीहरूले अपराधको जालो फैलाउन करिब ९ खर्ब रुपैयाँ (५८ अर्ब युआन) लगानी गरेको भेटिएको चीनले औपचारिक रूपमै जनाएको छ ।चीनको सार्वजनिक सुरक्षा मामिला मन्त्रालयले पुस ९ मा पत्रकार सम्मेलन गरेर विश्वभरबाट पक्राउ परेका आफ्ना देशका नागरिकको संख्या र उनीहरूमाथि लगाइएका कसुर सार्वजनिक गरेको थियो । तर चीनले कसुरदार ठानेका चिनियाँ नागरिक नेपालमा त्यस्तो कुनै गम्भीर अपराधमा संलग्नता देखिएनन् । यसबारे नेपालका प्रहरी अधिकारीहरूले स्पष्ट जवाफ दिएका छैनन् । तर चीनले नेपालसहित विभिन्न मुलुकबाट पक्राउ परेका आफ्ना देशका नागरिकलाई देशको अर्थतन्त्र धरापमा पार्ने गरी चीनविरुद्ध अपराध भइरहेको जनाएको छ ।ॅ५८ बिलियन युआन ठगीगिरोहले चीनमा दूरसञ्चार, इन्टरनेट, बैंकिङ अपराधलगायतको जालो फैलाएको चीन सरकारको दाबी छ । यस्तो अपराधमा करिब ५८ बिलियन युआन बराबरको आर्थिक क्षति पुगेको चीन सरकारले जनाएको छ । चीनको दाबीलाई बल पुग्ने गरी नेपालमा पक्राउ परेका १ सय २२ चिनियाँ महँगा अपार्टमेन्ट र बंगला बजार मूल्यभन्दा बढीमा भाडामा बस्ने गरेको पाइएको थियो ।चीनको सार्वजनिक सुरक्षा मन्त्रालयका प्रवक्ता गुओ लिनले पुस ९ मा पत्रकार सम्मेलन गरी नेपालसहित विभिन्न मुलुकबाट समातिएका चिनियाँका अपराधबारे चीन सरकारको आधिकारिक धारणा सार्वजनिक गरेका थिए । सार्वजनिक सुरक्षा मामिला मन्त्रालयका अनुसन्धान ब्युरोका उपनिर्देशक लिउ चोङ्यी, हेनान प्रान्तका पब्लिक सेक्युरिटी डिपार्टमेन्टको क्रिमिनल इन्भेस्टिगेसन क्रप्सका उपप्रमुख सुन जियानफेङ, झेजियाङ पब्लिक सेक्युरिटी डिपार्टमेन्टका उपप्रमुखद्वय झओ गेनयुआन र लु जियानपिङलाई साथमै राखेर गुओ लिनले चीनको अर्थतन्त्र सिध्याउन सीमापार अपराधमा आफ्नै देशका नागरिक सक्रिय भएको बताएका थिए ।चीनको अर्थतन्त्रमा द्रुत विकास भएसँगै इन्टरनेट र दूरसञ्चारको दुरुपयोगले नयाँ किसिमका अपराध बढेका छन्, उनले पत्रकार सम्मेलनमा भनेका थिए, अपराधीले सञ्चारका उपकरण र आधुनिक अनलाइन बैंकिङ प्रविधिबाट नयाँ किसिममा ठगी गर्ने र व्यक्तिहरूलाई पीडित बनाउने काम गरिरहेका छन् । यो विषयलाई पार्टीको केन्द्रीय कमिटी र स्टेट काउन्सिलले गम्भीर रूपमा लिएको उनको भनाइ छ । डाटा चोर्ने, विज्ञान तथा प्रविधिको दुरुपयोग गर्नेविरुद्ध निरन्तर नयाँ किसिमले अनुसन्धान र कारबाही गरिने चीनले स्पष्ट पारेको छ । सार्वजनिक सुरक्षा मामिला मन्त्रालयका प्रवक्ता गुओलिनले यसबारे धारणा सार्वजनिक गरेको साता दिनभित्रै नेपालका गृहमन्त्री रामबहादुर थापा चीनको भ्रमणमा निस्किएका छन् । स्टेट काउन्सिलर तथा सार्वजनिक सुरक्षामन्त्री झाओ केझीको निमन्त्रणामा थापा आइतबार चीन प्रस्थान गरेका हुन् । चीनको आग्रहमा १ सय २२ चिनियाँ पक्राउ परेकै बेला भएको गृहमन्त्री थापाको भ्रमणलाई अर्थपूर्ण मानिएको छ ।"
