शीर्षक,विवरण
ट्रम्पको आपराधिक आक्रामकता,"अमेरिकी राष्ट्रपति डोनाल्ड ट्रम्पको आदेशमा इरानका एक उच्च सैन्य अधिकारीको हत्या गरिएपछि खाडी क्षेत्रमा नयाँ शिराको अशान्ति र अस्थिरता बढेको छ । इरानी सेनाको विशिष्टीकृत इकाईका रूपमा परिचित काड्स फोर्स कमान्डरका रूपमा दुई दशकदेखि कार्यरत मेजर जनरल कासिम सुलेमानीलाई शुक्रबार बगदाद अन्तर्राष्ट्रिय विमानस्थलमा अमेरिकाले ड्रोन आक्रमण गरी मारेको थियो । अमेरिकी रक्षा संस्थापन पेन्टागनले सुलेमानीमाथि आक्रमणका निम्ति राष्ट्रपति ट्रम्पबाटै निर्देशन आएको जानकारी दिएपछि त्यसको सर्वत्र भर्त्सना भएको छ । अमेरिकाले यसअघि आफ्नो मुलुकभित्र जनधनको क्षति गराउने ओसामा विन लादेन र इस्लामिक स्टेट (आईएस) का अबु बक्र अलबग्दादीजस्ता अतिवादी अगुवाहरूलाई पनि मारेको थियो । तर हालको हत्यालाई ती घटनासँग तुलना गर्न किन मिल्दैन भने सुलेमानी उनीहरूजस्ता कुनै आतंकवादी संगठनका नेता नभई एउटा राज्यका जिम्मेवार सैन्य अधिकारी थिए । र, उनी कुनै युद्धको मोर्चामा मारिएका पनि होइनन्, उनलाई निसाना साँधेर ड्रोन आक्रमणमार्फत सफाया गरिएको हो । वास्तवमा यो एउटा विशुद्ध हत्या हो, जसमा अमेरिकी राष्ट्रपति ट्रम्पको आपराधिक आक्रामकताले काम गरेको छ । मेजर जनरल सुलेमानी इरानका कुनै सामान्य जर्नेलमात्र पनि थिएनन्, त्यहाँका सर्वोच्च नेता अयातुल्लाह अलि खुमेनीले विश्वास गरेको एलिट फोर्सका प्रभावशाली कमान्डर थिए, जसको भूमिका देशभित्रभन्दा बाहिर बढी केन्द्रित हुँदै गएको थियो । खाडी क्षेत्रमा इरानी प्रभाव विस्तारको स्रोतव्यक्तिका रूपमा उनी स्थापित थिए । त्यसले गर्दा उनी अमेरिकी आँखाको तारो बन्नु अस्वाभाविक होइन । खाडी क्षेत्रमा सुन्नी इस्लामिक राज्य स्थापना गर्न लडिरहेको आईएसविरुद्धको अभियानमा सियाबाहुल्य इरान र अमेरिकाले फरकफरक स्वार्थका बीच आआफ्नै ढंगबाट एउटै काम गर्दै आएका थिए । आईएसलाई प्रतिरक्षात्मक दिशातर्फ धकेल्नमा जर्नेल सुलेमानीको पनि महत्त्वपूर्ण भूमिका थियो । जब त्यो मिसन सफलताउन्मुख भयो, अमेरिका आफ्नो दशकौं पुरानो दुस्मन इरानका एक महत्त्वपूर्ण सैन्य हस्ती सुलेमानीलाई समाप्त पार्न अग्रसर भयो । खाडी क्षेत्रमा प्रभुत्व विस्तारको बहुमुखी स्वार्थ बोकेको अमेरिकाले आफूविरुद्ध सुलेमानीले अनेक षड्यन्त्र गरिरहेको अपुष्ट आरोप लगाउँदै उनको हत्याको औचित्य पुष्टि गर्न खोजेको छ । बिनातथ्य लगाइने यस्ता आरोप कुनै पनि विदेशी मुलुकका सैन्य अधिकारीलाई मार्ने कुराको लाइसेन्स बन्न सक्दैन । अमेरिकी राष्ट्रपति ट्रम्पले यसबीचमा आफ्नो पदीय मर्यादा र हैसियतलाई अवमूल्यन गर्ने अनेक कार्य गरेका छन् । इरानी जर्नेलको हत्या गर्ने उनको पछिल्लो आदेश यस पृष्ठभूमिको सबभन्दा सनकपूर्ण युद्धउन्माद हो । यसरी कुनै मुलुकका सैन्य अधिकारीलाई मार्ने अधिकार अमेरिकी राष्ट्रपतिलाई छैन । यो अन्तर्राष्ट्रिय कानुन र मानवअधिकारका आधारभूत मूल्यमान्यताको बिल्कुलै बर्खिलाफ छ । यसले अमेरिकाको लोकतान्त्रिक साख र विश्व नेतृत्वको आधिकारितालाई समेत नराम्रोसँग धुलिसात बनाएको छ । विगतमा अमेरिकी राष्ट्रपतिहरू जर्ज डब्लू बुस वा बराक ओबामाले सुलेमानीका बारेमा सूचना पाएर पनि यसरी हत्याको निर्देशन दिएका थिएनन् भन्ने हालै चुहिएका सूचनाहरूले समेत ट्रम्पको कदम अदूरदर्शी र गलत रहेको देखाउँछ । महाभियोग भोगेका राष्ट्रपति ट्रम्पले आगामी चुनावमा श्वेत राष्ट्रवादी ध्यान अन्यत्र मोड्न यसखाले अतिवादी कदम चालेको हुन सक्ने टिप्पणीहरू यसबीचमा सुनिने गरेका छन् । यद्यपि यस्ता तर्कले सुलेमानी हत्याको औचित्य पुष्टि गर्न सक्दैन, बरु यो बृहत्तर द्वन्द्वको कारक बन्न सक्छ । सन् २०१५ को इरानअमेरिका न्युक्लियर डिलबाट २०१८ मा एकतर्फी रूपमा बाहिरिएर पुनः इरानमाथि नाकाबन्दी लगाउन उद्यत ट्रम्पले त्यहाँ एक स्तरको तनाव बढाइसकेकै थिए । त्यो डिललाई कुनै रूपले पुनर्जीवन दिन सकिन्छ कि भनेर हाल भइरहेका कोसिसलाई सुलेमानीको हत्याले निकै पछाडि धकेलेको मात्र छैन, उनीहरूबीचको तनावलाई टकरावमा परिणत गरिदिएको छ । यसको परिणाम सन् १९७९ मा तेहरानस्थित अमेरिकी दूतावासलाई इरानी आन्दोलनकारीले कब्जामा लिएभन्दा खतरनाक हुन सक्छ । त्यसै पनि सदैव युद्धको विभीषिका व्यहोरेको खाडी क्षेत्रमा अमेरिकी आक्रामकताले आगोमा घिउ थप्ने काम गरेको छ । तर, ट्रम्पको युद्धउन्मादले खाडी क्षेत्रमात्र पिल्सिने छैन, यसखाले अतिवादी क्रियाकलापले अन्ततोगत्वा अमेरिका र अमेरिकी जनजीवनलाई समेत असुरक्षातर्फ धकेल्न सक्छ । भविष्यमा इरान र मुस्लिम समुदायबाट पश्चिमाविरोधी आक्रामकता अरू बढ्न सक्छ । यसको सिकार फेरि पनि सर्वसाधारण हुनेछन् । यस्तो सम्भावित आत्मघाती शृंखलाको जिम्मेवार अरू कोही नभएर राष्ट्रपति ट्रम्प नै हुनेछन् । त्यसैले पनि सुलेमानी हत्या प्रकरणमा उनको र अमेरिकी नीतिको विश्वव्यापी निन्दा अनिवार्य छ ।"
बढी पर्यटक भित्र्याउन,"विश्व प्रसिद्ध फोर्ब्स पत्रिकाले नेपाललाई घुम्नका लागि विश्वकै उत्कृष्ट गन्तव्यस्थल घोषणा गर्दा हामी नेपाल भ्रमण वर्ष२०२० को तयारी गर्दै थियौं । उपयुक्त समयमा भएको पत्रिकाको उक्त ठम्याई हाम्रालागि खुसीको कुरा भयो । यसबीच वर्षको सुरु दिनमै एउटा भव्य समारोह आयोजना गरेर त्यसको उद्घाटन पनि भैसकेको छ । तर नेपाल भ्रमण वर्षको तयारी भने हुनुपर्ने जति भएको छैन । पर्यटकहरू नेपाल आएर जहिले पनि काठमाडौं उपत्यका, पोखरा, लुम्बिनी, जनकपुर, चितवन, मुक्तिनाथ, स्वर्गद्वारी मात्रै घुम्छन् भने यो घोषणाको कुनै अर्थ छैन । हवाइसेवा र सडक यातायातको पहुँच नभएका हाम्रा जंगल, खोलानाला र डाँडाहरू पर्यटकीय महत्त्वका छन् । सांस्कृतिक भ्रमण र प्राकृतिक अध्ययनका पारखी पर्यटकहरूका लागि हवाई र सडक यातायात रोजाइको विषय नहुन पनि सक्छ । त्यसैले त्यस्ता ठाउँहरूसम्म पुग्न डोजरे विकासको सडक होइन, सहज पदयात्रा मार्ग निर्माणको योजना तुरुन्त बनाइहाल्नुपर्यो । त्यस्ता मार्गको ठाउँठाउँमा घामपानीबाट जोगिन आश्रयस्थल होऊन् । खान, बस्नको व्यवस्था होस् । त्यस्ता ठाउँका स्थानीय तहले प्रचारप्रसारका साथ यतिमात्र गरिदिए पनि बढी पर्यटक भित्र्याउन र तिनको बसाइ अवधि लम्ब्याउन सकिने थियो । इन्द्रकुमार श्रेष्ठ, ओखलढुंगा"
यतिसँग सरकार,"पछिल्लो समय तत्कालीन एमाले र अहिले नेकपासँग यति समूहको सम्बन्धमा सरकारले यति समूहलाई दिएको मात्र बाहिर आएको छ । सरकारले त्यसलाई सहज गर्न कानुनदेखि संविधान नै संशोधन गर्नुपरे पनि गर्नसक्ने अब प्रस्ट भइसकेको छ । बाँकी रह्यो, अब सरकार सञ्चालनमा रहेका यी प्रतिनिधिले के कस्तो स्वार्थमा राष्ट्रलाई नै एउटा व्यापारिक संस्थाका अगाडि लम्पसार बनाए ? अब त्यसको खोजी गरिनुपर्छ र व्यावसायिक घरानाभन्दा पनि सरकारमा रहेकाहरूलाई कडा कारबाही गरिनुपर्छ । कारण, व्यावसायिकको चाहना भनेको नाफा कमाउने नै हो, हुन्छ पनि । कतिपय अवस्थामा उसले आफ्नो व्यावसायिक स्वार्थका अगाडि जस्तो सम्झौता पनि गर्न सक्छ । तर राज्यसञ्चालनमा रहेका नेतादेखि मन्त्रीसम्मले सपथ लिएका हुन्छन् आफू र आफ्नो हितभन्दा पनि राष्ट्रिय हितमा काम गर्नेछु भनेर । आज त्यो वाचा कता गयो ? यति सँगको यो सम्झौतामा कसले कति र कसरी खाएका छन् ? कसका नाममा राखेका छन् र कोको यो सरकारी सम्पत्ति दुरुपयोगमा मतियार बनेका छन् ? कारबाही हुनुपर्छ । के आम नागरिकले बलियो भनिएको यो सरकारसँग यस्तै आस गरेका थिए त ? नागरिकका कर र मतको योभन्दा ठूलो दुरुपयोग अरु के हुनसक्छ ? एउटा व्यक्ति वा संस्था सरकारभन्दा बलियो कसले बनायो ? तिनीहरूको खोजीसँगै कारबाही गरिनु जरुरी छ । रामकृष्ण बराल, जोरपाटी२, काठमाडौं"
दरबन्दी मिलान आवश्यक,"शिक्षा, विज्ञान तथा प्रविधि मन्त्रालयले सामुदायिक विद्यालयमा कार्यरत सरकारी अनुदानबाट तलबभत्ता बुझ्ने राहत, अस्थायी करार तथा स्थायी शिक्षकहरूको दरबन्दी मिलानको प्रदेश, जिल्ला र स्थानीय गरी शिक्षकहरूको वर्तमान अवस्था, थपघट हुने तहगत संख्यासहितको तथ्यांक र निर्देशिका गरेको झन्डै एक महिना पुग्न लाग्दासमेत स्थानीय तहले यस सम्बन्धमा तदारुकता देखाएको छैन । देशभरमा प्राथमिक तहमा केही संख्यामा शिक्षकहरू पुलमा देखिए पनि मावि, निमावि र साविक उमाविमा भने उक्त संख्या झन्डै ६० हजार अपुग देखिन्छ । आगामी शैक्षिक सत्रदेखि दरबन्दी मिलानसहितको अपुग शिक्षकको उपस्थितिमा नयाँ शैक्षिक सत्र, नयाँ पाठ्यक्रम र नयाँ कक्षा सुरु गर्ने सरकारको निर्णयलाई हाल दरबन्दी मिलानको काममा देखिएको अन्योलले बाधा सिर्जना गर्ने देखिन्छ । अपुग भएका शिक्षकहरूको स्थायी विज्ञापन शिक्षक सेवा आयोगले गर्ने हो वा स्थानीय तहले करारमा नियुक्ति गर्नेगरी विज्ञापन गर्ने हो, स्पष्ट छैन ।२०४६ पछि अनुमति पाएका सामुदायिक विद्यालयमध्ये केहिले बाहेक पूर्ण दरबन्दी नपाएको अवस्थामा के आगामी शैक्षिक वर्ष२०७७ देखि दरबन्दी पाउलान् त ? सामुदायिक विद्यालयमा जुन तहको पठनपाठन भएको छ, त्यहाँ सोही तहको स्थायी शिक्षक प्राधनाध्यापक हुनुपर्ने शिक्षा ऐनको व्यवस्था विरुद्ध कक्षा १५, १८, ११० र ११२ मा प्राथमिक, राहत, अस्थायी करार आदि कनिष्ठ शिक्षकहरू प्राधनाध्यापक भएको अवस्था छ । यो अस्तव्यस्तता हटाउन पनि दरबन्दी मिलान छिट्टै गर्नुपर्छ । कुसुम न्यौपाने, अरुणखोला, नवलपरासी (पूर्व)"
विद्यार्थी संगठन केका लागि ?,"भोलि राष्ट्रिय राजनीतिमा आउनुपर्ने सबल तथा सक्षम नेतृत्वकर्ता आजका विद्यार्थी नै हुन् । विद्यार्थी संगठनहरूको सोच र दृष्टिकोण स्पष्ट भएन भने राजनीतिले सही दिशा लिन सक्दैन । विभिन्न राजनीतिक दलका आआफ्ना अपुंगे विद्यार्थी संगठनहरू भएकाले तिनीहरूको काम के हो, प्रस्टसँग थाहा छैन । विद्यार्थीहरूले राजनीति गर्नुपर्छ । तर अनावश्य ठाउँमा अनावश्यक तरिकाले राजनीति गर्न होइन । सही कामको समर्थन र खराब कामको विरोध गर्न विद्यार्थी संगठनहरू तयार हुनुपर्छ । विभिन्न कालखण्डमा भएका परिवर्तनका लागि विद्यार्थी संगठनहरूले खेलेको भूमिका अविस्मरणीय छ । त्यसो भन्दैमा विगत हेरेर वर्तमान रमाउनु ठिक होइन । विद्यार्थी संगठन भनेका विद्यार्थीहरूका हकहितका लागि खुलेका संगठनहरू हुन् । तर पछिल्लो समय भने विद्यार्थी संगठनहरू आफ्नै हकहितका लागि दौडिएको हो कि भन्ने भान पर्नथालेको छ । यदि होइन भने विद्यालय तथा कलेजहरूले मनलागी शुल्क लिँदा कुनै पनि विद्यार्थी संगठन किन बोल्दैनन् ? पुरुषोत्तम घिमिरे, जोरपाटी, काठमाडौं"
