शीर्षक,विवरण
असाधारण शिक्षक,"शिक्षक, गुरु, अध्यापक, मास्टर यी सबै पर्यायवाची शब्द हुन् । जसले जहाँ जे भनेर पुकारे पनि यी शब्दधारीहरूले दिने ज्ञान हो । देखाउने सत्मार्ग हो । शिक्षक, गुरु जे भने पनि यो समूह समाजको धरोहर हो । सही सदुपयोग गर्ने हो भने यो समूहसँग देश परिवर्तन गर्ने शक्ति हुन्छ, तर शिक्षकले राजनीति गर्नु हुँदैन । कुमार्गमा हिँडेको समाज या देशलाई मार्गदर्शन भने गर्नुपर्छ । ईसा पूर्वका महान नीतिशास्त्री चाणक्यले शिक्षकको महानतालाई दर्शाउँदै तत्कालीन मगध नरेश धनानन्दलाई भनेका थिए धनानन्द, शिक्षक साधारण हुँदैनन् । प्रलय र निर्माण दुवै शिक्षककै काखमा खेलेको हुन्छ । यसको लगत्तै उनै शिक्षकको कारण धनानन्दको अन्त्य पनि भयो । विद्वान् चाणक्यको नीति अहिले हाम्रो देशमा मेल खाइरहेको छ । विशेषगरी प्रजातन्त्र आएपछि स्वास्थ्य क्षेत्रमा भएको व्यापारीकरण र त्यसमा सुधार गर्न लागिपर्ने डा गोविन्द केसीबीचको यो जुहारी । जब सरकार फेरिन्छ, तब सरकारले आफ्ना कार्यकर्तालाई पोष पुग्ने गरी स्वास्थ्य नीति ल्याउँछ, अनि सुधारका लागि डा केसी अनशन बस्छन् र अन्त्यमा डा केसीको जित हुन्छ । यो जित आवश्यक पनि छ, किनकि देशलाई सत्मार्गमा हिँडाउने र जनहितमा लाग्ने, ज्ञान दिने शिक्षक साधारण हुँदैनन् । यसरी सबै शिक्षक राजनीतिमा नलागी आफ्नो व्यक्तिगत स्वार्थभन्दा माथि भइदिने हो भने देशको मुहार फेरिन पनि बेर लाग्दैन । जनकप्रसाद भण्डारी दोहा, कतार"
समृद्धिका बाधक नीति,"अन्त्यमा, माथि उल्लेख गरिएका चार नीति कार्यान्वयन गरियो भने प्रधानमन्त्रीको समृद्ध र सुखी नेपालको परिकल्पना साकार हुन सक्दैन । सरकारले लिने नीतिगत निर्णयअघि पूर्वअध्ययन अत्यावश्यक ।"
प्रदेशसँगका मतभेद,"यदि संघीय सरकार साँच्चिकै यो संविधानलाई जोगाउन चाहन्छ भने उसले संविधान सुधार आयोग गठन गर्नुपर्छ र निश्चित तालिकाभित्र सहमतिको निर्माण गर्दै संविधान संशोधन गर्नुपर्छ । यसो नभएमा प्रतिपक्षमा रहेका दलहरूले पनि निष्ठापूर्वक र प्रभावकारी रूपमा संविधान संशोधनको मुद्दालाई अगाडि बढाउन सक्नुपर्छ । प्रभावकारी प्रादेशिक अभ्याससँंग जोडिएका सवाललाई अनुमोदन गरेर प्रदेशसभाहरूले पनि संघीय संसद् समक्ष पठाउने कार्यमा ढिलो गर्नु हुँदैन । लोकतन्त्रमा मतभेदलाई निषेध गरिँदैन । त्यसको समुचित व्यवस्थापन गरिन्छ । प्रदेश सभाहरूबाट उठान भएका सरोकारको उपयुक्त व्यवस्थापन गरेर नै प्रतिनिधिसभाले राष्ट्रिय सहमतिको बाटो खोल्न सक्छ । यसले संघीय सरकारको कारणले आफैमा गतिहीन र अन्यमनस्क हुनपुगेको संवैधानिक यात्रालाई लिकमा ल्याउँछ भने अर्कोतिर संविधानप्रति राष्ट्रिय र अन्तर्राष्ट्रिय परिस्थिति अनुकूल र सहानुभूतिशील हँुदै जान्छ । संघीय सरकार चुक्दै गर्दा प्रदेशका मुख्यमन्त्रीहरूको भूमिका प्रादेशिक अभ्यासका पीडा, कठिनाइ र अभावको चिन्ता प्रकटमात्र गर्ने होइन, आपसी संवादबाट संघीय सरकारलाई तत्काल निर्णय लिन रचनात्मक दबाब दिनु पनि हो । यसबाट राष्ट्रिय आकांक्षाको तस्बिरलाई सफा र मुलुकको संवैधानिक गन्तव्यको दिशा तोक्ने काम सम्भव हुनसक्छ ।"
फाइदाजनक एपेन्डिक्स,खरेल धरानस्थित केन्द्रीय प्रविधि क्याम्पसको प्राणीशास्त्र विभागमा कार्यरत छन् ।
घेवा सुधारको पक्षमा,"एक त हामी नेपालीको औसत आम्दानी नै कम छ । त्यसमा कति प्रतिशत नै बचत गर्न सक्छौं र ! जन्मेदेखि मृत्युसम्म विविध संस्कारका नाममा हामी आर्थिक रूपमा दपिटिइरहेका छौं । हुनेखानेलाई यो विषयले खासै नछोला, तर हुदाँ खानेलाई परेको मारको कथा बेग्लै छ । हामी सच्चिएर जानुको विकल्प छैन ।"
कहिले खुल्छ रत्नमन्दिर ?,रत्नमन्दिरको केही पूर्वमा हिमागृह पनि छ । महेन्द्रका माइला भाइ हिमालय वीरविक्रमको नाममा बनाइएको हो । ताल किनारमै अवस्थित हिमागृहको क्षेत्रफल १० रोपनी ४ आना छ । लोकतन्त्रपछिको अन्तरिम संसद्ले पूर्वराजा वीरेन्द्रका नाममा रहेको सम्पत्ति राष्ट्रियकरण गरी ट्रस्ट बनाउने निर्णय गरेअनुसार २०६४ असोज २१ गतेको मन्त्रिपरिषद्ले यी दुवै संरचना सरकार मातहत ल्याएको थियो ।
गाउँमै प्राविधिक शिक्षा,गाउँमै पशुको कृत्रिम गर्भाधान सेवा उपलब्ध गराएका छन् । प्राविधिक शिक्षाको अध्यापन प्रभावकारी भएपछि प्रधानमन्त्री कृषि आधुनिक परियोजनाले मत्स्य जोन विकासअन्तर्गत १० लाख रुपैयाँ अनुदान उपलब्ध गराएको विद्यालय व्यवस्थापन समिति सदस्य नारायणप्रसाद उपाध्यायले बताए ।
छात्रको शंकास्पद मृत्यु,"मोरङ (कास) विराटनगरस्थित नोबेल मेडिकल कलेजमा एमबीबीएस चौथो वर्षमा अध्ययनरत सौरभ उप्रेतीको शंकास्पद मृत्यु भएको छ । बाराको कोलवी८ घर भई विराटनगर४ मा डेरा बस्दै आएका २४ वर्षीय उप्रेती बुधबार बिहान मृत फेला परेको प्रहरी नायब उपरीक्षक घनश्याम श्रेष्ठले बताए । उप्रेतीको घाँटीमा कम्प्युटरको चार्जरको तार बेरिएर मृत्यु भएको देखिएको छ, उनले भने । सुर्खेतको वीरेन्द्रनगर घर भई नोबेलमा सँगै पढ्ने कुबेरसिंह थापा र उप्रेती एउटै कोठामा बस्दै आएका थिए । राति आआफ्नो खाटमा सुतेको तर बिहान उठ्दा उप्रेतीको घाँटीमा तार बेरिएको अवस्थामा देखेपछि तत्काल अस्पताल लगेको थापाले बताउँदै आएको प्रहरी नायब उपरीक्षक श्रेष्ठले बताए ।"
ढिँडो छोडेर स्यान्डविच,"रोमियो एन्ड मुनानिर्देशक : नरेशकुमार केसीकलाकार : विनय श्रेष्ठ, सृष्टि श्रेष्ठ, प्रज्वल सुजल गिरी, सुषमा कार्की, सुरक्षा पन्त"
जीवन बदल्न रंगमञ्च,"सानैमा अनाथ बनेपछि हजुरआमाको सानिन्ध्यमा हुर्किएका मुर पछि गएर लागूऔषधको अम्मली हुँदै हत्यारा बनेका थिए । नाटकमार्फत आफूभित्रको मानवता फिर्ता ल्याउन सकेको भन्दै उनी अचेल खुसी छन् । हामी सबै एकजुट भएर यस्ता अद्भुत कार्यक्रम निर्माण गर्छौं, उनी भन्छन्, यसले हामीलाई हामी अपराधी मात्र होइनौं भन्ने आभास गराउँछ । समाजले हामीलाई जुन नाम दिएको छ हामी त्योभन्दा बेग्लै पनि छौं ।"
सहरमा पिकासो,पिकासोले के सिकाए ? पिकासोको जीवनबाट संघर्षको पाठ सिकेको बताउँछन् रमेश । उनी आफैं पनि कला समीक्षक भएकाले विश्वका चित्रकारको कलाकृति अध्ययन गरिरहन्छन् । उनले कुनै समय पोट्रेट र ल्यान्डस्केप बनाउँदै कलामा संघर्ष गरिरहेका पिकासोले फरक बाटो रोजेपछि मात्रै सफलता हासिल गरेको बताए । उनका अनुसार कलाकार जर्ज ब्राकसँग मिलेर उनले क्युबिजम आधारित पेन्टिङको आन्दोलन नै सुरु गरेको सुनाए ।
गीतकार खरेललाई महानन्द,"काठमाडौं (कास) यस वर्षको महानन्द साहित्य सम्मान कविगीतकार किरण खरेलले प्राप्त गरेका छन् । १२२ औं महानन्द जयन्तीका अवसरमा अन्तर्राष्ट्रिय नेपाली साहित्य समाज (अनेसास) डयालस, टेक्सासद्वारा उपलब्ध ५० हजार रुपैयाँसहितको सम्मान राजधानीमा मंगलबार कवि विप्लव प्रतीक र निबन्धकारपत्रकार दीपक सापकोटाले प्रदान गरे । नेपाली भाषाको श्रीवृद्धिमा विशेष योगदान दिने साहित्यिक व्यक्तित्वहरूलाई सन् २०१२ देखि महानन्द सापकोटा साहित्यिक पुरस्कार गुठीले यो सम्मान दिँदै आएको छ । हालसम्म विप्लव प्रतीक, वसन्त थापा, गोविन्द वर्तमान, किशोर नेपाल र दुर्गालाल श्रेष्ठ सम्मानित भइसकेका छन् ।"
आर्ट काउन्सिलमा उत्कृष्ट तस्बिर,"प्रदर्शनी उद्घाटन समारोहमा फोटो अफ दी इयर विजेता नरेन्द्र श्रेष्ठले आफूले पाएको १ लाख रुपैयाँ पुरस्कारमध्ये ७० हजार रुपैयाँ फुदन सदालाई हस्तान्तरण गरे । फुदन सदा नरेन्द्र श्रेष्ठले तराईमा बाढीका बेला खिचेको मृतक कमल सदाका बुवा हुन् । रकम पाएपछि सदाले भावुक हुँदै ४ कट्ठा जमिन भाडामा लिएर तरकारी खेती गर्ने बताए । १ लाख रुपैयाँमध्ये ३० हजार रुपैयाँ भने नरेन्द्रले दिवंगत पत्रकार यादव थपलियाको परिवारलाई हस्तान्तरण गरे । एक साता जारी रहने प्रदर्शनीमा नेपालका हरेक परिवेश, संस्कृति, समाचार, यर्थाथ र वास्तविकता झल्किने तस्बिरहरू छन् ।"
तीजगीतमा होडबाजी,"बुटवल घर भएका मनोज दर्नालले पनि पर्वहरूको सन्दर्भमा गीत निकाल्दै आएका छन् । केही वर्ष विदेशमा बस्दा उनी गीत सिर्जनामा रमाउँथे । मुलुक फर्केर व्यवसायमा रम्दै आएका उनले पनि रहर पूरा गर्नकै लागि गीत निकाले को बताए । लगानी त के उठ्थ्यो, उनले भने, चेलीहरूका लागि उपहार भनौं न । यसपटक उनले हिलजुत्ता भाँचियो गीत ल्याएका छन्, जसमा देविका घर्तीमगरको पनि स्वर सुन्न सकिन्छ ।"
बेइजिङमा नेपाली खाना,नेपाली खाना बनाउनका लागि नेपालबाट श्रीराम अधिकारी र सुरेशचन्द्र बस्नेत आएका छन् । अधिकारी नेपाली भान्से संघका अध्यक्ष पनि हुन् । महोत्सवमा हरेक शुक्रबार विशेष प्रस्तुति रहनेछ । आगामी शुक्रबार नेपाली थाङा कलाकारहरूले प्रत्यक्ष रूपमा थाङ्का बनाउने कार्यक्रम रहेको छ भने अर्को शुक्रबार नेपाली नृत्य प्रस्तुत गरिनेछ । साथै नेपाली भान्सेद्वयले आगन्तुक पाहुनाहरूलाई प्रत्यक्ष रूपमा नेपाली खाना बनाएर देखाउनेछन् । चीनमा पहिलो पटक आयोजना गरिएको नेपाली खाना महोत्सवलाई नेपाल पर्यटन बोर्ड र बेइजिङस्थित मिन्चु होटलले प्रायोजन गरेका हुन् ।
"बजेट बढ्यो, सडक बनेन","सन्दकपुर गाउँपालिकाले पछिल्लो समय आफ्नो क्षेत्रका केही स्थानमा सोलिङ गरी सहज बनाउने प्रयास गरेको छ । यो सडक केन्द्रीय बजेटमार्फत कालोपत्रे हुनेछ, सन्दकपुर गाउँपालिका प्रमुख उदय राईले भने । तर कालोपत्रे कहिले हुने भन्ने अन्योलमा रहेका स्थानीय तत्कालका लागि भए पनि सम्बन्धित स्थानीय तहले सडकको अवस्था सुधार गर्नुपर्ने बताउँछन् ।"
बजेट अभावमा काम ठप्प,"पाटनको यार्चा र तिब्बतको खाद्यवस्तुले जीवन निर्वाह गर्दै आएको पुलु गाउँका सोनामछिरिङ तामाङले बताए । भौगोलिक विकटता र अन्न उत्पादन न्यून हुने भएकाले तिब्बती बजारको भर पर्नुपरेको छ, उनले भने, तिब्बतमै गएर यार्चालगायत जडीबुटी बिक्री गर्दै आइरहेका छौं ।"
इजरायलबाट फर्केर खेतीमै,"सन् २०१४ देखि वार्षिक औसत ५ सय हाराहारी नेपाली युवायुवती इजरायल जान थालेको बैंक व्यवस्थापनले जनाएको छ । यो अवधिमा पुगेका २ हजार १ सय ६० जनामा पाँच जना भने उतै लुकेर काम गरिरहेको भट्टराईले बताए । सम्पर्कमा रहेका उनीहरूलाई देशको नाम बदनाम नगरी फर्कन भनिरहेका छौं, उनले भने ।"
मोदीलाई पछ्याउँदै खान,"गत सोमबार भारतीय प्रधानमन्त्री मोदी आफैंले खानलाई फोन गरेर चुनावमा हासिल गरेको जितका लागि बधाई दिएका थिए । साथै आगामी दिनमा पाकिस्तानमा लोकतन्त्र थप सुदृढ हुने र पूरै छिमेकमा शान्ति र विकास हेर्न चाहेको बताएको मोदीलाई उद्धृत गर्दै भारतीय विदेश मन्त्रालयले जनाएको थियो । लामो समयदेखि दुई मुलुकका नेतृत्वबीच संवादहीनता रहेको अवस्थामा मोदीको टेलिफोनलाई पनि दुई मुलुकबीचको सम्बन्धको नयाँ सुरुवातका रूपमा लिइएको छ । यसअघि भारत र मोदीको कटु आलोचना गर्दै आएका खानले पनि चुनावलगत्तैको पत्रकार सम्मेलनमा आफू भारतसँग सुखद सम्बन्धको पक्षमा रहेको बताएका थिए । यदि भारतको नेतृत्व एक कदम पाइला सार्छ भने हामी दुई कदम सार्नेछौं, त्यसैले वार्ताका लागि भारतले अग्रसरता लिनुपर्छ, उनले भनेका थिए ।"
