शीर्षक,विवरण
अफवाह फैलाएको आरोपमा अनलाइन सञ्चालक पक्राउ,यिनै हुन् १४ वर्षीया बालिकालाई जबर्जस्ती करणी गरी बलात्कार गरी हत्या गर्ने प्रहरी । सक्दो सेयर गर्नुहोला लेखेर प्रहरीको तस्बिरसहितको सामग्री उक्त अनलाइनमार्फत फैलिएको ब्युरोको निष्कर्ष छ । बलात्कारजस्तो संवेदनशील घटनाबारे अफवाह फैलाएको आरोपमा ब्युरोले बालाजुबाट उनलाई पक्राउ गरेको हो । उक्त अनलाइन प्रेस काउन्सिलमा दर्ता नरहेको ब्युरोले जनाएको छ ।
सुनुवाइ समितिका ६ सदस्यलाई पीएसओ,समितिको सदस्यसमेत रहेकी नेकपाकी सांसद निरु पालले मंगलबार साँझ एक अज्ञात व्यक्तिले आफूलाई धम्क्याएको भन्दै सुरक्षाको माग राखी बुधबार समितिमा निवेदन दिएकी थिइन् ।
बलात्कारपछि बर्बर हत्या,"युवतीको हत्यापछि गाउँमा त्रास छ । मसुरिया दलितबस्तीका महिला पशुचौपाया चराउन जंगल जान छाडेका छन् । बढेका छोरीलाई विद्यालय पठाउन मुस्किल हुन थालेको गाउँले बताउँछन् । किशोरीको परिवारमा धपक्क बलेको दियो त निभ्यो निभ्यो, सिंगै दलितबस्तीले बाटो डोर्याउने छोरी गुमायो, वडा सदस्य अमृता विकले भनिन्, कैद जरिवाना भएर मात्र हुन्न, पीडित परिवारलाई सरकारले क्षतिपूर्तिको व्यवस्था पनि गर्नुपर्ने हो ।"
सुनुवाइ विवाद उस्तै,"पालमाथि भएको आक्रमणको निन्दा समितिले मंगलबार साँझ समिति सदस्य निरुदेवी पालमाथि भएको आक्रमण प्रयासको निन्दा गरेको छ । बैठकमा उनले आफूलाई अज्ञात व्यक्तिले पेस्तोल ताकेर बैठकमा सहभागी नहुने धम्की दिएको बताएकी थिइन् । रेनकोट लगाएका अज्ञात व्यक्तिले आफूलाई त्यस्तो धम्की दिएको भन्दै पालले भरपर्दो सुरक्षाको बन्दोबस्त गर्न समितिमा आग्रह गरेकी थिइन् । तँ भोलि बैठकमा गइस् भने केपी ओलीलाई बा भन्न पनि पाउन्नस् भन्दै धम्की दिए, उनको भनाइ उद्धृत गर्दै स्रोतले भन्यो । बैठकपछि समितिका ज्येष्ठ सदस्य कर्णले घटनाको निन्दा गर्दै संसद् सचिवालयलाई तत्काल समिति सदस्यहरूको सुरक्षा व्यवस्था मिलाउन निर्देशन दिइएको बताए । उहाँको (निरुदेवी पाल) घटना सुनेर दु:ख लाग्यो, उनले भने, अविलम्ब समितिका सदस्यहरूलाई सुरक्षा व्यवस्था मिलाउनुहोस् भनेर बैठकले निर्देशन दिएको छ ।"
प्रवक्ताको राजीनामा,"श्रेष्ठ भने राजीनामा प्रकरण र पार्टीको बैठकमा भएको छलफलका विषयमा मौन छन् । यो विषयमा मेरो कुनै प्रतिक्रिया छैन, पार्टीका बैठकभित्रका कुरा कसरी बाहिर आए ? त्यसबारे मेरो कुनै टिप्पणी छैन, श्रेष्ठले कान्तिपुरसँग भने । स्रोतका अनुसार उनले आवेशमा राजीनामा दिएकाले पार्टीकै जिम्मेवारीमा फर्काउने तयारी छ । केसीको आमरण अनशनको विषय सहमतिमा टुंगिएसकेकाले अब त्यसको तुष बाँकी राखेर हिँड्न नहुने सुझाव नेताहरूले श्रेष्ठलाई दिएका छन् ।"
करार बदले मुद्दा,"कार्यदलले भारतमा जाने कामदारलाई समेत वैदेशिक रोजगारको दायरामा ल्याउन सुझाव दिएको छ । भारतमा जाने कामदारको व्यवस्थापन गर्दै जाने र सामाजिक सुरक्षा कोषमा आबद्ध गर्नेबारे अध्ययन गर्न जरुरी भएको छ, उनले भने, भारतमा जाने कामदारलाई वैदेशिक रोजगारीभित्र नपर्दा लाखौं नेपाली कामदार राज्यबाट पाउने सेवासुविधाबाट वञ्चित छन् । मन्त्री विष्टले वैदेशिक रोजगारको क्षेत्रलाई सुधार गर्न कार्यदलको सुझावलाई निकै महत्त्वपूर्ण दस्तावेजका रूपमा ग्रहण गरेको बताए ।"
बल्ल स्तनपान कक्ष,"जन्मेको तीन दिनभित्र आमाको दूध खाने ५७ प्रतिशत मात्रै छन् । स्वास्थ्य व्यवसायीकै सिफारिसमा ४८ प्रतिशत शिशुले फर्मुला मिल्क खाने गरेका छन् । आमाको दूधलाई प्रतिस्थापन गर्ने यस्ता वस्तुको बिक्री वितरण नियन्त्रण ऐन, २०४९ तथा नियमावली २०५१ अनुसारमा यस्ता वस्तुको प्रवद्र्धन, विज्ञापन गर्न र खुल्ला बेच्न पाइँदैन । अस्पताल हाताभित्र र वरपरका औषधि पसलमा यस्ता वस्तुको बिक्री रोक्न पहल भएको छैन । यसलाई नियन्त्रण गर्न बालस्वास्थ्य महाशाखाले सातै प्रदेशमा जनस्वास्थ्य निरीक्षक परिचालन गर्ने भएको छ ।"
कलाकारिताको आवरणमा मानव तस्करी,"अपराध महाशाखाले पक्राउ गरेका अर्का व्यक्ति हुन्, सुरज काफ्ले । क्यारेबियन समुद्रमा अकाल मृत्युवरण गरेकी सुमित्राका बैनीज्वाइँ हुन सुरज । अमेरिका जाने मोहमा हैटी पुगेकी सुमित्रासँगै रहेका अन्य दुई युवतीले सुदर्शनको निर्देशनमा सुरजको खातामा हैटीबाट पाँच लाख रुपैयाँ डिपोजिट गरिदिएको देखिन्छ । यी सबै प्रतिनिधि उदाहरणबाट सुदर्शनले मानव तस्करीको धन्दा चलाउनका निम्ति धेरै मान्छेलाई एकैचोटि उपयोग गरेको देखिन्छ ।"
चिकित्सकको लापर्बाहीले थपलियाको मृत्यु भएको दाबी गर्दै उजुरी,"काठमाडौं (कास) कान्तिपुर दैनिकका पत्रकार एवं साहित्यकार यादव थपलियाको उपचारमा संलग्न चिकित्सकको लापरबाहीका कारण मृत्यु भएको दाबी गर्दै उनकी पत्नी गंगा खतिवडाले बुधबार छानबिनका लागि काठमाडौं जिल्ला प्रशासन कार्यालयमा उजुरी दिएकी छन् । सामान्य ज्वरो आएर सिनामंगलस्थित काठमाडौं मेडिकल कलेज अस्पताल (केएमसी) मा भर्ना गरेको ४८ घण्टा बित्न नपाउँदै गत असार १५ मा थपलियाको मृत्यु भएको थियो । चिकित्सकले बिरामीको निधनमा हामीलाई जे कारण (भाइरल इन्फ्लुएन्जा) भन्नुभएको थियो, परीक्षणका क्रममा त्यो असत्य सावित भएको छ, भाइरल इन्फ्लुएन्जा नेगेटिभ देखिएको छ, त्यसैले यसको छानबिन गरी दोषीलाई कारबाही गर्न माग गर्छु खतिवडाले निवेदनमा उल्लेख गरेकी छन् । गंगाका अनुसार उपचारमा संलग्न चिकित्सकले सुरुमा थपलियालाई सामान्य ज्वरो (टाइफाइड) भएको बताएका थिए । असार १४ गते बिहान कलेजोमा संक्रमण देखिएको भन्दै चिकित्सकले पूर्ण परीक्षण नगरी उनलाई हाई केएर मा राखेका थिए । बिरामीको निधनपछि अस्पताल प्रशासनले स्वास्थ्य परीक्षणका रिपोर्ट दिन नमान्नुले पनि उपचारमा लापर्बाहीको आशंका बढेको बताएकी छन् ।"
चार वर्षपछि छुटे टीकाराम,"काठमाडौं (कास) साउदी अरबको जिजान जेलमा थुनिएका चितवनका टीकाराम सापकोटा निर्दोष सावित भई बुधबार छुटेका छन् । सापकोटा चार वर्षअघि खैरेनी१३, चितवनका सोमप्रसाद सिलवालको हत्या अभियोगमा पक्राउ परेका थिए । जेद्दास्थित महावाणिज्यदूतको कार्यालयले कानुनी प्रतिरक्षा गरी सापकोटालाई छुटाएको हो । तल्लो अदालतले उनलाई डेढ वर्षअघि नै निर्दोष प्रमाणित गरेको भए पनि जेलबाट निस्कन पाएका थिएनन् । कानुनी प्रक्रिया लम्बिएकाले रिहा हुन समय लागेको कार्यवाहक महावाणिज्यदूत रेवती पौडेलले बताए । सापकोटालाई प्रहरीले कम्पनीको जिम्मा लगाएर पठाएको छ । उनले साउदीमा काम गर्न पाउने पौडेलले बताए । लामो समय तनावमा रहेकाले दुईतीन दिनभित्र नेपाल पठाउने योजना छ, उनले भने । अदालतले प्यूठानका सफी उल्लाहलाई दोषी ठहर गरेको थियो ।"
भारतीय फिल्ड अफिस बन्द,बाढीले सुनसरीमा करिब १३ किलोमिटर खण्ड क्षतिग्रस्त बनेको थियो । सवारीसाधन आउजाउ गर्ने अवस्था थिएन । पूर्वी नेपालबाट पश्चिमी भूभागमा यात्रु तथा औद्योगिक सामान ढुवानी गर्न जोगबनी नाकाबाट छिरेर भारतीय बाटो हुँदै कोसी पार गर्नुपर्ने बाध्यता भयो । त्यसरी जाने सवारीसाधनलाई रुट परमिट दिनेलगायत काम गर्न फिल्ड अफिस राखिएको थियो ।
किसानले पाएनन् राहत,"त्यसैले उनीहरूले गत वर्ष हात्ती आउनुअघि नै हरियै धान काटेर चित्त बुझाए । यसपालि पनि त्यही तयारी गर्दै छन् । निकुञ्ज कार्यालयले बालीनाली, घरपालुवा जनावर, घरगोठ र भण्डार गरिएको अन्नमा क्षति पुगे राहत दिनुपर्ने नियम छ । तर, गत वर्ष बस्तीका कसैले पनि पाएनन् । निकुञ्जका जनावरहरू मध्यवर्ती क्षेत्रमा आएर गर्ने यी चार प्रकारका नोक्सानीमा गत वर्ष एक रुपैयाँ पनि राहत वितरण हुन सकेन, निकुञ्जका सहायक संरक्षण अधिकृत नुरेन्द्र अर्यालले भने । उनका अनुसार यी चार शीर्षकमा ७५ लाख ७७ हजार ५१५ रुपैयाँ राहत दिन बाँकी छ । क्षेत्रीय वन निर्देशनालयबाट रकम नै नआएको अर्यालले बताए । उनका अनुसार १ सय २० वटा घटना भएका छन् ।"
८ सम्बन्धन खारेज,"काठमाडौं (कास) सरकारले विश्वविद्यालयहरूलाई सम्बन्धन दिन रोक लगाएको छ । शिक्षामन्त्री गिरिराजमणि पोखरेलका अनुसार कुनै पनि विश्वविद्यालयले आंगिक र निजी कलेजलाई सम्बन्धन दिन पाउने छैनन् । रामपुरस्थित कृषि तथा वनविज्ञान विश्वविद्यालयले ८ निजी कलेजलाई दिएको सम्बन्धनसमेत बैठकले खारेज गरेको छ । कृषि विश्वविद्यालयले असार २१ गते दिएको सम्बन्धन खारेजीको माग गर्दै प्राध्यापक र विद्यार्थी आन्दोलनमा उत्रिएकाले २० दिनदेखि विश्वविद्यालय ठप्प थियो । विश्वविद्यालयको वर्गीकरण, नक्सांकन र जनशक्ति अध्ययनपछि मात्रै सम्बन्धन दिने पोखरेलले बताए । यसका लागि शिक्षामन्त्रीकै अध्यक्षतामा उच्चस्तरीय राष्ट्रिय शिक्षा आयोग गठन गरी काम थालिएको छ ।"
पूर्वसांसदको निधनमा शोक प्रस्ताव पारित,काठमाडौं (कास) प्रतिनिधिसभा र राष्ट्रिय सभाको बुधबार बसेको अलगअलग बैठक पूर्वसांसद कृष्णकुमार जोशीको निधनमा शोक प्रस्ताव पारित गर्दै स्थगित भएको छ । जोशी २०४८ सालमा नेपाली कांग्रेसबाट बैतडी निर्वाचन क्षेत्र नम्बर १ मा प्रतिनिधिसभा सदस्य निर्वाचित भएका थिए । लोकतान्त्रिक आन्दोलनमा सक्रिय जीवन बिताएका जोशीको ७३ वर्षको उमेरमा मंगलबार बूढानीलकण्ठस्थित निवासमा निधन भएको थियो ।
आदिवासी दिवसमा राजनीतिक सम्मेलन,"काठमाडौं (कास) नेपाल आदिवासी जनजाति महासंघले २४ औं विश्व आदिवासी दिवस (अगस्ट ९) का अवसरमा राजनीतिक सम्मेलन गर्ने भएको छ । महासंघले दुई साताव्यापी थप कार्यक्रमसमेत घोषणा गरेको छ । राजनीतिक सम्मेलनमा महासंघअन्तर्गतका जातीय संस्था, तिनका भ्रातृ संगठन, राजनीतिक दलसम्बद्ध जातीय मोर्चाका प्रतिनिधि सहभागी हुनेछन् । राजनीतिक सम्मेलन उद्घाटन प्रधानमन्त्री केपी ओलीले गर्ने कार्यक्रम छ ।"
तात्न थाले जनप्रतिनिधि,"शिक्षा, स्वास्थ्य, पशुजस्ता महत्त्वपूर्ण विषयगत कार्यालय व्यवस्थित बनाउन नसक्दा कार्यलाई तीव्रता दिन नसकेको जनप्रतिनिधिको गुनासो छ । इन्द्रावती गाउँपालिकाले कृषिअन्तर्गत हरियाली बनाउने अभियान लिएर एक टोलमा एक उत्पादन कामलाई गति दिन थालेको छ । एउटा गाउँमा एउटा तरकारीे खेतीलाई प्रोत्साहन गर्ने कार्यक्रम सुरुवात गरिसकेका छौं, इन्द्रावती गाउँपालिका प्रमुख वंशलाल तामाङले भने । तामाङका अनुसार असहाय बालबालिकालाई अमेरिकी सहयोग ल्याएर छात्रवृत्ति व्यवस्था गरिएको छ । जिल्लाका दुर्गम जुगल, त्रिपुरासुन्दरी, हेलम्बु, बलेफी, पाँचपोखरी थाङपालजस्ताले देखिने कामका लागि बढी अग्रसरता देखाएका छन् ।"
स्वास्थ्य विज्ञान प्रतिष्ठान: प्रदेश सरकारले देखायो चासो,अस्पताल निर्माण ठेक्का पाएका निर्माण व्यवसायी ध्रुव कार्कीले पुराना भवन भत्काई नसकेको कारण निर्माण सुरु नभएको बताए । उनले निर्माणस्थलमा रहेका पुराना भवन र रुख कटान भए तत्काल काम थाल्ने जनाए । मेडिकल सुपरिटेन्डेन्ट दवाडीले स्टोर र कर्मचारी आवासको समस्या भएको कारण तत्काल सञ्चालनमा रहेका संरचना भत्काउन नसकिएको र रुख कटानको स्वीकृति लिने प्रक्रियामा रहेको जानकारी दिए । मुख्यमन्त्री पौडेल र सामाजिक विकास मन्त्री दुलालले तीव्र गतिमा काम गर्न निर्देशन दिएका छन् । पौडेलले प्रतिष्ठानसम्बन्धी विधेयक लगभग तयार भएको भन्दै पैसाको कुनै चिन्ता नगर्न अनुरोध गरे ।
पासाङल्हामु मार्ग अवरुद्ध,"प्रहरी, प्रशासन र विदुनगरपालिकाका पदाधिकारीले पहिरोको अवलोकन गरेका छन् । उक्त सडकमा दैनिक ३ हजारभन्दा बढी सवारी आवतजावत हुने गर्छन् । गल्छीमैलुङ सडक निर्माणको क्रममा भीर काटेर सडक स्तरोन्नति गर्न भीर काटिएको थियो ।"
चित्लाङमा होमस्टे थपिँदै,"मकवानपुरको ऐतिहासिक रूपमा रहेको चित्लाङ प्राचीन सम्पदाले मात्र होइन, कला संस्कृतिले पनि धनी छ । चित्लाङले पर्यटक लोभ्याउन सफल भएकाले पर्यटन बोर्डले उक्त गाउँलाई पर्यटकीय गाउँका रूपमा घोषणा गरेको हो ।"
