शीर्षक,विवरण
"मेक्सिकोमा विमान दुर्घटना, ९७ घाइते","डुराङ्गो, मेक्सिको (एएफपी) उत्तरी मेक्सिकोमा मंगलबार एक यात्रुवाहक विमान दुर्घटना हुँदा ९७ यात्रु घाइते भएका छन् । मुसलधारे वर्षा भइरहेको समयमा डुराङगोबाट मेक्सिको सिटीका लागि उड्न लागेको एयरोमेक्सिकोको कम्पनीको विमान स्थानीय समयअनुसार मंगलबार दिउँसो ३ बजे धावनमार्ग नजिकै दुर्घटना भएको हो । एयरलाइन्सका महानिर्देशक आद्रेस कोनेसाले पत्रकार सम्मेलन गरी विमानमा चालक दलका ४ सदस्य, ८८ पुरुष, नौ केटाकेटी र दुई जना शिशु रहेको जानकारी दिए । दुर्घटनामा सबै व्यक्ति जीवितै रहेको डुराङगोका गभर्नर जोसे रोसासले पुष्टि गरेका छन् । दुर्घटनामा एक पाइलटको मेरुदण्डमा समस्या आएको र एक बालिकाको शरीर जलेर गम्भीर घाइते भएको जनाइएको छ । दुर्घटनापछि ९७ जना उपचारका लागि अस्पताल भर्ना भएका र अधिकांशको अवस्था सामान्य रहेको गृह मन्त्रालयले जनाएको छ । भीषण वर्षाका कारण चालकले आकस्मिक अवतरण गर्न खोजेपछि विमानमा आगलागी भएको थियो ।"
फेसबुकले हटायो २३ शंकास्पद पेज,"सन् २०१६ को राष्ट्रपति चुनावमा रूसी हस्तक्षेपको तुलनामा यी अकाउन्टका निर्माताले आफ्नो परिचय लुकाउन थुप्रै अकाउन्ट बनाएको फेसबुकले जनाएको छ । फेसबुकले आफ्नो ब्लगमा फेसबुकमा १७ र इन्स्टाग्राममा ७ शंकास्पद अकाउन्ट पाइएको जनाएको छ । तीमध्ये एउटा पेजलाई २ लाख ९० हजारभन्दा बढीले फलो गरेका छन् । नक्कली अकाउन्टमा अस्टलान वारियर्स, ब्ल्याक एलिभेसन, माइन्डफुल बिइङ, रेसिस्टर्सजस्ता रहेका छन् ।"
चीनमा गुगलको सेन्सर सर्च इन्जिन,"बेइजिङ (रोयटर्स) गुगलले चीनमा सेन्सर भर्सनको सर्च इन्जिन ल्याउने योजना बनाएको छ । केही निश्चित खालका वेबसाइट र शब्दहरू ब्लक गर्न मिल्ने खालको सर्च इन्जिन ल्याउने बताइएको छ । यसका लागि सन् २०१७ देखि ड्रागनफ्लाई नामको परियोजना जारी रहेको गुगलले जनाएको छ । गुगलका प्रमुख कार्यकारी सुन्दर पिचाई र चिनियाँ सरकारी अधिकारीबीच गत डिसेम्बरमा भएको बैठकपछि परियोजनाले तीव्रता पाएको हो । सर्च इन्जिनमा मानव अधिकार, प्रजातन्त्र, धर्म, शान्तिपूर्ण प्रदर्शनजस्ता शब्द कालोसूचीमा राखिएका छन् । अर्थात् ती शब्द राखेर गुगलमा सर्च गर्न मिल्दैन । कम्पनीले चिनियाँ अधिकारीलाई यसबारे प्रयोगात्मक रूपमै देखाइसकेको इन्टरसेप्टको रिपोर्टमा उल्लेख गरिएको छ । अन्तिम भर्सन आगामी ६ देखि ९ महिनासम्ममा सुरु गर्ने योजना रहेको र यसलाई सरकारले अन्तिम स्वीकृति दिन बाँकी रहेको जनाइएको छ । गुगलले भने इन्टरसेप्टको रिपोर्टका बारेमा प्रतिक्रिया जनाउन अस्वीकार गरेको छ ।"
थपन विक हत्या प्रकरण,जिल्ला अदालत महोत्तरीले २०७२ फागुन २७ गते विक हत्याका आरोपीलाई पक्राउ गर्न आदेश दिए पनि प्रहरीले फेला नपरेको जनाउँदै आएको छ । विककी श्रीमती गहतराजले महोत्तरी प्रहरीमा धेरैपटक आग्रह गर्दा पनि पक्राउ नगरेपछि उच्च अदालत गुहारेकी थिइन् । उच्च अदालतले महोत्तरी प्रहरीको नाममा कारण देखाउ आदेश जारी गरेको थियो । महोत्तरी प्रहरीका एसपी कुवेर कडायतले उच्च अदालतलाई लेखेको जवाफमा रिट निवेदन खारेजीको माग गरेका थिए । आरोपी भने मधेस आन्दोलनका क्रममा राजनीतिक आस्थाका आधारमा झुटो मुद्दा लगाइएको भन्दै फिर्ता हुनुपर्ने अडानमा छन् ।
नि:शुल्क औषधि सधैं अभाव,"चीनसँग सीमा जोडिएको नाम्खा गाउँपालिकास्थित स्वास्थ्यचौकीमा लामो समयदेखि औषधि अभाव छ । सरकारी विवरणमा स्वास्थ्यचौकी भए पनि स्वास्थ्यकर्मी कहिल्यै नपुग्ने लिमी तिलका छेवाङदोर्जे लामाले बताए । स्वास्थ्यकर्मी कहिल्यै जाँदैननन्, औषधि कसरी पुग्नु ? उनले भने, उपचार अभावमा स्थानीयले अकालमा ज्यान गुमाउँदै आएका छन् ।"
आमासँगै कारागार,"मानव बेचबिखनमा परेकी कालिमाटी गाउँपालिका७ की विकले १० महिने बालकलाई कुनै निकायले पालनपोषण गरे पठाउन सकिने बताएकी छन् । चार वर्षीया काजललाई कुनै बालगृहमा पठाउनेबारे सल्लाह भइरहेको जेलर केसीले बताए । बुढाथोकीले घरमा कोही नभउकाले चार वर्षकी छोरीलाई बाल केन्द्रमा पठाउन सकिने बताएकी छन् । जेलर केसीका अनुसार बालबालिका कारागारमा बस्दा विभिन्न आधारभूत आवश्यकताबाट वञ्चित हुँदै आइरहेका छन् । उनीहरूको पालनपोषणका लागि कसैले सहयोग गरे बालबालिकाले समयमै शिक्षा, स्वास्थ्य, मनोरञ्जन लगायतका सुविधा पाउने उनको भनाइ छ ।"
२०० वर्ष पुरानो पौवा जस्ताको तस्तै,"नगरप्रमुख भण्डारीले नगर क्षेत्रभित्र अवस्थित विभिन्न ऐतिहासिक सम्पदाको संरक्षणलाई प्राथमिकतामा राखेको बताए । उनका अनुसार कीर्तिखम्बको संरक्षणका लागि दामुकीर्तिपार्क निर्माण, नेपाली भाषाको सबैभन्दा पुरानो शिलालेखको संरक्षणका लागि तारबार गर्नुका साथै घामपानीबाट जोगाउन जस्तापाताले छाइएको छ ।"
दुवै देशको हितलाई सम्बोधन गर्ने,नेपालले दुई महिनादेखि कामदार पठाउन रोकेपछि मलेसियामा कामदारको अभाव हुन थालेको छ । नेपाल मलेसियामा श्रमिक आपूर्ति गर्ने दोस्रो ठूलो मुलुक हो । गत महिना सार्वजनिक भएको सरकारी तथ्यांकअनुसार यहाँ कानुनी हैसियतमा ३ लाख ७८ हजार ५ सय ७७ नेपाली कार्यरत छन् । तीमध्ये २४ हजार ४ सय २८ जना सुरक्षा गार्डको काम गर्छन् । कामदार अभावको सबैभन्दा बढी मार पनि यहाँको सुरक्षा क्षेत्रमै परेको छ ।
साना गाडीको आयात दोब्बर,वीरगन्जकै अर्को भन्सार वीरगन्ज भन्सार नाकाबाट मुलुकमै सर्वाधिक बढी सवारी साधन आयात हुन्छन् । यो भन्सारले संकलन गर्ने राजस्वमा सवारी साधनको योगदान सबैभन्दा बढी हुने गरेको छ ।
परीक्षण उडानमै सीमित विमानस्थल,"सरकारले इन्धन अनुदानमा वितरण गरेर निजी हवाई कम्पनीलाई प्रदेशभित्र उडान गर्न पठाउनुपर्ने रारा पर्यटन विकास समितिका अध्यक्ष देवीकृष्ण रोकायाले बताए । कर्णाली प्रदेश सरकारले कर्णालीरारा पर्यटन वर्ष घोषणा गरे पनि पर्यटक भित्र्याउन कुनै पहल नगरेको उनको भनाइ छ । रारामा एकै दिनमा एक सय पर्यटक जान खोज्दा प्लेन हुँदैन, सडकको अवस्था जोखिमपूर्ण छ, उनले भने, अनि कसरी जान्छन् रारामा पर्यटक ? उनले आन्तरिक हवाई सेवा सुरु गरेर रारालगायतका क्षेत्रमा प्याकेजमार्फत पर्यटक भित्र्याउनुपर्ने बताए ।"
१ सय १७ स्थानीय तह अझै बैंकविहीन,बैंकहरूलाई स्थानीय निकायमा शाखा खोल्न प्रोत्साहन गर्न राष्ट्र बैंकले सम्बन्धित बैंकलाई सरकारी कारोबारलगायत विशेष सुविधा दिएको छ ।
विराटनगर जुट मिलमा विवाद,नेपालले बनको मिल्समा १ थान पनि सेयर नभएकाले सञ्चालक समितिमा बस्न नमिल्ने दाबी गर्दै आएका छन् ।
तामाकोसीको सेयर वितरण,कार्यक्रममा नेपाल विद्युत् प्राधिकरणका कार्यकारी निर्देशक कुलमान घिसिङले रसुवा जिल्लाबासीका लागि सेयर बाँडफाँट गर्दा बिचौलियाको चलखेल बढेकाले दोलखामा त्यस्तो नहोस् भनेर सचेत गराए । उनले जनतालाई सचेत र सहयोग गर्ने कार्यमा जनप्रतिनिधिहरू नै अग्रसर हुनुपर्नेमा जोड दिए ।
सुपारी र रबर जोन घोषणा मात्रै,"जिल्लामा करिब एक हजार हेक्टर क्षेत्रफलमा रबरको व्यावसायिक खेती हुने गरेको छ । जिल्लामा सामुदायिक वन र सहकारी गरी १०, केही कम्पनी र करिब ३ सय साना किसानले व्यावसायिक रूपमा रबर खेती गर्दै आएका छन् । जिल्लामा उत्पादित रबर स्थानीय बजारमै खपत हुँदै आएको छ ।"
धमाधम वैदेशिक प्रशिक्षणमा,"१२ आंै साग खेलकुदमा ट्रायथलनले दुई पदक जितेको थियो । मिक्स रिले टिममा रजत जितेको नेपाललाई रोजा केसीले व्यक्तिगत इभेन्टमा कांस्य दिलाएकी थिइन् । अगस्ट ३१ देखि सेप्टेम्बर २ सम्म पालेम्वाङमा हुने ट्रायथलनमा नेपालले मिक्स टिम रिलेमै प्रतिस्पर्धा गर्नेछ । नेपालको खेल सेप्टेम्बर २ मा हुनेछ । ३०० मिटर पौडी, ६३ किमि साइक्लिङ र २१ किमि दौडमा प्रतिस्पर्धा हुनेछ । नेपाली टोली फुकेटबाट अगस्ट २९ मा पालेम्वाङ जानेछ ।"
नवयुवा सेमिफाइनलमा,भैरहवा (कास) नवयुवा खेलकुद तथा सांस्कृतिक परिवार ठुटिपिपल रूपन्देहीको कोटिहवामा जारी १८ औं लिस्नु कप फुटबलको सेमिफाइनल पुगेको छ । पशुपति माविको मैदानमा बुधबार प्रतिस्पर्धात्मक खेलमा नवयुवाले वालिङ नगरपालिका स्याङजालाई सडनडेथका पाखा लगाउँदै अन्तिम चारको यात्रा गरेको हो । सडनडेथमा वालिङका विदेशी खेलाडी सोलोको पेनाल्टी प्रहार बाहिरिएसँगै नवयुवाका सोयल रानाको पेनाल्टी गोलमा परिणत भएको थियो । यसअघि निर्धारित समयमा दुवैले ११ गोलको बराबरी खेलेका थिए भने टाइब्रेरकरमा पनि दुवैले ३३ गोल गरेका थिए । खेलमा नवयुवाका सोयल राना म्यान अफ द म्याच भए ।
आयोजक ए च्याम्पियन,काठमाडौं (कास) आयोजक ब्राइट फ्युचर स्कुल ए टिमले बुधबार उपत्यकाव्यापी गल्र्स फुटसल प्रतियोगिताको उपाधि जितेको छ । कलंकीस्थित आदर्श फुटसलमा आयोजक ए ले सेन्ट जेभियर्सलाई पेनाल्टी सुटआउटमा हराएको थियो । निर्धारित समय गोलरहित बराबरीमा सकिएको थियो । ब्राइट फ्युचरकै सी टिम तेस्रो भयो । मंगलदीप स्कुलले वाकओभर दिएको थियो ।
रुटको कप्तानी इनिङ्स,बर्मिङघम (एजेन्सी) कप्तान जो रुटको ८० र जोनी बरिस्टोको ७० रनको मदतमा इंग्ल्यान्डले भारतविरुद्ध पहिलो टेस्टको पहिलो दिन गतिलो स्कोर बनाएको छ । इंग्ल्यान्डले पछिल्लो स्थितिमा ७ विकेट गुमाई २ सय ७० रन बनाएको थियो ।
यात्रा थालनी,नेपाली समर्थक
रग्बी सेभेन्सको आशा,नेपाल रग्बी संघका अध्यक्ष टंकलाल घिसिङका अनुसार नेपाली महिला टिमले पनि एसिया रग्बी सेभेन्स ट्रफीमा प्रतिस्पर्धा गर्नेछ । ब्रुनाईमा अक्टोबर २२ र २३ मा हुने महिलाको प्रतियोगितालाई नेपाली टोलीको बन्द प्रशिक्षण भइरहेको उनले बताए ।
माउरिन्होलाई अन्त्यमा खुसी,"त्यो स्पिरिट हामीलाई आवश्यक थियो किनभने हामीलाई प्रिमियर लिगका सुरुका दुई वा तीन साता वास्तवमै कठिन हुनेछ । त्यसका लागि हामीले तयारी गरेका छैनौं, मोउरिन्होले बताए । यी पोर्चुगिज व्यवस्थापकसँग विश्वकपपछि भ्रमण र रमाइलोमा रहेका १२ खेलाडी थिएनन् । युनाइटेडले ६४,१४१ दर्शकसामु मियामीको हार्डरक रंगशालामा रियल म्याड्रिडविरुद्ध खेल सुरु गरेर प्रिसिजनको तयारी पूरा गर्यो । स्पेनी ला लिगा इंग्ल्यान्डको प्रिमियर लिगभन्दा एक साता पछाडि सुरु हुनेछ । रियलका नयाँ व्यवस्थापक जुलेन लोपेटेगुईले गारेथ बेललाई पहिलो रोजाइमा खेलाए भने जर्मन स्टार टोनी क्रुजलाई बेन्चमा राखेका थिए ।"
