शीर्षक,विवरण
महिला सांसद नियमित,"नेकपाको ११५ सांसदको हाजिर ७५ प्रतिशत नेकपाका १ सय ७४ सांसदमध्ये १ सय १५ जनाको हाजिरी ७५ प्रतिशतभन्दा बढी छ । डडेलधुराकी जैरुपछि महिलातर्फ काठमाडौंकी मायादेवी न्यौपाने ८१, अन्तर्राष्ट्रिय सम्बन्ध समितिकी सभापति पवित्रा निरौला, कैलालीकी लक्ष्मीकुमारी चौधरी र काठमाडौंकी बिनाकुमारी श्रेष्ठ ८० दिन उपस्थित भएका छन् । पुरुषतर्फ महर्जन, सिंह र बुढाक्षेत्रीपछि धादिङका खेमप्रसाद लोहनी, दार्चुलाका गणेशसिंह ठगुन्ना, कालिकोटका दुर्गबहादुर रावत ८१ दिन उपस्थित छन् । नेकपाका प्रमुख सचेतक देवप्रसाद गुरुङ, सुर्खेतका ध्रुवकुमार शाही, नवराज रावत, ललितपुरका नवराज सिलवाल, तेह्रथुमका विजय सुब्बा, दैलेखका रवीन्द्रराज शर्मा, बाजुराका लालबहादुर थापाको ८० दिन हाजिर छ । १५ जनाको हाजिरी ५० प्रतिशत पनि छैन । तिनमा १३ जना मन्त्री छन् । अध्यक्ष दाहाल र शिवकुमार मण्डल ४१ दिनभन्दा कम उपस्थित छन् । राजपाका १७ सांसदमध्ये ७५ प्रतिशत हाजिरी कटाउने ९ जना मात्र छन् । निर्जला राउतको उपस्थिति सबैभन्दा न्यून ३९ दिन छ । अमृतादेवी अग्रहरी सबैभन्दा बढी ७७ दिन हाजिर छिन् । संघीय समाजवादी फोरमका १६ सांसदमध्ये अध्यक्ष उपेन्द्र यादव २७, मोहम्मद इस्तियाक राई ३५, रेणुकुमारी यादव ३२ र सूर्यनारायण यादव १० दिनमात्रै बैठकमा गएका छन् । ७५ प्रतिशत हाजिरी कटाउने सात जना मात्र छन् । पार्टीका प्रमुख सचेतक उमाशंकर अरगरिया सबैभन्दा बढी ८१ दिन उपस्थित भएका छन् । महिलातर्फ सबैभन्दा बढी कालुदेवी विश्वकर्मा ७७ दिन हाजिर छिन् । पूर्वप्रधानमन्त्री एवं नयाँ शक्ति नेपालका संयोजक बाबुराम भट्टराई ४७ दिन मात्रै उपस्थित छन् । नेपाल मजदुर किसान पार्टीका प्रेम सुवाल ७२, राप्रपाका राजेन्द्र लिङदेन ६८, जनमोर्चाकी दुर्गा पौडेल ६२ दिन, स्वतन्त्र सांसद छक्कबहादुर लामा ७६ दिन उपस्थित भएका छन् । मन्त्री अधिकांशमा गयल बैठकमा मन्त्रीहरूकै हाजिरी दर कमजोर छ । उनीहरू आधाभन्दा बढी बैठकमा अनुपस्थित देखिएका छन् । प्रधानमन्त्री केपी ओली २६ दिन मात्र उपस्थित छन् । उनीसहित १३ मन्त्री र १ राज्यमन्त्री ४१ दिन पनि बैठक पुगेनन् । थममाया थापा ४०, रघुवीर महासेठ ३८, रवीन्द्र अधिकारी ३८, वर्षमान पुन ३७, मोहम्मद इस्तियाक राई ३५, चक्रपाणि खनाल, जगतबहादुर सुनार ३४, गोकुल बाँस्कोटा र मातृका यादव ३३, बिना मगर २९, उपेन्द्र यादव २७, शक्ति बस्नेत २६ र गोकर्ण विष्ट २४ दिन मात्रै उपस्थित भए । राज्यमन्त्री धनबहादुर बुढा ३५ वटा बैठकमा मात्र पुगे । मन्त्रीमध्ये भानुभक्त ढकाल सबैभन्दा बढी ७० वटा बैठकमा उपस्थित भए । शेरबहादुर तामाङ हटेपछि उनी कानुनमन्त्री भएका हुन् । उपप्रधानमन्त्री ईश्वर पोखरेल ५७, पद्मा अर्याल ५४, लालबाबु पण्डित ५३, प्रदीप ज्ञवाली ४७, गिरिराजमणि पोखरेल ४६, राज्यमन्त्रीहरू सुरेन्द्रकुमार यादव ४६ र रामकुमारी चौधरी ४५ दिन उपस्थित भए । राष्ट्रिय सभामा बढीराष्ट्रिय सभाको हाजिरी प्रतिनिधिसभामा भन्दा राम्रो पाइएको छ । ५९ सदस्यमध्ये ५४ जनाको हाजिरी ७५ प्रतिशत कटेको छ । फागुन २१ मा सुरु राष्ट्रिय सभाको दोस्रो अधिवेशन असोज ११ सम्मै चलेको थियो । कुल ६३ दिन बैठक बस्यो । ७५ प्रतिशत हाजिर पुग्न ४७ दिन उपस्थित हुनुपर्छ । त्यति पनि हाजिर नहुनेमा गृह, अर्थमन्त्री र अन्य तीन सांसद छन् । गृहमन्त्री रामबहादुर थापाको सबैभन्दा कम २७ दिन हाजिरी छ । त्यस्तै अर्थमन्त्री युवराज खतिवडाको ४२, नेकपाका सांसद चन्द्रबहादुर खडकाको ४३, कांग्रेसका दुर्गाप्रसाद उपाध्याय र संघीय समाजवादी फोरमका रामपृत पासवानको ४० दिन मात्र छ । नेकपाका उदया शर्मा पौडेल, खिमकुमार विक, परशुराम मेघी गुरुङ र मनोनीत रामनारायण बिडारीले एकै दिन बैठक छुटाएनन् । हाजिर गर्दै भाग्दै प्रतिनिधिसभामा अधिकांश सांसद हाजिर गर्दै बैठकबाट बाहिरिने गरेका छन् । संसद्मा महत्त्वपूर्ण विषयमा छलफल हुँदासमेत उनीहरू देखिँदैनन् । नेमकिपाका सांसद प्रेम सुवालले गणपूरक संख्या नपुगेको भन्दै बारम्बार आवाज उठाउने गरेका छन् । कतिपय सांसद बैठक सुरु हुनुअघि नै हाजिर गरेर बाहिरिन्छन् त कोही बैठक सकिएपछि हाजिर गर्न मात्र आउँछन् । केही माननीय त दुईचार दिनपछि आएर अस्तिको हाजिर गर्नु थियो भन्छन्, संसद् सचिवालयका एक कर्मचारी भने, जबर्जस्ती हाजिर गरेर जान्छन् । बैठकमा उपस्थित भएबापत सांसदलाई दुई हजार भत्ता दिइँदै आएको छ ।"
मुख्यमन्त्री राई सुटुक्क अमेरिका,"संघीय संरचना भएका देशमा प्रदेशको मुख्यमन्त्री तथा मन्त्री विदेश जानुअघि अनिवार्य रूपमा संघीय मन्त्रिपरिषदको अनुमति लिएरै जानुपर्ने नियम हुन्छ, पूर्वराजदूत तथा परराष्ट्रमन्त्री भेषबहादुर थापाले भने, गिरिजाप्रसाद कोइरालाको निधनमा श्रद्धाञ्जली व्यक्त गर्न बिहारका मुख्यमन्त्री नीतिशकुमार काठमाडौं आउन खोज्दा भारतको केन्द्रीय सरकारले अनुमति दिएको थिएन । हामीले छिमेकमा भइरहेको संघीय अभ्यासलाई मात्रै हेरे पनि पुग्छ ।सरकारले आफूसँग नसोधी थाइल्यान्ड जान लागेको भन्दै केही समयअघि पूर्व बाल लडाकु लेनिन विष्टलाई विमानस्थलबाटै रोकेको थियो । संस्कृत विश्वविद्यालयका उपकुलपति कुलप्रसाद कोइराला पनि विमानस्थलबाटै फर्काइएका थिए । राईलाई भने मन्त्रिपरिषदको निर्णयबिना नै अमेरिका जाने सुविधा मिलेकामा कूटनीतिज्ञहरूले सरकारको व्यवहारमा एकरूपता नझल्किएको टिप्पणी गरेका छन् । आफूसँग मन मिल्नेसँग एउटा र नमिल्नेसँग अर्काे व्यवहार गर्दा सरकारको स्वच्छता र निष्पक्षतामा प्रश्न उठ्ने धारणा परराष्ट्र मामिलाका जानकारहरूको छ । संघीय संरचनाअनुसार विदेश जाँदा केकस्तो प्रक्रिया अवलम्बन गर्ने भन्ने प्रस्ट नीति सरकारले बनाएर त्यसैअनुसार व्यवहार गर्दा समस्या आउँदैन, थापाले भने, राज्य सञ्चालनमा आवश्यक नीतिनियम नबनाउँदा सरकारको काममा परिपक्वता झल्किँदैन ।राज्य सञ्चालन प्रक्रियामा अनुशासनहीनता हुन दिन पनि यस्तो नीतिको निर्माण र पालना अनिवार्य रूपले हुनुपर्ने उनले बताए । विदेश भ्रमण गर्दा स्वीकृति लिनुपर्ने ठाउँबाट लिनुपर्छ, थापाले थपे, अनुशासन भनेको कर्मचारीले मात्रै पालना गर्ने होइन ।प्रदेश १ का प्रवक्ता हिक्मत कार्कीले राईको भ्रमण कानुनसम्मत भएको दाबी गरे । उहाँ उपचारका लागि थाइल्यान्ड जानुभएको हो र अमेरिकाचाहिँ निजी भ्रमणमा, उनले भने, जानुअघि नै उहाँले यसबारे कात्तिक पहिलो साता प्रदेश मन्त्रिपरिषद्मा प्रस्ताव राख्नुभएको थियो र प्रदेश सरकारबाट अनुमति पनि मिलिसकेको छ ।यही व्यहोराका साथ प्रदेश कार्यालय संघीय मन्त्रिपरिषद्लाई पत्र लेखेकाले संघ सरकारबाट अवश्य पनि स्वीकृति मिलेको होला भन्ने आफूलाई लागेको उनले बताए । तर, संघीय मन्त्रिपरिषद्ले यसबारे कुनै निर्णय गरेको छैन । यो उहाँको निजी भ्रमण हो र निजी भ्रमणमा संघले अनुमति दिइरहनुपर्दैन, प्रधानमन्त्री तथा मन्त्रिपरिषद् कार्यालयस्थित प्रदेश समन्वय शाखाका प्रमुख लक्ष्मण मैनालीले भने । राईले प्रधानमन्त्री कार्यालयमा निजी भ्रमण भने पनि अमेरिकामा उनले मुख्यमन्त्रीकै हैसियतमा त्यहाँस्थित नेपाली समुदायबाट सम्मान ग्रहण गरेका छन् । उनलाई आदिवासी जनजाति महासंघ अमेरिकाले ज्याक्सन हाइटमा बुधबार साँझ सार्वजनिक सम्मान गरेको थियो । उक्त महासंघले प्रधानमन्त्री केपी ओली राष्ट्रसंघीय महासभामा भाग लिन अमेरिका पुगेका बेला भने कालो झन्डा देखाएर विरोध प्रदर्शन गरेको थियो । पत्रकार राईमाथि कुटपिटन्युयोर्क (कास) प्रदेश नं १ का मुख्यमन्त्री राईको विषयमा समाचार लेखेकामा पत्रकार लोकमणि राईमाथि कुटपिट गरिएको छ । शुक्रबार राति एउटा कार्यक्रमस्थल बाहिर उमेश राईले पत्रकार राईलाई कुटपिट गरेका हुन् । स्थानीय उडसाइटमा तिहार कार्यक्रम चल्दै थियो । एक परिचित आएर पत्रकार राई एक छिन बाहिर जाऊँ न भन्दै कार्यक्रमस्थल बाहिर लिएर गएका थिए । त्यही मौकामा उमेश राईले अपशब्द प्रयोग गर्दै मुख्यमन्त्रीका विषयमा जे पायो त्यही लेख्ने पत्रकार तैं होस् भन्दै पत्रकार राईको अनुहारमा मुक्का हानेका थिए । घाइते राईलाई लगत्तै एम्बुलेन्समार्फत स्थानीय एलमहस्र्ट हस्पिटलको इमर्जेन्सीमा भर्ना गरिएको थियो । ६ घण्टापछि राई डिस्चार्ज भएका छन् ।कान्तिपुरसँग कुरा गर्दै पत्रकार राईले भने, कुटपिट गरिएको मेडिकल परीक्षणको प्रमाणसहित प्रहरीमा उजुरी गरेको छु । दोषीमाथि कारबाही हुनुपर्छ । अमेरिकामा हातपातको घटनालाई गम्भीर मानिन्छ र सोहीअनुरूप कानुनी दण्डको व्यवस्था छ । प्रहरीमा उजुरी र कानुनी प्रक्रियामा गएपछि पत्रकार राईमाथि मुख्यमन्त्री राईका सहयोगीले विवादलाई सामसुम पार्न र मिल्नुपर्छ भन्दै अहिले दबाब दिइएको छ । कुटपिट गर्ने र समुदायका केही मानिसहरू मिल्नुपर्छ भन्दै ममाथि दबाब दिइरहेका छन् । मलाई एकदमै तनाव भइरहेको छ, लोकमणिले भने । राईमाथिको कुटपिट घटनाको सर्वत्र विरोध गरिएको छ । अमेरिकामा रहेका नेपाली पत्रकारहरूको संस्था नेजा र इन्जाले घटनाको भत्र्सना गरेका छन् । नेजाका महासचिव किरण मरहठ्ठाले कान्तिपुरसँगको कुराकानीमा समाचारको विषयलाई लिएर अमेरिकामा पत्रकार कुटिनु गम्भीर एवं निन्दनीय भएको बताए । स्थानीय बीआरटी डमकम नामक न्युज पोर्टलमा पत्रकार राईले मुख्यमन्त्री राई थाइल्यान्डबाट अमेरिका आएको र विवादास्पद केही संस्था एवं व्यक्तिले अमेरिकामा स्वागत कार्यक्रम गरेको समाचार लेखेका थिए । मुख्यमन्त्री राईको स्वागतमा एक विवादास्पद संस्थाका प्रमुखसमेत सरिक भएको समाचारमा उल्लेख थियो । समाचारमा राष्ट्रसंघको महासभाका क्रममा प्रधानमन्त्री केपी ओलीको विरोधको प्रसंग उल्लेख गर्दै तिनै विरोधीहरू अहिले मुख्यमन्त्री राईको स्वागतमा लागिपरेकोलाई दोहोरो मापदण्डको संज्ञा दिइएको थियो । उपचार गर्न थाइल्यान्ड आएका मुख्यमन्त्री राई मंगलबार अमेरिका आएका थिए ।"
