शीर्षक,विवरण
अनुगमनमा सांसदको अवरोध,"कैफियत भेटिएको तेल उद्योगमा सिलबन्दी गर्दा अवरोध भएको जानकारी पाएको छु । उद्योगको सञ्चालक सांसद भन्ने सुनेको छु, मन्त्री मण्डलले कान्तिपुरसित भने, सांसद भए पनि केही फरक पर्दैन । मन्त्री भए पनि छाडदिनँ, सांसदको कुरै छाडौं । उनले कानुनी सल्लाहकारसँग परामर्श गरेर थप प्रक्रिया अघि बढाइने बताए । मन्त्रालयको निर्देशनमा केही साताअघि आपूर्ति व्यवस्थापन तथा उपभोक्ता हित संरक्षण विभागले विभिन्न खाने तेलको नमुना संकलन गरी परीक्षण गरेको थियो । विभागका शाखा अधिकृत दीपकराज पोखरेलका अनुसार नमुना परीक्षणका लागि खाद्य प्रविधि तथा गुण नियन्त्रण विभागमा पठाइएको थियो । त्यसक्रममा उक्त उद्योगको फेमिली ब्रान्डको तेलमा मापदण्डभन्दा बढी प्याराअक्साइड भ्यालु भेटिएको उनले बताए । खाद्यले पठाएको परीक्षण प्रतिवेदनमा फेमिली तोरी तेलको प्याराअक्साइड भ्यालु १० भन्दा तल हुनुपर्नेमा ११५३ रहेको फेला परेको छ, पोखरेलले भने, सोही प्रतिवेदन र प्रमाणका आधारमा अनुगमन भएको छ । मापदण्डभन्दा बढी भए स्वाथ्यमा असर गर्ने विभागका कर्मचारीहरू बताउँछन् । अनुगमनमा सहभागी मूल्य विश्लेषण शाखाका तथ्यांक अधिकृत मोहनकुमार पुडासैनीले उद्योगमा सिलबन्दी गर्न खोज्दा खुला स्थान भएकाले पूरै सिलबन्दी गर्न नसकिएको बताए । उत्पादन र कारोबार रोक्का गर्न निर्देशन दिएको उनले बताए । तर, उद्योगका कर्मचारीले मुचुल्कामा हस्ताक्षर गर्न अस्वीकार गरेको पुडासैनीले बताए । त्यसपश्चात् उद्योगका सञ्चालक अग्रवाल आएर मेरो उद्योग हो, हस्ताक्षर गर्दिनँ भन्दै प्रतिवाद गरेको पुडासैनीले बताए । कारोबार रोक्काका लागि फारम भर्यो, मुचुल्का उठायो । विभाग, इलाका प्रहरी कार्यालयको डीएसपी र जिल्ला प्रशासनका प्रतिनिधिको मुचुल्कामा हस्ताक्षर भयो, उनले भने, अग्रवालले हस्ताक्षर गरी उद्योग बन्द गर्दिनँ । थुनामा लाने भए लग्नुस् भनेका थिए । सञ्चालकले पत्र बुझ्न अस्वीकार गरेपछि अनुगमन टोलीले मुचुल्काको फोटोकपी उद्योगको गेटमा टाँसेर फर्केको पुडासैनीले बताए । उद्योगका सञ्चालक एवं सांसद अग्रवालले कारखाना नै बन्द गर्ने अधिकार कानुनमा नभएको बताए । अनुगमन टोलीलाई अवरोध नगरेको उनले दाबी गरे । खाद्य ऐन, उपभोक्ता संरक्षण ऐनमा उद्योग बन्द गर्न पाइँदैन । कुन कानुनअनुसार सिलबन्दी गर्दै हुनुहुन्छ भन्दा टोलीबाट जवाफ आएन, उनले भने । उनका अनुसार उद्योगले ५ महिनाअघि परीक्षण गर्दा प्याराअक्साइट भ्यालु ४३६ थियो । हाल सोही ब्याचको परीक्षण गर्दा ११ निस्केको आपूर्तिको दाबी छ । खाद्य सामग्री भएकाले उद्योगबाट खुद्रामा गएपछि त्यसको जिम्मेवारी लिन नसकिने अग्रवालले बताए । तेलको प्याकेटमा कुल एन्ड ड्राई प्यालेस भनेर तोकिएको स्थानमा भण्डारण गर्नुपर्ने भन्ने उल्लेख हुन्छ । उद्योगबाट सामान ब्याचअनुसार पठाउँछौं, उनले भने, विभागले परीक्षण गरेको ब्याचको तेल हामीले परीक्षण गर्दा सही मापदण्डमा छ । उद्योगबाट निस्केपछि हाम्रो जिम्मेबारी हुँदैन । चाडबाड र नयाँ मन्त्री फेरिने बित्तिकै अनुगमनको सन्दर्भमा संसदमा आवाज उठाउने बताए । मन्त्री मण्डलले भने कानुनी सल्लाह गरेर थप प्रक्रिया अघि बढाइने बताए । मुचुल्कामा हस्ताक्षर गर्न मान्नुभएन । त्यसको पनि प्रक्रिया छ, उनले भने, देशको मन्त्री नै भए पनि सभासद नै भए पनि दोषी त दोषी नै हुन्छ । कारबाही के गर्ने कुरा छिट्टै सार्वजनिक हुन्छ । उनका अनुसार उक्त उद्योगबाट अन्य ५६ ब्रान्डका वस्तु उत्पादन भएका थिए । जसले गर्दा अन्य ब्रान्ड पनि बन्द गर्नुपर्दा कानुनी र प्राविधिक समस्या हुने देखिएको पनि मन्त्री मण्डलले बताए । एकल ब्रान्ड भएको भए कारबाही गर्न सजिलो हुन्थ्यो, मन्त्री मण्डलले भने, एकदुई दिन ढिलाइ भए पनि सुरक्षा निकायसँग कुराकानी गरेर सिलबन्दी हुन्छ । विभागका अनुसार उक्त उद्योगलाई कारबाही गर्न जिल्ला प्रशासन कार्यालयमा चिठी पठाउने तयारी छ । चिठी तयार छ, पुडासैनीले भने, सम्भवत: शुक्रबार नै पठाउँछौं ।"
प्राधिकरणबाट गौतमलाई हटाउने तयारी,"काठमाडौं अन्तर्राष्ट्रिय नागरिक उड्डयन संगठन (आईकाओ) को गम्भीर सुरक्षा चासो (एसएससी) सूचीबाट नेपाललाई हटाउन पहल गरेका नागरिक उड्डयन प्राधिकरणका महानिर्देशक सञ्जीव गौतमलाई पर्यटनमन्त्री जितेन्द्रनारायण देवले हटाउन १२ बुँदे स्पस्टीकरण सोधेका छन् ।काठमाडौं विमानस्थल स्रोतका अनुसार दुई नम्बर प्रदेशको स्थानीय निर्वाचनका क्रममा प्रचारप्रसार गर्न सप्तरी पुगेका मन्त्री देव मंगलबार विराटनगरबाट काठमाडौं आएका थिए । स्पष्टीकरण सोध्ने निर्णय गरेर उनी पुन: हेलिकप्टर चार्टर गरी सप्तरी फर्किसकेका छन् । उनको निणयअनुसार पत्रमार्फत बुधबार पर्यटन मन्त्रालयले महानिर्देशक गौतमलाई तीन दिनभित्र जवाफ बुझाउन भन्दै थमाएको छ । पर्यटन सचिव महेश्वर न्यौपाने विदेश भ्रमणमा रहेकाले निमित्त सचिव सुरेश आचार्यको हस्ताक्षरमा ११ वटा विषयमा स्पष्टीकरण सोधिएको छ ।चार वर्षका लागि २७ महिनाअघि मन्त्रिपरिषदले नियुक्ति गरेका महानिर्देशक गौतमलाई हटाई उनको ठाउँमा पर्यटन मन्त्रालयका एक प्राविधिक सहसचिवलाई ल्याउने तयारी भइरहेको छ । एक पूर्व पर्यटनमन्त्रीका अनुसार चुनाव कार्यक्रम घोषणा भई आचारसंहिता लागू भइसकेको अवस्थामा स्पष्टीकरण सोध्न मिल्दैन । अब चुनावमा पैसा चाहिने भएकाले यो अनैतिक चलखेल हो, ती पूर्वमन्त्रीले भने, जसको नेतृत्वमा चार वर्ष लामो आइकाओको गम्भीर सुरक्षा चासोबाट मुलुक मुक्त भयो, उसैलाई स्पष्टीकरण सोधिनु दु:खद विषय हो । मन्त्री देवको यो निणर्यले नागरिक उड्डयन बिचौलियाको चंगुलमा पर्ने खतरा बढेको उनले बताए । मलाई पनि दबाब नआएको होइन तर मैले त्यसबेला यो विषयलाई भन्दा नेपाललाई आइकाओ र ईयूको सूचीबाट हटाउने विषयलाई मात्रै ध्यान दिएँ, ती मन्त्रीले भने ।महानिर्देशक गौतमलाई भक्तपुरमा रहेको प्राधिकरणको जग्गाको सुरक्षा गर्न किन नसकेको, भैरहवामा बन्दै गरेको गौतमबुद्ध अन्तर्राष्ट्रिय विमानस्थल निर्माणमा प्रगति नगरेको, सिमरामा बन्ने दोस्रो अन्तर्राष्ट्रिय विमानस्थलको कार्यसम्पादन न्यून (२५ प्रतिशतभन्दा कम) गराएको, त्रिभुवन अन्तर्राष्ट्रिय विमानस्थलको क्षमता सुधार गर्ने जिम्मा पाएको स्पेनी ठेक्केदार कम्पनीसँग सहजीकरण नगर्दा विस्तार कार्य अलपत्र परेको आरोप लगाइएको छ । त्यसैगरी महानिर्देशक गौतमले ०७१ देखि विमानस्थल विकास शुल्क शीर्षकमा संकलित करिब ४ अर्ब रुपैयाँ ठोस कार्यमा लगाउन नसकेको, प्राधिकरणको नीति तथा कार्यक्रम ५ वर्षे योजनाअनुसार गर्नुपर्नेमा नगरेको, आन्तरिक विमानस्थलको निर्माणको प्रभावकारी अनुगमन नगरेको, पोखरा क्षेत्रीय विमानस्थलको शिलान्यास भइसक्दा पनि निर्माण सुरु गराउन नसकेको, नेपाल वायुसेवा निगमको विमानबाट हवाई इन्धन चुहिएको घटनालाई ढाकछोप गरेको, मंगोलिया भ्रमणमा गएका बेला स्वीकृत बिदाभन्दा तीन दिन ढिलो स्वेदश फर्केको र कार्यसम्पादन सम्झौताअनुसार काम नगरेको आरोप पनि लगाइएको छ । मन्त्रीस्तरको निर्णयबमोजिम प्राधिकरण ऐनअनुसार कारबाही किन गर्नु नपर्ने हो ? तीन दिनभित्र चित्त बुझदो स्पष्टीकरण पेस गर्नू ? महानिर्देशक गौतमलाई बुझाइएको स्पष्टीकरणमा लेखिएको छ ।"
पर्यटन व्यवसायमा सुधार,"भैरहवा बाढीले सडक भत्काएर यातायात अवरुद्धपछि ठप्प बनेको भैरहवालुम्बिनीको पर्यटन व्यवसायमा पछिल्लो समय सुधार हुन थालेको छ । सडक यातायात सुचारु हुन थालेसँगै सुनौली नाका भएर नेपाल आउने पर्यटकको संख्या बढेको हो । होटल बुकिङ हुने क्रम पनि वृद्धि भएको छ । बाढीले पर्यटक आउन नसक्दा होटलका बुकिङ रद्द भएका थिए, भैरहवास्थित होटल रेडसनका व्यवस्थापक अमृत खनालले भने, पर्यटक आगमनमा सुधार हुन थालेपछि व्यवसायमा सकारात्मक प्रभाव पर्न थालेको छ । उनले सबैजसो होटलमा बुक हुन थालेको बताए । साउनको तेस्रो सातामा परेको वर्षासँगै आएको बाढीले भारतको गोरखपुरसुनौली मूल सडक अवरुद्ध भएको हो । यो नाका हुँदै सुनौलीबाट नेपाल आउने पर्यटक बीच बाटोमै अडकिएका थिए । त्यसपछि उनीहरू नेपालको भ्रमण रद्द गरी फर्कन बाध्य भएका थिए । न्यून संख्यामा मात्रै पर्यटक वैकल्पिक घुमाउरो बाटो प्रयोग गरेर सुनौलीबाट भित्रिने गरेका थिए । भारतको कुशिनगर, बोधगया, सारनाथलगायत भ्रमणपछि बुद्ध जन्मस्थल लुम्बिनीका लागि समूहमा पर्यटक आउन नसक्दा पर्यटन व्यवसाय प्रभावित भएको थियो । विशेषगरी अगस्त र सेप्टेम्बरमा श्रीलंकन पर्यटक लुम्बिनी आउने मुख्य सिजन हो । गोरखपुरसुनौलीसँगै मुग्लिङनारायणगढ सडक खण्ड पनि अवरुद्ध हुँदा अन्य मुलुकका र आन्तरिक पर्यटकसमेतको आगमन हुन सकेको थिएन । हिजोआज पर्यटक आगमन र होटल बुकिङ क्रमश: बढ्दै जान थालेपछि व्यवसायी उत्साहित हुन थालेको सिद्धार्थ होटल एसोसिएनका अध्यक्ष चन्द्रप्रकाश श्रेष्ठले बताए । अध्यागमन कार्यालय बेलहियाका अनुसार सडक अवरुद्धपछि यसै महिनाको १६ देखि फाट्टफुट्ट पर्यटक आउन थालेका हुन् । त्यसअघि दैनिक ६ सयभन्दा बढी पर्यटक सुनौली हुँदै नेपाल आउने गरेका थिए । यता आउने धेरै पर्यटक सडक समस्याले भारतको कुशिनगरबाट फर्केका थिए । एक सातादेखि दैनिक १ सय ५० देखि २ सयको संख्यामा आउन थालेका छन् । यो क्रम बढदो छ । पछिल्ला दिनमा पर्यटक आगमनमा केही सुधार आए पनि जुन अनुपातमा आउनुपर्ने हो, त्यो अझै कम छ, अध्यागमन कार्यालयका कर्मचारी राजीव अर्यालले भने, बाढीले अवरुद्ध सडक सुचारु भएको सन्देश पुग्न नसकेकाले बढ्न नसकेको हो । सेप्टेम्बर सुरु हुनासाथ विशेषगरी थाइल्यान्ड, कोरिया, भियतनाम, चीनका पर्यटक आउने गर्छन्् ।"
टाटा योद्धा नेपाली बजारमा,"काठमाडौं (कास) टाटा मोटर्सले राजधानीमा आफ्नो टाटा योद्धा सार्वजनिक गरेको छ । विभिन्न भेरियन्टहरूमा उपलब्ध टाटा योद्धामा ८५ एचपीको शक्तिशाली ३० लि इन्जिन, २५० एनएम टर्कले यसलाई आफ्नो वर्गको उत्कृष्ट गाडी साबित गरेको दाबी कम्पनीको छ । कम्पनीका अनुसार उत्कृष्ट ग्राउन्ड क्लियरेन्सले गर्दा यसलाई फलफूल र तरकारी, पोल्ट्री, माछा, दूध आदि ढुवानीमा, क्यास भ्यान र कन्सट्रकसन साइटहरूमा सर्भिस सपोर्ट भेहिकलका रूपमा प्रयोग गर्न सकिनेछ । टाटा योद्धालाई बिक्रेता सिप्रदी ट्ेरडिङले भित्र्याएको हो ।"
सुबिसु क्यान कमटेक सुरु,"काठमाडौं (कास) क्यान महासंघको आयोजनामा राजधानीमा दोस्रो संस्करणको सुबिसु क्यान कमटेक २०१७ सुरु भएको छ । सुबिसु क्यान कमटेकमा राखिएको ६५ स्टलहरूमा स्वदेशी तथा विदेशी सर्भिसेस एन्ड सोलुसन्स र ब्रोडब्यान्ड इन्टरनेट र कम्प्युनिकेसन टेक्नोलोजीसम्बन्धी कम्पनीहरूले भाग लिइरहेको जारी विज्ञप्तिमा उल्लेख छ । कमटेकको स्पोन्सरमा सुबिसु केबलनेट, डायमन्ड स्पोन्सरमा नेपाल टेलिकम, गोल्ड स्पोन्सरमा नेटिस, सिल्भर स्पोन्सरमा एस पावर बीपीई र प्रिन्ट स्पोन्सरमा नवीन डिस्ट्रिब्युटर्स रहेको आयोजकले जनाएको छ । कमटेकमा इन्टरनेट सेवा प्रदायक, टेलिकम्युनिकेसन्स, इलेक्ट्रोनिक सेक्युरिटी तथा सेफ्टी र सोलुसन, हार्डवेयर सेल्स तथा मेन्टिनेन्स, पावर सोलुसन्स, मोबाइल एसेसोरिज, डिलर र डिस्ट्रिब्युटर्स, आईसीटी कलेज तथा ट्रेनिङ इन्स्टिच्युट, पेमेन्ट सोलुसन्स र अन्य स्टलहरू रहेका जारी विज्ञप्तिमा छ । सञ्चार प्रवधिको बृहत् प्रदर्शनीका रूपमा आयोजना भइरहेको कमटेक प्रदर्शनीको बिहीबार सूचना तथा सञ्चारमन्त्री मोहनबहादुर बस्नेतले उद्घाटन गरेका हुन् ।"
सामसङको चाडपर्व योजना,"काठमाडौं (कास) सामसङ इलेक्ट्रोनिक्सले दसैं, तिहार र छठलाई लक्षित गर्दै सामसङ, खुसी फर्की आयो योजना ल्याएको छ । यस योजनाअन्तर्गत हरेक सामसङ टीभी तथा होम अप्लाइन्सहरूको खरिदमा विशेष छुटको व्यवस्था गरिएको जारी विज्ञप्तिमा छ । यो फेस्टिभ प्राइसअन्तर्गत २२ प्रतिशतदेखि ३३ प्रतिशतसम्मको छुटमा सामसङका एलईडी टीभी तथा १२ देखि २२ प्रतिशतसम्मको छुटमा सामसङका होम अप्लाइन्सहरू खरिद गर्न सकिने कम्पनीले जनाएको छ ।"
