शीर्षक,विवरण
एभरेस्ट अवार्ड र फेसन,"काठमाडौं एभरेस्ट फिल्म एकेडेमीले पाँच फिल्मकर्मीलाई सम्मान गरेको छ । एभरेस्ट लाइफ टाइम अचिभमेन्ट अनर बाट वरिष्ठ फिल्म निर्देशक लक्ष्मीनाथ शर्मालाई सम्मानित गरिएको हो । पूर्वप्रधान सेनापति रुक्मांगद कटवालले शर्मालाई सम्मानपत्र र दोसल्लाले सम्मान गरे । चार दशकभन्दा लामो समय फिल्म क्षेत्रमा बिताएका शर्माले भारतबाट फिल्म पढेर आएका थिए । उनले मनको बाँध को पटकथा लेखेका थिए भने बदलिँदो आकाश, छोरी बुहारी लगायतका फिल्म निर्देशन गरेका छन् । हामीले फिल्म सुरु गर्दा वर्षमा एकदुइटा मुस्किलले बन्थे, उनले भने, अहिले नेपाली फिल्म क्षेत्र फस्टाउँदै छ । कार्यक्रममा सन् २०१६ भरि प्रदर्शनमा आएका फिल्महरूमध्येबाट अभिनय, निर्देशन, सिनेमाटोग्राफी र दृश्य सम्पादनमा एभरेस्ट सिने अनर प्रदान गरिएको थियो । जात्रा का निर्देशक प्रदीप भट्टराई र अभिनेता विपिन कार्कीले विधागत उत्कृष्टताको अवार्ड पाए । त्यस्तै, लुट २ बाट दृश्य सम्पादनका लागि सुरेन्द्र पौडेल र सिनेमाटोग्राफीका लागि पुरुषोत्तम प्रधानले अवार्ड थापे । कलालाई कुनै पनि सिमानाले नबाँधिने उल्लेख गर्दै पूर्वप्रधान सेनापति कटवालले दक्ष जनशक्ति र प्रविधिको विकासले नेपाली फिल्म क्षेत्र व्यापक बन्दै गएको बताए । कार्यक्रममा कुटुम्ब ब्यान्डले सांगीतिक प्रस्तुति दिएको थियो । ब्यान्डले उत्सव, परिवर्तन, सान्नानी, सय थरी बाजा एउटै ताल लगायत आधा दर्जन धुनहरू सुनायो ।त्यस्तै, समारोहमा समसामयिक जातीय पहिरन विषयमा विभिन्न डिजाइनरका पहिरनमा सजिएर मोडलहरू र्याम्पमा उत्रिए । डिजाइनरहरू मिनु श्रेष्ठ, अस्मिता डंगोल, विद्या तामाङ, क्रिविना कक्षपती, पासाङ तामाङ, समन प्रजापती, निधि श्रेष्ठ, सागर आलेमगर, जोसिला श्रेष्ठ, अनु श्रेष्ठ, विष्ण श्रेष्ठ, अनिता विक, अञ्जली लामा, प्रमिता श्रेष्ठ, विमला थापा, सुनीता श्रेष्ठ, रेखा मोदी मित्रुकाका पहिरनहरू र्याम्पमा देखाइएका थिए ।"
दसैंमा लन्डन,"लन्डनमा स्वागतपछि (दायाँबाट) गायक हेमन्त राना, संगीतकार कालीप्रसाद बाँस्कोटा र कलाकार सुषमा कार्की ।लन्डन (कास) संगीतकार कालिप्रसाद बाँस्कोटा, गायक हेमन्त राना र हट एन्ड बोल्ड कलाकार सुषमा कार्की लन्डन आइपुगेका छन् । सिद्धार्थ एवं नेप्लिज इन्टरटेन्मेन्ट ग्रुपले गर्न लागेको विजया दशमी शुभकामना साँझका लागि कलाकार बेलायत आएका हुन् । बेलायत पहिलो भ्रमण भएकाले तीनै जना कलाकार खुबै उत्साहित छन् । हिथ्रो टर्मिनल फोरमा उत्रिँदा कलाकारलाई आयोजकहरू सिद्धार्थविक्रम क्षेत्री एवं नेप्लिज इन्टरटेन्मेन्ट ग्रुपका बिरेन खड्का, अनिल मल्ल, दीपक खड्का, अनिल आचार्यलगायतले स्वागत गरे । नीरा जहिले रिसाउने, पारि त्यो डाँडामा हेर, लैजाऊ घुमाउन मलाई ठमेल बजार जस्ता हिट गीतका सर्जक संगीतकार तथा नेपाल आइडलका निर्णायक बाँस्कोटा, सुन साइली साइली परदेशबाट गीतका गायक राना अनि हट एन्ड बोल्ड मोडल कार्की सहभागी दसैं शुभकामना साँझ मनोरञ्जनको भिन्न प्याकेज भएको आयोजकले दाबी गरेका छन् । तीनै जनाले यही शुक्रबार साँझ अल्डरटस्थित एम्पायर हलमा, १७ सेप्टेम्बरका दिन लन्डन साउथ हयारोको हयारो बरो फुटबल क्लब, २३ सेप्टेम्बरमा रेडिङस्थित किन्की कोला, २४ सेप्टेम्बरमा आसफोर्ड नोर्टन न्याचबुल स्कुल हल एवं १ अक्टोबरमा गेटवे हाउस उलविच लन्डनमा प्रस्तुति दिने तय भइसकेको छ ।"
नेपाल भाषा लिटरेचर फेस्टिभल हुने,"काठमाडौं (कास) राजधानीमा पहिलोपटक नेपालभाषा लिटरेचर फेस्टिभल हुने भएको छ । नेपालभाषा साहित्य नख:ले शनिबार पाटन संग्रहालयको केशवनारायण चोकमा फेस्टिभल गर्न लागेको हो । नेपालभाषा टाइम्स दैनिक र सन्ध्या टाइम्स सञ्चार सहकारीले फेस्टिभल गर्न लागेका हुन् । नेपाल भाषाको साहित्य सृजना सुस्त हुँदै गइरहेकोले यसलाई उकास्ने उद्देश्यले फेस्टिभल गर्न लागिएको आयोजक कमिटी उपाध्यक्ष सुरेश किरणले बिहीबार पत्रकार सम्मेलनमा बताए । मल्लकालदेखि नै नेपाल भाषामा साहित्य रचनाको अभ्यास सुरु भए तापनि विभिन्न समयमा यसमाथि आक्रमण भएकाले असर पर्दै गएको हो, उनले भने, फेस्टिभलमा नेपालभाषा साहित्यका विविध पक्षको बारेमा अन्तरक्रियासमेत गर्छाैं । यसले नेपाल भाषा साहित्यलाई उकास्ने आशा राखेका छौँ । फेस्टिभल छ सेसनमा बाँडिनेछ । पहिलो सेसनमा मल्ल के सुन्दरको उपन्यास द पोस्टर तथा कवि वसन्त चौधरीको नेपाल भाषामा अनूदित कविता संग्रह वसन्त को लोकार्पण गरिनेछ । यसलगत्तै प्रा प्रेमशान्ति तुलाधरले नेपाल भाषा साहित्यको परिचयबारे प्रवचन दिनेछिन् ।दोस्रो सेसनमा भोलिको नेपाल भाषा साहित्य विषयमा वरिष्ठ साहित्यकार भूषणप्रसाद श्रेष्ठ, ध्रुव मधिकर्मी, कवि सुलोचना मानन्धर र अध्येता राजन मानन्धरबीच छलफल हुनेछ । तेस्रो सेसनमा नेपाली भाषामा साहित्य सिर्जना गर्दै आइरहेका नेवा: स्रष्टाहरूसँग छलफल हुनेछ, जसमा संगीत तथा नाट्य प्रज्ञा प्रतिष्ठानका कुलपति सरुभक्त, कवि स्नेह सायमी, जलेश्वरी श्रेष्ठ र श्रीओम श्रेष्ठ रोदन सहभागी हुनेछन् । चौथो सेसनमा जनकवि दुर्गालाल श्रेष्ठ, वरिष्ठ साहित्यकार पूर्ण वैद्य, मथुरा सायमिदेखि नयाँ पुस्ताका दुई दर्जन साहित्यकारबाट नेपालभाषामा रचित साहित्य वाचन हुनेछ । फेस्टिभलको अन्त्यमा कुटुम्ब ब्यान्डका साथै लोकप्रिय गायकगायिकाबाट सांगीतिक प्रस्तुति रहने किरणले जनाए ।"
नेपथ्यको अर्को म्युजिक भिडियो,"काठमाडौं (कास) नेपथ्य ब्यान्डले नयाँ म्युजिक भिडियो ल्याएको छ । ब्यान्डले नवौं एल्बम ऐनाझयाल मा समाविष्ट मै मरी जाउँला गीतको भिडियो सार्वजनिक गरेको हो । लाङटाङ भेगतिरको लोकभाकामा आधारित तामाङ सेलो शैलीको उक्त गीतमा वैदेशिक रोजगारीमा गएकाहरूको वेदना समेटिएको छ । भेडाको ऊनजस्तो खोजी गरेकै ठाउँबाट यो भाका टिपेको नेपथ्यले जनाएको छ । यसको म्युजिक भिडियोलाई सिम्पल लिरिकल भिडियो का हिसाबले तयार पारिएको छ । हामीले हरेक एल्बममा औसत दस गीत राख्दै आएका छौं, नेपथ्य गायक अमृत गुरुङ भन्छन्, तीमध्ये एकाध मात्र लोकप्रिय हुन्छन्, बाँकी ओझेलमा पर्छन् । अहिले यो म्युजिक भिडियो आएकोमा खुसी लागेको छ ।"
"भारतमा डुंगा डुब्दा १९ को मृत्यु, ३० बेपत्ता",नयाँदिल्ली (सिन्हवा) उत्तरी भारतको बाघपत जिल्लास्थित यमुना नदीमा डुंगा डुब्दा कम्तीमा १९ जनाको मृत्यु भएको छ । घटनामा २० जना हराइरहेको भारतीय सञ्चारमाध्यमले जनाएका छन् । प्रहरीले ११ जनाको जीवितै उद्धार गरी उपचारका लागि अस्पताल पुर्याएको छ । प्रहरीका अनुसार डुंगा डुबेर हराएकाको खोजी जारी छ । उनीहरूमध्ये अधिकांशको मृत्यु भइसकेको प्रहरीको आशंका छ । डुंगामा ५० जना यात्रारत थिए । प्रारम्भिक अनुसन्धानमा क्षमताभन्दा बढी यात्रु बोकेका कारण डुंगा डुबेको हो । उत्तर प्रदेशका मुख्यमन्त्री योगी आदित्यनाथले दुर्घटनाबारे दु:ख व्यक्त गरेका छन् ।
२२ विद्यार्थीसहित २४ को मृत्यु,"क्वालालम्पुर मलेसियाको एक विद्यालयमा भएको आगलागीमा २४ जनाको मृत्यु भएको छ । राजधानी क्वालालम्पुरको दातुक करामतस्थित धार्मिक विद्यालयमा बिहीबार बिहान करिब पौने ६ बजे भएको उक्त घटनामा २२ विद्यार्थी र २ शिक्षकहरूको मृत्यु भएको मलेसियाली सञ्चारमाध्यमले जनाएका छन् । मृतक विद्यार्थीहरू १३ देखि १७ वर्षका छन् । मृतकहरूको शवलाई पोस्टमार्टमका लागि क्वालालम्पुरस्थित जनरल अस्पतालमा लगिएको छ । मृतकका शव कतिपय चिन्नै नसकिने अवस्थामा रहेकाले डीएनए परीक्षण गर्नुपर्ने स्वास्थ्यमन्त्री दातो एस सुब्रामानियमले बताएका छन् । मलेसियामा गत २० वर्षयताको यो सबभन्दा दु:खद् आगलागीको घटना भएको अधिकारीहरूले जनाएका छन् । अधिकारीका अनुसार उनीहरूमध्ये अधिकांशको शयनकक्षमा मृत्यु भएको हो । आगलागीपछि गम्भीर घाइते ४ सहित १० जनाको अस्पतालमा उपचार भइरहेको छ । अग्नि तथा उद्धार नियन्त्रण विभागका निर्देशक खिरुद्दिन द्रहमानले एएफपीलाई भने, यो हाम्रो देशको विगत २० वर्षको सबैभन्दा डरलाग्दो आगलागी हो । आगलागीमा परी सुरुमा २५ जनाको मृत्यु भएको जनाइए पनि प्रहरीले २४ को मृत्यु भएको पृष्टि गरेको हो । मलेसियामा इस्लामिक तहफिज विद्यालय कुरान पठनपाठनका लागि खोलिएका आवासीय विद्यालय हुन् । सञ्चारमाध्यमले विद्यालयको माथिल्लो तलाका कोठाहरू पूर्णरूपमा जलेको जताएका छन् । आगलागी भएलगत्तै दमकलसहित अग्नि नियन्त्रक घटनास्थलमा पुगे पनि उद्धारमा कठिनाइ भएको जनाइएको छ । अधिकारीले घटनाबारे अनुसन्धान भइहरहेको जनाएका छन् । अग्नि तथा उद्धार नियन्त्रण विभागका उपनिर्देशक सोइमाना जाहिदले भने, प्रारम्भिक अनुसन्धानमा विद्युत् सर्किट सर्ट भएर आगलागी भएको देखिएको छ । क्वालालम्पुर प्रहरी प्रमुख अमर सिंहले मृतकहरूको शरीर पूर्णरूपमा जलेको जनाए । उनले भने, बाहिर निस्कने एक मात्र ढोका भएकाले विद्यार्थीहरू भाग्न नसकेका हुन् । उनका अनुसार आगलागीपछि विद्यार्थीहरू ग्रिल ठोकिएका झयालबाट समेत उम्कने प्रयास गरेका थिए । यद्यपि १४ विद्यार्थी भने त्यहाँबाट बाहिरिएर ज्यान जोगाएका थिए । प्रधानमन्त्री नजिब रजकले घटनाप्रति दु:ख व्यक्त गरेका छन् । संघीय मन्त्री लोगा बाला मोहनले घटनाको तुरुन्तै छानबिन हुने बताएका छन् । उनले भने, छानबिनपछि भविष्यमा यस किसिमका घटनाको रोकथाम गर्न सकिन्छ ।"
