"शीर्षक","विवरण"
"एन्फाको आर्थिक नियमावली र कार्यविधि तयार","काठमाडौं : अखिल नेपाल फुटबल संघ (एन्फा) को आर्थिक नियमावली र कार्यविधि तयार भएको छ । एन्फालाई पारदर्शी बनाउने अभियानसहित एक वर्षअघि एन्फा नेतृत्वमा आएको कर्माछिरिङ शेर्पाको टोलीले आर्थिक नियमावली र कार्यविधि तय गरेको हो । एन्फाले सोमबार पत्रकार सम्मेलन गरी आर्थिक नियमावलीबारे जानकारी दिएको छ । हामीले चुनावअघि एन्फालाई पारदर्शी ढंगले अगाडि बढाउन आर्थिक पारदर्शिताको कुरा गरेका थियौं । सोहीबमोजिम रोडम्याप तयार गरेका हौं, एन्फा अध्यक्ष शेर्पाले भने । उनले नियमावलीले नीतिगत रूपमा गाइड र कार्यविधिले प्रक्रियाको विषयमा काम गर्ने पनि बताए । एन्फाको आर्थिक नियमावलीलाई अडिट एन्ड कम्पलायन्स कमिटीले दिशानिर्देश गर्ने बताइएको छ । एन्फाले सार्वजनिक गरेको आर्थिक नियमावली र कार्यविधिमा पेस्की र फस्र्योट, खरिद तथा निर्माण, टेन्डर, विश्व फुटबल महासंघ (फिफा) र एसियाली फुटबल महासंघ (एएफसी) बाट प्राप्त अनुदान र सहयोगको कार्यान्वयन, खर्चको प्रक्रिया, भत्ता, पदाधिकारीको भ्रमणलगायत विषय समेटिएको छ । पहिलो पटक लिखित रूपमा तयार पारिएको यस नियमावली र कार्यविधिलाई व्यवहारमा लागू गरिने प्रतिबद्धता पनि शेर्पाले गरेका छन् ।"
"तिब्बत प्रजातान्त्रिक सुधारको ६० वर्ष","पइचिङ : चालू वर्ष तिब्बत प्रजातान्त्रिक सुधारको ६०औं वार्षिकोत्सव हो । यसै अवसरमा चीनकोराज्य परिषदन्तर्गत प्रेस कार्यालयले मार्च २७ तारिख बुधवार तिब्बतमा प्रजातान्त्रिक सुधार साठी वर्ष शीर्षकको श्वेतपत्र जारी गरेको छ । सन् १९५९ मार्च २८ मा तिब्बतचीनमा विलय भएको थियो । विगत साठी वर्षमा तिब्बत स्वायत्त प्रदेशमा भएको प्रजातान्त्रिक सुधार र विकासमा मारेको छलाङ सम्बन्धमा उक्त श्वेतपत्र जारी गरेको हो । प्रजातान्त्रिक सुधार तिब्बतको इतिहासमा सबैभन्दा ठूलो र गहन रूपमा भएको सामाजिक सुधार हो । श्वेत पत्रअनुसार केन्द्रीय सरकार र समग्र जनताको समर्थनमा तिब्बतको विभिन्न जातिले गरिब र पिछडिएको पुरानो तिब्बतलाई आर्थिक समृद्ध, विकसित, पर्यावरणीय र सुखद जीवन भएको नयाँ तिब्बत निर्माण गरेका छन् । श्वेतपत्रमा प्रस्तावना र निष्कर्ष बाहेक दश खण्ड छन् । प्रजातान्त्रिक सुधारको माध्यमबाट सामन्ती दासत्व अन्त्य भएको थियो भने करिब दश लाख भूदास मुक्त भएका थिए । तिब्बतले विकासमा मारेको फड्काले प्रजातान्त्रिक सुधार सबै तिब्बतीको मूलभूत आकांक्षा भन्ने प्रस्ट भएको छ । सन् २०१८ मा तिब्बतको जीडीपी १४७७६ बिलियन रनमनपी (२२ बिलियन अमेरिकी डलर) पुगेको छ सन् १९५९ मा यो आँकडा १७४ मिलियन रममनपी मात्र थियो । तिब्बतले सन् २०१८ मा ३ करोड पर्यटक भित्र्याएको छ । हाल तिब्बतमा तिब्बती बौद्ध धर्म उपासनाका लागि १ हजार ७८७ वटा स्थल छन् र ४६ हजारभन्दा बढी भिक्षुभिक्षुणीका साथै ३५८ जना जीवित बुद्ध छन् । त्यसैगरी एउटा चर्च र चारवटा मस्जिद पनि छन् । सन् १९८० को दशकदेखि तिब्बती सांस्कृतिक अवशेष र महत्वपूर्ण मठमन्दिरको पुनः निर्माणमा १४ बिलियन रनमनपीभन्दा बढी खर्च गरिसकेको छ । सन् १९६५ सेप्टम्बर १ देखि ९ सम्म आयोजित पहिलो जनकंग्रेसको पहिलो अधिवेशनले तिब्बत स्वायत्त क्षेत्रको स्थापना गरेको थियो ।"
"जैविक रसादीको प्रयोगमा कृषक आकर्षित","डोल्पा : रसायनिक विषादी मौलाइ रहेको अवस्थामा डोल्पामा जैविक रसादीको महत्वबारे कृषकलाई बुझाउन थालिएको छ । जिल्लाको ठुलीभेरी नगरपालिका९ मोतिपूरको वस्तीमा जैविक रसादीको बारेमा महत्व बुझाउँदै उत्पादन थालिएको हो ।जैविक रसादी प्रयोग गरी स्वस्थ उत्पादन गर्न कृषकलाई जागरुक गराउन लागिएको छ । मोतीपुरका ५३ वटा घरधुरीमध्ये १२ घरमा विगत एक वर्षदेखि जैविक रसादीको उत्पादन गरी निशुल्क वितरण गरिएको कृषक बिमला थापाले बताइन् । रासायनिक विषादीले माटोको स्वरुप नै बिगारेको र जैविक रसादीको उत्पादन गरी पुस्तौंसम्मको माटोको उर्वरा शक्ति बचाइ राख्न कृषकलाई प्रयोग गर्न उत्प्रेरित गरिरहेको अर्का कृषक लालबहादुर कठायतले जानकारी दिए । लालबहादुरकाअनुसार बर्खाको समयमा कुहिएर खेर जाने तितो,पिरो,अमिलो,टर्रो झारपातको प्रयोग गरेर जैविक मल बनाइने गरेको बताए । स्थानीयस्तरमा पाइने तितेपाती,टिमुर,ओखरको पात,लिण्डे,खुर्सानीलगायतका दर्जनौ झारपात मिलाएर जैविक रसादीको उत्पादन गरिएको छ । पहिलापहिला विश्वास लागेन, बर्खाभरी बनायौं, हिउँदभर तरकारीमा प्रयोग गर्यौं ।मलबाट आम्दानी बढेको र माटोको उर्वरा समेत बढेर यही वर्षको हिउँदमा लाखौं रुपैयाँ तरकारीबाट आम्दानी गरेको हासी नेपालीले बताइन् । उनले भनिन्,' दिनमा १५ सय भन्दा धेरैको आम्दानी हुन्छ । हामी दलित परिवारमा आम्दानीको स्रोत बनेको छ ।' हिउँदको समयमा दुनै बजारमा मोतीपूरको तरकारी बाहेक अन्यत्रको कतैको नबेचेको हासी नेपालीले सुनाइन् । कर्णाली जनजिविका कार्यक्रमको प्राविधिक सहयोगमा मोतीपूरको वस्तीमा प्लाष्टिकका काला ड्रममा जैविक रसादी उत्पादन गरी जिल्लाका रुम,त्रिपूराकोट,जुफाल,डाँगीवाडालगायतका क्षेत्रमा निशुल्क वितरण गरिएको छ । जैविक रसादीको प्रयोगले तरकारीमा रङ हरियो हुनुका साथै स्वादमा मिठास आउने र स्वास्थ्यका लागि फाइदाजनक भएकोले यसबारे कृषकलाई बुझाउन नसकिएको (केड)नेपालका वरिष्ठ कृषि प्राविधिक कृष्णराज भामले जानकारी दिए । उनका अनुसार यो विषादी मात्र नभएर मल पनि भएको र आम्दानीको पनि राम्रो आधार भएकाले डोल्पा जिल्लामा उत्पादन गरेर बाहिर जिल्लामा समेत निर्यात गर्न सकिने दावी गरे । वर्षमा हाल १२ घरधुरीले एक सय लिटरभन्दा धेरै उत्पादन गरी जैविक मल गाउँगाउँका कृषकलाई निशुल्क वितरण गरी रहेकाले स्थानीय सरकारले पनि रसायनिक मल खरिद समेत बन्द गर्नुका साथै पहिला खरिद भएका विषादी समेत ताला लगाइएको र जैविक मललाई उत्पादनमुखी बनाउनेमा जोड दिने वडा ९ का अध्यक्ष बिरमल कुमार भण्डारीले प्रतिबद्धता जनाए । स्थानीयस्तरमा उत्पादन थालिएको जैविक रसादीको प्रयोगले मानिस स्वस्थ्य हुनुका साथै माटोको उत्पादन शक्ति बचाइ राख्दछ । बाख्रा भेडा गाई भैसीलाई जुम्रा परेको बेलामा प्रयोग गर्दा समेत जुम्राहरु बागेकोले मिलाइ कृषकले पशुवस्तुमा समेत प्रयोग गर्ने गरेको पाइएको छ ।"
"सर्वोच्चका लागि पाँच र उच्च अदालतका लागि १७ न्यायाधीश सिफारिस (सूचीसहित)","काठमाडौं : न्याय परिषदले सर्वोच्च अदालतका लागि पाँच र उच्च अदालतका लागि १७ न्यायाधीश नियुक्तिका लागि सिफारिस गरेको छ । न्याय परिषद्को मंगलबार बसेको बैठकले न्यायाधीश नियुक्तिका लागि सिफारिस गरेको हो । सर्वोच्चको न्यायाधीशका लागि सिफरिस भएकामा उच्च अदालत पाटनका मुख्य न्यायाधीश प्रकाशकुमार ढुंगाना, उच्च अदालत सुर्खेतका मुख्य न्यायाधीश सुष्मालता माथेमा रहेका छन् । त्यस्तै वरिष्ठ अधिवक्ता कुमार रेग्मी, अधिवक्ता हरिप्रसाद फुँयाल र अधिवक्ता मनोजकुमार शर्मालाई सर्वोच्चको न्यायाधीशका लागि सिफारिस गरिएको छ । त्यसै न्याय परिषद्ले उच्च अदालतका लागि १७ न्यायाधीशको सिफारिस गरेको छ । १७ मध्ये जिल्ला न्यायाधीशबाट ६, न्यायसेवाका विशिष्ट श्रेणीका अधिकृतबाट ३ र अधिवक्ताबाट ७ जना उच्च अदालतको न्यायाधीशका लागि सिफारिस गरिएको छ । परिषद् बैठकले एकजना साविक पुनरावेदन अदालतका पूर्व अतिरिक्त न्यायाधीशलाई उच्च अदालतको न्यायाशीधका लागि सिफारिस गरेको छ । त्यसैगरी उच्च अदालत विराटनगरका न्यायाधीश उमेशराज पौडेलको अवकाशपछि रिक्त पदका लागि अधिवक्ता अन्जु उप्रेती ढकाललाई नियुक्ति सिफारिस गरिएको छ ।"
"राहत वितरण र उद्दारमा धुर्मुस र रवि","पुरैनिया: हुरीले बितण्डा मच्चाउँदा घरबारविहीन भएका बारा पुरैनियाका पीडितलाई कलाकार सीताराम कट्टेल 'धुर्मुस' र सञ्चारकर्मी रवि लामिछानेले राहत वितरण गरेका छन् । हुरीले बढी प्रभावित पुर्याएको फेटा गाउँपालिका६ को पुरैनिया पुगेर कलाकार धुर्मुसले राहत वितरण गरेका हुन् । सोमबार दिउँसो बारा आएका धुर्मुसले ४ सय थान त्रिपाल, ९ क्विन्टल चामल र ४ सय कार्टुन चाउचाउ पुरैनियाका वडाअध्यक्ष जाकिर हुसेनलाई हस्तारन्तरण गरे । कलाकार धुर्मुसले प्राकृतिक विपतिबाट भएको यस्तो क्षतिमा थोरै भएपनि सहयोग गर्न सकिन्छ कि भनेर राहत लिएर बारा आएको बताए । उनले प्रभावित क्षेत्रमा आएर पीडितको अवस्था हेर्दा अत्यन्तै दुःख लोको प्रतिक्रिया दिए । 'घटनाबाट अकल्पनीय क्षति भएको छ, थुप्रै वस्ती विनास भएका छन् र मानिसको बिचल्ली भएको छ,' धुर्मुसले भने,'यस्तो अवस्थामा राहतका लागि जुट्न सबैलाई आग्रह पनि गर्न चाहन्छु ।' यसैगरी सञ्चारकर्मी रविले पनि पुरैनिया क्षेत्रमा राहत वितरण गरेका छन् । घटनाबाट ठूलो जनधनको क्षति भएको र थुप्रै स्थानीयको घर उजाडिएपछि राहत लिएर बारा आएको रविले बताए । उनले सोमबार साँझ पुरैनिया क्षेत्रमा राहत वितरण गरेका हुन् । यसैगरी सिमराका स्थानीय युवाले पनि पुरैनिया क्षेत्रमा राहत वितरण गरेका छन् । सिमरा फाउण्डेसन, होटल व्यवसायी संघ र हाम्रो समन क्याम्पलगायत स्थानीय युवाले राहत संकलन गरी पुरैनिया क्षेत्रमा वितरण गरेको सिमराका युवा त्रिलोक ठकुरीले जानकारी दिए । यसैगरी हुरी प्रभावित क्षेत्र पुरैनिया, भलुई भरवलियालगायतका स्थानमा राहत वितरणका लागि विभिन्न सामाजिक संघसंस्था आउनेक्रम जारी छ ।"
"स्थानीय तहमा काम गर्ने ढर्रा पुरानै : मन्त्री आङवो","विराटनगरः प्रदेश१ सरकारका अर्थ मामिला तथा योजनामन्त्री इन्द्रबहादुर आङवोले सिंहदरबारको विरासत तल्लो तहसम्म आए पनि काम गर्ने शैली पुरानै भएको आरोप लगाएका छन् । आर्थिक पत्रकार समाज (सेजन)ले विराटनगरमा गरेको कार्यक्रममा बोल्दै आङ्वोले खर्च गर्ने समाथ्र्यको आधारमा तीन तहकै सरकार उस्तै भएको तर्क गरेका हुन् । उनले कर्मचारी समायोजनदेखि नीति निर्माण बनाउने सम्मको सम्पूर्ण चरणमा पुरानै रवैया अपनाउनुपर्ने बाध्यात्मक अवस्थाका कारण लक्ष्यअनुसारको सफलता हाँसिल गर्न नसकेको स्वीकारे । 'खरिद ऐनदेखि दर्जनौं कानुनहरु पुरानै ढर्रामा छन्, कर्मचारीको काम गर्ने शैलीले समेत हामीले लक्ष्य प्राप्त गर्न सकेका छैनौँ,' उनले भने । मन्त्री आङ्वोले एकात्मक शासन व्यवस्थामा जस्तै असारे कार्यक्रममा पैसा खर्च गर्नुपर्ने बाध्यता रहेको बताए । योजना छनोटदेखि अनेकौं प्रावधानका बीच सरकारले ११ प्रतिशत मात्र विकास खर्च गर्न सकेको जानकारी दिए । पैसा थुप्रिनु विकासका लागि राम्रो लक्षण नभएको जानकारी भए पनि गलत ढंगले खर्च गर्ने अवस्थामा आफू नरहेको स्पष्ट रे । 'वित्तिय सुशासन पालना गर्दै खर्च गर्ने परिपाटी अंगालिन्छ, राज्यको ढिकुटीको सही सदुपयोग गर्नेतर्फ आफू सचेत छु,' उनले भने । प्रदेश योजना छनोट हुँदादेखि नै आर्थिक अनियमितता हुनसक्ने भएको भन्दै उनले तल्लो तहदेखि नै विशेष निगरानी बढाउनुपर्ने अवश्यता रहेको औंल्याए । त्यसका लागि जनता र मिडियाले उचित भूमिका खेल्न मन्त्री आङ्वोले आग्रह गरे । उनले राजनीतिक रुपमा संघीयता अभ्यासको चरणमै रहेको हुँदा आफू आशावादी रहेको पनि बताए । सेजनका अध्यक्ष पुष्पराज आचार्यले संघीयताको मर्मअनुसार नै प्रदेश समिति गठन भएको हुँदा सार्वजनिक खर्च तथा वित्तिय उत्तरदायित्व सचिवालय (पेफा) को सहयोगमा विभिन्न कार्यक्रम आयोजना गर्दै आर्थिक उत्तरदायित्वपूर्ण पत्रकारितालाई निरन्तरता दिने जानकारी दिए ।"
