"शीर्षक","विवरण"
"पार्टी ड्रग्ससहित रानीबारीबाट दुई नेपाली र एक भारतीय पक्राउ","काठमाडौँ : प्रहरीले प्रतिबन्धित लागूऔषधसहित काठमाडौँको रानीबारीबाट दुई नेपाली र एक भारतीयलाई पक्राउ गरेको छ । पक्राउ पर्नेमा काठमाडौं महानगरपालिका२२ यटखा बस्ने २८ वर्षीय आशिषमान श्रेष्ठ, गोंगबु बस्ने २८ वर्षीय सनि महर्जन र काठमाडौं लाजिम्पाट बस्ने भारतको मुम्बई घर भएका राजिव रामेश्वर लुथरा छन् । महानगरीय प्रहरी परिसर काठमाडौंबाट खटिएको उनीहरुलाई उक्त लागूऔषधसहित फेला पारी पक्राउ गरेको हो । उनीहरुको साथबाट लागूऔषध कोकीन ४ ग्राम, लागूऔषध चरेश १ किलो, लागू औषध बेचबिखन गर्ने तराजु , जेएसडी ३५ पिस र एमडीएमए १७ ग्राम सहित शनिबार साँझ बरामद गरेको छ ।"
"बसको ठक्करबाट दुईको मृत्यु","राँझा : बाँकेको बैजनाथ गाउँपालिका५ जिउगाउँस्थित पूर्वपश्चिम राजमार्गमा विद्यालयको बस र मोटरसाइकल ठोक्किँदा दुई जनाको मुत्यु भएको छ । मृत्यु हुनेमा सुर्खेतको लेकबेंसी नगरपालिका१ का विक्रम गहतराज र सुर्खेतकै गुर्भाकोट नगरपालिका १२ का मदन सुनार रहेको इलाका प्रहरी कार्यालय कोहलपुरका प्रवक्ता प्रहरी निरीक्षक मानबहादुर विसीले जानकारी दिए । सम्झनाचोकतर्फ जाँदै गरेको बालज्योति विद्यालयको बा१क ४४९५ नंको बस र बाँसगढीबाट कोहलपुरतर्फ आउँदै गरेको लु४३प ९५९९ नंको मोटरसाइकल ठोक्किएका हुन् । दुवैजनाको उपचारका लागि शिक्षण अस्पताल कोहलपुर लैजाँदै गर्दा मृत्यु भएको हो । रासस"
"अप्ठ्यारोमा लोकबाजा संग्रहालय","काठमाडौं : थापाथलीबाट त्रिपुरेश्वर जाने बाटोको छेउमै छ एउटा भत्किन लागेको भवन । चर्किएका भित्ता काठको टेको लगाएर अड्याइएको छ । पुरानो छानोमा झार उम्रेर सुकेको छ । जहाँ, मूलबाटोबाटै देखिने गरी नेपाली लोकबाजा संग्रहालय लेखेको बोर्ड झुन्ड्याइएको छ । यही भवनको दोस्रो तलामा नेपालका ६ सय ५० प्रकारका लोकबाजा संकलित छन् । विभिन्न अध्ययन, अनुसन्धानले नेपालमा एक हजार तीन सय ५० प्रकारका लोकबाजा प्रयोगमा रहेको देखाउँछ । पुरानो मधुकर बाजादेखि शीतम्बर, ढोलक, तबला, मादल, ठूलो सारंगी, सहनाई, नरसिंगा र पञ्चैबाजाका सेट संग्रहालयमा छ । भवनको अवस्था भने अत्यन्तै नाजुक छ । नेपालमा परापूर्वकालदेखि लोकबाजा प्रचलनमा छन् । नेपाली लोकबाजा, लोकगीत, लोकसंगीतमा बेग्लै मादकता छ । गाउँघरमा गन्धर्व दाइले बजाउने सारंगीको सुमधुर धुन होस् या विवाहमा बजाइने पञ्चैबाजाको ताल । सबैमा नेपाली संस्कृति झल्किन्छ । लोकबाजा कुनै फुकेर बजाइन्छ भने कुनै रेटेर सुर निकालिन्छ । कुनै ठटाएर बजाइन्छ । लोकबाजा संग्रहालयका परिकल्पनाकार धादिङ गजुरीका रामप्रसाद कँडेल २५ वर्षदेखि बाजा संग्रहमा जुटेका छन् । उनी २०५२ सालबाट लोकबाजा खोज्न गाउँगाउँ घुमिरहेका छन् । उनले केही साथीसँग मिलेर २०५४ सालमा नेपाली लोकबाजा संग्रहालय स्थापना गरे । अहिले यो संस्थामा २५ जना सदस्य छन् । ती सबै निःशुल्क रूपमा संस्थाका लागि काम गरिरहेका छन् । केही वर्ष कँडेलले आफ्नै कोठामा लोकबाजा थुपारेर राखे । उपयुक्त ठाउँको खोजी गरिहेकै बेला उनी नेपाल सम्पदा संघको कार्यसमिति सदस्य बने । त्यही बेला भद्रकाली गुठी संस्थानको भवनको माथिल्लो तला भाडामा लिएर २०५८ सालदेखि पाँच वर्षसम्म संग्रहालय बनाएर लोकबाजा संकलन गरिरहे । बाजाको संख्या बढिरहेको थियो । आफ्नै कुनै भवन थिएन । २०६३ सालमा संस्कृतिमन्त्री बुद्धिराज वज्राचार्यको कार्यकालमा उनले पुरातत्व विभागसँग आग्रह गरेर त्रिपुरेश्वरमा संग्रहालय सार्ने निधो गरे । पुरातत्व विभागमा कोषप्रसाद आचार्य महानिर्देशक थिए । उनकै सहयोगमा कँडेलले त्रिपुरेश्वर महादेव मन्दिरको सत्तल रहेको भवनमा नयाँ स्वरूपमा संग्रहालय स्थापना गरे । त्यसपछि उनले लगातार भाडा तिरेर संग्रहालय चलाइरहेका छन् । लोकबाजा संग्रहालयमा करिब ४० हजार अडियोभिडियो संगृहीत छन् । भीमशमशेर जबराको पालामा खिचिएको दुर्लभ भिडियो पनि छ । नेपालको संस्कृतिमा गरिएको अध्ययन तथा अनगिन्ती सामग्री पनि छन् । उनीहरू अब यी सबै सामग्री कुनै विश्वविद्यालय वा सरकारलाई जिम्मा दिन चाहन्छन् तर जिम्मा लिन कोही तयार छैनन् । बाजाको सांगीतिक अध्ययन जरुरी छ । यो पेसामा आउन खोज्नेलाई बाजा बजाउन सिकाउने, नेपालको मौलिक संस्कृति संरक्षण गर्नु जरुरी भएको उनी बताउँछन् । सरकारले आफैं गर्नुपर्ने काम एउटा संस्थाको माध्यमबाट आफूले गरिरहेको उनले बताए । ३५ लाखसम्मका बाजा संग्रहालयमा रहेका बाजाहरू चार हजारदेखि ३५ लाखसम्म मूल्यका छन् । हिमाल, पहाड र तराईका सबै भूभागमा बजाइने बाजाको कलेक्सन छ । यसका साथै यो संग्रहालयमा सारंगी, मादल तथा अनेक बाजा बजाउन सिक्न पनि सकिन्छ । केही समयअघि लोकबाजा प्रयोग प्रायः दुर्लभ भइसकेको थियो । यो संस्थाका माध्यमबाट उनीहरूले केही चेतना जगाउने काम गरे । विद्यालयस्तरको पाठ््यक्रममा कँडेलले लेखेको लोकबाजासम्बन्धी एउटा निबन्ध पनि समावेश छ । अहिलेका केही युवा पुस्ता संगठित रूपमा लोकसंस्कृति र लोकबाजा संरक्षणमा लागेका छन् । उनी भन्छन्, हामीसँग अन्य देशमा नभएका अनेक बाजा प्रचलनमा छन् । सहनाई मात्रै २८ प्रकारका छन् । पुर्खाका सीपलाई हामीले प्रयोग गर्न पनि नजान्ने भइसक्यौं । तर पछिल्लो समय यस क्षेत्रमा पुनर्जागरण भइरहेको उनको ठम्याइ छ । दौरा, सुरुवाल लगाउने चलन बढ्नु, विवाहमा आधुनिक ब्यान्डको सट्टा पञ्चैबाजा प्रयोग हुनु नेवारी समुदायमा पारम्परिक पहिरन लगाउनेको संख्या बढिरहेको उनको बुझाइ छ । अहिले संग्रहालय हटाउन दबाब आएको उनले जानकारी दिए । त्रिपुरेश्वर महादेव मन्दिरको निर्माण रानी ललित त्रिपुरा सुन्दरीले गरेकी थिइन् । उनले मन्दिरको निर्माण गरेपश्चात् काठमाडाैं बाहिरबाट आउने पाहुनालाई आ श्रय दिन मन्दिरको छेउमा संग्रहालय रहेको सत्तल निर्माण गरेको बताइन्छ । सत्तल रहेको स्थान संस्कृति मन्त्रालयअन्तर्गत पर्छ भने भवन गुठी संस्थानअन्तर्गत पर्छ । गुठी संस्थानले काठमाडाैं विश्वविद्यालयलाई अहिले यो संग्रहालय भएको भवन र ठाउँ भाडामा दिने गोप्य सम्झौता गरिसकेको छ । लोकबाजा संग्रहालय रहेको भवन भत्काएर केयूको म्युजिक विभाग सार्ने तयारी भइरहेको छ । अहिले निर्माणसम्बन्धी काम पनि भइरहेको छ । यसले गर्दा लोकबाजा संग्रहालय कहाँ राख्ने, कसरी यी अनमोल सम्पत्ति जोगाउने भन्ने चिन्ता छ । उनी भन्छन्, हामीले सांगीतिक पर्यटनमा धेरै प्रगति गर्न सक्ने सम्भावना छ । हाम्रा संस्कृति अमूल्य निधिका रूपमा छन् । संग्रहालयमा भएका बाजाको संरक्षण गरेर विश्वविद्यालयले उचित तरिकाले पाठ्यक्रममा समावेश गरिदिएमा आफ्नो सपना पूरा हुने उनले बताए ।"
"सामुद्रिक 'फेथाइ' ले मौसम बदली : देशभर चिसो बढ्यो","काठमाडौं : बङ्गालको खाडीको दक्षिणपश्चिमी क्षेत्रमा बनेको चक्रवात फेथाइ को प्रभावले नेपालमा मौसम बदली हुनुका साथै केही भूभागमा वर्षा र हिमपातको सम्भावना रहेको मौसम पूर्वानुमान महाशाखाले जनाएको छ । महाशाखाले सोमबार विज्ञप्ति जारी गर्दै चक्रवात उत्तरउत्तरपश्चिम दिशातर्फ सरिरहेको र यसको आंशिक प्रभावका कारण नेपालमा आज र भोलि देशको पूर्वी र मध्य क्षेत्रमा सामान्यदेखि पूर्णतया बदली भई केही भूभागमा हल्का वर्षा हुने र उच्च हिमाली भूभागहरूमा हल्कादेखि मध्यमखालको हिमपात हुने सम्भावना औँल्याएको हो । साथै पश्चिमी क्षेत्रहरूमा आंशिक बदली भई एकदुई स्थानमा हल्का र क्षणिक वर्षा हुने सम्भावना छ । चक्रवात प्रणाली उत्तरपश्चिम हुँदै भारतको आन्ध्र प्रदेशको तटीय क्षेत्रमा आज अपरान्ह्तिर ल्याण्डफल हुने महाशाखले जनाएको छ । महाशाखाका मौसमविद् वरुण पौडेलका अनुसार समुद्री आँधीले जमीनलाई छोएपछि त्यसलाई ल्याण्डफल भनिन्छ । ल्याण्डफलले वर्षा र हावाहुरी ल्याउने गर्दछ । आज बिहानैदेखि काठमाडौँ उपत्यकासहित मुलुकका विभिन्न क्षेत्रमा बदलीका कारण बढी चिसो महसुस गरिएको छ । उपत्यकाको आकाशमा बदली रहेका कारण चिसो बढेको छ । आज काठमाडौंको न्यूनतम २५ र अधिकतम तापक्रम २० डिग्री सेल्सियस रहेको छ । केही दिनयता निरन्तर न्यूनतम तापक्रम घटेकाले क्रमशः चिसो बढ्दै गएको छ । हिजो काठमाडौँको न्यूनतम तापक्रम ३ डिग्री सेल्सियस थियो । साता दिनअघि काठमाडौँको न्यूनतम तापक्रम ५ र ६ डिग्रीको हाराहारीमा थियो । पछिल्लो तीन दिन न्यूनतम तापक्रम ३ डिग्री सेल्सियस रहेको उपत्यकाको आज भने २ डिग्रीमा झरेको हो । न्यूनतम तापक्रम घट्नुका साथै मौसम बदली रहेकाले आज काठमाडौंमा यो वर्षकै बढी चिसो महसुस गरिएको छ । सबैभन्दा कम जुम्लाको न्यूनतम तापक्रम माइनस ६ डिग्री सेल्सियस रहेको छ ।"
"क्याम्पस प्रमुख वार्तामा नआएपछि रारा क्याम्पसका विद्यार्थी आन्दोलित","जनकपुरधाम : वार्तामा क्याम्पस प्रमुख नआएपछि रामस्वरुप रामसागर बहुमुखी क्याम्पसका विद्यार्थी आन्दोलित भएका छन् । क्याम्पसमा नियमित पठनपाठन गराउन असक्षम रहेको भन्दै क्याम्पस प्रमुख विजयलाल दासलाई विद्यार्थीले आइतबार दिउँसो कालोमोसो दलेका थिए । आइतबारै क्याम्पस प्रमुख दासले सूचना जारी गरेर सोमबार बिहान ८ बजे वार्ताको समय तोकेका थिए ।तर वार्ता गर्न प्रमुख दास नआएपछि विद्यार्थी प्रदर्शनमा उत्रिएका हुन् ।नियमित पठनपाठन हुनुपर्नेलगायतका माग राखेर विद्यार्थी सोमबार बिहान प्रदर्शन गरेका छन् । क्याम्पसमा पठनपाठन सुधारलगायतका माग पूरा नगरेसम्म आन्दोलन जारी राख्ने राष्ट्रिय विद्यार्थी संघका महासचिब रन्जित निष्पक्षले जानकारी दिए ।उनले क्याम्पस प्रमुखले राजिनामा दिएको भन्दै वार्तामा उपस्थित नभएको बताए ।"
"घाम लागेपछि मात्रै सुरु हुन्छ जिल्ला अस्पतालमा उपचार","सिमकोट : हिमपातले अत्याधिक जाडो बढेपछि जिल्ला अस्पताल हुम्लामा घाम लागेपछि मात्र बिरामीको उपचार हुने गरेको छ । उपचारका लागि अस्पताल आएका बिरामीलाई घाम लागेको समयमा खुलाचौरबाटै उपचार सुरु गरिएको जिल्ला स्वास्थ्य कार्यालयका निमित्त प्रमुख डा टसी लामाले जानकारी दिए । जिल्ला अस्पताल हुम्लाले बिरामीलाई चेकचाँज गर्दै आएको एक कोठा रंग लगाउने कार्य भैरहेको र अन्य कोठाभित्र अत्याधिक जाडो भएपछि गएको शुक्रबारदेखि खुलाचौरमै उपचार गर्न लागिएको डा लामाले बताए । जिल्ला स्वास्थ्य कार्यालयमा प्रशस्त भवन भएपनि कोठामा हिटर र अन्य व्यवस्था नभएपछि सामान्य स्वास्थ्य परीक्षणका लागि अस्पातल आउने बिरामीलाई खुलाचौरमै सेवा प्रदान गर्न लागिएको हो । जाडो र मौसम परिवर्तनसँगै बिरामीको संख्यामा वृद्धि भएर दैनिक ५० देखि ६० सम्मका बिरामीको चाँप हुन थालेपछि सबै बिरामीलाई अस्पताल परिसरकै चौरमा टेवल उपचार सुरु गरिएको जिल्ला अस्पताल स्रोतले जनाएको छ । जिल्लाको एक मात्रै अस्पताललाई सुविधा सम्पन्न बनाउनुभन्दा न्यूनतम मापदण्ड समेत पूरा नभएपछि बिरामीलाई अस्पतालका चिकित्सकले खुलाचौरबाटै उपचार सेवा प्रदान गरेको समान्य स्वास्थ्य परीक्षणका लागि जिल्ला अस्पतालमा आएका दाने खड्काले बताए ।"
