"शीर्षक","विवरण"
"संविधानमा लेखिएका कुरा 'यो त भन्ने कुरा न हो' गीतजस्तो होइन : प्रधानमन्त्री","काठमाडौं : प्रधानमन्त्री केपी शर्मा ओलीले संविधान कार्यान्वयनमा सरकार गम्भीरताका साथ लागेको दावी गरेका छन् । आफ्नो सरकार बन्नुअघिका सरकारले संविधानअनुसार कानुन बनाउने कामलाई हलुका ढंगले लिएकोले त्यसको अपजससमेत आफूले लिएर काम गरिरहेको प्रधानमन्त्रीको भनाइ छ । सरकारको एक वर्षको समीक्षा : संघीयता, सुशासन र समृतद्धिको आधार वर्ष' शीर्षकमा सिंहदरबारमा सम्बोधन गर्दै प्रधानमन्त्रीले संविधानमा लेखिएका कुरा 'भन्ने कुरा त हो' भन्ने गीतजस्तो नभएको टिप्पणी गरे । 'संविधानमा लेखिएका कुरा र त्यसको कार्यान्वयनको समयसीमा वर्तमान सरकारअघिका सरकारलाई पनि थाहा थियो तर म सरकारमा आउँदा ती कामले सरकार पर्खिरहेका थिएँ', प्रधानमन्त्रीले भने, 'संविधानमा लेखिएका कुरा 'यो त भन्ने कुरा न हो' भन्ने गीत जस्तो होइन ।' वर्तमान सरकार बनेपछि १६ कानुन निर्माण भइ कार्यान्वयनमा रहेको प्रधानमन्त्रीले सुनाए । मौलिक हक सम्बन्धी २५ कानुन संघीय संसदबाट पारित भएको उनले बताए । २३ विधेयकसंसदमा प्रस्तुत भएका र २४ विधेयक प्रस्तुत गर्ने अन्तिम तयारीमा रहेको उनले सुनाए । ३३९ कानुनमध्ये संविधानमा मेल नखानेलाई संविधान अनुकूल बनाउन लागिएको उनले सुनाए । संघ, प्रदेश र स्थानीय तहहरूमा अत्यन्त जटिल रहेको कर्मचारी समायोजनको काम पनि पूरा हुनै लागेको उनले बताए । गत वर्ष फागुन ३ मा केपी ओली नेतृत्वमा गठन भएको नेपाल कम्युनिस्ट पार्टी (नेकपा) नेतृत्वको सरकारले एक वर्ष पूरा गरेको अवसरमा प्रधानमन्त्रीले सरकारले गरेका काम सम्बोधनमार्फत् सुनाइरहेका हुन् । तस्बिर : सरोज बैजु"
"क्रिकेट र फुटबल खेलाडीलाई एक करोड ५६ लाख पुरस्कार दिने सरकारको निर्णय","काठमाडौं : मन्त्रिपरिषद् बैठकले क्रिकेट र फुटबल खेलाडीलाई १ करोड ५६ लाख रुपैयाँ पुरस्कार दिने निर्णय गरेको छ । सोमबार बसेको मन्त्रिपरिषद् बैठकको निर्णय बिहीबार सार्वजनिक गर्दै सूचना तथा सञ्चार प्रविधिमन्त्री गोकुल बाँस्कोटाले जानकारी दिएका हुन् । बास्कोटाका अनुसार क्रिकेट खेलाडीलाई पाँच लाख, मुख्य प्रशिक्षकलाई तीन लाख, अफिसियललाई जनही दुई लाख रकम दिने निर्णय भएको छ । सँगै सरकारले फुटबल खेलाडीलाई दुई लाख र शारीरिक सुगठन प्रतियोगिताका विश्व च्याम्पियन बनेका महेश्वर महर्जनलाई पाँच लाख दिने निर्णय गरेको बाँस्कोटाले जानकारी दिए । सँगै सरकारले अन्य विभिन्न विषयमा निर्णय गरेको छ । त्यसैगरी सरकारले नेपाल सरकार र संयुक्त राज्य अमेरिकाको मिलेनियम च्यालेन्ज कर्पोरेशन ९एमसीसी० बीच सम्पन्न ुमिलेनियम च्यालेन्ज कम्प्याक्ट अनुमोदनका लागि संघीय संसदमा पेश गर्ने, औद्योगिक क्षेत्र व्यवसथपन लिमिटेडको महाप्रबन्धकमा सुवास सिटौला नियुक्त गर्ने बजेट कायाृन्वयनमा देखिएको समस्या समाधान गर्ने निर्णय गरेको छ ।"
"प्रदेश १ : कानुन र योजनामै बित्यो पहिलो वर्ष","विराटनगर : प्रदेश १ सरकारले आफ्नो पहिलो वर्ष संघीयता कार्यान्वयनका लागि कानुन र आवधिक योजना निर्माणमै बिताएको छ । वर्षभर गरेका काम र उपलब्धिबारे जानकारी दिन मुख्यमन्त्री तथा मन्त्रिपरिषद् कार्यालयले विराटनगरमा बिहीबार पत्रकार सम्मेलन गर्दै बितेको एक वर्षलाई कानुन र आवधिक योजना निर्माण वर्ष भनेको छ । मुख्यमन्त्री शेरधन राईले गत वर्ष फागुन ३ गते प्रदेश १ को मुख्यमन्त्रीकारुपमा शपथ लिएर पाँच सदस्यीय मन्त्रीमण्डल गठन गरेका थिए । हामीले आफ्नो पहिलो वर्षको कार्यकाललाई संघीयता कार्यान्वयन र त्यसका लागि आवश्यक कानुन तर्जुमा गर्ने वर्षका रुपमा कार्यातालिका नै बनाएर काम गर्योँ, पत्रकार सम्मेलनमा राईले भने, पहिलो वर्ष कानुन निर्माण र आवधिक योजना निर्माण वर्षका रुपमा रहयो । कानुन निर्माण प्रक्रियामा दुईवटा अधिवेशन गरी २४ वटा ऐन पारित गरेको प्रदेश सरकारले जनाएको छ । पत्रकार सम्मेलनमा दर्जनौं निर्देशिका एवम् कार्यविधि तयार पारिएको मुख्यमन्त्री राईले बताए । उनका अनुसार तेस्रो अधिवेशन सकिँदा प्रदेशलाई आवश्यक धेरै कानुन बनाइसक्ने योजना छ । उनले नेपालमै पहिलो पटक प्रदेश सरकार बनेकाले सरकारले शून्य संरचनाबाट काम अघि बढाउनु पर्दा धेरै कठिनाइ झेल्नु परेको बताए । सुरुका केही समय संरचना, कर्मचारी र कार्यालय व्यवस्थापनमै खर्चनु परेको बताउँदै राईले कर्मचारी अभावका कारण गर्न खोजेका काम छिटोछरितो हुन नसकेको स्वीकारे । राईले विकास र सुशासनका लागि जनताले आशा र भरोसा गर्ने निकायका रुपमा प्रदेशलाई स्थापित गर्ने प्रतिवद्धा जनाए । काम छिटो र छरितो हुन नसक्नुमा संघीय सरकारको बिलम्ब भएको उनको आरोप छ । उनले आवधिक योजनासँग जोडेर विस्तृत योजना बनाएर अघि बढ्ने तयारी भइरहेको जानकारी गराएका छन् । लगानीका हिसाबले प्रदेश अनुकुल सन्देश दिन सकेका छौं, मुख्यमन्त्री राईले भने, कृषि क्षेत्रको आधुनिकीकरण, व्यवसायीकरण र बजारीकरणलाई मुख्य प्राथमिकतामा राखेर योजना अगाडि बढायएको छ । प्रदेशमा रहेको मिल्क होलिडेको ठूलो समस्या समाधान गर्न विराटनगर दुग्ध वितरण आयोजनाको पाउडर प्लान्ट स्थापनाको काम अघि बढेको उनको भनाइ छ । आत्मनिर्भर अर्थतन्त्र भएको प्रदेश बनाउन घोषणा गरिएको हरित अभियानलाई पनि सरकारले आफ्नो उपलब्धिका रुपमा लिएको उनको भनाइ छ । एक नम्बर प्रदेशको शान, सबैको अनुहारमा मुस्कानको नारासहित पर्यटन पूर्वाधार विकासमा जोड दिइएको मुख्यमन्त्री राईले बताए । पर्यटन प्रवद्र्धनलाई चाँडै व्यवस्थित बनाएर आन्तरिक तथा बाह्य पर्यटकलाई आकर्षित गर्ने योजना रहेको उनले प्रष्ट पारे । विराटनगर विमानस्थललाई अन्तराष्ट्रिय विमानस्थल बनाउनका निम्ति संघीय सरकारमा सिफारिस भएको उनको भनाइ छ । सप्तकोसी नदीमा सञ्चालन भएको जलयातायातलाई तुम्लिङटार र दोलालघाटसम्म विस्तार गर्नका लागि अध्ययन थालिएको उनले खुलासा गरे । चियाको राजधानी इलामको सूर्याेदय नगरपालिका, सबैभन्दा बढी पर्यटक भित्रिने सोलुखुम्बुको पासाङल्हामु गाउँपालिका र धनकुटाको आकर्षक पर्यटकीय गन्तव्यस्थल भेडेटार नाम्जे क्षेत्र रहेको साँगुरी गाउँपालिकालाई पर्यटकीय नगर र गाउँपालिका घोषणा गरिएको विषयलाई सरकारको उपलब्धिका रुपमा लिएको उनको भनाइ छ । प्रहरीको सबै सूचनासहितको स्टिकर प्रदेशका १० लाख घरमा टाँसिदा जनताले सुरक्षित महसुश गर्न सकेको दाबी मुख्यमन्त्री राईको छ । सुरक्षित सीमा, सुरक्षित जीवन, खुला सीमा र सुरक्षा चुनौतीलाई महसुस गर्दै बोर्डर आउट पोष्ट (वीओपी) को योजनाबद्ध विकास गर्ने उदेश्यका साथ १३ वीओपी निर्माण कार्य अघि बढाइएको उनको भनाइ छ । राईले प्रदेश भरी ४९ वटा प्रहरी कार्यालय निर्माणको काम अघि बढेको बताए । शिक्षा, स्वास्थ्य, खेलकुद जस्ता विषयमा सरकार गम्भीर भएर लागिरहेको उनको भनाइ छ । राईका अनुसार खेलकुदका लागि एक सय ३७ वटै स्थानीय तहमा एकैसाथ खेलमैदानहरू निर्माण हुँदैछन् । सिताराम कट्टेल (धुर्मुस) र कुञ्जना घिमिरे (सुन्तली) लाई सद्भावना दूतका रुपमा नियुक्त गरेर शिक्षा र स्वास्थ्यमा विशेष जोड दिइएको उनको दाबी छ । सामुदायिक विद्याललाई प्रविधियुक्त बनाउन नौ सय ५९ वटा विद्यालयमा कम्प्युटर ल्याबहरु स्थापना गरिएको उनको भनाइ छ । विराटनगरको कोसी अञ्चल अस्पताललाई विशेषज्ञ चिकित्सकसहित शिक्षण अस्पलाल बनाउन पहल सुरु भएको दाबीसमेत मन्त्री राईले गरे । पाँचथरको कुम्मायक, तुम्बेवा, तेह्रथुमको छथर र धनकुटाको चौबीसकोट गाउँपालिकाका खडेरी प्रभावित कृषकलाई राहत प्याकेज उपलब्ध गराइएको जानकारी मुख्यमन्त्री राईले दिए । सडकको स्तरोन्नती गर्दै सडक सुरक्षा र सुशासन कायम गर्न नयाँ कामको थालनी गरिएको राईले बताए । सुनसरीको कोसी गाउँपालिकाको भण्टाबारीमा अत्याधुनिक सुविधासम्पन्न रिफ्रेसमेन्ट सेन्टर परियोजनाको काम अघि बढाइएको उनको भनाइ छ । सडक, पुल, सिंचाई, भवन, खानेपानी लगायतका योजनाको विस्तृत सर्वेक्षण गरेर डीपीआएर तयार पार्ने काम भइरहेको उनको भनाइ छ । प्रदेशका ५६ निर्वाचन क्षेत्रमा सडक तथा पक्की पुलका योजना एकएक वटा राख्ने गरी बहुवर्षिय योजना छनोट गरी काम अगाडि बढेको छ, राईले भने, मुख्यमन्त्री ग्रामीण सडक कार्यक्रम प्रदेशका ५६ वटै निर्वाचन क्षेत्रमा लागू हुँदैछ । समानुपातिक विकासलाई प्राथमिकता दिँदा फायल बोकेर माग्ने र धाउने युगको अन्त्य हुने सरकारको विश्वास छ । प्रदेश बलियो हुँदा संघीयता प्रभावकारी हुने मुख्यमन्त्री राईको भनाइ छ ।"
"""परराष्ट्र नीतिबारे ओलीको नारा","'सबैसँग मित्रता, कसैसँग पनि छैन शत्रुता'"",""काठमाडौं : बिहीबार प्रधानमन्त्री केपी शर्मा ओलीले जनताका नाममा सम्बोधन गर्दै सरकार गठन भएको एक वर्षको अवधिमा छिमेक नीति र परराष्ट्र नीतिमा उल्लेखनीय प्रगति भएको बताएका छन् । ओलीले सरकारले 'सबैसँग मित्रता, कसैसँग पनि छैन शत्रुता नाराका साथ परराष्ट्र सम्बन्ध सुमधुर बनाएको बताएका हुन् । उनले विश्वमा देखिने गरी आफ्ना भनाइ अघि सार्दै सन्तुलित परराष्ट्र नीति अघि बढाएको दाबी गरेका छन् । उनले अन्तर्राष्ट्रिय जगतमा नेपालप्रतिको विश्वास र आकर्षण बढेको विश्वाससमेत व्यक्त गरेका छन् । उनले राष्ट्रपति विद्यादेवी भण्डारीको कतार र पोल्याण्ड भ्रमण सफल भएको र उपराष्ट्रपतिले १७ औं पश्चिमी चीन अन्तर्राष्ट्रिय मेलामा सहभागीता जनाएको उल्लेख गरेका छन् । मेरो भारत भ्रमण र भारतका प्रधानमन्त्रीको नेपाल भ्रमणबाट दुई देश बीचको सम्बन्ध नयाँ उचाइमा पुगेको छ, उनले भने, दुई मुलुक बीचका केही थाती रहेका समस्या समाधान हुँदै गएका छन् । उनले भारतको सहयोगमा सञ्चालित आयोजनाहरूको कार्यान्वयनले गति लिएको विश्वास व्यक्त गरे । दुई देशबीच कृषि, रेलमार्ग र अन्तरदेशीय जलमार्गका क्षेत्रमा सहयोग अघि बढाउने सहमति हुनुका साथै थप सहयोगका क्षेत्र विस्तार भएको बताए । ओलीले चीन भ्रमणको अवसरमा चीनका राष्ट्रपति तथा प्रधानमन्त्रीसँग भएका महत्वपूर्ण भेटघाट एवम् वार्ताबाट रेल्वे, कनेक्टिभिटी र ऊर्जा क्षेत्रसँग सम्बन्धित आयोजनामा सहयोग आदान प्रदान गर्नेविभिन्न १४ समझदारी तथा सम्झौता भएको स्मरण गरेका छन् । सँगै ओलीले संयुक्त राष्ट्रसंघको ७३ औं महासभालाई सम्बोधन गरेको र विश्व शान्ति, अन्तर्राष्ट्रिय सुरक्षा, मानव अधिकार र दीगो विकासलगायतका विषयमा नेपालको धारणा राखेँको सम्झना गरे । हामी आफैँले नेतृत्व गरेको मौलिक प्रकृतिको शान्ति प्रक्रिया आधारभूत रुपमा टुङ्गिएको मैले स्मरण गराएँ उनले भने, नेपालको यो अनुभव, द्वन्द्वमा फसेका मुलुकहरूका लागि अनुकरणीय सन्दर्भ हुनसक्ने विश्व जनमत रहेको मैले पाएँ ।'"""
"एयरपोर्टबाटै ट्याक्सी चालकले कुटपिट गरेर लुटे एक लाख","काठमाडौँ : एकजना ट्याक्सी चालकले त्रिभुवन विमानस्थलको मूख्य गेट (गोल्डेन गेट) अगाडिबाट यात्रुमाथि लुटपाट गरेका छन् । त्रिभुवन विमानस्थलको गोल्डेन गेट नजिकैबाट ती ट्याक्सी चालकले काठमाडौं महानगरपालिका३२ कोटेश्वर बस्ने ओखलढुंगा सिद्धिचरण नगरपालिका९ का ५६ वर्षीय रामराजा कार्कीबाट लुटपाट गरेका हुन् । प्रहरीका अनुसार गोल्डेन गेट नजिकै सडकमा बा१ ज ९०७१ नम्बरको ट्याक्सीका नाम थर नखुलेका चालकले कार्कीबाट बुधबार दिउँसो एक लाख रुपैयाँ लुटेर फरार भएका हुन् । त्यही ट्याक्सीले ठक्कर दिएर बायाँ खुट्टामा चोट लागेपछि सडकमा लडेका कार्कीको साथमा रहेको नगद ती ट्याक्सी चालकले लुटेर फरार भएका हुन् । ट्याक्सीले ठक्कर दिएपछि दुई पक्षबीच विवाद भएको थियो । विवादका क्रममा चालकले कार्कीलाई कुटपिटसमेत गरी नगद एक लाख रुपैयाँ लिएर फरार भएको केन्द्रीय प्रहरी समाचार कक्षले जनाएको छ । प्रहरीले फरार ट्याक्सी चालकको खोजी गरिरहेको जनाएको छ ।"
