"शीर्षक","विवरण"
"""चीनको अवरोधले भारत असन्तुष्ट","चिनियाँ सामान बहिस्कार गर्न ट्विटरमा अभियान"",""एजेन्सी नयाँदिल्ली : भारतले पाकिस्तानमा आश्रय लिइरहेको लडाकु समूहका नेता मसूद अजहर र उनले नेतृत्व गरेको जैशएमोहम्मद समूहलाई कालोसूचीमा राख्ने संयुक्त राष्ट्रसंघको प्रस्ताव चीनले अस्वीकृत गरेको भन्दै असन्तुष्टि व्यक्त गरेको छ । फेब्रुअरी १४ मा भारत प्रशासित कश्मीरको पुलवामा विस्फोट हुँदा ४० जना भारतीय सुरक्षाकर्मीको मृत्यु भएको थियो । जैशएमोहम्मदले उक्त घटनाको जिम्मेवारी लिएको थियो । उक्त घटनालगत्तै दुबै मुलुकबीच एकअर्का विरुद्ध हवाई आक्रमण र सीमाक्षेत्रमा गोलाबारी भएको थियो । कश्मीर विवादलाई लिएर विगतमा दुईपटक भीषण युद्ध गरिसकेका यी दुई आणविक अस्त्र सम्पन्न मुलुकबीच अर्को युद्ध भड्किने खतरा बढेको थियो । चीनले बुधबार बेलायत, फ्रान्स र अमेरिकाले मसूद अजहरलाई राष्ट्रसंघीय कालोसूचीमा राख्न अघि बढाएको प्रस्ताव स्थगन गरिदिएको थियो । मसूदमाथि विश्वव्यापी यात्रामा प्रतिबन्ध, सम्पत्ति रोक्का र हातहतियारमाथि प्रतिबन्ध लगाउने उक्त प्रस्तावमा उल्लेख थियो । पाकिस्तानलाई आर्थिक, राजनीतिक तथा सामरिक मद्दत गरिरहेको चीनले अजहरमाथिको प्रतिबन्धको प्रस्तावमाथि अध्ययन गर्न थप समय चाहिएको जनाएको थियो । चीनको उक्त अनुरोधसँगै प्रस्ताव करिब ९ महिनापछि धकेलिएको छ । चीनले स्थायी शान्ति कायम गर्न हतार हुने भन्दै आफूले भिटो प्रयोग गरेको जवाफ दिएको छ । मसूदलाई राष्ट्रसंघले आतंकवादी घोषणा गर्दा भारतपाकिस्तान शान्ति वार्तामा असर पर्ने भन्दै चीनले आफ्नो बचाउ गरेको छ । यस विषयमा अध्ययन गर्न समय लाग्ने र आफूले अध्ययन गरिहेको चीनको भनाइ छ । यद्यपि चीनले सन् २००१ देखि नै यो विषयलाई टार्दै आएको छ । भारतीय विदेश मन्त्रालयले चीनको कदमबाट भारत निराश भएको जनाएको छ । मन्त्रालयले भारतीय नागरिकमाथि नृशंस आक्रमणमा संलग्न आतंकवादी नेताहरूलाई कानुनी कठघरामा ल्याउन सबै सम्भाव्य उपाय खुलै राख्ने पनि स्पष्ट गरेको छ । चीनले राष्ट्रसंघीय प्रतिबन्धसम्बन्धी समितिमा विगतका तीनवटा प्रयत्नलाई अवरुद्ध गरिसकेको छ । जैशएमोहम्मदलाई सन् २००१ मै राष्ट्रसंघीय आतंकवादी सूचीमा राखिएको छ । संयुक्त राष्ट्र सुरक्षा परिषद्मा अमेरिकाले मसूदमाथि कारबाहीका लागि अन्य विकल्प लिने बताएको छ । चीनले आतंकवादविरुद्ध लड्ने हो भने यस्ता गतिविधि गर्न नहुने अमेरिकी भनाइ छ । चीनको निर्णयप्रति भारतीय सञ्चारमाध्यमले तिखो व्यंग्य गरेका छन् । चीनको कदमको भारतीयले विरोध गरेका छन् । योगगुरु बाबा रामदेवले पनि चिनियाँ सामानको बहिष्कार गर्न आह्वान गरेका छन् । उनले ट्विट गर्दै भनेका छन्, मसूद अजहर समर्थकसहित देशभित्र र बाहिरका व्यक्तिलाई हामीले राजनीतिक, सामाजिक, आर्थिक रूपमा बहिष्कार गर्नुपर्छ । चीनले त विशुद्ध रूपमा व्यावसायिक भाषा मात्र बुझ्छ । आर्थिक बहिष्कार युद्धभन्दा पनि शक्तिशाली हुन्छ । उनीहरूले सामाजिक सञ्जालमा चीनबाट आयात हुने सामान बन्द गर्न आह्वान गरेका छन् । उनीहरूले ट्विटरमा बाइकटचाइनिजप्रोडक्ट्स अभियान नै शुरु गरेका छन् । आफूले उपयोग गर्दा तिरेको रकम भारतमा आतंकवादी आक्रमण गर्नेको हातमा पुग्ने भन्दै उनीहरूले संयमित हुन उपभोक्तालाई आह्वान गरेका छन् ।"""
"निःशुल्क टयुसन कक्षा पाएपछि विद्यालय जान थाले मुसहर बालबालिका","सिरहा : धनगढीमाई नगरपालिका १३ भर्लेनीका रमेश सदायको उमेर १० वर्ष भए पनि कक्षा १ मै पढ्छन् । जन्मदर्ता प्रमाण पत्र नहुँदा उनी विद्यालयमा पढ्न कहिलेकाही गए पनि भर्ना भएका थिएनन् । सोही उमेरका रन्जन र सरिता सदाय कक्षा ५ मा पढ्छन् । सदायको भर्ना भए पनि नियमित विद्यालय जादैँन थिए । अभिभावक दिनभरी मजदुरी गर्न बाहिर जाँदा उनीहरु खेलेर समय बिताउने गरेका थिए । पछिल्लो समयमा वडा कार्यालयले दलित बालबालिकालाई निःशुल्क जन्मदर्ता र ट्युशन कक्षाको व्यवस्था गरिदिएपछि उनीहरु नियमित रुपमा विद्यालय गएर पढ्न थालेका छन् । गत आर्थिक वर्षमा वडा कार्यालयले दलित जनकल्याण युवा क्लबको सहयोगमा निःशुल्क ट्युशन कक्षा सञ्चालन गर्नका लागि सदाय दलित पाहुना तथा बाल भवन निर्माण गरिदिएका छन् । वडाले नै मासिक ६ हजार भत्ता दिएर एक जना शिक्षक नियुक्त गरेका छन् । अभिभावक काममा जाँदा खाली समय खेलेर नै बिताउने गरेका दलित बालबालिकाले अब त्यो समयमा ट्युसन पढ्न थालेपछि विद्यालयमा पनि नियमित भएको वडा अध्यक्ष सुर्यमान तामाङ्गले बताए । भवन निर्माणका लागि वडा कार्यालयको ३ लाख ७५ हजार , दलित जनकल्याण युवा कल्बले एक लाख र जनश्रमदानबाट २५ हजार खर्च लागेको थियो । ट्युसन कक्षामा ४३ जना बालबालिका पढ्ने गरेको उनीहरुलाई पढाउने शिक्षक शिवनाथ रामले बताए । सबै बालबालिका आधारभुत विद्यालय भर्लेनीका हुन् । शिवनाथ कक्षा १२ सम्म पढ्का छन् । अहिले कम्प्युटर विषयमा डिप्लोमा गरिरहेको उनले बताए । बिहान आफु पढ्छु र दिउँसो ३ बजेदेखि ५ बजेसम्म ट्युशन पढाउँछु, उनले भने,ट्युशन कक्षाले दलित बालबालिकामा परिवर्तन आएको छ । उनका अनुसार ४५ घरधुरी मुसहर समुदायका बालबालिका पढ्न थालेको छ । उनी मुसहर बालबालिकालाई ९ महिनादेखि पढाई रहेका छन् । सुरु सुरुमा मुसहर बालबालिकालाई विद्यालय पठाउन हम्मे हम्मे परेको वडा अध्यक्ष तामाङले सुनाए । विद्यालयमा भर्ना गराए पनि पढ्न नियमित जाँदैन थिए, उनले भने,त्यसपछि उनीहरु पढ्नलाई आकर्षित हुन् भनेर निःशुल्क रुपमा ट्युशन कक्षा सञ्चालन गरेँ । बालबालिकालाई विद्यालयमा नामाकंन गराउन पनि प्रहरी गाउँमा ल्याउर सचेत गराएपछि अभिभावकहरुले आफ्नो बालबालिका विद्यालयमा पठाउन थालेको उनले सुनाए । समय समयमा विद्यार्थीहरुलाई शैक्षिक सामग्री पनि सहयोग गरेको उनले जानकारी गराए । यस टोलको मुसहर बस्तीमा सबैभन्दा बढी पढ्ने अर्जुन सदाय हुन् । उनी कक्षा ८ मा पढ्छन् । उनैको अगुवाइमा भवानी बाल कल्ब गठन गरिएको छ । जसमा २५ जना बालकालिका आवद्ध रहेका छन् । रेखदेखका लागि फुलेश्वरीदेवी सदायको अध्यक्षतामा भवन निगरानी समिति पनि बनाइएको छ । फुलेश्वरीको पनि छोराहरु रन्जन कक्षा ५, धिरज कक्षा २ र छोरी श्रृजना कक्षा १ मा पढ्दै छन् । उनीहरु ट्यसन पाएपछि विद्यालय नियमित जान थालेको उनले सुनाइन् ।"
"प्रदेश १ मा ५१ प्रहरी भवन बन्दै","विराटनगर : प्रदेश १ मा ५१ वटा नयाँ प्रहरी भवन निर्माणको काम अघि बढाइएको छ । प्रदेश सरकारले आर्थिक वर्ष २०७५०७६ मा विनियोजन गरेको एक अर्ब ३० करोड रुपैयाँबाट भवन निर्माणको प्रक्रिया अघि बढाइएको हो । प्रदेशका १४ वटै जिल्लाका विभिन्न प्रहरी युनिटमा सुविधा सम्पन्न, प्रविधियुक्त र अत्याधुनिक भवन निर्माण हुने प्रदेश १ का प्रहरी प्रमुख डीआईजी केदार रिजालले बताए । भवन र आवश्यक संरचना अभावमा भाडाका घर र कच्ची संरचनाबाट जनताको सुरक्षा गर्नु परिरहेको थियो, उनले भने, त्यही भएर प्रदेशको शान्ति सुरक्षाको अवस्थालाई चुस्त बनाउन प्रहरीका लागि सुविधा सम्पन्न भवन निर्माण थालिएको छ । प्रदेश सरकारको बहुवर्षीय योजना अन्तर्गत सबै भवनहरु निर्माण भइसकेपछि प्रहरीलाई तत्कालको संरचना अभावको समस्या टर्ने बताइएको छ । एउटा भवन प्रदेश १ प्रहरी कार्यालय विराटनगरमा पनि बन्ने छ । प्रदेश १ का मुख्य मन्त्री शेरधन राईले शिलालेख अनावरण गरी विधिवत रुपमा भवनको शिलान्यास गरे । सम्झौता भएको मितिले दुई वर्ष भित्रमा निर्माण सम्पन्न गर्ने गरी प्रदेश सरकारले यो भवनका लागि आर्थिक वर्ष २०७५०७६ मा ५ करोड रुपैयाँ बजेट विनियोजन गरेको छ । १६ हजार १ सय २१ स्क्वायर फिटमा ५ तले सुविधा सम्पन्न भवन निर्माण गरिने डीआईजी रिजालले बताए । उनका अनुसार पहिलो तलामा १८ वटा कोठा भएको २ वटा कन्फरेन्स हल, सीसीटिभी सहितको प्रहरी परिचालन कक्ष रहने छ । दोस्रो तलामा ३० वटा कोठा, प्रदेश प्रहरी प्रमुखको कार्यकक्ष, मिटिङ्ग हल, महाशाखाको कार्यकक्ष रहने छ । यसै गरी तेस्रो तलामा २० वटा कोठाहरूमा महाशाखा, शाखा प्रमुखहरूको कार्यकक्ष रहनेछ भने चौथो तलामा १६ वटा कोठा र पाँचौ तलामा १३ वटा कोठाहरू रहने रिजालले बताए । प्रदेश सरकारले प्रदेश प्रहरीलाई १५ वटा चार पाङग्रे गाडी र २ सय मोटरसाइकल पनि प्रदान गरेको छ । मुख्यमन्त्री राईले सुरक्षा अवस्था मजवुत नभएसम्म विकास निर्माणलाई अगाडि बढाउन नसकिने बताए । प्रदेश सरकारले पहिलो प्राथामिकतामा सुरक्षा र सुशासनलाई राखेको छ, उनले भने, त्यही भएर प्रहरीका भवन निर्माणमा बजेट विनियोजन गरेर काम थालिएको छ । प्रहरीलाई सवारी साधन पनि हस्तान्तरण गरिएको छ । सुरक्षा अवस्था मजवुत नभएसम्म आम नागरिकले सुरक्षाको अनभूति गर्न नसक्ने उनले बताए । मुख्य मन्त्री राईले जनताकै सुरक्षाका लागि सरकार गम्भीर रहेको र सुरक्षामा खटिने प्रहरीलाई भौतिक रुपमा सुविधा सम्पन्न गराउँदै प्रविधियुक्त शान्ति सुरक्षामा जोड दिइएको बताए । आन्तरिक मामिला तथा कानुन मन्त्री हिक्मत कार्कीले शान्ति सुरक्षाको अवस्थालाई मजवुत बनाउन सकिए मात्रै मुलुकमा समृद्धि र विकास सम्भव रहेको बताए । प्रहरी महानिरीक्षक सर्वेन्द्र खनालले सुविधा सम्पन्न संरचना निर्माणले शान्ति सुरक्षाको अवस्था मजवुत बनाउन प्रहरीलाई ठूलो सहयोग र हौसला मिल्ने बताए । सुरक्षा पहिलो र आधारभूत सर्त रहेको बताउँदै उनले प्रहरी शान्ति सुरक्षा प्रदान गर्न कटिबद्ध भएर लागि परेको बताए ।"
"इलाममा आगलागीबाट १ करोड ४० लाखको क्षति","इलाम : इलामको सन्दकपुर गाउँपालिकाको माईपोखरी प्रवेशद्वार अगाडिको होटलमा बिहीबार भएको आगलागीबाट ५ वटा घर जलेका छन् । दिउँसो स्थानीय चक्रदिप मुखियाको भान्साघरबाट सुरु भएको आगोले ५ वटा होटल र होटलमा भएका सर सामान जलेर पूर्ण रुपमा नष्ट हुँदा १ करोड ४० लाख बढीको क्षति भएको प्रहरीले जनाएको छ । आगलागीबाट चक्र मुखिया, निमदोर्जे शेर्पा, मिङमालमु शेर्पा, कमल मुखिया, र लाक्पा शेर्पाले संचालन गर्दै आएका काठबाट निर्माण गरिएका होटल र ती होटलमा रहेका सरसामान जलेर पूर्ण रुपमा नष्ट भएको प्रहरीले जनाएको छ । आगलागीबाट चक्रदिप मुखियाले संचालन गरेको सिम्रन होटल जलेर नष्ट हुँदा ४२ लाख बराबरको सरसामान, २० तोला सुन , १० तोला चाँदी र १० लाख नगद जलेर नष्ट भएको जनाइएको छ । यस्तै निमदोर्जे शेर्पाको पेमु होटल जलेर नष्ट हुँदा ४० लाख मुल्य बराबरको सरसामान , नगद ३ लाख र ६ तोला सुन जलेर नष्ट भएको छ । आगलागीबाट कमल मुखियाले संचालन गरेको १० लाख बराबरको सरसामान, ९ लाख २० हजार नगद , १ तोला सुन र १० तोला चाँदी जलेर नष्ट भएको छ । यस्तै आगलागीबाट स्थानीय लाक्पा शेर्पाले संचालन गरेको होटल जल्दा २९ लाख बढीको क्षति भएका छ भने मिङमादिकी शेर्पाको होटल जल्दा ६ लाखको सरसामान, नगद ५० हजार र २ तोला सुन जलेर नष्ट भएको छ ।"
