"शीर्षक","विवरण"
"""१४ एसपी एसएसपीमा बढुवा","२६ डिएसपी एसपीमा बढुवा (सूचीसहित)"",""काठमाडौँ : लामो समयको अनिश्चिततापछि नेपाल प्रहरीले एसपी र एसएसपीको बढुवासूची सार्वजनिक गरेको छ । प्रहरी प्रधान कार्यालयले १४ जना एसपीलाई एसएसपीमा बढुवा गर्दा २६ जना डिएसपी एसपीमा बढुवा भएका छन् । प्रहरी प्रधान कार्यालयले खाली रहेको वरिष्ठ प्रहरी उपरीक्षक (एसएसपी) मा पदपुर्ति गरेको छ । प्रहरी प्रधान कार्यालय नक्सालमा शनिबार राति गृह सचिव प्रेमकुमार रार्इ र प्रहरी महानिरीक्षक सर्वेन्द्र खनालससहितको बैठकले १४ एसपीलाई एसएसपीमा बढुवा गर्ने निर्णय गरेको हो । एसएसपी बढुवा हुनेहरूमा सन्दीप भण्डारी, टेकप्रसाद राई, उमेशराज जोशी, श्यामलाल ज्ञवाली, गणेश रेग्मी, रामदत्त जोशी, दीपक थापा, मिरा चौधरी, बुद्धिराज गुरुङ, किरण बज्राचार्य, पोषराज पोखरेल, टेकबहादुर तामाङ, वसन्तबहादुर कुवँर र भीम ढकाल रहेका छन् । त्यसैगरी प्रहरी प्रधान कार्यालयले २६ जना प्रहरी नायव उपरीक्षक (डिएसपी) लाई प्रहरी उपरीक्षक (एसपी) मा बढुवा गरेको छ । बढुवामा पर्नेहरूमा रमेश बस्नेत, हिरा पाण्डे, श्यामकृष्ण अधिकारी, नान्तीराज गुरुङ, रवीन्द्र रेग्मी, गोविन्द अधिकारी, कृष्ण प्रसाईं, मेखबहादुर खत्री, विनोद सिलवाल, भीम दाहाल र रमेश थापा रहेका छन् । त्यसैगरी एसपीमा बढुवा हुने अन्यममा प्रकाश रानाभाट, बिमल कँडेल, कमल थापा, जनार्दन जिसी, कृष्ण कोइराला, सन्तोष खड्का, दानबहादुर मल्ल, रञ्जु सिग्देल, अनुप शमशेर राणा, श्याम महतो, कृष्ण पङ्गेनी, हेम थापा, अजय केसी, नवराज अधिकारी र वीरबहादुर बुढामगर रहेका छन् । अब प्रहरीले खाली रहेको एकजना प्रहरी नायव महानिरीक्षकमा बढुवाको टुंगो लगाउन बाँकी छ । काभ्रेमा भएको सवारी दुर्घटनामा ज्यान गुमाएका प्रहरी नायव महानिरीक्षक सुशील भण्डारीको स्थानमा प्रहरी प्रधान प्रधान कार्यालय एकजना एसएसपीलाई बढुवाको तयारी गरेको हो ।"""
"बालक हत्या गर्ने ८ वर्षपछि पक्राउ : सम्पत्ति हडप्न भिनाजुको यस्तो थियो योजना","विराटनगर : मोरङको रंगेली नगरपालिका ४ का १५ वर्षीय बालक उपेन्द्र साहको अपहरणपछि हत्या गरिएको घटनामा संलग्नलाई प्रहरीले घटना भएको ८ वर्षपछि पक्राउ गरेको छ । बालकको अपहरणपछि हत्या गर्ने रंगेली४ का ४० वर्षीय ठेङवा भनिने रमेश मण्डललाई प्रहरीले शुक्रबार राति पक्राउ गरेको हो । बालकको हत्यापछि भारतमा लुकिछिपी बसेका उनलाई गाउँ आएको मौका छोपेर पक्राउ गरिएको इलाका प्रहरी कार्यालय रंगेलीका प्रहरी निरीक्षक कवीन्द्र कार्कीले जानकारी दिए । उनका अनुसार २०६७ साल फागुन ८ गते साँझ अमरलाल साहका छोरा १५ वर्षीय उपेन्द्र बेपत्ता भएका थिए । लामो समयसम्म खोजतलास गर्दा पनि फेला नपरेका बालकको कंकाल बेपत्ता भएको चार वर्षपछि २०७१ कात्तिक १४ गते फेला परेको थियो । प्रनि कार्कीका अनुसार छिमेकी ईनरलाल मण्डलको शौचालयको सेफ्टी ट्याङ्की सफा गर्ने क्रममा कपडासहितको मानव कंकाल फेला परेपछि अनुसन्धान गर्दै जाँदा उक्त कंकाल उपेन्द्रकै भएको पत्ता लागेको थियो । त्यतिबेला बेपत्ता हुँदा लगाएको कपडाका आधारमा मानव कंकाल बालककै भएको खुलेको उनको भनाई छ । आफ्नै भिनाजु ४० वर्षीय शम्भु साहको योजनामा बालकको अपहरणपछि हत्या गरेको अनुसन्धानबाट पत्ता लागेको मोरङ प्रहरीका डीएसपी घनश्याम श्रेष्ठले बताए । उनका अनुसार घटनाको योजना बनाएका भिनाजु शम्भुले रमेशको साथ लिएर बालकको अपहरणपछि हत्या गरेको खुलेको हो । हत्या गरेपछि छिमेकीको सेफ्टी ट्यांकी भित्र शव फ्यालिएको र पछि सफा गर्ने क्रममा कंकाल फेला परेको श्रेष्ठले बताए । ससुरालीको सबै सम्पत्ति आफ्नो बनाउने प्रपञ्च रचेर शम्भुले ससुरालीमा रहेका एउटा मात्रै सालोको हत्याको योजना बनाएको अनुसन्धानका क्रममा खुलेको थियो । शम्भुलाई भने प्रहरीले यस अघि नै पक्राउ गरिसकेको छ । उनी अहिले कारागारमा अदालतले फैसला गरेको २० वर्षे कैद सजाय भुक्तान गरिरहेका छन् । घटनामा संलग्न भए पनि लामो समयदेखि फरार रहेका मण्डललाई समेत अपहरण तथा कर्तव्य ज्यान मुद्दामा उच्च अदालत विराटनगरले २० वर्ष कैद सजायको फैसला सुनाइसकेको छ । मण्डललाई २०७३ साल बैशाख २८ गते जिल्ला अदालत मोरङले एक वर्ष पाँच दिनको मात्रै कैद सजाय सुनाएको थियो । उक्त कैद सजाय भने भुक्तान गरेर उनी जेलमुक्त भएका थिए । पछि उच्च अदालत विराटनगरले २०७४ साल जेठ ३० गते जिल्लाको फैसलालाई उल्टाउँदै मण्डललाई २० वर्षको कैद सजाय सुनाएको थियो । त्यसपछि भने उनी फरार बनेका थिए । प्रनि कार्कीले लामो समयको निरन्तर निगरानी तथा नेपालभारत सीमावर्ती क्षेत्रमा आएको हुन सक्ने सूचनाका आधारमा मण्डललाई पक्राउ गर्न सकिएको हो । पक्राउ परेका मण्डललाई अदालतमा बुझाइने प्रहरीले जनाएको छ । अदालतले उनलाई कैद सजाय भुक्तानका लागि कारागार चलान गर्ने छ । त्यस्तै राहदानी किर्ते मुद्दाकी एक फरार प्रतिवादीलाई पनि प्रहरीले अदालतले दोषी ठहर गरेको सात वर्षपछि पक्राउ गरेको छ । मोरङको धनपालथान गाउँपालिका६ कदमाहकी ४५ वर्षीय प्रमेश्चरीदेवी मण्डललाई पक्राउ गरिएको मोरङ प्रहरीका प्रवक्ता डीएसपी श्रेष्ठले बताए । मण्डललाई जिल्ला अदालत मोरङले २०६८ साल साउन १३ गते एक महिना कैदको फैसला गरेको थियो । कैद फैसलापछि फरार रहेकी उनलाई गाउँबाटै पक्राउ गरिएको प्रहरीले जनाएको छ ।"
"सरकारले संघीयता कमजोर बनायो : भट्टराई","नुवाकोट : पूर्वप्रधानमन्त्री एवं नयाँ शक्ति पार्टी नेपालका संयोजक डा बाबुराम भट्टराईले सरकारले तीन तहको अधिकार बाँडफाट गर्न नसकेर संविधानलाई कमजोर बनाउँदै लगेको आरोप लगाएका छन् । लोकतन्त्रको जरो जनस्तरसम्म लगेर संविधानलाई प्रभावकारी बनाउने लक्ष्यमा सरकार एक वर्षमै चुकेको उनले दावी गरे । नुवाकोटको विदुरमा शनिबार पत्रकारसँग डा भट्टराइले वाम गठबन्धनको सरकार बनेको एक वर्षमा समेत संघले प्रदेश र स्थानीय तहलाई अधिकार प्रत्यायोजन नगर्नुले संविधान र संघीयताको कार्यान्वयनमा आशंका बढेको बताए । उनले संघीय लोकतान्त्रिक गणतन्त्रको जरो गाडे पनि सरकारले संघीयता कार्यान्वयनलाई गम्भीरतापूर्वक नलिएको बताए । नेपालको संविधान अनुसार देशमा तीनै तहको निर्वाचन भएर दुई तिहाइको सरकार बनेको एक वर्षमा समेत संघको अधिकार प्रदेशलाई र प्रदेशको अधिकार स्थानीय तहलाई दिएर कार्य सुरु भइसक्नु पर्नेमा सरकार संघमै अधिकार राख्न लागिरहेको भट्टराइको टिप्पणी छ । सरकारले अधिकार बाँडफाट गर्न नसकेका कारण संविधानअनुसार तलैबाटै लोकतन्त्रको जरो बलियो बनाउन नसकेको हुँदा आक्रमणका अनेक श्रृंखला सुरु हुन सक्ने आंशका उनले व्यक्त गरे । संविधानले दिएको अधिकार अनुसार अझै कानुन निर्माण हुन नसक्नु, तहहरूलाई अधिकार प्रत्योजन हुन नसक्नु, वित्तीय व्यवस्थापन हुन नसक्नु, राष्ट्रिय र अन्तर्राष्ट्रिय सम्बन्धको विश्लेषण गरेर पुँजी भित्राउन नसक्नु सरकारका कमजोरी रहेको डा भट्टराइले दावी गरे । उनले सरकारको वर्तमान गतिले जनतामा वितृष्णा जागेको पनि बताए । प्रदेशहरुले डेढ वर्षसम्म पनि प्रदेशको नामाकरण गर्न नसक्नु संघीयता कार्यान्वयनको चुनौती रहेको पनि डा भट्टराइले बताएका छन् । संविधानमा अनुसार प्रदेशको नामकरणसमेत हुन नसक्नु नसक्नु बिडम्बना हो । २ नं प्रदेश बाहेक ६ वटै प्रदेशमा नेकपाको सरकार छ । त्यति हुँदासमेत उहाँहरू निर्णय गर्न सक्नुहुन्न,डा भट्टराइले आरोप लगाए । भट्टराईले भेनेजुयला प्रकरणमा सत्तारुढ दलको प्रतिक्रिया सही नभएको टिप्पणी गरे । नेपाल जस्तो विकासोन्मुख, स्वतन्त्र र सार्वभौमसत्ता सम्पन्न देशले आआफ्ना शक्ति प्रदर्शन गरिरहेका देशका गतिविधिका सम्वन्धमा टिप्पणी गर्न सान्दर्भिक नहुने बताए । नेपाल र नेपालका नागरिकलाई असर पर्ने गरी कसैले पनि अनावश्यक टिप्पणी गरेर नेपालको सदियौंदेखिको आफ्नो स्वतन्त्र कुटनीति कसैले पनि कमजोर बनाउन नहुने डा भट्टराइको भनाई छ ।"
"महाकाली तर्न डुंगाको भर","डडेलधुरा : डडेलधुराको जोगबुडा क्षेत्र जोड्न महाकालीमा पुल नहुँदा स्थानीय मर्कामा परेका छन् । जिल्लाको भित्री मधेस क्षेत्र परशुरामधाम र भारतलाई जोड्न महाकालीमा पुल निर्माण नभएकाले डुंगाबाट वारपार गर्नुपरेको स्थानीय पुष्पा विष्टले बताइन् । भारतको उत्तराखण्डमा रहेको पूर्णागिरि धाम र नेपालतर्फको परशुराम धामका पर्यटक जोड्न महाकालीमा पुल आवश्यक रहेको उनले बताइन् । उनी भन्छिन्, छिमेकी मुलुक भारतबाट स्नानका लागि आउने पर्यटक पनि डुंगाकै प्रयोग गरी वारपार गर्छन् । यात्रा सुरक्षित नभएकाले उनीहरूको संख्या बढ्न सकेको छैन । कञ्चनपुरबाट परशुराम स्नानका लागि परिवारसँगै बालबच्चा ल्याएर परशुरामधाम आएका हर्कबहादुर धामीले पनि महाकालीमा पुल नहँदा समस्या भएको बताए । महाकालीमा पुल नहुँदा डुंगा तरेर आउँदा एउटा बच्चा डुंगाबाट महाकालीमा खस्यो, तीन मिटर तलबाट प्रहरीले बच्चालाई नदीबाट उद्धार गर्न सफल भयो र ऊ बाँच्यो, उनले भने । कञ्चनपुरका धार्मिक पर्यटकका लागि टनकपुरको बाटो भएर परशुरामधाम आउन छोटो हुन्छ । स्थानीय नवराज भट्ट भन्छन्, कञ्चनपुरबाट परशुराम क्षेत्र आउन, भारतबाट सहज हुन्छ, महेन्द्रनगरबाट बनवासा सय रुपैयाँ र बनबासाबाट टनकपुरसम्म १५ रुपैयाँ खर्च गरे परशुरामधाम पुग्न सकिन्छ तर महाकालीमा पुल नभएकाले डुंगाको जोखिमपूर्ण यात्रा गर्नुपरेको छ । महाकालीमा पुल निर्माण भए भारतीय धार्मिक पर्यटक र कञ्चनपुरका बासिन्दालाई सुविधा हुने उनले बताए । चुनावका बेला महाकालीको पुल एजेन्डा बन्ने र त्यसपछि हराउने परशुराम नगरपालिका४ का खेमराज जोशीको गुनासो छ । भन्सार नहुँदा व्यवसाय चौपट महाकाली छेउमा रहेको छोटी भन्सार पनि सशस्त्र द्वन्द्वको समयमा विस्थापित भएको छ । छोटी भन्सार कार्यालय पुनःस्थापना हुन नसक्दा डडेलधुराको आधा जनसंख्या भएको भित्री मधेस क्षेत्रका व्यवसायीको व्यापार चौपट भएको छ । परशुराम नगरापालिका५ परीगाउँ, बाङघाट र सिसमझालामा छोटी भन्सार कार्यालय पुनःस्थापना नहुँदा स्थानीयलाई समस्या भएको छ । महाकाली नदीपारि नजिकै भारतको टनकपुर रहे पनि छोटी भन्सार कार्यालय नहुँदा भारतीय सुरक्षाकर्मीले सामान ल्याउन नदिने व्यवसायीले बताएका छन् । जोगबुडा आसपासका व्यापारी कञ्चनपुर, कैलाली हुँदै भीमदत्त पन्त राजमार्ग भएर महँगोमा सामान ल्याउन बाध्य छन् । जोगबुडा क्षेत्रबाट जिल्ला सदरमुकाम अमरगढीभन्दा भारतको टनकपुर नजिक पर्छ । छोटी भन्सार कार्यालयको पुनःस्थापना र पुल मात्रै बनेको भए डडेलधुराको आधा जनसंख्या रहको क्षेत्रको आर्थिक अवस्था सुधार हुने परशुराम नगरपालिका४ का रामबहादुर विष्टले बताए ।"
"हिरो गोल्डकपमा म्यानमारसँग हार्यो नेपाल","काठमाडौं : नेपाली महिला फुटबल टोलीले भारतको भुवनेश्वरमा सञ्चालित हिरो गोल्डकपमा म्यानमारसँग पराजित भएको छ । शनिबारदेखि सुरु भएको प्रतियोगिताको पहिलो खेलमा नेपाल म्यानमारसँग ३० गोलले पराजित भएको हो । भारतीय फुटबल संघले नेपालको विराटनगरमा आगामी फागुन २८ देखि चैत ८ सम्म हुने पाँचौं संस्करणको महिला साफ च्याम्पियनसिप फुटबलको तयारीका लागि हिरो गोल्डप आयोजना गरेको हो । हिरो गोल्डकप प्रतियोगितामा आयोजक भारतसहित नेपाल, म्यानमार र इरानले प्रतिस्पर्धा गर्नेछन् । दोस्रो खेलमा माघ २८ गते भारतसँग र तेस्रो खेल फागुन १ गते इरानसँग खेल्नेछ । राउन्ड रोबिन लिगका आधारमा सञ्चालन हुने प्रतियोगिताका शीर्ष दुई टोली फाइनलमा पुग्नेछन् । फाइनल फागुन ३ गते हुनेछ । विराटनगरको सहिद रंगशालामा हुने महिला साफको समूह विभाजन यसअघि नै भइसकेको छ । नेपाल समूह एमा छ । नेपालको समूहमा बंगलादेश, भुटान र पाकिस्तान छन् । समूह बीमा भारत, माल्दिभ्स र श्रीलंका छन् ।"
