"शीर्षक","विवरण"
"नेविसंघद्वारा प्रधानमन्त्रीको पुत्ला दहन","काठमाडौं : संसद्ले चिकित्सा शिक्षा विधेयक जबरर्जस्तीरूपमा पारित गरेको भन्दै नेपाल विद्यार्थी संघले विरोध जनाएको छ । नेविसंघले आज बिहान उपत्यकाका त्रिचन्द्र, पशुपति, ग्रामीण आदर्श, सरस्वती, पाटन क्याम्पसअगाडि विरोध गरेको हो । नेविसंघका कार्यकर्ताहरुले आइतबार बिहान राजधानीको पशुपति क्याम्पस अगाडि प्रधानमन्त्री केपी शर्मा ओलीविरुद्ध नाराबाजी गर्दै ओलीको पुत्ला दहन गरेका हुन् । नेविसंघका नेता दीपक भट्टराईले सरकारले बहुमतको आधारमा आमरण अनशनरत डा गोविन्द केसीको मागलाई सम्बोधन नगरी चिकित्सा शिक्षा विधेयक पारित गरेकाले विरोध जनाएको बताए । 'काङ्ग्रेसका पूर्व सभापति एवं पूर्व प्रधानमन्त्रीद्वयका नाममा स्थापित अस्पताललाई समेत राजनीतिक पूर्वाग्रहका आधारमा स्वीकृति दिइएको छैन, त्यसैले हामी आन्दोलनमा उत्रेका हौँ', उनले भने । नेविसंघ काठमाडौंका अध्यक्ष मनोज वैद्यले सरकारले चिकित्सा शिक्षा विधेयक पारित फिर्ता नलिएसम्म आन्दोलन निरन्तर जारी राख्ने बताए । आन्दोलनका क्रममा उपत्यकाका विभिन्न क्याम्पसबाट प्रहरीले विद्यार्थीलाई पक्राउसमेत गरेको छ । यसैबीच नेविसंघ, तरुण दल, महिला संघले आज चिकित्सा शिक्षा विधेयकको विरोधमा आन्दोलन गर्ने जनाएका छन् ।"
"बर्दिया राष्ट्रिय निकुञ्जमा सेनाको महाहन्ट अपरेशन","गुलरिया : बर्दिया राष्ट्रिय निकुञ्जमा हुने अवैध गतिविधि नियन्त्रण गर्न नेपाली सेनाले महाहन्ट नामको स्विप अपरेशन सुरु गरेको छ । निकुञ्ज र चुरेपहाडका मध्यवर्ती क्षेत्रमा हुने काठ, ढुँगा तस्करी, चोरी शिकार लगायत अवैध घुसपैठ नियन्त्रण गर्न स्विप अपरेशन सुरु गरिएको हो । स्विप अपरेशनमा शिवदल गण ठाकुरद्वाराका सबै फौज, विशेष फौज बहिनी अन्तर्गत भैरवनाथ गणको फौजहरू र इन्टेलिजेन्ट विभागका टीमहरू परिचालन गरिएको शिवदल गण ब्यारेक ठाकुरद्वाराका गणपति प्रमुख सेनानी चन्द्रप्रसाद चापागाईले जानकारी दिए । मिशन अन्तर्गत सुरक्षाकर्मीहरू दिनरात ड्यूटी गर्ने छन् । अपरेशन सुरु भएपछि अवैध गतिविधि नियन्त्रण भइरहेको सेनले बताएको छ । 'निकुञ्जको कोर एरियाबाट ३ नाल भरुवा वन्दुक, १५ राउन्ड गोली, सुकुटी, शिकार खेल्ने बन्दोबस्तीका सामानहरू सहित एक महिला पक्राउ परेकी छन्' प्रमुख सेनानी चापागाईले भने,'निकुञ्ज भित्र अवैध प्रवेश गरेका सयौं जना मानिस पक्राउगरी निकुञ्जलाई बुझाइएको छ ।' निकुञ्जले लोपोन्मुख वन्यजन्तुको चोरी शिकार लगायत अवैध गतिविधि नियन्त्रणलाई केन्द्रीत गरी अपरेशन सुरु गरेको बर्दिया राष्ट्रिय निकुञ्जका सहायक संरक्षण अधिकृत अशोक भण्डारीले बताए । 'अभियान अन्तर्गत चितवनपर्सा, बर्दियाबाँके कम्प्लेक्स तथा शुक्लाफाँटा राष्ट्रिय निकुञ्जमा स्विप अपरेशन भैरहेको छ' उनले भने 'लोपोन्मुख वन्यजन्तु बाघ, गैंडाको चोरी शिकार नियन्त्रण गर्ने विशेष योजनामा छौं ।' यसपटक विगतका भन्दा फरक शैलीबाट निकुञ्जहरूमा स्विप अपरेशन भइरहेको उनले बताए । 'अपरेशनमा प्रविधिको प्रयोग गरिएको छ' उनले भने,'पछिल्लो समय निकुञ्ज क्षेत्रहरुमा अवैध गतिविधिहरू बढ्न थालेकाले अभियान संचालन गर्नु परेको हो ।'"
"गण्डकी प्रदेशले ल्यायो धवलागिरी संरक्षण क्षेत्रको अवधारणा","मुना (म्याग्दी) : गण्डकी प्रदेशले राष्ट्रिय वन, वन्यजन्तुको संरक्षण र पर्यटन विकासका लागि धवलागिरी संरक्षण क्षेत्र आयोजना सञ्चालनको अवधारणा अघि सारेको छ । म्याग्दीको मुनामा आइतबार धवलागिरी गाउँपालिकाको पाँचौ गाउँसभाको उद्घाटन गर्न आएका गण्डकी प्रदेशका मुख्यमन्त्री पृथ्वीसुब्बा गुरुङले धवलागिरी संरक्षण क्षेत्र आयोजना सञ्चालनको अवधारण अघि सारिएको बताए । मुख्यमन्त्री गुरुङले अन्नपूर्ण संरक्षण क्षेत्र आयोजना (एकयाप) र ढोरपाटन शिकार आरक्षको बीचमा रहेको राष्ट्रिय वन क्षेत्रको संरक्षणसँगै पर्यटन विकासका लागि म्याग्दी, मुस्ताङ र बागलुङलाई समेटेर धवलागिरी संरक्षण क्षेत्र आयोजना सञ्चालन गर्ने विचार व्यक्त गरे । मुख्यमन्त्री गुरुङले रोजगारी सिर्जना र आम्दानी वृद्धी गरेर जनताको जीवनस्तर सुधारमा प्राथमिकता दिएको बताए ।'पर्यटन, जलविद्युत, कृषि र उद्यमको विकास गरी जनताको आम्दानी वृद्धी गराउनु गण्डकी प्रदेशको लक्ष्य हो,' मुख्यमन्त्री गुरुङले भने 'खानेपानी, शिक्षा, स्वास्थ्य, सडक, विद्युत सेवामा आम नागरिकको पहुँच वृद्धीमा जोड दिएका छौं ।' सबै गाउँपालिकाको केन्द्रमा सडक, सबै घरमा विद्युत, स्वच्छ खानेपानी, स्थानीय तहका केन्द्रमा सभाहल र स्वास्थ्य चौकीको भवन निर्माण गरिने मुख्यमन्त्री गुरुङले जानकारी दिए । उद्योग, वन वातावरण तथा पर्यटन मन्त्री विकास लम्सालले स्थानीय तहसँग सहकार्य गरेर वन पैदावारको संरक्षण र उपयोगसँगै आयआर्जन वृद्धी, पर्यटन विकासमा जोड दिएको बताए ।धवलागिरी गाउँपालिकामा पर्यटन सूचना केन्द्र स्थापना, पदमार्गको विस्तार र पर्यटकीय क्षेत्रमा पूर्वाधार निर्माणमा प्राथमिकता दिने बताए । गाउँपालिकाका अध्यक्ष थमसरा पुनले संसारको सातौ अग्लो धवलागिरी, गुर्जा लगायत हिमाल, ढोरपाटन शिकार आरक्ष अवस्थित धवलागिरी गाउँपालिकाको सडक, विद्युत, भवन, शिक्षा, सञ्चार लगायत पूर्वाधारका क्षेत्रमा सघाउन प्रदेश सरकारको ध्यानाकर्षण गराइन् । प्रजिअ लीलाधर अधिकारीले भौगोलिक हिसाबले विकट र दुर्गम भएपनि धवलागिरी गाउँपालिका पर्यटन, जलविद्युत, जडिवुटीका हिसाबले प्रशस्त सम्भावना बोकेको बताए । उनले विपद् व्यवस्थापनका लागि म्याग्दीमा एक वार्ड एक हेलिप्याड निर्माण अभियान सञ्चालन गरिएको जानकारी दिए । उपाध्यक्ष रेशम छन्त्यालले गाउँपालिकामा रहेका प्राकृतिक स्रोत साधनको परिचालन गरि विकास र सम्बृद्धीमा रुपान्तरण गराउन आवश्यक ऐन कानुन छिटो बनाउन प्रदेश र संघीय सरकारको ध्यानाकर्षण गराए ।प्रमुख प्रशासकीय अधिकृत अर्जुन शर्माले दुर्गम भएकाले कर्मचारी आउनै नमान्ने र आएपनि सरुवा भएर जाने समस्या धवलागिरी गाउँपालिकाको विकास र सार्वजनिक सेवा प्रवाहमा देखिएको चुनौती भएको बताए ।"
"""राजधानीका क्याम्पसअगाडि नेविसंघको प्रदर्शन","प्रधानमन्त्रीको पुत्ला जलाइयो (फोटो)"",""काठमाडौं : संसद्ले चिकित्सा शिक्षा विधेयक जबरर्जस्तीरूपमा पारित गरेको भन्दै नेपाल विद्यार्थी सङ्घले विरोध जनाएको छ । नेविसङ्घले आज बिहान उपत्यकाका त्रिचन्द्र, पशुपति, ग्रामीण आदर्श, सरस्वती, पाटन क्याम्पसअगाडि विरोध गरेको हो । पशुपति क्याम्पसमा भएको प्रदर्शनका क्रममा प्रधानमन्त्रीको पुत्ला जलाइएको छ । पुत्ला बनाएर प्रधानमन्त्रीको फोटो टासी उनीहरूले आगो लगाएका हुन् । नेविसङ्घ काठमाडौंका अध्यक्ष मनोज वैद्यले सरकारले चिकित्सा शिक्षा विधेयक पारित फिर्ता नलिएसम्म आन्दोलन निरन्तर जारी राख्ने बताए । आन्दोलनका क्रममा उपत्यकाका विभिन्न क्याम्पसबाट प्रहरीले विद्यार्थीलाई पक्राउ समेत गरेको छ । हेर्नुस् अन्नपूर्णका सरोज बैजुले खिचेका पशुपति क्याम्सपमा भएको प्रदर्शनका फोटोहरूः"""
"गेटअपमा बादलको चिन्ता","बादल थापा (२१) ओई तिम्रो छ कि छैन कोही गीत गाएर चर्चामा छन् । चार पाँच वर्ष भयो, उनले गायनमा करियर सुरु गरेको । संगीत क्षेत्रमा जम्नकै लागि उनले गेटअपमा पनि विशेष ध्यान दिने गरेका छन् । मनमै बसी मन जलाई, चन्द्र जस्तो मुहार तिम्रो गुराँस जस्तो जोवन, प्रेमगीत टु को मेरो भन्नु (कभर सङ) जस्ता राम्रा गीतमा बादलले स्वर दिएका छन् । नेपालको बजार सानो भएकाले गाएरै जीवन निर्वाह गर्न गाह्रो हुन्छ । प्रायः गायकगायिकाहरू विभिन्न कन्सर्ट प्रफर्मेन्सबाटै जीविका चलाउँछन् । तर कन्सर्ट पाउन भने त्यति सजिलो छैन । बादल भन्छन्, कि त गायक डिमान्डमा हुनुपर्यो, कि त उसको गेटअप राम्रो हुनुपर्यो । पप, रक्स शैलीका गीत गाउन बढी रुचाउने बादल क्लासिक गीतमा पनि त्यत्तिकै ध्यान दिन्छन् । एसएलसीपछि प्लस टु पढ्दापढ्दै उनी संगीत सिक्न भारत गए । सानैदेखि गायनमा औधि रुचि राख्ने बादलको काठमाडौंको यात्रा भने सहज थिएन । यो क्षेत्रमा कला, गलामात्र भएर पुग्दैन, उनी भन्छन्, यहाँ ठूलो राजनीति हुन्छ । बादल थुप्रै कन्सर्टहरूमा जान्छन् । उनलाई त्यहाँको माहोल राम्रोसँग थाहा छ । गीत जति नै राम्रो गाए पनि, जति नै चलेको आर्टिस्ट भए पनि स्टेज प्रर्फमेन्समा गेटअपले काम गर्ने उनी बताउँछन् । राम्रो गेटअपमा गायकले स्टेजमा प्रर्फमेन्स दिँदा दर्शकको हेर्ने दृष्टिकोण पनि फरक हुँदो रहेछ, उनी भन्छन् । गीतसंगीतसँगै बाहिरी आवरणलाई पनि ध्यान दिनुपर्ने भएकाले बादल कहिले कपाल लामो पार्छन्, कहिले काट्छन् । आफूले लगाउने लुगाहरूमा पनि विशेष ध्यान दिन्छन् । कञ्चनपुर, दोधारा चाँदनीका बादलले दारु पार्टी, शिवजीको फ्यान जस्ता गीतले स्टेज तताउने गर्छन् । परिवारको साथ र सहयोग बिना संगीत क्षेत्रमा टिक्न गाह्रो हुने उनको ठहर छ । भन्छन्, चलेको गायक पनि एक समय पछि हराउँछ । त्यसैले आवरणमा पनि ख्याल गर्नुपर्छ । सधैं सदाबहार हुने कोसिस गर्नुपर्छ ।"
"कारागारमा भिडियो कन्फरेन्स","पोखरा : न्यायाधीशले सोधेका प्रश्नको जवाफ कैदीबन्दीले कारागारबाटै दिने गरी भिडियो कन्फरेन्सको व्यवस्था गरिने भएको छ । जटिल प्रकृतिका मुद्दामा भने कैदीबन्दीलाई अदालत लगिनेछ । गृहमन्त्रीको गृह प्रशासन सुधार प्रतिबद्धताअन्तर्गत यो व्यवस्था गर्न लागिएको कारागार व्यवस्था विभागका महानिर्देशक हरिप्रसाद मैनालीले बताए । उनका अनुसार भिडियो कन्फरेन्स सेवा काठमाडौं, कास्की, चितवनलगायत १४ जिल्लामा यही वर्ष सुरु गरिनेछ । कास्की पोखरामा आयोजित कारागार व्यवस्थापनसम्बन्धी प्रदेशस्तरीय समन्वय गोष्ठीमा उनले यसका लागि अदालत र कारागारमा यो प्रविधि जोड्नुपर्ने बताए । यो व्यवस्थाले सुरक्षाकर्मी दिनभर मुद्दाका विषयमा कैदीबन्दीलाई कुरेर अदालतमा बस्नुपर्ने अवस्था अन्त्य हुनेछ । सबै कारागारमा सीसी क्यामेरा जडान भइरहेको पनि उनले बताए । ठूला कारागारमा यो काम सकिएको उनले जानकारी दिए । आन्तरिक प्रशासन सुधारअन्तर्गत कारागारका चौकीदार, नाइके हेरफेर गर्ने व्यवस्था पनि गरिएको उनले बताए । एक वर्ष बसेका कैदीबन्दी चौकीदार नाइके हुन सक्ने व्यवस्था गरिएको हो । यसअघि एकै व्यक्ति लामो समय चौकीदार र नाइके हुँदा विकृति बढेको निष्कर्ष गृह मन्त्रालयले निकालेको छ । ३ सय क्षमताको खुला कारागार नेपालगन्जमा निर्माण कार्य अघि बढेको जानकारी दिइयो । आचरण, अवधि हेरी खुला कारागारमा राखिनेछ । देशभर ७२ जिल्ला कारागार छन् । २१ हजार कैदीबन्दी छन् । कारागारको क्षमता भने १२ हजार राख्न सक्ने मात्र छ । मकवानपुरमा ५ अर्ब लगानीमा साढे ५ सय रोपनी क्षेत्रफलमा ७ हजार क्षमताको कारागार बनाइरहेको महानिर्देशक मैनालीले सुनाए । नेपालगन्जमा ४० करोड लगानीमा ३ हजार क्षमताको कारागार बनाउने प्रक्रिया अघि बढेको छ । कारागार संघ र प्रदेश सरकारको साझा अधिकार सूचीमा छ । ठूला कारागार संघ (कारागार व्यवस्था विभाग)अन्तर्गत र साना प्रदेश मातहत रहने गरी कार्यविभाजन हुने जनाइएको छ । गण्डकी प्रदेशका आन्तरिक मामिला तथा कानुनमन्त्री हरिबहादुर चुमानले संघ र प्रदेशका जिम्मेवारी बाँडफाँट नहुँदा व्यस्थापनमा समस्या आएको बताए ।"
