"शीर्षक","विवरण"
"छोटिँदै कास्कीलमजुङ दूरी","पोखरा : कास्कीको सदरमुकाम पोखराबाट लमजुङ जाने बाटोको दूरी छोटो पर्ने पक्की सडक निर्माण अघि बढेको छ । पोखराको सिसुवादेखि रूपा गाउँपालिका हुँदै लमजुङ सिसाघाट जोड्ने १६ किलोमिटर सडक पिच निर्माण सुरु भएको हो । उक्त सडकको अधिकांश भाग कास्कीको रूपा गाउँपालिकामा पर्छ । यो पिच सडक बनेपछि लमजुङ जाने दूरी आधै छोटो पर्ने बताइएको छ । पोखराबाट लमजुङको बेंसीसहर र पूर्वीभाग जान पनि तनहुँ हुँदै जानुपर्ने बाध्यता छ । तर पिच सडक बनेपछि कास्की सीमाका थुप्रै गाउँदेखि बेंसीसहरसम्मै पुग्न पनि दूरी सीधा र छोटो पर्नेछ । राष्ट्रिय पुनर्निर्माण प्राधिकरणअन्तर्गत जिल्लास्तरीय परियोजना कार्यान्वयन इकाइ कास्कीले सिसुवापोल्याङटार बाटो स्तरोन्नति परियोजनाको काम थालेको हो । आशीष एन्ड फेवा जेभीले २१ करोड ३३ लाख रुपैयाँ १८ महिनामा काम सक्ने गरी उक्त सडकको ठेक्का लिएको छ । ६५ मिटर चौडा हुने सडकमा १ मिटर नालीसमेत हुनेछ । सडक खण्ड चक्लाबन्दी, ग्याबिन वाल, विपद् व्यवस्थापनलगायत काम हुनेछन् । सडक खण्डमा ३० वटा ह्युम पाइप कल्भर्ट राखिने ठेकेदार कम्पनी आशीष एन्ड फेवा जेभीले जनाएको छ । सडकको मापदण्ड दायाँबायाँ १०१० मिटर तोकिएको छ । प्रतिनिधिसभाका सांसद खगराज अधिकारीले आइतबार उक्त सडक निर्माणको शिलान्यास गरेका थिए । त्यस अवसरमा उनले भौतिक पूर्वाधार निर्माण निर्वाध रूपमा अघि बढ्न स्थानीय बासिन्दाको भूमिका हुने बताए । अहिले पिच हुन लागेको बाटो २०२८ सालअघिसम्म पोखराबाट काठमाडौं जाने मूल बाटो मानिन्थ्यो । पृथ्वीराजमार्ग बनेपछि भने उक्त बाटोमा लामोदूरीका पैदलयात्री शून्य भएका हुन् । तत्कालीन राजा महेन्द्र पोखरालगायत पश्चिम क्षेत्रको भ्रमण पनि कास्की देउरालीकै बाटो हुँदै आएका थिए ।"
"""महाकालीको डर","रातभर निद्रा लाग्दैन"",""महेन्द्रनगर : घरछेउ नजिकै उर्लिंदो महाकाली छ । बर्सेनि नदीले जमिन कटान गर्दै लगेपछि झनै महाकालीले आफ्नो क्षेत्र फराकिलो बनाउँदै लगेको छ । अझ बर्खा सुरु भएपछि झनै महाकालीको डरलाग्दो रुप देखिन्छ । र, कटानसमेत तीव्र पार्छ, कञ्चनपुरको भीमदत्त नगरपालिका११ भुजेलास्थित महाकाली टोलकी कौशिका पन्तले भनिन् । बर्खा सुरु भयो कि उनलाई रातभर निद्रा लाग्दैन । नदीको धार घरनजिकै आउन लागिसकेकाले उनको चिन्ता झन् बढ्दै गएको छ । वर्षौंदेखि महाकाली टोलमा बस्दै आएकी उनले सुरुमा देखेको महाकाली नदी र अहिलेको धेरै फरक भइसकेको छ वर्षाैंअघि धेरै टाढा बगेको देखिन्थ्यो महाकाली नदी, अहिले घरनजिकै आइसक्यो कौशिकाले भनिन् । जतिजति नदीले बर्सेनि कटान गर्दै लगेको छ, त्यति नै आफ्नो चिन्तासमेत बढेको छ । उनको घरनजिकै पुगिसकेको छ, आजभोलि महाकाली नदी । उनले घर, सम्पत्ति र बालबच्चा कसरी जोगाउने भन्ने डरले सधैं सताउने गरेको बताइन् । कौशिका पन्त मात्र होइनन्, महाकाली नदीकिनारमा बस्ने भीमदत्त नगरपालिकाका भुजेला, ऐरी, ओदाली, क्षेत्रका विभिन्न टोलका मानिसको एउटै पीडा हो । धेरै वर्ष भयो महाकालीमा आउने बाढीको पीडा भोग्दै आएको तर अहिलेसम्म पनि स्थायी समाधान भएको छैन, स्थानीय राधिका नेपालीले भनिन,्सरकारले तटबन्ध बनाएजस्तो गर्छ तर सधँै बाढीले असर पुयाउँदा त्यसको क्षति स्थानीयलाई हुन्छ । उनले सरकारले मजबुत खालको तटबन्ध निर्माण नगर्दा बर्सेनि समस्या हुने गरेको बताइन् । समयमा ठेकेदारले यस वर्षसमेत काम गरेनन् र अहिले पनि कटान थालिसक्यो, उनले भनिन्, सरकारले समयमा कामको जिम्मा दिएर भरपर्दो र बलियो तटबन्ध नबाँधेसम्म सधँै बाढीले दुःख दिइरहनेछ । भारत सरकारले आफ्नो भूभाग जोगाउन पक्की संरचना निर्माण गरी तटबन्ध बनाएकाले नेपालतर्फ समेत त्यस्तै खाले तटबन्ध निर्माण आवश्यक रहेको उनी बताउँछिन् । हामी त बाढी घर पसे पनि भागेर बाँच्न सकौंला तर बालबच्चा र बूढाबूढी कसरी जोगाउने भन्ने चिन्ता बढी हुन्छ, उनले भनिन् । बर्सेनि महाकाली नदी नियन्त्रणका लागि करोडौं रकम खर्च हुने गरेको छ । तर, समस्या भने समाधान हुन सकेको छैन । सरकारले अलिअलि गरेर काम गराउने, त्यही कामसमेत समयमा सम्पन्न हुँदैन, देवीसरा सुनारले भनिन् । उनले हरेक वर्ष नदी नियन्त्रणका लागि आउने रकम बालुवामा पानी हालेजस्तै भइरहेको बताइन् । महाकाली नदी नियन्त्रण संघर्ष समितिका अध्यक्ष श्याम थापा सरकारले एकै ैपटक धेरै बजेट लगाएर काम थाल्नुपर्ने बताउँछन् । यो समस्या प्रतिदिन बढ्दै जाने हो, उनले भने, महाकाली नदी नियन्त्रण गर्न बलियो तटबन्ध निर्माण गर्नु आवश्यक छ । यस वर्ष पनि बर्खा सुरु भएदेखि नै महाकाली टोलमा नदीले तटबन्ध कटान गर्न थालेको थियो । स्थानीयले तत्काल वैकल्पिक रूपमा नियन्त्रण गरे पनि वर्षात अझै बाँकी रहेकाले ढुक्क हुने अवस्था भने छैन ।"""
"नयाँ मुलुकी एेन : गाई मारे तीन वर्ष कैद","काठमाडौं : अबदेखि कसैले पनि गाई वा गोरु मार्न वा कुट्नसमेत नपाइने भएको छ । मुलुकी अपराध (संहिता) ऐनको परिच्छेद २७ मा पशुपंक्षीसम्बन्धी कसूरको व्यवस्था गरिएको छ । जुनसुकै कारणले पनि त्यसरी मारे तीन वर्षसम्म कैदको व्यवस्था गरिएको हो । यसका साथै कसैले गाई वा गोरुलाई कुटी अंगभंग भएमा निजलाई ६ महिना कैद र अन्य चोट पुर्याएमा ५० हजार रुपैयाँसम्म जरिवाना गरिने ऐनमा उल्लेख छ । भदाै १ गतेदेखि लागू हुने एेनकाे दफा २८९ मा गाई, गोरु मार्न वा कुट्न नपाइने व्यवस्था गरिएको हो । ऐनमा कसैले गाई वा गोरु मार्ने वा कुनै चोट पुर्याउने नियतले कुनै काम गर्नु वा गराउन नपाइने भएको छ । जुनसुकै कारणले पनि त्यसरी मारे तीन वर्षसम्म कैदको व्यवस्था गरिएको हो । यसका साथै कसैले गाई वा गोरुलाई कुटी अंगभंग भएमा निजलाई ६ महिना कैद र अन्य चोट पुर्याएमा ५० हजार रुपैयाँसम्म जरिवाना गरिने ऐनमा उल्लेख छ । कार्यकर्तालाई कमल थापाको निर्देशनधर्म परिवर्तन गराउनेलाई लखेट्नुस् धर्म परिवर्तन गराए देश निकाला धर्म परिवर्तन गराउने कार्य सरकारलाई पाच्य हुँदैन : अर्थमन्त्री खतिवडा जबरजस्ती धर्म परिवर्तन गराउने तीनजना चर्चबाटै समातिए दलितले किन गर्छन् धर्म परिवर्तन ? धर्म परिवर्तन गराउनेलाई पाँच वर्ष जेल"
"माछापुच्छ्रे बैंकको सुपर एजेन्टमा जिएमइ रेमिट","काठमाडौं : माछापुच्छ्रे बैंकले जिएमइ रेमिटलाई एजेन्टको रुपमा नियुक्त गरेको छ । एजेन्ट नियुक्ती सम्बन्धी सम्झौता पत्रमा बैंकका तर्फबाट प्रमुख कार्यकारी अधिकृत सुमन शर्मा र जिएमइका तर्फबाट प्रवन्ध निर्देशक दिवाकर पौडेलले हस्ताक्षर गरे । सम्झौता पश्चात माछापुच्छ्रे रेमिटको भुक्तानी जिएमईको ७ हजारभन्दा बढी एजेन्टमार्फत हुनेछ । त्यस्तै जिएमइको भुक्तानी बैंकका सबै शाखाहरुबाट हुनेछ । यो सम्झौतासँगै खाडी मुलुक,अमेरिका, यूके, मलेसिया, दक्षिण कोरिया, जापानलगायतका देशमा कार्यरत नेपालीहरुले छिटो छरितो र सुलभ तरिकाले पैसा पठाउन सक्नेछन् ।"
"जलेश्वर कारागार डुबानमा","गौशाला : भीषण वर्षापछि महोत्तरी, धनुषा र केही दिनदेखि सर्लाही जिल्लाको संयुक्त कारागारका रुपमा रहेको जलेश्वर कारागार डुबानमा परेको छ । जिल्लामा गएरातिको मुसलधारे वर्षाले जलेश्वर कारागार आज बिहान डुबानमा परेको हो । एक सय ६० वर्ष पुरानो राणाकालीन जलेश्वर कारागार जलेश्वर नगरपालिका२ मा सबैभन्दा गहिरो स्थानमा अवस्थित छ भने वर्षाको बेला यो कारागार पटकपटक डुबानमा पर्ने गरेको जेलर शोभेन्द्र ठाकुरले बताए । वर्षाका कारण कारागारको प्राङ्गणभित्र तथा बाहिर चारैतिर पानी भरिएको छ भने कार्यालय प्रमुख बस्ने तथा कर्मचारी प्रशासन कक्षमा समेत पानी प्रवेश गरेको छ ।कारागारको भित्र कैदीबन्दी बस्ने बन्दीगृहबाट पानी निकासका लागि बनाइएको नाला भएर पनि बाहिरको पानीभित्र प्रवेश गरेको चौकीदार श्रीनारायण महतोले जानकारी दिए । आगलागीमा आठ लाखको क्षति यसैगरी महोत्तरी जिल्लाको मटिहानी नगरपालिकाको एक घरमा सोमबार बिहान भएको भीषण आगलागीमा आठ लाखको क्षति भएको छ । जिल्ला प्रहरी कार्यालय महोत्तरीका प्रहरी नायब उपरीक्षक खगेन्द्रबहादुर खड्काका अनुसार मटिहानी नगरपालिका८ बस्ने विपीनकुमार लालकर्णको घरमा भएको आगलागीमा आठ लाख मूल्य बराबरको क्षति भएको हो । रासस"
