शीर्षक,विवरण
भूपू गोर्खाप्रति बेलायती न्यायालय उदार,"बेलायती सैनिकसरह समान पेन्सनबाट वञ्चित भएकामा दु:खी छन् करिब ३६ हजार भूपू गोर्खा । बेलायत र नेपाल सरकारबीच छिट्टै वार्ताको आशामा बसिरहेका उनीहरूको मनमा कहिल्यै चैन भएन । बेलायतमा वृद्धवृद्धाको दयनीय दिनचर्याबीच उनीहरू खुसी हुने एउटा पाटोचाहिँ छ पारिवारिक पुनर्मिलन ।बेलायती अदालतको निर्णयले भूपू गोर्खा भीमबहादुर गुरुङका छोरा हस्तबहादुर र रामबहादुर थापाका छोरा कर्णबहादुरले आवासीय भिसा प्राप्त गरेको सुखद समाचार छ, गोर्खा सत्याग्रह संयुक्त संघर्ष समितिका कार्यवाहक संयोजक सूर्य नेम्वाङले अघिल्लो साता फेसबुकमा लेखे, भान्जाहरूको भविष्य यूकेमा उज्ज्वल रहोस् । यस्तो जानकारी बारम्बार दिइरहनु नेम्वाङको जिम्मेवारीजस्तै छ अहिले । भूपू गोर्खाका ३० वर्षसम्मका वयस्क आश्रित (एडल्ट डिपेन्डेन्ट) सन्तानलाई आवासीय अधिकार दिने बेलायत सरकारको नीतिबाहिर गएर बेलायती अदालतले ३० वर्षमाथिका सन्तानलाई समेत भिसा दिनुपर्ने निर्णय गर्न थालेपछि भूपू गोर्खाहरू दंग छन् । सरकारले भूपू गोर्खाका सन्तान अविवाहित हुनुपर्ने, सन् २००९ मा विशेष व्यवस्थाबाट आवासीय अधिकार प्राप्त गरेका आमाबाबुसँग आर्थिक र भावनात्मक रूपमा आश्रित भएको हुनुपर्ने, दुई वर्षभन्दा बढी समय परिवारबाट टाढिएको हुन नहुने (अध्ययन वा अन्य विशेष परिस्थितिबाहेक), बेलायत सरकारको ऐतिहासिक भेदभावले उसलाई असर गरेको प्रमाणित गर्नुपर्ने (जस्तै: ऐतिहासिक भेदभाव नभएको भए निवेदक १८ वर्षभन्दा कम उमेरको हुन्थ्यो वा बेलायतमा जन्मिएको हुन्थ्यो) लगायतका दस सर्त राखेको छ । सरकारले नीतिमै अडिग भएर भिसा दिन इन्कार गरे पनि बेलायती अदालतले मानव अधिकार र ऐतिहासिक अन्यायको धरातलमा टेकेर भिसा दिनुपर्ने निर्णय गरिरहेको गोर्खा सत्याग्रह संयुक्त संघर्ष समितिका अभियान निर्देशक ज्ञानराज राईले जानकारी दिए । तर, हाम्रो चाहना मुद्दामामिला गरेर होइन, ऐतिहासिक अन्याय भएका आधारमा सबै भूपू गोर्खा र तिनका सन्तानलाई नि:सर्त आवासीय अधिकार दिइनुपर्छ भन्ने हो, राईले थपे, बेलायतमा वृद्धवृद्धा भूपूलाई हेरचाह गर्ने मान्छे छैनन्, कम्तीमा तिनका छोराछोरी भए उनीहरूको जीवन अहिलेजस्तो अप्ठ्यारो हुन्थेन । सर्भिस डिस्चार्ज हुने बेला १८ वर्षमुनिका सन्तानलाई भिसा दिएको भए सेटलमेन्ट पाइसक्ने जनाउँदै राईले नयाँ सहज नियम ल्याउन बेलायत सरकारसमक्ष मागसमेत गरे ।लन्डनस्थित एभरेस्ट ल सोलिसिटर्स फर्मका प्रिन्सिपल सोलिसिटर राजु थापाले सरकारको नीतिभित्र नपरे पनि युरोपियन युनियन महासन्धिको धारा ८ बमोजिम मानव अधिकार र ऐतिहासिक अन्यायका हिसाबले अदालतले भूपू गोर्खाहरूलाई केस जिताइरहेको बताए । उनले आफ्नो फर्मबाट मात्र विधवाका ७ र वयस्क आश्रितका ५५ वटा मुद्दा जितिसकेको जानकारी दिए । तर, सरकारको नीतिमा विधवालाई आवासीय अधिकार दिने उल्लेख छैन । विधवालाई नदिने भन्ने कुरा न्यायसंगत देखिन्न, थापा भन्छन्, यस्तो विभेद अन्त्य गरिनुपर्छ । भूपू गोर्खाहरू समान पेन्सनलाई आफ्नो मूल मुद्दा मान्छन् । समान पेन्सनलगायत माग पूरा गर्ने सम्बन्धमा वार्ता गर्न नेपाल र बेलायत सरकार सकारात्मक रहे पनि निर्णायक रूपबाट अझै सुरु भएको छैन । वार्ताको समन्वय गर्न नेपाल सरकारले लन्डनस्थित नेपाली दूतावासलाई जिम्मा दिएको छ ।"
पहिरोमा १२ को मृत्यु,जकार्ता इन्डोनेसियाको बालीस्थित बाङ्गली जिल्लाका दुई गाउँमा शुक्रबार बाढीपहिरो परी १२ जनाको मृत्यु भएको छ । घटनामा अन्य ५ जना घाइते भएका छन् । प्रकोप व्यवस्थापन निकायका अधिकारीका अनुसार अवान र सुकावान गाउँमा पहिरो गएको हो । मृतक सबैको शव पहिरोबाट निकालिएको छ भने घाइतेलाई उपचारका लागि अस्पताल लगिएको छ । बाढी पहिरोको खतरा रहेका अन्य क्षेत्रमा पनि सतर्कता बढाइएको अधिकारीले जनाएका छन् । शिशु बेचेको आरोपमा ८ जनालाई जेल सजायसांघाइ (सिन्हवा) चीनको सांघाईस्थित एक अदालतले नवजात शिशु किनबेच गरेको आरोपमा ८ जनालाई जेल सजाय दिएको छ । ती नवजात शिशुहरू सातदेखि २७ महिनासम्म रहेका छन् । उनीहरूलाई दुई हजारदेखि पाँच हजार युआनमा बेचिएको अदातलले जानकारी दिएको छ । करिब ५ हजार नवजात शिशु यसरी बेचिएका बताइएको छ ।
राष्ट्रसंघ प्रमुख टर्की भ्रमणमा,"संयुक्त राष्ट्रसंघ संयुक्त राष्ट्रसंघका महासचिव एन्टोनिओ गुटेर्टेज टर्कीको भ्रमणमा गएका छन् । टर्कीमा उनले ५ अरबी मुलुकसंग राष्ट्रसंघको चासोका बारेमा कुरा गर्ने जनाइएको छ । उनले भ्रमणका क्रममा सबैभन्दा पहिला सिरियाको शान्तिवार्ता सकारात्मक दिशातर्फ जाने आशासहित उनीहरूसँग छलफल गर्नेछन् । त्यसपछि उनले साउदी अरब, युनाइटेड अरब इमिरेटस् (युएई), ओमन, कतार र इजिप्टको उच्च नेतृत्वसँग सिरिया, यमन, लिविया र इजरायल तथा प्यालेस्टाइन द्वन्द्वका बारेमा कुरा गर्नेछन् ।"
ट्रम्पअफगान राष्ट्रपति वार्ता,"काबुल अफगान राष्ट्रपति मोहम्मद असरफ घानी र अमेरिकाका राष्ट्रपति डोनाल्ड ट्रम्पबीच टेलिफोन वार्ता भएको छ । वार्ता आतंकवादी र अतिवादी विरुद्धको लडाइँका विषयमा केन्द्रित भएको अफगान राष्ट्रपति कार्यालयले जनाएको छ । दुई नेताहरूले अफगानिस्तानको सुरक्षा अवस्था, विकासको अवस्था, लगानी र आर्थिक अवस्थाका बारेमा पनि छलफल गरेका थिए । अफगान राष्ट्रपति घानीले सुरक्षा जिम्मेवारी निर्वाह गर्न निकै गाह्रो भइरहेको अफगानिस्तानको राष्ट्रिय सुरक्षाफौजलाई आवश्यक सहयोगका बारेमा आग्रह गरेका थिए ।"
आठौंका लागि योजनै योजना,"दुई वर्षभित्रै आठौं राष्ट्रिय खेलकुद आयोजना गर्न मध्यपश्चिम क्षेत्रीय खेलकुद विकास समितिले सुरुबाटै सक्रियता बढाएको छ । अठार वर्षअघिको चौथो राष्ट्रिय खेलकुदको अनुभवबाट नेपालगन्जले मिसन २०७५ अभियान थालेको हो । प्रतियोगितालाई भौतिक पूर्वाधार निर्माण तथा तयारीसम्बन्धी कार्यदलले योजना निर्माण गरिरहेको छ । रंगशाला र कभर्डहलको स्थितिबारे विस्तृत अध्ययन हुँदै छ । पर्याप्त बजेट अभावले निर्माणाधीन पौडी पोखरी पूरा गर्न बहुवर्षीय ठेक्का आहान भइसकेको क्षेत्रीय समितिले जनाएको छ । चौथो संस्करण गर्दा हामीसँग पौडीपोखरी थिएन, क्षेत्रीय समितिका अध्यक्ष भीम ओलीले भने, आठौं संस्करणमा पौडी पनि नेपालगन्जमै गर्ने योजनामा छौं । नेपालगन्ज रंगशालाको ७ विघापरिसरमा प्रतियोगिता गर्न समस्या हुने भएपछि नजिकैको खाली जग्गा अधिग्रहण गर्नेगरी प्रस्ताव पेश गर्न लागिएको उनले बताए । आठौं राष्ट्रियकै लागि फराकिलो रंगशाला बनाउन खोज्दै छौं । मुआब्जा दिएर निजी जग्गा खेलकुदमातहतमा ल्याउने प्रक्रिया अगाडि बढाउँदै छौं, अध्यक्ष ओलीले भने । जुट्यो प्राविधिक कार्यदल आठौं राष्ट्रिय खेलकुदको भौतिक पूर्वाधार निर्माण गर्न राष्ट्रिय खेलकुद परिषद्ले कोषाध्यक्ष सुरेन्द्र हमालको संयोजकत्वमा ६ सदस्यीय भौतिक पूर्वाधार निर्माण तथा तयारी कार्यदल गठन गरेको छ । क्षेत्रीय अध्यक्ष ओली सदस्यसचिव रहेको कार्यदलमा परिषदा सदस्यद्वय शान्ति सिंह र विनोद मैनाली तथा इन्जिनियर विश्वामित्र सन्ज्याल सदस्य छन् । कार्यदलले भौतिक पूर्वाधारको अवलोकन गरी आवश्यक पर्ने थप संरचना र चाहिने पूर्वाधारबारे निष्कर्षसहित प्रतिवेदन पेश गर्ने संयोजक हमालले बताए । कार्यदलले २०७५ भित्रै प्रतियोगिता संचालन गर्न आवश्यक पर्ने पूर्वाधार निर्माणलाई आवश्यक कार्यमा सहजीकरण गर्ने बताउँदै उनले भने, तोकिएको समयमा राष्ट्रिय खेलकुद गर्न नसक्दा खेल क्षेत्रले राम्रो प्रगति गर्न सकेको छैन । त्यसैले आठौं संस्करण दुई वर्षभित्रै गर्ने अठोट छ । रंगशालाको स्तरोन्नति गरिँदै चार दशकअघि निर्मित नेपालगन्ज रंगशालालाई आठौं राष्ट्रियअगावै अत्याधुनिक बनाउन स्तरोन्नति गरिने कार्यदलले जनाएको छ । एउटै रंगशालामा सबै खेल गर्न सकिने गरी रंगशालाको पुनर्निर्माणमा जोड दिइने ओली बताउँछन् । रंगशालालाई दशरथ रंगशालाको मापदण्डअनुरुप बनाउने कार्यदलको योजना छ । त्यसका लागि रंगशालाको विस्तृत परियोजना प्रतिवेदन निर्माण गर्नं परामर्शदाता पनि नियुक्ति गरिसकिएको उनले जनाए । अहिले रंगशालाको माटो परीक्षण भइरहेको छ । रंगशालाको ६ लेन ट्रयाकलाई ८ लेन बनाउने तयारी छ । माटोको ट्रयाकलाई सेन्थेटिक बनाउने योजना अगाडि सारिएको छ । जीर्ण प्यारापिटलाई भत्काएर १० हजार दर्शक अटाउने गरी चारैतिर प्यारापिट निर्माण गरिने ओलीले बताए । अहिले एक हजार दर्शक मुस्किलले अट्न सक्छ । कभर्ड हल पुनर्निर्माण योजना रंगशाला परिसरको कभर्डहलमा विभिन्न नौवटा इन्डोर प्रतियोगिता संचालन र अभ्यास भइरहेका छन् । नेपालगन्जमा २०५५ सालमा भएको चौथो राष्ट्रिय खेलकुदपछि संरचना मर्मत तथा पुनर्निर्माण भएका छैनन् । त्यसैले ती जीर्ण भइसकेका छन् । सबै इन्डोर खेलका लागि उपयुक्त हुने गरी पुनर्निर्माण गर्ने योजना अगाडि सारिने कार्यदलले जनाएको छ । कभर्डहलको छाना जीर्ण बनेकाले पूरै छाना फेरिनेछ । कभर्डहलमा व्यवस्थित लाइटिङ संरचना निर्माण गर्ने कार्यदलको योजना छ । अहिले भूईंमा काठमात्र बिछयाइएको छ । कभर्डहलमा क्रमश: क्रंक्रिट, फ्रेम र काठ राखेर प्लेटिङ गरिनेछ । अभ्यास गर्न र प्रतियोगिता गर्न आधारभूत अन्तर्राष्ट्रिय मापदण्डअनुसार बनाइने इन्जिनियर सन्ज्यालले बताए । जीर्ण कभर्डहलमा अहिले टेबलटेनिस, ब्याडमिन्टन, भलिबल, तेक्दान्दो, जुडो, मार्सलआर्ट्स लगायतका खेल संचालन भइरहेका छन् । पौडीपोखरीका लागि बहुवर्षीय ठेक्कापाँचवर्षे गुरुयोजना बनाएर आधारभूत अन्तर्राष्ट्रिय मापदण्डको पौडीपोखरी निर्माण चार वर्षअघि थालिएको थियो । बर्सेनि आउने टुक्रे बजेटका कारण निर्माण सम्पन्न हुन नसकेको पौडीपोखरीका लागि बहुवर्षीय ठेक्का आहान भइसकेको छ । अहिलेसम्म पोखरीको खाल्डो र टिकट घर मात्र निर्माण सकिएको गरिएको समितिले जनाएको छ । कार्यदलका सदस्य एवं इन्जिनियर सन्ज्यालका अनुसार करिब २२ करोड लागतमा पौडीपोखरीको निर्माण कार्य सम्पन्न गरिने लक्ष्य छ । करिब ४ करोड खर्च भइसकेको छ । उनले चेन्जिङ रुम, प्यारापिट, पानी फिल्टर मेसिन, बोरिङ, स्कोर बोर्ड लगायतका संरचना निर्माण हुने जनाए । सुटिङ रेन्जलाई अत्याधुनिक बनाइने २०५५ मा रंगशाला परिसरमा निर्माण भएको सुटिङ रेन्जलाई पनि अन्तर्राष्ट्रिय मापदण्डको बनाउने कार्यदलको योजना छ । अस्थायी रूपमा टिनले छाएको सुटिङ रेन्ज चालु अवस्थामा छ । जीर्ण भइसकेकाले सम्पूर्ण इलेक्ट्रोनिक सामग्री जडान गरी व्यवस्थित बनाउने योजना कार्यदलको छ । नेपालगन्ज सुटिङ र भारोत्तोलन खेलको उर्वरथलो हो । भारोत्तोलन एकेडेमी निर्माण भइरहेको छ । सुटिङ रेन्ज पनि अत्याधुनिक बनाउनुपर्ने खाँचो छ, सुटिङका पूर्व खेलाडी तथा क्षेत्रीय समितिका उपाध्यक्ष नरेन्द्र थापाले भने । अरु रंगशाला र कभर्डहल पनि व्यवस्थित बनाइने नेपालगन्ज मात्र हैन, मध्यपश्चिमका अन्य खेलकुद मैदान र कभर्डहललाई व्यवस्थित बनाउने योजना रहेको कार्यदलले जनाएको छ । बर्दियामा बहुउद्देश्यीय कभर्डहल निर्माणका लागि पराशर्मदाता नियुक्त गरी डीपीआरको जिम्मा दिइएको छ । उसले वैशाखभित्र डीपीआर बुझाउने जनाइएको छ । सुर्खेत रंगशाला र कोहलपुर क्रिकेट मैदानलाई व्यवस्थित र आधारभूत मापदण्डसहितको बनाउने गरी डीपीआरको जिम्मा दिइएको ओलीले बताए । सबै कामको विस्तृत परियोजना प्रतिवेदन (डीपीआर) कन्सल्टयान्टले वैशाखभित्र बुझाई सक्नेछन्, क्षेत्रीय अध्यक्ष ओलीले भने, असारदेखि सबै पूर्वाधार निर्माण गर्न टेन्डर प्रक्रियामा जाने योजना छ ।"
