शीर्षक,विवरण
'बजारले नै ब्याजदर निर्धारण गर्नुपर्छ',"काठमाडौं : पूर्व बैंकर पर्शुराम कुँवर क्षेत्रीले बैंकको ब्याजदर निर्धारण बजारले नै गर्नुपर्ने बताएका छन्। खुल्ला बजारको अवधारणामा बैंकको ब्याजदर निर्धारण गर्न कुनै पक्षले एकरूपताको अभ्यास गर्न नहुनेमा जोड दिएका उनले सबै बैंकमा एउटै ब्याजदर हुँदा बजार प्रतिस्पर्धी बन्न नसकेको बताएका हुन्। नेपाल आर्थिक पत्रकार संघ (नाफिज) ले आयोजना गरेको नाफिज संवादमा आर्थिक पत्रकारहरूलाई प्रशिक्षण दिँदै पूर्व बैंकर क्षेत्रीले बैंकर्स संघले बैंकहरूको ब्याजदरमा एकरुपता ल्याउने अभ्यास गर्न नहुने बताएका हुन्। विगतदेखि भइरहेको अभ्यासले प्रतिष्पर्धी बजारको विकास हुन नसकेको बताएका उनले यस सम्बन्धमा अर्थमन्त्रालयले राष्ट्र बैंक र राष्ट्र बैंकले बैंक वित्तीय संस्थालाई प्रश्न गर्नुपर्ने बेला भएको बताए। परिस्थिति अहसज भएका बेला बैंकहरूले सहकार्य गरी स्थितिलाई नियन्त्रणबाहिर जान नदिएको भए पनि अहिले स्थिति सहज भएको भन्दै क्षेत्रीले ब्याजदर निर्धारणको जिम्मा बैंकहरू स्वयम्लाई दिनुपर्नेमा जोड दिए। बैंकिङ क्षेत्रमा अहिले साढे ३ खर्ब रुपैयाँभन्दा बढी लगानीयोग्य रकम भएको अवस्थामा बैंकहरूले आफू अनुकुल ब्याजदर निर्धारण गर्नुपर्ने उनले बताए। हिजो बजार असहज अवस्थामा हुँदा बैंकर्स संघले ब्याजदर नियन्त्रण गर्न राम्रो भुमिका खेलेको थियो, नेपाल राष्ट्र बैंकले अनौपचारिक दबाब पनि दिएको हो, क्षेत्रीले भने, अहिले साढे ३ खर्ब भन्दा बढी लगानीयोग्य रकम छ। यस्तोमा ब्याजदर बढाउने कि घटाउने बैंलाई नै छाड्नुपर्छ। खुला अर्थतन्त्रमा सबै बैंकको एउटै ब्याजदर कसरी हुन्छ ? क्षेत्रीले प्रश्न गरे। एउटै ब्याजदर हुँदा ग्राहकलाई कुन बैंकमा पैसा जम्मा गर्ने भन्ने छनोट गर्न पनि असहज भएको उनको भनाई छ। यस सम्बन्धमा अर्थ मन्त्रालयले राष्ट्र बैंकसँग जवाफ माग्नुपर्ने बेला भएको छ, क्षेत्रीले थपे, राष्ट्र बैंकले पनि बैंकर्स संघलाई नैतीक दबाब दिनुपर्छ। अहिले बजारमा बैंकहरूसँग ३ खर्ब ७० अर्ब रुपैयाँ लगानी गर्नसक्ने क्षमता छ। बैंकहरूसँग कुल स्रोत ५९ खर्ब २५ अर्ब रुपैयाँबाट ९० प्रतिशत सीडी अनुपातको आधारमा ५३ अर्ब ३३ करोड रुपैयाँ कर्जा लगानी गर्ने क्षमता छ। तर, शनिबारसम्मको तथ्य अनुसार ४९ खर्ब ५१ अर्ब रुपैयाँ बराबरको कर्जा लगानी भएको छ। अर्थात् बैंकहरूसँग ३ खर्ब ८२ अर्ब रुपैयाँ कर्जा लगानी गर्नसक्ने स्पेस छ। चालु आर्थिक वर्षको साढे ११ महिनामा बैंकहरूले १ खर्ब ४५ अर्ब रुपैयाँ बराबरको थप कर्जा प्रवाह गरेका छन्। अर्थात् बैंकको क्षमता अनुसार कर्जा प्रवाह हुने हो भने दुई साताभन्दा कमको अवधिमा साढे ११ महिनाको भन्दा ३ गुणा बढी कर्जा प्रवाह गर्न सक्छन्। नेपाल राष्ट्र बैंकले चालु आवमा कुल कर्जा प्रवाह १२६ प्रतिशतले वृद्धि गर्ने लक्ष्य लिएको थियो। तर, साढे ११ महिनामा ३०८ प्रतिशतले मात्र कर्जा प्रवाह बढेको छ। बाँकी अवधिमा केन्द्रीय बैंकको लक्ष्यअनुसार कर्जा प्रवाह हासिल हुन बजारमा पर्याप्त लगानीयोग्य रकम भए पनि लक्ष्य पुरा हुने देखिँदैन। पूर्व बैंकर क्षेत्रीले नेपालको कर्जाजीडीपी अनुपात पनि दक्षिण एसियाली क्षेत्रकै सबैभन्दा बढी रहेको बताए। नेपालमा बैंकहरूले मात्र कर्जा प्रवाह गर्छन्। विदेशमा कर्पोरेट क्षेत्रले बैंकसँगै धितोपत्र बजार र विदेशी संस्थाबाट विभिन्न उपकरणका माध्यमबाट पनि ऋण लिन्छन्। जसका कारण ति मुलुकमा कुल गार्हस्थ उत्पादनमा कर्जाको अनुपात थोरै भएको देखिन्छ। तर, नेपालको सन्दर्भमा भने कर्जा बैंकबाट मात्र परिचालन हुने भन्ने बुझाई र व्यवहारले कुल गार्हस्थ उत्पादनमा कर्जाको हिस्सा धेरै हुने गरेको छ। ऋणका सबै स्रोत मिलाउँदा पनि नेपालको कुल गार्हस्थ उत्पादनमा कर्जाको अनुपात दक्षिण एसिया क्षेत्रकै बढी हुने क्षेत्रीको ठहर छ। यद्यपि यी सबै कर्जा उत्पादनमुलक क्षेत्रमा भन्दा व्यापारिक क्षेत्रमा प्रवाह भएकाले आर्थिक वृद्धिमा योगदान दिन नसकेको क्षेत्रीको भनाइ थियो।"
नेप्से परिसूचकमा दोहोरो अंकको गिरावट,"काठमाडौं : धितोपत्र बजारमा शेयर कारोबार मापक नेप्से परिसूचक आज पनि दोहोरो अंकले ओरालो लागेको छ। नेपाल स्टक एक्सचेञ्जका अनुसार नेप्से परिसूचक २१ दशमलव ३२ अंकले ओरालो लागेर दुई हजार ७५ दशमलव ९७ मा सीमित भएको छ। ठूला कम्पनीको कारोबार मापन गर्ने सेन्सेटिभ परिसूचक चार दशमलव १७ अंकले ओरालो लागेर तीन सय ८६ दशमलव ३५ मा सीमित भएको छ। कारोबार भएका कूल १३ उपसमूहमध्ये दुई उपसमूहको शेयर मूल्यमा वृद्धि हुँदा ११ उपसमूहको शेयर मूल्यमा भने गिरावट आएको छ। कूल ९४ लाख १८ हजार नौ सय ५२ कित्ता शेयर रू चार अर्ब पाँच करोड १० लाख ७८ हजार तीन सय ७५ मूल्यमा खरिद बिक्री भएका छन्। कारोबारका आधारमा हिमालयन लाइफ इन्स्योरेन्स शीर्ष स्थानमा रहेको छ। सो कम्पनीको रू २३ करोड ९४ लाख ४५ हजार सात सय ८५ बराबरको कारोबार भएको छ। त्यस्तै सोल्टी होटल रू २० कोड ९४ लाख ३९ हजार दुई सय ८५, नागरिक लगानी कोष रू २० करोड ३३ लाख २५ हजार पाँच सय ५४, शिवम् सिमेन्ट रू १८ करोड १८ लाख दुई हजार, एनएलजी इन्स्योरेन्स कम्पनी रू १४ करोड नौ लाख ९० हजार एक सय २२ बराबरको कारोबार भई शीर्ष पाँचभित्र पर्न सफल भएका छन्। नेप्सेका अनुसार, सिवाइसीएल नेपाल लघुवित्त र बीपीडब्ल्यू लघुवित्तको शेयर मूल्यमा १० प्रतिशतले वृद्धि भई सकारात्मक सर्किट लागेको छ। सिटी होटल नौ दशमलव ९८, चन्द्रागिरी हिल्स तीन दशमलव ६८ र एनएलजी इन्स्योरेन्सका लगानकिर्ताले दुई दशमलव ८१ प्रतिशतले कमाएका छन्। त्यस्तै लक्ष्मी इक्विटी फण्ड आठ दशमलव ९५, सामुदायिक लघुवित्त सात दशमलव १३, पाँचथर पावर कम्पनी छ दशमलव शुन्य एक, सयपत्री हाइड्रोपावर पाँच दशमलव ४१ र एनआइसी एशिया ब्यालेन्स फण्डका लगानीकर्ताले चार दशमलव ८४ प्रतिशतले गुमाएका छन्।"
"पेट्रोल, डिजेल र मट्टितेलको भाउ घट्यो, नयाँ मूल्य कति?","काठमाडौं : नेपाल आयल निगमले पेट्रोल, डिजेल र मट्टितेलको मूल्य प्रति लिटर पाँचपाँच रुपैयाँका दरले घटाएको छ। सोमबार राति १२ बजेदेखि लागू हुने गरी तेस्रो वर्ग (काठमाडौं, पोखरा र दिपायल)का लागि इन्धनको मूल्य घटाइएको हो। काठमाडौंको पेट्रोलको नयाँ मूल्य १७०, डिजेल र मट्टितेलको १५० रुपैयाँ पर्ने छ। दोस्रो वर्ग (सुर्खेत र दाङ) का लागि भाउ प्रतिलिटर ६ रुपैयाँ र पहिलो वर्ग (चारआली, विराटनगर,वीरगन्ज, जनकपुर, अमलेखगञ्ज, भलवारी, नेपालगञ्ज र धनगढी) का लागि प्रतिलिटर साढे ७ रुपैयाँ घटेको छ। एलपी ग्यासको मूल्य यथावत राखेको निगमले हवाइ इन्धनको भाउ आन्तरिक तर्फ प्रतिलिटर १४ रुपैयाँ र अन्तर्राष्ट्रियतर्फ प्रतिहजार लिटर ११५ अमेरिकी डलरले घटाएको छ।"
उधारो उठाउने र अग्रीम जमानत ऐन ल्याउन अर्थमन्त्रीसँग माग,"काठमाडौं : नेपाल उद्योग परिसंघ र अर्थमन्त्री डा प्रकाशशरण महतबीच छलफल भएको छ। परिसंघका नवनिर्वाचित अध्यक्ष राजेशकुमार अग्रवाल नेतृत्वको परिसंघ पदाधिकारीहरूले सोमबार अर्थ मन्त्रालयमा छलफल गरेका हुन्। परिसंघका नवनिर्वाचित अध्यक्ष अग्रवालले अर्थतन्त्रलाई चलायमान बनाउन, घटेको निजी क्षेत्रको मनोबल उकास्न, ६ प्रतिशतको आर्थिक वृद्धि हासिल गर्न बजेटको प्रभावकारी कार्यान्वयन एवं खुकुलो मौद्रिक नीतिमा जोड दिए। आन्तरिक उत्पादनलाई प्रबद्र्धन गर्न चोरी पैठारी नियन्त्रणका लागि कठोर बन्न उनले आग्रह गरे। उनले उद्योगी व्यवसायीहरूलाई उधारो उठाउन सहजिकरण गर्न उधारो उठाउने ऐन ल्याउन आग्रह गरे। साथै वित्तिय कसुरमा आर्थिक जरिवाना मात्रै हुनुपर्नेमा जोड दिदै उनले अग्रिम जमानत कानूनको आवश्यकता औंल्याए। हालै बजेटमा घोषणा गरिएको आयातित सामानमा लेबलिङ लगाउनुपर्ने व्यवस्था साउन १ देखि कार्यान्वयनमा जान लागेको सूचना भन्सार विभागले सार्वजनिक गरिसकेको छ। तर सो सूचना स्पष्ट नभएको र चोरी पैठारी गरेर आयात गरिएका सामाग्रीमा समेत लेबलिङ लगाएर बेच्न सक्ने भएकाले लेबलिङ नगरिएका वस्तुहरू भन्सार विन्दुमै रोकिनुपर्नेमा अर्थमन्त्रीको ध्यानाकर्षण गराए। सो अवसरमा अर्थमन्त्री महतले परिसंघले उठाएका विषयहरूलाई गम्भितापूर्वक लिएको बताउँदै परिसंघ नयाँ कार्यसमितिलाई सफल कार्यकालको शुभकामना दिए। अर्थमन्त्रीसँगको छलफलमा उपाध्यक्षहरू विरेन्द्रराज पाण्डे, रोहित गुप्ता, अमित मोर, भीम घिमिरे, स्थायी आमन्त्रित पदाधिकारी छायाँ शर्मा सहभागी थिए।"
बेनीगलेश्वर सडक : पाँच महिनामा ८० प्रतिशत प्रगति,"बेनी : कालीगण्डकी कोरीडोरको बेनीजोमसोमकोरला सडक अन्तर्गत म्याग्दीको बेनी नगरपालिका८ कालीपुल देखि वडा नम्बर ९ गलेश्वर जोड्ने बेनीगलेश्वर खण्डमा पाँच महिनामा ८० प्रतिशत भौतिक प्रगति भएको छ । धेरैजसो विकास आयोजना ढिलासुस्तिका कारण अलपत्र बनिरहेको अवस्थामा बेनीगलेश्वर सडक स्तरोन्नतिको काममा भएको भौतिक प्रगतिले प्रशंसा पाएको छ । जिल्लामा भित्रिएका ठूला योजनाहरूमा ढिलासुस्ती, अलपत्र र समयमै सम्पन्न नहुने समस्याबीच बेनीगलेश्वर सडकमा छोटो समयमा धेरै काम भएको बेनपा९ का वडा अध्यक्ष चक्र केसी बताउँछन् । बेनीगलेश्वर सडक आयोजनामा छोटो समयमा हाँसिल भएको प्रगतिले ढिलासुस्ती गर्ने निर्माण व्यवसायीलाई चुनौती बनेको छ। उनले भने, निर्माण व्यवसायीको इच्छाशक्ति, जनशक्ति, उपकरण परिचालन व्यवस्थित हुने, निर्माण सामग्रीको पर्याप्त व्यवस्थापन गर्ने तथा सरोकारवालाले नियमनसँगै सहिजकरण गर्ने हो भने ढिलासुस्ति हटाउन सकिने सन्देश दिएको छ । बेनीजोमसोम कोरला सडक योजना प्रमुख जगत प्रजापतिले कोरिडोर अन्तरगत ठेक्का लागेका खण्डमध्ये सबभन्दा छिटो, छोटो समयमा धेरै काम गरेको खण्ड बेनी गलेश्वर रहेको बताए । २०७९ माघ ६ गतेबाट सुरु गरेको योजनाको काम हालसम्म सडक तलमाथिको पर्खाल, नाली, चार वटा कल्भट, सडक फराकिलो बनाउने काम, सबवेस र २ सय मिटर आरसिसी ढलानसहित ८० प्रतिशत काम सकिएको प्रजापतिले बताए । यस सडकमा बेस हाल्न र कालोपत्रे काम मात्र बाँकी छ, उनले भने बर्खा रोकिने बित्तिकै सम्पन्न गर्ने तयारीमा निर्माण कम्पनी र आयोजना कार्यालय छ । निर्माण कम्पनीका सञ्चालक सुवासचन्द्र कार्कीले ठेक्का सम्झौता लगत्तै योजनास्थलमा उपकरण र मजदुर परिचालन गरेर साँघुरो सडकलाई आठ मिटरको फराकिलो बनाउने, सडक तल माथि पर्खाल, चारवटा कल्भट, दुई सय मिटर आरसीसी ढलानको काम सकिएको बताए । दुई किलोमिटर १०२ मिटर सडक कालोपत्रे गर्नका लागि कम्पनीले भ्याटपिएससहित १२ करोड ७५ लाख ९४ हजार ४३६ रुपैयाँमा ठेक्का लिएको थियो । दुई वर्षमा सम्पन्न गर्ने लक्ष्यसहित गत पुस १७ गते आयोजना र निर्माण कम्पनीबीच सम्झौता भएको थियो । मुक्तिनाथ प्रवेशद्वारका रुपमा रहेको यो सडकखण्डलाई समयमै सम्पन्न गर्न आयोजनाका साथै स्थानीय रुपमा नियमित रुपमा अनुगमन, निरीक्षण र समन्वय गरिएको प्रमुख जिल्ला अधिकारी तुलसीराम पौडेलले बताए । यो सडक कालोपत्र भएपछि बेनी नगरपालिका सहित रघुगंगा र अन्नपूर्ण गाउँपालिका, मुस्ताङवासी र घुम्न आउने पर्यटकलाई आवात जावातमा सहज हुने छ । कालीगण्डकी नदीको कटान र माथिबाट खहरे भेलले सडक जीर्ण र साँगुरो बन्दै गएपछि पर्यटक र सर्वसाधारणको तीव्र दबाबपछि जिल्लाका जनप्रतिनिधि, सरोकारवाला र कोरिडोरको सक्रियतामा योजना अघि बढेको हो । म्याग्दीको बेनीगलेश्वर सडक । तस्बिर : सन्तोष गौतम"
