शीर्षक,विवरण
सुभांगीलाई स्वर्ण,"काठमाडौं : काठमाडौंकी सुभांगी श्रेष्ठले दोस्रो एनटीए लिग तेक्वान्दो प्रतियोगितामा स्वर्ण पदक जितेकी छन्। शुक्रबार भएको सिनियर महिलाको ५७ केजी तौल समूहमा सीतापाइला तेक्वान्दो डोजाङकी सुभांगीले मेनुकला राईलाई पराजित गर्दै स्वर्ण पदक जितेकी हुन्। यसैगरी जुनियर पुरुष ४५ केजीमुनि फाइनलमा कञ्चनपुरका भूपेन्द्र ठकुरीले स्वर्ण जिते। उनले दीलिप स्मृतिका कैलाश थापालाई पराजित गरे। सिनियर पुरुष ५४ केजीमुनि ढल्कोका अर्पण लामा, ५८ केजीमुनि नेपाल आर्मीका रुमित राउत, ६३ केजीमुनि आर्मीका शुक्रबहादुर विक, ८७ केजीमाथि आर्मीका प्रतापबहादुर तामाङ, ८७ केजीमुनि आर्मीका मोहन तामाङ र ८० केजीमुनि आर्मीका सुवास केसीले पहिलो स्थान हात पारे। जुनियर पुरुष ४८ केजीमुनि दीलिप स्मृतिका सिसम श्रेष्ठ पहिलो भए। तीन दिने प्रतियोगितामा पुम्से र ग्योरोगीमा जम्मा ७२ स्वर्णका लागि ६ सय ५० खेलाडीले प्रतिस्पर्धा गरिरहेका छन्।"
इटहरीलाई उपाधि,"धनकुटा : हाम्रो इटहरी भेट्रान क्लबले अन्तर्राष्ट्रिय आमन्त्रण रारा भेट्रान गोल्डकपको उपाधि जितेको छ। राजारानी खेलमैदानमा भएको फाइनलमा सिक्किमको बरमियोक नामफिङ भेट्रान क्लबलाई १० गोलले पराजित गर्दै इटहरीले उपाधि जितेको हो। इटहरीको जितमा दीपेन राईले निर्णायक गोल गरेका थिए। उनले खेलको ११औं मिनेटमा गरेको गोल नै इहटरीलाई उपाधि दिलाउन निर्णायक सावित भयो। इटहरीले उपाधिसँगै एक लाख एक सय एक सय ११ रुपैयाँ पुरस्कार पायो। उपविजेता सिक्किमले ५१ हजार एक सय ११ रुपैयाँमा चित्त बुझायो। प्रतियोगिताको सर्वोत्कृष्ट खेलाडी इटहरीका अंकुरकुमार खड्गी, सर्वाधिक गोलकर्ता इटहरीकै दीपेन राई र सन्तोष राई घोषित भए। उनीहरूले प्रतियोगिताभर तीनतीन गोल गरेका थिए। उत्कृष्ट गोलरक्षक इटहरीका तुलसी श्रेष्ठ बने। विधागततर्फका उत्कृष्ट खेलाडीले जनही सात हजार रुपैयाँ पुरस्कार पाए। फाइनल खेलको म्यान अफ दी म्याच सिक्किमका सहिन्सा अन्सारी घोषित भए। उनले पाँच हजार रुपैयाँ पुरस्कार प्राप्त गरे।"
केपी ओली कप क्रिकेट : मधेस च्याम्पियन,"पोखरा : मधेस प्रदेश पोखरामा सम्पन्न प्रथम केपी ओली टीट्वेन्टी कप क्रिकेट प्रतियोगितामा च्याम्पियन बनेको छ। विभागीय टोली त्रिभुवन आर्मी क्लबलाई ११ रनले पराजित गर्दै मधेसले उपाधि जितेको हो। मधेसले दिएको एक सय ३६ रनको लक्ष्य पछ्याएको विभागीय टोली आर्मीले निर्धारित २० ओभरमा सात विकेटको क्षतिमा एक सय २४ रन मात्रै बनाउन सक्यो। राष्ट्रिय टोलीका खेलाडीको बर्चश्व रहेको आर्मीका कप्तान विनोद भण्डारीले सर्वाधिक ३२ रन बनाए। यस्तै विवेक यादवले अविजित २५, भीम सार्कीले २२, सन्तोष कार्की र सोमपाल कामीले समान १६ रन बनाए। मधेसका हरिशंकर साहले चार विकेट लिए। प्रदीप पासवानले दुई तथा प्रतिक यादवले एक विकेट हात पारे। पोखरा रंगशालामा पहिले ब्याटिङ गरेको मधेसले निर्धारित २० ओभरमा आठ विकेटको क्षतिमा एक सय ३५ रनको योगफल खडा गरेको थियो। मधेसका विशाल पटेलले अविजित ४९ रनको योगदान दिए। यस्तै कप्तान हरिशंकर साहले २७, हिमांशु दत्तले १४ र विशाल सुस्लिङले १० रन बनाए। आर्मीका विवेक यादव र साहब आलमले तीनतीन विकेट लिए। यस्तै सोमपाल कामी र बसिर अहमदले एकएक विकेट हात पारे। फाइनल खेलमा चार विकेट लिएका मधेस प्रदेशका कप्तान हरिशंकर साह म्यान अफ दी म्याच घोषित भए। प्रतियोगिताको प्लेयर अफ दी सिरिज कप्तान हरिशंकर साह नै बने। यसैगरी बेस्ट ब्याटर बागमती प्रदेशका रिद गौतम बने। उनले प्रतियोगिताभर एक सय ७० रन बनाएका थिए। बेस्ट बलर बागमती प्रदेशकै सन्दीप लामिछाने भए। उनले प्रतियोगताभर १० विकेट लिएका थिए। उपाधिसँगै मधेसले पाँच लाख रुपैयाँ पुरस्कार पायो। उपविजेता आर्मीले दुई लाख ५० हजार रुपैयाँमा चित्त बुझायो। यो सबै प्रदेशको जित हो : साह मधेस प्रदेशका कप्तान हरिशंकर साहले मधेसको जितलाई सबै प्रदेशको जितका रुपमा लिनुपर्ने बताए। च्याम्पियन बनेर प्रदेशले विभागीय टोलीलाई पनि जित्न सक्छ भन्ने सन्देश दिएको उनले बताए। यो जित सबै प्रदेशको जित हो। अबका प्रतियोगितामा अरु प्रदेशले पनि यस्तै जित निकाल्न थप हौसला मिलेको छ, कप्तान साहले भने ।"
ललितपुर सिटी एफसीले आजको खेलका लागि १ हजार फ्रिटिकट बाँड्ने,काठमाडौं : नेपाल सुपर लिग एनएसएलको शनिबारको खेलमा ललितपुर सिटी एफसीले १ हजार फ्रिटिकट बाँड्ने भएको छ । लाखे समर्थकलाई फुटबल खेल देखाउने उद्देश्यले फ्रेन्चाईच टीम ललितपुरले शनिबार १ हजार टिकट निशुल्क बाँड्न लागेको हो। नेपाल सुपर लिग २०२३ को शनिबार हुने दोस्रो खेलमा ललितपुर सिटी एफसीले धनगढी एफसीको सामना गर्दैछ। धनगढी र ललितपुरबीच एक पटक भेट भएको थियो। जसमा दुवै टिमले ११ को बराबरी खेलेका थिए । आजको खेलमा दर्शक एवम् समर्थकको संख्या बढाउन ललितपुरले १ हजार समर्थकलाई नि:शुल्क टिकट बाँड्ने भएको हो। नेपालमा फुटबल संस्कृतिको विकास गर्न नयाँ योजना ल्याएको ललितपुर सिटी एफसीले जनाएको छ। आज दिउँसो ४ बजेबाट त्रिपुरेश्वरस्थित युनाईटेड वर्ल्ड ट्रेड सेन्टरको भुँइ तलमा रहेको पेपे पिज्जा र घान्द्रुक नेपाली किचेनबाट फ्रिटिकट वितरण हुनेछ । खेल शनिबार साढे ५ बजेबाट रंगशालामा सुरु हुनेछ।
मैदान मर्मतमै ठूलो लगानी,"फिदिम : सामान्यतया तयारी अवस्थामा रहेको खेल मैदानमा क्लबहरूले गोल्डकपजस्ता फुटबलका ठूला प्रतियोगिता सञ्चालन गर्दै आएका छन्। तर, पाँचथरमा भने हरेक पटक गोल्डकप सञ्चालन गर्न क्लबले मैदान मर्मत गर्नुपर्ने बाध्यता छ। खेलकुदप्रति राज्यको उदासिनताले मैदान निर्माणको दायित्व क्लबले बेहोर्नु परेको खेलप्रेमीहरूको तर्क छ। राज्य जिम्मेवार नभएकै कारण पाँचथर फुटबल क्लबले किराँत गोल्डकप सञ्चालन गर्न वर्षेनी मैदान मर्मतका लागि ठूलो रकम खर्चिनुपरेको छ। स्तरीय प्रतियोगिता सञ्चालन गर्न मैदान निर्माणमा ठूलो लगानी गर्नुपरेको पाँचथर फुटबल क्लबका अध्यक्ष अनुराग केप्छाकी मगरले जानकारी दिए। मैदान तयार गर्न राज्यका निकायले चासो नदिँदा जिल्लामा गोल्डकपलगायतका फुटबलका प्रतियोगिता सञ्चालन हुन नसकेको धेरै वर्ष भयो, मगरले भने फुटबलपे्रमीहरूको भावनालाई कदर गर्न मैदान मर्मत गरेर गोल्डकप सञ्चालन गर्ने हिम्मत गरेका हौं। शनिबारदेखि फिदिम माविको खेल मैदानमा प्रथम अन्तर्राष्ट्रिय आमन्त्रित किराँत गोल्डकप फुटबल प्रतियोगिता सञ्चालन हुँदैछ। प्रतियोगितामा नेपाल र भारतका गरी आठ टोलीले सहभागिता जनाउने निश्चित भएको छ। उक्त प्रतियोगितालाई स्तरीय बनाउन क्लबले मैदान मर्मतमा ठूलो लगानी गरेको हो। मैदान मर्मतका लागि आठ लाखभन्दा बढी खर्चनुपयो, सचिव राजु राईले भने मैदानको लेबल मिलाउनेदेखि अस्थायी प्यारापिट निर्माणमा क्लबले लगानी गरेको छ। मैदान मर्मतमा मात्रै झण्डै १० लाख अतिरिक्त खर्च बढेको क्लबको दावी छ। मैदान मर्मतको काम अन्तिम चरणमा पुगेको छ, मगर भन्छन् स्तरीय गोल्डकप सञ्चालन गर्न कडा मेहनतका साथ मैदान तयार गरेका हौं। सदरमुकाम फिदिममा २०७६ सालदेखि गोल्डकप सञ्चालन हुन सकेको छैन। मैदान अभावले चार वर्षयता स्तरीय गोल्डकप सञ्चालन हुन नसकेको हो। फिदिम माविको स्वामित्वमा रहेको मैदानको पर्खाल २०७६ साउनमा भत्किएपछि पाँचथरमा स्तरीय गोल्डकप सञ्चालन हुन नसकेको हो। मैदानको पर्खाल भत्किएपछि फिदिममा सञ्चालन हँुदै आएका फाल्गुनन्द गोल्डकप र पाँचथर गोल्डकप फुटबल प्रतियोगिता बन्द छन्। लामो समयसम्म स्तरीय गोल्डकप सञ्चालन नहुँदा प्रतिभाहरू निराश भएको भन्दै पाँचथर फुटबल क्लबले मैदान मर्मत गरेर गोल्डकप सञ्चालन गर्न लागेको हो। सदरमुकाममा स्तरीय मैदान निर्माणका लागि २०७७ माघमा ठेक्का लागेको थियो। १० करोड ७९ लाखमा पीएस किराँतेश्वर मैनाचुली जेभीले निर्माणको जिम्मा पायो। निर्माण कम्पनीले निर्धारित समयमा काम नसक्दा फिदिममा खेलकुदका गतिविधि ठप्प छन्। ३० वटा सटर भएको सपिङ कम्प्लेक्ससहितको खेल मैदान बनाउन लागिएको उक्त मैदानको काम आधा पनि भएको छैन। हालसम्म ४० प्रतिशत भौतिक र ३१ प्रतिशत बित्तिय प्रगति भएको बताइएको छ। निर्माण कम्पनीले काममा ढिलाई गरेपछि क्लबले मैदान मर्मत गरेर गोल्डकप सञ्चालनको तयारी गरेको हो। किराँत गोल्डकपमा हालसम्मकै सर्वाधिक पुरस्कार राशिको व्यवस्था गरिएको छ। १६ गतेबाट सञ्चालन हुने प्रतियोगितामा नेपाल र भारतका गरी जम्मा आठ टोलीले सहभागिता जनाउने छन्। मंसिर १६ गते हुने उद्घाटन खेलमा आयोजक पाँचथर फुटबल क्लब र तेह्रथुमको मितेरी फुटबल क्बलबीच भिडन्त हुनेछ। १७ गते सञ्चालन हुने खेलमा इलामको रेडहर्ष फुटबल क्लबसँग झापाको बिर्तामोड युनाइटेड क्लब भिड्नेछ। मंसिर १८ गते हुने खेलमा डीएफसी मोरङसँग दार्जिलिङको युनाइटेड फुटबल क्लबले प्रतिस्पर्धा गर्नेछ। मंसिर १९ गते हुने खेलमा ताप्लेजुङको कर्णसिंह सोनाम स्मृति क्लबसँग काठमाडौंको हिमालयन शेर्पा क्लब भिड्नेछ। प्रतियोगिताको प्रथम पुरस्कार चार लाख चार हजार चार सय ४४ रुपैयाँ र दोस्रो पुरस्कार दुई लाख दुई हजार दुई सय २२ रुपैयाँ राखिएको छ। प्रत्येक खेलको प्लेयर अफ दी म्याचलाई पाँच हजार, प्रतियोगिताको उत्कृष्ठ खेलाडीलाई १० हजार र म्यान अफ दी सिरिजलाई २५ हजार नगद पुरस्कार प्रदान गर्ने आयोजकको तयारी छ।"
