शीर्षक,विवरण
सुनमायाको हङकङ यात्रा,"हङकङ : चर्चित एड्भेन्चर्स ब्रान्ड द नर्थ फेसको निमन्त्रणामा हङकङ आएकी सुनमाया बुढाले एसिया प्यासिफिक एड्भेन्चर टिम टिएनएफ हङकङ ५० किलोमिटर ट्रेल रेस ६ घण्टा १० मिनेटमा पूरा गर्दै पहिलो स्थान हात पारिन्। योसँगै द नर्थ फेसको विभिन्न एडभेन्चर खेलकुदमा ब्रान्ड प्रमोसनमा उनी सहभागी हुनेछिन्। हङकङमा उनी पहिलो पटक अन्तर्राष्ट्रिय प्रतिस्पर्धामा सहभागी भएकी होइनन्, तीन दर्जनभन्दा बढी देशहरूमा विश्व चर्चित ब्रान्ड र आयोजकहरूको निमन्त्रणामा उनले आफ्नो धावक कौशलता देखाइसकेकी छन्। १३ वर्षअघि वीरेन्द्र रनिङ शिल्डमा सहभागी भएपछि उनले पछाडि फर्केर हेर्नुपरेको छैन। उनले थुप्रै राष्ट्रिय तथा अन्तर्राष्ट्रिय प्रतियोगितामा आफ्नो क्षमता देखाइसकेकी छन्। सन् २०१५ मा धरान आठ किलोमिटर दौडमा तेस्रो, सोही वर्ष गोदावरी ट्रेल रेसमा प्रथम र सन् २०१६ मा मनास्लु टेल रेस एक सय ७० किलोमिटरमा पहिलो स्थान हात पारिन्। अन्तर्राष्ट्रिय प्रतियोगिताहरूमा हङकङमा भएको ५० किलोमिटरको एमएसआईजी टेल रेस ६ घण्टामा पूरा गर्दै दोस्रो स्थान हात पारेकी थिइन्। यस्तै सन् २०१७ मा हङकङ साइकुङ ट्रेल रेसमा दोस्रो, सन् २०१८ चीनको गङलिगङ यूटीएमबी ५५ किलोमिटर दौड पाँच घण्टा ३० मिनेटमा पार गर्दै पहिलो स्थान हात पारेकी थिइन्। यस्तै फ्रान्सको ९० किलोमिटर दौडमा दोस्रो, ओमान टीयूएमबी ५० किलोमिटरमा पहिलो, सन् २०२१ थाइल्यान्डमा भएको प्रतियोगितामा पहिलो र सन् २०२२ मा चर्चित फ्रान्स टेल रेसमा दोस्रो स्थान हात पारेकी थिइन्। कर्णाली प्रदेशको जुम्ला पातारासी पेरे२ बाट उदाएकी सुनमायाको अविराम विजयी यात्रा उनकै दृढ संकल्प, कठोर परिश्रम र लगनको उपज हो। २४ वर्षअघि बुवा गोरा बुढा र आमा मुनतली बुढाको पाँचौ सन्तानका रुपमा जन्म लिएकी सुनमायाको ६ दिदीबहिनी र एक भाइ छन्। अभावै अभावमा हुर्किएकी उनको जीवन यात्रा कुनै चलचित्रको कथाभन्दा कम छैन। आफ्नो सफलता र कर्मले बुवा आमाको अनुहारमा खुसी ल्याउन सकेपनि राष्ट्रले आफूलाई पहिचान नदिएको गुनासो उनी गर्छिन्। कर्णाली प्रदेशले भने दुई लाख रुपैयाँसहित सम्मान गरेको थियो।"
एसीसी प्रिमियर कपमा भीमको अर्धशतक,काठमाडौं : एसीसी मेन्स प्रिमियर कपको समूह एको पहिलो खेलमा मलेसियाविरुद्ध दुई सय ३६ रनको लक्ष्य पछ्याइरहेको नेपालका लागि भीम सार्कीले अर्धशतक बनाएका छन्। त्रिवि क्रिकेट मैदानमा वान् डाउनमा क्रिजमा उत्रिएका भीमले ७५ बलमा तीन चौकासहित ५० रन पूरा गरेका हुन्। उनीसँगै क्रिजमा रहेका कुशल मल्लले २७ रन बनाएर खेलिरहेका छन्। त्यसअघि कप्तान रोहित पौडेल ४२ तथा कुशल भुर्तेल ३८ रन बनाएर आउट भइसकेका छन्। पहिलो इनिङमा कप्तान अहमद फैजको अर्धशतकप्रेरित मलेसियाले ९ विकेट गुमाएर दुई सय ३५ रनको योगफल तयार गरेको थियो। मलेसियाका लागि वान् डाउनमा क्रिजमा उत्रिएका फैजले ९५ बलमा एक छक्का र आठ चौकासहित ७६ रनको इनिङ खेले। ओपनर विरनदीपसिंहसँग एक सय १६ रनको साझेदारी गर्दै फैजले उत्कृष्ट इनिङ खेले। विरनदीपले ९४ बलमा दुई चौकासहित ४६ रन बनाए। यसअघि अर्का ओपनर मोहम्मद अमिर १८ बलमा १७ रन बनाएर पभिलियन फर्किँदा खिजार हायातले २२ रनको योगदान गरे। स्यार्जुल इद्रुसले २१ रन बनाउँदा अन्य ब्याटरले उल्लेख्य प्रदर्शन गर्न सकेनन्। नेपालका लागि सोमपाल कामीले ९ ओभरमा ४० रन खर्चेर तीन विकेट लिए। यस्तै। सन्दीप लामिछानेले १० ओभरमा ४८ रन खर्चेर एक मेडनसहित तीन विकेट लिए। ललित राजवंशीले दुई तथा गुल्शन झाले पनि एक मलेसियन ब्याटरलाई पभिलियन फर्काएका थिए।
एसीसी प्रिमियर कप : मलेसियाले नेपाललाई दियो २३६ रनको लक्ष्य,"त्रिवि क्रिकेट मैदानमा टस जितेर ब्याटिङ थालेको मलेसियाले ९ विकेट गुमाएर २३५ रनको योगफल तयार गर्यो। काठमाडौं : कप्तान अहमद फैजको अर्धशतकप्रेरित मलेसियाले एसीसी मेन्स प्रिमियर कपको समूह एको पहिलो खेलमा नेपाललाई २३६ रनको लक्ष्य दिएको छ। त्रिवि क्रिकेट मैदानमा टस जितेर ब्याटिङ थालेको मलेसियाले ९ विकेट गुमाएर २३५ रनको योगफल तयार गर्यो। मलेसियाका लागि वान् डाउनमा क्रिजमा उत्रिएका फैजले ९५ बलमा एक छक्का र आठ चौकासहित ७६ रनको इनिङ खेले। ओपनर विरनदीपसिंहसँग ११६ रनको साझेदारी गर्दै फैजले उत्कृष्ट इनिङ खेले। विरनदीपले ९४ बलमा दुई चौकासहित ४६ रन बनाए। यसअघि अर्का ओपनर मोहम्मद अमिर १८ बलमा १७ रन बनाएर पभिलियन फर्किँदा खिजार हायातले २२ रनको योगदान गरे। स्यार्जुल इद्रुसले २१ रन बनाउँदा अन्य ब्याटरले उल्लेख्य प्रदर्शन गर्न सकेनन्। नेपालका लागि सोमपाल कामीले ९ ओभरमा ४० रन खर्चेर तीन विकेट लिए। यस्तै, सन्दीप लामिछानेले १० ओभरमा ४८ रन खर्चेर एक मेडनसहित तीन विकेट लिए। ललित राजवंशीले दुई तथा गुल्शन झाले पनि एक मलेसियन ब्याटरलाई पभिलियन फर्काएका थिए।"
एसीसी प्रिमियर कप : भीम र कुशलको अर्धशतकमा नेपालको विजयी सुरुआत,"काठमाडौं : कुशल मल्लको अविजित अर्धशतकप्रेरित नेपालले एसीसी मेन्स प्रिमियर कपको समूह एमा विजयी सुरुआत गरेको छ। त्रिवि क्रिकेट मैदानमा टस जितेर ब्याटिङ थालेको मलेसियाले ९ विकेट गुमाएर दुई सय ३५ रनको योगफल तयार गरेको थियो। जवाफी ब्याटिङमा उत्रिएको नेपालले ३६२ ओभरमा चार विकेट गुमाएर लक्ष्य पूरा गर्यो। नेपालका लागि ४० बलको सामना गरेका कुशलले पाँच चोका र पाँच छक्कासहित ७० रनको अविजित इनिङ खेले। यस्तै, चौथो विकेटका लागि कुशलसँग एक सय १२ रनको साझेदारी गरेका भीम सार्कीले ९८ बलमा पाँच चौकासहित ७१ रनको इनिङ खेलेका थिए। त्यसअघि ओपनर कुशल भुर्तेल ३१ बलमा पाँच चौका र दुई छक्कासहित ३८ रन बनाएर पभिलियन फर्केका थिए। अर्का ओपनर आशिफ शेख १ रन जोडेर आउट हुँदा वान् डाउनमा क्रिजमा उत्रिएका भीमले उत्कृष्ट ब्याटिङ गरे। कप्ता रोहित पौडेल ४३ बलमा पाँच चौकासहित ४२ रन जोडेर पभिलियन फर्किएका थिए। मलेसियाका लागि मोहम्मद वाफिक, रिजवान हेदर, खिजर हायात र विरनदीप सिंहले एकएक विकेट लिए। पहिलो इनिङमा कप्तान अहमद फैजको अर्धशतकप्रेरित मलेसियाले ९ विकेट गुमाएर दुई सय ३५ रनको योगफल तयार गरेको थियो। मलेसियाका लागि वान् डाउनमा क्रिजमा उत्रिएका फैजले ९५ बलमा एक छक्का र आठ चौकासहित ७६ रनको इनिङ खेले। ओपनर विरनदीपसिंहसँग एक सय १६ रनको साझेदारी गर्दै फैजले उत्कृष्ट इनिङ खेले। विरनदीपले ९४ बलमा दुई चौकासहित ४६ रन बनाए। यसअघि अर्का ओपनर मोहम्मद अमिर १८ बलमा १७ रन बनाएर पभिलियन फर्किँदा खिजार हायातले २२ रनको योगदान गरे। स्यार्जुल इद्रुसले २१ रन बनाउँदा अन्य ब्याटरले उल्लेख्य प्रदर्शन गर्न सकेनन्। नेपालका लागि सोमपाल कामीले ९ ओभरमा ४० रन खर्चेर तीन विकेट लिए। यस्तै। सन्दीप लामिछानेले १० ओभरमा ४८ रन खर्चेर एक मेडनसहित तीन विकेट लिए। ललित राजवंशीले दुई तथा गुल्शन झाले पनि एक मलेसियन ब्याटरलाई पभिलियन फर्काएका थिए। नेपालले दोस्रो खेल शुक्रबार ओमानसँग कीर्तिपुरमै खेल्ने छ। मलेसियाले प्रतियोगिताको दोस्रो खेलमा बिहीबार साउदी अरबको सामना गर्नेछ। समूह बीमा हङकङ विजयी समूह बीअन्तर्गत मुलपानी क्रिकेट मैदानमा मंगलबार नै भएको खेलमा हङकङले सिंगापुरलाई आठ विकेटले पराजित गरेको छ। टस हारेर ब्याटिङ थालेको सिंगापुरले ४२१ ओभरमा सबै विकेट गुमाउनुअघि एक सय ७४ रनको योगपफल तयार गरेको थियो। सिंगापुरका कप्तान अरित्रा दत्तले ५७ बलमा ९ चौकासहित ४९ रन बनाउनुबाहेक अन्य ब्याटरले उल्लेख्य प्रदर्शन गर्न सकेनन्। हङकङका इशान खानले सर्वाधिक चार तथा यासिम मुर्ताजाले तीन विकेट लिएका थिए। दोस्रो इनिङमा हङकङका लागि विस्फोटक ब्याटिङ गरेका बाबर हायातले ९४ बलमा १० चौका र ६ छक्कासहित अविजित एक सय आठ रनको शतकीय इनिङ खेले। त्यसअघि कप्तान निजाकत खानले ८९ बलमा चार चौका र एक छक्कासहित ५१ रन जोडेका थिए।"
एसीसी प्रिमियर कप : नेपालले पहिले बलिङ गर्ने,"आजको खेलमा ज्ञानेन्द्र मल्ल, करण केसी र प्रतिश जिसी बेञ्जमा रहेका छन्। काठमाडौं : एसीसी मेन्स प्रिमियर कपको उद्घाटन खेलमा नेपालले मलेसियाविरुद्ध टस हारेर बलिङ गर्ने भएको छ। टस जितेर मलेसियाका क्याप्टेन हमद फैजले पहिले ब्याटिङ रोजेपछि नेपालले बलिङ गर्न लागेको हो। कीर्तिपुरस्थित त्रिवि क्रिकेट मैदानमा भएको खेलमा नेपाल विजयी सुरुआतको लक्ष्यमा छ। टस हारेपछि पहिलो खेलमा मलेसियाविरुद्ध नेपालले फिल्डिङ गर्ने निम्तो पाएको छ। नेपाल क्रिकेट संघ (क्यान)ले प्रतियोगिताका लागि १४ सदस्यीय राष्ट्रिय क्रिकेट टिम घोषणा गरिसकेको छ। रोहित पौडेलको कप्तानीमा आइतबार घोषित टिममा कुशल भुर्तेल, आशिफ शेख, ज्ञानेन्द्र मल्ल, कुशल मल्ल, आरिफ शेख, सोमपाल कामी, दीपेन्द्रसिंह ऐरी, गुल्शन झा, करण केसी, सन्दीप लामिछाने, भीम सार्की, प्रतिश जिसी र ललित राजवंशी छन्। यस्तै, अर्जुन साउद, सन्दीप जोरा, सूर्य तामाङ र किशोर महतोलाई वैकल्पिक राखेको छ। आजको खेलमा ज्ञानेन्द्र मल्ल, करण केसी र प्रतिश जिसी बेञ्जमा रहेका छन्। प्रतियोगिताको तयारी स्वरुप शनिबार भएको अभ्यास खेलमा नेपालले ओमानलाई पाँच विकेटले पराजित गरेको थियो। वैशाख १८ गतेसम्म हुने प्रतियोगितामा १० टिमको सहभागिता रहने छ। त्रिवि क्रिकेट मैदान र मुलपानी क्रिकेट मैदानमा हुने प्रतियोगितामा १० टिमलाई दुई समूहमा विभाजन गरेर राउन्ड रोबिन पद्धतिबाट सेमिफाइनलिस्टको टुङ्गो लगाइनेछ। समूह एमा नेपालसँगै ओमान, कतार, मलेसिया र साउदी अरब परेका छन्। यस्तै, समूह बीमा यूएई, हङकङ, कुवेत, सिंगापुर र बहराइन छन्। प्रतियोगिताको विजेताले आगामी सेप्टेम्बरमा पाकिस्तानमा हुने एसिया कपमा भारत र पाकिस्तान सम्मिलित समूहमा रहेर खेल्न पाउने छ। यही प्रतियोगिताका शीर्ष तीन टिमले जुलाईमा हुने एसीसी इमर्जिङ टिम्स एसिया कप खेल्न पाउने छन्। नेपालले पहिलो खेल वैशाख ५ गते मलेसियासँग त्रिवि क्रिकेट मैदानमा खेल्ने छ। यस्तै, दोस्रो ८ गते ओमान, तेस्रो ११ साउदी अरबसँग र १४ गते कतारसँग खेल्ने छ। साउदी अरब र नेपालबीचको खेल मुलपानी मैदानमा हुनेछ।"
