शीर्षक,विवरण
गरिबीको पीडा कहिलेसम्म ?,"सरकारले गरिबी निवारणका लागि ठोस कार्य गर्नै सकेको छैन। गरिबी निवारणका लागि चालिएका हरेक कदमले भ्रष्टाचारको छाप छोडेका छन्। घाउ होस् वा रोग, पीडा सहन सकिन्छ। अनि अपमान होस् वा बिछोड, त्यसको पनि पीडा सहन सकिन्छ। तर गरिबीको पीडा सहन सक्दैन मान्छे। एकदमै असह्य हुन्छ, गरिबीको पीडा। पीडाको आवेगमा मर्न र मार्न उद्यत् हुन्छन् मान्छे। गरिबी निकै निर्दयी छ। कहिले अपराधी बनाउँछ त कहिले आत्मघाती। आत्महत्या र हत्याको पनि एउटा कारण बन्दैछ गरिबी। गरिबीका कारण देशको संघीय राजधानी काठमाडौंमै सामूहिक आत्महत्या प्रयास भएका छन्। २०७८ फागुनमा काठमाडौं डल्लु घर भई नागार्जुनको रामकोट, डाँडापौवा डेरा बस्ने भीममान प्रधानको पाँच सदस्यीय परिवारले विषसेवन गरी आत्महत्या प्रयास गरेको घटना छ। २०७७ फागुनमा दैलेख आठबिसस्थित निमाइलकी सुखी बडुवालले तीन छोरी र एक छोरासहित कर्णाली नदीमा हाम फाले। कारण गरिबी नै थियो। प्रहरीको तथ्यांकअनुसार आर्थिक वर्ष २०७४७५ देखि २०७८७९ को अवधिमा वार्षिक औसत ६ हजार २ सय ६० वटा आत्महत्याका घटना भएका देखिन्छन्। मुलुकमा गरिबीका कारण हतास र निराश भएर आत्महत्या गर्ने अथवा हत्या गर्ने एवं भोक र रोगले थलिएर मर्ने क्रम बढिरहेको छ। जुन यथार्थ अखबारहरूमा छापिने समाचार र प्रहरी प्रतिवेदनले पुष्टि गर्छ। बागलुङ टंग्रामका तुलबहादुर पुनले मिर्गौला रोगी पत्नीको उपचार खर्च जुटाउन नसकेपछि पोखरामा अस्पतालको छतबाट हाम्फालेर आत्महत्या गरेको घटना ताजै छ। नेपालगन्जसँगैको कालिका गाउँका दुखीराम खटिकका दुई छोरा र एक छोरीलाई सर्पले टोक्यो। अस्पताल लैजान रिक्सा खर्च नभएकाले हिँडाएर लग्दै गर्दा सबैको बाटैमा मृत्यु भयो। झापाका विद्रोही कम्युनिस्ट नेता डिकेन्द्र राजवंशीले एमालेको तत्कालीन मुख्यालय बल्खुमा छोराको बेरोजगारीका कारण झुन्डिएर आत्महत्या गरेको र त्यही पीडामा छोरा शम्भुले पनि आत्महत्या गरेको घटना सायदै कसैले बिर्सेको होला। गरिबीकै कारण विशेषतः गाउँ र सहरका नेपाली जनताले एकल तथा सामूहिक आत्महत्या र आफ्नै सन्तानको हत्या गर्नु परिरहेको दुःखद् अवस्था विद्यमान छ। तर सरकारी निकाय भने निरन्तर गरिबी घटिरहेको तथ्यांक सार्वजनिक गरेर आफ्नो सफलताको प्रदर्शन गरे आत्मरतिमा रमाइरहेको छ। केन्द्रीय तथ्यांक कार्यालय (तत्कालीन तथ्यांक विभाग) ले गरेको पहिलो नेपाल जीवनस्तर सर्वेक्षण २०५२५३ अनुसार नेपालमा गरिबीको रेखामुनिको जनसंख्या ४१७६ प्रतिशत थियो। दोस्रो नेपाल जीवनस्तर सर्वेक्षण २०६०६१ अनुसार गरिबीको रेखामुनिको जनसंख्या ३०८५ प्रतिशत थियो। तेस्रो नेपाल जीवनस्तर सर्वेक्षण २०६६६७ अनुसार भने नेपालमा गरिबीको रेखामुनिको जनसंख्या २५३९ प्रतिशत पाइयो। चौथो नेपाल जीवनस्तर सर्वेक्षणको नतिजा आउन बाँकी नै छ। राष्ट्रिय योजना आयोगले तयार पारेको पन्ध्रौं योजनाको दस्तावेजमा नेपालमा गरिबीको रेखामुनिको जनसंख्या १८७ प्रतिशत छ। बहुआयामिक गरिबी सूचकांक २८६ प्रतिशत र मानव विकास सूचकांक ०५७९ रहेको उल्लेख छ। दस्तावेजमा गरिबी निवारण र आर्थिक असमानता न्यूनीकरणको क्षेत्रमा अपेक्षाकृत उपलब्धि हासिल हुन नसकेको पनि उल्लेख छ। पन्ध्रौं योजनामा गरिब र धनीबीचको आर्थिक असमानता न्यूनीकरण गर्दै गरिबीको रेखामुनि रहेको जनसंख्या एकल अंकमा ल्याउने लक्ष्य राखिएको छ। केही वर्षको अन्तरालमा नेपालमा गरिबीको रेखामुनिको जनसंख्या घटेको देखिन्छ। तथ्यांकमा गरिबी घटे पनि गाउँघरमा जनतालाई गरिबीकै कारण अमूल्य जीवन समाप्त पार्नुपर्ने बाध्यता छ। नेताहरू भने सत्ताको दाउपेचमै अल्झिरहेका छन्। पचासौं लाखको संख्यामा वैदेशिक रोजगारीमा गएका नेपाली कामदारले ठूलो परिमाणमा रेमिट्यान्स नपठाएको भए न अर्थतन्त्र चल्थ्यो, न त गरिब नेपालीको चुल्हो बल्थ्यो। नेपालको गरिबी न्यूनीकरणमा सरकारको होइन, विदेशी भूमिमा कार्यरत नेपाली कामदारको ठूलो देन छ। सरकारले गरिबी निवारणका लागि ठोस कार्य गर्नै सकेको छैन। गरिबी निवारणका लागि चालिएका हरेक कदमले भ्रष्टाचारको छाप छोडेका छन्। गरिबी निवारणमा भने उपलब्धि हासिल हुन सकेन। नेपालको कुल गार्हस्थ्य उत्पादनमा रेमिट्यान्सको हिस्सा २१ प्रतिशतभन्दा बढी छ। नेपाल राष्ट्र बैंकको अध्ययनअनुसार एक कामदारले वार्षिक औसत ५ लाख ३२ हजार रुपैयाँ रेमिट्यान्स पठाउँछ। बैंककै पाँचौं पारिवारिक बजेट सर्वेक्षणले नेपाली घरपरिवारको कुल मासिक आम्दानीमा रेमिट्यान्सको हिस्सा १७६१ प्रतिशत रहेको देखाउँछ। आर्थिक विश्लेषकहरूले गरिबीलाई दुई प्रकारले परिभाषित गर्छन्, निरपेक्ष गरिबी र सापेक्ष गरिबी। निरपेक्ष गरिबीमा साँच्चिकै गरिबहरू पर्छन् भने सापेक्ष गरिबीमा गरिब देखिनेहरू पर्छन्। साँच्चिकै गरिबहरू आर्थिक अवस्थाले गरिबीको दुष्चक्रमा फँस्दै गइरहेका छन्। बेरोजगारी र अत्यन्त न्यून आयको कारण धेरै मानिस गरिबीको दुष्चक्रमा फसेका छन्। यस्ता गरिबमा भोका छोराछोरीका क्रन्दनलाई चुपचाप सुन्नु र मुटु गाँठो पारेर सहनु सिवाय विकल्प छैन। रोग लाग्दा उपचारै नगरी बस्नुको विकल्प छैन। बढ्दो गरिबीसँगै गरिबीकै कारण सामूहिक आत्महत्या गर्नेको क्रम पनि बढ्दो छ। यस्तो खबरले सरकारमा बस्ने र नीतिनिर्माण गर्नेलाई दुख्नुपर्ने हो, लज्जाबोध हुनुपर्ने हो। दुःखद्, उनीहरू कागजमा गरिबी घटेको देखाएर सन्तोष मानिरहेका छन्। गरिबीको दुष्चक्र तोड्न सजिलो छैन। सामान्य प्रयासले गरिबी निवारण सम्भव छैन। मुलुकका लागि सामाजिक तथा आर्थिक चुनौतीको रूपमा खडा भएको गरिबीको दुष्चक्रलाई तोड्नु वास्तवमै चुनौतीपूर्ण कार्य हो।"
महालेखाका सुझावको बेवास्ता,"सरकारले तत्काल कारबाही प्रक्रिया अघि बढाउन सक्छ। भ्रष्टाचारका विषयलाई कारबाही गरेर नजिर बसाल्न सकिन्छ। महालेखापरीक्षक कार्यालयले हरेक वर्ष प्रतिवेदन सार्वजनिक गर्छ। त्यस बेला उसका सुझाव कार्यान्वयनको जिम्मा कसको भन्ने प्रश्न उठ्ने गर्छ। यसमा अलमल हुनुपर्ने कारण नै छैन। संवैधानिक निकायले दिने सुझाव कार्यान्वयनको जिम्मा सरकारको हो। बेथिति छ भने सुधार गर्न महालेखापरीक्षकले सरकारलाई भन्ने हो। पैसा असुली गर्नुपर्ने भए असुली गर, नियमन गर्नुपरे नियमन गर भनेर देखाइदिने हो। अर्को महत्वपूर्ण पक्ष हो, संसद्को सार्वजनिक लेखा समिति। प्रतिवेदनले औंल्याएका विषयमा महालेखापरीक्षकको उपस्थितिमा उसले छलफल गर्छ। कार्यान्वयन गर्न निर्देशन दिन्छ। समितिको निर्णयका आधारमा सरकारले सम्बन्धित निकायलाई कारबाही वा कार्यान्वयन गर्न भन्छ। आर्थिक हिनामिनाको विषय हो भने महालेखानियन्त्रक कार्यालयले हेर्छ। सैद्धान्तिक क्षेत्रको नीतिगत विषय हो भने अन्य सम्बन्धित निकायले सुधार गर्नुपर्छ। तर, विडम्बना ! समितिका बैठक नै नियमित हुन सकेका छैनन्। केही गरी बैठक बसेर कुनै निर्णय गरिहाले पनि सरकारले निहित स्वार्थमा बेवास्ता गर्छ। विकसित मुलुकसँगै छिमेकी भारतमा महालेखाले औंल्याएका विषयलाई सरकारले कार्यान्वयनमा लैजान्छ। अमेरिकामा ७०, चीनमा करिब ८० प्रतिशत सुझाव कार्यान्वयन हुने गरेका छन्। शतप्रतिशत त कहीँ पनि हुँदैन। तर, केही त हुनुपर्छ नि ! सबै सुझाव तथा सुधारका पाटा एकै वर्षमा पूरा गर्नै पर्छ भन्ने छैन। हरेक वर्ष प्रणालीगत सुधार गर्दै जानुपर्छ। अघिल्ला सुझाव कार्यान्वयन हुँदै जानुपर्ने हो। यसबाट प्रशासनिक एवं आर्थिक व्यवस्थाको मूल्यांकनमा पनि सुधार भएको मानिन्छ। सरकार तथा कर्मचारीतन्त्रले जवाफदेहिता महसुस गरे भनेर मूल्यांकन गर्ने ठाउँ पनि रहन्छ। तर, यस्तो हुन सकिरहेको छैन। अस्थिर सरकारका कारण प्रतिवेदनले प्राथमिकता पाउँदैन। प्रणालीगत सुधार गर्न सरकार प्रतिबद्ध हुनुपर्यो। अर्को भनेको कानुनी जिम्मेवारी लेखा समितिले पूरा गर्नुपर्छ। महालेखाको प्रतिवेदनमा कमजोरी भेटिए सुधार गराउने अधिकार पनि समितिलाई छ। तर, त्यत्तिकै गन्जागोल गरेर छाड्ने हो भने कहिले पनि सुशासन आउँदैन। कर्मचारीतन्त्रमा पुरानै मानसिकता हाबी हुन्छ। त्यसबाट जवाफदेहीमा असर गर्छ। जवाफदेहिता हुन नसके प्रणाली नै ध्वस्त हुन्छ। र, आर्थिक अनियमितताले गाँज्छ। सरकार, समिति र कर्मचारीतन्त्रमा जवाफदेहिता हुन जरुरी छ। सरकारले तत्काल कारबाही प्रक्रिया अघि बढाउन सक्छ। भ्रष्टाचारका विषयलाई कारबाही गरेर नजिर बसाल्न सकिन्छ। प्रतिवेदनकै आधारमा केही मुद्दा अख्तियारमा गएका पनि छन्। केहीमा कारबाही पनि भएका छन्। महालेखाको व्यवस्थामा पनि सुदृृढ गर्नुपर्नेछ। अहिलेको क्षमता, स्रोत तथा साधनले महालेखापरीक्षक कार्यालयले प्रभावकारी काम नगर्न सक्छ। (आचार्य पूर्वमहालेखापरीक्षक हुन्।)"
