शीर्षक,विवरण
दृष्टिका सञ्चालक श्रेष्ठ र सम्पादक सुब्बालाई जनही २५ हजार धरौटीमा छोड्न आदेश,"काठमाडौं : दृष्टि साप्ताहिकका सञ्चालक शम्भु श्रेष्ठ र कार्यकारी सम्पादन एमपी सुब्बालाई जनही २५ हजार धरौटीमा छोड्न आदेश भएको छ। विशेष अदालतका न्यायाधीश टेकनारायण कुँवर नेतृत्वको पूर्ण इजलासले श्रेष्ठ र सुब्बालाई धरौटीमा छोड्न आदेश दिएको हो। अवहेलना मुद्दामा यसअघि ३ दिनभित्र विशेष अदालतमा उपस्थित हुन श्रेष्ठ र सुब्बालाई आदेश दिइएको थियो। दृष्टि मिडियाका तर्फबाट कानुन व्यवसायी दिनेश त्रिपाठी, डेकेन्द्र सुवेदी, अनन्तराज लुइँटेललगायतका बहस गरेका थिए। इजसालले आउँदो असार १५ मा साक्षी बकपत्रका लागि समय तोकेको छ।"
रास्वपा सांसद सुमनाको प्रस्ताव निजी विद्यालयलाई १५ वर्षपछि गैरनाफामूलक बनाऔं,"काठमाडौं : राष्ट्रिय स्वतन्त्र पार्टी (रास्वपा)की सांसद एवं पूर्व शिक्षामन्त्री सुमना श्रेष्ठले निजी विद्यालयलाई १५ वर्षपछि गैरनाफामूलक संस्था बनाउनुपर्ने प्रस्ताव गरेकी छन्। प्रतिनिधिसभाअन्तर्गत शिक्षा, स्वास्थ्य तथा सूचना प्रविधि समितिको बैठकमा विद्यालय शिक्षा विधेयक उपसमितिको प्रतिवेदनमाथि छलफल गर्दै उनले निजी विद्यालयलाई १५ वर्षपछि गैरनाफामूलक र लोककल्याणकारीमा परिणत गर्नुपर्ने बताइन्। 'यो ऐन प्रारम्भ भएको मितिले १५ वर्षपछि नेपाल राज्यभित्र सञ्चालित निजी लगानीका विद्यालय क्रमशः गैरनाफामूलक र लोककल्याणकारी सेवामूलक विद्यालयको रूपमा रहनेछन् भनेर लेख्नुपर्छ,' उनले भनिन्। उनले १५ वर्ष विद्यार्थीको हित र बैंक ऋणका हिसाबले पनि ठीक रहेको बताइन्। शिक्षा र स्वास्थ्य क्षेत्रलाई गैरनाफामूलक बनाउन संविधानको स्प्रिट नै रहेको जानकारी गराउँदै उनले उक्त विषय विधेयकमा समेट्न माग गरिन्। 'शिक्षा क्षेत्रलाई गैरनाफामूलक बनाउनुपर्छ। संविधानले पनि शिक्षालाई गैरनाफामूलक बनाउनुपर्छ भन्छ। संविधानलाई मान्ने हो भने स्वास्थ्य र शिक्षामा नाफा कमाउन पाइँदैन। कि संविधान परिवर्तन गरौं,' उनले भनिन्। उनले आफ्नो प्रस्ताव राष्ट्रियकरण नभई गैरनाफामूलक रहेको प्रस्ट पारेकी थिइन्। 'मैले यसलाई राष्ट्रियकरण बनाउँ भनेको होइन। गैरनाफामूलक र लोककल्याणकारी बनाउ भनेको हुँ,' उनले भनिन्। उनले निजी शिक्षा क्षेत्र धेरै शक्तिशाली रहेको र यसअघि महत्त्वपूर्ण धेरै प्रतिवेदनहरू गायब बनाएको आरोपसमेत लगाएकी थिइन्।"
रुपन्देही ३ मा मोर्चाका तर्फबाट नागरिक उन्मुक्ति पार्टीको दाबेदारी,"काठमाडौं : संघीय लोकतान्त्रिक मोर्चाको तर्फबाट रुपन्देही क्षेत्र नं ३ मा नागरिक उन्मुक्ति पार्टी (नाउपा)ले दाबेदारी प्रस्तुत गरेको छ। नागरिक उन्मुक्ति पार्टीका संरक्षक रेशम चौधरीले बोलाएको मोर्चाको बैठकमा भएको उपनिर्वाचनसम्बन्धी एजेन्डामा नाउपाले दाबी प्रस्तुत गरेको हो। राप्रपाका सांसद दीपक बोहोराको निधन भएपछि उक्त क्षेत्र रिक्त रहेको छ। निर्वाचन आयोगले उक्त क्षेत्रमा उपनिर्वाचन गराउने तयारी गरिरहेका बेला मोर्चाले पनि साझा उम्मेदवार बनाउने विषयमा बिहीबार छलफल गरेको हो। पछिल्लो निर्वाचनको मतपरिणाम अनुसार मोर्चामा आबद्ध दलहरूमध्ये नाउपाले धेरै मत ल्याएको भन्दै संरक्षक चौधरीले दाबी प्रस्तुत गरेको बताए। 'रुपन्देही क्षेत्र नं ३ को उपनिर्वाचनमा साझा उम्मेदवार बनाउने विषयमा मोर्चा छलफल अगाडि बढाएको छ। गत संसदीय निर्वाचनमा उक्त क्षेत्रमा हाम्रो पार्टीले धेरै मत ल्याएको छ। स्वतः त्यस क्षेत्रमा हाम्रो दाबी रहन्छ,' संरक्षक चौधरीले अन्नपूर्णसँग भने। मोर्चामा आबद्ध दलहरूमध्ये उक्त क्षेत्रमा नाउपाले धेरै मत ल्याएको थियो। समानुपातिकतर्फ नाउपाले ६ हजार १०, जसपा नेपालले ५ हजार २९१, लोसपाले ५ हजार ५३ र जनमतले ३ हजार ७३२ मत ल्याएका थिए। प्रत्यक्षतर्फ पनि नाउपाले चौथो नम्बरमा रहेको थियो। सोही आधारमा उक्त क्षेत्रको दाबी प्रस्तुत गरेको नाउपाले जनाएको छ। सो विषयमा टुंगो भने लागेको छैन। 'आज प्रस्तुत भएका एजेन्डामाथि पार्टीमा छलफल गरेर फेरि आइतबार बस्ने कुरा छ,' संरक्षक चौधरीले भने। बैठकमा उपनिर्वाचनसहित मोर्चाको भावी कार्यक्रम, कार्यविधिको पूर्णता, राजबन्दी रिहाइ, लाल आयोगको प्रतिवेदनलगायत विषयमा छलफल भएको थियो। बैठकमा मोर्चामा आबद्ध दलहरूका शीर्ष नेताहरू सहभागी थिए। बैठकमा जसपा नेपालका उपेन्द्र यादव, राजकिशोर यादव, मनिष सुमन, राम कुमार शर्मा, नागरिक उन्मुक्तिका रेशमलाल चौधरी, लालबीर चौधरी, अरुण चौधरी, लोसपाका महन्थ ठाकुर, सर्वेन्द्रनाथ शुक्ला, लक्ष्मणलाल कर्ण, ज्ञानेन्द्र झा, जनमतका अब्दुल खान, राष्ट्रिय मुक्ति पार्टीका राजेन्द्र महतो, केशव झा, सीएन थारू, जनता प्रगतिशील पार्टीका हृदयेश त्रिपाठी, शिवजी यादव, सबिर हुसेन र तमलोपाका वृषेशचन्द्र लाल, ब्रज किशोर सिंह सहभागी थिए।"
डोटी पूर्णखोप सुनिश्चितता तथा दिगोपना जिल्ला घोषणा,डोटी : डोटी जिल्लालाई पूर्णखोप सुनिश्चितता तथा दिगोपना जिल्ला घोषणा गरिएको छ। डोटी जिल्लालाई बिहीबार पूर्ण खोप सुनिश्चितता तथा दिगोपना जिल्ला घोषणा गरिएको हो। सुदूरपश्चिम प्रदेशको पहिलो जिल्लाका रुपमा डोटीलाई पूर्णखोप सुनिश्चितता तथा दिगोपना घोषणा गरिएको छ। पूर्ण खोप समन्वय समितिका संयोजक एवं जिल्ला समन्वय समितिका प्रमुख लक्ष्मण बहादुर सिंहले सिलगढीमा आयोजित एक समारोहका बीच पूर्णखोप सुनिश्चिता तथा दिगोपना जिल्ला घोषणा गरेका हुन्। खोप लगाउने उमेर समूहका सबै बालबालिकाले खोप लगाएको सुनिश्चित भएपछि जिल्लाका नौवटै पालिकालाई यसअघिनै पूर्णखोप सुनिश्चितता तथा दिगोपना घोषणा गरिएको स्वास्थ्य कार्यालय डोटीका प्रमुख रमेश मलासीले बताए। जिल्लाका नियमित खोप लगाउने जन्मेदेखि १५ महिनासम्मका ३ हजार ४ सय ५३ बालबालिकाहरुलाई पूर्ण रूपमा नियमित खोप लगाए पछि जिल्लालाई पूर्णखोप सुनिश्चित तथा दिगोपना घोषणा गरिएको मलासीले बताए। जिल्लामा १६ देखि ५९ महिनासम्मका बालबालिकाको संख्या १० हजार ४ सय १५ जना रहेको छ। त्यसमध्ये खोपको शून्य डोज लगाउन छुटेका ६ जना र आंशिक खोप लगाउन छुटेका एक सय १२ जना बालबालिकाहरुको खोजि गरेर खोप लगाइएको स्वाथ्य कार्यालय डोटीका खोप संयोजक डिल्लीरमण जोशीले बताए। डोटी जिल्लालाई पहिलो पटक २०७५ जेठ १९ गतेका दिन पूर्णखोप सुनिश्चितता तथा दिगोपना जिल्ला घोषणा गरिएको थियो।
सासू आमाको हत्या गरी फरार भएका अभियुक्त २१ वर्षपछि पक्राउ,तानसेन : सासू आमाको हत्या गरी फरार भएका एक अभियुक्त २१ वर्षपछि पक्राउ परेका छन्। जिल्ला प्रहरी कार्यालय पाल्पाले पूर्वखोला गाउँपालिका१ गुनडाँडाका ६६ वर्षीय पूर्णबहादुर सार्कीलाई पक्राउ गरेको हो। सार्कीले २०६१ असार १९ गते सोही ठाउँकी ५५ वर्षीया चिनिसरा सार्कीको हत्या गरी फरार भएको प्रहरीले जनाएको छ। प्रहरीका अनुसार अदालतले पनि दोषी ठहर गरेका पूर्णबहादुर भारतमा लुकीछिपी बस्दै आएका थिए। उनीमाथि थप अनुसन्धान कार्य अगाडि बढाएको जिल्ला प्रहरी कार्यालय पाल्पाका प्रमुख प्रहरी उपरीक्षक पवन कुमार भट्टराईले बताए।
रानीमहललाई पुरानै अवस्थामा संरक्षण गरिने,"काठमाडौं : पाल्पाको रानीमहललाई पुरानै अवस्थामा फर्काइ संरक्षण गरिने भएको छ। उपप्रधानमन्त्री एवं अर्थमन्त्री, राष्ट्रिय योजना आयोगका उपाध्यक्ष, पाल्पा जिल्लाका जनप्रतिनिधि, पुरातत्व विभागका महानिर्देशक, पाल्पा जिल्लाका प्रमुख जिल्ला अधिकारी, इन्जिनियर लगायतको बैठकले खड्ग शम्शेरले निर्माण गरेको रानीमहलको स्वरूपमा ल्याएर संरक्षण गर्ने र त्यसका लागि गुरुयोजना बनाएर काम अघि बढाउने निर्णय गरेको हो। उपप्रधानमन्त्री एवं अर्थमन्त्री विष्णुप्रसाद पौडेलले रानीमहल दुर्लभ मध्येको एउटा महत्वपूर्ण ठाउँ रहेको उल्लेख गर्दै पुरानो शैली र आकारसँग सम्बन्धित सामग्रीहरू संकलन गरी अध्ययन गर्न, गुरुयोजना बनाउन र सोही अनुसार कार्यान्वयन विधि तयार पार्न पुरातत्व विभागलाई निर्देशन दिए। उनले ऐतिहासिक र पुरातात्त्विक महत्वलाई विशेष ध्यान दिएर नदी तथा पहिरो व्यवस्थापन र निर्माणका अरू कार्यलाई अघि बढाउन जोड दिए। राष्ट्रिय योजना आयोगका उपाध्यक्ष प्राडा शिवराज अधिकारीले दीर्घकालीन व्यवस्थित योजनाका साथ रानीमहल र त्यस वरपरका क्षेत्रलाई संरक्षण गर्नुपर्ने बताए। प्रतिनिधिसभाका सांसद ठाकुर गैरेले कालीगण्डकी नदीले रानीमहलको जग कटान गर्नबाट जोगाउन विशेष ध्यान दिनुपर्ने बताए। सांसद नारायण आचार्यले रानीमहललाई व्यवस्थित गर्न संघ, प्रदेश र स्थानीय तहबीच समन्वय गर्न जरुरी रहेको धारणा व्यक्त गरे।"
