शीर्षक,विवरण
"टुसा उम्रेको आलु ,प्याज र लसुन स्वास्थ्यका लागि फाइदा कि वेफाइदा ?","काठमाडौं : अंकुरित तरकारी स्वास्थ्यका लागि लाभदायक मानिन्छ। अंकुरित तरकारी खान चिकित्सकहरूले पनि बिरामीलाई सुझाब दिने गर्छन्। यसले पाचन प्रणाली कमजोर भएका व्यक्तिका लागि संजीवनीको काम गर्दछ। यसको नियमित सेवनबाट शरीरलाई चाहिने सबै प्रकारका पोषणतत्वहरू पूर्ति गर्न सकिने चिकित्सकहरू बताउँछन्त। तर, अंकुरित आलु,प्याज र लसुन भने खान नहुने स्वास्थ्य विज्ञहरू बताउँछन्। आलु टुसाउँदा धेरै मात्रामा ग्लाइकोअल्कलोइड्स भन्ने यौगिक उत्पादन हुन थाल्छ । यो प्राकृतिक विषय हो र यसले बिरुवालाई ढुसी र किराबाट बचाउँछ।तीमध्ये एकलाई सोलनिन भनिन्छ र त्यो आलु,गोलभेडा,भ्यान्टा र खुर्सानीमा पाइन्छ। यो मानिस र जनावरका लागि खतरापूर्ण हुन्छ। टुसाएको आलुको सबैभन्दा खतरा भनेको यसमा उत्पादन हुने ग्लाइकोअल्कलोइड हो। जसका कारण आलुको स्वाद धेरै तीतो बन्न जान्छ। यस्तो आलु खाँदा पखाला,बान्ता र पेट दुखाइ हुनसक्छ। पोटेटोज पोस्टहार्वेस्टका लेखक तथा लिंकन विश्वविद्यालयका पोस्टहार्वेस्ट प्रविधिक पाठक डाक्रिस विशपलेअंकुरित आलुमा सबैभन्दा खतरा ग्लाइकोअल्कालोइड हुने र यसले आलुलाई तितो र बान्ता गराउन सक्ने बताएका छन्। उनले बीबीसीलाई बताएअनुसार आलुको हरियो रंग हेरेर यसको उपस्थिति पत्ता लगाउन सकिने बताएका छन्। आलुमा हरियो रङ्गको भयो भने यसमा प्राकृतिक रसायन रहेको मानिन्छ। जो मानव शरीरका लागि घातक हुन्छ। हरियो नभएको आलुमा सोलनिनको तह कम हुन्छ। अंकुर हटाएपछि यदि आलु अझै गलेको छैन,कुहिने कुनै संकेत छैन भने त्यसलाई सुरक्षित रुपमा उपभोग गर्न सकिन्छ। तर, आलुमा हरियो रङ्ग विकसित भएको छ भने नखाँदा नै राम्रो हुन्छ। आलुभन्दा फरक टुसाएको प्याज र लसुन सामान्यत: खान सुरक्षित हुन्छन्। किनभने त्यसमा विषाक्तको जोखिम आलुजस्तो हुँदैन। विज्ञहरू प्याज र लसुनलाई चिसो,अँध्यारो,सुख्खा ठाउँमा भण्डारण गर्न सुझाव दिन्छन्। आलुलाई कसरी भण्डारण गर्ने ?  आलुलाई सुख्खा र अँध्यारो ठाउँमा भण्डारण गर्नुपर्छ। आलु भण्डारण गर्नुअघि धुनु हुँदैन किनभने यसले कुहिने समस्या बढाउँछ। आलुलाई प्याजबाट टाढा राख्नुपर्छ। दुवैले ग्यास र आर्द्रता उत्सर्जन गर्छन्,जसले अंकुरणलाई गति दिन्छ। एजेन्सीको सहयोगबाट"
विपद् जोखिम न्यूनीकरणका लागि पूर्वतयारी गर्न सरकारलाई संसदीय समितिको निर्देशन,"काठमाडौं : प्रतिनिधिसभा अन्तर्गतको कृषि, सहकारी तथा प्राकृतिक स्रोत समितिले बाढीपहिरो डुबानलगायत मौसमजन्य उच्च जोखिममा रहेका क्षेत्रहरू पहिचान गरी विपद् जोखिम न्यूनीकरणका लागि पूर्वतयारी गर्न सरकारलाई निर्देशन दिएको छ। सिंहदरबारमा बिहीबार बसेको समिति बैठकले प्राकृतिक प्रकोपबाट उच्च जोखिममा रहेका क्षेत्रहरू पहिचान गरी पूर्व सूचना प्रणाली सुदृढीकरण गराई विपद् जोखिम न्यूनीकरणका लागि पूर्वतयारी गर्न सरकारलाई निर्देशन दिएको हो। स्थानीय र प्रदेश तहमा सहकार्य गरेर प्रभावकारी कार्ययोजना निर्माण गरी प्राकृतिक प्रकोपबाट हुन सक्ने क्षतिको न्यूनीकरण गर्न गृह, रक्षा, भूमि व्यवस्था सहकारी तथा गरिबी निवारण मन्त्रालयलाई निर्देशन दिइएको समिति सभापति कुसुमदेवी थापाले जानकारी दिइन्। प्रभावकारी जोखिम नियन्त्रण न्यूनीकरण तथा उद्धारका कार्यहरु समयमा नै गर्न सक्ने गरी पूर्वतयारी रहन समितिले गृह मन्त्रालयलाई निर्देशन दिएको छ। त्यस्तै विपद् जोखिम न्यूनीकरणका लागि पूर्वतयारी र सूचना प्रणाली सुदृढ गरी समन्वयात्मक रुपमा कार्यसम्पादन गर्न तयार तथा उद्धार कार्यका लागि आवश्यक पर्ने तालिम प्राप्त जनशक्ति डोजर स्काभेटर, बेलिब्रिज जस्ता उपकरणहरूको समयमानै व्यवस्था गर्न समितिले निर्देशन दिएको सभापति थापाले बताइन्। उद्धार तथा राहत वितरण कार्यमा पीडित व्यक्ति प्रत्यक्ष लाभान्वित हुने गरी कडाइका साथ कार्यसम्पादन गर्ने व्यवस्था अवलम्बन गर्न गृह मन्त्रालय निर्देशन दिएको उनले जानकारी दिइन्। बैठकमा गृहमन्त्री रमेश लेखकले विपद्को पूर्वतयारी र प्रतिकार्यका लागि सरकार तयारी अवस्थामा रहेको जानकारी दिए। उनले प्रतिकार्यलाई प्रभावकारी बनाउन सबै प्रदेशलाई गोदाम घर हस्तान्तरण गरिसकेको उल्लेख गर्दै स्थानीय तहसँग पनि आवश्यक समन्वय भइरहेको धारणा राखे। बैठकमा समिति सदस्यहरूले मनसुनजन्य विपद्बाट जनधनको सुरक्षा तथा क्षति न्यूनीकरणका लागि सरकारले हरेक वर्ष तयारी गरेपनि क्षति भने बढ्दै गएको प्रति चिन्ता व्यक्त गरेका थिए। बैठकले मनसुनको अवस्थाबारे जानकारी दिन हाल प्रयोग गर्दै आएको एसएमएस प्रणालीलाई भरपर्दो र प्रभावकारी बनाउन समेत सरकारलाई निर्देशन दिएको छ।"
"नेप्सेको ओरालो यात्रा कायमै, ७ अर्बको कारोबार गरेर सेयर बजार बन्द","काठमाडौं : साताको अन्तिम सेयर कारोबार दिन नेप्से परिसूचक एकल अंकले घटेर बन्द भएको छ। नेप्से परिसूचक ४४५ अंकले घटेर २५९५७४ विन्दुमा झरेको छ। अघिल्लो दिन बुधबार नेप्से परिसूचक ०३३ अंकले घटेर २६००२० विन्दुमा अडिएको थियो। त्यसअघि मंगलबार परिसूचक ०२२ अंकले घटेर २६००५३ विन्दुमा पुगेको थियो। साताको पहिलो कारोबार दिन आइतबार नेप्से परिसूचक ३२९३ अंकले घटेको थियो। सोमबार भने ४७८ अंकले बढेको थियो। यसदिन कारोबार रकम भने बुधबारको तुलनामा वृद्धि भएको छ यसदिन ३०६ स्क्रिप्सको १ करोड ९६ लाख ५० हजार २१० कित्ता सेयर ७ अर्ब ७८ करोड २ लाख ४२ हजार २४३ रुपैयाँमा खरिदबिक्री भए। बुधबार ५ अर्ब ९४ करोड मूल्य बराबरको सेयर कारोबार भएको थियो। यसदिन कुनै पनि कम्पनीको सेयर सकारात्मक सर्किट लेभलमा कारोबार भएन। ग्रीन डेभलपमेन्ट बैंकको सेयर सर्वाधिक ९१८ प्रतिशतले बढ्यो। सप्तकोशी डेभलपमेन्टको ९ प्रतिशतले बढ्दा बरुण हाइड्रोपावरको ८९३ र पिपुल्स हाइड्रोपावरको सेयर ७१४ प्रतिशतले बढ्यो। रिलायबल समृद्धि योजनाका लगानीकर्ताले भने यसदिन सर्वाधिक गुमाए। सो कम्पनीको सेयर ९३० प्रतिशतले घट्यो। ६२ करोड मूल्य बराबरको सेयर कारोबार गरी बुटवल पावर शीर्षस्थानमा रह्यो। यसैगरी राधी विद्युतको ३९ करोड मूल्यको सेयर कारोबार हुँदा नगदी ग्रुपको ३२ करोड,सिंगटी हाइड्रोपावरको ३१ करोड र बरुण हाइड्रोपावरको २८ करोड मूल्य बराबरको सेयर कारोबार भयो। कारोबारमा आएकामध्ये ९३ स्टक्सको मूल्य बढ्दा १५५ वटाको घट्यो। चार समूहको उपसूचकबाहेक अन्यको उपसूचक नकारात्मक देखिएका छन्। डेभलपमेन्ट बैंक,हाइड्रोपावर,माइक्रोफाइनान्स र म्युचुल फण्डको उपसूचक बढ्दा अन्यको घटेको हो।"
बेलकोटगढीको बजेट बढ्यो,"नुवाकोट : बेलकोटगढी नगरपालिकासहित अधिकांश स्थानीय तहले मंगलबार बजेट सार्वजनिक गरेका छन् । अधिकांशले शिक्षा, स्वास्थ्य, कृषि, आधुनिक उपकरण, पर्यटन, धार्मिक तथा ऐतिहासिक स्थलको संरक्षण र संवर्धनको निर्णय गरेका छन् । नुवाकोटको आठ वर्ष पुरानो बेलकोटगढी नपाको दोस्रो नगरसभामा मेयर जगतबहादुर गुरुङद्वारा प्रस्तुत वार्षिक नीति तथा कार्यक्रम र उपमेयर शिवप्रसाद दाहालद्वारा प्रस्तुत वार्षिक बजेट पारित गर्दै मंगलबार बाघखोरमा सम्पन्न भएको छ । दोस्रो नगर बजेट अधिवेशनबाट आगामी आव २०८२०८३ को नीति, कार्यक्रम तथा विनियोजन विधेयकसहितको नगरसभा सहमतिको साथ सम्पन्न भएको छ । सो नपाको बजेट सभाले आगामी आवको कुल ९७ करोड ६३ लाख १५ हजार २ सय ९८ रुपैयाँको बजेट पारित गरेको छ । सो बजेट गत वर्षको भन्दा ५ करोड रुपैयाँको धेरै हो । बजेटमा कृषि, पर्यटन र पूर्वाधार विकासमा विशेष जोड दिइएको छ । विशेष रूपमा चिम्टेश्वर क्षेत्रको धार्मिक तथा पर्यटकीय सम्भावनालाई दृष्टिगत गर्दै चिम्टेश्वर विकास ऐन ल्याउने र चिम्टेश्वर विकास समितिलाई वैधानिकता दिने व्यवस्था गरिएको छ । स्वास्थ्य सेवा विस्तारको उद्देश्यले वडा नं ८ र १२ मा प्रसूति सेवासहितको बर्थिङ सेन्टर स्थापना, बालमैत्री विद्यालय कार्यक्रम, किसानमैत्री कृषि कार्यक्रम र एसबीबीएस चिकित्सक सेवा विस्तारजस्ता कार्यक्रमलाई प्राथमिकतामा राखिएको छ । सभाले उत्कृष्ट विद्यालय, उत्कृष्ट विद्यार्थी र उत्कृष्ट खेलाडीहरूलाई सम्मानसहित पुरस्कार प्रदान गरिएको मेयर जगतबहादुर गुरुङको भनाइ छ । सो नपामा बालमैत्री विद्यालय घोषणाको तयारी, कृषि, स्वास्थ्य, शिक्षालाई प्राथमिकता दिइएको उनको भनाइ छ । नगरसभामा बेलकोटगढीका उपमेयर शिवप्रसाद दाहाल, निमित्त प्रमुख प्रशासकीय अधिकृत दीपक थिङ, वडाध्यक्षहरू, कार्यपालिका सदस्यहरू, सदस्यहरू, विभिन्न शाखा प्रमुख तथा कर्मचारीहरू, विभिन्न राजनीतिक दलका प्रमुख तथा प्रतिनिधिलगायतले स्थानीय माग र आवश्यकता अनुसारका योजना सञ्चालन गर्नुपर्नेमा जोड दिए । अधिवेशनले स्थानीय स्रोत र साधनको संरक्षण र संवद्र्धन गर्नेसमेत जनाएको छ । यससँगै नुवाकोटको तारकेश्वर, तादी, दुप्चेश्वर, म्यागङ, सूर्यगढी, शिवपुरी, लिखु, किस्पाङसहित अधिकांश स्थानीय तहले आगामी आवका लागि बजेट पारित गरेका छन् । अधिकांशले स्थानीय क्षेत्रको विकास, प्रवद्र्धन, खेल, धार्मिक तथा पर्यटनमा जोड दिएका छन् ।"
इरानबाट २७२ भारतीयसँगै तीन नेपाली आइपुगे दिल्ली,काठमाडौं : इरानबाट तीन नेपाली नागरिक दिल्ली आइपुगेका छन्। बिहीबार २७२ भारतीय र तीन नेपाली नागरिक इरानबाट दिल्ली आइपुगेका हुन्। भारतीय विदेश मन्त्रालयका प्रवक्ता रणधीर जयसवालले सामाजिक सञ्जाल एक्समा अपरेशन सिन्धुअन्तर्गत अहिलेसम्म ३४२६ भारतीयलाई इरानबाट बाहिर निकालिएको बताए। इजरायल र इरानबीचको द्वन्द्वपछि भारत सरकारले अपरेशन सिन्धु सुरु गरेको थियो। भारतीय सरकारले नेपाली र श्रीलंकाका नागरिकको पनि इरानबाट उद्धार गरिरहेको छ। नेपाल सरकारले इरानमा रहेका नेपालीहरूलाई भारतीय सरकारको पहलबाट नेपाल ल्याउने नीति लिएको छ। यसअघि नै परराष्ट्रमन्त्री आरजु राणा देउवाले इरानमा रहेका नेपालीलाई भारत सरकारको पहलबाट उद्धार गर्ने बताएकी थिइन्।
