शीर्षक,विवरण
"विवाह भएको ६ महिना नबित्दै महिलाको मृत्यु, दाइजोको निहुँमा हत्या भएको आशंका",रौतहट : कटहरिया नगरपालिकामा विवाह भएको ६ महिना नपुग्दै एक मुस्लिम महिलाको संकास्पद मृत्यु भएको छ । दाइजोको कारण हत्या गरिएको माइती पक्षले दाबी गर्दै घटनाको छानबिन गरी कडा कानुनी कारबाही हुनुपर्ने माग गरेका छन्। कटहरिया वडा नम्बर ३ बड़ेरवा टोलमा घरभइ हाल कटहरिया ५ घर भएका अहमद राय भाटका छोरा अरमान राय भाटको श्रीमती २१ वर्षीया सानीया प्रविनको शंकास्पद मृत्यु भएको हो। आइतबार दिउँसो आफ्नै घरको कोठामा साडीको पासो लगाइ सिलिङ फ्यानमा झुण्डिएको अवस्थामा सानियाको शव भेटिएको प्रहरीले जनाएको छ। घटनाको खबर लगतै इलाका प्रहरी कार्यालय कटहरिया र ईलाका प्रहरी कार्यालय गरुडाको संयुक्त टोलीले घटनास्थलमा पुगेर अनुसन्धान थालेको प्रहरी जनाएको छ । मृतकको पोष्टमार्टमका लागि गौरस्थित प्रादेशिक अस्पताल पठाएको थियो । शव सतगतको लागि मृतक सानियाका आमा भारतको सुगौली घर भएकी कायमा खातुनले बुझेर लगेको प्रहरीले जनाएको छ।मृतककी आमा कायमा खातुनका अनुसार सानीयाको विवाह करिब ६ महिना अघिमात्र अरमान राय भाटसँग मुस्लिम परम्परा अनुसार भएको थियो। विवाहपछि ज्वाइँ अरमानले निरन्तर दाइजोको लागि छोरी सानियालाई शारीरिक तथा मानसिक यातना दिँदै आएका थिए । ज्वाईँ तथा उनको परिवारले दिने गरेको यातना सहन गर्न नसकेकोले उनीहरूले योजनाबद्ध तरिकाले सानियाको हत्यागरी आत्महत्या देखाउन खोजेको कायमाले दाबी गरेकी छन्। घटनामा संलग्न अरमानसहित सबैलाई पक्राउ गरी कडा कानुनी कारवाही हुनुपर्ने सानियाको माइती पक्षको माग छ। माइती पक्षले छोरीको हत्या भएको भन्दै इलाका प्रहरी कार्यालय गरुडामा जाहेरी दर्ता गरेको जानकारी दिएका छ्न् ।इलाका प्रहरी कार्यालय गरुडाका प्रमुख डिएसपी राजन कार्कीले घटनाविरुद्दको जाहेरी हालसम्म दर्ता नभएको तथा घटना शंकास्पद रहेकाले अनुसन्धान अघि बढाएको बताए ।
अर्थतन्त्रको गाडी अब त्रिशूलीमा खस्दैन : प्रधानमन्त्री,"काठमाडौं : प्रधानमन्त्री केपी शर्मा ओलीले सिनेपा नामक अत्याधुनिक इन्डोर छायाँकन स्टुडियो निर्माण आरम्भ हुनु नेपाली चलचित्र क्षेत्रका लागि एक प्रकारको क्रान्ति भएको बताएका छन्। बालुवाटारमा चलचित्र विकास बोर्डद्वारा आयोजित कार्यक्रममा प्रधानमन्त्री ओलीले काभ्रेको बनेपामा निर्माण हुने सो स्टुडियो बन्न नेपाली चलचित्र क्षेत्रले छ दसकदेखि आवाज उठाउनुपरे पनि अब बन्ने प्रक्रिया अघि बढेको बताए। प्रधानमन्त्री ओलीकै पहिलो कार्यकालमा उक्त निर्माणको निर्णय भए पनि जग्गा विवाद र सरकार परिवर्तनलगायत कारणले काम अवरुद्ध भएको थियो। 'त्यसबेला जति अहिले राज्यको ढुकुटीमा पैसा छैन। तैपनि थालेका काम हामी पूरा गर्छौं। यसका लागि बजेट विनियोजना हुन्छ। थालेपछि सफल हुन्छ। यसलाई पनि सफल बनाउनुपर्छ। यो निर्माण आरम्भ उद्घोषले यस क्षेत्रमा युग परिवर्तन सुरु भएको छ,' प्रधानमन्त्री ओलील भने। ओरालो लागेको अर्थतन्त्रलाई आफूले लयमा ल्याएको बताउँदै प्रधानमन्त्री ओलीले अर्थतन्त्रको गाडी अब त्रिशूलीमा नखस्ने बताए। बालाजुस्थित नेपाल चलचित्र विकास कम्पनीको जग्गा हिनामिना भएको भन्ने सम्बन्धमाउनले सञ्चारमन्त्री र सचिवलाई ध्यानाकर्षण गराएका थिए। प्रधानमन्त्री ओलीले हप्ता१० दिनभित्र त्यसको छानबिन गरी प्रतिवेदन दिन निर्देशन दिए। कतिपयले राजनीतिमा पनि अभिनय गर्न थाले पनि आफूहरू राजनीतिलाई यथार्थमा बदल्ने साधनका रूपमा लिएर काम गरिरहेको उनले स्पष्ट पारे।"
अवैध रूपमा काठ तथा अन्य वन पैदावार ओसारपसार गर्ने २६ सवारी साधन नियन्त्रण,"रौतहट : डिभिजन वन कार्यालय रौतहटले चालू आर्थिक वर्ष २०८०८१ मा वन ऐन उल्लंघन गरी अवैध रूपमा काठ तथा अन्य वन पैदावार ओसारपसार गर्ने २६ वटा सवारी साधन नियन्त्रणमा लिएको छ। कार्यालयले सार्वजनिक गरेको तथ्यांक अनुसार ती सवारी साधनहरूबाट साल काठसहितको ठूलो परिमाणको वन पैदावार बरामद गरिएको छ। साउनदेखि हालसम्म नियन्त्रणमा लिइएका सवारीसाधनहरूमा ट्रक, ट्याक्टर, साइकल र मोटरसाइकल रहेका छन् । अवैध ओसारपसारमा संलग्न २६ वटा सवारीसाधनबाट २५ लाख ९६ हजार ६६५ रुपैयाँ बराबरको अवैध सामान नियन्त्रणमा लिइएको कार्यालयको डिभिजन वन अधिकृत हेमन्त प्रसाद साहले बताए। कतिपय घटनामा दोहोरो सवारी प्रयोग (साइकल स्थान १, २, ३ र ४) र काठ लुकाएर तस्करी गरिएको पाइएको छ। यसबाहेक रौतहटको विभिन्न स्थानमा भएका वन अतिक्रमणमाथि पनि नियन्त्रण गरिएको प्रमुख साहले जानकारी दिए । गढीमाई नगरपालिका, फूलबारी, खयरधारी र भुलटार क्षेत्रलगायतका स्थानहरूमा गरी जम्मा १२७४७ हेक्टर वन क्षेत्र अतिक्रमणमा परेको फेला परेको छ। तीमध्ये कतिपय स्थानमा तारबार हटाइ पुनः वन क्षेत्र कायम गरिएको, कतै वृक्षारोपण गरिएको र केही स्थानमा दोषी उपर मुद्दा दायर गरिएको जनाइएको छ।"
"दोलखामा बन्न लागेको फिल्मसिटी बेवारिसे, १४ वर्षमा २५ प्रतिशत काम","दोलखाको : भीमेश्वर नगरपालिका९ डाङडुङे डाँडामा बन्न लागेको फिल्म सिटी अहिले बेवारिसे अवस्थामा छ। सरकारले निर्माण गर्ने स्टुडियोमा सुटिङ कहिलेबाट गर्न सकिने हो थाहा छैन। निर्माणाधीन डाङडुङे डाँडामा फिल्मसिटी निर्माणको सुरुवात २०६८ सालमा नै भएको हो। तर १४ वर्ष बितिसक्दा पनि २५ प्रतिशत काम पनि सम्पन्न भएको छैन। फिल्म सिटी निर्माणका सुरुमा १२१३ अर्ब लगानी लाग्ने र चीन सरकारको सहयोगमा निर्माण कार्य अघि बढाउने भनिएको थियो। पछि सरकारले गरेको विस्तृत अध्ययनमा १ अर्ब ६ करोड ३७ लाख लगानी लाग्ने जनाइएको थियो। फिल्म सिटी आयोजनाको वातावरणीय प्रभाव मूल्यांकन प्रतिवेदनमा आयोजनाका वातावरणीय प्रभाव न्यूनीकरणका लागि वृक्षारोपण, संरक्षण, अनुगमन लगायतका विषयमा आयोजनाको कुल लागतको ३ दशमलव ५२ प्रतिशत खर्च गर्नुपर्ने प्रस्ताव गरिएको थियो। फिल्म सिटीका सम्पूर्ण संरचना निर्माणका लागि ७६२५ हेक्टर जमिन आवश्यक पर्ने प्रतिवेदनमा उल्लेख गरिएको थियो। प्रस्तावित जग्गा मध्ये दोलखाको भीमेश्वर नगरपालिका वडा नम्बर ९ को सेतीदेवीदादर सामुदायिक वनको ६४ हेक्टर र सिन्धुपाल्चोक जिल्लाको १२ हेक्टर जमिनलाई उपयोग गर्ने उल्लेख गरिएको थियो। इन्डोर र आउटडोर सुटिङका लागि यति धेरै जग्गा आवश्यक परे पनि मुख्य संरचना ९६१ हेक्टरमा मात्र निर्माण हुने प्रतिवेदनमा उल्लेख गरिएको छ। २०६८ सालमा चलचित्र उद्योगका लागि छायाकंन गर्ने उपयुक्त ठाउँ नभएको अवस्थामा पहिलो पटक दोलखावासीले आफ्नो जिल्लामा फिल्म सिटी निर्माण गर्नुपर्छ भनेर ३०३५ रोपनी जग्गा उपलब्ध गराएका थिए। बागमती प्रदेशको साँढे ६ करोड बजेटबाट सांस्कृतिक संग्रहालय, प्रशासनिक भवन, गेस्ट हाउसलगायत तीनवटा भवन बनिसकेको छ। पूर्वाधार तयार भइसकेको छ। तर अहिले चासो कम छ। हिमाली जिल्लामा उच्च ठाउँमा फिल्मसिटी बनेको खण्डमा संसारभरीका मानिसको आकर्षण बढ्ने, देशको अर्थतन्त्र विकासमा ठूलो टेवा पुग्ने, चलचित्र उद्योगका लागि चलचित्र निर्माताहरू कही जान नपर्ने, दोलखाको समृद्धि हुने सम्भावना छ। प्रस्तावित फिल्म सिटी डाङ्डुङे डाँडा २ हजार ८ सय मिटरदेखि ३ हजार ४ सय मिटरसम्मको उचाइमा रहेको छ। काठमाडौंबाट १ सय ५ किलोमिटर पूर्व रहेको प्रस्तावित क्षेत्र सार्वजनिक जग्गा हुनु, वातावरणीय कम क्षति भए पनि त्यसको पूर्ति गर्न प्रशस्त ठाउँ रहेको, हावापानी अनुकूल रहेका र स्थानीयको उत्साहका कारण देशकै उत्तम ठाउँ डाङ्डुङे डाँडा नै उपयुक्त हुने सरोकारवालाहरूको भनाइ छ। डाङ्डुङे डाँडामा ५० प्रजातिका जैविक र १४ प्रकारका गुराँस रहेका छन्। ऐतिहासिक, पुरातात्त्विक, प्राकृतिक, धार्मिक सम्पदाले भरिपूर्ण दोलखामा निर्माण गर्न लागिएको फिल्मसिटी निर्माणस्थल डाँङडुङे डाँडाबाट काठमाडौंको स्वयम्भू, फुलचोकी, रोल्वालिङ हिमश्रृंखला, गौरीशंकर, जुगल, गणेश हिमालका साथै सिन्धुपाल्चोक, काभ्रेपलाञ्चोक, सोलुखुम्बु, रामेछाप तथा ओखलढुंगाको ६० प्रतिशत भूभाग दृश्यावलोकन गर्न सकिने स्थानीयको भनाइ छ। फिल्म सिटी निर्माणका लागि नेपाल सरकारले नै पब्लिक पार्टनरसिपमा जाने भनेर नीति बनाएको थियो। कम्पनी ऐनअनुसार सरकार, स्थानीय र बाहिरी लगानीकर्ताले सेयरमा लगानी गर्ने बारे चलचित्र विकास बोर्डले मोडालिटी तयार गरेको थियो। यसलाई अगाडि बढाउनका लागि सञ्चार मन्त्रालय र चलचित्र विकास बोर्ड उदासिन देखिएको फिल्म सिटी निर्माण समितिका संयोजक मदनदास श्रेष्ठले बताए। अन्तर्राष्ट्रिस्तरको फिल्म सिटी निर्माणका लागि चलचित्र विकास बोर्डले परामर्शदाताको रुपमा इको इन्भोयमार्फत यसको अध्ययन गरेको थियो। त्यत्रो लगानी गरिसकेको दोलखाको डाङडुङे डाँडामा फिल्म सिटी निर्माणका लागि बनेको भौतिक संरचना यतिकै खेर जाने पो हो कि भनेर मन कुडिन लागेको निर्माण समितिका संयोजक मदनदास श्रेष्ठले बताए। निर्माण कार्यले निरन्तरता नपाउनु दोलखालीका लागि दुर्भाग्य हो। अब दोलखालीहरूले चासो राख्नुपर्ने बेला आएको छ। दोलखालीहरूले खबरदारी गर्नुपर्ने बेला आएको छ। दोलखामा फिल्म सिटी बन्नु दोलखाको मात्र विकास नभएर समग्र देशको गौरवको आयोजना हो। यसरी देशकै उन्नती गर्न सक्ने आयोजनाहरू धरापमा पर्नु अत्यन्तै दुःखद कुरा हो, उनले भने। चलचित्र विकास बोर्डको बेवास्ता र सरकारको गैरजिम्मेवारीले निर्माणाधीन फिल्म सिटी बेवारिसे बनेको उनको भनाइ छ। पछिल्लो समय सरकार नै दोलखाको डाङडुङे डाँडामा फिल्म सिटी नबनाउने पक्षमा रहेको श्रेष्ठको धारणा छ। चलचित्र नगरी स्थापना गर्नका लागि तयार भएको जग्गा स्थानीय तहलाई जिम्मा दिएमा दोलखाली जनता आफैंले बनाउन सक्ने आँट भएको श्रेष्ठले बताए। सरकारले खोचे थापेर कहिले कता बनाउने कहिले कता बनाउने भनेर सुरु भएको कार्यलाई बेवास्ता गरेर अपमान गरेको छ। १६ अर्ब लगानी कहाँबाट खोज्ने जस्तो खोचे थाप्ने काम जुन भएको छ यो दोलखालीका लागि सह्य हुने छैन, उनले भने। अन्तर्राष्ट्रिय लगानी सम्मेलनमा सोकेसमा राखेको फिल्म सिटी मोरिसस र चीनले बनाउने प्रतिबद्धता जनाएका थिए। अहिले काभ्रेमा फिल्म सिटी बनाउने भनेर सरकारले जुन योजना बनाइरहेको छ। यसलाई हामी नराम्रो भन्दैनौ। नेपालभरी नै फिल्म सिटी बनोस्। विकासले गति लियोस् तर लगानी भइसकेको पूर्वाधारलाई बेवारिस नबनाओस्, उनले भने।"
सगरमाथा संवादले जलवायुजन्य संकट समाधानको निष्कर्ष निकाल्नेछ : ठाकुर गैरे,"काठमाडौं : सांसद ठाकुरप्रसाद गैरेले जलवायुजन्य सङ्कटले सताइरहेको बेलामा जलवायु न्यायका लागि सगरमाथा संवाद आयोजना हुनु सुखद पक्ष रहेको बताएका छन्। प्रतिनिधिसभा बैठकमा उनले जलवायु परिवर्तनको कारण बाढी पहिरोको जोखिम तथा अन्य प्राकृतिक विपद्का घटना बढिरहेकाले जलवायु न्याय स्थापित गर्न ढिलाइ गर्न नहुने बताए । ' संवादले सही निष्कर्ष निकाल्नेछ। तिनको कार्यान्वयन हुनेछ। सबैलाई कार्यान्वयन गर्ने विषयमा सबै देशहरू प्रतिवद्ध हुनेछन्,'उनले भने,'संवादले जलवायुजन्य सङ्कट समाधानको निष्कर्ष निकाल्नेछ।' जलवायु परिवर्तन,पर्वत र मानवताको भविष्य विषयमा पहिलो सगरमाथा संवाद आगामी जेठ २ देखि ४ गतेसम्म काठमाडौँमा हुँदैछ । संवादमा झण्डै ४० देशका १५० बढी विदेशी पाहुनाको सहभागिता हुने तय भएको परराष्ट्र मन्त्रालयले जनाएको छ । जसमा १२ देशबाट उच्च तहबाट प्रतिनिधिमण्डलहरू सहभागी हुनेछन्। संवाद आयोजनाका लागि प्रधानमन्त्री ओलीको संयोजकत्वमा उच्चस्तरीय निर्देशक समिति, परराष्ट्रमन्त्री डाआरजु राणाको संयोजकत्व र वन तथा वातावरणमन्त्री ऐनबहादुर शाही ठकुरीको सहसंयोजकत्वमा व्यवस्थापन समिति गठन गरिएको छ । प्रधानमन्त्री तथा मन्त्रिपरिषद्को कार्यालयका सचिव राजकुमार श्रेष्ठको संयोजकत्वमा सचिवालय,परराष्ट्र मन्त्रालयका सहसचिव लोकबहादुर पौडेल क्षेत्रीको संयोजकत्वमा प्रचारप्रसार समिति गठन गरिएको छ ।"
