शीर्षक,विवरण
नेकपा अब दुई टुक्रा,"गौतम र थापा अलमलमै छिनछिनमै आफ्नो निर्णय परिवर्तन गरिरहने नेकपा उपाध्यक्ष वामदेव गौतम र पटक्कै नबोलेर पार्टीको निर्णय प्रक्रियालाई अप्ठ्यारोमा पारिरहेका सचिवालय सदस्य रामबहादुर थापाले भने अझै आफ्नो लाइन पक्डेका छैनन् । प्रतिनिधिसभा भंग गर्ने प्रधानमन्त्री ओलीको असंवैधानिक कदमको विरोध गर्दै दाहालनेपाल समूहका सात मन्त्रीहरूले आइतबार राजीनामा दिँदा गृहमन्त्रीसमेत रहेका थापाले राजीनामा दिएनन् । बरु उनी बालुवाटारमै चलिरहेको स्थायी कमिटी बैठकलाई अनदेखा गर्दै प्रधानमन्त्रीले आयोजना गरेको निर्वाचन आयोगका पदाधिकारी र सुरक्षा निकायका प्रमुखहरूसँगको छुट्टाछुट्टै छलफलमा सहभागी भए ।उपाध्यक्ष गौतमले संसद् विघटन गर्ने ओलीको कदमलाई प्रतिगामी त भने तर स्थायी कमिटी बैठकमा गएनन् । सोमबार एक वक्तव्य जारी गर्दै उनले पार्टी फुटको घोषणा हुने कुनै पनि भेलामा आफू नजाने स्पष्ट पारे । अब फुटको घोषणा गर्नमात्रै बाँकी रहेको बैठक र भेलामा भाग नलिने निर्णय मैले गरें । म पार्टी एकताको पक्षमा छु, त्यसका निम्ति अर्को निर्णय नहुँदासम्म म पार्टी एकीकरण बचाउन सकिन्छ कि भन्ने प्रयासमै रहनेछु, गौतमले भने, कमरेड केपी ओलीले गरेको होस् या अरू कमरेडले गरेको नै किन नहोस्, ती सबै भेला पार्टी फुटाउनका निम्ति भइरहेका छन् । म फुटको साक्षी बस्न सक्दिनँ । यता ओली क्याम्पमा जान ठिक्क परेका थापालाई भने उनी निकटका केन्द्रीय कमिटी सदस्यहरूले रोकेका छन् । नेकपामा थापा पक्षका ३४ जना केन्द्रीय सदस्य छन् । तीमध्ये १६ जना केन्द्रीय सदस्यले सोमबार बिहान थापाकै निवासमा पुगेर तुरुन्तै राजीनामा दिन आग्रह गरेका थिए । केन्द्रीय सदस्यहरू मायाप्रसाद शर्मा र अमृता थापा मगरले जनयुद्ध, दाहालसँगको पार्टी विभाजन र एकीकरणसम्मका कुरा सुनाएर आँसु नै झारेपछि थापा भावुक बनेका थिए । त्यसपछि उनले पार्टी एकतायताका तीन वर्षमा ओली र दाहालले आफूलाई गरेको व्यवहारको फेहरिस्त नेताहरूलाई सुनाउँदै ओलीले संसद् विघटनको प्रस्ताव गर्नु प्रतिगामी निर्णय हो भनेका थिए । थापानिकट नेताहरूले अध्यक्षद्वयबीच पहिले शक्ति बाँडफाँटको लडाइँ भए पनि अहिलेको परिस्थिति सैद्धान्तिक मतभेदमै पुगेकाले प्रतिगमनलाई साथ दिएर अघि बढ्न नसकिने बताए ।थापाले दुवै अध्यक्षहरूसँग परामर्श गरेर आफू एउटा निर्णयमा पुग्ने जानकारी दिएको उनका राजनीतिक सल्लाहकारसमेत रहेका केन्द्रीय सदस्य सूर्य सुवेदीले बताए । तपाईंहरूले आफ्नो पोजिसन क्लियर गर्नुभएकै छ, म एक पटक दुवै अध्यक्षसँग कुराकानी गर्छु र तपाईंहरूलाई भनौंला, थापाले भनेका थिए, तर ढुक्क हुनुस्, म तपाईंहरूलाई निराश बनाउँदिनँ । केन्द्रीय सदस्यहरूसँगको छलफलपछि थापाले स्थायी कमिटी सदस्यहरू पम्फा भुसाल र देव गुरुङसँग आफूलाई अध्यक्ष दाहालले केही पनि नभनेको गुनासो गरेका थिए । थापाको यही गुनासो भुसालले दाहाललाई सुनाएपछि दाहाल मन्त्री क्वार्टर पुल्चोकमा पुगेर करिब १० मिनेट भलाकुसारी गरे । गृहमन्त्री थापाले साँझ प्रधानमन्त्रीसँग पनि परामर्श गरेका छन् तर उनले नेकपा विभाजनको अन्तिम घडीमा आइपुगुन्जेल कुन मार्ग लिएका हुन् स्पष्ट भइसकेको छैन ।"
कानुनविद् भन्छन् संसद् जीवितै छ,"कानुनविद्हरूले प्रधानमन्त्रीराष्ट्रपतिको कदमले प्रतिनिधिसभा विघटन हुन नसक्ने बताएका छन् । भंग गर्ने व्यवस्था संविधानमा नभएकाले त्यो जीवितै रहेको र सभामुखले अधिवेशन बोलाउन सक्ने उनीहरूको तर्क छ । संविधानमै नभएको व्यवस्था प्रधानमन्त्री र राष्ट्रपतिले भन्दैमा लागू हुँदैन, त्यसैले प्रतिनिधिसभा विघटन भएको छैन, वरिष्ठ अधिवक्ता शम्भु थापाले भने, जीवितै भएको संसद्को बैठक बोलाउने जिम्मेवारी सभामुखको हो, उहाँले त्यसो गर्न सक्नुहुन्छ । पुष्पकमल दाहालमाधवकुमार नेपाल समूहले सोमबार दिउँसो बानेश्वरमा गरेको कानुनी परामर्शमा पनि आफूले यही सुझाव दिएको थापाले बताए । उनका अनुसार अदालतमा रिट दायर गर्ने र संसद् पनि सञ्चालन गरी काम अघि बढाउने दुई उपाय सँगसँगै अवलम्बन गर्न सकिने सुविधा दलहरूसँग छ । अर्का कानुनविद् ओमप्रकाश अर्यालले पनि संविधानतः संसद् जीवितै रहेकाले यसको नियमित काम अघि बढाउन कुनै समस्या नभएको प्रतिक्रिया दिए । कतिपय निर्णय असंवैधानिक हुन्छन्, जसको निरूपण अदालतमा गर्न सकिन्छ, कतिपयचाहिँ अनधिकृत हुन्छन्, उनले भने, कानुन र संविधानले दिँदै नदिएको अधिकार प्रयोग गर्नु अनधिकृत काम हो, अधिकार नै नभएको संसद् विघटन गर्ने काम त्यस्तै अनधिकृत कदम हो, यसको प्रतिरक्षा गर्न अदालत गइराख्नुपर्दैन किनभने यो सुरुदेखि नै अमान्य र प्रभाव शून्यप्रायः छ । मन्त्रिपरिषद्को सिफारिसमा राष्ट्रपतिले संसद्को अधिवेशन बोलाउने संवैधानिक चलन छ । यसको अलावा बहुमत सदस्यले राष्ट्रपतिलाई निवेदन दिए भने पनि संसद्को अधिवेशन बोलाउनुपर्ने अर्यालको तर्क छ । यसो गर्दा प्रधानमन्त्रीलाई बीचमा ल्याइराख्नु पर्दैन, उनी भन्छन्, तर, राष्ट्रपतिबाट यस्तो निवेदनमाथि सुनुवाइ हुने लक्षण देखिन्न किनभने उहाँले नै संसद् भंग गर्ने सिफारिसलाई अनुमोदन गर्नुभएको छ । यस्तो अवस्थामा संसद् चलाउने अर्को बाटो पनि भएको उनले बताए । त्यो भनेको संसद्को स्वतः सक्रिय हुने समयावधि । एक अधिवेशनको अन्त्य भई अर्को अधिवेशन सुरु नभएको ६ महिना कट्यो भने सभामुख स्वयंले संसद्को बैठक बोलाउन पाउने व्यवस्था पनि छ, उनले भने, बर्खे अधिवेशन अन्त भएको ६ महिना पुस १७ मा पुग्दै छ, त्यसको भोलिपल्टै सभामुखले बैठक बोलाउन सक्नुहुन्छ ।राष्ट्रिय सभाका सांसद तथा अधिवक्ता रामनारायण बिडारीले पनि दाहालनेपाललाई यसै गर्न सुझाव दिएका छन् । हुन त संविधानमा सभामुख आफैंले संसद्को बैठक बोलाउन मिल्ने भनी कतै लेखिएको छैन, उनले भने, तर, संविधानमा प्रधानमन्त्री र राष्ट्रपति मिलेर संसद् विघटन गर्न सक्छन् भनेर पनि लेखिएको छैन, त्यसो हुनाले सभामुखले संसद् बैठक बोलाउन राष्ट्रपतिलाई आग्रह गर्न बाधा छैन ।"
खोपमा नेपाललाई प्राथमिकता : सेरम,"भारतको सबैभन्दा ठूलो खोप उत्पादक सेरम इन्स्टिच्युटले कोरोना भाइरसविरुद्धको खोप आपूर्तिका लागि नेपाललाई प्राथमिकतामा राखेको जनाएको छ । सेरमका संयुक्त निर्देशक प्रकाश सिंहले सोमबार भारतका लागि नेपाली राजदूत नीलाम्बर आचार्यसँगको भेटमा कम्पनीले नेपालका लागि समेत खोप उत्पादन गर्ने योजना बनाएको बताएका छन् । सेरमले कोरोना खोप आपूर्ति गर्ने सन्दर्भमा नेपाल, बंगलादेश, भुटानलगायत मुलुकलाई प्राथमिकता राखेको रहेछ, राजदूत आचार्यले भने ।भेटमा राजदूत आचार्यले खोप विकासको पछिल्लो अवस्था, उत्पादन र वितरण सम्बन्धमा चासो राखेका थिए । भारतमा हाल सेरमलगायत कम्पनीका ६ वटा खोपको परीक्षण अन्तिम चरणमा छ । केही मुलुकले खोप प्रयोगलाई अनुमति दिइसकेका छन् । नेपाल सरकारले जतिसक्दो चाँडो खोप उपलब्ध गराउन विभिन्न मुलुक र संस्थालाई औपचारिक रूपमै आग्रह गरिसकेको जनाएको छ । खोप खरिददेखि उपलब्ध गराउनेसम्मको प्रक्रियाको गृहकार्य सुरु भइसकेको पनि सरकारको दाबी छ । नेपालले भारतसँग पनि खोपको व्यावसायिक उत्पादन सुरु भएपछि सकेसम्म चाँडो उपलब्ध गराउन आग्रह गरिसकेको छ । यसैक्रममा भारतका लागि नेपाली राजदूत आचार्यले सोमबार सेरम इन्स्टिच्युटका संयुक्त निर्देशक सिंहसँग भेट गरेका हुन् । गत महिना भारतीय विदेश सचिव हर्षवर्धन शृंगलाको नेपाल भ्रमणका क्रममा भएको द्विपक्षीय छलफलमा पनि यस विषयले प्राथमिकता पाएको थियो । शृंगलाले पनि भारतको खोप उपलब्ध गराउने मुलुकहरूमा नेपाल प्राथमिकतामा रहेको जनाएका थिए । विश्वमा भारतले ६० प्रतिशतभन्दा बढी खोप उत्पादन गर्ने गरेको छ । भारतीय केन्द्रीय स्वास्थ्यमन्त्री हर्षवर्धनले आगामी जनवरीमा भारतमा खोप लगाउन सुरु हुने दाबी गरेका छन् । भारतमा खोपको सरकारी मूल्य ३ डलर र खुला बजारमा ६ डलरसम्म पर्ने अनुमान छ । उक्त खोप दुई पटक लगाउनुपर्ने बताइएको छ ।"
