शीर्षक,विवरण
गण्डकी सरकार पनि जोखिममा,"पोखरा (कास) प्रतिनिधिसभा विघटनपछि नेकपामा आएको विभाजनबाट गण्डकी प्रदेश सरकार पनि प्रभावित देखिएको छ । गण्डकीमा नेकपा स्थायी समिति सदस्य तथा प्रदेश इन्चार्ज पृथ्वीसुब्बा गुरुङ मुख्यमन्त्री छन् । उनको साथमा हालसम्म दुई तिहाइ बहुमत छ, तर अब पार्टी फुट निश्चितप्रायः भएकाले उनको सरकार पनि अल्पमतमा पर्ने जोखिम देखापरेको हो ।६० सदस्यीय प्रदेशसभामा पूर्वएमालेका २८, कांग्रेसका १५, पूर्वमाओवादी केन्द्रका १२, राष्ट्रिय जनमोर्चाका ३ र जनता समाजवादीका २ सांसद छन् । साविक एमालेबाट मुख्यमन्त्री र साविक माओवादीबाट सभामुख चयन गरिएको थियो । नेकपाका ४० र राष्ट्रिय जनमोर्चाको ३ गरी ४३ सांसदको समर्थन छ गुरुङलाई । अब ध्रुवीकरणपछिको अवस्थामा सरकारको समीकरण पनि बदलिन सक्ने नेकपाकै नेता बताउँछन् । पहिलो कुरा पार्टी के हुन्छ । फुटेपछि को कता लाग्छ भन्ने मुख्य कुरा हो, नेकपाका एक नेताले भने, बहुमत गुम्ने नै भयो, कांग्रेसले कसलाई सहयोग गर्छ भन्ने पनि हो ।२८ मध्ये साविक एमालेबाट निर्वाचित नेपाल पक्षधर सांसद इन्द्रलाल सापकोटाले प्रमको कदमलाई असंवैधानिक भनिसकेका छन् । स्वतन्त्रबाट चुनाव जितेर नेकपा प्रवेश गरेका राजीव गुरुङ (दीपक मनाङे) प्रति विश्वास पनि गरिहाल्ने अवस्था छैन । जनता समाजवादीले सहयोग गर्ने अवस्था देखिँदैन । अहिलेसम्म सरकारलाई समर्थन गरेको राष्ट्रिय जनमोर्चाले पनि नयाँ परिस्थिति कसरी अघि बढ्छ त्यसैमा सरकारलाई साथसमर्थन गर्ने जनाएको छ । प्रधानमन्त्रीको कदम एकदम बेठीक भयो, राजमो संसदीय दलका नेता तथा प्रदेशसभामा प्रदेश मामिला समितिका सभापति कृष्ण थापाले भने, वाम एकतामा जोड दिएर सरकारलाई समर्थन गरेका थियौं । तर अहिले धोकाजस्तो भएको छ । समर्थन गरिरहने वा फिर्ता लिने विषयमा अहिलेसम्म कुनै सोचाइ नभएको उनले बताए ।राजमोले साथ दिइरह्यो र इन्द्रलाल सापकोटाले पनि समर्थन गरेमा सरकार बहुमतमा भइरहन्छ । माओवादी विशेषगरी रामबहादुर थापा निकटका केही सांसदले अहिलेकै सरकारलाई समर्थन गरिरहने विश्वास पनि साविक एमाले पक्षधरको छ । सरकारको विषयमा के हुन्छ भन्ने विषयमा केही सोचेका पनि छैनौं, सरकारका प्रवक्ता भौतिक पूर्वाधार विकासमन्त्री रामशरण बस्नेतले भने । नेकपा संसदीय दलका प्रमुख सचेतक मायानाथ अधिकारीले पछिल्लो घटनाक्रमले पार्टीमा प्रभाव पर्ने भए पनि स्पष्ट चित्र भने नदेखिएको बताए । प्रदेश सरकार स्वायत्त हो । तर पनि राजनीतिक प्रभाव पर्न सक्छ, उनले भने, ठोस कुरा केही नभएकाले बोल्ने कुरा भएन ।साविक माओवादीबाट विजयी नेकपा सांसद रामजी बरालले प्रम ओलीको कदमलाई पछ्याएमा मुख्यमन्त्री गुरुङविरुद्ध अविश्वासको प्रस्ताव दर्ता हुने निश्चित रहेको बताउँछन् । साविक माओवादीबाट विजयी सांसद एकजुट छौं । प्रमको कदमलाई समर्थन गर्ने गुरुङविरुद्ध अरू सांसद पनि उभिने देख्छौं, उनले भने, अहिलेको सरकारविरुद्ध बहुमत प्राप्त हुन्छ । पूर्वमाओवादी सांसद एकै ठाउँमा रहेको र ओली पक्षधर भनिएका केही सांसद पनि आउने दाबी उनको छ ।पछिल्लो घटनाक्रमले हौसिएको कांग्रेस पनि अंक गणितीय लेखाजोखामा व्यस्त छ । तर समीकरणबारे अहिल्यै केही भन्न नसकिने कांग्रेस संसदीय दलका नेता कृष्णचन्द्र नेपाली बताउँछन् । एकदुई दिनमा सबै सिनारियो देखिन्छ, उनले भने, केन्द्रको निर्देशन पनि आउला । त्यसपछि केकसरी अघि बढ्ने भन्नेमा केन्द्रित हुनेछौं ।"
"रेमिट्यान्स बढ्यो, विदेशी लगानी घट्यो",स्रोत : राष्ट्र बैंक
एप र इन्टरनेटमा पनि क्लिन फिड माग्दै रिट,"काठमाडौं (कास) इन्टरनेट र एपहरूमार्फत प्रसारण हुने सामग्रीमा पनि क्लिन फिड लागू गर्न माग गर्दै सर्वोच्चमा रिट परेको छ ।विज्ञापन नियमन गर्ने ऐन२०७६ अनुसार कात्तिक ७ देखि नेपालमा प्रसारण हुने विदेशी टेलिभिजन च्यानलमा क्लिन फिड लागू भइसकेको छ । अधिवक्ता विश्वेश्वरप्रसाद गौतमले आइतबार दायर गरेको रिटमा एपमार्फत प्रसारण हुने र इन्टरनेटमार्फत प्रसारण हुने सामग्रीमा पनि क्लिन फिड लागू गर्न माग गरिएको छ । क्लिन फिड लागू हुनुअघि नै इन्टरनेट सेवा प्रदायकले उपलब्ध गराउँदै आएको आईपीटीभी रोक्नुपर्ने केबल टेलिभिजन व्यवसायीको माग छ । इन्टरनेट सेवा प्रदायकहरूले प्रयोग गर्ने डिभाइस एन्ड्रोइड भएको र त्यसमा क्लिन फिडबिनाको सामग्री प्रसारण भइरहेको भन्दै उनीहरूले केबल र इन्टरनेट सामग्रीलाई समान व्यवहार हुनुपर्ने भनेका छन् । सर्वोच्चमा परेको रिटमा सञ्चार तथा सूचना प्रविधि मन्त्रालयसहित सूचना तथा प्रसारण विभाग नेपाल र दूरसञ्चार प्राधिकरणलाई विपक्षी बनाइएको छ । विपक्षीहरूबाट विज्ञापन नियमन गर्ने ऐनको दफा ६, राष्ट्रिय प्रसारण नियमावलीको नियम ६ तथा सोही नियमावलीको अनुसूची ४ प्रतिकूल कार्य भइरहेकाले, सर्वोच्चमा दायर रिटमा भनिएको छ, विपक्षीका नाममा परमादेशलगायत अन्य जो चाहिने उपयुक्त आज्ञा, आदेश वा पुर्जी जारी गरिपाऊँ । रिटको अन्तिम टुंगो नलागेसम्म एन्ड्रोइड तथा आईओएस मोबाइल र एन्ड्रोइड आईपीटीभी बक्समा एप तथा ओटीटीका माध्यमबाट हुने प्रसारण तथा युट्युब र इन्टरनेट ब्राउजरका माध्यमबाट विज्ञापनसहितका सामग्री प्रसारण हुनबाट तत्काल रोक्नु भनी विपक्षीका नाममा आदेश जारी गर्न पनि रिटमा माग गरिएको छ ।"
उद्योगीले उखुको भुक्तानी दिन थाले,"उखु किसानको एक साता लामो आन्दोलनपछि उखु मिल मालिकहरूले बक्यौता भुक्तानी सुरु गरेका छन् । अघिल्लो आइतबारदेखि माइतीघर मण्डलमा आन्दोलनरत किसानमा बक्यौता पाउने आशा बढेको छ । तर उनीहरू सबै रकम नपाएसम्म आन्दोलन जारी राख्ने मनसायमा छन् । सरकार र उद्योगीबाट धेरै पटक धोका खायौं । अहिले थोरैथोरै गरेर भुक्तानी गरिरहेका छन्, उखु किसान सघर्ष समिति सर्लाहीका सचिव हरिश्याम रायले भने, तर शान्तिपूर्ण आन्दोलन यथावत् छ । भुक्तानी सबै पाएपछि मात्र घर फर्किन्छौं । श्रीराम सुगर मिलले पुस ३ मा १६ करोड ४४ लाख ७० हजार रुपैयाँ र ५ गते ८ करोड ८५ लाख ५७ हजार रुपैयाँ गरी २५ करोड ३० लाख २७ हजार रुपैयाँ भुक्तानी गरेको दाबी गरेको छ । पुस ३ र ५ गते गरी २५ करोड ३० लाख २७ हजार रुपैयाँ भुक्तानीका लागि उखु किसानको खाता रहेका बैंकहरूलाई निर्देशन दिई सोहीअनुसार किसानको खातामा रकम जम्मा भइरहेको व्यहोरा सबैमा जानकारी गराउन चाहन्छौं, श्रीरामले जारी गरेको विज्ञप्तिमा भनिएको छ, बाँकी बक्यौताको हकमा प्रत्येक दिन क्रमशः भुक्तानी गर्दै जाने व्यहोरासमेत सबैमा जानकारी गराउन चाहन्छौं । श्रीरामले भुक्तानी गरिरहेको दाबी गरे पनि संघर्ष समिति भने ठोस सबुत नभएको दाबी गर्छ । श्रीरामले २५ करोड भुक्तानी गरेको भनेको सुनेका छौं । तर किसानले पाएको कुनै प्रमाण छैन, सचिव रायले भने, पैसा किसानको खातामा पुगेको छैन ।अन्नपूर्ण सुगर मिलले पनि पुस ५ देखि बक्यौता रकम भुक्तानी गरिरहेको जनाएको छ । पुस ५ देखि बक्यौता रकम भुक्तानी सुरु गरेका छौं, मिलले जारी गरेको विज्ञप्तिमा भनिएको छ, पछिल्लो एक वर्षमा किसानलाई १८ करोड भुक्तानी गरेका छौं । अब नियमित रूपमा दैनिक १ करोडका दरले किसानको खातामा पठाउने भुक्तानी सूची तय भएको छ । सक्दो सबै छिट्टै भुक्तानी गर्नेछौं । अन्नपूर्णबाट पनि थोरै रकम प्राप्त गरेको रायले जानकारी दिए । ५ लाख ८८ हजार रुपैयाँ पाउने किसानले ८२ हजार पाएका छन्, ४ लाख रुपैयाँ पाउने किसानले ३६ हजार रुपैयाँ मात्रै पाए, उनले भने, किस्ताबन्दीमा पाए, सबै चुक्ता भएको छैन । लुम्बिनी सुगर मिलले किसानसँग माघ १ भित्र सबै भुक्तानी गर्ने सहमति गरेको जनाएको छ । लुम्बिनीका विषयमा भने संघर्ष समिति मौन रहेको रायले बताए । किसानसँगै सहमति भएपछि समितिले बोल्ने कुरा भएन, उनले भने ।यता उद्योग, वाणिज्य तथा आपूर्ति राज्यमन्त्री मोतीलाल दुगडले भने किसानका समस्या एक सातामै समाधान हुने दाबी गरे । उद्योगहरूले बक्यौता तिरिरहेका छन् । श्रीरामले एकदुई दिनमै सबै भुक्तानी गर्ने जनाएको छ । अन्नपूर्णको सबै चिनी बिक्री भएकाले उसले पनि सबै भुक्तानी गर्छ, उनले भने, अब एक सातामा सबै समस्या समाधान हुन्छ । सरकारले एक सातामा समस्या समाधान हुने बताए पनि किसान भने विश्वस्त छैनन् । उनीहरूले आन्दोलनसँगै वार्ता पनि गरिरहेका छन् । रायका अनुसार आइतबार उद्योग, वाणिज्य तथा आपूर्ति मन्त्रालयका सचिव र किसानका प्रतिनिधिबीच छलफल भयो । त्यस क्रममा सरकारी अधिकारीले पनि आन्दोलन स्थगन गर्न आग्रह गरेका थिए ।"
बूढीगण्डकीमा बोटबिरुवाको मुआब्जामा अल्झन,"प्रस्तावित जलाशययुक्त बूढीगण्डकी जलविद्युत् आयोजनामा जग्गाको मुआब्जा वितरण अन्तिम चरणमा पुगे पनि फलफूल र संरचनाको निर्धारण हुन सकेको छैन । निर्माण प्रक्रियामा जानुअघि डुबानमा पर्ने जग्गाको मुआब्जा निर्धारण सकेर वितरण जारी छ । अहिलेसम्म जग्गाको मात्र ३३ अर्ब रुपैयाँ मुआब्जा वितरण भइसकेको छ ।बजार क्षेत्रबाहेक तल्लो क्षेत्रका फलफूल र बोटबिरुवाको लगत संकलन सकिएको छ । एक वर्षअगावै लगत लिइएको घर, गोठ, फलफूल र बोटबिरुवाको मुआब्जा नपाउँदा प्रभावित निराश छन् । फलफूल र बोटबिरुवाको मुआब्जा वितरणलगायतको माग राख्दै प्रभावितले एक सातासम्म आयोजना कार्यालयमा धर्ना पनि दिए । बजार क्षेत्रअन्तर्गत आरुघाट बजारको पनि फलफूल र संरचनाको लगत संकलन सकिएको छ । बोटबिरुवाको भने यही साताबाट लगत संकलन थाल्ने आयोजना कार्यालयको तयारी छ ।प्रभावितको गुनासो बढेपछि शुक्रबार गोरखा र धादिङका दुवै जिल्लाको मुआब्जा निर्धारण समितिको संयुक्त बैठकले दररेट निर्धारणको तयारी थालेको छ । घरगोठ र भौतिक संरचनाको राष्ट्रिय पुनर्निर्माण प्राधिकरण जिल्ला आयोजना कार्यान्वयन इकाईले दररेट निर्धारण गर्नेछ । बोटबिरुवाको डिभिजन वन कार्यालय तथा फलफूलको कृषि ज्ञान केन्द्रलाई दररेट निर्धारणको जिम्मेवारी दिइएको बूढीगण्डकीको वातावरण मुआब्जा वितरण पुनर्वास तथा पुनःस्थापना इकाईका प्रमुख कृष्ण कार्कीले जानकारी दिए । दररेट निर्धारणको जिम्मेवारी पाएका कार्यालयले दुई महिनाभित्र आयोजना कार्यालयलाई प्रतिवेदन पेस गर्नेछन् । बोटबिरुवा र फलफूलको क्षतिपूर्ति दररेट निर्धारण गर्दा दुवै जिल्लाको दररेट हेरेर औसत लिन भनिएको छ । दररेट निर्धारण गरेर चालु आर्थिक वर्षभित्रै फलफूल र बोटबिरुवाको मुआब्जा वितरण सुरु गर्ने तयारी थालिएको उनले बताए । चैतभित्र संरचना र फलफूलको मुआब्जा वितरण नगरे विनियोजित बजेट फ्रिज हुने सम्भावना हुन्छ, उनले भने । आयोजनाका लागि चालु आर्थिक वर्षमा ८ अर्ब रुपैयाँ निकासा भएको उनको भनाइ छ । विनियोजित ८ अर्ब रुपैयाँमध्ये १ अर्ब रुपैयाँ जग्गाको मुआब्जा वितरणमा खर्च भइसकेको छ । संरचना र बोटबिरुवाको मुआब्जा वितरणका लागि मात्र १० अर्ब रुपैयाँभन्दा बढी लाग्ने अनुमान छ । भौतिक संरचनामा ह्रासकट्टी विवादले पनि मुआब्जा वितरणमा अलमल भएको आयोजनाले बताउँदै आएको छ । नेपाल सरकारको भवनसम्बन्धी प्रचलित कार्यविधिमा भौतिक संरचनाको ह्रासकट्टा गर्नुपर्ने प्रावधान छ । तर प्रभावित ह्रासकट्टी गरे मुआब्जा रकम नै नलिने अडानमा छन् । भौतिक संरचनामा ह्रासकट्टी हुँदा मर्कामा पर्ने प्रभावितहरू बताउँछन् ।आयोजनाको स्वीकृत ईआईए प्रतिवेदनमा ह्रासकट्टी नगरी क्षतिपूर्ति भुक्तानी हुन आवश्यक देखिएको उल्लेख छ । संरचना अधिग्रहण गर्दा हाल भइरहेका संरचनाअनुसारको दररेटमा हुने प्रतिस्थापन मूल्य वा ह्रासकट्टी नगरी क्षतिपूर्ति भुक्तानी दिन ऊर्जा, जलस्रोत, सिँचाइ मन्त्रालयसमक्ष माग गरिएको आयोजना प्रमुख कार्कीले बताए । ऐलानी पर्तीमा बसोवास गर्दै आएका डुबान प्रभावितलाई मुआब्जा वितरणका लागि अध्ययन गर्न दुवै जिल्लाका सहायक प्रमुख जिल्ला अधिकारी संयोजक रहेको कार्यदल बनाइएको छ ।"
