शीर्षक,विवरण
प्रधानमन्त्री बालुवाटार फिर्ता,"तर पछि प्रधानमन्त्री डिस्चार्ज भएर बालुवाटार गए । अस्पताल आउँदा उहाँको रगतमा क्रियाटिनिनको स्तर सामान्यभन्दा माथि थियो । बुधबार र बिहीबार डायलाइसिस गरेपछि अवस्था सामान्य छ, डा पाण्डेले भने, संक्रमण पनि नभएकाले उहाँलाई अस्पतालमा राखिराख्नुपर्दैन । अस्पताल स्रोतका अनुसार बुधबार अस्पताल भर्ना हुँदा प्रधानमन्त्री ओलीको रगतमा क्रियाटिनिनको स्तर ५ भन्दा माथि थियो । उनको बुधबार २ घण्टा र बिहीबार ४ घण्टा डायलाइसिस गरिएको थियो । रगतमा क्रियाटिनिनको स्तर बढ्यो भने तत्कालै अर्को डायलाइसिस गर्नुपर्ने हुन सक्छ, अस्पताल स्रोतले भन्यो । ग्रान्डीका निर्देशक डा पाण्डेले प्रधानमन्त्रीलाई थप डायलाइसिस वा प्रत्यारोपण आवश्यक रहेनरहेकोबारे केही खुलाएनन् । थप डायलाइसिस गर्ने कि नगर्ने वा प्रत्यारोपण गर्ने, अहिले भन्न मिल्दैन । प्रधानमन्त्रीको उपचारमा संलग्न चिकित्सकहरूले रगतको परीक्षण गर्नुहुन्छ । त्यसपछि के गर्ने भन्ने निर्णय लिनुहुन्छ, उनले भने, चिकित्सक टोलीले विदेशमा पनि परामर्श गरिरहेको छ । पत्रकार सम्मेलनमा डा पाण्डेले प्रधानमन्त्रीको स्वास्थ्य अवस्था हाललाई ठीक रहेको बताउँदै त्यसमा शंका नगर्न पटकपटक आग्रह गरेका थिए । उनले प्रधानमन्त्रीलाई अस्पतालबाट डिस्चार्ज गरे पनि उनका निजी चिकित्सक डा शाहसहितको टोलीले बालुवाटारमा निगरानी गरिरहने जानकारी दिए । हामीले अस्पतालबाट डिस्चार्ज गरेर पठाए पनि उहाँको स्वास्थ्य अवस्थालाई मनिटर गर्न चिकित्सक टोली उहाँसँगै जानेछ, उनले भने ।स्रोतका अनुसार प्रधानमन्त्रीको रगतमा क्रियाटिनिनको स्तर सामान्यभन्दा निकै माथि रहेकाले बुधबार अस्पताल लैजानेबित्तिकै डायलाइसिस गर्ने निर्णय गरिएको थियो । पहिलो डायलाइसिसपछि पनि रगतमा क्रियाटिनिनको स्तर कम नभएपछि चिकित्सकहरूले पुनः डायलाइसिस गरेका हुन् । प्रधानमन्त्री ओलीलाई ज्वरो पनि आइरहेको स्रोतले दाबी गरे पनि त्यसलाई डा पाण्डेले इन्कार गरेका छन् । ज्वरोको कारण खुट्टिन नसकेको अस्पताल स्रोतले जनाएको छ । बुधबार नै उनको रगत कल्चर गर्न पठाइएको छ । त्यसको रिपोर्ट आउन ७२ घण्टा लाग्छ । चिकित्सकका अनुसार इम्युनोसप्रेसिब खाइरहेका बिरामीको रगतमा संक्रमण देखिनु राम्रो मानिँदैन । मिर्गौला प्रत्यारोपण गरिएका बिरामीको शरीरले दाताबाट लिइएको मिर्गौलालाई अस्वीकार नगरोस् भनेर इम्युनोसप्रेसिब औषधि दिइन्छ । यो औषधिले ग्रहण गरिएको मिर्गौलालाई शरीरले अस्वीकार गर्न उत्पादन गर्ने एन्टिबडीलाई नियन्त्रणमा राख्नुका साथै शरीरको रोग प्रतिरोधी क्षमता घटाउँछ । जसका कारण मिर्गौला प्रत्यारोपण गरिएका बिरामीलाई संक्रमणको उच्च जोखिम रहन्छ । प्रधानमन्त्री ओलीको उपचार प्रक्रिया र परीक्षण रिपोर्टलाई अत्यन्तै गोप्य राखिएकाले ठ्याक्कै के भएको छ भन्न गाह्रो छ, स्रोतले भन्यो, उच्च सतर्कताका साथ उहाँको उपचार भइरहेको छ ।प्रधानमन्त्री ओलीलाई गत साउन १० गते सैनिक अस्पताल छाउनीमा नियमित ल्याब परीक्षणसहित यूएसजी गाइडेड रेनल बायोप्सी गरिएको थियो । त्यही रिपोर्टका आधारमा उनलाई सिंगापुर लगिएको थियो । प्रधानमन्त्री ओलीलाई साउन १८ देखि २७ सम्म सिंगापुरको नेसनल युनिभर्सिटी अस्पताल (एसएनयू) मा राखेर स्वास्थ्य परीक्षण गरिएको थियो । त्यतिबेला शरीरमा एन्टिबडी को मात्रा धेरै देखिएको थियो । प्लाज्माफेरेसिस प्रक्रियालाई निरन्तरता दिनुपर्ने भएकाले पुनः सिंगापुर गएका ओली सिंगापुरबाट भदौ २० गते फर्किएका थिए । सिंगापुरमा प्लाज्माफेरेसिस गरेपश्चात् उनको शरीरमा एन्टिबडीको मात्रा पुनः नबढोस् भनेर इम्युनोसप्रेसिब दिइएको थियो । तर उनलाई सिंगापुरमा उपचार गरेर फर्किंदा कुन इम्युनोसप्रेसिब दिइएको थियो भन्ने खुलाइएको छैन । ओलीको १२ वर्षअघि दिल्लीको अपोलो अस्पतालमा मिर्गौला प्रत्यारोपण गरिएको हो । ६ वर्षअघि उनको हातमा पनि संक्रमण भएको थियो । दिल्ली र थाइल्यान्डमा लामो उपचार गरेपछि निको भएका उनी नियमित फलोअपमा थाइल्यान्ड जाने गरेका थिए ।"
महराविरुद्ध साढे ७ वर्ष कैदको मागदाबी,"अदालत काठमाडौंमा दर्ता भएको अभियोगपत्रमा गत असोज १२ गते महरा नयाँ बानेश्वर २६ को कोठामा पुगेको र बलात्कारको प्रयास गरेको उल्लेख छ । दुवै पक्षबीच छिनाझम्टी हुँदा महराको चस्मा खसेर फुटेको थियो । सिसासहितको एउटा फ्रेम महराले लगेपछि एउटा आँखाको सिसा र चस्माको खुट्टा नयाँ बानेश्वर २६ को कोठामा छुटेको थियो । महराले पछि अनुसन्धानका क्रममा क्षतिग्रस्त चस्मा उपलब्ध गराएनन् । तर कोठामा भेटिएको सिसा र महराले प्रयोग गर्ने चस्माको पावर मिलेको थियो । आरोपपत्रमा भनिएको छ, घटनास्थलमा भेटिएको चस्माको सिसा र फ्रेमको डन्डी महराकै हो भन्ने तथ्य स्थापित भएको देखिन्छ ।महरामाथि सभामुखको पद दुरुपयोग गरेको आरोपसहित सरकारी वकिलले निवासबाट बाहिर निस्कँदासमेत आफ्ना वरिष्ठ सुरक्षाकर्मीलाई यकिन जानकारी नदिएको आरोप लगाइएको छ । केही सुरक्षाकर्मी मात्रै लिएर मादक पदार्थ सेवन गर्नुका साथै मादक पदार्थ साथमा लिई पीडितलाई मादक पदार्थ सेवन गर्न कर लगाएको र सार्वजनिक पदको लाभ लिएको आरोप छ । महरा जोडिएको घटना कार्यस्थल का कारण पनि संवेदनशील थियो । संहिताको दफा २२३ मा कार्यस्थल र त्यसका कारणले हुने करणी मात्रैलाई पनि कसुरयोग्य मानिएको छ । जसमा कार्यालय वा पेसागत सेवा प्राप्त गर्ने व्यक्तिसँग करणी गर्न नहुने उल्लेख छ । घटना हुँदा महरा प्रतिनिधिसभाका सभामुख थिए भने पीडित संसद् सचिवालयमा कार्यरत कर्मचारी हुन् । उक्त कानुनी व्यवस्थाअनुसार, कार्यालयको सेवा लिँदा वा दिँदा र कार्यस्थलमा करणी गर्नु हुँदैन । सरकारी वकिलको कार्यालयले यस कानुनी व्यवस्थाअनुसार थप मागदाबी भने गरेको छैन । प्रहरीले पनि यसमा राय दिएको थिएन, हामीले निकै छलफल गर्दा पनि सेवासँग जोडिएर करणी प्रयास भएको नदेखिएकाले मागदाबी लिएनौं, खनालले भने । सरकारी वकिलको कार्यालयले प्रहरीको कन्ट्रोल रुममा परेको उजुरीलाई पनि प्रमाणका रूपमा पेस गरेको छ । घटना भएको दिन बेलुकी ८ बजेर ४० मिनेट जाँदा नयाँ बानेश्वर २६ ले आफूमाथि महराबाट बलात्कारको प्रयास भएको भनी १०० मा फोन गरेकी थिइन् । रानीपोखरीस्थित आयुक्तको कार्यालयमा रहेको कन्ट्रोल रुम ले त्यो सूचना तत्काल बानेश्वर वृत्तलाई पठाइदिएको थियो । त्यही सूचनाका आधारमा बानेश्वरबाट प्रहरीहरूले घटनास्थल पुगेर पीडितलाई भेटेका थिए । घटनापछि प्रहरीले पीडित र महराबीचको मोबाइल फोनको कल र सूचना आदानप्रदानको पर्याप्त प्रमाण संकलन र विश्लेषण भने गर्न सकेन । महरा सरसँग फोन माग्दा रिसको झोंकमा फुटाइदिएँ भन्नुभयो । परिवारका सदस्यलाई सोध्दा कोठा सर्ने क्रममा हरायो भन्ने जवाफ आयो, प्रहरी स्रोतले भन्यो, पीडितले आफ्नो फोन परीक्षणका लागि दिन अस्वीकार गरेकाले हामीले कलको विश्लेषण र म्यासेजका विवरण हेरेर अनुसन्धान गरेका हौं । महराले फर्गेट यस्टर्डे (हिजोको कुरा बिर्सिदेऊ) भनी गरेको म्यासेजलाई प्रमाणका रूपमा पेस गरिएको छ । प्रहरीले महराको सुरक्षामा खटिएका सेना, सशस्त्र र नेपाल प्रहरीका आधा दर्जन सुरक्षाकर्मीसँग समेत बयान लिएको थियो । उनीहरूले पीडितको कोठा बाहिरसम्म आफूहरू गएको अनि महरा भित्र गएर फर्किएको बयान दिएका थिए । महरा करिब एक घण्टाभन्दा बढी समय पीडितको कोठामा बसेको खुलेको सीसीटीभी फुटेजबाट देखिएको छ । प्रहरीले महराको बलात्कार प्रयाससँग जोडिएका विभिन्न अन्तर्वार्ताको पनि विश्लेषण गरेको छ । स्रोतले भन्यो, सूचना आदानप्रदानका अन्य महत्त्वपूर्ण प्रमाण र साक्षी पनि अदालतमा पेस हुनेछन् ।३६ पेजको आरोपपत्रमा उजुरीकर्ताको अनुहार र हातमा लागेको चोटलाई बलात्कार प्रयासकै परिणामका रूपमा चित्रण गरिएको छ । बलात्कारको प्रयासका क्रममा नयाँ बानेश्वर २६ माथि हातपात र आक्रमणसमेत भएको आरोपपत्रमा उल्लेख छ । प्रहरीले प्रमाणका रूपमा घटनास्थलको फोटो, भिडियो, चस्माको डन्डी र सिसा, मदिराको बोत्तल र गिलास तथा महराको जुत्ताको तलुवासमेत अदालतमा पेस गरेको छ । महराले बयानका क्रममा आफूमाथिको आरोपलाई प्रायोजित भनी टिप्पणी गरेको स्रोतले बतायो । उनले मलाई फसाउन कसैले आफ्नो जुत्ताको तलुवा पीडितको कोठामा लगेर राखेको हुन सक्ने भनी प्रतिक्रिया दिएका थिए । सीसीटीभी फुटेजका सन्दर्भमा उनले घटनास्थल भनिएको ठाउँ नजिक गएको तर संसद् सचिवालयमा कार्यरत ती कर्मचारीको कोठामा नछिरेको दाबी गरेका थिए । बिहीबार मुद्दा दर्ता भएकाले शुक्रबार अदालत खुल्नासाथ महराको बयान हुनेछ । बयानको अवधि उनले दिने प्रतिक्रिया र जवाफमा निर्भर रहनेछ । अदालतका कर्मचारीहरूको अनुमानमा, शुक्रबार बयान सकिए आइतबार थुनछेकको बहस हुनेछ । त्यसपछि अदालतले महरालाई पुर्पक्षका लागि थुनामा राखी मुद्दा अघि बढाउने, धरौटी वा सामान्य तारेखमा छाड्नेबारे आदेश दिनेछ । बलात्कार र त्यससँग जोडिएका मुद्दामा निरन्तर सुनुवाइ हुने भएकाले न्याय सम्पादन प्रक्रियासमेत अन्य मुद्दाको प्रक्रियाका तुलनामा छिटो हुने अनुमान छ ।"
बंगलादेशका राष्ट्रपति हमिद नेपाल आउँदै,"काठमाडौं (कास) बंगलादेशका राष्ट्रपति अब्दुल हमिद यही महिनाको अन्त्यमा नेपाल आउने भएका छन् । बंगलादेश र नेपालले औपचारिक जानकारी नदिए पनि बंगलादेशका विदेश सचिव साहिदुल हगले कात्तिक ९ मा आयोजित पत्रकार सम्मेलनमा राष्ट्रपति हमिदको भ्रमणबारे बताएका हुन् । बंगलादेशको अंग्रेजी दैनिक द डेली स्टार का अनुसार बाकुमा भएको असंलग्न अभियानको १८ औं शिखर सम्मेलनलगत्तै गरिएको पत्रकार सम्मेलनमा विदेश सचिव हगले हमिदको नेपाल भ्रमणबारे जानकारी दिएका थिए । उनले भ्रमण मिति भने खुलाएका छैनन् । शिखर सम्मेलनमा भएको साइडलाइन वार्तामा बंगलादेशकी प्रधानमन्त्री शेख हसिनाले नेपालका प्रधानमन्त्री केपी शर्मा ओलीसँग भेटवार्ता गरेकी थिइन् । भेटमा बीबीआईएन (बंगलादेश, भुटान, भारत र नेपाल) बीच हुने भनिएको मोटरभेहिकल सम्झौता र पीटीए (ऊर्जा व्यापार सम्झौता) बारे छलफल भएको थियो । नेपालका लागि बंगलादेशकी राजदूत मसफी बिन्टे साम्सले राष्ट्रपति हमिदको नेपाल भ्रमणबारे अहिले नै केही बोल्न नमिल्ने कान्तिपुरलाई बताइन् । परराष्ट्र मन्त्रालयका प्रवक्ता भरतराज पौड्यालले राष्ट्रपति हमिदको भ्रमणबारे औपचारिक जानकारी आइनसकेको बताए ।"
