शीर्षक,विवरण
सम्झौताको एक दशकपछि बहुप्राविधिक महाविद्यालय,"(हेटौंडा)  भारतसँग सम्झौता भएको एक दशकपछि हेटौंडामा बहुप्राविधिक महाविद्यालयको निर्माण सुरु हुन लागेको छ । मकवानपुरको हेटौंडा उपमहानगरपालिका६ मा नेपालभारतमैत्री बहुप्राविधिक महाविद्यालय बन्ने भएको हो । निर्माणस्थलमा रहेका दुई हजार तीन सय ५१ वटा रुख कटान गरेर महाविद्यालयको निर्माण कार्य सुरु गर्न लागिएको महाविद्यालयका प्रशासन प्रमुख विष्णु घिमिरेले बताए । रुख कटान गरेर निर्माणस्थल तयारी अवस्थामा राखेको झन्डै दुई महिना बितिसक्यो, प्राविधिक कारण निर्माणमा ढिलाइ भएको थियो, उनले भने, मंगलबार शिलान्यास गरेर निर्माण कार्यको प्रारम्भ गर्नेछौं । कटान गरिएकामा करिब एक हजार नौ सय सल्लाका र चार सयजति अन्य जातका रुख थिए । प्रदेश३ का मुख्यमन्त्री डोरमणि पौडेलले कात्तिक १९ गते महाविद्यालय भवनको शिलान्यास गर्ने कार्यक्रम रहेको छ । चित्रपानी सामुदायिक वनले उक्त महाविद्यालय निर्माण गर्न एक दशकअघि नै साढे २६ बिघा जमिन उपलब्ध गराएको थियो । नेपाल र भारतबीच राष्ट्रपतिस्तरमा २०६६ फागुन ४ गते सम्झौता भएको थियो । राष्ट्रपति रामवरण यादव भारत भ्रमणमा जाँदा उक्त सम्झौता भएको हो । सम्झौताअनुसार हेटौंडामा जग्गा उपलब्ध गराएर तारबार लगाउने काम पनि तत्कालै गरिएको थियो । महाविद्यालय निर्माण कार्यको टेन्डर भारत सरकारले नै गत वर्ष निकालेको थियो । ५५ करोड लागतमा निर्माण हुने भवनको भारतीय टीसीआईएन निर्माण कम्पनीले ठेक्का पाएको छ । खानेपानी र विद्युत्को काम नेपाल सरकारको जिम्मेवारीमा छ । स्वास्थ्यबाहेक सम्पूर्ण प्राविधिक शिक्षा एकै स्थानमा पढाउन सकिने गरी महाविद्यालय स्थापना हुन लागेको हो । भारतीय अनुदानमा २६ वटा सुविधासम्पन्न भवन निर्माण हुनेछन् । शिलान्यास भएको दुई वर्षभित्र निर्माण कार्य सक्नुपर्ने समयावधि तोकिएको छ । पहिलो चरणमा उक्त विद्यालयमा डिप्लोमा तहको कम्प्युटर अर्थात् आईटी, मेकानिकल र इलेक्ट्री विषयको पढाइ हुनेछ । नगरपालिकाको मेयर हुँदाको सपना मुख्यमन्त्री भएपछि पूरा हुँदै छ, मुख्यमन्त्री पौडेलले भने ।"
दोब्बर यात्रु चढ्दा बस अनियन्त्रित,"(काठमाडौं)  सिन्धुपाल्चोकबाट क्षमताभन्दा बढी यात्रु लिएर काठमाडौं आइरहेको यात्रुवाहक बस शंकरापुर नगरपालिकाको लप्सेफेदीमा दुर्घटना हुँदा तीन जनाको घटनास्थलमै मृत्यु भएको छ । महानगरीय प्रहरी परिसर काठमाडौंका अनुसार दुर्घटनामा परी ५६ जना घाइते भएका छन् । जहरसिंह पौवाको ओरालो सकिएर पुल तरेलगत्तै बस सडकमै पल्टिएको थियो ।नुवाकोट र सिन्धुपाल्चोकको सिमाना गोल्फुभन्ज्याङबाट मेलम्ची हुँदै ३४ जनाको सिट क्षमता भएको बा५ख ५०७० नम्बरको आमा हेल्मो यातायातको बसमा ६० भन्दा बढी यात्रु कोचाकोच गरेर ल्याएकै कारण दुर्घटना भएको हुन सक्ने प्रहरी परिसर काठमाडौंका प्रवक्ता होबिन्द्र बोगटीले बताए । दुर्घटनामा परी दुई महिला र एक पुरुषको मृत्यु भए पनि उनीहरूको सनाखत हुन नसकेको प्रहरीले जनाएको छ । घटनास्थलमा रहेका शंखरापुर नगरपालिका४ का वडाध्यक्ष बुद्धिबहादुर तामाङका अनुसार बसमा सवार अधिकांश यात्रु घाइते भएका छन् । बसमा कोचाकोच यात्रु राखेर ल्याएका थिए, उद्धारमा खटिएका उनले भने, सबै घाइते छन् ।शव बसले च्यापिएपछि डोजर लगाएर निकालिएको स्थानीय विजय ओझाले बताए । दुर्घटनामा घाइते हुनेमा २६ महिला र २५ जना पुरुष छन् । घाइतेमध्ये साँखुको सुस्मा मेमोरियल अस्पतालमा ३० जना र लाइफलाइन अस्पतालमा २५ जनाको उपचार भइरहेको छ ।चालकसहित १० जना गम्भीर घाइते छन् । उनीहरूमध्ये ६ वर्षीय बालकसहित दुई जनाको शिक्षण अस्पताल महाराजगन्जमा, एक जनाको नेपाल मेडिकल कलेज, जोरपाटीमा उपचार भइरहेको छ ।"
पल्टिँदा छतभरि मान्छे थिए,"तिहार मनाएर काठमाडौं फर्कन बिहानैदेखि गाडीको पखाईमा थियौं । गोल्फुभञ्ज्याङबाट आएको बस १२ बजे ग्यालथुम आइपुग्यो । बसभित्र उभिने ठाउँसमेत थिएन । तर, काठमाडौं आउनैपर्ने थियो । बसमा नौजना कोचिएर चढ्यौं । समाउने ठाउँसमेत थिएन । भाइ र छोराचाहिँ छतमा चढे । गाडीमा कतिजना चढे, अनुमान गर्नै गाह्रो थियो । जहरसिंह पौवाको ओरालो सकिएपछि घर आएजस्तै लागेको थियो । लप्सेफेदीको पुल कट्नेबित्तिकै गाडी पल्टियो । त्यसपछि के भयो, थाहै भएन । होसमा आउँदा त हस्पिटलमा रहेछु । छतमा बस्ने छोरा विवेकको दुवै खुट्टा भाँचिएर मेडिकल कलेज जोरपाटीमा उपचार भइरहेको छ । मेरो पनि टाउकामा चोट लागेको छ । भाइ मिङ्मार, दिदी सविना पनि घाइते छन् । धन्न हामीलाई भगवान्ले बचायो । (चाबहिलको मेडिकेयरमा उपचारत ग्यालथुम, हेलम्बुकी बिनु तामाङसँगको कुराकानीमा आधारित)"
लाइसेन्स नहुँदा थोरै उत्पादन,"६ महिनादेखि निमित्तका भरमा६ महिनादेखि निमित्त महाप्रबन्धकका भरमा चलिरहेकाले कम्पनीबाट ठूला निर्णय हुन सकेका छैनन् । गत माघमा तत्कालीन महाप्रबन्धक डा रोभस कुसुम सुवेदीले राजीनामा दिएका थिए । मन्त्रिपरिषद्ले निर्णयमा ढिलाइ गर्दा कम्पनीले नयाँ नेतृत्व पाउन सकेको छैन ।यस्तै, बजार धान्ने औषधि उत्पादन नहुँदा कम्पनी आर्थिक संकटमा गुज्रिरहेको छ । आम्दानीले ८५ कर्मचारीलाई तलबसमेत दिन नपुग्दा कम्पनी ऋणमा डुबेको बज्राचार्यले बताए । हामीसँग भएको खाली ठाउँ भाडामा लगाएर आर्थिक व्यवस्थापन गरिरहेका छौं । उत्पादन र बजार बढाउन सके मात्रै कम्पनी ऋणमुक्त हुन्छ । कम्पनी परिसरको भवनमा सत्यनिरुपण आयोग, सरकारी वकिल कार्यालय, गृह मन्त्रालयको हज कमिटीका कार्यालय भाडामा छन् । कम्पनीले एन्टिबायोटिक, सिरप, आइड्रप, विभिन्न थरीका मलम गरी एक सय २० खालका औषधि उत्पादन गर्दै आएको थियो । कुनै समय यहाँबाट वार्षिक तीन करोड ट्याब्लेट उत्पादन हुन्थ्यो ।"
कात्तिक नाच आजदेखि,"छोट्टियो नाचपरम्पराअनुसार कात्तिक महिनाभर अथवा २७ दिन सञ्चालन गर्नुपर्ने नाच यस वर्ष पनि १२ दिनमा सीमित हुने भएको छ । हाम्रो लक्ष्य कात्तिक महिनाभर नै सञ्चालन गर्ने थियो तर सरकारी निकायले बेवास्ता गर्दा छोट्याउनुपर्यो, कात्तिक नाच संरक्षण समितिका कोषाध्यक्ष शाक्यले भने, १२ दिन सञ्चालन गर्न करिब चारपाँच लाख रुपैयाँ आवश्यक पर्छ, नाच पूरै सञ्चालन गर्ने हो भने ३० लाख चाहिन्छ ।पहिला अड्डा (गुठी संस्थान स्थापना गर्नुअघि) हुँदा नाचमा सहभागी हुने कलाकारलाई अड्डाबाट खटिएका कर्मचारीले घरमै आएर मानसम्मानसाथ बोलाउँथे । संस्कृति संरक्षणमा स्थानीयहरू लागिपर्दा पनि सरकारी निकायले बेवास्ता गर्दा नाच सञ्चालनमा समस्या भएको कात्तिक नाचका गुरु केशवकृष्ण श्रेष्ठ बताउँछन् । बडादसैंमा पाटन दरबारमा फूलपाती भित्र्याउन पनि कात्तिक नाचको मुख्य भूमिका हुन्थ्यो, उनले भने, तर सम्बन्धित सरकारी निकायले पहल नगर्दा बन्द भएको छ ।"
