शीर्षक,विवरण
सञ्जयका फिल्ममा अजयरनवीर,"बलिउडमा निर्देशकका रूपमा सञ्जयलीला भन्सालीको भ्यालु स्टारको भन्दा कम छैन । उनले लगातार बिग बजेट फिल्म निर्माण मात्रै गरेका छैनन्, कमाइ र समीक्षामा समेत उत्तिकै सफलता पाइरहेका छन् । देवदास, ब्ल्याक जस्ता फिल्मका निर्देशक भन्सालीका पछिल्ला फिल्म रामलीला, बाजीराव मस्तानी, पद्मावत ले पनि उनलाई निकै सफलता दिलायो । जबकि त्यसअघि उनका निकै आशा गरिएका दुई फिल्म सावरियाँ र गुजारिस बक्सअफिसमा फ्लप भएका थिए । यसको प्रत्यक्ष असर भन्सालीको करिअरमा परेको थियो । पछिल्लो पटक भन्सालीको सलमान खानसँगको जुगलबन्दी हुने कुराले निकै चर्चा पाएको थियो । सञ्जयले कुनैबेला सलमानलाई लिएर हम दिल दे चुके सनम फिल्म बनाइसकेका थिए भने त्यसपछि दुवैबीचको सम्बन्धमा चिसो बढेपछि उनी शाहरूख खानतर्फ लागे । पछिल्लो समय भने भन्सालीले रनवीर सिंहलाई आफ्ना फिल्ममा दोहोर्याइरहेका बेला इन्साअल्लाह फिल्म घोषणा मात्रै गरेनन्, लामो समयपछि पुनः सलमानसँग टिमअप गर्न लागेको खबर बाहिरियो तर उक्त फिल्म छायांकनमा जानु केही दिनअघि रोकियो । सलमानले इन्साअल्लाह नगर्ने घोषणा गरेपछि भन्सालीले पनि उक्त प्रोजेक्टलाई रोकिदिए । यतिबेला निर्देशक भन्सालीले लगालग दुई फिल्म गंगुबाई र बैजु बावरा घोषणा गरेका छन् । भन्सालीले नयाँ फिल्म घोषणासँगै यसको कास्टिङको अड्कलबाजी पनि चर्को देखिएको छ । आधिकारिक रूपमा घोषणा नभए पनि गंगुबाई मा भन्सालीले अजय देवगणलाई लिन सक्ने सम्भावना बलियो देखिएको छ । दिवालीको छेकोमा यी दुईबीच गंगुबाई का लागि मिटिङ चलेको थियो । इन्साअल्लाह मा सलमानसँगै अपोजिटमा नायिका आलिया भट्ट पनि हुने बताइएको थियो । उक्त फिल्म नबन्ने भएपछि भन्सालीले आलियालाई नै लिएर गंगुबाई बनाउन लागेका हुन् । सम्भवतः आलिया उक्त फिल्ममा अजयसँगै खेल्नेछिन् । त्यसो त केही अघि उक्त फिल्मको अभिनेताका लागि हृत्तिक रोशनलाई समेत अप्रोच गरिएको बताइएको थियो ।गंगुबाई लगत्तै बनाउने भनिएको बैजु बावरा का लागि भने भन्सालीले पुनः एकपटक रनवीरलाई नै विश्वास गरेको बुझिएको छ । यसको पात्र चयनको पनि आधिकारिक पुष्टि त भइसकेको छैन तर स्रोतको दाबी गर्दै भारतीय मिडियाले रनवीर सिंहलाई बैजु बावरा मा लिइसकेको र अपोजिटमा दिपिका पादुकोण नै हुन सक्ने अनुमान लगाएका छन् । गायक तथा संगीतकार बैजु बावराको जीवनीमा आधारित रही बनाउन लागिएको उक्त फिल्ममा रनवीर खेल्ने पक्कापक्की भए उनी उक्त चरित्रका लागि केही समय ट्रेनिङ गर्नुपर्ने भन्सालीले बताएका छन् । उक्त फिल्म २०२१ को दीवालीमा रिलिज गर्ने लक्ष्य राखिएको छ । एजेन्सी"
देउडामा भैली,"(बाँके)  देउसी खेल्दै रमाइलो भो जौ पातहामी बसै मिली, लौ मैले के भने भन् बाजसुख शान्ति समृद्धि होस् जौ पातसुदूरपश्चिमको देउडा भाकामा भैलीले यसरी आशिष दिँदै थिए । घरमूली पनि रमाइलो मान्दै देउडा तालमा नाच्न थाले । उनका लागि देउडाभैलो नौलो थियो । नेपालगन्ज सहरमा सुदूरपश्चिम संस्कृति सुन्न र हेर्न पाउँदा धेरै घरमूली छक्क परे । धम्बोजीस्थित शान्तकुमार मिश्रले पनि देउडा भैलो पहिलोपटक सुनेका हुन् । अछाम सेवा समाजको देउसीभैलो हुँदै गर्दा उनी छिमेकीको घरमै आएर सुने । छिमेकी अछामी हुन्, उनले भने, यहाँ देउडा भैली सुनेपछि नौलो लागेर हेर्न आएँ । तिहारमा खेलिने देउसी भैलो कतिपयका लागि रमाइलो, कसैका लागि आर्थिक सहयोग जुटाउने त कुनै समुदायका लागि सांस्कृतिक पक्ष संरक्षण गर्ने माध्यम बनेको छ । नेपालगन्जमा तिहारको भोलिपल्ट समेत भैलो खेलिएको थियो, संस्कृति संरक्षणको ध्येयसहित । अछाम सेवा समाजले देउडा शैलीमा पस्किएको देउसीभैलोले सांस्कृतिक महत्त्व झल्काएको थियो । देउडा नाचसँगै भट्याएको भाका अनौठो र रोचक थियो । अरू त बुझेँ, जौ पात र बाज भनेको चाहिं बुझिनँ, दर्शक बनेकी प्रिया गौतमले भैली टोलीसँग जिज्ञासा राखिन् । समाजका अध्यक्ष टेक खड्काले शब्दको अर्थ बुझाए, बाज भनेको अछामी भाषामा चरा हो, जौ पात भनेको जौको पात । समाजको भैलो टोलीले तिहारको तीन दिन भैलो खेलेर रमाइलो मात्रै गरेन, सँगै सुदूरपश्चिममा प्रचलित आफ्नो परम्परा, वेशभूषा र भाषा संस्कृतिको महत्त्व पनि बुझायो । मादल, छिनछिन बाजासँगै उनीहरूले आधुनिक पुस्तालाई मन पर्ने म्युजिक सिस्टम पनि बोकेर हिँडेका थिए । रमाइलो के थियो भने जहाँ उनीहरू भैलो भट्याउन थाल्थे, देउडा नाच र भाका सुन्न वरिपरिरका पनि भेला हुन्थे । खड्काका अनुसार अछाममा पुर्ख्यौलीले भैलो कहिल्यै खेलेनन् । नेपालगन्जमा बस्दै आएका अछामीले मिलेर तिहारमा रित्तै बस्नुभन्दा आफ्नो थलोको कला र संस्कृति चिनाउन देउसीभैलो खेल्न उचित ठाने । मान्छे जहाँ पुग्छ, त्यहीँ कला र संस्कृति पनि पुग्छ, उनले भने, त्यसैले देउडाको स्वाद चखाउन देउसीभैलो खेलेका हौं । भैलो खेलेर संकलित रकमले समाजको भवन निर्माण गर्ने योजना रहेको पनि उनले सुनाए ।कोहलपुरमा व्यवसाय गर्दै आएका इन्द्रराज केसीको पुर्ख्यौली घर सुर्खेत हो । चाडपर्व आउँदा उनलाई पुर्खाको याद आउँछ । नाचगान गर्न मन पर्छ । त्यसैले उनी तिहारमा दुईचार जना सुर्खेतका आफन्त बटुलेर पुर्ख्यौली संस्कृति झल्किने देउसी खेल्छन् । पाइन्टमाथि सारी लगाएर हातमा रुमाल हल्लाउँदै पुरुषहरू एकैनासले नाच्छन् । छेउछाउ देउसी रे भन्दै साथीहरूले ताली बजाउँछन् । सुर्खेतमा प्रचलित सिमताली नृत्यलाई उनले तिहारमा देउसी शैलीमा पस्किएको बताए । गाउँमा छँदा रातभरि नाच्थ्यौं, उनले सम्झिए, छोराछोरीले भुल्दै गए । उनीहरूलाई देखाउन भए पनि नाच्नुपर्छ ।दैलेखी समाजको देउसीभैलो रोचक थियो । नाचगानसँगै उनीहरूले दैलेखका प्रचलित धार्मिक स्थलका तस्बिरसमेत प्रदर्शन गरेका थिए । ब्यानरमा ठूला तस्बिर झल्किने, धार्मिकस्थल सात खम्बा, नागीस्थान, श्रीस्थान, कोटिला, ज्वालालगायत ऐतिहासिक महत्त्व बोकेका धार्मिक स्थलका तस्बिर बोकेका थिए । दैलेखमा जन्मेर नेपालगन्ज कर्म थलो बनाएको युवा जमातले आफ्नो संस्कृति जोगाउन भैली खेलेको समाजकी अध्यक्ष अमृताचन्द कार्कीले बताइन् । एक किसिमले जन्मथलोको प्रचारप्रसार पनि गरेका हौं, उनले भनिन्, धेरैले तस्बिर देखेर घुम्न जाने मुड बनाउन सक्छन् । अर्को साल दैलेखी लोपोन्मुख नाच देखाउने सोच छ ।"
सञ्जयको माया मेरी माया,"काठमाडौं (कास) नब्बेको दशकतिरको चर्चित गीत हो, माया मेरी माया । यही गीत टुबोर्ग ओपन सेसन्स् सिजन २ मा सार्वजनिक भएको छ । क्रसरोड्स ब्यान्ड्सले प्रदर्शन गरेको यो गीत च्यानल आरबिट्ररीद्वारा सञ्चालन हुने टुबोर्ग ओपन सेसन्स् २ मा सञ्जय श्रेष्ठले संगीतकार विनायक शाहको साथमा प्रस्तुत गरेका हुन् ।सन् १९९२ मा श्रेष्ठले क्रसरोड्स नामक पप ब्यान्ड स्थापना गरेका थिए । यो ब्यान्डले छिट्टै पश्चिमी र नेपाली सांगीतिक शैली मिलाई प्रस्तुत गरेका गीतबाट लोकप्रियता हासिल गर्यो । श्रेष्ठले माया मेरी माया लगायत विभिन्न लोकप्रिय गीत निर्माण गरेका छन् । क्रसरोड्सको पहिलो एल्बम नयाँ मोड मा अन्जान मायालु , त्यो मुटुलाई र माया मेरी माया जस्ता गीत थिए, जसले ब्यान्डलाई नेपाली संगीत क्षेत्रमा चिनायो । टुबोर्ग र च्यानल आरबिट्ररीद्वारा सञ्चालन हुने टुबोर्ग ओपन सेसन्स् २ एक युट्युब सिरिज हो, जसमा प्रसिद्घ कलाकारहरूको स्टुडियोमा प्रत्यक्ष रेकर्ड गरिएको प्रस्तुति राखिन्छ । उक्त डिजिटल प्ल्याटफर्मले कलाकारको रचनात्मकता र सांगीतिक सहकार्यमार्फत पुराना र नयाँ लोकप्रिय गीतको प्रवर्द्धन गर्छ । नेपाली संगीत उद्योगको विविधता अँगाल्ने र परम्परागत सांगीतिक आधारलाई सम्मान गर्ने यस सेसनको लक्ष्य रहेको बताइएको छ । आयोजक गोर्खा ब्रुअरीका मार्केटिङ निर्देशक वैभव शर्माले टुबोर्ग ओपन सेसन्स्, नेपाली संगीतको प्रवर्द्धन गर्ने निरन्तर प्रयासका रूपमा रहेको बताए । यसले प्रख्यात कलाकारको प्रशंसा र नयाँलाई प्रोत्साहन गर्छ, उनले भने । टुबोर्ग ओपन सेसन्स् सिजन १ मा ५१ वटा गीत च्यानल आरबिट्ररीमार्फत युट्युबमा अपलोड गरिएको थियो ।"
खोला प्रदूषित गराएको आरोपमा दुई पक्राउ,समितिले सिर्सिया खोलाको उद्गमस्थल मानिने बाराको सिमिरा रामवनदेखि वीरगन्जस्थित नेपालभारत सीमासम्म खोलाको अनुगमन र तथ्य अभिलेखीकरणपछि तयार पारेको प्रतिवेदनको निष्कर्षमा प्रदूषित बनाउने ४८ स्रोत किटान गरेको थियो ।
रोकिएन चितुवा आतंक,"मान्छेलाई आक्रमण गर्न सजिलो ः विज्ञव्यावहारिक विज्ञान प्रतिष्ठानका विज्ञ प्रकाश पौडेलका अनुसार पछिल्ला केही वर्ष चितुवा आक्रमणबाट ज्यान गुमाउने र घाइते हुनेको संख्या हात्ती आक्रमणपछिको हो । खासगरी मध्यपहाडी क्षेत्रमा चितुवा आक्रमण बढेको देखिन्छ, उनले भने, बैतडी, अर्घाखाँची, काभ्रे र अहिले तनहुँमा समस्या देखिएको छ । मध्यपहाडी क्षेत्रमा सामुदायिक वनको विकाससँगै उजाड पाखासमेत हराभरा भएपछि ती जंगलमा चितुवाको उपस्थिति बाक्लो बनेको हो । हरियो बासस्थान पायो तर चितुवाले खाने मृग प्रजाति, खरायो, बाँदर, पर्याप्त भएन, पौडेलको विश्लेषण छ, त्यस्तो बेलामा कुकुर, बाख्रा, गाईबस्तु खोज्दै आएका बेला मान्छेमाथि आक्रमण गर्छ । मान्छेमाथि आक्रमण गर्दा सुरक्षा चुनौती नहुने भएकाले पनि एकपटक आक्रमणपछि दोस्रोपटक मान्छेकै खोजीमा हुने वन्यजन्तुविज्ञहरूको भनाइ छ ।"
१७१ मृतक कामदारका परिवारलाई ७७ लाख,"काठमाडौं (कास) चालु आर्थिक वर्षको तीन महिना अवधिमा वैदेशिक रोजगारीका क्रममा मृत्यु भएका १ सय ७१ कामदारका परिवारलाई सरकारले राहतस्वरूप आर्थिक सहायता गरेको छ । वैदेशिक रोजगार प्रवर्द्धन बोर्डले साउनमा ६०, भदौमा ६४ र असोजमा ४७ मृतक कामदारका परिवारलाई ७७ लाख रुपैयाँका दरले आर्थिक सहायता उपलब्ध गराएको हो ।बोर्डले वैदेशिक रोजगारीका क्रममा करार अवधिभित्र तथा नेपाल फर्केको एक वर्षभित्र मृत्यु भएका व्यक्तिका परिवारलाई ७ लाखका दरले आर्थिक सहायता दिने गरेको छ । तीन महिना अवधिमा बोर्डले वैदेशिक रोजगारीका क्रममा अंगभंग तथा बिरामी भएका ९८ कामदारका परिवारलाई आर्थिक सहायता गरेको छ । बोर्डका अनुसार कामदारको परिवारका सात जनालाई औषधोपचार सहयोग उपलब्ध गराइएको थियो । बोर्डले कामदारको परिवारका सदस्यलाई क्यान्सर, मिर्गौला, मुटु, पार्किन्सन र अल्जाइमर रोगको उपचारका लागि आर्थिक सहायता दिने गरेको छ । बोर्डले सामान्य अवस्थाका बिरामीलाई १५ हजार, मध्यम अवस्थाका बिरामीलाई ३० हजार र गम्भीर अवस्था भएमा प्रतिव्यक्ति ५० हजार रुपैयाँ सहयोग गर्ने गरेको छ । यस आर्थिक वर्षको तीन महिनाको अवधिमा बोर्डले १ सय ८४ कामदारको शव मृतकको घरठेगानासम्म निःशुल्क रूपमा पुर्याइदिएको समेत जनाएको छ ।"
