शीर्षक,विवरण
र्यापिड टेष्ट निर्णय कार्यान्वयन अन्यौलमा,"बागलुङ : दुई संक्रमित भेटिएसँगै कोरोना भाइरस (कोभिड१९) को जिल्लामा जोखिम बढेको निष्कर्ससहित नेपाल सरकारले गरेको तत्काल द्रूत परीक्षण (र्यापिड टेष्ट) गर्ने निर्णय कार्यान्वयनमा अन्यौल देखिएको छ । स्वास्थ्य मन्त्रालयको आइतबारको पत्रकार सम्मेलनमा प्रवक्ता विकास देवकोटाले र्यापिड टेष्टका लागि टोली सोही दिन हिँड्ने बताएका थिए । मंगलबारको पत्रकार सम्मेलनमा पनि मन्त्रालयबाट टोली हिँडिसकेको बताए । तर, जिल्लाका सरोकारवाला निकाय अझै बेखबर छन् । गण्डकी प्रदेश स्वास्थ्य कार्यालय बागलुङ र धौलागिरी अञ्चल अस्पताल दुवै अन्यौलमा देखिएका छन् । अहिलेसम्म अस्पताल र स्वास्थ्य कार्यालयबाट शंकास्पद व्यक्तिको स्वाब संकलनपछि पठाउने काम मात्र गरिँदै आइएको छ । स्वास्थ्य कार्यालयका प्रमुख सुरज गुरौले केहि दिनयता मन्त्रालयबाट टोली हिँडिसकेको समाचारमा सुने पनि कुन टोली कहिले आउने भन्ने बारे जानकारी नरहेको बताए । 'र्यापिड टेष्ट गर्ने निर्णय त भएको जानकारीमा आएको छ,' कार्यालय प्रमुख गुरौले भने, 'अरु विस्तृतमा हामीलाई कुनै जानकारी र निर्देशन प्राप्त भएको छैन, हामी पनि अन्यौलमै रुमलिरहेका छौं।' मन्त्रालयले बागलुङमा विदेशबाट आएका झण्डै ९ सय र संक्रमण देखिएका दुईजनाका छिमेकीसहित झण्डै एक हजारको परीक्षण गर्नुपर्ने बताएको छ। स्वाब परीक्षण गर्ने विधि ढिला भएकाले कोरोनाको द्रुर्त परीक्षण थालिएको हो । स्वाबबाट गर्दा २४ देखि ४८ घण्टा सम्म लाग्नेमा सानो किटबाट गर्न सकिने द्रूर्त परीक्षणमा १० देखि १५ मिनेटमै उक्त किटले एकजनाको रगत परीक्षण गर्न सकिन्छ । तर उक्त किटबारे गुणस्तरमा विवाद छ । जसका कारण परीक्षण पश्चात मात्रै जिल्लामा र्यापिड टेष्ट मास्क स्केलमा गर्न सकिने गरी ल्याउने तयारीका कारण ढिलाई भएको हुन सक्ने गुरौले बताए । धौलागिरी अञ्चल अस्पतालका निमित्त मेडिकल सुपरिटेण्डेन्ट डा शैलेन्द्र बि पोखरेलले पनि कोरोनाले नेपालमा दोस्रो चरण लिइसकेकोले समुदाय तहको परीक्षणका लागि छिटो परीक्षण अपरिहार्य भए पनि कार्यान्वयनमा ढिलाइ भइरहेको बताए । 'र्यापिड टेष्टको विषयमा अस्पताललाई कुनै जानकारी छैन, जनस्वास्थ्यमार्फत गरिने भएकाले हामीसँग नभएको हुनसक्छ,' डापोखरेलले भने, 'म मन्त्रालयमा फ्लो अप गर्ने तयारीमा पनि छु, यसमा कदापी ढिलाई गर्नुहुँदैन ।' बागलुङमा अहिले दुईजना कोरोना संक्रमित छन् । उनीहरु दुवैको धौलागिरी अञ्चल अस्पतालमा उपचार भइरहेको छ । दुवैको स्वास्थ्य अवस्था सामान्य रहेको अस्पतालले जनाएको छ ।"
लकडाउनमै आयोजना चलाउने तयारी,"दमौली : काम प्रभावित भए पछि ऋषिङ१ स्थित तनहुँ जलविद्युत आयोजनाले कोरोना नियन्त्रणका लागि आह्वान गरिएको लकडाउनकै अवधिमा काम थाल्ने योजना बनाएको छ। 'सिनो हाइड्रोले जिम्मा लिएको विद्युतगृहको काम अघि बढिरहेको थियो। तर कोरोनाले समस्या पार्यो', आयोजनाका वरिष्ठ अधिकारी तुलसी सापकोटाले भने 'अब सरकारले बाटो खोलेकाले भित्रकै कामदारबाट थाल्ने सोचेका छौं।' आयोजनामा चिनियाँ प्राविधिक तथा श्रमिकसँगै नेपालीले पनि काम गर्दै आएका छन्। केही चिनियाँ नयाँ वर्ष मनाउने क्रममा उतै फसे पनि केही लकडाउन पहिले आएका छन्। हाल २४ चिनियाँ तथा अन्य गरी करिब ५० श्रमिक र प्राविधिक ठेकेदार कम्पनीसँग छन्। यस्तोमा सरकारले पनि ठूला आयोजनालाई काम गर्न अनुमति दिएकाले सुरक्षा सतर्कताका साथ काम थाल्ने तयारी गरिएको साइट इञ्चार्ज अशोक घिमिरेले बताए। 'भित्रबाटै काम थाल्ने जनशक्ति र संरचना भएकाले बाहिरबाट निषेध गरेर काम थाल्ने तयारीमा छौं' उनले भने 'सरकारी निकायबाट अनुमति आएमा बाहिरबाट कोही नआउने गरी काम थालिनेछ।' विद्युत गृह क्षेत्रमा टनेल खन्ने र सपोर्टिङको काम उपयुक्त हुने अधिकारीहरुको सुझाव छ। विष्फोटका काममा भने सेना संलग्न हुने भएकाले सेनासँग परामर्श गरिने अधिकारीहरुको भनाइ छ। हाल उपलब्ध जनशक्तिबाट तत्काल काम अघि बढाउन सकिएमा ढिलाई पनि नहुने र क्याम्पमा रहेका श्रमिकको श्रमको पनि सदुपयोग हुने उनीहरुको बुझाई छ। 'नजिकका श्रमिक बिदामा गए पनि टाढा घर भएका र अरु चिनियाँ यहीं छन्,' साइट इञ्चार्ज घिमिरेले भने,'उनीहरुले मात्र सघाए पनि काम अघि बढाउन कठिन छैन।' काममा अवरोध छैन श्रमिकको प्रयोग गरेर काम नभए पनि आयोजनाको डिजाइनसहितका काममा भने असर नपरेको दाबी अधिकारीहरुको छ। आयोजनाका ईन्जिनियर विदुर अधिकारीले परामर्शदाता कम्पनी र आयोजनाका कर्मचारी पनि क्याम्प परिसरमा नै रहेकाले कार्यालयबाट हुने काम भने भैरहेको बताए। 'फिल्डमा जाने काम रोकिए पनि डिजाइन र अरु प्राविधिक काम भैरहेको छ,' उनले भने। चीनमा नै रहेका केही प्राविधिक जनशक्तिले पनि घरबाटै डिजाइन र स्केचका काममा सघाएको उनले बताए।"
श्रमिकलाई अमूर्त राहत,"नेपालीले कोरोना भाइरसकै कारण लकडाउन भोगिरहेका छन्। यो परिस्थिति अझै कति लम्बिने हो स्पष्ट छैन। लकडाउनबाट सबै क्षेत्र र तप्का समस्यामा पर्छन्परेका छन्। सबैभन्दा बढी समस्यामा त ती वर्ग पर्छन्, जो दिनभरि काम गरेर साँझबिहानको छाक टार्छन्। यिनलाई अनौपचारिक क्षेत्रका श्रमिक भनिन्छ। तथ्यांक विभागको २०१७२०१८ को पछिल्लो तथ्यांकअनुसार नेपालमा ८४ दशमलव ६ प्रतिशत श्रमिक अनौपचारिक क्षेत्रमा छन्। लकडाउनले ती सबै श्रमिक समस्यामा परिरहेका छन्। श्रम संगठनसँग सम्बद्घ एक नागरिकका हैसियतले श्रमिकका समस्यालाई नजिकबाट बुझेको छु। राहतका नाममा सरकारले धेरै योजना घोषणा गरेको छ तर समस्यामा परेका श्रमिकले तत्कालै केही पाइहाल्ने देखिँदैन। खान नपुग्नेलाई स्थानीय तहले खाद्यान्न वितरण गर्ने भनिएको छ। वितरण गर्नुअघि स्थानीय तहले लगत खडा गर्ने भनिएको छ। कहिलेबाट वितरण सुरु गर्ने ? सरकार स्पष्ट छैन। राहतमा के दिने, कति दिने भन्ने उल्लेख गरिएको छैन। केही स्थानीय तहले लगत खडा गर्ने नाममा घरनक्सा, पानी र बिजुलीको बिलको फोटोकापीलगायतका कागजात मागेका छन्। वास्तविक निम्न वर्गको घरजग्गाको कागजात हुँदैन। तिनले पानी र बिजुली नै जोडेका हुँदैनन्। यति पनि थाहा नभएका स्थानीय पदाधिकारीबाट नागरिकले के अपेक्षा गर्ने ? अर्कोतर्फ घरजग्गा हुने श्रमिक नै भए पनि लकडाउनका बेला त्यो श्रमिक फोटोकपी गर्न कहाँ दौडन्छ ? ती कागजात भर्दै बुझाउन कहाँकहाँ दौड्न सक्छ ? जसका लागि राहतको कुरा गरिँदैछ उ भनेको देशभित्रै पनि अर्को जिल्लामा काम गर्ने श्रमिक वा प्रवासी पनि हो। त्यस्ता श्रमिकले स्थानीय निकायलाई मागबमोजिमको कागजात कसरी जुटाउन सक्छ ? लकडाउनले जहाँको तहीं रोकिएको श्रमिक घर फर्किन सकेको छैन। त्यसैले राहत दिइहाल्नुपर्ने बेलामा अर्को विवाद खडा गरिएको बुझिन्छ। राहत वितरणका लागि अहिले आएर स्थानीय तहलाई कोष खडा गर्नुपर्ने रे। कहिले कोष खडा गर्नु र वितरण चाहिँ कहिलेदेखि थाल्ने हो ? साँच्चै स्थानीय तहमार्फत वितरण गर्न खोजिएको हो ती वडाहरूमा टेड युनियनका प्रतिनिधिको रोहवरमा वितरणको प्रावधान बोल्नुपर्दथ्यो। बस्ने बासको ठेगान नभएका श्रमिकसँग पानी र बिजुलीको बिलको फोटोकपी मागेर राहत दिने भन्ने निर्णय कति व्यावहारिक होला ? यी सबै प्रवृत्तिा हेर्दा स्थानीय निकायका पदाधिकारीमार्फत राहत वितरण हुने विश्वास लिएर जिम्मेवारी दिनु संघीय सरकार जिम्मेवारीबाट पन्छिन मात्र खोजेको छैन, मान्छे मरेपछि हरियो काक्रो दिन खोजेजस्तै बुझिन्छ। सरकारको राहत कार्यक्रममा सहरका श्रमिकलाई एक महिनाको घर भाडा छुट दिन घर धनीलाई अनुरोध गरिएको छ। के त्यो अनुरोध घरधनीबाट स्वीकार्य होला ? अर्कोतर्फ दैनिक ज्यालादारी तथा विपन्न वर्गमा पर्ने श्रमिक सरकारले भनेअनुसारको घर बहालमा बस्दैनन्। त्यसैले सबै घरधनीले स्वीकार गरे पनि वास्तविक पीडितले राहत पाउँदैनन्। कार्यान्वयन नै हुन नसक्ने खोक्रो राहतको के भर ? साल्ट ट्रेडिङलगायतमा खाद्य सामग्री खरिद गर्दा १० प्रतिशत छुट र बिजुलीमा २५ प्रतिशत छुट, दूरसञ्चारमा २५ प्रतिशत छुटले त्यो विपन्न वर्गलाई कसरी छुन्छ ? सरकारले तुलनात्मक रूपमा विपन्न ज्यालादारी श्रमिकलाई हेर्नुपर्ने होइन र ? लकडाउनका कारण घर जान नपाएर ठाउँठाउँमा हजारौं संख्याका श्रमिक फसिरहेका छन्। यदि लोककल्याणकारी राज्य हो भने ती श्रमिकलाई कुनै माध्यमबाट सरकारले घर पुग्ने वातावरण बनाइदिनुपर्यो अथवा ठाउँठाउँमा ठूलाठूला शिविर खडा गरेर आवास तथा भोजनको व्यवस्थापन गरिदिनुपर्छ। चिकित्सक, नर्स, स्वास्थ्य प्राविधिक, महिला स्वास्थ्य स्वंयसेवीका, एम्बुलेन्स चालक, सफाइ श्रमिक, प्रत्यक्ष संलग्न सुरक्षाकर्मीलगायत लाई २५ लाखको बिमा रकम तोकिएको छ। तर, त्यो सबै क्षेत्रका श्रमिकलाई हो कि सरकारी सेवामा रहेका श्रमिक कर्मचारीलाई मात्र लागू हुने हो ? अत्यावश्यक सेवाअन्र्तगत रही भारतबाट ल्याई पेट्रोलियम पदार्थ वितरण गर्ने, खाद्यान्न तथा अन्य अत्यावश्यक सामग्री ढुवानी गर्ने ती सवारी साधनका चालक हेल्परलाई त्यो बिमा सुविधा दिनु पर्दैन र ? राज्यले यस्तो अवस्थामा सेवा दिने सबैलाई समान दृष्टिकोणबाट हेर्नुपर्ने हो कि विभेद गर्ने ! राई नेपाल ट्रेड युनियन कांगे्रस, राष्ट्रिय समितिका उपाध्यक्ष हुन्।"
भारतमा कोरोनाले ११४ जनाको मृत्यु,"भारत : कोरोनाको सङ्क्रमणका कारण ज्यान गुमाउनेको संख्या बढ्न थालेको छ। मङ्गलबार बिहानसम्म यसबाट ज्यान गुमाउने नागरिकको संख्या ११४ पुगेको भारतीय सञ्चार माध्यमले जानकारी दिएको छ। त्यसैगरी मङ्गलबार बिहानसम्म यसका सङ्क्रमितको संख्या ४ हजार ४२१ जना पुगेको भारतको स्वास्थ्य तथा परिवार कल्याण मन्त्रालयले जानकारी दिएको छ। भारतमा पछिल्ला केही दिनमा कोरोना सङ्क्रमितको संख्या बढ्न थालेको छ। कोरोना भाइरस सङ्क्रमण रहेका चार हजार ४२१ जनामा ३२५ जना भने उपचार गरी घर फर्र्किएका छन्। हाल ३ हजार ९८१ जना अस्पताल र केही आफ्नो घरमा नै निगरानीमा रही उपचार गराइरहेका सो मन्त्रालयले मङ्गलबार बिहान जानकारी दिएको छ। भारतमा विस्तारै यसको प्रकोप बढ्न थालेको महसुश गरिएको छ। भारतका अरु राज्यको तुलनामा महाराष्ट्र, तामिल नाडु र नयाँ दिल्लीमा यसका सङ्क्रमितहरु बढेको देखिएको छ। महाराष्ट्रमा ७४८, तामिल नाडुमा ६२१ र नयाँ दिल्लीमा ५२३ मा सो रोगका सङ्क्रमितहरु रहेका उक्त मन्त्रालयले जनाएको छ। भारतमा दुई हप्तायतादेखि देशैभर लकडाउनको घोषणा गरिएको छ। जसका कारण त्यहाँको जनजीवन निकै प्रभावित भएको बताइएको छ। तर यता दिन प्रतिदिन नयाँ सङ्क्रमितहरु थपिँदै जान थालेपछि भने यो लकडाउनको अवधि पनि थप लम्ब्याउन सकिने देखिएको बताइएको छ।"
"ट्रम्पको आरोप : डब्लूएचओ चीनकेन्द्रित भयो, हामीलाई किन खराब सल्लाह ?","वासिंटन : अमेरिकी राष्ट्रपति डोनल्ड ट्रम्पले विश्व स्वास्थ्य संगठनलाई कडा आलोचना गरेका छन् । ट्रम्पले मंगलबार विश्व स्वास्थ्य संगठन चीन केन्द्रित भएको र कोरोना महामारीका बेला खराब सल्लाह दिएको आरोप लगाए । डब्लूएचओले वास्तवमै उडायो, केही कारणवश अमेरिकाले ठूलो लगानी गरे पनि चीन केन्द्रित भयो । सौभाग्यवश मैले सीमा खुला राख्नुपर्छ भन्ने उनीहरुको सल्लाह अस्वीकार गरेँ, किन उनीहरुले हामीलाई यस्तो गलत सिफारिस गरे ? ट्रम्पले सोधेका छन् । डब्लूएचओले भने यसबारे कुनै प्रतिक्रिया सार्वजनिक गरेको छैन । जनवरी ३१ म डब्लूएचओले देशहरुलाई कोरोना महामारीका बावजुद सीमा खुला राख्न सल्लाह दिएको थियो । तर डब्लूएचओले कुनै पनि देशलाई आफ्ना नागरिकको सुरक्षाका लागि कदम चाल्ने अधिकार भएको पनि जनाएको थियो । ट्रम्पले भने सोही दिन चीनबाट अमेरिका यात्रा गर्न प्रतिबन्ध लगाएका थिए ।"
