शीर्षक,विवरण
कोरोना नियन्त्रणमा सरकार गम्भीर भएन : कांग्रेस,"काठमाडौं : कांग्रेसले कोरोना भाइरस (कोभिड१९) को संक्रमण फैलिन नदिन र रोकथामका लागि सरकार गम्भीर नरहेको निष्कर्श निकालेको छ। कोरोना नियन्त्रण अभियानमा सरकारलाई रचनात्मक सहयोग गर्दै आएको कांग्रेसले सरकारको पछिल्लो कार्यशैलीप्रति भने तीब्र असन्तुष्टि जनाएको हो। मंगलबार बसेको कांग्रेस पदाधिकारी बैठकले कोरोनाबाट जोगिन पर्याप्त समय हुँदा पनि सरकारले कुनै गम्भीरता नदेखाएको निचोड निकालेको छ। छिमेकी मुलुक चीनमा कोराना संक्रमण देखिएको चार महिना बितिसक्दा समेत सरकारले अत्यावश्यक स्वास्थ्यसामग्रीको बन्दोवस्त गर्न नसकेको र महामारीका बेला खरिद प्रकरणमा भएको अनियमिताप्रति कांग्रेसले आपत्ति जनाएको छ। मुलुक कोरोना संक्रमणको दोस्रो चरणमा प्रवेश गरेको उल्लेख गर्दै कांग्रेसले परीक्षणको दायरा व्यापक बनाउन सरकारको ध्यानाकर्षण गराएको छ। सरकारले समय पर्याप्त पाएर पनि पर्याप्त तयारी नगरिनुलाई अत्यन्तै दुःखद् रूपमा लिएका छौं, कांग्रेस प्रवक्ता विश्वप्रकाश शर्माले भने, मुलुक संक्रमण दोस्रो चरणमा प्रवेश गरेको स्थितिलाई गम्भीरतापूर्वक लिएर परीक्षणको दायरा तत्काल व्यापक रूपले बढाएर युद्धस्तरमा कार्य गर्न सरकारलाई अपिल गरेका छौं। कांग्रेस सभापति शेरबहादुर देउवाले कोरोना संक्रमणबाट मुलुकलाई जोगाउन आफूले सबै पक्षसँग निरन्तर संवाद गरिरहेको बैठकमा जानकारी गराएका थिए। देउवाले आइतबार पूर्वप्रधानमन्त्रीहरूसँग टेलिफोन संवाद गरेका थिए भने सोमबार सुदूरपश्चिम प्रदेशका मुख्यमन्त्रीसहित कैलाली र कञ्चनपुरका जिल्ला प्रमुख अधिकारीसँग पनि टेलिफान सम्वाद गरेका थिए। कांग्रेसले अहिलेको संकटसँग जुध्न सरकारलाई हरसम्भव सघाउने निर्णय गरेको छ। कांग्रेसले स्वास्थ्य सामग्री खरिदमा भएको अनियमिता छानबिन गर्नुपर्ने माग दोहोर्याएको छ। साथै उसले अनियमितामा संलग्नलाई पदमुक्त गर्न प्रधानमन्त्रीको ध्यानाकर्षण गराएको छ। स्वास्थ सामग्री खरिदमा बजार मूल्य भन्दा बढी राज्यकोषको रकम निकासा गराएर भएको भ्रष्टाचार र अनियमिततामा संलग्नलाई पदमुक्त गर्न अपिल गर्दै बैठकले अनिवार्य छानबिन र कारवाहीको बिषयमा ढिलाइ नगर्न सम्बन्धित निकायलाई आग्रह गर्दछौं, कांग्रेसको विज्ञप्तिमा उल्लेख छ। कांग्रेसले अत्यावश्यक स्वास्थ्यसामग्री खरिदको जिम्मा सेनालाई दिएर सरकार आफ्नो जिम्मेवारीबाट पन्छिन खोजेको आरोप लगाएको छ। पारदर्शी रूपमा जी टु जी प्रक्रियाबाट खरिद गर्न सकिने विषयलाई पनि आफ्नो कमजोरी लुकाउन सेनालाई जिम्मेवारी दिने काम बारेमा छलफल भएको नेताले सुनाए। अत्यावश्यक स्वास्थ्य सामग्रीको अभावका बीचमा पनि स्वास्थ्यकर्मीहरू काम गरिरहेको उल्लेख गर्दै कांग्रेसले सरकारलाई स्वास्थ्य सामग्रीको व्यवस्थापनमा ढिलाइ नगर्न आग्रह गरेको छ। पीपीइ, परीक्षण किट र भेन्टिलेटरलगायत अत्यावश्यक सामग्री अझैसम्म नपुग्दा परेको मनावैज्ञानिक तनाव तत्काल अन्त्य गर्न यथाशीघ्र ती सामग्रीको बन्दोबस्त गर्नुपर्छ, बैठकमा सहभागी एक नेताले भने। सीमाका नेपालीलाई व्यवस्थित रूपले क्वारेन्टाइनमा राख्ने गरी मुलुकभित्र प्रवेश दिनुपर्नेमा बैठकले जोड दिएको छ। पछिल्लो समय दार्चुलाको सीमापारी धार्चुलामा संयौंको संख्यामा नेपाली सीमामा बस्दै आएका छन्। कांग्रेसले उनीहरूलाई मुलुकभित्रै ल्याएर क्वारेन्टाइनमा राख्नुपर्ने माग गरेको हो। त्यस्तै ज्यालादारी श्रमिक र डेरामा बस्ने विद्यार्थी लक्षित राहत कार्यक्रम तत्काल ल्याउन कांग्रेसको माग छ। साना ठूला सबै व्यवसायीलाई पनि राहतको प्याकेज ल्याउन उसको माग छ। सुरक्षाकर्मी र संचारकर्मीलाई संक्रमणको जोखिमबाट सुरक्षित राख्न अत्यावश्यक प्रबन्ध मिलाउन कांग्रेसले सरकारको ध्यानाकर्षण गराएको छ। लकडाउन पालना गर्दै संयम, एकता र उच्च सतर्कता राख्न कांग्रेसले आमनागरिकलाई अपिल गर्नुका साथै पार्टीका केन्द्रीय सदस्य, संघीय र प्रदेश सांसद एवं सबै तहको नेतृत्वलाई आफ्नो जिम्मेवारीको क्षेत्रमा विशेष रूपले कार्य गर्न निर्देशन दिएको छ। कोरोनाको जोखिमसँग जुध्न बैठकले विज्ञ समूह निर्माण गरेर निरन्तर समूहको परामर्शमा कार्य गर्ने निर्णय गरेको छ। सभापति देउवा निवासमा बसेको पदाधिकारी बैठकमा प्रतिनिधिसभाका प्रमुख सचेतक बालकृष्ण खाँण र राष्ट्रिय सभामा विपक्षी दलका नेता राधेश्याम अधिकारी सहभागी थिए। वरिष्ठ नेता रामचन्द्र पौडेल भने स्वास्थ्य समस्याका कारण बैठकमा सहभागी नभएको कांग्रेस प्रवक्ता शर्माले जानकारी दिए।"
६० हजार वर्ष पुरानो काठमा कस्तो औषधि खोज्दैछन् वैज्ञानिक ?,"वासिंटन : ६० हजार वर्षअघि प्रागऐतिहासिक मानवहरु अफ्रिकाबाट बाहिरिन थालेपछि मेक्सिको खाडीको निकारमा खोला नजिकै जंगल बन्यो । जब रुखहरु बुढो हुन थाले, बिस्तारै ती रुख जमिनमै गड्न थाले । पछि समुद्री सतह बढ्न थालेपछि बिस्तारै उक्त जंगललाई समुद्रको भागले ढाकिदियो । अहिले वैज्ञानिकहरुले त्यही प्राचीन जंगल भेट्टाएका छन् । जहाँ उनीहरु मानव जीवन रक्षा गर्नसक्ने औषधि भेटिनसक्ने विश्वास गर्छन् । गत साता मात्रै उक्त जंगलबारे नेश्नल ओसियनिक एन्ड एटमोस्फिेरिक एड्मिनिस्ट्रेशनले प्रकाशन गरेको आलेखले यस्तो दावी गरेको हो । उक्त लेख अनुसार २००४ को विशाल आँधीले उक्क्त मेक्सिकन समुद्री खाडीलाई धक्का दियो । र समुद्री सतह घटाइदियो । जसले गर्दा उक्त पुरानो जंगलको भाग भेटिएको हो । यसपछि बारम्बार वैज्ञानिक र फिल्म मेकरहरुले यस क्षेत्रमा अवलोकन गर्दैआएका छन् । गत डिसेम्बरमा जब नर्थइस्टर्न युनिभर्सिटी र युनिभर्सिटी अफ उटाका वैज्ञानिकको टोली यस क्षेत्रमा पुग्यो तयसपछि यसबारे विस्तृत जानकारी सार्वजनिक भएको हो । रिपोर्ट अनुसार उनीहरु अध्ययनका लागि काठका टुक्रा संकलन गर्न पुगेका थिए । प्राध्यापक ब्रायन हेलमन्थ उक्क्त टोलीका एक अनुसन्धाता थिए । यो वास्तवकै सुन्दर दिन थियो, तर पिँधमा पुग्नु भनेको दुधको चकलेटमा डुबे जस्तै थियो । हामी आफ्नै हात अनुहारअघि पनि देख्न सक्दैनथ्यौँ, हेलमन्थ भन्छन् । जब वैज्ञानिकहरुले उक्त जंगल भेट्टाए त्यसपछि दंग परेका थिए । यसलाई उनीहरुले अनौठो ठानेका छन् । वैज्ञानिकहरुका अनुसार ६० हजार वर्ष पुरानो भए पनि उक्त जंगलका काठ भने नयाँ र ताजा देखिन्थे । उचित तरिकाले संरक्षित गरिराखे जस्तो देखिने उनीहरु बताउँछन् । साथै वैज्ञानिकहरुले ती काठ ल्याबमा लगेपछि झनै उत्साही भएको बताउँछन् । यसबाट कस्ता जीवले लाभ लिए, भिन्न किसिमका जनावर यहाँ गाडियो, कस्ता जनावर यसमाथि बसे यसबारे जानकारी लिन पायौँ, नर्थइस्टर्न युनिभर्सिटीका बरिष्ठ ल्याब व्यवस्थापक फ्रान्किस चोइले बताए । यस क्रममा ३ सय प्रकारका जनावर उक्त काठबाट हटाइएको उनीहरुले जनाएका छन् । वैज्ञानिकहरु खासगरी समुद्री गंड्यौला र त्यस्तै प्रकृतिका जनावरमा केन्द्रित थिए । जब कि, उनीहरु यसमा काठ जनावरको तन्तुमा रुपान्तरण भएको बारे अध्ययन गर्न सक्छन् । यस्ता गंड्यौला विज्ञानका लागि नयाँ त हैन । ती सामान्यतः अधिकांश समुद्रमा भएका काठमा भेटिन्छ । तर ६० हजार वर्ष पुरानो काठभित्र रहेका जुका तथा गँड्यौलामा पाइने ब्याक्टेरिया यसअघि कहिल्यै भेटिएको थिएन । (सिएनएनबाट)"
बेलायतमा मस्जिदहरु बन्द भएपछि बीबीसीबाटै प्रार्थना,लण्डन : बेलायतमा रहेका मुस्लिम समुदायका धर्मावलम्वीहरुले अब बीबीसी रेडियोबाटै प्रार्थना सुन्न पाउने भएका छन् । मुस्लिम धर्मावलम्वीहरुले गर्ने शुक्रबारको नियमित प्रार्थना बीबीसीले पहिलो पटक सुरु गरेको हो । हरेक शुक्रबार स्थानीय समय अनुसार बिहान ५ बजेर ५० मिनेट जाँदा कुरानबाट पैगम्बर मुहम्मदका भनाइ उद्धरण गर्दै प्रार्थना गरिन्छ । बेलायतमा ठूलो संख्यामा रहेका मुस्लिम स्रोतालाई लक्षित गरी बीबीसीले यस्तो प्रार्थना गरेको जनाएको छ । कोरोना महामारकिा कारण आइसोलेसनमा रहेका समुदायसँग नजिकन लोकल रेडियोबाट प्रार्थना गर्ने बीबीसी लोकल रेडियोका प्रमुख क्रिस बन्र्सले जनाए । बेलायतका प्रार्थना स्थल मार्च २३ देखि बन्द छन् । बीबीसीले यसअघि नै क्रिस्चियन सेवा पनि सुरु गरेको छ । बीबीसीमा मुस्लिम प्रार्थना गत शुक्रबार सुरु भएको हो । मुस्लिम समुदायका धर्मावलम्वीहरु मस्जिद जान नपाएसम्म यसलाई निरन्तर राख्ने बताइएको छ ।
नेकपा सचिवालय बैठक : चार घण्टासम्म सरकारका कामको समीक्षा,"काठमाडौं : चार घण्टा लामो नेपाल कम्युनिस्ट पार्टी (नेकपा) सचिवालय बैठक सरकार र कोरोना भाइरस (कोभिड १९) संक्रमण नियन्त्रण, रोकथाम तथा समन्वयन उच्चस्तरीय समितिको कारमकारबाही बारे छलफलमै टुंगिएको छ। मंगलबार दिउँसो साढे ४ बजे सुरु भएको बैठक राति साढे आठ बजेसम्म चलेको थियो। बैठकमा प्रधानमन्त्री एवम् पार्टी अध्यक्ष केपी ओलीले कोरोना नियन्त्रणमा भइरहेका प्रयास र उपलब्धिबारे जानकारी गराएका थिए। त्यसैगरी कोरोना रोकथाम उच्चस्तरीय समितिका संयोजक ईश्वर पोखरेलले कोरोना भाइरसको संक्रमणको समस्याले उत्पन्न स्थितिको सामना गर्न चालिएका कदम र गरेका कामबारे जानकारी गराए। त्यसपछि बैठकमा सहभागी सचिवालय सदस्यले धारणा राखेका थिए। सचिवालय सदस्यले बैठकमा प्रस्तुत भएका सुझावलाई अझ बढी प्रभावाकारी ढंगले कार्यान्वयन गर्न माग गरेका छन्। सुझाव कार्यान्वयन हुने कुरामा आश्वस्त हुन प्रधानमन्त्री एवम् पार्टी अध्यक्ष ओलीले आग्रह गरेको प्रवक्ता नारायणकाजी श्रेष्ठले जानकारी दिए। प्राप्त सुझावलाई आवश्यकताको आधारमा कार्यान्वयनमा ध्यान दिनेगरी प्रधानमन्त्री तथा पार्टी अध्यक्ष केपी ओलीले आश्वस्त पार्नु भएर बैठक सम्पन्न भयो, बैठकपछि जारी विज्ञप्तिमा श्रेष्ठले भनेका छन्। प्रधानमन्त्रीको सरकारी निवास बालुवाटारमा बसेको बैठककको अध्यक्षता अध्यक्षद्वय ओली र पुष्पकमल दाहाल प्रचण्डले गरेका थिए। प्रेस विज्ञप्ति जस्ताको तस्तै नेपाल कम्युनिष्ट पार्टी९नेकपा ० केन्द्रीय सचवालयको बैठक प्रधानमन्त्री निवास बालुवाटारमा सम्पन्न भएको छ। पार्टी अध्यक्ष तथा सम्माननीय प्रधानमन्त्री केपी शर्मा ओली र अर्का अध्यक्ष पुष्पकमल दाहालूप्रचण्डूको संयुक्त अध्यक्षतामा बसेको बैठकको प्रारंभमै प्रधानमन्त्री एवं पार्टी अध्यक्ष केपी शर्मा ओलीले कोभिड( १९ को रोकथाम, नियन्त्रण रउपचारमा सरकार र राज्यका विभिन्न निकायले गरेका प्रयाश र हासिल भएका उपलब्धिहरूको बारेमा विस्तारपूर्वक जानकारी गराउनुभयो। बैठकमा सचिवालय सदस्य, उपप्रधान तथा रक्षामन्त्री एवं उच्चस्तरीय निर्देशन समितिका संयोजक ईश्वर पोखरेलले यस कोरोना भाइरसको संक्रमणको समस्याले उत्पन्न स्थितिको सामना गर्न चालिएका कदम र गरिएको कामहरूको विस्तृत जानकारी गराउनुभयो। बैठकमा सचिवालयका सबै सदस्यहरूले कोभिड(१९ नियन्त्रण, रोकथाम र उपचारका सम्बन्धमा आआफ्ना महत्वपूर्ण धारणा राख्दै सरकारले चालेका कदम र लिएका नीति सही नै रहेको र अझ प्रभाकारी रूपमा अघि बढ्न आवश्यक सुझावहरू राख्नुभयो। उहाँहरूले बैठकमा प्रस्तुत गर्नुभएका सुझावहरूलाई अझ प्रभावकारी रूपमा कार्यान्वयन गर्न पनि बैठकमा जोड दिनुभयो। प्राप्त सुझावहरूलाई आवश्यकताको आधारमा कार्यान्वयनमा ध्यान दिनेगरी प्रधानमन्त्री तथा पार्टी अध्यक्ष केपी शर्मा ओलीले आश्वस्त पार्नुभएर बैठक सम्पन्न भयो। नारायणकाजी श्रेष्ठ प्रवक्ता नेकपा २५ चैत २०७६"
