शीर्षक,विवरण
"डाक्टरले हेर्नै मानेनन्, एम्बुलेन्समै बिरामीको मृत्यु","बुटवल : सरकारी अस्पतालले नै उपचार नगरेपछि ३६ वर्षीया कलामुन निशाले ज्यान गुमाएकी छन्। कपिलवस्तुको यशोधरा गाउँपालिका६ रंगपुरकी निशालाई ज्वरो आएपछि आइतबार कपिलवस्तु जिल्ला अस्पताल तौलिहवा लगिएको थियो। त्यहाँका स्वास्थ्यकर्मीले इमर्जेन्सीमा राखेर जाँच्नुको साटो भैरहवाको मेडिकल कलेज जान भनेका थिए। उनका ससुरा सरिफ मुसलवानले एम्बुलेन्समा राखेर बुहारीलाई मेडिकल कलेज पुर्याए। तर, त्यहाँको प्रशासनले त ज्वरोका बिरामीको उपचार नगर्ने भन्दै गेटभित्र प्रवेशसमेत दिएन। ज्वरो आएका मान्छेको उपचार हामी गर्दैनौ भनेर फर्काए, मुसलवानले भने। त्यसपछि उनीहरू जिल्ला अस्पतालमै फर्किए। प्रमुख जिल्ला अधिकारी (सीडीओ)समक्ष गुनासो गरे। सीडीओले फोन गरी उपचार गर्न निर्देशन दिएपछि डाक्टरहरू अस्पतालबाहिरैै चेकजाँच गर्न तयार भए। तर, उनीहरू बिरामी भएको एम्बुलेन्ससम्म पुग्दानपुग्दै निशाको प्राण गइसकेको थियो। आइतबार राति उनलाई निजी सवारी साधनमा राखेर अस्पताल पुर्याइएको थियो। अस्पतालले भर्ना नलिँदा बुहारीको मृत्यु भएको गुनासो मुसलवानले गरे। निशाका दुई छोरा र दुई छोरी छन्। वडाध्यक्ष श्यामनारायण उपाध्यायले अस्पतालले भर्ना नलिँदा बिरामीले उपचार नपाएको बताए। भैरहवाबाट पुनः कपिलवस्तु ल्याए पनि अस्पताल परिसरमै चिकित्सकले मृत घोषणा गरेको उनले सुनाए। अस्पतालले उपचार गरेको भए उनको मृत्यु हुँदैनथ्यो, उनले भने। निशालाई एक साताअघि पनि ज्वरो आएको थियो। तौलिहवाकै मेडिकलबाट औषधि लगेर उनले सेवन गरेकी थिइन्। मेडिकल सञ्चालकले सामान्य टाइफाइड भन्दै औषधि दिएका थिए। मुसलवानका अनुसार त्यही औषधिले ज्वरो ठीक भएको थियो। कपिलवस्तु अस्पतालका मेडिकल सुपरिटेन्डेन्ट डा किशोर बञ्जाडेले एम्बुलेन्समै बिरामीको ज्यान गएको स्वीकार गरे। मृतकलाई कसरी भर्ना गर्ने ? , उनले भने। त्यसअघि नै अस्पताल लगेको विषय भने उनले टारेका छन्। प्रमुख जिल्ला अधिकारी दीर्घनारायण पौडेलले कपिलवस्तु अस्पताल आएर भैरहवा गएको विषयमा आफूले जानकारी नपाएको बताए। पछिल्लो पटक अस्पताल आउँदा डाक्टरले रेस्पोन्स गरेका छन्, उनले भने, त्यसअघिको विषय भने मलाई जानकारी छैन। भैरहवाको युनिभर्सल मेडिकल कलेजले केही दिनअघि मात्रै बुटवलका एक बिरामीलाई उपचार नगरी फर्काएको थियो। खुट्टा भाँच्चिएर अस्पताल पुगेका उनलाई ज्वरो आएको भन्दै फिर्ता गरिएको थियो। सरकारले उपचार नगर्ने अस्पताललाई कारबाही गर्ने भने पनि बिरामी मृत्यु शृंखला निरन्तर छ। निजी अस्पताल, मेडिकल कलेज मात्र होइन, सरकारी अस्पतालले नै उपचारमा आनाकानी गरिरहेका छन्। बुटवलमा नौ दिनअघि बिरामीको उपचार नहुँदा मृत्यु भएको थियो। नौ दिनसम्म उठेन शव बुटवलको कोरोना अस्पतालमा नौ दिनअघि मृत्यु भएका बाबुराम थापाको शव अहिलेसम्म उठाइएको छैन। अस्पतालको लापरवाहीले मृत्यु भएको भन्दै थापाका आफन्तले शव नबुझेका हुन्। उनीहरूले मृत्युको कारण बताउन अस्पताल प्रशासनसँग माग गरेका छन्। लुम्बिनी प्रादेशिक अस्पताल र बुटवल उपमहानगरले बनाएको कोरोना अस्पतालले सो विषयमा जानकारी गराएको छैन। पाल्पा रिब्दिकोट घर भई रुपन्देहीको सैनामैना बस्दै आएका थापा ज्वरो आएर चैत १३ गते अस्पताल पुगेका थिए। उनको १६ गते निधन भएको थियो। तीन दिनसम्म उनको कोरोना परीक्षण नभएको र उपचारसमेत नगरिएको गुनासो परिवारले गरेको छ।"
आडम्बरी फुटबलर वाल्कर !,"लन्डन : विश्वव्यापी रूपमा कोरोना भाइरसको महामारी फैलिएको बेला इङ्ल्यान्डका फुटबल खेलाडी केली वाल्करले गजबको चर्तिकला देखाएका छन्। यतिबेला इङ्ल्यान्डको अधिकांश सहरमा सरकारले कोरोना भाइरसको संक्रमणबाट जोगिन नागरिकलाई घरबाट बाहिर निस्कन प्रतिबन्ध लगाएको छ। यस्तो बेलामा पनि 'नाइट पार्टी' को आयोजना गरेपछि इङ्लिस प्रिमियर लिग क्लब म्यानचेस्टर सिटीका डिफेन्डर वाल्करको व्यापक आलोचना भइरहेको छ। कोरोना भाइरसको संक्रमणबाट जोगिन सरकारले 'लकडाउन' को घोषणा गरेको बेला २९ वर्षीय वाल्करले साथीसँग मिलेर आफ्नै घरमा 'नाइट पार्टी' को आयोजना गरेका थिए। उक्त पार्टीका लागि वाल्कर र उनका साथीले दुई हजार दुई सय पाउन्ड खर्च गरेका थिए। 'नाइट पार्टी' मा सहभागी हुन उनीहरूले २१ वर्षीया लुइस म्याकनमारा र २४ वर्षीया ब्राजिलियन 'कल गर्ल' लाई आफ्नो घरमा बोलाएका थिए। उनीहरूलाई घरसम्म पुयाउने एक व्यक्तिले यो रहस्य खोलेका हुन्। 'नाइट पार्टी' को आयोजना गर्नुभन्दा एक दिन अगाडि वाल्करले सामाजिक सञ्जाल इन्स्टाग्राममार्फत आफ्ना समर्थकहरूलाई कोरोना भाइरसको संक्रमणबाट जोगिन कुनै पनि हालतमा घरबाट ननिस्कन सुझाव दिएका थिए। इन्स्टाग्राममा वाल्करका १७ लाख फलोअर छन्। समर्थकहरूलाई यस्तो सुझाव दिएको एक दिनपछि नै आफैंले घरमा 'नाइट पार्टी' को आयोजना गरेपछि वाल्कर विवादमा परेका हुन्। 'उनी (वाल्कर) आडम्बरी खेलाडी रहेछन्। पहिले उनी आफैंले समर्थकलाई घरबाट ननिस्कन आह्वान गरे। त्यसलगत्तै उनले लकडाउनकै अवस्थामा साथीहरूसँग मिलेर नाइट पार्टीको आयोजना गरे। उनले सर्वसाधारणलाई जोखिममा पार्ने काम गरेका छन्', अपराधशास्त्रका एक विद्यार्थी लुइसले भनेका छन्। वाल्करले 'नाइट पार्टी' मा निम्त्याएका दुई महिलामध्ये एकले आफूलाई पहिले उनीहरू फुटबल खेलाडी हुन् भन्ने बारेमा कुनै जानकारी नरहेको बताएकी छन्। एक बच्चाकी आमासमेत रहेकी ती एकल महिला हुन्। उनले 'नाइट पार्टी' पछि आफूहरूले बिहान २ बजे वाल्करको घर छाडेको बताएकी छन्। 'अघिल्लो दिन उनी लकडाउनको बेला सबैलाई घरभित्र बस्न र कोरोनाविरुद्घको अभियानमा सरकारलाई सहयोग गर्न आफ्ना समर्थकलाई आग्रह गर्छन् अनि भोलिपल्टै उनी आफ्नै घरमा महिलालाई बोलाएर नाइट पार्टीको आयोजना गर्छन् भने यो आडम्बर नभएर के हो त ? ', लुइस प्रश्न गर्छन्। वाल्कर इङ्ल्यान्डको राष्ट्रिय टोलीका सदस्य पनि हुन्। उनले इङ्ल्यान्डका लागि ४८ खेल खेलेका छन्। वाल्करले उक्त घटना सार्वजनिक भएपछि आफ्ना समर्थकहरूसँग माफी पनि मागेका छन्। 'मबाट जुन घटना भयो त्यसका लागि आफ्ना समर्थकसँग माफी माग्न चाहन्छु', उनले भनेका छन्। उनले आफ्नो परिवार, क्लब, साथीभाइ, समर्थक र सर्वसाधारणसँग पनि क्षमा याचना गरेका छन्। उनको क्लब म्यानचेस्टर सिटीले पनि उक्त घटनाको विषयमा छानबिन गरिने बताएको छ। 'हामी छानबिन अगाडि बढाउने छौं। घटना प्रमाणित भएमा वाल्कर अनुशासनको कारबाहीमा पर्नेछन्', म्यानचेस्टर सिटीद्वारा जारी विज्ञप्तिमा भनिएको छ। म्यानचेस्टर सिटीले अनुशासन उल्लंघन गर्ने कसैले पनि सजायबाट उन्मुक्ति नपाउने बताएको छ। यसैगरी स्थानीय प्रहरीले पनि लकडाउन उल्लंघन गरेको आरोपमा वाल्करमाथि छानबिन अगाडि बढाउने भएको छ।"
प्रधानमन्त्री ओलीबाट राष्ट्रका नाममा सम्बोधन (भिडियो),"काठमाडौं : प्रधानमन्त्री केपी शर्मा ओलीले मंगलबार राष्ट्रका नाममा सम्बोधन गरेका छन्। सरकारी निवास बालुवाटारबाट राष्ट्रका नाममा सम्बोधन गर्दै ओलीले कोरोना भाइरस संक्रमण फैलिन नदिन सरकार पूर्ण तयारीका साथ जुटेको बताएका छन्। प्रधानमन्त्री ओलीले कोभिड१९ कोरोना भाइरसको जोखिम रोक्न सरकारले जारी गरेको लकडाउन, नागरिकको साथ, स्वास्थ्य सेवा, उपचार र सरकारका कदमबारे चर्चा गरेका थिए। प्रधानमन्त्री ओलीले यसअघि यही चैत ७ गते पनि राष्ट्रका नाममा सम्बोधन गरेका थिए।"
नेकपा सचिवालय बैठक ४ बजे,काठमाडौं : नेपाल कम्युनिष्ट पार्टी (नेकपा)ले सचिवालय बैठक बोलाएको छ। मंगलबार अपराह्न ४:०० बजे प्रधानमन्त्री निवास बालुवाटारमा बैठक बोलाइएको हो। पार्टी प्रवक्ता नारायणकाजी श्रेष्ठका अनुसार बैठकमा कोभिड१९ कोरोना भाइरस र समसामयिक राजनीतिक परिस्थितिबारेमा छलफल हुनेछ। बन्दाबन्दी (लकडाउन) पछि पहिलो पटक नेकपाले बैठक बोलाएको हो। नेकपाभित्र अध्यक्ष पुष्पकमल दाहाल प्रचण्डलाई सचिवालय बैठक बोलाउन दबाब दिइएको थियो। दबाब पछि प्रधानमन्त्रीसमेत रहेका अर्का अध्यक्ष केपी शर्मा ओलीसँग प्रचण्डले छलफल गरेपछि मंगलबारका लागि बैठक डाकिएको हो। स्वास्थ्य सामाग्री खरिदको विवाद र त्यसपछि सेनालाई दिइएको जिम्मेवारीबारे नेकपाभित्रै विवाद छ। सो बारे पनि छलफल हुने बताइएको छ।
तलब कटाती गरेपछि खेलाडी रुष्ट,"लन्डन : इङ्लिस प्रिमियर लिगले खेलाडीको तलब कटौती गर्ने प्रस्तावप्रति खेलाडीहरूले असन्तुष्टि जनाउन थालेका छन्। प्रिमियर लिग प्रमुख र लिगका २० क्लब प्रतिनिधिबीच भएको भिडियो कन्फ्रेन्स बैठकले खेलाडीको तलबमा ३० प्रतिशत कटौती गर्ने प्रस्ताव गरेको थियो। उक्त प्रस्तावलाई खेलाडीसँगको छलफलपछि मात्रै निर्णय गरिने जनाइएको छ। तर अधिकांश क्लबका खेलाडीले यस निर्णयको आलोचना गरेका छन्। म्यानचेस्टर सिटीका खेलाडी केभिन डे ब्रुनले प्रिमियर लिगको यस प्रस्ताव हचुवाको भरमा आएको बताएका छन्। वाटफोर्डका कप्तान ट्रोय डिने र वेस्टहामका कप्तान मार्क नोब्लेले भिडियो सन्देशबाट प्रिमियर लिगको प्रस्ताव उचित नभएको धारणा राखेका थिए। अधिकांश खेलाडीले घुमाउरो तरिकाले तलब कटौती व्यावहारिक नभएको बताएका छन्। बैठकले प्रिमियर लिगले कोरोनाविरुद्ध लड्न नेसनल हेल्थ सर्भिस (एनएचएस) र गरिब परिवारका लागि २० मिलियन पाउन्ड सहयोग गर्ने निर्णय पनि गरेको थियो। यस निर्णयप्रति पनि खेलाडी रुष्ट देखिएका छन्। 'खेलाडीहरू एनएचएसलाई व्यक्तिगत रूपमा जति पनि सहयोग गर्न तयार थिए। तर क्लब मालिकले खेलाडीको पैसाबाट सहयोग गर्ने काम गरे', खेलाडीले भनेका छन्। खेलाडीले क्लब मालिकहरू राजनीतिज्ञको भनाइमा आकर्षित बनेको आरोपसमेत लगाएका छन्। हालै मात्र बेलायतका स्वास्थ्य सचिव म्याट हान्ककले प्रिमियर लिगका खेलाडीले आफ्नो तलब कटौती गरेर देशलाई सहयोग गर्नुपर्ने बताएका थिए। यसैगरी इङ्ल्यान्डका पूर्वकप्तान वायन रुनीले पनि प्रिमियर लिग क्लबले खेलाडीको तलबमा ३० प्रतिशत कटौती गर्ने विषय लज्जास्पद भएको बताएका छन्। 'प्रिमियर लिगको निर्णयले खेलाडीको अपमान भएको छ। खेलाडीमा 'विन विन' को तरिका खोजिनु पथ्र्यो। आर्थिक संकट टार्ने हो भने बढी तलब खाने र कम तलब लिने खेलाडीलाई उही नियममा बाँधिनुु हुन्न। यहाँ शक्तिको प्रयोग गर्न खोजियो,' ३४ वर्षीय रुनीले भने। रुनीले तलब कटौती गर्नेे विषय सार्वजनिक गर्नुभन्दा व्यक्तिगत छलफल गरेर निर्णय गरिनु उचित हुने पनि बताएका छन्। उनले धेरै रकम उठाएर एनएचएसलाई दिने भनिएको २० मिलियन पाउन्ड समद्रमा एक थोपा पानी हाले जस्तै भएको पनि बताए। प्रिमियर लिग बैठकले मे महिनामा लिग सुरु हुन नसक्ने भन्दै परिस्थिति सहज नबनेसम्म खेलाउन नसक्नेसमेत उल्लेख गरेको थियो। प्रिमियर लिगमा अहिले लिभरपुल उपाधि नजिक छ। लिभरपुलले २९ खेलबाट ८२ अंक बनाएको छ। लिभरपुलले अब तीन खेल जितेमा च्याम्पियन बन्नेछ। दोस्रो स्थानमा रहेको म्यानचेस्टर सिटीको २८ खेलबाट ५७ र तेस्रो स्थानमा रहेको लेस्टर सिटीको ५३ अंक छ।"
