शीर्षक,विवरण
ओलीलाई नायक बन्ने विकल्प,मुमाराम खनाल
घरबाटै जागिरमैना धिताल,"पठनपाठन पनि ॅभर्चुअल नैयति बेला रिमोट वर्कको सबैभन्दा बढी उपयोग गर्नेमा शिक्षा क्षेत्र पनि पर्छ । साउथ चाइना मर्निङ पोस्टको एउटा रिपोर्टअनुसार, चीनमा लकडाउनका बेला १८ करोडभन्दा बढी नागरिकलाई प्रत्यक्ष टीभी प्रसारणमार्फत पठनपाठन सामग्री उपलब्ध गराइयो । यस्तै, हङकङमा फेब्रुअरीमा जब कोभिड१९ फैलिन थाल्यो, अनलाइनमार्फत घरमै पढ्ने क्रम सुरु भयो । अमेरिकामा धेरैजसो कलेजले मध्य मार्चदेखि नै छात्रावासमा बस्ने विद्यार्थीलाई आआफ्ना घर जान वा कोठा खोजेर बस्न आग्रह गरे । क्याम्पसमा हुने कक्षा पूर्ण रूपमा बन्द गरियो अनि अनलाइनमार्फत पढाउन थालियो । शिक्षक र विद्यार्थी सामाजिक दूरी कायम गर्दै भर्चुअल क्लासमा सरिक भए । कतिपय सेमिनार र अन्तरक्रिया पनि अनलाइनमार्फत नै हुँदै आएका छन् । यति बेला कलेजहरूले एडोबी कनेक्ट, क्यानभास, जुम, वेबेक्स, ब्ल्याकबोर्डजस्ता माध्यमको प्रयोग गरी सिङ्क्रोनस र एसिङ्क्रोनस विधिबाट पढाइरहेका छन् । सिङ्क्रोनस विधिअन्तर्गत च्याट र भिडियो कन्फरेन्समार्फत अनलाइन र रियल टाइममा पढाइ हुन्छ । यो भर्चुअल क्लासमा विद्यार्थीले वास्तविक कक्षामा जस्तै प्रश्न सोध्न पाउँछन् भने, शिक्षकले तुरुन्तै जवाफ दिन सक्छन् । पावरप्वाइन्ट देखाएर पढाउन सक्छन् । अन्तरक्रिया वास्तविक कक्षाकोठामा झैं गर्न सकिन्छ । एसिङ्क्रोनसमा विद्यार्थी अफलाइन हुँदा पनि पठनपाठन गर्न सकिन्छ । यसमा पाठ्यसामग्री वेब, इमेल र म्यासेजबोर्डमार्फत प्रवाह हुन्छ । यसमा विद्यार्थीले आफ्नै गतिमा कोर्स पूरा गर्न सक्छन् । इन्टरनेटको उति जरुरत पर्दैन । दूर शिक्षाले गर्दा धेरै मुलुकमा पुरानो शैक्षिक प्रणालीमा देखिने गरी फेरबदल हुनेछ । विकसित मुलुकमा त यसअघि नै अनलाइन शिक्षाले प्रभाव देखाइसकेको थियो । विगतमा अनलाइन शिक्षामा खासै चासो नदिएका कलेजहरूले पनि सोचाइ बदलेका छन् । नेपालमा लकडाउनका कारण स्कुलकलेज ठप्पै छन् । पुरानै शैलीको पठनपाठन हावी भएकाले यस्तो बेला पनि प्रविधिको लाभ लिन सकिएको छैन । नेपालजस्ता मुलुकका लागि यो अभ्यास नयाँ हो । तर, असम्भव भने हैन । प्रविधिको यो दौडमा आफूलाई पछाडि छुट्न नदिन नेपालका शैक्षिक संस्थाले पनि बेलैमा यसतर्फ ध्यान दिनुपर्ने समय आइसकेको छ । चुनौती वर्क फ्रम होम का केही कमजोरी पनि छन् । कतिपयले घरमा बसेर काम गर्दा डिस्ट्र्याक्सन बढी हुने अनुभव गरेका छन् । खासगरी बालबालिका र परिवारका सदस्य सँगै बसेर काम गर्दा त्यो अवस्था आउन सक्छ । अर्कातिर, सहकर्मीहरूसँग स्वाभाविक रूपमा अन्तरक्रिया हुन नपाउने र सोसल आइसोलेसन हुने चिन्ता पनि कतिपयको छ । यस्तै, रेस्टुरेन्ट, पार्लर, प्लम्बिङ, प्रहरी, निर्माण लगायतका केही क्षेत्रमा अहिले नै पूर्ण रूपमा वर्क फ्रम होम लागू गर्न कठिन छ । तर, प्रविधिको विकाससँगै ती क्षेत्रमा पनि परिवर्तन हुने नै छ । प्रविधिको पहुँचमा हुने र नहुने वर्गबीचको खाडल पनि अर्को चुनौती हो । सहरी क्षेत्रमा इन्टरनेटको उपलब्धता र पहुँच राम्रो भए पनि अझै धेरै गाउँघरमा बिजुली र इन्टरनेट पुगेको छैन । सरकारले चाहेमा यो समस्याको हल खोज्न सक्छ । स्थानीय निकाय, टेलिकम र निजी इन्टरनेट प्रदायकहरूसँग मिलेर कम्तीमा स्कुलकलेजका लागि इन्टरनेटलगायत आधारभूत पूर्वाधार स्थापना गर्न सक्छ । रोजगारदाताले पनि हात बाँध्नुभन्दा कर्मचारीलाई घरबाट काम गर्ने वातावरण किन नमिलाउने ? यो सन्त्रास हटेपछि पनि सबै कर्मचारीलाई घरबाटै काम गर्न अनिवार्य गर्नुपर्छ भन्ने छैन । तर, चाहनेहरूलाई ऐच्छिक रूपमा यो सुविधा दिन सकिन्छ । महँगो भाडा तिरेर अफिस लिनुको साटो कर्मचारीलाई घरमै फोन, इन्टरनेट र कम्प्युटर लगायतका सामान उपलब्ध गराउनु फाइदाजनक हुन्छ । यसो गर्दा फरक क्षेत्रका, फरक समुदायका प्रतिभाहरू पनि लिन सकिन्छ । रिमोट वर्क को विकल्प भएमा संसारका जुनसुकै कुनामा रहेर पनि काम गर्न सकिनेछ । कम्तीमा अहिलेको अवस्थामा नेपालमा पनि ठूला निजी संस्थाहरूले वर्क फ्रम होम को अभ्यास थाल्न ढिलो भइसकेको छ ।"
अस्ट्रेलियाले कसरी नियन्त्रण गर्दै छ कोरोना ?,नेपालीको अवस्था अस्ट्रेलियामा करिब १ लाख २० हजार नेपाली बसोबास गरिरहेको अनुमान भए पनि अहिलेसम्म जम्मा ९ जना यस भाइरसको संक्रमण परे । जसमध्ये सिड्नीका ४ र तास्मानियाका एक गरी ५ विद्यार्थी थिए भने मेलबर्नमा ४ जना थिए । उनीहरू सबै पूर्णरूपमा स्वस्थ भएर आफ्नो दैनिकीमा फर्किसकेको अस्ट्रेलियाका लागि नेपाली राजदूत महेशराज दाहाल सुनाउँछन् । उनी दूतावासका तर्फबाट दैनिक रूपमा नेपालीका बारेमा जानकारी लिने गरिएको बताउँदै अहिलेको अवस्थामा कोही पनि नेपाली यसको संक्रमण नरहेको दाबी गर्छन् । यद्यपि यस भाइरसका कारण रोजगारी गुमाएका हजारौं नेपाली विद्यार्थी भने अहिले पनि समस्यामा छन् । उनीहरूलाई अत्यावश्यक सामग्रीहरू एनआरएनलगायत अन्य केही संस्थाले सहयोग गरिरहेका छन् ।
कोरोनापीडित गोर्खालाई सहयोग गर्न आग्रह,"लन्डन (कास) बेलायतस्थित नेपाली दूतावासले कोरोना भाइरस (कोभिड१९) बाट प्रभावित पूर्वगोर्खालाई सहयोग गर्न आग्रह गरेको छ । दूतावासले सोमबार ब्रिटिस सरकारलाई लेखेको पत्रमा नेपालीमध्ये कोरोनाका कारण भूतपूर्व गोर्खा वृद्धवृद्धा र उनीहरूका परिवार बढी प्रभावित भएको जनाउँदै यथाशक्य चाँडो आवश्यक सहयोग उपलब्ध गराउन अनुरोध गरेको हो । दूतावासले भाइरसका कारण भूतपूर्व गोर्खाहरूको मृत्युदर उच्च रहेको, उनीहरूमा भाषागत समस्या तथा अस्पताल र अत्यावश्यक सामग्रीहरूमा न्यून पहुँचजस्ता विविध समस्या रहेकोतर्फ पनि ध्यानाकर्षण गराएको छ । बेलायतमा हालसम्म कोरोना संक्रमणका कारण ३४ जना नेपालीको मृत्यु भएकामध्ये २६ जना पूर्वगोर्खा छन् ।राजदूत डा दुर्गाबहादुर सुवेदीले बेलायतको परराष्ट्र मन्त्रालय, रक्षा मन्त्रालय र गोर्खा वेलफेयर ट्रस्टका पदाधिकारीसँग कुरा गरी समस्याबारे ध्यानाकर्षण गराउनुका साथै यसमा दूतावासले आवश्यक समन्वय गर्ने प्रतिबद्धता व्यक्त गरेको उपनियोग प्रमुख शरदराज आरनले जनाए ।दूतावासले पूर्वगोर्खाका लागि नेपाली भाषामै जानकारी र परामर्श उपलब्ध गराउन तथा अस्पताल र औषधि पहुँचलाई पनि सहजीकरण गराउन बेलायत सरकारलाई आग्रह गरेको आरनले बताए । साथै, दूतावासले गोर्खा वेलफेयर ट्रस्टलाई आवश्यक खाद्यान्न व्यवस्थापन र उसबाट प्रदान हुने अन्य सहयोगमा पनि सहजीकरण गरिदिन आग्रह गरेको छ । बेलायतमा भूतपूर्व गोर्खाको संख्या करिब २० हजार रहेको अनुमान छ । यहाँ कष्टकर जीवन बाँचिरहेका अधिकांश गोर्खा समान पेन्सन पाए नेपाल नै फर्कने मनस्थितिमा रहेका गोर्खा संगठनहरूले बताउँदै आएका छन् ।"
बंगलादेशका गार्मेन्ट खुले,"ढाका (एजेन्सी) कोरोना भाइरस (कोभिड१९) का कारण बंगलादेशमा देशव्यापी लकडाउन जारी भए पनि गार्मेन्ट कारखानामा काम सुचारु गरिएको छ ।बंगलादेशी सञ्चारमाध्यमका अनुसार कारखानाका हजारौं मजदुर मंगलबार काममा फर्किएका छन् । भाइरसको संक्रमण बढ्ने क्रममा रहेकै बेला मजदुरहरू काममा फर्किएपछि समस्या थप जटिल हुन सक्ने आकलन गरिएको छ । राजधानी ढाका र चटगाउँका कारखानाहरू खोल्न सरकारले अनुमति दिएसँगै सोमबारदेखि कारखानामा काम हुन थालेको थियो । सोमबार निकै कम मात्र मजदुरले काम गरेका भए पनि मंगलबार हजारौं काममा फर्किएका जनाइएको छ । बंगलादेशमा सरकारले मे ५ सम्म देशव्यापी लकडाउन हुने घोषणा यसअघि नै गरेको थियो । तर स्थितिको समीक्षा गर्दै थप कदम चालिने सरकारी अधिकारीको भनाइ छ । बंगलादेशका गार्मेन्ट कारखाना मार्चको अन्त्यदेखि बन्द भएका थिए । तर निर्यातका लागि यसअघि नै लिइएको अर्डर पूरा गर्न कारखाना खोल्नुको विकल्प नभएको बताइएपछि सरकारले काम सुचारु गर्न अनुमति दिएको थियो । ढाका, चटगाउँ र अन्य क्षेत्रका गरी कम्तीमा हजार कारखाना खुला गरिने योजना रहेको जनाइएको छ ।बंगलादेशको कुल निर्यातको करिब ८० प्रतिशत हिस्सा तयारी पोसाकले ओगटेको छ । तर कोभिड१९ को संकट गहिरिएसँगै तयारी पोसाकको माग घटेको छ । कतिपयले आफ्ना अर्डर रद्द गरेका छन् । जसका कारण बंगलादेशले यस आर्थिक वर्षमा करिब ६ अर्ब डलरको नोक्सानी व्यहोर्नुपर्ने अवस्था आएको जनाइएको छ । गार्मेन्ट कारखानाका मजदुर मोफज्जल होसेनले कारखानामा तत्काल फर्कन आफू बाध्य भएको बताए । उनले मासिक करिब १ सय १५ अमेरिकी डलर कमाउँछन् । बंगलादेशमा कोभिड१९ का कारण मंगलबार साँझसम्म १ सय ५५ जनाले ज्यान गुमाइसकेका छन् । ६ हजार ४ सय ६२ जनामा संक्रमण देखिएको छ । स्वास्थ्य अधिकारवादीहरूले मजदुरका कारण कोभिड१९ को महामारी थप फैलिन सक्ने भन्दै चिन्ता व्यक्त गरेका छन् । बंगलादेशका गार्मेन्ट कारखानामा ४० लाखभन्दा बढीले काम गर्दछन् । बंगलादेशबाट विश्वका चर्चित एचएन्डएम, इन्डिटेक्स र वाल्मार्ट जस्ता कम्पनीका लागि गत वर्ष ३५ अर्ब डलरभन्दा बढीको तयारी पोसाक निर्यात भएको थियो । बंगलादेश तयारी पोसाक उत्पादक तथा निर्यात संघका उपाध्यक्ष मोहम्मद हातिमले कोभिड१९ लाई जीवनको एक हिस्साका रूपमा स्विकार्नुको विकल्प नभएको बताए । कारखाना तत्काल नखोले बंगलादेशमा भयावह आर्थिक संकट उत्पन्न हुने उनको दाबी छ । सरकारले गत महिन निर्यातमुखी क्षेत्रका मजदुरको तलब भुक्तानीका लागि ५८ करोड ८० लाख अमेरिकी डलर बराबरको राहत प्याकेज घोषणा गरेको थियो । तर गार्मेन्ट उद्योगीहरूले सरकारी प्याकेज अपर्याप्त रहेको गुनासो गर्दै आएका छन् । राजधानी ढाकाका सडकहरूमा लकडाउनकै बीच आइतबार सामाजिक दूरीको समेत बेवास्ता गर्दै सयौं गार्मेन्ट मजदुरले प्रदर्शन गरेका थिए । उनीहरूले लकडाउन अवधिमा आफूहरूलाई तलब तथा ज्याला दिइनुपर्ने भन्दै प्रदर्शन गरेका हुन् । आफ्ना माग पूरा नभए लकडाउन उल्लंघन गर्दै प्रदर्शन जारी राख्ने उनीहरूले चेतावनी दिएका छन् । यसअघि धार्मिक भेला र प्रदर्शनमा रोक लगाउने सरकारी घोषणा अबज्ञा भएपछि सेना परिचालन गर्नुपरेको थियो ।"
तरकारीको थोक बजारमा खुद्राको मूल्य,"ती बजारले शारीरिक दूरी पनि कायम गर्न सकेका छैनन्, भण्डारीले भने, कालीमाटीबाट बजारसम्म पुग्दा ५१० रुपैयाँ फरक परेको छ । यो स्वाभाविक हो । तर यी बजारबाट लगेर बिक्री गर्नेले सय प्रतिशत नाफा लिने गरेका छन् । यो समस्या चाँडै समाधान गर्न लागिपर्ने उनको भनाइ छ । टोलटोलमा तरकारीको माग छ । यसका लागि टोल सुधार क्लबले व्यवस्थापन गरेका छन् । टोलमा नयाँ मान्छे भित्रिन नदिने, आफैं सावधानी अपनाएर तरकारी ल्याएर बिक्री गर्ने काम भएको छ, भण्डारीले भने, हामीले समन्वय गर्ने काम गरेका छौं । सुरु गरिएका बजारमा बिहान ३ देखि ९ बजेसम्म बजार सञ्चालन गर्नेबारे जिल्ला प्रशासन कार्यालयमा जानकारी गराइएको छ । सुरुका ११ स्थानमध्ये नजिकै तरकारी बजार भएकाले बाफलमा बिक्री सुरु नगरिएको उनले जानकारी दिए । चाबहिल र वसुन्धरामा थप दुईदुई ठाउँमा बिक्री गरिएको छ । ११ मध्ये दुईवटा पार्टी प्यालेसबाट पनि तरकारी बिक्री सुरु गरिएको छ । ६ ठाउँमा कालीमाटी तरकारी तथा फलफूल बजार, चार ठाउँमा बल्खु र एक ठाउँमा गैरआवासीय नेपाली संघअन्तर्गतको कृषि सहकारीले बिक्री गर्ने जिम्मा लिएका छन् । त्यसमा दुईवटा पार्टी प्यालेसबाट तरकारी उपलब्ध गराइएको छ । मदननगर, कलंकी, स्वयम्भुचोक, वनस्थली, नवदुर्गा पार्टी प्यालेस र चाबहिलमा कालीमाटीका व्यवसायीले तरकारी बिक्री व्यवस्थापन गरिरहेका छन् । लैनचौर, अस्थायी बसपार्क रत्नपार्क, तीनकुने र कोटेश्वरमा बल्खुका व्यवसायीले व्यवस्थापन गरेका छन् । काठमाडौंका सहायक प्रमुख जिल्ला अधिकारी जीवनप्रसाद आचार्यले प्रचारप्रसारको कमीका कारण तरकारीका थोक बजारबारे सबैलाई थाहा भइनसकेको बताए । कहाँ बजार खुलेको छ भन्ने कुरा सबैलाई थाहा छैन, उनले भने, थोकबाट लगेको तरकारी खुद्रामा पुग्दा महँगोमा बिक्री भएको कुरा आएको छ, यसबारे अनुगमन गर्ने काम महानगरपालिकामार्फत नै भइरहेको छ ।"
