शीर्षक,विवरण
कर वृद्धिविरुद्ध ज्ञापनपत्र,"पत्रकारहरूमाथि महानगरका कर्मचारी र अध्यक्षले गरेको व्यवहारको नेपाल पत्रकार महासंघ चितवन शाखा, नेपाल प्रेस युनियन लगायतले विरोध गरेका छन् । सार्वजनिक चासोका विषयमा सार्वजनिक रुपमा सुचना लिन पुग्दा पत्रकारमाथि दुब्र्यबहार हुनु र समाचार संकलनमा रोक लगाइनु प्रेस स्वतन्त्रताको उल्लंघन हो पत्रकार महासंघ चितवनले जारी गरेको विज्ञप्तीमा उल्लेख छ ।"
क्षमताभन्दा तेब्बर कैदीबन्दी,वर्षाता बेला पालैपालो सुत्नुपर्ने बाध्यता रहेको उनीहरूले बताए । कारागार ८ वर्षअघि विदुर नगरपालिका २ पुरानो सदरमुकाम नुवाकोट डाँडाबाट तल सरेको हो । उक्त पुरानो कारागार काठमाडौ डिल्लीबजारको जस्तै भए पनि कैदीबन्दी क्षमता बढेपछि नयाँ भवन बनाएर विदुर नगरपालिका १ मा सारिएको हो । नेपाल एकीकरणपछि राजा पृथ्वीनारायण शाहले १८१७१९ सालमा नुवाकोटको दरबार बनाएपछि जघन्य अपराधीलाई आफ्नै दरबारको छैटांै तल्लामा राख्ने गरेका थिए । पछि मात्र कैदीबन्दीलाई छुट्टै भवनमा सारिएको विदुर २ भुटोलका अनुपराजसिंह खड्काले बताए ।
३५ महिनादेखि भूकम्पपीडित टहरामै,"रकम वितरणका लागि प्रयास जारी रहेको वडा कार्यालयले जनाएको छ । वडाध्यक्ष नरहरि पाण्डेले करिब ६ पटक जिल्ला समन्वय समिति र राष्ट्रिय पुनर्निर्माण प्राधिरकण जिल्ला समन्वय समितिलाई निवेदन दिएको बताए । अरूले किस्ता लिई घर बनाइसके, पाण्डेले भने, मोहियानी हक लालपुर्जा राखेर लाभग्राहीमा संलग्न गराई दिनुुस् भन्दा कुनै निकायले स्पष्ट जवाफ दिएनन् । जिल्लामा ६५ हजार २ सय ५९ भूकम्पपीडित छन् । तीमध्ये ४१ हजार धुरीले जग हाली दोस्रो किस्ता लिएका छन् । तेस्रो किस्ता लिने ६ हजार पुगेको सचिवालयका निमित्त प्रमुख वेदप्रसाद गौडेलले बताए ।"
तीन दशकको दौडधुपपछि नयाँ विद्यालय भवन,समुदायमा हस्तान्तरण भएपछि अभिभावकहरूले भवनका सुरक्षित र व्यवस्थित कोठाहरू निरीक्षण गरेका थिए । स्थानीय अगुवा तथा अभिभावक नेत्रबहादुर बस्नेतले सुन्दर र व्यवस्थित कक्षा कोठाहरू पाएपछि विद्यार्थी संख्या बढ्ने बताए । अभिभावकको मागअनुसार कम्प्युटर सामग्री र गुणस्तरी शिक्षाका लागि जनशक्ति सघाउनेबारे छलफल भइरहेको डनबस्को सोसाइटीका कुलिगल अगस्टीले बताए ।
प्रदर्शनकारीमाथि दमन,यस्तै गरेर पूर्वाधार विकासका क्रममा स्थानीयका घरजग्गामा क्षति पुग्ने र आफूहरू विस्थापित हुने भन्दै न्यायोचित विकास गर्न प्रदर्शनको कार्यक्रम राखेका थिए । पीडित र प्रभावितसँग मञ्जुरी नलिइकन सडक विकास र विकासको नाममा नागरिकलाई दीर्घकालीन प्रभाव पार्ने कुनै काम गर्न नपाइने उनीहरूको भनाइ छ ।
डाउन सिन्ड्रोम प्रभावित आत्मनिर्भरतातर्फ,"विश्व स्वास्थ्य संगठनका अनुसार विश्वभर आठ सयमध्ये एक जनामा डाउन सिन्ड्रोम देखिन्छ । संगठनका अनुसार जन्मजात विभिन्न खाले अपांगता लिएर जन्मने ४५ हजार शिशुमध्ये १५ सयमा यस्तो समस्या देखिने गरेको छ । नेपालमा भने डाउन सिन्ड्रोमबारे यकिन तथ्यांक छैन । वैज्ञानिक अध्ययनअनुसार केही हदसम्म यो वंशाणुगत समस्या हो भने, ३५ वर्षभन्दा माथि उमेरका व्यक्तिबाट जन्मने शिशुमा डाउन सिन्ड्रोम हुने सम्भावना उच्च हुन्छ । समयमै पहिचान गरेर उपचार थाल्ने हो भने उनीहरूको सुधार हुने र गुणस्तरीय जीवनयापन गराउन सकिन्छ ।"
६० वर्षअघिको काठमाडौं भक्तपुरमा,सन् ५० को दशकमा हागनले कैद गरेका थुप्रै संरचनाहरू आधुनिकतासँगै मासिइसकेका छन् । हागनकी छोरी डा क्याट्रिनले ६० वर्षअघिको नेपाल र अहिलेको नेपालमा धेरै फरक भएको बताउँदै बाँकी रहेको संरचनालाई जगेर्ना गर्न सुझाव दिएकी छन् ।
विवाद गर्दै मेयर र उपमेयर,माघ ५ पछि कार्यपालिकाको बैठकसमेत नबसेको उनी बताउँछन् । उपमेयर मधिकर्मीको आरोप खण्डन गर्दै मेयर श्रेष्ठले भने बैठक राखेर स्थापना दिवस मनाउने तयारीबारे छलफल गर्दा उनीहरू नआएको बताएका छन् । स्थापना दिवस अवसरमा आयोजित कार्यक्रममा उनले नगरलाई प्लास्टिकको झोला उत्पादन र प्रयोग निषेध क्षेत्र बनाउन नगरपालिकाले पहल गर्ने प्रतिबद्धता व्यक्त गरे ।
पीठ निर्माण गर्न सहयोग जुट्दै,तान्त्रिक बन्धुदत्त आचाजुले तान्त्रिक विधिले आराधना गरेर कलश स्थापना गरेको बुङमतीविद् तुलाधरको भनाइ छ । वैशाखको मातृऔंसी पारुको दिनमा रातो मत्स्येन्द्रनाथको रथारोहण गर्न कटुवाल दहमा देवता लिन जाने प्रचलन छ । भदौमा पनि दिलाद्योको नाममा रातो मत्स्येन्द्रनाथ दहमा लिन जार्ने परम्परा यथावत् छ । कटुवाल दह ललितपुर महानगर पालिकाबाट १५ किमि दक्षिणपश्चिम दुर्गम पहाडी भेगमा पर्छ ।
थ्रीस्टार सेमिफाइनलमा,बिहीबार नेपाल पुलिस र मनाङ मस्र्याङ्दीबीच अन्तिम क्वाटरफाइनलमा प्रतिस्पर्धा हुनेछ ।
गोल्डेनगेट र आर्मी भिड्ने,"प्ले फर डिप्राइभ्ड चिल्ड्रेन नेपालको आयोजनामा जारी प्रतियोगिताको फाइनल र तेस्रो स्थानको खेल शनिबार हुनेछ । दशरथ रंगशालामा हुने फाइनल विजेताले २ लाख रुपैयाँ जित्नेछ । उपविजेताले १ लाख र तेस्रोले ५० हजारमा चित्त बुझाउने छन् । उत्कृष्ट खेलाडी, सर्वाधिक स्कोरर, डिफेन्स, उदीयमान खेलाडी र प्रशिक्षकले १०१० हजारबराबरको उपहार प्राप्त गर्नेछन् ।"
विराजको कोसेढुंगा,"आगामी दिनमा पनि बिराज यसलाई निरन्तरता दिने सुरमा छन् । जतिसम्म मेरो तनमनले साथ दिन्छ, त्यसबेलासम्म म निरन्तर राष्ट्रको सेवामा समर्पित छु । म अझै पनि खेल्न सक्ने क्षमता राख्छु र राष्ट्रिय टोलीको सफलतामा योगदान दिन सकेसम्म मैदानमा डटिरहने छु, उनले टुंग्याए ।"
बढ्यो सन्दीपको व्यस्तता,"सन्दीपले भने आईपीएल र आफूले पाएको अवसरबारे खासै प्रतिक्रिया जनाएनन् । यसलाई सामान्य रूपमा लिएको छु, कुनै दबाब छैन, उनले भने । दिल्ली डेयरडेभिल्सले किंग्स इलेभन पन्जाबविरुद्ध उसैको गृहमैदान मोहालीमा ८ अप्रिलमा खेल्नेछ । दिल्ली अप्रिल ६ मा मोहाली जाने कार्यक्रम छ ।"
झापा फाइनलमा,म्यान अफ द म्याच झापाका विकास थुलुङ भए । उनलाई समाजसेवी चन्द्रबहादुर तामाङले ५ हजार रुपैयाँ प्रदान गरे । बिहीबार गोर्खा ब्वाइज रूपन्देही र संकटा क्लबबीच प्रतिस्पर्धा हुनेछ । विजेताले चैत १७ मा झापासँग ५ लाखसहित उपाधिका लागि प्रतिस्पर्धा गर्नेछ ।
अर्जेन्टिना र जर्मनी पराजित,अर्को खेलमा इंग्ल्यान्ड र इटाली ११ को बराबरीमा रोकिए । जेमी भार्डीले २६ औं मिनेटमा घरेलु टोलीलाई अग्रता दिलाए । तीन मिनेट बाँकी रहँदा इटालीले पेनाल्टी पायो । लोरेन्जो इन्सिन्याले पेनाल्टी सदुपयोग गर्दै खेल बराबरीमा ल्याए । अन्य खेलमा बेल्जियमले साउदी अरेबियालाई ४० ले र फ्रान्सले रसियालाई ३१ ले हराए । अस्ट्रेलिया र कोलम्बियाबीचको खेल गोलरहित बराबरीमा टुंगियो ।
सुदूरपश्चिम उपाधि नजिक,मुम्बईको स्काई क्रेस्ट ब्वाइजलाई हराएर ब्वाइज युनियन सेमिफाइनल पुगेको थियो । सुदूरपश्चिमले जावलाखेल युथ क्लबलाई रोकेको थियो ।सुदूरपश्चिमका विनोद केसी म्यान अफ द म्याच घोषित भए । बिहीबार दोस्रो सेमिफाइनलमा त्रिभुवन आर्मी र सरस्वती युवा क्लबको प्रतिस्पर्धा हुनेछ ।
एकवर्षे प्रतिबन्धमा स्मिथ र वार्नर,आईपीएलका अध्यक्ष राजीव शुक्लाले बुधबार दुवै खेलाडीले आईपीएल नखेल्ने स्पष्ट पारेका छन् । आईसीसीले नियमअनुसार स्मिथलाई एक खेल प्रतिबन्ध तथा शतप्रतिशत जरिवाना लगाएको थियो । वार्नर भने आईसीसीको कारबाहीमा परेनन् ।
स्तर सुधार्ने मौका,"सामुदायिक विद्यालयले लगानीको प्रतिफल प्राप्त गर्न सकेको छैन । निजी विद्यालयमा अभिभावकले लगानीअनुसार जुन प्रतिफल पाइरहेका छन्, सामुदायिकले पनि निजीको सफल अभ्यासलाई पछ्याउन हिचकिचाउनु हँुदैन । निजी विद्यालयमा शिक्षक र लगानीकर्ताले जसरी मिहिनेत गर्छन्, सामुदायिक विद्यालयमा पनि लगानीको अनुभूति हुने गरी व्यवस्थापन समितिको भूमिका आवश्यक छ । यसमा स्थानीय तहको भूमिका अहम् हुन्छ । विद्यालय शिक्षामा अतिरिक्त (ऐच्छिक) विषयलाई अनिवार्य बनाउनु जरुरी छ । परीक्षामुखीभन्दा पनि परिणाममुखी शिक्षा बनाउन जोड दिनुपर्छ । निजी विद्यालयलाई यसअघिका केन्द्रीय सरकारले जसरी छाडा छाडेका थिए अब नियमन गर्दै उसको लगानी पनि सुरक्षित गर्ने नीति अवलम्बन गर्न जरुरी छ ।"
प्रिस्कुल किन ?,"शिक्षाविद् मनप्रसाद वाग्ले व्यावसायिक मुनाफाका लागि बाल विकास केन्द्र खोल्ने र सञ्चालन गर्ने प्रचलन बढ्दै गएको बताउँछन् । उनका अनुसार विशेषगरी निजी विद्यालयमा शारीरिक र मानसिक रूपमा परिपक्क नभएका बालबालिकालाई जबरजस्ती पढाइलेखाइ सिकाउने गरिएको छ । उमेरै नपुगेका बालबालिकालाई जबरजस्ती पढाउन खोजेर अन्याय गरिएको छ, उनले भने, सुरुमै इच्छाविपरीत गरे उत्तर बाल्यावस्थामा उनीहरूको सिकाइ कमजोर हुँदै जान्छ । सामुदायिक र संस्थागत प्रिस्कुलमा पढाउने शिक्षक योग्य नभएका समेत उनले बताए । बालमनोविज्ञान बुझ्ने शिक्षकले सहजीकरण गर्नुपर्नेमा कम पढेका शिक्षकलाई सहजकर्ता राखिएको छ, उनले भने । निजी विद्यालयले सञ्चालन गरेका यस्ता स्कुलहरू निम्नवर्गीय परिवारका बालबच्चाका लागि निकै महँगो छ । मासिक चर्को शुल्क उठाउने गरिएको अभिभावकले बताए । अभिभावकलाई बच्चाले अंग्रेजी जान्यो भनेर देखाउन, बालकक्षामा शिक्षक लठ्ठी लिएर जान्छन, प्रिस्कुलहरू सरकारको नीति, निर्देशिका नियमबिनै चलेका छन्, वाग्लेले भने ।"
प्रतिस्पर्धामा सामुदायिक,"काठमाडौंकै बौद्ध महांकालस्थित जनकल्याण मावि एक्काइसौं शताब्दीअनुकूल अब्बल सामुदायिक विद्यालय बनाउन प्रयास जारी राखेको प्रधानाध्यापक कुमारीकमला राई बताउँछिन् । आईसीटीको माध्यमबाट कक्षा सञ्चालन, मन्टेसोरीमा आधारित खेलकुदका सामग्रीसहित शिशु र केजी, बालमैत्री कक्षा व्यवस्थापन, आधुनिक फर्निचर निर्माण, सुविधायुक्त पुस्तकालय र कम्प्युटर ल्याबको व्यवस्थामा जोड दिइएको छ । कक्षा १ देखि ८ सम्म अंग्रेजी माध्यमबाट पढाइ, आधुनिक विज्ञान प्रयोगशाला, ड्रिल तथा पिटी, स्काउटको व्यवस्थालाई महत्त्व दिइएको छ ।शिक्षाविद् प्राध्यापक विद्यानाथ कोइराला विद्यालय शिक्षा अब नयाँ आयामबाट अघि बढेको छ । हरेक स्थानीय निकायले योजनाका खाका निर्माण गरेर विद्यालय शिक्षा सुधारमा लागिपरेका छन् । सातै प्रदेशका प्रदेश र स्थानीय जनप्रतिनिधिसहित शैक्षिक सुधारमा विषयमा बहस भएको छ । स्थानीय सरकारका मान्छे तातेका छन् तर उसको अधिकार सुनिश्चित हुन सकेको छैन ।"
कसरी सुधार्ने शिक्षाको स्तर ?,"शिक्षाको गुणस्तर सुधार्न गर्न लब्धांकपत्रभन्दा माथि मानिसको सीप र व्यवहारसँग शिक्षालाई जोड्न आवश्यक छ । शिक्षालाई नीतिनियमले संरक्षण गर्ने, यथार्थपरक, विद्यार्थीमुखी हुनुपर्छ । गुणस्तरमा सम्झौता नगरी शिक्षकलाई आवश्यक शैक्षिक तालिम र सुविधा प्रदान गर्नुपर्छ । विद्यालयको भौतिक पूर्वाधारसम्पन्न हुनुपर्छ । विद्यालयलाई शान्ति क्षेत्र घोषणा गरिएकाले कुनै पनि पक्षले कुनै बहाना बनाएर पठनपाठन बाधा अड्चन गर्न हुन्न र गर्नेलाई कडा कारबाही हुनुपर्छ । शिक्षकले विद्यार्थीलाई पाठ्यक्रमअनुसार ज्ञान, सीप दिनुपर्छ, जसले विद्यार्थीको जीविकोपार्जनमा मद्दत गरोस् । विश्वमा प्रचलनमा आएका नयाँ प्रविधिबारे विद्यार्थीलाई ज्ञान प्रदान गरिनुपर्छ । विश्वसँग प्रतिस्पर्धा गर्न सक्षम बनाउँछ । साथै शिक्षा संस्कारयुक्त हुनुपर्छ, जसले आफ्नो देशको माटोलाई माया गर्ने प्रेरणा दिन्छ ।प्रस्तुति : लीला श्रेष्ठ"
