शीर्षक,विवरण
असारसम्ममा सबै स्थानीय तहमा बैंक,स्थानीय निकायमा अस्वस्थ्य प्रतिस्पर्धा नहोस् भन्ने उद्देश्यले पहिलो शाखा खुलेपछि ३ वर्षसम्म अर्को बैंकले शाखा खोल्न नपाउने व्यवस्था गरिएको राष्ट्र बैंकले गरेको छ ।
निक्षेपको वृद्धिदर घटयो,"करिब साढे २ वर्षअघि राष्ट्र बैंकले चुक्ता पुँजी वृद्धिको निर्देशन दिएपछि बैंक तथा वित्तीय संस्थाहरू कर्जा विस्तारको दबाबमा छन् । यसकारण आक्रमक रूपमा कर्जा विस्तार भएको छ । तर, कर्जाको वृद्धिअनुसार निक्षेप बढ्न नसकेपछि वित्तीय असन्तुलन डरलाग्दो बनेको थियो । तर, पछिल्ला साताहरूमा उक्त अवस्थामा बिस्तारै सुधार हुँदै गएको विज्ञहरू बताउँछन् ।"
अर्थतन्त्र जटिल अवस्थामा,"उनले पर्यटन, कृषि र उत्पादनमूलक उद्योगको विकासतर्फ केन्द्रित रहने बताए । कर्णाली प्रदेशले २०७५ लाई पर्यटन वर्ष घोषणा गरेको छ । त्यहाँको पहिलो पर्यटक बन्न चैत २९ गते रारा जाँदै छु, उनले भने, त्यहाँबाट पर्यटन उद्योगको विकासका बिगुल फुक्छु ।"
विमानस्थलले ४० करोड बक्यौता उठाउन सकेन,"एयर एसियाले त्रिभुवन अन्तर्राष्ट्रिय विमानस्थललाई कम्तीमा २७ करोड रुपैयाँ बराबरको बक्यौता तिर्न बाँकी छ । यो रकम उक्त एयरलाइन्सले अवतरण (ल्यान्डिङ), पार्किङ (बिसौनी), एयर नेभिगेसन (सञ्चार तथा उड्डयन सहायक सेवा), विमानस्थल विकास शुल्क, कोठा भाडालगायत सेवा लिएबापतको बुझाउनुपर्ने बक्यौता हो । यो रकममा १३ करोड रुपैयाँ विलम्ब शुल्कसमेत छ । यी दुवै शीर्षकको कुल हिसाब ४० करोड रुपैयाँ नाघ्छ । एयर एसियाका सीईओ बेन्यामिन स्मेइलको इमेलपछि दुईजना अधिकारी मलेसियाबाट काठमाडौं आएका थिए । उनीहरूले आफ्नो मुलुकबाट लेखा अधिकृत पठाई एक साताभित्रै बक्यौता रकमको हिसाब पुन मिलान गर्ने भनेका थिए ।"
भारतबाट आयात गर्ने बिजुली महँगिने,"प्राधिकरणले व्यापारिक सम्झौता, विद्युत् आदानप्रदान सम्झौता (पावर एक्सेन्ज) र महाकाली सन्धिअन्तर्गतको बिजुली भारतबाट ल्याइरहेको छ । व्यापारिक सम्झौताअनुसार ढल्केबरमुजफ्फरपुर क्रसबोर्डर प्रसारण लाइनमार्फत र अन्य स्थानबाट पावर एक्सेन्जअन्तर्गत भारतबाट बिजुली ल्याइरहेको छ । दुई मुलुकबीचको पावर एक्सचेन्च कमिटी (पीईसी) ले तय गरेको मूल्यका आधारमा प्राधिकरणले बिहार, उत्तरप्रदेश र उत्तराखण्डबाट विद्युत् आयात गर्छ ।"
जनता आवास कार्यक्रम अलपत्र,विभागका अनुसार कार्यक्रम घोषणा भएदेखि हालसम्म १२ हजार ५ सयभन्दा बढी जनता आवास इकाई बनेका छन् । सबै घर बनाउन १२ अर्ब रुपैयाँ लागत लाग्नेछ । सरकारले उक्त कार्यक्रमका लागि चालु आवमा २ अर्बभन्दा बढी निकासा गरेको छ । गत आवमा मात्रा १ अर्ब ८१ करोड रुपैयाँ जनता आवास बनाउन रकम विनियोजन गरेको थियो । यी दुवै आवमा घोषणा गरेका आवास बनाउन २१ हजारमध्ये बाँकी र चालु आवका २५ हजार घर निर्माण गर्नुपर्ने बाध्यता रहेको महानिर्देशक शर्माले बताए ।
प्रदूषणले तरकारी उत्पादनमा कमी,"इँटा उद्योगले घटायो तरकारीको परिमाणतरकारी फल्ने जग्गामा इँटा उद्योग सञ्चालनमा आएपछि काठमाडौं र पोखराकालगायतका सहरहरूमा जाने तरकारीको परिमाण पनि घटेको छ । अघिल्लो वर्षहरूमा दैनिक ४० खेपसम्म तरकारी काठमाडौंका बजारमा जान्थ्यो, अहिले १० खेप पनि पुग्न मुस्किल छ, धार्केस्थित तरकारी संकलन केन्द्रका बाबुकृष्ण गजुरेल भने । किसानले धान मकैको सट्टा हरेक वर्ष एउटै जग्गामा फरकफरक किसिमका तरकारी खेती गर्दै आएका थिए । इँटा उद्योगहरूकै कारण जिल्ला कृषि विकास कार्यालय, जिल्ला विकास समिति, तत्कालीन गाविसहरूले सञ्चालनमा ल्याएका साना सिँचाइ योजनाहरू लथालिंग भएका छन् । सिँचाइ योजनाको पानी पनि किसानहरूको साटो इँटा उद्योगहरूले नै माटो मुछ्ने कार्यमा प्रयोग गरेका छन् । स्थानीय किसान कान्छी कँडेलले भनिन्, अहिले वर्षमा २० हजारमा चित्त बुझाउनुपरेको छ, त्यही पनि धूवाँधूलाले बिरामी पर्दा औषधि गर्न पनि पुग्दैन । त्यस क्षेत्रमा विशेषगरी काउली, बन्दा, गोलभेडा, खुर्सानीलगायत नगदे तरकारी बाली खेती हुँदै आएको थियो ।"
बृज सिमेन्टको शिक्षा स्वास्थ्यमा सहयोग,यस कार्यका लागि बृज सिमेन्ट एवं पुष्पतारा केडिया फाउन्डेसनबाट ५ लाख रुपैयाँको सहयोग गरिएको र ३ वर्षसम्म निरन्तर रहने विज्ञप्तिमा छ ।
जगदम्बामा भीआरएम प्रविधि,यो प्रविधिपश्चात् कम्पनीको उत्पादन प्रतिदिन ८० हजार बोरा हुने जनाइएको छ ।
चिउरी बन्यो आम्दानीको स्रोत,"बलिथुम क्षेत्रमा जीविकोपार्जन तथा संरक्षण कार्यक्रम सञ्चालन गरिरहेको बीसीएनका वरिष्ठ कार्यक्रम अधिकृत मित्र पाण्डेले चिउरी आम्दानीको राम्रो स्रोत बन्न सक्ने अहिलेसम्मको सिकाइले पुष्टि गरेको बताए । स्थानीयको लगाव अत्यधिक देखिएकाले चिउरी आम्दानीको स्रोत बन्नेमा हामी ढुक्क छौं, पाण्डेले भने ।"
नाम चलेका क्याम्पसका परीक्षा अमर्यादित,"परीक्षा मर्यादित बनाउन बाहिरबाट पर्यवेक्षक खटाए पनि प्रभावकारी हुन नसकेको सिंहले बताए । प्रदेश २ का त्रिविका चार आंगिक क्याम्पसको परीक्षाको अवस्था बिग्रेको पाइएको छ, उनले भने, चारवटै क्याम्पसमा पढाइ नहुने र परीक्षामा चोरी हुने समस्या देखिएको छ ।"
म्यान्मारको नयाँ राष्ट्रपतिमा विन मिन,गत साता राष्ट्रपति टिन च्वले स्वास्थ्यको कारण देखाउँदै राजीनामा दिएपछि नयाँ राष्ट्रपति छान्न बुधबार निर्वाचन भएको हो । निर्वाचनमा तीन उपराष्ट्रपतिहरू प्रतिस्पर्धामा थिए । संसद्को ६ सय ३६ मतमध्ये मिनले ४ सय ३ मत प्राप्त गरेका थिए भने सेना समर्थित उम्मेदवार मिन स्वेले २ सय ११ मत पाएका थिए । नवनिर्वाचित राष्ट्रपति मिन २०१२ देखि म्यान्मारको तल्लो संसद्का सभामुख थिए ।
श्रीलंकामा प्रधानमन्त्रीको अधिकार कटौती,केन्द्रीय बैंकको नियन्त्रण प्रधानमन्त्रीबाट किन खोसियो भन्नेबारेमा सरकारले कुनै पनि औपचारिक जानकारी दिएको छैन । सन् २०१५ मा प्रधानमन्त्री विक्रमासिंघले केन्द्रीय बैंकमा नियुक्त गरेका गभर्नर अर्जुन महेन्द्रन अनियमिततामा मुछिएका थिए । यसै विषयमा छानबिन गर्न राष्ट्रपतिले गठन गरेको विशेष समितिले विक्रमासिंघलाई सफाइ दिए पनि महेन्द्रनले आफ्ना ज्वाइँलाई संवेदनशील सूचना चुहाएकोमा दोषी ठहर गरिएका थिए ।
परमाणु नि:शस्त्रीकरण गर्ने किमको प्रतिबद्धता,"उनले भनेका छन्, किमले आफ्ना जनता र मानवताका लागि सही कार्य गर्नेछन् । ट्रम्पले पनि उत्तर कोरियासँग वार्ता गर्नुअघि चीन र जापानसँग पनि छलफल गर्ने बताएका थिए । आगामी वार्ताहरूमा बेइजिङको भूमिकाको खोजी भइरहेका बेला चीनको निम्तोमा किमको भ्रमण भएको हो । यसैगरी दक्षिण कोरियाले पनि किमको चीन भ्रमणको स्वागत गरेको छ ।"
अमेरिका र मेक्सिकोबीच सुरक्षासम्बन्धी सम्झौता हुने,मेक्सिकोका राष्ट्रपति नियटोले अमेरिकामा आफ्ना नागरिकको सुरक्षाका विषयमा चासो राखेका थिए । दुई देशबीच सीमाको विषयलाई लिएर धेरै समस्या हुने गरेको छ । अमेरिकाले आफ्नो देशमा हुने आतंकवादी क्रियाकलापका लागि मेक्सिकोको सीमा क्षेत्रबाट घूसपैठ हुने गरेको आरोप लगाउने गरेको छ । तर मेक्सिकोले भने त्यसको विरोध गर्ने गरेको छ । सोही कारण पनि अमेरिकी राष्ट्रपति डोनाल्ड ट्रम्पले निर्वाचन अभियानका क्रममा मेक्सिकोतर्फ पर्खाल लगाउने बताएका थिए ।
सडक दुर्घटनामा ४ सय २८ को मृत्यु,"विभागले सार्वजनिक गरेको वार्षिक प्रतिवेदनअनुसार मृत्यु भएका ४ सय २८ जनामध्ये १ सय ७७ जना कुवेती नागरिक रहेका छन् । त्यसैगरी २१ जना बेडोइन्स्, १६ जना गल्फ कर्पोरेसन काउन्सिल र अरू २१४ जना अन्य विभिन्न देशका नागरिक रहेको विभागले जनाएको छ । सबैभन्दा धेरै दुर्घटना हवालीमा भएको छ । त्यहाँ १९ हजार ६ सय ९७ वटा दुर्घटना भएका छन् । त्यसैगरी राजधानीमा १७ हजार ८ सय ५१ दुर्घटना भएको विभागले जनाएको छ । सडक दुर्घटनाको मुख्य कारण ट्राफिक नियमको उल्लंघन नै भएको विभागले जनाएको छ । रातो बत्तीको संकेतको बेवास्ता गर्ने, अत्यधिक गतिमा सवारी साधन चलाउने, हेलचेक्रयाइँ र मोबाइल फोनको प्रयोग लगायतका कमजोरी बढी देखिएको पाइएको छ ।"
कंगोमा १० मारिए,कंगो (सिन्हवा) कंगोमा विद्रोही समूह एलिड डेमोक्रयाटिक फोर्स (एडीएफ) को आक्रमणमा परी १० जनाको मृत्यु भएको छ । देशको उत्तर किभु प्रान्तमा पर्ने बेनी भन्ने ठाउँमा मंगलबार राति भएको आक्रमणमा परी उनीहरूको मृत्यु भएको अधिकारीहरूले बताएका छन् । आक्रमणमा परी मारिएका सबै जना निर्दोष आमनागरिक भएको सरकारी सेनाका प्रवक्ताले बताए । सेनाले सुरक्षा कारबाही सुरु गरेको केही घण्टापछि आक्रमणकारीहरू त्यहाँबाट भागेका थिए ।
गुटाबाट १ लाख २८ हजार विस्थापित,दमासकस (सिन्हवा) सिरियाको विद्रोही नियन्त्रित गुटाबाट एक लाख २८ हजार जना विस्थापित भएका छन् । सुरक्षाकर्मीहरूले विद्रोहीविरुद्ध कारबाही पनि जारी राखेका छन् । पछिल्लो विवरणअनुसार मंगलबार मात्रै झन्डै ५ सय सर्वसाधारण विस्थापित भएका छन् । उनीहरू गुटाबाट भागेर सरकारको नियन्त्रणमा रहेको वाफिडिन क्षेत्रमा पुगेका हुन् । वाफिडिन क्षेत्र राजधानी दमास्कसदेखि उत्तरपूर्वी क्षेत्रमा पर्छ ।
मनोजको ट्रम्प सफलता,"अहिले मनोजलाई ट्रम्प बन्न आग्रह गर्ने धेरै भइसके । उनी चाँडै कतार र जापानमा ट्रम्प बनेर पुग्दै छन् । अरबका शेखदेखि चिनियाँहरूको भेषमा दर्शक हसाइसकेका उनी अझै माथि उठ्न चाहन्छन् । ट्रम्प बन्नु त्यही चाहनाको एउटा परिणाम थियो, उनले भने, अन्तर्राष्ट्रिय दर्शकलाई छुने खालका वा बृहत् विषयका थप काम गर्ने रहर छ ।"
यस्ता पनि बानी,अमेरिकी गायिका जेसिका सिम्पसन दाँत माझ्न झर्को मान्छिन् । माउथ फ्रेसनरले काम चलाए पनि उनी नजिक आउँदा दुर्गन्ध फैलिन्छ । अभिनेता जोनी डेप एउटै लुगामा घुमिरहन्छन् । उनलाई लुगा फेर्ने बानी छैन । गायिका क्रिस्टिना एगुलेरा शौचपछि हात धुन्नन् । उनको स्वरको प्रशंसा गर्नेहरू पनि हातदेखि घिनाउँछन् ।एजेन्सी
लाल मस्तिष्क जाजरकोटमा,"नायिका रेखा थापाको मुख्य भूमिका रहने फिल्ममा जाजरकोटकै १५ वर्षीया किशोरी कमला ओली पनि रहनेछिन् । छोरीको निम्ति स्वर्णिम नेपाल महाअभियान की अभियन्ता रेखा थापा र वरिष्ठ जीवन प्रशिक्षक नरबहादुर कार्कीले फिल्मको कथा लेखेका र निर्माण गर्न लागेका हुन् । आगामी कात्तिक २१ गते प्रदर्शनको लक्ष्य गरिएको फिल्मको निर्देशन सम्झना उप्रेती रौनियारले गर्नेछिन् । संगीत सुरेश अधिकारी, छायांकन रामशरण उप्रेती, द्वन्द्व निर्देशन राजकुमार उप्रेतीले गर्नेछन् ।"
सुनकोसी र इन्द्रावतीमा चरम दोहन,"इन्द्रावती क्षेत्रमा एक दर्जन क्रसरले ५० भन्दा बढी एक्जाभेटरमार्फत नदीको धार नै बिगारेर उत्खनन् गरिरहेका छन् । मेलम्ची नगरपालिकाले सूर्योदयदेखि नअस्ताएसम्म एउटा एक्जाभेटरको अधिकार दिएपछि झनै उत्खनन् बढदो छ । क्रसरले नगरको नियमलाई सहारा बनाएर मापदण्डको धज्जी उडाएका छन्, एक स्थानीयले भने, प्रहरी र प्रशासनलाई मूकदर्शक बनाएर उनीहरूको कार्य भइरहेको छ ।"
विषयगत समितिमा सर्वसम्मत नेतृत्व,"कांग्रेस प्रमुख सचेतकमा घलेनेपाली कांग्रेस प्रदेश ३ संसदीय दलको प्रमुख सचेतकमा राधा घले चयन भएकी छन् । हेटौंडास्थित पार्टी कार्यालयमा बसेको दलको बैठकले सचेतकमा छिरिङ दोर्जे लामा, सदस्यसचिवमा निमा लामा तथा अनुशासन समितिको संयोजकमा बिजुला बर्मालाई चयन गरेको हो । बैठकले प्रदेशसभाका ५ विषयगत समितिमध्ये सार्वजनिक लेखा समितिको सभापतिमा न्हुच्छेनारायण श्रेष्ठलाई उठाउने निर्णय गर्दै अरूमा दाबी नगर्ने निर्णय गरेको सदस्यसचिव निमा लामाले जानकारी दिए । बैठकले यूएस बंगला एयरलाइन्सको विमान दुर्घटनामा २२ नेपाली सहित ४९ जनाको मृत्यु भएकोमा दु:ख व्यक्त गर्दै घाईतेको उपचार र मृतकलाई तत्काल क्षतिपूर्ति उपलब्ध गराउन मागसमेत गरेको छ ।"
