शीर्षक,विवरण
सहकारी ठगीमा गोर्खा मिडियाका तत्कालीन प्रबन्ध निर्देशक लामिछानेको बयान आज,"छिटपुट कोही बोलाउनुपर्ने कर्मचारी बाँकी रहेमा बोलाउनुपर्ने स्थिति हुन्छ, नत्र शुक्रबारदेखि हाम्रो सोधपुछ गर्ने काम सकिन्छ र समिति प्रतिवेदन लेखनलाई टुंग्याउने दिशामा लाग्छ, सभापति थापाले कान्तिपुरसँग भने, सोधपुछ र प्रतिवेदन लेखनको काम सँगसँगै जस्तो अघि बढेकाले समितिले पाएको समय सीमाभित्रै प्रतिवेदन बुझाउने तयारी छ । पहिलो बैठक बसेको मितिले समितिलाई तीन महिनाको समय छ जुन आगामी भदौ २३ मा सकिँदै छ । समितिलाई ९ वटा सहकारीको रकम हिनामिना, गोर्खा मिडिया नेटवर्क प्रालिलगायत अन्य कम्पनी वा संस्थाहरूमा सहकारीहरूबाट प्रवाह भएको रकमको स्थिति, सो रकम गैरकानुनी रूपमा प्रवाह भए नभएको निश्चित गर्ने, त्यस्तो गैरकानुनी वा अनुचित कार्यमा संलग्न देखिएमा त्यस्ता व्यक्तिहरूको अध्ययन र छानबिन गरी संलग्न व्यक्तिहरूमाथि कानुनबमोजिमको कारबाहीका लागि सिफारिस गर्ने अधिकार छ । कार्यादेशको अनुसूची २ मा तोकिएका ९ वटा सहकारीहरूमा सुप्रिम, साहारा चितवन, सूर्यदर्शन, स्वर्णलक्ष्मी, आइडियल यमुना, इमेज, सानो पाइला, समानता, सुमेरु सहकारी छन् । त्यस्तै अनुसूची १ मा उल्लेख गरिएका २० वटा सहकारीका सम्बन्धमा संकटको अध्ययन गर्ने, सहकारीको बचतकर्ताको रकमको सुरक्षा गर्ने, जोखिममा रहेका तथा दुरुपयोग भएको बचत रकम छिटो र सहज ढंगले फिर्ता गराउने कार्यादेशमा उल्लेख छ ।"
