शीर्षक,विवरण
एक दशकपछि लण्डनबाट पारुको कमब्याक (भिडियो),"काठमाडौं : गायिका पारु राईलाई १ दशकअघि गायनमा जम्न मन थियो। उनले एकपछि अर्को गर्दै गीत निकाल्न थालिन्। चर्चा चलिरहेको थियो तर उनी एक्कासी बेलायत पुगिन्। बेलायत गए पश्चात उनी अर्कै संसारमा रम्न थालिन्। करिब १ दशकपछि पारु पुन सांगीतिक यात्रामा फर्किएकी छन्। पारुले 'तिम्रो तृष्णा' बोलको गीतको भिडियो बजारमा ल्याएकी हुन्।। उनलाई स्वरमा भ्वाइस अफ नेपालका फाइनलिष्ट विकास लिम्बूले साथ दिएका छन्। गायिका पारुकै शब्द रचना रहेको गीतमा संगीत गायक तथा संगीतकार तारा प्रकाश लिम्बुको रहेको छ। बेलायत र नेपालका विभिन्न सुन्दर तथा रमणीय स्थानमा छायांकन गरिएको भिडियोमा छांयाकन, सम्पादन एवं निर्देशन सञ्चारकर्मी कुशल श्रेष्ठले गरेका छन्। नेपालतर्फ सुरज तामाङले निर्देशन गरेका हुन्। करिब डेढ दशक यता ब्रिटिश गोर्खा सेनामा सेवारत साथै सामाजिक अभियन्ता मण्डल थेवे, पारु राई, विकाश लिम्बू र वृक्षा लिम्बूले यस गीतमा अभिनय गरेका छन्। सानै उमेरदेखि कलाकारितामा झुकाव भएकाले अवसर पाएसम्म समय मिलाएर कलाकारितामा निरन्तर लाग्ने उनले बताए। भिडियोमा मेकअप बिपना गुरुङ, सहछांयाकन आशिष श्रेष्ठ र रंग संयोजन नवीन निरौलाको रहेको छ। नेपाल छँदै संगीतको आधारभूत शिक्षा लिइसकेकी गायिका राईले प्रवासमा रहेर आफूलाई मन पर्ने पेसा अंगाल्नका लागि सोचे जस्तो सहज नभएको बताइन्। पाँचथरमा जन्मिएकी र हाल बेलायतमा पल्टने जीवन बिताइरहेकी पारु राई करिब एक दशकदेखि बेलायतमै बस्दै आएकी छन्।"
सूर्य नेपालद्वारा तीन सरकारी अस्पताललाई ६५ लाखको स्वास्थ्य सामग्री प्रदान,"काठमाडौं : सूर्य नेपाल प्रा लि द्वारा काठमाण्डौका ३ सरकारी अस्पताललाई विभिन्न प्रकारका स्वास्थ्य सामग्रीहरु प्रदान गरिएको छ । कम्पनीले त्रिभुवन विश्वविद्यालय शिक्षण अस्पताल, वीर अस्पताल स्थित राष्ट्रिय ट्रमा सेन्टर र निजामति कर्मचारी अस्पताल लाई ल्याटेक्स पन्जा, सर्जिकल मास्क, अनुहार ढाक्ने फेस सिल्ड, व्यक्तिगत सुरक्षा उपकरण र अक्सिमिटर प्रदान गरेको छ। यी स्वास्थ्य सामग्रीहरु सम्बन्धित अस्पतालका कार्यकारी निर्देशकहरुलाई हस्तान्तरण गरिएको हो । स्वास्थ्य सामग्री हस्तान्तरण र वितरणको कार्यलाई ती अस्पतालमा कार्यरत चिकित्सकहरुको प्रतिनिधित्व सहित काठमाडौंस्थित एउटा गैर नाफामूलक संस्था इजीबीओएसएले सहजीकरण गरेको थियो । विद्यमान कोभिड१९ महामारीको दोश्रो लहरले मुलुकको स्वास्थ्य प्रणालीमा पारेको उल्लेख्य दवावलाई विचार गरी यस प्रकारको अभूतपूर्व संकटको घडिमा कम्पनीले अन्य विभिन्न क्रियाकलापहरु समेत सञ्चालन गर्ने योजना रहेको कम्पनीले जनाएको छ । यस वर्षको शुरुवातमा नै कम्पनीले नेरु ७ करोड रकम (प्रत्येक प्रदेशलाई रु १ करोडका दरले) ७ वटै प्रदेशहरुमा स्थापनमा गरिएको कोभिड१९ उपचार तथा नियन्त्रण कोषू मा योगदान गरेको थियो ।"
सिटिजन्स बैंकको सुचना अधिकारीमा राजेन्द्र लाल श्रेष्ठ र प्रवक्तामा नारायण राज अधिकारी नियुक्त,"काठमाडौं : सिटिजन्स बैंक इन्टरनेसनल लिमिटेडले सुचना अधिकारीमा राजेन्द्र लाल श्रेष्ठ र प्रवक्तामा नारायण राज अधिकारीलाई नियुक्त गरेको छ । करिव २२ वर्ष देखि बैंकिङ क्षेत्रमा कार्यकुशलता प्रदर्शन गर्दै आएका राजेन्द्र लाल श्रेष्ठले स्थापनाकाल देखिनै बैंकसंग आबद्ध भई विभिन्न ओहदामा रही कार्य सम्पादन गरेका छन् । भारतको पुणे स्थित सिम्बायोसिस इंस्टीट्यूट अफ बिजनेस मैनेजमेंटबाट व्यवस्थापन विषयमा स्नातकोत्तर गरेका श्रेष्ठसँग शाखा संचालन, ट्रेड प्रशासन, जोखिम व्यवस्थापन तथा कर्जा असुली जस्ता क्षेत्रमा अब्बल दक्षता रहेको छ । हाल उनी बैंकको सहायक प्रमुख कार्यकारी अधिकृतका साथसाथै कम्पनी सचिवको रुपमा समेत कार्यरत छन् । प्रवक्तामा नियुक्त भएका नारायण राज अधिकारीसँग करिव १७ वर्षको बैंकिङ अनुभव रहेको छ । त्रिभुवन विश्व विद्यालयबाट वित्त व्यवस्थापन विषयमा स्नातकोत्तर गरेका अधिकारी शाखा संचालन तथा जोखिम व्यवस्थापनमा अब्बल छन् । अधिकारीले सामान्य सेवा विभाग, मानव संसाधन विभाग, कर्जा असुली विभाग, कर्जा प्रशासन र कर्पोरेट कम्युनिकेशन विभाग समेतको जिम्मेवारी वहन गर्दै आएका छन् । 'भित्र सिस्टम र बाहिर इमेज' को नारालाई आत्मसाथ गर्दै कार्यपथमा लम्कि रहेका बैंकका प्रमुख कार्यकारी अधिकृत गणेशराज पोखरेलले बैंकिङ क्षेत्रमा रहेको लामो अनुभवले बैंकलाई नयाँ उचाइँमा लैजाने विश्वास व्यक्त गरेका छन्।"
विदेशी सहयोग जुटाउने प्रयास गर्न राजदूतलाई निर्देशन,"काठमाडौं : सरकारले विभिन्न मुलुकमा सेवारत नेपाली राजदूतलाई कोभिड१९ विरुद्धको खोप, औषधि र अन्य स्वास्थ्य सामग्री सहयोगस्वरुप जुटाउने प्रयासमा लाग्न निर्देशन दिएको छ। परराष्ट्रमन्त्री प्रदीपकुमार ज्ञवालीले १३ देशका नेपाली राजदूतसँगको अप्रत्यक्ष बैठकमा खोप, चिकित्सा अक्सिजनसँग सम्बन्धित वस्तु, औषधि र अन्य स्वास्थ्य सामग्री अन्तरराष्टिय सहायतास्वरुप नेपालका निम्ति जुटाउन निर्देशन दिएका हुन्। महामारीका कारण उत्पन्न संकट तथा मुलुकको वर्तमान आवश्यकतालाई दृष्टिगत गरी द्विपक्षीय र बहुपक्षीय तहका साथै परोपकारी संस्था, निजी क्षेत्र एवं प्रवासी नेपालीबाट सहायता जुटाउनका लागि अधिकतम प्रयत्न गर्न उनले निर्देशन दिएका हुन्। सहयोग प्राप्ति र परिचालनका अन्य सम्भावनाको खोजी गर्न पनि मन्त्री ज्ञवालीले निर्देशन दिएको मन्त्रालयले जनाएको छ। उनले विदेशमा रहेका नेपाली नागरिकको सुरक्षा र हितलाई उच्च प्राथमिकतामा राखेर काम गर्न पनि निर्देश दिए। त्यसअघि मन्त्री ज्ञवालीले महामारीसँग जुध्न सरकारले गरेका प्रयासबारे जानकारी गराएका थिए। उनले राजदूतले सहयोग परिचालनमा भएका प्रयास र उपलब्धिबारे जानकारीसमेत गराए।रासस"
सप्तरीमा बन्ने भयो अक्सिजन प्लान्ट,"राजविराज : अक्सिजनको अभावलाई न्यूनिकरण गर्न सप्तरीमै अक्सिजन प्लान्ट स्थापना हुने भएको छ। राजविराजस्थित गजेन्द्रनारायण सिंह अस्पताल नजिकै रहेको निजी अस्पताल छिन्नमस्तामा अक्सिजन प्लान्ट स्थापना हुने भएको हो। अक्सिजन प्लान्टका लागि राहत तथा विपद व्यवस्थापन कोषबाट सोधभर्ना हुने गरी ३० लाख रुपैयाँ उपलब्ध गराउने शनिबारको निर्णयसँगै छिन्नमस्ता अस्पताल प्रालिले अक्सिजन प्लान्टको योजना अगाडि बढाएको सञ्चालक शैलेन्द्रमोहन झाले बताए। सो अस्पतालले विरामीहरुको उपचारमा जिल्लामै अग्रणी भूमिका निर्वाह गर्दै आएको छ। कोरोना संक्रमितको उपचारका लागि छिन्नमस्ता अस्पतालले २० एचडियुसहित ५० बेडको आइसोलेसन केन्द्र सञ्चालनमा ल्याएको छ। राजविराजस्थित गजेन्द्रनारायण सिंह अस्पतालले आफ्नै भवनमा २५ बेडको एचडियु व्यवस्थासहितको आइसोलेसन केन्द्र र साइकृष्ण मेडिकल कलेज एण्ड अस्पतालमा ५० बेडको आइसोलेसन केन्द्र सञ्चालनमा ल्याएको छ। हाल सप्तरीमा कोरोना संक्रमितको सङ्ख्या सात सय नाघेको जिल्ला स्वास्थ्य कार्यालयले जनाएको छ। निमित्त प्रमुख दुनियालाल यादवका अनुसार सप्तरीमा कोभिड१९ को दोस्रो लहरमा २३ जनाको मृत्यु भएसँगै कोरोना संक्रमणले मृत्यु हुनेको सङ्ख्या ६३ पुगेको छ। बिरामीहरुले पर्याप्त अक्सिजन नपाउँदा उपचारमा समस्या भएको अस्पतालले जनाएको छ। अक्सिजनको अभावका कारण कोरोना संक्रमितको उपचारका लागि थप बेड र आइसोलेसन केन्द्र विस्तार हुन नसेकेको सीडीओ फणिन्द्रमणि पोखरेलले बताए। सप्तरीमा अक्सिजन प्लाण्ट स्थापनापछि थप बेड विस्तार भएपछि उपचारमा सहज हुने विश्वास गरिएको छ। जिल्ला समन्वय समिति सप्तरीको आयोजनामा शनिबार बसेको बैठकले अक्सिजन प्लान्टका लागि ३० लाख उपलब्ध गराउने निर्णयसँगै राहत तथा विपद व्यवस्थापन कोषमा यथाशिघ्र रकम जम्मा गर्न स्थानीय तहसँग आग्रह गरिएको छ। केही स्थानीय तहले रकम जम्मा गरिसकेको र केहीले जम्मा गर्ने तयारीमा रहेको जिसस प्रमुख प्रभाकर यादवले बताए। अक्सिजनको अभावलाई न्यूनीकरण गर्न दैनिक राजविराजबाट ५० किलोमिटर दुरीमा रहेको सुनसरीको इटहरी गएर अक्सिजन भर्ने गरिएको छ। इटहरीबाट दैनिक ५० सिलिण्डर अक्सिजन भराएर ल्याउनु पर्ने बाध्यता रहेको गजेन्द्रनारायण सिंह अस्पतालका निमित्त मेडिकल सुपरिटेण्डेण्ट डा रणजितकुमार झाले बताए। निमित्त मेसु डा झाले परिस्थिति विषम भएकाले यथाशिघ्र अक्सिजन प्लाण्ट आवश्यक रहेको बताए। अक्सिजन प्लाण्ट स्थापना भए थप बेडहरु विस्तार गर्न सकिने र संक्रमितको उपचारमा सहज हुने उनले बताए। जिल्ला समन्वय समितिका प्रमुख यादवको अध्यक्षतामा बसेको बैठकले अस्पतालमा बसेर १० दिन उपचार गरेका संक्रमितको थप तीन दिनसम्म कुनै लक्षण नदेखिए दोस्रो पटक पीसीआर परीक्षण नगर्ने निर्णय गरेको छ। दोस्रो पीसीआर परीक्षण नगरी चिकित्सकको सल्लाह बमोजिम एक हप्तासम्म होम आइसोलेसनमा बस्ने गरी पठाउने निर्णय भएको हो। आइसोलेसन र क्वारेन्टाइनमा १४ दिनसम्म बसेकालाई पनि दोस्रो पीसीआर नगराइ होम आइसोलेसनमा पठाउने निर्णय भएको छ। जिल्ला संकट व्यवस्थापन केन्द्र र जिल्ला समन्वय समितिको बैठकको विगतको निर्णय अनुसार क्वारेन्टाइन र आइसोलेसन केन्द्र तयार नगरेका स्थानीय तहलाई अबिलम्ब तयार गर्न तथा नेपाल सरकारबाट घोषित ५, १० र १५ बेडको अस्पतालको अवस्थाको विषयमा जिल्ला संकट व्यवस्थापन केन्द्रलाई जानकारी गराउने निर्णय भएको छ। अक्सिजन प्लान्टको स्थापना हुने निर्णयले सप्तरीवासी खुसी भएका छन्। विभिन्न मितिमा गरिएका निर्णय स्थानीय तहले यथाशीघ्र कार्यान्वयन गर्नुपर्ने भन्दै पवनकुमार झाले अक्सिजन प्लान्टका लागि स्थानीयवासी समेत सहयोग गर्न तत्पर रहेको बताए।"
एभरेष्ट ग्यास ग्रुपका अध्यक्ष घिमिरेले चीनबाट स्वास्थ्य सामग्री ल्याउँदै,"काठमाडौं : कोभिड संक्रमितका लागि अत्यावश्यक अक्सिजनको व्यवस्थापन गर्न निजी क्षेत्र पनि जुटेको छ । मुलुकभर अक्सिजनको अभाव भएपछि एभरेष्ट ग्यास ग्रुपका अध्यक्ष व्यवसायी शिवप्रसाद घिमिरेले चीनबाट अक्सिजन व्याग, अक्सिजन मास्क तथा अक्सिजन सिलिण्डर ल्याउने भएका हुन् । ग्रुप अन्तर्गतका दुई कम्पनी एसएलआर टेक्नो एन्ड ट्रेड प्रालि र एभरेष्ट ग्यास उद्योग प्रालिमार्फत भित्र्याइने यी सामग्री सात दिनभित्रै आइपुग्ने अध्यक्ष घिमिरेले जानकारी दिए । पहिलो चरणमा ४० लिटर क्षमताका ५ हजार सेट अक्सिजन ब्याग तथा ५ हजार अक्सिजन मास्क र २ हजार अक्सिमिटर सोमबार हवाई मार्गबाट काठमाडौं आइपुग्ने जनाइएको छ । यस्तै, अक्सिजन सिलिण्डर १० लिटर क्षमताका २२ सय युनिट र अक्सिजन सिलिण्डर ४० लिटर क्षमताका २२५० युनिट जेठ ७ गतेभित्र स्थलमार्गबाट नेपाल ल्याइपुयाइने अध्यक्ष घिमिरेले जानकारी दिए । घिमिरेले मुलुकमा अक्सिजन अभावको समस्या भयावह भएको उल्लेख गर्दै यो बेला मुनाफा नराखी लागत मूल्यमा यी सामग्री आवश्यकताका आधारमा अस्पताल तथा व्यक्तिहरुलाई उपलब्ध गराइने जानकारी दिए । 'अहिलेको महामारीमा हामी सबै व्यवसायीले विदेशमा आफ्नो नेटवर्कमार्फत अक्सिजनलगायतका अत्यावश्यकीय स्वास्थ्य सामग्री भित्र्याउन पहल गर्नुपर्छ भनेर यो प्रयास गरिएको हो,' अध्यक्ष घिमिरे भन्छन्, 'तत्कालका लागि अक्सिजन सिलिण्डर, ब्याग र मास्क भित्र्याएका छौं र आवश्यकताका आधारमा थप सामग्री ल्याउने योजनामा छौं ।' अक्सिजन ब्यागको उपयोगिता यातायातको पहुँच नपुगेका क्षेत्रमा तत्काल अस्पताल पुयाउनु पर्ने संक्रमितका लागि गर्न सकिने जनाइएको छ । अन्य मुलुकमा यस्तो व्याग आपतकालिन उपचारका लागि प्रभावकारी सावित हुँदै आएको छ ।"
