शीर्षक,विवरण
नझुकोस् वीरको शिर,"वीर अस्पताल मुलुककै जेठो अस्पताल हो। १३१ वर्ष बिरामीको सेवा गरेको अनुभव छ। मुलुकभर अस्पतालको संख्या बढे पनि यहाँ बिरामीको चाप घट्दैन। बेवारिसे होस् वा बेहोसीको अवस्था, जुनै समय सबैको उपचारमा उदार छ। त्यसैले त गरिबको अस्पताल पनि भनेर चिनिन्छ। दिने सेवावापत लिने रकम न्यून नै छ। पैसा नभए पनि अस्पतालले हरेकको उपचार गरेकै छ। हाम्रै देशभित्र लाखौं वा विदेशमा महँगो पर्ने उपचार पनि यहाँ कम शुल्कमै भएका धेरै उदाहरण भेटिन्छन्। अस्पतालको हरेक विभागको उपचारको परिणाम संसारकै राम्रो अस्पतालको दर्जामा पर्छ। तर, गरिबदेखि भीभीआईपीसम्मको उपचार गर्ने अस्पताल पुगे पनि व्यवस्थापनको पक्ष गर्व गर्न लायक छैन। अस्पातलमा उपचार गर्न जाँदा बिहान चार बजेदेखि नै लाइन बस्नुपर्छ। साढे ८ बजेको प्रतिक्षामा पाँच घण्टा उभिनुको विकल्प छैन। सजाय दिए जसरी बिरामी र उनका आफन्तलाई उभ्याएको घटना यहाँ नयाँ होइन। दैनिक हजारौंले सेवा लिने अस्पतालमा एउटा सामान्य टोकन वितरण गर्ने प्रणाली स्थापना गर्न नसक्नु आफैंमा लाजमर्दो विषय हो। यसले वीरको इतिहासलाई गिज्याइरहेको छ। अस्पतालको आधारभूत संरचना हेर्न लायक छ। विशेषज्ञ डास्टर, नर्स र अन्य स्वास्थ्यसेवक पर्याप्त छन्। सरसफाईमा क्रमिक सुधार छ। तर, बिरामीका आफन्तलाई अस्पताल पेटी र प्यासेजमा रात काट्नुपर्ने बाध्यता छ। बाहिर झट्ट देख्दा र सुन्दाको जस्ता सहजता अस्पताल पुग्दा भेटिँदैनन्। पीडा बोकेर पुग्नेहरू सेवा लिन नै सास्ती भोग्नु परेको महसुस गर्छन्। अस्पतालभित्र समस्या हरेक क्षेत्रमा भेटिन्छन्। फोहोर व्यवस्थापन, प्रशासनिक क्षेत्र, पार्किङ मात्रै होइन, नयाँ सेवाग्राही पुगे कहाँ कसरी जाने ? सोध्ने कर्मचारी भेटिँदैनन्। भीआईपी र भीभीआईपी आउँदा सबै तैनाथ हुने तिनै कर्मचारी सर्वसाधारणले भने खोज्दा पनि भेटिँदैनन्। भेटे झर्किएर जवाफ दिने गुनासो कम छैन। सोझैभन्दा सर्वसाधारणले सहज सेवाको महसुस यहाँ पुग्दा गर्दैनन्। पुरानो, इतिहास बोकेको, सरकारको प्रत्यक्ष निगरानी भएको अस्पतालको हालत पनि अन्य सरकारी अस्पतालको सरह नै छ। सबै समस्या केलाउँदा अस्पताल र सरकारले सार्वजनिक गर्ने वीरको अवस्था कागजमा फुलाइएका फूलजस्ता मात्रै देखिन्छन्। पुरानो भनेर गर्व गर्नुबाहेक अन्यभन्दा फरक अवस्था यहाँ छैन। वीर अस्पताल मुलुकको गौरव गर्न लायक संरचना हो। अरू अन्य सरकारी अस्पतालजस्तै बन्नु दुःखको कुरा हो। प्रशासनिक कार्यमा धेरै कमजोरी छन्। यसको सुधार र सर्वसाधारणको सहज पहुँचका लागि धेरै आदेशका श्रृंखला पनि चले। तर, कार्यान्वयन भएनन्। अस्पतालका कर्मचारीलाई समयको पूर्ण प्रयोग कसरी गराउने त्यसमा कुनै निगरानी छैन। धेरै कर्मचारीको जागिर यता, समय कतै लाभमा नै बितेका छन्। दण्ड र पुरस्कारको व्यवस्था छैन। कहिले कर्मचारी नियुक्तिको अखडा बन्छ भने कहिले स्वार्थको राजनीति गर्ने स्थान पनि वीर नै बन्छ। अस्पतालभित्र मात्र बीसभन्दा बढी संख्यामा विभिन्न राजनीतिक पार्टीका संघ, संगठन छन्। यहाँ गरिने सबैजसो विशेष नियुक्ति पूर्ण रूपमा पार्टीगत छ। भागबन्डाको व्यवस्था छ। राजनीतिक संगठनसँग आवद्ध हुनेको प्रगति चाँडै हुन्छ। जो कुनै दल वा संगठनसँग आवद्ध छैनन्, उनीहरूको प्रगति हुँदैन। यसको असर सोझै सेवाग्राही र व्यवस्थापनमा परेको छ। सेवाग्राहीको समस्या केलाउनेभन्दा पनि माथिकालाई रिझाउने धाउनमा कर्मचारी छन्। यो नै अस्पतालभित्र जरो गाडेको मुख्य रोग हो। अस्पतालको हरेक विभागको उपचारको परिणाम संसारकै राम्रो अस्पतालको दर्जामा तुलना गर्न सक्नेसम्म बन्यो। यसलाई टिकाउन अब व्यवस्थापनको पाटो चुस्त हुनुपर्यो। अस्पतालको मुख्य काम भनेकै बिरामीको उपचार गर्नु हो। रोग सबैलाई लाग्छ र गर्ने उपचार पद्धति पनि एउटै हुन्छ। विशिष्ठ व्यक्ति आए सुरक्षाका कुरा होलान् तर उपचार र औषधि त सर्वसाधारण दिइने जस्तै हो। यहाँ बिरामीलाई गर्ने व्यवहार एउटै हुनुपर्छ। पद र प्रतिष्ठा हेरेर उपचार गरे वीरको शिर झुक्न समय लाग्दैन। दिने सेवा र गर्नेपर्ने सुधारमा अस्पताल प्रशासनको ध्यान चाँडो पुगोस्।"
उद्धार प्रक्रियामै सुत्केरीको मृत्यु,"गोरखा : उद्धार गर्ने झन्झटिलो प्रक्रियाका कारण गोरखाको दुर्गम चुम्चेत गाउँमा सुत्केरीको मृत्यु भएको छ। सडक सञ्जालले नजोडिएको सो गाउँमा हेलिकप्टरका लागि प्रक्रिया पूरा गर्दागर्दै सुत्केरी हिसे डोमा लामाको मृत्यु भएको स्थानीय फुर्बा याङ्जेन लामाले जानकारी दिइन्। चुमनुब्री६ कोम्बाकी २५ वर्षीया हिसे डोमाको बिहीबार दिउँसो ३ बजे मृत्यु भएको हो। बच्चा त बुधबार राति १२ बजे नै जन्मिएको रहेछ। सालनाल नझरेपछि मृत्यु भएको हो, उनले भनिन्, उद्धार गर्न हेलिकप्टर ल्याण्ड गर्नु र मान्छे मरिसक्यो भनेर फोन आउनु एकै चोटी भयो। सो गाउँमा बाक्लो हुस्सुका कारण हेलिकप्टर अर्को गाउँ चुम्लिङमा बसेको थियो। सुत्केरीको उद्धारका लागि महिला, बालबालिका तथा जनसंख्या मन्त्रालयले हेलिकप्टर पठाएको थियो। बिहीबार बिहानैदेखि हेलिकप्टरका लागि प्रक्रिया थालिएको थियो। तर, दिउँसो ३ बजेसम्म पनि उपलब्ध हुन सकेन। पर्खदापर्खंदै महिलाको मृत्यु भयो। हेलिकप्टरका लागि स्वास्थ्यचौकीले स्वास्थ्य शाखालाई, स्वास्थ्य शाखाले गाउँपालिकालाई, गाउँपालिकाले जिल्ला प्रशासनलाई र जिल्ला प्रशासनले महिला, बालबालिका तथा जनसंख्या मन्त्रालयलाई खबर गर्नुपर्ने व्यवस्था रहेको गाउँपालिकाकी उपप्रमुख कुमारी गुरुङले जानकारी दिइन्। प्रक्रिया पूरा गर्दैमा चार घण्टा जति बित्यो होला, उनले भनिन्, सबै निकायबाट जतिसक्दो चाँडो प्रयास त गरेकै हौं। हेलिकप्टरमार्फत उद्धार गरिदिन आफूलाई साढे १२ बजे खबर आएको गाउँपालिकाका प्रमुख प्रशासकीय अधिकृत भीमसेन श्रेष्ठले बताए। गाउँपालिकाबाट प्रशासन कार्यालयमा सवा १ बजे खबर प्राप्त भएको कार्यालयका प्रशासकीय अधिकृत हर्क रोकाले बताए। मैले सबै प्रक्रिया पूरा गरी महिला, बालबालिका तथा जनसंख्या मन्त्रालयलाई पत्र लेख्दा २ बजेको थियो, रोकाले भने। मन्त्रालयले पठाएको नेपाली सेनाको हेलिकप्टर चुम्लिङमा ल्याण्ड गर्दा र सुत्केरी मरेको फोन आउँदा तीन बजिसकेको चुम्लिङका लोप्साङ लामाले बताए। आकस्मिक बिरामी र घाइतेका लागि कागजपत्र नपर्खी टेलिफोनबाट जानकारी आएकै भरमा चिठी बनाइदिन आग्रह गरेको प्रमुख जिल्ला अधिकारी शालिग्राम पौडेलले बताए। चिठीपत्र आउँदै गर्छ। फोनबाट जानकारी आएपछि हामीले बनाउने चिठी बनाइहाल्नू भन्ने आदेश दिएको थिएँ, प्रजिअ पौडेलले भने, उताबाटै खबर आउन ढिला भयो। हामीले त समयमै लेखापढी गरेका थियौं। कि पालिकाले सिधै मन्त्रालयमा पत्राचार गर्ने व्यवस्था हुनुपर्यो। यथासक्य छिटो हेलिकप्टर पठाए पनि सुत्केरीलाई बचाउन नसकिएको उनले बताए। एक घण्टा छिटो हेलिकप्टर पुर्याउन सकेको भए सुत्केरीलाई बचाउन सकिन्थ्यो, गाउँपालिकाकी उपप्रमुख गुरुङ भन्छिन्, मौसमले पनि साथ दिएन। दिनभरि त्यत्रो मिहिनेत गर्दा पनि बचाउन सकिएन। निराश भएर बसेको छु। मौसम, टेलिफोन, इन्टरनेटलगायतका प्रविधिले पनि साथ नदिएका कारण सुत्केरीको बेलामै उद्धार गर्न नसकिएको वडाअध्यक्ष लोप्साङफुञ्जो लामाले बताए। छेकम्पारका धावा ग्याल्जेन लामालाई ८ बजे नै खबर आएको थियो। तर, सरकारी प्रक्रियागत झञ्झटका कारण आफूले उद्धार गर्न नसकेको उनले बताए। मैले २ जना बिरामीका लागि हेलिकप्टर चार्टर्ड गर्दै थिएँ। सुत्केरीलाई पनि उद्धार गरिदिनुपर्यो भनेर ८ बजेतिर फोन आयो, उनले भने, दुईजना बिरामीका लागि त प्रक्रिया पूरा गरिसकेको थिएँ। त्यसमा नयाँ मान्छे राख्न प्रशासन कार्यालय, गृह मन्त्रालय, परराष्ट्र मन्त्रालय, नागरिक उड्डयन प्राधिकरण सबैतिर प्रक्रिया पुर्याउनु पर्ने हुन्थ्यो जुन मेरा लागि असम्भव भयो। हेलिकप्टरमा सिट पनि खालि नै भएकाले प्रक्रिया छोटो भइदिएको भए आफूले नै ल्याइदिन सक्ने उनले बताए। निषेधित क्षेत्र भनेर उत्तरी गोरखामा हेलिकोप्टर उडाउन झञ्झटिलो प्रक्रिया बनाएकोमा उनले दुःख व्यक्त गरे। चुम्चेत पुग्न सदरमुकामबाट ४ दिन पैदल हिँड्नुपर्छ। सडक सञ्जालले पनि नजोडिएको, लोक्पामा निरन्तर गइरहने पहिरो र सर्दीभीरको क्याण्टिलिभर पुल पनि भत्किएका कारण पैदल आवतजावत गर्न पनि नसकिने अवस्था रहेको वडाअध्यक्ष लामाले बताए।  यस्तो छ, झन्झटिलो प्रक्रियाविकट गाउँका सुत्केरीको उपचारका लागि सरकारले निःशुल्क हेलिकप्टर उद्धारको व्यवस्था गरेको छ। तर, त्यसका लागि अपनाउनुपर्ने सरकारी प्रक्रिया यति धेरै झन्झटिलो छ, कि कतिपयले हेलिकप्टर नपुग्दै ज्यान गुमाउँछन्। सर्वसाधारणलाई प्रक्रिया पूरा गर्नै सकस हुन्छ। सुत्केरी हुन गाह्रो भएपछि स्वास्थ्य चौकीले गाउँपालिकाको स्वास्थ्य शाखालाई सिफारिस गर्छ। स्वास्थ्य शाखाले गाउँपालिका कार्यालयलाई सिफारिस गर्छ। त्यसपछि गाउँपालिकाले जिल्ला प्रशासन (सीडीओ) कार्यालयलाई सिफारिस गर्नुपर्छ। सीडीओ कार्यालयले महिला तथा बालबालिका मन्त्रालयलाई सिफारिस पठाउँछ। महिला मन्त्रालयले हेलिकप्टर पठाउँछ। यी सबै प्रक्रिया पूरा गर्न २ घण्टादेखि एक दिनसम्म लाग्ने गर्छ। तर, सुत्केरी हुन नसकेरभइसकेपछि गम्भीर बनेका महिलाहरूले प्रक्रिया पूरा गर्दागर्दै ज्यान गुमाउनु परेका घटना बढ्दै गएका छन्। उपचार नपाएर सुत्केरीले ज्यान गुमाउन नपरोस् भनेर सरकारले निःशुल्क हवाई उद्धारको व्यवस्था गरेको छ। तर, प्रक्रियागत झन्झटका कारण सुत्केरीको ज्यान जाने क्रम रोकिएको छैन। उडानको प्रतीक्षा गर्दागर्दै सुत्केरीको ज्यान गइरहेको छ। अर्कातिर उनीहरूको ज्यान जोगाउन सरकारले दिएको रकम भने खर्च हुन सकेको छैन। यसले कार्यक्रमको प्रभावकारितामा प्रश्न खडा गरेको छ। गत वर्ष ५ करोड रुपैयाँ यस कार्यक्रमका लागि विनियोजन भएकोमा ३ करोड रुपैयाँ मात्र खर्च भएको छ। चालू आवमा भने सरकारले बजेट घटाएर ४ करोड रुपैयाँमा झारेको छ। कार्यक्रम ल्याउने तर पीडितले उपचार नपाउनेमा को दोषी होला ? कार्यविधिले दिएको नियमभित्र रहेर मात्र उद्दार गर्दै आइएको मन्त्रालयका सचिव यामकुमारी खतिवडाले जानकारी दिइन्। राष्ट्रपति महिला उत्थान कार्यक्रमअन्तर्गत दुर्गम क्षेत्रका ज्यान जोखिममा परेका गर्भवती तथा सुत्केरी महिलाहरूका लागि हवाइ उद्धारसम्बन्धी कार्यविधि २०७५ कार्यान्वयनमा छ। योजना १९ जिल्लामा पूर्ण र २९ जिल्लामा आंशिक लागू भएका छन्। हालसम्म यो योजनाबाट २ सय ४० जनाको उद्धार गरिएको योजना प्रमुख गोमा ढकाल पौडेलले जानकारी दिइन्।"
