शीर्षक,विवरण
जाजरकोटमा भरुवा बन्दुक सहित एक जना पक्राउ,जाजरकोट: जाजरकोटमा अवैध भरुवा बन्दुक सहित एक जना पक्राउ परेका छन् । नलगाड नगरपालिका १० का ५६ वर्षीय मोहन विक एकनाले भरुवा बन्दुक सहित पक्राउ परेका हुन् । इलाका प्रहरी कार्यालय रग्दाबाट गएको प्रहरीको गस्ती टोलीले विकलाई उनकै घरबाट पक्राउ गरेको हो । विशेष सूचनाका आधारमा घर नजिकै बाँदर हेर्ने भनी बनाएको कटेरोमा लुकाई छिपाई राखेको एकनाले खाली भरुवा बन्दुक र रातो प्लाष्टिकको झोलाभित्र फलामको जस्तो देखिने सानो ठूलो १५ टुक्रा फेला पारी रीतपूर्वक बरामद गरी नीजलाई कानून बमोजिम पक्राउ गरिएको जिल्ला प्रहरी प्रमुख डिएसपी मधुकुमार थापाले बताए । जिल्ला प्रशासन कार्यालयबाट म्याद थप गरी अनुसन्धान गरिएको र उनलाई अवैध हातहतियार तथा खरखजना सम्बन्धी मुद्दा चलाइने थापाले बताए । यसअघि नलगाड ८ का वीरबहादुर पुनलाई गत सोमबार अवैध भरुवा बन्दुक सहित प्रहरीले पक्राउ गरेको थियो ।
संवैधानिक परिषद्सम्बन्धी अध्यादेश : संवैधानिक इजलासमा प्रधानन्यायाधीश नबस्ने,"काठमाडौं : संवैधानिक परिषद् सम्बन्धी अध्यादेशविरुद्धको रिटको इजलासमा प्रधानन्यायाधीश चोलेन्द्रसमशेर जबरा नबस्ने भएका छन्। रिटको सनुवाईका लागि संवैधानिक इजलासबाट शुक्रबार पेसी तोकिएपनि प्रधानन्यायाधीशको भूमिकामाथि प्रश्न उठेको छ। संवैधानिक इजलास प्रधानन्यायाधीशको नेतृत्वमा गठन हुने व्यवस्था छ। प्रधानन्यायाधीश चोलेन्द्रसमशेर जबरा संवैधानिक परिषद्ले गरेको निर्णयमा संलग्न भएकाले प्रधानन्यायाधीश जबरारहित इजलासमा सुनुवाई हुनुपर्ने रिट निवेदकको माग छ। गत मंसिर ३० मा मन्त्रिपरिषद्को सिफारिसमा राष्ट्रपति विद्यादेवी भण्डारीले संवैधानिक परिषद् सम्बन्धी अध्यादेश जारी गरेकी थिइन्। संविधानको धारा ११४ को उपधारा (१) बमोजिम संवैधानिक परिषद् (काम, कर्तव्य, अधिकार र कार्यविधि) सम्बन्धी (पहिलो संशोधन) अध्यादेश, २०७७ जारी भएको थियो।"
"प्रदेश १ मा मन्त्रिपरिषद् विस्तार सुरु, दुई मन्त्री नियुक्त","विराटगनर: प्रदेश १ का मुख्यमन्त्री भीम आचार्यले प्रदेश मन्त्रीपरिषद् विस्तार सुरु गरेका छन् । उनले शुक्रबार दुई जनालाई मन्त्री नियुक्त गरे । नेकपा (एकीकृत समाजवादी)को नेतृत्व गरिरहेका माधवकुमार नेपालको साथ छाडेका ताप्लेजुङका बलहादुर सामसोहाङ र तेह्रथुमका लछुमन तिवारीलाई आचार्यले मन्त्री नियुक्त गरेका हुन् । तिवारीलाई उद्योग, पर्यटन, वन तथा वातावरण र सामसोहाङलाई सामाजिक विकास मन्त्रालयको जिम्मेवारी दिइएको छ । नवनियुक्त दुबै मन्त्रीलाई शुक्रबार नै प्रदेश १ का प्रमुख सोमनाथ अधिकारी प्यासीले शपथग्रहण गराए । मुख्यमन्त्री आचार्यका स्वकीय सचिव अनिल राजधामीका अनुसार पहिलो चरणमा दुई जनालाई मन्त्री नियुक्त गरिएको छ । अरु पनि मन्त्री नियुक्त गरेर मन्त्रिपरिषद् विस्तार गर्ने योजनामा मुख्यमन्त्री रहेको जानकारी उनले दिए । एमाले सचिव एवं पार्टीका प्रदेश इन्चार्ज आचार्य बिहीबार मात्रै प्रदेश १ को मुख्यमन्त्री नियुक्त भएका हुन् । प्रदेशका संस्थापक मुख्यमन्त्री शेरधन राईले राजीनामा दिएर आचार्यलाई मुख्यमन्त्री बन्ने बाटो खुला गरिदिएका थिए । आफू मुख्यमन्त्री बनेको भोलिपल्ट आचार्यले दुई जनालाई मन्त्री बनाउँदै प्रदेश मन्त्रिपरिषद् विस्तार थालेका हुन् ।"
अनेरास्ववियु दाङका अध्यक्षको टोलीले चिकित्सकलाई कालोमोसो दलेपछि स्वास्थ्यकर्मीहरु आन्दोलित,"दाङ: दाङको राप्ती प्रादेशिक अस्पताल तुलसीपुरका मेडिकल सुपरिटेन्डेन्ट डा विनोद सिंहमाथि अनेरास्ववियुका अध्यक्षसहितको टोलीले कालोमोसो दलेपछि स्वास्थ्यकर्मीहरु आन्दोलित बनेका छन् । अस्पतालको कार्यकक्षमै मेडिकल सुपरिटेन्डेन्ट डा सिंहलाई नेकपा एमाले निकट अनेरास्ववियुका जिल्ला अध्यक्ष सर्जन परियार सहितको समूहले कार्यकक्षमा अभद्र व्यवहार गर्दै कालोमोसो दलेको हो । अनेरास्ववियु अध्यक्ष परियारको नेतृत्वमा गएको ४५ जनाको समूहले मेसुसँग सामान्य कुराकानी गर्दै गरेको अवस्थामा शुक्रबार दिउँसो पौने २ बजे मेसुको कार्यकक्षमा कालोमोसो दलेको प्रहरीले जनाएको छ । विनाकारण अस्पतालको मेसुलाई कालोमोसे दलिएपछि अहिले अस्पतालमा कार्यरत स्थास्थयकर्मी तथा चिकित्सकहरु आन्दोलित भएका छन् । ईलाका प्रहरी कार्यालय तुलसीपुरमा सर्जन परियार, दिवस क्षेत्री, गणेश खड्का लगायतको नाममा किटानी जाहेरी सहतिको उजुरी समेत अस्पताल प्रशासनले दर्ता गरेको प्रहरीले जनाएको छ । टाइडफाईड भएको बिरामीको रगत कल्चार परीक्षणको विषयमा परियार सहतिका यूवाहरुले बिहीबारदेखि नै अस्पतालमा विवाद सिर्जना गरिरहेका थिए । 'अस्पतालमा चिकित्सकले त्यो सेवा अस्पतालमा नभएको भनेपछि अस्पतालमै किन सेवा नदिने भन्दै बिहीबार उनीहरुले मेसु र चिकित्सकहरुसँग विवाद गरेका थिए । अस्पतालमा नभएको सेवालाई साथीहरुले यहाँ छैन, भन्नु भएको रहेछ,' मेसु सिंहले भने, 'त्यही विषयमा कुरा भइरहेको थियो एक्कासी अभद्र व्यवहार गरेर कालोमोसो दलेर युवाहरु भागे ।' विनाकारण यस्तो अवस्था आउन थालेपछि आफूहरु काम गर्न नसक्ने स्वास्थ्यकर्मीहरुको भनाइ छ । सुरक्षासमेत नहुने भएकाले उनीहरुले काम रोकेको बताएका छन् । 'यस्तो अवस्थामा कुन चिकित्सकले सेवा दिन सक्छ ?' डा सिंहले भने । उनले सुरक्षाको प्रत्याभूति गराएर सहज रुपमा काम गर्ने वातावरण गराउन र दोषीलाई हदैसम्मको कारवाही गर्न माग गरेका छन् । अस्पताल विकास समितिका अध्यक्ष पदम प्रसाद न्यौपानेले अस्पतालभित्र अराजकता देखाउनेहरुलाई कानुनी कारवाही हुनुपर्ने बताए । 'अस्पताल भित्र भएको घटना निन्दनीय र भत्र्सना युक्त छ, उनले भने, दोषीलाई तत्काल नियन्त्रणमा लिएर कानुनी कारवाही गरिनु पर्छ' उनले भने । दोषीलाई कारवाही नहुँदासम्म अस्पताल व्यवस्थापन समिति, चिकित्सक संघले संयुक्तरुपमा नै अतिआवस्यक र इमर्जेन्सी सेवा बाहेका सेवाहरु दिन नसक्ने निर्णय गरेको बताए । अनेरास्ववियुका जिल्ला अध्यक्ष सर्जन परियारको नेतृत्वमा गरिएको गतिविधि निन्दनीय भएको भन्दै अस्पतालले दोषीलाई हदैसम्मको कारवाहीको माग समेत गरेको छ । घटना लगत्तै बसेको अस्पताल विकास समितिको बैठकले यस्तो माग गरेको हो । घटनामा संलग्न दोषीलाई हदैसम्मको कारवाहीको माग र घटनाप्रति खेद प्रस्ताव पारित गर्दै दोषीहरुलाई किटानी जाहेरी दिने निर्णय गरेको अध्यक्ष न्यौपानेले बताए । अस्पतालमा कार्यरत चिकित्सक तथा स्वास्थ्यकर्मीहरुले शनिबार बिहान ९ बजेसम्म दोषीलाई पक्राउ गरेर कारवाही नगरिए अस्पतालबाट दिइने सेवा ठप्प पार्ने चेतावनी दिएका छन् । एमाले अध्यक्ष टीकाराम खड्काले यस घटनालाई अराजकताको पराकाष्टा भएको भन्दै दोषीलाई कारवाही हुनुपर्ने प्रतिक्रिया दिएका छन् ।"
बीपी प्रतिष्ठानका रजिष्ट्रार रेग्मीले दिए राजीनामा,"धरान: बीपी कोइराला स्वास्थ्य विज्ञान प्रतिष्ठान धरानका रजिष्ट्रार डा मोहनचन्द्र रेग्मीले पदबाट राजीनामा दिएका छन् । रेग्मीले शुक्रबार प्रधानमनत्री शेरबहादुर देउवालाई रजिष्ट्रार पदबाट राजीनामा बुझाएको पत्र बुझाएका छन् । बीपी प्रतिष्ठानका ६ जना सिनेट सदस्यले वर्तमान चारैजना पदाधिकारीहरुलाई बर्खास्त गर्न बिहीबार प्रधानमन्त्री शेरबहादुर देउवालाई निवेदन दिएको भोलिपल्ट डा रेग्मीले पदबाट राजीनामा दिएका हुन् । रेग्मीले सरकारले बीपी प्रतिष्ठानमा भएको छानविन प्रक्रियालाई सहयोग गर्न आफूले पदबाट राजीनामा दिएको राजीनामा पत्रमा उल्लेख गरेका छन् । स्वास्थ्य मन्त्रालयका सचिव डा रोशन पोखरेलले रेग्मीले रजिष्ट्रार पदबाट राजीनामा दिएको पत्र प्रधानमन्त्रीलाई बुझाएको पुष्टि गरेका छन् । रेग्मीलाई तत्कालीन स्वास्थ्यमन्त्री भानुभक्त ढकालले बीपी प्रतिष्ठानको रजिष्ट्रारमा नियुक्त गरेका थिए । बीपी प्रतिष्ठानका उपकुलपति डा ज्ञानेन्द्र गिरी, शिक्षाध्यक्ष डा गुरु खनाल, रजिष्ट्रार डा रेग्मी र निर्देशक डा गौरीशंकर साहले प्रतिष्ठानमा करौडौं रुपैयाँ भ्रष्ट्राचार गरेको प्रतिष्ठान संचालन गर्न नसकेको भन्दै ७४ दिनदेखि प्रतिष्ठानका चिकित्सक र कर्मचारी आन्दोलनरत छन् । प्रतिष्ठान सुद्धिकरणको माग राखेर चिकित्सक र कर्मचारीहरुले आन्दोलन सुरु गरेपछि प्रतिष्ठानमा भएको आर्थिक अनियमिताका विषयमा छानविन गर्न प्रधानमन्त्री देउवाले प्रधानमन्त्री कार्यालयका सचिव डा बैकुण्ठ अर्यालको संयोजकत्वमा ८ सदस्य समिति गठन गरेका थिए । उक्त समितिले प्रतिष्ठानका चारैजना पदाधिकारीहरु आर्थिक अनियमिताका घटनामा मुछिएको र सही ढंगले प्रतिष्ठान संचालन गर्न नसकेको भन्दै कारवाही गर्न सिफारिस गरेको थियो ।"
