शीर्षक,विवरण
"पहिरोमा तीनजना बेपत्ता, एकको उद्धार","नवलपुर : बुधबार रातिदेखि परेको अविरल वर्षाका कारण नवलपरासी (बर्दघाटसुस्तापूर्व)को हुप्सेकोटमा पहिरो खस्दा तीनजना बेपत्ता भएका छन्। हुप्सेकोट४ माथिल्लो चारघरे रुम्सीमा शुक्रबार बिहान खसेको पहिरोमा परी तीन बेपत्ता हुनुका साथै एक घाइते भएका जिल्ला प्रहरी कार्यालयले जनाएको छ। कार्यालयका सूचना अधिकारी मधुसुदन सिंहका अनुसार पहिरोले चार घरेका ५० वर्षीय हस्तबहादुर पुलामीको घरमा पूर्णरुपमा क्षति पुर्याएको छ। उनका अनुसार पहिरोले पुरेका अवस्थामा उनलाई स्थानीय र प्रहरीले उद्धार गरी उपचारका लागि मध्यबिन्दु जिल्ला अस्पताल डण्डामा ल्याइएको छ। पहिरोमा बेपत्ता भएकाको खोजी जारी छ। पहिरोमा परी पुलामीकी ४० वर्षीया श्रीमती धनमाया , सात वर्षीया नातिनी भूमिसरा र छ वर्षीया नातिनी देउमाया पुलामी बेपत्ता भएका सूचना अधिकारी सिंहले बताए।"
लुम्बिनी विश्वविद्यालयको छात्रावास डुबानमा: १० घण्टादेखि शिक्षकविद्यार्थीसहित ३० जना थुनिए,"बुटवल: लुम्बिनी बौद्ध विश्वविद्यालयको छात्रावास र शिक्षक आवास क्षेत्र डुबानमा पर्दा शिक्षक र विद्यार्थीसहित ३० जना फसेका छन् । निरन्तर परेको पानीले रुपन्देहीको खडैयामा रहेको आवास र छात्रावास क्षेत्र डुबेको हो । दानव नदीमा उच्च बाढी आएपछि आवास क्षेत्रसहित खडैया गाउँ नै डुबानमा परेको छ । बौद्ध विश्वविद्यालयका निमित्त परीक्षा नियन्त्रक इन्द्र काफ्लेले बिहान ७ बजेपछि दानव नदीमा बाढी आउँदा गाउँ नै डुबानमा परेको बताए । अहिले खोला र बस्तीको पानी सम्मै छ, कोही पनि बाहिर निस्किन सक्ने अवस्था छैन,' उनले भने । विश्वविद्यालयको छात्रावासमा विद्यार्थी बस्दैआएका छन् । पूर्वाधार निर्माण गरिरहेका मजदुरहरु पनि सोही भवनमा आश्रय लिएका छन् । उनीहरुको अस्थायी क्याम्प नै डुबेको हो । विश्वविद्यालयका रजिष्ट्रार डा तिलकराम आचार्यले पानीको सतह नघटे उद्धारको प्रयास गर्नुपर्ने बताए । नदीको पानी नै पसेका कारण पानीको सतह घटिरहेको छैन, पानी नघटे उद्धार नै गर्नुपर्ने हुन्छ, बाहिर निस्किनका लागि अरु कुनै विकल्प छैन,' उनले भने । शिक्षकहरु थुनिएपछि विश्वविद्यालयको पठनपाठन समेत अवरुद्ध भएको उनले बताए । रुपन्देहीमा बिहीबार बिहानदेखि नै निरन्तर पानी परिरहेको छ । निरन्तरको बर्खापछि ससाना खोलाहरुमा पानीको सतह बढेको छ । लुम्बिनी क्षेत्रका अधिकांश क्षेत्र जलमग्न भएका छन् । बाढीले लुम्बिनी प्रदेशका तराई क्षेत्रमा बढी क्षति गरेको छ । पश्चिम नवलपरासी सदमुकाम पनि डुबानमा छ । रुपन्देहीको देवदहमा पुल भासिँदा पूर्व पश्चिम राजमार्ग अवरुद्ध भएको छ । कपिलवस्तुका दक्षिणी क्षेत्रको अधिकांश खेती र ससाना घरहरु डुबानमा परेका छन् ।"
उदयपुरमा पहिरोमा परी बालकको मृत्यु,उदयपुर: पहिरोमा परेर उदयपुरमा एक ७ वर्षीय बालकको शुक्रबार दिउँसो मृत्यु भएको छ । कटारी नगरपालिका २ मिलनचोकका पोष्टबहादुर मगरका छोरा कर्ण मगरको पहिरोमा परी ज्यान गएको हो । घर नजिक रहेको आँप खहरे खोलामा खेल्ने क्रममा माथिबाट अचानक बगेको पहिरोमा परेर बालक घाइते भएको जिल्ला प्रहरी कार्यालयका डिएसपी बेदप्रसाद गौतमले जानकारी दिए । घटना लगत्तै स्थानीयले बालकलाई उद्धार गरी उपचारको लागि कटारी अस्पताल लैजाने क्रममा बाटोमै ज्यान गएको उनले बताए ।
"मुस्ताङका स्याउमा रोगको प्रकोप: प्राविधिक भन्छन्, 'जलवायु परिवर्तनको असर'","जोमसोम: मौसम परिवर्तनसँगै मुस्ताङका स्याउमा रोग किराको प्रकोप देखिएको छ । अविरल वर्षाका कारण स्याउका बोटमा स्क्याप रोगको प्रकोप देखिएपछि जिल्लाका स्याउ किसान चिन्तित बनेका छन् । मुस्ताङको घरपझोङ गाउँपालिका र थासाङ गाउँपालिका लगायत स्थानमा रहेका स्याउ बगैँचामा स्क्याप रोग देखा परेको हो । गत वर्ष भन्दा यस वर्ष मुस्ताङका स्याउका बोटमा रोग किराको प्रकोप बढेकाले स्याउको उत्पादन तथा गुणस्तरमा कमी हुने शितोष्ण वागबानी विकास केन्द्र मार्फाले जनाएको छ । केन्द्रका अनुसार जलवायु परिवर्तनको असर तथा अन्य कारणले मुस्ताङमा बढी मात्रामा वर्षा भएको र यसले स्याउका बोट र फलमा विभिन्न रोग किराको प्रकोप देखिएको हो । स्याउको बोटमा फल लाग्ने समयमा भारी वर्षा हुँदा स्क्याप रोग देखा पर्ने केन्द्रका निमित्त कार्यालय प्रमुख काशीराम पाण्डेले बताए । स्याउमा रोग किराको प्रकोप देखिनुको मुख्य कारण प्राविधिकले सिफासिर गरेको भन्दा बढी डोज औषधिको प्रयोग गर्नु भएको पनि प्राविधिकको भनाइ छ । किसानले विभिन्न प्राविधिकको सल्लाह विना नै औषधिको प्रयोग गर्नाले पनि स्याउमा विभिन्न प्रकोप आउने गरेको बताइन्छ । स्याउ बगैँचामा प्रकोप देखिएसँगै स्याउको पात झर्दै बोट उजाड देखिने, स्याउका दानामा टिकटिके दाग देखिने, पत्ता खुम्चिएर सेता ढुसी लाग्ने र फलको गुणस्तरमा समेत ह्रास आएको बताइएको छ । मुस्ताङमा गत वर्ष पनि स्याउमा विभिन्न रोग किराको संक्रमण देखि पर्दा किसान मर्कामा परेका थिए । स्याउ बगैँचाको हेरचाह तथा व्यवस्थान र विभिन्न संक्रमण फैलिन नदिन आवश्यक सावधानी अपनाउनुपर्ने प्राविधिकले सल्लाह दिने गरेका छन्। मुस्ताङको थासाङमा गत वर्ष कुल उत्पादनको दुई तिहाइ स्याउ गुणस्तर नष्ट भएको थियो । यस वर्ष पनि मुस्ताङका किसानले स्याउ उत्पादनमा करोडौं घाटा व्यहोर्नुपर्ने देखिएको छ । मुस्ताङको घरपझोङ २ मार्फाका किसान सन्तोष लालचनका अनुसार मौसम आएको परिवर्तनले गर्दा स्याउ बोटमा विभिन्न रोग देखा परेकाले स्याउको उत्पादन तथा गुणस्तरमा कमी आउन थालेको छ । मुस्ताङमा प्रमुख आयआर्जनको माध्यम बनेको स्याउ खेतीमा रोग किराको प्रकोपले किसानले ठूलो घाटा व्यहोर्नुपरेको बताए । स्याउ किसान लालचनले विगतका वर्षमा १२ लाखसम्मको स्याउ बिक्री गरेको भए पनि गत वर्ष जम्मा १५ हजारको मात्र स्याउ बिक्री गरेका थिए । यस वर्ष पनि स्याउमा रोगकिराको प्रकोप देखिकाले खासै उत्पादन र गुणस्तर कायम हुन नसकेको उनले बताए । समुद्री सतहदेखि २५ सय मिटर उचाईको जोमसोम, स्याङ, मार्फा, ठिनी, ढुम्बा, कोवाङ, सौरु र टुकुचे लगायत स्थानमा स्याउ बोटमा प्रकोप देखिएको छ । मुस्ताङमा विगत वर्षहरु झैँ बोटमा फलेका स्याउ विकसित हुने क्रम सुरु भएको छ । मुस्ताङमा उत्पादन हुने स्याउ खरिद गर्न जिल्ला बाहिरका व्यापारी मुस्ताङ आउँछन् । बर्सेनी भदौको पहिलो साता स्याउको अवलोकन गरी स्याउको बैना लगाउन जिल्ला बाहिरका ब्यापारी मुस्ताङ आउने गर्छन् । भदौको अन्तिम र असोजको पहिलो साता ब्यापारीहरु स्याउ टिप्न किसानको बगैँचासम्म पुग्छन् । प्रत्येक वर्ष भदौ महिनामा स्याउ बगैँचा हेर्न आउने र असोजकार्तिकमा स्याउ टिपेर बजार पुर्याउने गरेको स्याउ ब्यापारीहरु बताउँछन् । ब्यापारीहरुले मुस्ताङबाट प्रति केजी एक सयमा खरिद गरी बजारमा २ सय रुपैयाँ केजीसम्म बिक्री गर्ने उल्लेख गरे । केही वर्षअघि मुस्ताङका किसानले बिक्री गरेको स्याउ पूर्ण रुपमा विकसित नहुँदै बजारमा पुर्याउने गर्दा मुस्ताङको स्याउको गुणस्तरमा प्रश्न उठेको थियो । चिसो हावापानीमा उत्च्पादन गरिएको मुस्ताङको स्याउले सहर बजारमा उत्तिकै महत्व राख्थ्यो । तर, मुस्ताङमा स्याउ खरिद गर्न आउने ब्यापारीले भदौ महिनामै स्याउ टिपेर बजार लगेर बिक्री गर्दा स्याउ खरिद गर्ने उपभोक्ता निराश हुने गरेका छन् । मुस्ताङको स्याउमा गुणस्तर कायम गर्ने उद्देश्यले प्रधानमन्त्री कृषि आधुनिकीकरण परियोजना, परियोजना कार्यान्वयन ईकाई स्याउ जोन मुस्ताङले किसानलाई असोजअघि नै स्याउ नटिप्न अनुरोध गरेको छ । पछिल्लो समय मुस्ताङका किसान स्याउ खेतीतर्फ आकर्षित हुन थालेपछि मौसम परिवर्तनले किसानको उत्पादनमा उत्साहित बनाउन सकेको छैन । मुस्ताङको जोमसोमदेखि तल्लोक्षेत्रमा स्याउ बोटमा प्रकोप देखिए पनि जोमसोमदेखि माथिल्लो क्षेत्रमा रोग किराको प्रकोप देखिएको छैन । मुस्ताङमा विगत ३ वर्षदेखि उच्च घनत्वको स्याउ खेती सुरु हुन थालेको छ । संघ तथा प्रदेश सरकारको अनुदानमा मुस्ताङका किसानलाई उच्च घनत्वको स्याउ बिरुवा उपलब्ध गराइएको छ । पछिल्लो समय जिल्लामा कुल १५ सय हेक्टर जमिनमा स्याउ बगैँचा विस्तार भएको छ । जसमध्ये करिब ५ सय हेक्टर जमिनमा लगाएको स्याउ बोटले उत्पादन दिने गरेको छ । गत वर्ष मुस्ताङमा ७ हजार एक मेट्रिक टन स्याउ उत्पादन भएको थियो ।"
बाढीग्रस्त क्षेत्रमा विद्युत सेवा कटौती,"गौशाला (महोत्तरी) : महोत्तरीको वलवा नगरपालिका ४ तिलगढमा रातु नदीको पानी पसेर विजुलीका पोलहरूमा क्षति पुर्याएको छ। पोलमा क्षति पुगेपछि सो क्षेत्रमा अनिश्चितकालको लागि विद्युत सेवा कटौती गरिएको छ। सो क्षेत्रमा बाढीको पानीले गर्दा थप जनधनको क्षति हुनबाट जोगाउनका लागि विद्युत सेवामा कटौती गरिएको जलेश्वर वितरण केन्द्रले जनाएको छ। जलेश्वर वितरण केन्द्रले दिएको जानकारी अनुसार लोहारपट्टी र पडौल फिडरको केही थान पोल रातो नदिमा आएको बाढीको कारण क्षतिग्रस्त भएकोले हो। अनिश्चित समयका लागि बाढीग्रस्त क्षेत्र बदिया, बन्चौरी, तिलगढ, रामुटोल, कबिरगमा, भगवानपुर, भ्रमरपुरा, लोहारपटी, डठौरा, पररिया र अन्हारवन गाउँहरुमा सेवा अवरुद्ध गरिएको जलेश्वर वितरण केन्द्रले जनाएको छ । नदीमा पानीको वहाव कम भएपछि क्षतिग्रस्त लाइनलाई मर्मत गरी यथाशीघ्र सुचारु गरिने कार्यालय स्रोतले जनाएको छ।"
