शीर्षक,विवरण
राष्ट्रपति र प्रधानमन्त्रीको दर्शन नै यति महँगो ?,"उनले दोषीहरू खुलेआम हिँड्ने र तिनलाई कारबाहीको माग गर्दा धरपकड गर्ने र झूटो मुद्दा लगाउने प्रयास भएको गुनासो गरिन् । दोषीहरू खुलेआम हिँडिरहेका छन्, सरकार उनीहरूलाई कारबाही गर्दैन, बरु उल्टै हामीलाई यहाँबाट हटाउन लागिपरेको छ तर न्याय पाउने सुनिश्चित नभएसम्म हामी आन्दोलन रोक्दैनौं, उनले भनिन् ।शनिबार अस्पताल भर्ना हुनुअघि रुबीले बाँके प्रहरीका एसपी मधुसुदन न्यौपाने र डीएसपी श्यामकृष्ण अधिकारीले नै अभियुक्तहरूलाई संरक्षण दिएर राखेको, न्यायका लागि संघर्ष गर्दा महिला अधिकारकर्मी र मृतकका परिवारलाई अभद्र व्यवहार गरेको भन्दै उनीहरूलाई पनि कारबाही गर्नुपर्ने माग गरेकी छन् । बाँके प्रहरीका एसपी र डीएसपीले नै अभियुक्तहरूलाई संरक्षण गरेर राख्नुभएको छ, पीडितलाई न्याय दिलाइयोस् भन्ने माग गर्दा महिला अधिकारकर्मी र मृतकका आफन्तलाई नै अभद्र व्यवहार भएको छ, उनले भनेकी छन्, त्यसैले दोषीको संरक्षण गर्ने प्रहरीले पीडितलाई न्याय दिन सक्दैन । सबैभन्दा पहिले त डीएसपी श्यामकृष्ण अधिकारी र एसपी मधुसूदन न्यौपानेलाई विभागीय कारबाही गरियोस् भनेर म सरकारसँग माग गर्दछु ।उनले बाँकेमा प्रहरीले दोषीलाई पक्राउ गरी अदालत पुर्याएको भनेर प्रचार गरे पनि त्यस्तो कुनै काम नभएको बताइन् । प्रहरीले अदालतसम्म मुद्दा पुर्यायौं भनेर सन्देश प्रवाह गरिरहेको छ, वास्तवमा त्यस्तो भइरहेको छैन । नन्कुन्नी धोबीको हत्यामा संलग्न दुई जनालाई समातिएको हो, निर्मला कुर्मीको केसमा कसैलाई पनि प्रहरीले समातेको छैन, उनले भनिन्, हामीमाथि अनावश्यक दबाब, धम्की र धरपकड गर्ने काम भइरहेको छ । अब त हामी संघर्षमा उत्रिएकाहरू नै असुरक्षित छौं । हाम्रो सुरक्षाको ग्यारेन्टी गरियोस् ।श्रीमान्बाट निरन्तर घरेलु हिंसा खेप्दै आएकी नन्कुन्नी धोबी गत ५ साउनमा आफ्नै घरभित्र मृत अवस्थामा फेला परेकी थिइन् । तर, उनको हत्या भएको माइती पक्षको आरोप छ । प्रहरीले भने धोबीको पोस्टमार्टम रिपोर्टले आत्महत्या गरेको देखाएको भन्दै फाइल क्लोज गर्न चाहेको थियो । आन्दोलन सुरु भएपछि प्रहरीले धोबीका पति र उनका जेठाजुलाई पक्राउ गरेको छ । निर्मला कुर्मी भने गत वर्षको मंसिरदेखि बेपत्ता छिन् । दुई छोरीकी आमा उनलाई किन र कसले बेपत्ता पार्यो ? अहिलेसम्म प्रहरीसँग जवाफ छैन । कुर्मीका आफन्तले गत मंसिर १६ मै किटानी जाहेरी दिए पनि प्रहरीले गरेको अनुसन्धानप्रति उनीहरू सन्तुष्ट छैनन् । रुबीले आन्दोलनरत महिलाका घरमा आन्दोलनबाट फिर्ता हुन भन्दै धम्की दिने, झूटो मुद्दा लगाउँछु भनेर डर देखाउने जस्ता गतिविधि भइरहेको सुनाइन् । हामी यहाँ जो साथीहरू छौं, हाम्रो घरमा मान्छे पठाएर धम्की दिने, डर देखाउने काम भइरहेको छ । त्यहाँ आन्दोलनमा किन बसेको ? घर आऊ भनेर दबाब दिने काम भइरहेको छ । आउँछौ भने आऊ, नत्र के गर्नुपर्छ हामीलाई थाहा छ भनेरसमेत धम्क्याइरहेका छन्, उनले भनिन्, हामी सबै आन्दोलनकारीको सुरक्षाको ग्यारेन्टी गरियोस् । हामीमाथि कुनै पनि झूटो मुद्दा लगाउन पाइँदैन । रुबीले यो आन्दोलन दुई महिलाको हत्याको विषय मात्रै नभएर समग्र महिला हिंसा र हत्याका घटनासँग जोडिएको बताइन् । उनले आफूमाथि प्रहरीले ज्यादती गरेको गुनासो गरेकी छन् । जुन दिन प्रहरीले हामीलाई उपचारका लागि भनेर अस्पताल पुर्यायो, त्यहाँ हाम्रो उपचार भएन । बरु पुरुष प्रहरीले हामीमाथि धरपकड गरे । धरपकड गर्दा प्रहरीले मेरो झोलामा रहेका महत्त्वपूर्ण कागजात र ल्यापटप गायब गरिदिएको छ । त्यसपछि मलाई रातारात नेपालगन्ज पुर्याएर झूटो मुद्दामा फसाउने कोसिससमेत गरिएको छ, उनले भनिन् ।"
तीनै तहको चुनाव एकसाथ गर्न छलफल,"त्यसो गर्दा स्थानीय तहको कार्यकाल सकिएको ६ महिनाभन्दा बढी हुन्छ, जुन असंवैधानिक हुन जान्छ । जेठ वा असारमा चुनाव गर्न राष्ट्रिय सहमति बन्नुपर्ने संविधानविद् टीकाराम भट्टराईको भनाइ छ । किनकि प्रतिनिधिसभाको निर्वाचन निर्धारित अवधिभन्दा अघि गर्न संवैधानिक जटिलता हुने उनको तर्क छ । अर्ली इलेक्सन परिकल्पना संविधानले गरेको छैन । सर्वोच्चले सरकार बन्ने विकल्प रहेसम्म प्रतिनिधिसभा विघटन गर्न पाइँदैन भनेर व्याख्या गरेको छ, उनी भन्छन् । राजनीतिक सहमतिमार्फत प्रतिनिधिसभाबाट विशेष प्रस्ताव पारित भएमा भने त्योभन्दा अघि पनि चुनाव हुन सक्ने उनको भनाइ छ ।तीन चुनाव एकसाथ गर्न प्रतिनिधिसभाले आफैंले आफैंलाई मारेर संकल्प प्रस्ताव पास गर्नुपर्छ, अरू उपाय छैन, उनी भन्छन्, यसो गरे मात्रै यो अन्तर्राष्ट्रिय मान्य संसदीय सिद्धान्तमा पर्छ । त्योबाहेक प्रतिनिधिसभा जीवित रहेसम्म अर्ली इलेक्सनमा जान सकिँदैन ।"
तीन किशोरी बलात्कृत,"सिन्धुली (कास) आफन्तको घरमा दसैंको टीका लगाएर फर्किएका तीन किशोरीमाथि सामूहिक बलात्कार भएको छ । बलात्कार आरोपमा प्रहरीले ३ युवकलाई पक्राउ गरेको छ । ६ जना फरार छन् । बाटोमा ढुकेर बसेका ९ जना युवाले शनिबार राति कमलामाई नगरपालिका५ को लब्दाह खोलाको पुलमुनि किशोरीहरूलाई बलात्कार गरेका हुन् । मध्यरातमा किशोरीहरू घर आउँदै थिए । पुलमुनि अँध्यारोमा एकान्त स्थानमा सामूहिक बलात्कार गरिएको उजुरीमा उल्लेख छ । कमलामाई५ बोझेका ती किशोरीहरूका अभिभावकले उजुरी दिएपछि तीन युवकलाई पक्राउ गरेको सिन्धुलीका प्रहरी निरीक्षक रामभक्त भट्टराईले जानकारी दिए । बलात्कृत हुने किशोरीहरू १५, १६ र १७ वर्षका छन् । पक्राउ पर्नेमा २२ वर्षीय हिमा लामा, २४ वर्षीय गणेश मगर र २२ वर्षीय विवेक मगर छन् । फरारहरूको खोजी भइरहेको प्रहरी निरीक्षक भट्टराईले बताए ।"
कुटपिटपछि मृत्यु,"(चितवनकाठमाडौं)  दसैंको नवमीका दिन बिहीबार भरतपुर महानगरपालिका४ दुर्गाचोकमा स्थानीय भीमबहादुर विकको ज्यानै जाने गरेर भएको कुटपिट घटनामा संलग्नलाई कारबाही गर्न विभिन्न दलित संघसंगठन र मानव अधिकारवादीले माग गरेका छन् । बिहान १० बजे आसपास भएको घटनामा संलग्न दुई जनालाई प्रहरीले तत्काल गिरफ्तार गरिसकेको छ ।विभिन्न १९ वटा संघसंस्था र व्यक्तिले आइतबार संयुक्त रूपमा जारी गरेको विज्ञप्तिमा दुर्गाचोकमा रहेको मन्दिरमा दसैंका बेला बोका चढाउने विषयमा भीमबहादुरले सोधखोज गर्दा गालीगलौज र कुटपिट भएको उल्लेख छ । घटनामा जातीय विभेदसमेत जोडिएको आरोप विज्ञप्तिमा छ । उनीहरूले ज्यानसम्बन्धी कसुरका साथै घटनामा संलग्नलाई जातीय विभेदमा पनि कारबाही गर्न माग गरेका छन् ।जिल्ला प्रहरी कार्यालय चितवनका डीएसपी नरहरि अधिकारीका अनुसार घटनामा संलग्न भएको आरोपमा सोही ठाउँका सीताराम बस्नेत र दुर्गाचोकमा मेडिकल सञ्चालन गरेका दिलीप श्रेष्ठलाई तत्काल पक्राउ गरिएको हो । त्यतिबेला हामीलाई प्राप्त जानकारीअनुसार भीमबहादुरले मादक पदार्थ खाएर गाली गर्दै हिँडेपछि बस्नेत र श्रेष्ठले कुटपिट गरेको भन्नेछ, डीएसपी अधिकारीले भने । प्रहरीमा ज्यानसम्बन्धी कसुरमा जाहेरी परेकाले त्यहीअनुसार अनुसन्धान अघि बढेको जानकारी उनले दिए । नारायणगढ बजारदेखि करिब ५ किमि पश्चिम सहिदचोक हुँदै मंगलपुर जाने सडकनजिक दुर्गाचोक छ । चोक आडमा सानो मन्दिर छ । मन्दिरदेखि दक्षिणतर्फ करिब तीन सय मिटर पर भीमबहादुरको घर छ । ५८ वर्षका भीमबहादुर यहाँका पुराना बासिन्दा हुन् । भीमबहादुरका २८ वर्षीय छोरा किसन विकले नवमीका दिन बिहान साढे ८ बजेसम्म बुबा घरमै रहेको बताए । त्यसपछि सामान किन्न भन्दै तल झर्नु भएको थियो, मन्दिरमा बोका चढाउने विषयमा सोधखोज गर्नुभएको थियो भनेर हामीलाई सुनाएका छन्, सोधखोज गर्दैमा यसरी आक्रमण भएछ, उनले सुनाए । डीएसपी अधिकारीका अनुसार सुरुमा सीतारामले भीमबहादुरलाई पाइपले पिटेका थिए । त्यसपछि मेडिकल चलाउने दिलीपले झापड हान्दा उनी सडकमा बजारिएका थिए । जसका कारण टाउकामा चोट लागेको थियो । दिलीप आफैंले गाडीका राखेर उपचारका लागि चितवन मेडिकल कलेजको शिक्षण अस्पतालमा ल्याएका रहेछन्, अस्पताल ल्याउनासाथ चिकित्सकले मृत घोषणा गरेका हुन्, उनले भने । श्रेष्ठको मेडिकल र बस्नेतको घर मन्दिरनजिकै छ ।त्यतिबेला हामीलाई भीमबहादुरले मादक पदार्थ खाएर भन्नु नभन्नु भनेपछि कुटपिट गरेको भनिएको थियो । मन्दिरको विषय के हो, यो पनि अनुसन्धान गर्दैछौं, अहिले खुलेको छैन, अधिकारीले भने । मन्दिरदेखि करिब सय मिटर पर चोकमै घर भएका भागवत कँडेलले प्रहरी आएपछि मात्र आफूले घटनाबारे जानकारी पाएको बताए । भीमबहादुर यहाँका पुराना मान्छे हुन् । बेलाबेलामा मादक पदार्थ खाने गरेको थाहा छ । त्यस दिन पनि खाएका थिए रे भन्ने सुनेको हो । जे भयो साह्रै नराम्रो भयो, उनले भने । दलित संघसंस्था र मानव अधिकारका क्षेत्रमा सक्रिय व्यक्तिले जारी गरेको विज्ञप्तिमा घटना जातीय विभेदसँग जोडिएको दाबी गर्दै स्थानीय प्रशासनले कुनै दबाबमा नआई निष्पक्ष छानबिन गर्नुपर्ने माग गरिएको छ । जातीय भेदभाव तथा छुवाछूत (कसुर सजाय) ऐन २०६८ र ज्यानसम्बन्धी कसुरअन्तर्गत यस घटनाका दोषीहरूलाई हदैसम्म कानुनी कारबाही गरियोस्, न्यायिक निकायबाट कुनै पनि किसिमको प्रभावमा परी हदैसम्मको कारबाही नभएको खण्डमा यसले ठूलो राष्ट्रव्यापी आन्दोलनसंघर्षको रूप लिनेछ, विज्ञप्तिमा भनिएको छ ।भीमबहादुरका छोरा किसनले बुबाले मन्दिरमा पूजा गर्न पाइन्छ कि पाइँदैन भनेर सोधेकै आधारमा कुटपिट गरिएको दाबी गरे । हामीलाई अरू बेला पनि मन्दिर प्रवेश गर्न दिइँदैन । त्यही कुरालाई लिएर बुबाले दलितलाई पनि पूजा गर्न दिनुपर्छ भन्नुभएको रहेछ, उनले कान्तिपुरसँग भने, पहिले पाइपले पिठ्युँभरि डाम बस्ने गरी कुटेछन् । पछि फेरि झापड हान्दा बुबा ढल्नुभएछ, अप्ठ्यारो ठाउँमा लाग्यो होला, बुबा त्यही बित्नुभयो । उनले थपे, बुबालाई अरू कुनै रोग पनि थिएन । राम्रैसँग काम गर्दै आउनुभएको हो । त्यो दिन बिहान जुरुक्क उठेर जानुभएको, फेरि फर्किनुभएन ।भरतपुर महानगरपालिकाका प्रवक्ता अरुणपीडित भण्डारीले जातका आधारमा मन्दिर प्रवेशमा निषेध गरिएको सन्दर्भमा यस्तो घटना हुनु निन्दनीय भएको बताए । दुर्गा पूजाको सन्दर्भमा दलितले पनि पूजा गर्न पाउनुपर्छ भन्दा त्यस्तो घटना भएको रहेछ । मन्दिरमा पूजा गर्ने विषयमा कुटपिट र झगडा गरी ज्यानै जानेसम्मको घटना हुनु अत्यन्तै निन्दनीय हो, उनले भने, जमाना कहाँ पुगिसक्यो, हामी कहाँ छौं, सोच्नुपर्ने अवस्था आएको छ । महानगरमै यस्तो घटना हुनु दुःखद कुरा हो ।वडा४ का अध्यक्ष हरिप्रसाद आचार्यले भने गाउँमा जातीय विभेदको समस्या नरहेको बताए । मेरो वडामा त्यस्तो समस्या छैन, मैले कार्यालय सहायक नै दलित राखेको छु । पहिले त्यस्तो समस्या थियो । अलि विवादित ठाउँ पनि हो, तर यो घटनामा मैले त्यस्तो बुझिनँ । उनको अलि बढी बोल्ने स्वभाव रहेछ । मादक पदार्थ पनि सेवन गरेका रहेछन् । स्थानीयले घर जाऊ, हल्ला नगर भन्दा नमानेपछि कुटपिट भएको रहेछ, फेरि मान्छेअनुसार बुझाइ फरक हुन्छ, उनले कान्तिपुरसँग भने, मुद्दालाई जाततिर नलैजाऔं, त्यसो गर्दा घटनाले अर्को रूप लिन्छ भनेर साथीहरूलाई भनेको छु । पीडित परिवारलाई राहत र दोषीलाई कारबाहीका लागि पहल गर्ने प्रतिबद्धता आफूले जनाएको उनले बताए ।घटनाको चार दिन बित्दासमेत परिवारले शव बुझेको छैन । शनिबार भरतपुर अस्पतालमा पोस्टमार्टम भए पनि रिपोर्ट नआएको डीएसपी अधिकारीले बताए । रिपोर्ट नआउँदासम्म शव नबुझ्ने अडानमा परिवारका सदस्य छन् । दोषीहरू पक्राउ परेका छन्, तर कारबाही हुने सम्भावना देखिरहेको छैन । हामीलाई दलित भनेर फेरि टालटुल पारेर झुक्याउने काम हुन सक्छ, त्यसैले न्याय पाउने अवस्था नभएसम्म शव बुझ्दैनौं, किसनले भने । भीमबहादुर निर्माण मजदुर हुन् । उनका श्रीमती, १ छोरा र ३ छोरी छन् । छोरीहरूको विवाह भइसकेको छ ।"
