शीर्षक,विवरण
जब निगमको जहाज ७ यात्रु छाडेरै उड्यो,"(काठमाडौं)  माइतीको हातबाट दसैंको टीका लगाउने खुसी मनमा साँचेर शारदा राउत आइतबार बिहान सानो काखे बाबुसहित भोजपुर जान काठमाडौं विमानस्थल पुगिन् । उनको टिकटमा काठमाडौंभोजपुर समय बिहानको ८ः३० बजे लेखिएको थियो । उनी एक घण्टाअघि अर्थात् ७ः३० बजे त्रिभुवन अन्तर्राष्ट्रिय विमानस्थलस्थित आन्तरिक ट्रमिनल भवनमा पुगिसकेकी थिइन् । टिकट थियो, राष्ट्रिय ध्वजावाहक नेपाल वायुसेवा निगमको । निगमको काउन्टरमा जब उनी बोर्डिङ पास लिन पुगिन् । त्यहाँ निगमका कोही कर्मचारी थिएनन् । लगत्तै उनी ३ महिनाको सानो छोरा र झोलातुम्बा बोकेर निगमको टर्मिनल भवनभित्रै रहेको विमानस्थल कार्यालयमा पुगिन् । उडानबारे त्यहाँ रहेका कर्मचारीले दिएको खबरले माइती घरमा दसैं मनाउने उनको योजना क्षणभरमै भताभुंग भयो । उनले टिकट काटेको जहाज त एक घण्टाअघि नै भोजपुरका लागि उडिसकेछ । निगमको टुइनअटर जहाजले शारदालाई मात्रै होइन उनी जस्तै दसैंको टीका थाप्न घर फर्किन लागेका र बिरामी अभिभावकलाई भेट्न जाँदै गरेका ७ जना यात्रुलाई छाडेर बिहान ६ः४५ बजे नै उडिसकेको रहेछ । जहाज उडिसकेको खबर थाहा पाएपछि त्यहाँ छुटेका यात्रु र कर्मचारीबीच भनाभन चल्यो । कर्मचारी पन्छिए । हामी केही गर्न सक्दैनौं । न्युरोड हेड अफिस जानुहोस् । टिकटमा समय जसले लेखेको उसैलाई भन्नुहोस् भनी सेवाग्राहीसँग पन्छिए, राउतले भनिन्, झन्डै हात हालाहालको अवस्था आइपर्यो । निगमको जहाजले काठमाडौंभोजपुर यात्रामा ४० मिनेट समय लगाउँछ । यो रुटमा निगमले प्रतियात्रु ५ हजार ३ सय रुपैयाँ भाडा लिन्छ । अरू बेला समय सारिएको फोन आउँथ्यो, यसपटक त्यस्तो केही खबर गरिएन, राउतले भनिन् । उडानमा रहेका चालक दलले भोजपुर पुगेर काठमाडौं फर्किने बेलामात्रै यात्रु छुटेको खबर पाएका थिए । भोजपुरबाट उडेको केही समयपछि एटीसीले तपाईंहरूले काठमाडौंमा ७ जना यात्रु छाडेर आउनुभएको रैछ भने, उक्त उडानमा रहेका क्याप्टेन रचित मल्लले कान्तिपुरसँग भने । टर्मिनलमा रहेको निगमको कार्यालयबाट सहयोग नपाएपछि उडान छुटेका ७ यात्रु निगम मुख्यालय पुगे । त्यहाँ टिकटमा साढे ८ बजे लेख्ने अधिकृत ओमप्रकाश ठाकुरसँग निकै भनाभन चल्यो । लामो वादविवादपछि उनीहरूलाई सोमबारको ९ बजेको उडानको टिकट बनाइयो । यो घटनाबारे यात्रुले आइतबारै पर्यटन मन्त्रालयमा पनि उजुरी दिए । यात्रुको उजुरीपछि पर्यटन मन्त्री प्रेमबहादुर आलेले निगमका महाप्रबन्धक डिमप्रसाद पौडेललाई घटनाका सम्बन्धमा छानबिन गर्न भनेका छन् । मन्त्रीको निर्देशनपछि निगमको वाणिज्य विभागका निर्देशक जनकराज कालाखेतीले टिकट बिक्री गर्ने अधिकृत ओमप्रकाश ठाकुरलाई ४८ घण्टाको स्पष्टीकरण सोधेका छन् । काठमाडौंभोजपुर यात्रा गर्ने यात्रुहरूलाई मर्का पर्न गएको र ७ यात्रुको राजस्व गुम्नुका साथै निगमको साखमा समेत गम्भीर असर पर्न गएको हुँदा के कति कारणले यस्तो लापरबाही भएको हो सोमबार कार्यालय समयभित्र स्पष्टीकरण पेस गर्नू, अधिकृत ठाकुरलाई लेखिएको स्पष्टीकरणमा उल्लेख छ ।"
यसरी बन्यो बैंक लुट्ने योजना,"यसो भन्छन् घाइते सुरक्षागार्ड ?दिउँसोको समय थियो । बैंकमा सामान्य ढंगले कारोबार भइरहेको थियो । ड्युटीमा तैनाथ सुरक्षागार्ड कुमालले सेवाग्राहीको सुरक्षा जाँच गर्दै भित्र पठाइरहेका थिए । त्यो क्रममा सरासर भित्र प्रवेश गर्ने व्यक्तिहरूलाई रोकेर के कामका लागि आएको प्रश्न गरे । माथि एउटा काम छ भन्दै बैंकको एक फन्को लगाएर उनीहरू फर्के । १५ मिनेटपछि उनीहरू फेरि आए । कुमालले रोक्न खोजे । वरिपरिबाट घेरेर उनीहरूमध्ये एकले कुमालको खुकुरी खोसे । अर्को एकले पेस्तोल ताके । कुमालले खोस्नै खोज्दा घम्साघम्सीका क्रममा पछाडिबाट अर्को लुटेराले प्रहार गरेको दुई राउन्ड गोली कुमालको घाँटीको दुवै छेउतिर लाग्यो । एउटा छोएर गयो भने अर्को गोली भित्रै अडकियो । उनी भुइँमा ढले । कोलाहल मच्चियो । गोली प्रहारपछि मलाई करेन्ट लागे जस्तो भयो, घटनाको ५७ मिनेटमै मलाई यहाँ ल्याइयो, त्यसपछि के भयो ? मलाई थाहा छैन, सुरक्षागार्ड कुमालले कान्तिपुरसँग भने, बैंकका कर्मचारी, धनमाल र सेवाग्राहीको सुरक्षाका लागि मैले सकेसम्मको कोसिस गरें । मोरङ प्रहरीका अनुसार गोली प्रहारको दुईतीन मिनेटभित्र लुटेराहरूले बैंक लुटे । मुख नछोपी र मास्क नलगाई आए पनि लुटेराहरूमध्ये कसैलाई पनि आफूले चिन्न नसकेको कुमालले बताए ।"
देउवा सरकारको औचित्य !,"केपी शर्मा ओलीको शासन शैलीसँग असहमत भएरै अहिलेको गठबन्धन सरकार बनेको हो । यसर्थ ओलीकै जस्तो स्वेच्छाचारी ढंगले हिँड्ने छुट शेरबहादुर देउवा सरकारलाई छैन । आमजनता देउवा सरकार प्रजातान्त्रिक ढंगले हिँडोस्, संविधानका अक्षर र भावनाको कदर गरोस्, हावादारी सपना नभई जनताका आधारभूत आवश्यकता पूरा गर्न लागोस्, ओली सरकारको पालामा भएका भ्रष्टाचारका काण्डहरूको छानबिन गरोस् र राज्यका सबै अंग स्वतन्त्र, निष्पक्ष भएरअघि बढ्ने वातावरण बनाओस् भन्ने चाहन्छन् । हिजो ओलीविरुद्धको गठबन्धनका पार्टीहरूले सडकमा यही नारा दिएका थिए । तर, आज आफैंले गरेका वाचाबाट पछि हटिरहेको आभास जनतालाई हुन थालेको छ । गैरसांसद गजेन्द्र हमाललाई मन्त्री नियुक्त गर्नमा होस् वा बाँकेको नेवाजी गाउँका महिलाहरूले उठाएको न्यायिक आवाज सुन्नमा ढिलाइ गर्नमै किन नहोस् । अनि रुबी खानलाई थुनामा राखेको अवस्थामा समेत थुनेको छैन भनेर अदालतमा झूटो जवाफ पठाउनमा होस् वा मोतीपुर घटनामा अधिक बल प्रयोग गर्दा ठूलो क्षति व्यहोर्नुपरेको वास्तविकता नै किन नहोस्, यी सबै घटनाले कहीँ देउवा सरकार पनि ओलीकै पथमा हिँड्न खोजी हो कि भन्ने लाग्न थालेको छ । मोतीपुरमै एमाले नेता विष्णु पौडेलले केही दिनअघि ढुंगा खाएका थिए । यो घटनामा पौडेलको धारणा के छ, आम नागरिक जान्न चाहन्छन् अनि आइन्दा यस्तो काम धेरै तयारी गरेर मात्र गरियोस् । ओलीले आफ्नो पालामा राजस्व अनुसन्धान, गुप्तचर जस्ता शक्तिशाली विभागहरू नियमविपरीत आफ्नो मातहतमा ल्याएका थिए, जसको पछाडि शक्तिको भोक मुख्य कारण थियो । देउवाले ओलीको त्यो गल्तीलाई सच्याउलान् भन्ने अपेक्षा थियो । तर, तीन महिना बित्दासमेत यो काम भएको छैन । देउवा सरकारले राम्रो काम देखाउन सके मात्र ओली सरकार हटाउनुको औचित्य पुष्टि हुन्छ । गोपाल देवकोटा, जोरपाटी, काठमाडौं"
बिहानबेलुका सरकारी कार्यालय,"सरकारले पुँजीगत खर्च बढाउन र विकास निर्माणका काममा गति दिन दिउँसो र राति गरी दुई चरणमा काम लगाउने तयारी गरिरहेको विषय स्वागतयोग्य छ । यद्यपि, यो योजना विकास निर्माणतर्फ मात्रै केन्द्रित देखिन्छ । दैनिक सेवापर्वाहतर्फ पनि यस्तै योजना ल्याउनुपर्छ । अहिले सरकारी कर्मचारी बिहान १० देखि साँझ ५ बजेसम्म दिनको ७ घण्टा काम गर्छन्, सरकारी कार्यालयहरू पनि दिउँसो मात्र सञ्चालन हुन्छन् । कर्मचारीले काम गर्ने समय सामान्यतया दिनको ८ घण्टा हो । अहिलेको समयमा थप १ घण्टा सरकारी कार्यालय खुले जनतालाई केही सहज हुने थियो । दुर्गम जिल्लाको कुनै नागरिक काठमाडौं आएर सेवा लिन, कम्तीमा दुई दिन लाग्छ । सरकारले मन्त्रालय तथा विभागमा पनि दिनको दुई चरणमा काम प्रवाह गराउने हो भने आमजनताले समयमै सेवा पाउनेछन् । फलस्वरूप भ्रष्टाचार पनि रोकिन सक्छ । बिहान ७ देखि दिउँसो १ बजेसम्म एक सिफ्ट र १ देखि ७ बजेसम्म अर्को गरी कर्मचारीहरूलाई काम लगाउने हो भने आमजनतालाई राहत हुने थियो । होइन भने कर्मचारीलाई सरकारी काम कहिलेजाला घाम भइरहनेछ र जनताले कहिल्यै पनि समयमा सेवा पाउने छैनन् । यस विषयमा सम्बन्धित निकायले ध्यान दिनुपर्छ । भुवन सिंह पाण्डे, बूढानीलकण्ठ ८, काठमाडौं"
सवारी दुर्घटनासम्बन्धी योजना खोइ ?,"गत मंगलबार मुगुको छायानाथ रारा नगरपालिकामा बस दुर्घटनामा परी ३२ जनाको मृत्यु भयो । ती मृत्यु हुनेहरू प्रायः युवा उमेरका थिए । त्यस्तै गत सोमबार कास्कीको घान्द्रुक घुम्न गएका ८ जनाको जिप दुर्घटनामा मृत्यु भयो । अछाममा पनि दसैंकै बेला जन्ती बोकेको जिप दुर्घटना हुँदा ४ जनाको मृत्यु भयो । यी त प्रतिनिधि घटना मात्र हुन् । देशभरि चाडबाडका बेला यसरी दुर्घटना बढ्न थालेको धेरै भयो तर यसो हुनुको कारण पत्ता लगाएर यसलाई कम गर्ने तदारुकता सम्बन्धित निकायले देखाउन सकेको छैन । घटना भइसकेपछि छानबिन समिति बनाएर नाटक गर्नुभन्दा पहिल्यै चाडबाडका बेला यात्रुहरू ओसारपसार गर्ने सवारीसाधनलाई निगरानी गर्नु आवश्यक छ । खचाखच यात्रु कोचेर दुर्घटना निम्त्याउनुभन्दा सिट क्षमताबाहेक यात्रु बोक्न बन्देज गर्नु जरुरी छ । सवारी तीव्र गतिमा कुदाउनाले पनि दुर्घटना दर बढेको विभिन्न अध्ययनले देखाउँछ । पैसाका लागि छतमा समेत हालेर यात्रा गराउनु जोखिमपूर्ण हुन्छ, यो पनि दुर्घटनाको मुख्य कारकमध्ये एक हो । ट्राफिक प्रहरीले दसैं, तिहार जस्ता चाडपर्वमा हुने सवारी दुर्घटना न्यूनीकरण गर्न चेकजाँचलाई कडा गर्नु आवश्यक छ । यात्रुहरूको चापलाई मध्यनजर गर्दै यातायात व्यवसायीहरूलाई सवारीसाधनको संख्या बढाएर सुरक्षित तरिकाले गन्तव्यमा पुर्याउन सरकारले सहयोग गर्नुपर्छ । क्षमताभन्दा धेरै यात्रु बोक्ने, बिनाइजाजत सवारी चलाउने, अनुमतिपत्रबिना सवारी कुदाउनेजस्ता नियमविपरीत कार्य गर्ने सवारीधनीको इजाजत रद्द गर्नुपर्छ । उनीहरूलाई जरविाना तथा रसिद काटेर छोड्नु हुँदैन । घान्द्रुकको दुर्घटना धेरै यात्रु बोकेकाले भयो । देशका अन्य भेगमा भएका छिटपुट दुर्घटनाका मुख्य कारण पनि यात्रुको अत्यधिक चाप हुने गरेको छ । चाडबाडका बेला सार्वजनिक सवारीसाधन बढाए पनि त्यसको मर्मत र सम्भारमा ध्यान दिइँदैन । सवारीसाधनले यात्रुलाई सहज बनाउनेभन्दा पनि जीवन नै गुम्ने हो कि भन्ने डर पैदा गर्ने गरेको छ । यात्रुहरूलाई जोखिममा नपार्न सम्बन्धित निकाय बेलैमा सचेत हुनु जरुरी छ । यात्रुहरूले पनि यात्राभन्दा ठूलो ज्यान हो भन्ने बुझेर जबर्जस्ती, जोखिम मोलेर यात्रा गर्नु हुन्न । रोग लागेर उपचार गर्नुभन्दा रोगको बाटो नै बन्द गर्नु वेश । कुसुम न्यौपाने, अरूणखोला, नवलपरासी (पूर्व)"
