शीर्षक,विवरण
सिंगो विश्व तरंगित,"अमेरिकाको एकल वर्चस्वलाई चुनौती दिँदै चीनको उदय हुनु इतिहासको अनिवार्यता र आकस्मिकता दुवै हो । ठूलाठूला साम्राज्य पतन वा कमजोर भएर जानु र अर्को राष्ट्र शीर्षस्थ स्थानमा पुग्नु इतिहासको नियमजस्तो भएको छ । घाम नअस्ताउने साम्राज्यको अधिपति बेलायत आज ओरोलो लागेको छ । चीन भने एक दशकभित्रैमा शीर्ष स्थानमा पुग्ने आकलन गरिएको छ, उनले भने, अमेरिकाको स्थानमा चीन पुग्नु एउटा आकस्मिकता पनि हो, अन्य देश पनि पुग्न सक्थे होलान् । चीन आफ्नै सक्षमताका कारण त्यो स्थानमा पुग्दै छ ।चिनियाँ कम्युनिस्ट पार्टीले स्थापनाको सय वर्ष मनाइरहेका बेला नेपालका कम्युनिस्ट पार्टीहरू भने स्थापनाको ७० वर्ष पूरा भएको तिथिमिति पल्टाएर इतिहासमै रमाउने स्थिति मात्रै छ । कम्युनिस्ट सिद्धान्तको एकदलीय पद्धतिलाई पन्छाएर बहुदलीय प्रतिस्पर्धामा जाने लोकतान्त्रिक पद्धति अँगाले पनि नेपालका कम्युनिस्टमा व्यक्तिगत स्वार्थ को घेरा कहिल्यै नघटेको तुलाधर बताउँछन् । चीनले जेजसरी आर्थिक, रणनीतिक र राजनीतिक विकासक्रमको अभियानलाई अघि बढायो, यसमा सबै तहमा व्यक्तिगत स्वार्थको घेरा नभएर र सामूहिक स्वार्थमा अघि बढेरै यो स्थिति आएको हो, उनले भने । नेपालका कम्युनिस्टले बहुदलीय प्रतिस्पर्धामा जाने भने पनि बहुदलीय पद्धतिका नराम्रो पक्ष मात्रै आफूले लिने गरेको तर एकदलीय भनेर चिनियाँ कम्युनिस्ट पार्टीका अनुपम पक्षलाई स्विकार्न नचाहेको उनको बुझाइ छ । आफू तत्कालीन प्रधानमन्त्री झलनाथ खनालको विदेश मामिला सल्लाहकार भएका बखत पहिलो सल्लाह मनमोहन अधिकारीको आदर्श र व्यवहार सम्झनुस् है भनेको तुलाधरले सुनाए । झलनाथजीले पनि खासै केही सिक्न र अनुशरण गर्न सकेको देखिएन, उनले भने । पछिल्लो उदाहरण कोरोना महामारीले सिंगो विश्व आक्रान्त र संकटमा परिरहेका बेला कोरोनाको उत्पत्ति थलो चीन भने यही संकटलाई अवसर बनाएर अघि बढिसकेको छ । हामीले कम्युनिस्टका नारालाई आदर्श बनायौं, व्यवहारमा भने कहिल्यै सरोकारै राखेनौं, मास्केले भने, यही कारण चिनियाँ कम्युनिस्टहरू त्यहाँ छन्, हामी कहींकतै पनि छैनौं । नेपालका कम्युनिस्टहरूमध्ये मनमोहन अधिकारी, पुष्पकमल दाहाल, माधवकुमार नेपाल, झलनाथ खनाल, बाबुराम भट्टराई र केपी शर्मा ओली गरी ६ जना प्रधानमन्त्री भइसकेका छन् । २०५१ सालपछि एमाले निरन्तर जस्तै सरकारको नेतृत्वमा छ । २०६४ सालको संविधानसभाको निर्वाचनपछि माओवादी पनि त्यसैगरी कुनै न कुनै रूपमा सत्तामा निरन्तर छ । तर कम्युनिस्टले भन्दै आएका जनजीविकाका कुरामा ठूलो परिवर्तन ल्याउन सकेका छैनन् । योबीच नेपालका कम्युनिस्टहरूलाई दुइटा ठूल्ठूला अवसर प्राप्त भएका थिए । पहिलो, ठूलो अवसर आएको थियो २०६४ सालमा । राजतन्त्रसमेत फालिएपछि माओवादी तत्कालीन संविधानसभामा निकै ठूलो उपस्थितिसहित उदाएको थियो । तर उसले पनि केही गर्न सकेन । बरु सत्ताको खिचातानीको संसदीय फोहोरी खेलमा डुब्यो । यतिसम्म कि माओवादीकै नेतृत्वको सरकार हँॅदा पहिलो संविधानसभाले संविधान नबनाई मृत्युवरण गर्नुपर्यो । २०७४ सालका स्थानीय तह, प्रतिनिधिसभा र प्रदेशसभाको निर्वाचनपछि अर्को अवसर आयो । वाम गठबन्धनका नाममा निकै ठूलो मतसहित संघदेखि प्रदेश र स्थानीय तहसम्म कम्युनिस्टहरूको वर्चस्व कायम भयो । सातमध्ये ६ वटा प्रदेशमा तत्कालीन नेकपाको एकल सरकार बन्यो । केन्द्रमा करिब दुई तिहाइ नेतृत्वको ओलीको सरकार निर्माण भयो । स्थानीय तहमा पनि ठूलो संख्यामा जनप्रतिनिधि कम्युनिस्ट पार्टीहरूबाटै निर्वाचित भए । बिग्रेको शासन प्रणालीका अवयवलाई नयाँ ढंगले चलायमान गराउन कम्युनिस्टहरूलाई पर्याप्त अवसर प्राप्त भएको थियो । तर यी सबै अवसर उनीहरूले गुमाएका छन् । उनीहरू अहिले पनि उही ७० वर्षदेखि चलिआएको टुटफुटको शृंखलाबाट बाहिर आउन सकेका छैनन् । चिनियाँ कम्युनिस्ट पार्टीे सय वर्षमा आर्थिक कायापलट गरेर विश्व महाशक्ति बनेको घटनाले संसारको ध्यान खिचिरहेका बेला ७० वर्षर् ेइतिहास भएको नेपाल कम्युनिस्ट पार्टीको एउटा हाँगो एमालेमा केन्द्रीय कमिटी बैठक बसाउने विषयमै नेताहरूको जुँगाको लडाइँ चलिरहेको थियो ।"
