शीर्षक,विवरण
छात्रवृत्तिका विद्यार्थी भन्छन् : हामी कहाँ पढ्न जाने ?,"काठमाडौं : पारामेडिक्सतर्फका विद्यार्थीले छात्रवृत्तिमा नाम निकाले कलेजले भर्ना लिन नमानेपछि रुष्ट भएका छन्। कलेजले भर्ना लिन नमानेको भन्दै पीडित विद्यार्थीले संसदीय समितिको ध्यानाकर्षण गराएका छन् । संसदको शिक्षा तथा स्वास्थ्य समितिलाई उनीहरुले शुक्रबार बिहान ज्ञापनपत्र बुझाएका हुन् । पीडित विद्यार्थी अंकिता मण्डलले आफूले संसद्को शिक्षा तथा स्वास्थ्य समितिमा पत्र बुझाएको अन्नपूर्णलाई बताइन्। उनले भनिन्,'आयोगले हाम्रो कुरा सुनेन। विश्वविद्यालयले पनि हामीलाई वेवास्ता गर्यो। बाध्य भएर संसद् समितिमा आएका हौं।' उपरोक्त सम्बन्धमा राष्ट्रिय चिकित्सा शिक्षा आयोगको २०७७७८ मा लिइएको एकीकृत प्रवेश परीक्षामा उत्तीर्ण भइ छात्रवृत्तिमा प्यारामेडिक्स जस्तै बीएससी नर्सिङ, बिपिएच, विफार्मालगायतको विषयमा पूर्वाञ्चल विश्वविद्यालयअन्र्तगत काठमाडौं उपत्यकाभित्र रहेका आधिकांश शिक्षण संस्थाले निकै कम विद्यार्थी र छात्रवृत्तिको मात्र विद्यार्थी भएका कारण पठनपाठन गराउन अस्वीकार गरेको अवगत गराउन चहान्छौं । २०७८ साल मंसिर ११ बाट सुरु हुनुपर्ने पठनपाठन हालसम्म पनि सुरू नभएको साथै हाम्रो समस्या चिकित्सा शिक्षा आयोगमा पटक पटक व्यक्त गर्दा पनि आयोगले बेवास्ता गरेको कारण हामीलाई मानसिक पिडाले सताइरहेको हुनाले शिक्षा तथा स्वास्थ्य समितीमा यो करा पुर्उयाउन बाध्य भयौं, 'ज्ञापनपत्रमा भनिएको छ। पूर्वाञ्चल विश्वविद्यालयअन्र्तगत उपत्यकामे छात्रवृत्ति पाएका विद्यार्थीलाई उपत्यकामै रहेका १० भन्दा बढी पूर्वाञ्चलका कलेजमध्ये जुनकुनै एकमा मर्ज गराउनुपर्ने, चिकित्सा शिक्षा आयोडाले भर्ना अगावै छात्रवृत्तिका विद्यार्थीसँग गरेको कबूलियतनामा खारेज गरी विद्यार्थीले चाहेको अरू कलेज वा विश्वविद्यालयमा पढ्ने वातावरण मिलाउनुपर्ने विद्याथर्तीको माग छ । यस्तै, काठमाडौं उपत्यका बाहिरका छात्रावृत्ति पाएका विद्यार्थीहरू पनि काठमाडौंमा नै सहज हुने भएकाले र सबै विद्यार्थीहरू सहमत पनि भएकाले उपत्यका भित्रै मर्ज गर्नुपर्ने माग अघि सारेका छन् । चिकित्सा शिक्षा आयोगका सूचना अधिकारी सेमन्तराज कोइरालाले छात्रबृत्तिमा नाम निकालेका विद्यार्थीको समस्या सम्बोधनका सन्दर्भमा सम्बन्धित विश्वविद्यालयसँग योजना माग गरिएको बताए । उनले भने, विश्वविद्यालयको योजना मागेका छौं। केहीको आइ पनि सकेको छ । यसरी पढाउँछौं भनेर प्रस्ताव पठाउँदैछन् । सम्भवतः मंगलबार निर्णय हुनसक्छ । समस्या के हो ? गत भदौ ८ मा चिकित्सा शिक्षातर्फको एकीकृत प्रवेश परीक्षामा असन्तुष्ट जनाउँदै नीजि कलेज सञ्चालकहरुले सरकारलाई चाबी बुझाए । उनीहरुले राष्ट्रिय चिकित्सा शिक्षा आयोगलाई मंगलबार चाबी बुझाएका थिए । कारण थियो,एकीकृत प्रवेश परीक्षामा आयोगले छुट्याएको कोटाभन्दा निकै न्युन मात्रामा विद्यार्थी उत्तिर्ण हुनु । बिएससी नर्सिङ,बिएससी एमएलटी, बिपिएचलगायतमा सिट संख्याभन्दा प्रवेश परीक्षामा उत्तिर्ण हुनेको संख्या कम भएपछि कलेज सञ्चालकहरुले उत्तिर्ण प्राप्तांकको प्रतिशत घटाउनुपर्ने माग पनि राखे । सिट संख्याभन्दा कम विद्यार्थी उत्तिर्ण भएपछि मेडिकल कलेज नै खाली हुने अवस्था आएको भन्दै कलेज सञ्चालकहरुले उत्तिर्ण प्राप्ताकं ३५ प्रतिशतमा झार्नुपर्ने अडान राखेका थिए । नीजि कलेज सञ्चालकको भनाइ छ, शुल्क निर्धारण आयोगले गर्ने, कलेज अनुगमन आयोगले गर्ने, सिट निर्धारण आयोगले गर्ने, प्रवेश परीक्षा आयोगले लिने तर आयोगले निर्धारण गरेको सिट संख्या पुग्ने गरी प्रवेश परीक्षा उत्तीर्ण नगराइ सबै नीजिस्तरमा संचालित कलेजलाई विद्यार्थी नदिइ सुनुयोजित ढंगबाट संस्था बन्द गर्ने षड्यन्त्र चिकित्सा शिक्षा आयोगले गरेको छ । चिकित्सा शिक्षा आयोगले बिएससी नर्सिङतर्फ लिएको एकीकृत प्रवेश परीक्षामा अंकीता मण्डल उत्तीर्ण भइन् । आयोगले गरेको म्याचिङमा उनले नर्भिक कलेजमा छात्रवृत्तिमा अध्ययन गर्न पाउने गरि कलेजको नाम तोकियो । तर, नर्भिकले भर्ना लिन मानेन । कारण थियो, कलेजलाई विश्वविद्यालयबाट छात्रवृत्तिका विद्यार्थीलाई अध्ययन नगराउनु भन्ने जबाफ । गाइघाटका आशिषकुमार चौधरीको बी फार्मा पढ्ने योजना छ । अंकिता जसतै उनले पनि आयोगले लिएको एकीकृत प्रवेश परीक्षामा छात्रवृत्तिमै अध्ययन गर्न पाउने गरी नाम निकाले । आयोगको म्याचिङ प्रक्रियामा उनी लीटिल बुद्ध कलेजमा अध्ययन गर्न मिल्ने गरी तोकियो । तर, उनी अहिलेसम्म भर्ना हुन पाएका छैनन् । पूर्वाञ्चल विश्वविद्यालयले आफू अन्तर्गतका कलेजहरुमा छात्रवृतिमा अध्ययनको लागि कोटा पाएका विद्यार्थीलाई पढाउन आनाकानी गर्दै आएको छ । यो समस्याबाट करिब एक सय ५० विद्यार्थी प्रताडित बनेका छन् । ती बिद्यार्थीहरु दैनिक आयोग पुग्छन् । तर, आयोगले सुने नसुनेझैं गर्दै आएको छ । पीडित विद्यार्थीले भने, आयोगले हामीलाई विद्यार्थी कम भएपछि पेइङका विद्यार्थी कम भए, विश्वविद्यालयले थोरै विद्यार्थी भयो, पढाउन सक्दैनौं भन्यो, त्यही भएर समस्या देखिएको हो भनेर जबाफ दिन्छ । आयोग गैरजिम्मेबार भयो । आयोगले सिट संख्याभन्दा थोरै विद्यार्थी पास भएका बीएस्सी नर्सिङ र बीफार्मेसीलगायत विषयमा कतिपय कलेजमा छात्रवृत्ति कोटाको विद्यार्थी मात्रै पढ्न पठाएपछि यो समस्या आएको हो । निजी कलेज सञ्चालकहरू भर्ना भएकामध्ये १० प्रतिशत विद्यार्थी मात्रै छात्रवृत्ति अध्ययन गराउने अडानमा छन् । अधिकांश कलेजमा छात्रवृत्ति कोटाका विद्यार्थी मात्रै अध्ययन गर्न आएकाले कक्षा सञ्चालन गर्न नसक्ने अवस्था आएको उनीहरुको भनाइ छ । आफूहरूले मेरिटका आधारमा रोजेको शिक्षण संस्थामा पढ्न पाउनुपर्ने उत्तीर्ण हुने विद्यार्थीहरुको भनाइ छ । आयोगले लिएको एकीकृत परीक्षामा बीपीएचमा १४२० कोटा छुट्याएकोमा ५६५ जनाले मात्रै प्रवेश परीक्षा उत्तीर्ण गरेका थिए । बिएससी नर्सिङमा ११०० सय छुट्याइएकोमा ५०४ जनाले प्रवेश परीक्षा उतीर्ण भएका थिए । बी फार्मेसीमा ९०२ वटा कोटा छुट्याउदा ५४७ जना मात्रै उत्तीर्ण भएका थिए । फिजियोथेरापी बीपीटीमा १५० जनाको कोटा हुदाँ ११४ जना, बीएस्सी एमआइटी रेडियोग्राफीमा ७१ कोटमा ३५ जना, बिएस्सी एमएलटी ४२५ सिटमा ११८ जना उत्तीर्ण भएका थिए । कोटाभन्दा कम विद्यार्थी उत्तीर्ण भएपछि कलेज खाली हुने अवस्था आएको अलाइड साइन्स इस्टिच्युट ओरल एसोसियसनले बताएको छ ।"
झुण्डिएको अवस्थामा एसएसपी सुशील यादव मृत फेला,"रुपन्देही : संघीय प्रहरी इकाइ कार्यालय रुपन्देहीका प्रहरी वरिष्ठ उपरीक्षक (एसएसपी) सुशीलकुमार यादव झुण्डिएको अवस्थामा मृत फेला परेका छन् । नेपाल प्रहरीका प्रवक्ता प्रहरी वरिष्ठ उपरीक्षक बसन्तबहादुर कुँवरले यादव झुण्डिएको अवस्थामा मृत फेला परेको पुष्टि गरेका हुन्। उनले भने, यादवको शव मृत अवस्थामा भेटिएको हो । मृत्युको कारण खुलेको छैन। अहिले छानविन भइरहेको छ। अहिले प्रहरीका अधिकारीहरु घटनास्थल पुगेका छन्। उनी आफ्नै कार्यालयको क्वाटरमा शुक्रबार दिउँसो १२ :४५ बजेतिर मृत अवस्थामा फेला परेका हुन् ।"
अलजाइमरविरुद्ध औषधि प्रभावकारी बनेको जापान विश्वविद्यालयको दाबी,"सेन्दाई : जापान विश्वविद्यालयले अलजाइमर समस्याविरुद्ध औषधि प्रभावकारी बनेको दाबी गरेको छ । जापानको यमागाता विश्वविद्यालयले शुक्रबार अलजाइमर र लाउ गेहरिज रोगको रुपमा चिनिने एमिओट्रोफिक लेटरल स्क्लेरोसिस पीडितविरुद्ध औषधि प्रभावकारी बनेको दाबी गरेको हो । सो समस्याविरुद्ध औषधि बन्दै गरेको र औषधिको नाम भने तत्काल नखुलाउने विश्वविद्यालयका रिसर्चरहरुले बताएका छन् । अल्जाइमरलगायत समस्याबाट पीडित हास्न, बोल्न, हिँडडुल गर्न र मानसिक रुपमा तन्दरुस्त नभएका बिरामीमा असामान्य रुपमा जमेको प्रोटिनविरुद्ध उपचार गर्न सो औषधि प्रभावकारी बनेको यामागाता नेसनल हस्पिटल एलएस रिसर्च सेन्टरका प्रमुख ताकेको कातोले क्योडो न्युजसँग बताएका छन् । सो समस्याविरुद्ध आफूहरुले गरेको परिक्षण सफल भएको उनले बताएका छन् । यद्यपि, सो औषधि भने सन् २०२४ देखि बजारमा उपलब्ध हुने आश्वासनसमेत उनले दिएका छन् । मिसुविसि तानावे फर्माको अध्ययनअनुसार हाल जापानमा करिब १० हजार मानिस अल्जाइमर र एमिओट्रोफिक लेटरल स्क्लेरोसिस नामक नयाँ रोगबाट पीडित छन् ।"
दक्षिण कोरियाद्वारा पूर्व राष्ट्रपतिलाई माफी,सिओल : दक्षिण कोरियाली सरकारले पूर्वराष्ट्रपति पार्क जेउन हेलाई माफी दिएको छ। भ्रष्टाचारको आरोपमा २२ वर्षे जेल सजाय भोगिरहेकी पूर्व राष्ट्रपति हेलाई सरकारले माफी दिएको हो। त्यहाँको राष्ट्रपतीय कार्यालय ब्लु हाउसका प्रवक्ता पार्क क्युङ मीले शुक्रबार सो जानकारी दिएका हुन्। राष्ट्रपति मुन जाईले पूर्व राष्ट्रपति हेको बिग्रंदो स्वास्थ्य अवस्थालाई ध्यानमा राखी माफी दिएको प्रवक्ता मीले बताएका छन्। सन् २०१७ मा लोकतान्त्रिक नेताको रुपमा दक्षिण कोरियाको राष्ट्रपति बनेकी पार्कलाई विभिन्न अभियोगमा पदबाट जबरजस्ती हटाइएको थियो। सत्ता र शक्तिको दुरुपयोग गर्दै भ्रष्टाचार र अन्य गतिविधि गरेको भन्दै सन् २०१८ मा उनी दोषी ठहरिएकी थिइन्। सो आरोपमा त्यहाँको उच्च अदालतले करिब २४ वर्षको जेल सजाय सुनाए पनि पछि उनको सजाय २० वर्ष हुने गरी फैसला गरिएको थियो। सन् २०१९ मा जेल पुगेकी ६९ वर्षीया पूर्व राष्ट्रपति हेले ४ वर्ष ८ महिनाको जेल जीवनपछि सरकारले माफी दिएको बताइएको छ। माफीपछि उनी आफ्नो स्वास्थ्य सुधारतर्फ र सरकारलाई सघाउनेतर्फ केन्द्रित हुने अन्तर्राष्ट्रिय मिडियामा खबर छ।
"कसको हालत के हुन्छ, निर्वाचनमा देखिन्छ : प्रचण्ड","काठमाडौं : नेकपा माओवादी केन्द्रका अध्यक्ष पुष्पकमल दाहाल 'प्रचण्ड' ले सत्तामा रहँदा केही फोहोरमैला लागेको बताएका छन् । नेकपा मसाल (सम्पर्क केन्द्र' सँगको एकता कार्यक्रममा शुक्रबार बोल्दै उनले यस्तो बताएका हुन । उनले भने,'फोहोरमैला बढार्न एकताले सघाउँछ । माओवादी केन्द्र सत्ताको नजिक पुगेपछि फोहरमैला लागेको छ। सत्तानजिक हुँदा लाग्दो रहेछ। तपाईं आएपछि सफाइमा सहयोग पुग्छ ।' प्रचण्डले माओवादीमा अहिले ८ लाख सदस्य पुगेको भन्दै १० लाख पुर्याउने लक्ष्य लिइएको बताए । उनले कसको हालत के हुन्छ भन्ने कुरा आउने निर्वाचनमा देखिने बताए । उनले भने, 'कसको हालत के हुन्छ, त्यो निर्वाचनले देखाउँछ।' प्रचण्डले आफूहरुले सही विचारका साथ एमालेसँग एकता गरेको तर अर्को पक्षले सत्तामा पुग्ने भर्याङका रुपमा प्रयोग गर्दा धोका र विश्वासघातमा परिणत भएको बताए । प्रचण्डले नेकपा मसाल र आफूहरु मूलभूत रुपमा एउटै स्कुलका विद्यार्थी भएकाले एकता दिगो हुने दावी गरे।"
मेरो पराजयको समीक्षा हुनुपर्छ : महत,"काठमाडौं: नेपाली कांग्रेसको १४औं महाधिवेशनमा महामन्त्रीको उम्मेदवार बनेका डा प्रकाशशरण महतले महामन्त्रीमा मात्रै क्रस भोट भएकाले आफ्नो पराजय अनपेक्षित भएको बताएका छन्। उनले सञ्चारकर्मीसमक्ष कुरा गर्दै आफ्नो पराजयको पनि समीक्षा हुने बताए। समीक्षा गरेपछि थाहा हुन्छ, मेरो उम्मेदवारीको विरुद्धमा को किन लागे भन्ने कुरा। अहिल्यै कही नभनौं, उनले भने, अन्तर्घात आफ्नै समूहबाट भएको मैले भन्ने कुरा होइन। मिडिया र साथीहरूले बुझ्ने कुरा हो। उनले अपेक्षा गरे जति आफूले मत नपाएको बताए। 'अपेक्षा अनुसारको नतिजा आएन। तर मेरो बलिायो मत आएको छ। दुःखी हुनुपर्ने केही छैन। पदमा हुँदा पनि, नहुँदा पनि म पार्टीमा अझै बढी क्रियाशील भएर लाग्नेछु, उनले भने। उनले सभापतिले केन्द्रीय सदस्यमा मनोनित गरे त्यसलाई स्वीकार गरेर सक्रिय हुँदै अघि बढ्ने बताए।"
