शीर्षक,विवरण
जनप्रतिनिधिविरुद्ध प्रदर्शन,"राजर्षि जनक उच्चमाविका प्रधानाचार्य वीरेन्द्र यादवले विद्यालयको कम्पाउन्ड वाल तथा कक्षा कोठाको पर्खालसमेत भत्काएकाले विद्यार्थीलाई अध्ययनअध्यापन गराउन कठिन भएको बताए । सडक छेउको विद्यालय हो । सडकमा गाडीको चाप हुन्छ । बजारमा होहल्ला भइरहन्छ । विद्यार्थीको पठनपाठन प्रभावित भएको छ, प्रअ यादवले भने । वडाध्यक्षले भने विद्यालय प्रशासनले सडक मिचेर भवन बनाएकाले गाउँको वातावरण बिग्रेको आरोप लगाए । राजर्षि जनक उमावि निर्माणका लागि आफ्नै पूर्वजहरूले नै जग्गा उपलब्ध गराएको उल्लेख गर्दै महासेठले विद्यालय भवनसँगै केही आफन्तको घरजग्गा जोगाउन प्रअ पनि लागि परेको बताए ।"
दाउन्ने सडकमा दिउँसै बत्ती,धुलैधुलोका कारण दिउँसै बत्ती बाल्नुपर्ने अवस्था रहेको जिल्ला प्रहरीको भनाइ छ । मोडमा धूलोले दुर्घटना बढ्ने जोखिम उत्तिकै छ ।
बंगलादेशमा चिनाउँदै नेपाली,"नेपालमा पाइने खान्की यहीं पाउँदा खुसी लाग्यो, उनले भने, बंगलादेशको खान्कीभन्दा नेपालको खान्की फरक छ । यहींको स्वाद जिब्रोमा लागिसकेकाले नेपाली स्वाद लिन भने अलि गाह्रो हुँदो रहेछ । उनले भने । भूमिज थिएटरका अध्यक्ष एवं बंगलादेशी नाटकका निर्देशक सोरकार हैदरका अनुसार नेपालको ढाकाटोपीदेखि घुम्नलायक ठाउँको प्रदर्शन, खान्की, चिया लगायतले अन्तर्राष्ट्रिय नाटकको स्वभाव बढेको बताए । नेपाल नै नगई हामीले बंगलादेशमै नेपाली स्वाद चाख्न पायौं । नेपालीसँग रम्न पायौं, खुसी हुँदै उनले भने । नाटक नोगेडी टोलीबाट पाएको ढाकाटोपी र नेपाली नोटलाई संगालेर राख्ने उनले बताए ।"
वेदना र विद्रोहका सुसेली विमोचन,पूर्वप्राज्ञ अमर गिरीले शर्माको पुस्तक वेदनाको उत्कृष्ट प्रस्तुति रहेको बताए । व्यक्तिगत विरहलाई पनि सार्वजनिक रूप दिन पुस्तक सफल भएको उनले बताए । लेखक शर्माले मानसिक रोगबाट लामो समयदेखि थलिएकी जीवनसंगिनीको स्याहारका क्रममा कोरिएका भावनालाई पुस्तकको रूप दिएको बताए ।
छानबिनको छेउ,"यो घटनाले हाम्रो प्रहरीको योग्यताको ऐना देखाइरहेको छ । राज्य प्रणालीको परीक्षा लिइरहेको छ । यसमा अनुत्तीर्ण हुने छुट कसैलाई छैन । अबको अनुसन्धानमा कुनै छिद्र नछोडी यथाशीघ्र दोषी पत्ता लगाउनैपर्छ । यो जिम्मेवारी नेपाल प्रहरीको हो । उसलाई सघाउने कर्तव्य राज्यका अरू निकायको । अपराधी कानुनको कठघरामा उभिएको दिन मात्रै निर्मलाको आत्माले शान्ति पाउँछ । उनका बाबुआमाले न्यायको अनुभूति गर्छन् । र, आम नागरिकले कानुनी राज्यप्रति विश्वास गर्छन् । यति गरे पो सरकार, नत्र बेकार ।"
दुरभिसन्धि : हिन्दुत्व र साम्यवाद,:
भद्रकालीमा भद्रगोल,"यसपालि महानवमीको दिन भद्रकालीमा ट्राफिक प्रहरीले गरेको ड्युटी उदेकलाग्दो थियो । कुनै सर्वसाधारण नागरिकका सवारी साधन पार्किङ गर्न दिइएको थिएन । अत्यन्तै कठोर बनेर ट्राफिक प्रहरी ड्युटी गर्दै थिए, मानौं स्वयम् भगवान यो लोकमा आउँदैछन् । महानवमीका दिन भद्रकाली, तलेजु भवानी, शोभाभगवती नपुग्ने काठमाडौंवासी कमै होलान् । अति विशिष्ट मानिएकाहरूले सर्वसाधारण नागरिकले पनि सहज ढंगले मन्दिरमा दर्शन गरुन् भन्ने हेक्का राख्नु पर्दैन ? राष्ट्रपति लगायत अति विशिष्ट भनिएकाहरूको उपस्थितिका लागि आम मानिसले सार्वजनिक स्थानदेखि देवालयसम्म किन खाली गरिदिनुपर्ने ? रामकृष्ण बराल, जोरपाटी २, काठमाडौं"
केन्द्रप्रदेश किचलो,"कहिले कर्मचारी अभाव सुनिन्छ । केन्द्र सरकारले चाहने हो भने तिनलाई व्यवस्थापन गर्न कठिन छैन । प्रदेश र स्थानीय तहमा जानेलाई केही सुविधा दिनुपर्छ । घरपायक तथा भोलिका दिन सरुवाबढुवामा उचित मापदण्ड बनाइदिनुपर्छ । अधिकृत तहभन्दा मुनि आवश्यकता अनुसार स्थानीय तहमा स्थानीय तहकै अस्थायी कर्मचारी लिएर केही समय वा दरबन्दी मिलान नभएसम्म वा लोकसेवाले नपठाएसम्म व्यवस्था गरे धेरै समस्या समाधान हुन्छ । अझै केन्द्र तथा जिल्ला तहमा कर्मचारी थुप्रेका छन्, ती तल्लो तहमा जान तयार छैनन् वा आनाकानी तथा अनेक बहाना र शक्तिको आडमा पूर्ववत रहेका होलान् । तिनीहरूलाई जाने वातावरण बनाउनुपर्छ । विकास र समृद्धि कसरी हुन्छ भन्नेभन्दा कसो गर्दा किचलो हुन्छ र जुँगाको लडाइँ गरेर अरूभन्दा फरक देखाउने ध्याउन्नमै छन्, अधिकांश प्रदेश । यस्तो प्रवृत्तिले बढावा पाउनु हँुदैन । श्रीकृष्ण राजवंशी, सुनकोसी३, सिन्धुली"
मुर्झाएको प्रतिपक्षी,"सरकारको गुण र दोषको आधारमा समर्थन वा आलोचना गर्नु प्रतिपक्षीको दायित्व हो । सरकार पक्षको हाराहारीमा जनमत आफ्नो पनि छ भन्ने हेक्का नगरी कांग्रेस मुर्झाएको छ । सरकार भने स्वेच्छाचारी बन्दै गएको छ । शिक्षा, स्वास्थ्यजस्ता जनताका आधारभूत अवश्यकतामा क्षेत्रमा बेथिति व्यापक छ । कांग्रेस भने रानो हराएको माहुरीजस्तै रनभुल्ल छ । यस्तो प्रतिपक्षी हुनु र नहुनुमा तात्त्विक भिन्नता छैन । बरु सत्तापक्षकै वरिष्ठ नेता माधव नेपाल, झलनाथ खनाल लगायतले प्रतिपक्षको भूमिका निर्वाह गरिरहेका छन् । कुसुम न्यौपाने,मध्यबिन्दु ११, नवलपुर"
दक्षिणाले आशीर्वाद फिक्का,"घटस्थापनाका दिन सुरु भएर दशमीको दिनसम्म मनाइने हिन्दुहरूको महान चाड बडादसंैको आफ्नै महत्त्व छ । बडादसंैको मुख्य दिन दसमी आफूभन्दा मान्यजन र ठूलाबडाका हातबाट टीका र आशिर्वाद ग्रहण गरेपछि दसंै सिध्दिने भए पनि कोजागत पूर्णिामाको दिनसम्म टीका लगाउने परम्परा छ । सत्ययुगमा असत्यमाथि सत्यले जित हासिल गरेको किंवदन्तीका आधारमा दसंैपर्व मनाउने गरिएको छ । राक्षसको रगत पृथ्वीमा पर्दा सबैतिर राक्षसको जन्म हुने भएकोले माता नवदुर्गा भवानीले राक्षसको रगत भुइँमा पर्न नदिई पिएको आधारमा शक्तिपीठ एवं दुर्गा भवानीको मन्दिरमा खसी, बोका, राँगा, कुखुरा र हाँस लगायत निर्दोष पशुपन्छीको बलि दिने गलत परम्परा छ । यसले विकृतितर्फ डोर्याइरहेको छ । मानवको खुसीका लागि निर्दोष पशुको हत्या गर भनेर कुनै पनि धर्मग्रन्थमा उल्लेख गरेको पाइँदैन । मानिसले आफ्नो स्वार्थपूर्तिका लागि गलत व्याख्या गरेर निर्दोष पशुलाई बलि दिइएको हो । मानिस मांसाहारी प्राणी हुँदै होइन । मांसाहारी प्राणीका नङ्ग्रा हुन्छन्, दाह्रा हुन्छन्, तर मानिसको नङ हुन्छ, दाँत हुन्छ । मांसाहारी प्राणीले राति आँखा देख्छ । सत्ययुगका घटनाहरूको सकारात्मक व्याख्या गर्दै बडादसंैका राम्रा पक्षहरूलाई अँगाल्दै र खराब पक्षलाई छाड्दै जानुपर्छ । पुरुषोत्तम घोरासैनी, बालाजु १६, काठमाडौं"
गयो दसैं,"आयो दसैं गयो दसैं, कस्तोकस्तो भयो दसैंढोल बजाई आयो दसैं, ऋण बोकाई गयो दसैंगाउँभरिका, टोलभरिका बाख्रा पाठा चपाएरबल्ल दसैं बिदा भयो, हत्या हिंसा गराएरआयो दसैं भन्दै मान्छे खुँडा तरबार बोकी हिँडेपशुपन्छी तर्साएर यिनका गर्धन तोडी हिँंडेदैलो, भण्डार, मठ, मन्दिर रगतैका आहाल भएपीडा रोदन व्यर्थ भयो निर्दोषहरू बेहाल भएयही रीतले वर्षैपिच्छे गाउँटोलमा आउँछ दसैंमानवता बिर्को लगाई दानवता ल्याउँछ दसैं । कृष्ण कुम्पुरे, धादिङ"
वृत्तिविकासमा स्वेच्छाचारिता,"जनतालाई साँच्चिकै सुरक्षाको प्रत्याभूति दिलाउने हो भने राज्यले प्रहरी ऐनमा रहेको वृतिविकासको प्रावधानमा संशोधन गरी वैज्ञानिक, निष्पक्ष, पारदर्शी र यथार्थपरक बनाउनुपर्छ । शक्तिकेन्द्रहरूमा धाउनुको साटो योग्यता, इमानदारिता र मिहेनतको बलमा मात्र वृतिविकास सम्भव हुन्छ भन्ने सुनिश्चितता तथा भरोसा प्रहरी ऐनले गर्नुपर्छ, तबमात्र प्रहरी जनमुखी हुन्छ । लेखक नेपाल प्रहरीका अवकाशप्राप्त एआईजी हुन् ।"
समृद्धिको साँघुरो संकथन,:
फाइट ब्याक समाधान होइन,"आफ्ना सन्तानप्रति अति विश्वास गर्नुको सट्टा उमेर बढ्दै जाँदाको शारीरिक र मानसिक विकासका क्रममा हुने परिवर्तनप्रति अभिभावक चनाखो र सचेत हुन जरुरी छ । यौन हिंसा निराकरणका लागि महिलालाई आत्मरक्षा तालिम दिनु भनेको टाउको दुख्दा पेटको अपरेसन गरे जस्तै हो । छोरीलाई आत्मरक्षा तालिम होइन, छोरालाई नारीप्रति हेर्ने दृष्टिकोण बदल्न अभिप्रेरित गरौँ ।"
स्काइलक्ड नेपाल !,"अबको बाटो भारतलाई चिढाएर आफूखुसी गर्छु भनी बढ्न खोज्दा झन् समस्या बल्झिन सक्छ । भारतलाई खुसी पारेरै अगाडि बढ्नु बुद्धिमानी हुनेछ । भारत चिढिन्छ भनी हामीले हाम्रा राष्ट्रिय स्वार्थका परियोजनालाई अघि बढाउन हिचकिच्याउन हुंँदैन, बरु अझ बढी उत्साह र जोशका साथ त्यस्ता परियोजनालाई गति दिनुपर्छ । देश समृद्ध भयो भने सानै भए पनि कसैले हेप्न सक्दैन । उदाहरण सिंगापुर, ब्रुनाई, अष्ट्रिया, स्वीट्जरल्यान्ड हुन् । नेपालले केही समय पर्खिनु मनासिव हुनेछ । यसबीच बिभिन्न तहबाट कूटनीतिक पहल निरन्तर जारी राख्नुपर्छ । आशा गरौं, एकदिन सच्चा मित्रको हैसियतले भारतीय पक्षले हाम्रा सबै बाधाअड्चन फुुकाइदिनेछ ।लेखक नेपाल नागरिक उड्डयन प्राधिकरणका पूर्वमहानिर्देशक हुन् ।"
म्हेनिङ उल्लास,"गायक तथा संस्कृतिकर्मी फूलकुमार बमजनका अनुसार तामाङ समुदायको यो निकै पुरानो मौलिक पर्व हो । खासगरी बोन परम्परा अनुसार तत्कालीन कृषि प्रणाली र प्रकृतिसँग जोडिएको पर्व भए पनि बौद्धमार्गी तामाङहरूले पनि म्हेनिङ मनाउँछन् । तामाङ समुदाय आठौं शताब्दीमा (पद्मसम्भवको समय) बोनबाट बौद्धमार्गी बन्ने प्रक्रिया सुरु भएको मानिन्छ । अहिले यो पर्व बोन र बौद्ध दुवै संस्कृतिबाट मिश्रित छ, सिन्धुली घरमा म्हेनिङ मनाएर फर्केका बमजनले भने, दसैंसँगै यो पर्व पर्ने भएकाले अहिले एकप्रकारको भ्रम चाहिँ पैदा भएको छ ।"
विविधतारहित दसैं गीत,"दसैंतिहारमाथि बनेका सबैजसो गीत एकैखाले सुनिए । अधिकांश गीत उस्तै लागे । यसपालि निस्किएका गीतहरूको बोल एउटै छ, दसैं आयो। यही भएर पनि दसैंका बेला पनि प्राय: पुरानै गीत बजेको सुनियो, सुनिरहिएको छ ।"
सर्जकको दसैं,हरेक वर्ष दसैंमा (अमेरिकाबाट) मुलुक फिर्छु । यसपटक मदन पुरस्कारले पनि व्यस्त बनायो । यसबाहेक केही साहित्यिक कर्म गरें । आफ्नै पुराना कृतिहरू पुनर्पठन गरें । वेली कथा संग्रहको दोस्रो संस्करण आउँदै छ । यसको सम्पादनलाई समय दिइरहेकी छु ।
कवि योगेन्द्र सम्मानित,"प्रत्येक वर्ष लगातार आयोजना भइरहेको साहित्य सम्मेलनका अवसरमा यसपल्ट १५ लेखकले आफ्ना कविता, निबन्ध र कथा पनि प्रस्तुत गरेका थिए ।"
चक्रपथमा विद्युतीय सवारी: सरकारद्वारा अध्ययन सुरु,"हाल उपत्यकाका १५ रुटमा ७ सय १४ विद्युतीय सफा टेम्पो सञ्चालनमा छन । दिन प्रतिदिन उपत्यकाको वातावरण प्रदूषित हुंँदै गएको उल्लेख गर्दै प्रतिवेदनमा विद्युतीय सवारी साधन आवश्यक भएको उल्लेख छ । उपत्यकामा सवारी उत्सर्जनबाट ३८ प्रतिशत, मर्मत तथा सम्भार, ग्राभेल सडकबाट २५ प्रतिशत, कृषिबाट १८ प्रतिशत, इँटाभट्टाबाट ११ प्रतिशत, पशुपालन (चौपाया) बाट ३ प्रतिशत, अन्य उद्योगबाट ३ प्रतिशत, घरायसी फोहोर जल्दा १ प्रतिशत र अन्य १ प्रतिशत प्रदूषण उत्सर्जन हुने गरेको प्रतिवेदनले औंल्याएको छ । समितिले ३ वर्षअघि बुझाएको प्रतिवेदन अहिलेसम्म लागू भएको छैन । यातायात व्यवस्था विभागका महानिर्देशक लावण्य ढकालले विद्युतीय सवारी साधन चलाउनबारे छलफल भइरहेको जानकारी दिए । अध्ययन भइसकेको छ, उनले भने, अब अन्तिम निर्णय गर्न बाँकी छ ।"
२ प्रतिशतमा ऋण पाउने समय सकियो,०७२ वैशाखको विनासकारी भुकम्पले ठूलो मात्रामा जनधनको क्षति भएको थियो । मुलुकभर करिब ८ लाख घरपूर्ण रुपमा भत्किएका थिए । यसकारण पिडितको आवास निर्माणमा सहयोग पुर्याउने उद्देश्यले २ प्रतिशत ब्याजदरमा काठमाडौं उपत्यका भित्र २५ लाख र उपत्यका बाहिर १५ लाख रुपैयाँसम्म ऋण प्रदान गर्ने व्यवस्था राष्ट्र बैंकले ल्याएको थियो । पछि यो कार्यक्रमलाई सरकारले आफ्नो कार्यक्रममा समावेश गरेको थियो । यही कार्यक्रम तीन वर्षपछि सकिएको हो ।
