शीर्षक,विवरण
निर्मला हत्या प्रकरण: विष्ट र भट्ट बर्खास्त प्रक्रियामा,गत साउन १० मा बलात्कारपछि हत्या गरिएकी निर्मलाको शव भोलिपल्ट फेला परेको थियो ।
१० राजदूत छिट्टै,राणा कांग्रेस सभापति शेरबहादुर देउवाकी सासू हुन् भने ढकाल म्यानपावर व्यवसायी हुन् । सासूलाई फिर्ता नबोलाउन देउवाले प्रधानमन्त्री ओलीसँग आफैंले आग्रह गरेको र कन्फ्लिक्ट अफ इन्ट्रेस्ट हुने गरी नियुक्त भएकी पराजुली प्रधानमन्त्री ओलीसँग राम्रो सम्बन्ध बनाउन सफल भएकीले उनीहरूको पद भने थामिन सक्ने स्रोतको दाबी छ ।
"पार्क पसे ढिकी, जाँतो र कोल","१० वर्ष अघिसम्म घरघरमा रहेको ढिकीमै कुटेको चामलको भात खान्थ्यौं, गोरखा नगरपालिका १२ दसकिलोकी ६० वर्षीया ज्ञानुमाया आचार्यले सुनाइन्, अहिलेका मानिस बरु घण्टौं मिलमा पालो कुरेर चामल कुट्छन् । आफूहरूले ढिकी, जाँतो, कोलको प्रयोग गरेको सुनाउँदा पछिल्लो पुस्ताका बालबालिकाले अचम्म मान्ने गरेको उनले बताइन् । घरघरमा हुने ढिकी, जाँतो लोप हुने अवस्थामा पुगेका थिए, धन्न पार्कमै भए पनि देख्न पाउँदा खुसी लाग्यो, आचार्यले भनिन् ।"
"चालक निदाउँदा बस पल्टियो, ६ को मृत्यु",लु१ख ८४५४ नम्बरको बसका चालक निदाएकाले राजमार्गबाट पल्टिएर दुर्घटना भएको ट्राफिक प्रहरी कार्यालयका पदम बडुले जनाए । घाइतेको चितवनस्थित पुरानो मेडिकल कलेजमा उपचार भइरहेको छ ।
नक्कली नोट छाप्ने मेसिनसहित ५ पक्राउ,"प्रहरीले पैसा छाप्न प्रयोग हुने दुई बन्डल पेपर, कैंची, लालीगुराँस अंकित रबर छाप र नक्कली नोट बरामद गरेको छ । परिसरका डीएसपी मोहनकुमार थापाका अनुसार यो गिरोहले हजार रुपैयाँको नक्कली नोट मात्रै छापिरहेको थियो । चाडबाडमा सजिलो हुने ठानी उनीहरूले सक्कलीमा नक्कली नोट मिसाएर रेस्टुरेन्ट र किराना पसलमा कारोबार गरेको पाइएको छ ।"
ऋण तिर्न खोजे लिलामी नगर्नू,"प्रक्रियाविपरीत ऋणीको परिवार सदस्यको सम्पत्ति लिलामी गर्न नमिल्ने भन्दै सर्वोच्चले एकाघरको श्रीमतीका नामको जग्गा लिलाम गरे पनि प्रक्रिया पूरा हुनुपर्ने व्याख्या गरेको हो । फैसलामा भनिएको छ, ऋणीले आफूले तिर्नुपर्ने रकम लिलामी हुनुभन्दा पहिले नै अदालतमा धरौटी राखेको देखिएकाले पुनरावेदन अदालतको फैसला अन्यथा देखिएन ।"
वनको कार्यक्षेत्र खुम्चियो,"एक्यापले तोकेको शुल्क संरक्षण क्षेत्र व्यवस्थापन समितिलाई तिरेपछि जोसुकैले नार्फूूबाहेकका गाउँपालिकाका खर्कमा एकदेखि डेढ महिना यार्चा संकलन गर्न पाउँछन् । नार्फूमा भने संकलकले ३५ हजार रुपैयाँ बुझाउनुपर्छ । यो गाउँपालिकाभित्रका खर्कमा मनाङीले मात्र संकलन छुट पाउँछन् । २०६७ मा गोरखाको केरौंजाबाट नारमा यार्चा संकलन गर्न आएका सात जनाको हत्यापछि अन्य जिल्लाकालाई प्रतिबन्ध लगाइएको हो । एक्याप मनाङअन्तर्गत ११ वटा व्यवस्थापन समिति छन् । तिरुवाका अनुसार मनाङका विभिन्न खर्कमा संकलित यार्चा चारवटा नाकाबाट बाहिरिन्छ । सबभन्दा बढी चामे, धारापानी, बेंसीसहर हुँदै काठमाडौं निकासी हुन्छ भने धारापानी, लार्केपास, गोरखाको सामागाउँ हुँदै तिब्बत पनि पुर्याइन्छ । यस्तै, थोरङपास, जोमसोम, कोरला नाका हँुदै तिब्बत र हेलिकप्टरबाट सिधै काठमाडौंसम्म पनि निकासी हुने गरेको छ ।"
दुबईमा रामसार सम्मेलन सुरु,"रामसारमा नेपालका १० स्थान सूचीकृत छन् । दुई वर्षअघि पोखराको फेवा, बेगनास, रूपालगायत ९ वटा ताल सूचीकृत भएका छन् । यसअघि रसुवाको गोसाइँकुण्ड, चितवनको बिसहजारी, कैलालीको घोडाघोडी, सोलुखुम्बुको गोक्यो, कपिलवस्तुको जगदीशपुर, इलामको माईपोखरी, मुगुको रारा र डोल्पाको फोक्सुन्डो ताल रामसारमा सूचीकृत थिए । नेपालमा यिनले ६० हजार ५ सय ६१ हेक्टर जमिन ओगटेका छन् । एक सय ७० देश यसका सदस्य छन् । ती देशका २ हजार ३ सय ३१ स्थान रामसारमा सूचीकृत छन् । यिनले करिब २५ करोड हेक्टर जमिन ओगटेका छन् । बेलायतका सबैभन्दा बढी स्थान सूचीकृत छन् । सम्मेलनमा विश्वभर भएका सिमसारको संरक्षणमा देखा परेका चुनौती, तिनको उपादेयता र दिगो संरक्षणबारे छलफल भइरहेको छ । जीविकोपार्जनका कार्यक्रम अघि बढाउन, पर्यापर्यटन प्रवद्र्धन, वन्यजन्तु र चराचुरुंगी संरक्षणका लागि सिमसारले महत्त्वपूर्ण भूमिका खेलेका छन् ।"
विशेष शिक्षामा सुविधा माग,"सरकारले हालै जारी गरेको अनिवार्य तथा नि:शुल्क शिक्षासम्बन्धी ऐन, २०७५ मा अपांगता तथा दलित नागरिकको विशेष अधिकारबारे उल्लेख छ । ऐनको परिच्छेद७ (३३) मा दृष्टिविहीन नागरिकलाई ब्रेललिपि र बौद्धिक अपांगता भएकालाई सांकेतिक भाषाका माध्यमबाट तोकिएबमोजिम नि:शुल्क शिक्षा पाउने अधिकार हुने उल्लेख छ । अपांगता भएका तथा विपन्न दलित नागरिकलाई शिक्षा प्राप्त गर्ने सम्बन्धमा यस ऐनमा लेखिएका अधिकारका अतिरिक्त प्रचलित कानुनबमोजिम थप विशेष अधिकार प्राप्त हुनेछ भनिएको छ । ऐनमा विशेष शिक्षा शिक्षक तथा कर्मचारीबारे भने उल्लेख छैन । नेपाल सरकार, प्रदेश सरकार वा स्थानीय तहले सुविधासम्पन्न नमुना विद्यालय वा विशिष्टीकृत विद्यालय वा घुम्ती विद्यालय वा यस्तै अन्य विशेष प्रकारको विद्यालय स्थापना र सञ्चालन गर्न सक्नेछ, ऐनमा भनिएको छ, यस ऐनको प्रयोजनका लागि प्रत्येक स्थानीय तहले आफ्नो क्षेत्रभित्रका मातृभाषी, दलित, अपांगता भएका र आर्थिक रूपले विपन्न व्यक्तिको विवरण अद्यावधिक गरी राख्नुपर्नेछ ।"
अस्पतालमै दसैं,"महाराजगन्जस्थित शिक्षण अस्पताल (टिचिङमा) मा उपचाररत धेरै बिरामी घर जान पाएनन् । अस्पतालका वरिष्ठ मेडिकल रेकर्ड अफिसर कुमार केसी भन्छन्, घरमा राख्दा झनै जोखिम हुने बिरामीलाई घर पठाउन सकेनौं, उनीहरूलाई स्वास्थ्यकर्मीकै सहयोग चाहिन्छ । कात्तिक २ गतेसम्म टिचिङमा २ सय ४७ बिरामी भर्ना भएका थिए । टेकुस्थित शुक्रराज ट्रपिकल तथा सरुवा रोग अस्पतालमा १५ जना बिरामी घर जान पाएनन् । सर्पले टोकेर रगत पातलो भएका, एचआईभी संक्रमित, भर्खरै क्षयरोगको औषधि सुरु गरेका र टाढाबाट रेफर भएर आएका बिरामीलाई घर पठाउन नमिल्ने अस्पतालका प्रवक्ता डा अनुप बास्तोलाले बताए । उनले भने, यस्ता बिरामीलाई चोटपटक लागेमा रगत रोकिँदैन, निरन्तर रगत बगेर ज्यानै जोखिममा पर्ने हुँदा डिस्चार्ज गर्न सकेनौं ।"
अस्ट्रेलियामा नेपाली विद्यार्थीलाई अवार्ड,"यहाँका सबै विश्वविद्यालयमा अध्ययनरत विदेशी विद्यार्थीमध्ये उत्कृष्टलाई दिइने इन्टरनेसनल स्टुडेन्ट अफ द इयर अवार्ड र विद्यावारिधि गरिरहेका विद्यार्थीलाई अनुसन्धानका आधारमा दिइने एकेडेमिक एक्सिलेन्स : पोस्टग्राजुएट रिसर्च अवार्ड कँडेलले जितेका हुन् । कँडेललाई व्यापार, लगानी तथा पर्यटनमन्त्री डेभिड रिज्वेले एक कार्यक्रममा अवार्ड तथा प्रमाणपत्र प्रदान गरे । बाग्लुङ, गल्कोटका कँडेल आँखामा लाग्ने रोगले मानिसको जीवनमा पार्ने प्रभावबारे अध्ययन गर्न ४ वर्षअघि अस्ट्रेलिया आएका थिए ।"
२४ वर्षपछि पायो जात्रा,"भक्तपुर र काठमाडौंमा पनि मनाइयोविजयादशमीको मध्यरातमा भक्तपुर तलेजुको पाय:द्यो (खड्ग देव) जात्रा मनाइएको छ । तलेजु भवानीको साक्षात् रूप मानिने पाय:द्योलाई रातो कपडाले बेरेर युद्ध कवच पहिर्याई यो जात्रा मनाइन्छ । दशमी राति तलेजु आगम मन्दिरको खँ कुथि कोठाबाट विधिपूर्वक पूजा गरिएका बलिपात्र र शस्त्रअस्त्रसहित तलेजुको प्रतिरूप पाय: द्योलाई तलेजुका मूल आचाजु, पुरोहितले राजोपाध्यायलाई हस्तान्तरण गरेपछि जात्रा सुरु हुने तलेजुका मूल नाइके नरेन्द्रप्रसाद जोशीले बताए । तलेजुमा राजोपाध्यायले पाय:द्योलाई आफ्ना काँधमा बोकेर तलेजु मूलचोकबाट बेको चोक पुगेपछि सर्वसाधारणका लागि पूजा र दर्शन गर्न दिने परम्परा छ । काठमाडौं हनुमान ढोका दरबार र असन बाकु ननी:लगायत टोलबाट पनि पायो जात्रा निकालियो ।"
दुर्गामूर्ति विसर्जन गर्न लैजाँदा तनाव,कफर्युकै बीच आइतबार साँझ ७ बजेतिर मूर्ति विसर्जन गरिएको छ । ढुंगा प्रहार गरिएकै बाटोबाट मूर्ति बजार परिक्रमा गराई सुरई खोलामा विसर्जन गरिएको हो । मूर्ति बजार परिक्रमा गराउन १ घण्टाभन्दा बढी लागेको थियो ।
नारायणगढमुग्लिन सडक भासियो,साढे पाँच मिटर मात्रै चौडा ३६ किलो मिटर लम्बाइको यो सडकलाई तीन वर्ष लगाएर एसियाली मापदण्ड अनुरूपको दुई लेनको फराकिलो बनाउने काम हालै मात्रै सकिएको हो । दिनहुँ १० हजार गाडी ओहोरदोहोर गर्ने यो सडकमा निर्माण कार्य भइरहँदा यात्रुहरू घण्टौं जाम हुने समस्याबाट आजित थिए । अहिले पनि सानो समस्या आए वा पहिरो खसे जामको समस्या सुरु भइहाल्छ ।
दोलखामा खड्गजात्रा,"जात्राको अर्को रोचक पक्ष पहिरन पनि हो । सेता पोसाक, फेटा र पटुका लगाइएको हुन्छ । शीरमा जमराका मालाले सजिएको हुन्छ । त्यस्तो भेषका लडाकुहरूले राजकुल, श्यामसुन्दर, नक्छे र टसिचा टोलमा युद्ध लडेको अभिनय गर्छन् । गम्भीरखर्कमा पुगेर थप शक्ति जुटाउँछन् अर्थात् त्यसमा नयाँ लडाकुहरू थपिन्छन् । रास्नी पुगेपछि लडाकुहरू फरक दृश्यमा नाच्छन् ।"
गाउँमा स्वास्थ्य भवन,रामेछाप र ओखलढुंगाको सीमावर्ती व्यापारिक केन्द्र साँघुटारमा स्थानीय अतिरिक्त ओखलढुंगाका पश्चिमी क्षेत्रका बासिन्दाले उपचार सुविधा लिने गरेका छन् । व्यापारिक केन्द्रसमेत भएको र बाह्रै महिना सवारी साधन सञ्चालन हुने भएकाले आसपासका अन्य स्वास्थ्य चौकीको भन्दा साँघुटारमा बिरामीको चाप उच्च रहेको जिल्ला स्वास्थ्य कार्यालयले जनाएको छ । भूकम्पले स्वास्थ्य चौकी भवनमा क्षति पुगेपछि युनिसेफले स्थायी प्रकृतिको भवन निर्माण गरेको थियो ।
१०८ वर्षीयको हातबाट टीका,"राणाकाल,पञ्चायत र गणतन्त्र सवै देखियो र फरक पनि पर्दै गएको उनको अनुभव छ । यस्तो बाटोघाटो, मोबाइल र स्कुल बनेका छन् । बाँचेपछि धेरै देखिँदोरहेछ उनले भने । अझै पनि बाँच्न रहर बोकेका हरिलाल काल नआएसम्म मर्न कहाँ पाइन्छर भन्छन् । १९९० सालको भूकम्प आउँदा रूखमा चढेर घाँस काट्दै थिए । २०७२ सालको भूकम्पमा घरभित्र थिए । बेसरी हल्लायो तर घर भत्केन । भत्केको भए किचेर मरिन्थ्यो होला । ढुंगामाटाको गाह्रो भएको जस्तापाताले छाएको उनको घर छ । यो घर बनाएको ५ दशक वितिसकेको छ तर भत्केन । उनलाई अरू नेता र राजाको नाम थाहा छैन, थाहा भएको भए पनि बिर्सिसके तर मनमोहन अधिकारीको नाम उनलाई कन्ठै छ । अधिकारीले नै वृद्ध भत्ता दिएकाले अहिलेसम्म सम्झना छ, उनले भने ।"
क्यान्सर रोगीलाई उपचारमा राहत,"योबापत ५२ लाख ३ हजार रुपैयाँ खर्च हुने गरेको छ । यसका साथै अस्पताल आफंैले गर्ने आम्दानीबाट बिरामीलाई सुविधा दिने गरेको छ । क्यान्सर सेवा समाज नामको संस्थाले गर्ने सिफारिसका आधारमा अस्पतालले गत आवमा ३१ लाख ७९ हजार ५५३ रुपैयाँ बराबरको सेवा उपलब्ध गराएको कार्यकारी निर्देशक डा आचार्यले जानकारी दिए । सबै प्रकारका गरेर अस्पतालले ९६ करोड ३३ लाख १५ हजार ५०५ रुपैयाँ बराबरको नि:शुल्क सेवा सुविधा उपलब्ध गराएको छ । भरतपुरको क्यान्सर अस्पतालले उपचारका लागि आउने देशका कुल क्यान्सर रोगीमध्ये ५० देखि ६० प्रतिशतलाई सेवा दिएको कार्यकारी निर्देशक डा आचार्य बताउँछन् । सरकारी अस्पतालमा सेवा केही सस्तो छ । तर निजीमा महँगो छ ।क्यान्सर सेवा समाजका अध्यक्ष चीजकुमार मास्के भन्छन्, निजीमा उपचार गराउन जाँदा सानो खर्चले भेट्दैन । सरकारी अस्पतालमा केही सुलभ र सुविधा पनि होला तर भएको छुट र सुविधा पनि पर्याप्त अझै छैन । उपचारबाट निकै हुने क्यान्सरलाई सरकारी अनुदान बढाउन उनले अपिल गरे ।"
साप्सुखोलाबाट ७ मेगावाट,जिल्लाका दस स्थानीय तहमा सानाठूला गरी डेढ दर्जन बढी साना हाइड्रोपावर सञ्चालनमा छन् । तत्कालीन जिल्ला विकास समितिले आर्थिक वर्ष २०६३०६४ मा पाँच वर्षभित्र जिल्लालाई लोडसेडिङमुक्त बनाउने योजना बनाएको थियो ।
