शीर्षक,विवरण
स्टर्लिङ चम्कँदा इंग्ल्यान्ड विजयी,"इंग्ल्यान्डले समय बिताउन खेल्यो । केही खेलाडी घाइते भएर ढले पनि । र, स्पेनमाथि दबाब बढिरहेको थियो । अन्तिम दस मिनेटमा रोडरिगोको प्रहार बाहिर गयो । त्योभन्दा पनि नजिक थियो एसेन्सियोको प्रहार । मार्को अलोन्सोले प्रहार गरेको बल डिफ्लेक्ट हुदै बारमा लाग्यो । र। रामोसले ९८ औं मिनेटमा हेडर गोल गरे । तर, त्यसपछि खेल पुन: सुचारु हुने समय पनि थिएन । इंग्ल्यान्डको जितले पूर्णता पायो ।"
संघर्ष गर्दै रियल र बायर्न,"बायर्नको भित्री स्रोतलाई मान्ने हो भने अहिले टिम दुई भागमा विभाजित छन् । सुरुका चार खेल जित्दा त सबै ठीक थियो, त्यसयता टिममा चिरा पर्न सुरु भयो । खेलाडीको एक समूह प्रशिक्षकका समर्थक छन् । अर्को समूह प्रशिक्षकका विरोधी । यो नै कोभाचलाई लिएर सबैभन्दा ठूलो समस्या हो । केही खेलाडीले के आरोप लगाएका छन् भने यी प्रशिक्षक नाम चलेका ठूला खेलाडीकै मात्र पछाडि जान्छन्, उनको पूरा ध्यान प्रशिक्षणमा पनि छैन । बीबीसी"
मोनाकोमा फर्केका हेनरी,"हुन पनि, आधुनिक फुटबलमा हेनरीको हेलमेल लगभग सबै उत्कृष्ट व्यक्तित्वसँगै भएको छ । उनले जिनेदिन जिदान, लियोनल मेसी र डेनिस बर्गक्याम्पसँग खेले । अनि आर्सन वेन्गर र पेप ग्वार्डिओलोको नेतृत्वमा खेले पनि । फेरि हेनरी मोनाकोमा निकै लोकप्रिय पनि छन् । क्लबका पनि उनलाई माया गर्ने धेरै छन् । यस्तोमा विश्वास गर्न सकिन्छ, हेनरी र मोनाकोको साझेदारी लामो समय चल्नेछ, त्यो पनि सफल रूपमा ।"
बुटवल दरबारलाई उपाधि,"दसैंको मौकामा रेष्टुरेन्ट व्यवसायीहरूबीचमा भ्रातृत्व र एकता बढाउने उद्देश्यका साथ प्रतियोगिता आयोजना गरिएको लाइम एन्ड लेमनका सञ्चालक सागर पौडेलले बताए । प्रतियोगितामा बुटवल उपमहानगरपालिका क्षेत्रका १४ वटा रेष्टुरेन्ट व्यवसायीहरूको टिमले उपाधिका लागि प्रतिस्पर्धा गरेका थिए । इलाका प्रहरी कार्यालयका प्रहरी नायव उपरीक्षक डिलबहादुर मल्ल, रूपन्देही जिल्ला फुटबल संघका अध्यक्ष दीर्घबहादुर केसी, रूपन्देही होटल तथा रेष्टुरेन्ट व्यावसायी संघका अध्यक्ष समुन्द्र जीसी, खेल संयोजक शीत्तल शर्माले विजेता, उपविजेता तथा उत्कृष्ट खेलाडीहरूलाई पुरस्कार वितरण गरे ।"
कोन्टा दोस्रो चरणमा,बेल्जियन मर्टेन्सविरुद्ध ब्रेक गर्दै कोन्टाले सेटमा सफलता हात पार्दै जित निकालेकी थिइन् । ४४ औं वरीयताकी कोन्टाले दोस्रो चरणमा रुसकी भितालिया दियाचेन्को वा अस्ट्रेलियन डारिया गाभरिलोको सामना गर्नेछिन् । कोन्टाको गत साता प्रशिक्षक माइकल जोयससँग विवाद परेको थियो र उनले यस साता क्रेमलिनमा ट्रायलको रुप्मा दिमित्री जाभिएलोफसँग काम गरिरहेकी छिन् ।
