शीर्षक,विवरण
भूकम्पको इपिसेन्टर पुगेका राष्ट्रपति पौडेलले भने सबै मिलेर विपद्को सामाना गरौं,"जाजरकोट: राष्ट्रपति रामचन्द्र पौडेलले विपत्तीको बेलामा कोही छैन भनेर नआत्तिन भूकम्प पीडितसँग आग्रह गरेका छन्। मंगलबार बिहान भूकम्प प्रभावित क्षेत्र जाजरकोटको रामीडाँडा पुगेका राष्ट्रपति पौडेलले हामी सबै मिलेर विपद्को सामना गर्न आग्रह गरेका हुन्। राष्ट्रपति पौडेलले भने, 'अहिलेको अवस्थामा कोही छैन भनेर नठान्नु होला। हाम्रो सरकार छ भन्ने सोच्नु होला ।'उनले विपद्को समयमा युद्धस्तरमा काम गर्नुपर्ने उल्लेख गरे उनले स्थानीय जनप्रतिनिधिहरुलाई भूकम्पको क्षति तथा अवस्थाबारे सही तथ्याङक राख्न र पीडितहरु नठगिउन भन्ने तर्फ सचेत हुन पनि सुझाव दिए। 'दुई तीनवटा घर हुनेले राहात पाउने तर केही नहुनेले पाउँदै नपाउने अवस्था नआओस् । हामी सबै मिलेर विपद्को सामाना गरौं, लोकतन्त्र तपाईंहरूको साथमा छ,'उनले भने। राष्ट्रपतिले पौडेलले आफू विगतमा झाडापखालाको महामारी हुँदा यस क्षेत्रका जनतासँगै रहेको प्रसंग उल्लेख गर्दै विनकाशकारी भूकम्पको विपत्तिमा दुःख परेको बेलामा पनि स्थानीयको साथमा रहेको बताए। 'यो दुर्भाग्यपूर्ण र प्राकृतिक विपद्को दुःखद घटना हो,तपाईहरूको दुःखमा साथै रहन र राहत र उद्दारमा भइरहेका कामहरूको अवस्था बुझ्न साथै यहाँको अल्पकालिन र दिर्घकालिन पुर्नस्थापनाको प्रबन्धलाई प्रभावकारी बनाउनपर्छ भनेर यहाँ आएको हुँ,'उनले भने। उनले स्थायी घर नबन्दासम्मका लागि जाडो र वर्षायाममा समस्या नहुने गरी बसोबासको अस्थायी प्रबन्ध तथा दिर्घकालिन रुपमा कुनै उपयुक्त ठाउँको पहिचान गरी स्थायी घर निर्माण गर्नुपर्नेमा अहिले नै सोचेर काम थाल्न आग्रह गरे। सो अवसरमा बारेकोट गाउँपालिकाका अध्यक्ष वीरबहादुर गिरीले ४३ सय घरधुरीमध्ये २४० पूर्णरुपमा ध्वस्त भएको,१ हजार ८ सय ९१ उच्च जोखिममा रहेको र १ हजार परिवार विस्थापित भएको जानकारी गराएका थिए। सुरक्षित आवास र दैनिक जीवनयापन सहज बनाउनका लागि ठूलो चुनौती रहेको अध्यक्ष गिरीले बताएका थिए। भूकम्प प्रभावितहरुको अवस्था बुझन् मंगलबार बिहान जाजरकोट सदरमुकाम खलङ्गा पुगेका राष्ट्रपति पौडेलले त्यहाँ जिल्ला अस्पतालमा उपचाररत घाइतेलाई भेटेका थिए। उनले भूकम्पले क्षतिग्रस्त घरहरुको पनि अवलोकन गरेका थिए। राष्ट्रपति पौडेलले २२ कात्तिकदेखि तय भएको युरोप भ्रमण स्थगित गरेर भूकम्प प्रभावित क्षेत्र पुगेका हुन्। राष्ट्रपति पौडेलसँगै उपप्रधान एवम् रक्षामन्त्री पूर्णबहादुर खड्का,उर्जामन्त्री शक्ति बस्नेत,जाजरकोटका प्रदेश सांसद,प्रधानसेनापति प्रभुराम शर्मा जाजरकोटा आएका हुन्।"
नेपालमा लगानी गर्न एसिया प्रशान्त क्षेत्रका व्यवसायीलाई प्रधानमन्त्रीको आग्रह,"काठमाडौं : प्रधानमन्त्री पुष्पकमल दाहालले मुलुक आर्थिक समृद्धिको मार्गमा रहेकाले नेपालमा लगानी गर्न एसिया प्रशान्त क्षेत्रका व्यवसायीलाई आग्रह गरेका छन्। नेपाल उद्योग वाणिज्य महासंघका अध्यक्ष चन्द्रप्रसाद ढकालको नेतृत्वमा गएको एसिया प्रशान्त क्षेत्रीय उद्योग वाणिज्य परिसंघका अध्यक्ष पिटर म्याकमुलिन एमसहितको प्रतिनिधिमण्डलसँगको भेटमा उनले नेपालको आर्थिक समृद्धिको यात्रामा सहयोग गर्न आग्रह गरे। नेपालले राष्ट्रिय एवं अन्तर्राष्ट्रिय लगानी आह्वान गरिरहेको, नेपालमा लगानीका लागि उपयुक्त कानुन र वातावरण रहेको तथा लगानीकर्तालाई सबै प्रकारका सहयोग गर्न सरकार तयार रहेको प्रधानमन्त्री दाहालले विश्वास दिलाए। सो अवसरमा महासंघका अध्यक्ष ढकालले ३७औँ क्यासी सम्मेलन नेपालको आर्थिक विकासका मुद्दामा केन्द्रित भएको र सम्मेलन सहयोगी हुने अपेक्षा नेपाली निजी क्षेत्रले गरेको बताए। एसिया प्रशान्त क्षेत्रबाट लगानी एवं प्रविधि भित्र्याउन क्यासीमार्फत् महासंघले पहल गर्ने थप स्पष्ट पारे। क्यासीका अध्यक्ष पिटरले लगानी आकर्षण एवं आर्थिक व्यावसायिक सम्बन्ध विस्तारमा सहयोग पुर्याउन तयार रहेको प्रतिबद्धता जनाएको महासंघले जनाएको छ।"
"कांग्रेस महासमिति बैठक फेरि सर्यो,पुस १६ देखि हुने","काठमाडौं : नेपाली कांग्रेसको महासमिति बैठक फेरि सरेको छ। मंगलबार पार्टी केन्द्रीय कार्यालय सानेपमा पत्रकार सम्मेलन गरी यसबारे जानकारी गराएको हो। कांग्रेस प्रचार विभागका प्रमुख मीनबहादुर विश्वकर्माले बैठक पुस १६ गतेबाट १९ गतेसम्म सञ्चालन हुने बताए। उनले यसअघि मंसिर १३ देखि १५ गतेसम्म गर्ने भनिएको बैठक मंसिर २९ बाट पुसको २ गतेसम्म गर्ने निर्णय गरिएको भए पनि विविध कारणले पूर्वनिर्धारित मिति परिवर्तन गर्नुपरेको बताए। यसैगरी कांग्रेसले जाजरकोट र रुकुम पश्चिममा भूकम्पपछि राहत,पुन:स्थापना र पुन: निर्माणलाई थप व्यवस्थित बनाउन सरकारलाई सुझाव दिएको छ। मंगलबार बिहान कांग्रेससभापति शेरबहादुर देउवासहित महामन्त्री द्वय विश्वप्रकाश शर्मा र गगन कुमार थापालगायतको टोली बालुवाटार पुगेर प्रधानमन्त्री पुष्पकमल दाहाल प्रचण्डलाई भेटेर भूकम्प पीडितहरूलाई एकद्वार प्रणालीमार्फत प्रदेश सरकार र स्थानीय सरकारहरूलाई नै जिम्मेवारी दिएर राहत,पुन:स्थापना र पुन: निर्माणलाई थप व्यवस्थित बनाउन सुझाव दिएका हुन्। कांग्रेसले भूकम्प प्रभावितहरूलाई राहतस्वरुप ५० लाख रुपैयाँ सरकारलाई उपलब्ध गराएको छ। सभापति देउवालाई सो रकम बराबरको चेक प्रधानमन्त्री दाहाललाई हस्तान्तरण गरेका थिए।"
"प्रदेशमा छ विपद्, मुख्यमन्त्री अमेरिका सयरमा","कुनै समय मधेस प्रदेशका मुख्यमन्त्री लालबाबु राउतको भ्रमण रोकेको संघीय सरकारले चौधरीलाई भने विदेश सयरमा सहयोग गरेको छ। काठमाडौं : आफ्नै प्रदेशसहितका नागरिकहरू भूकम्पले त्राहीत्राही भएका बेला लुम्बिनी प्रदेशका मुख्यमन्त्री डिल्लीबहादुर चौधरी भने विदेश भ्रमणमा निस्किएका छन्। भूकम्पले नागरिकहरूको ज्यान गइरहेको सूचना आइरहँदा मुख्यमन्त्रीले मन्त्रिपरिषद्बाट भ्रमण स्वीकृत गराएर अमेरिकाको भ्रमणमा निस्किएका हुन्। प्रदेशका मुख्यमन्त्रीको भ्रमण संघीय सरकारले समेत स्वीकृत गर्छ। कुनै समय मधेस प्रदेशका मुख्यमन्त्री लालबाबु राउतको भ्रमण रोकेको संघीय सरकारले चौधरीलाई भने विदेश सयरमा सहयोग गरेको छ। चौधरी अमेरिकामा आयोजना हुने द एसेम्बली स्टेट अफ न्युयोर्क र अलबेनिक ३० औं डिस्ट्रिक्ट कार्यक्रममा सहभागी हुन अमेरिका गएका हुन्। प्रदेश सरकारका प्रवक्ता एवं गृहमन्त्री सन्तोषकुमार पाण्डेले मुख्यमन्त्रीको भ्रमण निजी भएको बताए। उहाँको आफ्नै प्रयासमा भएको निजी भ्रमण हो, उहाँका साथमा अरू कोही गएको छैन, उनले भने। भ्रमण स्वीकृत गर्ने सरकारी प्रक्रिया भएकाले मन्त्रिपरिषद्बाट स्वीकृत भएको उनले बताए। कार्यबहाक मुख्यमन्त्रीले कार्य गरिरहनुभएको उनले बताए। मुख्यमन्त्री चौधरी अमेरिका प्रस्थान गरेपछि लुम्बिनी प्रदेशको कार्यवाहक मुख्यमन्त्रीको जिम्मेवारी अर्थमन्त्री धनबहादुर मास्कीलाई प्रदान गरिएको छ। मुख्यमन्त्री चौधरी कात्तिक २६ गते स्वदेश फर्कने कार्यक्रम रहेको छ। गठबन्धन दलहरूको सहयोगमा चौधरी मुख्यमन्त्री भएका हुन्। मुख्यमन्त्री भएका चौधरीले अहिलेसम्म मन्त्रिपरिषद्मा पूर्णता दिन सकेका छैनन्। प्रदेशको बजेट कार्यान्वयनसमेत निकै कमजोर रहेको छ। चालु आर्थिक वर्षको पहिलो त्रैमासिकमा ७ प्रतिशत मात्रै बजेट खर्च भएको छ। अहिले लुम्बिनी प्रदेशका नागरिकसमेत भूकम्पबाट प्रभावित भएका छन्। प्रदेश राजधानी भएको जिल्ला दाङसहित रुकुमपूर्व, रोल्पा र प्युठानमा भूकम्पले घर भत्किएका छन्। भूकम्पपीडित नागरिकहरूको राहतका लागि केन्द्रीय कोषमा पठाउन प्रदेशले ढेड करोड छुट्ट्याए पनि भत्किएका घर पुनर्निर्माण तथा नागरिकको राहतमा कुनै योजना बनाएको छैन।"
भूकम्प प्रभावितको अवस्था बुझ्न राष्ट्रपति आज जाजरकोट र रुकुम पश्चिम जाँदै,गत शुक्रबार राति गएको भूकम्पबाट प्रभावित क्षेत्रका नागरिकको अवस्था बुझ्न राष्ट्रपति पौडेल आज त्यस क्षेत्रमा जान लागेका राष्ट्रपतिका प्रेस सल्लाहकार किरण पोखरेलले जानकारी दिए। काठमाडौं : राष्ट्रपति रामचन्द्र पौडेल आज बिहान भूकम्प प्रभावित क्षेत्र जाजरकोट र रुकुम पश्चिम जाँदै छन्। गत शुक्रबार राति गएको भूकम्पबाट प्रभावित क्षेत्रका नागरिकको अवस्था बुझ्न राष्ट्रपति पौडेल आज त्यस क्षेत्रमा जान लागेका राष्ट्रपतिका प्रेस सल्लाहकार किरण पोखरेलले जानकारी दिए। भूकम्पपछि मुलुकमा आाइपरेको प्राकृतिक विपत्तिको अवस्थामा मुलुक बाहिर जानु उपयुक्त नभएकाले राष्ट्रपति पौडेलले यही कात्तिक २२ गतेदेखि तय भएको आफ्नो युरोप भ्रमण स्थगित गरेका छन्।
"भूकम्प प्रभावित क्षेत्र पुगे राष्ट्रपति पौडेल, बिरामीको अवस्थाबारे लिए जानकारी",काठमाडौं : राष्ट्रपति रामचन्द्र पौडेल आज भूकम्प प्रभावित क्षेत्र जाजरकोट पुगेर बिरामीको स्वास्थ्य अवस्थाबारे जानकारी लिंदै छन्। भूकम्पबाट प्रभावितहरुको जनधनको क्षतिबारे जानकारी लिन मङ्गलबार जाजरकोट गएका राष्ट्रपति पौडेलले जाजरकोट जिल्ला अस्पतालमा पुगी भूकम्पमा परी घाइते भएका बिरामीको स्वास्थ्य अवस्थाबारे जानकारी लिएका हुन्।
भूकम्पबाट भएको क्षतिप्रति जापानी विदेशमन्त्रीले गरे दुःख व्यक्त,काठमाडौं : जापानका विदेशमन्त्री कामिकावा योकोले गत शुक्रबार पश्चिम नेपालका गएको भूकम्पबाट भएको जनधनको क्षतिप्रति दुःख व्यक्त गरेका छन्। विदेशमन्त्री कामिकावाले भूकम्पबाट धेरैको ज्यान गएको र ठूलो भौतिक क्षति भएको सुन्दा आफूलाई अत्यन्त दुःख लागेको उल्लेख गर्दै ज्यान गुमाउनेप्रति श्रद्धाञ्जली र शोकसन्तप्त परिवारजनमा समवेदना व्यक्त गरेका छन्। विदेशमन्त्री कामिकावाले भूकम्पबाट भएको जनधनको क्षतिप्रति दु:ख व्यक्त गर्दै शोक सन्देश पठाएको परराष्ट्रमन्त्री नारायणप्रकाश साउदले जनाएका छन्। शोक सन्देशमा उनले जापान सरकार सदैव नेपाल सरकार र जनताका साथ रहेको र नेपालको स्थानीय आवश्यकताका आधारमा उचित सहयोग गर्न तत्पर रहेको बताएका छन् । विदेशमन्त्री कामिकावाले भूकम्प प्रभावित क्षेत्रको यथाशीघ्र पुनःनिर्माणको कामना गर्दै घाइतेको शीघ्र स्वास्थ्यलाभको कामना गरेका छन्।
"चिनियाँ कम्युनिस्ट पार्टीका तिब्बत सचिव भोलि नेपाल आउँदै, यतैबाट कोलम्बो जाने","काठमाडौं : चीनको स्वसाशित क्षेत्र तिब्बत (सिजाङ)को चिनियाँ कम्युनिस्ट पार्टीका सचिव वाङ च्युनचङ बुधबार नेपाल भ्रमणमा आउने भएका छन्। परराष्ट्र मन्त्रालय स्रोतका अनुसार सचिव च्युनचन बुधबार काठमाडौं आइपुग्नेछन्। नेपाल बसाईका क्रममा उनले प्रधानमन्त्री पुष्पकमल दाहालको चीन भ्रमणका बेला भएका सम्झौता र सहमति कार्यान्वयनका लागि पहल गर्ने स्रोतले बताएको छ। नेपालका लागि चिनियाँ राजदूत छन् सोङले सोमबार प्रधानमन्त्री दाहाललाई भेटेर चिनियाँ कम्युनिस्ट पार्टीको नेपाल भ्रमणबारे जानकारी गराएका थिए। पाँच दिने भ्रमणमा काठमाडौं आउन लागेका उनी उपराष्ट्रपति, प्रधानमन्त्री, गृहमन्त्रीसहित शीर्ष नेताहरूसँग शिष्टाचार भेट गर्नेछन्। सचिव च्युनचङले बुधबार नै उपराष्ट्रपति रामसहाय यादवसँग भेटवार्ता गर्नेछन्। त्यसको भोलिपल्ट बिहीबार उनले प्रधानमन्त्री पुष्पकमल दाहाल, राष्ट्रियसभा अध्यक्ष गणेशप्रसाद तिमिल्सिना र सामान्य प्रशासनमन्त्री अनिता देवीसँग भेटवार्ता गर्नेछन्। उनी शुक्रबार पोखरा जाने कार्यक्रम रहेको छ। पोखरा बसाईको क्रममा उनले शनिबार आयोजना हुने नेपालचीन कल्चरल एक्सचेन्ज कार्यक्रममा सहभागी हुनेछन्। सचिव च्युनचङ शनिबार नै काठमाडौं फर्केर गृहमन्त्री नारायणकाजीसँग भेटवार्ता गर्ने कार्यक्रम रहेको छ। उनले आइतबार भूकम्पबाट क्षति भई चीन सरकारको सहयोगमा पुनःनिर्माण भइरहेको भक्कतपुरका आयोजनाहरूको अवलोकन गर्ने कार्यक्रम रहेको स्रोतको भनाइ छ। त्यसपश्चित उनी आइतबार नै श्रीलंकाको कोलम्बो प्रस्थान गर्नेछन्।"
