शीर्षक,विवरण
सुनियोजित भ्रम फैलाएको भन्दै पत्रकार महासंघविरुद्ध कान्तिपुरको आपत्ति,"काठमाडौं : नेपाल पत्रकार महासंघले विज्ञप्ति निकालेर सुनियोजित भ्रम फैलाएको भन्दै कान्तिपुर पब्लिकेशन्सले आपत्ति जनाएको छ। कान्तिपुरले मंगलबार विज्ञप्ति जारी गर्दै संस्था र नेतृत्वप्रति दूराग्रहपूर्वक लाञ्छना लगाउने र राजनीतिक प्रतिशोध लिने शृंखलाविरुद्ध गम्भीर ध्यानाकर्षण भएको जनाएको छ। आर्थिक मन्दीबाट ग्रसित देश र सञ्चार उद्योगको विषम परिवेशअनुसार पब्लिकेशन्सले समग्र वित्तीय पुनरावलोकन गर्नुपरेकाले जनशक्तिको आकार पनि सीमित गर्न खोजेको कान्तिपुरले स्पष्ट पारेको छ। यस क्रममा नेपाल पत्रकार महासंघ, कान्तिपुर शाखाले राखेका सरोकारका विषयमा चरणबद्ध संवाद गरी भएको सहमतिका आधारमा संस्थाले आर्थिक प्याकेजसहितको स्वैच्छिक अवकाश आह्वान गरेको र संस्थाले दिएको समयसीमाभित्र उल्लेख्य संख्यामा सञ्चारकर्मीहरूको राजीनामा आएको कान्तिपुरले जानकारी दिएको छ। त्यस्तै माग र आपूर्तिको सिद्धान्तअनुसार जनशक्ति घटबढ गर्नु तथा आवश्यकताका आधारमा सरुवा गर्न पाउनु व्यावसायिक अधिकार रहेको भन्दै कान्तिपुरले त्यस क्रममा कानुनको परिपालना गर्नु आफ्नो दायित्व रहेको बताएको छ। 'जीवन्त संस्थामा यो क्रम निरन्तर जारी रहन्छ। त्यसको मापदण्ड तय गर्दा पहिलो प्राथमिकता आपसी समझदारी हो भने त्यसको विकल्प कानुनी मार्ग हो। यी वैधानिक मार्गबाहेक कुनै पनि तेस्रो पक्षको गैरव्यावसायिक दबाबसँग सम्झौता गर्न कान्तिपुर किञ्चित तयार छैन,' मानव संसाधन विभागका प्रमुख पुष्पराज गिरीद्वारा जारी विज्ञप्तिमा भनिएको छ। तीन दशकभन्दा लामो व्यावसायिक पत्रकारिताको दौरानमा कान्तिपुरले यस्ता अनेक मोडको सामना गरेको उसले स्पष्ट पारेको छ। कतिसम्म भने व्यवस्थापन र पत्रकार महासंघ प्रतिष्ठान शाखाबीच संवाद भइरहेका बेला वार्ता भाँड्ने उद्देश्यले महासंघले चरणबद्ध विज्ञप्ति जारी गरेको कान्तिपुरले आरोप लगाएको छ। पत्रकारहरूको हितमा संवाद र सहमति गर्ने शाखालाई निलम्बन गर्ने हर्कतबाट पनि महासंघ अहिले कस्तो समूहको नियन्त्रणमा छ भन्ने छर्लंग भएको विज्ञप्तिमा भनिएको छ। कान्तिपुरले ८२ जना सञ्चारकर्मीलाई कारबाही गरेको दाबी पुष्टि गर्न महासंघलाई चुनौतीसमेत दिएको छ। 'पत्रकार महासंघले पटकपटक विज्ञप्ति जारी गर्दै कान्तिपुरले ८२ जना सञ्चारकर्मीलाई कारबाही गरेको दाबी गरेर आफ्नै विश्वसनीयता गुमाएको छ। महासंघले दाबी गरेकोमध्ये आधा संख्यामात्र पनि पुष्टि गर्न कान्तिपुर महासंघ नेतृत्वलाई चुनौती दिन्छ,' विज्ञप्तिमा भनिएको छ, 'बरु आन्दोलनमा गएका पत्रकारलाई समेत सबै खाइपाइ आएको दसैं पेस्कीसमेत प्रदान गरिएको छ।' कानुनी बाटो छाडेर निहित उद्देश्यले संस्थाको बदनाम गर्ने, गेटमा जम्मा भएर पत्रकार तथा कर्मचारीको काममा अवरोध गर्ने प्रवृत्ति अविलम्ब नरोकिए सम्बन्धित सबैलाई प्रचलित कानुनअनुसार कारवाही गर्न र त्यस्तो कार्यमा उक्साउने समूहविरुद्ध आवश्यक कानुनी उपचार खोज्ने कान्तिपुरको विज्ञप्तिमा उल्लेख छ।"
बर्दिवासले भूकम्पपीडितलाई १२ लाख सहयोग गर्ने,महोत्तरी : जाजरकोट र रुकुम पश्चिमका भूकम्पपीडितलाई बर्दिवास नगरपालिकाले १२ लाख रुपैयाँ सहयोग गर्ने भएको छ। ती राहतस्वरुपको रकम चाँडै नै त्यसक्षेत्रमा पठाउने तयारी भएको बर्दिवास नगरपालिकाले जनाएको छ। नगरपालिका क्षेत्र भित्र रहेको सरकारी तथा गैरसरकारी संघ संस्थासँग छलफल गरेपछि नगरपालिकाले सहयोग गर्ने निर्णय गरेको हो। जाजरकोट र रुकुम पश्चिमका ४ स्थानीय पालिकालाई ३ लाखका दरले जम्मा १२ लाख रकम दिइने नगर प्रवक्ता विजय कुमार महतोले जानकारी दिए।
नदी प्रदूषित गर्ने उद्योगलाई दोस्रो पटक जरिवाना,"वीरगन्ज : वीरगन्जको सिर्सिया नदीमा प्रदूषण गर्ने सिद्धि टेक्सटाइललाई महानगरपालिकाले दोस्रो पटक जरिवाना तिराएको छ। नदीमा प्रदूषण गरेको भन्दै महानगरपालिकाले वीरगन्ज महानगरपालिका२१ स्थित सिद्धि टेक्सटाइलसहित पाँच उद्योगलाई यसअघि गत चैत १४ गतेपनि ३३ लाख जरिवाना गरेको थियो। मंगलबार अनुगमनका क्रममा उद्योगबाट निस्किने रसायन र लेदोसहितको फोहोर पानी सिद्धि टेक्सटाइले सोझै सिर्सिया नदीमा मिसाएर प्रदूषित गरेको भेटिएपछि महानगरले उसलाई फेरि ३० हजार रुपैयाँ जरिवाना गरेको हो। मंगलबार अनुगमनका क्रममा सिद्धि टेक्सटाइलले उद्योगबाट निस्केको रसायन र लेदोसहितको फोहोर पानी प्रशोधन नै नगरी सोझै सिर्सिया नदीमा मिसाउने गरेको भेटिएपछि ३० हजार रुपैयाँ जरिवाना गरिएको वीरगन्ज महानगरपालिका सरसफाइ व्यवस्थापन महाशाखाका प्रमुख सर्फुदीन मियाँले बताए। वीरगन्जका उद्योगी अशोक मित्तल सञ्चालक रहेको सिद्धि टेक्सटाइललाई यसअघि पनि महानगरपालिकाले तीन लाख रुपैयाँ जरिवाना गर्दा समेत उसले सिर्सिया नदिलाई प्रदूषित गर्ने कामलाई जारी नै राखेको भेटिएको उनले बताए। वीरगन्जको लाइफलाइनकै रुपमा रहेको सिर्सिया नदी करपब तीन दशकदेखि प्रदूषणको चपेटामा परेको छ। पर्सा बारा औद्योगिक करिडोरमा रहेमा ४५ भन्दा बढी उद्योगले उद्योगबाट निस्कने फोहरजन्य पदार्थ, छालाजन्य लेदो र रसायनयुक्त पानी सोझै नदीमा मिसाउँदा नदी नै प्रदूषित बन्दै आएको छ। वीरगन्ज र यस आसपासका करिब डेढ दर्जन गाउँका स्थानीयले त्यही प्रदूषित नदीमा छठ पर्व मनाउन बाध्य हुँदै आएका छन्। नदीलाई प्रदूषणमुक्त बनाउन महानगरपालिकाले गत चैतदेखि अभियान नै थालेर कडाइ गरेपछि दुई दिनअघि मात्र सिद्धि टेक्सटाइलसहितका यहाँका उद्योगले तिहार तथा छठ पर्व अगाडि नै सिर्सिया नदीको प्रदूषण रोक्ने सहमति जनाएका थिए। त्यसअघि गत गत असोज २९ गतेका दिन महानगरका मेयर राजेशमान सिंह आफैले गरेको अनुगमन पश्चात् उद्योगका सञ्चालकहरूले रसायनयुक्त लेदो तथा फोहोर प्रशोधन गरेर मात्रै नदीमा पठाउने र त्यसो नगरे उद्योग सिल गरी नियमबमोजिम जरिवाना तिर्ने सहमति जनाएका थिए। सहमति अनुसार मरियम लेदर उद्योग र अरनिको टेक्सटायल्सले अत्याधुनिक पानी प्रशोधन गर्ने प्लान्ट बनाउने कामअघि बढाए पनि सिद्धि टेक्सटाइलका सञ्चालक मित्तलले सहमतिलाई लत्याउँदै सिर्सिया नदीलाई प्रदूषित गर्ने कार्य जारी राखेको भेटिएपछि दोस्रो पटक जरिवाना गरिएको मियाँले बताए। उनका अनुसार यअघि गत चैतमा ३र३ लाख जरिवाना गरिएका ग्लोबल लेदर, मारुती पल्स एन्ड पेपर र दुर्गा पल्स एन्ड पेपरले पनि आफ्ना उद्योगमा फोहोर पानी प्रशोधन गर्ने यन्त्र जडान गर्न अटेर गरिरहेका छन्। यद्यपि ग्लोबल, मारुती र दुर्गा पल्सले छठसम्मका लागि उद्योग बन्द गरे पनि सिद्धि टेक्लेसटाइलले भने त्यस्तो नगरेको सरसफाइ व्यवस्थापन महाशाखाका प्रमुख मियाँले बताए।"
भूकम्पपीडितका लागि भैरहवामा न्यानो माया अभियान,"भैरहवा : भूकम्पपीडितहरूको सहयोगका लागि रुपन्देहीको भैरहवामा न्यानो माया अभियान सञ्चालन गरिएको छ। चिसोयाम सुरु भएसँगै पीडितहरूलाई न्यानो कपडा आवश्यक पर्न सक्ने भएकोले लत्ताकपडा संकलनका लागि अभियान सञ्चालन गरिएको हो। सिद्धार्थनगर नगरपालिका (भैरहवा) को उपप्रमुख उमा अधिकारीको नेतृत्वमा सहरमा लत्ताकपडा संकलन भइरहेको छ। सर्वसाधारणहरूले नयाँ र प्रयोग भएका (प्रयोग गर्न सकिने) दुवै प्रकारका लत्ता कपडा सफा गरी उपलब्ध गराउन सर्वसाधारणलाई आग्रह गरिएको उपप्रमुख अधिकारीले बताइन्। म पहिला पनि खेलकुदको माध्यमबाट जाजरकोट पुगेको छु , निकै विकट क्षेत्रहरू छन् र त्यहाँ बालबालिका लगायत अन्यलाई कपडा आवश्यकता महसुस गरेको थिए उनले भनिन्, भूकम्पका कारण पीडितहरू थप बिच्चली परेकाले समस्यालाई मध्यनजर गर्दै अभियान सञ्चालन गरेका हौँ। अभियान सञ्चालन भएसँगै भैरहवाका सर्वसाधरणले नयाँ र पुनः प्रयोग गर्न मिल्ने लत्ता कपडाहरू संकलन केन्द्रमा पुर्याउन थालेका छन्। उनले आइतबार बिहानदेखि सुरु भएको अभियानअन्तर्गत आइतबार साँझसम्म संकलन भएको ३५ बोरा कपडा नगरपालिका कार्यालयको राहतसँगै भूकम्प प्रभावित जिल्लामा पठाइएको बताइन्।"
बागमतीका कर्मचारीले भूकम्पपीडितलाई १ करोड २५ लाख सहयोग गर्ने,हेटौंडा : बागमती प्रदेशमा कार्यरत कर्मचारीहरूले भूकम्प पीडितलाई १ करोड २५ लाख सहयोग गर्ने भएका छन्। मंगलबार बागमती प्रदेशका प्रमुख सचिव घनश्याम उपाध्यायको अध्यक्षतामा बसेको बैठकले जाजरकोट र रुकुम पश्चिमका भूकम्पपीडितलाई सहयोग रकम उपलब्ध गराउने निर्णय गरेको हो। बैठकले प्रमुख सचिव र सचिवको ३ दिनको तलब अधिकृत स्तरको कर्मचारीको २ दिनको र बाँकी कर्मचारीहरूको १ दिनको तलब कर्णाली प्रदेश विपद् व्यवस्थापन कोषमा जम्मा गर्ने निर्णय गरेको हो।
भूकम्प पीडितलाई वाणिज्य बैंकका कर्मचारीले गरे एक करोड सहयोग,काठमाडौं : राष्ट्रिय वाणिज्य बैंकका कर्मचारीहरूले जाजरकोट र रुकुम पश्चिमका भूकम्प पीडितलाई एक करोड रुपैयाँ सहयोग गरेका छन्। उनीहरूले मंगलबार प्रधानमन्त्री पुष्पकमल दाहाल 'प्रचण्ड' लाई भेटेर सो रकम बराबरको चेक हस्तान्तरण गरेका हुन्। सरकारले भूकम्प पीडितका लागि प्रधानमन्त्री दैवीप्रकोप उद्धार कोषमा सहयोग जम्मा गर्न आश्वन गरेको छ। सरकारले भूकम्पमा परी मृत्यु भएकाको परिवारलाई तत्काल राहतस्वरुप दुई लाख रुपैयाँ उपलब्ध गराउने निर्णय गरेको छ। गत शुक्रबार राति जाजरकोटको रामीडाँडा केन्द्रविन्दु भएर गएको भूकम्पमा परी जाजरकोट र रुकु्मपश्चिममा १५३ जनाको मृत्यु भएको छ भने करिब दुई सयजना घाइते छन्। भूकम्पबाट हजारौं भौतिक संरचना भत्किएका छन्। समयमै राहत सामग्री नपाउँदा भूकम्प पीडितहरू खुला आकाशमुनि रात बिताउन बाध्य भएका छन्। भूकम्प गएको चारदिन वितिसक्दा पनि प्रयाप्त मात्रामा राहत नपाएको पीडितहरूले गुनासो गरेका छन्।
मलेसियाबाट फर्किएर तीन छोराछोरीसहित श्रीमतीको अन्तिम दाहसंस्कार गरेका उदय,"जाजरकोट : भेरि नगरपालिका १ जाजरकोटका ४० वर्षीय उदय विक भूकम्प गएको चार दिनपछि मलेसियाबाट घर फर्किएका छन्। जाजरकोट स्थित रावत गाउँका उनी गत वर्ष कार्तिकमा वैदेशिक रोजगारीको लागि मलेसिया गएका थिए। मलेसियामा नै उनले गत शुक्रबार राती आएको भूकम्पले आफ्नो घरमा क्षति भएको थाहा पाए। घरबाट फोन गरेर छिटो फर्किन भने। उनलाई नराम्रो घटना भएको आभाश भइसकेको थियो। फर्किएपछि मात्र उनले भूकम्पमा परी तीन छोराछोरी र श्रीमती गुमाएको थाहा पाए। जाजरकोट केन्द्रबिन्दु भएर कार्तिक१७ गते गएको भूकम्पमा उनका परिवारका ६ सदस्यको मृत्यु भएको छ। भूकम्पमा उनले पत्नी, दुई छोरी र एक छोरा, भाइकी एक छोरी र भान्जी गुमाएका छन्। ३० वर्षीया पत्नी जानु सूनार,१३ र ८ वर्षीया छोरीहरु सर्मिला विक र अञ्जली विक र ४ वर्षीय छोरा उज्जवल विकको मृत्यु भएको हो। त्यस्तै माइला भाइ मोहनबहादुर विककी छोरी ११ वर्षीया निरूताको पनि भूकम्पमा परी मृत्यु भएको छ। भूकम्प गएको चार दिनपछि विक घर पुगेका थिए। त्यसपछि उनले परिवारका सदस्यको अन्तिम संस्कार गरेका हुन्। छोराछोरीको शव भने गाडीएको हो। विक छोराछोरी र श्रीमतीको अन्तिम विदाइमा आफूलाई सम्हाल्न सकेका थिएनन्। आफ्ना तीन छोराछोरी शव गाड्दा भावविह्वल हुँदै भने, 'मेरो मुटुको टुक्राहरुको भविष्य बनाउन लाग्दा यता उनीहरुले ज्यान नै गुमाए। मलाई सबैले एक्लै छाडेर गए। मेरा मु्टुका टुक्राहरु फेरि अर्को राम्रो ठाउँमा जन्म लिउनू।'"
