शीर्षक,विवरण
भूकम्पले त्रसित बाल मानसिकता,"घाइते बालबालिकाको उपचार, अभिावकविहीनलाई आश्रय र नियमित पठनपाठनको व्यवस्था नभएसम्मका लागि सबै बालबालिकाहरूलाई व्यस्त राख्ने उपायहरू अवलम्बन गर्न अति आवश्यक छ। प्राकृतिक विपत्तिमा सबैभन्दा बढी प्रभावित हुने बालबालिका र वृद्धवृद्धा हुन्। अझ बालबालिकामा भूकम्पको असर वर्षौंपछिसम्म पनि बसिरहन्छ। विश्वमा भएका ठूला भूकम्पहरूमा पनि मानवीय क्षतिको संख्यामा बालबालिका, वृद्धवृद्धा र महिला बढी छन्। जाजरकोट केन्द्रबिन्दु भएर गएको भूकम्पमा मृत्यु भएकामध्ये झन्डै आधा संख्या बालबालिका रहेका छन्। कात्तिक १७ गते राति गएको भूकम्पबाट मृत्यु भएका १ सय ५३ मध्ये ७८ बालबालिका रहेको दुःखद् तथ्यांकले पनि यस्ता विपत्तिमा बालबालिकाको जोखिम स्तर प्रस्ट पार्छ। जाजरकोटमा ५० र रुकुम पश्चिममा २८ जना बालबालिकाको भूकम्पमा परी मृत्यु भएको गृह मन्त्रालयको तथ्यांक छ। यो तथ्यांकमा रुकुम पश्चिमको अवस्था अझ कारुणिक छ। भूकम्पमा परी ५२ जनाको मृत्यु भएकोमा २८ बालबालिका रहेका छन्। १० महिनाका दुई बालबालिकाले समेत ज्यान गुमाएका छन्। मृत्युसँगै घाइते हुनेको संख्या पनि बालबालिकाको बढी रहेको छ। अबको समय भनेको घाइते बालबालिकाको उचित उपचार मुख्य कुरा हो। घाइते बालबालिकालाई प्राथमिकतामा राखेर उपचारको काम गरिनुपर्दछ। २०७२ को भूकम्पबाट पाठ सिकेर बालबालिकाको उपचार, परामर्श र पढाइको निरन्तरतामा ध्यान दिन जरुरी छ। २०७२ को भूकम्पमा घाइते भएका कतिपय बालबालिकाले समयमा नै उपचार नपाएर ज्यान गुमाए। कतिपय भूकम्पको मानसिक असरले पढाइलाई निरन्तरता दिन नसक्ने भए। हजारौं विद्यार्थीको पढ्ने कापी कलममात्रै क्षति भएन, वर्षौैंसम्म विद्यालयसमेत पुनर्निर्माण हुन सकेन। भूकम्पमा अभिभावक गुमाएका बालबालिका टुहुरा मात्र भएनन्, कतिपयको अध्ययनको यात्रा पनि रोकियो। २०८० को जाजरकोट केन्द्रबिन्दु भएर गएको भूकम्पपछि पनि यस्तै समस्याको पुनरागमन हुँदैछ। धेरै बालबालिकाले अभिभावक गुमाएका छन्। कयौं बालबालिका घाइते छन्। घर भत्किएपछि कापीकलम हराएको छ। विद्यालय भत्किएर पढाइ रोकिएको छ। कतिपय मानसिक रूपमा विक्षिप्त भएका छन्। सबैभन्दा गम्भीर सबाल बालबालिकाको मनमस्तिष्कमा जरा गाडेर रहन सक्ने भय, त्रास र मानसिक विचलन हो। त्यसैले यसकारण भूकम्पपछिको पुनर्निर्माण र पुनस्र्थापनाको प्राथमिकताक्रममा बालबालिका र शिक्षालाई पहिलो प्राथमिकतामा राखिनुपर्छ। किनभने हिजोसम्म सँगसँगै रहने आफ्ना साथीहरू र अभिभावक गुमाएका बालबालिकालाई शोक र त्रासको मनस्थितिबाट नियमित पठनपाठनको दायरामा ल्याउनु गम्भीर चुनौती हो। घाइते बालबालिकाको उपचार, अभिावकविहीनलाई आश्रय र नियमित पठनपाठनको व्यवस्था नभएसम्मका लागि सबै बालबालिकाहरूलाई व्यस्त राख्ने उपायहरू अवलम्बन गर्न अति आवश्यक छ।"
"पीडित भोकै, सुगममै थन्कियो राहत","जाजरकोट : शुक्रबार राति गएको भूकम्पका कारण घरबारविहीन बनेका पीडितले हालसम्म राहत पाउन सकेका छैनन्। सरकारी तथा गैरसरकारी निकायले भूकम्पपीडितका लागि उपलब्ध गराउने भनिएको राहत सामग्री सुगममै थन्किएको हो। भूकम्पका कारण सबैभन्दा क्षति पुगेको जाजरकोट सदरमुकाम खंलगा र पालिकाको केन्द्रमै राहत थन्किएको छ। विभिन्न निकायले उपलब्ध गराएको राहत सामग्री सुगममै थन्किएका कारण सबैभन्दा मारमा दुर्गमका पीडितहरू परेका छन्। जिल्ला प्रशासन कार्यालयले जाजरकोटले एकद्वार प्रणालीबाट राहत वितरण गरिएको जनाएको छ। तर, राहत सामग्री दुर्गमका पीडितसम्म पुग्न नसकेको हो। राहत सामग्री सदरमुकाम र पालिकाको केन्द्रसम्म पुगे पनि पीडितले पाउन नसक्दा थप संकट पैदा भएको छ। भूकम्पबाट घरबारविहीन भएको तीन दिनसम्म पनि त्रिपाल, खाद्यान्न र कपडालगायतका राहत सामग्रीहरू नपाउँदा थप समस्या भएको पीडितको गुनासो छ। जाजरकोटको नलगाडमा पीडितहरू चिसोका कारण बिरामी पर्न थालेका छन्। त्रिपालबिनै चिसोमा रात काट्नु परेका कारण रुघाखोकी र ज्वरोको समस्या देखिएको छ। राहत सामग्री थुप्रिए पनि सडक नपुगेको बस्तीका पीडितले पाउन सकेका छैनन्। दुर्गमका पीडितले मात्र होइन, सदरमुकाम खलंगाभित्रै पीडितले हालसम्म राहत पाउन नसकेको गुनासो गरेका छन्। भेरी नगरपालिका३ थाप्लेका प्रकाशजंग शाहले भने, भूकम्पले घरै पूरै भत्किएर खुला चौरमा बास भएको छ, तर हामीले आजसम्म त्रिपाल पनि पाएका छैनौं। पीडितको नाममा आएको राहत पहुँचवालाले मात्र पाएका छन्, वास्तविक पीडितले राहत नै पाउन सकेका छैनन्। सदरमुकामभित्रैका पीडितले राहत पाउन नसकिरहेको अवस्थामा सडक नपुगेका र विकट क्षेत्रका पीडितले राहत नै देख्न नपाएको समाजसेवी जनक केसी बताउँछन्। उनी भन्छन्, सदरमुकामकै पीडितले राहत पाउन सकेका छैनन्, विकट बस्तीमा राहत पुग्ने कहिले हो ? चिसोमा रात बिताउनुपर्ने बाध्यताका कारण गाउँमा पीडितहरू बिरामी हुन थालेका छन्, पहुँचवालाले नै राहतमा रजाइँ गर्ने अवस्था छ। भेरी नगरपालिकाकै भूकम्पपीडित तारा विकले घर भत्किएपछि आफूहरू सडकमै सुत्न बाध्य भएको सुनाइन्। उनले भनिन्, राहत नै पाएका छैनौं, एउटा त्रिपाल पनि नहुँदा खुला स्थानमा चिसोमा रात काट्नु परेको छ। हाम्रो टोलमा कोही पनि राहत दिन आएका छैनन्, भत्किएको घर छाडेर राहत माग्न कहाँ जाऊँ ? जाजरकोटकै बारेकोटका वीरबहादुर नेपालीले भने, मेरो घर भत्किएको छ, बस्नलाई ठाउँ नै छैन। तर, आज तीनदिन भयो, कसैले राहत दिएनन्। रातमा निदाउन नसकेको भन्दै उनले बस्ने र खाने टुंगो नभएको सुनाए। भत्किएको घरको मुचुल्का उठाउनसमेत कोही नआएको भन्दै उनले आफ्ना लागि सरकार नै नभएको दुखेसो पोखे। भूकम्पका कारण घरबारविहीन बनेकाहरूले भत्किएको घरबाट सामान नै निकाल्न सकेका छैनन्। बचेका कपडा र खाद्यान्न निकाल्न नपाएका कारण पनि आफूहरू भोकभोकै बस्नुपर्ने अवस्था भएको पीडित कमला वलीले बताइन्। उनले भनिन्, भूकम्पमा भाग्यले ज्यान त जोगायौं, तर अहिले चिसोमा भोकै बस्नुपर्ने बाध्यता छ। सरकारले राहत दिन्छ भन्छन्, हामीले आजसम्म पाएका छैनौं।केही स्थानमा राहत वितरण सुरु गरिए पनि पर्याप्त नहुँदा विवाद भएपछि रोकिएको छ। पीडितले राहत पाउन नसकिरहेका बेला स्थानीय प्रशासनले भने प्रभावित क्षेत्रमा राहत पठाउन सुरु भएको जनाएको छ। जिल्ला प्रशासन कार्यालय जाजरकोटका सूचना अधिकारी हरिश्चन्द्र शर्माले पीडितलाई राहत उपलब्ध गराउनका लागि प्रयास भइरहेको बताए। उनले भने, हामीले उद्धारको काम सकेपछि राहत वितरण थालेका छौं, प्रभावित क्षेत्रमा राहत वितरणका लागि सम्बन्धित पालिकालाई राहत सामग्री हस्तान्तरण सुरु गरेका छौं। उनले सोमबारसम्म ६ हजार कम्बल, ७ हजार त्रिपाल र चामल २५ सय बोरा पालिकाहरूलाई जिम्मा लगाएको बताए। पालिकाको जिम्मा लगाइएकाले चाँडै पीडितले राहतले पाउने उनको भनाइ छ।"
नेपालमा पहिलोपल्ट एसियन बैंकिङ सम्मेलन हुँदै,"काठमाडौं : नेपालमा पहिलोपल्ट एसियन बैंकिङ कन्फेरेन्स आयोजना हुने भएको छ। एसियन बैंकर्स एसोसिएसनको आयोजनामा कात्तिक २३ र २४ गते सम्मेलन आयोजना हुन लागेको नेपाल बैंकर्स संघले बताएको छ। संघको आग्रहमा पहिलो पटक नेपालमा रोडम्याप, रिकभरी एन्ड सस्टेनेबल ग्रोथ थिममा कन्फरेन्स आयोजना हुन लागेको हो। सम्मेलनमा २५ देशका करिब ७० प्रमुख कार्यकारी अधिकृतहरू आउने निश्चित भएको बताइएको छ। संघका अनुसार सम्मेलनले विश्वव्यापी परिस्थितिबाट समाधान खोज्ने र दिगो विकास लक्ष्य हासिल कसरी सम्भव भनेर बहस हुनेछ। साथै एक सय वर्षपछि आएको महामारी, युद्धलगायतले निम्त्याएको परिस्थितिबाट कसरी सहज वातावरण बनाउने भन्नेबारे छलफल हुनेछ।"
बैंकिङ क्षेत्र स्वस्थ,"काठमाडौं : बैंकरहरूले पहिलो त्रैमासिक अन्त्यसम्म नाफामा गिरावट आए पनि बैंकिङ क्षेत्र स्वस्थ रहेको दाबी गरेका छन्। वाणिज्य बैंकहरूले सार्वजनिक गरेको पहिलो त्रैमासको वित्तीय विवरणमा नाफा घटेको भन्दै जानकारहरूले सो विवरणलाई निराशाजनक भनेका छन्। तर, वाणिज्य बैंकका प्रमुख कार्यकारी अधिकृतहरू भने सो मान्न तयार नभएका हुन्। कर्जा नोक्सानी प्रोभिजनले चालू आर्थिक वर्षको पहिलो त्रैमासमा नाफा घटे पनि भविष्यका लागि राम्रो हुने तर्क बैंकरको छ। निष्क्रिय कर्जासँगै बैंकहरूको लोन लस प्रोभिजन बढ्नुको असर नाफामा परेको छ। बैंकहरूले जुन मात्रामा लोन लस प्रोभिजन गरेका छन् र जुन स्तरको पुँजी कोष कायम गरेका छन्, त्यसले बैंकिङ क्षेत्र स्वस्थ नै रहेको संकेत गर्ने हिमालयन बैंकका प्रमुख कार्यकारी अधिकृत अशोक राणा बताउँछन्। राणा भन्छन्, निष्क्रिय कर्जा पनि अब थप बढ्ने छैन, उल्टै म्यानेज हुनेछ। उनका अनुसार नेपालको अर्थतन्त्र दबाबमा रहेका कारण नेपाल राष्ट्र बैंक र बैंकहरूले कर्जा प्रवाहमा कडाइ गरेका हुन्। वाणिज्य बैंकहरूको छाता संगठन नेपाल बैंकर्स संघका अध्यक्ष सुनील केसी विश्वव्यापी रूपमा आर्थिक मन्दी, द्वन्द्व, निजी क्षेत्र सुस्ताउनुलगायतको कारणले बैंकिङ प्रणाली प्रभावित बनेको र परिणामस्वरूप बैंकको निष्क्रिय कर्जाको आकार बढेको बताउँछन्। केसी बैंकहरूको निष्क्रिय कर्जा बढेर उच्च बिन्दुमा पुगेको र अब विस्तारै व्यवस्थापन हुनेमा विश्वस्त छन्। उनले बैंकले कर्जा नोक्सानी प्रोभिजन १६ अर्ब छुट्ट्याएको बताए। उनले भने, बैंकले प्रोभिजन छुट्ट्याए तर कर्जा प्रवाह बढाउन सकिएको छैन। उनका अनुसार चालू आर्थिक वर्षको कात्तिक १७ गतेसम्म वाणिज्य बैंकमा रहेको कुल निक्षेप १ खर्ब २० अर्ब र कर्जा प्रवाह ८४ अर्बले बढेको छ। हामीले अझै धेरै कर्जा प्रवाहको अपेक्षा गरेका थियौं तर हुन सकेन, केसीले भने। वित्तीय विवरणअनुसार बैंकहरूको खराब कर्जाको हिस्सा कुल कर्जाको औसत ३०६ प्रतिशत हाराहारीमा छ। जबकि गत असारसम्म औसत २९ प्रतिशत थियो। केसी भन्छन्, खराब कर्जा बढ्नुको पृष्ठभूमि कोभिड हो। हामीले कर्जालाई पुनर्संरचना गरेर ल्याएका थियौं, अब भने सजग भएर अगाडि बढ्नुपर्ने अवस्था आएको छ, केसीले भने, पोर्टफोलियो डाइभर्सिफाइड हुँदा अहिले केही कर्जा डिफल्ट भए पनि खराब कर्जा नै हुने सम्भावना कम छ। डिफल्ट कर्जामा अहिले प्रोभिजन गरेर जाँदा भोलि रिकभरीसँगै राइटब्याक हुनेछ। वाणिज्य बैंकहरूको अघिल्लो आर्थिक वर्षको तुलनामा पहिलो पटक नाफा घटेको विवरण सार्वजनिक गरेका थिए। यसबीचमा बैंकहरूको खुद ब्याज आम्दानी बढेको छैन भने अन्य शुल्क तथा आम्दानी करिब एक अर्बले मात्रै बढेको छ। यसैबीच जाजरकोट भूकम्पको लागि नेपाल बैंकर्स संघको आग्रहमा पाँच करोडभन्दा बढीको सहयोग गर्ने प्रतिबद्धता आएको बैंकर्स संघले जानकारी दिएको छ।"
