शीर्षक,विवरण
कांग्रेस सरकार गिराउने खेलमा लागेको छ : एमाले उपाध्यक्ष पौडेल,"बागलुङ : नेकपा एमालेका उपाध्यक्ष विष्णु पौडेलले नेपाली कांग्रेसले वर्तमान समीरकरणलाई बिगारेर सरकारमा आउन संसदीय छानबिन समिति माग गरेको बताएका छन्। सरकार गिराउन कांग्रेसले गृहमन्त्री रवि लामिछानेको विषयमा अनुसन्धान गर्न समिति बनाउनुपर्ने माग गरिरहेको उनको आरोप छ। उनले सहकारी ठगिका विषयमा राज्यका निकायहरूले अनुसन्धान गरिरहेकाले अहिले नै संसदीय छानबिन समिति आवश्यक नरहेको बताए। राज्यका निकायहरूले सहकारी ठगिका विषयमा अनुसन्धान गरिरहेका छन्। छानबिन नगर्ने भन्ने होइन, सत्ताबाट प्रतिपक्षमा पुगेको कांग्रेसको नियत ठीक छैन। उसले सत्ता समीकरण बिगार्नमात्रै यो माग गरिरहेको छ,' उनले भने। कांग्रेस संसदको समय दुरुपयोगको काममा मात्रै तल्लीन भएको पौडेलको भनाइ छ। उनले कम्युनिष्ट फुटाएर राज गर्न खोज्ने कांग्रेसको पालो अब सकिएको बताए। कम्युनिष्ट शक्तिबीच समीकरण बन्दा जनतामा आशा पलाएको उनले बताए। उनले वर्तमान सरकार टिकाउन नदिन विभिन्न षड्यन्त्र भइरहेको बताउँदै एमालेले वर्तमान सरकारलाई २०८४ को निर्वाचनसम्म लैजाने बताए। एमाले बलियो नभएमा देश कमजोर हुन्छ, उपाध्यक्ष पौडेलले भने, देशको विकास, समृद्धि र नागरिकको भविष्य राम्रो बनाउनका लागि एमाले शक्तिशाली हुनुपर्छ। त्यसका लागि सबै नेताकार्यकर्ता एक जुट भएर लाग्नुपर्छ।"
"समाजवादी मोर्चाका दलबीच एकताको विकल्प छैन, एक ठाउँमा हुन्छौँ : प्रचण्ड","प्रधानमन्त्री प्रचण्डले आगामी नीति तथा कार्यक्रम एवं बजेट उत्पादनमुखी एवं रोजगारी सिर्जना गर्नेगरी ल्याइने स्पष्ट पारे। विराटनगर : प्रधानमन्त्री पुष्पकमल दाहाल प्रचण्डले समाजवादी मोर्चामा सहभागी साथीहरू चाँडै एकताबद्ध हुने बताएका छन्। उनले माओवादी केन्द्रको प्रदेश केन्द्रीय सदस्य र प्रदेश पदाधिकारीको संयुक्त बैठकलाई आज सम्बोधन गर्दै उनले माओवादी आन्दोलनका सहभागीहरू सबै एकताबद्ध हुन आह्वान गरेका हुन्। प्रचण्डले आगामी दिनमा माओवादी आन्दोलनका सहभागीहरू एकताबद्ध हुने विश्वास व्यक्त गरे। उनले भने,माओवादी आन्दोलनका सहभागीहरू सबै एकताबद्ध हुनुपर्छ। समाजवादी मोर्चामा सहभागी साथीहरू चाँडै एकताबद्ध हुनुपर्छ भन्नेमा हुनुहुन्छ। बाँकी साथीहरू पनि एकताको विकल्प छैन भन्नेमा पुग्नु भएको छ। हामी सबै एक ठाउँमा हुन्छौँ, हुनेछौँ। उनले आगामी आर्थिक वर्षको नीति तथा कार्यक्रम एवं बजेटमा पूर्वलाई प्राथमिकतामा राखिने बताए। सरकारले जनताका पक्षमा महत्त्वपूर्ण पहल लिएको उनको भनाई छ। प्रधानमन्त्री प्रचण्डले आगामी नीति तथा कार्यक्रम एवं बजेट उत्पादनमुखी एवं रोजगारी सिर्जना गर्नेगरी ल्याइने स्पष्ट पारे। उनले सङ्घीय निजामति ऐन पारित गर्ने चरणमा रहेको र सङ्घीय प्रहरी ऐन बनेको एवं प्रदेश प्रहरी ऐन कार्यान्वयनको चरणमा रहेको जानकारी दिए। प्रचण्डले सुशासन र सामाजिक न्यायका सन्दर्भमा सरकारले गरेका सकारात्मक काम जनतासमक्ष पुर्याउनुपर्नेमा जोड दिए।"
सर्वोच्च अदालतको आदेशविपरीत गण्डकीका मुख्यमन्त्रीले थपे दुई मन्त्रालय,"काठमाडौं : गण्डकी प्रदेशका मुख्यमन्त्री खगराज अधिकारीले दुई मन्त्रालय थप गर्ने निर्णय गरेका छन्। उनले सामाजिक विकास तथा स्वास्थ्य मन्त्रालयबाट स्वास्थ्य मन्त्रालय र मुख्यमन्त्री कार्यालयबाट आन्तरिक मन्त्रालय छुट्टै बनाउने निर्णय गरेका हुन्। गठबन्धन दललाई भाग पुर्याउन मुख्यमन्त्री अधिकारी मन्त्रालय थप गरेका हुन्। यसअघि ७ मन्त्रालय रहेको गण्डकीमा अब ९ मन्त्रालय हुनेछन्। सर्वोच्च अदालतले बुधबारमात्र दीर्घकालीन असर पर्ने निर्णय नगर्न मुख्यमन्त्री अधिकारीका नाममा अन्तरिम आदेश जारी गरेको थियो। निवर्तमान मुख्यमन्त्री सुरेन्द्रराज पाण्डेले दायर गरेको रिटमा न्यायाधीश विनोद शर्माको एकल इजलासले सभामुख कृष्णप्रसाद धितालको समेत गणना गरेको र संवैधानिक व्याख्याको प्रश्न, संसदीय अभ्यास, यस अदालतबाट स्थापित सिद्धान्तलगायत विषयमा निरुपण हुन आवश्यक देखिएको भन्दै त्यस्तो आदेश दिएको थियो। नियुक्तिविरुद्ध अन्तरिम आदेश दिँदा सरकार शून्यताको अवस्था सृजना हुने भन्दै पूर्ण सुनुवाइका लागि वैशाख १० गतेलाई पेशी तोकिएको छ।"
माथिल्लो अरुण र दूधकोशीको काम छिटो थाल्ने सहमति,"काठमाडौं : सरकार र दुई ठूला जलविद्युत आयोजना माथिल्लो अरुण र दूधकोशीका प्रमुख वित्तीय व्यवस्थापक विश्व बैंक र एसियाली विकास बैंकबीच आयोजना निर्माणको काम छिटो थाल्ने सहमति भएको छ। अर्थमन्त्री वर्षमान पुन, ऊर्जामन्त्री शक्तिबहादुर बस्नेत, अर्थ मन्त्रालयका सचिव (राजश्व) डा रामप्रसाद घिमिरे, ऊर्जासचिव सुशीलचन्द्र तिवारी, नेपाल विद्युत प्राधिकरणका कार्यकारी निर्देशक कुलमान घिसिङ, विश्व बैंकका नेपाल, माल्दिभ्स र श्रीलंका हेर्ने निर्देशक फारिस हजाद जर्भोस (भर्चुअल रुपमा) तथा एसियाली विकास बैंकका नेपाल निर्देशक अर्नाउड काउचियोसबीच बिहीबार अर्थ मन्त्रालयमा भएको छलफलमा दुवै आयोजनाको वित्तिय व्यवस्थापन छिटो सकेर निर्माणको काम अघि बढाउने सहमति भएको हो। छलफलमा आयोजनाको वित्तीय व्यवस्थापन र आयोजना कार्यान्वयनको क्षमता अभिवृद्धबारे विस्तृतमा छलफल भएको थियो। छलफलमा दुवै आयोजनाको पूर्वतयारीका लागि सम्पन्न गरिएका कामबारे प्रस्तुति गरिएको थियो। संखुवासभाको भोटखोला गाउँपालिकामा निर्माण हुने १ हजार ६३ मेगावाटको अर्धजलासययुक्त माथिल्लो अरुणको विश्व बैंक र खोटाङ, ओखलढुङ्गा र सोलुखुम्बूको सिमानामा पर्ने दूधकोशी नदीस्थित रभुँवाघाटबाट निर्माण हुने ६ सय ३५ मेगावाटको जलासययुक्त दूधकोशी जलविद्युत आयोजनाको एसियाली विकास बैंक नेतृत्वको सहवित्तीयकरणमा अन्तर्राष्ट्रिय वित्तीय संस्थाको सहुलियतपूर्ण ऋण र स्वदेशी बैंक तथा वित्तीय संस्थाबाट गरी ७० प्रतिशत ऋण लगानी जुटाउनुका साथै ३० प्रतिशत स्वपुँजी (इक्विटी) बाट वित्तीय व्यवस्थापन गर्ने तयारी छ। बैठकमा आयोजनास्थलमा जारी निर्माण पूर्वका तयारी कार्यबारे अवगत गराइएको थियो। आयोजना प्रवर्द्धक नेपाल विद्युत प्राधिकरणको सहायक कम्पनी माथिल्लो अरुण हाइड्रोइलेक्ट्रिक लिमिटेडले आगामी सन् २०२६ को सुरुबाटै आयोजना निर्माण थालिने बताएको छ। आयोजना निर्माणका लागि अनुमानित पाँच वर्षको समयसीमा तोकिएको छ। माथिल्लो अरुणको पूर्वतयारीस्वरुप २ किलोमिटर सुरुङ मार्ग र २१ किलोमिटर पहुँच मार्ग निर्माणको काम अघि बढेको छ। जग्गा प्राप्ति र मुआब्जा वितरण करिब सकिएको छ। विद्युतको उच्च माग हुने हिउँदको ६ महिना दैनिक ६ घण्टा पूर्ण क्षमतामा सञ्चालन गरिने माथिल्लो अरुण नेपालकै गेमचेन्जर आयोजना हो। सो आयोजनाबाट वार्षिक चार अर्ब ५३ करोड युनिट ऊर्जा उत्पादन हुनेछ। उत्पादित विद्युत ६ किलोमिटर ४ सय केभीको प्रसारण लाइनमार्फत् संखुवासभाको हाइटारमा नयाँ बन्ने सबस्टेसनमार्फत् राष्ट्रिय प्रसारण प्रणालीमा जोडिनेछ। रभुँवाघाटमा निर्माण हुने ६ सय ३५ मेगावाटको दूधकोशी जलविद्युत आयोजनालाई सरकारले राष्ट्रिय गौरवको आयोजनामा सामावेश गरेको छ। आयोजनाको सम्भाव्यता अध्ययन, विस्तृत इञ्जिनियरिङ डिजाइन, वातवारणीय प्रभाव अध्ययन मूल्याङ्कनलायतका काम यसअघि नै सकिएका छन्। पहुँच मार्ग निर्माण र मुआब्जा वितरणको काम अन्तिम चरणमा छ। दुवै आयोजनाको अनुमानित लागतबारे प्राविधिक तहमा छलफल गर्ने बताइएको छ। क्षेत्रीय बजारमा नेपालले उपस्थिति जनाइसक्योः अर्थमन्त्री अर्थमन्त्री पुनले माथिल्लो अरुण र दूधकोशीजस्ता ठूला आयोजनाको निर्माणपछि नेपालको ऊर्जा क्षेत्रमा नयाँ अध्याय थपिने बताए। उनल आयोजना निर्माणको काममा ढिलाई गर्न नहुनेमा सरकार स्पष्ट रहेको उल्लेख गर्दै त्यसका लागि सहजीकरण गर्न तयार रहेको बताए। उनले दुवै आयोजनाको तयारी राम्रोसँग भइरहेको भन्दै प्रमुख वित्तय व्यवस्थापक विश्व बैंक र एसियाली विकास बैंकले सहवित्तकर्ताहरूसँग समन्वय गरिरहेको जानकारी पाउँदा खुसी लागेको उल्लेख ग । मन्त्री पुनले दुई ठूला आयोजनाको निर्माणपछि नेपालको अरु ठूला आयोजना निर्माणका लागि क्षमता वृद्धि हुने विश्वास व्यक्त गरे। प्रधानमन्त्री पुष्पकमल दाहाल प्रचण्डको भारत भ्रमणका क्रममा १० हजार मेगावाट विद्युत निर्यातसम्बन्धी सम्झौता गरेको तथा बंगलादेशलाई ४० मेगावाट विद्युत दिन लागिएको भन्दै आन्तरिक मात्र नभई क्षेत्रीय बजारमा समेत नेपालको विद्युतको माग रहेको उल्लेख गरे।"
उद्योगीव्यापारीलाई प्रहरी प्रशासनले दुःख दिए कारबाही गर्छौं : गृहमन्त्री लामिछाने,"वीरगन्ज : उपप्रधान तथा गृहमन्त्री रवि लामिछानेले राजश्व चुहावट पूर्णरूपमा नियन्त्रण गरी मुलुकको राजश्व संकलनमा वृद्धि गर्नका लागि अहिलेको सरकार लागि परेको बताएका छन्। वीरगन्जमा बिहीबार गृहमन्त्रालय र अर्थमन्त्रालयद्वारा आयोजित राजश्व अभिवृद्धि तथा चुहावट निन्त्रणसम्बन्धी गोष्ठीमा बोल्दै उपप्रधानमन्त्री लामिछानेले यस्तो बताएका हुन्। राजश्व चुहावट पूर्णरूपमा नियन्त्रणका लागि राजश्व संकलनमा देखिएका चुनौतीहरूको सामना गर्न सरकार तयार रहेको पनि उनले बताए। राजश्व चुहावट पूर्णरूपमा नियन्त्रणका लागि सरकारसँगै प्रहरी प्रशासन र निजी क्षेत्रका पनि उत्तिक्कै भूमिका रहेको उनले बताए। पछिल्लो समय मुलुकको उद्योग व्यवसायको क्षेत्र पनि अति राजनीतिको सिकार भएको भन्दै उनले राज्यलाई कर तिरेर व्यापार व्यवसाय गर्छु भन्नेहरूसमेत त्रसित बनेर बस्न परिरहेको बताए। उनले भने, 'यसका अतिरिक्त उद्योगी व्यापारी चर्को ब्याजले अप्ठयोरमा छन्। कर तिर्ने प्रणाली पनि झन्झटिलो छ। यी सब कारणले उद्योगी व्यापारीहरू पेसाबाटै पलायन हुने अवस्थामा पनि पुगेका छन्। यही चुनौती र समस्या समाधानका लागि अब त कसै न कसैले हिम्मत गर्नै पर्छ भन्ने उदेश्यले पछिल्लो सत्ता समीकरण र सरकार गठन भएको लामिछानेले बताए। उनले भने, ती सबै समस्या समाधान गर्न सकन्छि भनेर नै नयाँ सत्ता समीकरण र सरकार बनेको हो। यो सरकारले ती सब काम गर्छ पनि। राजश्य चुहावट रोकेर राजश्व संकलन वृद्धिका लागि यदि राज्यको नीति र कानुन अव्यवहारिक वा गलत छन् भने त्यसलाई संशोधन गरेर सरकार अगाडि बढ्ने उपप्रधानमन्त्री लामिछानेले बताए। यसका साथै सुरक्षा निकायले पनि वैध व्यापार व्यवसाय गर्नेहरूका लागि सहज वातावरण बनाउनुपर्ने उनले बताए। गृहमन्त्री लामिछानेले भने, गृह प्रशासन के कुरामा स्पष्ट छ भने गलत क्रियाकलाप नगरिकन राज्यलाई कर तिरेर वैध व्यापार व्यवसाय गरिरहेका हरेक व्यापारी व्ययसायीको पक्षमा प्रहरी प्रशासन छ। जसले कर छलिरहेको छैन। वैध व्यापार गरिरहेको छ। तस्करी गरिरहेको छैन। राज्यलाई तिर्नुपर्ने कर तिरिरहेको छ। त्यस्ता व्यापारी व्यवसायीहरू कसैबाट पनि डराउनुपर्ने अवस्था अब रहँदैन। उनीहरूलाई संरक्षण गर्न प्रहरी प्रशासन तयार छ। वैध व्यापार व्यवसाय गरिरहेका उद्योगी वा व्यापारीलाई दुःख दिने काम प्रहरी प्रशासनबाट भएको पाइए कारबाही गर्ने चेतावनी पनि उनले दिए।"
देशमा राजनीतिक विकृति बढ्यो : राजेन्द्र लिङ्देन,"काठमाडौं : राप्रपा अध्यक्ष राजेन्द्र लिङ्देनले मुलुकमा राजनीतिक विकृत बढेको बताएका छन्। बिहीबार काठमाडौंमा आयोजित कार्यक्रममा उनले राजनीतिलाई व्यवसाय बनाउने र पैसा कमाउने माध्यमको रूपमा बुझ्दा विकृतजस्तो भएको प्रस्ट्याए। उनले राजनीति भन्ने बित्तिकै ओढ्ने ओछ्याउने व्यवसाय, छोराछोरी पाल्ने पेसाजस्तो मानिराखेको र राजनीति गर्ने मान्छेसँग डराउने अवस्था आएको बताए। राजनीतिक लेखपढले मात्रै नहुने उनको भनाइ छ। राजनीतिलाई पेसा नभई सेवाको रूपमा अवलम्वन गर्ने अग्रजहरूप्रति सम्मान रहेको उनले बताए।"
