शीर्षक,विवरण
बैंकबाट पौने ३ करोड निकाल्ने एनआईसी एसियाका प्रबन्धक र नक्कली ऋणी थुनामा,"राजविराज : एनआईसी एसिया बैंक शाखा राजविराजमा भएको पौने ३ करोड रुपैयाँको स्क्याम प्रकरणका आरोपित बैंकका तत्कालीन प्रबन्धक सन्तोषकुमार यादवसहित तीन जना पुर्पक्षका लागि सोमबार थुनामा पुगेका हुन्। सप्तरी जिल्ला अदालतका न्यायाधीश नविनकुमार जोशीको इजलाशले राजविराज नगरपालिका७ का सन्तोष, राजविराज नगरपालिका९ का मो सदाम, सप्तरीको रुपनी गाउँपालिका५ का दिपेन भनिने दीपककुमार सुतिहारलाई पुर्पक्षका लागि राजविराज कारागारमा पठाएको हो। सरकारी लिखत किर्ते गरी संगठित रूपमा ठगी गरेको आरोपमा मङसिर १० गते सन्तोष हाजिर भएपछि मङसिर २० गते सदाम र दिपक पनि अदालतसमक्ष हाजिर भएका थिए। अदालतबाट पक्राउ पुर्जी जारी भएपछि बैंकबाट निलम्बित यादव फरार थिए। सदाम भने अनुसन्धानका लागि गत असार १९ गते पक्राउ परेर छुटेका थिए। स्क्याम प्रकरणपछि गत वैशाखको दोस्रो साता प्रबन्धक यादव, ऋण अधिकृतसहितका १० जना विरुद्ध सरकारी कागजात, छाप र हस्ताक्षर किर्ते मुद्दामा पक्राउ पुर्जी जारी भएको थियो। जिल्ला प्रशासन कार्यालय सप्तरीले पत्राचार गरेपछि जिल्ला प्रहरी कार्यालय सप्तरी प्रहरी नायव उपरीक्षक नरेश कुमार सिंह प्रतिवेदक भई कारबाहीका लागि उजुरी दिएका थिए। गत माघ २२ गते बैंकमा सरकारी कागजात किर्ते गरी बनाइएको फर्जी जग्गाधनीलाई स्वीकृत गरिएको दुई करोड ८० लाख रुपैयाँमध्ये दुई करोड ३० लाख रुपैयाँ ऋण प्रवाह गरेको स्क्याम को खुलासा माघ २३ गते भएको थियो। बैंकका प्रबन्धक यादवसहित बैंकका केही कर्मचारी, व्यवसायी, लेखापढी व्यवसायी र भूमिसुधार तथा मालपोत कार्यालय राजविराजका कम्प्युटर अपरेटरहरूको मिलामतोमा राजविराज नगरपालिका८ का रविन्द्रकुमार यादवको नाममा रहेको प्रसवनी९ (ग) को कित्ता नम्बर २२१ को १० कठ्ठा ५ धुर जग्गाको कीर्ते जग्गा धनी प्रमाणपत्र बनाई राजविराज नगरपालिका९ (तत्कालीन मलेठ गाविस७) की वसिरन खातुनलाई फर्जी जग्गा धनी बनाइएको आरोप लागेको छ। एनआईसी एसिया बैंकमा सरकारी कागजात किर्ते गरी बनाइएको नक्कली जग्गाधनीको ऋण माँगलाई बैंकले स्वीकृत गरेको थियो। नक्कली जग्गाधनी खडा गरी लिएको ऋणकर्जा २ करोड ८० लाख रुपैयाँमध्ये २ करोड ३० लाख रुपैयाँ ऋण प्रवाह समेत भएको थियो। वास्तविक जग्गाधनीले थाहा पाई घटना बाहिरिएलगत्तै बैंकका प्रबन्धक यादवसहित बैंकका केही कर्मचारी र व्यवसायीहरू तत्काल फरार भएका थिए। जग्गाधनी रबिन्द्रकुमार यादवका अनुसार आरोपितहरूले लेखापढी व्यवसायी र भूमिसुधार तथा मालपोत कार्यालय राजविराजका कम्प्युटर अपरेटरसँग मिलेमतो गरेर नक्कली जग्गाधनी खडा गरी बैंकबाट ऋणकर्जा निकालेका थिए। राजविराज नगरपालिका८ बस्ने यादवका नाममा रहेको साविक प्रसवनी गाविस९ (ग) को कित्ता नम्बर २२१ को १० कठ्ठा ५ धुर जग्गाको नक्कली जग्गा धनी प्रमाणपत्र बनाएका थिए। आरोपितहरूले साविक मलेठ गाविस ७ हाल राजविराज नगरपालिका९ की वसिरन खातुनलाई नक्कली जग्गा धनी बनाएका थिए। किर्ते गरी बनाएको सोही नक्कली जग्गा धनी प्रमाणपत्रको आधारमा बैंकले रोक्का नम्बर १५१२०९८० एनएल ०००२२९० मा नक्कली जग्गा रोक्का गरेको थियो। राजविराजस्थित घरेलु तथा साना उद्योग कार्यालयमा खातुनकै बुहारी आसमा खातुनको नाममा दर्ता रहेको एएस ट्रेडर्स एण्ड सप्लायर्सलाई बैंकले गत माघ ९ गते सो ऋण प्रवाह गरेको थियो। पक्राउ परेका मोबाइल व्यवसायी सदाम नक्कली जग्गाधनी बसिरन खातुनका छोरा तथा ऋणी आसमाका श्रीमान् हुन्। आसमाले ऋण लिएको बेला श्रीमान् सदामकै मोबाइल पसल मूल्यांकन गराएकी थिइन्। स्क्याम प्रकरण बाहिरिएसँगै गत माघ २९ गते जिल्ला प्रशासन कार्यालयको निर्देशनपछि भूमिसुधार तथा मालपोत कार्यालय राजविराजले सरकारी कागजात, छाप र हस्ताक्षर किर्ते भएको विषयमा आवश्यक कारबाहीका लागि जिल्ला प्रहरी कार्यालयमा पत्राचार गरेको थियो। सप्तरीको अग्निसाइर कृष्णासवरन गाउँपालिका वडा नम्बर ४ को कार्यालयले पनि फागुन ११ गते आवश्यक कारबाहीका लागि प्रहरीलाई पत्राचार गरेको थियो। स्क्यामका अन्य आरोपित राजविराज नगरपालिका९ का बसिरन खातुन, उनका बुहारी आसमा खातुन, विवेक देव, राजविराज नगरपालिका२ का मो समसाद, राजविराज नगरपालिका७ का दिपेन्द्र यादव, सप्तरीको विष्णुपुर गाउँपालिका१ का शंकरप्रसाद यादव र सप्तरीको राजगढ गाउँपालिका१ का रमेशकुमार यादव रहेका छन्।"
एकैपटक धेरै विद्यार्थी दीक्षित गराउनेमा त्रिविले बनायो विश्व कीर्तिमान,"काठमाडौं : त्रिभुवन विश्वविद्यालयले एकैपटक धेरै विद्यार्थी दीक्षित गराउनेमा विश्व कीर्तमान बनाएको छ। दशरथ रंगशालामा सोमबार त्रिविले ४९औं दीक्षान्त समारोह आयोजना गरेको थियो। जसमा २६ हजार बढी विद्यार्थीलाई दीक्षित गराएकोमा विश्व कीर्तमान कायम गरिएको अफिसियल वर्ल्ड रेकर्डले जनाएको छ। उसले प्रदान गरेको प्रमाणपत्रमा २६ हजार बढीको भौतिक उपस्थितिमा दीक्षमान्त समारोह आयोजना गरेको र इतिहासमै यो धेरै भएको उल्लेख छ। त्रिविले विभिन्न संकाय र तहमा उपाधिप्राप्त १२ हजार चार सय १५ विद्यार्थी दीक्षित भएको जनाएको छ। त्रिविको ६१औं ग्रेसलिष्टमा परेका ७४ हजार सात सय ४९ विद्यार्थीमध्ये यसपटक १२ हजार चार सय १५ जनाले दीक्षान्त समारोहमा सहभागिताका लागि आवेदन दिएका थिए। निवेदन दिएकामध्ये स्नातक तहतर्फ आठ हजार ९८ जना, स्नातकोत्तर तहतर्फ चार हजार एक सय चार, एमफिलतर्फ ४४ तथा विद्यावारिधितर्फ एक सय १२ विद्यार्थी दीक्षित भएका हुन्। गत वर्ष १० हजार तीन सय विद्यार्थी दीक्षान्त समारोहमा सहभागी भएका थिए।"
"मलेसियामा साथीको हत्या, फरार रहेका व्यक्ति नेपालमा पक्राउ","काठमाडौं : मलेसियामा साथीको हत्या गरेर फरार रहेका एक नेपाली युवक पक्राउ परेका छन् । साथीको हत्या गरी पक्राउ पर्नेमा महोत्तरीको गौशालाका अनिलकुमार साह रहेको केन्द्रीय प्रहरी प्रवक्ता तथा प्रहरी नायब महानिरीक्षक कुवेर कडायतले जानकारी दिए । उनले भने, साहले गएको मङ्सिर २५ गते झापाका धनबहादुर प्रधानको हत्या गरेका र हत्यापछि भागेर नेपाल आएको, प्रधानको शव नेपाल ल्याइएपछि हत्या गरेको भन्ने उजुरी परेपछि निजलाई पक्राउ गरिएको हो । मुलुकी अपराध संहितामा रहेको बहुक्षेत्रीय अधिकारसम्बन्धी प्रावधानअनुसार पक्राउ परेका साहविरुद्ध नेपालमै कर्तव्य ज्यान मुद्दामा अनुसन्धान र अभियोजन हुने प्रवक्ता तथा प्रहरी नायब महानिरीक्षक कडायतले जानकारी दिए।  रासस"
मलेसियामा साथीको हत्या गरी फरार रहेका व्यक्ति पक्राउ,काठमाडौं : मलेसियामा साथीको हत्या गरेर फरार रहेका एक नेपाली युवक पक्राउ परेका छन् । पक्राउ पर्नेमा महोत्तरीको गौशालाका अनिलकुमार साह रहेको नेपाल प्रहरीका केन्द्रीय प्रहरी प्रवक्ता तथा प्रहरी नायब महानिरीक्षक कुवेर कडायतले जानकारी दिए । साहले मङ्सिर २५ गते झापाका धनबहादुर प्रधानको हत्या गरी नेपाल आउन लागेको उजुरी परेपछि उनलाई पक्राउ गरेको प्रहरी नायब महानिरीक्षक कडायतले बताए। उनीविरुद्ध ज्यानसम्बन्धी कसुर मुद्दामा जिल्ला अदालत काठमाडौंबाट पाँच दिनको म्याद लिइ इन्टरपोलमार्फत् मलेसियन प्रहरी र मलेसियास्थित नेपाली राजदूतावासँग समन्वय गरी थप अनुसन्धान भइरहेको प्रहरीले जनाएको छ।
राष्ट्रिय एस्ट्रोनोमी ओलम्पियाड : २०२४ को आवेदन खुल्यो,"काठमाडौं : सन् २०२४ मा सञ्चालन गरिने एघारौं राष्ट्रिय एस्ट्रोनोमी ओलम्पियाडको आवेदन आजदेखि खुला गरिएको नेपाल एष्ट्रोनोमिकल सोसाइटीले जनाएको छ । विद्यालय तहका विद्यार्थीको प्रतिभा पहिचान तथा प्रवद्र्धनका लागि सन् २०१४ देखि सञ्चालित कार्यक्रममा यस वर्ष कक्षा ८ देखि १२ मा अध्ययनरत १३ वर्षदेखि २० वर्ष उमेर समूहका विद्यार्थीले आवेदन दिनसक्ने सोसाइटीका अध्यक्ष सुरेश भट्टराईले राससलाई जानकारी दिए। विद्यार्थीको तहगत सिकाइलाई ध्यान दिँदै राष्ट्रिय एस्ट्रोनोमी ओलम्पियाड सन् २०१९ देखि जुनियर र सिनियर गरी दुई विधामा आयोजना गरिँदै आएको उनले बताए । विद्यालय तहका विद्यार्थीलाई खगोल विज्ञानमा रुचि जगाउने उद्देश्यले सोसाइटीले यो प्रतियोगितलाई निरन्तरता दिँदै आएको छ । यसअन्तर्गत कक्षा ८ देखि १० सम्मका विद्यार्थीले जुनियरमा र कक्षा ११ देखि १२ का विद्यार्थीले सिनियरमा आवेदन दिनसक्ने सोसाइटीले जनाएको छ । ओलम्पियाडको पहिलो चरणको छनोट परीक्षा प्रादेशिकरुपमा आयोजना गरिनेछ । आगामी माघ १३ गते शनिबार दिउँसो १२ बजेदेखि २ बजेसम्म इटहरी, जनकपुर, काठमाडौँ, पोखरा, बुटवल, सुर्खेत तथा धनगढीमा आयोजना गरिने भएको छ । इच्छुक विद्यार्थीले पायकपर्ने सम्बन्धित प्रदेशका संयोजकलाई आवेदन फाराम बुझाउनसक्ने सोसाइटीका अध्यक्ष भट्टराईले बताए। पहिलो अर्थात् प्रदेश चरणमा गरेको प्रदर्शनका आधारमा दोस्रो अर्थात् राष्ट्रिय चरणमा सम्बन्धित प्रदेशका विद्यार्थीलाई सामेल गराइने भएको छ । दोस्रो चरणमा उत्कृष्ट प्रदर्शन गर्ने विद्यार्थीलाई तेस्रो तथा अन्तिम चरणमा सहभागी गराइनेछ । तेस्रो चरणको मूल्याङ्कनमार्फत सहभागी विद्यार्थीलाई सन् २०२४ मा सञ्चालन हुने अन्तर्राष्ट्रिय एस्ट्रोनोमी तथा एस्ट्रोफिजिक्स ओलम्पियाडका लागि सिफारिस गरिनेछ ।"
पाँच लाख घूससहित वडाध्यक्ष पक्राउ,बारा : जितपुर सिमरा उपमहानगर३ का वडाध्यक्ष तारा कार्कीलाई अख्तियार दुरुपयोग अनुसन्धान आयोग हेटौंडाको टोलीले पक्राउ गरेको छ। कार्की पाँच लाख रुपैयाँ घूससहित आज पक्राउ परेका हुन् । वडाध्यक्ष कार्कीलाई जितपुरस्थित जैसवाल होटलबाट पक्राउ गरिएको प्रहरीले जनाएको छ। सडक बनाउने क्रममा उनले स्थानीय राजन उप्रेतीसँग घूसबापत पाँच लाख नगद रकम लिएको इलाका प्रहरी कार्यालय सिमराका प्रमुख प्रदीप क्षेत्रीले बताए। घटनाबारे अनुसन्धान भइरहेको अख्तियार स्रोतले जनाएको छ। पक्राउ परेका वडाअध्यक्ष कार्की नेकपा (एमाले) पार्टीबाट निर्वाचित भएका थिए।
१२ हजार बढी विद्यार्थी दीक्षित बन्दा (फोटो फिचर),"काठमाडौं : त्रिभुवन विश्वविद्यालयको ४९औं दीक्षान्त समारोहमा विभिन्न संकाय र तहमा उपाधिप्राप्त १२ हजार चार सय १५ विद्यार्थी दीक्षित भएका छन्। त्रिपुरेश्वरस्थित दशरथ रंगशालामा भएको समारोहमा राष्ट्रपति रामचन्द्र पौडेलको उपस्थितिमा प्रधानमन्त्री एवं कुलपति पुष्पकमल दाहालबाट विद्यार्थीहरू दीक्षित भएका हुन्। त्रिविको ६१औं ग्रेसलिष्टमा परेका ७४ हजार सात सय ४९ विद्यार्थीमध्ये यसपटक १२ हजार चार सय १५ जनाले दीक्षान्त समारोहमा सहभागिताका लागि आवेदन दिएका थिए। निवेदन दिएकामध्ये स्नातक तहतर्फ आठ हजार ९८ जना, स्नातकोत्तर तहतर्फ चार हजार एक सय चार, एमफिलतर्फ ४४ तथा विद्यावारिधितर्फ एक सय १२ विद्यार्थी दीक्षित भएका हुन्। विश्वविद्यालयका कार्यवाहक उपकुलपति प्राडा शिवलाल भुसालले विसं २०७९ असार १ देखि २०८० जेठ मसान्तसम्म उत्तीर्ण गरेका विद्यार्थी दीक्षान्त समारोहमा सहभागी हुन पाउने व्यवस्था गरिएको जानकारी दिए। गत वर्ष १० हजार तीन सय विद्यार्थी दीक्षान्त समारोहमा सहभागी भएका थिए। उनले उत्तीर्ण विद्यार्थीलाई स्वदेशमै रोजगारीसहित टिकाउने चुनौती देखिएको स्थितिमा विश्वविद्यालयले शिक्षासँगै उद्यमशीलता अपनाउने प्रतिबद्धता व्यक्त गरे।"
