शीर्षक,विवरण
"प्रधानमन्त्रीले भने भागबण्डा गर्नुहुँदैन भन्छौं, तर हामी आफैं विश्वविद्यालयमा भागबण्डा गरिरहेका छौं","काठमाडौं : प्रधानमन्त्री पुष्पकमल दाहाल 'प्रचण्ड'ले विश्वविद्यालयहरू स्वायत्त प्राज्ञिक निकाय हुनुपर्ने बताएका छन्। त्रिभुवन विश्वविद्यालयको ४९औं दीक्षान्त समारोहमा सम्बोधन गर्दै प्रधानमन्त्री दाहालले विश्व विद्यालय राजनीतिक भागबण्डा र दाउपेचबाट अलग हुन नसकेको भन्दै यसको गम्भीर छलफल र समीक्षा हुन आवश्यक रहेको बताए। प्रधानमन्त्री दाहालले विश्व विद्यालयहरुमा राजनीतिक भागबण्डा गर्नुहुँदैन भन्ने राजनीतिक दलहरू नै भागबण्डा खोज्दै हिँड्नु बिडम्बना भएको बताए। 'हामी एकातर्फ हामी विश्वविद्यालयहरूमा राजनीतिक भागबण्डा हुनुहुँदैन,विश्वविद्यालयहरू स्वायत्त प्राज्ञिक निकायहरू हुनुपर्दछ भनिरहेका छौँ, अर्कोतर्फ हामी आफै राजनीतिक भागबण्डा र दाउपेचका निम्ति दौडिरहेका हुन्छौँ ,'प्रधानमन्त्री दाहालले भने,' यस्ता चुनौती र प्रश्नहरूबारे पनि हामीले गम्भीरतापूर्वक छलफल गर्ने र निर्णय लिने बेला आएको छ ।' प्रधानमन्त्री दाहालले विश्वविद्यालयहरूको वर्तमान अवस्थामा रूपान्तरण गर्न सरकार र राजनीतिक नेतृत्वको पनि महत्त्वपूर्ण भूमिका रहेको बताए। प्राज्ञिक संस्थाहरूलाई आवश्यक साधनस्रोत र पर्याप्त प्राज्ञिक जनशक्तिको व्यवस्थामा राज्यले पनि आफ्नो भूमिका बढाउनुपर्नेमा जोड दिए। दीक्षित विद्यार्थीहरूलाई बधाइ दिँदै प्रधानमन्त्री दाहालले आफूलाई सचेत र इमान्दार नागरिकका रूपमा स्थापित गर्दै आफ्नो राष्ट्रप्रतिको कर्तव्यलाई जिम्मेवारीका साथ निभाउन आग्रह समेत गरे। उनले मुलुकको समृद्धिमा प्राविधिक जनशक्तिको महत्त्वपूर्ण योगदान हुने बताए। त्रिभुवन विश्वविद्यालयले प्राविधिक शिक्षालाई जोड दिँदै उच्चस्तरीय जनशक्ति उत्पादन गरी देश विकासमा अग्रणी भूमिका खेलेको र आगामी दिनमा पनि प्राविधिक शिक्षाको भूमिका बढाउँदै लैजानेमा विश्वास व्यक्त गरे। प्रधानमन्त्री दाहालले गुणस्तरीय शिक्षा आजको आवश्यकता रहेको बताए।"
विप्लवविरुद्ध जारी भएको पक्राउ पूर्जी आदेशविरुद्ध समाजवादी मोर्चाको आपत्ति,"काठमाडौं : नेपाल कम्युनिस्ट पार्टीका महासचिव नेत्रविक्रम चन्द 'विप्लव' र सोही पार्टीका प्रवक्ता खड्गबहादुर विश्वकर्मा 'प्रकाण्ड'लगायतविरुद्ध पक्राउ पूर्जी आदेश भएपछि नेपाल समाजवादी मोर्चाले गम्भीर आपत्ति जनाएको छ। काठमाडौं जिल्ला अदालतले जारी गरेको उक्त आदेशले द्वन्द्व सिर्जना गर्ने भन्दै समाजवादी मोर्चाले आपत्ति जनाएको हो। मोर्चाका संयोजक माधव कुमार नेपालले विज्ञप्तिमा जारी गर्दै नेपाल कम्युनिस्ट पार्टीसँग सरकारले गरेको तीन बुँदे सम्झौता कार्यान्वयन गर्न माग गरे। 'केही दिनअघि नेपाल कम्युनिष्ट पार्टीका महासचिव कमरेड विप्लव र प्रवक्ता कमरेड प्रकाण्ड सीलगायतका नेताविरुद्ध काठमाडौं जिल्ला अदालतले जारी गरेको आदेशप्रति समाजवादी मोर्चा नेपालको गम्भीर ध्यानाकर्षित भएको छ। मुलुकको वर्तमान राजनीतिक परिस्थितिमा यस प्रकारको कुनै पनि द्वन्द्व पैदा हुने स्थिति आउन नदिनका लागि नेपाल सरकार र नेपाल कम्युनिष्ट पार्टीबीच भएको तीन बुदे सम्झौतालाई पूर्णरूपमा कार्यान्वयन गर्न हामी नेपाल सरकार र सम्बद्ध पक्षलाई आह्वान गर्दछौं,' विज्ञप्तिमा भनिएको छ।"
फोहोर व्यवस्थापनको महानगरको प्रयासमा सरकारको साथ र सहयोग छ : प्रधानमन्त्री,"काठमाडौं : प्रधानमन्त्री पुष्पकमल दाहाल प्रचण्डले काठमाडौं उपत्यकाको फोहोर व्यवस्थापनको काठमाडौं महानगरपालिकाको प्रयासमा संघीय सररकाको सधैं साथ र सहयोग रहने बताएका छन्। ललितपुर महानगरपालिकाको १०५औ स्थापना दिवसको अवसरमा आयोजित कार्यक्रममा बोल्दै प्रधानमन्त्री दाहालले उपत्यकाको फोहोर व्यवस्थापनका सन्दर्भमा आफूले निकै गम्भीरतापूर्वक छलफल गरिरहेको बताए। प्रधानमन्त्री दाहालले उपत्यकाको फोहोरको वैज्ञानिक एवं दीर्घकालीन व्यवस्थापनका निम्ति समेत पहल भइरहेको जानकारी दिए। उनले फोहोर व्यवस्थापन परम्परागत रुपमा नभइ आधुनिक प्रविधियुक्त विधिबाट दीर्घकालीन व्यवस्थापन गरिनुपर्नेमा जोड दिए। प्रधानमन्त्री दाहालले भने,' फोहोर व्यवस्थापन परम्परागत रूपमा होइन, आधुनिक प्रविधियुक्त विधिबाट दीर्घकालीन व्यवस्थापन र आम्दानीको स्रोत एवं रोजगारी सिर्जनासँग जोडेर जानुपर्दछ भन्नेमा सङ्घीय सरकार स्पष्ट छ । तसर्थ, फोहोर व्यवस्थापनको महानगरको प्रयासमा सङ्घीय सरकारको सधै साथ र सहयोग रहने जानकारी गराउँदै दीर्घकालीन र प्रतिफलमुखी व्यवस्थापनमा केन्द्रित हुन म महानगरलाई विशेष आग्रह गर्दछु ।' प्रधानमन्त्री दाहालले खानेपानी समस्याको निराकरणका लागि पनि सङ्घीय सरकार नगरवासीलाई स्वच्छ खानेपानी व्यवस्था गर्न प्रतिवद्ध रहेको औंल्याए। । त्यस्तै भौतिक एवं मानवीय विकासका अन्य पक्षमा पनि सङ्घीय सरकारको तर्फबाट आवश्यक समन्वय र सहयोग रहने विश्वास व्यक्त गरे। यसैगरी प्रधानमन्त्री दाहालले सार्वजनिक निर्माणमा देखिएका कमीकमजोरी र सम्पदाको पुनर्निर्माणमा देखिएका नीतिगत र कानुनी जटिलताका लागि आएका गुनासोहरूका उचित सम्बोधन गरिने बताए। सार्वजनिक खरिद प्रक्रियामा नीतिगत र कानुनी सुधारका लागि प्रयास भइरहेकाले यो समस्याको सम्बोधन हुने जिकिर गरे। संविधानले स्थानीय तहलाई विकास निर्माण र सेवा प्रवाहको क्षेत्रमा महत्वपूर्ण अधिकार र जिम्मेवारी प्रदान गरेको भन्दै प्रधानमन्त्री दाहालले नागरिकको नजिकको सरकार भएकाले स्थानीय तहको भूमिका जवाफदेही, पारदर्शी र नागरिकमैत्री हुनुपर्नेमा जोड दिए।"
प्रधानमन्त्री प्रचण्डको गुनासो : स्थानीय जनप्रतिनिधिले परिवर्तनको दीर्घकालीन औचित्यका बारे बोलेनन्,"उनले भने, पढे लेखेका मानिस बाहिर जाने, जमिन बाझो राख्दै हिँड्ने, भएको जागिर छाडेर जाने, विदेशमा गएर तल्लोस्तरको श्रम गर्न अफ्ठ्यारो नमान्ने, मान्छेको सोच बदलेपछि जागिर र सुविधा दिएपनि बस्दो रहेनछ।अर्कै फेसन चलेपछि। काठमाडौं : प्रधानमन्त्री पुष्पकमल दाहाल प्रचण्डले स्थानीय तहका जनप्रतिनिधिले परिवर्तनको दीर्घकालीन औचित्यका बारेमा नबोलेको आरोप लगाएका छन्। सोमबार बिहान ललितपुर महानगरको स्थापना दिवसको समारोहलाई सम्बोधन गर्दै उनले स्थानीय जनप्रतिनिधिले ऐतिहासिक महत्वलाई आत्मसाथ गर्न र परिवर्तनको दीर्घकालीन औचित्यका बारेमा किन बोल्नुहुन्न भन्दै प्रश्न गरेका हुन्। उनले परिवर्तनको ऐतिहासिक महत्त्वलाई जनतालाई निरन्तर सम्प्रेषण गर्नु आवश्यकता रहेको बताए। संघीयता भनेको संघ मात्र नभई प्रदेश र स्थानीय तह पनि भएको उनको भनाई छ। उनले स्थानीय सरकार बनेपछि र संघीय लोकतान्त्रिक गणतन्त्र बनेपछि विकास निर्माणका कामले तीव्रता र सन्तोषजनक भएको बताए। प्रधानमन्त्री प्रचण्डले नेपाल डुब्यो, नेपालमा बसेर काम छैन भनेर प्रचार गर्ने फेसन बनेको टिप्पणी गरे। उनले भने,पढे लेखेका मानिस बाहिर जाने, भएको जमिन बाझो राख्दै हिँड्ने, भएको जागिर छाडेर जाने, विदेशमा गएर तल्लोस्तरको श्रम गर्न अफ्ठ्यारो नमान्ने, मान्छेले सोच बदलेपछि जागिर र सुविधा दिएपनि नेपाल बस्दो रहेनछ, अर्कै फेसन चलेपछि। उनले देश भक्ति र राष्ट्रप्रेम जगाउनु आवश्यकता रहेको उल्लेख गरे। उनले स्थानीय र प्रदेशलाई मजबुद बनाउन संघीय शिक्षा ऐन तत्काल ल्याउने प्रतिबद्धता व्यक्त गरे।"
"मेलम्चीको पानी माग्दै प्रदर्शन, तीनकुनेको ट्राफिक व्यवस्थापन अस्तव्यस्त","काठमाडौं : काठमाडौं उपत्यका मेलम्ची खानेपानी संघर्ष समितिले मेलम्ची खानेपानी छिटो ल्याउन दवावमूलक र्याली निकालेको छ। समितिले सोमबार बिहान ११ बजेबाट कोटेश्वर चोकदेखि तीनकुनेहुँदै मिनभवनसम्म विरोध र्याली निकालेको हो। मेलम्चीमाथि बारम्बार राजनीतिक चलखेल भएको भन्दै चलखेल तुरून्त बन्द गरी पानी सञ्चालन गर्न माग गर्दै र्याली निकालिएको संघर्ष समितिका संयोजक गोविन्दराज पन्तले जानकारी दिए। प्रदर्शनकारीहरूले मेलम्चीमाथिको चलखेल बन्द गरजस्ता विविध नारा लेखिएका प्लेकार्डहरू प्रदर्शन गरेका थिए। माग पूरा नभएसम्म उपत्यकाभरि विविध दबाबमूलक कार्यक्रम गरिने समितिले जनाएको छ। समितिले र्याली निकालेपछि बिहान ११ बजेदेखि अहिलेसम्म तीनकुने क्षेत्रको ट्राफिक व्यवस्थापन अस्तव्यस्त बनेको छ। तीनकुनेसिनामंगलएयरपोर्ट चाबहिल सडकखण्डमा सवारी आवतजावत प्रभावित बनेको छ। उता कोटेश्वर,नयाँ बानेश्वरतिर पनि ट्राफिक जामले सडक अस्तव्यस्त बनेको छ।"
बुटवलमा लागूऔषधसहित युवा पक्राउ,बुटवल : बुटवलमा लागूऔषधसहित युवा पक्राउ परेका छन्। पक्राउ पर्नेमा धादिङ धुनिबेसी घरभई हाल पोखरा महानगरपालिका१७ बस्ने २६ वर्षीय सन्नी गुरुङ रहेका छन्। सोमबार दिउँसो बुटवल उपमहानगरपालिका३ स्थित गोलपार्कमा लागूऔषध कारोबार गरेको भन्ने गोप्य सूचनाका आधारमा उनलाई पक्राउ गरिएको हो। शंकास्पद अवस्थामा हिँडिरहेका उनको साथबाट विभिन्न प्रकृतिका लागूऔषधहरु बरामद गरी लागूऔषध कसुर शीर्षकमा मुद्दा दर्ता गरेर थप अनुसन्धान सुरु भएको इलाका प्रहरी कार्यालय बुटवलका प्रहरी नायव उपरीक्षक दानबहादुर थापाले जानकारी दिए।
सातौं बागलुङ महोत्सव हुने,"बागलुङ : बागलुङमा सातौं बागलुङ महोत्सव हुने भएको छ। पर्यटन, कृषि, कला संस्कृति, उद्योग र व्यापार, समुन्नत बागलुङ निर्माणको आधार भन्ने नाराका साथ बागलुङ उद्योग वाणिज्य संघले आगामी पुस ११ गतेदेखि २२ गतेसम्म महोत्सव आयोजना गर्न लागेको हो। महोत्सवलाई गण्डकी प्रदेशस्तरीय पर्यटन, कृषि तथा औद्योगिक व्यापार मेला स्तरमा विकास गर्न लागिएको संघका अध्यक्ष नरेश कँडेलले जानकारी दिए। उनले पछिल्लो समय बागलुङको व्यापार सुस्ताउँदै गएकाले बजारलाई चलायमान बनाउने उद्देश्यले महोत्सवको आयोजना गरिएको बताए। महोत्सवमा व्यावसायिक १२०, प्रवर्द्धनात्मक स्टल ३० र मेडइन बागलुङ स्टल रहने बताए। व्यवसायका लागि १२० वटा स्टल छुट्टाएका छौं। हालसम्म ५० प्रतिशत स्टल बुक भइसकेका छन्, अध्यक्ष कंडेलले भने,महोत्सवमा जिल्लाका कृषि तथा घरेलु उत्पादनहरूलाई प्रवर्द्धनात्मक गर्न ३० वटा स्टल छुट्टाइएको छ। यस्तै जिल्लामै उत्पादन भइरहेका ब्राण्डहरूलाई मेडइन बागलुङ नाममा स्टल छुट्याएर प्रवर्द्धन र बिक्री गर्ने व्यवस्था मिलाएको छौं। अंग्रेजी नयाँ वर्षका अवसरमा धेरैभन्दा धेरै पर्यटकहरूलाई बागलुङ भित्राउने लक्ष्य रहेको अध्यक्ष कँडेलले बताए। बागलुङलाई व्यावसायिक गन्तव्य बनाउन र समग्र धौलागिरि क्षेत्रमा पर्यटक भित्र्याउन महोत्सवले मद्दत पुग्ने अध्यक्ष कँडेलले बताए। १० करोडको कारोबार हुने अपेक्षा लिइएको महोत्सवमा १ करोड ७० लाख रुपैयाँ आम्दानी र १ करोड ४५ लाख रुपैयाँ खर्च हुने अनुमान गरिएको छ। ७ लाख जनाले महोत्सवको अवलोकन अनुमान गरिएको संघका प्रेस सल्लाहकार सुवास आचार्यले बताए। महोत्सवमा खुला राष्ट्रिय दोहोरी तथा लाइभ दोहोरी गीत प्रतियोगिता, पालिकास्तरीय खुला पुरुष भलिबल प्रतियोगिता, खुला महिला भलिबल प्रतियोगिता, खुला भजन प्रतियोगिता, युवा उद्यमी सम्मेलन, विभिन्न झाँकी प्रदर्शनी र राष्ट्रिय कलाकारको सांगीतिक प्रस्तुतिसहित मेलाको समयमा पर्ने अंग्रेजी नयाँ वर्ष २०२४ को अवसरमा लाइभ डिजे कन्सर्ट हुने प्रेस सल्लाहकार आचार्यले जानकारी दिए। अंग्रेजी नयाँ वर्षको उपलक्ष्यमा धेरैभन्दा धेरै पर्यटकहरूलाई बागलुङ भित्र्याउने लक्ष्य रहेको आचार्यले बताए। मेलाको उद्घाटन पुस ११ गते राष्ट्रपति रामचन्द्र पौडेलले गर्नेछन्।"
