शीर्षक,विवरण
"प्रधानमन्त्रीलाई अनौंठो निमन्त्रणा, उपहारमा दिइयो घोङी, ढिक्री, सुरिक सिकार र जाँरक झ्वार","काठमाडौं : प्रधानमन्त्री पुष्पकमल दाहाललाई थारू समुदायको परम्परागत विधिअनुसार निमन्त्रणा गरिएको छ। थारू कलाकारहरूको टोलीले प्रधानमन्त्री दाहाललाई बालुवाटार निवासमै पुगेर थारू विधिअनुसार प्रमुख अतिथिको निमन्त्रणा गरेको हो। थारू कलाकारहरूले थारू परम्परागत विधिअनुसार अन्दीको भात, घोङी, सिध्रा, झिङ्गे माछा र बंगुरको मासुको परिकार, बयरको चट्नी, केराउ र आलुको तरकारी, बर्या, ढिक्री र जाँरक झ्वार (जाँड) कोसेली लिएर निमन्त्रणा दिन बालुवाटार पुगेका थिए। राष्ट्रिय थारू कलाकार मञ्चका उपाध्यक्ष अन्जु चौधरीले उक्त कोसेली प्रधानमन्त्री दाहाललाई हस्तान्तरण गरेकी थिइन् । थारू समुदायमा चेलीको हातबाट कोसेली दिने प्रचलन छ। प्रधानमन्त्री दाहालले थारू समुदायको परम्परागत विधिबाट गरिएको निमन्त्रणाबाट आफू निकै प्रभावित भएको बताए। उनले आफूलाई अहिलेसम्म कसैले यसखालको निमन्त्रणा नदिएको बताए। यस्तो खालको निमन्त्रणा मलाई कसैले दिएको थिएन। तपाईँहरूले दिनुभएको परम्परागत निमन्त्रणाबाट म निकै प्रभावित भएँ, प्रधानमन्त्री दाहालले भने। उनले उक्त निमन्त्रणाको सम्मानमा थारू कलाकारहरूले आयोजना गर्ने कार्यक्रममा सहभागी हुने प्रतिवद्धता जनाएका थिए। मञ्चका अध्यक्ष विनय वैद्यका अनुसार थारू कलाकारहरूको महाधिवेशनका लागि उक्त निमन्त्रणा दिइएको हो। मञ्चले माघ २७ गते चितवनको सौराहामा महाधिवेशन आयोजना गर्दैछ। थारू कलाकारहरूको छाता संस्थाको रूपमा रहेको मञ्चको महाधिवेशनमा देशभरिका थारू कलाकाहरू जुट्ने अध्यक्ष वैद्यको भनाइ छ। उनले थारू समुदायको परम्परागत विधिलाई देशकै कार्यकारीसमक्ष प्रस्तुत गरेर संस्कृति जोगाउनुपर्ने उदाहरण दिएको बताए। थारू समुदायका परम्परागत विधि, पद्धतिहरू विस्तारै लोप हुने अवस्थामा छ। सरकार पनि त्यसको संरक्षण र प्रवर्द्धनमा चुकिरहेको भान हुन्छ। त्यसैले देशको कार्यकारी प्रमुखलाई नै यसखालको निमन्त्रणा दिएर संस्कृति जोगाउनुपर्ने उदाहरण प्रस्तुत गरेका हौं, अध्यक्ष वैद्यले भने।"
विधान संशोधन गर्ने एकीकृत समाजवादीको तयारी,"काठमाडौं : नेकपा एकीकृत समाजवादीले पार्टीको विधान संशोधन गर्ने तयारी गरेको छ। पार्टी कार्यालय आलोकनगरमा सोमबार बसेको सचिवालय बैठकमा पार्टीको विधान संशोधन कार्यसमितिले विधान संशोधन प्रस्ताव पेस गरेको हो। आगामी जेठ ३ देखि ७ गतेसम्म काठमाडौंमा हुने महाधिवेशनका क्रममा विधान संशोधनका लागि पार्टीका संगठन विभाग प्रमुख वेदुराम भुसाल संयोजकत्वको समितिले सचिवालय बैठकमा प्रस्ताव पेस गरेको पार्टी सचिव जीवनराम श्रेष्ठले जानकारी दिए। विधान संशोधन प्रस्तावमाथि मंगलबार पनि सचिवालय बैठकमा छलफल हुने उनले बताए। प्रस्तावमाथि आएका सुझावहरूलाई समेटेर अघि बढाइने उनले बताए। सचिवालयको बैठकपछि पुको ९ गते स्थायी कमिटी, १० गते पोलिट्व्युरो र पुस ११ र १२ गते केन्द्रीय कमिटिको बैठक बस्ने समाजवादीले जनाएको छ। त्यस्तै समाजवादीले माघको १४ र १५ गते राष्ट्रिय सम्मेलनको आयोजना गर्ने यसअघि नै निर्णय गरिसकेको छ।"
हत्या अभियोगमा सफाइ पाएका सांसद महतोलाई २१ किलोको माला,महोत्तरी : थमन विक हत्या प्रकरणमा महोत्तरी जिल्ला अदालतबाट सफाइ पाएका प्रतिनिधिसभा सदस्य लक्ष्मी महतो कोइरीलाई २१ किलोको मालाले स्वागत गरिएको छ। नेपाल कुशवाहा कल्याण समाजले उनको निवास निगौलमा सम्मान गरेको हो। समाजका जिल्ला अध्यक्ष विजयकुमार महतोले सांसद महतोलाई सफल कार्यकालको शुभकामना दिएका थिए। जनताको दुःखमा मल्हम लगाउनका लागि जनमैत्री विकास निर्माणमा सक्रिय भूमिका निर्वाह गरिदिन उनीहरूको आग्रह थियो। जनतासँग प्रत्यक्ष भेटघाट गरी उनीहरुको समस्या समाधानका निम्ति आफू सक्रियरूपमा लाग्ने सांसद महतोले प्रतिवद्धता जनाएका थिए। अदालतले गत बिहीबार महतोलाई सफाई दिएको थियो।
जतिसक्दो चाँडो कांग्रेस नेतृत्वमा सरकार बनाउनुपर्छ : शेखर कोइराला,"नुवाकोट : नेपाली कांग्रेसका वरिष्ठ नेता शेखर कोइरालाले देशको समस्या समाधानका लागि अहिलेको सरकारको विकल्प आवश्यक रहेको बताएबा छन्। उनले कांग्रेस आफैं सक्षम हुँदाहुँदै अरुलाई नेतृत गर्न दिनु नै भुल भएको बताए। नेकपा माओवादी नेतृत्वको सरकारले जनतामा आशा जगाउन नसकेको भन्दै उनले अब कांग्रेसको नेतृत्वमा सरकार बन्नुपर्ने बताए। यसको लागि नेतृत्व तयार रहनुपर्ने उनको भनाइ छ। जनतामा निरासा छाएका कारण त्यसको विकल्पमा सरकार परिवर्तन हुनुपर्ने उनले बताए। कांग्रेसको सरकारले मात्रै देशमा विद्यमान समस्या समाधान गर्न सक्ने उनको दाबी छ। उनले कांग्रेसलाई अरुले प्रयोग गरिरहेको र यो कार्यकतालाई मन नपरेकोसमेत बताए। भ्रष्टाचार, अनियमितता, महँगी बढिरहेका बेला सरकार जनताको दैनिकीसँग बेखवर रहेको नेता कोइरालाले बताए। कांग्रेसले वर्तमान सरकारलाई सहयोग गरिरहेका कारण प्रधानमन्त्री पुष्पकमल दाहालले एक वर्षको कार्य प्रगतिविवरण पेस गर्नुपर्ने उनको माग छ। उनले कांग्रेसकै पदाधिकारी, नेता, जनप्रतिनिधि तथा कार्यकर्ताबीच सहकार्य र समन्वय नहुँदासमेत समस्या आइरहेको बताए। सरकारसँग जनता निराश छन्, जताततै बेथिति मौलाएको छ, भ्रष्टाचार बढेको छ। जतिसक्दो चाँडो सरकार परिवर्तन गर्नुपर्छ र सरकारको नेतृत्व कांग्रेसले लिनुपर्छ, अहिलेको नेतृत्वबाट देशले निकास पाउँदैन, जनताले दुःख मात्रै पाउँछन्,' उनले भने।"
"प्रधानमन्त्रीले 'एक्सन रुम' बाटै गरे दुई सडक आयोजनाको अनुगमन, द्रूतगतिमा काम गर्न निर्देशन",काठमाडौं : प्रधानमन्त्री पुष्पकमल दाहाल 'प्रचण्ड' ले सिंहदरबारस्थित कार्यालयमा रहेको 'एक्सन रुम' बाटै दुई सडक आयोजनाको अनुगमन गरेका छन्। प्रधानमन्त्री दाहालले सोमबार अपरान्ह एक्सन रुपमा बसेर नारायणघाटबुटवल सडक र मुग्लिङपोखरा सडकको भर्चुअल छलफल र अनुगमन गरेको प्रधानमन्त्रीको सचिवालयले जनाएको छ। सो क्रममा प्रधानमन्त्री दाहालले द्रूतगतिमा दुई सिफ्टमा काम गर्न सम्बन्धित निकायलाई निर्देशन समेत दिएका छ्न्। लामो समयदेखि निर्माणाधीन रहेका दुवै सडक आयोजनाको काम ठेकेदारको ढिलासुस्तीका कारण निर्माण सम्पन्न हुन सकेको छैन।
धनगढी र काठमाडौं बराबरीमा रोकियो,काठमाडौं : नेपाल सुपर लिग (एनएसएल) फुटबल प्रतियोगितअन्तर्गत आज भएको धनगढी एफसी र काठमाडौं रेजर्सबीचको खेल बराबरीमा सकिएको छ। त्रिपुरेश्वरस्थित दशरथ रंगशाला सम्पन्न खेलमा धनगढी र काठमाडौ्बीचको खेल ११ गोलको बराबरी सकिएको हो। यससँगै दुवै टोलीले एकएक अंक बाँडेका छन्। खेलमा पहिलो अग्रता भने धनगढीले लिएको थियो। खेलको १५औं मिनेटमा धनगढीका अहमद हिजाजीको गोल गर्दै आफ्नो टोलीलाई पहिलो अग्रता दिलाए। त्यस्तै खेलको ६६औं मिनेटमा काठमाडौंले बराबरी गोल गर्यो। काठमाडौंको तोजीदिनोभको क्रसमा किङ्गे ओलिभरले हेडरमार्फत् गोल गर्दै खेललाई एकएक गोलको बराबरीमा ल्याए। त्यसपछि दुवै टोलीले गोल गर्न सकेनन् र खेल एकएक गोलको बराबरीमा सकियो। यस खेलसँगै धनगढीले ६ खेलको समाप्तिमा १२ अंक जोड्दै तालिकाको शीर्ष स्थानमा छ। काठमाडौं पाँच खेलमा नौ अंकसहित तालिकाको चौथो स्थानमा यथावत छ।
यो संविधानले कुनै दलको बहुमत आउँदैन : देउवा,नुवाकोट : नेपाली कांग्रेसका सभापति शेरबहादुर देउवाले अहिलेको संविधानअनुसार कुनै पनि दलको बहुमत नआउने बताएका छन्। उनले अहिलेको संविधानले कुनै पनि दललाई चुनावमा बहुमत ल्याउन नदिने ठोकुवा गरे। नुवाकोटको विदुरमा सोमबार प्रथम जिल्ला भेलाको उद्घाटन गर्दै देउवाले संविधान जारी भएको आठ वर्षपछि विमति जाहेर गरे। उनले बहुमत नआउने भएका कारण अन्य दलसँग मिलेर चुनावमा गएको बताए। कांग्रेसको विधान र देशको संविधान दुवैको विषयमा कुरा उठिरहेका कारण आफूले गम्भीरतापूर्वक लिएको उनले बताए। आफ्नै दलभित्रसमेत विविध विचार आइरहेका कारण कांग्रेसले पनि अब सोचेर अगाडि बढ्नुपर्ने बेला आएको उनको भनाइ छ। असहमति र असन्तुष्टिलाई छलफल गरेर समाधान गर्नुपर्ने जोड दिँदै उनले राम्रो कामको समर्थन र गलत कामको खबरदारी गर्न नुवाकोटबासीलाई आग्रह गरे। उनले देशमा विविध परिवर्तन गरेको कांग्रेस दलहरुबीच छुट्टै महत्वको भएको बताए।
योग्यताका आधारमा उपकुलपति नियुक्त गर्छौं : प्रधानमन्त्री,"काठमाडौं : प्रधानमन्त्री पुष्पकमल दाहाल प्रचण्डले योग्यताका आधारमा त्रिभुवन विश्वविद्यालयको उपकुलपति नियुक्त गरिने बताएका छन्। प्रधानमन्त्री एवं त्रिभुवन विश्वविद्यालयका कुलपति समेत रहेका दाहालले विश्वविद्यालयहरूमा हुने राजनीतिक नियुक्तिहरूमा राजनीतिक भागबण्डाको अन्त्य गरी 'मेरिट'का आधारमा पदाधिकारीहरू नियुक्त गर्ने बताएका हुन्। सोमबार दिउँसो त्रिपुरेश्वरमा आयोजित त्रिभुवन विश्वविद्यालयको ४९ औं दीक्षान्त समारोहलाई सम्बोधन गर्दै प्रधानमन्त्री दाहालले राजनीतिक दलहरूलाई त्रिभुवन विश्वविद्यालयमा भागबण्डा होइन मेरिटको आधारमा नियुक्ति हुनका लागि अग्रसर हुन अपील गरे। प्रधानमन्त्रीले भने,'आजको यो दिक्षान्त समारोह नेपालको इतिहासमा मात्रै ऐतिहासिक बनेन,विश्व इतिहासमा नै दीक्षान्त समारोहको तमाम श्रृङ्खलामा एउटा रेकर्ड हुन गयो। म आज यस अवसरमा त्रिभुवन विश्व विद्यालयबाट नै राजनीतिक भागभण्डाको अन्त्य गर्ने मेरिटको आधार भिसीलगायतका पदाधिकारी नियुक्ति गर्ने प्रतिबद्धता तपाईहरूको अगाडि व्यक्त गर्दछु। प्रधानमन्त्री दाहालले यसका निम्ति खुला प्रतिस्पर्धामा आउन विज्ञहरूलाई आह्वान समेत गरे। ' खुला प्रतिस्पर्धामा आउन देशभित्र र विश्वभरि रहेका विज्ञ नेपालीहरूलाई विशेष आह्वान पनि गर्दछु।'"
एन्फाको सीईओमा इन्द्रमान तुलाधर नियुक्त,काठमाडौं : अखिल नेपाल फुटबल संघ (एन्फा)को प्रमुख कार्यकारी अधिकृत सीईओमा इन्द्रमान तुलाधर नियुक्त भएका छन्। सोमबार काठमाडौंमा बसेको एन्फा कार्यसमिति बैठकले एन्फाका पूर्व महासचिव तुलाधरलाई सीईओ नियुक्त गरेको हो। त्यस्तै बैठकले सहायक कोषाध्यक्षमा प्रविण कुमार यादवलाई नियुक्त गरेको छ। बैठकले एन्फाको बिषेश साधारणसभा माघ ८ गते काठमाडौंमा गर्ने निर्णय गरेको छ भने नियमित साधारणसभा फागुन १४ गते काठमाडौंमा गर्ने निर्णय गरेको छ। त्यस्तै एन्फाले भविष्यमा हुने अन्तराष्ट्रिय प्रतियोगीता आयोजना गर्दा निशुल्क पास वितरण पूर्णरूपमा बन्द गर्ने र एन्फाले टिकट बिक्री गरि उठेको रकमका २० प्रतिशत रकम प्रतियोगितामा सहभागी हुने उमेर समूह र राष्ट्रिय महिला तथा पुरुष फुटबल टिमका खेलाडीलाई प्रदान गर्ने निर्णय गरेको छ।
