शीर्षक,विवरण
"प्रतिनिधिसभा बैठक बस्दै, एमालेले अवरोध नगर्ने","काठमाडौं : संघीय संसद्अन्तरगतको प्रतिनिधिसभा बैठक बस्दैछ। बैठक नयाँ बानेश्वरस्थित संसद भवनमा दिउँसो ३ बजे बस्दैछ। आजको बैठकमा प्रमुख प्रतिपक्ष नेकपा एमालेले अवरोध नगर्ने जनाएको छ। विमानस्थलबाट बरामद ६० किलो सुनको अनुसन्धानमा उच्चस्तरीय छानबिन समिति गठन गर्न सरकार तयार भएपछि एमालेले संसद बैठकमा अवरोध नगर्ने भएको हो। एमाले प्रमुख सचेतक पदम गिरीले उच्चस्तरीय छानबिनका लागि गठित तीन सदस्यीय कार्यदलले समितिको संरचना र कार्यक्षेत्रको प्रस्ताव तयार पारेर दिउँसो २ बजे बस्ने शीर्ष नेताको बैठकमा बुझाउने बताए। उनले एमालेको माग अनुसार उच्चस्तरीय छानबिन समिति गठन गर्न सरकार सहमत भएकाले अब संसदको अवरोध हट्ने बताए। सुन प्रकरणको अनुसन्धानका लागि उच्चस्तरीय छानबिन समितिको माग गर्दै एमालेले साउन १० गतेयता संसद चल्न दिएको थिएन। सोमबार राति सिंहदरबारमा बसेको राष्ट्रिय मान्यताप्राप्त दलहरुको संयुक्त बैठकमा कार्यादेश (टिओआर) तय गर्न तीन सदस्यीय समिति गठन भएको हो। कार्यदलमा नेकपा एमालेका संसदीय दलका उपनेता सुवासचन्द्र नेम्वाङ, नेपाली कांग्रेसका प्रमुख सचेतक रमेश लेखक र माओवादी केन्द्रका प्रमुख सचेतक हितराज पाण्डे छन्। आजको बैठकमा पूरानै एजेण्डालाई निरन्तरता दिने संघीय संसदको सचिवालयले जनाएको छ। सम्भावित कार्यसूची अनुसार बैठकमा सभामुख घिमिरेले प्रतिनिधि सभा नियमावली, २०७९ को नियम २४८ को उपनियम (३) को प्रयोजनको लागि प्रतिनिधि सभा सदस्य टोपबहादुर रायमाझी निलम्बन भएको जानकारी गराउनेछन्। रायमाझी नक्कली भुटानी शरणार्थी प्रकरणमा पक्राउ परी हाल पूर्पक्षका लागि थुनामा रहेका छन्। नेपालीलाई भुटानी शरणार्थी बनाएको अभियोगमा हाल एमालेबाट निर्वाचित सांसद रायमाझी हाल पूर्पक्षका लागि थुनामा छन्। सभामुखले प्रतिनिधि सभा नियमावली, २०७९ को नियम २४८ को उपनियम (१) को प्रयोजनको लागि प्रतिनिधि सभा सदस्य डासुनिल कुमार शर्मा पक्राउ परेको र थुनामुक्त भएको जानकारी गराउने छन् । यसैगरी कानुन,न्याय तथा संसदीय मामिला मन्त्री धनराज गुरुङ्गले नेपाल सरकार, मन्त्रिपरिषद्को निर्णयबाट आयोगको कार्यावधि थप गर्ने गरी जारी भएको आदेश बेपत्ता पारिएका व्यक्तिको छानबिन, सत्य निरुपण तथा मेलमिलाप आयोग ऐन, २०७१ को दफा ४२ को उपदफा (२) बमोजिम सदन समक्ष पेश गर्ने सम्भावित कार्यसूची छ। यसैगरी शिक्षा विज्ञान तथा प्रविधि मन्त्री अशोककुमार राईले राष्ट्रिय सभामा उत्पत्ति भएको नेपाल विश्वविद्यालय विधेयक, २०८० लाई दफावार छलफलको लागि सम्बन्धित समितिमा पठाइयोस् भनी प्रस्ताव प्रस्तुत गर्ने, सभामुखले प्रतिनिधि सभा नियमावली, २०७९ को नियम २१३ को उपनियम (१) बमोजिम १० वा सो भन्दा बढी बैठकमा अनुपस्थितसदस्यहरुको अनुपस्थितिको सूचनाहरु सभाको स्वीकृतिको लागि पेश गर्ने कार्यसूची छ।"
उच्चस्तरीय छानबिन समितिको कार्यादेश बनाउन गठित समितिको बैठक आज बस्दै,"काठमाडौं : विमानस्थलबाट भएको सुन तस्करीमाथि छानबिनका उच्चस्तरीय छानबिन समितिको कार्यादेश बनाउन गठित कार्यदलको बैठक आज बस्ने भएको छ। एमालेले लामो समयदेखि माग गर्दै आएको उच्चस्तरीय छानबिन समिति गठनका लागि सोमबार बेलुका सिंहदरबारमा बसेको राष्ट्रिय मान्यताप्राप्त दलहरुको संयुक्त बैठकमा कार्यादेश (टिओआर) तय गर्न तीन सदस्यीय समिति गठन भएको हो। उच्चस्तरीय छानबिन समितिको संरचना र कार्यक्षेत्रको प्रस्ताव तयार पार्न नेकपा एमालेका संसदीय दलका उपनेता सुवासचन्द्र नेम्वाङ, नेपाली कांग्रेसका प्रमुख सचेतक रमेश लेखक र माओवादी केन्द्रका प्रमुख सचेतक हितराज पाण्डे रहेको कार्यदल गठन गरिएको एमालेका प्रमुख सचेतक पदम गिरीले जानकारी दिए। उनका अनुसार उक्त कार्यदलको मंगलबार बिहान ११ बजेसम्म बस्ने बैठकले उच्चस्तरीय छानबिन समितिको संरचना र कार्यक्षेत्रको मस्यौदा तयार पार्ने र दिउँसो बस्ने शीर्ष नेताहरुको बैठकमा पेस गर्नेछ । एमालेको माग अनुसार उच्चस्तरीय छानबिन समिति गठन गर्न सरकार सहमत भएकाले अब संसदको अवरोध हट्ने गिरीले जानकारी दिए। छानबिन समितिले उनले सीआइबीको अनुसन्धान प्रभावित नहुने बताए। यसैगरी कांग्रेसका प्रमुख सचेतक लेखकले मंगलबार बैठक बसेको टुंगो लगाउने बताए। प्रमुख प्रतिपक्षी दल एमालेले सुन तस्करीको विषयमा उच्चस्तरीय छानबिन समिति गठनको माग गर्दै साउन १० गतेदेखि संसद अवरुद्ध गर्दै आएको छ। प्रतिपक्षको माग सरकारले सम्बोधन नगर्दा सदन चल्न सकेको छैन।"
ललिता निवासको छानबिन प्रतिवेदन सरकारी वकिल कार्यालयमा,"काठमाडौं : बालुवाटारस्थिल ललिता निवास जग्गा प्रकरणमा रायसहितको प्रतिवेदन (सीआईबी) ले सरकारी वकिल कार्यालयलाई बुझाएको छ।अनुसन्धान सकेर सुझावसहितको प्रतिवेदन मंगलबार बिहान सरकारी वकिलको कार्यलयमा बुझाएको सीआईबीका प्रवक्ता नवराज अधिकारीले जानकारी दिए। उनले भने,'ललिता निवास प्रकरणमा ५७ दिन लामो अनुसन्धानपछि तयार पारिएको प्रतिवेदन सरकारी वकिलको कार्यालय बुझाइएको हो। सो प्रकरणमा पक्राउ परेकामाथि किर्तेसम्बन्धी कसुर र सङ्गठित अपराध कसुरमा अनुसन्धान गरेर प्रतिवेदन तयार गरिएको हो।' सो प्रकरणमा मुछिएका तत्कालीन प्रधानमन्त्री माधवकुमार नेपाल र बाबुराम भट्टराईलगायत पूर्वमन्त्रीसँग सोधपुछपछि सीआईबीले अनुसन्धानलाई अन्तिमरुप दिएको हो। सर्वोच्च अदालतले ललिता निवास जग्गा प्रकरणमा तत्कालीन मन्त्रिपरिषदबाट निर्णय गर्ने र निर्णय प्रमाणित गरी कार्यान्वयन तहमा प्रत्यक्षरुपमा संलग्न हुनेहरुमाथि अनुसन्धान गर्न आदेश दिएको थियो। अदालतको उक्त आदेशपछि सीआईबीले नेपाल र भट्टराईसँग सोधपुछ गरेको हो। ललिता निवास जग्गा हिनामिना प्रकरणमा हालसम्म २३ जना पक्राउ परेकोमा तीनजना बन्दी प्रत्यक्षीकरणको रिटमार्फत् छुटेपछि बाँकी २० जनालाई हिरासतमा राखेर अनुसन्धान भइरहेको छ।यो प्रकरणमा तत्कालीन प्रधानमन्त्री,मन्त्रीका साथै सम्बन्धित मन्त्रालयका सचिव,गुठी संस्थान र मालपोत कार्यालयका अधिकारीहरू मुछिएका छन्। ललिता निवास प्रकरणमा प्रहरीले सञ्चार मन्त्रालयका सचिव कृष्णबहादुर राउत,भाटभटेनी सुपरमार्केटका सञ्चालक मीनबहादुर गुरुङ, निर्वाचन आयोगका पूर्वआयुक्त सुधीरकुमार शाह, पूर्वसरकारी कर्मचारीसहित २० जनालाई पक्राउ गरेको हो। उनीहरूविरुद्ध मुलुकी ऐन,२०२० को किर्तेसम्बन्धी कसुर र सङ्गठित अपराध कसुरमा प्रहरीले अनुसन्धान गरेको थियो। विसं २०४९ देखि २०६९ को अवधिमा सरकारका नाममा रहेको बालुवाटारस्थित ललिता निवासको एक सय ४३ रोपनी जग्गा हिनामिना भएको थियो। यसअघि सीआईबीले अनुसन्धान सकेर तीन सय जनाविरुद्ध मुद्दा चलाउनुपर्ने रायसहितको प्रतिवेदन बुझाएको थियो। तर, सरकारी वकिलको कार्यालयले थप अनुसन्धान गर्नुपर्ने भन्दै प्रतिवेदन फिर्ता गरेको थियो।"
पूर्वप्रधानमन्त्री ओली र नेपालका लागि अमेरिकी राजदूत थम्पसनबीच भेटवार्ता,काठमाडौं : पूर्वप्रधानमन्त्री केपी शर्मा ओली र नेपालका लागि अमेरिकाका राजदूत डीन आर थम्पसनबीच भेटवार्ता भएको छ। राजदूत थप्पसन मंगलबार बिहान एमाले अध्यक्ष ओलीलाई भेट्न बालकोट पुगेका हुन्। भेटमा एमालेका नेता तथा विदेश विभाग प्रमुख राजन भट्टराईसमेत थिए। उनीहरुबीच दुई देशको पारस्परिक सम्बन्ध र अन्य समसामयिक विषयमा छलफल भएको बालकोट स्रोतले जनाएको छ। असार अन्तिम साता अमेरिकी सहायक विदेशमन्त्री डोनाल्ड लुपनि एमसीसी कार्यान्वयनका विषयमा छलफल गर्न नेपाल आएका थिए। अमेरिकाले संसदबाट अनुमोदन भएको एमसीसी परियोजना कार्यान्वयनका लागि नेपालका राजनीतिक दलहरुलाई ताकेता गरिरहेको छ। एमसीसी परियोजना कार्यान्यवनको मिति नजिकिएसँगै अमेरिकी राजदूतले नेताहरुसँगको भेटलाई तिब्रता दिएका छन्। एमसीसी सम्झौताअनुसार अमेरिकाले नेपाललाई ५० करोड अमेरिकी डलर अनुदान दिने घोषणा गरेको छ। हालको सत्ता गठबन्धनले १२ बुँदे व्याख्यात्मक घोषणासहित २०७८ साल फागुन १५ गते संसदबाट एमसीसी कम्प्याक्ट सम्झौता अनुमोदन गरेको थियो।
"शितल निवासमा सर्वदलीय बैठक जारी, एमालेले गर्यो बहिस्कार","काठमाडौं : राष्ट्रपति कार्यालय शितल निवासमा सर्वदलीय बैठक जारी रहेको छ। मंगलबार बिहान राष्ट्रपति रामचन्द्र पौडेलले सर्वदलीय बैठक बोलाएका हुन्। तर राष्ट्रपति पौडेलले बोलाएको पहिलो सर्वदलीय बैठक नै विवादास्पद बनेको छ। प्रमुख प्रतिपक्षी दल नेकपा एमालेले राष्ट्रपतिले संविधानमा नभएको सक्रियता देखाउन खोजेको भन्दै बैठक बहिस्कार गरेको छ। बैठकमा प्रधानमन्त्री पुष्पकमल दाहाल (प्रचण्ड), कांग्रेस सभापति शेरबहादुर देउवा, रास्वपा सभापति रवि लामिछाने, जनमोर्चाका अध्यक्ष चित्रबहादुर केसी, नागरिक उन्मुक्तिकी अध्यक्ष रञ्जिता श्रेष्ठ, नेकपा एसका नेता मेटमणी चौधरी, जनमत पार्टीका नेता अब्दुल खान, रक्षामन्त्री पूर्णबहादुर खड्का लगायतका नेताहरु सहभागी छन्। राष्ट्रपतिका प्रेस सल्लाहकार किरण पोखरेलले संसद्मा सहभागी सबै दलका प्रतिनिधिलाई बोलाइएको जानकारी दिएका थिए। तर प्रमुख प्रतिपक्ष दल एमालेले भने प्रधानमन्त्री प्रचण्डले सर्वदलीय बैठक बोलाइरहेको र छलफल जारी रहेकै बीचमा राष्ट्रपति पौडेलले अनावश्यक चासो राखेर बैठक बोलाएको भन्दै आपत्ति जनाएको छ। एमाले उपाध्यक्ष एवं संसदीय दलका उपनेता सुवासचन्द्र नेम्वाङले प्रधानमन्त्रीले एकातिर छलफल गरिरहेको बेला राष्ट्रपतिले अर्को बैठक आह्वान गरेर राष्ट्रपतिले संविधान विपरीत अनावश्यक सक्रियता देखाएको बताए। त्रिभुवन अन्तर्राष्ट्रिय विमानस्थल बाहिरबाट गत साउन २ गते बरामद भएको ६० किलो सुन तस्करी प्रकरणको विषयमा छानबिन गर्न उच्चस्तरीय समिति गठन गर्नुपर्ने अडान राख्दै एमालेले सदनमा लगातार अवरोध गर्दै आएको थियो। तर सोमबार बेलुका सिंहदरबारमा बसेको राष्ट्रिय मान्यताप्राप्त दलहरुको संयुक्त बैठकमा विमानस्थलबाट भएको सुन तस्करीमाथि छानबिनका उच्चस्तरीय छानबिन समितिको कार्यादेश बनाउन कार्यदल गठन र समितिको संरचना र कार्यक्षेत्रलाई अन्तिम मस्यौदा तयार गर्न आज पुन: शीर्ष नेताको बैठक बस्ने तयारी भइरहेको छ। एमाले अध्यक्ष केपी शर्मा ओलीले सोमबारकै बैठकमा प्रधानमन्त्रीलाई उच्चस्तरीय समिति बन्ने र संसद खुल्ने जानकारी राष्ट्रपतिलाई गराइदिन आग्रह गर्दै शितल निवासको बैठक रोक्न सुझाव दिएपनि बैठक बसेपछि एमाले नगएको अर्का नेताले जानकारी दिए। छानबीन समिति गठनका लागि सरकार तयार भएकाले आजको संसद बैठक एमालेले अवरोध नगर्ने जनाएको छ।"
