शीर्षक,विवरण
विपद्को विपद्कथा,"जबजब विपद् आइपर्छ, तबतब त्यसबाट प्रभावित जीवनको रक्षाका लागि सरकार तत्पर हुन्छ भन्ने स्वयंसिद्ध मान्यता हो। विश्वव्यापी यो अवधारणालाई नेपालका सन्दर्भमा थप सिद्ध गर्न विपद् जोखिम न्यूनीकरण तथा व्यवस्थापन ऐन २०७४ तथा राष्ट्रिय विपद् जोखिम न्यूनीकरण तथा व्यवस्थापन प्राधिकरण, २०७६ क्रियाशील छन्। यसलाई संघ, प्रदेश र स्थानीय तहसम्म विस्तार गर्न प्रदेश विपद् व्यवस्थापन समिति, जिल्ला विपद् व्यवस्थापन समिति, स्थानीय विपद् व्यवस्थापन समिति पनि क्रियाशील छन्। राष्ट्रिय, अन्तर्राष्ट्रिय स्तरका गैरसरकारी संस्थाहरू पनि अस्तित्वमा छन्। औपचारिकता र विधिविधानमा यी तमाम संरचना छन्, तर पीडितले राहत महसुस गर्ने गरी व्यवहारमा यिनीहरूको भूमिका खट्किएको देखिन्छ। आहारा खाने चरी आशीर्वादले बाँच्दैन। विपद्मा परेर छटपटाइरहेकाहरूलाई ऐन, कार्यविधि, प्राधिकरण, समिति, संघसंस्थाको कागजले केही लछारपाटो लाउँदैन। त्यसैले कागजी बाघ होइन, तत्काल उद्धार चाहिन्छ, राहत चाहिन्छ र पुनर्बास तथा पुनस्र्थापना चाहिन्छ। गोरखाको खानीगाउँबासी अहिले चर्किएको घर र चिरिएको जमिनमा डराईडराई बाँचिरहेका छन्। टाढाबाट हेर्दा गाउँमा कतै पहिरो छैन। तर गाउँबाट हेर्दा हरेक घर, चुल्हो, मझेरी, पिँडी र आँगन धाँजा फाट्न कतै बाँकी छैन। त्यहाँको माटो बगिरहने अत्यन्त नरम खालको छ। आँखाले हेर्दा देखिँदैन तर चुङगङदेखि आएको स्थानीय दुङ्स्योङ खोलाले गाउँलाई निरन्तर बगाइरहेको छ। त्यसैले त्यहाँको बस्तीलाई यथाशीघ्र स्थानान्तरण गर्नुपर्छ भनेर राष्ट्रिय पुनर्निर्माण प्राधिकरणले २०७५ सालमा स्थलगत अध्ययन प्रतिवेदन तयार गरेको थियो। तर पाँच वर्ष बित्यो। स्थानान्तरण भने अझै भएको छैन। फलस्वरूप बर्सेनि गाउँलेहरू बर्खाको झरीभित्र रोइकराइ बस्न बाध्य छन्। कुरो खानीगाउँको मात्र होइन, नेपाल बाढी, पहिरो तथा भूकम्पजस्ता प्राकृतिक प्रकोपहरूबाट उच्च जोखिममा छ। भूकम्पका दृष्टिले ११औं र मिश्रित विपत्तिहरूका दृष्टिले नेपाल विश्वस्तरमा १६औं अग्रस्थानमा छ। जलवायु परिवर्तनका कारणले पर्ने दुष्प्रभावका दृष्टिले नेपाल चौथो उच्च जोखिममा छ। भारतीय र युरोपियन जमिन एकआपसमा ठोक्किएको भूभागमाथि नेपाल अवस्थित छ, जसकारण यहाँ ठूलाठूला प्राकृतिक विपत्तिहरू बारम्बार आइरहन्छन्। त्यसैले विपद् पूर्वतयारी, प्रतिकार्य तथा आपत्कालीन परिस्थिति न्यूनीकरणका लागि योजना निर्माण गर्नु, उद्धार, राहत तथा पुनर्बास र पुनस्र्थापनाको तयारी अवस्थामा रहनु पर्छ। विपद् व्यवस्थापन तथा न्यूनीकरणका लागि गठित सबै निकाय र सामाजिक संघसंस्था संयुक्त रूपमा खटिनु पर्ने हो। सरकारी, गैरसरकारी सबै संरचनाको समन्वयात्मक र प्रभावकारी पहलमा तत्काल प्राकृतिक तथा गैरप्राकृतिक विपद्बाट सर्वसाधारणको जीउज्यान र सार्वजनिक, निजी तथा व्यक्तिगत सम्पत्ति, प्राकृतिक एवं सांस्कृतिक सम्पदा र भौतिक संरचनाको संरक्षण गर्न संयुक्त पहलको खाँचो पर्छ। हरेक वर्ष टालटुलले मात्र हुँदैन।"
पूर्वप्रधानमन्त्रीद्वय नेपाल र भट्टराईसँग घरमै पुगेर सोधपुछ,"सीआईबी प्रमुख एआईजी किरण बज्राचार्यले ललिता निवास प्रकरणको अनुसन्धान टुंगोमा पुर्याउनका लागि प्रधानमन्त्रीद्वयसँग घरमा गएर जानकारी लिइएको बताइन्। काठमाडौ : ललिता निवास जग्गा प्रकरणमा मुछिएका पूर्वप्रधानमन्त्री माधवकुमार नेपाल र बाबुराम भट्टराईको घरमा नै पुगेर नेपाल प्रहरीको केन्द्रीय अनुसन्धान ब्युरो (सीआईबी)को टोलीले बयान लिएको छ। तर, यसलाई प्रहरीले आफ्नो भाषामा बयान नभई घटना विवरण कागज भनेको छ। सीआईबी प्रमुख एआईजी किरण बज्राचार्यले ललिता निवास प्रकरणको अनुसन्धान टुंगोमा पुर्याउनका लागि प्रधानमन्त्रीद्वयसँग घरमा गएर जानकारी लिइएको बताइन्। भनिन्, अनुसन्धानका क्रममा आवश्यक देखिएका सबै व्यक्तिसँग प्रहरीले सोधपुछ गर्न सक्छ। मुद्दाका लागि आवश्यक प्रमाण जुटाउने गर्छ। त्यसै क्रममा उहाँहरूसँग घटना विवरण कागज गर्ने काम भएको हो। बालुवाटारस्थित ललिता निवास र त्यसले चर्चेको सरकारी जग्गा हिनामिना प्रकरणका निर्णयाधिकारी पूर्वप्रधानमन्त्रीद्वय माधवकुमार नेपाल र बाबुराम भट्टराईसँग बयान गराउनका लागि सीआईबीमाथि दबाब पर्दै आएको थियो। प्रधानमन्त्रीद्वयसँग बयान नलिएको भन्दै तीव्र आलोचना भएपछि सीआईबीले पक्राउ नगरी सोधपुछ गरेको हो। आइतबार राति उनीहरूको घरमा पुगेर घटनाका विषयमा सीआईबी टोलीले सोधपुछ गरेको थियो। उनीहरूकै समयमा ललिता निवासको जग्गा व्यक्तिका नाममा लैजाने गरी मन्त्रिपरिषद्बाट निर्णय भएको थियो। प्रमाणका लागि यस कार्यको निर्णयमा संलग्न भएकामाथि अनुसन्धान गर्नुपर्ने सीआईबीलाई दबाब छ। तर, स्रोतका अनुसार सत्ता गठबन्धनको दबाबमा नेपाल र भट्टराईसँग बयान लिन सीआईबीलाई सकस परिरहेको थियो। ललिता निवास प्रकरणको अनुसन्धान छिटो सकेर सरकारी वकिल कार्यालयलाई फाइल बुझाउनुपर्ने दबाब सीआईबीलाई छ। मन्त्रिपरिषद्बाट निर्णय गराउने मुख्य व्यक्तिसम्मै अनुसन्धान गर्नका लागि सर्वोच्च अदालतले आदेश दिएको थियो। सर्वोच्च अदालतले ललिता निवास प्रकरणमा मन्त्रिपरिषद्ले गरेको चारवटा निर्णयमा संलग्नहरूलाई पनि अनुसन्धानको दायरामा ल्याउन आदेश गरेको थियो। साउन २१ मा न्यायाधीश अनिलकुमार सिन्हा र डा कुमार चुडालको इजलासले सो आदेश गरेपछि पूर्वप्रधानमन्त्री भट्टराई र नेपालमाथि पनि अनुसन्धान गर्ने बाटो खुलेको थियो। अदालतको आदेशअनुसार प्रधानमन्त्रीद्वयको बयान नलिइकन रायसहितको प्रतिवेदन सरकारी वकिल कार्यालयमा बुझाउन सीआईबीलाई कानुनी अफ्ठ्यारो पर्यो। सीआईबीले उनीहरूलाई गरेको सोधपुछपछि प्रधानमन्त्रीद्वयलाई प्रतिवादी नबनाउने गरी घटना विवरण कागज मात्रै गराएको हुनसक्ने स्रोतको भनाइ छ। यस्तो कागजले अप्रत्यक्ष रूपमा प्रधानमन्त्रीद्वयलाई सफाइ दिएको कानुनविज्ञहरू बताउँछन्। जिल्ला सरकारी वकिल कार्यालयका एक सहायक जिल्ला न्यायाधिवक्ता भन्छन्, घटना विवरण कागज गर्दा प्रतिवादी बनाइएको हँुदैन। घटना घटेको समयमा के भएको थियो ? भन्ने विषयमा सामान्य सोधपुछ मात्रै गरिने हो। प्रतिवादीको रूपमा बयान नलिएपछि यस्तो कागजले सफाइ दिएको जस्तै हुन्छ। मुद्दाका विषयमा आवश्यक पर्दा सरकारी साक्षीको रूपमा राख्न सक्ने गरी कागज गराइएको छ। सीआईबीका प्रवक्ता नवराज अधिकारी भन्छन्, अनुसन्धानका लागि आवश्यक बयान लिएका छौं। बयान कहाँ गएर लियौं भन्ने ठूलो विषय भएन, आवश्यक जानकारी लिएका छौं।"
