शीर्षक,विवरण
सशस्त्रका ८४ जना प्रहरी निरीक्षक बढुवाका लागि सिफारिस (सूचीसहित),काठमाडौं : सशस्त्र प्रहरी बलले ८४ जना प्रहरी निरीक्षकलाई सशस्त्र प्रहरी नायव उपरीक्षकमा बढुवाका लागि सिफारिस गरेको छ। कोको परे? सूची हेर्नुस्:
बिआरआई परियोजनाले नेपालचीन सम्बन्धमा नयाँ उचाइ ल्याउँछ : चिनियाँ राजदूत,"काठमाडौं : नेपालका लागि चिनियाँ राजदूत छन् सोङले बिआरआई परियोजनाको कार्यान्वयनपछि नेपालचीन सम्बन्ध फरक उचाइमा पुग्ने दाबी गरेका छन्। उनले बिआरआई परियोजना दुवै मुलुकको लागि 'वीन वीन'को बाटोमा लैजाने दाबी गरे। काठमाडौंमा आयोजित एक कार्यक्रममा उनले सिल्क रोडको भावनालाई विरासतको रूपमा अगाडि बढाउन नेपालसँग हातेमालो गरेको प्रस्ट पारे। बिआरआई परियोजनामा नेपालले हस्ताक्षर गरे पनि कार्यान्वयन भने हुन सकेको छैन। चीन सरकारले यसपटकको भ्रमणका बेला बिआरआई परियजना कार्यन्वयनमा प्रधानमन्त्री पुष्पकमल दाहाल प्रचण्डको प्रतिवद्धता खोजेको छ। त्यस्तै चिनियाँ राजदूत सोङले कोरोना महामारीपछि नेपाल र चीनबीच सांस्कृतिक आदानप्रदान बढेको बताए। 'यस वर्षको सुरुवातदेखि जनताजनताबीचको सम्बन्ध र सांस्कृतिक आदानप्रदान र सहयोगमा वृद्धि भएको छ। पोखरास्थित फेवा तालमा पहिलो चीननेपाल मैत्री ड्र्यागन बोट रेस समारोह सफलतापूर्वक सम्पन्न भएको छ। लुम्बिनीको चिनियाँ मन्दिरमा हजारौं मानिसहरूले विश्व शान्तिको लागि दीप प्रज्वलन गरी प्रार्थना गरेका छन्,' उनले भने। चीननेपाल रणनीतिक सहकार्य र साझेदारीको विकासका लागि शीर्ष स्तरको सोच आवश्यक रहेको उनको भनाइ छ। चीनले चिनियाँ शैलीको आधुनिकीकरणको माध्यमबाट राष्ट्रको महाकायाकल्पलाई चौतर्फीरूपमा अगाडि बढाइरहेको बताउँदै उनले नेपालले पनि अतिकम विकसित मुलुकबाट विकसित मुलुकको लागि बनाएको योजनामा चीनले साथ दिने बताए। 'थर्टी थाउजन्ड माइल अफ चाङआन'को उदाहरणओ दिँदै उनले भने, 'अभिनेताले फिल्ममा भनेका भनेका छन्, 'तिमी र म यस्तो समृद्ध संसारमा हुनुपर्छ, हामी मित्र हुनुपर्छ।' चीन र नेपाल पनि त्यस्तै मित्र बन्नुपर्ने उनको भनाइ छ। उनले शैक्षिक आदानप्रदान र सहयोगका लागि दीर्घकालीन सहयोग र कडा परिश्रमका लागि चीन र नेपालका सबै क्षेत्रका मित्रहरूलाई धन्यवाद दिएका थिए। चिनियाँ पक्षले नेपालमा चिनियाँ भाषा शिक्षाको स्तरोन्नतिलाई सशक्त रूपमा प्रवर्द्धन गर्न, उत्कृष्ट विद्यार्थीहरूलाई छात्रवृत्ति र अनुदान उपलब्ध गराउन, चिनियाँ भाषालाई व्यावसायिक, उच्चस्तरीय र पाठ्यक्रमको रूपमा विकास गर्न नेपालसँग मिलेर काम गर्ने उनले बताए।"
उच्चस्तरीय छानबिन समितिको संरचना र कार्यक्षेत्र टुंग्याउन शीर्ष नेताको बैठक बस्दै,"काठमाडौं : सरकारले प्रमुख प्रतिपक्ष दल एमालेको माग अनुसार उच्चस्तरीय छानबिन समिति बनाउने भएको छ। उच्चस्तरीय छानबिन समितिको संरचना र कार्यक्षेत्र कस्तो हुने भन्ने विषयको मस्यौदालाई आज दिउँसो बस्ने शीर्ष नेताको बैठकले टुंग्याउने एमालेका प्रमुख सचेतक पदम गिरीले जानकारी दिए। उनका अनुसार विमानस्थलबाट भएको सुन तस्करीमाथि उच्चस्तरीय छानबिन समितिको कार्यादेशको ड्राफ्ट तयार गर्न गठित कार्यदलको बैठकले बिहान ११ बजेभित्र मस्यौदा तयार गर्ने र त्यसपछि बस्ने शीर्ष नेताको बैठकले अन्तिम रुप दिनेछ। सोमबार बेलुका सिंहदरबारमा बसेको राष्ट्रिय मान्यताप्राप्त दलहरुको संयुक्त बैठकमा कार्यादेश (टिओआर) तय गर्न नेकपा एमालेका संसदीय दलका उपनेता सुवासचन्द्र नेम्वाङ, नेपाली कांग्रेसका प्रमुख सचेतक रमेश लेखक र माओवादी केन्द्रका प्रमुख सचेतक हितराज पाण्डे रहेको कार्यदल गठन गरिएको छ । एमालेको माग अनुसार उच्चस्तरीय छानबिन समिति गठन गर्न सरकार सहमत भएकाले आजको संसद बैठकमा अवरोध हट्ने गिरीले जानकारी दिए। छानबिन समितिले सीआइबीको अनुसन्धान प्रभावित नहुने उनले बताए। प्रमुख प्रतिपक्षी दल एमालेले सुन तस्करीको विषयमा उच्चस्तरीय छानबिन समिति गठनको माग गर्दै साउन १० गतेदेखि संसद अवरुद्ध गर्दै आएको छ। प्रतिपक्षको माग सरकारले सम्बोधन नगर्दा सदन चल्न सकेको छैन।"
राष्ट्रियसभाको बैठक दिउँसो ३:१४ बजेलाई सारियो,"सङ्घीय संसद् सचिवालयका महासचिव डा भरतराज गौतमले आज जारी गरेका सूचनामा विशेष कारणवश तोकिएको समयमा बैठक बस्न नसक्ने भएकाले सवा दुई घण्टा ढिला सारिएको उल्लेख छ। काठमाडौं :आज दिउँसो १ बजेर १ मिनेटका लागि बोलाइएको राष्ट्रियसभाको बैठक दिउँसो ३ बजेर १४ मिनेटमा बस्ने भएको छ। सङ्घीय संसद् सचिवालयका महासचिव डा भरतराज गौतमले आज जारी गरेका सूचनामा विशेष कारणवश तोकिएको समयमा बैठक बस्न नसक्ने भएकाले सवा दुई घण्टा ढिला सारिएको उल्लेख छ। राष्ट्रियसभा नियमावली, २०७५ को नियम ६ को उपनियम (३) बमोजिम बैठक सारिएको सूचनामा उल्लेख छ। विगत एक महिनादेखि प्रमुख प्रतिपक्षी दल नेकपा (एमाले)को अवरोधका कारण सङ्घीय संसद्को दुवै सदनका बैठक कार्यसूचीमा प्रवेश नगरी स्थगित हुने गरेको छ।"
मेरो छायाँ परेर होला राष्ट्रपतिले बोलाएको बैठकमा एमालेका नेता आएनन् : माधव नेपाल,"काठमाडौं : राष्ट्रपति रामचन्द्र पौडेलले शीतलनिवासमा बोलाएको बैठकमा एमाले नेताहरू सहभागी नभएपछि नेकपा एकीकृत समाजवादीका अध्यक्ष माधवकुमार नेपालले व्यंग्य गरेका छन्। मंगलबार दिउँसो पार्टीको केन्द्रीय कमिटीको बैठकलाई सम्बोधन गर्दै अध्यक्ष नेपालले आफू आउने थाहा पाएपछि एमालेका नेताहरू सर्वदलीय बैठकमा नआएको टिप्पणी गरेका हुन्। 'आज राष्ट्रपतिले एउटा बैठक बोलाउनु भएको थियो । पार्टीको तर्फबाट म पनि गाथे। थाहा छैन मलाई के कारणाले हो एमालेका नेताहरू आएनन्,'उनले भने,' संवभत त्यहाँ माधव नेपालको छायाँ, एकीकृत समाजवादीको छायाँ परेर होला। आउने काम भएन।' उनले आफू एमालेजस्तो संकीर्ण र सानो चित्त नभएको बताउँदै राष्ट्र, जनताका मुद्दामा हातेमालो गर्दै अगाडि बढिरहेको जिकिर गरे। राष्ट्रपति रामचन्द्र पौडेलले संसदको गतिरोधबारे छलफल गर्न मंगलबार बिहान सर्वदलीय बैठक बोलाएका थिए। बैठकमा एमाले सहभागी भएन। एमालेबाहेक प्रधानमन्त्री पुष्पकमल दाहाल (प्रचण्ड), कांग्रेस सभापति शेरबहादुर देउवा, रास्वपा सभापति रवि लामिछाने, जनमोर्चाका अध्यक्ष चित्रबहादुर केसी, नागरिक उन्मुक्तिकी अध्यक्ष रञ्जिता श्रेष्ठ, नेकपा एसका नेता मेटमणी चौधरी, जनमत पार्टीका नेता अब्दुल खान, रक्षामन्त्री पूर्णबहादुर खड्का लगायतका नेताहरु बैठकमा सहभागी थिए। उनले तत्कालीन नेकपा एमालेबाट विद्रोह गरेर अत्यन्त उचित काम गरेको जिकिर गरे । 'त्यो विद्रोह जायज थियो। औचित्यपूर्ण थियो भन्ने कुरामा हामी विश्वस्त हुनुपर्छ,'उनले भने,'अहिलेसम्मका घटनाक्रमले त्यो बेला चालेको कदम जायज थियो भनेर बारम्बार पुष्टि हुँदै आएको छ। हामीले आँट गरेकै हौं।' पूर्वप्रधानमन्त्री समेत रहेका नेपालले विगतमा पार्टीको संगठनको अस्तित्वलाई अगाडि बढाउन गरेका प्रयासलाई बिर्सन नहुने बताए। उनले कडा मिहेनत र परिश्रमले नेकपा एसको जन्म भएको जिकिर गरे। नेपालको कम्युनिष्ट आन्दोलनमा मात्रै नभइ राजनीतिमा नेकपा एसको विशेष भूमिका रहेको उनको भनाइ छ। उनले पार्टी गठनका क्रममा असंभव ठानिएका विषय पनि मिहेनत र संघर्षले संभव भएको दावी गरे।"
जसपाले तोक्यो प्रदेश र विभागको जिम्मेवारी,"काठमाडौं : जनता समाजवादी पार्टी (जसपा) नेपालले आफ्ना पार्टीका नेताहरुको प्रदेश र विभागको जिम्मेवारी तोकेको छ । सो पार्टीको सम्पन्न केन्द्रीय कार्यकारिणी समितिको बैठकले प्रदेश र विभागको जिम्मेवारी तोकेको हो । पार्टीका केन्द्रीय कार्यकारिणी समिति सदस्य सुशिला श्रेष्ठलाई बागमती प्रदेश इन्चार्ज, राजकिशोर यादवलाई लुम्बिनी प्रदेश इन्चार्ज, प्रकाश अधिकारीलाई कर्णाली प्रदेश इन्चार्ज र गोविन्द चौधरीलाई सुदूरपश्चिम प्रदेश इन्चार्ज तोकेको सो पार्टीका केन्द्रीय प्रचारप्रसार तथा प्रकाशन विभाग प्रमुख पूर्ण बस्नेतले जानकारी दिए। उनका अनुसार बैठकले कार्यकारिणी समिति सदस्य परशुराम बस्नेतको अध्यक्षतामा चन्देश्वरप्रसाद सिंह, पेशल ढकाल, न्हुच्छेलाल महर्जन र ई देवनारायण यादव रहेको केन्द्रीय कार्यालय समितिसमेत गठन गरेको छ । यसैगरी सङ्गठन विभागको प्रमुखमा केन्द्रीय कार्यकारिणी सदस्य राजेन्द्र श्रेष्ठलाई चयन गरेको छ भने विभागका सदस्यमा रेणु यादव र लाक्पा शेर्पा रहेका छन्। संघीय मामिला तथा स्थानीय तह विभाग प्रमुखमा लालबाबु राउत तथा सदस्यमा शैलेन्द्र साह र सनबहादुर राई चयन भएका छन् । सूचना, सञ्चार, विज्ञान तथा प्रविधि विभागमा मनिषकुमार सुमन तथा सदस्यमा लक्ष्मण हुमागाईं र योगराज वनेम चयन भएका छन्। यसैगरी नवलकिशोर साहलाई आर्थिक विभागको सदस्यमा चयन गरिएको छ भने युवा, विद्यार्थी तथा खेलकुद विभागको प्रमुखमा रमेशबाबु श्रेष्ठ रहेका छन् । विभागको सदस्यमा विदेश्वर यादव, दीपक दोर्जे लामा र वीरेन्द्र प्रधान सदस्य रहेका छन्। महिला विभागमा लीला सिटौला, सदस्यमा उर्मिला साह, मञ्जु अन्सारी, विनिता यादव, किरण साह, निर्मला यादव, भगवती सुवेदी, रेणुका सिंह, अञ्जना शेर्पा, शोभा बज्राचार्य र कमला विश्वकर्मा चयन भएको सो पार्टीले जनाएको छ । केन्द्रीय सदस्य मनोरञ्जन गोइतमाथि गरिएको अनुशासनात्मक कारबाही फुकुवा गर्ने निर्णय गरेको केन्द्रीय प्रचारप्रसार तथा प्रकाशन विभाग प्रमुख बस्नेतले जानकारी दिए।"
प्रधानन्यायाधीश विश्वम्भरप्रसाद श्रेष्ठको शपथ आज,"काठमाडौं : नवनियुक्त प्रधानन्यायाधीश विश्वम्भरप्रसाद श्रेष्ठले आज पद तथा गोपनीयताको शपथ ग्रहण गर्ने भएका छन्। सोमबार सर्वोच्च अदालतको ३१ औं प्रधानन्यायाधीशमा नियुक्त भएका श्रेष्ठले आज दिउँसो राष्ट्रपति रामचन्द्र पौडैलसमक्ष पद तथा गोपनीयताको शपथ लिन लागेका हुन्। संवैधानिक परिषद्को सिफारिसमा सोमबार राष्ट्रपतिले श्रेष्ठलाई संविधानको धारा १२९ को (२) बमोजिम प्रधानन्यायाधीश पदमा नियुक्त गरेका हुन्। संवैधानिक परिषद्ले १८ साउनमा श्रेष्ठलाई प्रधानन्यायाधीशमा सिफारिस गरेको थियो। तत्कालीन प्रधानन्यायाधीश हरिकृष्ण कार्की उमेरहदका कारण २० साउनमा अवकासमा गएपछि बरिष्ठतम् न्यायाधीश श्रेष्ठले कामयमुकायमको जिम्मेवारी पाएका थिए। २०१६ सालमा डोटीमा जन्मिएका श्रेष्ठ २०३८ सालमा शाखा अधिकृताबाट सरकारी सेवामा प्रवेश गरेका थिए। उनी जिल्ला,उच्च अदालतहुँदै सर्वोच्च अदालतको न्यायाधीश बनेका थिए। २०७३ सालदेखि उनी सर्वोच्च अदालतको न्यायाधीश थिए।"
