शीर्षक,विवरण
"बेपत्ता महिलाको शव २२ घण्टापछि फेला, बाघ नियन्त्रणमा",महेन्द्रनगर : कञ्चनपुरको बेलौरीमा बाघको आक्रमणबाट बेपत्ता महिलाको शव २२ घण्टापछि फेला परेको छ। महिलालाई आक्रमण गरी बेपत्ता पार्ने पाटे बाघलाई राष्ट्रिय निकुञ्जको प्राविधिक टोलीले नियन्त्रणमा लिएलगत्तै सोही स्थानमा महिलाको शव फेला परेको प्रहरीले जनाएको छ। कञ्चनपुरको बेलौरी नगरपालिका८ पचुइका गंगा चन्दको शव शनिबार बिहान फेला परेको हो। प्राविधिक टोलीले करिब २२ घण्टापछि बाघ नियन्त्रणमा लिन सफल भएको हो। बर्दिया राष्ट्रिय निकुञ्जको र शुक्लाफाँटा राष्ट्रिय निकुञ्जको प्राविधिक टोलीले बाघ नियन्त्रणमा लिएको हो। जिल्ला प्रहरी कार्यालय कञ्चनपुरका प्रवक्ता प्रकाश डांगीले बाघ फेला परेकै स्थानमा महिलाको शव पनि फेला परेको बताए। चन्दसहित स्थानीय महिला घाँस काट्न गएका बेला बाघले आक्रमण गरेको थियो। सो क्रममा अन्य महिला भागेर ज्यान जोगाउन सफल भएका थिए। शुक्लाफाँटा राष्ट्रिय निकुञ्जका सहायक संरक्षण अधिकृत रोशनसिंह ठगुन्नाले बाघ नियन्त्रणमा लिएर बेल्डाँडी पोस्टमा पुर्याइएको बताए। उनले केही समय बाघलाई निगरानीमै राख्ने र पछि विभागको निर्देशनअनुसार थप निर्णय लिने बताए। सो घटनापछि दक्षिण क्षेत्रका स्थानीय त्रसित छन्।
चितवन क्षेत्र नं २ मा लामो दूरीका गाडी मात्रै चल्ने,"लामो दूरीका सवारी साधनलाई पनि समूहमा मात्रै सुरक्षा निगरानीसहित नारायणगढतर्फ पठाइने सूचनामा उल्लेख छ । चितवन : चितवन क्षेत्र नं २ को उपनिर्वाचनका लागि यस क्षेत्रमा स्थानीय रुटका सवारी साधन आवागमन बन्द गरिएको छ । जिल्ला प्रशासन कार्यालय चितवनले एक सूचना जारी गर्दै लामो दूरीका सवारी साधनबाहेक अन्य सबै सवारी साधन सञ्चालनमा रोक लगाइएको हो । लामो दूरीका सवारी साधनलाई पनि समूहमा मात्रै सुरक्षा निगरानीसहित नारायणगढतर्फ पठाइने सूचनामा उल्लेख छ । प्रहरीले चितवनको सिमाना धादिङतर्फको मौवा खोला, मुग्लिन, नारायणगढको पुलचोक र गोन्द्राङ चोकमा चेकजाँच गरी केही समयको अन्तरालमा मात्रै समूहमा मात्रै सवारी साधनलाई गन्तव्यमा पठाइने प्रशासनले जनाएको छ । चितवन प्रशासनले नारायणी पुलमा पर्नसक्ने सवारी साधनको जामको असरलाई न्यूनीकरण गर्न नवलपरासी पूर्वको गैँडाकोट क्षेत्रमा कडा चेकजाँच गरेर लामो दूरीका सवारी साधन यकिन गरेर मात्रै पठाउन भनिएको जनाएको छ । वैशाख १० गते जिल्ला प्रशासनबाट अनुमति प्राप्त सवारी साधन, एम्बुलेन्स, स्वास्थ्यकर्मी, पत्रकारका सवारी साधन मात्र सञ्चालन गर्न पाइने चितवन प्रशासनले जनाएको छ ।"
कोसी प्रदेशमा दुर्घटनामा परेर ३ जनाको मृत्यु,"गम्भीर घाइते भएका ऋषिदेवलाई उपचारका लागि रंगेली अस्पताल पुर्याउनसाथ चिकित्सकले मृत घोषित गरेका हुन्। दुर्घटनामा मोटरसाइकल चालक रंगेली६ का अन्दाजी ४० वर्षीय अजय मण्डल गम्भीर घाइते भएका छन्। विराटनगर : कोसी प्रदेशका विभिन्न जिल्लामा सवारी दुर्घटना हुँदा ३ जनाको मृत्यु भएको छ। दुर्घटनामा परेर २ जना घाइते भएका छन्। कोसी प्रदेशका खोटाङ, मोरङ र सुनसरीमा शुक्रबार दुर्घटना भएको प्रहरीले जनाएको छ। खोटाङको खोटेहाङ गाउँपालिका४ कुलाभन्ज्याङस्थित सडकमा दिक्तेलबाट खोटाङ बजारतर्फ जाँदै गरेको बा ३ ख ३४४१ नम्बरको बसबाट लडेर १ जनाको मृत्यु छ। बसबाट ओर्लने क्रममा राति ९:३० बजेतिर लडेर जन्तेढुंगा गाउँपालिका३ आरुबोटेका ३८ वर्षीय दिनेश राईको मृत्यु भएको कोसी प्रदेशका ट्राफिक प्रहरी प्रमुख एसपी श्यामकुमार महतोले जानकारी दिए। बसको ढोकाबाट लडेर राई गम्भीर घाइते भएका थिए। उपचारका क्रममा स्वास्थ्य चौकी खोटाङ बजारमा शनिबार बिहानका राति १ बजेतिर उनको मृत्यु भएको एसपी महतोको भनाइ छ। उनका अनुसार दुर्घटनालगत्तै बसका चालक हलेसीतुवाचुङ नगरपालिका१ का अन्दाजी २३ वर्षीय मनोज कार्की फरार बनेका छन्। फरार रहेका चालकको खोजी तीव्र पारेर घटनाको अनुसन्धान सुरु गरिएको प्रहरीले जनाएको छ। त्यस्तै, मोरङको रंगेली नगरपालिका७ बक्राहा खोलास्थित रंगेलीविराटनगर सडकखण्डमा मोटरसाइकल दुर्घटना हुँदा १ जनाको मृत्यु भएको छ। पूर्वबाट पश्चिमतर्फ आउँदै गरेको को २३ प ७२४५ नम्बरको मोटरसाइकल आफैँ अनियन्त्रित भएर राति ९ बजेतिर दुर्घटनामा परेको हो। प्रहरीका अनुसार दुर्घटनामा परेर मोटरसाइकलको पछाडि सवार रंगेली८ दर्बेसाका अन्दाजी २७ वर्षीय रविन ऋषिदेवको मृत्यु भएको छ। गम्भीर घाइते भएका ऋषिदेवलाई उपचारका लागि रंगेली अस्पताल पुर्याउनसाथ चिकित्सकले मृत घोषित गरेका हुन्। दुर्घटनामा मोटरसाइकल चालक रंगेली६ का अन्दाजी ४० वर्षीय अजय मण्डल गम्भीर घाइते भएका छन्। उपचार सम्भव नभएको भनेर रंगेली अस्पतालले रेफर गरेपछि उनलाई थप उपचारका लागि विराटनगरको कोसी अस्पताल ल्याइएको छ। मोटरसाइकल चालकको साथमा सवारी चालक अनुमति पत्र (लाइसेन्स)लगायतका कागजात फेला नपरेको प्रहरीले जनाएको छ। तीव्र गतिका कारण मोटरसाइकल दुर्घटनामा परेको प्रहरीको प्रारम्भिक अनुसन्धानबाट खुलेको छ। यसैबीच, कोसी लोकमार्गअन्तर्गत सुनसरीको इटहरी उपमहानगरपालिका१२ मा मोटरसाइकल दुर्घटना हुँदा चालकको मृत्यु भएको छ। दक्षिणबाट उत्तरतर्फ जाँदै गरेको को १७ प ९०४ नम्बरको मोटरसाइकल अनियन्त्रित भएर दिउँसो २ बजेतिर दुर्घटनामा परेको थियो। प्रहरीका अनुसार उक्त दुर्घटनामा मोटरसाइकल चालक धनकुटाको साँगुरीगढी गाउँपालिका३ का अन्दाजी ३२ वर्षीय हेमचन्द्र लिम्बूको मृत्यु भएको छ। गम्भीर घाइते भएका लिम्बूको उपचारका क्रममा दिउँसो ४ बजेतिर मृत्यु भएको हो। दुर्घटनामा मोटरसाइकलको पछाडि सवार साँगुरीगढी३ का ३३ वर्षीय जितेन याख्खा घाइते भएका छन्। उनको बीपी कोइराला स्वास्थ्य विज्ञान प्रतिष्ठान धरानमा उपचार भइरहेको छ। मोटरसाइकलको तीव्र गतिका कारण दुर्घटना भएको प्रहरीको प्रारम्भिक अनुसन्धानबाट खुलेको छ।"
बाघलाई नियन्त्रणमा लिन विशेषज्ञसहितको टोली परिचालन,"महिलाईलाई आक्रमण गरी बेपत्ता बनाउने बाघलाई नियन्त्रणमा लिन विशेषज्ञसहितको टोली परिचालन भएको छ। बर्दिया : बेलौरी नगरपालिका८ पचुँइमा महिलाईलाई आक्रमण गरी बेपत्ता बनाउने बाघलाई नियन्त्रणमा लिनका लागि बर्दिया राष्ट्रिय निकुञ्जबाट विशेषज्ञसहितको टोली परिचालन भएको छ। निकुञ्जका डा दिनेश देवकोटासहितको पाँच जनाको टोली बाघलाई डार्ट(बेहोस) गर्नका लागि परिचालन भएको छ। बर्दिया निकुञ्जको टोलीसँगै शुक्लाफाँटा राष्ट्रिय निकुञ्जको टोली, नेपाल प्रहरी, सशस्त्र प्रहरी र सवडिभिजन वन कार्यालय कुण्डाको वन सुरक्षाकर्मीको टोली बाघ नियन्त्रण गर्नका लागि शुक्रबारदेखि नै परिचालन भएको छ। 'शुक्रबार नै बाघलाई नियन्त्रणमा लिनका लागि धेरै प्रयास गर्यौँ, राति भइसकेकाले डार्टन गर्न सकिएन', सवडिभिजन वन कार्यालय कुण्डाका प्रमुख दिनेशकुमार यादवले भने, 'अग्लो घाँस हुँदा बाघलाई नियन्त्रमा लिन गाह्रो भएको छ', दुई दुई मिटरको दूरीमा घेरा हालेर बाघलाई नियन्त्रणमा लिने प्रयास गर्दा पनि सफल हुन नसकेको उनले बताए। उनका अनुसार बाघ अहिले पनि सोही क्षेत्रमा देखिए पनि बेपत्ता महिला भने फेला पर्न सकिएको छैन। बाघ नियन्त्रण गर्नका लागि पुनः टोली केही छिनमै परिचालन हुन लागेको प्रमुख यादवले जानकारी गराए। शुक्रबार बिहान ९ बजे खेतमा घाँस काटदै गरेकी स्थानीय अन्दाजी ४५ वर्षीया गङ्गादेवी चन्दलाई बाघले आक्रमण गरी बेपत्ता बनाएको थियो। बाघले महिलालाई आक्रमण गरी लगेपछि खोजीका लागि प्रहरी, सशस्त्र प्रहरी र स्थानिय बासिन्दाले खोजीको तीव्र बनाए पनि महिलालाई अझै पनि फेला पार्न सकेका छैनन्। भारतीय दुधुवा नेशनल पार्कबाट बाघ नेपाली बस्तीमा पसेको बताइएको छ। सीमा क्षेत्रमा दिउँसै ओहरदोहर गर्दै आएको बाघले महिलालाई आक्रमण गरी बेपत्ता बनाएपछि यस क्षेत्रको जनजीवन त्रसित भएको छ। रासस"
"टोखामा आगलागी, पाँच सटर जलेर नष्ट","जिल्ला प्रहरी परिसर काठमाडौंका प्रवक्ता, प्रहरी उपरीक्षक सीताराम रिजालले मासु पोल्दा प्रयोग हुने आगोको झिल्को अन्य ठाउँमा फैलिँदा पाँच सटर आगलागी भएर नष्ट भएको राससलाई जानकारी दिए। काठमाडौं : काठमाडौंको टोखामा आगलागी हुँदा पाँच सटर जलेर नष्ट भएको छ । हिजो साँझ अन्दाजी ७ बजेतिर ग्राण्डी अस्पताल नजिक मासु पसलमा लागेको आगलागीले पाँच सटर जलेर नष्ट भएको हो । जिल्ला प्रहरी परिसर काठमाडौंका प्रवक्ता, प्रहरी उपरीक्षक सीताराम रिजालले मासु पोल्दा प्रयोग हुने आगोको झिल्को अन्य ठाउँमा फैलिँदा पाँच सटर आगलागी भएर नष्ट भएको राससलाई जानकारी दिए। नेपाल प्रहरी, सशस्त्र प्रहरी बल, दमकल र पानीको ट्याङ्करको सहायताले आगलागी नियन्त्रणमा आएको छ । रासस"
बागलुङमा डढेलोले ४५० हेक्टर वन सखाप,"बस्ती नजिकैका सामुदायिक तथा निजी आवादी वन क्षेत्र र सामुदायिक तथा राष्ट्रिय वनमा आगलागी भइरहेको डिभिजन वन अधिकृत मुकुन्दप्रसाद अधिकारीले बताए। बागलुङ : सुक्खायाम सुरु भएसँगै बागलुङको करिब चार सय ५० हेक्टर वन क्षेत्रमा आगलागी भएको छ । पाँच राष्ट्रिय र १७ सामुदायिक वनमा आगलागी भएको हो । गत माघ १८ गते पहिलो पटक जिल्लाको तमानखोला गाउँपालिकाको खुंखानीमा पर्ने हापली छहरा मठुरे राष्ट्रिय वनमा आगलागी भएको थियो । चार दिनसम्म फैलिएको आगलागीले दुई सय हेक्टर वन क्षेत्र मासेको डिभिजन वन कार्यालय बागलुङको तथ्याङ्क छ । गतमाघदेखि सुरु भएको आगलागीको शृङ्खला रोकिएको छैन । बस्ती नजिकैका सामुदायिक तथा निजी आवादी वन क्षेत्र र सामुदायिक तथा राष्ट्रिय वनमा आगलागी भइरहेको डिभिजन वन अधिकृत मुकुन्दप्रसाद अधिकारीले बताए। जानीजानी वा दुर्घटनावश बिहीबारसम्म बागलुङका २२ वनमा डढेलो लागेको तथ्याङ्क छ । केही तथ्याङ्क भने आउनै बाँकी छ । यस वर्ष सबैभन्दा धेरै आगलागी बागलुङ नगरपालिकाका वनमा भएको छ । बागलुङ नगरपालिकाका छ सामुदायिक वन र एक ठाउँमा राष्ट्रिय वन क्षेत्रमा आगलागी भएको हो । जैमिनी नगरपालिकाका पाँच, बडिगाडका तीन, काठेखोलाका दुई र तमानखोला, निसीखोला र बरेङ गाउँपालिका तथा ढोरपाटन नगरपालिकाको एकएक वनमा आगलागी भएको छ । जिल्लामा एक लाख पाँच हजार पाँच सय एक हेक्टर जमिनमा वन फैलिएको छ । जिल्लाभर पाँच सय २७ सामुदायिक वन ३३ हजार नौ सय नौ हेक्टरमा फैलिएका छन् भने, आठ दर्ता भएका निजी र बाँकी राष्ट्रिय वन क्षेत्र रहेको सहायक वन अधिकृत मदन कँडेलले बताए। गत वर्ष हिउँदमा वर्षा हुँदा बागलुङका वन क्षेत्रमा आगलागी भएको थिएन । एकाध वन क्षेत्रमा लागेको आगोसमेत समयमै स्थानीयले नियन्त्रणमा लिएका थिए । यस वर्ष हिउँद सुक्खा हुँदा अधिकांश वन क्षेत्र आगलागीको जोखिममा परेको वन अधिकृत अधिकारीले बताउनुभयो । वर्षा नभएसम्म बाँकी रहेका वन क्षेत्रसमेत आगलागीको जोखिममा छन् । 'गत वर्ष डढेलो नलागेकाले वनमा कुहिएका काठ र पात पतिङ्गर सङ्कलन भएर बसेका थिए', उनले भने, 'थुप्रो लागेका काठ, पात र झाडीका कारण यो वर्ष वन थप जोखिममा परे, आगलागी भएको ठाउँमा नियन्त्रण गर्न कठिन भयो ।' डढेलोको सम्भावित जोखिम भएका ठाउँमा सचेतनामूलक कार्यक्रम गर्ने, अग्निरेखा बनाउने तालिम, आगलागी भइहालेमा रोकथाम र नियन्त्रणका लागि सुरक्षा निकायलाई उपकरण उपलब्ध गराउनेलगायतका काम गरिएको उनले बताए। वनमा आगो लगाउनेलाई बिगो असुल, तीन वर्ष कैद सजाय, ६० हजार जरिवाना वा ती सबै सजाय हुने कानुनी व्यवस्था छ तर वनमा आगो लागउनेको पहिचान हुन सकेको छैन । जङ्गली जनावरबाट बच्न, वर्षायाममा मल हुने लोभलगायतका कारणबाट वनमा आगो लगाउने गरेको पाईन्छ । खरबारीमा डढेलो लगाएमा नयाँ घाँस राम्रो र बाक्लो पलाउँछ भनेर पनि आगो लगाउँदा नियन्त्रणभन्दा बाहिर गई क्षति हुने गरेको छ । वनजङ्गलमा आगलागी हुँदा बस्तीमा ल्याइएका पानीका पाइप पोलिएर कयौँ ठाउँमा खानेपानीको समस्या छ भने कतिपय जङ्गल क्षेत्रमा रहेका महत्वपूर्ण जडीबुटी जलेका छन् । रासस"
