शीर्षक,विवरण
गिट्ठा खोज्न जाने कि भोट हाल्न ?,"भोट हाल्नेभन्दा पनि परिवारमा छाक टार्ने पिरलो छ उनीहरूलाई। दुःख गरेर भोट हाले पनि आफूहरूको भोकमरी नटरेको उनीहरूको गुनासो छ। चितवन : ऊ त्यो पारिको स्कुलमा हो भोट हाल्न जाने ठाउँ। यहाँबाट त्यहाँ पुग्न दुई घण्टा हिँड्नु पर्छ। गरिबको छोरो, सधैं भोट हाल्यो सधैं भोको बस्नुपर्छ। सरकारै देखेको छैन, ९० वर्षका भोटेबहादुर प्रजा चेपाङले डाँडामा बसेर आफ्नो दुःखेसो यसरी सुनाए। डाँडापारिको स्कुल देखाउँदै त्यहाँसम्म पुग्नै अप्ठ्यारो भएको बताए। इच्छाकामना गाउँपालिका१ साप्रेनीको पारिपट्टिको गाउँ कोलभन्ज्याङ पुग्न दुई घण्टा लाग्छ। गत मंसिरमा भोट हाले। फेरि भोट हाल्न जाने कुराले उनी रिसाए पनि। इच्छाकामना गाउँपालिका१ स्थित साप्रेनीका चेपाङलाई भोट हाल्न दुई घण्टा हिँड्नु पर्छ। भोट हाल्नेभन्दा पनि परिवारमा छाक टार्ने पिरलो छ उनीहरूलाई। दुःख गरेर भोट हाले पनि आफूहरूको भोकमरी नटरेको उनीहरूको गुनासो छ। भोट दिने भन्यो सधैं भोको पेट बस्नुपर्छ। सरकारले गर्ने होला भन्यो सरकारै देखेको छैन, उनले भने, भोट हाल्न मन छ, तर खानेकुरा छैन। जंगलमा गिठ्ठा खोज्न जाने कि भोट हाल्न जाने ? उनी सधैं भोट हाल्छन् तर केही परिवर्तन नभएको गुनासो गर्छन्। चेपाङ गाउँमा खाद्यान्न अभाव छ। उनीहरू अहिले मकै गोड्न थालेका छन्। जेनतेन फलेको मकैले तीन महिना पनि पुग्दैन। अहिले छाक टार्ने पिरलो छ। जंगलमा गिट्ठा भ्याकुर खोज्ने कि भोट हाल्न जाने पिरलो छ। ६ महिना अनिकाल ६, महिना सहकाल छ। कुटो, कोदालो गर्ने हामीलाई चुनाव आएर के हुन्छ र ? ४० वर्षीय काजीमाया चेपाङले भनिन्, चुनाव हुन्छ भनेको सुनेको हो, नेताहरू आएको छैन। भोट खसाएर केही हुन्न झंै लाग्छ। एक छाक खान, एक सरो लाउन पनि सपना जस्तै हुन्छ हामीलाई। कतिपयले उम्मेदवार चिनेकै छैनन्। चुनावभन्दा पनि खाद्यान्नको जोहो गर्न चटारो छ। दुई छाक पेटभरि खान उनीहरूको क्षमताले भ्याउँदैन। चुनाव हुन्छ भन्ने सुनेको हो, भोट ठूलै होला तर हामीलाई त जसरी पनि बाँच्नु ठूलो हो, उनले भनिन्। काजीमायाका श्रीमान् नरबहादुर चेपाङ ५२ वर्षका भए। उनी हरेक पटक भोट हाल्छन्। तर, उनले आफूले खसालेको भोटले ल्याएको परिवर्तन कहिले अनुभूति गर्न पाएनन्। चेपाङका लागि छाक टार्नु नै ठूलो कुरा भएको छ। जित्नेले गरिबलाई राम्रो गर्छन् कि भन्ने आशाले भोट लगाउने हो, हामीलाई के गर्छन् होला भन्ने सोचेको छु। भोट सधैं हाले पनि केही भएको छैन, उनले भनिन्। उनलाई रोजगार पाए आम्दानी हुन्थ्यो भन्ने लागेको छ। चुनावै पिच्छे भोट हाल्दै आएका उनीजस्ता कैयौं चेपाङहरूको जीवनशैली कहिल्यै फेरिएन। चैत लागेपछि चेपाङको घरमा खाद्यान्न संकट सुरु भइसकेको चेपाङ अभियन्ता केपी किरण शर्माले बताए। उनीहरूका लागि पेट भर्ने ठूलो कुरा हो, उनले भने, चुनाव आउँछ जान्छ तर यिनीहरूका लागि कहिल्यै सुख आएन।"
शून्यको मूल्य अनन्त,"नेपालको कर्णालीवासीको जीवनको सूक्ष्म मनोचिकित्सा हो शून्यको मूल्य। ती मूल्यहरू डाक्टर नवराज कृत शून्यको मूल्य (सास, साहस र स्नेहको कथा) मा समेटिएको छ। यी कथाहरू सामाजिक अध्येताहरूको वा राज्यको नीति निर्माताहरूको आँखा, ज्ञान र अध्ययनबाट अझै बञ्चित छन्। यस कृतिमा भने कर्णालीका जनताको मूल्यमा शून्य जोडिएको होइन घटाइएको तितो यथार्थ समेटिएको छ। राज्यले आफ्नै देशका नागरिकको जीवनको अवमूल्यन कतिसम्म गरेको छ र त्यसको मूल्य कर्णालीवासीले कसरी चुकाइरहेका छन् ? सास, साहस र स्नेहको मूल्यमा कर्णालीका जनताले चुकाएको जीवनको मूल्य पोखिएको छ। सहरका ठूलाठूला विश्वविद्यालयहरूमा पठाइने किताबका पाना र ती पाना पठाउने आत्माहरू सहरमै छोडेर गाउँ पसेको डाक्टरलाई कर्णाली समाजको विश्वविद्यालयमा विद्यावारिधि गराइदिने कसले ? तर स्कुल कलेजका मोटामोटा किताबका अनुहार नै नदेखेका भए पनि जिन्दगीको पढाइमा भने जीवनवारिधि गरेकाहरूले डाक्टरको अपूरो विद्यावारिधिलाई पूर्णता दिलाए। डाक्टर केसीले लेखकीय मन्तव्य अर्थात् प्राक्थानमा प्रकट गरेका छन्, डाक्टरको अपूरो विद्यावारिधिलाई पूर्णता दिलाइदिने गुरुहरू पुतली आमा, भेडिनी कान्छी, नामै सोध्न भुलेको जुम्ल्याहाकी आमा, नामै नभएकी भुनभुनेकी आमा र बुधेकी फुपूआमा जस्ता धेरैधेरै जीवनवारिधि गरेका कर्णाली समाजका प्रोफेसरहरू थिए। वर्षौं लगाएर कर्णालीको सामाजिक विश्वविद्यालयभित्र गरेको जीवनवारिधिको यात्राको पुछारमा मात्र डाक्टरले हराएको आफूलाई, नदेखिएको आफ्नै समाजलाई र नभेटिएको देश साहित्य स्वैरकल्पना मात्र होइन। समाजको गति, प्रगति र ज्ञानको सीमाको दस्ताबेज पनि साहित्य हो। बालरोग विशेषज्ञ डा नवराज केसीको यस कृतिले लेखकीय कल्पनाशीलतामा होइन कि सामाजिक जीवनको यथार्थमा नै कल्पनातीत मिथक, बिम्ब, प्रतीक र पात्रहरूलाई बिर्साउने जीवन्त पात्रहरूसँग पाठकलाई साक्षात्कार गराएको छ। पाठकलाई लेखकले जन्माएका पात्रहरूको पृष्ठभूमि बुझ्न र खोज्न समाज बाहिर जानै पर्दैन। आफ्नै वरिपरिका त्यस्ता अनगिन्ती पात्रहरू पाठक वरिपरि जम्मा हुन्छन्। बुधेकी फुपूआमा, बुधे र उसको परिवेश जोडिएको समाजको कथा त हुँदै हो तर यो त्यति मात्र होइन। यो समाज विज्ञान, मनोविज्ञान र जीवन विज्ञान पनि हो। डाक्टर केसी पाठकहरूले पत्तै नपाउने गरी बुधेको कथामा जीवविज्ञान र मस्तिष्क विकासका चरणहरूका बारेमा कुराकानी गर्न थाल्छन्। कर्णालीको गरिबी, त्यहाँका महिला र बालबालिकाको स्वास्थ्य र जीवन, उच्च शिक्षा, वैदेशिक रोजगार, प्राकृतिक विपत्ति र विकासका कुराहरूको कहालिलाग्दो अवस्थाको वर्णन करिब ७० पेजको एउटा कथामा भन्न सकिने कुरा होइन। विकास योजनाका, समाज अध्ययनका वा अन्य विकासे परियोजनाहरूका लागि तयार परिएका रिपोर्ट ५ पेज पढ्दै पट्याएर लाग्ने पाठकहरूले यो ७० पेज लामो कथा एकपछि अर्को उत्सुकतासँग नै पढ्न सक्छन्। पढेर आफूले संसार बुझें भनेर जन्मदिने आफ्नी आमालाई अनपढ भन्ने विद्वानलाई डाक्टर केसी सम्झाउँदै लेख्छन्, हे विद्वान बाबु, यो कुरा पनि बुझ, एउटी आमाको गर्भले जानेको विज्ञान संसारका सारा वैज्ञानिक अनि कम्प्युटरभन्दा उत्कृष्ट छ। यसको कला कुनै कलाकारको कृतिभन्दा लाखौं गुणा सुन्दर छ। बुवालाई चिठी, अर्को कथाको शीर्षक हो। तर शीर्षक मात्र एउटा कथा र पात्र यति धेरै छन्, जहाँ एउटा समाज देखा पर्छ। घरेलु हिंसापीडित महिलाको सुरक्षाका लागि महिलाको गर्भमा भएको बच्चाले ती महिलाका श्रीमान् अर्थात् महिलाको गर्भमा रहेकै बच्चाका तर्फबाट आफ्ना पिताका लागि डाक्टरले लेखेर पठाएको चिठीका बारेमा धेरैले पढिसक्नु वा सुनिसक्नु भएको हुनसक्छ। तर त्यही कुरालाई डा केसीले बच्चा र आमाका बीचको जैविक सम्बन्ध, बच्चा जन्मनासाथ किन रुन्छ वा किन रुनुपर्छ जस्ता विज्ञानका कुराहरू पनि कर्णालीको गरिबीका कथाका पात्रहरूसँग जोडेका छन्। त्यसैले पनि उनका कथामा कर्णालीको गरिबी मात्र छैन। उनका कथाले मानवीय जीवनका सम्बन्ध, सकारात्मक वा प्रेरणादायी सन्देशहरू पनि प्रवाह गर्छन्। संसारका कुनै पनि बाआमा छोराछोरीबाट केही चिताउँदैनन्। तर छोराछोरीले माया गरिदिएको क्षण उनीहरूको स्वर्ग हो। मरेर कहाँ गइन्छ र ? मरेर त माटोमै जाने हो। यसभित्रको यो सन्दर्भ यो कुनै मेडिकल डाक्टरद्वारा तिनका बिरामीका लागि गरिएको औषधिको सिफारिसभन्दा महत्त्वपूर्ण छ। आमाको कोखबाट कुनै बच्चा जन्मेपछि त्यस बच्चाको आमासँगको सम्बन्ध कस्तो रहन्छ ? रगतको र ममताको सम्बन्ध त रहने नै भयो तर डा केसी कर्णालीको दुःखमा पनि आमा र सन्तानका बीचको जैविक सम्बन्ध पाठकलाई दिन्छन्। भेडिनी कान्छी, मृत्युपछिको जीवन, पुतली आमा यी थप तीन शीर्षकमा पनि समाज, राजनीति, बालबालिका, गरिबी, रोजगारी, महिला सामाजिक जीवनका सबै पक्षको मिहीन चर्चा छ। तर यो चर्चा पट्यारलाग्दो अर्ती उपदेशका रूपमा छैनन्। पाठकहरूका लागि कथा उपन्यासजस्ता आख्यानभित्रका रोचक सन्दर्भ बनेर आएका यी प्रसंग आकर्षक वा पठनीय र ग्रहणयोग्य पनि छन्। कर्णालीका हेलिकप्टर काठमाडौंका सडकमा गुड्ने तीनपाङ्ग्रे टेम्पोजस्तै भएको अनुभव अढाई दशक पहिलेको यही पंक्तिकारको अनुभव डाक्टर केसीको पनि रहेछ। राज्यले नागरिकको स्वास्थ्यमा गर्ने लगानीको मात्रा, रोगी एकातिर औषधि र खर्च अर्कातिर, गर्भवती महिलाको स्वास्थ्य र प्रसूति सेवा, हिम्मतबहादुरको कथा, भेडिनी कान्छीको बाल मनोविज्ञान, खरायोको मातृत्व प्रेम, हजुरआमा र आमाहरूको आर्थिक योगदान, महिलाहरूको शरीर विकासमा हर्माेन आदिको विकासको सम्बन्ध, मानसिक, शारीरिक तथा आध्यात्मिक स्वास्थ्य, भेडिनी कान्छीको तीनखुट्टे भेडीसँगको मितिनी साइनोको आत्मीयता, पटुकी बैंक, मृत्युको क्षण पहिलेको मानिसको दिमागी प्रक्रिया आदि यस्ता कति धेरै सन्दर्भहरू छन् जसले पाठकहरूको मन मस्तिष्क छुन्छ। कर्किनी बज्यैसँगको कवितामय संवाद र उनको आतिथ्य, तिनका जीवनकथा यस्तो लाग्छ कर्णाली नदी यति घुमेको छ कि कहिलेकाहीं लाग्छ, यो नदी आफैंलाई रिंगटा लाग्दो हो। कोमल मुटु बोकेको मान्छेहरूलाई ढुंगाभन्दा पनि कठोर परिस्थितिहरूले साँच्चिकै ढुंगाको मूर्ति बनाउँदो रहेछ। डा केसीको यो अनुभूति पुतली आमाको यो कथनमा वास्तविक झैं लाग्छ, बनापैसा बचेको, अलिकति बचेको सास बच्छ कि भनेर आस खोज्दै आएकी हुँ बाबु ? भलो होला त ? एकजना बिरामीका आफन्तबाट यो कुरा सुनेर सायद निःशब्द बनेका डाक्टर सोच्छन्, पैसा सकियो, सास सकिएको छैन बिरामीको। यो कस्तो वचन थियो। यो वाक्यको अर्थ के होला ? भाव बुझें झैं वा बुझ्नै नसके झैं। दुनियाँमा एउटा वाक्यको किताब पनि बन्छ होला। पहाड जत्रा शब्द। सागर जस्तो भाव। एउटा वाक्य आज डाक्टरका लागि पाठशाला बनेको थियो। अब यो बुझ्नलाई उसलाई यो जुनी लाग्नेछ। स्वदेश र विदेशका कुनै पनि युनिभर्सिटीमा नबुझेको कुरा डाक्टरलाई कर्णालीको समाजले बुझाउँछ। कृतिमा कथा छ, कथामा डाक्टर छन् र पात्रहरू छन्। प्रचलित आख्यान वा काव्यलाई बिर्साउने यस कृतिलाई सिर्जनात्मक गैराख्यान भनिएको छ सांग्रिला प्रकाशनको प्रेस लाइनमा। कथा र कथाका पात्र वा भूगोलको धेरै नालीबेली लगाउँदा पाठकका लागि कृति बेस्वादिलो बन्न सक्छ। स्वादु व्यञ्जनलाई धेरै गिजोलेर बेस्वादिलो बनाउनु पनि त भएन नि ? डाक्टर नवराज केसीको नेपाली समाजको मनोविज्ञानको उत्खनन हामी पाठकका लागि मन छुने दुःखद् कथा मात्र होइन, हाम्रा नीति निर्माता वा राज्यका लागि आँखा र प्रेरणा पनि बनुन्। महाकवि लक्ष्मीप्रसाद देवकोटाको कथन छ, शून्यबाट सुरु भएर शून्यमा नै अन्त्य। तर डाक्टर केसीको प्रिप्किसन छ, शून्यबाट दस। तर शून्यको मूल्यमा शून्यको मानक वा गणनाले होइन, जीवनको त्यो सार जुन महाकवि देवकोटाले बोध गरेका थिए मृत्यु शय्यामा, त्यो बोध जीवनकालमै गरेका डाक्टर केसीले पाठकहरूलाई पनि त्यही बोध गराउन प्रयास गरेको कृति हो (शून्यको मूल्य (सास, साहस र स्नेहको कथा)। न भक्ति भो न भावआखिर रहेछ श्रीकृष्ण एकशून्यमा शून्य सरि बिलाएँ म। (महाकवि, देवकोटा)"
