शीर्षक,विवरण
'आस्थाको आसन बाट कानुनको कठघरातर्फ,"पछि सिन्धुपाल्चोकको इन्द्रावती६, बाँडेगाउँस्थित तोड्के जंगलमा पनि आश्रम बनाए, जहाँ प्रहरीले २०७६ पुसमा छापा मारेको थियो । त्यहाँ बेपत्तामध्येका मकवानपुरका सञ्चलालको हत्या गरेको प्रहरीको आशंका थियो । करिब ८० रोपनीको आश्रम भित्र एक स्थानमा कमलो माटो भेटेर उत्खनन गर्दा ९ वटा नुनको प्याकेट फेला पारिएको थियो । शव गलाउन नुनको प्रयोग गरिएको हुन सक्ने आशंका गरे पनि पुष्टि हुने थप प्रमाण फेला पर्न सकेको थिएन । त्यस्तै उजुरी सिन्धुलीमा पनि थियो । आश्रमका आनीहरूमाथि यौन हिंसा गरेको, बेपत्ता पारेको र हत्या गरेको भन्दै किटानी जाहेरी परेको थियो । जाहेरीपछि २०७६ सालमा उनी फरार भए । प्रहरीले उनलाई पक्राउ गर्न बारा, सिन्धुली, सिन्धुपाल्चोक, लमजुङका आश्रमहरूमा छापासमेत मारेको थियो । तर, उनी प्रहरीलाई छक्याउँदै, लुक्दै हिँड्न सफल भइरहे । बम्जनले चार अनुयायीलाई आश्रमबाटै बेपत्ता पारेको भनी उनीविरुद्ध विभिन्न प्रहरी कार्यालयमा उजुरी परेको छ । चुन्मो भन्ने चिनीमाया तामाङ, डोल्मो भन्ने फूलमाया रुम्बा, सञ्चलाल वाइबा र सुरेशकुमार आले आश्रमबाट बेपत्ता भएकाले खोजतलास गरी पाऊँ भन्दै परिवारका सदस्यले उजुरी गरेका छन् । नुवाकोटकी २९ वर्षीया चुन्मो २०६९ असोजदेखि, मकवानपुरकी ३० वर्षीया डोल्मो २०७१ माघदेखि, मकवानपुरकै ५१ वर्षीय सञ्चलाल २०७१ चैतदेखि र बाराका ३४ वर्षीय सुरेश २०७२ जेठदेखि बेपत्ता छन् । चुन्मो, डोल्मो र सञ्चलाल सिन्धुपाल्चोकको बाँडेगाउँ आश्रमबाट र सुरेश बारा निजगढस्थित आश्रमबाट बेपत्ता भएका थिए । बम्जनलाई बोधी श्रवण धर्म संघ र नमो तपोवन संरक्षण तथा संवर्द्धन समितिका स्वयंसेवकले सुरक्षा दिने गरेका थिए । २०६९ मा संघकै पदाधिकारीले सिन्धुपाल्चोककी एक आनी र एक विदेशी नागरिकलाई तीन महिनासम्म बन्धक बनाएको आरोप लागेको थियो । बम्जनले बाराको हलखोरियामा राष्ट्रिय वन अतिक्रमण गरेर गुम्बा बनाएको आरोपसमेत लागेको थियो । जिल्ला वन कार्यालय र स्थानीय प्रशासनले बम्जनलाई वन क्षेत्रमा प्रवेशमै रोकसमेत लगाएको थियो । पछि उच्च अदालत, हेटौंडाले अन्तिम फैसला नहुन्जेल बम्जनलाई नरोक्नू भन्ने आदेश दिएको थियो । त्यसपछि उनी पुनः हलखोरियाको वनमा बस्न थालेका थिए । पछि वन मन्त्रालयले २०७० मा हलखोरिया वन क्षेत्रमा कुनै पनि निर्माण र उपभोग गर्न नदिने निर्णय गरेको थियो । मन्त्रालयको उक्त निर्णयविरुद्ध बम्जनका अनुयायीले आन्दोलनसमेत गरेका थिए । तर, स्थानीय प्रशासनले वनभित्र बनाइएको भौतिक संरचना भत्काइदिएपछि उनी सिन्धुली पुगेका थिए । भागम्भाग गर्दै आएका उनी अनुसन्धान व्यवस्थित भएपछि चार वर्षदेखि भने फरार थिए । तर, मंगलबार साँझ नेपाल प्रहरीको केन्द्रीय अनुसन्धान ब्युरो (सीआईबी) ले उनलाई काठमाडौंको बूढानीलकण्ठस्थित एउटा बिलासी घरबाट पक्राउ गरेको हो । उनको निवासबाट ३ करोड ३४ लाख ३७ हजार ९ सय ६ रुपैयाँ बरामद भएको छ । यस्तै अमेरिका, अस्ट्रेलिया, भारत, चीन, क्यानडा, डेनमार्क, इन्डोनेसियालगायत १७ देशका ३० लाख ९२ हजार ४ सय ६ रुपैयाँ बराबरको मुद्रा पनि बरामद भएको थियो । ५ करोडमा सेतो रङको ल्यान्ड क्रुजर गाडी किन्ने तरखरमा रहेका बम्जनले धुम्बाराहीस्थित युनाइटेड ट्रेडर्स सिन्डिकेट सोरुमलाई ३ करोड रुपैयाँ नगद बैनासमेत गरिसकेको अनुसन्धान अधिकारीहरूले बताएका छन् । हाल भने उनी तुलाराम तामाङका नाममा रहेको प्रदेश३०१ ०२४ च ६७२९ नम्बरको सेतो रङको टोयोटा फर्चॅनर चढ्थे । अरू चार वटा मोटरसाइकल प्रयोग गर्थे । प्रहरीले बम्जनबाट गाडीको चाबी, १४ वटा मोबाइल, ५ वटा आइप्याड र ट्याब, तीन वटा मोटरसाइकलका बिलबुक, २ वटा ल्यापटप, २० वटा पेनड्राइभ, एउटा भ्वाइस रेकर्डर र २ वटा मेमोरी कार्ड पनि बरामद गरेको छ । उनका थप सम्पत्ति विवरणबारे विस्तृत अनुसन्धान भइरहेको सीआईबीले जनाएको छ । यो कहाँबाट आयो, कसरी आयो, के स्रोत हो भन्ने अनुसन्धान हुँदै छ तर अवश्य पनि यति ठूलो पैसा घरमा राख्नु सामान्य मान्न सकिँदैन, पत्रकार सम्मेलनमा प्रहरी अधिकारीले भने । बाल यौन दुराचार मुद्दामा फरार भएकाले बुधबार नै उनलाई सर्लाही लगिएको छ । बिहीबार सर्लाही अदालतमा उपस्थित गराइने सीआईबीका प्रवक्ता नवराज अधिकारीले बताए । अवैध रूपमा विदेशी तथा नेपाली मुद्रा राखेको लगायत अन्य आरोपमा अनुसन्धानपछि थप मुद्दा चलाइने प्रहरीको भनाइ छ ।बम्जनले बाराको हलखोरियास्थित आश्रममा रहेकी आनीलाई २०७१ साउनमा बलात्कार गरेको मुद्दा जिल्ला अदालत सर्लाहीमा परेको थियो । सर्लाही अदालतले २०७६ माघ २३ मा पक्राउ पुर्जी जारी गरेपछि उनी फरार भएका थिए । काठमाडौं, सिन्धुपाल्चोक, सिन्धुली, मकवानपुर र बाराका प्रहरीको सूचीमा पनि बम्जन फरार अभियुक्त थिए ।प्रहरीका अनुसार दुई महिनादेखि श्रीमती र दुई सन्तानसहित बूढानीलकण्ठमा बस्दै आएका थिए । पक्राउ गर्न प्रहरी घरमा छिरेपछि हाम फालेर भाग्ने प्रयास गरेका थिए । यसपालिको अपरेसन धेरै व्यवस्थित थियो, त्यसैले सफल भयो, सीआईबीकी प्रमुख एआईजी किरण बज्राचार्यले भनिन्, पहिलाका अपरेसनहरू अलि सार्वजनिक हुन्थे, अनुयायी र विभिन्न माध्यमबाट उसले आफूलाई हाइड गर्थ्यो । यो अनुसन्धानलाई ब्युरोले अपरेसन ब्लु भनेको छ ।"
मन्त्रिपरिषद्ले निर्णय गरे पनि २३ उद्योगमा जोडिएन बिजुली,"मन्त्रिपरिषद्को निर्णय र प्राधिकरणलाई मन्त्रालयको पत्राचार बिहीबार पुग्छ, उनले भने, बिहीबार नै उद्योगको लाइन जडान हुन्छ । डेडिकेटेड र ट्रंकलाइनको बक्यौताको सन्दर्भमा सरकारले नै रोक्ने र खोल्ने गरेको छ । ०७६ मा डेडिकेटेड र ट्रंकलाइनको बक्यौता उठाउन प्राधिकरणले लाइन काटेको थियो । ०७६ सालमा लाइन काट्दा अर्थमन्त्री, उद्योगमन्त्री, ऊर्जा मन्त्रालयका मन्त्री तथा सचिवसहितको समूहले माइन्युट गरेर लाइन जोड्न लगाइएको थियो । यस पटक पनि सरकारले काट्न निर्देशन दिने, रोक्ने काम निरन्तर गरिरहेको छ ।काटिएको उद्योगमा हालसम्म बिजुली नजोडिएको नेपाल सिमेन्ट उद्योग संघका अध्यक्ष ध्रुव थापाले बताए । सरकारले हिजै न्यायिक आयोग बनाउने र लाइन जोड्ने निर्णय गरेको थियो तर अहिलेसम्म लाइन जोडिएको छैन, उनले भने, सम्बन्धित वितरण केन्द्रमा बुझ्दा लिखित निर्देशन नआएसम्म बिजुली जोड्न मिल्दैन भन्ने जानकारी दियो । ऊर्जा मन्त्रालयका प्रवक्ता नवीनराज सिंहले पनि बुधबार मध्याह्नसम्म मन्त्रालयमा पत्र नआइसकेको प्रस्ट्याए । उत्पादन ठप्प र हजारौं मजदुर बेरोजगार हुँदा पनि सरकार यसतर्फ संवेदनशील नदेखिएको नेपाल उद्योग वाणिज्य महासंघका पूर्वअध्यक्ष पशुपति मुरारकाले बताए । सरकारकै प्रवक्ताले लाइन जोड्ने, आयोग गठन गर्ने बोलिसके तर २६ घण्टा बित्दासम्म लाइन जोडिएको छैन, उनले भने, सरकारकै निर्णय कार्यान्वयनमा पनि अन्योल देखियो । गत भदौ २५ मा पनि महासंघका अध्यक्ष चन्द्र ढकालको नेतृत्वमा गएका उद्योगीको टोलीले प्रधानमन्त्री दाहाललाई भेटेपछि लाइन नकाट्न निर्देशन भएको थियो । तर पुस ५ मा प्रधानमन्त्री दाहालले नै बिजुली काटेर भए पनि बक्यौता उठाउन निर्देशन दिएपछि प्राधिकरणले पुस ६ देखि लाइन काट्न सुरु गरेको थियो । हालसम्म २४ वटा उद्योगको लाइन काटिएकामा हिमाल आइरन एन्ड स्टिलले बक्यौताबापत पहिलो किस्ता तिरेर लाइन जोडेको थियो । टीओडी मिटरका आधारमा तिर्नुपर्ने रकम तिर्न तयार रहेको उद्योगीहरूले बताउँदै आएका छन् । प्राधिकरणले भने केही उद्योगको टीओडी मिटरको तथ्यांक नभए पनि लगसिट र एम्पावर सफ्टवेयरमा तथ्यांक सुरक्षित रहेको बताउँदै आएका छन् । प्राधिकरणका अनुसार ६१ वटा उद्योगको २२ अर्ब २४ करोड रुपैयाँ बक्यौता छ । आयोग गठन गर्ने र काटिएका उद्योगमा बिजुली जोड्ने सरकारको निर्णयलाई निजी क्षेत्रले स्वागत गरेको छ । नेपाल उद्योग वाणिज्य महासंघ र नेपाल चेम्बर अफ कमर्सले सरकारले न्यायिक आयोग गठन गरी तत्काल लाइन जोड्न विद्युत् प्राधिकरणलाई निर्देशन दिएको निर्णयको स्वागत गरेको हो । बुधबार विज्ञप्ति जारी गर्दै महासंघ र चेम्बरले तत्काल लाइन जोडी यससम्बन्धी विवाद निरूपणका लागि न्यायिक आयोग गठन गर्न माग गरेबमोजिम नै सरकारको न्यायिक आयोग गठन गर्ने निर्णयको स्वागत गरेको छ । आयोगले विगतमा भएका अध्ययन, अहिलेको अवस्था, बिजुली उपभोग गरेको प्रमाण आदिको अध्ययन गरी निष्पक्ष समाधानको राय दिने महासंघले जनाएको छ । लोडसेडिङको समयमा केही उद्योगमा जडित डेडिकेटेड र ट्रंकलाइन विद्युत् महसुलबारे विद्युत् प्राधिकरण र उद्योगीबीच मतभिन्नता हुँदा यसले समग्र लगानी र व्यवसायमैत्री वातावरणमा असर गर्ने देखिएको थियो, ढिलै भए पनि समस्या समाधान हुनेमा विश्वस्त छौं, विज्ञप्तिमा भनिएको छ ।उद्योगी व्यवसायीले भने यो विवादित विषय भएको भन्दै महसुल नतिर्ने अडान राख्दै आएका छन् । डेडिकेटेड र ट्रंकलाइनको बक्यौता विवाद ०७५ वैशाखबाट लोडसेडिङ अन्त्य भएपछि चर्किएको हो । लोडसेडिङका समयमा डेडिकेटेड र ट्रंकलाइनबाट विद्युत् जडान गरी पाऊँ भनी प्राधिकरणमा निवेदन नै नदिएको तर प्राधिकरणले पछि अतिरिक्त महसुलको बिल काटेको भन्दै उद्योगीहरू रकम नतिर्ने अडानमा छन् । लोडसेडिङ अन्त्यपछि पनि डेडिकेटेड र ट्रंकलाइन शीर्षकमा विद्युत् उपयोग गरेको भनी ६७ प्रतिशत महँगो बिल प्राधिकरणले पठाएको भन्दै उद्योगीले यो विवादित विषय भएको र समस्या समाधान गरिदिन सरकारसमक्ष निरन्तर अनुरोध गरिरहेका छन् ।"
