शीर्षक,विवरण
वैदेशिक सहायता नीतिका आधार,"संविधान मूल कानुन भएकाले राज्यका सबै अंग, निकाय र अधिकारीले संविधानले तय गरेका आधार, तोकेका सीमा र अपेक्षा गरेका विषयवस्तुको सम्बोधन हुने गरी मात्र कानुन र नीति निर्माणको कार्यान्वयन गर्नुपर्छ। वैदेशिक सहायताका निम्ति वार्ता वा सन्धिसम्झौता गर्दासमेत संविधानको सीमा नाघ्न मिल्दैन। संविधानले तय गरेका अन्तर्राष्ट्रिय सम्बन्धका विषयमा नेपालको अडान संविधानअनुकूल हुनुपर्छ। संविधानविपरीत हुने गरी पूर्णाधिकार दिन मिल्दैन र सन्धिसम्झौतामा त्यस्ता सर्त भए, त्यस्ता प्रावधान आरक्षित नराखी नेपालले हस्ताक्षर मिल्दैन। संवैधानिक प्रावधान १ संविधानको धारा ५९(१) अनुसार संघ, प्रदेश र स्थानीय तहले आफ्नो अधिकार क्षेत्रभित्रको आर्थिक विषयमा कानुन र बजेट बनाउन, निर्णय गर्न, नीति र योजना तयार गर्दा संविधानअनुकूल हुने गरी बनाउनुपर्छ। २ संविधानको धारा ५९(६) मा वैदेशिक सहायता र ऋण लिने अधिकार नेपाल सरकारको हुने व्यवस्था भएकाले प्रदेश र स्थानीय तहले यो अधिकारको प्रयोग गर्न सक्दैनन्। नेपाल सरकारले पनि त्यस्तो सहायता वा ऋण लिँदा देशको समष्टिगत आर्थिक स्थायित्व हुने गरी लिनुपर्छ। ३ संविधानको धारा ६० मा संघीय एकाइहरूबीच राजस्व बाँडफाँटसम्बन्धी व्यवस्था छ। यस धाराको प्रयोजनका लागि वैदेशिक सहायता राजस्व होइन। त्यसैले वैदेशिक सहायता नेपाल सरकारको अधिकारको विषय देखिन्छ। अर्थात् कस्ता, कुन दाताबाट के, कुन, कस्तो सहयोग कुन सर्तमा कति लिने र के, कस्तो, कुन, कति सहयोग नलिने भन्ने नेपाल सरकारले तय गर्ने हो। ऋणको सीमाबारे विधायिकी नियन्त्रण भने रहन्छ। साथै विधायिकाले वैदशिक सहयोगबारे निर्देशन गरेको हुन सक्छ, तर वैदेशिक सहयोगको प्रयोग भने संविधानले अपेक्षा गरेका विषयमा गर्नुपर्छ। ४ संविधानको धारा २७८ ले सन्धिसम्झौता सम्पन्न गर्ने अधिकार संघमा निहित रहने व्यवस्था गरेको छ। प्रदेशको अधिकारको सूचीमा परेको विषयमा सन्धि वा सम्झौता गर्दा नेपाल सरकारले सम्बन्धित प्रदेशसँग परामर्श गर्नुपर्छ। साथै यस धाराअनुसार प्रदेश मन्त्रिपरिषद्ले नेपाल सरकारको सहमति लिई आर्थिक तथा औद्योगिक विषयमा करारजन्य सम्झौता गर्न भने सक्छ। करारजन्य सम्झौता भनेको मूलतः नेपाल सरकारले सन्धि वा सम्झौता गरेपछि त्यसको कार्यान्वयनको लागि गरिने व्यक्तिव्यक्तिबीच हुनसक्ने प्रकृतिको व्यापारिक वा व्यावसायिक करार हो। ५ संविधानको धारा २७९ अनुसार कुनै पनि सन्धिसम्झौताको पक्ष नेपाल राज्य र नेपाल सरकार मात्र हुन सक्छ। यहाँ नेपाल राज्य भनेको बोलीचालीमा राज्य भनिने प्रदेश होइन। ६ संविधानका धाराहरूमा प्रदेश सरकारले वैदेशिक सहायता लिन पाउने वा त्यसका लागि संघको सहमति लिई वा नलिई आग्रह वा अनुरोध गर्न सक्ने भन्ने उल्लेख छैन। तर अनुसूची ६ (प्रदेशको अधिकारको सूची) को क्रमांक २ को अन्त्यमा केन्द्रको सहमतिमा वैदेशिक अनुदान र सहयोग भन्ने लबज परेको छ। संविधानमा अन्यत्र केन्द्र भन्ने शब्द परेको छैन। केन्द्र शब्द संविधानमा परिभाषित पनि छैन। अनुसूची ६ को यो व्यवस्था संविधानको पेटबोलीअनुकूल देखिँदैन। पेटबोलीको भावनाविपरीत अनुसूचीमा व्यवस्था गर्नु मसौदाको हडबडी र गडबडी हो। अनुसूची पेटबोलीसँग बाझिए अनुसूची मान्य नहुने कानुन व्याख्याको मान्यता छ। यसको निक्र्योल न्यायिक उपायबाट होला। ७ संविधानको धारा ५१(घ)(११) मा वैदेशिक सहायताबाट प्राप्त रकम राष्ट्रिय बजेटमा समाहित गर्नैपर्ने उल्लेख छ। राष्ट्रिय बजेट भनेको संघीय वा नेपाल सरकारले संसद्मा पेस गर्ने बजेट हुँदा प्रदेशले सम्झौता गरे पनि सो रकम राष्ट्रिय बजेटमा समाहित हुनैपर्ने देखिन्छ। ८ संविधानको धारा ५९(६) ले वैदेशिक सहायता र ऋण लिने अधिकार नेपाल सरकारको हुने व्यवस्था गरेको छ, तर अनुसूची ६ मा अनुदान र सहयोग को कुरा छ। अनुसूचीको यो व्यवस्थाले प्रदेशले केन्द्रको सहमतिमा सम्झौता नै गर्ने अधिकार दिएको हो वा अनुदान र सहयोग प्राप्त गर्न सहमति लिई सम्झौताको लागि केन्द्रलाई अनुरोध गर्ने व्यवस्था गरेको हो भन्ने कुरा पनि स्पस्ट गर्दैन। जे होस्, अनुसूची ६ मा ऋण शब्दको प्रयोग नहुँदा वैदेशिक ऋण सम्बन्धमा प्रदेशको कुनै अधिकार छैन। ९ स्थानीय तहको अधिकारको सूची रहेको अनुसूची ८ मा अनुसूची ६ को क्रमांक २ को जस्तो व्यवस्था नभएकाले वैदेशिक सहायता सम्बन्धमा स्थानीय तहले सम्झौता गर्न वा सहमति माग्न सक्दैनन्। १० संविधानको धारा ५१(घ)(१०) मा राष्ट्रिय हितअनुकूल आयात प्रतिस्थापन, निर्यात प्रवद्र्धनका क्षेत्रमा वैदेशिक पुँजी तथा प्रविधि लगानीलाई आकर्षित गर्दै पूर्वाधार विकासमा प्रोत्साहन एवं परिचालन गर्ने भन्ने व्यवस्था छ। यो व्यवस्था मूलतः वैदेशिक निजी लगानीसँग सम्बन्धित देखिन्छ। ११ धारा ५१(घ)(१०) मा वैदेशिक सहायता लिँदा राष्ट्रिय आवश्यकता र प्राथमिकतालाई आधार बनाउँदै यसलाई पारदर्शी बनाउने र वैदेशिक सहायताबाट प्राप्त रकम राष्ट्रिय बजेटमा समाहित गर्ने भन्ने व्यहोरा उल्लेख छ। यो प्रावधानले अब उप्रान्त नेपालले राष्ट्रिय आवश्यकता र प्राथमिकता तय गर्नुपर्ने, वैदेशिक सहायता यस्ता क्षेत्रबाहेक अन्यत्र प्रयोग र परिचालन गर्न नसकिने र वैदेशिक सहायताबाट प्राप्त रकम राष्ट्रिय बजेटमा समाहित हुनुपर्ने व्यवस्था गरेको छ। स्मरण रहोस्, अन्तरसरकारी वित्त व्यवस्थापन ऐन, २०७४ मा राष्ट्रिय आवश्यकता र प्राथमिकता तय गरिएको छ। १२ संविधानको धारा ५१ (ञ) (१४) मा अन्तर्राष्ट्रिय गैरसरकारी संघसंस्थाको लगानी र भूमिकालाई जवाफदेही र पारदर्शी बनाउँदै त्यस्ता संस्थाको स्थापना, स्वीकृति, सञ्चालन, नियमन र व्यवस्थापनका लागि एक द्वार प्रणाली अपनाउने र राष्ट्रिय आवश्यकता र प्राथमिकताका क्षेत्रमा मात्र त्यस्ता संस्थाहरूलाई संलग्न गराउने भन्ने व्यवस्था रहेको छ। अन्तर्राष्ट्रिय गैरसरकारी संस्था भनेका विदेशी गैरसरकारी संस्था हुन्। अब ती संस्था जवाफदेही र पारदर्शी भएमा र नियमनको सीमाभित्र बसेमा मात्र तिनको भूमिका रहन सक्छ। यी संस्था निजी उद्यमीजस्ता लगानीकर्ता कदापि होइनन्। लगानीकर्ता हुन् भने यी नाफामूलक हुन्। यी विदेशी संस्थालाई अब उप्रान्त राष्ट्रिय आवश्यकता र प्राथमिकताको क्षेत्रमा मात्र भूमिका दिन सकिन्छ। यी संस्था विदेशी हुँदा यिनलाई नेपालमा नागरिकसरहको अधिकार हुँदैन। अब यी विदेशी संस्थालाई सीधै परियोजना सञ्चालन गर्न दिन मिल्दैन। यिनले गर्ने सहयोग स्वदेशी राजस्व होइन। त्यो विदेशी सहायता भएकाले तिनले परिचालन गर्न चाहेको रकम पनि राष्ट्रिय बजेटमा समाहित हुनुपर्छ। अब यी संस्थालाई समानान्तर सरकारजस्तो गरी काम गर्न दिन नहुने संविधानको आशय प्रस्ट देखिन्छ। १३ विदेशी गैरसरकारी संस्था र त्यसमा कार्यरत विदेशी नागरिकले नेपालको सभ्यता, संस्कृति, सामाजिक सद्भावविपरीत तथा आफ्नो आस्था र विश्वासको प्रचार गर्ने वा नेपालीको आस्था र विश्वास परिवर्तन गराउने काममा खर्च गर्न र भूमिका खेल्न मिल्दैन। किनकि संविधानको धारा २६ ले कसैले पनि कसैको धर्म परिवर्तन गराउन नपाउने र त्यसो गराउनु अपराध हुने व्यवस्था गरेको छ। नेपालमा दर्ता रहेका र काम गरिरहेका विदेशी गैरसरकारी संस्थाका मूल अभिलेख, तिनका क्रियाकलाप, तिनले उठाएको र खर्च गरेको रकम र त्यो रकमका प्रापकको प्रकृति र प्रवृति पारदर्शी हुनुपर्छ। यसका लागि सूचनाको हकसम्बन्धी कानुनमा सुधार जरुरी छ। यी संस्थाको नियमनका लागि यी संस्था र यिनमा काम गर्ने व्यक्तिको कामकारबाहीमाथि निगरानी गर्न सुरक्षा निकायमा छुट्टै संयन्त्रको व्यवस्था गर्नुपर्ने देखिन्छ। किनकि यी संस्थालाई देशको सभ्यता, संस्कृति र सद्भाव खल्बलाउने अधिकार हुँदैन। १४ संविधानको धारा ५१(ञ)(१४) को व्यवस्थालाई यथाशीघ्र कार्यान्वयन गर्न विदेशी गैरसरकारी संस्था (नियमन, व्यवस्थापन र नियन्त्रण) ऐन तुरुन्त बनाउन जरुरी छ। १५ नेपालको संविधानले वैदेशिक सहायता राष्ट्रिय बजेटमा समाहित हुने व्यवस्था गरेकाले दूतावास, राष्ट्रसंघीय निकाय वा अन्य कुनै विदेशी संस्थाले नेपालमा सीधै परियोजना सञ्चालन गर्न वा रकम दिन सक्दैन। अब त्यसो गर्नु र गर्न दिनु संविधानको उल्लंघन हुन्छ। संविधानको धारा ५१(ड)(२) मा विगतमा भएका सन्धिहरूको पुनरावलोकन गर्दै समानता र पारस्परिक हितका आधारमा सन्धिसम्झौता गर्ने कुरा उल्लेख छ। त्यस्ता सन्धिसम्झौता छन् भने पुनरावलोकन गर्नुपर्छ। १६ संविधानको धारा ५०(३) ले सार्वजनिक, निजी र सहकारी क्षेत्रको सहभागिता र विकासमार्फत राष्ट्रिय अर्थतन्त्रलाई आत्मनिर्भर, स्वतन्त्र र उन्नतशील बनाउने उद्देश्य राखेको छ। सधैं दाता र विदेशी संस्थाको मुख ताकेर बस्न नहुने आशय संविधानको छ। त्यसैले सानातिना कुरामा विदेशीको मुख ताक्न तत्काल बन्द गर्न संविधानले राष्ट्रिय आवश्यकता र प्राथमिकता तय गरी त्यसमा मात्र वैदेशिक सहयोग लिन सकिने व्यवस्था गरेको हो। यसका लागि फजुल खर्च र भ्रष्टाचार नियन्त्रण तत्काल आवश्यक छ। १७ विदेशी खर्चिला परामर्शदाताबाट निजात पाउन धारा ५१(क)(७) ले अवकाशप्राप्त राष्ट्रसेवकको ज्ञान, सीप र अनुभवलाई उपयोग गर्नुपर्ने बताएको छ। आफ्नो मुलुकमा राम्रो मौका पाउन अयोग्यलाई विमानस्थलमा उत्रनेबित्तिकै नेपालविद् मान्ने तर यहाँ विभिन्न क्षेत्रमा वर्षौं काम गरेकालाई सोधपुछ नगर्ने चलनको अन्त्य गर्नु यो व्यवस्थाको आशय देखिन्छ। नेपाली नागरिकको क्षमता नभएको क्षेत्रमा बाहेक अब विदेशी परामर्शदाता नियुक्त गर्नु हुँदैन। साथै नेपालस्थित विदेशी र अन्तर्राष्ट्रिय संस्थामा बसेर कानुन, नीति र पाठ्यक्रम बनाउँदा आफ्नो मूल्य प्रणाली लाद्न र नेपालको सभ्यता, संस्कृति र सामाजिक सद्भाव बिथोल्न उद्यत् परामर्शदातालाई पनि मौका दिनु हुँदैन। १८ संविधानको धारा ५१(घ) ८ मा राष्ट्रिय अर्थतन्त्र निर्माणमा राष्ट्रिय उद्योगधन्धा र साधनस्रोतको संरक्षण र प्रवर्द्धन गरी नेपाली श्रम, सीप र कच्चा पदार्थमा आधारित स्वदेशी लगानीलाई प्राथमिकता दिने भनिएको छ। साथै उपखण्ड (९) मा राष्ट्रिय अर्थतन्त्रको विकासका लागि स्वदेशी लगानीलाई प्राथमिकता दिने कुरा उल्लेख छ। धारा ५१(घ)(१२) ले गैरआवासीय नेपालीको ज्ञान, सीप, प्रविधि र पुँजी राष्ट्रिय विकासमा उपयोग गर्ने भनेको छ। धारा ५१(च)(३) मा विकास निर्माणको प्रक्रियामा स्थानीय जनसहभागितामा अभिवृद्धि गर्ने कुरा उल्लेख छ। यसको आसय परनिर्भरता घटाउने हो। यसका लागि संविधानका यी प्रावधानका शब्द र भावना को आत्मसात गर्न जरुरी छ। निष्कर्ष नेपालको संविधानको ठाउँठाउँमा राष्ट्रिय अर्थतन्त्र निर्माण गर्ने, सार्वजनिक, निजी सहकारी र गैरआवासीय नेपालीलाई विकास कार्यमा लगाउने, स्वदेशी र गैरआवासीय नेपालीको ज्ञान, श्रम, सीप, प्रविधि र पुँजीको उपयोग गर्ने, स्वदेशी लगानीलाई प्राथमिकता दिने, परनिर्भरता घटाउनेजस्ता लबजको प्रयोग भएको देखियो। साथै अर्कोतिर विदेशी सहायता राष्ट्रिय आवश्यकता र प्राथमिकता क्षेत्रमा मात्र लिने, वैदेशिक सहायताबाट प्राप्त रकम राष्ट्रिय बजेटमा समाहित गर्ने, विदेशी गैरसरकारी संस्थालाई जवाफदेही र पारदर्शी बनाउने र नियमित गर्ने, यस्ता संस्थाको भूमिका राष्ट्रिय आवश्यकता र प्राथमिकता क्षेत्रमा मात्र सीमित गर्ने उल्लेख छ। तसर्थ अबको वैदेशिक सहायता नीति संविधानका यिनै शब्द र भावनाअनुरूप हुन जरुरी छ। सानातिना कुरामा विदेशीको मुख ताक्न तत्काल बन्द गर्न संविधानले राष्ट्रिय आवश्यकता र प्राथमिकता तय गरी त्यसमा मात्र वैदेशिक सहयोग लिन सकिने व्यवस्था गरेको हो। यसका लागि फजुल खर्च र भ्रष्टाचार नियन्त्रण तत्काल आवश्यक छ।"
