शीर्षक,विवरण
पशुपतिमा तीनमहिने सफाइ अभियान,"काठमाडौं (कास) संस्कृति, पर्यटन तथा नागरिक उड्डयन मन्त्रालयले पशुपति क्षेत्र सफाइ अभियान थालेको छ । तीनमहिने अभियानको सुरुवात शनिबार विश्वरूपा मन्दिर परिसरबाट पर्यटनमन्त्री सुदन किरातीसहित मन्त्रालय मातहतका २१ वटा निकायका कर्मचारीपदाधिकारीहरूले गरेका हुन् । पहिलो दिन कर्मचारीसहित २ सय हाराहारी स्वयंसेवी खटिएका थिए । उनीहरूले विश्वरूपा, वनकाली, गुह्येश्वरी क्षेत्र सफाइ गरे । सफाइका क्रममा ठूलो परिमाणमा प्लास्टिक र सुर्तीजन्य फोहोर संकलन भएको छ । ठूला ओहदामा बसेका पदाधिकारीहरूले सरसफाइ जस्तो सानो काम गर्नुहुँदैन भन्ने मानसिकताविरुद्ध पशुपति परिसरबाट सफाइ अभियान थालिएको मन्त्री किरातीले बताए । पहिलो दिन तीनै सुरक्षा निकाय, मातहतका श्रीमती संघ, विभिन्न जातजाति संगठन पनि सहभागी थिए । मन्त्री किरातीले सफाइकै क्रममा पशुपति विकास कोषका पदाधिकारीलाई सफाइ कार्ययोजना पेस गर्न निर्देशन दिए । कोषका सदस्यसचिव मिलन थापाले सरसफाइका लागि दुई दर्जन हाराहारी कर्मचारी मात्रै भएको बताउँदै वार्षिक ४० लाख रुपैयाँ सफाइमा खर्च भइरहेको बताए । सफाइका लागि सीमित कर्मचारी छन् । नयाँ भर्ना लिन कानुन पारित गर्नुपर्ने छ, उनले भने, हामीसँग सफाइमा बजेट र कर्मचारीको अभाव भएकाले अहिले नेपाल इन्भेस्टमेन्ट मेगा बैंकले वार्षिक १ करोड रुपैयाँ पशुपतिको सफाइमा लगानी गरिरहेको छ । मातहतका सबै निकायमा कार्यविधि बनाउन लगाएर सम्पदा क्षेत्र सफाइ अभियान सञ्चालन गरिएको मन्त्रालयले जनाएको छ ।"
निःशुल्क अनिवार्य शिक्षा सुरु,"(काभ्रे)जिल्लाका दुई पालिकामा निःशुल्क अनिवार्य शिक्षा कार्यक्रम सञ्चालन गरिने भएको छ । बेथानचोक गाउँपालिका र खानीखोला गाउँपालिकाले अपांगता भएका कारण विद्यालय जान नसकेका, अभिभावकविहीन, गरिबी वा अन्य कारण विद्यालय नपुगेका बालबालिकालाई लक्षित गरी निःशुल्क अनिवार्य शिक्षा कार्यक्रम सञ्चालन तयारी गरेका हुन् । खानीखोला गाउँपालिका शिक्षा शाखा प्रमुख विष्णुबहादुर अधिकारीका अनुसार यो कार्यक्रममा ४ वर्ष पूरा भई १३ वर्ष ननाघेका बालबालिकाका समेटिनेछन् । जटिल खालको अपांगताका कारण विद्यालय जान नसकेका विद्यार्थीको हकमा घरमै गएर घुम्ती शिक्षकको व्यवस्था गरिनेछ । कार्यक्रम शैक्षिक सत्र २०८० बाट सुरु गर्ने तयारी भइरहेको छ । बेथानचोक गाउँपालिकामा पहिलो चरणको कार्यक्रम सुरु भएको शिक्षा शाखा प्रमुख पुष्पा राईले जानकारी दिइन् । कार्यक्रमका लागि प्रारम्भिक चरणमा शिक्षा समिति, विद्यालय व्यवस्थापन समिति तथा सामुदायिक सिकाइ केन्द्रलाई प्रभावकारी ढंगले परिचालन गरी सूचना प्रवाह गरिने उनले बताइन् । त्यसपश्चात् वडास्तरीय घरदैलो कार्यक्रम रहनेछ, जसमा बालबालिकाको घरघरमा पुगेर अवस्था बुझिनेछ, लागत तथा तथ्यांक संकलन गरिनेछ, अनि विद्यालयसम्म पुग्न नसकेका विद्यार्थीहरूको कारण खोजिन्छ, उनले भनिन्, विद्यालयसम्म पुग्न नसक्नेलाई घरमै गएर पढाउने, आवश्यक परे आवासीय विद्यालय सञ्चालन गर्ने योजना पनि बनाइएको छ ।अपांगता तथा गरिबीको रेखामुनि रहेका बालबालिकाको संख्याका आधारमा बजेट विनियोजन गर्ने, पोसाक, झोला, जुत्ता, पुस्तक, कापीकलम उपलब्ध गराउने गाउँपालिकाका अध्यक्ष भगवान अधिकारीले जानकारी दिए । अटेर गर्ने अभिभावकलाई गाउँपालिकाबाट प्रदान गरिने सेवासुविधा रोक्का गरी बालबालिकालाई विद्यालय पठाएपछि मात्र सेवालाई निरन्तरता दिइने बाध्यकारी नीति बनाउँछौं, उनले भने । यो केन्द्र सरकारको सामाजिक विकास मन्त्रालयअन्तर्गतको कार्यक्रम हो ।"
सूचनाको हक कार्यान्वयन गराउँछौं,"नुवाकोट (कास) आन्तरिक मामिला तथा कानुनमन्त्री गंगानारायण श्रेष्ठले प्रदेश सरकारले सूचनाको हकलाई तल्लो वर्गमा कार्यान्वयन गर्ने बताउँदै यसका लागि सरोकारवाला निकायलाई निर्देशनसमेत दिएका छन् ।विदुरमा शनिबार आयोजित सूचनाको हक प्रवर्द्धन कार्यक्रममा उनले वाग्मती सरकारले मातहतका कार्यालयमा सूचनाको हकलाई मौलिक हकका रूपमा कार्यान्वयनमा लैजान कार्यक्रम गरिएको बताए । राजनीतिक सुशासन कायम गर्न र समृद्धिको यात्रा अगाडि बडाउन सूचना महत्त्वपूर्ण रहने भन्दै उनले यसले नागरिकलाई सशक्त बनाउने विचार राखे । मन्त्रालयका सचिव नारायणप्रसाद शर्माले प्रदेश सरकार सुशासनतर्फ लागिपरेको बताए । वाग्मती प्रदेश सञ्चार रजिस्ट्रार रेवती सापकोटाले सूचना लिने र दिनेबीच द्वन्द्व रहे पनि सूचना लिन पाउनु नागरिकको हक भएको धारणा राखे । ऐन, कानुनमा भएका भाषा सरलीकृत गर्नुपर्नेमा पनि उनले जोड दिए । जिसस प्रमुख रजिन्द्रविक्रमसिंह ठकुरीले सूचनाको हक लागू गरेर भ्रष्टाचार कम गर्न सुझाए । प्रदेश सूचना पुनरावेदन समितिका अध्यक्ष हरिप्रसाद अधिकारीले कार्यपत्र प्रस्तुत गर्दै सूचनाको हकको माध्यमबाट वाग्मती सरकारले गरेका कामकारबाही पारदर्शी गराई नागरिकमा लोकतन्त्रप्रति बढेको नकारात्मक भावना निरुत्साही गराउन सघाउन पुग्ने बताए ।"
तरलता व्यवस्थापन गर्न नसक्दा अमेरिकाको सिलिकन भ्याली बैंक बन्द,"(काठमाडौं) तरलता व्यवस्थापन गर्न नसक्दा अमेरिकाको सिलिकन भ्याली बैंक बन्द भएको छ । अमेरिकामा निक्षेप सुरक्षणको जिम्मा पाएको फेडरल डिपोजिट इन्स्योरेन्स कर्पोरेसन (एफडीआईसी) ले सिलिकन बैंक बन्द गर्ने निर्णय गरेको हो । यस्तो निर्णयसँगै अमेरिकाकै ठूलोमध्यको एक बैंक बन्द भएको हो । एफडीआईसी नेपालको निक्षेप तथा कर्जा सुरक्षण कोष जस्तै अमेरिकाका बैंकको निक्षेप र कर्जा सुरक्षण (बिमा) गर्ने सरकारी निकाय हो । सिलिकन बैंक बन्दलाई सन् २००८ को मन्दीपछिकै अमेरिकी बैंकिङ क्षेत्रमा अर्को ठूलो संकटका रूपमा समेत हेरिएको छ । सन् २००८ मा वासिङ्टन म्युचअल टाट पल्टिएको घटनापछि यो सबैभन्दा ठूलो संकट भएको बताइएको छ । सिलिकन भ्याली अमेरिकामा १६औं ठूलो बैंक हो । तत्काल पर्याप्त तरलता व्यवस्थापन गर्न नसकेकै कारण एक साताको अवधिमा बैंक बन्द भएको हो । मुद्रास्फीति अकासिएसँगै अमेरिकी केन्द्रीय बैंक फेडरल रिजर्भले निरन्तर ब्याजदर बढाइरहेको छ । ब्याजदर निरन्तर उकालो लागेपछि त्यहाँको बन्ड मार्केट हालसम्मकै न्यून बिन्दुमा ओर्लिएको छ । बन्ड मार्केटमा अमेरिकाका धेरै बैंकले ठूलो लगानी गरेका छन् । बन्ड मार्केटबाट नोक्सानी बेहोरिरहेका बेला सिलिकन बैंकमा एक्कासि निक्षेपकर्ताले निक्षेप फिर्ता लगेपछि संस्थामा समस्या आएको हो । निक्षेपकर्ताको निक्षेप फिर्ता गर्नकै लागि सिलिकन बैंकले ठूलो नोक्सान बेहोरेर न्यून मूल्यमा बन्ड बिक्री गरेको छ । यही नोक्सानीका कारण तरलता व्यवस्थापन गर्न नसक्दा सिलिकन बैंक समस्यामा परेको हो । छोटो समयमा बैंक समस्यामा पर्नुका पछि अल्पकालीन निक्षेप धेरै हुनु र तरलता अवस्था नाजुक हुनुलाई प्रमुख कारणका रूपमा हेरिएको छ । घाटा पूर्तिका लागि यस बैंकले गत बुधबार मात्र ठूलो हिस्सामा बन्ड (सेयर) बेचेको र करिब २२५ बिलियन बराबरको नयाँ सेयर बेच्ने घोषणा गरेको थियो । बैंकको उक्त घोषणापछि ठूला सेयरहोल्डर र बचतकर्ताले आफ्नो लगानी र बचत फिर्ता लिन सुरु गरेका थिए । क्यालिफोर्नियामा मुख्यालय रहेको यो बैंक टाट पल्टिने अवस्थामा पुगेकाले बन्द गर्नुपरेको नियामक निकाय एफडीआईसीको भनाइ छ । यद्यपि एफडीआईसीले सबै बचतकर्ताको पैसा सुरक्षित भएको बताएको छ । एफडीआईसीले अमेरिकामा प्राकृतिक व्यक्तिको प्रतिखाता २ लाख ५० हजार अमेरिकी डलर बराबरको निक्षेप सुरक्षण (बिमा) गर्दै आएको छ । बिमा गरिएको रकम बराबर निक्षेप फिर्ताका लागि एफडीआईसीले सोमबार (मार्च १४ तारिख, २०२३) मा निक्षेपकर्तालाई डाकेको छ । बैंकका शाखा खोल्न लगाएर सबै बचतकर्ताको पैसा सोमबारसम्म भुक्तानी गरिनेछ, सूचनामा भनिएको छ । बिमा नभएको रकमका लागि बैंकको सम्पत्ति तथा दायित्व मूल्यांकनपछि निर्णय गरिने एफडीआईसीको सूचनामा उल्लेख छ । एफडीआईसीका अनुसार उक्त बैंकमा करिब १७५ बिलियन अमेरिकी डलर निक्षेप छ । सिलिकन बैंक बन्द हुँदैमा अमेरिकामा पुनः वित्तीय संकट भनेर विश्लेषण गरिहाल्न नमिल्ने जानकारहरू बताउँछन् । तर यसलाई वित्तीय संकटको संकेत मानेर संयमित हुनुपर्ने अवस्था आएको उनीहरूको भनाइ छ । किनकि अमेरिकामा धेरै बैंकको ठूलो लगानी बन्ड मार्केटमा छ । यस्तो अवस्थामा ती बैंकहरूलाई तत्काल सेयर बेच्ने बाध्यता आइलाग्यो भने उनीहरूलाई पनि समस्या पर्न सक्छ । पछिल्ला दिनमा तरलता अवस्था सहज भएका बैंकको सेयर मूल्य बढेको छ भने कमजोर बैंकको घटेको छ । यसरी सेयर मूल्य घटेको बैंकहरूले एकै पटक धेरै निक्षेप फिर्ता गर्नुपर्ने अवस्था आयो । त्यसका लागि ती बैंकले पनि सेयर बिक्री गर्नुपर्यो भने वित्तीय समस्या आउने सक्ने जानकारहरू बताउँछन् । तरलता स्थिति सहज भएको बैंकले आउँदा दिनमा पनि त्यसलाई कायमै राखेको अवस्थामा भने उनीहरू संकटबाट जोगिनेछन् । सन् १९८३ मा क्यालिफोर्निया बैंकका रूपमा स्थापना भएको सिलिकन भ्याली बैंक पछिल्लो एक दशकमा तीव्र विस्तार भएको हो । यस बैंकका विश्वका विभिन्न देशमा गरी करिब ८ हजार ५ सय कर्मचारी छन् । सिलिकनमा देखिएको संकट वैश्विक अर्थतन्त्रमा समेत पर्ने सम्भावना रहेको अर्थशास्त्रीहरूको भनाइ छ । यस वर्ष बन्द भएको उक्त बैंक एफडीआईसीले सुरक्षण (बिमा) गरेको पहिलो संस्थान हो । साढे २ वर्षअघि अल्मेना स्टेट बैंक बन्द भएको थियो ।३१ डिसेम्बर २०२२ सम्म बैंकको कुल सम्पत्ति २०९ बिलियन डलर बराबरको भएको बताइएको छ । एफडीआईसीका अनुसार क्यालिफोर्निया र म्यासाचुसेट्समा गरी बैंकका १७ शाखा छन् । सिलिकन भ्याली बैंकले मुख्यगरी प्रविधि केन्द्रित स्टार्टअप व्यवसायमा लगानी गर्दै आएको थियो । बिहीबार मात्र सिलिकन भ्याली बैंकको प्यारेन्ट कम्पनी एसभीबी फाइनान्सियल ग्रुपको सेयरमा ७० प्रतिशतसम्म गिरावट आएको थियो ।सिलिकन भ्याली बैंक टाट पल्टिनुको आंशिक कारण संघीय रिजर्भ बैंकले गत वर्ष ब्याजदर वृद्धि गर्नु पनि भएको सीएनएनले जनाएको छ । अमेरिकी अर्थमन्त्री जेनेट येलेनले पछिल्लो घटनाक्रमलाई सावधानीपूर्वक हेरिरहेको बताएकी छन् । नियामक निकायका उच्च अधिकारीलाई भेटेर वित्तीय क्षेत्रको यथावत् सञ्चालनका लागि आवश्यक कदम चाल्न पनि उनले निर्देशन दिएकी छन् ।विश्व बैंकको पछिल्लो प्रक्षेपण प्रतिवेदनले समेत सन् २०२३ देखि विश्वका धेरैजसो मुलुकमा आर्थिक मन्दी लम्बिने उल्लेख गरेको छ । प्रतिवेदनले विश्वको आर्थिक वृद्धि सन् २०२३ मा १७ प्रतिशतमा रहने अनुमान गरेको छ । विश्वमा विद्यमान मुद्रास्फीति, बढ्दो ब्याजदर र निजी क्षेत्र तथा सर्वसाधारणमा गरिएको लगानी घट्नुले विश्व लामो समय आर्थिक मन्दीमा रहने बैंकको अनुमान छ । कोभिडको असर तथा रुस र युक्रेनबीचको तनावले मुद्रास्फीति बढेको प्रतिवेदनमा उल्लेख छ । ब्याजदर उच्च हुनु र नागरिकप्रति लगानीमा आएको संकुचनले आर्थिक मन्दीलाई बढाउने बैंकको प्रक्षेपण छ । पछिल्लो पटक गत माघमा अमेरिकी केन्द्रीय बैंक (फेडरल रिजर्भ बैंक) ले लगातार आठौं पटक ब्याजदर बढाउने निर्णय गरेको थियो । यसअघि गरिएको ब्याजदर वृद्धिले मूल्यवृद्धि नियन्त्रणमा सघाउ पुगेको जनाउँदै फेडरल रिजर्भ बैंकका अध्यक्ष जेरोम एच पावेलले थप नियन्त्रणको प्रयास गर्नुपरेको बताएका थिए । यो निर्णय सन् २०२३ मार्चदेखि लागू भएको हो । जसअनुसार ब्याजदर ०२५ प्रतिशत बिन्दुले बढेको छ । त्यसैले मार्चदेखि फेडरल रिजर्भ बैंकले सन्दर्भ ब्याजदर (पोलिसी रेट) ४५ देखि ४७५ प्रतिशत कायम गर्ने भएको छ । अमेरिकी ब्याजदरले सुनचाँदी, कच्चा तेल तथा अमेरिकामा उत्पादित वस्तुको मूल्यमा समेत असर पार्ने भएकाले समग्र विश्व अर्थतन्त्रमा प्रभाव पर्दछ । सन्दर्भ ब्याजदरले नै अमेरिकामा उपभोक्ताले लिने जुनसुकै ऋण, ओभरड्राफ्टको दर बढाउनेछ, जसले गर्दा घर, सवारीसाधन वा व्यापारिक ऋणको लागत महँगो हुँदै आएको छ ।"
सेयर ओरालो लाग्दा ४ बैंकले गुमाए ५५ अर्ब डलर,एजेन्सी
