शीर्षक,विवरण
अस्पतालमा दर्जनौ पटक ठूला पटाका पड्काउँदा बिरामीहरू त्रसित,"कपिलवस्तु : कपिलवस्तु अस्पताल परिसरमा प्रदर्शन गर्दै ठूलो आवाज आउने खालका दुई दर्जन बढी हवाई पटाका पड्काउँदा बिरामीहरू त्रसित भएका छन्। अस्पतालमा नयाँ मेडिकल सुपरिटेण्डेन्टका रुपमा दोस्रो पटक डाकिशोर बन्जाडे हाजिर भएको खुशीयाली व्यक्त गर्दै अस्पताल भित्रकै केही कर्मचारीले ठूलो आवाज आउने खालका पटाकाहरू पड्काएका हुन्। यसअघि नेपाली कांग्रेस माओवादी गठबन्धनको सरकारका बेला कपिलवस्तु जिल्लाबाट गुल्मी जिल्ला सरुवा भई गएका डा वन्जाडे सरकार परिवर्तनसँगै दोस्रो पटक मेडिकल सुपरिटेण्डेन्टको रुपमा सरुवा भई आएका हुन्। डा वन्जाडेको अस्पतालमा स्वागत स्वरुप पटाकाहरू पड्काइको थियो। अस्पतालमा भर्ना भएका विभिन्न खाले बिरामीहरू पटाकाको लगातारको ठूलो आवाजका कारण निकै त्रसित बनेका अस्पतालमा उपचार गर्न आएका बिरामीका आफन्त कपिलवस्तु नगरपालिका९ का राम रतन यादवले बताए। अस्पतालमा कुनै पनि कर्मचारी सरुवा भई आउने जाने सामान्य प्रक्रिया हो। तर अस्पताल भित्रै यति ठुलो ठुलो आवाजमा पटाका पड्काउनु गम्भीर अपराध रहेको स्थानीय युवा समाजसेवी गोपीकृष्ण शर्माले बताए। आज अस्पताल परिसरको अवस्था हेर्दा लाग्थ्यो, कुनै ठुलै विजय उत्सवको खुशीयालीमा पटकाहरू पट्कदै छन्, समाजसेवी शर्माले भने, यस्ता खाले गतिविधीहरूले अस्पतालमा भर्ना भई उपचाररत बिरामी र चेक अपका लागि अस्पताल आएका नयाँ बिरामीहरूको मनोभावनामा कस्तो असर पुग्ला ? यस्ता उदण्ड क्रियाकलाप गर्ने जो कोहीलाई पनि पहिचान गरी कडा कारवाही गर्नुपर्छ, शर्माले भने। अस्पताल परिसर वरपरका सडकहरू समेत आवाज निषेधित क्षेत्रका रुपमा पर्छन्। तर अस्पताल परिसर भित्र भर्ना भई उपचाररत रहेका बिरामीको वार्ड माथि नै ठुलो आवाजमा पटाका पड्काईनु गम्भीर अपराध भएको भन्दै आम सर्वसाधारणहरूले पनि सामाजिक सञ्जाल मार्फत विरोध जनाएका छन्। अस्पताल भनेको निकै संवेदनशील क्षेत्र हो। यस प्रकारको गतिविधि गर्नु निन्दनीय रहेको छ, कपिलवस्तु नगरपालिकाका युवा नेता डा राजेश गुप्ताले भने। अस्पताल परिसरमा एकाएक पटाकाहरू पड्कन थालेपछि अस्पताल वरपरको माहौल केही बेर निकै त्रसित बनेको थियो। अस्पतालसँगै रहेको तौलेश्वरनाथ संस्कृत माध्यमिक विद्यालयमा समेत कुनै अप्रिय घटना घट्यो की भन्दै शिक्षक तथा विद्यार्थीहरू कक्षा कोठाबाट निस्केर चौरमा एकत्रित भई बसेको विद्यालयका प्रधानाध्यापक पुजारी कुर्मीले बताए। सामाजिक सञ्जालहरूमा घटनाको विरोध गर्दै विभिन्न खाले प्रतिक्रियाहरू आउन थाले पछि अस्पताल प्रशासनले विज्ञप्ति प्रकाशित जारी गरेको छ। अस्पताल भित्रै भएको पटाकावाजी बारे आफूहरूलाई केही थाहा नभएको भन्दै विज्ञप्ति प्रकाशित गरिएको छ। अस्पतालले जारी गरेको विज्ञप्तिमाथि धेरैले विरोध जनाएका छन्। अस्पताल परिसरमा सुरक्षा सतर्कताका लागि नेपाल प्रहरीको एउटा सानो टोली समेत २४ घण्टे ड्युटीमा खटिएको छ। प्रत्यक्षदर्शीका अनुसार अस्पताल सुरक्षा टोलीका इन्चार्जको उपस्थितिमै लगातार पटाकाहरू पड्काइँदा समेत सुरक्षाकर्मीहरूको तर्फबाट कुनै रोकावटको अवस्था भने देखिएन। अस्पतालमा भएको घटनाका बारेमा सर्वसाधारणले मौखिक उजुरी गरेका र आफूले पनि पटक पटक ठूलो आवाजमा पटाका पड्केको सुनेको प्रमुख जिल्ला अधिकारी विश्व प्रकाश अर्यालले बताए। घटना बारे बुझ्न प्रहरीलाई निर्देशन दिएको उनको भनाइ छ। अस्पताल भित्र भएको यस्तो घटनाप्रति स्थानीय प्रशासनको गम्भीर ध्यानाकर्षण भएको प्रहरी नायब उपरीक्षक हरिबहादुर वलीले बताए। घटनाबारे अनुसन्धानका लागि १ जनालाई नियन्त्रणमा लिएको उनले बताए।"
मुग्लिनपोखरा सडक विस्तार तीव्र,"तनहुँ : मुग्लिनपोखरा सडक विस्तारअन्तर्गत पूर्व र पश्चिम दुई खण्डमा सडक विस्तारलाई तीव्रता दिइएको छ। पृथ्वीराजमार्गको पूर्वतर्फ ३३ र पश्चिमतर्फ २० किमि सडक कालोपत्र गरिसकिएको आयोजनाले जनाएको छ। पूर्वतर्फ ४१ दशमलव ७ किमि र पश्चिमतर्फ ३८ दशमलव ८८ किमी सडक विस्तार भइरहेको छ। आँबुखैरेनीदेखि जामुने सडक खण्डमा २७ किमि चार लेन र छ किमि दुई लेनको सडक कालोपत्र गरिएको पूर्व खण्डका इन्जिनियर विष्णु पाण्डेले जानकारी दिए। उनले भने, पृथ्वीराजमार्गअन्तर्गत आँबुखैरेनी, डुम्रे, व्यास, चापाघाट, म्याग्दे र जामुनेलगायतका स्थानमा कालोपत्र गरिएको छ। पूर्व खण्डमा ७० प्रतिशत बढी कार्य प्रगति भइसकेको उनले जानकारी दिए। विसं २०८१ वैशाख २ गते सम्झौता म्याद सकिएपछि पुनः एक सय ५५ दिन म्याद थप गरी निर्माणलाई निरन्तरता दिइएको हो। कोभिड१९ का बेला काम प्रभावित भएकाले म्याद थप गरिएको इन्जिनियर पाण्डेले बताए। त्यसैगरी पश्चिम खण्डमा २६ प्रतिशत कार्य प्रगति भइसकेको छ। दुई लेनको २० किमि सडक कालोपत्र गरिएको छ। सम्झौता अनुसार विसं २०८१ भदौ ११ सम्म काम सम्पन्न गरिसक्नुपर्नेछ। उनका अनुसार यस सडकखण्डमा वर्षायाम अगावै नालासहित एकतर्फी सडक ग्राभेल गर्ने लक्ष्य राखिएको छ।"
वैदेशिक रोजगारीका नाममा अनलाइनमार्फत ठगी गर्ने व्यक्ति पक्राउ,काठमाडौं : वैदेशिक रोजगारीका नाममा अनलाइनमार्फत ठगी गर्ने व्यक्ति पक्राउ परेका छन्। पक्राउ पर्नेमा काठमाडौंको नागार्जुन नगरपालिका४ सितापाइलाका १८ वर्षीय अंकित बस्नेत रहेका छन्। काठमाडौं उपत्यका अपराध अनुसन्धान कार्यालयका सूचना अधिकारी रविन्द्र रेग्मीका अनुसार सामाजिक सञ्जालहरूको प्रयोग गरेर उनले ५ लाख रुपैयाँ ठगी गरेका थिए। उनले कम्बोडियाको विज्ञापन राखेर इभिसा लगाइदिने र त्यहाँ पुगेपछि वर्क पर्मिट निकाली वर्क भिसा गराइदिने भनेर विश्वास दिलाएर रकम आफ्नो खातामा जम्मा गर्न लगाएका थिए। उनलाई कार्यालयको टोलीले बानेश्वरबाट पक्राउ गरेको हो। उनलाई ठगी सम्बन्धी कसुरमा आवश्यक कारबाहीका लागि जिल्ला प्रहरी परिसर टेकु पठाइएको कार्यालयले जनाएको छ।
नेपालभारतको दशगजा क्षेत्रमा गाडिएको अवस्थामा भेटियो दुई पुरुषको शव,"वीरगन्ज : भारतसँग सीमा जोडिएको पर्साको जगरनाथपुर गाउँपालिकाको दशगजा क्षेत्रमा गाडिएको अवस्थामा दुई जना पुरुषको शव फेला परेको छ। जगरनाथपुर गाउँपालिका१ बिसनपुर्वाबाट भारत बिहारको नगरदेही जाने बाटो छेउको नेपालतर्फ पर्ने ओरिया खोलास्थित दशगजा क्षेत्रमै मंगलबार बिहान पहिचान खुल्न नसकेका दुई पुरुषको शव भेटिएको हो। दशगजा क्षेत्रमा पर्ने ओरिया खोलामा रहेको ४२१५ नम्बरको सीमा पिल्लर नजिकै बालुवामा गाडिएको अवस्थामा अन्दाजी ३५४० वर्ष उमेरको जस्तो देखिने दुई पुरुषको शव भेटिएको पर्साका प्रहरी नायब उपरीक्षक दीपक भारतीले जानकारी दिए। मंगलबार बिहान ७ बजेतिर दशगजा क्षेत्रमा नेपालको सशस्त्र प्रहरी र भारतको एसएसबीको संयुक्त टोलीले गस्ती गर्ने क्रममा गाडिएको अवस्थामा ती दुवै शव भेटिएको हो। शव भेटिएको स्थल नेपाल तर्फको भूभाग रहेको भन्दै भारतीले पहिचान भने खुल्न नसकेको बताए। गाडिएको शव निकालेर पोष्टमार्टमका लागि वीरगन्जस्थित नारायणी अस्पतालमा पठाइएको भारतीले जानकारी दिए। उनले भने,दुवै शवको पहिचान अहिलेसम्म खुल्न सकेको छैन। त्यसका लागि प्रहरीले प्रयास गरिरहेको छ।"
नारायणी अस्पताल सुधार गर्छु : स्वास्थ्यमन्त्री,"वीरगन्ज : स्वास्थ्य तथा जनसंख्या मन्त्री प्रदीप यादवले सर्वोच्च अदालतमा विचाराधीन नारायणी अस्पतालको ५ सय शय्या भवन निर्माणको मुद्दालाई फास्ट ट्रयाकमा टुङ्गो लगाउन आफू लागि परेको बताएका छन्। गृहनगर वीरगन्जमा रहेको नारायणी अस्पतालको मंगलबार अनुगमन गरेपछि वीरगन्ज महानगरका मेयर, अस्पताल विकास समितिका अध्यक्ष र मेसुसँग छलफल गर्ने क्रममा मन्त्री यादवले उक्त जानकारी गराएका हुन्। नारायणी अस्पतालमा थप ५ सय शय्याको सुविधासम्पन्न भवन निर्माण सम्बन्धि मुद्दा सर्वोच्च अदालतमा चार वर्षदेखि विचाराधीन रहेको छ। भवन निर्माण सम्बन्धी टेण्डर आह्वानको विषयलाई लिएर केही निर्माण कम्पनीले सर्वोच्चमा रिट हालेपछि चार बर्षदेखि उक्त मुद्दा विचाराधीन रहेको छ। मंगलबारको छलफलमा मन्त्री यादवले अदालतमा विचाराधीन रहेको अस्पताल भवन निर्माणको मुद्दालाई फास्ट ट्रयाकमा सम्बोधन गर्न आफू लागिपरेको बताए। उनले भने, अस्पतालको भवन निर्माणका लागि सबै प्रक्रिया अगाडि बढे पनि केही स्वार्थी व्यक्तिले अदालतमा मुद्दा हालेको कारण काम अगाडि बढेको छैन। मैले प्रधानमन्त्री र कानुन मन्त्रीसँग भेटेर फास्ट ट्रयाकमा मुद्दाको फैसला गर्न आग्रह गरेको छु। मुद्दा फैसला भएसँगै भवन निर्माणको काम द्रुत गतिमा अगाडि बढ्ने उनले बताए। मन्त्री यादवले अस्पतालको पूर्वाधार स्तरोन्नतिदेखि औषधि उपकरण खरिदका लागि पनि आफूले मन्त्रालयबाट विभिन्न प्याकेजहरू घोषणा गरेको जानकारी दिए। मन्त्री यादवले छलफलमा सहभागी वीरगन्जका मेयर राजेशमान सिंह र अस्पतालका निमित्त मेसु डा एनामुल हकलाई अस्पतालका विद्यमान समस्याहरूको सूची तयार पारेर छिट्टै मन्त्रालय आउन निर्देशन पनि दिए। उनले भने मेसु साब समस्याहरूको सूचीसँगै तत्कालै, मध्यकालीन र दीर्घकालीन समाधानका उपायसहितको एउटा रिपोर्ट तयार पारेर तपाईहरु मन्त्रालय आउनुहोस्। बजेट व्यवस्थापन मेरो जिम्मामा छ। के गर्नुपर्छ गर्छु तर नारायणी अस्पतालमा सुधार हुन्छ। मंगलबार अनुगमनका क्रममा मन्त्री यादवले नारायणी अस्पतालको ओपिडी, फार्मेसी, पोस्टअप, ल्याबलगायत अनुगमन गर्दै त्यहाँ उपचाररत बिरामी र कुरुवासँग समेत कुराकानी गरेका थिए। अनुगमनकै क्रममा मन्त्री यादवले बिरामीले सुनाएका गुनासोलाई यथाशीघ्र सम्बोधन गर्न अस्पतालका निमित्त मेसु हकलाई निर्देशन दिए। उनले फार्मेसीमा औषधीको व्यवस्थापनका लागि मन्त्रालयसँग बजेट माग गर्न र ओपिडी सेवाका लागि आउने बिरामीको सहजताका निमित्त टिकट काउन्टर थप्दै टिकट काउन्टरलाई वातानुकूलित बनाउनपनि निर्देशन दिए। त्यसअघि निमित्त मेसु हकले नारायणी अस्पताल ३५० बेडमा स्तरोन्नति भएको वर्षौं बितिसक्दा पनि कर्मचारी दरबन्दी सय बेड अनुसार कै रहेको जानकारी मन्त्री यादवलाई गराएका थिए। दरबन्दी नहुँदा जनशक्ति अभाव छ। हामीले अपेक्षित ढङ्गबाट सेवा प्रवाह गर्न सकेका छैनौँ। बेड अनुसारको दरबन्दी कायम गर्न मेरो आग्रह छ, हकले भने ,त्यस्तै क्वाटर, मेसिनरी र अन्य पूर्वाधार अभाव लगायतका समस्या पनि छन्।"
