शीर्षक,विवरण
संसदीय छानबिन समितिको कार्यादेश टुंग्याउन सिंहदरबारमा कार्यदलको बैठक,"काठमाडौं : सहकारी ठगी प्रकरणमा छानबिन गर्न गठित संसदीय दलको गठित कार्यदलको बैठक सिंहदरबारमा जारी छ। कानुन न्याय तथा संसदीय मामिला मन्त्रालयमा जारी बैठकले संसदीय समितिको कार्यादेश बनाउनेछ। सत्तापक्ष र प्रतपक्षका शीर्ष नेताहरू सहकारी ठगी प्रकरणसम्बन्धी अनुसन्धान गर्न संसदीय छानबिन समिति बनाउन शनिबार सहमत भएका हुन्। प्रमुख प्रतिपक्षी दल नेपाली कांग्रेसले सहकारी ठगी प्रकरणमा उपप्रधान एवं गृहमन्त्री रवि लामिछानेमाथि छानबिन गर्न संसदीय समिति गठनको माग गर्दै लामो समयदेखि संसदमा अवरोध गर्दै आएको थियो। कानुनमन्त्री पदम गिरीको संयोजकत्वमा गठित कार्यदलमा नेकपा एमालेका महेश बर्तौाला,कांग्रेसका जीवन परियार र राष्ट्रिय स्वतन्त्र पार्टीका शिशिर खनाल रहेका छन्।"
राष्ट्रियसभाको बैठक पनि सर्यो,काठमाडौं : दिउँसो १ बजेर १५ मिनेटका लागि तय गरिएको राष्ट्रियसभाको बैठक दुई घण्टाका लागि सारिएको छ । संसद् सचिवालयका अनुसारका दिउँसो ३ बजेर १५ मिनेटमा बस्नेगरी बैठक तय भएको छ। सहकारीको रकम अपचलनकासम्बन्धी संसदीय छानबिन समिति गठनका लागि कार्यादेश टुङ्गो लगाउन अहिले सत्तापक्ष दल र प्रमुख प्रतिपक्षी दल नेपाली कांग्रेसबीच छलफल जारी छ। कार्यादेश टुङ्गो लाग्न नसकेपछि बैठक सारिएको हो । यसअघि प्रतिनिधिसभाको बैठक पनि दिउँसो दुई बजे बस्ने गरी सारिएको थियो। सहकारी ठगी प्रकरणमा मुछिएपछि उपप्रधान एवं गृहमन्त्री रवि लामिछानेमाथि छानबिन गर्न संसदीय समिति गठन गर्न सत्ता पक्ष र प्रतिपक्षबीच सहमत भइपनि कार्यादेशमा सहमति जुट्न नसकेपछि संघीय संसदका दुवै सदन प्रभावित भएका छन्।
एमालेको प्राथमिकता सत्ता समीकरणको निरन्तरता र कम्युनिष्ट शक्ति निर्माण : महासचिव पोखरेल,"दाङ : नेकपा (एमाले)का महासचिव शंकर पोखरेलले वर्तमान सत्ता समीकरणको भविष्य प्रधानमन्त्रीको कार्यशैलीमा भरपर्ने बताएका छन्। प्रेस चौतारी नेपाल दाङले आयोजना गरेको पत्रकार सम्मेलनमा बोल्दै पोखरेलले प्रधानमन्त्री प्रचण्डले न्यूनतम नीतिगत प्राथमिकता र साझा संकल्पका आधारमा काम गरूञ्जेल एमाले गठबन्धनकै पक्षमा रहने बताएका हुन्। महासचिव पोखरेलले सत्ता बाहिर रहनुको छटपटीले काँग्रेस नेताहरूमा देखिएको उनको भनाई छ। उनले वर्तमान सत्ता गठबन्धनलाई २०८४ सालसम्म निरन्तरता दिने बताए। पोखरेलले भने,एमाले गठबन्धनको विकल्प खोज्ने पक्षमा छैन। वर्तमान सत्ता समीकरणलाई २०८४ को निर्वाचनसम्म निरन्तरता दिने पक्षमा हामी छौं। विगतमा कम्युनिष्ट एकता बचाउन नसक्नु गम्भीर त्रुटी भएको बताउँदै महासचिव पोखरेलले एमालेको प्राथमिकता वर्तमान सत्ता समीकरणको निरन्तरता र बलियो कम्युनिष्ट शक्ति निर्माण नै रहेको बताए। एमालेको प्राथमिकता वर्तमान सत्ता समीकरणको निरन्तरता हो। बलियो कम्युनिष्ट शक्ति निर्माण हो, महासचिव पोखरेलले भने पार्टी एकता र २०८४ को निर्वाचनका लागि नयाँ सत्ता समीकरण निर्माण भएको नभई मुलुकलाई संकटमुक्त बनाउनका लागि हो। कम्युनिष्ट शक्तिका बीचमा सहकार्यको थालनी गर्नु मात्रै हो। संसदमा गृहमन्त्रीलाई बोल्नमा रोक लगाउनु कांग्रेसको पश्चगामी सोच महासचिव पोखरेलले संसदमा गृहमन्त्री रवि लामिछानेलाई बोल्नमा रोक लगाउनु कांग्रेसको पश्चगामी सोच भएको टिप्पणी गरे। उनले यो प्रयत्न परिवर्तनका लागि सङ्घर्ष गरेको पार्टी नेपाली कांग्रेसका लागि शोभनीय नभएको बताए। उनले भने,गृहमन्त्रीले आफूमाथि लागेका आरोपबारे सदनमा बोल्न पाउनुपर्छ। अनि उहाँका नाममा मात्रै होइन, सिङ्गो सहकारी समस्याका बारेमा छानबिन गरिनुपर्छ। महासचिव पोखरेलले प्रक्रियाबाटै सहमतिमा जिल्ला नेतृत्व चयन गरेर दाङका नेता कार्यकर्ताले मुलुकलाई सन्देश प्रवाह गर्ने विश्वास व्यक्त गरे।"
"माइतीघरमा सरकारविरुद्ध नेविसंघको नारा  चिया छानेको, सहकारी ठग जोगाउन कति जानेको ?","काठमाडौं : नेपाल विद्यार्थी संघ (नेविसंघ) ले सहकारी ठगीसम्बन्धी गिरिनबन्धु टी स्टेटको अनुसन्धान गर्न संसदीय छानबिन समितिको माग गर्दै राजधानीमा विरोध प्रर्दशन गरेको छ। सहकारी पीडितलाई न्याय दिनुपर्ने माग गर्दै र्यालीसहित प्रदर्शन गरेको हो । नेविसंघले काठमाडौंको माइतीघरमा सहकारी ठगी प्रकरणमा मुछिएका उपप्रधान एवं गृहमन्त्री रवि लामिछाने र झापाको गिरिबन्धु टी स्टेटको जग्गा विवादबारे अनुसन्धान गर्न संसदीय छानबिन समितिको माग गर्दै विरोध गरेको हो। प्रदर्शनमा सहभागीहरूले चिया छानेको,सहकारी ठग जोगाउन जानेको,लुट्न सके लुट कान्छा,लुट्न सके लुट,अरु देशमा पाइदैन नेपालमै लुट,सहकारी ठगीको प्रमाण यहाँ छ,रवि दाइ अदालतले भन्यो गिरिबन्धु,ओली सरकारको नीतिगत भ्रष्टाचार,कारवाही गर्ने हिम्मत छ ? लगायतका नारा लेखिएका प्लेकार्ड प्रदर्शन गरेका छन्। लामिछानेमाथि संसदीय समिति गठन गर्न सत्ता पक्ष र प्रतिपक्ष सहमत भएपनि कार्यादेशमा सहमति जुट्न सकेको छैन। आइतबार बिहान संसदीय समितिको कार्यादिशा टुंग्याउन बसेको कार्यदलको बैठक निष्कर्षविहीन भएको छ। सहमति जुटाउन बैठक पुन: बस्दैछ। दलहरूबीच कार्यादिशामा सहमति जुट्न नसक्दा संघीय संसदनका प्रतिनिधिसभा बैठक र राष्ट्रिय सभा बैठक तोकिएको समयमा बस्न सकेका छैनन्।"
टीओआरमा सहमति जुट्न नसकेपछि प्रतिनिधिसभा बैठक सर्यो,"काठमाडौं : आइतबार बिहान ११ बजेका लागि बोलाइएको प्रतिनिधिसभा बैठक सरेको छ। बैठक दिउँसो २ बजे बस्नेगरी बोलाइएको संघीय संसदले जनाएको छ। संसदीय छानबिन समितिको कार्यादेश टुंगाउन बसेको कार्यदलको बैठक लम्बिएपछि संसद् बैठक सरेको हो। अहिले कार्यदलको बैठक सिंहदरबारमा जारी छ। सहकारी ठगी प्रकरणमा उपप्रधान एवं गृहमन्त्री रवि लामिछानेमाथि छानबिन गर्न संसदीय समिति गठन गर्न सत्ता पक्ष र विपक्षी दल सहमत भएका छन्। तर, समितिको कार्यदेशामा सहमति जुट्न सकेको छैन।"
"प्रतिनिधिसभा बैठक बस्दै, यस्तो छ संभावित कार्यसूची ?",काठमाडौं : संघीय संसदअन्तरगतको प्रतिनिधिसभा बैठक बस्दैछ। बिहान ११ बजेका लागि बोलाइएको बैठकमा सभामुख देवराज घिमिरेले प्रधानमन्त्री तथा मन्त्रिपरिषदको कार्यालयबाट प्राप्त कार्यभार थप सम्बन्धी पत्रको व्यहोरा पढेर सुनाउने संभावित कार्यसूची छ। बैठकमा सभामुख घिमिरेले प्रतिनिधिसभा नियमावली २०७९ को नियम १० बमोजिम बैठकको अध्यक्षता गर्न सदस्यहरूको मनोनयन गर्ने संभावित कार्यसूचीमा उल्लेख छ। यसैगरी बैठकमा प्रधानमन्त्री पुष्पकमल दाहाल 'प्रचण्ड'ले संघीय संसदनको दुवै सदनको संयुक्त बैठकलाई राष्ट्रपतिले गरेको सम्बोधनको प्रति टेबुल गर्नेछन्। प्रधानमन्त्रीले नेपालको संविधानको धारा ५३ बमोजिमको नेपाल सरकारको वार्षिक प्रतिवेदन आर्थिक वर्ष २०७९८० पेश गर्ने कार्सूची छ। उद्योग वाणिज्य तथा आपूर्ति मन्त्री दामोदर भण्डारीले लगानी सहजीकरण सम्बन्धी केही नेपाल ऐनलाई संशोधन गर्ने अध्यादेश २०८१ पेश गर्ने संभावित कार्यसूचीमा उल्लेख छ। उपप्रधान एवं गृहमन्त्री रवि लामिछानले राजनीतिक दलसम्बन्धी 'दोस्रो संशोधन विधेयक २०८०' लाई फिर्ता लिने प्रस्ताव प्रस्तुत गर्ने संभावित कार्यसूची छ।
पार्टीभित्र आन्तरिक छलफलपश्चात कांग्रेसतर्फका कार्यदल सदस्य पुन : बैठकमा,"काठमाडौं : कांग्रेसभित्र आन्तरिक छलफलपश्चात कांग्रेसतर्फका सदस्यहरु पुन: कार्यदलको बैठक सुरु भएको छ। सत्ता पक्ष र प्रतिपक्ष आआफ्नै अडानमा रहँदा आइतबार बिहान बसेको संसदीय छानबिन समितिको कार्यादेश टुंग्याउन बसेको कार्यदलको बैठकमा टीओआर टुंग्याउन बाँकी रहेको हो। कानुन न्याय तथा संसदीय मामिला मन्त्रालयमा आइतबार बसेको कार्यदलको बैठकमा कांग्रेस सैद्धान्तिक रुपमा सहमति भएपनि केहि विषयमा सहमति हुन नसक्दा बैठक रोकेर कार्यदलका सदस्यहरु महामन्त्री गगन थापा र प्रमुख सचेतक रमेश लेखकलाई मस्यौदाको ब्रिफिङ गर्न पुगेका थिए। उनीहरुको निर्देशन पश्चात कार्यदलको बैठकमा सहभागी भएका हुन्। कार्यादेशमा उपप्रधानमन्त्री गृहमन्त्री रवि लामिछानेको नाम राख्ने कि नराख्ने भन्ने विवाद कायमै छ। गोलमोटोल कुरा गरेर सत्तापक्ष मूल मुद्दाबाट भागेको कांग्रेसले आरोप लगाएको छ। लामिछाने जोडिएका सहकारीको नाम राख्न कार्यदलका सदस्यहरु सकारात्मक छन्। कार्यदलका सदस्यहरुबीच भएको सहमतिको मस्यौदामाथि कांग्रेसमा आन्तरिक छलफलमा गृहमन्त्री लामिछानेको नाम राख्नैपर्ने जोड छ। उनीहरुले गृहमन्त्री र गोर्खा मिडियाले रकम अपचलन गरेका सहकारीको नाम नराख्दा कांग्रेसले संसद्मा राख्दै आएको माग पूरा नहुने उनीहरुको भनाई छ। संसदीय समितिको कार्यादेश (टीओआर) बारे कार्यदलस्तरमा भएको छलफलमा अधिकांश विषयमा सहमति नजिक पुगेको एमालेका प्रमुख सचेतक महेश बर्तौलाले जानकारी दिए। उनले भने,सहमति नजिक पुगेका छौं तर बैठक टुंगिएको छैन, मोटामोटी छलफल भएको छ। एकाध विषयमा कांग्रेसको असहमति छन्। सैद्धान्तिक रुपमा सहमति भएपनि बुँदागत रुपमा आज बेलुकासम्म टुंगिन सक्छ। विषयगत,नीतिगत र कानुनी रुपमा कसरी लाभ हुन सक्छ भनेर टीओआर टुंग्याउनुपर्ने भएकाले सहमत हुन समय लाग्ने उनले बताए। समग्र समस्याग्रत सहकारीको समाधान होस्, संसदीय छानबिन समिति भनेको सांसदहरुको संलग्नतामा हुने समिति हो, त्यसले अनुसन्धान अधिकारीको रुपमा कति काम गर्न सक्छसक्दैन त्यो पनि याद गरौं। बर्तौलाले भने, नीतिगत र कानुनी पक्षमा कसरी लाभ हुने गरी कसरी पुग्न सकिन्छ भन्ने ठाउँबाटै टीओआर निर्माण गरौं भन्ने सहमति भएको छ।"
प्रतिनिधिसभा बैठक फेरि सर्यो,"काठमाडौं : प्रतिनिधिसभा बैठक फेरि सरेको छ। बैठक आजै बेलुका ४:३० बजेलाई सारिएको संघीय सचिवालयले जनाएको छ। यसअघि बिहान ११ बजेका लागि बोलाइएको बैठक दिउँसो २ बजेलाई सारिएको थियो। संसदीय छानबिन समितिको कार्यादेशमा टुंगो लगाउन सत्ता पक्ष र प्रतिपक्ष आन्तरिक छलफलमा जुटेपछि बैठक सारिएको हो। सहकारी ठगी प्रकरणमा उपप्रधान एवं गृहमन्त्री रवि लामिछानेमाथि अनुसन्धान गर्न संसदीय छानबिन समिति गठनमा सत्ता पक्ष र प्रतिपक्षबीच सहमति भएको छ। तर ,समितिको कार्यादेशमा सहमति जुट्न सकेको छैन। कार्यादेशमा सहमति जुटाउन कार्यादलको बैठक जारी छ। प्रमुख प्रतिपक्षी दल नेपाली कांग्रेसले कार्यादेशमा सहमति नजुटेसम्म सदनको कामकारवाही अगाडि नबढाउन सभामुख देवराज घिमिरेसमक्ष आग्रह गरेको छ। कांग्रेसले लामो समयदेखि संसदीय छानबिन समितिको माग गर्दै संसदमा अवरोध जनाउँदै आएको छ।"
