शीर्षक,विवरण
बोझिला विमानस्थलहरू,"यातायातको विकास बिना समृद्धिको कल्पना गर्न सकिन्न। विकासको पहिलो आधार यातायात पूर्वाधार हो। जब कि नेपालमा यातायातको पूर्वाधारको विकासलाई नै सम्पूर्ण विकास ठानिन्छ। पहाडी मुलुक नेपालमा यातायातको पूर्वाधारको अभाव छ। राष्ट्रिय राजमार्गहरूकै हालत खराब छ। राजधानी जोड्ने वैकल्पिक राजमार्ग समेत छैन। जिल्लाहरू बल्लतल्ल स्थलमार्गबाट जोडिएका छन्। त्यसैले मोटर पुर्याउन कठिन ठाउँमा जहाज यातायात पुयाउन जरुरी छ। मोटर जान नसक्ने दुर्गम ठाउँमा जहाज जान सक्छ। उडेर जाने जहाजलाई बस्ने ठाउँ भए पुग्छ। जहाज बस्ने ठाउँ अर्थात् विमानस्थल। तर विमानस्थल निर्माण पनि चानेचुने काम होइन। खर्चिलो नै पूर्वाधार हो। अर्काे कुरा विमानस्थल भनेको केवल धावनमार्गमात्रै होइन। जहाजका संकेत र सन्देशहरू आदानप्रदान गर्ने उपकरण र मानव संसाधन पनि सँगसँगै चाहिन्छ। तर नेपालमा पछिल्लो समय जिल्लैपिच्छेजस्तो जहाज ग्राउन्ड अर्थात् विमानस्थल निर्माणको होड नै चल्यो। अनि विमानस्थल पनि धेरै नै बने। दुर्भाग्य के भने ती विमानस्थलसम्म मुलुकका ४६ जिल्लामा विमानस्थल छन्। एउटै जिल्लामा एकभन्दा बढी विमानस्थल पनि छन्। जहाजको आउजाउचाहिँ छैन भन्दा पनि हुन्छ। ५६ वटा विमानस्थलमध्ये ४० वटाभन्दा बढी त बेवारिस जस्तै छन्। त्यहाँ जहाज जाँदैनन्। बरु गौचरन बनेका छन्। यस्तो किन भयो भने विमानस्थल आवश्यकताले भन्दा राजनीतिक पहुँचले बनाइए। यसै पनि नेपालीको त्यस्तो क्रयशक्ति छैन, जसले यातायातको साधन भनेकै जहाज भनेर चढिरहोस्। त्यसमाथि यात्रु। पहाडी जिल्लामा जनसंख्या नै कम छ। अनि यात्रु को पाइने ? नागरिक उड्डयन प्राधिकरण मातहतका दर्जन विमानस्थलले पनि नाफा दिन सकेका छैनन्। अधिकतर घाटामा छन्। यस्तो सेवालाई घाटैघाटामा चलाइरहन आवश्यक छ कि छैन ? उत्तर खोज्नै पर्छ। स्थल यातायातको सबैतिर पहुँच बनाउने र निश्चित केन्द्रहरूमा मात्रै विमानस्थल निर्माण गर्नुपर्ने हो। तर महँगो रहर र नचाहिँदो राजनीतिक फुर्तिफार्तीले मुलुकमा विमानस्थल धेरै भए, तर चलेनन्। राज्यको ठूलो लगानी तिनमा त्यसै खेर गयो। अब बरु चलाउन सक्नेलाई चलाउन प्रयत्न गर्ने तर नयाँ नथप्ने नै गर्नुपर्छ। विमानस्थलहरू यसै त बोझ भएका छन्, अरू थप्नुको कुनै औचित्य छैन। अन्तर्राष्ट्रिय विमानस्थल भनेर पोखरा र भैरहवामा निर्मित विमानस्थलमा अन्तर्राष्ट्रिय जहाज चलेका छैनन् र राष्ट्रलाई ऋणमात्रै थपेका छन्। दुर्गम र जिल्लाजिल्लाका विमानस्थलमा आन्तरिक उडान भएको छैन। दुवैथरीले राज्यलाई भारमात्रै थपे। उपलब्धि दिन सकेनन्।"
असारे विकास नगर्ने वगनासकाली,"समय छँदै काम नसक्ने, हतपत र लतपत गर्दै सक्ने प्रवृत्तिले नेपालको विकासमा बाधा पुयाएकै छ । आर्थिक वर्षको अन्तिम महिना असार जब लाग्छ, तबतब विकासका काम धमाधम गर्न खोजिन्छ वा गरेको जस्तो पारिन्छ र त्यस्तै लतपत भएका कामको भुक्तानी पनि हुन्छ । यस्तो प्रवृत्ति असारे विकासका नाममा बदनामित छ । पाल्पाको वगनासकाली गाउँपालिका यसमा अपवाद देखिएको छ । यो पालिकाले यो वर्ष गर्नुपर्ने जति सबै काम सकेको छ । कुनै योजना बाँकी छैन, जुन हतारहतार असारमा सक्नुपरोस् र भुक्तानी दिनुपरोस् । काम पनि सकिएका छन् र भुक्तानी पनि सबै । सबै योजना पनि जेठमा होइन, वैशाखमै सकिएका हुन् । वगनासकालीले कसरी सक्यो त सबै काम ? उपभोक्ताहरूसँग मिलेर सम्पन्न योजनामात्रै चार सय वटा थिए । तिनलाई चैतभित्रै सक्ने सम्झौता जो थियो । ती त्यसैअनुसार फत्तै भए । ठेक्कापट्टामा लगाएका १६ वटा योजना थिए । तिनलाई वैशाख १५ भित्र सक्ने सम्झौता थियो । ती पनि सकिए । सबै वडामा उपभोक्तासँगका काममा प्राविधिक खटाएर पालिकाले बेलैमा काम गर्न सकेको छ । यो एउटा उदाहरण भएको छ कि पालिकाहरूले चाहँदा बेलामा काम गर्न सकिन्छ । ठेक्कापट्टामा पनि म्याद सकिएपछि फेरि समय थप्ने रोग पनि यहाँ लागेन । प्रदेश र संघ सरकारहरूका थुप्रै काम भने अझै पनि सकिएका छैनन् । धमाधम जेठ असारतिर आएर मात्रै तात्ने प्रवृत्ति छ । भुक्तानी असारमै धेरै हुन्छ । एउटा पालिकाले काम गर्न सक्छ भने प्रदेश र संघले नसक्ने भन्ने कुरै होइन । र देशभरका अरू पालिकाहरूले पनि गर्न सक्छन् । तर काम गर्ने तौरतरिका पनि छैन र अन्तिमअन्तिममा आएर काम सक्दा जस्तो गरे पनि हुने अनि भुक्तानी दिने र लिने गर्ने नियत पनि असारे विकासको मुख्य कारण हो । योजनाहरूको बेलामा सम्झौता गर्ने, नियमित अनुगमन गर्ने र काम सक्न ताकेता गर्ने हो भने असम्भव भन्ने हुँदैन । तर धेरैभन्दा धेरै टुक्रे योजना राख्ने, प्राविधिक जाँच गर्नै नभ्याउने आदि कारण पनि असारे विकासका कारण हुन् । असारे विकासले वास्तवमा देशको धनको विनाशमात्रै गरेको छ । उपलब्धिमूलक विकास हुन सकेको छैन । विसका र समृद्धिका लागि बेलामा काम गर्ने र गुणस्तरीय काम गर्ने बानीको जरुरी छ । वगनासकाली गाउँपालिकाबाट देशभरका सरकारले सिक्न जरुरी छ ।"
