शीर्षक,विवरण
जागिर छाडेर साबुन उद्योग,"सिन्धुपाल्चोक : सिन्धुपाल्चोकको बाह्रबिसे नगरपालिका वडा नं ८ मानेश्वराका ३२ वर्षीय विमल राउत अहिले आफ्नै व्यवसायमा ब्यस्त छन्। जागिरे जीवन छोडेर उनले ६ महिनाअघि गाउँमै मेटा साबुन उद्योग खोलेका छन्। उनी परिवारका सदस्यहरूसँग मिलेर लुगा धुने साबुन बनाइरहेका हुन्छन्। उद्योगबाट राउतले राम्रो आम्दानीसँगै चर्चा पनि कमाइरहेका छन्। आसपासका विभिन्न बजारमा साबुन पुर्याउँछन्। कतिपय भने राउतको कारखानामै पुगेर पनि साबुन खरिद गर्छन्। बजारबाट ल्याउने साबुनको कारखाना गाउँमै स्थापना भएपछि स्थानीय पनि खुशी छन्। साबुन कसरी बनाइन्छ भनेर थाहा नभएकाहरू अहिले साबुन बनाएर बेचिरहेका मात्रै छैनन्, दैनिक रूपमा आवश्यक पर्ने साबुन आफैंंंले बनाउन सकिन्छ भनेर पुष्टि गरिरहेका छन्। आफ्नै गाउँठाउँमा केही गर्नुपर्छ भन्ने सोच भएर साबुन उद्योग सञ्चालनमा ल्याएको राउत बताउँछन्। पहिले देखि नै गाउँमै केही गर्छु भन्ने लाग्थ्यो, बीचमा विदेश जान्छु भन्ने पनि लाग्यो, अहिले आफ्नै ठाउँमा सानोतिनो उद्योग सञ्चालन गरेको छु, उनी भन्छन्। सुरुवाती चरणमा लुगा धुने साबुन मात्र बनाइरहेका उनले बजारको अध्ययन पछि नुहाउने साबुन र डिटर्जेन्ट पनि बनाउने लक्ष्य रहेको सुनाए। आफ्नो नयाँ ब्राण्ड भएपछि बजारमा नाम चलेका ब्राण्डहरूसँग प्रतिस्पर्धा गर्न कठिन हुने राउतको भोगाइ छ। सुरुवाती अवस्थामा आफूहरूले उत्पादन गरेको साबुनले बजार पाउन निकै मुस्किल हुने गरेको स्मरण गर्दै उनले भने सानो व्यवसाय गर्नेलाई ठूलो लगानीका व्यवसायीलाई जस्तो सहज नहुँदो रहेछ। सुरुवात गर्दा विभिन्न समस्या बेहोर्नुपर्यो। तर, साबुन लगेर प्रयोग गर्नेहरूबाट भने सकारात्मक प्रतिक्रिया पाएको उनी बताउँछन्। अहिलेसम्म सिन्धुपाल्चोक जिल्लाका बाह्रबिसे, भोटेकोशी, बलेफी गाउँपालिकामा उनको ब्राण्डले बजार पाउन थालेको छ। मागअनुरूप उत्पादन पनि बढाउँदै लैजाने उनको योजना छ। जिल्लाभरि नै आफ्नो उत्पादन टिकाइराख्ने उनको लक्ष्य छ। उत्पादनले राम्रो बजार पायो भने अन्य युवालाई समेत रोजगारी दिनेमा राउत विश्वस्त छन्। उनले स्थानीय उत्पादनलाई प्रोत्साहन दिन र युवाहरूलाई स्वदेशमै रोजगार बनाउने उद्देश्यमा सहयोग गर्न अनुरोधसमेत गरे। उनले सुरुवाती चरणमा २५ लाखको लगानीमा साबुन उद्योग सञ्चालन गरेका थिए। अहिले सुरुवाती चरणमा खर्च कटाएर मासिक ३० देखि ३५ हजारसम्म आम्दानी भइरहेको उनी बताउँछन्। कम्पनी दर्तासँगै जिल्ला घरेलु कार्यालय सिन्धुपाल्चोकमा उद्योग दर्ता गरेर आफ्नो काम अगाडि बढाएका राउतले सुरुमा तालिम लिएर सीप सिकेको बताए। आफ्नै ठाउँमा केही गर्नुपर्छ भनेर साबुन उद्योग सञ्चालनमा ल्याएको छु, उनले भने यहाँबाट उत्पादित साबुन खपत गराउनका लागि स्थानीय सरकारले केही प्रयास गरिदिए हामीजस्ता साना उद्यमीहरूको मनोबल बढ्नेछ।"
किसान सूचीकरण गर्न पालिकाहरूको ढिलासुस्ती,"परासी : सरकारले सञ्चालन गरेको किसान सूचीकरण कार्यक्रम नवलपरासीमा भने सुस्त गतिमा भएको पाइएको छ। कृषि तथा पशुपन्छी विकास मन्त्रालयले किसानलाई वर्गीकरण गर्ने उद्देश्यले तथ्यांक संकलन गरिरहेको छ। २०७७ सालबाट सरकारले राष्ट्रिय अभियानकै रूपमा यो कार्यक्रम देशभर नै सञ्चालन गरेको हो। देशका विभिन्न स्थानमा किसानको सूचीकरण कार्य अघि बढे पनि नवलपरासीका स्थानीय तहहरूले भने यसमा ढिलासुस्ती देखाएका छन्। किसानहरूको सूचीकरण कार्य सम्बन्धित वडाहरूबाट गरिन्छ। राष्ट्रिय जनगणना २०७८ अनुसार जिल्लाका सात पालिकामा कुल ५५ हजार ९८ जना किसान छन्। केही पालिकाहरूले किसानको तथ्यांक लिने काम गरे पनि उक्त काम भने सुस्त गतिमा भइरहेको छ। किसानको सूचीकरण गर्नका लागि पालिकाहरूमा गणकहरू छन्। किसानको घर घरमा पुगेर तथ्यांक संकलन गर्न गणकहरूलाई राखिएको हो। केही पालिकाहरूले घरमै पठाएर तथ्यांक संकलन गरेका छन्। केहीले भने वडा कार्यालयमा सूचना निकालेर तथ्यांक संकलन गरेको जनाएका छन्। तर, त्यसलाई निरन्तरता दिन नसक्दा जिल्लामा किसान सूचीकरणको संख्या कम देखिएको छ। सुरु चरणमा गणकहरूले किसानको तथ्यांक संकलन गरेपछि त्यसको विवरण सफ्टवेयरमा प्रविष्ट गरिन्छ। प्रविष्ट गरेको तथ्यांक वडा समितिले स्वीकृत गर्नुपर्ने हुन्छ। स्वीकृत विवरण पालिकामा पठाएपछि किसानको वर्गीकरण गरी परिचयपत्रको प्रक्रिया सुरु हुने गर्छ। तर, वडा समितिहरूले प्रविष्ट गरेका तथ्यांकको स्वीकृत गर्न ढिला गर्दा अन्य प्रक्रिया अघि बढ्न नसकेको सम्बन्धित पालिकाका कर्मचारीहरूले बताएका छन्। जिल्लाका ६ पालिकाले किसानहरूको विवरण संकलन गरेर सफ्टवेयरमा प्रविष्ट गरेका छन्। पाल्हिनन्दनले भने उक्त कार्यसमेत सुरु नगरेको कृषि ज्ञान केन्द्रका प्रमुख रवीन्द्र चौवेले बताए। किसानको तथ्यांक प्रविष्ट गरेका पालिकाले पनि पूरै किसानको तथ्यांक लिएका छैनन््। जिल्लाका किसानको संख्याका आधारमा आधाको पनि तथ्यांक संकलन हुन सकेको छैन। जिल्लाका ६ पालिकाले २७ हजार २३९ किसानको मात्र विवरण प्रविष्ट गरेको कृषि ज्ञान केन्द्रका कृषि अधिकृत नवीन गैरेले जानकारी दिए। जसमध्ये सुस्ता र प्रतापपुरले मात्र प्रविष्ट गरेका किसानहरूको तथ्यांकलाई स्वीकृत गरेका छन्। सुस्ताले ४ हजार ८३१ किसानको तथ्यांक प्रविष्ट गरेकोमा २ हजार ७४८ जनाको स्वीकृत गरेको छ। त्यस्तै ७ हजार ४६९ किसानको तथ्यांक संकलन गरी सफ्टवेयरमा नाम प्रविष्ट गरेको प्रतापपुरले ५ हजार ७२५ किसानको नाम स्वीकृत गरेको छ। बाँकी ४ पालिकाले तथ्यांकलाई प्रविष्ट गराए पनि स्वीकृत गरेका छैनन््। सूचीकरणका लागि काम सुरु गरेका पालिकामध्ये बर्दघाटले १ हजार ६७, रामग्रामले ९ हजार ५ सय २२, सुनवलले १ हजार ६८० र सरावलले २ हजार ६५४ किसानको नाम प्रविष्ट गरेको कृषि अधिकृत गैरेले जानकारी दिए। सूचीकरणका लागि पालिकाहरूले प्रचारप्रसार गर्न नसक्नुले पनि किसानहरू त्यसबारे अनविज्ञ हुँदा तीव्र रूपमा विवरण संकलन हुन नसकेको बताइएको छ। किसानहरूलाई वर्गीकरण गरी परिचय पत्र प्रदान गर्नका लागि सुरु गरिएको यो कार्यक्रमअन्तर्गत सुरुमा सूचीकरणको चरण पुरा गर्नुपर्ने हुन्छ। त्यसका लागि नागरिकता, जग्गाधनी पूर्जा, लिजमा लिएको भए सो को प्रमाण आवश्यक रहन्छ। अन्य विवरण भने सफ्टवेयरमा उल्लेख भएअनुसार किसानले गणकहरूलाई मौखिक रूपमा उपलब्ध गराउन सक्ने छन्। सूचीकरणका लागि किसानको जग्गा अनिवार्य गरिएको छैन। मुख्य पेसा कृषि बनाएको र ६ महिनादेखि कृषि पेसामा संलग्न भएको किसानहरू सूचीकरण हुन पाउने प्रावधान रहेको कृषि ज्ञान केन्द्रले जनाएको छ।"
टीओआरमा सहमति जुट्न नसकेपछि प्रतिनिधिसभा बैठक सर्यो,"काठमाडौं : आइतबार बिहान ११ बजेका लागि बोलाइएको प्रतिनिधिसभा बैठक सरेको छ। बैठक दिउँसो २ बजे बस्नेगरी बोलाइएको संघीय संसदले जनाएको छ। संसदीय छानबिन समितिको कार्यादेश टुंगाउन बसेको कार्यदलको बैठक लम्बिएपछि संसद् बैठक सरेको हो। अहिले कार्यदलको बैठक सिंहदरबारमा जारी छ। सहकारी ठगी प्रकरणमा उपप्रधान एवं गृहमन्त्री रवि लामिछानेमाथि छानबिन गर्न संसदीय समिति गठन गर्न सत्ता पक्ष र विपक्षी दल सहमत भएका छन्। तर, समितिको कार्यदेशामा सहमति जुट्न सकेको छैन।"
बेसारबाट आयआर्जन,"गुलरिया : गुलरिया नगरपालिका ८ थपुवाकी मिना थारू बेसारबाट आम्दानी भएपछि दंग छिन्। ५ कठ्ठा क्षेत्रफलमा लगाएको बेसार ४२ क्विन्टल फल्यो। बिना झन्झट थोरै मेहनतमै पनि राम्रो उत्पादन पाएकी उनी काँचो बेसार बेचेरै ८४ हजार रुपैयाँ आम्दानी गर्न पाउँदा खुसी छन्। बेसार लगाएपछि गोडमेल गर्न, मलपानी हाल्न झन्झट नपर्ने भएकाले सजिलो भयो। उनले भनिन् थोरै जमिनमा धेरै उत्पादन हुने आम्दानी पनि हुने बेसार खेती धेरै सजिलो लाग्यो। सुनौलो महिला विकास बहुउद्देश्यीय सहकारी संस्था लिमिटेड गुलरिया ६ बर्दियाले बेसार प्रशोधन केन्द्र स्थापना गरेपछि उत्पादित काँचो बेसारले सजिलै बजार पाएको छ। लुम्बिनी प्रदेश सरकार कृषि तथा भूमि व्यवस्था मन्त्रालय पशुपक्षी तथा मत्स्य विकास निर्देशनालयअन्तर्गत एकीकृत कृषि तथा पशुपंक्षी विकास कार्यालय बर्दियाको सहयोगमा बेसार प्रशोधन केन्द्र सञ्चालन गरेको हो। सहकारी संस्थाको समेत सहलगानीमा स्थापना गरिएको प्रशोधन केन्द्रमा वासिङ मेसिन, पिलर मेसिन, ड्रायर मेसिनलगायत प्याकेजिङ मेसिन रहेको सहकारीकी अध्यक्ष इन्दिरा सुवेदीले जानकारी दिइन्। प्रदेश सरकारको १७ लाख २ हजार ४६९, संस्थाको ५ लाख ६७ हजार ४८९ गरी २२ लाख ६९ हजार ९५९ रूपैयाँको लागतमा मेसिनरी जडान गरेका छौं।, उनले थपिन्, प्रशोधन केन्द्रमार्फत बेसार पाउडर उत्पादन गरी बिक्री वितरण गर्ने हाम्रो लक्ष्य छ। जसबाट २ सय ३० जना महिला लाभान्वित हुनेछन्। बेसार प्रशोधन केन्द्र स्थापनासँगै महिलाको आयआर्जनमा पहुँच पुग्ने अध्यक्ष सुवेदीले विश्वास व्यक्त गरिन्। मेसिन जडान त गर्यौं कच्चापदार्थ नपाए हामीलाई समस्या पर्छ। किसानहरू अनुदान पाउँदा बेसार खेतीतर्फ आकर्षित हुन्छन्। अनुदान नपाए लगाउन मन गर्दैनन्। यसवर्ष कृषि तथा पशुपक्षी विकास कार्यालयसँग सहकार्य गर्दै बाँसगढीलगायत जंगल किनारका कृषकहरूलाई बेसारको बीउ अनुदान वितरण भएपछि कच्चा पदार्थ पाइने आशा व्यक्त गरिन्। गुलरिया नगरपालिकाका प्रमुख प्रसासकीय अधिकृत ओमकार शाहले सहकारीले उत्पादन गरेको बेसार बजारीकरणमा नगरपालिकाले सहजीकरण गर्ने बताए। उनले भने महिला सहकारीले सञ्चालन गरेको मसलाजन्य बेसार उद्योगले नगरको आर्थिक प्रबद्र्धनमा टेवा पुग्ने भएकाले पनि नगरले यसको प्रबद्र्धन गर्ने योजना बनाएको उनले बताए। गुलरिया नगरपालिकाका प्रवक्ता एवम् वडा नम्बर ६ का वडाध्यक्ष शुधांसु प्रकाश शर्माले वडाका महिलाहरूले मेहनतका साथ सञ्चालन गरेको बेसार प्रशोधन केन्द्रलाई उचाइमा पुर्याउन वडाले भरपुर सहयोग गर्ने बताए। स्थानीय महिला समूह तथा किसानले रासायनिक मलखाद र विषादी प्रयोग नगरी उत्पादन गरेको बेसार संकलन गरी तयार पारिएको सुद्ध बेसारले नगरसँगै जिल्लाकै पहिचान वृद्धि हुने प्रवक्ता शर्माले बताए।"
सुनको मूल्य तोलामा १६ सयले वृद्धि,काठमाडौं : स्थानीय बजारमा पहेँलो धातुको मूल्य आज तोलामा एक हजार छ सयले वृद्धि भएको छ । नेपाल सुनचाँदी व्यवसायी महासङ्घका अनुसार छापावाला सुन शुक्रबार तोलामा एक लाख ३९ हजार तीन सयमा कारोबार भएकामा आजका लागि भने एक लाख ४० हजार नौ सय निर्धारण गरिएको छ । यस्तै तेजाबी सुन शुक्रबार प्रतितोला एक लाख ३८ हजार छ सय ५० मा कारोबार भएकामा आजका लागि भने एक लाख ४० हजार दुई सय निर्धारण भएको छ । रासस
