शीर्षक,विवरण
दुई महिनापछि खुले मुस्ताङका विद्यालय,"मुस्ताङ : मुस्ताङका सामुदायिक विद्यालयमा पठनपाठन सुरुआत भएको छ। दुई महिना हिउँदे बिदापछि जिल्लाका बारागुङ, घरपझोङ र थासाङ गाउँपालिकाका विद्यालय पुनः सञ्चालनमा आएका हुन्। हिउँदयामको पुस र माघ महिनामा हिमपात र अत्यधिक चिसोले बालबालिकाको शिक्षण सिकाइ क्रियाकलाप प्रभावित हुने तल्लो मुस्ताङका सामुदायिक विद्यालयले विद्यार्थीलाई लामो हिउँदे बिदा दिने गर्दछन्। हिउँदयाममा स्थानीय तहका विद्यालयलाई दुई महिना लामो हिउँदे जाडो बिदा दिने गरिन्छ। उपल्लो मुस्ताङको लोमान्थाङ र लोघेकर दामोदरकुण्ड गाउँपालिकाअन्तर्गतका सामुदायिक, गुम्बा, आमची र संस्थागत विद्यालय भने हिउँदयाममा साविक स्थान छाडेर बेँसीमा झारिने शिक्षा विकास तथा समन्वय एकाइ प्रमुख रामेश्वर लामिछानेले बताए। जिल्लामा ३५ सामुदायिक विद्यालय छन्। गुम्बा, आमची र संस्थागत गरी १२ विद्यालय सञ्चालनमा छन्। जिल्लाका ४७ विद्यालयमध्ये घरपझाङ, थासाङ र बारागुङ मुक्तिक्षेत्र गाउँपालिकाका २४ विद्यालयले बर्सेनि हिउँदे बिदा दिने गरेका छन्। यसरी दुई महिना लामो हिउँदे जाडो बिदा दिएका विद्यालयले फागुनको पहिलो सातादेखि क्रमशः शिक्षण सिकाइ क्रियाकलापलाई निरन्तरता दिने गर्छन्। जिल्लामा दुई महिना लामो हिउँदे बिदाका लागि ४५ दिन वार्षिक सरकारी बिदा र १५ दिन सट्टा बिदा गरी ६० दिन विद्यालयको शैक्षिक पठनपाठन स्थगित गरिने जनाइएको छ। जिल्लाका तीन स्थानीय तहका सामुदायिक विद्यालयहरू फागुनदेखि क्रमशः शैक्षिक पठनपाठन सञ्चालनमा आएको शिक्षा विकास तथा समन्वय एकाइ प्रमुख लामिछानेले जानकारी दिए। उनका अनुसार विद्यालय खुले पनि जिल्ला बाहिर रहेका विद्यार्थी विद्यालय फर्किन थालेका छन्। घरपझोङ, थासाङ र वारागुङ मुक्तिक्षेत्रका अधिकांश सामुदायिक तथा धार्मिक गुम्बा विद्यालयहरूमा शैक्षिक पठनपाठन सुरु भएको एकाइ प्रमुख लामिछानेको भनाइ छ। उनका अनुसार जिल्लाका तीन स्थानीय तहका विद्यालय हिउँदयामको पुस र माघमा विद्यालय पूर्ण रूपमा बन्द हुने भए पनि उपल्लो मुस्ताङका विद्यालयले विद्यार्थीलाई हिउँदे बिदा दिँदैनन्। उपल्लो मुस्ताङका विद्यालयले स्थानीय गाउँपालिकाको सिफारिसमा विद्यार्थीलाई घुम्ती कक्षा चलाउन बेँसी स्थान्तरण गर्ने प्रचलन छ। चिसोले बालबालिकाको स्वास्थ्यमा असर पर्ने विद्यालयको शैक्षिक क्रियाकलाप सञ्चालन गर्नसमेत बाधा पुग्ने भएकाले उपल्लो मुस्ताङका विद्यालयहरूले विद्यार्थीलाई पोखराका विभिन्न स्थानमा लगेर शैक्षिक क्रियाकलाप गर्ने गर्छन्। उपल्लो मुस्ताङका विद्यालय जाडो छल्दै घुम्ती कक्षा चलाउन कात्तिक अगावै बेँसीको न्यानो स्थानमा स्थान्तरण गर्ने प्रचलन रहेको लोमान्थाङ गाउँपालिकाका प्रशासन प्रमुख विकास केशीले जानकारी दिए। लोमान्थाङ गाउँपालिकाको तीन सामुदायिक विद्यालयको पोखरामा आफ्नै भवनमा घुम्ती कक्षा चलाउने गरेको उनले बताए। यसैगरी उपल्लो मुस्ताङको लोघेकर दामोदरकुण्ड गाउँपालिकाका आठ सामुदायिक विद्यालयमध्ये सात विद्यालयलाई जाडो छल्न बेँसी झारिएको थियो। गाउँपालिकाको घमी आधारभूत विद्यालय भने जाडो छल्न बेँसी नझरी दुईमहिने हिउँदे बिदा दिएको थियो। घमी आधारभूत विद्यालय हिउँदे बिदापछि सञ्चालनमा आएको र बाँकी सात सामुदायिक विद्यालयले घुम्ती कक्षाका रूपमा बेँसीमै रहेको गाउँपालिका अध्यक्ष लोप्साङ छोम्फेल बिष्टले जानकारी दिए। लोघेकरका विद्यालय आपसमा अस्थायी मर्ज गरी दुई स्थानमा घुम्ती कक्षा सञ्चालनमा रहेको अध्यक्ष बिष्टले बताए। तल्लो मुस्ताङका विद्यालय दुईमहिने लामो बिदापछि खुले पनि उपल्लो मुस्ताङका विद्यालय भने गर्मीयाम लागेपछि वैशाखमा साविककै स्थानमा फर्किएर शिक्षण सिकाइ क्रियाकलापलाई नियमित गर्छन्। सरकारले गत वर्षदेखि देशभर शैक्षिक सत्रमा एकरूपता ल्याएपछि हिमाली जिल्लाको शैक्षिक क्रियाकलापमा अप्ठ्यारो पर्दै आइरहेको छ। यसअघि हिमाली जिल्लामा पुसअगावै चालु शैक्षिकसत्र सकेर फागुनमा नयाँ शैक्षिकसत्रको पठनपाठन सुरु गर्ने गरिन्थ्यो। शैक्षिकसत्र एकरुपताले हिमाली क्षेत्रमा पढ्ने विद्यालयका बालबालिकाको शिक्षण सिकाइ क्रियाकलापमा बाधा पुग्ने गरेको जनहित माध्यमिक विद्यालयकी व्यवस्थापन समिति सदस्य सम्झना थकालीले बताए। उनका अनुसार हिउँदे दुईमहिने बिदाले विद्यार्थीले पढेका र सिकेका सिकाइ उपलब्धि बिर्सने भएकाले शैक्षिक नजितामा असर पुग्ने गरेको छ। सरकारले हिमाली क्षेत्रको शैक्षिकसत्र कार्यान्वयनमा पुनर्विचार गर्नुपर्ने आवश्यकता रहेको उनको भनाइ छ।"
नुवाकोटको सडकमार्गमा टाइम कार्ड लागू,"नुवाकोट : नुवाकोटको सडकमार्गमा पहिलो पटक टाइम कार्ड प्रणाली लागू गरिएको छ। पहिलो चरणमा सो टाइम कार्ड प्रणाली त्रिशूलीछहरेटोखामाछापोखरी सडकमा लागू गरिएको हो। जिल्ला प्रशासन कार्यालय नुवाकोटमा सरोकारवालाहरूको संयुक्त बैठकले सडक मार्गमा सवारी दुर्घटना बढेपछि टाइम कार्ड प्रणाली लागू गर्ने निर्णय गरेको हो। सरोकारवालाहरूको निर्णय अनुसार यही फागुन १५ गते बिहीबारदेखि पहिलो चरणमा ५५ किलोमिटर दूरीको त्रिशूलीछहरेटोखामाछापोखरी सडकमा लागू गरिएको हो। यसबाट यातायात दुर्घटना न्यूनीकरण भई धनजनको क्षति हुनबाट जोगिने जिल्ला प्रशासन कार्यालय नुवाकोटले जनाएको छ। त्रिशूलीछहरेटोखामाछापोखरी सडक खण्डमा सञ्चालन भइरहेका सार्वजनिक यातायातका साधनका लागि टाइम कार्ड लागू गरिएको प्रमुख जिल्ला अधिकारी रामकृष्ण अधिकारीको भनाइ छ। उनका अनुसार उक्त सडक खण्डमा सार्वजनिक यातायातहरू बढी दुर्घटनामा हुन थालेपछि टाइमकार्ड प्रणाली लागू गरिएको हो। सडकको क्षमता र प्रकृति अनुसार टाइमकार्डको सीमाभित्र रहि सञ्चालन गर्न गराउनका लागि समेत आग्रह गरिएको सहायक प्रजिअ कृष्णप्रसाद हुमागाईंद्वारा जारी विज्ञप्तिमा जनाइएको छ। यही फागुन १२ गते यातायात व्यवसायी सहित सम्बन्धित पक्ष र सरोकारवालासँगको बैठकपछि सो निर्णय गरिएको जनाइएको छ। काठमाडौंको सामाखुशीबाट ५० किलोमिटरको यात्रापछि नुवाकोटको गंगटे पुग्न सकिन्छ। नुवाकोट प्रवेशका लागि सो मार्ग सबैभन्दा छोटो दूरीको बाटो हो। बाटोको अवस्था साँघुरो र घुम्ती बढि भएकाले द्रुत गतिमा सवारी सधान सञ्चालन भए दुर्घटनाको सम्भावना बढि हुने गरेको जिल्ला ट्राफिक प्रहरी कार्यालयले जनाएको छ। सोही कारण पटकपटक दुर्घटना हुँदै आएको छ। पछिल्लो समय उक्त सडकमा साना गाडी बढि चल्ने गरेका छन्। सवारीसाधानहरू समयमा गन्तव्यमा पुगे नपुगेका विषयमा भने ट्राफिक प्रहरीले निगरानी गर्ने बताइएको छ। पछिल्लो समय उक्त सडकबाट दैनिक दुई हजार भन्दा सवारी साधन ओहोरदोहोर गर्ने अनुमान गरिएको छ। जिल्ला ट्राफिक कार्यालयका नुवाकोटका अनुसार उक्त सडकलाई दुई खण्डमा विभाजन गरिएको छ। जसअनुसार पहिलो खण्डमा ढिकुरेदेखि छहरे र दोस्रो छहरेदेखि गुर्जेभन्ज्याङ रहेको छ। सो अनुसार ढिकुरेबाट छहरेसम्म ५ दशमलव ४ किमीका लागि २० मिनेट र छहरेबाट गुर्जेभन्ज्याङ १९ दशमलव ७ किमिका लागि ५० मिनेट समय निर्धारण गरिएको छ। पछिल्लो समय नुवाकोट, काठमाडौंका लागि सहज र छोटो बाटोमा रूपमा उक्त सडकलाई लिने गरिएको र यातायातका साधन र यात्रुहरूको चाप बढिरहेको शिवपुरी गाउँपालिका अध्यक्ष गोविन्दप्रसाद थपलियाको भनाइ छ। नुवाकोटमा नमस्ते पासाडल्हामु यातायात प्रालि, टिमुरे यातायात, त्रिशूली यातायात र नेपाल माइक्रो कम्पनीले सार्वजनिक यातायात सञ्चालन गर्दै आएका छन्।"
