शीर्षक,विवरण
धार्मिक पर्यटनका लागि सूदुरपश्चिम भर्जिन क्षेत्र : मन्त्री पाण्डे,"काठमाडौं: संस्कृति पर्यटन तथा नागरिक उड्डयनमन्त्री बद्री पाण्डेले सुदूरपश्चिम प्रदेश धार्मिक पर्यटन क्षेत्रका रूपमा भर्जिन क्षेत्र रहेको बताएका छन्। बिहीबार सुदूरपश्चिम पर्यटन व्यवसायीहरूसँगको छलफलका क्रममा मन्त्री पाण्डेले उक्त कुरा बताएका हुन्। 'सुदूरपश्चिम पर्यटकीय रूपमा भर्जिन छ। तर पनि राज्यबाट पछि परेको छ। मानव विकास सूचकांकका दृष्टिकोणले समेत पछाडि परेको छ,उनले भने, 'यसका लागि हामीले सुदूरपश्चिमको पर्यटकीय क्षेत्रको विकास लागि राजनीति दल सरोकारवालाहरूसँग छलफल गरेर अघि बढ्नेछु।' मन्त्री पाण्डेले ५ सय भन्दा बढी पर्व र १३० वटा भाषा भएको उल्लेख गरे । उनले भाषा सभ्यता,संस्कृति,भेषभुषा र पर्यटकीय दृष्टिकोणले मुलुक धनी भएको बताए। संस्कृति र पर्यटनलाई चलायनमान बनाउने र त्यसलाई सुनिश्चित बनाउनका लागि नागरिक उड्डयनको क्षेत्रलाई प्रभावकारी बनाउन बनाउन सकेमा देशमा आर्थिक वृद्धि हुने उल्लेख गरे। उनले मन्त्रालयको समग्र विषयवस्तु बुझिसकेको र अब प्राथमिकरणका आधारमा अघि बढ्ने समेत दावी गरे। साथै उनले नीतिगत र कानुनी रूपमा भएका त्रुटिहरू समेत संशोधन गर्दै अघि बढिरहेकोमा प्रस्ट पारे।"
सुनसरीको सीमा क्षेत्रमा मानव बेचबिखन विरुद्धको अभियान,"धरान : सुनसरीको नेपालभारत सीमा क्षेत्रमा मानव बेचबिखन विरुद्धको अभियान सुरु गरिएको छ। सीमा क्षेत्रमा मानव बेचबिखनका घटनाहरूलाई नियन्त्रण गर्न जिल्ला प्रहरी कार्यालय सुनसरीले यो अभियान सञ्चालन गरेको एसपी विपिन रेग्मीले बताए। प्रहरीले सुनसरीका कोशी गाउँपालिका, भोक्राहा नरसिंह गाउँपालिका, हरिनगरा गाउँपालिका, बर्जु गाउँपालिका र देवानगन्ज गाउँपालिकाका सीमा क्षेत्रमा मानव बेचबिखन विरुद्धको जनचेतना अभियान सञ्चालन गरिएको एसपी रेग्मीले बताए। उनले प्रहरी साझेदारी कार्यक्रमअन्तर्गत मानव बेचबिखन विरुद्धको राष्ट्रिय दिवसको अवसरमा सुनसरी मातहतका प्रहरी कार्यालयमार्फत मानव बेचबिखन तथा ओसारपसार नियन्त्रणसम्बन्धी सचेतनामूलक कार्यक्रम सञ्चालन गरिएको बताए। प्रहरीले सीमा क्षेत्रका स्थानीय भद्रभलादमी, बुद्धिजीवी, समाजसेवी र जनप्रतिनिधिहरूलाई उपस्थित गराई मानव बेचबिखन तथा ओसारपसारविरुद्ध सचेतनामूलक प्रशिक्षण दिइएको एसपी रेग्मीले बताए। सुनसरीमा नेपालभारत सीमा क्षेत्रबाट मानव बेचबिखनका घटना घटिरहेकाले यसको नियन्त्रण गर्न प्रहरीले अभियान सञ्चालन गरेको जिल्ला प्रहरी कार्यालयका प्रवक्ता डीएसपी नवीनकृष्ण भण्डारीले बताए।"
आत्मकथा बेच्दै महावीर वीरगन्जमा,"वीरगन्ज : २१ वर्षअघि बन्द गरिएको वीरगन्ज कृषि औजार कारखाना पुनः सञ्चालनका लागि आर्थिक श्रोत जुटाउन राष्ट्रिय आविष्कार केन्द्रका अध्यक्ष महावीर पुन वीरगन्ज आइपुगेका छन्। पुन आफ्नो आत्मकथा लेखिएको पुस्तक बेच्ने देश दौडाहा अभियानमा छन्। बिहीबार बिहान वीरगन्जको व्यस्त चोक घण्टाघरमा आफूले लेखेको किताब बेच्दै गरेको अवस्थामा भेटिएका पुनले भने, अहिलेसम्म १ लाख ३० हजार बढी थान यो किताब बेचिसकेको छु। त्यसबाट ९ करोड ७५ लाख रुपैयाँ जम्मा पनि भइसकेको छ। ३ लाख थान किताब बेच्ने लक्ष्य राखेका पुनले भने, अहिलेसम्म ३४ जिल्ला पुगेर किताब बेचिसकेको छु। अब ४३ जिल्लामा पुग्न बाँकी छ। ३ लाख किताब बेच्न सकियो भने साढे २२ करोड रुपैयाँ जम्मा हुन्छ। त्यतिले कृषि औजार कारखाना मज्जाले फेरि पहिलेकै जस्तै चल्छ। २०८० पुष २३ मा बैतडीबाट किताब बेच्ने अभियान सुरु गरेका पुनले अहिलेसम्म पुगेको हरेक जिल्लामा मानिसले स्वःस्फूर्त रूपमा आफ्नो किताब किन्ने गरेको बताए। उनले भने, सबैभन्दा बढी मेरो यो किताब रुपन्देही जिल्लामा १७ हजार थान बिक्री भयो। आशा छ ५६ दिनको वीरगन्ज बसाईमा त्यो रेकर्ड वीरगन्जले तोड्नेछ। सोभियत संघ रुसको सहयोगमा २०२१ सालमा स्थापित सरकारी स्वामित्वको वीरगन्ज कृषि औजार कारखाना निरन्तर घाटामा गएको भन्दै सरकारले २०५९ सालमा पूर्ण रूपमा बन्द गरिदिएको थियो। दुई दशकदेखि बन्द उक्त कारखाना पुन चलाउन भन्दै सरकारले २०७९ भदौं ३१ मा राष्ट्रिय आविष्कार केन्द्रलाई जिम्मा दिने निर्णय गर्यो। त्यसपछि आविष्कार केन्द्र र अर्थ मन्त्रालयबीच २०७९ असोज ११ गते सम्झौता भयो। उक्त सम्झौता पत्रमा कारखानाको मर्मतसम्भार लगायतका कामका लागि आवश्यक बजेट अर्थ मन्त्रालयले आविष्कार केन्द्रलाई उपलब्ध गराउनुपर्ने उल्लेख थियो। कारखाना पुनः सञ्चालनका लागि विकल्प सुझाउन कृषि मन्त्रालयले गठन गरेको कार्यदलले तयार पारेको प्रतिवेदनमा कारखाना मर्मत सम्भार गरी पुन सञ्चालनमा ल्याउन ३० करोड रुपैयाँ आवश्यक पर्ने उल्लेख गरिएको थियो। तर अर्थ मन्त्रालयले आवश्यक बजेट दिन चासो नै नलिएपछि आविष्कार केन्द्रका अध्यक्ष पुनले आवश्यक रकमको जोहो गर्न आफैं अगाडि सर्दै आफ्नो आत्मकथा लेखेको पुस्तक बेच्न २०८० पुसदेखि देश दौडाहा अभियान सुरु गरेका हुन्। अध्यक्ष पुनले अहिलेसम्म कारखानाको मर्मत सम्भारमा आविष्कार केन्द्रको झण्डै साढे २ करोड रुपैयाँ खर्च भइसकेको जानकारी पनि गराए। आविष्कार केन्द्रले कारखाना जिम्मा लिएको २३ महिनामा कारखानामा रहेका पुराना उपकरण र मेशिनहरू मर्मत सम्भार गरेर हालसम्म १० किसिमका कृषि औजारहरू परीक्षणका रूपमा उत्पादन पनि गरिसकेको पुनले बताए। धान रोप्ने सानो मेसिन, घाँस खुर्किने, ड्याङ बनाउने मेसिन, खाल्डो खन्ने हाते औजार, आलु रोप्ने, आलु गोड्ने, घाँस तथा पराल काट्ने, धान काट्ने सानो मेसिन, प्लास्टिक ओछ्याउने र केराको फाइबर निकाल्ने मेसिन उत्पादन गरिएको उनले बताए। आविष्कार केन्द्रका सहायक मेकानिकल इन्जिनियर अरुण साहले कारखानामा रहेका पुराना सानाठूला गरेर ५५ उपकरणमध्ये ५१ वटा मर्मतसम्भार गरेर सञ्चालन गर्न सकिने बताए।"
"पशुपतिनाथमा तिजको तयारी पूरा, यी स्थानबाट सुरू हुन्छ दर्शन गर्ने लाइन","काठमाडौं : हरितालिका तीजका अवसरमा पशुपतिनाथको दर्शन गर्न आउने भक्तजनका लागि पशुपति क्षेत्रमा सबै तयारी पूरा भएको छ। पशुपति क्षेत्र विकास कोषले बिहीबार पत्रकार सम्मेलनको आयोजना गर्दै हरितालिका तिजको अवसरमा पशुपति दर्शन गर्न आउने दर्शनार्थीहरूका लागि सबै तयारी पूरा भएको जानकारी गराएको हो। मन्दिरको दर्शनका लागि पहिलो लाइन गुह्येश्वरीगौरीघाटउमाकुण्डदक्षिणामूर्तिरुद्रगाडेश्वरवासुकी हुँदै उत्तर ढोकाबाट, दोस्रो लाइन जयवागेश्वरीभुवनेश्वरीशङ्कराचार्य मठ हुँदै फलामेपुलपश्चिम सानो ढोकाबाट मन्दिर प्राङ्गण प्रवेश गर्ने व्यवस्था मिलाइएको पशुपति विकास कोषका प्रवक्ता रेवतीरमन अधिकारीले जानकारी दिए। त्यसैगरी तेस्रो लाइन पिङ्गलास्थानवनकालीचार शिवालय हुँदै पञ्चदेवल पूर्वबज्रघरदक्षिण ढोकाबाट, चौथो लाम बत्तीसपुतलीगौशालातर्फबाट पिङ्गलास्थानवनकालीचार शिवालय हुँदै पञ्चदेवल पूर्वबज्रघरदक्षिण ढोकाबाट मन्दिर प्राङ्गण प्रवेश गर्ने व्यवस्था मिलाइएको उनले बताए। दर्शनार्थीले छिटोभन्दा छिटो दर्शन गरी फर्कन सक्नेगरी बिहान ३ बजेदेखि नै पशुपतिनाथको मन्दिका चारवटै ढोका खोल्ने अधिकारीले जानकारी दिए। उनले मेलामा चोरी र लुटपाटको हुन नदिन भक्तजनलाई बहुमूल्य गरगहना लगाएर नआउन र सकेसम्म साना बालबालिका साथमा लिएर नआउन अनुरोध गरे। नेपाल प्रहरीसँगको समन्वयमा सुरक्षा व्यवस्था कडा पारिने उनको भनाइ छ। त्यसैगरी भक्तजनको सवारी पार्किङका लागि गुह्येश्वरीपारि, सिफलचौर, तिलगङ्गाको खाली स्थान, कोषको कार्यालय परिसर र गौशालास्थित महानगरीय ट्राफिक प्रहरी प्रभागको कार्यालयमा व्यवस्था गरिएको कोषले बताएको छ। कोषले जुत्ताचप्पल राख्ने व्यवस्थाका लागि वरुणधारा, कैलाशडाँडामुनि, कोषको कार्यालय, भुवनेश्वरी, वाग्मतीपारि राममन्दिरको मुनि लगायतका स्थानहरू छुट्याइएको पनि जानकारी दिएको छ।"
कर्णाली करिडोर खार्पुसुनाखाडा खण्ड अवरुद्ध,हुम्ला : कर्णाली करिडोर अन्तरगतको खार्पु सुनखाडा सडक खण्ड पुनः अवरुद्ध भएको छ। जिल्लामा नियमित रूपमा अविरल वर्षासँगै माथिबाट आएको पहिरोका कारण खार्पु सुनखाडा सडकखण्ड पुनः अवरुद्ध भएको हो। एकसाता यता नियमित परेको अविरल वर्षाले खार्पुनाथ गाउँपालिका१ मुस्याडी नजिक पहिरो आउँदा बाटो अवरुद्ध बनेको सर्केगाड गाउँपालिका३ का स्थानीय कर्ण कामीले जानकारी दिए। उनले सडक अवरुद्ध भएपछि सवारी साधन ठप्प भएको बताए। सर्केगाडबाट सिमकोट आवतजावतमा यातायातका साधन मात्र नभई पैदलयात्रुलाई समेत कठिनाइ हुने गरेको स्थानीय कामीको भनाइ छ। सर्केगाडबाट खार्पुसम्म गाडीमा २ हजार र मोटरसाइकलमा ३ हजार रुपैयाँ भाडा लिने गरेको पाइएको छ। तर यो समय बाटो अवरुद्ध हुँदा पैदल मार्ग भएर आवतजावत गर्नुपर्दा निकै कठिनाइ हुने गरेको इलाका प्रशासनका प्रमुख घमानसिंह रावतले बताए। उनले बिहीबार आफू सर्केगाडमा रहेको इलाका प्रशासन कार्यालयमा जाँदै गर्दा बाटो अवरुद्धले सास्ती खेप्नु परेको गुनासो गरे। यसअघि पनि उक्त सडक खण्डको बाटो अवरुद्ध भएको भएपनि गाउँपालिकाले ढुङ्गा माटो पन्छाएर सडक खुलाएको थियो। नयाँ निर्माण गरिएको सडक भएकाले पनि यहाँ दैनिक दिन माथिबाट पहिरो आउँदा आवतजावतमा समस्या हुने गरेको रावतको भनाइ छ।
नदी दोहन गर्ने सवारी नियन्त्रण,"नुवाकोट : अवैध रूपमा प्राकृतिक स्रोत साधन दोहन गर्ने सवारी साधनहरूलाई नुवाकोट प्रहरीले नियन्त्रणमा लिएर कारबाही गरेको छ। विभिन्न नदी, खोला, नालाहरूबाट अवैध रूपमा बालुवा, गिट्टी उत्खनन तथा ओसारपसार गर्ने उपकरण नियन्त्रणमा लिई जरिबाना समेत गरिएको हो। पहाडी संरचना रहेको नुवाकोटमा त्रिशूली, तादी, लिखु, सामरी, कोल्पु, सलाखु, फलाखुलगायत विभिन्न २५ वटाभन्दा बढी नदी खोलाहरू रहेका छन्। कानुन विपरीत नदी उत्खनन गरिरहेका साधन तथा उपकरण नियन्त्रणमा लिई प्रहरीले सम्बन्धित स्थानीय तहमा पठाएको हो। एक वर्षको अवधिमा विभिन्न प्रकृतिका २८ थान उपकरणलाई कारबाही गरिएको जिल्ला प्रहरी कार्यालय नुवाकोटले जनाएको छ। उनीहरूबाट कुल सात लाख २९ हजार रुपैयाँ जरिबाना असुल गरी राजश्व संकलन गरिएको छ। सबैभन्दा बढी कारबाही गत वैशाखमा गरिएको नुवाकोट प्रहरीले जनाएको छ। सो महिनामा पाँच थान मिनिट्रक, दुई थान आइचर, एक थान ट्रिपर र एक थान ट्रयाक्टरलाई नदीबाट नियन्त्रणमा लिएर एकलाख ५९ हजार रुपैयाँ जरिबाना गरिएको प्रहरी उपरीक्षक शान्तिराज कोइरालाले बताए।"
मटिहानी नगरपालिकामा शुक्रबार सार्वजनिक बिदा,महोत्तरी : महोत्तरीको मटिहानी नगरपालिकाले चौठचन्द्रको सार्वजनिक बिदा दिएको छ। मटिहानी नगरपालिकाले सार्वजनिक सूचना जारी गर्दै मिथिलानि महिलाहरूको महत्वपूर्ण पर्वमध्ये चौठचन्द्रको अवसरमा सार्वजनिक बिदा दिएको हो। मिथिला क्षेत्रमा खासगरी मधेशी समुदायमा यो पर्वलाई विशेष महत्वका साथ विधिपूर्वक उपवास गरी मनाइने भएकोले बिदा दिइएको मेयर हरिप्रसाद मण्डलद्वारा हस्ताक्षरित सूचनामा जनाएको छ। यसवर्ष तिथि अनुसार चौंठचन्द्र पर्व शुक्रबार मनाउन लागिएको हो।
शुक्रबार देशका यी स्थानमा हुने छ वर्षा,"काठमाडौं : शुक्रबार देशभर आंशिकदेखि साधारणतया बदली रहने छ। मौसम पूर्वानुमान महाशाखाका अनुसार देशका पहाडी भूभागका केही स्थानहरूमा मेघ गर्जनचट्याङसहित हल्कादेखि मध्यम वर्षाको सम्भावना र बाँकी भूभागका थोरै स्थानहरूमा हल्कादेखि मध्यम वर्षाको सम्भावना रहेको छ। कोशी, बागमती, गण्डकी र कर्णाली प्रदेशका एकदुई स्थानमा भारी वर्षाको पनि सम्भावना रहेको छ। शुक्रबार राति देशभर आंशिकदेखि साधारणतया बदली रहने छ। देशका पहाडी भूभागका केही स्थानहरूमा मेघ गर्जनचट्याङसहित हल्कादेखि मध्यम वर्षाको सम्भावना र बाँकी भूभागका थोरै स्थानहरूमा हल्कादेखि मध्यम वर्षाको सम्भावना रहेको छ। गण्डकी प्रदेशको एकदुई स्थानमा भारी वर्षाको पनि सम्भावना रहेको छ।"
