शीर्षक,विवरण
आधारभूत अस्पतालको कमजोर आधारभूमि,"तत्कालीन प्रधानमन्त्री केपी शर्मा ओलीले २०७७ मंसिर १५ मा एकै पटक ३९६ आधारभूत अस्पताल शिलान्यास गरे । ती अस्पताल निर्माणको टुंगो नलाग्दै सरकारले २०७७ पुस १२ मै थप २५९ वटा आधारभूत अस्पताल निर्माण गर्ने निर्णय गर्यो । यसलाई तत्कालीन सरकारले स्वास्थ्य क्षेत्रमा ठूलो क्रान्ति का रूपमा व्याख्या गर्यो । तर, यो कार्य यति हचुवाका भरमा अघि बढाइएको थियो कि तीन वर्ष बितिसक्दा ती अस्पताल अलपत्र अवस्थामा छन् । कतै जग्गाकै टुंगो लागेको छैन, कतै विस्तृत परियोजना प्रतिवेदन (डीपीआर) बनेको छैन, निर्माण सुरु भएका कतिपयमा जनप्रतिनिधिकै कारण काम रोकिएको छ । कुनै पालिकामा बजेट छैन, कतै खर्च हुन नसकेर फ्रिज हुने गरेको छ । कुनै नागरिक किनमेलका लागि बजार जानुपर्यो भने उसले सामान किन्न पैसा जोहो गर्छ । गाडीमै जानुपर्नेछ भने भाडा छुट्याउँछ । खाजा खर्च जोगाएर राख्छ । बेलुका यति बजेसम्म घर आइपुग्छु भनेर समयको यकिन गरेर निस्कन्छ । मात्र एक दिनको कामका लागि त सामान्य नागरिकले यसरी योजना बनाउँछ भने राज्य सञ्चालक सरकारले बनाउने हरेक योजना अझ व्यवस्थित र दीर्घकालीन हुनुपर्ने हो । तर, सरकारमा स्रोतसाधन सुनिश्चित नगरी सस्तो लोकप्रियताका लागि योजना बनाउने र घोषणा गर्ने प्रवृत्ति देखिएको छ । राजनीतिक नेतृत्वमा सस्तो लोकप्रियताको मोह यति छ कि एउटै विमानस्थल पटकपटक शिलान्यास गरिन्छ, उही सडकमा फरकफरक नेताले उद्घाटन गर्ने होड चल्छ । तर, घोषणा, शिलान्यास र उद्घाटनमा जस्तो तदारुकता योजना निर्माण, स्रोत व्यवस्थापन र कार्यान्वयनमा देखाइँदैन, यसका ज्वलन्त उदाहरण अलपत्र आधारभूत अस्पताल हुन् । संविधानले प्रत्येक नागरिकलाई राज्यबाट आधारभूत स्वास्थ्य सेवा निःशुल्क प्राप्त गर्ने हक हुनेछ र कसैलाई पनि आकस्मिक स्वास्थ्य सेवाबाट वञ्चित गरिने छैन र प्रत्येक नागरिकलाई स्वास्थ्य सेवामा समान पहुँचको हक हुनेछ भनेको छ । संविधानप्रदत्त यस हकको प्रत्याभूत गराउन हरेक पालिकामा कम्तीमा पाँच शय्याको अस्पताल बनाउने तीन वर्षअघि ल्याइएको सरकारको नीति तथा कार्यक्रम सराहनीय थियो । त्यति बेला भूगोल र जनसंख्याका आधारमा हरेक स्थानीय तहमा ५ देखि १५ शय्यासम्मको आधारभूत अस्पताल स्थापना र स्तरोन्नति गर्ने घोषणा गरिएको थियो । तर, स्रोत, जग्गा र जनशक्ति व्यवस्थापन सुनिश्चित नभई शिलान्यासमा हतारो देखाइयो । शिलान्यासपछि पनि अस्पताल निर्माणलाई सरकारले प्राथमिकताका साथ अघि बढाएन । भएकै अस्पतालका दरबन्दीमा पदपूर्ति हुन नसकिरहेका बेला नयाँ आधारभूत अस्पताल खुल्दा सञ्चालन र जनशक्ति व्यवस्थापन कसरी गर्ने भन्ने विषयमा पनि सरकारले गृहकार्य गरेको देखिँदैन । बरु पछिल्लो समय आधारभूत अस्पताल बनिसक्ने टुंगो नहुँदै सरकारले तिनका लागि स्वास्थ्य उपकरण खरिदमा हतारो देखाइरहेको छ । पहिलो चरणमा शिलान्यास भएका ३९६ आधारभूत अस्पताल निर्माणमा लाग्ने करिब ५८ अर्ब रुपैयाँ खर्चको स्रोत सुनिश्चित भइसकेको सरकारको भनाइ छ । यो तीन वर्षमा २० अर्ब ६४ करोड रुपैयाँ पनि खर्च भइसकेको छ । दोस्रो चरणमा थप भएका २५९ अस्पतालका लागि भने अझै स्रोत सुनिश्चित भइसकेको छैन । कतै निर्माण नै सुरु हुन नसकेको, कतै सुरु भए पनि विवाद वा स्रोतको समस्याले काम रोकिएको अवस्थामा सरकारले आधारभूत अस्पताल निर्माणको समग्र कार्यक्रमलाई नै पुनरावलोकन गर्न जरुरी छ । सबैतिर कम्तीमा आधारभूत अस्पताल आवश्यक त छ । तर, एकैचोटि स्रोतसाधन व्यवस्थापन गर्न सकिँदैन भने चरणबद्ध अघि बढाएर कामलाई तीव्रता दिनुपर्छ । जहाँजहाँ कुनै समस्याबिना निर्बाध काम गर्न सक्ने अवस्था छ, त्यहाँ जतिसक्दो छिटो अस्पताल सञ्चालन गर्ने गरी काम अघि बढाउनुपर्छ । अन्यमा पनि विवाद सुल्झाउँदै, स्रोत व्यवस्थापन गर्दै सहज रूपमा अस्पताल बन्ने वातावरण तयार गर्नुपर्छ । तीन वर्षअघि सरकारले कमजोरी गर्यो भनेर यस योजनालाई अलपत्र छाड्न मिल्दैन । अस्पतालको भवन निर्माण सकेर मात्र हुँदैन । स्वास्थ्य उपकरणदेखि जनशक्ति व्यवस्थापनलगायत अन्य धेरै पूर्वाधार तयार गर्नुपर्ने हुन्छ । न्यूनतम स्वास्थ्य सेवाबाट नागरिक वञ्चित भइरहेको अवस्थामा पालिकापिच्छे आधारभूत अस्पताल खोलेर गुणस्तरीय स्वास्थ्य सेवा दिनु पक्कै चुनौतीपूर्ण छ । केन्द्र सरकार र स्थानीय तहले दृढ अठोटका साथ जतिसक्दो अस्पताल बनाइसकेर गाउँमै आधारभूत स्वास्थ्य सेवा सुनिश्चित गर्नुपर्छ ।"
कृषिप्रधान देशमा दूधको दुर्दशा,"भुइँ जनता कोहीले गाईभैंसी पालेर घर खर्च जोहो गर्न केही लिटर दूध बेचेका छन् र कोही किसानले व्यावसायिक रूपमै गाईभैंसी पालेर दूध बेचेका छन् । देशमा अहिले सबैखाले किसान दूध बिक्री गरेको रकम नपाउँदा मर्कामा मात्रै परेका छैनन्, यो पेसाप्रति निरुत्साहित छन् । भुक्तानी नपाउँदा न घर खर्च चलेको छ न किसानले कर्जाको किस्ता र पशुलाई आवश्यक आहार व्यवस्था गर्न सकेका छन् । तीनचार महिना दूधको रकम बाँकी रहँदा सरकार कानमा तेल हालेर सुतेको छ ।दूधको सात अर्ब भुक्तानी बाँकी शीर्षकको समाचारले किसान कति पीडामा रहेछन् भन्ने छर्लङ्ग हुन्छ । आजको आवश्यकता भनेको कृषि उत्पादन सरकारले लागत विश्लेषण गरेर आफैंले क्रय मूल्य तोकी किसानबाट सोझै खरिद गर्ने प्रणाली विकास गर्नु नै हो । किसानलाई अनुदान र सुविधा पनि उत्पादनमा आधारित रहेर दिनुपर्छ । तर, हाम्रो देशमा किसान र कृषिलाई सम्बोधन गर्न हरेक वर्ष केही न केही कार्यक्रम आउँछ तर यो कार्यक्रम असली किसानलाई कागलाई बेल पाक्यो हर्ष न विस्मात् भनेझैं हुन्छ । सबै कार्यक्रम झोले किसान, नेताका आसेपासे र कर्मचारीसँग होस्टेमा हैंसे गर्नेका लागि मात्र सीमित हुन्छ ।सरकारले निर्वाहमुखीभन्दा कृषिलाई व्यावसायिक र आधुनिक बनाउन सक्नुपर्छ । दूध उत्पादनलाई प्राथमिकतामा राखेर दुग्धजन्य वस्तु निर्यातको व्यवस्था मिलाउन सक्ने हो भने समग्र मुलुककै आयात र निर्यातको खाडललाई केही कम गर्न सहयोग मिल्छ । बिचौलियाको बिगबिगीलाई बिदा गर्ने हो भने सम्पादकीयले भनेजस्तै दूध किसानले दूध सडकमा पोख्ने वातावरण सिर्जना हुँदैन र बिक्री भएको दूधको भुक्तानीका लागि तीनचार महिनासम्म कुर्न पनि पर्दैन ।शासन व्यवस्था कमजोर भएपछि धेरै क्षेत्र क्षतविक्षत हुन पुग्दोरहेछ । किसानले आफ्नो पसिनाको उचित मूल्य नपाइरहेका बेला बिक्री गरेको उत्पादनको भुक्तानीका लागि पनि महिनौं कुर्नुपर्ने अवस्था विडम्बनापूर्ण छ । यतिबेला माओवादी अध्यक्ष पुष्पकमल दाहालको सरकार छ तर उनले विगतमा भनेझैं पुँजीवादी अर्थ व्यवस्थाले सर्वहारा वर्गको समाजवादी अर्थव्यवस्थालाई गिज्याइरहेझैं छ । जुनसुकै व्यवस्था आओस् र जसको सरकार बनोस्, त्यो तपसिलको कुरा हो तर एउटा भुल्न र बिर्सन नहुने कुरा के हो भने हाम्रो देशमा किसान र कृषि पहिलो प्राथमिकतामा पर्नुपर्छ । किसानको माग सम्बोधन हुनैपर्छ । सुन्दर तिवारी, मध्यबिन्दु१, नवलपुर"
म कसरी कनिष्ठ ?,"म त्रिभुवन विश्वविद्यालय शिक्षाशास्त्र संकायको डिन पदमा कार्यरत छु । शिक्षामन्त्रीको संयोजकत्वमा गठित त्रिवि उपकुलपति छनोट तथा सिफारिस समितिले त्रिविका लागि खुला प्रतिस्पर्धाबाट २०८० फागुन ६ गते मेरो नाम १ नम्बरमा सिफारिस गरेको थियो । तर, समितिलाई बदनाम गर्न र मेरो चरित्रमा दाग लगाउने दुराशयले कान्तिपुरको फागुन १० को अंकमा प्रकाशित त्रिवि उपकुलपति नियुक्तिमा माओवादीभित्रै दुई धार शीर्षकको समाचारको खण्डन गर्छु । म शिक्षाशास्त्र संकायको सबैभन्दा वरिष्ठ प्राध्यापक भए पनि समाचारमा भागबन्डामा कनिष्ठलाई तीन वर्षअघि डिन बनाएको उल्लेख गर्दै कनिष्ठ भएकैले मलाई उपकुलपति बनाउन नमिल्ने उल्लेख गरिएकामा पनि मेरो आपत्ति छ ।पद्मकन्या बहुमुखी क्याम्पसमा प्राध्यापनरत सहप्राध्यापक मेरी श्रीमती धनकुमारी थापा र शिक्षामन्त्री अशोक राईबीच एक पटक पनि भेटघाट भएको छैन । तर, २० वर्ष अगाडि नेकपा मालेमा रहेर सँगै काम गरेको हुनाले मन्त्रीले अन्तर्वार्तामा नम्बर बढी दिलाउन प्रभाव पारेको भनी उल्लेख गरिएको सत्य होइन ।उक्त समितिले आवेदकहरूको नम्बर सार्वजनिक नगरेको अवस्थामा गोप्य कागजातलाई आफैंले देखेजस्तै गरी सिफारिसमा पार्न प्रस्तुतीकरणमा २० मा १८ नम्बर दिएको भनी लेखिएको छ, जुन गलत हो । त्रिवि अध्ययन संस्थान तथा संकायका सबै डिनहरू त्रिवि प्राज्ञिक परिषद्को पदेन सदस्य हुने त्रिवि ऐनमा व्यवस्था छ । तर, मेरो नियुक्ति प्रक्रियालाई नकारात्मक प्रभाव पार्ने दुराशयले मलाई कारबाही गरी सो परिषद्को सदस्य पदबाट हटाएको भनिएको छ, जुनसमेत तथ्यहीन छ । चित्रबहादुर बुढाथोकी, बागलुङ, हाल : त्रिवि काठमाडौं"
एनआईसी एसियालाई प्रश्न,"कान्तिपुरमा सोमबार प्रकाशित कुराकानीमा एनआईसी एसिया बैंकका प्रमुख कार्यकारी अधिकृत रोशनकुमार न्यौपानेले कुनै पनि शाखा बन्द गर्न बैंकले राष्ट्र बैंकमा निवेदन नदिएको दाबी गर्नुभयो । तर, राष्ट्र बैंकका सहसूचना अधिकारी भागवत आचार्यले एनआईसी एसियाबाट शाखा बन्द गर्न निवेदन आएको सार्वजनिक रूपमा स्विकार्दै आउनुभएको छ । यसले न्यौपानेको इमानदारीमाथि गम्भीर प्रश्न उठाउँछ । बैंकिङ प्रणाली संवेदनशील क्षेत्र हो, जसमा लाखौंको रोजीरोटी जोडिएको छ । कुनै बैंकको सर्वोच्च कार्यकारी पदमा बस्ने व्यक्तिको यस्तो भनाइले बचतकर्ता र बैंकरबीच थप अविश्वास मात्र सिर्जना गर्छ । निमेश दाहाल, बचतकर्ता, एनआईसी एसिया"
सुशासनको पर्खाइ,"हिजो पञ्चायतकालमा टेबलमुनिबाट लेनदेन गरिन्थ्यो । अहिले गणतन्त्र नेपालमा हाकाहाकी कति आउँछ भनेर मोलमोलाइ गरिन्छ । केन्द्रदेखि स्थानीय तहसम्म नीतिगत भ्रष्टाचार मौलाएको छ । अनुगमन गर्ने निकाय फितलो भएका छन् । सरकारले बनाएको आयोगले दोषी ठहर्याउँदा सरकारले कारबाही गर्न सक्दैन । निजी कम्पनी फाइदामा जाँदा सरकारी कम्पनी जहिले किन घाटामा जान्छ ? मन्त्री झन्डा हल्लाएर अख्तियारमा बयान दिन जान्छन् अनि आरामसँग सरकारी सेवा सुविधा लिन्छन् । भ्रष्टाचारको आरोप लागिसकेपछि नैतिकताका आधारमा राजीनामा दिनुपर्छ अनि मात्र छानबिन गर्नुपर्छ । यहाँ नेताहरूमा नैतिकता नै हराइसक्यो । कतिपय भ्रष्टाचारका फाइल बन्द भइसके, कतिपय बन्द हुने अवस्थामा छन् । प्रधानमन्त्री पटकपटक सुशासनको कुरा गर्छन्, भ्रष्टाचार निर्मूल पार्छु भन्छन् । प्रधानमन्त्रीले भन्न खोजेको सुशासन र भ्रष्टाचार कस्तो हो, जनता जान्न चाहन्छन् । पुरुषोत्तम घिमिरे, जोरपाटी, काठमाडौं"
सांसदको सभ्यता,"हिजोआज सांसदहरू एकले अर्कोको चरित्र हत्या गर्ने र आफूलाई राम्रो देखाउने होडबाजी चलेको छ । सांसद ज्ञानेन्द्र शाहीले बालकुमारी हत्याकाण्डका दोषी मन्त्री प्रकाश ज्वालालाई मन्त्री पदबाट बर्खास्त गरी कारबाही गर्न सरकारसँग माग गरे । त्यस विषयमा माओवादी सांसद माधव सापकोटासँग आरोपप्रत्यारोप चल्यो । मन्त्री सुदन किराती र सांसद रामहरि खतिवडाले तल्लोस्तरमा एकअर्कालाई दोषारोपण गरे । विमान खरिद प्रक्रिया र लुम्बिनी क्षेत्र विकास कोषको उपाध्यक्षमा बन्दुकको गोली लकरमा राख्ने ल्हारक्याल लामालाई नियुक्ति गरेको विषय उठाउँदै खतिवडाले मन्त्री किरातीको टिप्पणी गरेका थिए । त्यसपछि मन्त्री किरातीले सांसद खतिवडालाई महँगो घडी चोरेको आरोप लगाउन भ्याए । मन्त्री र सांसदका यस्ता आरोपप्रत्यारोप अत्यन्तै अशोभनीय छ । विशिष्ट पदमा बसेका जो कोही मर्यादित र जिम्मेवार हुनुपर्छ । भगवान पुडासैनी, जोरपाटी, काठमाडौं"
