शीर्षक,विवरण
टी२० विश्वकप : क्यानडाले अमेरिकालाई दियो १९५ रनको लक्ष्य,"अमेरिकामा जारी टी२० विश्वकपमा भइरहेको पहिलो खेलमा क्यानडाले अमेरिकालाई जितको लागि १९५ रनको लक्ष्य दिएको छ । क्यानडाले २० ओभरमा ५ विकेट गुमाएर १९४ रन बनाएको हो। क्यानडाका लागि नवनीत धालिवाल र निकोलस किर्टनले अर्धशतक बनाएका छन् । अमेरिकाका लागि कोरी एन्डरसन, हरमित सिंह र सौरभ नेत्रावलकरले ११ विकेट लिएका थिए । परगट सिंह र दिलप्रीत बाजवा रनआउट भएका थिए । अमेरिका र क्यारेबियन टापुको आयोजनामा भएको टी२० विश्वकप आजबाट सुरु भएको छ । पहिलो खेल क्यानडा र अमेरिकाबीच अमेरिकाको डलासमा हुँदैछ । अमेरिकाले टस जितेर पहिले बलिङ गर्ने निर्णय गरेको थियो।"
भन्सार महशुल वृद्धिले मुद्रास्फिति लक्ष्यमा चुनौती,"काठमाडौं : विभिन्न वस्तुको आयातमा लाग्ने भन्सार महसुल वृद्धिले महंगी नियन्त्रणमा नआउने सरोकारवालाहरूले निचोड निकालेका छन्। सरकारले आगामी आर्थिक वर्षको बजेटमार्फत मुद्रास्फीतिलाई ५५ प्रतिशतमा राख्ने लक्ष्य महसुल वृद्धिदरले चुनौती थपिएकाले नेपाल समुन्द्रपार निकासी पैठारी संघले यस्तो निचोड निकालेको हो। अर्कोतर्फ यसले खुला सिमानाबाट हुने अनधिकृत आयातलाई पनि बढावा दिने बारे संघले ध्यानाकर्षण गरेको छ। संघका अनुसार भन्सारमा पाइने एमएफएनको सुविधा खारेजीले आयातित वस्तुको भाउ बढ्ने हुँदा यसले मुद्रास्फीतिको सरकारी लक्ष्यमा चुनौती थप्ने र उपभोक्ता चर्को मूल्य तिर्न बाध्य हुनेछन्। संघ भन्छ, कतिपय वस्तुको एकाइमा भन्सार लगाउनुपर्ने संघको मागलाई पनि बजेटले बेवास्ता गरेको छ। यस्तो व्यवस्थाले स्थानीय उद्योगलाई परेको अप्ठेरो हट्ने र न्यून तथा अधिक बिजकीकरण न्यूनीकरण हुने सम्भावना हुँदा हुँदै पनि सरकार चुकेको छ। मदिरामा अन्तःशुल्क बढाउने र कर नतिर्ने घरेलु मदिरालाई प्रवर्द्धन गर्ने घोषणाले उल्लेख परिमाणमा राजस्व तिर्ने व्यवसायीमाथि दबाब पर्ने संघले बताएको छ। साथै मदिराको चोरी पैठारीले प्रश्रय पाउने जोखिम बढेको बारे पनि ध्यानाकर्षण गरेको छ। विद्युतीय सवारीसाधनको भन्सार र अन्तःशुल्क दरमा गरिएको परिवर्तनले सरकारी नीतिहरू अझै पनि स्थिरता उन्मुख नरहेको संकेत गरेको छ। यसैगरी आर्थिक ऐनले चामल उद्योगहरूले धान आयात गर्दा २५ प्रतिशत अग्रिम आयकर लाग्ने व्यवस्था गरिएको छ। भारतबाट कच्च पदार्थको रुपमा धान आयात गरी चामल उत्पादन गर्ने उद्योगी र तयारी चामल आयात गर्ने दुवैलाई लाग्ने अग्रिम आयकर बराबर जस्तो हुँदा स्वदेशी चामल उद्योग धराशायी हुने जोखिम बढेको बताइएको छ। सरकारले दाल उद्योगको कच्चा पदार्थ गेडागुडी र तयारी दाल आयातमा समान भन्सार दर कायम गरेको छ। यो तयारी वस्तु र कच्चा पदार्थमा एक तहको भन्सार दर फरक गर्ने बजेटकै घोषणा विपरीत भएको संघको टिप्पणी छ। जस्मा १० प्रतिशत अग्रिम आयकर तिर्न नाफा ५० प्रतिशत भएमात्र सम्भव हुन्छ, जबकी २० प्रतिशतभन्दा बढी नाफा लिन हाम्रो कानुनले नै प्रतिबन्ध लगाएको छ। दाल जस्तो अत्यावश्यक वस्तुमा ५० प्रतिशत नाफा हुने अनुमान गरेर १० प्रतिशत अग्रिम आयकर लगाउनु नै अवैज्ञानिक देखिन्छ, संघले भन्यो अतः अग्रिम आयकर र यसको दर वृद्धिले व्यावसायिक वातावरण बिगार्ने सम्भावना उच्च छ। व्यापार व्यवसायमा नाफा हुन्छ नै भन्ने निश्चित नहुने परिप्रेक्ष्यमा अग्रिम आयकरको औचित्य नरहेकोले यसलाई खारेज गर्नुपर्ने संघको माग छ। सरकार अग्रिम आयकर लिने अनि कुनै आय वर्षमा असुल गरिएको अग्रिम आयकर रकमलाई सोही वर्षमा तिर्नुपर्ने कर दायित्वमा मिलान गरेर बढी हुन आएको रकम आगामी आय वर्षमा सारी लैजान वा फिर्ता लिन नपाउने व्यवस्था अन्यायपूर्ण रहेकोमा संघले विरोध गरेको छ। कुनै वर्षमा आयात गरेको सामान सोही वर्ष बिक्री नभएर स्टक रहन जान्छ। त्यस्तो अवस्थामा के हुने ? अर्को वर्ष पुनः आयकर तिर्नुपर्ने पो हो कि जस्ता सन्देह पैदा भएको छ। आयातित सामान बोकेर आउने कन्टेनरले हालसम्म ७२ घण्टासम्म कुनै शुल्क तिर्नु नपर्ने प्रावधान छ। तर अब प्रवेश गर्ने बित्तिकै प्रति कन्टेनर १ हजार ५ सय तिर्नुपर्ने भएको छ। यसले व्यवसायको लागत बढाउने हुँदा यो कदम व्यापार सहजीकरण गर्ने सरकारको नीति विपरीत भएकोमा संघको आपत्ति छ। यस्तै, कतिपय वस्तुको हकमा आयातमा लगाइएको प्रतिबन्धले अनधिकृत पैठारीलाई प्रश्रय दिइरहेको तथ्य सरकारले मनन नगरेको संघले बताएको छ।"
प्री ओपन सेसनमा नेप्से परिसूचक ३५२ अंकले बढयो,काठमाडौं : प्री ओपन सेसनमा आइतबार नेप्से परिसूचक ३५२ अंकले बढेको छ। नेप्से ३५२ अंकले बढेर २०७३०६ विन्दुमा अडिएको छ। यो समयमा ४९ स्क्रिप्सको ५ हजार ९७७ कित्ता सेयर ३४ लाख ६३ हजार १४९ रुपैयाँमा खरिद बिक्री भए। प्री ओपन सेसनमा ३० स्टकको मूल्य बढ्दा १७ वटाको घट्यो भने २ वटाको मूल्य स्थिर रह्यो।
निजी क्षेत्रको मनोबल माथि उठाउन जरुरी छ : अर्थमन्त्री,काठमाडौं : अर्थमन्त्री वर्षमान पुनले राष्ट्रियसभाको आजको बैठकमा आर्थिक वर्ष २०८१०८२ को राजस्व र व्ययको वार्षिक अनुमानमाथि सामान्य छलफल गरियोस् भन्ने प्रस्ताव पेस गरेका छन् । प्रस्ताव पेस गर्दै मन्त्री पुनले निकै अन्योलताका बीचमा आगामी आर्थिक वर्षको बजेट प्रस्तुत भएको जानकारी गराए। अर्थमन्त्री पुनले प्रधानमन्त्री पुष्पकमल दाहाल प्रचण्ड र नेपाल कम्युनिष्ट पार्टी (एमाले)का अध्यक्षका अध्यक्ष केपी शर्मा ओलीको निरन्तरको पहलका कारण सहज रुपमा प्रक्रिया अगाडि बढेको बताए। उनले सांसदहरुको सल्लाह र पृष्ठपोषणका आधारमा बजेट ल्याइएको उल्लेख गर्दै सरोकार भएका सबै निकाय र क्षेत्रको समेत सुझाव लिइएको दावी गरे। अर्थतन्त्र पूर्णरुपमा गतिशील अवस्थामा आइनसकेकाले जिम्मेवारीपूर्वक निजी क्षेत्रको मनोबल उठाउन जरुरी रहेको उनको भनाइ छ। युवामा रहेको निराशालाई चिरेर अगाडि बढ्नुपर्ने अवस्थालाई ख्याल गरिएको अर्थमन्त्री पुनले बताए । मुद्रास्फीति न्यून विन्दुमा रहेको तथ्य पेस गर्दै हरेक घरको भान्सामा पर्ने मूल्यवृद्धिको चापलाई नियन्त्रण गर्ने गरी प्रयास गरिएको उनको भनाइ छ । सङ्कुचित भएको साधन र स्रोतलाई विश्लेषण गरेर बजेट प्रस्तुत गरिएको भन्दै सबै क्षेत्रले सन्तुलित बजेट आएको टिप्पणी गरेका अर्थमन्त्री पुनले जिकिर गरे।
"सेयर बजारमा १३ अंकको सुधार,४ अर्ब ३१ करोडको कारोबार","काठमाडौं : साताको पहिलो सेयर कारोबार दिन आइतबार नेप्से परिसूचक दोहोरो अंकले बढेर बन्द भएको छ। नेप्से परिसूचक १३५१ अंकले बढेर २०८३०४ विन्दुमा अडिएको छ। सेन्सेटिभ इण्डेक्स ०३९ प्रतिशतले बढेर ३७१६५ विन्दुमा कायम भएको छ। ३२५ स्क्रिप्सको ९६ लाख ९७ हजार २०६ कित्ता सेयर ४ अर्ब ३१ करोड १० लाख १५ हजार ६२९ रुपैयाँमा खरिदबिक्री भए। यसदिन दुईवटा कम्पनीको सेयर सकारात्मक सर्किट लेभलमा कारोबार भयो। मल्टीप्रपोज फाइनान्स र मकर जितुमाया सुरी हाइड्रोपावरको सेयर १० प्रतिशतले बढेको हो। कालिञ्चोक दर्शन,अपर सोलु हाइड्रो इलेक्ट्रिक र माइ खोला हाइड्रोपावरको सेयर ८ प्रतिशत बढिले वृद्धि भयो। कारोबार रकमका आधारमा नेपाल फाइनान्स शीर्ष स्थानमा रह्यो। सो कम्पनीको सेयर २२ करोड ६४ लाख रुपैयाँमा किनबेच भयो। नारायणी डेभलपमेन्ट बैंकका लगानीकर्ताले गुमाए। सो कम्पनीको सेयर ९१३ प्रतिशतले घट्यो। १० वटा समूहको उपसूचक बढ्दा ३ वटाको सूचक नकारात्मक देखिएका छन्। इन्भेस्टमेन्ट ,मनु एण्ड प्रो र म्युचुअल फण्डको सूचक नकारात्मक देखिए। कारोबारमा आएका १७४ स्टकमध्ये ६१ वटाको घट्यो । १२ वटा स्टकको मूल्य भने आज स्थिर रह्यो।"
