शीर्षक,विवरण
रुसी सेनामा भएका नेपालीका आफन्त ११ दिनदेखि अनशनमा,"(काठमाडौं)रुसी सेनामा भर्ती भएका नेपालीको उद्धारको माग राखी उनीहरूका आफन्त ११ दिनदेखि अनशनरत छन् । उनीहरूले सोमबार करारपत्र रद्दसहित १३ बुँदे माग राखेर रुसी दूतावास अगाडि प्रदर्शन गरेका छन् । प्रदर्शनका क्रममा प्रहरीले रुसी सेनामा आबद्ध नेपालीको जीवन रक्षा अभियानकी संयोजक कृतु भण्डारी, रुकुमकी सिरानी घर्ती मगर, उषा खत्री, रोजी पुन, देवेन्द्र भट्ट र मोहन भट्टलाई पक्राउ गरेको थियो । उनीहरूलाई साँझ छाडिएको प्रहरीले जनाएको छ । भण्डारी, मगर र किसन थापा वैशाख ७ देखि रत्नपार्कमा अनशनरत छन् । उनीहरूलाई रुसी सेनामा भर्ती भएका नेपालीका परिवारले आलोपालो अनशन बसेर साथ दिँदै आएका छन् ।रुसी सेनामा भर्ती भएका नेपालीको सकुशल उद्धार गरी नेपाल ल्याउनुपर्ने, करार सम्झौता रद्द गरी उद्धारको पर्खाइमा रहेका व्यक्तिलाई पुनः युद्ध मैदानमा लगिएकाले उनीहरूलाई तत्काल उद्धार गर्नुपर्ने परिवार तथा आफन्तको माग छ । युद्धमा घाइते नेपालीलाई उचित क्षतिपूर्ति तथा तलब भत्ता उपलब्ध गराउनुपर्ने, युक्रेनको कब्जामा रहेका ५ जना युद्धबन्दीको सकुशल उद्धार हुनुपर्ने, मृतकको शव ल्याउने र क्षतिपूर्तिसहित रुसी सेनाबाट पाउने तलब भत्ता उपलब्ध गराउनुपर्ने उनीहरूको माग छ । त्यस्तै उनीहरूले बेपत्ताको अवस्था खोजी गर्न विधि र प्रक्रिया घोषणा गरी तत्काल कार्यान्वयन तहमा ल्याउनुपर्ने, रुसी सेनामा कार्यरत नेपालीको तथ्यांक सार्वजनिक गर्नुपर्ने माग पनि गरेका छन् । उनीहरूले प्रलोभनमा परी रुस पठाउने बिचौलियाको पहिचान गरी तत्काल कारबाही, पीडित परिवारको उद्धार, राहत र पुनःस्थापनाका लागि मन्त्रीस्तरीय समन्वय समिति गठन गर्नुपर्ने, रुसी सेनाबाट फर्किएर आएका युवाको पुनःस्थापना तथा पीडित परिवारको उचित हेरचाहको व्यवस्था गर्नुपर्ने, कूटनीतिक सम्बन्ध भएका देशहरूमा नेपालले आफ्ना नागरिकलाई सैन्य सम्झौताबिना सैन्य सेवामा भर्ती नगर्न पहल गर्नुपर्ने माग पनि राखेका छन् ।रुसी सेनामा भर्ती भएका नेपालीका विषयमा सरकार गम्भीर नभएकाले बाध्य भएर आमरण अनशन बस्नुपरेको संयोजक भण्डारीले बताइन् । पुसदेखि नै हामीले करारपत्र सम्झौता भंग गरी स्वदेश ल्याउन भनिरहेका थियौं । रुसमा हरेक सेकेन्ड नेपाली जोखिममा छन् । तर, काठमाडौंमा सरकार सुतेर बसिरहेको भान भइरहेको छ, उनले भनिन्, जबसम्म सरकारले हाम्रो माग सम्बोधन गर्दैन तबसम्म अनशनमा बस्नेछौं ।रुसी सेनामा भर्ती भएका नेपालीमध्ये कम्तीमा सय जना परिवारको सम्पर्कमा छैनन् । रुसयुक्रेन युद्धमा ३६ नेपालीको मृत्यु भइसकेको छ । मृतकका परिवारले शवसमेत पाउन सकेका छैनन् । अनशनमा बसिरहेकी सिरानीका श्रीमान् माइतमान गत मंसिर १२ देखि सम्पर्कमा आएका छैनन् । १२ लाख रुपैयाँ खर्चेर गत कात्तिक ७ मा रुस पुगेका थिए । राज्यले आफूहरूलाई नदेखेको उनको गुनासो छ । सरकारले स्वीकृति दियो अनि मात्रै गए । नेपालकै विमानस्थलबाट गएका हुन् । हाम्रा बूढाहरू श्रम स्वीकृति नलिई गएका हुन् । तर राज्यले अनुमति दिने व्यवस्था नै नभएको भए त जाने नै थिएनन्, उनले भनिन्, तर, हाम्रो मुद्दालाई राज्यले गम्भीर रूपमा हेरेन ।"
सकियो लगानी सम्मेलन साढे ६ अर्ब रुपैयाँको लगानी सम्झौता,"(काठमाडौं)मुलुकमा साढे ६ अर्ब स्वदेशी तथा विदेशी लगानी भित्र्याउने सम्झौतासहित तेस्रो लगानी सम्मेलन सकिएको छ । सम्मेलनमा तीन परियोजनामा लगानी र ७ वटा विविध सहकार्यसम्बन्धी सम्झौता भएको लगानी बोर्डले जनाएको छ । काठमाडौंमा आइतबार र सोमबार आयोजित सम्मेलनमा यी सम्झौता भएका हुन् । यद्यपि सरकारले लगानी आह्वानका लागि प्रस्तुत गरेको परियोजना सूचीमा भने यी परियोजना थिएनन् ।सम्मेलनको पहिलो दिन डाटा सेन्टर निर्माण तथा सञ्चालनका लागि चौधरी ग्रुपको बीएलसी होल्डिङ्स र योट्टा डाटा सर्भिसेज भारतबीच समझदारी भयो । बीएलसी होल्डिङ्सकी प्रतिनिधि मेघा चौधरी र योट्टाका सीईओ सुनील गुप्ताले समझदारीपत्रमा हस्ताक्षर गरे । साढे तीन अर्ब लगानीमा मुलुकमा डाटा सेन्टर, क्लाउड सर्भिस र आर्टिफिसियल इन्टेलिजेन्स प्लेटफर्म निर्माणका लागि समझदारी भएको हो । सम्मेलनको दोस्रो दिन साखः एन्ड कम्पनी र चीनको बोर ग्रुप अफ होटलबीच होटल व्यवसायमा लगानी गर्ने गरी सम्झौता भएको छ । कपिलवस्तुको गोरुसिंगेमा १ अर्ब ९० करोड (जग्गाबाहेक) खर्चेर होटल बनाउने गरी सम्झौता भएको हो । सम्मेलनमै अस्ट्रेलियाको एक्सपर्ट ग्रुप र रारा होल्डिङ्स रिसोर्टबीच मुगुको रारामा लक्जरी रिसोर्ट बनाउने गरी सम्झौता भएको छ । सम्झौतामा एक्सपर्ट ग्रुपका तर्फबाट बद्री अर्याल, सञ्जीव शर्मा र रारा होल्डिङ्स रिसोर्ट प्रालिका तर्फबाट अभिषेकविक्रम शाहले हस्ताक्षर गरे । रिसोर्ट बनाउन दुई चरणमा गरी १ अर्ब १० करोड खर्चिने रारा होल्डिङ्सका शाहले जनाए । सम्मेलनमा विभिन्न क्षेत्रमा सहकार्यसम्बन्धी सम्झौता पनि भएका छन् । रेमिट हाइड्रोको अवधारणाअनुरूप हाइड्रोइलेक्ट्रिसिटी इन्भेस्टमेन्ट एन्ड डेभलपमेन्ट कम्पनी र गैरआवासीय नेपाली संघ, राष्ट्रिय समन्वय परिषद्हरूबीच सम्झौता भएको छ । रेमिट्यान्सको रकम जलविद्युत् तथा अन्य नवीकरणीय ऊर्जाको विकासमा उपयोग गर्ने गरी सम्झौता भएको हो । ७०३ मेगावाट क्षमताको सिम्बुवा खोला जलविद्युत् आयोजना र ७७५ मेगावाट क्षमताको घुन्साखोला जलविद्युत् आयोजनाको सेयर लगानीमा कम्पनीको प्रतिबद्धताअनुरूप वैदेशिक रोजगारीमा संलग्न व्यक्तिहरूलाई सहभागी गराउने बताइएको छ । यी दुई आयोजनाको कुल सेयर पुँजीको २९ प्रतिशत वैदेशिक रोजगारीमा रहेकाहरूका लागि छुट्याइनेछ । सम्मेलनकै क्रममा नेक्सजेन म्यानेजमेन्ट सोलुसन प्राइभेट लिमिटेड र चीनको एमएबीसी इन्भेस्टमेन्ट प्राइभेट लिमिटेड बीच सम्झौता भएको छ । नेक्सजेनले एमएबीसीको मुख्य कम्पनीलाई नेपालमा वैदेशिक लगानी गर्न सहजीकरण गर्नेछ । नेपालमा सार्वजनिकनिजी साझेदारी प्रवर्द्धनका लागि वर्ल्ड एसोसिएसन अफ पीपीपी युनिट्स एन्ड प्रोफेसनल्स (वाप) र नेपाल एसोसिएसन अफ पीपीपी प्रोफेसनल्स अफ प्राक्टिस्नर्स (नाप) बीच महत्त्वपूर्ण सम्झौता भएको छ । वापका तर्फबाट अध्यक्ष जियादअलेक्स्यान्डर हायक र नापका तर्फबाट अध्यक्ष अनुपकुमार उपाध्यायले यससम्बन्धी सम्झौतापत्रमा हस्ताक्षर गरे । दुवै संस्थाले साझा चासोका विषयमा सहकार्य गर्ने, सार्वजनिकनिजी साझेदारी (पीपीपी) सम्बन्धी ज्ञान तथा अनुभव आदानप्रदान गर्ने सम्झौतामा उल्लेख छ । सम्मेलनमा सबैभन्दा बढी सहकार्यसम्बन्धी सम्झौता नेपाल उद्योग वाणिज्य महासंघ (एफएनसीसीआई) को भएको छ । महासंघले आइतबार नेसनल चेम्बर अफ कमर्स एन्ड इन्डस्ट्री, मलेसियाबीच व्यापार तथा लगानी प्रवर्द्धन गर्न सम्झौता गरेको हो । महासंघका अध्यक्ष चन्द्रप्रसाद ढकाल र नेसनल चेम्बर अफ कमर्स एन्ड इन्डस्ट्री अफ मलेसियाका अध्यक्ष टान स्री दातो सो थियान लाईले सम्झौतापत्रमा हस्ताक्षर गरे । महासंघले आइतबार नै फेडेरेसन अफ मलेसिया म्यानुफ्याक्चरसँग पनि समझदारी गरेको छ । सम्मेलनको दोस्रो दिन महासंघले इन्डियन इन्डस्ट्रिज एसोसिएसन (आईआईए) बीच द्विपक्षीय सहकार्यसम्बन्धी सम्झौता गरेको छ । सम्झौतापत्रमा एफएनसीसीआईसीका तर्फबाट खिमलाल भण्डारी र आईआईएका तर्फबाट अध्यक्ष अनुजकुमार गर्गले हस्ताक्षर गरे । नेपाल र भारतबीच लगानी, व्यापार तथा उद्योग क्षेत्रमा आपसी सहकार्य गरिनेछ । महासंघले सोमबार नै चाइना डोङ्गुआ सिङ लङ लाइटिङ प्रोडक्ट कम्पनीसँग नेपालमा लगानी सहजीकरणका लागि सहकार्य गर्नेसम्बन्धी सम्झौता गरेको छ । सम्मेलनमा नेपाल चेम्बर अफ कमर्स र क्रोएसियाको व्यावसायिक प्रतिनिधिमण्डलबीच व्यापार र पर्यटन क्षेत्रमा सहकार्य गर्ने गरी सम्झौता भएको छ । सम्मेलनमा उद्योग विभागले यसअघि नै स्वीकृति दिइसकेको ९ अर्ब १३ करोड रुपैयाँ बराबरको विदेशी लगानीको स्वीकृतिपत्र चार जना लगानीकर्तालाई हस्तान्तरण गरेको छ । भक्तपुरमा लगानी कम्पनी स्थापनाका लागि ६ अर्ब, व्यावसायिक भवन निर्माण तथा सञ्चालनका लागि ३ अर्ब र २ सय किलोवाट क्षमताको जलविद्युत् आयोजना निर्माणका लागि ७ करोड ६६ लाख रुपैयाँ र होटल तथा रेस्टुरेन्ट निर्माणका लागि ६ करोड २५ लाख रुपैयाँ लगानीको स्वीकृतिपत्र दिइएको हो । विभागले सम्मेलनमै स्वचालित मार्ग (अटोमेटिक रुट) मार्फत विदेशी लगानी स्वीकृति हुने प्रणाली उद्घाटन गर्दै कार्यान्वयनमा ल्याएको छ । स्वचालित मार्गबाट कुल पुँजी ५० करोड रुपैयाँसम्म हुने उद्योग व्यवसायमा स्वदेशी तथा विदेशी लगानी गर्न सकिनेछ । सूचना प्रविधिमा आधारित उद्योगमा न्यूनतम सीमा लागू नहुने विभागको विदेशी लगानी तथा प्रविधि हस्तान्तरण शाखाका निर्देशक शंकरसिंह धामीले जनाए । सम्मेलनमा ३ सय २७ मेगावाट क्षमताको माथिल्लो मर्स्याङ्दी२, चीननेपालमैत्री औद्योगिक पार्क र राइजेन सोलार परियोजना विकास सम्झौता (पीडीए) गर्ने तय भएको थियो । त्यस्तै डाबर नेपालको विस्तारका लागि परियोजना लगानी सम्झौता (पीआईए) गर्ने तयारी थियो । तर तयारी नपुग्दा पीडीए र पीआईए हुन नसकेको बोर्डले जनाएको छ ।सम्मेलनमा आठ सयभन्दा बढी विदेशी प्रतिनिधि सहित दुई हजार पाँच सयभन्दा बढीको सहभागिता थियो । सम्मेलनका क्रममा आशयपत्र मागिएका १९ र मार्केट साउन्डिङ (लगानीकर्ताको प्रतिक्रिया संकलन) का ९ सहित १५४ परियोजना प्रस्तुत गरिएको थियो । आशयपत्र पेस गर्न लगानीकर्तालाई ऊर्जा परियोजनाको हकमा ४५ दिन र गैरऊर्जा परियोजनाको हकमा ३५ दिनको समय दिइएको लगानी बोर्डले बताएको छ । सम्मेलनमा ५५ देशका २२ भन्दा बढी प्रतिनिधिको सहभागिता थियो ।"
