शीर्षक,विवरण
म्याराथनमा कृष्ण र राजपुरा च्याम्पियन,"बेलझुन्डी (दाङ) : आठौं राष्ट्रिय खेलकुद प्रतियोगिताअन्तर्गत एथलेटिक्सको म्याराथनमा आर्मीका कृष्ण बस्नेत र नेपाल पुलिस क्लबकी राजपुरा पछाई च्याम्पियन भएका छन्। सोमबार भएको पुरुष म्याराथनमा कृष्णले कर्णाली प्रदेशका दुर्गाबहादुर बुढालाई पछि पार्दै स्वर्ण जितेका हुन्। कृष्णले निर्धारित दूरी दुई घण्टा १७ मिनेट ३३ सेकेन्डमा पूरा गरे। दुर्गाले दुई घण्टा १८ मिनेट ३९ सेकेन्डमा दौड पूरा गर्दै रजत पदक जिते। यस्तै दुई घण्टा २२ मिनेट १० सेकेन्डको समयसहित एपीएफका किरणसिंह बोगटीले कांस्य जिते। महिलातर्फ पुलिसकी राजपूरा पछाईले दुई घण्टा ५९ मिनेट ३८ सेकेन्डमा म्याराथन पूरा गरिन्। एपीएफकी पुष्पा भण्डारीले तीन घण्टा ५९ सेकेन्डका साथ रजत पदक जित्दा आर्मीकी सरिता बासीले तीन घण्टा आठ मिनेट तीन सेकेन्डको समयसहित कांस्य जितिन्। यसैगरी चार गुणा एक सय मिटर रिले दौडमा आर्मीले पुरुष र महिला दुवैमा स्वर्ण पदक जितेको छ। पुरुषतर्फ आर्मीले ४३१९ सेकेन्डको समय निकाल्दै स्वर्ण जित्यो। निर्धारित दूरी ४३४० सेकेन्डमा पूरा गरेको एपीएफले रजत जित्दा पुलिसले ४४५५ सेकेन्डको समयसहित कांस्य पदक प्राप्त गयो। महिलातर्फ पनि आर्मीले स्वर्ण जितेको छ। आर्मीले निर्धारित दूरी ५०५६ सेकेन्डमा पूरा गयो। प्रदेश ५ ले ५१६६ सेकेन्डको समय निकाल्दै रजत र ५३१२ सेकेन्डको समयसहित एपीएफले कांस्य पदक जित्न सफल भयो। पुरुष चार सय मिटर हडल्समा एपीएफका नीरप्रताप महतोले स्वर्ण जिते। निर्धारित दूरी ५५६० सेकेन्डको समय निकाल्दै नीरले स्वर्ण हात पारेका हुन्। आर्मीका जीवन चौधरीले ५६४९ सेकेन्डको समयसहित रजत र आर्मीकै अशोक कुँवरले ५७४४ सेकेन्डको समयसहित कांस्य पदक जिते। महिलातर्फ आर्मीकी तुलसा श्रेष्ठले स्वर्ण जितिन्। उनले एक मिनेट ०९७९ सेकेन्डको समय निकाल्दै स्वर्ण जितिन्। यस्तै आर्मीकै तुलसा खत्रीले एक मिनेट १११३ सेकेन्डसहित रजत र गण्डकी प्रदेशकी कल्पना श्रेष्ठले एक मिनेट १२७८ सेकेन्डको समयसहित कांस्य जितिन्। महिला आठ सय मिटर दौडमा आर्मीकी सरस्वती भट्टराईले स्वर्ण पदक जितिन्। उनले निर्धारित दूरी दुई मिनेट १६०० सेकेन्डमा पूरा गरिन्। आर्मीकै सानुमाया कार्कीले रजत जित्दा एपीएफकी फूलमती रानाले कांस्य जितिन्। सानुमायाले दुई मिनेट १७९४ सेकेन्ड र फूलमतीले दुई मिनेट १८३८ सेकेन्डमा दौड पूरा गरे। पुरुषको आठ सय मिटर दौडमा आर्मीका उमेश मस्र्याङ्दी मगरले स्वर्ण जिते। उनले निर्धारित दूरी एक मिनेट ५७५५ सेकेन्डमा पूरा गरे। दोस्रो भएका आर्मीकै टंक कार्कीले एक मिनेट ५८०५ सेकेन्डको समय निकाले। प्रदेश ३ का सुवास थापाले एक मिनेट ५८५३ सेकेन्डको समयसहित कांस्य पदक प्राप्त गरे। एथलेटिक्समा विभागीय टोली त्रिभुवन आर्मी क्लब च्याम्पियन भएको छ। आर्मीले महिलातर्फ ११ र पुरुषमा १० स्वर्ण जित्यो। यस्तै महिलामा चार रजत ६ कांस्य तथा पुरुषमा तीन रजत र तीन कांस्य जित्यो। यस्तै एपीएफले महिलामा दुई तथा पुरुषतर्फ ६ स्वर्ण जित्दै दोस्रो हुँदा अर्को विभागीय टोली नेपाल पुलिस क्लबले महिलामा तीन स्वर्ण जित्यो। एपीएफले महिलातर्फ तीन रजत र ६ कांस्य, पुरुषमा तीन रजत तीन कांस्य जित्यो। नेपाल पुलिसले महिलामा एक रजत एक कांस्य तथा पुरुषमा चार रजत तीन कांस्य जित्न सफल भयो।"
गौरिकाको दोहोरो कीर्तिमान,"नेपालगन्ज : त्रिभुवन आर्मी क्लबकी गौरीका सिंहले ८औं राष्ट्रिय खेलकुद अन्तर्गत पौडीको महिला एक सय मिटर बटरफ्लाई र दुई सय मिटर फ्रिस्टाइलमा नयाँ राष्ट्रिय कीर्तिमान बनाएकी छन्। मंगलबार भएको एक सय मिटर बटरफ्लाइमा एक मिनेट ०७९७ सेकेन्डमा पूरा गर्दै नयाँ कीर्तिमान बनाएकी हुन्। यो विधामा यसअघि पनि उनकै नाममा एक मिनेट ०८६३ सेकेन्डको कीर्तिमान थियो। सो स्पर्धामा आर्मीकै दुआना लामाले रजत र एपीएफकी श्रीबी महर्जनले कास्य जितिन्। त्यसैगरी दुई सय मिटर फ्रिस्टाइलमा पनि उनले दुई मिनेट ०९१९ सेकेण्डको कीर्तिमान बनाइन्। आर्मीकै दुआना लामाले रजत जित्दा एपीएफकी टिसा शाक्यले कास्य जितिन्। गौरीकाले दुई सय मिटर ब्याकस्ट्रोकमा पनि स्वर्ण जितिन्। निर्धारित दूरी दुई मिनेट ४१२५ सेकेन्डमा पूरा गर्दै उनले स्वर्ण जितेकी हुन्। नेपाल पुलिस क्लबकी अनुष्का पोखरेलले रजत र एपीएफकी दीया स्थापितले काँस्य जिते। यसैगरी महिला चार गुणा एक सय मिटर रिलेमा पनि गौरिका सम्मिलित आर्मीले स्वर्ण जित्यो। पुलिसले रजत र एपीएफले काँस्यमा चित्त बुझाए। त्यसैगरी महिला ५० मिटर ब्रेष्टस्ट्रोकमा आर्मीकी दुआना लामाले स्वर्ण, आर्मीकै उपास्ती महर्जनले रजत र एपीएफकी टिसा शाक्यले कास्य जिते। यसैगरी पुरुष ५० मिटर ब्रेष्टस्ट्रोकमा एपीएफका शुभम् श्रेष्ठले नयाँ राष्ट्रिय कीर्तिमान बनाएका छन्। उनले निर्धारित दूरी ३१९० सेकेन्डमा पूरा गर्दै कीर्तिमान बनाएका हुन्। यसअघि ३२०१ सेकेन्डको कीर्तिमान उनकै नाममा थियो। यस विधामा पुलिसका दिपंकर अवाले दोस्रो र एपीएफका बेधाग्य राज जोशी तेस्रो भए। यसैगरी पुरुष एक सय मिटर बटरफ्लाइमा पुलिसका सैयद हमजा साहले नयाँ राष्ट्रिय कीर्तिमान बनाएका छन्। उनले हिट चरणमा निर्धारित दूरी एक मिनेट ०२५ सेकेन्डमा पूरा गरेका थिए। फाइनल चरणमा भने उनी रजत पदकमा सिमित भए। आर्मीका अनुभव सुब्बाले स्वर्ण जिते। एनआरएनएका नाथुन दोर्जे शेर्पाले कास्य जिते। पुरुष दुई सय मिटर ब्याकस्ट्रोकमा एनआरएनएका नाथुन दोर्जे शेर्पाले स्वर्ण, एपीएफका तेन्जिङ नाम्डोल र रायन गुरुङले रजत तथा एपीएफकै नासिर हुनेनले काँस्य जिते। पुरुष चार गुणा एक सय मिटर रिलेमा पुलिसले स्वर्ण, एपीएफले रजत र आर्मीले कास्य जिते। गाैरिका रियो ओलम्पिक कान्छी खेलाडी पौडीमा गौरिकालाई दुई स्वर्ण र दुई कीर्तिमान"
पुरुष फुटबलमा आर्मी र पुलिस फाइनलमा,"नेपालगन्ज : आठौँ राष्ट्रिय खेलकुद प्रतियोगिता अन्तर्गत पुरुष फुटबलमा त्रिभुवन आर्मी क्लब र नेपाल पुलिस क्लब फाइनलमा पुगेको छ। नवनिर्मित नेपालगन्ज रंगशालामा मंगलबार भएको सेमिफाइनल खेलमा प्रदेश ५ लाई हराउँदै आर्मी र एपीएपीलाई हराएर पुलिस फाइनलमा प्रवेश गरेका हुन्। घरेलु टिम प्रदेश ५ लाई ट्राइबेकरमा ३१ को अन्तरले पराजित गरी आर्मी फाइनलमा पुगेको हो। निर्धारित खेल अवधिको पहिलो हाफ निकै आक्रमक खेलेर आर्मीले २० को अन्तरमा अग्रता लिएको थियो। प्रदेश ५ का ५ नं जर्सीका खेलाडी दीपेन्द्र सिंह ठकुरीले आत्मघाती गोल गरेका छन्। दोस्रो गोल भने आर्मीका १६ नं जर्सीका दीपकुमार लामाले ३१ मिनेटमा गरेका थिए। दोस्रो हाफमा भने प्रदेश ५ जवाफी आक्रमणमा उत्रेको थियो। दुई पटक पाएको पेल्नाटीको अवसरलाई जर्सी नं १० का खेलाडी विनोद केसीले गोलमा परिणत गरी आर्मीलाई बराबरीमा रोकेका थिए। दोस्रो हाफमा आर्मीले ३ वटा कर्नरको अवसर पाएको थियो। तीन वटा सशक्त प्रहार प्रदेश ५ का गोलकिपरले रोकेका थिए। ट्राइब्रेकरमा आर्मीका नवयुग श्रेष्ठ, विवेक बस्नेत र सन्तोष तामाङले गोल गरे। जितेन्द्र कार्की र दीपक गुरुङले गोल गर्न सकेनन्। प्रदेश ५ का कृष्ण रानाभाटले मात्र गोल गरे। दीपेनसिंह ठकुरी, चेतन चौधरी र विवेक पुनले गोल गर्नबाट चुके। यसैगरी अर्को सेमी फाइनलमा पुलिसले एपीएफलाई २१ गोलले पराजित गर्यो। पुलिसको जितमा ९औं मिनेटमा रवि पासवान र ३३औं मिनेटमा तेज तामाङले गोल गरे। एपीएफका आशिष लामाले ७१ औं मिनेटमा सान्तवना गोल गरेका थिए। फाइनल खेल बुधबार हुनेछ।"
मनिताको पुनरागमन,"बुटवल : लामो समयपछि पुनः खेलमा फर्किएकी तेक्वान्दो खेलाडी मनिता शाही आठौं राष्ट्रिय खेलकुद प्रतियोगिताअन्तर्गत भैरहवामा जारी तेक्वान्दो खेलको आफ्नो तौलसमूहको सेमिफाइनलमा प्रवेश गरेकी छिन्। नेपाल पुलिस क्लबबाट आठौं राष्ट्रिय खेलकुदमा सहभागी भएकी उनी महिला ७३ केजी माथिको तौलसमूहमा स्वर्ण पदक नजिक पुगेकी हुन्। उनले उपाधिका लागि मंगलबार हुने फाइनल खेलमा अर्काे विभागीय टोली एपीएफकी सुष्मा गुरुङसँग प्रतिस्पर्धा गर्नेछिन्। यसअघि राष्ट्रिय टोलीबाट धेरै खेल खेलिसकेकी मनिता पछिल्लो चार वर्षयता खेलबाट टाढा रहेकी थिइन्। एक वर्षीया छोरीसहित प्रतियोगिता खेल्न भैरहवा पुगेकी मनिताले आफू अब फेरि तेक्वान्दोमा फर्किएको बताइन्। पछिल्लो केही वर्ष पारिवारिक कारणले खेललाई निरन्तरता दिन सकिरहेकी थिइनँ, मनिताले भनिन्, अहिले खेलमा फर्किएकी छु। अब फेरि तेक्वान्दोलाई निरन्तरता दिनेछु। मनिताको तौलसमूहमा गण्डकी प्रदेशकी मीरा गुरुङ र प्रदेश १ की पजु राईले कांस्य जितेका छन्। प्रतियोगिताअन्तर्गत सोमबार भएको प्रतिस्पर्धामार्फत पुरुषको ८७ केजी माथिको तौलसमूहमा त्रिभुवन आर्मी क्लबका रामहरि महत र नेपाल पुलिस क्लबका अनुज पुजारीले फाइनलमा स्थान सुरक्षित गरेका छन्। यस्तै पुरुषको ५८ केजीमुनिको तौलसमूहमा प्रदेश नम्बर ५ का गोबिन्दबहादुर आले र एपीएफका चन्द्र रानामगरले अन्तिम दुईमा स्थान सुरक्षित गरे। महिलाको ४९ केजीमुनिको तौलसमूहमा एपीएफका अस्मिता खड्का र सेनाकी युनिशा राई, पुरुषको ५४ केजी मुनिको तौलसमूहमा गणेश चौधरी र नेपाल पुलिसका मनोज मल्ल तथा महिलाको ४६ केजीमुनिको तौलसमूहमा सुदूरपश्चिमकी गीता कठेत र नेपाल पुलिसकी रेजिना कार्की फाइनलमा प्रवेश गरेका छन्।"
जिम्न्यास्टिकमा राजुलाई पाँच स्वर्ण,"नेपालगन्ज : राष्ट्रिय जिम्न्यास्टिक प्रतियोगितामा एपीएफका राजु राईले पाँच स्वर्ण जितेका छन्। राजुले थप एक रजत पनि जिते। सातौं राष्ट्रिय खेलकुदमा भने राजुले सात स्वर्ण जितेका थिए। कारकाँडोस्थित जुडो हलमा सोमबार भएको प्रतियोगितामा राजुले पुरुष फ्लोरमा ७७५ अंक जोड्दै स्वर्ण जिते। एपीएफका दिनेश सुनुवार दोस्रो तथा प्रदेश ३ का उज्ज्वल तिवारी तेस्रो भए। भल्टिङ टेबलमा राजुले रजतमा चित्त बुझाउँदा प्रदेश ३ का उज्ज्वल तिवारीले ७२५ अंक जोड्दै स्वर्ण चुमे। प्रदेश ३ कै त्रिदेव गिरी तेस्रो भए। प्यारलल् बारमा राजु ७४ अंकसाथ शीर्ष स्थानमा रहे। प्रदेश ३ का सत्यनारायण मानन्धर दोस्रो तथा प्रदेश ७ का जितेन्द्र चौधरी तेस्रो भए। पोमेल हर्समा पहिलो भएका राजुले ५९० अंक जोडे। एपीएफकै रिकेश तामाङ दोस्रो तथा प्रदेश ३ का त्रिदेव गिरी तेस्रो भए। अलराउन्डमा पहिलो स्थान हात पारेका राजुले २६९० अंक प्राप्त गरे। प्रदेश ३ का सत्यनारायण मानन्धर दोस्रो तथा एपीएफका विष्णु बाटा तेस्रो भए। राजुले थप एक स्वर्ण टिम इभेन्टमा जिते। राजुसहितको रिकेश तामाङ, रमेश श्रेष्ठ, श्रीकृष्ण खर्बुजा, दिनेश सुनुवार र विष्णु बाटाको टोलीले ११०६० अंक जोड्दै स्वर्ण जितेको हो। प्रदेश ३ दोस्रो तथा प्रदेश ७ तेस्रो भयो। यसैगरी महिलाको टिम इभेन्टमा प्रदेश ३ ले स्वर्ण हात पायो। प्रदेश ३ का तारा शिवाकोटी, जेनिशा थापा, प्रकृति थापामगर, रिजु रञ्जित, सौभाग्य कोजु र सविक्षा सुवालको टोलीले ४८५७५ अंक जोडे। एपीएफ दोस्रो र प्रदेश ७ र प्रदेश ५ तेस्रो भए। एपीएफकी पिंकी झाङले दोहोरो स्वर्ण चुमिन्। पिंकीले महिला भल्टिङमा ७७० अंक जोडिन्। प्रदेश ३ की तारा शिवाकोटी दोस्रो तथा आर्मीकी विदिशा न्यौपाने तेस्रो भए। पिंकीले फ्लोर स्पर्धामा अर्को स्वर्ण चुमिन्। प्रदेश ३ की तारा शिवाकोटी र आर्मीकी विदिशा न्यौपाने तेस्रो भए। महिला अलराउन्डमा प्रदेश ३ की तारा शिवाकोटी पहिलो भइन्। ताराले १६९५ अंक हासिल गरिन्। एपीएफकी लुमिला मानन्धर दोस्रो तथा प्रदेश ३ की प्रकृति थापामगर तेस्रो भए।"
