शीर्षक,विवरण
ऋषभ पन्तको विस्फोटक ब्याटिङले दिल्लीको सानदार जित,"काठमाडौं : इन्डियन प्रिमियर लिग(आईपीएल)मा सोमबार राति भएको खेलमा नेपालका युवा क्रिकेटर सन्दीप लामिछाने आवद्ध टोली दिल्ली क्यापिटलले सानदार जित निकालेको छ । राजस्थान रोयल्सलाई ६ विकेटले हराउँदै दिल्ली अंक तालिकाको शीर्ष स्थानमा उक्लिन सफल भएको छ । जयपुर मैदानमा भएको खेलमा दिल्लीले टस जितेर पहिले फिल्डिङ रोजेको थियो । पहिले ब्याटिङ गरेको राजस्थानले २० ओभरमा ६ विकेट गुमाएर १९१ रन बनाएको थियो । १९२ रनको लक्ष्य दिल्लीले १९२ ओभरमा ४ विकेट गुमाएर पूरा गर्यो । दिल्लीको जितका लागि ऋषभ पन्तले फिस्फोटक ब्याटिङ गरे । जम्मा ३६ बलको सामना गरेका उनले ६ चौका र ४ छक्कासहित ७८ रन बनाई अविजित रहे । त्यसबाहेक शिखर धावनले ५४ र पृथ्वी शाले ४२ रनको योगदान गरे । कप्तान श्रेयस अयर भने ४ रन बनाएर आउट भए । पहिले ब्याटिङमा उत्रिएको राजस्थानले दिल्लीविरुद्ध विस्फोटक ब्याटिङ गर्यो । ओपनर सन्जु सामसनलाई शून्य रनमै गुमाएको राजस्थानका लागि अजिंका राहने र कप्तान स्टेभेन स्मीथले ७१ बलमा १३० रनको साझेदारी गरे । रहाने १०५ रन बनाई नटआउट हुँदा स्मीथ ५० रन बनाएर पेभिलियन फर्किए । रहानेले आईपीएलमा ब्यक्तिगत दोस्रो शतक बनाएका हुन्। उच्च स्कोरतर्फ बढिरहेको राजस्थानको १६औं ओभरमा बेट स्ट्रोकको विकेट गुमेपछि रन बन्ने गति सुस्त बन्यो जसका कारण अपेक्षित स्कोर बनाउन सकेन । दिल्लीका लागि कागिसो रबाडाले २ विकेट लिए भने इशान्त शर्मा, अक्सर पटेल, क्रिस मोरिसले ११ विकेट लिए । यस खेलमा दिल्लीले सन्दीप लामिछानेको सट्टा अलराउण्डर क्रिस मारिसलाई उतारेको थियो । मोरिस यस खेलमा सबैभन्दा महंगा बलर बने ४ ओभरमा उनले ४१ रन दिए । जितपछि ११ खेल खेल्दा १४ अंक बनाएको दिल्ली शीर्ष स्थानमा उक्लिएको छ । १० खेलबाट समान अंक बनाएको चेन्नई रन रेटमा पछि परी दोस्रो स्थानमा छ ।"
आर्मी फाइनलमा,"नेपालगन्ज: आठौँ राष्ट्रिय खेलकुद प्रतियोगिता अन्तर्गत पुरुष फुटबलमा त्रिभुवन आर्मी क्लब फाइनलमा पुगेको छ। नवनिर्मित नेपालगन्ज रंगशालामा मंगलबार घरेलु टिम प्रदेश ५ लाई ट्राइबेकरमा ३१ को अन्तरले पराजित गरी आर्मी फाइनलमा पुगेको हो। निर्धारित खेल अवधिको पहिलो हाफ निकै आक्रमक खेलेर आर्मीले २० को अन्तरमा अग्रता लिएको थियो। प्रदेश ५ का ५ नं जर्सीका खेलाडी दीपेन्द्र सिंह ठकुरीले आत्मघाती गोल गरेका छन्। दोस्रो गोल भने आर्मीका १६ नंं जर्सीका दीपकुमार लामाले ३१ मिनेटमा गरेका थिए। दोस्रो हाफमा भने प्रदेश ५ जवाफी आक्रमणमा उत्रेको थियो। दुई पटक पाएको पेल्नाटीको अवसरलाई जर्सी नं १० का खेलाडी विनोद केसीले गोलमा परिणत गरी आर्मीलाई बराबरीमा रोकेका थिए। दोस्रो हाफमा आर्मीले ३ वटा कर्नरको अवसर पाएको थियो। तीन वटा सशक्त प्रहार प्रदेश ५ का गोलकिपरले रोकेका थिए। ट्राइब्रेकरमा आर्मीका नवयुग श्रेष्ठ, विवेक बस्नेत र सन्तोष तामाङले गोल गरे। जितेन्द्र कार्की र दीपक गुरुङले गोल गर्न सकेनन्। प्रदेश ५ का कृष्ण रानाभाटले मात्र गोल गरे। दीपेनसिंह ठकुरी, चेतन चौधरी र विवेक पुनले गोल गर्नबाट चुके। मंगलवार अपरान्ह ४ बजे नेपाल पुलिस क्लब र एपीएफ क्लबबीच दोस्रो सेमिफाइनल खेल हुनेछ।"
पौडीमा गौरिकासँगै शेर्पाको चर्चा,"नेपालगन्ज: आठौं राष्ट्रिय खेलकुदअन्तर्गत नेपालगन्जमा जारी पौडी प्रतियोगितामा नेपालकी कान्छी ओलम्पियन गौरिका सिंहसँगै अर्का एक खेलाडी नाथनदोर्जे शेर्पा पनि उत्तिकै चर्चामा छन्। राष्ट्रिय खेलकुदमा पहिलो पटक सहभागिता जनाइरहेको एनआरएनए टोली शेर्पाकै योगदानका कारण पदक तालिकामा कर्णाली प्रदेशभन्दा माथि उक्लिएको छ। पदक तालिकामा एनआरएनए टोलीले जितेका चारमध्ये तीन स्वर्ण शेर्पाकै नाममा लेखिएको छ। पौडीको पहिलो दिन दुई स्वर्ण आफ्नो नाममा लेखाएका शेर्पाले दोस्रो दिन सोमबार अर्को एक स्वर्ण थपेका छन्। उनले सोमबार पुरुष चार सय मिटर फ्रिस्टाइल स्पर्धामा स्वर्ण पदक हात पारे। निर्धारित दूरी पूरा गर्न शेर्पाले चार मिनेट ३३०९ सेकेन्ड समय खर्चिए। सो स्पर्धामा एएपीएफ क्लबका नासिर हुसेनले रजत र सोही क्लबका उर्गेन महर्जनले कांस्य पदक पाए। शेर्पाले आइतबार भने पुरुष आठ सय मिटर फ्रिस्टाइल र दुई सय मिटर बटरफ्लार्ईमा आपूलाई च्याम्पियनको रूपमा उभ्याएका थिए। सोमबारको खेलमा त्रिभुवन आर्मी क्लबकी गौरीका सिंहले पनि दुई स्वर्ण थप्दै आफ्नो स्वर्ण पदक संख्या चार पुयाएकी छिन्। अघिल्लो दिन दुई राष्ट्रिय कीर्तिमान बनाएकी गौरीकाले सोमबार पनि महिला एक सय मिटर फ्रिस्टाइलमा कीर्र्तिमान बनाएकी छिन्। उनले निर्धारित दूरी ५९६० सेकेन्डमा पूरा गरेर कीर्तिमान बनाएकी हुन्। सो स्पर्धामा आर्मी क्लबकै सोफिया शाह दोस्रो र एपीएफ क्लबकी टिसा शाक्य तेस्रो भए। सोमबार नै गौरीकाले महिला चार सय मिटर फ्रिस्टाइल स्पर्धामा पनि स्वर्ण पदक जितिन्। निर्धारित दूरी पूरा गर्न गौरिकाले चार मिनेट ४४८१ सेकेन्ड खर्चिन्। सो स्पर्धामा आर्मी क्लबकै दुआना लामाले रजत र एपीएफकी टिसा शाक्यले कांस्य पदक हात पारे। सोमबार अर्को बनेको कीर्तिमान भने पुलिस क्लबका खेलाडी शैयद हमजा शाहको नाममा रह्यो। उनले पुरुष ५० मिटर बटरफ्लाईमा निर्धारित दूरी २७०० सेकेन्डमा पार गर्दै कीर्तिमानसहित स्वर्ण पदक जितेका हुन्। सो स्पर्धामा आर्मी क्लबका अनुभव सुब्बा दोस्रो र एपीएफका तेन्जिङ गुरुङ तेस्रो भए। महिलाको ५० मिटर बटरफ्लाईमा सोफिया शाहले स्वर्ण पदक जितिन्। उनले निर्धारित दूरी ३३५० सेकेन्डमा पूरा गरेकी थिइन्। सो स्पर्धामा पुलिस क्लबकी अनुसिया तण्डुकारले रजत र एपीएफकी श्रीबी महर्जनले कांस्य पदक जिते। यसैगरी पुरुष दुई सय मिटर ब्रेस्टस्ट्रोकमा एपीएफ क्लबका शुभम श्रेष्ठ पहिलो, पुलिस क्लबका दीपांकर अवाले दोस्रो र प्रदेश १ का विकास कुमाल तेस्रो भए। महिला दुई सय मिटर ब्रेस्टस्ट्रोक स्पर्धाको उपाधि भने दुआना लामाको पोल्टामा पयो। उक्त स्पर्धामा आर्मी क्लबकै उपास्ती महर्जनले रजत र पुलिस क्लबकी प्रदिप्सा वैद्यले कांस्य पदक हात पारे। जारी प्रतियोगितामा दुआनाको यो तेस्रो स्वर्ण हो। आर्मी क्लबका एलेक्स शाहले पनि राष्ट्रिय कीर्तिमानसहित पुरुष एक सय मिटर फ्रिस्टाइलमा स्वर्ण पदक जिते। उनले सो कीर्तिमान हिट चरणको खेलमा बनाएका हुन्। हिट चरणमा निर्धारित दूरी ५५३८ सेकेन्डमा पूरा गर्दै एलेक्सले राष्ट्रिय कीर्तिमान कायम गरेका हुन्। स्वर्णका लागि भएको भिडन्तमा भने सोही दूरी पूरा गर्न एलेक्सले ५५६३ समय खर्चिए। उक्त स्पर्धामा पुलिस क्लब सहिद हमजा शाह दोस्रो र आर्मी क्लबका अनुभव सुब्बा तेस्रो भए।"
ताप्लेजुङमा सर्वाधिक धनराशीको भलिबल प्रतियोगिता,"काठमाडौं : ताप्लेजुङको मैवाखोला गाउँपालिकामा नेपालकै सर्वाधिक धन राशीको तेस्रो पाथीभरा राष्ट्रिय पुरुष भलिवल प्रतियोगता हुने भएको छ। नेपाल कम्युनिस्ट पार्टी (नेकपा) स्थायी कमिटी सदस्य एवम् सांसद योगेश भट्टराईको उपस्थितीमा काठमाडौंमा आयोजित पत्रकार सम्मेलनमा प्रतियोगिताबारे जानकारी दिइएको हो। प्रतियोगितामा प्रथम हुने टिमलाई तीन लाख ५१ हजार पाँचसय पाँच रुपैयाँ, उपविजेतालाई एक लाख ७६ हजार दुई सय ५१ रुपैयाँ र सेमी फाइनलका टिमलाई ५० हजार रुपैयाँ प्रदान गर्ने आयोजकले जनाएको छ। प्रतियोगिताको कुल लागत ३६ लाख ५६ हजार रहेको बताइएको छ। वैशाख २२ देखि २६ गतेसम्म मैवाखोला गाँउपालिका ३ साँघुस्थित नारायणी माविको खेल मैदानमा हुने खेलको नगद पुरस्कारको प्रायोजन ताप्लेजुङ निवासी काठमाडौंका व्यवसायीहरु बलबहादुर तामाङ, ईश्वरी पौडेल र रमेश बरालले गरेका छन्। नेपाल भलिबल संघ र ताप्लेजुङ जिल्ला भलिबल संघको प्राविधिक सहयोग तथा मौवाखोला क्लब र न्यू पाथीभरा क्लबको सहआयोजनामा प्रतियोगिता हुने संयोजक दिवस चोङवाङले जानकारी दिए।"
प्याराग्लाइडिङमा आर्मी र गण्डकीको वर्चस्व,"पोखरा : आठौं राष्ट्रिय खेलकुद प्रतियोगिताअन्तर्गत प्याराग्लाइडिङ प्रतियोगितामा कुल ६ स्वर्णमध्ये विभागीय टिम नेपाल आर्मीले चार र गण्डकी प्रदेशले दुई स्वर्ण जितेका छन्। राष्ट्रिय खेलकुदमा पहिलो पटक समावेश गरिएको प्याराग्लाइडिङ प्रतियोगितामा पहिलो पटक प्याराग्लाइडिङ प्रतियोगितामा सहभागी भएको नेपाल आर्मीले पुरुष तर्फ तीन र महिलातर्फ एक स्वर्ण पदक जितेको हो। गण्डकी प्रदेशले महिला र पुरुष दुवैतर्फ एक एक स्वर्ण जितेको छ। सोमबार सम्पन्न प्रतियोगितामा नेपाल आर्मी चार स्वर्ण र चार रजत पदक जित्दै च्याम्पियन भएको छ। त्यसैगरी गण्डकी प्रदेश दुई स्वर्ण, एक रजत र चार कांस्य पदक हात पार्दै दोस्रो स्थान ओगटेको छ। प्रदेश नं १ एक रजत र एक कांस्य पदकका साथ तेस्रो र प्रदेश ३ एक कांस्य पदकका साथ चौथो भएको छ। सम्पन्न प्रतियोगितामा नेपाल आर्मीले एक्युरेसीतर्फ पुरुष र महिला इन्डिभिजुअल, टिम एक्युरेसी तथा पुरुष इन्डिभिजुअल क्रसकन्ट्रीमा गरी चार स्वर्ण पदक हात पारेको हो। त्यसैगरी गण्डकी प्रदेश महिला इन्डिभिजुअल क्रसकन्ट्री र पुरुष क्रसकन्ट्रीतर्फ दुई स्वर्ण पदक हात पार्न सफल भएको छ। एक्यरेसी इन्डिभिजुअल पुरुषतर्फ ओभरअलमा १९ अंक बटुल्दै नेपाल आर्मीका सागर नेपालीले स्वर्ण पदक हात पारे भने नेपाल आर्मीकै ऋषि जलारी पोडले २३ अंकका साथ रजत पदक जिते। गण्डकीका अनिश भट्टराई ३३ अंक प्राप्त गर्दै कांस्य पदक हात पारे। सोही इभेन्टको महिला तर्फ पनि नेपाल आर्मीकी दुर्गामाया गुरुङले चार सय ७९ अंक प्राप्त गर्दै स्वर्ण पदक जितिन्। यसैगरी गण्डकीकी प्रतिभा भुजेलले पाँच सय ४० अंकका साथ रजत र गण्डकीकै सविता तामाङ पाँच सय ७३ अंक बटुल्दै कांस्य पदक जितेकी छन्। एक्युरेसी टिम इभेन्टमा नेपाल आर्मी एक सय ७५ अंक प्राप्त गर्दै स्वर्ण पदक हात पार्न सफ भएको छ भने प्रदेश नं १ ले एक हजार १९ अंकका साथ रजत पदक हात पारेको छ। गण्डकी प्रदेश एक हजार तीन सय ४५ अंक प्राप्त गरी कांस्य पदकमा चित्त बुझाएको छ। क्रसकन्ट्री पुरुष इन्डिभिजुअलमा नेपाल आर्मीका सुरज थापाले ओभरअलमा दुई हजार पाँच सय ९५ अंक बटुल्दै स्वर्ण पदक जितेका छन। नेपाल आर्मीकै विशाल थापाले दुई हजार पाँच सय ५० प्राप्त गरी रजत पदक हात पार्दा गण्डकीका आशिष थापाले दुई हजार पाँच सय ४५ अंकका साथ रजत पदकमा चित्त बुझाएका छन। क्रसकन्ट्री महिला इन्डिभिजुअल इभेन्टमा गण्डकीकी त्रिशा बमजनले एक हजार एक सय ३५ अंक प्राप्त गर्दै स्वर्ण पदक जितेकी छन्। नेपाल आर्मीकी स्वस्तिका गुरुङ ६ सय ५७ अंक बटुल्दै रजत पदक हात पारिन्। प्रदेश १ की सुस्मिता सुनुवार तीन सय ४५ अंकका सात तेस्रो हुँदै कांस्य पदक जितिन्। क्रसकन्ट्री पुरुष टिम इभेन्टमा गण्डकी प्रदेशले कुल नौ हजार पाँच सय ७६ अंक प्राप्त गरी स्वर्ण पदक जितेको छ। सोही इभेन्टमा नेपाल आर्मीले नौ हजार एक सय १४ अंक बटुल्दै रजत पदक जितेको छ। प्रदेश नं ३ ले आठ हजार दुई सय ४३ अंक प्राप्त गरी कांस्य पदक हात पारेको हो। वैशाख ६ गते बाट पोखरामा सुरु भएको प्याराग्लाइडिङ प्रतियोगितामा ६ स्वर्ण, ६ रजत र ६ कांस्य पदकका लागि १० महिलासहित पुरुष ४९ गरी कुल ५९ जना खेलाडी प्रतिस्पर्धामा सहभागी भएका थिए।"
