शीर्षक,विवरण
नागरिकलाई रैती नै ठान्ने 'ॅरमिता,"विशिष्ट व्यक्तिको सुरक्षा कार्यविधि २०७७ अनुसार राजकीय भ्रमण, संसद्को बजेट अधिवेशन, संयुक्त संसद्को पहिलो बैठक, विदेशी राष्ट्रप्रमुख र सरकार प्रमुखको निमन्त्रणामा हुने विदेश भ्रमण, नेपाल सरकारले तोकेको अन्य भ्रमण अति विशिष्ट सवारी हुन् । कार्यविधिमा भनिएको छ, अति विशिष्ट सवारीका बेला सडकमा समन्वय गरेर सुरक्षा व्यवस्थापन मिलाइनेछ । सडक खाली गराएर सवारी गर्ने विषय कतै उल्लेख छैन । तर सेना, प्रहरी, सशस्त्र र राष्ट्रिय अनुसन्धान विभागका अधिकारीले भक्ति प्रदर्शन गर्न सडक खाली गराउँदै आएका छन् । जसबाट राष्ट्रपतिसहित विशिष्टहरूप्रति नागरिक तहमा असन्तुष्टि चुलिँदो छ । तर, जनताबाट निर्वाचित विशिष्ट भने जनविरोध वास्ता नगरी राजामहाराजाजस्तै रमाउँदै आएका छन् । राष्ट्रपतिको सवारीमा निकट र भित्री सुरक्षा सेनाबाटै, मध्य सुरक्षामा सेना र प्रहरीबाट तथा बाहिरी सुरक्षामा निसानाबाज सेना खटाइएको हुन्छ । शीघ्र कारबाही टोली भनेर सेना र सशस्त्रलाई खटाइएको हुन्छ भने बाटो नियन्त्रणमा प्रहरी र सशस्त्र तैनाथ हुन्छन् । राष्ट्रपतिलगायत अति विशिष्टको सवारीबाट सडकमा अनावश्यक चाप नपरोस् भनेर केही वर्षअघि विकल्पमा बहस भए पनि सुधारको सुरुवात भएको छैन । सवारीका बेला सडकको एउटा लेन मात्रै खाली गराउने, त्यो पनि सवारी सकिनेबित्तिकै पूरै सडक खुलाउने बहस भएका थिए । राष्ट्रपति विदेश जाँदा निवासबाट विमानस्थलसम्म हेलिकोप्टर प्रयोगको विषय पनि उठेको थियो । तर, यी सबै विषय थाती रहे, एक पूर्वसुरक्षाकर्मी भन्छन् । नेपाल प्रहरीका पूर्वएआईजी प्रद्युम्न कार्की व्यस्त सडक बन्द गराएर नागरिकलाई बाटो हिँड्नै नदिने र हिँड्न खोज्नेलाई लाठी प्रहार गर्ने प्रवृत्ति गलत भएको बताउँछन् । विशिष्टको सवारी छ भन्दैमा नागरिक घण्टौं अडिएर बसिरहनुपर्ने होइन, कोही आपत्कालीन काममा पनि जानुपर्ने हुन सक्छ । सुरक्षाकर्मीले यस विषयमा ख्याल गर्नुपर्ने हो, उनी भन्छन् । घण्टौं सवारी बन्द भएर पुनः सुचारु गराउन खटिएका सुरक्षाकर्मीमा मानसिक र शारीरिक तनावले नकारात्मक परिणाम पनि ल्याउने गरेको उनको भनाइ छ ।पूर्वगृह सचिव खेमराज रेग्मी नागरिकलाई घण्टौं सडकमा उभ्याएर राष्ट्रपति सवार हुनु पुरानै संस्कारको निरन्तरता भएको बताउँछन् । विशिष्ट व्यक्तिहरूको आवागमन हुँदा सवारी व्यवस्थापन हुनुपर्छ तर राजामहाराजाको शाही ठाँट होइन, देश र परिवेश सुहाउँदो हुनुपर्छ, रेग्मी भन्छन्, तर, हाम्रोमा गणतन्त्रलोकतन्त्र आएपछि विशिष्ट भनाउँदाको ठाँट हटेन । यसले व्यवस्थाप्रति नै वितृष्ण फैलाउने जोखिम बढ्यो । उनले आफ्नो सवारीका क्रममा नागरिकले पाएका सास्तीबारे ख्याल गरेर राष्ट्रपति आफैंले तामझाम होइन, जनताले दुःख नपाउने गरी सवारी व्यवस्थापन गर्नु भनेर भन्न नसकेको टिप्पणी पनि गरे । यसले राष्ट्रपतिमा पनि शाही रवाफको भोक देखिएको छ, उनले भने ।"
राष्ट्रपतिका प्रश्नैप्रश्न,"बजारमा देखिएको मौद्रिक तरलता सूचकांकका कारण बैंक तथा वित्तीय संस्थाको ब्याजदर बढेको छ, जुन संकट हल गर्न तत्काल कदम चालिहाल्नु आवश्यक देखिएको छ, उनले भनिन्, तरलता अभावको स्थितिमा ब्याजदर बढ्न गई उत्पादन लागत बढ्नु स्वाभाविक हो । यसबाट उद्योगी व्यापारी मात्र होइन आम उपभोक्तासमेत मारमा पर्दछन् । पछिल्ला दिनमा निजी क्षेत्रमा देखिएको निराशा यसैको उपज हो । सम्बोधनको क्रममा उनले वार्षिक नीति तथा कार्यक्रम जस्तै हरेक क्षेत्रलाई समेटेर कमजोरी र सुधारको बाटो औंल्याइन् । कृषि क्षेत्रमा सुधार ल्याउन ५ वर्षभित्र रासायनिक मल उत्पादन गर्ने कारखाना सञ्चालनमा ल्याउनुपर्ने उनले सुझाइन् । मल कारखाना स्थापना गर्ने कार्यक्रम सधैं बनाए पनि यसले सार्थकता भने कहिल्यै नपाएकामा उनले गुनासो गरिन् । स्वदेशी उत्पादनको प्रयोग गर्न, कच्चा खाद्यवस्तुमा मूल्य अभिवृद्धि गर्ने खाद्य प्रशोधन उद्योग स्थापना गर्न र कृषिवस्तुको भण्डारण क्षमता बढाउन प्रोत्साहित गर्ने कार्यक्रम अविलम्ब सञ्चालन गर्न उनको सुझाव छ । युवा तथा शिक्षित बेरोजगारमा देखिएको चरम निराशाको अवस्था तोड्न सरकारले ध्यानकेन्द्रित गर्नुपर्ने उनले बताइन् ।सुशासनको प्रत्याभूत गराउन र आमनागरिकमा राज्यको अनुभूति दिलाउन नसकेको उनको भनाइ छ । सार्वजनिक सेवा प्रवाह चुस्त दुरुस्त हुनुपर्छ । सरकारी संयन्त्रको सेवा प्रवाहमा हुने ढिलासुस्ती र अनियमितता हटाउन नसकिए हामीले मुलुकमा सुशासन छ भनेर दाबी गर्नॅ निरर्थक हुन्छ, उनले भनिन्, त्यसैले नागरिकले घरदैलोमै सरकार छ भन्ने अनुभूत गर्न सक्ने गरी सेवा प्रवाहको व्यवस्था मिलाउनुपर्छ । नागरिकले घरैमा वा नजिकको वडा कार्यालयबाट सेवा लिन सक्ने प्रणालीको विकास गर्नुपर्ने उनले बताइन् । सरकारी सेवा सूचना प्रविधिको माध्यमबाट उपलब्ध गराउने भनिए पनि कतिपय सेवाका लागि झन् लामो लाइन बस्नुपर्ने बाध्यता देखिएको उनको भनाइ छ । केही स्थानीय तहको साक्षरता दर ५० प्रतिशत पनि नभएकाले विद्यालय शिक्षामा बृहत् सुधारको खाँचो औंल्याउँदै उनले स्वास्थ्यमा क्षेत्र पनि विकराल अवस्था रहेको बताइन् । सामान्य औषधि र न्यूनतम उपचारको अभावमा अकालमा ज्यान जाने अवस्था आउन दिनु हँॅदैन । हरेक नागरिकले देशभित्रै विशिष्ट स्वास्थ्य सेवा प्राप्त गर्ने गरी स्वास्थ्य क्षेत्रका कार्यक्रम कार्यान्वयन गर्न सरकारको ध्यान अवश्य जानेछ, उनले भनिन् ।पूर्वाधारको क्षेत्रका आयोजना कार्यान्वयनको गति अन्त्यन्त सुस्त र गुणस्तरहीन भएकोमा पनि उनले असन्तुष्टि व्यक्त गरिन् । निर्माण भएको छोटो अवधिमै जीर्ण हुने गरी पूर्वाधार विकास हुनु स्रोतको दुरुपयोग मात्र हो भन्ने मेरो बुझाइ छ, उनले भनिन्, पूर्वाधार आयोजनाको छनोट र निर्माणमा कनिका छराइको प्रवृत्ति छिट्टै बन्द हुनुपर्छ । प्रतिफल नदिने र आवश्यक अध्ययन विश्लेषणबिना राजनीतिक, प्रशासनिक दबाब र प्रभावमा कार्यान्वयन गरिने ससाना आयोजनाले एकातिर स्रोतको दुरुपयोगलाई बढावा दिन्छ भने अर्कातिर सोबाट प्रतिफल पनि प्राप्त हँॅदैन । आर्थिक, सामाजिक, उद्योग, रोजगार, पर्यटन, सार्वजनिक सेवा प्रवाह, शिक्षा, स्वास्थ्य, महिला, बालबालिका, युवा, ज्येष्ठ नागरिक, पूर्वाधार, जलस्रोत, जलवायु जस्ता मूल विषयमा राष्ट्रपति भण्डारीले आफूले सात वर्षको अनुभवमा देखिएका विषय प्रस्तुत गरेको बताइन् । सरकारले आगामी आर्थिक वर्षको नीति तथा कार्यक्रम तयार गर्दा यी सबैलाई समेट्दै सोका आधारमा बजेटमा आवश्यक स्रोत व्यवस्थापन गर्ने नै छ, उनले भनिन्, सरकारका कामकारबाहीमा सबै नागरिकबाट सकारात्मक सहयोग प्राप्त हुने अपेक्षा गर्दछु ।"
इलमी बनाउँदै विद्यालय,"विद्यार्थीलाई मद्दत गर्न विद्यालयमा आयस्रोत वृद्धि गर्नुपर्ने दायित्वबाट उक्त अभियानको अवधारणा ल्याइएको प्रअ वलीको धारणा छ । यस्तो उपायलाई छिमेकका विद्यालयले पनि पछ्याउँदै आएका छन् । हाल उक्त अवधारणाअनुसार सिद्धरत्न मावि हाङजाबाङ र काउलाबोटको विद्यालयले अनुसरण गरेको देख्न पाउँदा खुसी लागेको उनी बताउँछन् । स्थानीय समाजसेवी जयनारायण गौतमको नामबाट २०४१ सालमा स्थापना गरिएको उक्त विद्यालयमा हाल डेढ सय विद्यार्थी पढ्छन् । दलित समुदायको बाक्लो बसोबास रहेको क्षेत्रमा विद्यालय छ । आसपासका बसोबासीमा विपन्न परिवार धेरै छन् । उनीहरूका बालबालिका विद्यालयमा पढ्छन् । ती बालबालिकाका लागि शैक्षिक सामग्री प्रदान गर्न र खानबस्नको समेत व्यवस्था गर्नुपर्ने अवस्था छ । प्रअ वलीका अनुसार नयाँ भवन, थप जग्गा र होस्टलको समेत व्यवस्था भए गरिब विद्यार्थीलाई पढाइमा नियमित अवसर दिन सकिन्थ्यो । विद्यालयलाई नयाँ अभ्यासबाट सञ्चालन गर्ने योजनाबाट अभिभावकसमेत खुसी छन् । अभिभावकलाई सघाउँदै आएका निरन्तर शिक्षाका लागि वैकल्पिक शिक्षण सिकाइ परियोजनाका संयोजक धरेन्द्र डाँगीले शिक्षक, विद्यालय, विद्यार्थीबीचको आत्मीय समन्वयबाट शिक्षण सिकाइमा समेत सकारात्मक प्रभाव पारेको बताए । त्रिवेणी७ गैरीगाउँ गाङको वीरेन्द्र माविले पढ्दै कमाउँदै कार्यक्रम सञ्चालन गर्दै आएको छ । कमजोर आर्थिक अवस्थाका विद्यार्थीको छनोट गरी उनीहरूका अभिभावकलाई समेत आबद्ध गरेर व्यवसाय चलाउन विद्यालयले आर्थिक सहयोग गरेको हो । भर्ना भएका विद्यार्थीको छनोट गरी ७ वटा समूहमा बाँडेर ३ लाखभन्दा बढी रकम प्रदान गरिएको छ । प्रत्येक विद्यार्थीलाई खसी पाल्न १० हजार, माछा पाल्न १५ हजार, रैथाने जातका कुखुरा पाल्न १० हजार, तरकारी खेती गर्न ८ हजार रुपैयाँका दरले नगद सहयोग दिइएको प्रधानाध्यापक बरमान बुढामगरले बताए । विद्यार्थीको आर्थिक अवस्था कमजोर भएकाले परिवारसँग मिलेर व्यवसाय गर्न हामीले सहयोग दिने निर्णय गरेका हौं, विद्यालय व्यवस्थापन समितिका अध्यक्ष चित्रबहादुर झाँक्रीले भने, सबै पैसा हामीले विद्यार्थीसँगै भैलो खेलेर संकलन गरेका थियौं । त्यही बाँडेर विद्यार्थीलाई व्यवसायी बनाउन पढ्दै कमाउँदै कार्यक्रम चलाएका हौं । उनका अनुसार २०७९ को भैलो कार्यक्रममार्फत संकलित रकमबाट ७ समूहका दर्जनौं विद्यार्थीले व्यवसायी बन्ने अवसर पाएका छन् । गाङमै विद्यालयले संस्कारसहितको शिक्षा कार्यक्रमसमेत चलाइएको छ । जसअनुसार विद्यालयलाई आधार केन्द्र मानी व्यावहारिक ज्ञान प्रदान गर्ने लक्ष्य रहेको प्रधानाध्यापक बुढामगरले बताए । वीरेन्द्र माविले बोली, व्यवहार, शैली, सीप र ज्ञानको विस्तार गर्न यस्तो अभियान थालेको हो । हामीले बोलीमा शुद्धता ल्याउन आवश्यक छ । विद्यालयमा जे सिक्यो, त्यहीअनुसार जीवनमा व्यवहार बन्ने हो । त्यसैले हामीले संस्कारसहितको शिक्षा कार्यक्रम थालेका हौं, उनले भने । हाल विद्यालयमा ४ सयभन्दा बढी विद्यार्थी छन् । सानैबाट नयाँ कुरा सिक्ने हुटहुटी भएकालाई व्यवसायी बनाउने, सीप सिकाइने भएकाले विद्यालयले ल्याउने कार्यक्रमलाई सघाउने गरेको अभिभावक सिर्जना झाँक्रीले बताइन् । विद्यालयमा नयाँ अभियान थालेकाले मेरो सानो छोराले पनि नयाँ कुरा सिकिरहेको छ, उनले भनिन्, मलाई यो देख्दा निकै आनन्द लाग्छ । अभावग्रस्त र निम्न गुणस्तरीय शैक्षिक अभियानबाट माथि उठ्न विद्यालयले थालेका यस्ता नयाँ अभियानबाट प्रभावित भएको त्रिवेणी गाउँपालिकाका प्रमुख प्रशासकीय अधिकृत निमबहादुर केसीले बताए । विद्यालय नै अग्रसर भएर पढ्दै कमाउँदै र कमाउँदै पढाउँदै कार्यक्रम थालेकामा निकै खुसी लागेको छ, उनले भने, हामी पनि ती विद्यालयलाई सहयोग गर्ने नीति ल्याउँदै छौं । त्रिवेणीमा यसअघि निजी विद्यालयलाई सामुदायिक विद्यालयमा गाभिएको थियो । यहाँका हरेक विद्यालयलाई वास्तविक ज्ञानको केन्द्र बनाउन तल्लो कक्षाका विद्यार्थीका लागि बसाइ व्यवस्थापन अभियान पनि थालिएको छ । सबै विद्यालयमा शिशुदेखि कक्षा ४ सम्मका विद्यार्थीलाई कार्पेटमाथि राखेर व्यावहारिक ज्ञान दिने शैलीमा पढाइ हुने गरेको छ ।"
धरोहरलाई पुनर्जीवन,राजधानीको त्रिचन्द्र कलेज पुनर्निर्माणमा खटिएका कामदार । स्थापनाको १०४ वर्ष पुगेको कलेज भवनलाई २०७२ वैशाख १२ को भूकम्पले क्षति पुर्याएको थियो । भवन तथा सहरी पूर्वाधार विभागको केन्द्रीय आयोजना कार्यान्वयन इकाइ (भवन तथा आवास) ले पुनर्निर्माण सुरु गरेको हो । निर्माणका काम ३ वर्षभित्र पूरा गर्नुपर्ने गरी ३४ करोड ६७ लाखमा सम्झौता भएको छ । क्याम्पस भवन पुनर्निर्माणकै क्रममा घण्टाघरको घडीलाई पनि स्वचालित बनाउने योजना छ ।तस्बिर ः सन्जोग मानन्धरकान्तिपुर
