शीर्षक,विवरण
रियल म्याड्रिडलाई हराउँदै एट्लेटिकोले जित्यो सुपर कपको उपाधि,"तलिन : यूईएफए सुपर कप फुटबलको उपाधि एट्लेटिको मड्रिडले जितेको छ । इस्टोनियाको तलिनमा बुधबार राति भएको खेलमा एट्लेटिको चर्चित द्वन्द्वी एवं साविक विजेता रियल म्याड्रिडलाई ४२ गोलले हरायो । टोलीका प्रभावशाली स्ट्राइकर क्रिस्टियानो रोनाल्डो युभेन्ट्स गएपछि अहिल रियललाई रोनाल्डोको अभाव खड्किएको छ । एउटै सहरका दुई टोलीबीचको प्रतिस्पर्धात्मक भिडन्तमा निर्धारित ९० मिनेटमा दुवै टोली २२ गोलको बराबरीमा रोकिएका थिए । त्यसपछि अतिरिक्त समयमा धकेलिएको खेलमा एट्लेटिकोले दुई गोल थप्दै उपाधिमा कब्जा जमायो । एट्लेटिको मड्रिडलाई उपाधि जिताउन डिएगो कोस्टाले दुई तथा साउल निग्वेज र कोकीले एक एक गोल गरे । रियल म्याड्रिडका लागि करिम बेन्जेमा र सर्जियो रामोसले एक एक गोल गरे पनि टोलीलाई उपाधि दिलाउन सकेनन् । खेल सुरु भएको पहिलो मिनेटमै एट्लेटिकोका कोस्टाले उत्कृष्ट गोल गरेका थिए । एट्लेटिकोको गोलपछि आक्रामक देखिएको रियलले २७औं मिनेटमा बराबरी गोल फर्कायो । बेन्जेमाले गोल गर्दै खेललाई ११ को अवस्थामा पुयाए । पहिलो हाफ बराबरीमा सकिएको खेलमा रियलले ६३औं मिनेटमा पेनाल्टीमार्फत २१ को अग्रता बनायो । उक्त पेनाल्टीको रामेसले सदुपयोग गरे । रियलको अग्रतापछि जोसिएको एट्लेटिकोले ७९औं मिनेटमा बराबरी गोल फर्कायो । कोस्टाले व्यक्तिगत दुई गोल गर्दै खेललाई बराबरीमा ल्याए । निर्धारित समयमा २२ गोलको बराबरीमा सकिएपछि अतिरिक्त समयमा एट्लेटिको हावी देखिएको थियो । ९९औं मिनेटमा निग्वेज र १०४औं मिनेटमा कोकीले गोल गर्दै एट्लेटिकोलाई सहज जित दिलाएका थिए । एट्लेटिकोले योसहित यूईएफए सुपर कप उपाधि जितेको तेस्रोपटक हो । यसअघि एट्लेटिकोले सन् २०१० र २०१२ मा उपाधि जितेको थियो । रियलले भने चारपटक यस उपाधि जितेको छ । रियल सन् २००२, २०१४, २०१६ र २०१७ मा च्याम्पियन बनेको थियो ।"
फिफा वरीयतामा नेपालको स्थान यथावत्,"काठमाडौं : फिफा वरीयतामा नेपालको स्थान यथावत् रहेको छ । विश्व फुटबल महासंघ (फिफा)ले बिहीबार सार्वजनिक गरेको पछिल्लो वरीयतामा नेपाल एक सय ६१औं स्थानमा यथावत् छ । दक्षिण एसियामा भने नेपाल तेस्रो स्थानमा छ । दक्षिण एसियामा भारत शीर्ष स्थानमा छ । एक स्थान सुधार गरेको भारत समग्रमा ९६औं स्थानमा छ । दोस्रो स्थानमा रहेको माल्दिभ्स समग्रमा वरीयतामा एक सय ५०औं स्थानमा यथावत् छ । यसैगरी चौथो स्थानमा रहेको भुटान एक सय ८३, पाँचौं स्थानमा रहेको बंगलादेश समग्रमा एक सय ९४, श्रीलंका दुई सय र पाकिस्तान दुई सय एक स्थानमा छन् । एसियाको शीर्ष स्थानमा रहेको इरान समग्रमा ३२औं स्थानमा छ । अस्ट्रेलिया ४३औं स्थानमा छ भने जापान ५५औं स्थानमा छ । यसैगरी विश्वकप विजेता फ्रान्स शीर्ष स्थानमा उक्लिएको छ । फ्रान्सले ६ स्थान सुधार गरेको छ । एक स्थान सुधार गरेको बेल्जियम दोस्रो स्थानमा उक्लिएको छ । ब्राजिल एक स्थान खस्कँदै तेस्रो स्थानमा झरेको छ । १६ स्थान सुधार गरेको क्रोएसिया चौथो स्थानमा उक्लिएको छ । उरुग्वे नौ स्थान सुधार गर्दै पाँचौं स्थानमा उक्लिएको छ ।"
सन्दीप लयमा,"काठमाडौं : नेपाली राष्ट्रिय टोलीका युवा स्पिनर सन्दीप लामिछानेले क्यारेबियन प्रिमियर लिग (सीपीएल)मा आफ्नो उत्कृष्ट प्रदर्शन जारी राखेका छन् । लिगअन्तर्गत बिहीबार भएको खेलमा सन्दीपले दुई विकेट लिए । सन्दीपले २१ रन खर्चिएर दुई विकेट लिएका थिए । सन्दीप लयमा देखिए पनि उनको टोली सेन्ट किट्स एन्ड नेभिस प्याट्रियट्स भने जमैका तल्वाहाससँग ४७ रनले पराजित भयो । जमैकाले दिएको एक सय ७९ रनको लक्ष्यसहित जवाफी ब्याटिङमा उत्रिएको प्याट्रियट्स निर्धारित २० ओभरमा नौ विकेटको क्षतिमा एक सय ३१ रनमा समेटिएको थियो । प्याट्रियट्सका कप्तान क्रिस गेलले २४ र मोहमद महमुदउल्लाहले २२ रन जोडेका थिए । यसअघि टस हारेर पहिले ब्याटिङ गरेको जमैकाले २० ओभरमा चार विकेटको क्षतिमा एक सय ७८ रन बनाएको थियो । जमैकाका लागि रोस टेलरले ५१, केन्नर लेविस ४९ र ग्लेन फिलिप्सले ४१ रन बनाए । प्याट्रियट्सका सन्दीपले दुई विकेट लिए । लिगमा तीन खेल खेलेको प्याट्रियट्सका लागि सन्दीपले पाँच विकेट लिइसकेका छन् । लिगमा दुई अंक बनाएको प्याट्रियट्स तालिकाको पाँचौं स्थानमा छ । शीर्ष स्थानमा रहेको जमैकाको ६ अंक छ । सन्दीप हालै नेदरल्यान्ड्समा एकदिवसीय खेल खेलेर उतैबाट क्यारेबियन प्रिमियर लिग (सीपीएल) खेल्न गएका थिए । इन्डियन प्रिमियर लिग (आईपीएल) खेल्ने पहिलो नेपाली खेलाडी बनेको सन्दीपले आईपीएलमा पनि तीन खेलमा पाँच विकेट लिएका थिए । सन्दीपले अघिल्लो महिना ग्लोबल टीट्वेन्टी क्यानाडा लिगमा मोन्ट्रियल टाइगर्सबाट ६ खेलमा ८ विकेट लिएका थिए । सन्दीपले नेपालबाट २२ लिस्ट ए खेलमा ४३ विकेट लिइसकेका छन् ।"
समूह चरणबाटै बाहिरियो नेपाल,"काठमाडौं : १८औं एसियाली खेलकुद प्रतियोगिता (एसियाड) फुटबलमा नेपाल समूह चरणबाटै बाहिरिएको छ । समूह चरणको दोस्रो खेलमा नेपाल भियतनामसँग २० गोलले पराजित भएपछि अन्तिम खेल अगावै प्रतियोगिताबाट बाहिरिएको हो । इन्डोनेसियाको विबावा रंगशालामा बिहीबार भएको खेलमा भियतनामले नेपाललाई खेल अवधिभर दबाबमा राखेको थियो । नेपालले दुवै हाफमा एकएक गोल खाएको थियो । पहिलो खेलमा जापानसँग १० ले पराजित भएको नेपालले भियतनामसँग सुधारिएको प्रदर्शन गर्ने अपेक्षा गरिए पनि नेपालले गोलको खडेरी भने तोड्न सकेन । निकै फितलो प्रदर्शन गरेको नेपालले खेलको ३१ र ६३औं मिनेटमा गोल खाएको थियो । भियतनामका लागि आन दुक एग्युएनले ३१औं मिनेटमा गोल गर्दै टोलीलाई अग्रता दिलाएका थिए । त्यस्तै खेलको ६४ औं मिनेटमा फान भान दुकले गोल गर्दै भियतनामको जित सुनिश्चित गरेका थिए । पहिलो हाफमा भियतनामले केही उत्कृष्ट प्रहार गरेको थियो । लगातार पोस्टमा आक्रमण हुँदा कप्तान तथा गोलरक्षक किरण चेम्जोङ निकै व्यस्त बन्नु परेको थियो । लगातार दोस्रो खेलमा हार बेहोरेपछि अघिल्लो चरण पुग्ने नेपालको लक्ष्यमा पनि धक्का लागेको छ । नेपाललाई पराजित गरेसँगै भियतनाम भने अघिल्लो चरणमा प्रवेश गरेको छ । पहिलो खेलमा भियतनामले पाकिस्तानलाई ३० गोल अन्तरले पराजित गरेको थियो । नेपाल भने पहिलो खेलमा जापानसँग १० गोल अन्तरले पराजित भएको थियो । यू२३ टोलीबीचको प्रतिस्पर्धामा नेपालले बलियो प्रतिद्वन्द्वी जापानसँग बहादुरीपूर्वक खेलेपछि अखिल नेपाल फुटबल संघ (एन्फा)ले खेलाडीलाई जनही एक सय अमेरिकी डलर पुरस्कार दिने घोषणा गरेको थियो । एन्फाले नेपाली टोलीले भियतनामलाई हराए जनही एक सय ५० र पाकिस्तानलाई हराएमा एक सय अमेरिकी डलर पुरस्कार दिने घोषणा गरेको थियो । एसियन गेम्सअन्तर्गत पुरुष फुटबलको समूह डि मा नेपालसहित जापान, भियतनाम र पाकिस्तानसँग रहेका छन् । नेपालले समूह चरणको अन्तिम खेलमा पाकिस्तानसँग अगष्ट १९ मा खेल्नेछ । एसियाड फुटबलमा सहभागी टोलीलाई ६ समूहमा विभाजन गरिएको छ । समूहका शीर्ष दुई टोली र चार उत्कृष्ट तेस्रो टोली अघिल्लो चरणमा पुग्नेछन् । नेपाली टोली तीन महिना लामो घरेलु तयारी गरेर थाइल्यान्ड हुँदै एसियाडमा सहभागी हुन इन्डोनेसिया पुगेको हो । नेपालले थाइल्यान्डमा दुईवटा मैत्रीपूर्ण अभ्यास खेल खेलेको थियो । नेपाल दुईवटै अभ्यास खेलमा पनि पराजित भएको थियो । तीनजना सिनियर खेलाडी राख्न पाउने प्रावधानअनुसार नेपालले कप्तान एवं गोलरक्षक किरण चेम्जोङ, मिडफिल्डर रोहित चन्द र विशाल राईलाई टोलीमा राखेको छ ।"
पिसाङलाई उपाधि,"बेसीसहर : हिमाल पारिको जिल्ला मनाङमा तीर हान्ने प्रतियोगिताको उपाधि पिसाङ युवा क्लबले जितेको छ । मनाङवासीको संस्कृतिसँग जोडिएको तीर हान्ने पर्वलाई जगेर्ना गर्न प्रतियोगिता आयोजना गरिएको हो । ङिस्याङ गाउँपालिका१ मा रहेको पिसाङ युवा क्लबको आयोजनामा प्रतियोगिता गरिएको हो । आफ्नो संस्कार र संस्कृतिसँग जोडिएका पर्वलाई जगेर्ना गर्न प्रतियोगिता आयोजना गरिएको क्लबका अध्यक्ष राजु गुरुङले जानकारी दिए । दुई दिनसम्म भएको प्रतियोगितामा आयोजक पिसाङ युवा क्लबको समूहले नै उपाधि हात पायो । प्रतिसमूह तीन खेलाडी रहेको प्रतियोगिताका विजेताले एक सय दुई अंक जोडेका थिए । उपाधिसँगै विजेता समूहले नगद २० हजार प्राप्त गयो । प्रतियोगितामा माथिल्लो मनाङको समूह दोस्रो र माथिल्लो मनाङकै अर्को समूह तेस्रो भएको छ । उपविजेताले नगद १५ हजार तथा तेस्रो हुने समूहले नगद पाँच हजार पुरस्कार प्राप्त गरे । प्रतियोगितामा आयोजक पिसाङ युवा क्लबका धावा टासी लामा उत्कृष्ट खेलाडी घोषित भए । सोही क्लबका लाक्पा गुरुङ सर्वाधिक स्कोरकर्ता बने । उनीहरूले जनही पाँच हजार पुरस्कार हात पारे । प्रतियोगिताका विजेतालाई गाउँपालिका अध्यक्ष कान्छा घले, वडाध्यक्ष भुजु गुरुङ र समाजसेवी याङडुङ गुरुङले पुरस्कार प्रदान गरेका थिए । मनाङमा मनाइने चाड पर्वमध्ये तीर हान्ने पर्व एक मुख्य पर्व हो । विशेषगरी यो पर्व चैतमा मनाउने चलन भए पनि यसलाई बचाउन र यस खेलमा युवाहरूलाई आकर्षित गर्न अन्य समयमा पनि प्रतियोगिता आयोजना गर्ने गरिन्छ ।"
