शीर्षक,विवरण
"ईपीएल क्रिकेट : पोखराविरुद्ध भैरहवाको कीर्तिमानी जित, रवि इन्दरको सतक",काठमाडौँ : भैरहवा ग्लाडियटर्सले विशाल लक्ष्य भेट्टाउँदै एभरेस्ट प्रिमियम लिग (ईपीएल) मा पोखराविरुद्ध कीर्तिमानी जित दर्ता गरेको छ। आइतबार त्रिवि कीर्तिपुरमा पोखराले दिएको २ सय १६ रनको फराकिलो लक्ष्य ६ विकेट गुमाउँदै भेट्टाएको हो। भैरहवाको जितमा भारतीय खेलाडी रवि इन्दर सिंह नायक सावित भए। उनले ६० बल खेल्दै १ सय २५ रन बनाए। उनले १० छक्का र ८ चौका हिर्काए। यसअघि टस जितेर ब्याटिङ गरेको पोखराले निर्धारित २० ओभरमा ५ विकेट गुमाउँदै २ सय १५ रन बनायो। यो टिट्वेन्टी फम्र्याटमा फराकिलो स्कोर हो। पोखराका लागि रिचार्ड लेभीले ७९ रन तथा कप्तान किल कोएट्जरले ४७ रन जोडे।
रोहित चन्द इन्डोनेसियन लिगका सर्वोत्कृष्ट खेलाडी,काठमाडौं : नेपाली राष्ट्रिय फुटबल टोलीका मिडफिल्डर रोहित चन्द इन्डोनेसिया लिगको सर्वोत्कृष्ट खेलाडी भएका छन् । उनी आवद्ध टोली पर्सिजा जकार्ताले आइतबार लिग वनको उपाधि जितेसँगै रोहित लिगको सर्वोत्कृष्ट खेलाडी घोषित भएका हुन् । लिग अन्तिम चरणमा पुग्दै गर्दा गत साता रोहित इन्डोनेसिया लिगको उत्कृष्ट खेलाडीको अन्तिम सूचीमा परेका थिए । लिगको प्राविधिक अध्ययन समितिको मनोनयन सूचीमा पर्सिजा जाकार्ताका मिडफिल्डर रोहितसँगै अरू दुई खेलाडी परेका थिए । रोहितले मिडफिल्डमा उत्कृष्ट प्रदर्शन गरेपछि पर्सिजाले यो सिजनको लिग उपाधि पनि उचाल्यो । अन्तिम तथा जित्नै पर्ने खेलमा मिट्रा कुकारलाई २१ ले हराउँदै पर्सिजाले लिग उपाधि हात पारेको हो । पर्सिजालार्इ उपाधि दिलाउने क्रममा लिगका ३१ खेलमा मैदान उत्रेका रोहितले तीन गोल गरेका थिए । अन्य दुर्इ गोलका लागि उनले अवसर दिलाएका थिए । मिडफिल्डरको भूमिकामा खरो उत्रिएका रोहितले अग्रपंक्तिलाई पास उपलब्ध गराएर प्ले मेकरको काम गरे । उनले विपक्षीबाट बल खोस्ने मुख्य जिम्मेवारी पनि गरेका थिए । सर्वोत्कृष्ट बनेका रोहितसँगै मनोनयनमा पर्सबायाका ब्राजिलियन स्ट्राइकर डेभिड डे सिल्भा र पीएसएम मकासरका डच मिडफिल्डर भिलेम जान प्लाम थिए । समितिले लिगका क्रममा निरन्तर राम्रो प्रदर्शन गर्ने खेलाडीलाई मनोनयनमा राखिएको जनाएको थियो । समितिको नजरमा सबै कोणबाट रोहित अब्बल सावित हुँदै सर्वोत्कृष्ट खेलाडी बनेका हुन् ।
ईपीएलमा रवि इन्दर सिंहले बनाए पहिलो सतक,काठमाडौँ : शनिबारदेखि जारी एभरेस्ट प्रिमियम लिग (ईपीएल) मा भारतीय खेलाडी रवि इन्दर सिंहले पहिलो सतक बनाएका छन् । उनले भैरहवा ग्लाडियटर्सका लागि ४७ बलमा एक सय रन बनाएका हुन्। त्रिवि कीर्तिपुर मैदानमा जारी ईपीएलको दोस्रो सिजन अन्तर्गत तेस्रो खेलमा पोखरा राइनोजले दिएको दुई सय १६ रनको लक्ष्य भैरहवाले पछ्याइरहेको छ । यसअघि पोखराका रिचार्ड लेभीले ३६ बलमा ७९ रनको मद्दतमा ठूलो स्कोर बनाएका थिए । ताजा अवस्थामा भैरहवाले १८ ओभरमा ६ विकेट गुमाउँदै १ सय ९९ रन बनाएको छ । क्रिजमा सिंह र पुनित मेह्रा छन् ।
जाउलाखेललाई हराउँदै थ्रिस्टार लिगको दोस्रो स्थानमा,"काठमाडौं : थ्रीस्टार क्लबले जाउलाखेल युथ क्लबलाई पराजित गर्दै शहीद स्मारक ए डिभिजन लिग फुटबल प्रतियोगिताको दोस्रो स्थानमा उक्लेको छ। सातदोबाटोस्थित एन्फा कम्लेक्सको मैदानमा आज भएको दोस्रो खेलमा थ्रिस्टारले जाउलाखेल माथि २० को जित निकाल्दै अङ्क तालिकाको दोस्रो स्थानमा उक्लेको हो। थ्रिस्टारको जितमा रञ्जीत धिमाल नायक बने। उनले खेलको दोस्रो हाफमा दुई गोल गरे। खेलको ५२ मिनेटमा पाएको पेनाल्टीलाई सदुपयोग गर्दै थ्रिस्टारलाई पहिलो अग्रता दिलाए। थ्रिस्टारका सुनिबल बलले डिबक्स एरियाभित्र प्रहार गरेको बललाई जाउलाखेलका खेलाडी कुलदीप कार्कीले ह्यान्ड गरेपछि थ्रिस्टारले पेनाल्टी पाएको थियो। खेलको ६९औँ मिनेटमा थ्रिस्टारका खेलाडी रञ्जन विष्टले एक्लै बल अगाडि लगिरहेको अवस्थामा जाउलाखेलका कुलदीप कार्कीले फाउल गरेपछि थ्रिस्टारले फ्रिकिक पाएको थियो, सोही फ्रिकिकलाई सदुपयोग गर्दै रञ्जीतले थ्रिस्टारका लागि विजयी गोल गरे। यता फाउल गरेका कुलदीपले रातो कार्ड खाएपछि जाउलाखेल १० खेलाडीमा सीमित बनेको थियो। थ्रिस्टारले सात खेलमा छ जित र एक हारसँगै १८ अङ्क जोडेको छ। यता पराजित जाउलाखेल चार अङ्कका साथ अङ्क तालिकाको १२औँ स्थानमा छ। जारी लिगमा मनाङ मस्र्याङ्दी क्लब पहिलो तथा सङ्कटा क्बल तेस्रो स्थानमा छ। खेलमा म्यान अफ द म्याच थ्रिस्टारका रञ्जीत धिमाल घोषित भए। रासस"
थाइल्यान्डका खेलाडीको वर्चस्व,"काठमाडौं : योनेक्स सनराइज नेपाल इन्टरनेसनल सेरिज २०१८ ब्याडमिन्टन प्रतियोगितामा थाइल्यान्डका खेलाडीले वर्चस्व कायम गरेका छन्। शनिबार सम्पन्न खेलमा थाइल्यान्डले मिक्स डबल्स, महिला एकल र मेन्स डबल्स स्पर्धाको उपाधि हात पायो। मिक्स डबल्स स्पर्धामा थाइल्यान्डका सुपाक जोमखो र सुपिसारा पेवसामपरानको जोडीले उपाधि जिते। उनीहरूले आफ्नै देशका पानाचाई वरासाकतायनान र पिचायानिन उन्काको जोडीलाई १९२१, २११५, २११४ ले पराजित गरे। यस स्पर्धामा सिंगापुरका डानी बावा क्रिसनन्ता र तान वेई हान र भारतका राजु मोहमद रेहान र जे अनिश कोवसारको जोडीले तेस्रो स्थान हात पारे। यसैगरी महिला एकलमा थाइल्यान्डकी चाननचिदा जुचारोएनले उपाधि जितिन्। निकै प्रतिस्पर्धात्मक फाइनलमा उनले म्यानमारकी थित हतार थुजारलाई २११८, १०२१, २११७ ले स्तब्ध पारिन्। यस स्पर्धामा इरानकी सोरया आघाइहाजिआघा र भारतकी राशि त्यागीले कांस्य पदक जिते। पुरुष एकलमा पनि थाइल्यान्डकै खेलाडीले उपाधि जिते। निकै प्रतिस्पर्धात्मक फाइनलमा थाइल्यान्डका कुनलाभुत भितिदसर्नले मलेसियाका तेक झी सुलाई पराजित गरे। फाइनलमा भितिदसर्नले सुलाई २०२२, २२२०, २१९ ले स्तब्ध बनाए। भारतका दिनुका करुनारथ र कौशल धर्मामरले तेस्रो स्थानमा चित्त बुझाए। यसैगरी महिला डबल्सको उपाधि भने भारतकी अपर्ना बलान र श्रुतिका केपीको जोडीले जित्न सफल भए। उनीहरूले श्रीलंकाकी थिलिनी प्रमोदिका र काभिदी सिरिमानागेको जोडीलाई २११६, २११३ को सोझो सेटमा पाखा लगाउँदै उपाधि हात पारे। मेन्स डबल्सतर्फको उपाधि भिडन्तमा भने थाइल्यान्डका सुपाक जोमकोह र वाचिरावित सोतहोनको जोडीले बाजी मारे। उनीहरूले आफ्नै देशका वरित सारापत र पानाचाईको जोडीलाई २१११, २११५ को सोझो सेटमा पराजित गरे। भारतका हेमन्त गोवडा र मधुसूदन मादप्पा तथा भी रंगनाथा र आसिथ सूर्याको जोडी तेस्रो भयो।"
"मेसीको दुई गोल, बार्सिलोनाको एकपक्षीय जित",एजेन्सी : स्पेनिस ला लिगा अन्तर्गत शनिबारको खेलमा लिग लिडर बार्सिलोनाले फराकिलो अन्तरकोे जित निकालेको छ । मेसीको कप्तानीमा रहेको बार्सिलोनाले स्पानियोलमाथि ४० को एक पक्षीय जित हात पार्न सफल भएको हो । स्पानियोलको घरेलु मैदानमा भएको खेलमा बार्सिलोनाको सान्दार जितका लागि कप्तान मेसीले २ गोल गरे भने स्वारेज र ओसमान डेम्बेलेले एकएक गोल गरे । १७ औं मिनेटमा मेसीको गोलमार्फत खेलमा अग्रता बनाएको बार्सिलोनाका लागि २६ औं मिनेटमा डेम्बेलेले गोल गरी अग्रता दोब्बर बनाए । ४५ औं मिनेटमा स्वारेजले गोल गर्दा पहिलो हाफअघि नै बार्सिलोना ३० ले अघि रह्यो । मेसीले ६५ औं मिनेटमा दोस्रो गोल गरी बार्सिलोना ४० को जित पक्का गरे । यो जितसँगै १५ खेलबाट ३१ अंक जोड शीर्ष स्थानमा कायम रहेको बार्सिलोनाका लागि शनिबारको ला लिगामा अर्काे फाइदा प्राप्त भयो । यस सिजनमा बार्सिलोनालाई टक्कर दिइरहेको सेभिल्ला शनिबारको खेलमा भ्यालेन्सियासँग ११ को बराबरीमा रोकिँदा बार्सिलोनालाई अंकदूरी बढाउने अवसर मिल्यो । दोस्रो स्थानमा रहेको सेभिल्लाको १५ खेलबाट २८ अंक छ । शनिबार नै भएको खेलमा आलाभेजमाथि ३० को जित निकालेको अर्काे प्रतिस्पर्धी टोली एथ्लेटिको मड्रिडले पनि १५ खेलबाट २८ अंक बनाइ अन्तरमा पछि परी तेस्रो स्थानमा छ ।
मनाङलाई पछ्याउँदै संकटा,"काठमाडौं : संकटा क्लब पल्सर सहिद स्मारक ए डिभिजन लिगको दोस्रो स्थानमा उक्लिएको छ। हल्चोकस्थित एपीएफ क्लबको मैदानमा शनिबार भएको खेलमा संकटाले एनआरटीलाई १० गोलले हरायो। जितसँगै संकटाले शीर्ष स्थानमा रहेको मनाङ मस्र्याङ्दी क्लबसँगै बराबरी १८ अंक बनाएको छ। संकटाको कठिन जितमा अफ्रिकी खेलाडी म्यासवेलले दोस्रो हाफको इन्जुरी समयमा निर्णायक गोल गरेका थिए। पहिलो हाफमा केही आकर्षक अवसर गुमाएको संकटालाई दोस्रो हाफमा पनि एनआरटीले टक्कर दिएको थियो। २०औं मिनेटमा संकटाका सुवास गुरुङको सशक्त प्रहार पोस्टमा लागेर बाहिरिएको थियो। संकटालाई खेलभर दबाब दिएको एनआरटीको गोल फर्काउने प्रयास सफल बन्न सकेन। एनआरटीका गोलरक्षक अजित प्रजापति म्यान अफ दी म्याच घोषित भए। उनले १० हजार रुपैयाँ पुरस्कार पाए। जितसँगै संकटाले सात खेलबाट १८ अंक बनाएको छ। संकटा र शीर्ष स्थानमा रहेको मनाङले समान १८ अंक बनाएका छन्। अपराजित मनाङले एक खेल कम खेलेको छ। सात खेलबाट एक अंक बनाएको एनआरटी तालिकाको अन्तिममा छ। बराबरीमा रोकियो पुलिस यसैगरी हल्चोक मैदानमै भएको अर्को खेलमा विभागीय टोली नेपाल पुलिस क्लब र हिमालयन शेर्पा क्लबले ११ गोलको बराबरी खेल्दै अंक बाँडेका छन्। पुलिसले सुरुआतमा लिएको अग्रता जोगाउन नसक्दा हार बराबरीमा चित्त बुझाएको थियो। पुलिसका लागि ३१औं मिनेटमा भरत शाहले गोल गरेका थिए। उनले तेज तामाङको पासमा वान टच जाली चुमाएका थिए। लगत्तै उनै भरत शाह पोस्ट नजिक वान भर्सेस वानको अवस्थामा चुकेका थिए। भरतले खाली पोस्टमा हानेको सटिक प्रहार पोस्ट बाहिर परेको थियो। पहिलो हाफमा पुलिसको दबाब खेपेको शेर्पा दोस्रो हाफमा खेलमा फर्किएको थियो। शेर्पाका लागि विश्वास श्रेष्ठले ७०औं मिनेटमा बराबरी गोल गरे। म्यान अफ दी म्याच घोषित विश्वासले १० हजार रुपैयाँ पुरस्कार पाए। बराबरीसँगै पुलिस र शेर्पाले सात खेलबाट समान ११११ अंक बनाएका छन्। समान अंक भए पनि गोलअन्तरका आधारमा पुलिस पाँचौं र शेर्पा छैटौं स्थानमा छ। खेलपछि पुलिसका प्रशिक्षक अनन्त थापाले भरत शाहले खाली पोस्टमा गोल गर्न नसक्दा दबाब भएको बताए। टोलीमा अनुभवी खेलाडीको कमी छ। पाएको मौकामा गोल गर्न नसक्दा गाह्रो भयो। आगामी खेलमा सुधार गर्दै जानेछौं, अनन्तले भने। हिमालयन शेर्पाका प्रशिक्षक सुवास लिम्बूले जित्ने हिसाबले खेले पनि बराबरीमा चित्त बुझाउनु परेको बताए। हामीले पनि मौका राम्रो पाएको थियौं। दोस्रो हाफमा गोल पनि भयो। तर रेफ्रीले हामीले पाएको पेनाल्टी दिएनन्। रेफ्रीको गल्तीका कारण क्लबको लगानी डुब्ने खतरा देखिन्छ, सुवासले भने।"
