शीर्षक,विवरण
किन हुन्छ महिला हिंसा ?,"महिला हिंसाविरुद्धको सोह्रदिने अभियान आज सम्पन्न हुँदैछ। तर सधैंजस्तै यसपाील पनि यो अभियान सहरकेन्द्रित नै भयो जबकि महिला हिंसा भने गाउँगाउँमा व्याप्त छ। महिलाहरू कतै दाइजो र तीलक प्रथाका कारण जिउँदै जल्नुपरेको छ। कतै बोक्सीको आरोपमा शारीरिक र मानसिक यातना भोग्नुपरेको छ। कतै छाउपडीजस्तो कुप्रथा कायमै छ भने कतै एकल महिला उपेक्षित छन्। महिला सशक्तीकरणका लागि अनेकन् आन्दोलन हुँदा पनि महिलाको अवस्थामा खासै सुधार भने भएको छैन। यस्तो विभेद केवल सामाजिक व्यवहारमा मात्र कायम छैन। राजनीतिक संरचनामा पनि महिला विभेदमै छन्। दुईतिहाइ बहुमत ल्याएको सत्ताधारी पार्टीमा पनि महिला उपस्थित अल्पसंख्यामा छ तर यो आजको समस्या होइन। संविधानसभा जारी हुँदा नै पटकपटक समझदारी निर्माण गर्ने नाममा दलका शीर्ष नेताहरूको बैठक बस्ने गथ्र्यो। तर त्यस्तो बैठकमा कहिल्यै पनि महिलानेत्रीको उपस्थिति देखिएन। महिला उपस्थितिलाई संविधानसभामा थपडी बजाउनेमा मात्र सीमित राखिएको थियो। के कुनै पनि दलको शीर्ष तहमा महिला थिएनन् ? हाम्रो समाज पितृसत्तात्मक चिन्तनले ग्रसित भएकै कारण आम महिलाले समानता अनुभूत गर्न सकिरहेका छैनन्। पितृसत्तात्मक चिन्तनले पुरुष मात्र ग्रसित हुने भन्ने मानसिकता पनि देखिन्छ तर त्यो गलत मानसिकता हो। पितृसत्तात्मक चिन्तनले महिला पनि ग्रसित भएका हुन्छन्। त्यसैकारण कतिपय अवस्थामा महिलामाथि महिलाले नै हिंसा गरिरहेको पनि पाइन्छ। हिजो सासूले बुहारीलाई हिंसा गर्थे भने अहिले बुहारीले सासूलाई वृद्धा श्रम पठाउने प्रवृत्ति पनि बढ्न थालेको छ। आफ्नो पद सुनिश्चित गर्नकै लागि राजनीतिक क्षेत्रमा महिलाले महिलालाई हिंसा गरेको पनि पाइन्छ। आफूबाहेक अरूको अस्तित्व नदेख्ने महिला नेताका कारण पार्टीमा योगदान गरेका सक्षम महिला ओझेलमा पारिएका छन्। यो पनि एक प्रकारको हिंसा हो। महिलाहरू हिंसामा पर्नुको अर्को एउटा कारण गलत तरिकाको हुर्काइ हो। महिलालाई सानैदेखि सहनशीला सुशीला हुनुपर्ने शिक्षा दिइन्छ। शोषण र हिंसाको विरोध गर्नुपर्छ भन्ने शिक्षा दिइएको हुँदैन। त्यस्तै हाम्रा संस्कृति र परम्परा पनि महिला हिंसा कायम रहनुमा जिम्मेवार छ। विभिन्न संस्कृति र परम्पराका नाममा अझै पनि शोषण व्याप्त छ। पुरुषलाई महिलाभन्दा सक्षम मान्ने चिन्तनले पारिवारिक र सामाजिक संरचनामा मात्र होइन, राजनाीतिक संरचनामा पनि उत्तिकै प्रभाव पारेको छ। आधा आकाश ओगटेका महिलालाई हरेक दलभित्र ३३ प्रतिशत सहभागी गराइने भनिए पनि पूरा हुन सकेको छैन। पार्टीको तल्लो तहमै ३३ प्रतिशत महिला सहभागिता छैन भने जिल्ला कमिटी, अञ्चल कमिटी र केन्द्रमा खोजेर कहा पाइन्छ ? त्यसैले तल्लो तहबाटै महिला सहभागिता बढाउन आवश्यक छ। अहिले पनि पार्टी कमिटीमा महिलालाई मुख्य जिम्मेवारी दिन कन्जुस्याइँ गरिन्छ। पितृसत्तात्मक चिन्तनको जरो उखेलेर फाल्न नसक्दासम्म हामी अभियान र कार्यक्रममा सीमित हुनेछौं। हामीकहाँ पितृसत्तात्मक चिन्तनको जरो उखेल्ने क्रममा पुरुषहरूको खुबै सत्तोसराप र विरोध गर्ने चलन चलिआएको छ।"
