शीर्षक,विवरण
सहमतीय सरकार,"संविधान जारी भएको झन्डै १० महिना पुग्न लागेको छ । केपी ओलीको सरकार त्योभन्दा केही दिन मात्र कान्छो छ । ०६३ को आन्दोलन र त्यसले प्रतिबद्धता व्यक्त गरेको राजनीतिक स्थायित्वको नाराको मर्मविपरीत यो आठौँ सरकार हो, नौ वर्षमा । केपी ओलीको सरकारको निरन्तरता त्यति सहज देखिँदैन, यता आएर । गठबन्धन सरकारको दोस्रो ठूलो समूह माओवादीले बजेट पारित भएपछि अर्थात् असार २५ पछि यो सरकारको निरन्तरता नहुने या आफ्नो पार्टीको समर्थन जारी नरहने बताएका छन् । माओवादी नेता पुष्पकमल दाहालको विश्वसनीयता अरू नेताहरूजस्तै या केही बढी नै गुमेको उदाहरण या प्रमाण प्रशस्त छन्, त्यसैले ओली सरकारबाट समर्थन फिर्ता लिने अभिव्यक्तिलाई तत्काल उनको दलको अठोट या निर्णयको रूपमा लिइनु हुँदैन । तर कुनै प्रयोजन या अन्य उपलब्धिको लागि आफैँ सामेल गठबन्धन सरकारलाई धम्काइराखेका छन् त्यो केही समयपछि मात्र स्पष्ट हुनेछ, उनको कारबाही बाट । तर पनि यसले सरकारको आधिकारिकता र जनताको त्यसमाथिको विश्वासमा आघात पुयाउनेछ । प्रशासनयन्त्रले यो ढल्न लागेको सरकारलाई किन सहयोग गर्ने भन्ने मनोविज्ञान बनाउनेछ । दाहाल मात्र हैन, एमालेकै वरिष्ठ नेता वामदेव गौतमले पनि अर्को साता बजेट पारित भएलगत्तै सरकार बिदा हुने अभिव्यक्ति दिएका छन् । खासगरी परिवर्तनका नौ वर्षमा मुलुकले परिचालित राजनीति, सत्ता फेरबदल र अस्थायित्व तथा अराजकता भोग्दै आएको छ । राजनीति शुद्धरूपमा सत्ताकेन्द्रित र लेनदेनबाट निर्देशित छ । त्यही क्रममा सरकार बन्ने र भत्किने गरेका छन् । यसपटकको अभ्यास फरक देखिँदैन । दाहालको यसपटकको अभ्यास वैशाख २७ गते केपी ओलीसँग एमाले अध्यक्षको हैसियतमा गरेको नौबुँदे सहमति कार्यान्वयन नभएको झोकबाट निर्देशित देखिन्छ । जुनसुकै सरकार आओस्, हत्या, बलात्कार र यातनाका घटना र तिनका दोषीले उन्मुक्ति पाउन सक्तैनन्, जनयुद्ध या अन्य कुनै नाउँमा । राजनीतिक परिवर्तनलाई संस्थागत गर्न केही कानुनलाई शिथिल बनाउन सकिन्छ, तर व्यक्तिको जीवन, सम्मान र सुरक्षा हक मारेर कुनै दल या व्यक्ति या समूहलाई उन्मुक्ति दिन सकिँदैन । यसर्थ नौबुँदेको कार्यान्वयन सम्भव छैन । तर यो सरकारभित्रै संविधानलाई लिएर फरकफरक मान्यता राख्ने समूहहरू छन् । संवैधानिक राजतन्त्रदेखि हिन्दु राष्ट्र र संघीयताको विरोध गर्ने विभिन्न दलहरूको उपस्थिति मन्त्रिपरिषद्मा छ एकातिर भने अर्कोतिर प्रधानमन्त्रीलाई हैन, आफ्ना दलका मन्त्रीहरूमध्ये कसैलाई नेता मान्ने प्रचलन बनाएर प्रधानमन्त्रीको पद, प्रभावकारिता र हैसियतको अवमूल्यन भएको छ । त्यसैले सिद्धान्त र सरकारको प्रभावकारितासँगै विश्वसनीयता सुनिश्चित गर्नु राजनीतिक दलहरूको दायित्व बन्न जान्छ । तर सरकार परिवर्तन र कुनै हासिलले सत्ता हासिल गर्ने प्रयासले सिद्धान्तहीनता र अनिश्चिततालाई मात्र प्रोत्साहित गर्नेछ । त्यही अभ्यास सम्भवतः दोहोरिँदै छ, अहिले ।"
१५ चिकित्सकको निगरानीमा कांग्रेस महामन्त्री कोइराला,"काठमाडौँः ओम अस्पताल भर्ना भएका कांग्रेस महामन्त्री डा शशाङ्क कोइरालाको स्वास्थ्य अवस्था गम्भीर भएको उपचारमा संलग्न चिकित्सकले बताएका छन् । कोइरालालाई हृदयाघातको आशङ्का गरिए पनि परीक्षणका क्रममा हृदयाघात नभएको तर फोक्सोको निमोनिया रहेको उपचारमा संलग्न चिकित्सक डा लव जोशीले जानकारी दिए । चिकित्सकका अनुसारको अहिले उनको रक्तचापको अवस्था ९०६० रहेको छ । पिसाब बन्ने क्रम प्रतिघन्टा ५० एमएल रहेको छ । रक्तचाप कम भएकाले उनलाई अहिले तीन किसिमका औषधि दिइएको छ भने शरीरको तापक्रम बढाउन नदिने उपाय अपनाइएको डाक्टर जोशीले बताए । डा जोशीले भने, उहाँको स्वास्थ्यलाई स्थिर राख्ने प्रयास गरिएको छ । अवस्था गम्भीर छ । डा कोइरालाको उपचारमा डा अर्जुन कार्की, डा भगवान कोइराला, डा युएन पाठक, डा लवजोशी, डा श्याम महर्जन, डा सुवास आचार्य, डा महेश भट्टराई, डारवीन्द्र श्रेष्ठ, डा रावल पाठक, डा पिके क्षेत्री, डा हरिकिशोर श्रेष्ठ, डा हरिश जोशीलगायतका १५ जनाभन्दा बढी चिकित्सकको टोली सक्रिय रहेको अस्पतालले जनाएको छ । डाकोइरालालाई थप उपचारका लागि एयर एम्बुलेन्सबाट भारतमा लैजाने तयारी भए पनि शरीरको अवस्था स्थिर नरहेका कारण तत्काल सम्भव नभएका कारण लैजान नसकिएको पनि अस्पतालले जनाएको छ । महामन्त्री डा कोइरालाको स्वास्थ्य अवस्था जानकारी लिन अस्पतालमा प्रधानमन्त्री केपी शर्मा ओली, पार्टी सभापति शेरबहादुर देउवा, वरिष्ठ नेता रामचन्द्र पौडेललगायत पार्टीका शीर्ष नेता पुगेका छन् । प्रधानमन्त्री ओलीले कोइरालाको उपचारमा कुनै कमी हुन नदिन चिकित्सक एवम् अस्पताल प्रशासनलाई निर्देशन दिएका छन् ।रासस"
मानव तस्करीमा तानिएका संसदमाथि माओवादीले छानबिन गर्ने,"काठमाडौँ: माओवादी केन्द्रले मानव तस्करीमा तानिएका सांसदमाथि छानबिन गर्न तीन सदस्यीय समिति गठन गरेको छ। बुधबार बसेको माओवादी पोलिटब्यूरो बैठकले तीन सदस्य छानबिन समिति गठन गरेको हो। अमिक शेरचन संयोजक रहेको समितिमा कृष्णबहादुर महरा र पम्फा भुसाल सदस्य रहेको समिति गठन गरेको हो। माओवादी सांसदहरु गोमा कुँवर, डोरप्रसाद उपाध्याय, राममाया बोगटी, सन्तकुमार थारु, रुपा महर्जन, दिलमाया धामी, धना पहरी र सिर्जना खत्रीमाथि मानव तस्करीको आरोपमा प्रहरीले अनुसन्धान गरिरहेका बेला पार्टीले समेत छानबिन गर्ने भएको हो। बुधबारको पोलिटब्यूरो बैठकमा माओवादी केन्द्रका प्रमुख सचेतक हितराज पाण्डेले विवादमा तानिएका सांसदबारे जानकारी गराएपछि बैठकले समिति गठन गरेको हो। स्पेनका लागि भिसा आवेदन गर्दा सांसदहरुले परराष्ट्र मन्त्रालयको कन्सुलर सेवा विभागको सिफारिस पत्र किर्ते गरेको आरोप लागेको छ।"
सरकार फेर्नेबारे माओवादी द्विविधामा,"काठमाडौं: माओवादी केन्द्र एमाले अध्यक्ष केपी ओली नेतृत्वको सरकार टिकाउँदा र गिराउँदा हुनसक्ने जोखिमसहितको द्विविधामा अल्झिएको छ । केन्द्रको मंगलबार पार्टी कार्यालय पेरिसडाँडामा बसेको पोलिटब्युरो बैठकमा सरकारको समीक्षा गर्न एजेन्डा प्रवेश गराइए पनि टिकाउने र गिराउनेबारे नेता द्विविधामा देखिए । सरकारका बारेमा बुधबार बस्ने बैठकमा छलफल गरी निर्णय गर्ने समझदारी पार्टीका नेताहरूले बनाएका छन् । राष्ट्रिय सरकारका बारेमा कांग्रेस र एमालेको रणनीति बुझ्ने, एमालेसँग भएको नौबुँदे लिखित र तीनबुँदे मौखिक सहमति कार्यान्वयनका लागि दबाब दिने र राष्ट्रिय सहमतिको सरकार गठनका लागि आफ्नो पहलकदमी बढाइराख्नेमा केन्द्रित भएर निर्णय गर्ने अधिकार अध्यक्ष दाहाललाई दिएर बैठक सकिने एक नेताले बताए । संविधान कार्यान्वयन, शान्तिप्रक्रियाको पूर्णता र पुनर्निर्माणलाई तीव्रता दिन सरकार छोड्न पनि भएको छैन । अहिलेकै तरिकाले सरकारमा बसिराख्न पनि भएको छैन । यही रूपमा बस्दा हामी झन् कमजोर हुन्छौं । सरकार र मन्त्रीका कार्यशैलीप्रति कोही नेता सन्तुष्ट पनि देखिँदैनन्', पोलिटब्युरो सदस्य नारायण दाहालले बैठकपछि अन्नपूर्णसँग भने, अहिलेका राष्ट्रिय एजेन्डा कार्यान्वयन गर्न राष्ट्रिय सहमतिको सरकार गठन गर्नु उपयुक्त हुन्छ तर त्यसका लागि कांग्रेस र एमालेले गर्ने निर्णयमा निर्भर गर्छ । कांग्रेस, एमाले, केन्द्र, मधेसवादी र राप्रपा नेपाल एक ठाउँमा उभिएको अवस्थामा राष्ट्रिय सरकार बन्ने हो ।' उनका अनुसार सरकारका बारेमा पोलिटब्युरोमा छलफल भए पनि निर्णय गर्ने अधिकार केन्द्रीय कार्यालय वा अध्यक्ष दाहाललाई दिएर टुंग्याइन्छ । अहिलेको सत्ता गठबन्धनमा नेतृत्व परिवर्तन गराउने, कांग्रेससँग मिलेर बहुमतको सरकारमा माओवादी केन्द्र सहभागी हुने सम्भावना बढी देखिएको छ । शान्तिप्रक्रियाका बाँकी काम पूरा गर्न जोसँग सहकार्य गर्दा सहज हुन्छ, त्यहीसँग सहकार्य गर्नुपर्छ । यही सरकारलाई टिकाइराख्न हामी जरुरी पनि ठान्दैनौं', उनले भने । नेता जनार्दन शर्माले सरकारका बारेमा छलफल गर्न एजेन्डा बनाउन माग गरेपछि दाहाल एजेन्डा बनाउन सहमत भएका हुन् । नेता प्रकाश पोखरेलका अनुसार समसामयिक राजनीतिक विषयमा छलफल गर्ने क्रममा सरकारको विषयलाई पनि समेटेर एजेन्डा बनाइएको हो । सात प्रदेश र प्रवासका नेताहरूले रिपोर्टिङ गर्ने क्रममा सरकारमा आफ्नो पार्टीको पनि हिस्सा रहेको अनुभूति हुन नसकेको भन्दै सरकारको आलोचना गरेका छन् । एक नम्बर प्रदेशबाट हिमाल किराँती र सावित्री काफ्ले, दुई नम्बरबाट विश्वनाथ साह, तीन नम्बरबाट नारायण दाहाल, चार नम्बरबाट हरि अधिकारी, पाँच नम्बरबाट चक्रपाणि खनाल र पूर्ण घर्ती, ६ नम्बरबाट कालीबहादुर मल्ल र मायाप्रसाद शर्मा तथा सात नम्बरबाट खगराज भट्टले रिपोर्टिङ गरेका थिए । उनीहरूले पार्टी एकतापछि पनि संगठनात्मक संरचनामा भद्रगोल रहेको, भद्दा सांगठनिक संरचनाले गर्दा एकतापछिको उत्साहमा कमी आएको, पार्टीभित्र अराजकता र अन्योल कायम रहेको रिपोर्टिङ गरेका थिए । नेता वर्षमान पुनले पेस गरेको संगठनात्मक, निर्वाचन कार्यविधि र सरकारका बारेको प्रस्तावमा बुधबार बस्ने बैठकमा छलफल गर्ने समझदारी बनाइएको अर्का नेता डीआर पौडेलले बताए । प्रवक्ता पम्फा भुसालका अनुसार महाधिवेशनको मिति तोक्ने, संठनात्मक संरचना, राजनीतिक परिस्थितिलगायत विषयमा बुधबारको बैठकमा छलफल हुनेछ ।"
