शीर्षक,विवरण
सिंचाइमन्त्री गिरी गृहजिल्ला पुग्दा यस्तो तामझाम!,"घोराहीः अघि अघि जनपद प्रहरी अनि ट्राफिक, त्यसपछि सिचाईं मन्त्री दीपक गिरी चढेको झन्डा फहराएको गाडी। त्यसपछि सशस्त्र प्रहरीको गाडी अनि नेता कार्यकर्ता र सरकारी कार्यालयका गाडीको लस्कर। पहिलो पटक मन्त्री बनेका नेपाली कांग्रेसका केन्द्रीय सदस्य दीपक गिरी मन्त्री भएपछि पहिलोपटक गृहजिल्ला दाङ छिर्दा मंगलबार देखिएको तामझाम यस्तै थियो। उनको स्वागत, सत्कारका लागि नेता कार्यकर्ता, सरकारी कार्यालय तथा सुरक्षा निकायका गरी करिब ३५ वटा जीपहरु उनी चढेको गाडी अघिपछि थिए। त्यसपछि उनका कार्यकर्ता चढेका मोटरसाइकलहरु पनि उत्तिकै थिए। तीमध्ये धरैजसो गाडीहरु उनकै कार्यकर्ता आफैं चढ्नका लागि प्रयोग गरेका निजी सवारी थिए। पश्चिम दाङको श्रीगाउँ गाविसका दीपक गिरी पुष्पकमल दाहाल नेतृत्वको सरकारमा नेपाली कांग्रेसका तर्फबाट सिंचाई मन्त्रालयको जिम्मेवारीमा मन्त्री बनेका हुन्। सथप ग्रहण तथा मन्त्रालयस्तरीय बैठक तथा कार्यक्रमहरु सकेर उनी मंगलबार गृहजिल्ला दाङ आएका हुन्। गाउँमा पुख्र्याैली घर छ तर, उनी आफ्नै निजी निवास तुलसीपुरमा बस्दै आएका छन्। दाङको क्षेत्र नं ५ बाट निर्वाचित भएर सांसद भएका गिरी नेपाली कांग्रेसको राजनीतिक सुरुवातदेखि नै कोइराला परिवारको निकट भएका थिए। विद्यार्थीकालमा सशांक कोइरालासँग निकै नजिकको मित्रता गाँसेका गिरी केही समय कोइराला परिवारसँग सँगै बसेर पढाई सकेका हुन्। त्यही पारिवारिक पृष्ठभूमिबाट राजनीतिमा अघि बढेका गिरी नेपाल विद्यार्थी संघको महामन्त्रीसमेत भएका थिए। कांग्रेसभित्र उनी गनिएका युवा नेताहरुमध्यका मानिन्छन्। राजनीतिक जीवनमा उनी पहिलोपटक मन्त्री भएका छन्। त्यसपछि पहिलोपटक उनी मंगलबार गृहजिल्ला दाङ आए। उनलाई विभिन्न संघसंस्थाहरु सरकारी कार्यालयहरुलगायतले स्वागत र सम्मान गरेका थिए। जिल्लास्थित सरकारी कार्यालयका प्रमुखहरुलाई उनले करिब आधाघण्टा निर्देशन दिए। त्यसक्रममा उनले जनतालाई सहज तरिकाले सेवा उपलब्ध गराउन तथा सरकारको नीति कार्यक्रमलाई पूर्ण रुपमा लागु गर्नका कर्मचारी बर्गको भूमिका हुने भन्दै सरकारी सेवाबाट कुनै पनि आम नागरिकको गुनासो आउन नहुनेगरी सेवा प्रवाह गर्न निर्देशन दिए। दाङको घोराहीमा नेपाल पत्रकार महासंघले गरेको स्वागत तथा सम्मान कार्यक्रममा उनले दाङ जिल्लामा एकीकृत सिंचाई परियोजना ल्याउने आश्वासन दिए। त्यस्तै उनले कांग्रेसको प्रतिनिधित्व गर्दै सरकारमा गएपनि आफूले कुनै पनि आस्थाका आधारमा काम नगर्ने बताए। म नेपाली कांग्रेसको सदस्य हुँ तर, मन्त्रालयका काममा मैले कुनै राजनीतिक आस्था देखाउने छैन, किनकि म जनताको प्रतिनिधि हुँ उनले भने सकेसम्म मेरो कार्यकालमा सिंचाई क्षेत्रमा नयाँ क्रान्ति ल्याएरै छोड्नेछु। मंगलबार दाङ आएका गिरी दाङ प्रवेश गर्नासाथ पूरै व्यस्त भएका छन्। भैरहवा विमानस्थलमा ओर्लिएर मन्त्री गिरी सरकारी गाडी चढेर दाङ आएका थिए। बुधबार नै निरीक्षण तथा स्वागत सम्मानलगायत करिब एक दर्जन कार्यक्रममा सहभागी भइसकेका बुधबार पनि करिब एक दर्जन त्यस्तै कार्यक्रमहरुमा सहभागी भएर बिहीबारको मन्त्रिपरिषद बैठक भ्याउन राजधानी फर्किनेछन्। दाङ जिल्लाबाट अहिलेसम्म मन्त्री भएकामध्ये गिरी चौधौ मन्त्री हुन्।"
तरुण दल काठमाडौंको अध्यक्षमा खड्का र सचिवमा शाह निर्वाचित,"काठमाडौंः तरुण दल काठमाडौंको अध्यक्षमा कृष्णजी खड्का निर्वाचित भएका छन्। चौथौं महाधिवेशनबाट खड्का नेतृत्वको प्यानलनै निर्वाचित भएको छ। खड्काले अध्यक्षका अर्का प्रत्याशी रमेश महर्जनलाई भारी मत अन्तरले पराजित गरे। अध्यक्षमा निर्वाचित खड्काले ४१० मत ल्याउँदा उनका प्रत्याशी महर्जनले जम्मा ७१ भोटमात्रै प्राप्त गरे। यस्तै उपाध्यक्षमा खड्का प्यानलकै राजदत्त महर्जन र सचिवमा दिनेश विक्रम शाह निर्वाचित भएका छन्। कोषाध्यक्षमा अमृत मानन्धर निर्वाचित भएका छन्। सचिवमा विजयी शाहले ३८८ मत प्राप्त गरे भने प्रत्याशी रुकेश श्रेष्ठले १४६ मत पाए। कोषाध्यक्षमा निर्वाचित मानन्धरले ४०० मत पाउँदा प्रतिद्वन्द्वी शंकर तिमिल्सिनाले ११८ मत प्राप्त गरे। महाधिवेशनले कांग्रेस नेता प्रकाशमान सिंहका पुत्र प्रभासमान सिंहलाई निर्विरोध केन्द्रीय प्रतिनिधिमा चयन गरेको थियो। यस्तै प्रतिनिधि प्रभासमान सिंह निर्विरोध केन्द्रीय रमिला महत गड्तौला, शारदा श्रेष्ठ, मनदेवी श्रेष्ठ, उमेश गुरुङ र भूमिका श्रेष्ठ पनि महाधिवेशन प्रतिनिधि चयन भएका छन्। ४० सदस्यीय कार्यसमितिमा निर्वाचित पदाधिकारीसहित प्रत्येक निर्वाचन क्षेत्रबाट एकएक जना सदस्य निर्वाचित यसअघि नै भइसकेका छन्। अध्यक्षले २६ जना सदस्य मनोनित गर्न पाउने प्रावधान छ।"
"भारतले प्रस्ताव गरेकै मितिमा प्रचण्ड दिल्ली जाने, मन्त्रिपरिषद्ले निर्णय नै गर्नुपरेन","काठमाडौँ: भारतले प्रस्ताव गरेकै मितिमा प्रधानमन्त्री पुष्पकमल दाहाल प्रचण्ड नयाँदिल्ली जाने भएका छन् । भदौ ३० गते दिल्ली जाने गरी भ्रमणको तयारी भइरहेको छ। प्रधानमन्त्रीको विदेश भ्रमणका बारेमा मन्त्रिपरिषद्ले निर्णय गर्ने चलन भए पनि अहिलेसम्म औपचारिक निर्णय भएको छैन। मन्त्रिपरिषद्को निर्णय नहुँदै प्रधानमन्त्री दाहालले संसद्को विकास समितिको बैठकमा आफूले भदौ ३० गते भारत भ्रमण गर्न लागेको घोषणा गरिसकेका छन्। प्रधानमन्त्री दाहालका विशेषदूतका रूपमा नयाँदिल्ली गएका उपप्रधान तथा गृहमन्त्री विमलेन्द्र निधिसमक्ष भारतीय अधिकारीहरूले भदौ ३० गते भ्रमणको मिति प्रस्ताव गरेका थिए। भदौं ३१ गते भारतीय प्रधानमन्त्री नरेन्द्र मोदीसँग विशेष भेटवार्ता र सहयोगसम्बन्धी दुईपक्षीय सम्झौतामा हस्ताक्षर गर्ने गरी तयारी भइरहेको छ। माओवादी केन्द्रभित्रैबाट पनि भारतले प्रस्ताव गरेको मितिमा नयाँदिल्ली जान नहुने भन्दै दाहाललाई दबाब दिइएको छ। मन्त्रिपरिषद्बाट निर्णय नगरी भारतले प्रस्ताव गरेकै मितिमा दिल्ली जान लागेको भन्दै संसद्मा पनि आलोचना भएको छ। संसदीय समितिमा सोमबार प्रधानमन्त्री दाहालले भने, म आउने भदौ ३० गते भारतको भ्रमणमा जाने क्रममा छु र हुलाकी मार्गसहित भारतसँग सम्बन्धित विकास निर्माणका कामहरूका बारेमा प्राथमिकताका साथ राख्नेछु ।' एमाले अध्यक्ष केपी शर्मा ओली नेतृत्वको सरकारमाथि अविश्वासको प्रस्ताव पेस गरेर माओवादी केन्द्रका अध्यक्ष प्रचण्डको नेतृत्वमा बनेको सरकार बन्नसाथ भारतीय प्रधानमन्त्री मोदीले प्रचण्डले छिटो दिल्ली आउन निम्तो दिएका थिए। भारत जानुअघि मधेसलाई सम्बोधन गर्न संविधान संशोधनको प्रस्ताव संसद्मा दर्ता गर्ने र स्थानीय चुनावका लागि कानुनी तथा राजनीतिक वातावरण तयार गर्ने कसरतमा यतिबेला प्रधानमन्त्री दाहाल जुटेका छन् । उनले खासगरी एमालेसँगको अनौपचारिक सम्वादलई तीव्र बनाएका छन्।"
'नेपालबाटै विश्व शान्तिको सन्देश फैलाउन सकिन्छ',"काठमाडौँः प्रधानमन्त्री पुष्पकमल दाहालले नेपालबाटै विश्व शान्तीको सन्देश फैलाउन सकिने विश्वास व्यक्त गरेका छन्। प्रधानमन्त्री निवास बालुवाटारमा चीन बौद्धधर्मावलम्बी सङ्घको प्रतिनिधिमण्डलसँगको भेटमा प्रधानमन्त्री दाहालले विश्वका बौद्ध धर्मावलम्बीलाई मात्रै नेपाल आउने वातावरण सिर्जना गर्न सके देशले ठूलो लाभ लिन सकिने बताएका हुन्। 'यसले नेपालाई पनि चिनाउँछ, आर्थिक समृद्धिको मार्ग प्रशस्त गराउँछ।' दाहालले भने। प्रधानमन्त्री दाहालले नेपालमा बौद्ध समुदायको आवागमनका लागि जोड दिनुपर्ने बताए। यसो गर्न सकियो भने विश्वभर शान्तिको सन्देश प्रवाह हुनुका साथै नेपालको आर्थिक एवम् पर्यटन क्षेत्रमा ठूलो योगदान पुग्छ बुद्धको शिक्षा सार्वभौम सर्वकालका लागि मान्य हुने भन्दै दाहालले विश्व शान्ति चाहने सबैका लागि समेत उपयोगी हुन बताए। नेपाल बुद्धको भूमि भएकाले पनि शान्तिको सन्देश नेपालबाटै फैलनुपर्छ र फैलन्छ भन्नेमा म पूर्ण रुपमा विश्वस्त छु ' दाहालले भने। प्रधानमन्त्रीले मगध सम्राट् अशोकको भूमिका युद्धबाट फर्केर शान्तिका लागि भए जस्तै आफूले पनि युद्धबाट शान्ति प्रक्रियामा आएको र नेपालमा जन्मेका गौतम बुद्धको सन्देश विश्वभर फैलाउन सकारात्मक योगदान पुर्याउन चाहेको बताए। प्रतिनिधिमण्डलले विश्व शान्तिका लागि बुद्ध भूमिलाई सहयोग गर्न आफूहरु तयार रहेको प्रधानमन्त्रीलाई जानकारी गराएको प्रधानमन्त्रीको सचिवालयले जारी गरेको प्रेस विज्ञप्तिमा उल्लेख छ।"
प्रस्तावित राजदूतको सुनुवाइबारे १० दिने सूचना सार्वजनिक गरिने,"काठमाडौं: व्यवस्थापिकासंसद संसदीय सुनुवाइ विशेष समितिले भारत र चीनका लागि प्रस्तावित नेपाली राजदूतको संसदीय सुनुवाइका सम्बन्धमा आमसञ्चार माध्यममार्फत १० दिने सूचना सार्वजनिक गर्ने निर्णय गरेको छ। सरकारले छिमेकी गणतन्त्र भारतका लागि राजदूतमा नेपाली काँग्रेसका नेता दीपकुमार उपाध्याय र चीनका लागि पूर्व मुख्यसचिव लीलामणि पौड्यालको नाम प्रस्ताव गरी संसदीय सुनुवाइका लागि समितिसमक्ष पठाएको हो। मन्त्रिपरिषदको यही भदौ १६ गतेको बैठकले उनीहरुलाई राजदूतमा नियुक्तिका लागि सिफारिस गर्ने निर्णय गरेको थियो। समितिको मंगलबारको बैठकले उपाध्याय र पौड्याललाई राजदूत पदमा नियुक्ति गर्न उपयुक्त छैन् भन्ने कसैलाई लागेमा स्पष्ट आधार एवम् सवुत प्रमाणसहित यही भदौ ३१ गतेसम्म सूचना उपलब्ध गराउन सूचित गर्ने निर्णय गरेको हो। समितिले संसदीय सुनुवाइ समिति, व्यवस्थापिकासंसद सचिवालय सिंहदरबारमा त्यससम्बन्धी सूचना उपलब्ध गराउन सबैमा सूचित गरेको छ। रासस"
