शीर्षक,विवरण
मानव तस्करी,"नेपाल मानव तस्करीको लागि सहज मुलुकको रूपमा स्थापित छ । केही वर्ष अघिसम्म नेपालबाट सीमापारि भारतमा घरेलु कामदारको रूपमा जानेहरू श्रम र तीमध्ये केही यौन शोषणको सिकार हुने गरे पनि उनीहरूको भौतिक सुरक्षा त्यति चिन्ताको विषय बनेको थिएन । त्योसँगै भारतीय यौन बजार मा नेपाली बालिका तथा युवतीको बेचबिखन र त्यो कारोबारमा नेपाली दलाल हरूको संलग्नता कानुन र राज्यका विविध संयन्त्रको सक्रियताबाट निरुत्साहित हुँदै आए पनि नयाँ रूपमा मानव तस्करी मौलाएको छ । सार्कले मानव तस्करीविरुद्धको सहयोग सञ्जाललाई सक्रिय बनाउने निर्णय गरेपछि सम्भवतः यौन बजार मा नेपाली महिलाको उपस्थितिमा न्यूनता आएको छ । तर दुर्भाग्य, सार्क मुलुकहरूलाई ट्रान्जिट प्वाइन्ट बनाएर त्यहाँभन्दा बाहिर नेपालीहरूलाई पुर्याउने प्रवृत्ति तथा घटनामा अनायास वृद्धि भएको छ, खासगरी गत वर्षको विनाशकारी भूकम्प र त्यसले लाखौंको संख्यामा नेपालीहरूलाई विस्थापन गरेपछि । आर्थिक र सामाजिक हिसाबले अनिश्चिततामा धकेलिनेहरू अनेक प्रलोभन र आश्वासनको सिकार बन्ने गर्छन् । अहिले त्यही भएको छ । राष्ट्रिय मानव अधिकार आयोगले हालै सार्वजनिक गरेको एक प्रतिवेदनअनुसार भूकम्पपछिको अवस्थामा नेपालबाट तस्करी हुनेहरूको संख्यामा २० प्रतिशतसम्म वृद्धि भएको छ । झन्डै १० हजारको हाराहारीमा गत वर्ष नेपालीहरू मानव तस्करीको सिकार बनेका छन् । संख्याको हिसाबले विगतका वर्षहरूभन्दा यस वर्ष त्यस्ता घटनामा गिरावट आए पनि सरकार र दलहरूले यी घटना र त्यसको आपराधिक पक्षबारे उदासीनता देखाएका छन् । वर्तमान संसद्का आठजना सदस्यहरूमाथि मानव तस्करीको आरोप लागे पनि सरकार र सम्बन्धित दलहरूले उनीहरूमाथिको कारबाहीलाई अपेक्षित तीव्रताका साथ अनुसन्धान गरेको छैन । कामको खोजीमा नेपालीहरू खाडी मुलुकहरूमा गइरहेका छन्, मुलुकभित्रका विभिन्न म्यानपावर एजेन्सी मार्फत भने महिलालाई एजेन्सी तथा बाह्य कारोबारीहरूका दलालमार्फत भारतको दिल्ली, मुम्बई र श्रीलंकाको कोलम्बो हुँदै खाडी मुलुक पुर्याइन थालेका छन् । लैंगिक समानता आर्थिक, सामाजिक र न्यायिक हकको लागि अत्यावश्यक नागरिक हक हो र त्यसमा राज्य अनि उससँग अनुमति हासिल गरी सञ्चालनमा रहेको कुनै पनि निकायले भेदभाव गर्न पाउँदैन । नेपाली नागरिकहरू देशभित्र या बाहिर गई रोजगार गर्दा उनीहरूको सामाजिक र कानुनी सुरक्षाप्रति सरकार उदासीन रहन पाउँदैन । बढ्दो तस्करीबाट मुलुकका नागरिक प्रभावित हुँदै जाँदा सार्क संयन्त्र र अन्य दुईपक्षीय कूटनीतिक च्यानल अनि विदेशस्थित आफ्ना दूतावासलाई सक्रियताका साथ परिचालन गरी तस्करी का सिकारहरूको सुरक्षा र तस्करहरूलाई कानुनको दायरामा ल्याउने दायित्वबाट सरकार पन्छिन पाउँदैन ।"
प्रधानमन्त्री 'प्रचण्ड' लाई 'विप्लव'को पत्र (पूर्णपाठ),"काठमाडौँ: नेत्रविक्रम चन्द विप्लव नेतृत्वको माओवादीले प्रधानमन्त्री पुष्पकमल दाहाल प्रचण्डलाई बजार अनुगमनलाई नियमित गर्न र कालोबजारी तथा कमिशनखोरलाई कानुनको दायरामा माग गर्दै पत्र बुझाएको छ । पत्र बुझ्दै प्रधानमन्त्री प्रचण्डले जनताको दैनिक जीवनलाई सहज र सरल बनाउने उद्देश्यका साथ सरकारले नियमित बजार अनुगमन गरिरहेको र त्यसबाट सकारात्मक परिणाम आइरहेको बताएका छन् । मंगलबार प्रधानमन्त्री तथा मन्त्रिपरिषद् कार्यालयमा बुझाएको ज्ञापनपत्र बुझ्दै प्रधानमन्त्रीले बजार अनुगमनलाई नियमित गर्ने र कालोबजारी तथा कमिसनखोरलाई कानुनको दायरामा ल्याउने प्रयास जारी रहेको प्रष्ट पारेका छन् । आमजनताको माग जतिसक्दो धेरै सम्बोधन गर्न तथा राहत दिन सरकार र आफू पूर्णरुपमा प्रतिबद्ध भएर लागेको उल्लेख गर्दै प्रधानमन्त्री दाहालले यसमा सकारात्मक सहयोग गर्न माओवादीका नेतालाई आग्रह गरे । प्रचण्डले भने, आमजनताको माग समावेश गरेर ज्ञापनपत्र बुझाउन आउनुभो, यसले आफूलाई काम गर्न सहयोग पुग्ने छ, यसैगरी सकारात्मक सहयोग गर्नुस्, सरकार पूर्णक्षमताका साथ जनतालाई राहत प्रदान गर्न क्रियाशिल छ । ज्ञापनपत्रमा दाल, चामललगायत दैनिक उपभोग्य वस्तुमा ५० प्रतिशत सहुलियत दिन माग गरिएको छ । दाल, चामल, तेल, पिठो, दूध, तरकारी, फलफूल, मासु र मसलाको मूल्यमा ५० प्रतिशत सहुलियत दिन माग गरेको माओवादीका नेता धर्मेन्द्र बास्तोलाले जानकारी दिए । ज्ञापनपत्र बुझाउन पुगेका माओवादीका अर्का नेता सन्तोष बुढा मगरले जनताको दैनिक जीवनसँग जोडिएका विषयमा विशेष ध्यान दिन र जनतालाई राहत प्रदान गर्न आफूहरुले प्रधानमन्त्रीसँग माग राखेको बताए । भेटमा प्रधानमन्त्रीले सरकार जनतालाई बढीभन्दा बढी राहत दिन क्रियाशील रहेको र त्यसैलाई ध्यान दिएर बजार अनुगमनलाई गति दिइएको बताउनुभएको नेता मगरले जानकारी दिए । ज्ञापनपत्रमा किसानका सबै उत्पादन राज्यले खरिद गरी सिधै उपभोक्तासम्म पुयाउने व्यवस्था गर्न, विचौलियाको जालो ध्वस्त पार्न र सो कार्यमा सङ्लग्नलाई कारबाहीको दायरामा ल्याउन, माथिल्लो कर्णाली, अरुण तेस्रो जलविद्युत् आयोजनामा भारतीय कम्पनीसँग गरिएको आयोजना विकास सम्झौता (पिडिए) तत्काल खारेज गरी स्वदेशी पूँजीमा नै निर्माण गर्न आग्रह गरिएको छ ।"
"महिला संघ महाधिवेशनको तयारीमा, ७३ जिल्लाको अधिवेशन सकियो","काठमाडौं: तेस्रो राष्ट्रिय महाधिवेशनको तयारीमा रहेको नेपाल महिला संघको ७३ जिल्लामा अधिवेशन सकिएको छ। सङ्घको यही भदौ २९ देखि ३१ गते काठमाडौँमा हुने तेस्रो अधिवेशनका लागि नुवाकोट र रुपन्देहीबाहेक ७३ जिल्लामा अधिवेशन सकिएको केन्द्रीय सदस्य हरिप्रभा खड्गीले जानकारी दिए। नेपाली काँग्रेसको १३ औँ महाधिवेशनबाट पार्टी सभापतिमा शेरबहादुर देउवा निर्वाचित भएपछि बसेको पहिलो केन्द्रीय समितिको बैठकले सबै भ्रातृ संस्थाको निर्वाचन ६ महिनाभित्र गरिसक्ने निर्णय गरेसँगै महिला सङ्घ अधिवेशनमा गर्न लागिएको हो। तेस्रो राष्ट्रिय महाधिवेशनमा दुई हजार २४४ मतदाताले मतदान गर्न पाउने भएका छन्। देशभरका २४० निर्वाचन क्षेत्रबाट नौ जनाका दरले दुई हजार १०, सभापतिले मनोनीत गर्ने १० जना, वर्तमान केन्द्रीय समिति ४४ र विदेशस्थित सम्पर्क समितिबाट ३० जनाले भाग लिन पाउने महिला नेत्री इन्दिरा तिवारीले जानकारी दिइन्। लोकतान्त्रिक राज्य व्यवस्था एवम् मूल्य पद्दतिको स्थापनाका लागि स्वर्गीय मङ्गलादेवी सिंहको नेतृत्वमा विसं २००४ साउन २४ मा स्थापना भएको महिला सङ्घको अहिले बल्ल तेस्रो अधिवेशन हुन लागेको हो। सामाजिक, आर्थिक र राजनीतिक रुपमा पछाडि परेका महिला वर्गको हकहितको संरक्षण र संवद्र्धन गर्दै राष्ट्रियता, लोकतन्त्र र समाजवादको आदर्शलाई अगाडि बढाउन विसं २००४ मा स्व सिंहको सक्रियतामा चिनियाँलाल श्रेष्ठको घरमा महिला भेला गराई ११ सदस्यीय कार्यसमिति गठन गरिएको थियो। आगामी महाधिवेशनमा वर्तमान केन्द्रीय समितिका सदस्य लड्न नपाउने व्यवस्था गरिएको छ। यही भदौ २९ गतेदेखि हुने निर्वाचनमा अध्यक्ष, महासचिव, कोषाध्यक्षसहित कुल ४२ पदका लागि निर्वाचन हुँदैछ। बयालिस केन्द्रीय कार्यसमितिमध्ये खुला १५, प्रत्येक प्रदेशमा दुई जनाका दरले १४, जनजाति तीन, दलित तीन, मधेसी तीन र मुस्लिम एक पदका लागि निर्वाचन हुनेछन् । यस्तै, एक उपाध्यक्ष, एक महासचिव र एक सचिवसहित ९ सदस्य मनोनीत गरिने व्यवस्था गरिएको छ। लामो समयपछि हुन लागेका निर्वाचनमा अध्यक्षका लागि अहिलेसम्म मीना पाण्डे, रुक्मिणी कोइराला, गोमा केसी, प्रतिमा गौतमलगायत चुनावी प्रतिस्पर्धामा उत्रने आकाङ्क्षा देखाएका छन्। विसं २००७ को राणा शासनको अन्त्यका लागि भएका सङ्घर्षमा महिला सङ्घको ठूलो भूमिका रहेको छ। विसं २०१७ पुस १ गते तत्कालीन राजा महेन्द्रले दलहरुमाथि प्रतिबन्ध लगाएपछि महिला सङ्घ पनि प्रतिबन्धमा पर्यो। विसं २०४६ को आन्दोलनपछि राजनीतिक दलहरु फुकुवा भएपछि महिला सङ्घ पनि फुकुवा भयो। विसं २००४ मा स्थापना भएको सङ्घको पहिलो राष्ट्रिय अधिवेशन विसं २०५८ असोज १७ देखि १९ सम्म विराटनगरमा सम्पन्न भयो। पहिलो महाधिवेशनले अध्यक्षमा उमा रेग्मीसहित ३२ सदस्यीय केन्द्रीय कार्यसमिति निर्वाचित गरेको थियो। दोस्रो केन्द्रीय महाधिवेशन २०६४ वैशाख २७ देखि २९ सम्म नेपाली काँग्रेस पार्टी कार्यालय सानेपामा सम्पन्न भयो र अध्यक्षमा अम्बिका बस्नेत निर्वाचित भएकी थिइन्। महाधिवेशनले ३५ केन्द्रीय कार्यसमितिको पनि चयन गरेको थियो। दोस्रो महाधिवेशनमा अध्यक्ष पदमा निर्वाचित बस्नेतको कार्यसमितिले तोकिएको समयमा अधिवेशन गर्न नसकेपछि २०६९ सालमा डा डिला सङ्ग्रौलाको अध्यक्षतामा ४५ सदस्यीय तदर्थ समिति गठन गरिएको थियो। सङ्ग्रौलाकै कार्यसमितिले अहिले निर्वाचन गराउन लागेको हो। रासस"
