शीर्षक,विवरण
एनआरएनलाई परराष्ट्रमन्त्रीको प्रश्नः विदेशमा सिकेको सीप किन स्वदेश पुग्दैन ?,"काठमाडौः परराष्ट्रमन्त्री डा प्रकाशशरण महतले विदेशमा हासिल गरेका ज्ञान र सीपलाई नेपालको विकासमा अधिकतम प्रयोगमा ल्याउने काममा गम्भीर हुन गैर आवासीय नेपालीलाई आग्रह गरेका छन् । उनले विदेशमा सिकेको सीप स्वदेश नपुग्नुको कारण समेत सोधेका छन् । मातृभूमिमा किन यहाँको सीप पुग्दैन ? महतले भने । अष्ट्रेलियाको सिड्नी सहरमा शुक्रबार नेपाली समुदायको कार्यक्रमलाई सम्बोधन गर्दै मन्त्री डा महतले गैर आवासीय नेपालीका रुपमा जहाँ गएर बसेको भए पनि त्यो पहिचान बनाउने आफ्नो मातृभूमिप्रतिको दायित्व नबिर्सिन आग्रह गरे । तपाईहरु संसारको कुनै पनि देशमा भए पनि यो हैसियत निर्माण गरिदिने आफ्नो मातृभूमि हो भन्ने वास्तविकता बुझेर देशको विकासका लागि हर समय लाग्न मेरो आग्रह छ, उनले भने । विदेशमा प्राप्त गरेको ज्ञान र सीपलाई नेपालमा लगाउन सक्ने हो भने संसारमा छरिएर रहेका नेपालीले समृद्ध र समुन्नत नेपालको निर्माण गर्न धेरै समय नलाग्ने महतको भनाइ छ । गैर आवासीसय नेपाली संघ अष्ट्रेलिया र न्यु साउथ वेल्सका लागि नेपाली अवैतनिक महावाणिज्यदूतको कार्यालयले गरेको समारोहमा मन्त्री डा महतले नेपालमा बढीभन्दा बढी लगानी भित्र्याउन पनि गैर आवासीय नेपाली नागरिकलाई आग्रह गरे । नेपाल हाल नयाँ संविधान कार्यान्वयनको चरणमा प्रवेश गरेको र विगत लामो समयसम्म हिंसा र पछ्यौटेपनमा परेको नेपालले विकास र समृद्धिको बाटो लिने समय भएको भन्दै मन्त्री डा महतले नेपालमा लगानीको वातवरण अब राम्रो भएको वास्तविकता बुझ्न र आफू रहेको देशमा पनि यो सन्देश प्रवाहगर्न संसारमा रहेका गैर आवसीय नेपाली समक्ष विशेष जोड दिए । गैर आवासीय नेपालीलाई पनि नेपाली नागरिकता र अरु अधिकारका लागि संविधानमा राख्ने क्रममा आपूले विशेष भूमिका निर्वाह गरेको स्मरणगर्दै मन्त्री डा महतले यससम्बन्धी कानुनको निर्माण अब चाडै हुने जानकारी गराए । आफू मन्त्री भएपछि खाडीमा रहेका लाखौँ लाख नेपालीलाई ध्यानमा राखेर आपूले काम गरेको र त्यसको पहिलो निर्णय सानै भए पनि खाडीका केही देशमा पासपोर्ट निर्माणका लागि लाग्ने दस्तुर कम गरेको जानकारी गराए । मन्त्री डा महतले परराष्ट नीतिलाई प्रयोग गरेर आफ्नो राजनीतिक स्वार्थ सिद्ध गर्न खोज्ने प्रवृत्तिका कारण नेपालको कूटनीतिक क्षेत्रमा समस्या आउने गरेको धारणा राखे । भन्नुपर्ने र राख्नुपर्ने ठाउमा आफ्ना कुरा नराख्ने तर सडकमा ठूलो आवाजका साथ यस्तो संवेदनशील विषयमा नाराबाजी गर्ने गरिएको उनले बताए । सो कार्यक्रममा मन्त्री डा महतले गैर आवासी नेपाली संघलो प्रकाशित गरेको स्मारिका विमोचन गरे । यसैगरी मन्त्री महतले शुक्रबारबिहान अष्ट्रेलियाका पूर्व विदेशमन्त्री बब कारसँग पनि भेटवार्ता गरेका छन्। सिड्नीमा नेपाल अष्टेलिया डेमोक्र्याटिक फोरमद्धारा आयोजित एक अन्तरक्रियामा पनि मन्त्री डा महत सहभागी भएका छन्। त्यस अवसरमा महतले नेपालमा प्रजातन्त्रको सबलीकरण र विकासका लागि भूमिका निर्वाह गर्न पनि सबैलाई आग्रह गरे । कार्यक्रममा नेपाली काँग्रेसका पवर्तका पूर्व सभापति नवराज गुरुङ, सो संस्थाका अध्यक्ष विवेक थापा, सल्लाहकार नारायण काफ्ले, पूर्व अध्यक्ष महेन्द्र थापा र छिरिङ तेन्जी शेर्पालगायतले अष्टेलियामा रहेका नेपालीको अवस्था र सम्भावनाका बारेमा चर्चा गरेका थिए । मन्त्री डा महतले भोलि शनिबार सिड्नीमा गैर आवासीय नेपाली संघ अष्टेलिया र त्यहाँस्थित नेपाली दूताबासद्धारा आयोजित नोपल फेस्टिबलको उद्घाटन गर्ने कार्यक्रम छ ।"
कानुनमन्त्रीले भारतको संविधानको प्रशंसा गर्दै भनेः संघीय संरचनामा उपयोगी,"काठमाडौँ: कानुन, न्याय तथा संसदीय मामिलामन्त्री अजयशङ्कर नायकले भारतीय संविधान सङ्घीय संरचनामा निकै उपयोगी भएको बताएका छन् । भारतको संविधान १२५औँ स्थापनाका अवसरमा नेपालभारत बिपी कोइराला फाउन्डेसनले गरेको कार्यक्रममा उनले भारतको संविधान मौलिक हक, न्यायिक स्वतन्त्रताका साथै सङ्घीय संरचनामा उपयोगी भएको बताए । विश्वकै ठूलो संविधानका रुपमा परिचित भारतको संविधान मौलिक र त्यहाँको जनताको भावना बुझ्ने खालको भएको उनको भनाइ छ । नेपालका लागि भारतीय राजदूत रणजित रायले भारतको संविधान निर्वाचित प्रतिनिधिले नबनाएको भए तापनि कठोर नभई लचिलो भएको बताए । उनले नेपालभारतबीच धार्मिक तथा सांस्कृतिक रुपमा नजिकको सम्बन्ध रहेको उल्लेख गरे । सर्वोच्च अदालतका पूर्व न्यायाधीश गिरीशचन्द्रलालले भारतको संविधानमा शक्ति पृथकीकरण र सन्तुलनको दृष्टिकोणले निकै उपयुक्त भएको उल्लेख गरे । प्रा डा सूर्य ढुङ्गेल, डा निश्चलनाथ पाण्डेले भारतको संविधान सङ्घीय संरचनामा निकै राम्रो देखिएको र ठूलो संविधान भइकन पनि प्रभावकारी कार्यान्वयन हुनु अत्यन्तै राम्रो विशेषता भएको चर्चा गरे । रासस"
रामदेवको योग शिविरमा प्रधानमन्त्री प्रचण्ड नजाने,"काठमाडौंः राष्ट्रपति विद्यादेवी भण्डारीले बिहीबार उद्घाटन गरेको भारतीय योग गुरु बाबा रामदेवको योग शिविर समापन समारोहमा प्रधानमन्त्री पुष्पकमल दाहाल प्रचण्ड नजाने भएका छन्। वीरगञ्जमा जारी शिविरको समापन कार्यक्रममा आयोजकले प्रधानमन्त्रीलाई निम्तो गरेता पनि प्रधानमन्त्री सहभागी नहुने उनको सचिवालयले जानकारी दिएको छ । रामदेवको उपस्थितीमा जारी शिविरको समापन १३ गते हुँदैछ। यसअघि प्रधानमन्त्री प्रचण्ड समापनमा जाने निश्चित भइसकेको थियो। प्रधानमन्त्री प्रचण्डका स्वकीय सचिव प्रकाश दाहालले प्रधानमन्त्रीले राजनीतिक व्यस्तताका कारण कार्यक्रममा सहभागी हुन नसक्ने जानकारी दिए । संविधान संशोधन लगायतका वर्तमान राजनीतिक परिस्थितिका कारण प्रधानमन्त्री उक्त कार्यक्रम समापनमा नजाने निश्चित भइसकेको छ, उनले भने ।"
एमालेको सहमतिविना संशोधन प्रस्ताव दर्ता हुँदैनः साउद,"काठमाडौंः प्रमुख सत्तारुढ दल नेपाली काँग्रेसका नेता एनपी साउदले संविधान संशोधनमा प्रमुख प्रतिपक्षी दल एमालेलाई विश्वास लिएर अघि बढ्नुपर्ने बताएका छन्। साउदले एमालेलाई विश्वासमा लिएर मात्रै संविधान संशोधन प्रस्ताव अघि बढाउनुपर्ने बतााएका हुन्। उनले संविधान संशोधनमार्फत असन्तुष्टहरुको मागलाई सम्बोधन गर्नुपर्नेमा जोड दिए। रिपोर्टर्स क्लबले शुक्रबार गरेको कार्यक्रममा साउदले संविधान संशोधनको सरोकारवाला पक्ष, सत्तारुढ दल र प्रमुख प्रतिपक्षी दलवीच संशोधनको विषयमा सहमति कायम गरेरमात्रै अघि बढ्नुपर्ने स्पष्ट पारे। उनले भने,मधेशवादी दलहरुले पनि नयाँ शर्तहरु थुपार्दै जाने हो, सरोकारवालाहरुवीच सहमति भएन भने मुलुकमा नयाँ द्वन्द्व सिर्जना हुन्छ । साउदले प्रधानमन्त्री पुष्पकमल दाहाल प्रचण्डले संशोधन प्रस्ताव ल्याउनको लागि हतार गरेको समेत आरोप लगाए। उनले भने,प्रचण्डजीले हतार हतार गरिरहनुभएको छ, रेलको इन्जिनमात्रै कुदाउने तर डब्बा छोड्ने काम गर्नुभएन नि ? उनले प्रतिपक्षीले बोलेका कुरालाई सरकारले नजरअन्दाज गर्न नहुने बताए । उनले कैलालीकञ्चनपुरको जनता कहाँ बस्ने भन्ने कुरा त्यहाँका जनताले भन्दापनि काठमाडौंमा बस्नेहरुले बढि गरेको आरोप लगाए। कार्यक्रममा एमालेका नेता रघुविर महासेठले प्रचण्डको नेतृत्वको सरकारले संविधान संशोधन प्रस्ताव कुनै हालतमा ल्याउन नसक्ने ठोकुवा गरे। उनले सरकारले संशोधनको नाममा हल्ला र प्रोपागाण्डा फैलाएको आरोप लगाए । उनले भने,यो सरकारले संविधान संशोधन प्रस्ताव ल्याउनको लागि होइन, त्यत्तिकै हल्ला र प्रापागाण्डा फैलाईरहेको छ, अन्तिममा आएर एमालेको कारणले वा एमालेले मानेन भन्छ अनि यही बहाना बनाउँछ। नेता महासेठले अहिले संविधान संशोधन आवश्यकै नभएको समेत स्पष्ट पारे। उनले संविधान संशोधनभन्दा पनि अहिले कार्यान्वयन आवश्यक भएको जिकिर गरे ।"
प्रचण्ड नेतृत्वको सरकार चटके : ओली,"पोखरा: नेकपा एमालेका अध्यक्ष केपी शर्मा ओलीले नेकपा माअोवादी केन्द्रका अध्यक्ष पुष्पकमल दाहाल प्रचण्ड नेतृत्वको सरकारलाई चटकेको संज्ञा दिएका छन्। संविधान कार्यान्वयनका लागि बनेको सरकारले संशोधनको कुरा गर्नुलाई उनले चटकेको संज्ञा दिएका हुन्। प्रेस चौतारी कास्कीले पोखरामा अायाेजना गरेको पत्रकार सम्मेलनमा अोलीले भने, यो सरकार संक्रमण टुङ्ग्याउन बनेको हो, संविधान संशोधन गर्न होइन।निर्वाचनतिर केही ध्यान छैन, संशोधनमात्रै भनिरहेको छ। अहिलेको संसद संघीय संसद पनि नभएको हुँदा निर्वाचन गरेर संक्रमण टुङ्ग्याउनुपर्ने उनको भनाइ थियो। २०७४ माघ ७ भित्र चुनाव गर्नु पर्नेपट्टि सरकारले चर्चासम्म नगरेको ओलीले टिप्पणी गरे। सरकारले संविधान संशोधन विधेयक दर्ता गर्ने भए पनि त्यसलाई आफूहरुले रोक्न नसक्ने पनि उनले बताए। संसद सचिवालयमा दर्ता हुने कुरा हो, उनले भने, हामी त्यहाँ लाठी लिएर बस्ने कुरा भएन । निर्वाचनभन्दा अगाडि मधेसी दलहरुलाई सहमतिमा ल्याउन संविधान संशोधन गर्नुपर्ने हो कि भन्ने पत्रकारहरुको प्रश्नमा ओलीले मधेसी सहमत नभएको अस्वीकार गरे। कसले मानेको छैन? मधेसबाट निर्वाचित जनप्रतिनिधि मै हुँ, उनले भने, म कहिल्यै पहाडबाट निर्वाचित भएको छैन। संविधानलाई संशोधन गर्नै नहुने उनको भनाइ थियो। तर केका लागि? देशका लागि जनताका लागि संशोधन हुन सक्छ। तर कुनै अमूर्त मागका लागि संशोधन हुँदैन, उनले भने, सामाजिक एकता र सदभाव वृद्धि हुने गरी संशोधन हुन सक्छ। सरकारले पूरक बजेट ल्याउन लागेर देशलाई द्वन्द्वमा फसाउन खोजेको ओलीले बताए। नयाँ आयोजनालाई नथपी नहुने भएमात्रै पूरक बजेट ल्याउन मिल्ने उनको भनाइ थियो।"
