शीर्षक,विवरण
सेनाको अभिव्यक्ति,"मुलुक डरलाग्दो र अराजक स्थितिमा छ । राजनीतिक नेतृत्व र सरकार जवाफदेही बन्न सकेका र चाहेका छैनन् । मुलुकभित्र विखण्डनवादी शक्तिहरूले राजनीतिक' जामा लगाउँदै विदेशी दाता र कूटनीतिज्ञहरूसँग सहकार्य गरिरहेका छन्, खुला रूपमा । त्यति मात्र होइन, नेपाली जनताबाट निर्वाचित एक प्रतिनिधिले समेत नेपालकै भूभाग स्वतन्त्रताको वकालत गरेका छन्, सामाजिक सञ्जालमार्फत । अर्कोतिर विदेशी कूटनीतिज्ञमध्ये केही भियाना कन्भेन्सन' र कूटनीतिक मर्यादाविपरीत त्यस्ता गतिविधिमा सहयोगी भूमिका खेल्नुका साथै नेपालका राष्ट्रिय विभूतिहरूप्रति अमर्यदित टिप्पणी गर्नसमेत पछि परेका छैनन्, सार्वजनिक टिप्पणीमार्फत । यी सबै कुरा या गतिविधिप्रति एउटा स्वतन्त्र तथा आधिकारिकतायुक्त व्यवहार या प्रतिक्रिया दिन सकेको छैन सरकारले । यस्तो अवस्था कतिपय बौद्धिक तथा राजनीतिक कोणबाट परिस्थिति सहज बनाउन सेना अगाडि आउनुपर्ने सुझावसमेत बाहिर आएका छन् । राष्ट्र र राष्ट्रियताका वाहक जनता हुन्, मुख्य रूपमा । राज्य र राष्ट्र भनिने भूगोलप्रति उनीहरूको बफादारी अनि हामी यो मुलुकका हौं' भन्ने भावनाको प्रत्याभूति राज्यबाट हुनु आवश्यक सर्त हुन्, मुलुकको सम्मानित तथा सार्वभौम हैसियत हुनको लागि । तर नेताहरूको लोभ, आत्मसमर्पणवादी चरित्र र भूसामरिक अवस्थितिका कारण मुलुकमा अवाञ्छित बाह्य गतिविधि बढेका छन् । सामान्यतया बाह्य आक्रमणको अवस्थामा र ठूलो आन्तरिक गडबडीमा शान्तिसुरक्षा कायम हुन नसक्दा सेनाको भूमिका अपेक्षित हुन्छ । तर प्रजातान्त्रिक शासन व्यवस्थामा र सामान्य अवस्थामा सेना दलीय नियन्त्रण तथा स्वच्छन्द नहुने आशा पनि गरिन्छ । त्यति हुँदाहुँदै पनि नेपालको राजनीतिक संक्रमणको व्यवस्थापन या जनताको अपनत्व नरहेको, त्यसले राजनीतिक र संवैधानिक रिक्तता पैदा गरेको, सरोकारवाला तथा कूटनीतिक सम्बन्ध भएका अन्य मुलुकहरू नेपालको अस्थिरता र अस्थायित्वबाट आश्वस्त हुन नसकेको अवस्थालाई जनताले बेवास्ता गर्न सकेका छैनन् । दलहरू जनताप्रति उत्तरदायी नबन्दा उनीहरूप्रति आम विश्वसनीयता गुमेको छ । आम जनताकै सोचाइमा पनि केही परेमा सेना त छ नि' भन्ने मानसिकता या मान्यता देखा परेका छन् । सेनाको वार्षिक समन्वय' बैठकमा करिब तीन दर्जन जर्नेल' हरूबीच प्रधानसेनापति राजेन्द्र क्षेत्रीले मुलुकको वास्तविक परिस्थितिबारेको ज्ञान, जनताको त्रस्त मनोविज्ञान र दलहरूप्रतिको अविश्वाससँगै केही अन्तर्राष्ट्रिय शक्तिहरूको चलखेलबारेका परिस्थितिजन्य या प्रमाणित तथ्यका आधारमा केही खरो टिप्पणी गरे । २०७४ माघसम्ममा तीन निर्वाचन (संसद्, प्रान्त र स्थानीय निकाय) सम्पन्न गर्नुपर्ने संवैधानिक बाध्यता, त्यो हुन नसक्दा उत्पन्न हुने परिस्थिति, संविधान संशोधनसम्बन्धी विरोधाभासका परिणामबारे सजग हुन र उत्पन्न परिस्थितमा आफ्नो दायित्व निभाउन प्रधानसेनापतिले स्वाभाविक आग्रह गरेका छन् । त्यसै सन्दर्भमा उनले केही विदेशी शक्ति र दाताहरूले सेनालाई धर्मसँग जोडी त्यसविरुद्ध जनता भड्काउने कामप्रति पनि चासो व्यक्त गरेका छन् । वास्तवमा सेना प्रमुखबाट यस्तो अभिव्यक्ति आउनुपूर्व त्यस्ता अराजक र देशविरोधी गरिविधिबारे सरकार र दलहरूसमेत सचेत नहुनु नै उनीहरूको कर्तव्य र राष्ट्रप्रतिको उदासीनताको प्रमाण हो । प्रधानसेनापतिको यो अभिव्यक्तिले मुलुकको अनिश्चितता र भोगाइको चित्रण गरेको छ र त्यसबाट खासगरी अहिलेको सत्ता गठबन्धनले सही पाठ' या निष्कर्ष निकाल्नैपर्छ । प्रजातन्त्रको सुदृढीकरण र मुलुकको सार्वभौम हैसियतप्रति उनीहरू उदासीन रहेको सन्देश जनताले पटकपटक दिइसकेका छन् ।"
'सरकार निर्वाचनको मिति घोषणा गर्न आतुर छ',"काठमाडौं: उपप्रधानमन्त्री एवम् गृहमन्त्री विमलेन्द्र निधिले सबै राजनीतिक दलको सहमति र सहकार्यमा सरकारले निर्वाचनको मिति घोषणा गर्न लागेको बताएका छन्। उनले भने, 'निर्वाचनको मिति घोषणा गर्न सरकारले राजनीतिक दलसित संवाद गरिरहेको छ, सहमति जुट्नासाथ मिति घोषणा हुन्छ, संविधान कार्यान्वयनका गर्न निर्वाचनको विकल्प छैन।' व्यवस्थापिकासंसद्, राज्य व्यवस्था समितिको शुक्रबारको बैठकमा गृहमन्त्री निधिले सरकारका तर्फबाट निर्वाचनका लागि आवश्यक तयारी गरिरहेको जानकारी दिँदै समितिमा विचाराधीन तीनवटा विधेयकलाई छिटो टुङ्गोमा पुर्याउन आग्रहसमेत गरे। समितिमा निर्वाचनसित सम्बन्धित राजनीतिक दलसम्बन्धी कानुनलाई संशोधन र एकीकरण गर्न बनेको विधेयक, २०७३, निर्वाचन आयोगको काम, कर्तव्य र अधिकारसम्बन्धी कानुनलाई संशोधन र एकीकरण गर्न बनेको विधेयक, २०७३ र मतदाता नामावलीसम्बन्धी कानुनलाई संशोधन र एकीकरण गर्न बनेको विधेयक, २०७३ विचाराधीन अवस्थामा रहेका छन् । संविधानमा २०७४ माघ ७ गतेभित्र स्थानीय, प्रदेश र केन्द्रीय संसद् (तीन तह) को निर्वाचन सम्पन्न गरिसक्नुपर्ने प्रावधान रहेको छ । गृहमन्त्री निधिले भने 'तपाईंहरु समितिबाट छिटोभन्दा छिटो निर्वाचनसँग सम्बन्धित ती विधेयकलाई पारित गरिदिनुहोस्, सरकार निर्वाचनको मिति घोषण गर्न आतुर छ ।' सो अवसरमा सांसदहरुले तीनवटा विधेयकलाई समितिबाट पारित गराउनु पूर्व तीनवटा उपसमिति गठन गरी अध्ययन गर्न सुझाव दिएका थिए। उनीहरुले विधेयकमा निर्वाचन आयोगलाई बलियो बनाउन, थ्रेसहोल्डको प्रावधान राख्न र निर्वाचनलाई मितव्यी बनाउन सुझाव राखेका थिए। बैठकमा निर्वाचन आयुक्त इला शर्माले आयोगले प्रस्तुत गरेको मस्यौदाको भावना विपरीत विधेयकका मस्यौदा आएकोमा गुनासो गरेकी थिइन्। आयोगले मस्यौदा गरेको विधेयकमा सरकारको परामर्शमा निर्वाचन आयोगले निर्वाचनको मिति घोषणा गर्ने प्रावधान रहेको थियो । अहिले समितिमा छलफल रहेको विधेयकको मस्यौदामा आयोगको सल्लाहमा सरकारले निर्वाचनको मिति घोषणा गर्ने प्रावधान राखिएको छ। रासस"
'अंगीकृतलार्इ प्रमुख पद दिने गरी संविधान संशोधन हुँदैन',"काठमाडाैं: प्रधानमन्त्री पुष्पकमल दाहाल प्रचण्डले संविधान संशोधन भएपछि पनि अंगीकृत नागरिक मूख्यमन्त्रीदेखि राष्ट्रपति सम्मका पदमा निर्वाचित हुन नपाउने बताएका छन्। शुक्रबार कास्की जिल्लाको विकास निर्माणका विषयमा प्रधानमन्त्रीलाई ध्यानाकर्षण गराउन आएको माओवादी केन्द्रको प्रतिनिधि मण्डलसँगको भेटमा प्रधानमन्त्री प्रचण्डले संविधान संशोधनमा मूख्यमन्त्रीदेखि राष्ट्रपतिसम्मका सबै पदमा बंशजको नागरिक मात्र निर्वाचित हुन पाउने बताएका हुन्। उनले भने,'संविधान संशोधनका विषयमा बजारमा अनेकौं हल्ला चल्ने गरेका छन्, ती हल्ला सत्य होइनन्। सरकारले संविधान संशोधन प्रस्तावको तयारी गरिरहेको छ। तर, संविधान संशोधनमा मूख्यमन्त्रीदेखि राष्ट्रपतिसम्मका सबै पदमा बंशजको नागरिक मात्र निर्वाचित हुन पाउने व्यवस्था हुन्छ, अंगीकृतले पाउँदैनन्। प्रधानमन्त्री प्रचण्डले नागरिकताको सवालमा अन्तरिम संविधानमा व्यवस्था भएको कुनै विदेशी महिलाले नेपाली नागरिकसँग बिवाह गरी सम्बन्धित देशको नागरिकता परित्याग गरेपछि नेपालको अंगीकृत नागरिक हुन पाउने व्यवस्थालाई समावेश गरी संविधान संशोधनको प्रस्तावमा छलफल चलेको जानकारी दिए। उनले भने,' नागरिकतामा अरु संशोधन हुँदैन, विदेशी महिलाले नेपाली पुरुषसँग बिहे गरेपछि आफ्नो देशको नागरिकता त्याग्छ भने नेपाली अंगीकृत नागरिकता पाउन सक्नेबारे छलफल चलिरहेको छ। सीमाङ्कनका सम्बन्धमा विगतमा कांग्रेसएमालेले तयार पारेको सात प्रदेशको प्रस्ताव वरिपरि नै सहमति खोजिन्छ । भाषाका बारेमा आयोगलाई अधिकार दिइन्छ र राष्ट्रिय सभाको प्रतिनिधित्वबारे पनि भूगोल र जनसंख्यालाई ख्याल गरेर प्रस्ताव तयार पारिन्छ। प्रधानमन्त्री प्रचण्डले सरकारले पुरक बजेटको तयारी गरिरहेको जानकारी दिए। उनले पुरक बजेटमा गरिबका लागि सरकार, जनता पेन्सन कार्यक्रम र बेरोजगार युवाहरुलाई रोजगारी दिन नसके बेरोजगार भत्ता दिने व्यवस्था गरिने जानकारी दिए। भेटमा माओवादी केन्द्र कास्कीका नेताहरुले आफ्नो जन्मस्थान भएका कारण आगामी निर्वाचन कास्कीबाट चुनाव लड्ने गरी सोच्न पनि प्रधानमन्त्रीसँग आग्रह गरेका थिए।"
'५ नम्बर प्रदेश टुक्र्याउने प्रस्ताव आए विपक्षमा मतदान गर्छु',"काठमाडौंः सत्तारुढ दल नेकपा माओवादी केन्द्रका संसदीय दलका उपनेता टोपबहादुर रायमाझीले ५ नम्बर प्रदेशलाई टुक्र्याउने गरी संविधान संशोधन प्रस्ताव ल्याए आफूले त्यसको विपक्षमा मतदान गर्ने चेतावनी दिएका छन्। रायमाझीले सरकारले ५ नम्बर प्रदेशलाई तलमाथि गर्ने गरी संशोधन प्रस्ताव ल्याए आफूले त्यसको विपक्षमा मतदान गर्ने चेतावनी दिएका हुन्। शुक्रबार रिपोर्टर्स क्लब नेपालले आयोजना गरेको साक्षात्कारमा उनले भने,मेरो लागि देश र जनता ठूलो कुरा हो, पार्टी भनेको त्यसपछिमात्रै हो। रायमाझीले विवाद नै नभएको ५ नम्बर प्रदेशलाई टुक्र्याउँदा कसैलाई पनि फाइदा नहुने जिकिर गरे। उनले ५ नम्बर प्रदेशलाई टुक्र्याउने गरी संविधान संशोधनको प्रस्ताव आएमा उक्त प्रस्तावको विपक्षमा मतदान गर्दा पार्टीले कारवाही गरेपनि आफूलाई कुनै फरक नपर्ने स्पष्ट पारे। ५ नम्बर प्रदेशलाई टुक्र्याउने विषयमा ९० प्रतिशतको विरोध रहेको उल्लेख गर्दै रायमाझीले भने,५ नम्बर प्रदेशका सबै दलहरु एक ढिक्का छन्, यदि ५ नम्बर प्रदेशलाई तलमाथि गर्ने कुरा भए जनता स्वतस्फुर्त आन्दोलनमा उत्रिन्छन्, अहिलेपनि आन्दोलनका झिल्काहरु देखा परेका छन् ।"
संविधान संशोधनले देशमा राजनीतिक द्वन्द्व निम्त्याउँछ: ज्ञवाली,"काठमाडौं: नेकपा एमालेका सचिव प्रदीपकुमार ज्ञवालीले संविधान संशोधनको तयारीले मुलुकमा राजनीतिक र सामाजिक द्वन्द्व निम्तिने खतरा बढेको बताएका छन्। प्रेस चौतारी नेपाल गोरखापत्र प्रतिष्ठान शाखाको दोस्रो अधिवेशनको काठमाडाैंमा शुक्रबार उद्घाटन गर्दै नेता ज्ञवालीले अहिलेको आवश्यकता संशोधन नभई संविधान कार्यान्वयन र निर्वाचनको घोषणा भएको बताए। उनले भने,' संविधान जारी गराउन महत्वपूर्ण भूमिका निर्वाह गर्ने दोस्रो ठूलो दल एमालेलाई बाहिर राखेर कसरी सर्वस्वीकार्यता हुन्छ, यसको मानक परिभाषा सुन्ने मन छ।' ज्ञवालीले संविधानमा प्वाल पारेर निर्वाचन हुन नदिई अवाञ्छित स्वार्थ लाद्न खोज्ने दिनको पर्खाइ रहेकासँग सतर्क हुनुपर्नेमा जोड दिँदै सामाजिक र राष्ट्रिय एकताका लागि सञ्चार क्षेत्रको भूमिका प्रभावकारी हुनुपर्ने बताए। रासस"
