शीर्षक,विवरण
नाम मात्रैका प्रधानमन्त्री,"नेपालका प्रधानमन्त्री पुष्पकमल दाहाल हालै चीनको साताव्यापी भ्रमणपछि फर्किए । त्यससम्बन्धी अनेक समाचार र विचार प्रकाशित भए । तर भनिएका कुरा र भन्न खोजिएका कुरा फरक देखिए । कूटनीतिक भाषामा जे बोलिए पनि त्यसभित्र लुकेको राजनीतिक संकेत र अभिव्यक्ति बेग्लै रहे । जुन लक्ष लिएर नेपालका प्रधानमन्त्री चीन गएका थिए, के त्यो पूर्ण भएको छ ? यसको उत्तर प्रकाशित सामग्रीबाट ठहर गर्न कठिन देखिन्छ । त्यसकारण तलका पंक्ति पढेर पाठकले आफ्नो स्वविवेक प्रयोग गरेर एउटा निष्कर्षमा पुग्नुपर्ने देखिन्छ । चीनका राष्ट्रपति सी जिनपिङले नेपालका प्रधानमन्त्री पुष्पकमल दाहालसँगको बेइजिङमा भएको भेटमा भने, 'दुई मुलुकबीच राजनीतिक तहमा विश्वास बढाउँदै सम्बन्धलाई नयाँ उचाइमा लैजान आवश्यक रहेको छ ।' (भन्न खोजेको कुरा 'तपाईं प्रधानमन्त्री भएपछि चीनबाट टाढिनुभयो । भारतसित लहसिनुभयो । त्यसकारण हामीलाई तपाईंको विश्वास हुन पनि छोड्यो । गोवामा भेट हुँदा तपाईंले मलाई अप्ठेरोमा पार्नुभयो । त्यसबेला म नेपाल आउँछु भन्दा तपाईं र तपाईंका सहयोगीहरूले केके अप्ठेरा कुरा निकाल्नुभयो । मुखले त हामीसित नजिकै रहेको गफ गर्नुभयो तर तपाईंका क्रियाकलाप र हावभावबाट हामीले बुझिहाल्यौं, तपाईं कतातिर झुक्दै जानुभएको छ । हामीले तपाईंलाई अप्ठेरो पार्ने केही भन्नु पनि भएन । अहिले पनि तपाईंसित भेट्ने मन थिएन, तर तपाईंले साह्रै कर गर्नुभएकाले म भेट्न तयार भएको हुँ । भेटेर मात्र विश्वास बढ्ने होइन । आपसी विश्वास बढाउन दुई हातको ताली बज्नुपर्छ । एउटा हातले मात्र विश्वास बढ्न सक्दैन ।') प्रधानमन्त्री पुष्पकमल दाहालले चीन भ्रमणका क्रममा अघिल्लो सरकारका पालामा भएका पारवहन सम्झौताको प्रोटोकल बनाउने कामलाई उच्च प्राथमिकताका साथ नेपालले अघि बढाएको जनाए । प्रधानमन्त्री पुष्पकमल दाहालले चीन जानुअघि अविश्वासको दूरी हटाउने प्रयास गर्ने बताएका थिए । दूरी रहेको पुष्टि त भयो तर यसको चर्चा नै नगरी उनले भने, 'नेपालले अन्तर्राष्ट्रिय मामिलामा सक्रियतापूर्वक चीनले निर्वाह गर्दै आएको भूमिका प्रशंसनीय छ र अन्तर्राष्ट्रिय र क्षेत्रीय मामिलामा नेपालले चीनसँग मिलेर काम गर्न चाहेको छ । यो छलफलबाट नेपाल र चीनको सम्बन्ध विकासमा महत्वपूर्ण आयाम थपेको छ।' (भन्न खोजेको कुरा तपाईंहरूको भावनालाई बुझेरै मैले तपाईंसित भेट गर्न खोजेको हो । म तपाईंहरूबाट टाढिन खोजेको होइन । तपाईंकै नेता माओको नाम जप्दै म यहाँसम्म आइपुगेको छु । म विचार र भावनाबाट तपाईंहरूबाट अलग रहन सक्दै सक्दिन । तर परिस्थितिवश, म तपाईंहरूबाट टाढिएको देखिन पुग्यो । तपाईंहरूलाई थाहै छ, म अहिले साह्रै अप्ठेरो अवस्थामा परेको छु । उनीहरूको कुरा नमानूँ भने मलाई हेगमा लगेर १७ हजार मानिस मारेको अपराधमा दोषी ठहर्याएर सजाय दिने धम्की दिएका छन् । त्यसैले मैले उनीहरूका कुरा मान्नुपर्ने मजबुरी छ । होइन भने म चीनबाट टाढिन सक्ने मान्छे होइन । मैले उनीहरूका कुरा मानेजस्तो गरेर तपाईंहरूको मन नदुखाउने किसिमले काम गर्न खोजेको छुनेपाल र मेरो संकटलाई तपाईंहरूले राम्ररी बुझिदिनुहोला भनेरै म तपाईंसित भेट्न आएको हुँ ।' राष्ट्रपति सीसित भेट्नुअगाडि नै प्रधानमन्त्री दाहालले बोआओमा चीनका उपप्रधानमन्त्री झाङ गाओलीसित भेट गरेका थिए । भेटवार्तामा प्रधानमन्त्री दहालले 'वान बेल्ट वान रोड' को अवधारणामा नेपालको प्रतिबद्धता जनाए, तर त्यसको सदस्यतासम्बन्धी समझदारी पत्रमा नेपालको आवश्यक तयारी पूरा नभएकाले हस्ताक्षर हुन नसकेको बताए । (भन्न खोजेको कुरा हामीलाई राम्ररी थाहा छ, त्यो एउटा उत्तम अवधारणा हो । तर यस घडीमा हामीले आफ्नो प्रतिबद्धताभन्दा बढी केही गर्न असमर्थ छौं कारण हामीमाथि यसमा हस्ताक्षर नगर्न उताको ठूलो दबाब छ । त्यसैकारण यससम्बन्धी तपाईंहरूले पठाउनुभएको चिठी हाम्रो परराष्ट्र मन्त्रालयमा थन्किएर बसेको छ । यसबारेमा तपाईंहरूले अन्यथा नलिनु होला । सहज परिस्थिति आएपछि हामीले यस सम्झौतामा हस्ताक्षर गर्नेछौं ।) त्यस भेटमा प्रधानमन्त्री दाहालले नेपालचीन सिमानामा आइपुग्न लागेको रेल रसुवा, काठमाडौं, पोखरा हुँदै लुम्बिनीसम्म विस्तार गर्न, नेपालचीन विद्युतीय प्रसारण लाइन तथा सीमापार आर्थिक क्षेत्रलगायत विषयमा दुई देशबीच सहमति आवश्यक रहेको बताए । यसको उत्तरमा चिनियाँ उपप्रधानमन्त्री झाङले प्रस्ट भने, 'यी विषयमा छिटै सहमति गरेर सहकार्य गर्न चीन प्रतिबद्ध छ । तर तपाईंहरूले नै रुचि नदेखाउनुभएकाले हामी चुप लागेर बसेका हौं ।' (भन्न खोजिएको कुरा 'हामीलाई थाहा छ, यस कुरामा तपाईंहरू किन चुप लागेर बस्नुभएको हो ? तपाईंभन्दा पहिलेको सरकारसँग पारवहन र रेलसम्बन्धी गरिएका सम्झौता कार्यान्वयन हुन सकेको भए अहिलेसम्म चिनियाँ रेल केरुङ पुगिसक्थ्यो । यसबारेमा तपाईंले कुरा नउठाइरहन पनि भएको छैन, यसलाई अगाडि बढाउन पनि मिलेको छैन । यसबारे तपाईंका कुरा प्रचारको लागि कुरा मात्र हुन् । यसलाई अगाडि बढाउने साहस तपाईंमा छैन भन्ने खबर हामीले पहिल्यै पाइसकेका छौं ।' यी विषय चिनियाँ राष्ट्रपति सीसितको भेटमा पनि छलफल भयो । भेटमा प्रधानमन्त्री दाहालले चीनले अघि बढाएको वान बेल्ट वान रोडको अवधारणाले नेपाल, भारतलगायत एसिया क्षेत्रकै आर्थिक विकासमा महत्वपूर्ण योगदान दिने बताए । उनले नेपालले चाँडैभन्दा चाँडै उक्त अवधारणाको अंग बनी त्यसबाट लाभ लिन चाहेको बताए । दाहालले अघिल्लो सरकारका पालामा चीनसँग भएका पारवहन सम्झौताको प्रोटोकल बनाउने कामलाई उच्च प्राथमिकताका साथ नेपालले अघि बढाएको जनाए । अन्य सहमति र सम्झौता कार्यान्वयनमा सरकार कटिबद्ध रहेको पनि बताए । प्रत्युत्तरमा चिनियाँ राष्ट्रपति सीले भने, 'पारस्परिक लाभको लागि चीनले अघि बढाएको वान बेल्ट वान रोड अवधारणा एक अवसरका रूपमा रहेको छ । उक्त अवधारणाअन्तर्गत कनेक्टिभिटी, स्वतन्त्र व्यापार, कृषि, उत्पादन, ऊर्जा र विपत्तिपछिको पुनर्निर्माणलाई अघि बढाउन सकिनेछ । द्विपक्षीय व्यापार र लगानी, व्यापार सन्तुलन र दिगो विकासका लागि उक्त अवधारणा महत्वपूर्ण रहेको पनि छ ।' पर्यटन, संस्कृति, युवा, सञ्चारमाध्यम र सहकार्यका अन्य क्षेत्रमा सहकार्य घनीभूत पार्नुपर्ने कुरा पनि चिनियाँ नेता सीले भने । (भन्न खोजिएको कुरा 'तपाईंले जति विषय उठाउनुभएको छ, त्यसमा तपाईं गम्भीर हुनु हुन्न । तपाईं नेपाल फर्केपछि यी सब कुरा बिर्सनु हुनेछ । किनभने मलाई तपाईंका सबै कमजोरी थाहा छ । नेपाली जनतालाई सुनाउन तपाईंले मेरो अगाडि यी विषयहरू उठाउनुभएको हो । तर यी क्षेत्रमा तपाईलें के गर्दै हुनुहुन्छ भनेर उताबाट हेरिरहेको तथ्यलाई पनि तपाईंले बुझ्नुभएको छ । तपाईंको सीमा बुझेरै मैले तपाईंसित भेट्न नखोजेको हो । किनभने तपाईंसित विताएको समय व्यर्थ खेर जानेछ भन्ने मलाई लागेको छ । के गर्ने, हामीले तपाईंहरूलाई मद्दत गर्न खोजेका हौं । दिने हात मात्र तातेर नहुने रहेछ । लिने हात पनि उत्तिकै अगाडि बढ्नुपर्ने रहेछ । त्यो काम तपाईंले गर्न सक्नु हुन्न । तपाईं नाउँको मात्र प्रधानमन्त्री हुनुभएको छ । निर्णय त अरूले नै लिने गरेका छन् । नेपालप्रति हाम्रो जुन चाहना र भावना छ, त्यसको कदर गर्नको लागि भए पनि म तपाईंसित भेट्दै छु र यति कुरा गर्दैछु । तपाईं यसरी लाचार हुनुको साटो अलि साहसिलो भएको भए हामीले तपाईंलाई कत्ति मद्दत गर्न सक्थ्यौं !'"
