"शीर्षक","विवरण"
"""संविधान रक्षाका लागि होइन","देश र जनताको रक्षामा गठबन्धन हुनुपर्छ : लिङ्देन"",""काठमाडौं : राष्ट्रिय प्रजातन्त्र पार्टी (राप्रपा)का अध्यक्ष राजेन्द्र लिङ्देनले देश र जनताको हित रक्षामा गठबन्धन गर्नुपर्ने बताएका छन् । लिङ्देनले दलहरूले संविधानको रक्षाभन्दा देश र जनताको हित रक्षामा गठबन्धन गर्नुपर्ने भएपनि उल्टो भएको बताएका हुन् । राष्ट्रपति निर्वाचनमा बनेको आठ दलीय गठबन्धनलाई लक्षित गर्दै उनले नेपालमा दलहरु उल्टो दिशामा गइरहेको टिप्पणी गरेका छन् । उनले संविधान गीता, बाइबल, कुरान जस्तो अपरिवर्तनीय नहुने स्पष्ट पारेका छन् । संविधानको रक्षाका लागि गठबन्धन भन्दै शनिबार बिहान सांसद लिङ्देनले ट्वीटरमा लेखेका छन्,संविधान गीता, बाइबल, कुरान जस्तो अपरिवर्तनीय हुँदैन आवश्यकता अनुसार फेरिन्छ र फ्याँकिन्छ पनि, दलहरूले संविधानको रक्षाभन्दा देश र जनताको हित रक्षामा गठबन्धन गर्नुपर्ने हो तर उल्टो भइरहेको छ । एमाले नेतृत्वको माओवादी केन्द्र, राप्रपा, रास्वपा, जनमतको गठबन्धन तोडेर राष्ट्रपतिको निर्वाचनमा प्रधानमन्ती पुष्पकमल दाहाल प्रचण्डले कांग्रेससँग पुन : गठबन्धन गरेका छन् । कांग्रेससँग सहकार्य गरेपछि राप्रपाले प्रचण्डलाई दिएको समर्थन फिर्ता लिएर सरकारबाट बाहिरिएको छ ।"""
"छेडागाड नगरपालिकाले उचाल्यो राष्ट्रपति रनिङ्ग शिल्ड","जाजरकोट: १३ औं जिल्ला स्तरीय राष्ट्रपति रनिङ्ग शिल्डको उपाधी छेडागाड नगरपालिकाले जितेको छ । भेरी नगरपालिकाको वडा १३ कुदुस्थित भगवती माध्यमिक विद्यालयमा सञ्चालन गरिएको रनिङ्ग शिल्डको उपाधी छेडागाडले जितेको हो । ८ स्वर्ण, ९ रजत, ९ कास्य गरी जम्मा २२ पदक जितेर शिल्डको उपाधी उचालेको हो । जिल्ला समन्वय समितिका संयोजक कालीबहादुर खत्रीले रनिङ्ग शिल्ड छेडागाड नगरपाकिकाका नगरप्रमुख रत्नबहादुर खड्का र खेलाडीहरुलाई प्रदान गरेका छन् । यस्तै रनिङ्ग शिल्डमा दोस्रो स्थान नलगाड नगरपालिकाले प्राप्त गरेको छ । उसले ७ स्वर्ण, ७ रजत, ७ कास्य गरी २१ पदक जितेर दोस्रो स्थान प्राप्त गरेको छ । यस्तै तेस्रो स्थान भेरी नगरपालिकाले प्राप्त गरेको छ । ६ स्वर्ण, ३ रजत, ९ कास्य गरी जम्मा १८ पदक जितेको हो । फागुन १६ गते सुरु भएको रनिङ्ग प्रतियोगिता शान्तिपूर्ण तरिकाले सम्पन्न भएको जिल्ला खेलकुद विकास समिति जाजरकोटका अध्यक्ष नरबहादुर बस्नेतले जानकारी दिए । एथेलेष्टिक, लङ्गजम्प, त्रिपलजम्प, हाईजम्प, सटफुट, कपर्दी, भलिबल लगायतका विधामा पालिका स्तरीय प्रतियोगिता भएको थियो । यसअघि पालिका स्तरमा भएको रनिङ्ग शिल्डमा उत्कृष्ट भएका खेलाडी छनौट गरी पालिका स्तरीय खेलमा सहभागिता गराईएको अध्यक्ष बस्नेतले बताए । जिल्लाका सात पालिकाको सहभागिता रहेको यस खेलमा उत्कृष्ट हुने खेलाडीलाई प्रदेश स्तरीय खेलमा सहभागि गराईने भएको छ । विद्यालय तहदेखि खेल सुरु गरेर राष्ट्रिय तहसम्म पुग्न सबै खुड्किला पार गदै गए राष्ट्रिय खेलाडी बन्ने र बनाउने यो महत्वपुर्ण अवसर भएको उनले बताए ।"
"जैविक मलको ५० लाख अनुदान झ्वाम","जाजरकोट : भेरी नगरपालिका १३ कुदुमा निर्माण भएको जैविक मल तथा जैविक विषादी उत्पादन उद्योग (कर्णाली बायो इनर्जी एन्ड अर्गानिक फर्टिलाइजर प्रालि) अलपत्र परेको छ । दैनिक दुई मेट्रिकटन जैविक मल तथा जैविक विषादी (गाई, भैंसी, कुखुराको गोबरबाट) उत्पादन गर्ने लक्ष्यका साथ स्थापना गरिएको उद्योग सञ्चालनमा नआउँदै अलपत्र पारिएको हो । कर्णाली प्रदेशले अर्गानिक प्रदेश बनाउन सबै जिल्लामा विभिन्न विषादीमुक्त मलका लागि अनुदान दिएको हो । आर्थिक वर्ष २०७८०७९ मा कर्णाली प्रदेश सरकारको उद्योग पर्यटन वन तथा वातावरण मन्त्रालयबाट कर्णाली बायो इनर्जी एन्ड अर्गानिक फर्टिलाइजर प्रालिले ५० लाख अनुदान पाएको थियो । अनुदान लिएपछि उद्योग सञ्चालकहरू टहरोमात्र बनाएर रकम भुक्तानी लिएर सम्पर्कविहीन भएको भेरी नगरपालिका१३ का वडाध्यक्ष अध्यक्ष यज्ञ बटालाले बताए । प्रदेश सरकारले भेरी नगरपालिकामार्फत उपलब्ध गराएको ५० लाख रुपैयाँमध्ये सम्झौताअनुसार काम नभएको भन्दै नगरपालिकाले ४२ लाख मात्र भुक्तानी दिएको थियो । कुशे गाउँपालिका८ का मानबहादुर रोकाय, दिनेश रोकाय र भेरी नगरपालिका१३ प्रदीप विकको नाममा उद्योग दर्ता छ । अनुदानबाट निर्माण गरिएका उद्योगका संरचनाहरू अलपत्र छन् । उद्योगका लागि तारजालीले घेरबार गरिएको छ भने भवनसमेत निर्माण छन् । सञ्चालकहरूले काम छोडेपछि भवन जीर्ण बन्दै गएको छ । लगाएका तारजालीसमेत चोरी भएका छन् । सञ्चालकले थप ५० प्रतिशत लगानी गरेर सञ्चालन गर्ने भनिएको उद्योग हाल अलपत्र अवस्थामा छ । अनुदान लिएको कर्णाली बायोइनर्जी एन्ड आर्गानिक फर्टिलाइजर प्रालि सञ्चालकमध्येका एक मानबहादुर रोकायले भने अनुदानअनुसार काम भए पनि साथीहरूबाट धोका हुँदा उद्योग सञ्चालन गर्न नसकिएको बताए । अनुदान लिँदा गरिएको सम्झौताअनुसार जैविक मल उत्पादनका लागि गाई, भैंसी र गाई पाल्नुपर्ने सम्झौता छ । भैंसीपालन गरी जैविक मल तथा विषादी उत्पादन गर्नुपर्ने लक्ष्य भए पनि सञ्चालकहरू अनुदानको रकम मात्र लिएर भागेको स्थानीयको आरोप छ । अनुदानका नाममा राज्यको लाखौं रकम दुरुपयोग हुँदा पनि सरोकारवाला निकाय मौन छन् । तोकिएको काम सम्पन्न नगरी बीचमै छोड्दा राज्यलाई आर्थिक हानिसमेत भएको छ भने जैविक मल उत्पादन गर्ने लक्ष्य पनि तुहिएको छ । उद्योग सञ्चालकहरूले अनुदानको केही रकम मात्रै प्रयोग गरेर भौतिक संरचना निर्माण गरेको तर उनीहरूले लगानी नगर्दा उद्योग सञ्चालन हुन नसकेको भेरी नगरपालिकाले जनाएको छ । प्रदेश सरकारको ५० प्रतिशत र ५० प्रतिशत स्वलगानीका लागि आयोजनाले बजेट पाएको भएपछि स्वलगानी नहुँदा उद्योग सञ्चालनमा आउन नसकेकोे जिल्ला समन्वय समितिका संयोजक कालीबहादुर खत्रीले बताए । अनुदान लिएर उद्योग अलपत्र पार्नेलाई सम्बन्धित निकायले आवश्यक कारबाही गर्नुपर्ने उनको भनाइ छ ।"
"रुससँग लड्न युक्रेनलाई अमेरिकाले पठायो ४०० मिलियन डलरको हतियार","किभ : रुससँग युद्धरत युक्रेनलाई अमेरिकाले फेरि सैन्य सहयोग गरेको छ । अमेरिकी रक्षा मन्त्रालयले युक्रेनलाई ४०० मिलियन डल बराबरको सैन्य उपकरण र हतियार पठाएको बताएको छ । रक्षा मन्त्रालयले यो सहयोग युक्रेनको रक्षा आवश्यकता पूरा गर्नका लागि भएको बताएको छ । फेब्रुअरी २०२२ मा युक्रेनमा रुसले आक्रमण गरेदेखि अमेरिकाले ३० अर्ब डलरभन्दा बढी सहयोग पठाइसकेको छ ।"
"राष्ट्रपतिमा नेम्वाङको जित निश्चित: रायमाझी","सन्धिखर्क: नेकपा एमालेका सचिव टोपबहादुर रायमाझीले अबको निर्वाचनमा एमालेको बहुमत ल्याउने अभियानका साथ मिसन ग्रासरुट सञ्चालन गरेको बताएका छन् । आगामी हुने निर्वाचनमा एमाले एकल निर्वाचन लड्दा पनि बहुमत आउने गरी संगठन बनाउन पाटीले मिसन ग्रास रुट लिएर गाउँगाउँमा छिरेको जानकारी दिए । प्रेस चौतारी नेपाल अर्घाखाँची शाखाले सन्धिखर्क शाखाले गरेको पत्रकार सम्मलेनमा बोल्दै एमालेका नेता रायमाझीले राष्ट्रको लक्ष्य प्राप्त गर्न र सुखी नेपाली समृद्ध जनता बनाउन र एमालेले आफ्नो पालामा गरेका कामको जानकारी गाउँगाउँमा गराउन अभियान सञ्चालन भएको बताए । नेकपा एमालेका स्थायी कमिटि सदस्य तथा विदेश विभाग प्रमुख डाक्टर राजन भट्टराईले राष्ट्रपतिको निर्वाचनमा पाटीको ह्वीप नलाग्ने भएकाले दुई पात्र हेरेर भोटिंग हुँदा राष्ट्रपतिमा सुवास नेम्वाङको जित हुने दाबी गरेका छन् । एमाले र माओवादीबीच राष्ट्रपतिमा एमालेले लिने भनेर भएको सहमति तोडेर माओवादी अध्यक्ष प्रचण्डले नयाँ गठबन्धन बनाएको बताउदै एमालेले पहिलाको सहमति अनुसारनै राष्ट्रपतिमा उम्मेदवार उठाएको बताए । वर्तमान गठबन्धनका कारण देशमा आर्थिक संकट उत्पन्न भएको बताए । वर्तमान गठबन्धनले देशमा संकट निम्ताउने उनको दावी छ । कार्यक्रममा नेकपा एमालेका पोलिट्ब्युरो सदस्य सूर्य थापा, विमला घिमिरे, जिल्ला अध्यक्ष पिताम्वर भुसाल लगायतको सहभागिता थियो ।"
"राम्रो गर्न खोज्दा एमालेमाथि प्रहार भइरहेको छ : ओली","जनतालाई दिग्भ्रमित पार्न विरोधीहरु लागि परेका छन् । उनीहरुलाई भ्रमबाट मुक्त पार्ने काम बुद्धिजीवीको हो । जनतालाई तर्साउने, धम्याउने कामहरु भइरहेका छन्, सचेतना जगाउनुस् । काठमाडौं : नेकपा एमालेका अध्यक्ष केपी शर्मा ओलीले राम्रो गर्न खोज्दा एमालेमाथि प्रहार भइरहेको बताएका छन् । शनिबार भक्तपुरमा आयोजित नेपाल बुद्धिजीवी परिषद्को तेस्रो बैठकलाई सम्बोधन गर्दै ओलीले जनतालाई भ्रममा पार्ने र अल्मल्याउनेलाई बुद्धिजीवीले भ्रमजालबाट मुक्त बनाउनुपर्ने धारणा राखेका हुन् । ओलीले एमालेजस्तो पार्टी निर्वाचनमा हार्छ भने जनतालाई चेतनाको स्तर कहाँ छ भन्ने मूल्याङ्कन गर्नुपर्ने र जनतामा जागरण ल्याउनुपर्ने बताए । उनले राजनीतिमा हरेक प्रणाली गाँसिएको हुने बताए । सामाजिक परिवर्तनका विरोधीहरु जनता अल्मल्याउन सफल हुँदा एमालेले हार्नुपरेको उनको भनाई छ । उनले भने,जनतालाई दिग्भ्रमित पार्न विरोधीहरु लागि परेका छन् । उनीहरुलाई भ्रमबाट मुक्त पार्ने काम बुद्धिजीवीको हो । जनतालाई तर्साउने, धम्याउने कामहरु भइरहेका छन्, सचेतना जगाउनुस् । ओलीले रेलको डिब्बा र इन्जीनसँग तुलना गर्दै बुद्धिजीवी इन्जीन भएको बताए । उनले एउटा लेख लेखेपछि अरुको लागि प्रेरणादायी हुने र विचार प्रवाह हुने उल्लेख गरे । विचारसँग नकरात्मक टिप्पणी आए नआत्तिन आग्रह गर्दै उनले भने, गलत प्रवृत्तिविरुद्ध निरन्तर लाग्नुहोस् ।ओलीले बिना मेहनत, बिना संघर्ष कोहीपनि विजेता बन्न नसक्ने धारणा राखे ।"
"""कर्नाटकमा भाजपा विधायकको घर र कार्यालयमा छापा","१६ करोड बरामद"",""नयाँ दिल्ली : कर्नाटकको लोकायुक्त पुलिसले भाजपाका विधायक के मदाल विरुपकक्षप्पा र उनका छोरालाई भ्रष्टाचारको मुद्दामा मुख्य अभियुक्त बनाएको छ । यस मुद्दामा हालसम्म १० करोड भारु (१६ करोड नेरु)बरामद भइसकेको छ । विधायक के मदाल विरुपाक्षप्पाले कर्नाटक सोप्स एण्ड डिटर्जेन्ट लिमिटेडको अध्यक्ष पदबाट राजीनामा दिएका छन् । यो एक सरकारी कम्पनी हो जसले प्रसिद्ध साबुन बनाउँछ । के मदल विरुपकक्षप्पाको कार्यालय र घरमा बिहीबार छापा मारिएको थियो जुन शुक्रबारसम्म जारी थियो । कर्नाटक विधानसभा चुनावको दुई महिना अघि भ्रष्टाचारको मुद्दाले भाजपालाई गाह्रो बनाउन सक्छ । लोकायुक्त प्रहरी अधिकारीले आफ्नो परिचय लुकाउँदै बीबीसी हिन्दीलाई भने, अध्यक्ष र उनका छोरा प्रशान्तको घरबाट ६ करोड १० लाख भारु बरामद भएको छ । प्रशान्तको निजी कार्यालयबाट १ करोड ६२ लाख रुपैयाँ प्राप्त भएको छ । यस घटनामा प्रशान्त, उनका लेखापाल र अन्य तीन जनासहित पाँच जनालाई पक्राउ गरिएको छ । यी तीन जनामाथि घुस दिएको आरोप छ । लोकायुक्त प्रहरीलाई गोप्य सूचना र औपचारिक उजुरी समेत दर्ता भएपछि यो छापा मारिएको हो । प्रशान्तले ४० लाख भारु घुस लिएको भन्दै छापा मारेको बताइएको छ । यो घुस प्रशान्तले बुबाको सट्टामा लिएको आरोप छ । प्रशान्त आफै सरकारी जागिर गर्छन् । उनी बैंगलोर पानी आपूर्ति र ढल निकास बोर्डमा मुख्य लेखापाल हुन् । यसअघि उनी भ्रष्टाचार विरोधी ब्यूरोमा आर्थिक सल्लाहकार थिए । यो ब्यूरो गत वर्ष विघटन गरी लोकायुक्त बनेको थियो । बीबीसी"""
