शीर्षक,विवरण
स्वर्णस्मारक अनावरण,"उपराष्ट्रपति नन्दबहादुर पुनले ललितपुर२२ बुङ्गमतीस्थित आदर्श सौल युवक माविको स्वर्णस्मारक तथा सरस्वती मन्दिरको अनावरण गरेका छन् । विद्यालयको ५० औं वार्षिकोत्सवका अवसरमा आइतबार उनले स्वर्णमहोत्सव स्मारिकासमेत विमोचन गरे ।विद्यालयले स्वर्णमहोत्सका अवसरमा पूर्व प्रधानाध्यापहरू, शिक्षकहरू, व्यवस्थापन समितिका पूर्वअध्यक्ष तथा पदाधिकारी र सल्लाहकारहरूलाई सम्मान गरेको जानकारी प्रधानाध्यापक आचार्यले दिए । विद्यालयका पूर्वविद्यार्थीमध्ये खेलकुद, प्रहरी, मूर्तिकलालगायत विधामा उत्कृष्टलाई सम्मान गरिएको थियो । साताव्यापी महोत्सवमा अभिभावक दिवस, पूर्व शिक्षक, कर्मचारी तथा विद्यार्थी पुनःमिलन खेलकुद प्रतियोगिता, विज्ञान प्रदर्शनी, सांस्कृतिक कार्यक्रमसमेत गरिएको थियो ।"
सम्पदा पुनर्निर्माण दुई वर्षभित्रै : मन्त्री भट्टराई,"काठमाडौं(कास) संस्कृति, पर्यटन तथा नागरिक उड्ययन मन्त्री योगेश भट्टराईले पुनर्निर्माण हुन बाँकी रहेको सम्पदा दुई वर्षभित्र सम्पन्न गर्ने बताएका छन् । भूकम्पले नौ सय २० सम्पदाको क्षति भए पनि चार वर्षमा चार सय वटा सम्पदाको निर्माण भइसकेको पुरातत्त्व विभागले जनाएको छ । दुई वर्षभित्र पुनर्निर्माण सकिएपछि हामीले सिध्यायौं भनेर विश्व समुदायलाई जानकारी दिन सम्मेलनै गर्छौं, भुईंचालोले क्षति पुर्याएका सम्पदाको अवस्थाको जानकारी दिन आयोजित कार्यक्रममा मन्त्री भट्टराईले भने, सम्पदालाई विश्वव्यापी आँखाबाट हेर्नुपर्छ । यहाँको सम्पदा विश्वकै सम्पदा हो । नेपालको सभ्यता सबैभन्दा पुरानो भएकाले यसको अध्ययन गर्न विश्वभरिका अनुसन्धाता ल्याउन सकिने उनले बताए ।"
भक्तपुरमा धिमेबाजा प्रतियोगिता,"भक्तपुर (कास) भक्तपुर नगरपालिकाले जिल्लास्तरीय मौलिक धिमेबाजा प्रतियोगिताको आयोजना गरेको छ । धिमेबाजा प्रतियोगितामा भक्तपुर कमलविनायक न्हुज धिमे खलः प्रथम, दत्तात्रयको ख्वप धिमे खलः द्वितीय, चाँगुनारायण नगरपालिका छालिङको श्री गणेश दाफा भजन समूह तृतीय, नगाँचा धिमे बाजा खलः र याछेंको द राइजिङ कल्चर ग्रुपले सान्त्वना स्थान हासिल गरेका छन् । सूर्यविनायक नगरपालिका पान्डोबजारको पान्डोबजार धिमाय् बाजा खलः र मध्यपुर थिमी गुंगचिवाको गुंगचिवा धिमेले प्रोत्साहन पुरस्कार प्राप्त गरेका छन् ।धिमेबाजा प्रतियोगितामा जिल्लाका चारवटै नगरपालिकाबाट ७७ समूहले सहभागिता जनाएको छ । भक्तपुरबाट ६० समूह, चाँगुनारायणबाट १३ समूह, सूर्यविनायक र मध्यपुर थिमि नगरपालिकाबाट २२ समूहको सहभागिता रहेको आयोजकले जनाएको छ ।"
सरकार उपस्थिति देखाऊ,"गत डिसेम्बर अन्तिम सातादेखि संक्रमणका रूपमा देखा परिसकेको नोवल कोरोना भाइरसको उद्गम स्थल चीनको हुबेई प्रान्तको वुहान सहर अहिले निर्जन र एकान्तिकझैं बनिसकेको छ । यो संक्रमणको सन्त्रासका माझ वुहानसहित आसपासका तीन सहरमा बसोबास गर्ने अधिकांश मुलुकका आप्रवासी नागरिक अहिले घरफिर्ता भइसकेका छन्, यी सहरहरूमा चीन सरकारले सम्पूर्ण रूपका आवागमन बन्द गरेको छ । वुहान र आसपासका सहर बाहिरी विश्व र चीनको आन्तरिक सम्पर्कसंवादबाटै एक्लिएको यो अवस्था तत्कालै सहजीकरणको दिशामा जाला भन्ने स्थिति छैन । संख्याका आधारमा झन्डै ८ सय संक्रमितको ज्यान गइसकेको र ३० हजारभन्दा बढी संक्रमणमा परेर उपचाररत रहेको स्थितिलाई सामान्य मान्न मिल्दैन ।वुहान र आसपासका सहरमा रहेका विश्वविद्यालय, अध्ययन संस्थान र अन्यत्र रहेका गरेर अहिलेसम्म सूचीकृत १८० जना विद्यार्थीले घर फर्कनका लागि नेपाल सरकारसँग बिन्तीभाउ गरेको पनि एक साता भइसकेको छ । संक्रमणको गम्भीर अवस्थासँगै मनोवैज्ञानिक सन्त्रासले घेरिएर बसेका नेपालीका लागि उनीहरूको अन्तिम इच्छास्वरूप घर फर्काउने दिशामा नेपाल सरकारले भने देखावटी र आश्वासनकारी उपायमात्रै अवलम्बन गर्दै आएको देखिन्छ । कतिसम्म भने कुनै संक्रमणमा नपरेका र बिरामी अवस्थामा नरहेका विद्यार्थीलाई चीनबाट सिधै ल्याएर अस्पताल भर्ना गर्नुपर्नेझैं गरेर यही कारण अस्पतालमा बेड व्यवस्थापन गरिँदैछ भनेरै सरकारले झन्डै १० दिनको समय गुजारिसकेको छ । संक्रमणको सम्भावना अवधि पार गर्न कम्तीमा १४ दिन आइसोलेसनमा राख्नुपर्ने चिकित्सकीय अभ्यास र सुझावमा पछिल्ला दिनमा यस्तो एकान्तिक स्थल खोजिरहेका छौं भनेर सरकारले अर्को आलटालको जवाफ दिइरहेको छ । सरकारका उच्च पदाधिकारीहरू ती विद्यार्थीलाई नेपाल ल्याउनुभन्दा चिनियाँ सेवा, सुविधा र सुरक्षामा उतै रहन दिनु उपयुक्त भन्ने भावको सन्देश सुनाइरहेका छन् । अझ केही राजनीतिक दलका वरिष्ठ नेताहरू चीनबाट विद्यार्थी काठमाडौं ल्याउनु हुन्छ कि हुन्न भन्ने बहसमा उत्रिएका छन्, केही स्थानीय समुदायले भक्तपुरमा आइसोलेसन सेन्टर राख्न नदिनेसम्मको नाराजुलुस गरिसकेका छन् । यसबेला राज्य संवेदना, संयन्त्र र अठोटको प्रश्न त पूरै अर्थहीन बनेको छ नै, त्यसमाथि आफ्ना नागरिकको जीवनरक्षा एवं यो संकटको घडीमा राज्यले आफ्ना नागरिकप्रति देखाउनुपर्ने अपनत्वबोध पनि खोजीको विषय बनेको छ । स्थिति कस्तो लज्जास्पद देखिन्छ भने प्रधानमन्त्री, परराष्ट्रमन्त्री र उच्चपदस्थ पदाधिकारीले समेत सार्वजनिक मञ्चमा उभिएर हामी चीनमा रहेका विद्यार्थी एकदुई दिनमै ल्याउँछौं भनिरहेका छन्, तर यो प्रक्रियामा जोडिनैपर्ने नागरिक उड्डयन प्राधिकरण, हवाई सेवा, बेइजिङस्थित कूटनीतिक नियोग भने उद्धार प्रक्रिया र संयन्त्रका बारेमा पूरै बेखबर छन् । चीनको वुहानबाट स्वास्थ्य संवेदनशीलताबारेको सबै प्रक्रिया पूरा गरेर नेपाली विद्यार्थी घरफिर्ता ल्याउनु भनेको इराक वा सिरियामा रहेका अलपत्र नेपाली कामदार फिर्ता ल्याउनुसरहको जटिल एवं मुस्किलको स्थिति हो भन्ने मानसिकताले सरकारी संयन्त्रमा पकड राखेको देखिन्छ । स्वभावतः यो भयावह संक्रमणसँग जुध्ने र सावधानी अपनाउने स्थिति आफैंमा निकै जोखिमयुक्त छ नै, तर यसो भन्दैमा आफ्ना नागरिकले एकान्तिक बन्दै गएको विदेशी भूमिबाट गरिरहेको घरफिर्तीको आर्तनाद र बिन्तीभाउ सुन्नै नचाहेको अवस्था भने मानवीय संवेदनहीन देखिन्छ र यो स्थिति निन्दनीयसमेत छ ।यो संकटको घडीमा पक्कै पनि राजनीतिक तहमा भनिने गरेझैं आजको भोलि नै उद्धार र समन्वयको प्रक्रिया पार गर्न मुस्किल छ, यो सबैले मनन गर्ने तथ्य हो । तर, यो संक्रमण फैलिएको दुई महिना बितिसक्दा, वुहानमा रहेका भारतीय, बंगलादेशी, श्रीलंकालीसहित पश्चिमा मुलुकका विद्यार्थीहरूसमेत घरफिर्ती भइसक्दा नेपाल सरकारले गरेको तयारी र निर्देशनबाहेकको व्यावहारिक काम के थियो भनेर आम तहमा सोध्ने बेला आएको छ । बेइजिङस्थित नेपाली राजदूतले गरेको अपिलमा संकटको यो घडीमा धैर्य तथा संयम अपनाउनु हुन, भाइरस संक्रमणको नियन्त्रणका लागि चीन सरकारले दिने सुझाव पालना गर्नुहुन, भ्रमपूर्ण वा अतिशयोक्तिपूर्ण समाचार वा सूचनासँग सावधान रहनुहुन भनेरै मृत्यु मुखैमा आएर पनि धैर्यधारण गरिरहने हो कि ? अथवा, नेपालीसमेत संक्रमणको चपेटामा परेर मृत्युसंख्या गन्ने स्थिति आइहालेमा यो बहुमतीय सरकारको साख र अस्तित्व कहाँ खोज्न सकिएला ? यसकारण अब धैर्यधारणको मीठो मुखबोली मात्रै होइन, नेपाली विद्यार्थीको आर्तनाद सुनेर जतिसक्दो चाँडो उद्धारसंयन्त्र व्यवहारमा देख्न पाइयोस्, आग्रह छ ।"
एमसीसी र भ्रम,"नेकपा अध्यक्ष प्रचण्डले एमसीसीलाई अगाडि बढाउने दृढता व्यक्त गरेको समाचार आइरहँदा यो परियोजना नेपालमा ल्याउनु हुँदैन भन्ने विरोधको पनि समाचार आइरहेकै छन् । निकै लामो समयदेखि एमसीसीको विषयमा बहस चलिरहेकै छ । एकथरी एमसीसी पास गरेरै छाड्ने पक्षमा छन् भने अर्काथरी यसलाई पारित गरियो भने देशघाती कदम हुने भनेर प्रचार गरिरहेका छन् । सर्वसाधारण जनमानसमा चाहिँ अन्योलमा परेका छन् । कतिपय नागरिकमा एमसीसी के हो भन्ने कुरा थाहा पनि छैन । एकथरीले चाहिँ एमसीसीबारे अनावश्यक भ्रम फैलाइरहेका छन् । यसले गर्दा कतिपय साधारण जनतामा एमसीसी भनेको अमेरिकी सेना नेपालमा आउने हल्ला र भ्रम फैलिएको छ । यसकारण एमसीसी भनेको के हो ? एमसीसी नेपालमा ल्याउँदा यसका फाइदा के छ र बेफाइदा के छ ? एमसीसी सम्झौतामा अमेरिकी सेना नेपालमा प्रवेश गर्ने कुरा छ कि छैन ? एमसीसीमा रहेका सर्तहरू केके हुन् ? या निःसर्त नेपालमा आउन लागेको हो या सर्तसहित आउन लागेको हो ? भन्नेबारे जनमानसमा उठिरहेका प्रश्नहरूको उत्तर दिइनुपर्छ । यस्तो भ्रमलाई सरकारले चिर्न सक्नुपर्छ । यसबारे प्रस्ट पारेर अगाडि बढे राम्रो हुने थियो । सबै सामु एमसीसीबारे प्रस्ट कुरा राखेमा भ्रमहरू हट्ने थियो । हल्लाहरू कम हुने थियो । सबैको अगाडि सर्वस्वीकार्य निर्णय लिएर देशको हितमा हुनेगरी निर्णय लिएर अगाडि बढ्नसके सरकारलाई पनि सहज हुने र जनतामा पनि विरोधको आवाज कम हुने देखिन्छ । रेशमकुमार सुनुवार, नेपाल ल कलेज, काठमाडौं"
संसद अवरोधको गलत पद्धति,"अहिले २० अर्ब विगो दाबीसहित अख्तियार दुरुपयोग अनुसन्धान आयोगले ठूलो संख्यामा पूर्वमन्त्री र सचिवहरूलाई भ्रष्टाचार आरोपमा अदालतमा मुद्दा चलाएको खबरले ठूला भ्रष्टाचारीहरूको मनमा ढ्याङ्ग्रो बज्न थालेको छ । अख्तियारको यो साहसले भ्रष्टाचारीहरूको मनोबल गिरेको छ । अख्तियारको यो सकारात्मक सक्रियताले अब मुलुकमा भ्रष्टाचारीहरूको दोहोलो काडिने सन्देश गएको हामी आमनागरिकले महसुस गरेका छौं । ललिता निवास प्रकरणको भ्रष्टाचारमा आफ्नो दलको उपसभापति विजयकुमार गच्छदार मुछिएपछि कांग्रेसले उनलाई फँसाइएको भन्दै प्रतिनिधिसभाको बैठक अवरुद्ध पार्ने काम गरेको छ । यसले कतै भ्रष्टाचारीहरूको मनोबल बढ्ने त होइन ? यसतर्फ कांग्रेस सचेत रहनुपर्छ । भ्रष्टाचार गरेको छ भने आफ्नो र अर्को नभनी कारबाही गर्न अख्तियारलाई साथ दिनुपर्छ । गोविन्द विक, बुनपा१२, कपन, काठमाडौंकुनै बेला कांग्रेसका एकेजीबी अर्थात् अर्जुननरसिंह केसी, खुमबहादुर खड्का, गोविन्दराज जोशी र विजयकुमार गच्छदार शक्तिशाली नेता थिए । प्राप्त राजनीतिक शक्तिलाई दुरुपयोग गर्दै सम्पत्ति संकलनमा लाग्दा आज उनीहरू त बिलाएबिलाए, नेपाली कांग्रेसलाई पनि बिलाउने स्थितिमा पुर्याए । तर पनि कांग्रेसजन विशेषतः शेरबहादुर देउवाको चेत खुलेन । नेपाली कांग्रेसले इतिहास र वर्तमानबाट पाठ सिक्ने बेला आएको छ । गच्छदार विवादास्पद व्यक्ति हुन् । सधैं सत्तासुखमै रमाउने र प्रायः सधैं आकर्षक मन्त्रालय छान्ने गच्छदारसँग आज करोडौं सम्पत्ति छ । ती सबै सम्पत्ति के इमानदार राजनीति गर्दा प्राप्त हुने कुरा हो र ? यस्ता पात्रहरूबारे अख्तियारले छानबिन र मुद्दा चलाउँदा कांग्रेसले कोकोहोलो नै मच्चाउनु भोलि कांग्रेसकै लागि प्रत्युत्पादक हुन्छ । बरु भ्रष्टाचारबारे शंका लागे जोकोही नेतालाई छानबिन गर, गच्छदार लगायत माधवकुमार नेपाल र विष्णु पौडेललाई पनि अभियोग लगाऊ भनेर सहयोग पो गर्नुपर्छ । तर कांग्रेस उल्टो बाटोमा हिँंडिरहेको छ । कांग्रेसले सदनदेखि सडकसम्म विरोध अभियान चलाउनाले आमजनताले कांग्रेसको भ्रष्टाचार नीतिबारे शंका गर्न थालेका छन् । गोपाल देवकोटा, जोरपाटी, काठमाडौं"
