शीर्षक,विवरण
संसद् अवरोधप्रति कांग्रेसभित्रै असन्तुष्टि,"(काठमाडौं)  कांग्रेसले आफ्ना नेता विजयकुमार गच्छदारविरुद्ध पूर्वाग्रह राखेर भ्रष्टाचार मुद्दा चलाइएको भन्दै तीन पटक संसद् अवरोध गरिसकेको छ ।ललिता निवास प्रकरणमा तत्कालीन उपप्रधान तथा भौतिक पूर्वाधारमन्त्री गच्छदारसहित १७५ जनालाई मुद्दा दायर गर्दा अख्तियार दुरुपयोग अनुसन्धान आयोगले त्यही प्रकरणका निर्णयकर्ता पूर्वप्रधानमन्त्रीहरू माधवकुमार नेपाल र बाबुराम भट्टराई, तत्कालीन मुख्यसचिव लीलामणि पौडेल र सरकारी जग्गा खरिद गर्ने नेकपा महासचिव विष्णु पौडेलका छोरा नवीनमाथि मुद्दा दायर नगरेको विषयलाई कांग्रेसले मुख्य मुद्दा बनाएको छ । सडकमा समेत कांग्रेसको विरोध जारी छ । अख्तियारको कामकारबाहीका विषयमा संसद्मा न सरकारले जवाफ दिन सक्छ न त संसद्को नेतृत्वकर्ताको हैसियतले सभामुखले त्यसको कुनै समाधान दिन सक्छन् । तैपनि कांग्रेसले निरन्तर अवरोध गर्दा जनताका सरोकार र महत्त्वपूर्ण विधेयकमाथिका छलफल रोकिएका छन् । कांग्रेसका एक नेताका अनुसार संसद् अवरोध गर्नेसम्मको निर्णय पार्टीको थिएन र गर्न हुन्न भन्ने थियो । गच्छदारविरुद्ध मुद्दा दायर भएको भोलिपल्ट बिहीबार सभापति शेरबहादुर देउवाको बूढानीलकण्ठस्थित निवासमा बसेको अनौपचारिक बैठकले संसद् अवरोध नगरी विरोधमा मात्रै बोल्ने निर्णय गरेको थियो । निर्णयअनुसार बिहीबारको राष्ट्रिय सभा बैठक अवरुद्ध गरिएन । प्रतिनिधिसभा बैठक भने कांग्रेसले त्यसै दिनदेखि अवरुद्ध गर्दै आएको छ । बूढानीलकण्ठ बैठकको निर्णय संसद् अवरोध गर्ने थिएन, पछि कसले के लाइदियो, संसद् अवरोध गर्ने भनेर प्रमुख सचेतक बालकृष्ण खाँणबाट सर्कुलर भयो, देउवानिकट स्रोतको भनाइ छ, गलत बाटोमा कांग्रेस फस्न पुग्यो ।संसद् बैठक सुरु हुनुअघि बस्ने कार्य परामर्श समिति बैठकमा समेत कांग्रेस प्रमुख सचेतक खाँणले सांकेतिक रूपमा एक दिनका लागि मात्रै अवरुद्ध गर्ने बताएका थिए तर अवरोध जारी राखिएपछि अहिले पार्टीभित्रै असन्तुष्टि बढ्न थालेको छ । अन्तहीन मुद्दामा लगातार संसद् अवरोध गर्न नहुने भन्दै अधिकांश नेताले संसदीय दलका नेतासमेत रहेका पार्टी सभापति देउवालाई सुझाव दिन थालेका छन् । सोमबार हुने केन्द्रीय कार्यसमिति बैठकमा समेत यसै विषयमाथि छलफल केन्द्रित हुने भएको छ । निकास निकाल्न नसकिने मुद्दामा संसद् अवरोधको शृंखला सुरु गर्नु गलत थियो, कांग्रेसका अर्का एक नेता भन्छन्, एक दिन सांकेतिक रूपमा अवरोध गरेर दोस्रो दिनबाट खुलाउनुपर्थ्यो । त्यसो नगर्दा जनतामा गलत सन्देश गई पार्टीलाई ड्यामेज गर्ने काम भइरहेको छ ।सरकारले पनि कांग्रेसको अवरोध खुलाउन कुनै चासो दिएको छैन । नेकपा संसदीय दलका उपनेता सुवास नेम्वाङले प्रतिपक्षीले सरकारसँग कुनै माग नराखेकाले अवरोध खुलाउन संवाद नभएको बताए । यो माग सरकारसँग सम्बन्धित होइन भन्ने उहाँहरूले (कांग्रेस) राम्रोसँग बुझ्नुभएरै होला, प्रधानमन्त्री र गृहमन्त्रीले बोल्नुपर्छ भनेर यस पटक भन्नुभएको छैन, त्यसैले हामी पर्खिरहेका छौं, उनले कान्तिपुरसँग भने । कांग्रेस केन्द्रीय सदस्य मीन विश्वकर्माले भने प्रधानमन्त्री केपी शर्मा ओलीले विपक्षीले उठाएको विषयमा आश्वस्त हुने गरी संसद्मा बोलेर अवरोध खुलाउन अग्रसर हुनुपर्ने बताए । सदनबाट प्रधानमन्त्रीले संवैधानिक निकायमाथि कार्यकारीले हस्तक्षेप गर्दैन भनेर सम्बोधन गरिदिए संसद्ले निकास पाउने उनको तर्क छ । सरकारले पूर्वाग्रह र त्रुटिपूर्ण भएका निर्णयमा संवादबाटै समाधान निकाल्न सकिन्छ भनेर विरोधमा उठेको शक्तिलाई महसुस हुने गरी सम्बोधन गर्नुपर्छ, उनले भने, तर अहिले किन अवरोध भइरहेको हो भनेर सत्तापक्षबाट सोध्ने कामसम्म भएको छैन । नेकपाका उपनेता नेम्वाङ स्वतन्त्र र संवैधानिक निकायले गरेको निर्णयबारे प्रधानमन्त्रीले जवाफ दिन नमिल्ने बताउँछन् । कार्य व्यवस्था परामर्श समितिको बैठकमा हाम्रा प्रमुख सचेतकले तपाईंहरूले केका लागि अवरोध गर्न खोज्नुभएको हो भन्दा पहिलो दिन सांकेतिक रूपमा एक दिनका लागि मात्रै गर्ने हो भन्नुभयो, भोलिपल्टदेखि निरन्तरता दिनुभएको छ, उनले भने, आइतबारको बैठकमा केन्द्रीय कार्यसमिति बैठकसम्म हो भन्नुभएको छ । उहाँहरूको निर्णय के हुन्छ हामी पर्खिरहेका छौं ।कांग्रेस नेता दिलेन्द्र बडूले केन्द्रीय कार्यसमिति बैठकले निकास दिने बताए । अख्तियारको विभेदपूर्ण व्यवहारको विरोध गरेका हौं, हामीले उठाएको मुद्दा स्थापित पनि भएको छ, उनले भने, अब सधैं संसद् अवरुद्ध राख्ने होइन । निष्पक्ष र स्वतन्त्र संवैधानिक निकायबाट विभेदपूर्ण कार्य नहोस् भन्ने ध्यानाकर्षण गराउँदै पार्टीले उचित निर्णय लिनेछ ।"
'अदालतको विषय संसद्बाट निरूपण हुँदैन',"काठमाडौं (कास) सभामुख अग्निप्रसाद सापकोटाले संवैधानिक निकाय अख्तियार दुरुपयोग अनुसन्धान आयोगबाट विशेष अदालतमा दायर भएको मुद्दाको विषयमा सदनले निकास दिन नसक्ने बताएका छन् । आफ्ना संसदीय दलका उपनेता विजयकुमार गच्छदारविरुद्ध राजनीति पूर्वाग्रह राखेर अख्तियारले भ्रष्टाचार मुद्दा चलाएको भन्दै प्रमुख प्रतिपक्षी कांग्रेसले आइतबार तेस्रो दिन संसद् बैठक अवरुद्ध पारेपछि उनले यस्तो बताएका हुन् ।सदन अवरुद्ध गर्न उभिएका कांग्रेस सांसदलाई सम्बोधन गर्दै सभामुख सापकोटाले संविधानको धारा १०५ मा उल्लिखित प्रावधान ख्याल गर्न आग्रह गरे । उक्त धारामा अदालतमा विचाराधीन मुद्दामा न्यायनिरूपणका क्रममा प्रतिकूल असर पार्ने र न्यायाधीशले कर्तव्य पालनको सिलसिलामा गरेको न्यायिक कार्यको विषयमा संघीय संसद्को कुनै सदनमा छलफल गरिने छैन, भन्ने उल्लेख छ । न्यायाधीशविरुद्धको महाअभियोग प्रस्तावमा छलफल गर्दा भने उल्लेखित बन्देज लागू नहुने व्यवस्था छ । संवैधानिक निकायले गरेको निर्णय, त्यो पनि अदालत गइसकेको छ, सापकोटाले भने, अदालतको विषय संसद्बाट निरूपण हुन सक्दैन । बैठक सुरु भएलगत्तै कांग्रेस सांसदले उभिएर अवरोध गरेका थिए । सापकोटाले संसद्मा भएका गतिविधिलाई अन्तर्राष्ट्रिय समुदायले समेत हेरिरहेको भन्दै सदन चलाउन सहयोग गर्न कांग्रेसलाई आग्रह गरे । बैठकलाई जीवन्त र चलायमान बनाउनु आवश्यक छ, अन्य सांसदले पनि बोल्नका लागि समय माग्नुभएको छ, संसद्को क्षेत्राधिकारमा नपर्ने विषय तपार्इंहरूलाई जानकारी नै छ, सापकोटाले भने । कांग्रेस सांसद दिलेन्द्रप्रसाद बडूले अख्तियारले बदनियत राखेर एउटै प्रकृतिका मुद्दामा कसैलाई छुट र कसैलाई कारबाही गरेको अरोप लगाए तर उनले बोल्दा माइक बन्द थियो । कांग्रेसले यसअघि लगातार दुई दिन संसद् बैठक अवरुद्ध गरिसकेको छ । पटकपटक आग्रह गर्दा पनि कांग्रेस सांसद बस्न नमानेपछि सभामुख सापकोटाले प्रमुख प्रतिपक्षी दल उभिरहनु भनेको अवरुद्धको अवस्था हो भन्दै संसद् बैठक मंगलबारसम्मका लागि स्थगित भएको घोषणा गरेका थिए ।"
जनता आवासलाई ४१ करोड,"वनकरियालाई भवनलोपोन्मुख वनकरिया समुदायलाई पनि जनता आवास कार्यक्रमबाट भवन बनाउने सहरी विकास तथा भवन कार्यालय मकवानपुरको योजना रहेको छ । उनीहरूको आफ्ना नाममा जग्गा नभएकाले घर बनाउन समस्या । वनकरिया समुदाय अहिले मनहरी गाउँपालिका४ मुसेधापमा बस्दै आएका छन् । उक्त स्थानमा पर्सा वन्यजन्तु राष्ट्रिय निकुञ्जले घर बनाउन दिँदैन, भवन कार्यालयका प्रमुख पाण्डेले भने, उनीहरूको नाममा जमिन भयो जनता आवास कार्यक्रमअन्तर्गत भवन वनाउन सकिन्छ । २० घरधुरीमा ८२ जना वनकरिया बस्छन् । उनीहरूका लागि घर बनाउन जमिनको खोजी भइरहेको गाउँपालिका अध्यक्ष एकराज उप्रेतीले बताए ।"
इजलास व्यवस्थापनमा दुई करोड,"हेटौंडा (कास) प्रदेश सरकारको आन्तरिक मामिला तथा कानुन मन्त्रालयले न्यायिक समितिलाई बजेट विनियोजन गरेपछि वाग्मती प्रदेशका ११९ पालिकाका न्यायिक समिति व्यवस्थित हुन थालेका छन् । सरकारले चालु आर्थिक वर्षमा दुई करोड रुपैयाँ बजेट विनियोजन गरेको छ । समितिको इजलास व्यवस्थित बनाउन मन्त्रालयले बजेट उपलब्ध गराएको हो । उपमेयर र गाउँपालिकाका उपाध्यक्षको संयोजनमा गठित न्यायिक समितिलाई व्यवस्थित बनाउन बजेट उपलब्ध गराएको आन्तरिक मामिला तथा कानुनमन्त्री शालिकराम जम्मकट्टेलले बताए । पहिलो चरणमा १९ वटा पालिकालाई ४५ लाख रकम उपलब्ध गराइएको मन्त्रालयका कानुन अधिकृत मदन शिवाकोटीले बताए । मन्त्रालयले नगरपालिकालाई ५० प्रतिशत र गाउँपालिकालाई ४० प्रतिशत साझेदारीमा सहयोग गरेको छ । पहिलो किस्ता प्राप्त भएअनुसार खर्चने तयारी भइरहेको इन्द्रसरोवर गाउँपालिकाकी उपाध्यक्ष उमाकुमारी लामाले बताइन् । यसैगरी, मन्त्रालयले कानुनी सहकर्ताको कार्यविधि बनाएर ११९ वटै पालिकाकामा कानुनी सहजकर्ता खटाएको छ । भक्तपुरको मध्यपुर ठिमीमा रहेको एक पालिकाबाहेक सबैमा सहजकर्ताले न्यायिक समिति र पालिकावासीलाई सहयोग पुर्याइरहेका छन् । भक्तपुरमा राजनीतिका कारण सहजकर्ता नियुक्त हुन सकेका छैनन् ।"
टोखा केन्द्रमा बल्ल डाक्टर,"नगर अस्पताल बनाउन पहल नगरपालिकाले अहिले नगरस्तरको अस्पताल बनाउन पहल गरिरहेको छ । १० रोपनी जग्गाको आवश्यक हुने भएकाले त्यसतर्फ लागिरहेको वडाध्यक्ष जोशीले बताए । जग्गा नापजाँच गरिरहेका छौं, उनले भने, अस्पताल निर्माण गर्न सरकारले सहयोग गर्नुपर्छर् । पञ्चायतकालदेखि नै वडा कार्यालयसँगैको भवनमा सञ्चालन हुँदै आएको स्वास्थ्य केन्द्रले २०७५ मा नयाँ भवन पाएको हो । २०७५ असोजमा संघीय सरकारले ५ रोपनी जग्गामा ३ तलाका भवन निर्माण गरी नगरपालिकालाई दिएको थियो । आठ करोड लागतमा निर्माण भएको भवनमा केन्द्रबाट सेवा दिइँदै आएको छ । नगरपालिकाका प्रमुख प्रकाश अधिकारीका अनुसार नगरस्तरीय अस्पताल बनाउन स्वास्थ्य मन्त्रालयमा आवेदन दिइए पनि मापदण्ड नपुगेकाले अस्वीकार भएको छ । १० रोपनी जग्गा, स्वास्थ्यकर्मी बस्न स्टाफ र क्वाटरका लागि छुट्टै भवन निर्माण गर्नुपर्ने रहेछ, उनले भने, तर हामीसँग ५ रोपनी मात्र जग्गा छ । अहिले केन्द्रको परिसरमा रहेको सार्वजनिक जग्गालाई लिजमा लिन नगरसभामा निर्णय गरी बाँकी प्रक्रिया अघि बढाइने उनले बताए ।"
करेन्ट लागेर मृत्य,सिन्धुली (कास) सिन्धुलीमा छुट्टाछुट्टै दुर्घटनामा तीन जनाको मृत्यु भएको छ । करेन्ट लागेर २ र ट्र्याक्टर दुर्घटनामा एक जनाको मृत्यु भएको प्रहरीले जनाएको छ । काँडेतारबाट बेरा बनाउन फलामे रड सोझ्याउने क्रममा करेन्ट लागेर दुधौली१० का ३५ वर्षीय कृष्ण कटुवालको मृत्यु भएको छ । त्यसैगरी रुखबाट घाँस झार्ने क्रममा गोलन्जोर ७ खुर्कोटमा करेन्ट लागेर ४५ वर्षीय टीकाबहादर कार्कीको मृत्यु भएको प्रहरीले जनायो । दुधौली१ डकाहाचकमके ग्रामीण सडकमा ट्र्याक्टर दुर्घटनामा परी ७० वर्षीय बरमलाल धामीको मृत्यु भएको छ ।
