शीर्षक,विवरण
सम्झनामा सम,नेपाली शिक्षा परिषद्की सदस्यसचिव प्राज्ञ रमा शर्माले पनि समको निवासलाई संग्रहालय बनाउने विषयमा आफूहरूले पनि सघाउने बताइन् । समको रंग शिल्प नाट्यसम्राट् समको बायोग्राफी र ऐतिहासिक तस्बिरहरू पावर प्वाइन्टमार्फत देखाउँदै नेपाल संगीत नाट्य प्रज्ञा प्रतिष्ठानले पनि समको सम्झना गर्यो । प्रतिष्ठानका कुलपति नारायणभक्त श्रेष्ठ (रायन) ले बहुमुखी प्रतिभाका धनी समलाई सम्झिनु राज्यकै दायित्व रहेको बताए । कार्यक्रममा प्राध्यापक सावित्री मल्ल कक्षपतिले समको रंगशिल्पकलाबारे प्रकाश पारिन् । रंगकर्मी बालकृष्ण सम र उनको शिल्पकला विषयमै विद्यावारिधि गरेकी उनले सम नाटककार मात्रै नभई स्वयंमा कलाकार रहेको बताइन् ।
त्रिमूर्तिले सम्झ्यो स्रष्टा,"काठमाडौं (कास) आधुनिक कथा र उपन्यास सिर्जनाका माध्यमबाट नेपाली भाषा साहित्य प्रवर्द्धन गरेबापत साहित्यकार गीता केशरी र पद्मावती सिंहलाई संयुक्त रूपमा त्रिमूर्ति निकेतनले नेपाली साहित्य नारीरत्न पुरस्कार प्रदान गरेको छ । वाङ्मय शताब्दी पुरुष सत्यमोहन जोशीले दुवैलाई ताम्रपत्रसाथै जनही एक लाख रुपैयाँ हस्तान्तरण गरे । यसै गरी सम र समका कृति मार्फत नाट्यसम्राट् बालकृष्ण समको महत्त्वपूर्ण दस्ताबेज लेखनका साथै साढे सात दशकदेखि नेपाली भाषासाहित्यमा योगदान दिएबापत साहित्यकार प्राडा तारानाथ शर्मालाई एक लाख रुपैयाँसहित बालकृष्ण सम पुरस्कार प्रदान गरियो । चित्रकार राजन काफ्ले, समाजसेवीद्वय श्रीगोपाल महर्जन र चिनयाँराज श्रेष्ठलार्ई सत्यमोहन जोशी शताब्दी पदक पाए । निकेतनले हालसम्म नेपाललगायत २५ राष्ट्रका २ सय २६ जना महानुभावलाई सत्यमोहन जोशी शताब्दी पदक प्रदान गरिसकेको अध्यक्ष इन्दिरा प्रसाईंले बताइन् । निकेतनकै मोहनकृष्ण सापकोटा र डण्डुराज घिमिरेपनि सम्मानित भए । कार्यक्रममा समालोचक प्राडा वासुदेव त्रिपाठीद्वारा लेखिएको नरेन्द्रराज प्रसार्इंको जीवनीकृति, मेरी आमा भागीरथा प्रसार्इं ः समीक्षात्मक विमर्श, नरेन्द्रराज प्रसार्इं र इन्दिरा प्रसार्इंबाट सम्पादित राष्ट्रकविको सय वर्ष र नरेन्द्रराज प्रसाईंकै शताब्दी पुरुषको सय वर्ष नामक जीवनीकृतिको पनि लोकार्पण गरियो ।"
पद्यावती र भागीरथी एकसाथ,"काठमाडौं (कास) नेपाली आख्यान विधामा पनि कथा लेखनमा अर्थपूर्ण नाम बनाएका पद्यावती सिंह र भागीरथी श्रेष्ठका कथा संग्रह एकसाथ बजारमा आएका छन् । जीवनका जटिलतालाई सहज शैली र भाषामा लेख्न रुचाउने पद्यमावतीका दुई दर्जन कथाको संग्रह प्रतिनिधि कथाहरू हालै रत्न पुस्तक भण्डारबाट प्रकाशित भएको छ । यसअघि कथादि, कथायाम, कथाकार, पद्मावतीका कथाहरू, मौन स्वीकृति, समय दंश लगायत कथा संग्रह प्रकाशित गरिसकेकी पद्यामवतीको नयाँ संग्रहमा धेरैजसो नारी चरित्र र संवेदनाका विषय समेटिएका छन् । यसैगरी, कथा तथा उपन्यास लेखनमा सशक्त नारी हस्ताक्षरका रूपमा चिनिएकी भागीरथीका मालती (उपन्यास), यौटा यस्तो आकाश (उपन्यास), क्रमशः र मोहदंश (कथासंग्रह) प्रकाशित छन् । पछिल्लो कथासंग्रह रातो गुलाफ मा भगीरथीले नवीन शिल्प र विषयका १७ वटा कथा समेटेकी छन् । आख्यान लेखनमा सशक्त रहेका नारी हस्ताक्षरको प्रतिनिधि संकलनमा यस वर्ष पद्यमावती र भागीरथीलाई समेटेका हौं, रत्न पुस्तकका प्रबन्धक गोविन्दप्रसाद श्रेष्ठले भने ।"
किमाथांकामा हेलिकप्टरबाट खाद्यान्न,"संखुवासभा (कास) चीनको सीमावर्ती भोटखोलाको किमाथांकामा सेनाको हेलिकप्टरबाट खाद्यान्न ढुवानी गरिएको छ । भोटखोला गाउँपालिकाले सदरमुकाम खाँदबारीमा किनेर राखेको चामल, नुन र तेललगायतका खाद्य सामग्री शनिबार सेनाको हेलिकप्टरबाट किमाथांका लगिएको हो ।चार हजार २५० किलो चामल, एक हजार ८२ लिटर तेल र २०० किलो नुन लगिएको जिल्ला प्रहरीका डीएसपी मीमबहादुर लामाले बताए । खाद्य सामग्री भोटखोला१ को किमाथांकाका ८६ घरपरिवार, भर्खरै स्थापना गरिएको सशस्त्र प्रहरीको सीमा सुरक्षा पोस्ट, प्रहरी चौकी र स्वास्थ्य चौकीलगायत कार्यालयका कर्मचारीलाई वितरण गरिएको हो । कोरोना भाइरसको महामारीपछि चीनले २० दिनयता किमाथांका नाका बन्द गरेको छ । वारिपारि आउजाउ नै बन्द गरिएपछि किमाथांकामा खाद्यान्न अभाव भएको थियो । संकट टार्न खाद्यान्न किमाथांकामा लगिएको प्रमुख जिल्ला अधिकारी जीवनप्रसाद दुलालले बताए । उनले भने, केही दिनलाई यसले धान्छ, त्यसपछि अर्को विकल्प अपनाउनुपर्छ । हेलिकप्टरबाट लगिएको खाद्यान्न शनिबारै वितरण गरिएको गाउँपालिकाका अध्यक्ष तेम्बा भोटेले बताए । चीनले नाका बन्द गर्नुअघि किमाथांकाका बासिन्दाले पारिको चाँगाबाट उपभोग्य सामग्री ल्याउने गरेका थिए । किमाथांकामा कोदो, मकै र आलुबाहेकका अरू खाद्यान्न उत्पादन हुँदैन ।"
व्यवस्थापनपर्यटक दुवैको कमजोरी,"काठमाडौं (कास) आठ भारतीय पर्यटकको निसासिएर मृत्यु भएको मकवानपुरको दामनस्थित एभरेस्ट पानोरमा रिसोर्ट पर्यटन विभागमा दर्ता नै नभई सञ्चालनमा रहेको खुलेको छ । दक्षिण भारतको केरलाका उनीहरू पोखराबाट घुम्दै माघ ६ गते साँझ उक्त रिसोर्टमा बास बस्न पुगेका थिए । मृत्युको घटनालगत्तै संस्कृति, पर्यटन तथा नागरिक उड्डयन मन्त्रालयले पर्यटन विभागका निर्देशक सुरेन्द्र थापाको संयोजकत्वमा छानबिन गर्न समिति गठन गरेको थियो । १५ दिनको अनुसन्धान कार्यादेश दिइएको उक्त समितिको प्रतिवेदनले घटनामा रिसोर्ट व्यवस्थापन र पर्यटक दुवै पक्षको गल्ती देखाएको छ । रिसोर्ट स्थानीय नगरपालिका, घरेलु कार्यालय, कम्पनी रजिस्ट्रारमा दर्ता भए पनि पर्यटन विभागमा भने दर्ता नभई सञ्चालन भएको पाइयो, विभागका एक उच्च अधिकारीले कान्तिपुरसँग भने । उक्त रिसोर्ट दोस्रो पक्षले सञ्चालन गरिरहेको पनि छानबिनका क्रममा देखिएको छ । पर्यटकस्तरीय रिसोर्ट भइसकेपछि पूर्वाधार हुनुपर्छ तर सामान्य पूर्वाधार पनि व्यवस्थापन गरेको भेटिएन, ती अधिकारीले भने, सारमा व्यवस्थापनको कमजोरी देखिन्छ । प्रतिवेदनले उक्त रिसोर्टको कोठामा धूवाँ, ताप, आगो आदि पहिचान गर्ने स्मोक डिटेक्सनको व्यवस्था पनि नभएको औंल्याएको छ । धूवाँ वा ग्यास हुँदा अलार्म (सूचक घन्टी) लगायतका आपत्कालीन ध्वनि निकाल्ने उपकरण राखिनुपर्ने हो तर त्यहाँ छैन, मन्त्रालयमा बुझाइएको प्रतिवेदनमा उल्लेख गरिएको विवरण उल्लेख गर्दै ती अधिकारीले भने, आतिथ्य व्यवस्थापनमा रिसोर्ट चुकेको देखिन्छ । समितिले मन्त्रालयमा बुझाएको प्रतिवेदन सार्वजनिक हुन भने बाँकी नै छ । उक्त घटनामा मृत्यु हुने भारतीय पर्यटकसँग सुत्ने बेलामा हिटरका लागि झगडा भएको थियो । होटलका प्रतिनिधिले चौरमा आगो ताप्न प्रयोग हुने ग्यास हिटर नै अतिथिले कोठामा जबर्जस्ती लगेको बयान दिएका छन् । यसलाई अतिथिहरूको कमजोरीका रूपमा व्याख्या प्रतिवेदनमा गरिएको छ । रिसोर्टले कोठा व्यवस्थापनमा निगरानी पुर्याउन नसकेको भनिएको छ । १५ जनाको समूहमा रहेका उनीहरूले चारवटा कोठा बुक गरेका थिए तर दुई परिवारका आठ जना एउटै कोठामा सुतेका थिए । मृतकमध्ये चार जना नाबालक थिए । घटनाको छानबिनमा विभागको होटल शाखाका निर्देशक सुरेन्द्र थापाबाहेक स्वास्थ्य तथा जनसंख्या मन्त्रालय, होटल संघ नेपाल, पर्यटक प्रहरी प्रमुख (निरीक्षक) र होटल विभागकै शाखा अधिकृत तिलक रिजाल सदस्य थिए । समितिले एक रात दामनमै बसेर घटनाको अनुसन्धान गरेको थियो । मृतकका आफन्तजन तथा उक्त रिसोर्टमा बसेका मृतकका सहयात्रीहरूसँग भने छलफल नभएको अनुसन्धानमा संलग्न एक सदस्यले बताए ।"
'सन्तोष गर्ने अवस्था छैन',"(काठमाडौं)  आफ्नो सरकार बनेपछि विकास निर्माणका काम नभएको आम टिप्पणीप्रति खरो प्रतिवाद गर्दै आएका प्रधानमन्त्री केपी शर्मा ओलीले आइतबार भने सन्तोष गर्न सकिने अवस्था नरहेको बताएका छन् ।राष्ट्रिय योजना आयोगको ४७औं राष्ट्रिय विकास समस्या समाधान समितिको बैठकलाई सम्बोधन गर्दै ओलीले विकास निर्माणका काम अत्यन्त सुस्त गतिमा भइरहेको प्रतिक्रिया दिए । पहिलो चौमासिक समीक्षाअनुसार, मेरो विचारमा सन्तोष गर्न सकिने अवस्था छैन, बैठकलाई करिब ४ मिनेट मात्रै सम्बोधन गरेका उनले भने, केही उपलब्धि नभएका चाहिँ होइनन् ।विकास निर्माणका काम सुस्त गतिमा भइरहेका कारण पुँजीगत खर्च अत्यन्त न्यून भएको ओलीले बताए । प्रथम चौमासिकको पुँजीगत खर्च ६१ प्रतिशत मात्रै रहेको योजना आयोगले तथ्यांक पेस गरेको थियो । छ महिनामा पुँजीगत खर्च १४ प्रतिशत मात्रै पुगेको छ । यसबारे प्रधानमन्त्री ओलीले बैठकमा उपस्थित मन्त्री, प्रदेशका मुख्यमन्त्री, योजना आयोगका पदाधिकारी र सचिवहरूमाझ असन्तुष्टि जनाए । वैदेशिक लगानीका आयोजनाको काम तीव्र गतिले अघि बढ्न सकेको छैन । आयोजनाहरूमा हामीले ढिला गर्दा त्यसको प्रतिफल ढिलो हुन्छ, उनले भने, हामीलाई जुन गतिका साथ विकासको नतिजा चाहिएको छ, त्यो पकड्न सकेका छैनौं । सरकारका उच्च अधिकारी सबैलाई त्यतातिर ध्यान केन्द्रित गर्न उनले अनुरोध गरे । सबैले व्यवस्थित ढंगले काम गर्नुहुनेछ भन्ने विश्वास लिएको छु, उनले भने । स्वास्थ्यका कारण उनी बैठकको पूरै समय बसेनन् । बैठकमा आयोगका उपाध्यक्ष पुष्पराज कँडेलद्वारा प्रस्तुत प्रतिवेदनअनुसार प्रतिशतका आधारमा यसपटक चार वर्षयताकै सबैभन्दा कम खर्च भएको छ । आव ०७३७४ देखि पछिल्ला तीन वर्षमा क्रमशः १५, १७ र १८५ प्रतिशत कुल बजेट प्रथम चौमासिकमा खर्च भएको थियो । यस वर्ष भने १४७ प्रतिशत मात्रै खर्च भएको विवरण कँडेलले पेस गरे । तथ्यांकअनुसार ८० प्रतिशतभन्दा बढी प्रगति गर्ने आयोजना ८१, ५० देखि ८० प्रतिशत प्रगति गर्ने आयोजना ८५ र ५० प्रतिशतभन्दा कम प्रगति गर्ने आयोजना ७० छन् । प्रगति नै नखुलेका आयोजना भने २१ वटा रहेको आयोगको तथ्यांक छ । राष्ट्रिय गौरवका आयोजनाको प्रगति झन् निराशाजनाक छ । राष्ट्रिय समस्या विकास समाधान समितिको बैठकले गरेका निर्णयसमेत कार्यान्वयन नभएको तथ्यांक कँडेलले पेस गरेका थिए । करिब एक दर्जन निर्णय हुँदा बढीमा २ वटा कार्यान्वयन भएको उनको भनाइ छ । यो तथ्यांकले समग्र सरकारलाई गिज्याउने काम गरिरहेको प्रदेश ५ का मुख्यमन्त्री शंकर पोखरेलले बताए । मुलुकका सबै उच्च तहका अधिकारी सहभागी बैठकमा भएको निर्णय कार्यान्वयन नहुने गरेको भन्दै उनले बैठकको औचित्यमाथि प्रश्न गरे । बैठकमा तीव्र गतिमा काम हुन नसक्नुका दर्जनभन्दा बढी कारण आयोगका उपाध्यक्ष कँडेलले पेस गरे । स्थानीय तहमा राजस्वसँग जानकार कर्मचारीको अभाव, केन्द्र र प्रदेशबीच आयोजनाहरूको विषय अझै अस्पष्ट हुनु, ढुंगा, गिट्टी, बालुवा, जग्गा प्राप्ति, आधुरा आयोजनाहरूमा अन्योल, स्थानीय तहका जनप्रतिनिधिमा क्षमताको अभाव, कानुनी अस्पष्टतालगायत समस्या देखापरेको कँडेलले बताए । यो समस्या सामधान गर्न आधा दर्जन एजेन्डा पेस गर्दै उनले त्यसलाई निर्णय गरेर तत्काल समाधान गर्नुपर्नेमा जोड दिए । ढुंगा, गिट्टी एवं बालुवा खानीको समस्या सामधान गर्न एक उच्चस्तरीय समिति गठन गरी चार महिनाभित्र राष्ट्रिय नीति बनाउनुपर्ने उनको प्रस्ताव छ । आयोगका सदस्यको नेतृत्वमा प्रधानमन्त्री तथा मन्त्रिपरिषद्को कार्यालय, उद्योग वाणिज्य तथा आपूर्ति मन्त्रालय, भूमि व्यवस्था, सहकारी तथा गरिबी निवारण मन्त्रालय, वन तथा वातावरण मन्त्रालय, गृह एवं अर्थ मन्त्रालयका सचिव सम्मिलित समिति हुनुपर्ने प्रस्ताव पेस भएको हो । समितिले ढुंगा, गिट्टी, बालुवा खानीका विषयमा बनाएको नीति मन्त्रिपरिषद्ले पास गरी कार्यान्वयनमा ल्याई विकास निर्माणमा देखिएको समस्या सामधान गर्नुपर्ने कँडेलको प्रस्ताव छ ।"
