शीर्षक,विवरण
'दिलीप नै दोषी',१ एसपी दिल्लीराज बिष्ट (बर्खास्त)२ इन्स्पेक्टर जगदीश भट्ट (बर्खास्त)३ डीएसपी अंगुर जीसी (निलम्बित)४ डीएसपी ज्ञानबहादुर सेटी (निलम्बित)५ इन्स्पेक्टर एकेन्द्र खड्का (निलम्बित)६ सई रामसिंह धामी (निलम्बित)७ सई हरसिंह धामी (निलम्बित)८ जवान चाादनी साउद (निलम्बित)
अबको आईजीपी को ?,"(काठमाडौं)  प्रहरी महानिरीक्षक (आईजीपी) सर्वेन्द्र खनालले ३० वर्षे सेवा अवधिका कारण मंगलबार अनिवार्य अवकाश पाउँदै छन् । तर त्यसको एक दिनअघिसम्म पनि अबको आईजीपी को हुने भन्ने निर्णय सरकारले गर्न सकेको छैन । खनाल २०७४ फागुन २८ मा नेपाल प्रहरीको २६ औं महानिरीक्षक बनेका थिए । सामान्य अवस्था र स्वाभाविक नेतृत्व चयन प्रणालीको विकास भइसकेको अवस्थामा वरिष्ठ एआईजी आईजीपीका हकदार हुन्थे । त्यहीअनुसार एक महिनाअघि नै बहालवाला आईजीपी बिदामा बसेर भावी नेतृत्वमा जिम्मेवारी हस्तान्तरण गर्ने चलन थियो । आफ्नो कार्यकाल बढाउन खनाल र उनका ब्याची लबिइङमा लागेका थिए तर त्यो सम्भव भएन । उनी बिदामा पनि बसेका छैनन् । खनालसँगै १८ डीआईजी र तीन एआईजीले पनि अवकाश पाउँदै छन् । त्यसैले खनालपछि नेतृत्वको दाबेदारमा वरिष्ठ तीन डीआईजी छन् प्रदेश १ का ठाकुर ज्ञवाली, सुदूरपश्चिम प्रदेशका तारिणीप्रसाद लम्साल र प्रहरी प्रधान कार्यालयका सूर्यप्रसाद उपाध्याय । उनीहरूको ३० वर्षे अवधि असार २४ मा सकिनेछ । तीनै जना वरीयतामा क्रमशः १, २ र ३ नम्बरमा छन् । उनीहरू आईजीपी खनालका वैकल्पिक ब्याची हुन् ।उनीहरूपछिको वरिष्ठतामा २०४९ सालमा सेवा प्रवेश गरेका डीआईजीहरू शैलेश थापा, हरिबहादुर पाल, निरजबहादुर शाही, प्रद्युम्नकुमार कार्की र विश्वराज पोखरेल छन् । थापा प्रहरी प्रवक्ता, पाल विशेष ब्युरो, शाही केन्द्रीय अनुसन्धान ब्युरो, कार्की प्रदेश २ प्रहरी प्रमुख र पोखरेल महानगरीय प्रहरी आयुक्त छन् । एआईजी बन्नसमेत डीआईजीहरूको दौड सुरु भइसकेको छ । ज्ञवाली आईजीपी भए उनीपछि एआईजी बन्नेलाई आगामी आईजीपी बन्ने बाटो सहज हुनेछ । तर ज्ञवालीसँगै सेवा प्रवेश गरेका लम्साल र उपाध्यायलाई एआईजी बनाएर २०४९ सालमा सेवा सुरु गरेकामध्येबाट एकलाई एआईजीमा बढुवा गरिए उनलाई आगामी आईजीपीको बाटो झनै सहज हुनेछ । एआईजीको तीन दरबन्दी भए पनि दाबेदार सात जना छन् ।"
७ घटनाको कसीमा आईजीपी खनाल,७ एकेडेमी विस्थापन खनालकै कार्यकालमा राष्ट्रिय प्रहरी प्रशिक्षण प्रतिष्ठान महाराजगन्जबाट हटाउने निर्णय भयो । सरकारले राष्ट्रपति निवास विस्तार गर्न भन्दै गत वर्ष महाराजगन्जबाट प्रतिष्ठान हटाएर काभ्रेमा लैजाने निर्णय गरेको हो । खनालले ६ दशकभन्दा पुरानो तालिम केन्द्र त्यहाँबाट हटाउने सरकारी निर्णय निरीह बनेर स्विकारे । उनीअघिका आईजीपीहरूले प्रतिष्ठान हटाउन नहुने भन्दै सरकारलाई बुझाउन सकेका थिए ।
राष्ट्र बैंकले कार्यविधि बनाउँदै,"विदेशी विनिमय अपचलन हुने गरी कसैले त्यसरी कारोबार गरेको पाइए विदेशी विनिमय ऐन र प्रचलित कानुनबमोजिम कारबाही गर्ने राष्ट्र बैंकले चेतावनी दिएको छ । विदेशी विनिमय ऐनमा सरकारी निकायको अनुमति नलिई गरेको विनिमयको कारोबार जफत र बिगोको तीन गुणासम्म जरिवाना गर्न सक्ने व्यवस्था छ । बिगो नखुल्ने कारोबार भए कसुरको मात्रा हेरी दुई लाखसम्म जरिवाना गर्न सक्ने व्यवस्था उक्त ऐनमा छ । सामाजिक सञ्जालमा रकम भुक्तानी गर्न व्यवस्थित पेमेन्ट गेटवे नभएकाले प्रायः विज्ञापनदाताले अनौपचारिक माध्यमबाट भुक्तानी गर्दै आएका छन् । पछिल्लो निर्देशनपछि फेसबुक, युट्युबजस्ता सामाजिक सञ्जालमा भिडियो बनाएर आम्दानी गर्दै आएका नेपालीले पनि बैंकिङ प्रणालीमार्फत रकम लिनुपर्नेछ । त्यस्ता भिडियोमा विज्ञापन राखेबापत युट्युबले निश्चित प्रतिशत भिडियो निर्मातालाई उपलब्ध गराउँछ । उक्त रकम प्रायःले विदेशमा रहेका आफन्त तथा साथीभाइको खातामा जम्मा गर्ने र अनौपचारिक माध्यमबाट नेपाल भित्र्याउने गरेको गुनासो आएकाले सूचना जारी गरिएको राष्ट्र बैंकका विदेशी विनिमय व्यवस्थापन विभाग प्रमुख मिश्रले बताए । सूचना प्रविधिमा काम गर्ने नेपाली युवाले स्वदेशमै बसेर दिनहुँजसो ठूलो रकम पाउँदा रहेछन्, उनले भने, त्यो रकम बैंकिङ प्रणालीबाट आउँदैन । नेपालका नियामक निकायसँग अनुमति लिई औपचारिक माध्यमबाट सामाजिक सञ्जालमा विज्ञापनबापतको रकम भुक्तानी गर्नेको संख्या निकै कम छ ।"
घानामा दुई नेपाली अलपत्र,"काठमाडौं (कास) अफ्रिकी एक तेल कम्पनीमा काम गर्ने भन्दै गएका दुई नेपाली घानामा अलपत्र परेका छन् । गौशालास्थित एक म्यानपावर कम्पनीलाई जनही १२ लाख रुपैयाँ बुझाएर एक महिनाअघि घाना पुगेका उनीहरू भनिएको कम्पनी र काम नभेटेर अलपत्र परेका हुन् ।गौशालास्थित सनराइज म्यानपावरले घानामा रहेको अमेरिकी तेल कम्पनी आर्कोमेटका बारेमा जानकारी गराएको र मासिक १५ सय ७० अमेरिकी डलर तलब हुन्छ भनेपछि म्यानपावर एजेन्ट अमर पाण्डेलाई पैसा बुझाएकोबारे पीडितले घानास्थित गैरआवासीय नेपाली संघलाई जानकारी गराएका छन् । सिन्धुपाल्चोकका ३१ वर्षीय रेशम श्रेष्ठ र मोरङका ३२ वर्षीय सुमन भण्डारी गत एक महिनायता कागजातविहीन अवस्थामा रहेको घानास्थित गैरआवासीय नेपाली संघका अध्यक्ष रोशन श्रेष्ठले बताए । अध्यक्ष श्रेष्ठले पीडित नेपालीको स्थितिबारे श्रम तथा रोजगार मन्त्रालय र सम्बद्ध सरोकार निकायमा जानकारी गराइसकेका छन् । दुवैजना अहिले घानाको टाकोरादीमा अलपत्र छन्, श्रेष्ठले भने, जानकारीमा आएअनुसार त्यही सनराइज म्यानपावरबाट फेरि यो साता थप १२ नेपालीलाई घाना ल्याइन लागेको रहेछ । यो मानव तस्करीको स्थितिलाई तत्काल रोक्न श्रम मन्त्रालय र वैदेशिक रोजगार विभागलाई अनुरोध गरेका छौं ।विगतमा पनि चार जना नेपालीलाई यही म्यानपावरले घाना ल्याएर अलपत्र पारेको र मुस्किलको प्रबन्धबाट घर फिर्ता गरिएको जानकारी उनले दिए । पश्चिम अफ्रिकी मुलुक घानामा कुनै पनि प्रयोजनमा आउनुपरेमा गैरआवासीय नेपाली संघ घानाको आधिकारिक सहमतिपत्र बोकेर मात्रै आउनका लागि पनि अध्यक्ष श्रेष्ठले अनुरोध गरेका छन् । घानामा हाल ४५ जना नेपाली रहेको र सबै जना सुरक्षित एवं मर्यादित काममा संलग्न रहेको जानकारी दिँदै श्रेष्ठले म्यानपावर र एजेन्टको मात्रै भर परेर अफ्रिकी मुलुकमा नआउनका लागि अनुरोध गरेका छन् ।अहिले हामी टाकोरादीस्थित अध्यागमन कार्यालयमा बसेका छौं तर आफूसँग पासपोर्ट नभएकाले घर फर्कन कठिनाइ भएको अवस्था छ, अलपत्र अवस्थामा रहेका रेशम र सुमनले गैरआवासीय नेपाली संघमार्फत उद्धार समन्वयका लागि पत्र लेख्दै भनेका छन्, नेपालको एजेन्टले आफैं टिकट काटेर घर आउनु भनेको छ, तर हामी टिकट न पासपोर्टको अवस्थामा छौं ।अफ्रिकी मुलुकमा रहेका नेपालीमाझ आइपर्ने सहयोगसमन्वयमा जुटेका नाइजेरियास्थित हिक्मत थापाले नेपाली सोझासाझा युवायुवतीलाई वैदेशिक रोजगारीका नाममा अलपत्र बनाउन पछिल्ला वर्षहरूमा अफ्रिकी रुटलाई उपयोग गर्न थालिएको बताए । हामीले विगतमा केन्यातान्जानियाका डान्स बारमा नेपाली युवतीलाई मुजुरा नृत्य गर्न ल्याइने गरेकोबारे नेपाल सरकारको ध्यानाकर्षण गराएका थियौं तर यसबारेमा न फलोअप भयो, न रोकथाम हुन सकेको छ, थापाले भने, भिजिट भिसामा युवायुवती ल्याएर अनधिकृत काममा लगाउने प्रवृत्ति यथावत् देखिएको छ । त्योभन्दा पनि मानव तस्करीको नयाँ रुटका रूपमा अफ्रिकी मुलुकलाई उपयोग गर्न थालिएकामा थप चिन्ता बढेको छ ।"
चीनमा रहेका विद्यार्थीको अझै उद्धार भएन,"(काठमाडौं)  चीनको हुबेई प्रान्तको वुहान सहरबाट फैलिएको कोरोना भाइरसका कारण मानिसको मृत्यु हुन थालेपछि विभिन्न मुलुकले चीनबाट आफ्ना नागरिकलाई उद्धार गरिसकेका छन् । २० दिन बित्दा पनि नेपालले भने आफ्ना नागरिकलाई उद्धार गर्न सकेको छैन ।संक्रमण पहिचान भएको ११ औं दिन (माघ १७) मा भारतले एयर इन्डिया पठाएर आफ्ना नागरिकलाई फर्काएको थियो । त्यसको अघि र पछि गरेर अमेरिका, जापान, टर्की, इजिप्ट, अस्ट्रेलिया, न्युजिल्यान्डलगायतका दर्जनौं मुलुकले उद्धार गरिसकेका छन् । सरकारका एक उच्च अधिकारीका अनुसार नेपालीलाई उद्धार गर्न अझै एक साताभन्दा बढी लाग्छ । चीनमा रहेका नेपालीले उद्धारका लागि बेइजिङस्थित नेपाली दूतावाससँग र हुबेईमा रहेका नेपालीका आफन्तले स्वास्थ्य मन्त्रालयसँग आग्रह गरिरहेका छन् । सरकारले आफ्ना नागरिकलाई कहिले र कसरी ल्याउने भन्ने ठोस निर्णय गर्न सकेको छैन । सबैले भनेजस्तो सहजै नेपाली नागरिकलाई उद्धार गरेर ल्याउन सकिन्न, यसका लागि विभिन्न पक्षलाई हेर्नुपर्ने हुन्छ, ती अधिकारीले भने । चीनबाट ल्याएर क्वारेन्टाइन (आइसोलेसनमा राख्ने) मा राख्ने स्थल तय गरे पनि त्यसको ठोस निर्णय बाहिर नआउँदा र उद्धार गर्न नसक्दा सरकारको आलोचना भइरहेको छ । वुहानमा रहेका १८५ नेपालीले फर्कने इच्छा देखाउँदै बेइजिङस्थित दूतावासमा आवेदन दिएका छन् । कोरोना भाइरसका कारण चीन, अमेरिका र जापानका गरी ८१३ जनाको मृत्यु भइसकेको छ भने कम्तीमा ३७ हजार ५५२ जनामा संक्रमण भेटिएको छ । रोकथाम तथा नियन्त्रणका उपाय खोज्न र चीनबाट उद्धार गरी ल्याइने नेपालीलाई क्वारेन्टाइनमा राख्ने स्थानको सुरक्षाबारे छलफल गर्न आइतबार मुख्यसचिव लोकदर्शन रेग्मीको संयोजकत्वमा विभिन्न मन्त्रालयका सचिव तथा उच्च सुरक्षा अधिकारीहरूबीच छलफल भएको थियो । स्वास्थ्यसचिव खगराज बराल, गृहसचिव महेश्वर न्यौपाने, रक्षासचिव रेश्मीराज पाण्डे, उपरथी प्रभुराम शर्मालगायतको छलफलबाट कुनै ठोस निर्णय भने निस्किएन ।सरकारले अहिलेसम्म क्वारेन्टाइनका लागि चारवटा स्थान छनोट गरेको छ खरिपाटीस्थित विद्युत् प्राधिकरणको तालिम केन्द्र, सूर्य विनायकस्थित सैनिक क्षेत्र, इचंगुनारायण र शिवपुरी । तीमध्ये पनि उद्धार गरिएका नेपालीलाई कुनमा राख्ने भन्ने तोकिएको छैन ।सरकारका एक उच्च अधिकारीले चीनबाट नेपालीलाई उद्धार गर्न अन्य मुलुकलाई जस्तो नेपाललाई सहज नभएको बताए । ती अधिकारीले भने, चीनमा रहेका नेपालीलाई ल्याउन सहज छैन । नेपाल एयरलाइन्सबाट नेपालीलाई उद्धार गरेपछि पाइलटसहित सम्फूर्ण त्रुका सदस्यलाई समेत कम्तीमा १४ दिन क्वारेन्टाइनमा राख्नुपर्ने हुन्छ । यसले गर्दा नेपाल एयरलाइन्सलाई पाइलटलगायत जनशक्तिको समस्या पनि पर्न सक्छ ।ती अधिकारीका अनुसार नेपालले उद्धार कार्य अघि बढाउँदा सबैभन्दा पहिले विश्व स्वास्थ्य संगठनको सम्पूर्ण प्रक्रिया पूरा गर्नुपर्छ । नेपालमा एक हजार बिरामी अट्ने छुट्टै अस्पताल भएको भए ठिक हुन्थ्यो, त्यो नभएकाले अन्य स्थान हेरिरहेका हौं, उनले भने । ती अधिकारीले सम्पूर्ण प्रक्रिया नपुर्याई नेपालीलाई फर्काउने तयारी गरिए सबैभन्दा पहिला चीनले नमान्ने र पूर्णरूपमा व्यवस्थित क्वारेन्टाइन नभई उद्धार गर्दा विदेशीले समेत नेपाल भ्रमण नगर्ने बताए । भ्रमणका लागि नेपाल अन्य मुलुकको कालोसूचीमा पर्न सक्छ, उनले भने ।"
नेपालीलाई तत्काल उद्धार गर्न निर्देशन,"राष्ट्रिय मानव अधिकार आयोगले चीनको हुबेई प्राप्तमा रहेका नेपालीलाई तत्काल उद्धार गर्न सरकारलाई निर्देशन दिएको छ । आयोगको आइतबार बसेको आकस्मिक बैठकले आफ्ना नागरिकहरूलाई शीघ्र सुरक्षित रूपमा स्वदेश फर्कने वातावरण मिलाउन निर्देशन दिने निर्णय गरेको आयोगद्वारा जारी विज्ञप्तिमा छ ।आयोगले हुबेईमा रहेका सबै नेपाली नागरिकको स्वास्थ्य अवस्थाको जानकारी र स्वदेश फिर्ता गर्ने सम्बन्धमा सरकारका सम्बन्धित मन्त्रालयहरूले गरेको कामकारबाहीको सन्दर्भमा आवश्यक जानकारी लिन परराष्ट्र, शिक्षा र स्वास्थ्य मन्त्रालयका सचिवहरूलाई आयोगमा बोलाउने निर्णयसमेत गरेको छ ।"
