शीर्षक,विवरण
वाम तालमेल सकारात्मक : मोहनविक्रम सिंह,"गैंडाकोट (नवलपरासी) : नेपाल कम्युनिस्ट पार्टी (मसाल)का महामन्त्री मोहनविक्रम सिंहले वामपन्थी तालमेललाई एकीकृत कम्युनिस्ट स्वरूप मान्न नसकिने बताएका छन् । एमाले, माओवादी केन्द्र र नयाँ शक्तिबीचको एकता एकीकृत कम्युनिस्ट पार्टी निर्माणको कदम भने पनि त्यस्तो नभएको उनको भनाइ छ । नवलपरासीको गैंडाकोटमा आयोजित पत्रकार सम्मेलनमा उनले छरिएर रहेका कम्युनिस्ट पार्टीबीचको दूरी मात्र कम भएको बताए । यद्यपि, उनले चुनावी एकता भए सकारात्मक रहेको टिप्पणी गरे । क्रान्तिकारी कम्युनिस्टवादी सिद्धान्तबाट विचलित भएका शक्तिबाट एकीकृत कम्युनिस्ट पार्टी बन्छ भन्ने विश्वास छैन, उनले भने, छरिएर रहेका माक्र्सवादी र लेनिनवादीहरूबीच अलिकति भए पनि दूरी घटेकोे छ, कम्युनिस्ट पार्टी निर्माणको कदम भने होइन । भारतको चलखेलका कारण वामपन्थी दलहरूबीच फाटो आएको उनको भनाइ थियो । उनले राष्ट्रिय जनमोर्चाले निर्वाचनमा भाग लिने बताए । निर्वाचनमा कोसँग तालमेल गर्ने भन्ने विषयमा छलफल नभएको उनको भनाइ थियो । हामीले जित्दैनौं भन्ने थाहा छ तर निर्वाचन हाम्रो लागि संघर्षको माध्यम हो, उनले भने, संघीयताको विरोध भए पनि संविधानअनुसार पालना गरेका हौं ।"
इलाममा एमालेका चार उम्मेदवार सर्वसम्मत,"इलामः एमाले इलामले प्रतिनिधि सभाका दुई र प्रदेश सभाका दुई निर्वाचन क्षेत्रमा सर्वसम्मत उम्मेद्वार सिफारिस गरेको छ भने बढी आकांक्षी रहेको दुई प्रदेश क्षेत्रका लागि रायसहित उम्मेद्वार सिफारिस गरेको छ। जिल्ला कार्य समितिको बैठकले प्रतिनिधि सभाका लागि निर्वाचन क्षेत्र नम्बर १ बाट पूर्व प्रधानमन्त्री एवम् नेकपा एमालेका वरिष्ठ नेता झलनाथ खनाल र क्षेत्र नम्बर २ का लागि नेता सुवासचन्द्र नेम्बाङलाई सर्वसम्मत उम्मेद्धार सिफारिस गरेको उपसचिव उमेश गुरुङले जानकारी दिए। एमालेले निर्वाचन क्षेत्र नम्बर १ को प्रदेश क्षेत्र नम्बर १ मा सात जनाको नाममा भक्त केशी, उमेश गुरुङ, कृष्ण श्रेष्ठ, खिनु ल्वागुन, सिखरनाथ सापकोटा, जेवी लुगेली र याम अधिकारी सिफारिसमा परेका छन्। क्षेत्रीय स्तरमा उम्मेद्वार छनोटका लागि भएको मतदानमा मतपत्र च्याताच्यात भएपछि न्यायी कमिटीमा परेको उजुरीलाई ध्यानमा राख्दै सबै आकांक्षीको नाम प्रदेशमा पठाएको एमालेले जनाएको छ। एमालेले क्षेत्र नम्बर १ कै २ नम्बर क्षेत्रमा भने काजीमान कागतेको नाम सर्वसहमत रुपमा सिफारिस गरेको छ। प्रतिनिधि सभा निर्वाचन क्षेत्र नम्बर २ को प्रदेश क्षेत्र १ मा राम रानाको नाम सर्वसहमत रुपमा सिफारिस गरेको छ भने क्षेत्र नम्बर २ मा तीन जनाको नाम सिफारिस गरेको छ । क्षेत्र नम्बर २ का लागि ओमनारायण खनाल, जयप्रकाश राई र रिप्पल राईको नाम सिफारीस गरेको उपसचिव गुरुङले बताए। जिल्लाले पठाएको सिफारिसलाई आइतबार बस्ने प्रदेश कमिटिको बैठकले राय सुझावसहित स्थायी समितिमा पठाउने उनले बताए। सबै प्रदेशबाट गएका नामावलीलार्ई २६ र २७ गते बस्ने स्थायी कमिटिको बैठकले टुंगो लगाउने एमालेले जनाएको छ। एमालेले समानुपातीकमा १३ जनाको नाम सिफारिस गरेको छ। एमालेले माओवादी केन्द्रलाई समानुपातीकमा मात्र इलाममा ठाउ दिन समेत सुझाव पठाएको छ। माओवादीले स्थानीय तह र संविधान सभामा पाएको मतको आधारमा पनि ठूलो भाग दिए राम्रो परिणाम नआउने एमालेले सुझाव पठाएको छ।"
ध्रुवीकरणभन्दा सबै पार्टीबीच सहकार्य आवश्यकः अध्यक्ष राणा,"काठमाडौँ: राष्ट्रिय प्रजातन्त्र पार्टी (प्रजातान्त्रिक) का अध्यक्ष पशुपति शम्शेर जबराले नेपालमा वामपन्थी र प्रजातन्त्रवादी शक्तिबीचको धु्रवीकरणभन्दा पनि संघीय गणतन्त्र तथा शिशु संविधानलाई संस्थागत गर्न सबै पार्टीबीच सहकार्य आवश्यक भएको बताएका छन्। रिपोर्टर्स क्लबमा आज आयोजित साक्षात्कारमा राणाले वामपन्थी शक्तिहरुले गठबन्धन गरेपछि प्रजातन्त्रवादी शक्तिको गठबन्धनमा आफ्नो पार्टी सहभागी भइसकेको, तर लोकतन्त्रवादीको गठबन्धन कसैप्रति लक्षित नभएको बतए। लोकतन्त्रवादी र वामपन्थीहरुको गठबन्धनबाट मुलुकलाई स्थिरतातर्फ लैजाने विश्वास व्यक्त गर्दै नेता राणाले यसले नै मुलुकमा दीर्घकालीन योजना तयार गर्नुका साथै विकास र समृद्धि गर्ने मौका पाइने बताए।"
सिरहा क्षेत्र नम्बर १ बाट एमाले अध्यक्ष ओलीको नाम सिफारिस,"सिरहा : सिरहा प्रतिनिधिसभा निर्वाचन क्षेत्र नम्बर १ बाट नेकपा एमाले अध्यक्ष केपी शर्मा ओलीको नाम सिफारिस भएको छ । शुक्रवार साँझ बसेको क्षेत्रीय कमितिको बैठकबाट सर्वसम्मत रुपमा अध्यक्ष ओलीको नाम सिफारिस भएको क्षेत्रीय अध्यक्ष रामदयाल यादबले जानकारी दिए। प्रतिनिधिसभाको लागि चार निर्वाचन क्षेत्र कायम भएको सिरहाका अन्य तीन क्षेत्रमा भने उम्मेवारको सिफारिस हुन सकेको छैन । एमाले जिल्ला अध्यक्ष प्रमोद यादबले प्रतिनिधिसभाको तीन क्षेत्रबाट उम्मेदवारको नाम टुंगो लगाउन अझै छलफल जारी रहेको बताए । उनले भने,आजसम्ममा सबै क्षेत्रबाट उम्मेवारको नाम सिफारिस भएर जिल्लामा आउँछ । त्यसपछि जिल्लाले केन्द्रमा पठाउँछ ।' सिरहा निर्वाचन क्षेत्र नम्बर १ मा मधेस आन्दोलनको उद्गम स्थल लहान पनि पर्छ । पहिलो मधेस आन्दोलनपछि लहानसहितका ठाउँ पर्ने सिरहा क्षेत्र नम्बर १ बाट तत्कालीन मधेसी जनअधिकार फोरम नेपालबाट लक्ष्मण मेहता पहिलो संविधानसभाको निर्वाचनमा निर्वाचित भएका थिए । दोस्रो संविधानसभा चुनावमा भने काँग्रेसबाट पद्मनारायण चौधरी निर्वाचित भए । अहिले स्थानीय तहको निर्वाचन हुँदा लहानको मेयरमा एमालेका मुनी साह निर्वाचित भएका छन् । नयाँ संरचना अनुसार कायम भएको सिरहा निर्वाचन क्षेत्र नम्बर १ मा लहान नपा, सखुवा ननकारकट्टी गापा, भगवानपुर गापा, नवराजपुर गापा, धनगढी नपाका केही वडा, लक्ष्मीपुर पतारी गापाको केही वडा पर्छ । यी ठाउँमध्ये एमाले लहान नगर र सखुवाननकारकट्टी गाउँपालिका कब्जा गरेको छ । भगवानपुर, नवराजपुर, धनगढी र लक्ष्मीपुर पतारीमा पनि यो निर्वाचनमा एमालेले बलियो नै देखियो । सिरहा क्षेत्र नम्बर १ मा एमाले बलियो देखिएकोले अध्यक्ष ओलीको जित सुनिश्चित भइसकेको स्थानीय नेताहरुले दावी गरेका छन् ।"
एमाले रुकुमले पूर्व र पश्चिम क्षेत्रका उम्मेदवारको सिफरिस गर्यो,"रुकुम : नेकपा एमाले पश्चिम रुकुम र पूर्व रुकुम गरी दुवै जिल्लाले आसन्न राष्ट्रिय सभा र प्रदेश सभाको निर्वाचनका लागि उम्मेदवारको सिफारिस गरेका छन्। पुर्व र पश्चिम रुकुम कमिटीले छुटछुटै बैठक गरी आआफ्नो क्षेत्रका आकांक्षी उम्मेदवारहरुको सुची तयार गरी माथिल्नो कमिटीलाई सिफारिस गरी पठाएका हुन्। शुक्रबार बसेको एमाले पश्चिम रुकुमको बैठकले समानुपातिकमा तीन र प्रत्यक्षमा तीन जना गरी जम्मा छ जनाको नाम सिफारिस हुनुपर्नेमा आकांक्षीको संख्या धेरै भएका कारण प्रत्यक्षमा नौ र समानुपातिकमा ११ जना गरी जम्मा २० जनाको नाम सिफरिस गरी पठाएको एमाले रुकुमका नेता गणेश खड्काले बताए। नेता खड्काका अनुसार पश्चिम रुकुमबाट प्रतिनिधिसभाका लागि प्रत्यक्षतर्फ सिफारिस हुनेमा नारायण शाह, नन्दराम देवकोटा र विद्यापति रिजाल रहेका छन् भने समानुपातिक तर्फ तिर्था गौतम, विमल पुन, सुरज परियार र गणेश केसीको नाम सिफारिसमा परेको छ। एमाले पश्चिम रुकुमले प्रदेश सभाका लागि निर्वाचन क्षेत्र नं १ बाट ठगेन्द्र प्रकाश पुरी, माधव गौतम र डिला शाहीको नाम सिफरिस गरी पठाएको छ भने समानुपातिक तर्फ गणेश केसी, देवी ओली र चन्द्रबहादुर विकको नाम सिफारिसमा गरेको छ। त्यस्तै प्रदेश सभाकै लागि निर्वाचन क्षेत्र नं २ बाट प्रत्यक्षतर्फ धनराज खड्का, पुस्तक चन्द र टेका रानाको नाम सिफरिस गरेको छ भने समानुपातिकतर्फ ऋषी शर्मा र कल्पना खड्का, खड्क परियार र मानविर घर्तीको नाम सिफरिस गरेको छ। त्यस्तै उता एमाले पूर्व रुकुम जिल्ला कमिटीले पनि आसन्न प्रतिनिधिसभा र प्रदेश सभाका लागि आकांक्षी उम्मेदवारको सूची तयार गरी सिफारिस गरेको जनाएको छ। सदरमुकाम रुकुमकोटमा बसेको जिल्ला कमिटी बैठकले प्रत्यक्ष र समानुपातिक तर्फ गरी जम्मा १२ जनाको नाम सिफारिस गरेको हो। जिल्ला कमिटी संयोजक सतमान पुन मगरका अनुसार टोपबहादुर ओली, मोहन केसी र नुमेन्द्रा खड्काको नाम प्रतिनिधिसभाका लागि प्रत्यक्षतर्फ सिफारिस गरिएको छ भने समानुपातिक तर्फ खेममान खड्का, नन्दलाल शर्मा र राजिमाया पुनको नाम सिफरिसमा परेको छ। पूर्व रुकुमबाट निर्वाचन क्षेत्र नम्वर १ को प्रदेश सभाका लागि प्रत्यक्षतर्फ लक्ष्मीप्रसाद पुन मगरको नाम मात्रै सिफारिस गरिएको छ भने समानुपातिकमा सतमान पुन, आशा स्वर्णकार र मस्त समालको नाम सिफारिस गरेको छ। त्यस्तै निर्वाचन क्षेत्र नं २ बाट प्रदेशसभाका लागि प्रत्यक्षतर्फ टीकाराम उपाध्याय र समानुपातिकतर्फ फत्ते ओलीको नाम सिफरिस गरी पठाएको छ। नेकपा माओवालीसँग चुनावी तालमेल गर्ने जनाइसकेको एमालेले सिफरिस गरेका प्रत्यक्ष तर्फका उम्मेदवारहरुले तालमेल पश्चात नाम तलमाथी पर्दा पनी आफूहरुले साझा उम्मेदवारलाई सघाउने जनाएका छन्। यसकारण पनि एमाले रुकुमममा समानुपातिक तर्फका आकांक्षीहरुको संख्या प्रत्यक्ष भन्दा धेरै रहेको पाइएको छ। एमाले बाहेक जिल्लामा रहेका नेपाली कांग्रेस र नेकपा माओवादी केन्द्रले भने यस अघि नै आकांक्षी उम्मेदवारहरुको नाम सिफारिस गरी पठाइसकेका छन्।"
