शीर्षक,विवरण
भक्तपुर कांग्रेसद्वारा उम्मेदवारमा २३ को नाम सिफारिस,"भक्तपुर : नेपाली कांग्रेस भक्तपुरले प्रतिनिधिसभा तथा प्रदेशसभाका लागि २३ नेताहरुको नाम उम्मेदवारमा सिफारिस गरेको छ । दुई क्षेत्र र चार प्रदेश क्षेत्र गरी ६ जना उम्मेदवारका लागि कांग्रेसले २३ जना नेताहरुको नाम उम्मेदवारमा सिफारिस गरेको हो । कांग्रेस भक्तपुरका जिल्ला सभापति दुर्लभ थापाले प्रतिनिधिसभाका लागि दुई क्षेत्रबाट तीनतीन जना नेताहरुको नाम सिफारिस गरिएको जानकारी दिए । चार वटा प्रदेश क्षेत्रका लागि भने तीनवटाबाट ३३ र एउटाबाट ८ जनाको नाम सिफारिस गरिएको उनले बताए । उनका अनुसार क्षेत्रीय समितिबाट सिफारिस भएर आएकै नाउँमा केही सच्याएर केन्द्रमा सिफारिस गरिएको छ । भक्तपुर निर्वाचन क्षेत्र नं १ का लागि वरिष्ठ अधिवक्ता बाबुराजा जोशी, यादवप्रसाद अधिकारी र नवराज दाहालको नाम सिफारिस गरिएको छ । जसमध्ये वरिष्ठ अधिवक्ता जोशीले टिकट पाउने प्रवल सम्भावना रहेको कांग्रेस वृत्तमा चर्चा छ । निर्वाचन क्षेत्र नं १ मा भक्तपुर नगरपालिका र चाँगुनारायण नगरपालिका परेका छन् । निर्वाचन क्षेत्र नं १ मा परेका दुई प्रदेशमध्ये १ मा क्षेत्रीय सभापति जीवन खत्रीसहित आठ जनाको नाम सिफारिस गरिएको छ । उक्त प्रदेशमा सिंगो चाँगुनारायण नपा र भक्तपुर नपाको वडा नं १० का मतदाताले मतदान गर्नेछन् । उक्त प्रदेशमा खत्रीसँगै प्रवीण बन, कृष्णलाल भडेंल, किरण न्यौपाने, सुरेश श्रेष्ठ, धर्मराज थापामगर, मनोजकुमार थापा र यज्ञविक्रम थापाको नाम केन्द्रमा सिफारिस गरिएको जिल्ला सदस्य रवीन्द्र प्रधानले जानकारी दिए । यस प्रदेशमा क्षेत्रीय सभापति खत्रीले टिकट पाउने निश्चित जस्तै भएको बताइएको छ । भक्तपुर नपाको १ देखि ९ वडासम्मका मतदाताहरुले मतदान गर्ने दोस्रो प्रदेशका लागि रवीन्द्र प्रधान, नारायणप्रसाद तमखु र अनिल भुजूको नाम सिफारिस गरिएको छ । यस प्रदेशमा कांग्रेस भक्तपुरको नगर सभापति रहिसकेका प्रधानको सम्भावना बढी छ । त्यस्तै भक्तपुर निर्वाचन क्षेत्र २ को लागि भने वर्तमान सांसद रामेश्वरप्रसाद ढुंगेलसँगै जिल्ला सभापति दुर्लभ थापा र वरिष्ठ पत्रकार कविर राणाको नाम सिफारिस गरिएको छ । यहाँ जिल्ला सभापति थापा र वरिष्ठ पत्रकार राणाले टिकट पाउने प्रवल सम्भावना छ । कांग्रेसभित्रको गुटबन्दी मिलाउनुपर्ने भएकाले प्रदेशमा टिकट पाउने नेताको आधारमा कांग्रेसले जित्ने भक्तपुर क्षेत्र नं २ मा थापा र राणामध्ये एकले टिकट पाउने कांग्रेस नेताहरु बताउँछन् । उक्त निर्वाचन क्षेत्रअन्तर्गत मध्यपुर थिमि नपा र सूर्यविनायक नपा पर्छन् । जसमध्ये सिंगो मध्यपुर थिमि नगरपालिका परेको प्रदेशसभाको लागि निवर्तमान जिल्ला सभापति गणेशमान चक्रधर, मदनकृष्ण श्रेष्ठ र नगर सभापति सुरेन्द्र श्रेष्ठको नामलाई जिल्ला समितिले टुंग्याएर केन्द्रमा पठाएको छ । त्यस्तै सिंगो सूर्यविनायक नगरपालिका रहेको अर्को प्रदेशसभाका लागि क्षेत्रीय सभापति नारायणभक्त खायमलीसँगै सुशील बस्नेत र उद्धव सिलवालको नाम सिफारिस गरिएको छ । एमालेले तोक्यो संयोजक यता एमाले भक्तपुरले भने प्रतिनिधिसभा र प्रदेशसभाको लागि उम्मेदवार छनोट गर्न संयोजक तोकेको छ । एमाले भक्तपुरको मंगलबार बसेको बैठकले ६ जना संयोजक तोकेको जिल्ला अध्यक्ष राजेन्द्र राजथलाले जानकारी दिए । उनका अनुसार हरिशरण लामिछाने र बचन देउजालाई क्रमशः भक्तपुर निर्वाचन क्षेत्र नं १ र २ को संयोजक तोकिएको छ । प्रदेशसभाको लागि भक्तपुर नपाको लागि बालमुकुन्द सुवाल, मध्यपुर थिमि नपाको लागि नगर प्रमुख मदनसुन्दर श्रेष्ठ, चाँगुनारायण नपाको लागि मोहनवीर श्रेष्ठ र सूर्यविनायक नपाको लागि नगर प्रमुख वासुदेव थापालाई संयोजक तोकिएको छ । संयोजकहरुलाई असोज १९ गतेभित्र महिलासहित तीनजनाको नाम सिफारिस गर्ने समयावधि दिएका छौं, जिल्ला अध्यक्ष राजथलाले भने, उहाँहरुबाट सिफारिस भएर आएका नाम नकाटिकन आवश्यक परे थपेर असोज २० गतेभित्र प्रत्यक्ष र समानुपातिक उम्मेदवारहरुको नाम केन्द्रमा पठाउँछौं ।उनले माओवादी केन्द्रसँग पार्टी एकताको प्रयास भइरहेकाले भक्तपुर एमालेले गरेको निर्णयमा फेरबदल पनि हुनसक्ने बताए । माओवादीसँगै अन्य दल छलफलमै त्यस्तै भक्तपुरमा माओवादी केन्द्र, नेपाल मजदुर किसान पार्टी, राप्रपालगायतका अन्य पार्टी भने छलफलमै रहेको छ । माओवादी केन्द्र भक्तपुरका नेता सुनिल गोथेले एमालेसँग पार्टी एकताको बहस अघि बढेकाले तत्काल नाम टुंग्याउने भन्दा सम्भावित उम्मेदवारहरुको बारेमा पार्टी छलफलमा रहेको बताए। उनले एमालेसँग एकता भए पनि नभए पनि माओवादी केन्द्रको तर्फबाट आफ्ना उम्मेदवारहरुको टुंगो लगाइने जानकारी दिए ।"
जुम्लाका नेताले यसरी गरे तालमेलको स्वागत,"जुम्ला : केन्द्रमा तीन पार्टीबीचमा एकताको प्रयास र तालमेलको सहमति भएसँगै जिल्लामा पनि यसको प्रत्यक्ष प्रभाव परेको छ । तीन दलको उक्त निर्णय देशको राजनीतिक परिवर्तनका लागि ऐतिहासिक निर्णय भएको भन्दै जिल्लास्थित नेकपा एमाले, माओवादी केन्द्र र नयाँ शक्ति नेपालले स्वागत गरेका छन्। दलहरुले बुधवार जुम्लामा पत्रकार सम्मेलन गर्दै पार्टी नेतृत्वले गरेको ऐतिहासिक एकताको निर्णय स्वागत योग्य रहेको र यथासीघ्र कार्यान्वयन गर्ने बिषयमा प्रतिबद्धता जनाएका छन् । मंगलबार नेकपा एमाले, माओवादी केन्द्र र नयाँ शक्तिको हस्ताक्षरमा भएको ६ बुद्धे सहमति बारे जानकारी दिन एमाले पार्टी कार्यालयमा ३ दलले संयुक्त पत्रकार सम्मेलन आयोजना गरी केन्द्रको निर्णय र निर्देशन जिल्लामा प्रभावकारी रुपमा कार्यान्वयन गरिने बताएका छन् । एकाएक एकताको प्रयासमा वामपन्थी पार्टीहरु पुगेपछि जुम्लामा तीनै दलको सहमतिमा दलका नेता कार्यकर्ता तथा जनतालाई यो एकताको स्वागत गर्न समेत आह्वान गरेका छन् । माओवादी केन्द्र जुम्ला संयोजक वीरबहादुर कुँवर, एमाले अध्यक्ष तिर्थ बुढा र नयाँ शक्ति नेपालका जिल्ला ईन्चार्ज नरेन्द्रनाथ योगीद्धारा संयुक्त हस्ताक्षरित विज्ञप्तीमा एमाले, माओवादी केन्द्र र नयाँ शक्तिले केन्द्रमा गरेको ६ वुँदे सहमतिलाई स्वागत गर्दै समर्थन गरिएको छ । विज्ञप्तिमा भनिएको छ, विसं २००६ सालमा स्थापित नेपाल कम्युनिष्ट पार्टी वर्ग संघर्ष, विचारात्मक संघर्ष र व्यवहारिक प्रयोगका अनेक श्रृखला प्रयोग गर्दै यो अवस्थामा पुगेको छ । नेकपा एमाले, माओवादी केन्द्रको नीतिगत नेतृत्वले मुलुकमा गणतन्त्र, संघीयता, समानुपातिक समावेसिता, धर्मनिरपेक्षता र सामाजिक न्यायसहितको संविधान निर्माण भएको छ । यसैगरी आगामी प्रतिनिधिसभा र प्रदेश सभामा भएको निर्वाचनमा जसले उम्मेदवारको अवसर पाएपनि एकमत भएर विजय गराउने निर्णय भएको छ । यसैगरी विज्ञप्तिमा अभियानलाई सफल पार्न क्रियाशिल वामपन्थी पार्टीहरु र स्वतन्त्र समूह सबैलाई एकता प्रक्रियामा सहभागि हुन आह्वान गरिएको छ । पत्रकार सम्मेलनमा पूर्व संस्कृति, पर्यटन तथा नागरिक उड्यन राज्यमन्त्री बलबहादुर महतले अब हिजोको बिषयलाई बिर्सेर एकमत भएर अगाडी बढ्नेमा सबैले सोच्नुपर्ने बताए । पार्टी एकताको प्रयास र आसन्न चुनावी तालमेल गर्ने सहमतिको स्वागत गर्दै तीन दलले दीप प्रज्वलनको आह्वान गरेका छन् । साँझ ६ बजे चन्दननाथ मन्दिर अगाडी दिप प्रज्वलन गर्ने र आगामी २० गते जिल्लामा तीनपार्टीबीचमा चियापान कार्यक्रमको आयोजना गरी शुभकामना आदानप्रदान समेत गरिने बताइएको छ ।"
सबै दलबीच सहकार्य आवश्यक : कोइराला,"नवलपरासी : नेपाली कांग्रेसका महामन्त्री डा शशांक कोइरालाले दिगो शान्ति, समृद्धि र संविधानको कार्यान्वयनका लागि सबै दलबीच सहकार्य गर्नुपर्ने आवश्यकता रहेको बताएका छन्। नवलपरासीको देवचुलीमा नेपाली काँग्रेस देवचुली नगरकार्य समितिद्वारा मंगलबार आयोजित चियापान तथा शुभकामना कार्यक्रममा बोल्दै नेता कोइरालाले कांग्रेस निर्णायक शक्ति बन्न नसकेकाले मुलुकमा प्राप्त राजनीतिक उपलब्धिलाई संस्थागत गर्न नसकिएको जिकिर गरे। सोही अवसरमा बोल्दै महामन्त्री कोइरालाले यसका लागि आशन्न प्रदेश र प्रतिनिधिसभाको निर्वाचनमा नेपाली काँग्रेसलाई पहिलो पार्टी बनाउनका लागि सहयोग गर्न सबैलाई आग्रह गरे। रासस"
सत्ता स्वार्थका लागि तालमेल: राणा,"काठमाडौं: अर्थराज्य मन्त्री उदय शम्शेर राणाले तीन बाम घटकबीच भएको चुनावी तालमेललाई सत्ता स्वार्थको संज्ञा दिएका छन्। चुनावमा एक्लाएक्लै जाँदा पराजय हुने डरले तीन दलहरुबीच तालमेल भएको दावी गरे। काठमाडौंमा बुधबार आयोजित एक कार्यक्रममा नेपाली कांग्रेसका युवा नेता एवम् अर्थराज्यमन्त्री राणाले भने, 'नाममा बाम एकता भने पनि सत्ता स्वार्थका लागि उनीहरु एक ठाउँमा उभिन बाध्य भएका हुन्। चुनावमा पराजय हुने डरले गर्दा एक भएका हुन्।' मंगबालर नेकपा एमाले, नेकपा माओवादी केन्द्र र नयाँ शक्तिबीच चुनावी तालमेल गर्ने र चुनाव लगत्तै पार्टी एकता गर्ने औपचारिक घोषणा भएको थियो। उनले तीन दलबीचको तालमेल लोकतन्त्रका लागि खतरा भएको समेत बताए। लोकतान्त्रिक व्यवस्थालाई कमजोर बनाउन बाम शक्तिहरु एक भएको दावी गरे। अर्थराज्यमन्त्री राणाले कांग्रेसले लोकतान्त्रिक शक्तिहरुलाई एकतावद्ध गर्ने बताए। उनले भने, हामी लोकतान्त्रिक शक्तिहरुलाई एक ठाउँमा राखेर बृहत लोकतान्त्रिक गठबन्धन बनाउँछौं।"
कांग्रेस केन्द्रीय कार्यसम्पादन समितिको बैठक बालुवाटारमा जारी,"काठमाडौं: नेपाली कांग्रेसको केन्द्रीय कार्यसम्पादन समितिको बैठक प्रधानमन्त्री निवास बालुवाटारमा जारी छ। काठमाडौंमा उपलब्ध केन्द्रीय सदस्यसहित कार्यसम्पादन समितिको बैठक बसेको हो। पछिल्लो विकसित राजनीतिक घटनाक्रमबारे छलफल गर्न कांग्रेसले कार्यसम्पादन समितिको बैठक बोलाएको हो। सत्तारुढ दल नेकपा माओवादी र प्रमुख प्रतिपक्षी दल नेकपा एमालेबीच निकट भविष्यमा पार्टी एकता गर्ने गरी तत्काल चुनावी तालमेल गर्ने औपचारिक सहमति भएपछि कांग्रेस पार्टीको आगामी रणनीति बनाउन जुटेको हो। माओवादी केन्द्रले सरकारलाई दिएको समर्थन फिर्ता नलिने जनाए पनि कांग्रेसका नेताहरुले भने माओवादीसंगको सम्बन्धमा पुनविचार गर्नुपर्ने धारणा राखेका छन्। बालुवाटारमा जारी कार्यसम्पादन समितिको बैठकमा बाम एकताबारे छलफल हुनुका साथै बृहत लोकतान्त्रिक गठबन्धन बनाउनेबारे पनि छलफल हुने कांग्रेस केन्द्रीय सदस्य एनपी साउँदले बताए। उनले भने, कम्युनिष्ट पार्टीहरु एक ठाउँमा उभिदै गर्दा हामीलाई पनि लोकतान्त्रिक शक्तिहरुको गठबन्धन बनाउन दवाव छ। कांग्रेसले यसको नेतृत्व गर्छ। मंगलबार नेकपा एमाले, एमाओवादी केन्द्र र नयाँ शक्तिबीच चुनावी तालमेल गर्ने र चुनाव लगत्तै पार्टी एकता गर्ने गरी ६ बुँदे सहमति भएको थियो।"
