शीर्षक,विवरण
"गोली, अश्रुग्यास र आगजनीपछि परासी तनावग्रस्त (फोटो फिचर )","नवलपरासी: राष्ट्रिय जनता पार्टी (राजपा) नेपालका अध्यक्ष महन्थ ठाकुरसहित शीर्ष नेता सहभागी कार्यक्रम स्थल तनावग्रस्त बनेको छ । स्थानीय निर्वाचन कार्यक्रमको विरोधमा राजपाले नवलपरासीको सदरमुकाम परासीमा शनिबार लाठी जुलुस गरेको थियो । लाठी जुलुसपछि बुद्धचोकमा आयोजित सभालाई सम्बोधन गर्न काठमाडौंबाट अध्यक्ष महन्थसहित शीर्ष नेताहरु राजेन्द्र महतो, अनिलकुमार झा, राजकिशोर यादव, ह्दयश त्रिपाठी, जितेन्द्र सोनाललगायतका नेताहरु परासी पुग्नु भएको थियो । कार्यक्रमको अन्तिम चरणमा अध्यक्ष महन्थ ठाकुरले सम्बोधन गरिरहँदा एक्कासी कार्यक्रम स्थल तनावग्रसत बनेको थियो ।कार्यक्रम स्थल नजिक रहेको मध्य नेपाल यातायत व्यवसायी समितिमा बसबाट लैजानका लागि एमालेको प्रचारप्रसारका लागि टिसर्टहरु राखिएको थियो। उक्त टिसर्टहरु महन्थ ठाकुरसहितका शीर्ष नेताकै अगाडी जलाइएका थियो । केही कार्यकर्ता टिसर्ट राखेको भन्दै मध्यनेपाल यातायात समितिमा पुगेर तोडफोड गर्न थालेपछि राजपाका कार्यकर्ता र प्रहरीबीच झडप भएको थियो । सो क्रममा प्रहरीले केही अश्रुग्यास र रबरको गोली प्रहार गरेको थियो । तनावपछि अध्यक्ष ठाकुरले बीचमै सम्बोधन छाड्नु भएको थियो । अश्रुग्यास प्रहार हुन थालेपछि ठाकुरसँगै राजेन्द्र महतो नजिकै रहेका होटलमा लुक्न पुग्नु भएको थियो । नेता ह्रदयश त्रिपाठीले कार्यकर्तालाई संयम हुन आग्रह गर्नुभएको थियो । तर स्थिति उग्र हुन थालेपछि प्रहरीले रबरका गोली र अश्रुग्यास प्रहार गरेको थियो । रबरको गोली लागेर दुई घाइते भएका छन् । तस्बिरहरु: हरि शर्मा"
ओबीओआर कार्यन्वयनबारे चीनसँग मंगलवार बैठक हुँदै,"काठमाडौं : नेपालचीनबीच आगामी मंगलबार परराष्ट्र सचिवस्तरीय कूटनीतिक परामर्श संयन्त्रको ११औं बैठक काठमाडौंमा आयोजना हुने भएको छ । दुई देशबीच विगतका सहमति र सम्झौताको व्यावहारिक कार्यान्वयनमा देखिएका समस्या र समाधानका उपायबारे बैठकमा छलफल हुने परराष्ट्र मन्त्रालयका अधिकारी बताउँछन् । विशेषगरी चिनियाँ अवधारणा बेल्ट एन्ड रोड (ओबीओआर)' अन्तर्गत रही आगामी दिनमा द्विपक्षीय सहयोग अभिवृद्धि गर्ने विषयमा बैठकमा छलफल हुने उनीहरूको भनाइ छ । बेल्ट एन्ड रोड अवधारणालाई व्यावहारिक कार्यान्वयनमा जाने विषयमा बैठकमा छलफल हुनेछ', उनीहरूले भने । नेपालले ओबीओआर अवधारणामा आफ्नो सहभागिता सुनिश्चित गर्दै एक महिनाअघि चीनसँग समझदारीपत्रमा हस्ताक्षर गरेको थियो । परराष्ट्र मन्त्रालयमा हुने एकदिने बैठकमा चिनियाँ सहायक विदेशमन्त्री कोङ सोन्यु नेतृत्वको एक चिनियाँ प्रतिनिधिमण्डल सहभागी हुनेछ । चिनियाँ टोली सोमबार नेपाल आइपुग्नेछ । बैठकमा नेपालका तर्फबाट परराष्ट्रसचिव शंकरदास वैरागी नेतृत्वको टोली सहभागी हुनेछ । कूटनीतिक परामर्श संयन्त्रको बैठकमा पारवहन सम्झौताअन्तर्गतका प्रोटोकलमा हस्ताक्षर हुन नसकेको विषयमा छलफल हुने सरकारी अधिकारीले बताए । पूर्वप्रधानमन्त्री केपी शर्मा ओलीको डेढ वर्षअघिको चीन भ्रमणमा हस्ताक्षरित पारवहनलगायत १० सम्झौता दाहाल नेतृत्वको सरकारका बेला तदारुकतासाथ कार्यान्वयनमा जान नसक्दा चीन रुष्ट थियो । बैठकमा खासा नाका पुनः सञ्चालनमा आउन नसकेको विषयमा नेपालले चिनियाँ पक्षको ध्यानाकर्षण गराउनेछ । परराष्ट्र सचिवस्तरीय बैठकमा नेपालचीन जोड्ने खासा नाका पुनः सञ्चालनमा आउन नसकेको विषयमा नेपालले चिनियाँ पक्षको ध्यानाकर्षण गराउनेछ । भूकम्पले क्षतिग्रस्त बनाएपछि यो ऐतिहासिक नाका पुनः सञ्चालनमा आउन सकेको छैन । देउवा नेतृत्वको सरकारले बेल्ट एन्ड रोड अवधारणालाई प्रभावकारी रूपमा व्यावहारिक ढंगले अघि बढाउँछ या बढाउँदैन भन्नेमा चिनियाँ पक्ष सशंकित देखिएको एक सरकारी अधिकारीले बताए । बेल्ट एन्ड रोड अवधारणाबाट लाभ लिन नेपालले अब चीनसमक्ष सडक, रेल, औद्योगिक पार्क, विमानस्थल, जलविद्युत् परियोजनालगायत ठूला तथा मझौला आकारका भौतिक पूर्वाधार विकासका परियोजना प्रस्ताव गर्नुपर्ने हुन्छ । नेपालले प्रस्ताव गरेका परियोजना निर्माणका लागि चीनले सिल्क रोड फन्ड र एसियाली पूर्वाधार विकास बैंकमार्फत् सहुलियत ऋण तथा अनुदान नेपाललाई उपलब्ध गराउनेछ ।"
मुलकको विकास तथा समृद्धि गर्न काँग्रेस नेतृत्वको आवश्यकताः डा महत,"पाँचथर : नेपाली काँग्रेसका नेता डा रामशरण महतले गरिब विपन्न जनताको जीवनस्तर उकास्न र मुलकको विकास तथा समृद्धि गर्न स्थानीय तहमा पनि काँग्रेस नेतृत्वको आवश्यकता रहेको बताउनुभएको छ । पाँचथर र इलामको सिमानास्थित राँके बजारमा आज नेपाली काँग्रेसले आयोजना गरेको चुनावी सभामा उहाँले काँग्रेसका उम्मेदवारले मात्रै मुलुकको विकास र समृद्धि गर्न सक्ने भएकाले आसन्न स्थानीय तहको निर्वाचनमा पाटीका उम्मेदवारलाई विजयी गराउन सबै मतदातामा आग्रह गर्नुभयो । नेता डा महतले राँकेरवि हुँदै भेडेटार जोड्ने सडकको कालोपत्रेका लागि आफू अर्थमन्त्री हुँदा बजेट विनियोजन गरेको बताउँदै अब यस सडकको निर्माण कार्य चाँडै थालिने र समयमै पूरा हुने विश्वास व्यक्त गर्नुभयो । कार्यक्रममा काँग्रेसका केन्द्रीय सदस्य भिष्मराज आङदेम्बे, जिल्ला सभापति नरेन्द्रकुमार केरुङ र जिल्ला सचिव वृजहाङ आङदेम्बे लगायतले स्थानीय तहको निर्वाचन, विकास र काँग्रेस नेतृत्वको भूमिकाका बिबिध पक्षमाथि प्रकाश पार्नुभयो । रासस"
महिलामा राजनीतिक प्रतिस्पर्धात्मक क्षमता बढेको छःराष्ट्रपति,"जेनेभा : राष्ट्रपति विद्यादेवी भण्डारीले नेपाली राजनीतिमा अनुभव नभएका महिलालाई पूर्ण प्रतिस्पर्धामा भाग लिन लगाएको अवस्थामा भन्दा सकारात्मक विभेदअन्तर्गत थोरै आरक्षण दिइएको अवस्थामा उनीहरूको राजनीतिक संलग्नतामा व्यापक सुधार भएको बताउनुभएको छ । संयुक्त राष्ट्र सङ्घका लागि स्थायी प्रतिनिधि दीपक धितालले आफ्नो सम्मानमा शुक्रबार आयोजना गर्नुभएको स्वागत कार्यक्रममा राष्ट्रपति भण्डारीले पूर्ण प्रतिस्पर्धा समान रूपमा सक्षम व्यक्तिहरूबीच मात्र हुनसक्ने बताउँदै शताब्दीयौँदेखि विभेद गरिएका र अनुभव नभएका महिला तथा सक्षम र अनुभवी व्यक्तिबीच प्रतिस्पर्धा गर्नु उचित नहुने बताउनुभयो । राष्ट्रपति भण्डारीले विसं २०४९ अगाडि स्थानीय निकायका करिब दुई लाख पदमध्ये केवल १३६ मा मात्र महिला विजयी भएको देखिएकामा विकेन्द्रीकरणअन्तर्गत निर्वाचनमा २० प्रतिशत महिलालाई उम्मेदवार बनाउनुपर्ने व्यवस्थाबाट ३६ हजार महिला विजयी भएको र थप चार हजार महिला मनोनीत हुँदा करिब ४० हजार महिला राजनीतिक पदमा स्थापित भएको उदाहरण प्रस्तुत गर्नुभयो । उहाँले यसरी नै अनुभवले खारिएर महिलामा राजनीतिक प्रतिस्पर्धात्मक क्षमता बढेको बताउनुभयो । राष्ट्रपति भण्डारीले वर्तमान संविधानअन्तर्गत निर्वाचनमा महिला उम्मेदवारी ४० प्रतिशत अनिवार्य बनाउँदा र प्रमुख तथा उपप्रमुखमध्ये एक पदमा महिला उम्मेदवारी अनिवार्य बनाउँदा हालैको निर्वाचनबाट धेरै महिला उपप्रमुखमा निर्वाचित भएको बताउँदै अब उनीहरूले पनि न्यायाधीशसरह अधिकार प्राप्त गरेको उल्लेख गर्नुभयो । उहाँले संसद्का लागि ३३ प्रतिशत स्थानमा महिला उम्मेदवारीको व्यवस्थाले ३३ प्रतिशत स्थानमै महिलाले विजय हासिल गरेको बताउँदै सभामुख र उपसभामुखमा एक पद तथा राष्ट्रपति र उपराष्ट्रपतिमध्ये एक पद महिलाले प्राप्त गर्दा उनीहरूलाई अनुभवी तथा व्यावहारिक बनाउने बताउनुभयो । राष्ट्रपति भण्डारीले अब आर्थिक विकास गरी लोकतन्त्रको फाइदा जनतालाई उपलब्ध गराउनुपर्नेमा जोड दिनुभयो । उहाँले प्रवासी नेपाली मुलुकको सद्भावना दूत भएको बताउँदै उनीहरूले जनस्तरका साथै सरकारी र कूटनीतिक स्तरमा समेत प्रभाव पार्नसक्ने र विदेशमा सिकिएको सीप स्वदेशमा उपयोग गर्न सकिन्छ भन्नुभयो । यहाँ आयोजना भइरहेको १०६औँ अन्तर्राष्ट्रिय श्रम सम्मेलनको एक भागका रूपमा रहेको रोजगारीको विश्व शिखर बैठक लाई सम्बोधन गर्न यहाँ आउनुभएका राष्ट्रपति भण्डारी सहभागी कार्यक्रममा स्विट्जरल्यान्डमा बसोबास गर्ने नेपाली समुदायका सदस्य, अन्तर्राष्ट्रिय श्रम सङ्गठनको सम्मेलनका लागि नेपाली प्रतिनिधि तथा राष्ट्रपति भण्डारीका भ्रमण दलका सदस्य पनि उपस्थित हुनुहुन्थ्यो । कार्यक्रममा स्विट्जरल्यान्डका लागि नेपाली राजदूत धितालले अन्तर्राष्ट्रिय श्रम सङ्गठनमा नेपालको सहभागिता र नेपालले प्राप्त गरेको उपलब्धिका विषयमा जानकारी गराउनुभएको थियो । रासस"
रेणु दाहाललाई गालीबेइज्जती गर्नेविरुद्ध किटानी जाहेरी,"चितवन : चितवनको भरतपुर महानगरपालिकाको प्रमुखकी उम्मेदवार रेणु दाहालविरुद्ध सामाजिक सञ्जालमार्फत गाली बेइज्जती गर्ने दुईजना विरुद्ध किटानी जाहेरी परेको छ । रेणु दाहालका श्रीमान् अनिलकुमार पाठकले किटानी जाहेरी दिनु भएको हो । चितवनका प्रहरी प्रमुख तथा प्रहरी उपरीक्षक दीपक थापाले दुई जनाविरुद्ध किटानी जाहेरी परेको जानकारी दिनुभयो । सामाजिक सञ्जालमा गाली गर्ने निरव ज्ञवाली र एसवी बोहरा विरुद्धकिटानी जाहेरी परेको थापाले जानकारी दिनुभयो । जसले जे गरे पनि हुन्छ जस्तो देखियो, एउटा गलत नजिर बस्ने अवस्था देखिएकाले मेरो श्रीमानले जाहेरी दिनुभएको हो, रेणु दाहालले भन्नुभयो । शुक्रबार जिल्ला प्रहरी कार्यालय चितवनमा जाहेरी दर्ता भए पनि साइवर अपराध मुद्दा काठमाडौ जिल्ला अदालतले मात्रै हेर्ने भएकाले काठमाडौँकै प्रहरीबाटै हेर्नेगरी पठाइएको उपरीक्षक थापाले बताउनुभयो । विद्युतीय कारोबार ऐन २०६३ को दफा ४७ अनुसार कसुर प्रमाणित भएमा रु दुई लाख जरिवाना र पाँच वर्षसम्म कैद या दुबै सजाय हुनसक्ने उहाँको भनाइ छ । निरव ज्ञवाली र एसबी बोहराको नामको फेसबुक आइडीमा दाहाललाई अश्लिल शब्दमा गाली गरी लेखिएको छ । विद्युतीय कारोबार ऐन २०६३ ले बन्देज लगाएको कानुन विपरितको कार्य गरेको हुँदा निज अन्यायी दुबै जनालाई खोजतलास गरी यसै कार्यालयबाट तत्काल पक्राउ गरी ल्याई विद्युतीय कारोबारी ऐनअनुसार हदैसम्मको सजाय जरिवानासमेत गरी न्याय पाउँ,' पाठकको किटानी जाहेरीमा उल्लेख छ । उनीहरुको खोजीकार्य जारी रहेको प्रहरीले जनाएको छ । रासस"
संविधान संशोधन नभई हुने निर्वाचनमा भाग लिदैँनौ : नेता महतो,"काठमाडौँ : राष्ट्रिय जनता पार्टीले संविधान संशोधन नभई हुने स्थानीय तहको निर्वाचनमा पार्टीले भाग नलिने पुनः स्पष्ट पारेको छ । राजपाको मागअनुसार संविधान संशोधनलाई प्राथमिता दिन ठूला तीन दल नेपाली काँग्रेस, नेकपा (एमाले) र नेकपा माओवादी केन्द्रसँग आग्रह गर्दै सो पार्टीले सरकार तराईमधेसका जनताको मागप्रति गम्भीर हुन नसकेको आरोप लगाएको छ । राजपाका अध्यक्ष मण्डलका सदस्य एवम् नेता राजेन्द्र महतोले आज यहाँ आयोजित साक्षात्कारमा स्थानीय तहको असार १४ गते हुने निर्वाचनमा पार्टीले भाग नलिने जानकारी दिँदै पार्टीले प्रदेश नं २ को निर्वाचन सार्न सरकारलाई कुनै आग्रह गरेको छैन भन्नुभयो । उहाँले भन्नुभयो, 'संविधान संशोधन नभई हुने निर्वाचनमा हामी भाग लिदैँनौ, संविधानलाई वैधानिकता दिई आफ्नो खुट्टामा आफैँ बञ्जरो हान्ने काम गर्दैनौँ।' नेता महतोले राजपाले आफ्नो माग संवैधानिक दायराबाट समाधान होस् भन्ने चाहेको चर्चा गर्दै गणतन्त्र स्थापनाका लागि मधेसी जनताले निर्वाह गरेको भूमिकालाई बिर्सन नहुनेमा पनि जोड दिनुभयो । रासस"
