शीर्षक,विवरण
वाम धु्रवीकरणको सन्देश,"दसैं बिदाका दिनमा एमाले र माओवादी केन्द्रबीच बढेका छलफलको परिणामस्वरूप दुई दल चुनावी तालमेलमा जाने निक्र्यौलमा पुगेपछि एकाएक नेपाली राजनीति तरंगित हुन पुगेको छ । तालमेलमा नयाँ शक्तिका डाबाबुराम भट्टराई पनि थपिएका छन् । चुनावपछि यी दलहरूबीच पार्टीक एकीकरणमै जाने सहमति भएको खुलासा भएपछि अनेक टीकाटिप्पणी हुन थालेका छन् । एउटा पंक्तिले यी पार्टी तालमेल हुँदै एकतातिर अग्रसर हुनुलाई सकारात्मक रूपमा लिएका छन् भने अर्को पंक्ति यसको वैचारिक राजनीतिक आधारमाथि प्रश्न उठाउँदै कतै राजनीतिक अस्थिरता थप बढ्ने पो हो कि भनेर आशंका गर्दैछन् । तर्क र टिप्पणी जे गरिए पनि चुनावको मुखमा कम्युुनिस्ट शक्तिबीच तालमेल हुनुले नेपाली राजनीतिमा सकारात्मक संकेत देखिएको छ । खासगरी लामो समयदेखि एउटै शक्तिको बहुमत आउन नसकेर सरकार सञ्चालनमा गठबन्धन संस्कृतिले परम्पराकै रूप लिँदै गरेको पृष्ठभूमिमा यसले नेपाली राजनीतिलाई स्थिरताउन्मुख गर्ने अपेक्षा गर्न सकिन्छ । त्यस अर्थमा यो तालमेल र एकताका प्रयास अर्थपूर्ण छन्, सकारात्मक छन् । तालमेलको घोषण जति सहज छ त्यसको व्यवस्थापन गर्न त्यत्ति नै कठिन हुने देखिन्छ । तालमेल, त्यसपछि एकताका चरणमा एमाले, माओवादीलगायतका पार्टीहरूको आन्तरिक व्यवस्थापन ठूलो चुनौतीका रूपमा आउने घोषणासँगै नेताकार्यकर्ता पंक्ति तहबाट आएका क्रियाप्रतिक्रियाबाट अनुमान लगाउन सकिन्छ । त्यसकारण शीर्ष नेतृत्वले तालमेल र त्यसपछि एकताका प्रक्रिया सुझबुझ ढंगले बढाउन आवश्यक छ । नेपाली कम्युनिस्ट पार्टीहरूमा जुट्ने भन्दा फुट्ने प्रवृत्ति बढी छ । अधिकांश मतदाता वामपन्थी दलको पक्षमा हुँदाहुँदै पनि गुटबन्दी र फुटपरस्त प्रवृत्तिले गर्दा यी दलले आफ्ना मुद्दा स्थापित गर्न सकेका छैनन् । व्यक्तिगत अहं, प्रतिष्ठाको लडाइँ, गुट र सत्ताकेन्द्रित मनोविज्ञानका कारण यी वामपन्थी नेताहरू एकअर्कालाई आरोपप्रत्यारोपमै रमाउँदै आएका छन् । अहिले एकाएक नविन अभ्यास सुरु भएको छ, तालमेल र एकीकरणको जुन सकारात्मक अभ्यास हो । यद्यपि यी दलहरूले तालमेल र एकताको प्रक्रियामा बढ्दै गर्दा यसका राजनीतिक वैचारिक आधार के ? यो एकताबाट मुलुकले के पाउँछ ? त्यो प्रस्ट रूपमा भन्न सक्नुपर्छ । विगतमा टुट, फुट र गुटमा रमाउने कम्युनिस्टहरू अहिले किन र कसरी एउटै थलोमा आउन तयार भए ? हिजो किन एकै ठाउँमा अटाएनन् र आज पुनः एकै ठाउँमा आउने आवश्यकता किन पर्यो ? तालमेल र एकता गर्दै गर्दा यी प्रश्नको जवाफ पनि आउनु जरुरी छ । मुलुक लामो राजनीतिक संक्रमणबाट गुज्रेको छ । पटकपटक भएका राजनीतिक आन्दोलनस्वरूप यतिबेला मुलुक संघीय लोकतान्त्रिक गणतन्त्रको चरणमा छ । नयाँ संविधान बनेको छ । स्थानीय तहको चुनावले संविधानको पूर्ण कार्यान्वयनको बाटो खोलेको छ । अब हुने प्रदेशसभा र केन्द्रका चुनावसँगै यसको संस्थागत विकासको प्रक्रिया प्रारम्भ हुन्छ । यतिबेला मुलुकको आवश्यकता संवैधानिक स्थायित्वसँगै राजनीतिक स्थायित्व पनि हो । पटकपटक राजनीतिक संघर्षमा पोख्त नेपाली राजनीति र नेतृत्वले मुलुकलाई विकास र सम्मृद्धिको बाटोमा अग्रसर गराउन सकेको छैन । हामी वर्षौंदेखि नेपाल किन बनेन ? भनेर एउटै प्रश्नमै रुमल्लिइरहेका छौं । यो सन्दर्भ र पृष्ठभूमिमा राजनीतिक स्थिरता र स्थायित्वको अभिप्रायले एमाले, माओवादीलगायतका दलबीच सहमति, सहकार्य र एकता हुनु स्वागतयोग्य हो । तर यी प्रयास त्यतिबेला फलिभूत भएको मानिन्छन्, जब मुलुकले सही अर्थमा विकास र समृद्धिको यात्रा तय गर्न थाल्नेछ । त्यसकारण यो धु्रवीकरणबाट अहिले निश्चय पनि वामपन्थी रुझान भएका नेताकार्यकर्ता उत्साहित होलान्, आम जनता र नयाँ पुस्ता उत्साहित हुन धु्रवीकरणपछि मुलुकको समृद्धि सपनाले आकार लिनुपर्छ । अनि मात्रै धु्रवीकरणको अर्थ र औचित्य प्रमाणित हुन्छ ।"
माओवादी केन्द्रको चुनाव चिन्हमा चुनाव लड्ने संयुक्तको निर्णय,"काठमाडौ : सत्ता गठबन्धनको एक अर्को घटक नेकपा संयुक्तले आगामी प्रतिनिधिसभा र प्रदेशसभाको निर्वाचनमा नेकपा माओवादी केन्द्रको चुनाव चिन्ह गोलाकारभित्रको हसिया हथौडा चिन्हमा चुनाव लडने निर्णय गरेको छ। सो पार्टीको बुधवार काठमाडौमा बसेको आकस्मिक पोलिटव्यूरो बैठकले एमाले,माओवादी केन्द्र र नयाँ शक्ति नेपालको अग्रसरतामा भएको एकीकृत कम्युनिष्ट पार्टी निर्माणको घोषणालाई उच्च मूल्याङकन गर्दै स्वागत गरेको छ । बर्तमान समय र अवस्थामा बामहरु वीच एकता र एकीकृत पार्टी निर्माण देश काल परिस्थिति तथा आम सर्वसाधारणको माग हो बैठकपछि सो पार्टीका महासचिव ठाकुर शर्मा,कार्यबाहक संयोजक सुनिल मानन्धर र बरिष्ठ नेता चन्द्रदेव जोशीले जारीगरेको संयुक्त बक्तव्यमा भनिएको छ । सो पार्टीका अध्यक्ष गणेश शाह मुलुक बाहिर रहेका कारण महासचिव शर्माको अध्यक्षतामा बसेको बैठकले समाजवाद उन्मुख आर्थिक,सामाजिक परिवर्तन,सुशासन,राष्ट्रिय एकता,अखण्डता तथा सार्वभौमिकताको संरक्षणका लागि बाम एकता मुलुकको आवश्यकता रहेको संयुक्तको मान्यता रहेको बिज्ञप्तिमा उल्लेख छ । बृहद बाम एकीकरणको यस प्रक्रियालाई सफलताका साथ पूर्णता दिन सबैबाट निष्ठापूर्वक काम गर्नु र आ आफनो क्षेत्रबाट सहयोग पुरयाउन सम्पूर्ण आम जनसमुदाय,देशक्त र प्रगतिशील बुद्धिजीवीहरुलाई सो पार्टीले अपिल गरेको छ । बरिष्ठ नेता जोशी नेतृत्वको टोलीले बाम एकता प्रक्रियामा सहमति निर्माण गर्न जुटिरहेका नेकपा माओवादी केन्द्रका अध्यक्ष समेत रहेका गृहमन्त्री जनाद्र्धन शमासँग छलफल गरेका थिए । प्रदेश नम्बर २ र ७ मा आफनो प्रभाव क्षेत्र रहेको सो पार्टीका तीन जना साँसद छन् । सो पार्टी प्रधानमन्त्री शेरबहादुर देउवा नेतृत्वको सरकारमा सहभागी छ ।"
लोकतान्त्रिक गठबन्धनका लागि सात सदस्यीय कार्यदल गठन,"काठमाडौं: एमाले, माओवादी केन्द्र र नयां शक्ति पार्टीले चुनावी सहमतिको घोषणा गरेको २४ घण्टा नबित्दै नेपाली कांग्रेस, राष्ट्रिय प्रजातन्त्र पार्टी, संघीय समाजवादी फोरम नेपाल, राप्रपा(राष्ट्रवादी), नेपाल लोकतान्त्रिक फोरम र राष्ट्रिय जनता पार्टी नेपाल संलग्न ६ दलबीच चुनावी मोर्चाका लागि आवश्यक गृहकार्य गर्न सात सदस्यीय कार्यदल गठन गरेको छ। प्रधानमन्त्री निवास बालुवाटारमा बुधबार साँझ ६ बजेदेखि ८:४५ बजेसम्म कांग्रेसका सभापति शेरबहादुर देउवाको अध्यक्षतामा बसेको बैठकमा सो सहमति भएको हो। सात सदस्यीय कार्यदलमा कांग्रेसबाट दुई र अन्य पाच दलबाट एकएक जनाको प्रतिनिधित्व हुने भएको छ। कार्य दलमा रहने सदस्यहरुको नाम बिहिबार बिहान ८ बजेसम्म प्रधानमन्त्रीलाई उपलब्ध गराउने र बिहान ९ बजे बैठक बस्ने भएको छ। सात सदस्यीय कार्यदललाई बैठकले प्रतिनिधिसभा र प्रदेशसभामा ६ पार्टीको चुनावी तालमेल, साझा चुनावी घोषणा पत्र, चुनावी सहभागिताका लागि आवश्यक रोडम्याप दुई दिन भित्र तयर गर्ने कार्यविधि दिएको जानकारी राप्रपाका एक नेता दिए। उनले अन्नपूर्णसँग भने, 'आज कांग्रेसले देखाएको लचकताका परिणाम ६ लोकतान्त्रिक शक्तिको एकता चुनावी तालमेलका लागि अटुट रहनेछ। उनले भने, अब यो मुलुकमा वृहद्ध प्रजातान्त्रिक राष्ट्रवादी मोर्चा गठन भई वाम एकता बिरुद्ध चुनावी प्रतिस्पर्धा हुनेछ।' राजपा अध्यक्ष मण्डलका एक नेताले सात सदस्यीय कार्य दलले दिने प्रतिवेदनका आधारमा आफूहरुबीच मंसिर १० र २१ गते हुने चुनाबमा चुनावी तालमेल हुने बताए। उनले भने,'यो चुनावी तालमेल वाम एकताले मुलुकलाई 'एक दलीय अधिनायकवाद' तर्फ लग्ने सोच र रणनीति बिरुद्ध रहेको छ।' प्रधानमन्त्री स्वयमले बैठकमा संघीय लोकतान्त्रिक गणतन्त्रको रक्षा, बहुदलीय व्यवस्था र बहुलवादको लागि लोकतान्त्रिक शक्ति एक जुट हुनै पर्ने धारणा राखको भण्डारीले जानकारी दिए। बैठकमा राप्रपाका अध्यक्षले वृहद्ध प्रजातान्त्रिक एकताबाटै निर्वाचनमा प्रतिस्पर्धा गर्नु पर्ने बिद्यमान परिस्थितिमा कांग्रेसको हदैसम्मको लचकतापूर्ण नीति र व्यवहार अपरिहार्य रहेको धारणा राखेका थिए।"
गणतन्त्र पक्षधरसँग तालमेल गर्न सकिने: अध्यक्ष केसी,"काठमाडौँ: राष्ट्रिय जनमोर्चा पार्टीका अध्यक्ष चित्रबहादुर केसीले गणतन्त्र पक्षधरसँग चुनावी तालमेल हुनसक्ने संकेत गरेका छन्। रिपोर्टस क्लबद्वारा बुधबार आयोजित कार्यक्रममा अध्यक्ष केसीले नेकपा(एमाले), नेकपा (माओवादी केन्द्र) र नयाँशक्ति नेपालबीच भएको तालमेल र एकता प्रयासलाई आफूले ठूलो रुपमा नलिएको भन्दै चुनावी तालमेल भए तापनि पार्टी एकता भने हुन नसक्ने बताए। नेकपा (माले)का महासचिव सिपी मैनालीले चुनावअघि आफूहरु पार्टी एकीकरणमा नजाने बताए। उनले एमाले, माओवादी केन्द्र र नयाँशक्तिबीच भएको तालमेलको शुरुवात सकारात्मक भएको भन्दै आगामी चुनावपछि मात्र छलफलमा जाने भनाइ व्यक्त गरे। त्यसैगरी नेकपा (क्रान्तिकारी माओवादी)का उपाध्यक्ष सिपी गजुरेलले एमाले र माओवादी केन्द्रबीचको एकतालाई दक्षिणपन्थी एकताको संज्ञा दिँदै बाम एकताको प्रयास नै गलत भएको बताए। उनले एमाले, माओवादी र नयाँशक्तिले कम्युनिष्ट आन्दोलनको गठबन्धन बनाउँछौं भनेर जनतालाई ढाँट्ने काम गरेको आरोप लगाउँदै यो गठबन्धन जनता र राष्ट्रको लागि औचित्यहिन रहेकोसमेत दाबी गरे। माओवादी केन्द्रका नेता दीनानाथ शर्माले एमाले, माओवादी केन्द्र र नयाँ शक्तिबीचको तालमेलले वर्तमान सरकारलाई केही असर नपर्ने बताए। उनले बाम तालमेलको प्रयासबारे आफ्नो पार्टीका अध्यक्ष पुष्पकमल दाहालले प्रधानमन्त्री शेरबहादुर देउवालाई भेटेर नै जानकारी दिएको उल्लेख गर्दै भने, 'हामीले एमालेसँग बाम तालमेल गर्नेबारे काँग्रेसलाई जानकारी दिएका थियौं, त्यसैले यो कसैका विरुद्ध लक्षित छैन्।' नेता शर्माले प्रधानमन्त्री देउवा नेतृत्वको सरकारबाट चुनाव हुने भन्दै पार्टी फुटेर भन्दा पनि जुटेर अघि बढ्नु उपयुक्त हुने बताए।"
