शीर्षक,विवरण
दुर्भाग्यपूर्ण त्रुटि,"संविधान नीति र कानुनसम्मत रूपमा राज्य सञ्चालनलाई निर्देशित गर्ने दस्ताबेज हो । त्यसको आधिकारिक व्याख्याता सर्वोच्च अदालत हो । आगामी तीन दिनपछि सर्वोच्च न्यायालयले नयाँ नेतृत्व पाउनुपर्ने हुन्छ, किनकि वर्तमान प्रधानन्यायाधीश सुशीला कार्कीले उमेर हदका कारण अवकाश पाउनु हुनेछ । तर संविधानको मुख्य व्याख्याता नै नयाँ नेतृत्व छनोटबारे उदासीनता देखा परेको छ, जुन दुर्भाग्य हो । अपवादको अवस्थामा यस्ता त्रुटिहरू हुन सक्छन् तर कानुनमा स्पष्ट व्याख्या भएको विषयमा किन न्यायपरिषद् तथा त्यसका प्रमुख या प्रधानन्यायाधीश चुके ? न्यायपरिषद्को बैठक नबोलाइनु र कार्यवाहकको रूपमा वरिष्ठतमले पदभार सम्हाल्ने परिस्थिति किन उत्पन्न भयो ? अहिलेको सर्वोच्च अदालत या न्यायालयलाई खासगरी त्यसको नेतृत्वलाई विभिन्न राजनीतिक दलहरू र तिनीहरूसँगको सम्बन्धका आधारमा नागरिक समाज तथा सञ्चारमाध्यमले पूर्वाग्रही तरिकाले हेर्ने गरेको पाइन्छ । संवैधानिक तहको रिक्तताले उत्पन्न गर्ने परिस्थितिको मूल्यबारे कतै चिन्ता देखिँदैन । अझ दलहरूको र अन्तर्राष्ट्रिय दाताहरूको प्रभावमा सर्वोच्च अदालत विभाजित भएको मान्यता सर्वत्र फैलिँदा यस्तो रिक्तताको मूल्य अझ चर्को बन्न जान्छ । के बाहिरिन लाग्नुभएकी प्रधानन्यायाधीश र उत्तराधिकारको लागि रोलक्रम या वरिष्ठतम हिसाबले सबभन्दा माथि रहेका न्यायाधीशबीचको तीक्त सम्बन्धका कारण यो रिक्तता जानीजानी लादिएको हो मुलुकमाथि ? के प्रधानन्यायाधीश र न्यायपरिषद् आफ्नो संवैधानिक दायित्व पूरा गर्न बाध्य छैनन् ? न्यायपालिका नेतृत्व र न्यायपरिषद्सँग जानीजानी संवैधानिक त्रुटि गर्ने छुट हुँदैन । 'भ्रष्टाचार' प्रति शून्य सहनशीलताको नाममा र सम्भवतः एउटा योजनाअन्तर्गत अहिलेको सर्वोच्च नेतृत्वले केही गम्भीर न्यायिक त्रुटि गरेको छ, पूर्वका फैसलाहरूमा भएको 'गम्भीर त्रुटि' सच्याउने नाममा । त्यसमा पुनरावलोकनको बाटो छेक्न एकपछि अनेक 'बृहत्पूर्ण इजलास' गठनको बाटो अपनाइएको छ । त्यस्तै व्यापक जनसरोकारका मुद्दा उठाउँदा 'प्रक्रिया' बाधक नबनोस् भनी संविधानमा उल्लेख गरिएको 'पब्लिक इन्टरेस्ट लिटिगेसन' पनि अब राजनीतिक औजार बन्न पुगेको छ । विगत केही महिनामा सर्वोच्च अदालतले अनेक प्रतिशोधात्मक र त्रुटिपूर्ण तरिकाले फैसला दिएको छ । पूर्वमा प्रधानन्यायाधीशहरूले नै दिएको फैसलालाई हास्यास्पद तरिकाबाट उल्टाइएको छ । त्यति मात्र हैन, राजनीतिमा प्रयोग हुने 'कोटरी' या 'किचन क्याबिनेट' संस्कृति न्यायपालिकामा भित्रिएको छ । त्यो कोटरीको प्रभाव 'इजलास' निर्माणमा समेत देखिएको सर्वत्र अनुभूति भएको छ । नयाँ प्रधानन्यायाधीशको छनोटले विधिवत्रूपमा कार्कीको अवकाशपूर्व नै औपचारिकता पाएको भए एउटा स्वस्थ परम्पराको निर्माणमा सघाउ पुर्याउँथ्यो त्यसले, तर दुर्भाग्य त्यो हुन सकेन । यसले भावी प्रधानन्यायाधीशको भूमिकालाई अझ महत्वपूर्ण र चुनौतीपूर्ण बनाएको छ । सर्वोच्च अदालतले विगतमा केही मामिलामा न्याय सम्पादनका विधि, प्रक्रिया र सर्वमान्य सिद्धान्तको अवमूल्यन गरेको छ । त्यसको निराकरणसँगै न्यायपालिका राजनीतिक दलहरूको विस्तारित अखडा हैन र हुनु हुँदैन भन्ने सन्देश आगामी दिनमा सर्वोच्चबाट जानु जरुरी छ । उसको फैसलाका आधार प्रमाण, निष्पक्षता र नजिर हुनुपर्छ, मनोगत र भावनात्मक टिप्पणी तथा दलीय हित हुनु हुँदैन ।"
"'वातारण संरक्षणमा मन, वचन र कर्मले लागौँ'","काठमाडौँ: राष्ट्रपति विद्यादेवी भण्डारीले स्वच्छ तथा मनोरम वातावरण र जीवनको पर्याय वन क्षेत्रलाई संरक्षण गर्दै सुन्दर भविष्य सुनिश्चित गर्न मन, वचन र कर्मले लाग्न आह्वान गर्नुभएको छ। विश्व वातावरण दिवसका अवसरमा जनसङ्ख्या तथा वातावरण मन्त्रालयद्वारा यहाँ आज आयोजित समारोहलाई सम्बोधन गर्दै राष्ट्रपति भण्डारीले भावी पुस्ताका लागि अमूल्य र विशिष्ट जीवजन्तु तथा वनस्पति र वन क्षेत्रको संरक्षण एवम् संवद्र्वन गर्दै सुन्दर भविष्य सुनिश्चित गर्न सबैमा अपिल गर्नुभयो। राष्ट्रपति भण्डारीले भन्नभयो, 'जलवायु परिवर्तनको प्रभाव वातावरणीय ह्रास विकास र वातावरण बीचको सन्तुलनलाई सम्बोधन गरी प्रत्यक्ष तथा स्वच्छ वातावरण सिर्जना गर्न हामी सबै गम्भीर भएर लाग्नुपर्दछ।' राष्ट्रपति भण्डारीले वातावरण दिवस मनाउनु एउटा औपचारिक विषय मात्र नभएको भन्दै प्रकृतिलाई सिँगार्दै नेपालमा सिङ्गो, सामाजिक, आर्थिक, विकास गर्ने लक्ष्यप्रति दृढ सङ्कल्प गरी त्यसलाई महत्वपूर्ण अवसरका रूपमा सदुपयोग गर्नुपर्नेमा जोड दिनुभयो। 'जलवायु परिवर्तनका कारण विश्वमा वातावरण विनाश भइरहेको सन्दर्भमा प्राकृतिक र जैविक विविधताले सम्पन्न राष्ट्र नेपालका लागि वातावरण दिवस मनाउनुको आफ्नै विशेष महत्व रहेको छ', राष्ट्रपति भण्डारीले भन्नुभयो। नेपालको संविधानले सुनिश्चित गरेको स्वच्छ वातावरणमा बाँच्न पाउने हकलाई सुनिश्चित गर्न सरकार, निजी क्षेत्र, गैरसरकारी क्षेत्र समुदाय विकास साझेदारलगायत आम नागरिक सचेत र प्रतिबद्ध रहनुपर्ने राष्ट्रपति भण्डारीको भनाइ छ। उहाँले प्रकृति तथा मावन बीचको सम्बन्ध अभिन्न अङ्ग रहनाले स्थानीय समुदायले जल, जङ्गल र जमिनको संरक्षण गरी वातावण संरक्षणमा पुर्याएको उल्लेख्य योगदानको कदर गर्नुभयो। राष्ट्रपति भण्डारीले भन्नुभयो, नेपालमा सामुदायिक वनको सफलता विश्वमा उदाहरणीय छ, नेपाल प्राकृतिक सम्पदा, ग्रामीण समुदायको आर्थिक तथा सामाजिक विकासको दिगो आधारका रूपमा रहिआएको छ।' भौगोलिक तथा सामाजिक महत्व बोकेको चुरे क्षेत्रको प्राकृतिक वातावरण यथावत् राखिरहन सञ्चालित राष्ट्रपति चुरे संरक्षण कार्यक्रम' राष्ट्रिय निकुञ्ज तथा वन्यजन्तु आरक्षण, संरक्षित क्षेत्र, जलाधार संरक्षण आयोजनाजस्ता कार्यले विश्व वातावरण सन्तुलन कायम राख्न मद्दत पुर्याइरहेको राष्ट्रपतिले बताउनुभयो। राष्ट्रपति भण्डारीले ग्रामीण पर्यटन, पूर्वाधार, विकासमा समेत टेवा पुर्याउने वन तथा प्राकृतिक सम्पदाको संरक्षण प्रवद्र्धन उपयोग ता समुदायसम्मको दरो अन्तरसम्बन्ध र व्यवस्थापन प्राथमिता बन्नुपर्छ भन्नुभयो। सन् १९७२ मा सम्पन्न संयुक्त राष्ट्र सङ्घको साधारणसभाले विश्वमा हरेक वर्ष जुन ५ का दिन विश्व वातारण दिवस मनाउने घोषणा गरेअनुरूप विश्वभर विभिन्न कार्यक्रमसहित जुन ५ लाई विश्व वातावरण दिवसका रूपमा मनाउने गरिएको पाइन्छ।यस वर्षको नारा प्रकृतिसँग हाम्रो सम्बन्ध ः रहिरहोस् अनन्त' भन्ने रहेको छ। समारोहमा जनसङ्ख्या तथा वातावरणमन्त्री जयदेव जोशीले सङ्घीय लोकतान्त्रिक गणतन्त्र स्थापनासँगै आर्थिक, सामाजिक विकासले गति लिइरहेको अवस्थामा वातावरण विकासले समेत गति लिन थालेको छ भन्नुभयो। वातारण संरक्षण समितिका कार्यवाहक सभापति मानबहादुर विश्वकर्माले संविधानको कार्यान्वयनस्वरूप वातावरण संरक्षण तथा प्रवद्र्धनबारे स्थानीय निकायले महत्वपूर्ण भूूमिका निर्वाह गर्नुपर्ने धारणा राख्नुभयो। मन्त्रालयका सचिव डा विश्वनाथ ओलीले पछिल्लो तथ्याङ्कअनुसार वन क्षेत्रले ओगटेको क्षेत्र विगतको तुलनामा झन्डै पाँच प्रतिशतभन्दा बढीले वृद्धि भएको बताउनुभयो। मन्त्रालयले यस वर्षको वातारण संरक्षण पुरस्कार' महिला बालबालिका तथा वातावरण सुधार केन्द्र मकवानपुरलाई प्रदान गरेको छ।सोही पुरस्कार वातावरण अभियन्ता कैलालीका लालबहादुर रावललाई प्रदान गरिएको छ।पुरस्कारको राशि जनही रु एक लाख ५० हजार रहेको छ। त्यसैगरी, वातारण संरक्षण महिला पुरस्कार इन्दिरा पराजुली (कास्की)लाई प्रदान गरिएको छ।पुरस्कारको राशि रु ५० हजार रहेको छ। वातारणमैत्री उद्योग पुरस्कार युनिलिभर नेपाल (संस्था), वातारण पत्रकार पुरस्कार लक्ष्मीप्रसाद उपाध्यक्ष र जलवायु परिवर्तन व्यवस्थापन पुरस्कार अभिषेक श्रेष्ठ (मोरङ)लाई प्रदान गरिएको छ।पुरस्कारको राशि क्रमशः रु २५ हजार, ५० हजार र २५ हजार रहेको छ। सोही अवसरमा राष्ट्रपति भण्डारीले वातावरण संरक्षणका लागि मोटरसाइकलमा दक्षिण एसियाली मुलुक यात्रा गर्न लाग्नुभएका युवालाई नेपालको झन्डा प्रदान गर्नुभयो। रासस"
भरतपुर फैसला आज दुई बजेपछि,काठमाडौं : भरतपुर महानगरपालिकाको वडा नम्बर १९ को फैसला आज दुई बजेपछि आउने भएको छ । मतगणना सुचारु गर्नुपर्ने मागसहित आइतबार सर्वोच्च आदालतमा परेको रिट निवेदनको सुनुवाई आज दुई बजेपछि हुने भएको हो । उक्त मुद्वाको बेञ्च न्यायाधिश चोलेन्द्र शमशेर जवराको इजलासमा परेको छ । चोलेन्द्रको एकल इजलासले सभंवत आजै उक्त मुद्वाको किनारा लगाउने छ । निर्वाचन आयोगले भरतपुर महानगरपालिकाको वडा नम्बर १९ मा पुनः मतदान गर्नुपर्ने निर्णय गरेपछि असन्तुष्ट पक्षले सर्वोच्चमा रिट दायर गरेको थियो । सोही गाउँका मतदाता समेत रहनुभएका अधिवक्ता तुलसीराम पाण्डे र नेकपा एमालेको भरतपुर १९ को खुलातर्फबाट वडा सदस्यका उम्मेदवार बन्नुभएका गुञ्जमान विश्वकर्माले भरतपुरमा पुनः मतदान गराउन नहुने भन्दै रिट दायर गर्नुभएको थियो । उक्त रिटको पेशी सोमबारका लागि तोकिएको थियो । प्रमुख प्रतिपक्ष दल नेकपा एमालेले भरतपुर १९ मा च्यातिएका मतपत्र बदर गरी मतगणना सुचारु गर्न ध्यानाकर्षण गराउँदै संसद अबरुद्ध गरिरहेको छ । मतगणना चलिरहेको बेला माओवादी प्रतिनिधिले मतपत्र च्यातेका थिए । मतपत्र च्यात्ने माओवादी कार्यकर्ता भने धरौटीमा छुटिसकेका छन् । केही दिनअघि निर्वाचन आयोगले भरतपुर १९ मा पुनः निर्वाचन गराउने निर्णय गरेपछि एमालेले उक्त निर्णयको विरोध गर्दै आएको छ। भरतपुर महानगरपालिकामा रेणु दाहाल र देवी ज्ञवालीबीच रोचक प्रतिष्पर्धा छ । प्रचण्डपुत्री रेणु नेकपा माओवादी केन्द्र र कांग्रेसको साझा उम्मेदवार हुनुहुन्छ भने ज्ञवाली एमालेका तर्फबाट उम्मेदवार हुनुहुन्छ ।
