शीर्षक,विवरण
देउवालार्इ ३९१ सांसदको साथ,"काठमाडौं : चौथो कार्यकालका लागि प्रधानमन्त्री हुन लाग्नुभएका कांग्रेस सभापति शेरबहादुर देउवालाई संसद्मा झन्डै दुई तिहाइ बहुमतको समर्थन जुटिसकेको छ । वर्तमान सत्ता गठबन्धनका साथै राष्ट्रिय प्रजातन्त्र पार्टी, राष्ट्रिय जनता पार्टी, संघीय समाजवादी फोरमलगायत केही साना दलले उहाँलाई पनि समर्थन गरिसकेका छन् । देउवालाई मंगलबारसम्ममा ३ सय ९१ सांसदको समर्थन रहेको उहाँका निजी सचिव केशवराज जोशीले जानकारी दिनुभयो । 'अहिलेसम्म ३ सय ९१ सांसदको समर्थन छ', जोशीले अन्नपूर्णसँग भन्नुभयो । प्रधानमन्त्रीमा देउवालाई समर्थन गर्ने दलहरू धेरै भए पनि केही दल मात्रै तत्काल सरकारमा जानेछन् । सरकारको मुख्य घटक माओवादी केन्द्र र कांग्रेसबीच नै मन्त्रालय भागबन्डाका विषयमा अन्तिम निर्णय भइसकेको छैन । देउवानिकट एक नेताका अनुसार प्रधानमन्त्री चयन भएपछि मंगलबार साँझ सानो मन्त्रिमण्डलको नाम टुंगो लगाउने तयारी छ । 'सम्भवतः बुधबार प्रधानमन्त्रीको शपथ हुने भएकाले मंगलबार साँझसम्ममा माओवादी र कांग्रेसबाट पहिलो चरणमा सरकारमा सहभागी हुने मन्त्रालय र मन्त्रीको टुंगो लाग्नेछ', ती नेताले भने, 'सानो मन्त्रिमण्डल बनेपछि मात्रै कुनकुन दल सरकारमा सहभागी हुने भन्ने विषयमा थप छलफल हुन्छ ।' स्रोतका अनुसार पहिलो चरणमा कांग्रेस र माओवादीबाट तीनतीन जना र फोरम लोकतान्त्रिकबाट एक गरी सात जनाको मन्त्रिमण्डल बनाउने तयारी छ । त्यसको साता दिनपछि मन्त्रिमण्डलमा केही सदस्य थपेर विस्तार गर्ने र मन्त्रिमण्डललाई पूर्णता भने असार १४ गतेको स्थानीय चुनावपछि मात्रै दिने तयारीमा देउवा हुनुहुन्छ । स्थानीय चुनावका लागि पनि केही मन्त्रालयमा मन्त्री आवश्यक पर्ने भएकाले गृह, अर्थ, स्थानीय विकास, कानुनलगायत मन्त्रालयमा बुधबार नै मन्त्री तोक्ने तयारी छ । गृह मन्त्रालय माओवादी केन्द्र र अर्थ मन्त्रालय कांग्रेसले लिने सहमति दुई दलबीच भइसकेको छ । फोरम लोकतान्त्रिकका अध्यक्ष विजयकुमार गच्छदारले भने उपप्रधानसहित स्थानीय विकास मन्त्रालयको जिम्मेवारी पाउने लगभग टुंगो लागिसकेको स्रोतको दाबी छ । पार्टीभित्र विवादबीच सरकारलाई समर्थन गरेको राप्रपा सरकारमा आउने वा नआउने विषयमा पनि अझै टुंगो लागेको छैन । कांग्रेस र माओवादीभित्र भने संविधान संशोधन प्रस्तावमा समर्थन गर्ने लिखित सहमति नभएसम्म उसलाई सरकारमा सहभागी गराउन नहुने दबाब छ । 'राप्रपा वर्तमान सत्तागठबन्धनलाई धेरै महत्वपूर्ण समयमा धोका दिएर गएको हो', माओवादीका एक बहालवाला मन्त्रीले भने, 'अब अहिले उसलाई सरकारमा सहभागी गराउँदा कम्तीमा सत्तागठबन्धनले संसद्मा पेस गरेको संविधान संशोधन प्रस्तावमा समर्थन गर्ने प्रतिबद्धता गराउनुपर्छ ।' राप्रपा र कांग्रेसका नेताबीच सोमबार साँझ कांग्रेस संसदीय दलको कार्यालय सिंहदरबारमा छलफल भएको थियो । उक्त छलफलमा राप्रपाले सरकारमा आफ्नो हिस्साका विषयमा जिज्ञासा राखे पनि औपचारिक कुनै निर्णय भएन । कांग्रेस नेताहरूले प्रधानमन्त्री चयन भएपछि मात्रै मन्त्रालय बाँडफाँटका विषयमा छलफल गर्ने भन्दै सरकारमा सहभागिताका विषयमा सकारात्मक धारणा राखेका थिए । वर्तमान सत्तागठबन्धनमा रहेका र देउवालाई समर्थन गरेका साना दलको तर्फबाट भने सामूहिक प्रतिनिधित्व हुनेगरी बढीमा दुई जना मन्त्री र एक राज्यमन्त्रीसम्म दिने तयारी छ । सत्तागठबन्धनमा साना दलबाट अहिले तीन जना मन्त्री छन् ।"
पराजुलीविरुद्ध रिट हाल्ने गिरी सम्पर्कविहीन,"काठमाडौं : सर्वोच्च अदालतका न्यायाधीश गोपाल पराजुलीलाई प्रधानन्यायाधीश नबनाउन माग गर्र्दै रिट दायर गर्ने अधिवक्ता विकास गिरी चार दिनदेखि सर्वोच्चको सम्पर्कबाहिर रहनुभएको छ । गिरीले गत बुधबार न्यायाधीश पराजुलीविरुद्ध रिट दर्ता गरेपछि न्याय क्षेत्रमा सनसनी फैलिएको थियो तर सबैलाई जिल्याउँदै गिरी एकाएक सम्पर्कविहीन भएको प्रसंगले सर्वोच्च प्रशासनका कर्मचारी र कानुन व्यवसायी आश्चर्यमा परेका छन् । पराजुलीविरुद्ध नौ पृष्ठ लामो रिट हाल्न सक्रिय गिरी एकाएक सम्पर्कविहीन हुँदा रिटको पक्षमा बहस गर्ने तयारीमा रहेका कतिपय लब्धप्रतिष्ठित कानुन व्यवसायीसमेत जिल्लिएका छन् । गिरीको रिटमा सुनुवाइका लागि गत बिहीबार न्यायाधीश केदारप्रसाद चालिसेको इजलासमा पेसी तोकिएको थियो । त्यसदिन न्यायाधीश चालिसे आईजीपी विवादमा गठित बृहत् इजलासमा समेत रहनुपरेका कारण सुनुवाइका लागि पालो आएन । त्यसदिनदेखि गिरी मुद्दाको तारिख गुजार्दै सम्पर्कमा नआएको सर्वोच्च प्रशासनले जनाएको छ । गिरी आइतबार पनि सम्पर्कमा आउनुभएन । सर्वोच्चका प्रवक्ता महेन्द्रनाथ उपाध्यायले निवेदक गिरी सम्पर्कमा नरहेको बताउनुभयो । उहाँ सम्पर्कमा आउनुभएको छैन । तारिख थाम्न पाउने म्याद छउन्जेल हेर्नुपर्ने हुन्छ । अकारण तारिख गुजारेमा बेञ्चले कानुनी कारबाही गर्नसक्छ,' उपाध्यायले अन्नपूर्ण पोस्टसँग भन्नुभयो । एक वर्षअघि मात्र अधिवक्ताको प्रमाणपत्र लिएका गिरी बनेपा, टुकुचाका स्थायी बासिन्दा हुनुहुन्छ । उहाँ हाल उच्च अदालत पाटन बार एसोसिएसनको सदस्य रहेको जनाइएको छ ।"
'माग पुरा नभएसम्म राजपा चुनावमा जादैन',"वीरगन्ज: राष्ट्रिय जनता पार्टीका अध्यक्ष महन्थ ठाकुरले आफुहरुको माग पुरा नभए सम्म चुनावमा सहभागी नहुने बताउनुभएको छ। बाराको कलैयामा सोमबार आयोजित पार्टी प्रवेश कार्यक्रमलाइ सम्बोधन गर्दै अध्यक्ष ठाकुरले सरकारले जबरजस्ति चुनाव गराए मुलुकका लागि दुर्भाग्य हुने चेतावनी दिनुभयो। उहाँले भन्नुभयो, 'मधेसको माग पुरा नभए सम्म चुनावमा सहभागी नहुने मधेसी जनताको म्याण्डेट हो, त्यसैले हाम्रा माग सम्बोधन नभए सम्म हामी चुनावमा जान्नौ , यदि जबरजस्ति चुनाव गर्न खोजियो हामीले त्यो चुनाव हुन दिन्नौ।उहाले संघर्षको लागि तयार रहन कार्यकर्ताहरुलाइ निर्देशन पनि दिनुभयो। मधेसमा स्थानीय निकायको संख्या थप गर्नुको विकल्प नभएको अध्यक्ष ठाकुरको भनाइ छ। कार्यक्रममा उद्योग वाणिज्य संघ बाराका महासचिव जय प्रकाश साह नेपाली काँग्रेस परित्याग गरि राष्ट्रिय जनता पार्टीमा प्रवेश गर्नु भयो ।साहलाइ अध्यक्ष ठाकुरले फुलमाला लगाएर पार्टीमा स्वागत गर्नुभयो। साहले कलैया उपमहानगरपालिकाको मेयरमा काँग्रेसको तर्फबाट टिकट नपाउने सम्भावना देखेपछि मेयरको उम्मेदवार बन्न राजपामा प्रवेश गरेको श्रोतले जनाएको छ। यस्तै नेकपा एमालेका राम एकबाल मिया, 'काँग्रेसका चन्देश्वर दुबे सहित चार सय जना विभिन्न पार्टी परित्याग राष्ट्रिय जनता पार्टीमा प्रवेश गरेको राष्ट्रिय जनता पार्टी बाराका प्रवक्ता रमेश सर्राफले जानकारी दिनुभयो। राष्ट्रिय जनता पार्टी बाराका अध्यक्ष नवलकिशोर सिंहको अध्यक्षतामा सम्पन्न कार्यक्रममा राष्ट्रिय जनता पार्टीको अध्यक्ष मण्डलका सदस्य महेन्द्र राय यादव , महामन्त्री जितेन्द्र सोनल ,महासचिव राजेशमान सिंह , केन्द्रिय सदस्य रमेश यादव लगायतका नेताहरुको उपस्थिती रहेको थियो।"
डोटीमा दोस्रो चरणको निर्वाचन बिथोल्ने विप्लव माओवादीको योजना,"डोटी: स्थानीय निर्वाचन असफल पार्न नेत्रविक्रम चन्द 'विप्लव'नेतृत्वको नेपाल कम्युनिष्ट पार्टीले बिभिन्न गतिविधिहरु गर्ने भएको छ ।असार १४ गते हुने निर्वाचनअसफलपार्न गाउँगाउँमा जनसरकार गठन गर्न लागिएको नेपाल कम्युनिष्ट पार्टी डोटीले जानकारी दिएको छ। निर्वाचन बिफल पार्न सक्रिय रुपमा लाग्ने बताएको छ।जनसरकार गठनका लागि ग्रामीण क्षेत्रमा ठूलो संख्यामा पार्टीका कार्यकर्ता परिचालन भएका छन् । जिल्लाको दक्षिण भेगमा पर्ने साविककाजोरायल, गड्सेरा, मन्नाकापडी, बर्छैन तथालानाकेदारेश्वरगाविसहरुमाजनसरकार गठन भइसकेको जनाइएको छ। जोरायलमा योगेन्द्र बोहरा, गड्सेरामा दिपक बोगटी, तेजबहादुर बोहरा, मन्नाकापडीमा तारासिंह मन्नी, बर्छैनमा प्रेमबहादुर विष्ट तथा लानाकेदारेश्वरमा गोरख बोगटीलाई जनसरकार प्रमुख तोकेको पार्टी श्रोतले जानकारी दिएको छ। बिस्तारै जिल्लाकाअन्य क्षेत्रहरुमा समेत गतिविधि संचाल नगरिने बताइएको छ।स्थानीयकाअनुसार उनिहरुले ग्रामीण भेगहरुमाबिभिन्नकिसिमकागतिबिधीहरु संचालनगरिरहेका छन्। निर्वाचनलाई हुन नदिने उद्देश्यका साथ गाउँहरुमा निर्वाचन विरोधी गतिविधीहरु संचालन भईरहको छ। स्थानीयहरुलाई समेत डर त्रासमा राखिएको स्थानीयको गुनासो पाइन्छ। नेपाल कम्युनिष्ट पार्टी डोटीका ईन्चार्ज विवेक कुमालले सरकारले तोकेको दोस्रो चरणको निर्वाचनकुनै पनि हालमा सम्पन्न हुन नदिने दाबी गरेका छन्। हामी पार्टीको नीतिनिर्देशनमा परिचालनभएका छौँ।' ईन्चार्ज कुमालले भने, 'जनहितविपरीत गरिन लागेको स्थानीयतहको निर्वाचनलाई परास्तगर्न हामीले विभिन्न योजना अगाडि बढाएका छौं ।,निर्वाचनकुनै पनिहालतमा सफलहुनदिन्नौँ।'"
पूर्व राजाको योगदानको सम्झना गर्दै प्रधानमन्त्री प्रचण्ड सिंहदरवारबाट विदा,"काठमाडौ : प्रधानमन्त्री पुष्पकमल दाहाल प्रचण्ड पूर्व राजाहरुको सम्झना गर्दै सिंहदरवारबाट विदा भएका छन् । राज्यको पुनरसंरचनाका सन्दर्भमा पूर्व राजाका योगदान सम्झना गर्दै प्रधानमन्त्री प्रचण्डले २१ औ शताब्दीमा ती योगदान पर्याप्त नभएको बताउनुभयो । आफनो कार्यकालमा नेपालको पुनरसंरचना सात सय ४४ स्थानीय तहमा बदलिएको तर्फ संकेत गर्दै प्रधानमन्त्री प्रचण्डले नेपालको एकीकरण गर्ने पृथ्वीनारायण शाह,नेपाललाई १४ अञ्चल ७५ जिल्ला र पाँच विकास क्षेत्रमा पुनरसंरचना गर्ने महेन्द्रवीर विक्रम शाह र विरेन्द्र वीर विक्रम शाहको नाम नलिइकन सम्झनु भएको हो । रुपान्तरणमा टेकेर देशको एकता गर्ने हो । हिजो एउटा बिशिष्टतामा रुपान्तरण भएर आएको हो । राजा,महाराजाहरुले गरेकै हुन । गर्दै गरेका होइनन भन्ने छैनप्रधानमन्त्री प्रचण्डले भन्नुभयो उनीहरुले एउटा बिशिष्टतामा गरे । अहिले २१ औ शताब्दीमा त्यो आधारले चल्दैन । नयाँ बिशिष्टतामा नयाँ एकता आवश्यक छ । प्रधानमन्त्री तथा मन्त्रिपरिषद कार्यालयमा कार्यरत मुख्यसचिव,सचिव लगायत सबै कर्मचारीहरुद्धारा सोमबार सिंहदरवारमा आयोजित विदाई कार्यक्रममा प्रधानमन्त्री प्रचण्डले संघीय लोकतान्त्रिक गणतन्त्र र स्थानीय तहमा रुपान्तरण गरिएको बताउँदै भन्नुभयो जाती,भाषा,समुदाय र भुगोलाई एकताबद्ध राखेर तीब्र आर्थिक विकासतिर जाने हाम्रो मिसन हो । यो मिसनलाई तपाईहरुले कसरी बुझनुहुन्छ भन्ने धेरै महत्वपूर्ण छ । ०६५ मा प्रधानमन्त्री हुँदा झिलिमिलीमै वितेको र अहिले १० महिनाको अवधिमा राजनीतिक,आर्थिक लक्ष्य निर्धारण गरेर आफूले काम गरेको पनि उहाँले बताउनुभयो । मैले मोदीसँग कुरा मात्रै धेरै भयो,काम हुनु परयो भनेर कुरा गरेको थिए भारतीय प्रधानमन्त्री नरेन्द्र मोदीसँग दिल्लीमा भएको भेटको सन्दर्भ कोटयाउँदै प्रधानमन्त्री प्रचण्डले भन्नुभयो हुलाकी मार्ग लगायतका परियोजनामा अहिले गति आएको छ । आफू अप्ठयारो,पेचिलो र जटिल अवस्थामा प्रधानमन्त्री भएको पनि उहाँले बताउनुभयो । संविधानको स्वीकार्यता बढाउन,मधेश,पहाड र हिमाललाई एकताबद्ध गर्न आफू सफल भएको पनि उहाँले बताउनुभयो ।"
